"lon","lat","species","gbifID","locality","countryCode","coordinateUncertaintyInMeters","year","basisOfRecord","issue"
-90.53333,40.11667,"Acalypha deamii",3125117967,"Just E of Rushville along E. Lafayette St., roadside in vicinity of Crane Creek","USA",NA,2000,"PRESERVED_SPECIMEN","CONTINENT_DERIVED_FROM_COORDINATES;INSTITUTION_MATCH_FUZZY;COLLECTION_MATCH_NONE"
-86.156022,39.354142,"Acalypha deamii",1933548292,"","USA",10,2018,"HUMAN_OBSERVATION","COORDINATE_ROUNDED;CONTINENT_DERIVED_FROM_COORDINATES"
-87.841522,40.08961,"Acalypha deamii",3829929112,"S of Fithian, Illinois, along the Salt Fork","USA",3794,1954,"PRESERVED_SPECIMEN","CONTINENT_DERIVED_FROM_COORDINATES;INSTITUTION_MATCH_FUZZY"
-78.684348,36.822279,"Acalypha deamii",3357404941,"Kerr Reservoir lands. Along the Roanoke (Staunton) River, ca. 0.4 mi. SSE of US 360 bridge, 2.2 miles west of Public Fork.","USA",NA,1997,"PRESERVED_SPECIMEN","GEODETIC_DATUM_ASSUMED_WGS84;CONTINENT_DERIVED_FROM_COORDINATES;INSTITUTION_MATCH_FUZZY"
-78.714552,37.669799,"Acalypha deamii",3357404946,"Sandy silver maple- dominated forest along the James River, NE of its confluence with Mayo Creek, N of Wingina","USA",NA,1997,"PRESERVED_SPECIMEN","GEODETIC_DATUM_ASSUMED_WGS84;CONTINENT_DERIVED_FROM_COORDINATES;INSTITUTION_MATCH_FUZZY"
-78.672275,36.835884,"Acalypha deamii",3357405227,"Kerr Reservoir lands. Along the Roanoke (Staunton) River, ca. 0.3 mi. SW of the Rt. 92 bridge, 1.6 mi. WNW of Public Fork; elev. 330 ft.","USA",NA,1997,"PRESERVED_SPECIMEN","GEODETIC_DATUM_ASSUMED_WGS84;CONTINENT_DERIVED_FROM_COORDINATES;INSTITUTION_MATCH_FUZZY"
-78.556703,37.763588,"Acalypha deamii",3357405229,"Along the James River at Warren, terminus of Rt. 627.","USA",NA,1997,"PRESERVED_SPECIMEN","GEODETIC_DATUM_ASSUMED_WGS84;CONTINENT_DERIVED_FROM_COORDINATES;INSTITUTION_MATCH_FUZZY"
-79.04027,37.419721,"Acalypha deamii",3357405687,"Along the James River at Joshua Landing, off Rt. 726 opposite Joshua Falls.","USA",NA,1997,"PRESERVED_SPECIMEN","GEODETIC_DATUM_ASSUMED_WGS84;CONTINENT_DERIVED_FROM_COORDINATES;INSTITUTION_MATCH_FUZZY"
-77.998707,39.042686,"Acalypha deamii",4010714533,"Along the Shenandoah River, < 0.1 mi. down-stream from the US 50 (Byrd) bridge and 2.8 miles SE of Millwood.","USA",NA,1998,"PRESERVED_SPECIMEN","GEODETIC_DATUM_ASSUMED_WGS84;CONTINENT_DERIVED_FROM_COORDINATES;INSTITUTION_MATCH_FUZZY"
-78.565457,38.588176,"Acalypha deamii",4010714549,"Along South Fork Shenandoah River, just upstream from DGIF boat launch off US 340, 0.5 mi. SW of Alma.","USA",NA,1998,"PRESERVED_SPECIMEN","GEODETIC_DATUM_ASSUMED_WGS84;CONTINENT_DERIVED_FROM_COORDINATES;INSTITUTION_MATCH_FUZZY"
-78.32925,38.840667,"Acalypha deamii",4010714550,"Along the South Fork Shenandoah River, just downstream from Indian Hollow Bridge on Rt. 613 on north side of river, 0.9 mi. NW of Bentonville.","USA",NA,1998,"PRESERVED_SPECIMEN","GEODETIC_DATUM_ASSUMED_WGS84;CONTINENT_DERIVED_FROM_COORDINATES;INSTITUTION_MATCH_FUZZY"
-77.524141,39.126574,"Acalypha deamii",4010714499,"Balls Bluff Regional Park. Along the Potomac River, ca. 0.4 mi. downstream from Balls Bluff National Cemetery and 2.0 miles NE of Leesburg.","USA",NA,1998,"HUMAN_OBSERVATION","GEODETIC_DATUM_ASSUMED_WGS84;CONTINENT_DERIVED_FROM_COORDINATES"
-91.468908,37.981375,"Acalypha deamii",3759148561,"","USA",NA,2020,"HUMAN_OBSERVATION","COORDINATE_ROUNDED;CONTINENT_DERIVED_FROM_COORDINATES"
-90.5883,38.5353,"Acalypha deamii",1257882826,"Near Sherman, 30 m east of Sherman Beach parking lot along Stinging Nettle trail","USA",NA,2012,"PRESERVED_SPECIMEN","GEODETIC_DATUM_ASSUMED_WGS84;INSTITUTION_MATCH_FUZZY;COLLECTION_MATCH_NONE"
-91.22527,39.55194,"Acalypha deamii",1260984177,"1.4 mi W of state Highway 79 on county Road 103, ca. 2.5 airmi W of Ashburn thin strip of disturbed bottomland forest between road and N bank of Salt River; scattered in partial shade","USA",NA,1998,"PRESERVED_SPECIMEN","GEODETIC_DATUM_ASSUMED_WGS84;INSTITUTION_MATCH_FUZZY;COLLECTION_MATCH_NONE"
-90.37,40.51,"Acalypha deamii",4042925723,"Illinois: Fulton County","USA",NA,2011,"PRESERVED_SPECIMEN","COUNTRY_INVALID;GEODETIC_DATUM_ASSUMED_WGS84;CONTINENT_DERIVED_FROM_COORDINATES;INSTITUTION_MATCH_FUZZY;COLLECTION_MATCH_NONE"
-89.93,40.42,"Acalypha deamii",4042805587,"Illinois Mason County River Watershed","USA",NA,1999,"PRESERVED_SPECIMEN","COUNTRY_INVALID;GEODETIC_DATUM_ASSUMED_WGS84;PRESUMED_NEGATED_LONGITUDE;CONTINENT_DERIVED_FROM_COORDINATES;INSTITUTION_MATCH_FUZZY;COLLECTION_MATCH_NONE"
-96.54279,38.278,"Acalypha deamii",176865856,"Cottonwood Falls, 6.5 mi S","USA",8577,1975,"PRESERVED_SPECIMEN","AMBIGUOUS_COLLECTION"
-95.590379,39.0366,"Acalypha deamii",176865743,"Techumseh, 0.5 mi S, 0.5 mi W","USA",943,1996,"PRESERVED_SPECIMEN","AMBIGUOUS_COLLECTION"
-92.71185,43.14201,"Acalypha deamii",176865458,"Floyd, 1 mi N, 1 mi E: Wentlands Woods","USA",NA,2007,"PRESERVED_SPECIMEN","AMBIGUOUS_COLLECTION"
-93.1275,37.185,"Acalypha deamii",1260962974,"James River, ca. 100m downstream from Highway 125 bridge scattered along wooded banks and in channel gravel bars of James RiverWith Urtica chamaedryoides, Pilea pumila, Boehmeria cylindrica, and Acalypha virginica","USA",NA,1998,"PRESERVED_SPECIMEN","GEODETIC_DATUM_ASSUMED_WGS84;INSTITUTION_MATCH_FUZZY;COLLECTION_MATCH_NONE"
-91.534805,40.435778,"Acalypha deamii",1257984788,"Frost Island Conservation Area, ca. 2 airline miles SE of St. Francisville along the Des Moines River.","USA",NA,2013,"PRESERVED_SPECIMEN","OCCURRENCE_STATUS_INFERRED_FROM_INDIVIDUAL_COUNT;COORDINATE_ROUNDED;GEODETIC_DATUM_ASSUMED_WGS84;INSTITUTION_MATCH_FUZZY;COLLECTION_MATCH_NONE"
-78.820948,37.630888,"Acalypha deamii",3738041304,"James River State Park, 0.9 mi N of Buffalo Station... ca 0.25 mi WNW of Green Hill Pond","USA",100,2021,"PRESERVED_SPECIMEN","GEODETIC_DATUM_ASSUMED_WGS84;CONTINENT_DERIVED_FROM_COORDINATES;INSTITUTION_MATCH_FUZZY;COLLECTION_MATCH_FUZZY"
-77.943023,37.68141,"Acalypha deamii",4041260307,"Powhatan State Park, along the James River and River Trail, NE of primitive campground, 1.4 mi SW of Irwin","USA",300,2002,"PRESERVED_SPECIMEN","GEODETIC_DATUM_ASSUMED_WGS84;CONTINENT_DERIVED_FROM_COORDINATES;INSTITUTION_MATCH_FUZZY;COLLECTION_MATCH_FUZZY"
-88.2486,40.1297,"Acalypha deamii",3897772493,"Champaign County. T. 19N, R. 8E, SE¼ NE¼ SE¼ SW¼ Sect. 1. Private residence, 1411 Winding Lane, Champaign; Thomasboro 7.5' quadrangle.","USA",NA,2003,"PRESERVED_SPECIMEN","GEODETIC_DATUM_ASSUMED_WGS84"
-90.213333,39.816389,"Acalypha deamii",2561139393,"Payson Spring, 1.5 miles east of Payson, Pigeon Creek, Payson 7.5 minute topographic map. In floodplain of Pigeon Creek along both banks of creek. East side of Road","USA",NA,1996,"PRESERVED_SPECIMEN","COORDINATE_ROUNDED;GEODETIC_DATUM_ASSUMED_WGS84"
-90.466044,37.305441,"Acalypha deamii",4061406302,"Coldwater Access to the St. Francis River. Wetlands Inventory, Missouri Dept. of Conservation funded. Overflow forest at entrance parking, rocky moist-mesic sandy scour area.","USA",NA,2022,"PRESERVED_SPECIMEN","OCCURRENCE_STATUS_INFERRED_FROM_INDIVIDUAL_COUNT;GEODETIC_DATUM_ASSUMED_WGS84;DIFFERENT_OWNER_INSTITUTION"
-91.67361,37.45888,"Acalypha deamii",1261008003,"Montauk State Park, Montauk 7.5' quadrangle. Bank of Current River near bridge","USA",NA,1974,"PRESERVED_SPECIMEN","GEODETIC_DATUM_ASSUMED_WGS84;DIFFERENT_OWNER_INSTITUTION"
-87.816,40.093,"Acalypha deamii",3963038305,"S side of Salt Fork River, Oakwood; E of bridge crossing; Oakwood 7.5' quadrangle. T19N R13W SW¼ SW¼ NE¼ Section 22.","USA",NA,1995,"PRESERVED_SPECIMEN","GEODETIC_DATUM_ASSUMED_WGS84;CONTINENT_DERIVED_FROM_COORDINATES;INSTITUTION_COLLECTION_MISMATCH"
-90.67598,38.43667,"Acalypha deamii",2269019928,"Glassberg Conservation Area, along trail 100 m north of parking area.","USA",NA,2018,"PRESERVED_SPECIMEN","GEODETIC_DATUM_ASSUMED_WGS84;INSTITUTION_MATCH_FUZZY;COLLECTION_MATCH_NONE"
-88.9331,38.9428,"Acalypha deamii",3963040303,"IL 185 (FAP 777), N side, S bank of Hickory Creek; ca. 8.1 mi. due E-SE of Vandalia, 0.1-0.2 mi. NW of Confidence Rd. (1750E); Brownstown 7.5' USGS quadrangle. T6N, R2E, SE¼ SW¼, Section 25.","USA",NA,2001,"PRESERVED_SPECIMEN","GEODETIC_DATUM_ASSUMED_WGS84;CONTINENT_DERIVED_FROM_COORDINATES;INSTITUTION_COLLECTION_MISMATCH"
-86.130182,37.186918,"Acalypha deamii",3112735304,"","USA",5,2017,"HUMAN_OBSERVATION","COORDINATE_ROUNDED;CONTINENT_DERIVED_FROM_COORDINATES"
-87.610294,39.895755,"Acalypha deamii",2572995105,"South side of Salt Fork River, Oakwood; Oakwood 7.5 min quadrangle. T19N R13W SW1/4 SW1/4 NE1/4 section 22. East of bridge crossing.","USA",969,1995,"PRESERVED_SPECIMEN","CONTINENT_DERIVED_FROM_COORDINATES;INSTITUTION_MATCH_FUZZY;COLLECTION_MATCH_NONE"
-91.529722,37.967078,"Acalypha deamii",3759878547,"","USA",NA,2020,"HUMAN_OBSERVATION","COORDINATE_ROUNDED;CONTINENT_DERIVED_FROM_COORDINATES"
-85.906045,36.244533,"Acalypha deamii",2460155298,"","USA",19,2019,"HUMAN_OBSERVATION","COORDINATE_ROUNDED;CONTINENT_DERIVED_FROM_COORDINATES"
-84.268333,37.90056,"Acalypha deamii",4061098144,"Fort Boonesborough State Park, southwest of junction of KY 627 and the Kentucky River.","USA",NA,1992,"PRESERVED_SPECIMEN","GEODETIC_DATUM_ASSUMED_WGS84;INSTITUTION_MATCH_NONE"
-89.484878,40.935914,"Acalypha deamii",1990028494,"Chilicothee 7.5 minute quadrangle. South bank of main channel of Senachwine Creek just north of Chillocothe. In the floodplain of the Illinois river.","USA",1052,2000,"PRESERVED_SPECIMEN","CONTINENT_DERIVED_FROM_COORDINATES;INSTITUTION_MATCH_FUZZY"
-85.86015,36.06101,"Acalypha deamii",1990028197,"Eastern Highland Rim Physiographic Province. Edgar Evins State Park. Forested ravine on west side of Center Hill Lake (formerly Caney Fork River).","USA",10,2002,"PRESERVED_SPECIMEN","CONTINENT_DERIVED_FROM_COORDINATES;INSTITUTION_MATCH_FUZZY"
-87.013397,35.945885,"Acalypha deamii",1990028219,"Fairview Quadrangle. Peach Orchard Hollow, off of Big East Fork Road, ca. 5.2 miles S of Old Harding Road","USA",10,2013,"PRESERVED_SPECIMEN","CONTINENT_DERIVED_FROM_COORDINATES;INSTITUTION_MATCH_FUZZY"
-90.025809,39.987866,"Acalypha deamii",1990028418,"T. 18N, R. 9W, SE 1/4, NE 1/4, SE 1/4, NE 1/4, Sect. 9. Site M. Newmansville 7.5 Minute topographic map. Cox Creek.","USA",3036,1994,"PRESERVED_SPECIMEN","CONTINENT_DERIVED_FROM_COORDINATES;INSTITUTION_MATCH_FUZZY"
-85.524665,35.646762,"Acalypha deamii",1990028207,"Low area along Welchland Road. Est of Spencer.","USA",720,2000,"PRESERVED_SPECIMEN","CONTINENT_DERIVED_FROM_COORDINATES;INSTITUTION_MATCH_FUZZY"
-86.9624,35.9998,"Acalypha deamii",1990028206,"Natchez Trace Parkway. Larger, undeveloped area E of roadway. Park in lot up from parkway, between mile matker 439 and 440. Plants located along old logging road on edge of NPS property, ca. 0.5 air-mile NE of parking area.","USA",10,2015,"PRESERVED_SPECIMEN","CONTINENT_DERIVED_FROM_COORDINATES;INSTITUTION_MATCH_FUZZY"
-87.29409,35.69601,"Acalypha deamii",1990028231,"Natchez Trace Parkway. Downstream of Jackson Falls, S. of mile marker 405. Plants located near confluence of Jackspn Branch and Duck River.","USA",10,2015,"PRESERVED_SPECIMEN","CONTINENT_DERIVED_FROM_COORDINATES;INSTITUTION_MATCH_FUZZY"
