"lon","lat","species","gbifID","locality","countryCode","coordinateUncertaintyInMeters","year","basisOfRecord","issue"
-59.56,3.41,"Aristida torta",1456295373,"Rupununi Northern Savanna, Mountain View, Nappi","GUY",NA,1963,"PRESERVED_SPECIMEN","GEODETIC_DATUM_ASSUMED_WGS84"
-41.3,-13.58,"Aristida torta",3005704482,"Serra do Sincorá. Ca. 14km. N. of Barra da Estiva, near the Ibicoara road.","BRA",NA,1974,"PRESERVED_SPECIMEN","GEODETIC_DATUM_ASSUMED_WGS84"
-72.387833,3.489019,"Aristida torta",3893499854,"Finca El Brasil, vereda Fundación, Serranía de Manacacías","COL",NA,2014,"HUMAN_OBSERVATION","COORDINATE_ROUNDED"
-50.883333,2.45,"Aristida torta",2998276176,"5km south of Calçoene.","BRA",NA,1993,"PRESERVED_SPECIMEN","RECORDED_DATE_INVALID;COORDINATE_ROUNDED;GEODETIC_DATUM_ASSUMED_WGS84;CONTINENT_DERIVED_FROM_COORDINATES;INSTITUTION_MATCH_FUZZY;COLLECTION_MATCH_FUZZY"
-51.866667,-12.9,"Aristida torta",2998556151,"8km NE of the Base Camp of the Expedition, c.270km N of Xavantina.","BRA",NA,1968,"PRESERVED_SPECIMEN","COORDINATE_ROUNDED;GEODETIC_DATUM_ASSUMED_WGS84;CONTINENT_DERIVED_FROM_COORDINATES;INSTITUTION_MATCH_FUZZY;COLLECTION_MATCH_FUZZY"
-56.13,-12.25,"Aristida torta",3342975531,"Estrada para Projeto Ipiranga. 47 km de Tapurah. Savana arborizada com árvores e arbustos concentrados sobre murunduns. Solo alagável","BRA",NA,1997,"PRESERVED_SPECIMEN","GEODETIC_DATUM_ASSUMED_WGS84;CONTINENT_DERIVED_FROM_COORDINATES;AMBIGUOUS_INSTITUTION"
-57.572778,-17.907778,"Aristida torta",2237775084,"Serra do Amolar, entre parque Nacional do Pantanal e Fazenda Mandioré.","BRA",NA,2003,"PRESERVED_SPECIMEN","COORDINATE_ROUNDED;GEODETIC_DATUM_ASSUMED_WGS84;CONTINENT_DERIVED_FROM_COORDINATES;INSTITUTION_MATCH_FUZZY;INSTITUTION_COLLECTION_MISMATCH"
-50.918611,-12.560556,"Aristida torta",2612209316,"Parque Estadual do Araguaia. Campo de Murundum 1. Hectare 3.","BRA",NA,2005,"PRESERVED_SPECIMEN","COORDINATE_ROUNDED;GEODETIC_DATUM_ASSUMED_WGS84;CONTINENT_DERIVED_FROM_COORDINATES;INSTITUTION_MATCH_FUZZY;INSTITUTION_COLLECTION_MISMATCH"
-43.637778,-20.505833,"Aristida torta",1090847565,"Serra de Ouro Branco, Afloramento rochoso.","BRA",NA,2005,"PRESERVED_SPECIMEN","GEODETIC_DATUM_ASSUMED_WGS84;CONTINENT_DERIVED_FROM_COORDINATES;DIFFERENT_OWNER_INSTITUTION"
-43.710833,-20.485,"Aristida torta",1090848864,"Serra de Ouro Branco - Área 3, Campo arenoso úmido.","BRA",NA,2006,"PRESERVED_SPECIMEN","GEODETIC_DATUM_ASSUMED_WGS84;CONTINENT_DERIVED_FROM_COORDINATES;DIFFERENT_OWNER_INSTITUTION"
-43.786111,-20.508611,"Aristida torta",1090848905,"Serra de Ouro Branco - Área 1, Caminho arenoso no meio do campo graminoso quartzítico.","BRA",NA,2007,"PRESERVED_SPECIMEN","GEODETIC_DATUM_ASSUMED_WGS84;CONTINENT_DERIVED_FROM_COORDINATES;DIFFERENT_OWNER_INSTITUTION"
-84.0083,22.1194,"Aristida torta",1320640986,"Municipio Guane, Laguna de los Carneros, Sta. Teresa.","CUB",NA,2001,"PRESERVED_SPECIMEN","GEODETIC_DATUM_ASSUMED_WGS84"
-83.88333,14.66666,"Aristida torta",1259412605,"Puente Pozo Azul on Río Kurnog, ca 10 km S of Bilwaskarma; pine savanna near river","NIC",NA,1971,"PRESERVED_SPECIMEN","GEODETIC_DATUM_ASSUMED_WGS84;INSTITUTION_MATCH_FUZZY;COLLECTION_MATCH_NONE"
-83.33,9.17,"Aristida torta",1259236537,"Sabanas de Buenos Aires, cerca del río Sebror","CRI",NA,1983,"PRESERVED_SPECIMEN","GEODETIC_DATUM_ASSUMED_WGS84;INSTITUTION_MATCH_FUZZY;COLLECTION_MATCH_NONE"
-57.333333,5.297222,"Aristida torta",4031396191,"Corentyne County, Corentyne District, ca. 0.5 km W of Orealla village and the Corentyne River.","GUY",NA,1988,"PRESERVED_SPECIMEN","OCCURRENCE_STATUS_INFERRED_FROM_INDIVIDUAL_COUNT;COORDINATE_ROUNDED;GEODETIC_DATUM_ASSUMED_WGS84;INSTITUTION_MATCH_FUZZY;COLLECTION_MATCH_NONE"
-61.05,4.66666,"Aristida torta",1259105428,"A 14 km al norte de Santa Elena de Uairen. En sabana Trachypogon","VEN",NA,1989,"PRESERVED_SPECIMEN","GEODETIC_DATUM_ASSUMED_WGS84;INSTITUTION_MATCH_FUZZY;COLLECTION_MATCH_NONE"
-47.000583,-14.00015,"Aristida torta",1260174479,"Rocky slopes, wet campo, and creek margin, Chapada dos Veadeiros, ca. 20 km W. of Veadeiros.","BRA",NA,1966,"PRESERVED_SPECIMEN","COORDINATE_ROUNDED;GEODETIC_DATUM_ASSUMED_WGS84;INSTITUTION_MATCH_FUZZY;COLLECTION_MATCH_NONE"
-47.70192,-14.1167,"Aristida torta",1929859347,"Chapada dos Veadeiros, ca. 20 km W. of Alto Paraíso de Goiás (formerly Veadeiros).","BRA",5000,1966,"PRESERVED_SPECIMEN","COLLECTION_MATCH_FUZZY"
-48.12,-15.73,"Aristida torta",1927781664,"Between Taguatinga and Brazlândia","BRA",5000,1966,"PRESERVED_SPECIMEN","GEODETIC_DATUM_ASSUMED_WGS84;COLLECTION_MATCH_FUZZY"
-63.020833,-7.506111,"Aristida torta",4021001421,"","BRA",NA,2015,"PRESERVED_SPECIMEN","GEODETIC_DATUM_ASSUMED_WGS84;CONTINENT_DERIVED_FROM_COORDINATES;AMBIGUOUS_INSTITUTION"
-64.36,-8.657361,"Aristida torta",1042666700,"Joana D'Arce, Campina ca. 20 km depois de Joana D'Arce, de estrada de barro. Formação savânica. Mancha de cerrado.","BRA",NA,2007,"PRESERVED_SPECIMEN","GEODETIC_DATUM_ASSUMED_WGS84;GEODETIC_DATUM_INVALID;ELEVATION_MIN_MAX_SWAPPED;INSTITUTION_MATCH_NONE"
-50.88,1.6439,"Aristida torta",1042485200,"White sand campo sujo, 5 Km south of Calçoene.","BRA",NA,1993,"PRESERVED_SPECIMEN","GEODETIC_DATUM_ASSUMED_WGS84;GEODETIC_DATUM_INVALID;INSTITUTION_MATCH_NONE"
-63.17,-7.516667,"Aristida torta",1042539843,"Humaitá, Campo I, 500 m ao norte da BR 230, Km 2.","BRA",NA,1980,"PRESERVED_SPECIMEN","GEODETIC_DATUM_ASSUMED_WGS84;GEODETIC_DATUM_INVALID;INSTITUTION_MATCH_NONE"
-51.033333,-0.4,"Aristida torta",2513523102,"","BRA",NA,1988,"PRESERVED_SPECIMEN","INSTITUTION_MATCH_FUZZY;INSTITUTION_COLLECTION_MISMATCH"
-43.583333,-19.166667,"Aristida torta",1291003668,"Serra do Cipó","BRA",NA,1991,"PRESERVED_SPECIMEN","GEODETIC_DATUM_ASSUMED_WGS84;CONTINENT_DERIVED_FROM_COORDINATES;DIFFERENT_OWNER_INSTITUTION"
-43.9,-18.916667,"Aristida torta",1806851616,"Serra do Cipó, Santana do Pirapama. Fazenda Inhame (Serra Mineira).","BRA",NA,1982,"PRESERVED_SPECIMEN","GEODETIC_DATUM_ASSUMED_WGS84;CONTINENT_DERIVED_FROM_COORDINATES;DIFFERENT_OWNER_INSTITUTION"
-47.433333,-14.116667,"Aristida torta",1291004247,"","BRA",NA,1995,"PRESERVED_SPECIMEN","GEODETIC_DATUM_ASSUMED_WGS84;CONTINENT_DERIVED_FROM_COORDINATES;DIFFERENT_OWNER_INSTITUTION"
-70.177556,6.327139,"Aristida torta",2427926081,"Vereda Samuco, predio San Genaro","COL",31,2018,"PRESERVED_SPECIMEN","COORDINATE_ROUNDED;INSTITUTION_MATCH_FUZZY;COLLECTION_MATCH_FUZZY"
-44.3275,-19.406666,"Aristida torta",1265924820,"","BRA",NA,2005,"PRESERVED_SPECIMEN","OCCURRENCE_STATUS_INFERRED_FROM_INDIVIDUAL_COUNT;GEODETIC_DATUM_ASSUMED_WGS84;CONTINENT_DERIVED_FROM_COORDINATES;INSTITUTION_MATCH_NONE"
-52.61667,-17.5,"Aristida torta",3127353414,"11 km a oeste do acesso a Mineiros, ao longo da rodovia BR - 364.","BRA",NA,1986,"PRESERVED_SPECIMEN","OCCURRENCE_STATUS_INFERRED_FROM_INDIVIDUAL_COUNT;GEODETIC_DATUM_ASSUMED_WGS84;CONTINENT_DERIVED_FROM_COORDINATES;INSTITUTION_MATCH_NONE"
-47.70833,-15.59167,"Aristida torta",1265920294,"Cpac","BRA",NA,1980,"PRESERVED_SPECIMEN","OCCURRENCE_STATUS_INFERRED_FROM_INDIVIDUAL_COUNT;GEODETIC_DATUM_ASSUMED_WGS84;CONTINENT_DERIVED_FROM_COORDINATES;INSTITUTION_MATCH_NONE"
-57.257777,-15.641666,"Aristida torta",2285833439,"14 km ao norte do rio Cachoeirinha, na estrada de Cáceres a Barra do Bugres.","BRA",NA,1985,"PRESERVED_SPECIMEN","OCCURRENCE_STATUS_INFERRED_FROM_INDIVIDUAL_COUNT;GEODETIC_DATUM_ASSUMED_WGS84;CONTINENT_DERIVED_FROM_COORDINATES;INSTITUTION_MATCH_NONE"
-53.36,5.51,"Aristida torta",1456273556,"Savane Mamaribo, R.N. 1, 1 km a l'Est, sur la R.N. 1","GUF",NA,1989,"PRESERVED_SPECIMEN","GEODETIC_DATUM_ASSUMED_WGS84"
-67.62,-12.45,"Aristida torta",3005746796,"Dpto. La Paz: Prov. Iturralde. Siete Cielos, Río Manupare. Ca. 2.5 km al E. Pampa con arbustos y arboles bajos (4-5 m) y torcidos.","BOL",NA,1987,"PRESERVED_SPECIMEN","GEODETIC_DATUM_ASSUMED_WGS84"
-43.433056,-18.890556,"Aristida torta",1801097154,"","BRA",NA,2016,"PRESERVED_SPECIMEN","GEODETIC_DATUM_ASSUMED_WGS84;AMBIGUOUS_INSTITUTION"
-66.5,-14.58,"Aristida torta",3005700868,"Yacuma, Est. Porvenir, Estacion Biologica Del Beni.","BOL",NA,1987,"PRESERVED_SPECIMEN","GEODETIC_DATUM_ASSUMED_WGS84"
-57.78,5.56,"Aristida torta",1456437752,"Ebini Station","GUY",NA,1956,"PRESERVED_SPECIMEN","GEODETIC_DATUM_ASSUMED_WGS84"
-59.4167,3.06667,"Aristida torta",1456140231,"Kanuku Mountains; ±12-14 mi. NE of Sand Creek","GUY",NA,1989,"PRESERVED_SPECIMEN","GEODETIC_DATUM_ASSUMED_WGS84"
-68.75,6.166667,"Aristida torta",1259013833,"Distrito Pedro Camejo; along the Río Meta at the junction of the Caño Siriaco, 15.4 airline km W of Buena Vista.","VEN",NA,1978,"PRESERVED_SPECIMEN","OCCURRENCE_STATUS_INFERRED_FROM_INDIVIDUAL_COUNT;COORDINATE_ROUNDED;GEODETIC_DATUM_ASSUMED_WGS84;INSTITUTION_MATCH_FUZZY;COLLECTION_MATCH_NONE"
-71.202,4.595,"Aristida torta",1259013893,"31 km W of Las Gaviotas along road to Puerto Gaitán. Open treeless Trachypogon vestitus savanna.","COL",NA,1973,"PRESERVED_SPECIMEN","GEODETIC_DATUM_ASSUMED_WGS84;INSTITUTION_MATCH_FUZZY;COLLECTION_MATCH_NONE"
-61.06666,5.33333,"Aristida torta",1259105413,"Sabanas ubicadas en el valle del Río Karaurín alto, aprox. 12 km al SW del Tramentepui","VEN",NA,1986,"PRESERVED_SPECIMEN","GEODETIC_DATUM_ASSUMED_WGS84;INSTITUTION_MATCH_FUZZY;COLLECTION_MATCH_NONE"
-41.4625,-12.437778,"Aristida torta",2826605345,"Chapada Diamantina. Vale do Cercado.","BRA",NA,2009,"PRESERVED_SPECIMEN","GEODETIC_DATUM_ASSUMED_WGS84;CONTINENT_DERIVED_FROM_COORDINATES;INSTITUTION_MATCH_NONE"
-52.266667,4.583333,"Aristida torta",2515622624,"French Guiana, Mts. de Kaw, Trésor Reserve, near main trail, third tree after big Ficus.","GUF",NA,2003,"PRESERVED_SPECIMEN","INSTITUTION_MATCH_FUZZY;INSTITUTION_COLLECTION_MISMATCH"
-59.4667,2.81667,"Aristida torta",1456123812,"Along W side of river ±1 mi. S of Dadanawa Ranch","GUY",NA,1989,"PRESERVED_SPECIMEN","GEODETIC_DATUM_ASSUMED_WGS84"
-88.379444,14.365278,"Aristida torta",1259686747,"Municipio San Miguelito: 4 mi NW of San Miguelito along the road betwen La Esperanza and Gracias. Disturbed pine savanna.","HND",NA,1994,"PRESERVED_SPECIMEN","OCCURRENCE_STATUS_INFERRED_FROM_INDIVIDUAL_COUNT;COORDINATE_ROUNDED;GEODETIC_DATUM_ASSUMED_WGS84;INSTITUTION_MATCH_FUZZY;COLLECTION_MATCH_NONE"
-52.441667,4.949722,"Aristida torta",4031800093,"Lieu-dit Maya, route de la Carapa, Macouria. Savane bordant la savane-roche SR1, géoréférencée par 4 deg. 57 min. 10 sec. North et 52 deg. 26 min. 23 sec. West.","GUF",NA,2005,"PRESERVED_SPECIMEN","OCCURRENCE_STATUS_INFERRED_FROM_INDIVIDUAL_COUNT;COORDINATE_ROUNDED;GEODETIC_DATUM_ASSUMED_WGS84;INSTITUTION_MATCH_FUZZY;COLLECTION_MATCH_NONE"
-83.88333,14.75,"Aristida torta",4031981844,"In and near Bilwaskarma especially Thaeler Memorial Hospital grounds and Mission; pine savanna [Seymour series]","NIC",NA,1971,"PRESERVED_SPECIMEN","GEODETIC_DATUM_ASSUMED_WGS84;INSTITUTION_MATCH_FUZZY;COLLECTION_MATCH_NONE"
-62.35,5.7,"Aristida torta",1259804864,"PIAR: Kamarata. Disturbed Tachypogon savanna around village.","VEN",NA,1982,"PRESERVED_SPECIMEN","OCCURRENCE_STATUS_INFERRED_FROM_INDIVIDUAL_COUNT;GEODETIC_DATUM_ASSUMED_WGS84;INSTITUTION_MATCH_FUZZY;COLLECTION_MATCH_NONE"
-52.41027,4.78194,"Aristida torta",1259212168,"Savannas of Gallion. Ca. 20 km SW of Cayenne","GUF",NA,2001,"PRESERVED_SPECIMEN","GEODETIC_DATUM_ASSUMED_WGS84;INSTITUTION_MATCH_FUZZY;COLLECTION_MATCH_NONE"
-80.13333,8.6,"Aristida torta",1260007763,"Savannas near El Valle.","PAN",NA,1963,"PRESERVED_SPECIMEN","GEODETIC_DATUM_ASSUMED_WGS84;INSTITUTION_MATCH_FUZZY;COLLECTION_MATCH_NONE"
-44.13,-17.57,"Aristida torta",1929130374,"Middle slopes of Serra do Cabral, ca. 2.5 km W. of Cantoni","BRA",NA,1970,"PRESERVED_SPECIMEN","COLLECTION_MATCH_FUZZY"
-43.2439,-16.4147,"Aristida torta",1930458105,"Serra do Espinhaço, ca. 33 km N.E. of Francisco Sá, on road to Salinas","BRA",5000,1969,"PRESERVED_SPECIMEN","COLLECTION_MATCH_FUZZY"
-47.5167,-13.95401,"Aristida torta",1928082137,"Chapada dos Veadeiros, ca. 18 km N of Alto Paraíso","BRA",1000,1971,"PRESERVED_SPECIMEN","COLLECTION_MATCH_FUZZY"
-68.316667,6.316667,"Aristida torta",1314810406,"Venezuela","VEN",NA,1979,"PRESERVED_SPECIMEN","COORDINATE_ROUNDED;GEODETIC_DATUM_ASSUMED_WGS84;INSTITUTION_MATCH_FUZZY;COLLECTION_MATCH_NONE"
-43.488056,-20.299722,"Aristida torta",2598716567,"Antônio Pereira","BRA",NA,2013,"PRESERVED_SPECIMEN","COORDINATE_ROUNDED;GEODETIC_DATUM_ASSUMED_WGS84;INSTITUTION_MATCH_FUZZY;COLLECTION_MATCH_NONE"
-43.7833,-18.0833,"Aristida torta",1927820321,"Serra do Espinhaço, ca. 2 km N. of São João da Chapada","BRA",5000,1970,"PRESERVED_SPECIMEN","COLLECTION_MATCH_FUZZY"
-43.68024,-18.32666,"Aristida torta",1929750482,"12 km by road W of Diamantina on road to Curvelo. Serra do Espinhaço.","BRA",5000,1973,"PRESERVED_SPECIMEN","COLLECTION_MATCH_FUZZY"
-62.533333,5.733333,"Aristida torta",4031861551,"Guayaraca, between escarpment and Río Guayaraca, southern base of Auyan-tepui.","VEN",NA,1982,"PRESERVED_SPECIMEN","OCCURRENCE_STATUS_INFERRED_FROM_INDIVIDUAL_COUNT;COORDINATE_ROUNDED;GEODETIC_DATUM_ASSUMED_WGS84;INSTITUTION_MATCH_FUZZY;COLLECTION_MATCH_NONE"
-66.23333,7.95,"Aristida torta",1258814898,"A 21 Km al sur de Santa Rita, carretera Las Mercedes-Cabruta. En sabana pobre y húmeda, superficialmente inundable","VEN",NA,1995,"PRESERVED_SPECIMEN","GEODETIC_DATUM_ASSUMED_WGS84;INSTITUTION_MATCH_FUZZY;COLLECTION_MATCH_NONE"
-59.666667,2.933333,"Aristida torta",1259013835,"Chaakoitou, near Mountain Point, just S of Kanuku Mts. Wet savanna","GUY",NA,1979,"PRESERVED_SPECIMEN","OCCURRENCE_STATUS_INFERRED_FROM_INDIVIDUAL_COUNT;COORDINATE_ROUNDED;GEODETIC_DATUM_ASSUMED_WGS84;INSTITUTION_MATCH_FUZZY;COLLECTION_MATCH_NONE"
-86.87055,13.98083,"Aristida torta",1259237422,"Quebrada del Muro, road to Yuscarán. Open ground","HND",NA,1951,"PRESERVED_SPECIMEN","GEODETIC_DATUM_ASSUMED_WGS84;INSTITUTION_MATCH_FUZZY;COLLECTION_MATCH_NONE"
-86.953889,14.027222,"Aristida torta",1259236937,"Las Mesas.","HND",NA,1951,"PRESERVED_SPECIMEN","OCCURRENCE_STATUS_INFERRED_FROM_INDIVIDUAL_COUNT;COORDINATE_ROUNDED;GEODETIC_DATUM_ASSUMED_WGS84;INSTITUTION_MATCH_FUZZY;COLLECTION_MATCH_NONE"
-52.97958,5.30208,"Aristida torta",3310289548,"","GUF",5000,2011,"HUMAN_OBSERVATION","COUNTRY_MISMATCH;GEODETIC_DATUM_ASSUMED_WGS84;CONTINENT_DERIVED_FROM_COORDINATES"
-46.04666,-14.88055,"Aristida torta",1260526356,"Mpio de Cocos. Fazenda Trijunçao. Pontol. Solo: arenoso/argiloso. Relevo: levemente ondulado. Vegetaçao: Camp sujo.","BRA",NA,2001,"PRESERVED_SPECIMEN","GEODETIC_DATUM_ASSUMED_WGS84;INSTITUTION_MATCH_FUZZY;COLLECTION_MATCH_NONE"
-58.916667,3.883333,"Aristida torta",1259013898,"Rupununi river; Monkey Pond landing, SW of Mt. Makarapan","GUY",NA,1988,"PRESERVED_SPECIMEN","OCCURRENCE_STATUS_INFERRED_FROM_INDIVIDUAL_COUNT;COORDINATE_ROUNDED;GEODETIC_DATUM_ASSUMED_WGS84;INSTITUTION_MATCH_FUZZY;COLLECTION_MATCH_NONE"
-61.05,4.75,"Aristida torta",1259105432,"Selva ribereña, a lo largo del Río Uairén, 12 kms (por carretera) al noreste de Santa Elena de Uairén, 3 kms al Este de la carretera principal. Hato Divina Pastora. Savanna","VEN",NA,1982,"PRESERVED_SPECIMEN","GEODETIC_DATUM_ASSUMED_WGS84;INSTITUTION_MATCH_FUZZY;COLLECTION_MATCH_NONE"
-65.78333,3.75,"Aristida torta",4031779557,"Poco frecuente en sabana recién quemada. Sabana de Culebra, ribera izquierda (sur) del medio Río Cunucunuma","VEN",NA,1980,"PRESERVED_SPECIMEN","GEODETIC_DATUM_ASSUMED_WGS84;INSTITUTION_MATCH_FUZZY;COLLECTION_MATCH_NONE"
-65.43333,4.76666,"Aristida torta",4031463539,"Sabanas de Rancho Pando, a unos 20 km al SW de Cacurí en al Alto Ventuari","VEN",NA,1979,"PRESERVED_SPECIMEN","GEODETIC_DATUM_ASSUMED_WGS84;INSTITUTION_MATCH_FUZZY;COLLECTION_MATCH_NONE"
-60.28,5.7,"Aristida torta",1456059634,"Imbaimadai Savannas, Pakaraima Mts., Upper Mazaruni River","GUY",NA,1951,"PRESERVED_SPECIMEN","GEODETIC_DATUM_ASSUMED_WGS84"
-68.1,-13.73333,"Aristida torta",4060997171,"De Ixiamas unos pocos Km hacia el Este vía Aserradero Fatixi.. Pampa de Gramineas altas con lagunos árboles de Curatella americana","BOL",NA,1990,"PRESERVED_SPECIMEN","GEODETIC_DATUM_ASSUMED_WGS84;INSTITUTION_MATCH_NONE"
-84.08333,13.48333,"Aristida torta",4061349673,"Road between Limbaika and Siuna; pine savanna [Seymour series]","NIC",NA,1971,"PRESERVED_SPECIMEN","GEODETIC_DATUM_ASSUMED_WGS84;DIFFERENT_OWNER_INSTITUTION"
-61.13333,5.08333,"Aristida torta",1259567106,"Quebrada El Jaspe (río Caco), afloramientos de jaspe colorado, 47 kms al norte de Santa Elena, al sur del río Yuruani. Savanna border of stream","VEN",NA,1976,"PRESERVED_SPECIMEN","GEODETIC_DATUM_ASSUMED_WGS84;DIFFERENT_OWNER_INSTITUTION"
-66.66666,-14.76666,"Aristida torta",1259353897,"unos 60 Km al este de San Borja. Estacisn Biolsgica Beni","BOL",NA,1989,"PRESERVED_SPECIMEN","GEODETIC_DATUM_ASSUMED_WGS84;DIFFERENT_OWNER_INSTITUTION"
-55.58,5.38,"Aristida torta",1456074992,"Coesenwÿne Savanna, W part of","SUR",NA,1976,"PRESERVED_SPECIMEN","GEODETIC_DATUM_ASSUMED_WGS84"
-59.78,3.33,"Aristida torta",1456465566,"Rupununi Northern Savanna, St. Ignatius, 0.5 mi. S of","GUY",NA,1963,"PRESERVED_SPECIMEN","GEODETIC_DATUM_ASSUMED_WGS84"
-55.36,5.7,"Aristida torta",1456258527,"Poika Savanna","SUR",NA,1951,"PRESERVED_SPECIMEN","GEODETIC_DATUM_ASSUMED_WGS84"
-43.54,-18.55,"Aristida torta",2997839165,"Serra do Cipó, Santana do Pirapama. Fazenda Inhame (Serra Mineira).","BRA",NA,1982,"PRESERVED_SPECIMEN","GEODETIC_DATUM_ASSUMED_WGS84;CONTINENT_DERIVED_FROM_COORDINATES;INSTITUTION_MATCH_FUZZY;COLLECTION_MATCH_FUZZY"
-63.56,6.38,"Aristida torta",1456423459,"Río Paragua, Isla Casabe, Captain Paulino's village","VEN",NA,1951,"PRESERVED_SPECIMEN","GEODETIC_DATUM_ASSUMED_WGS84"
-66.25,5.35,"Aristida torta",1259566043,"Frecuente en sabana arenosa al pie del cerro. Sabanas ubicadas en la región de colinas y cerros al sur y sureste del Cerro Camani, a unos 20-25 km al W de San Juan de Manapiare","VEN",NA,1979,"PRESERVED_SPECIMEN","GEODETIC_DATUM_ASSUMED_WGS84;DIFFERENT_OWNER_INSTITUTION"
-88.474722,16.506944,"Aristida torta",1257757749,"Approximately 2 km South of Independence junction and 500 m East of Southern Highway along Aquar Mar access road; 50 m South of track.","BLZ",NA,2010,"PRESERVED_SPECIMEN","OCCURRENCE_STATUS_INFERRED_FROM_INDIVIDUAL_COUNT;COORDINATE_ROUNDED;GEODETIC_DATUM_ASSUMED_WGS84;DIFFERENT_OWNER_INSTITUTION"
-43.890556,-20.398889,"Aristida torta",1087641345,"Gambá. Mina Ferteco - CVRD.","BRA",NA,2005,"PRESERVED_SPECIMEN","GEODETIC_DATUM_ASSUMED_WGS84;AMBIGUOUS_INSTITUTION"
-43.901389,-20.099444,"Aristida torta",1087661837,"Mina Capitão do Mato, Litotipo: Cobertura detrito-laterítica; concreções supergênicas de óxidos de ferro e concreções ferruginosas preenchendo fraturas.","BRA",NA,2013,"PRESERVED_SPECIMEN","GEODETIC_DATUM_ASSUMED_WGS84;AMBIGUOUS_INSTITUTION"
-44.341389,-20.241389,"Aristida torta",1563172561,"Córrego Fazenda Velha","BRA",NA,2015,"PRESERVED_SPECIMEN","GEODETIC_DATUM_ASSUMED_WGS84;AMBIGUOUS_INSTITUTION"
-43.343333,-18.122333,"Aristida torta",1087621879,"Parque Estadual do Rio Preto, trilha do alojamento até o Córrego das Éguas","BRA",NA,2002,"PRESERVED_SPECIMEN","GEODETIC_DATUM_ASSUMED_WGS84;AMBIGUOUS_INSTITUTION"
-45.326694,-22.596833,"Aristida torta",1087652643,"Serra da Mantiqueira, Fazenda Boa Esperança, estrada para mata do Barão.","BRA",NA,2011,"PRESERVED_SPECIMEN","GEODETIC_DATUM_ASSUMED_WGS84;AMBIGUOUS_INSTITUTION"
-49.605,-14.753611,"Aristida torta",3397859323,"Serra dos Três Buracos, Região da Serra.","BRA",NA,2021,"PRESERVED_SPECIMEN","GEODETIC_DATUM_ASSUMED_WGS84;AMBIGUOUS_INSTITUTION"
-43.381389,-19.849722,"Aristida torta",2563083084,"Cocais","BRA",NA,2019,"PRESERVED_SPECIMEN","GEODETIC_DATUM_ASSUMED_WGS84;AMBIGUOUS_INSTITUTION"
-43.801667,-20.143611,"Aristida torta",1949963474,"Córrego Fazenda Velha, Região do Córrego Fazenda Velha","BRA",NA,2015,"PRESERVED_SPECIMEN","GEODETIC_DATUM_ASSUMED_WGS84;AMBIGUOUS_INSTITUTION"
-43.863611,-20.264722,"Aristida torta",1949963827,"Pico do Itabirito","BRA",NA,2015,"PRESERVED_SPECIMEN","GEODETIC_DATUM_ASSUMED_WGS84;AMBIGUOUS_INSTITUTION"
-43,-20.436389,"Aristida torta",2447819635,"Antiga Estação Ferroviária Dom Bosco, Proximidades da Estação","BRA",NA,2018,"PRESERVED_SPECIMEN","GEODETIC_DATUM_ASSUMED_WGS84;AMBIGUOUS_INSTITUTION"
-68.45,-14.95,"Aristida torta",4061013185,"Apolo 57 Km hacia Charasani pasando Correo, campamento Calabatea, río Yuyu.. Debajo del campamento. Pradera de quema periodicamente con Gramineas altas, perennes, pocos arbustos","BOL",NA,1990,"PRESERVED_SPECIMEN","GEODETIC_DATUM_ASSUMED_WGS84;INSTITUTION_MATCH_NONE"
-67.25,-13.08333,"Aristida torta",4061007292,"Luisita. Sabana húmeda, al W del río Beni","BOL",NA,1984,"PRESERVED_SPECIMEN","GEODETIC_DATUM_ASSUMED_WGS84;INSTITUTION_MATCH_NONE"
-53.41,5.41,"Aristida torta",1456222265,"Estrada Sinnamary-Organabo, Campo úmido","GUF",NA,1954,"PRESERVED_SPECIMEN","GEODETIC_DATUM_ASSUMED_WGS84"
-67.64,9.24,"Aristida torta",1259105439,"Parque Nacional Aguaro-Guariquito: Morichal Charcote","VEN",NA,1981,"PRESERVED_SPECIMEN","GEODETIC_DATUM_ASSUMED_WGS84;INSTITUTION_MATCH_FUZZY;COLLECTION_MATCH_NONE"
-60.58333,-3.03333,"Aristida torta",1260177841,"Campo Amélia (Faz. Belo Horizonte), entre ig. Acajatuba e margem direita do rio Negro. Extenso campo graminoso na terra firme; solo argiloso, impermeável.","BRA",NA,1986,"PRESERVED_SPECIMEN","GEODETIC_DATUM_ASSUMED_WGS84;INSTITUTION_MATCH_FUZZY;COLLECTION_MATCH_NONE"
-37.148333,-10.688611,"Aristida torta",2464819905,"Riacho dos Negros","BRA",NA,1991,"PRESERVED_SPECIMEN","GEODETIC_DATUM_ASSUMED_WGS84;INSTITUTION_MATCH_NONE"
-70.705639,5.167472,"Aristida torta",1707495936,"Vereda Pavanay Finca Las Navidades","COL",NA,2012,"PRESERVED_SPECIMEN","COORDINATE_ROUNDED;GEODETIC_DATUM_ASSUMED_WGS84;INSTITUTION_MATCH_NONE"
-61.2344,-16.39,"Aristida torta",3005670555,"Velasco, Propiedad Santa Clara.","BOL",NA,2008,"PRESERVED_SPECIMEN","GEODETIC_DATUM_ASSUMED_WGS84"
-88.68,16.5,"Aristida torta",2900440057,"Savanna between the foothills of the Maya Mountains at Chun Bank (mouth of the canyon of Bladen Branch) and the Southern Highway. Grassy area in pine savanna.","BLZ",NA,1987,"PRESERVED_SPECIMEN","GEODETIC_DATUM_ASSUMED_WGS84;CONTINENT_DERIVED_FROM_COORDINATES;CONTINENT_INVALID"
-59.8,3.35,"Aristida torta",1456122147,"Rupununi Dist., 6 mi. S of Lethem","GUY",NA,1956,"PRESERVED_SPECIMEN","GEODETIC_DATUM_ASSUMED_WGS84"
-68.58556,-12.8475,"Aristida torta",3059536388,"Bolivia: Depto. La Paz, Prov.: Abel Iturralde, Pampas de Heath al Estze, Sabana inundadas. Hierba amacollada, fertil, laminas conduplicadas, glabras punzantes. Alt.: 139 m.2008-05-24, Leg.: Cori,R. & Reichle,S. 13.","BOL",NA,2008,"PRESERVED_SPECIMEN","GEODETIC_DATUM_ASSUMED_WGS84;CONTINENT_DERIVED_FROM_COORDINATES;INSTITUTION_MATCH_FUZZY"
-65.53,3.18,"Aristida torta",1928201366,"La Esmeralda","VEN",NA,1969,"PRESERVED_SPECIMEN","GEODETIC_DATUM_ASSUMED_WGS84;COLLECTION_MATCH_FUZZY"
-63.33,0.82,"Aristida torta",1929111612,"Campina en la región alta del Río Jauarí (afluente del Río Aracá, llamado Río Cuieiras en los mapas RADAM), aprox. 15 Km al NW de la punta SW de la Serra Aracá","BRA",NA,1985,"PRESERVED_SPECIMEN","GEODETIC_DATUM_ASSUMED_WGS84;COLLECTION_MATCH_FUZZY"
-48.255,-15.939722,"Aristida torta",1213535902,"Santo Antônio do Descoberto.","BRA",NA,1980,"PRESERVED_SPECIMEN","COORDINATE_ROUNDED;GEODETIC_DATUM_ASSUMED_WGS84;CONTINENT_DERIVED_FROM_COORDINATES;INSTITUTION_MATCH_NONE"
-47.516667,-14.116667,"Aristida torta",1213535905,"Alto Paraíso de Goiás, 10km ao S de Alto Paraíso de Goiás.","BRA",NA,1969,"PRESERVED_SPECIMEN","COORDINATE_ROUNDED;GEODETIC_DATUM_ASSUMED_WGS84;CONTINENT_DERIVED_FROM_COORDINATES;INSTITUTION_MATCH_NONE"
-52.560556,-14.766111,"Aristida torta",3965596134,"Vereda da Fazenda da Abonizia - Outro lado da estrada.","BRA",NA,2021,"PRESERVED_SPECIMEN","COORDINATE_ROUNDED;GEODETIC_DATUM_ASSUMED_WGS84;CONTINENT_DERIVED_FROM_COORDINATES;INSTITUTION_MATCH_NONE"
-47.958056,-15.959444,"Aristida torta",3965601409,"Park Way, Fazenda Água Limpa, ribeirão do Gama.","BRA",NA,2017,"PRESERVED_SPECIMEN","COORDINATE_ROUNDED;GEODETIC_DATUM_ASSUMED_WGS84;CONTINENT_DERIVED_FROM_COORDINATES;INSTITUTION_MATCH_NONE"
-51.091539,0.239725,"Aristida torta",3897233316,"Br 156, Km 24., Savana arborea, latossolo.","BRA",NA,2012,"PRESERVED_SPECIMEN","GEODETIC_DATUM_ASSUMED_WGS84;CONTINENT_DERIVED_FROM_COORDINATES;INSTITUTION_MATCH_NONE"
-51.357806,-0.792111,"Aristida torta",1213529841,"Igarapé Edvaldo, parcela 09, Margem esquerda do rio Araguari. Savana arborea, latossolo concrecionário.","BRA",NA,2012,"PRESERVED_SPECIMEN","GEODETIC_DATUM_ASSUMED_WGS84;CONTINENT_DERIVED_FROM_COORDINATES;INSTITUTION_MATCH_NONE"
-56.46,3.1,"Aristida torta",1456433774,"Kayser Airstrip, Zuid R., 45 km above confl. with Lucie R., Wilhelmina Gebergte","SUR",NA,1963,"PRESERVED_SPECIMEN","GEODETIC_DATUM_ASSUMED_WGS84"
-61.58,4.5,"Aristida torta",1456226498,"El Pauji, E of town","VEN",NA,1985,"PRESERVED_SPECIMEN","GEODETIC_DATUM_ASSUMED_WGS84"
-43.879167,-21.697222,"Aristida torta",1424266495,"Lima Duarte; trilha Lagoa Seca - Janela do Céu.","BRA",NA,2004,"PRESERVED_SPECIMEN","COORDINATE_ROUNDED;GEODETIC_DATUM_ASSUMED_WGS84;CONTINENT_DERIVED_FROM_COORDINATES;INSTITUTION_MATCH_FUZZY;COLLECTION_MATCH_FUZZY"
-61,-13.55,"Aristida torta",4062082532,"Estancia Flor de Oro, W side of the río Guapore (=Río Itenez). Flat, grazed grassy savanna with regularly spaced brush-covered ant/termite mounds with Brosimum gaudichaudii, Curatella american, Simarouba, Cybistax antisyphillitica, on fine Recent alluvium","BOL",NA,1991,"PRESERVED_SPECIMEN","GEODETIC_DATUM_ASSUMED_WGS84;DIFFERENT_OWNER_INSTITUTION"
-62.666667,5.433333,"Aristida torta",4061891746,"Lower section of Río Ambutuir, along trail to Uriman.","VEN",NA,1982,"PRESERVED_SPECIMEN","OCCURRENCE_STATUS_INFERRED_FROM_INDIVIDUAL_COUNT;COORDINATE_ROUNDED;GEODETIC_DATUM_ASSUMED_WGS84;DIFFERENT_OWNER_INSTITUTION"
