"lon","lat","species","gbifID","locality","countryCode","coordinateUncertaintyInMeters","year","basisOfRecord","issue"
-39.4094,-7.2342,"Aristida torta",1090551655,"Chapada do Araripe","BRA",NA,1965,"PRESERVED_SPECIMEN","GEODETIC_DATUM_ASSUMED_WGS84;CONTINENT_DERIVED_FROM_COORDINATES;INSTITUTION_MATCH_FUZZY;COLLECTION_MATCH_FUZZY"
-38.6219,-5.8906,"Aristida torta",1090551692,"","BRA",NA,1965,"PRESERVED_SPECIMEN","GEODETIC_DATUM_ASSUMED_WGS84;CONTINENT_DERIVED_FROM_COORDINATES;INSTITUTION_MATCH_FUZZY;COLLECTION_MATCH_FUZZY"
-48.8086,-15.9236,"Aristida torta",1090547612,"Antônio Manuel","BRA",NA,1956,"PRESERVED_SPECIMEN","GEODETIC_DATUM_ASSUMED_WGS84;CONTINENT_DERIVED_FROM_COORDINATES;INSTITUTION_MATCH_FUZZY;COLLECTION_MATCH_FUZZY"
-62.55,5.533333,"Aristida torta",1259425754,"Middle part of Río Purpur, affluent of Río Ambutuir, along trail to Urimán. At base of escarpment.","VEN",NA,1982,"PRESERVED_SPECIMEN","OCCURRENCE_STATUS_INFERRED_FROM_INDIVIDUAL_COUNT;COORDINATE_ROUNDED;GEODETIC_DATUM_ASSUMED_WGS84;INSTITUTION_MATCH_FUZZY;COLLECTION_MATCH_NONE"
-67.52,9.04,"Aristida torta",1259105420,"Parque Nacional Aguaro-Guariquito: Saladillal Los Galapagos","VEN",NA,1981,"PRESERVED_SPECIMEN","GEODETIC_DATUM_ASSUMED_WGS84;INSTITUTION_MATCH_FUZZY;COLLECTION_MATCH_NONE"
-52.46494,4.62556,"Aristida torta",3310188808,"","GUF",5000,2011,"HUMAN_OBSERVATION","COUNTRY_MISMATCH;GEODETIC_DATUM_ASSUMED_WGS84;CONTINENT_DERIVED_FROM_COORDINATES"
-60.720271,2.87396,"Aristida torta",1503371810,"Campus do Cauame (CCA/UFRR), regiao do Monte Cristo","BRA",NA,2013,"HUMAN_OBSERVATION",""
-60.851166,2.65489,"Aristida torta",1503371881,"Campo Experimental Agua Boa (Embrapa Roraima), regiao do Igarape Agua Boa","BRA",NA,2013,"HUMAN_OBSERVATION",""
-69.58,4.517778,"Aristida torta",1259013883,"Ca. 25 km E of Cumaribo along the unimproved dirt road between Las Gaviotas and Santa Rita.","COL",NA,1973,"PRESERVED_SPECIMEN","OCCURRENCE_STATUS_INFERRED_FROM_INDIVIDUAL_COUNT;COORDINATE_ROUNDED;GEODETIC_DATUM_ASSUMED_WGS84;INSTITUTION_MATCH_FUZZY;COLLECTION_MATCH_NONE"
-59.151389,-0.441389,"Aristida torta",2302451728,"Vila Pacaraima; rio Surumú; estrada Boa Vista-Pacaraima (BR-174). Savana.","BRA",NA,1991,"PRESERVED_SPECIMEN","COORDINATE_ROUNDED;GEODETIC_DATUM_ASSUMED_WGS84;CONTINENT_DERIVED_FROM_COORDINATES;INSTITUTION_MATCH_FUZZY;COLLECTION_MATCH_FUZZY"
-52.55,-0.55,"Aristida torta",2302448149,"Caloene. Campo de terra firme.","BRA",NA,1982,"PRESERVED_SPECIMEN","RECORDED_DATE_INVALID;GEODETIC_DATUM_ASSUMED_WGS84;CONTINENT_DERIVED_FROM_COORDINATES;INSTITUTION_MATCH_FUZZY;COLLECTION_MATCH_FUZZY"
-56.23,2.11,"Aristida torta",1456272827,"Palaime Savanna, Upper Sipaliwini River","SUR",NA,1952,"PRESERVED_SPECIMEN","GEODETIC_DATUM_ASSUMED_WGS84"
-72.64,2.43,"Aristida torta",3705115485,"serranía La Lindosa (Formación Araracuara)","COL",NA,1996,"PRESERVED_SPECIMEN","INSTITUTION_MATCH_NONE"
-72.17,2.77,"Aristida torta",1062921041,"sabanas de La Fuga, km 1 S de hato Nare","COL",NA,2010,"PRESERVED_SPECIMEN","INSTITUTION_MATCH_NONE"
-71.35,4.57,"Aristida torta",768742888,"centro de investigación Carimagua, bosque de palmas a lo largo de las riveras","COL",NA,1992,"PRESERVED_SPECIMEN","INSTITUTION_MATCH_NONE"
-53.55,5.48,"Aristida torta",1456034431,"Savane Macoua; piste allant de la R.N.1 vers la mer","GUF",NA,1989,"PRESERVED_SPECIMEN","GEODETIC_DATUM_ASSUMED_WGS84"
-51.78,-17.2,"Aristida torta",3005707772,"Planalto do Brasil. Serra do Caiapó. Roadside, ca. 45km S. of Caiaponia on road to Jataí.","BRA",NA,1964,"PRESERVED_SPECIMEN","GEODETIC_DATUM_ASSUMED_WGS84"
-83.34,9.17,"Aristida torta",1259236991,"Entre Río Ceibo y Buenos Aires","CRI",NA,1966,"PRESERVED_SPECIMEN","GEODETIC_DATUM_ASSUMED_WGS84;INSTITUTION_MATCH_FUZZY;COLLECTION_MATCH_NONE"
-62.4,7.3,"Aristida torta",1259105421,"Más bien frecuente en sabana abierta. Sabanas sobre afloramientos rocosos igneos en la Piedra del Zamuro, Hato El Zamuro, aprox. 14 km al SE de El Manteco","VEN",NA,1982,"PRESERVED_SPECIMEN","GEODETIC_DATUM_ASSUMED_WGS84;INSTITUTION_MATCH_FUZZY;COLLECTION_MATCH_NONE"
-69.666667,6.8,"Aristida torta",4061563498,"Area between the Laguna del Termino and the Río Capanaparo, 24-32 airline km SW of Elorza.","VEN",NA,1979,"PRESERVED_SPECIMEN","OCCURRENCE_STATUS_INFERRED_FROM_INDIVIDUAL_COUNT;COORDINATE_ROUNDED;GEODETIC_DATUM_ASSUMED_WGS84;INSTITUTION_MATCH_NONE"
-41.877778,-13.533056,"Aristida torta",1094787255,"Base do Pico das Almas.","BRA",NA,2003,"PRESERVED_SPECIMEN","GEODETIC_DATUM_ASSUMED_WGS84;CONTINENT_DERIVED_FROM_COORDINATES;DIFFERENT_OWNER_INSTITUTION"
-41.383333,-12.566667,"Aristida torta",1094885512,"","BRA",NA,2009,"PRESERVED_SPECIMEN","GEODETIC_DATUM_ASSUMED_WGS84;CONTINENT_DERIVED_FROM_COORDINATES;DIFFERENT_OWNER_INSTITUTION"
-41.752222,-13.433333,"Aristida torta",1094792694,"Arapiranga. Próximo ao Rio da Galinha. Serra do Porco Gordo.","BRA",NA,2003,"PRESERVED_SPECIMEN","GEODETIC_DATUM_ASSUMED_WGS84;CONTINENT_DERIVED_FROM_COORDINATES;DIFFERENT_OWNER_INSTITUTION"
-41.2,-11.583333,"Aristida torta",1094836433,"ca. 3 km da cidade, na subida para o Morrão.","BRA",NA,2007,"PRESERVED_SPECIMEN","GEODETIC_DATUM_ASSUMED_WGS84;CONTINENT_DERIVED_FROM_COORDINATES;DIFFERENT_OWNER_INSTITUTION"
-43.625,-20.457611,"Aristida torta",1087476896,"Serra do Ribeiro","BRA",NA,2004,"PRESERVED_SPECIMEN","GEODETIC_DATUM_ASSUMED_WGS84;CONTINENT_DERIVED_FROM_COORDINATES;INSTITUTION_MATCH_NONE"
-62.616667,5.35,"Aristida torta",1259429024,"Urimán. (georgr. coordinates from Adelca hydrological station).","VEN",NA,1982,"PRESERVED_SPECIMEN","OCCURRENCE_STATUS_INFERRED_FROM_INDIVIDUAL_COUNT;COORDINATE_ROUNDED;GEODETIC_DATUM_ASSUMED_WGS84;INSTITUTION_MATCH_FUZZY;COLLECTION_MATCH_NONE"
-52.63103,5.04285,"Aristida torta",3073555287,"","GUF",5000,2012,"HUMAN_OBSERVATION","COUNTRY_MISMATCH;GEODETIC_DATUM_ASSUMED_WGS84;CONTINENT_DERIVED_FROM_COORDINATES"
-61.58333,5.7,"Aristida torta",1260670455,"Parupa, La Gran Sabana.","VEN",NA,1999,"PRESERVED_SPECIMEN","GEODETIC_DATUM_ASSUMED_WGS84;INSTITUTION_MATCH_FUZZY;COLLECTION_MATCH_NONE"
-45.36666,-21.83333,"Aristida torta",1259013868,"21 km SW of the intersection of Highways 381 and 267 near (7 km W of Campanha). Grassy hillside of degraded and heavily grazed cerrado.","BRA",NA,1976,"PRESERVED_SPECIMEN","GEODETIC_DATUM_ASSUMED_WGS84;INSTITUTION_MATCH_FUZZY;COLLECTION_MATCH_NONE"
-47.565,-15.505,"Aristida torta",2996882613,"Árie Santuário de Vida Silvestre do Riacho Fundo","BRA",NA,1998,"PRESERVED_SPECIMEN","GEODETIC_DATUM_ASSUMED_WGS84;CONTINENT_DERIVED_FROM_COORDINATES;ELEVATION_MIN_MAX_SWAPPED;INSTITUTION_MATCH_FUZZY;COLLECTION_MATCH_FUZZY"
-47.560833,-15.441111,"Aristida torta",2996882614,"Cascalheira do Entroncamento. Cascalheira distante cerca de 2 km da Administração do Parque Nacional de Brasília","BRA",NA,2005,"PRESERVED_SPECIMEN","COORDINATE_ROUNDED;GEODETIC_DATUM_ASSUMED_WGS84;CONTINENT_DERIVED_FROM_COORDINATES;INSTITUTION_MATCH_FUZZY;COLLECTION_MATCH_FUZZY"
-54.15,-16.5,"Aristida torta",1095360675,"BR 364 (alto da Serra de Petrovina) para Itiquira via Ponte de Pedra, a ca. 19 km da BR 364","BRA",NA,1995,"PRESERVED_SPECIMEN","GEODETIC_DATUM_ASSUMED_WGS84;DIFFERENT_OWNER_INSTITUTION"
-46.0248,-14.525,"Aristida torta",1095326763,"Fazenda Trijunção. Cerrado sobre encosta com afloramentos de tapiocanga local muito próximo ao Marco VT Paredão do IBGE nas divisas dos estados Bahia Minas Gerais e Goiás 14°52'50 46°02'48 W","BRA",NA,2001,"PRESERVED_SPECIMEN","GEODETIC_DATUM_ASSUMED_WGS84;DIFFERENT_OWNER_INSTITUTION"
-41.12,-11.35,"Aristida torta",1095337834,"ca. 3 km da cidade na subida para o Morrão 11°35' S 41°12' W","BRA",NA,2007,"PRESERVED_SPECIMEN","GEODETIC_DATUM_ASSUMED_WGS84;DIFFERENT_OWNER_INSTITUTION"
-42.3927,-13.4826,"Aristida torta",1095341206,"estrada Igaporã-Caetité BR 430 cerca de 38 km de Caetité Serra Curva do Vento 13°48'26 S 42°39'27 W","BRA",NA,2005,"PRESERVED_SPECIMEN","GEODETIC_DATUM_ASSUMED_WGS84;DIFFERENT_OWNER_INSTITUTION"
-43.37,-19.19,"Aristida torta",1213531254,"Km 104 da Rodovia Belo Horizonte-Conceição do Mato Dentro","BRA",NA,1982,"PRESERVED_SPECIMEN","GEODETIC_DATUM_ASSUMED_WGS84;DIFFERENT_OWNER_INSTITUTION"
-41.4508,-13.26,"Aristida torta",1095337925,"Arapiranga próximo ao Rio da Galinha Serra do Porco Gordo 13°26'0 S 41°45'8 W","BRA",NA,2003,"PRESERVED_SPECIMEN","GEODETIC_DATUM_ASSUMED_WGS84;DIFFERENT_OWNER_INSTITUTION"
-44.2358,-19.1503,"Aristida torta",1095315620,"","BRA",NA,2004,"PRESERVED_SPECIMEN","GEODETIC_DATUM_ASSUMED_WGS84;DIFFERENT_OWNER_INSTITUTION"
-57.3422,-17.5428,"Aristida torta",1095316912,"Serra do Amolar entre Parque Nacional do Pantanal e Fazenda Mandioré lat. 17°54'28 S long. 57°34'22 W","BRA",NA,2003,"PRESERVED_SPECIMEN","GEODETIC_DATUM_ASSUMED_WGS84;DIFFERENT_OWNER_INSTITUTION"
-44.1939,-19.2424,"Aristida torta",1095321060,"no cerrado. Lat. 19°24'24 S long. 44°19'39 W","BRA",NA,2005,"PRESERVED_SPECIMEN","GEODETIC_DATUM_ASSUMED_WGS84;DIFFERENT_OWNER_INSTITUTION"
-51.02,-0.24,"Aristida torta",1213531129,"Campo experimental do Cerrado - Km 45 da rodovia BR-156 (trecho Macapa - Ferreira Gomes)","BRA",NA,1988,"PRESERVED_SPECIMEN","GEODETIC_DATUM_ASSUMED_WGS84;DIFFERENT_OWNER_INSTITUTION"
-67.37,-12.27,"Aristida torta",1213531233,"Siete Cielos, Rio Manupare, cerca 2,5km al E. Pampa com arbustos y arboles bajos (4-5m) y torcidos","BOL",NA,1987,"PRESERVED_SPECIMEN","GEODETIC_DATUM_ASSUMED_WGS84;DIFFERENT_OWNER_INSTITUTION"
-44.4305,-22.1554,"Aristida torta",1095343076,"Parque Estadual do Papagaio Subida para Serra dos Costas 22°15'54S 44°43'05W","BRA",NA,2007,"PRESERVED_SPECIMEN","GEODETIC_DATUM_ASSUMED_WGS84;DIFFERENT_OWNER_INSTITUTION"
-69.680475,6.269769,"Aristida torta",2283948843,"","COL",NA,2015,"HUMAN_OBSERVATION","COORDINATE_ROUNDED;CONTINENT_DERIVED_FROM_COORDINATES"
-56.216667,-12.416667,"Aristida torta",1098471307,"Estrada para Projeto Ipiranga. 47 Km de Tapurah","BRA",NA,1997,"PRESERVED_SPECIMEN","GEODETIC_DATUM_ASSUMED_WGS84;CONTINENT_DERIVED_FROM_COORDINATES;INSTITUTION_MATCH_FUZZY;COLLECTION_MATCH_FUZZY"
-62.21666,5.91666,"Aristida torta",1259460695,"Piar, Río Aparamán. Kambay-merú rapids. Ca. 3 km SE of SSE corner of Amaruay- tepui. Forest, forest edge, and savanna. Alt. 500 m, 5º55'N, 62º13'W.","VEN",NA,1986,"PRESERVED_SPECIMEN","OCCURRENCE_STATUS_INFERRED_FROM_INDIVIDUAL_COUNT;GEODETIC_DATUM_ASSUMED_WGS84;INSTITUTION_MATCH_FUZZY;COLLECTION_MATCH_NONE"
-62.88333,6.03333,"Aristida torta",1259429749,"HERES: San Salvador de Paul. Gravelly Trachypogon savanna.","VEN",NA,1982,"PRESERVED_SPECIMEN","OCCURRENCE_STATUS_INFERRED_FROM_INDIVIDUAL_COUNT;GEODETIC_DATUM_ASSUMED_WGS84;INSTITUTION_MATCH_FUZZY;COLLECTION_MATCH_NONE"
-69.73333,8.7,"Aristida torta",1259013830,"Distrito Morán: 16 km SW of Sanare, by road. Rocky hills with savanna forest (Byrsonima, Roupala, Bowdichia) dominant with scattered pockets of savanna grasses.","VEN",NA,1982,"PRESERVED_SPECIMEN","GEODETIC_DATUM_ASSUMED_WGS84;INSTITUTION_MATCH_FUZZY;COLLECTION_MATCH_NONE"
-60.01,4.71,"Aristida torta",1456393483,"Ireng R., Orinduik Falls, Essequibo County","GUY",NA,1956,"PRESERVED_SPECIMEN","GEODETIC_DATUM_ASSUMED_WGS84"
-59.58,3.86,"Aristida torta",1456006734,"Rupununi, Route de Good Hope","GUY",NA,1956,"PRESERVED_SPECIMEN","GEODETIC_DATUM_ASSUMED_WGS84"
-59.9667,4.83333,"Aristida torta",1456293409,"Pakaraima Mts, Upper Ireng R; 0.5 km section of Tay-Slay-O Creek, 4-8 km upstream of Ireng mouth","GUY",NA,1993,"PRESERVED_SPECIMEN","GEODETIC_DATUM_ASSUMED_WGS84"
-52.7,5.08,"Aristida torta",1456237472,"Savane des Singes","GUF",NA,1989,"PRESERVED_SPECIMEN","GEODETIC_DATUM_ASSUMED_WGS84"
-88.316667,16.766667,"Aristida torta",1259199045,"Sapodilla Lagoon savanna.","BLZ",NA,2003,"PRESERVED_SPECIMEN","OCCURRENCE_STATUS_INFERRED_FROM_INDIVIDUAL_COUNT;COORDINATE_ROUNDED;GEODETIC_DATUM_ASSUMED_WGS84;INSTITUTION_MATCH_FUZZY;COLLECTION_MATCH_NONE"
-70.8984,4.5681,"Aristida torta",1259013890,"Ca. 8 km E of Las Gaviotas along the unimproved dirt road to Santa Rita. Completely open Trachypogon savanna with forest along spring fed stream.","COL",NA,1973,"PRESERVED_SPECIMEN","GEODETIC_DATUM_ASSUMED_WGS84;INSTITUTION_MATCH_FUZZY;COLLECTION_MATCH_NONE"
