"lon","lat","species","gbifID","locality","countryCode","coordinateUncertaintyInMeters","year","basisOfRecord","issue"
47.19,-18.1,"Asplenium anisophyllum",2618611842,"Madagascar, Antananarivo Province, Analamanga Region, Ankazobe District, Fokontany Firarazana, Route Nationale 4, Ankafobe Protected Area, 25 km NNE of Ankazobe.","MDG",NA,2018,"PRESERVED_SPECIMEN","GEODETIC_DATUM_ASSUMED_WGS84;INSTITUTION_COLLECTION_MISMATCH"
49.363889,-15.138611,"Asplenium anisophyllum",1260893610,"Forêt d'Anjiabe, suivant la ligne de crête vers Est sud d'Ambatoharanana, à 4 km vol d'oiseau à l'est de Fokotany d'Andranomena, commune rurale de Matsoandakana, Befandrina nord, région Sofia. Echantillons préservés en alcool.","MDG",NA,2008,"PRESERVED_SPECIMEN","OCCURRENCE_STATUS_INFERRED_FROM_INDIVIDUAL_COUNT;COORDINATE_ROUNDED;GEODETIC_DATUM_ASSUMED_WGS84;DIFFERENT_OWNER_INSTITUTION"
48.324167,-18.856667,"Asplenium anisophyllum",4061536361,"Toamasina, Moramanga, Ambohibary, Ampitambe, Ambatovy, environ 22 km au Nord Est de Moramanga. Récolté avec C. Rakotovao & R. Razafindasy.","MDG",NA,2005,"PRESERVED_SPECIMEN","OCCURRENCE_STATUS_INFERRED_FROM_INDIVIDUAL_COUNT;COORDINATE_ROUNDED;GEODETIC_DATUM_ASSUMED_WGS84;DIFFERENT_OWNER_INSTITUTION"
11.22534,0.43693,"Asplenium anisophyllum",4060977200,"Concession Rougier du Haut-Abanga, Sud-Est de Mikongo, partie Nord des montagnes Mekié.","GAB",NA,2008,"PRESERVED_SPECIMEN","OCCURRENCE_STATUS_INFERRED_FROM_INDIVIDUAL_COUNT;GEODETIC_DATUM_ASSUMED_WGS84;INSTITUTION_MATCH_NONE"
48.164167,-19.0275,"Asplenium anisophyllum",4061152506,"Région Alaotra-Mangoro, District de Moramanga, Commune Amboasary, FKT Antsily, forêt d'Antadina","MDG",NA,2012,"PRESERVED_SPECIMEN","OCCURRENCE_STATUS_INFERRED_FROM_INDIVIDUAL_COUNT;COORDINATE_ROUNDED;GEODETIC_DATUM_ASSUMED_WGS84;DIFFERENT_OWNER_INSTITUTION"
48.383333,-14.083333,"Asplenium anisophyllum",1260054293,"E of Ankaramy, Reserve Speciale de Manongarivo, Antsatroto. Plants preserved in alcohol.","MDG",NA,1993,"PRESERVED_SPECIMEN","OCCURRENCE_STATUS_INFERRED_FROM_INDIVIDUAL_COUNT;COORDINATE_ROUNDED;GEODETIC_DATUM_ASSUMED_WGS84;INSTITUTION_MATCH_FUZZY;COLLECTION_MATCH_NONE"
49.555833,-13.216667,"Asplenium anisophyllum",4032141643,"Daraina, forêt d'Antsahabe.","MDG",NA,2004,"PRESERVED_SPECIMEN","OCCURRENCE_STATUS_INFERRED_FROM_INDIVIDUAL_COUNT;COORDINATE_ROUNDED;GEODETIC_DATUM_ASSUMED_WGS84;INSTITUTION_MATCH_FUZZY;COLLECTION_MATCH_NONE"
-8.396983,7.699067,"Asplenium anisophyllum",4032137178,"Monts Nimba. Concession minière SMFG. Affluent droit de la Zié un peu en aval de la station de pompage.","GIN",NA,2012,"PRESERVED_SPECIMEN","OCCURRENCE_STATUS_INFERRED_FROM_INDIVIDUAL_COUNT;COORDINATE_ROUNDED;GEODETIC_DATUM_ASSUMED_WGS84;INSTITUTION_MATCH_FUZZY;COLLECTION_MATCH_NONE"
48.335278,-18.82,"Asplenium anisophyllum",4031566225,"Analamay, Ambatovy, Fokontany Ampitabe, Firaisana Ambohibary, Fivondronana Moramanga. Forêt dense humide de moyenne altitude .","MDG",NA,2005,"PRESERVED_SPECIMEN","OCCURRENCE_STATUS_INFERRED_FROM_INDIVIDUAL_COUNT;COORDINATE_ROUNDED;GEODETIC_DATUM_ASSUMED_WGS84;INSTITUTION_MATCH_FUZZY;COLLECTION_MATCH_NONE"
45.5,-18.3,"Asplenium anisophyllum",1259080882,"MAJUNGA: Ca. 16 km NW of Ambohitsaratelo-Bebao (NW of Tsiroanomandidy). Forest. Elev. ca. 1100 m.","MDG",NA,1985,"PRESERVED_SPECIMEN","OCCURRENCE_STATUS_INFERRED_FROM_INDIVIDUAL_COUNT;GEODETIC_DATUM_ASSUMED_WGS84;INSTITUTION_MATCH_FUZZY;COLLECTION_MATCH_NONE"
49.505,-14.755,"Asplenium anisophyllum",2423893707,"Andapa; Befingotra; RS d'Anjanaharibe-Sud, sur le versant Sud-Est, à 6.5 km au Sud-Sud-Ouest de Befingotra, au bord de la rivière Marolakana.","MDG",NA,1994,"PRESERVED_SPECIMEN","OCCURRENCE_STATUS_INFERRED_FROM_INDIVIDUAL_COUNT;GEODETIC_DATUM_ASSUMED_WGS84;INSTITUTION_MATCH_FUZZY;COLLECTION_MATCH_NONE"
37.993333,-4.324444,"Asplenium anisophyllum",1258683340,"T3. South Pare Mountains. Chome Forest Reserve, Shengena Forest, near Kanza Village. Riverine forest, Mhokevuta River.","TZA",NA,1999,"PRESERVED_SPECIMEN","OCCURRENCE_STATUS_INFERRED_FROM_INDIVIDUAL_COUNT;COORDINATE_ROUNDED;GEODETIC_DATUM_ASSUMED_WGS84;INSTITUTION_MATCH_FUZZY;COLLECTION_MATCH_NONE"
38,-4.316667,"Asplenium anisophyllum",1258768256,"Gonja-Kanza Village. Maganda Forest Reserve.","TZA",NA,2000,"PRESERVED_SPECIMEN","OCCURRENCE_STATUS_INFERRED_FROM_INDIVIDUAL_COUNT;COORDINATE_ROUNDED;GEODETIC_DATUM_ASSUMED_WGS84;INSTITUTION_MATCH_FUZZY;COLLECTION_MATCH_NONE"
47.289319,-18.181274,"Asplenium anisophyllum",3873437568,"","MDG",4,2022,"HUMAN_OBSERVATION","COORDINATE_ROUNDED;CONTINENT_DERIVED_FROM_COORDINATES"
34.013932,-13.360533,"Asplenium anisophyllum",2397475368,"","MWI",NA,2019,"HUMAN_OBSERVATION","COORDINATE_ROUNDED;CONTINENT_DERIVED_FROM_COORDINATES"
13.30566,-0.22526,"Asplenium anisophyllum",2268877384,"Concession SEEF, Mount Ngouadi.","GAB",NA,2017,"PRESERVED_SPECIMEN","OCCURRENCE_STATUS_INFERRED_FROM_INDIVIDUAL_COUNT;GEODETIC_DATUM_ASSUMED_WGS84;DIFFERENT_OWNER_INSTITUTION"
10.7833,1.1833,"Asplenium anisophyllum",1936562803,"Centro Sur: Evian, entre Aconibe y Acurenam","GNQ",NA,1999,"PRESERVED_SPECIMEN","GEODETIC_DATUM_ASSUMED_WGS84;CONTINENT_DERIVED_FROM_COORDINATES;INSTITUTION_MATCH_FUZZY;COLLECTION_MATCH_FUZZY"
10.08,5.82,"Asplenium anisophyllum",912575121,"Bali Ngemba FR near Mantum village.","CMR",NA,2001,"PRESERVED_SPECIMEN","GEODETIC_DATUM_ASSUMED_WGS84;CONTINENT_DERIVED_FROM_COORDINATES;INSTITUTION_MATCH_FUZZY;COLLECTION_MATCH_FUZZY"
11.133333,2.816667,"Asplenium anisophyllum",2516136281,"Station du Cacaoyer de N'koemvone, S. of Ebolowa, 14 km on the road to Ambam.","CMR",NA,1974,"PRESERVED_SPECIMEN","INSTITUTION_MATCH_FUZZY;INSTITUTION_COLLECTION_MISMATCH"
36.666667,7.833333,"Asplenium anisophyllum",2517826470,"c 30 km NW of Jimma.","ETH",NA,1965,"PRESERVED_SPECIMEN","INSTITUTION_MATCH_FUZZY;INSTITUTION_COLLECTION_MISMATCH"
-8.416689,7.616914,"Asplenium anisophyllum",1671689575,"crête Mt. Nimba","GIN",NA,1969,"PRESERVED_SPECIMEN","COORDINATE_ROUNDED;GEODETIC_DATUM_ASSUMED_WGS84;CONTINENT_DERIVED_FROM_COORDINATES;INSTITUTION_MATCH_FUZZY;COLLECTION_MATCH_FUZZY"
48.72638,-17.51111,"Asplenium anisophyllum",4031536918,"Fivondronana: Ambatondrazaka, Parc National de Zahamena. Forêt de Bemoara, 2 km au Sud Est d'Ankosy, près rivière Manambato. Récolté avec S. Rakotonandrasana, N.M. Andrianjafy, L.J. Razafitsalama, Doany, R. Rakotondrajaona, L.Randrianjanaka.","MDG",NA,2002,"PRESERVED_SPECIMEN","OCCURRENCE_STATUS_INFERRED_FROM_INDIVIDUAL_COUNT;GEODETIC_DATUM_ASSUMED_WGS84;INSTITUTION_MATCH_FUZZY;COLLECTION_MATCH_NONE"
48.957778,-14.155278,"Asplenium anisophyllum",1259027431,"Massif de Tsaratanana. Montagnes au Nord de Mangindrano, Diego, Ambanja, Marotolana, Ampanopia, Matsabory maika. Forêt dense humide de moyenne altitude dominé par endroit par des bambous. Sylves à lichens sur les sommets. Cette localité de récolte s'étend jusqu'à 14º 10' 15E, 48º 56' 42S.","MDG",NA,2001,"PRESERVED_SPECIMEN","OCCURRENCE_STATUS_INFERRED_FROM_INDIVIDUAL_COUNT;COORDINATE_ROUNDED;GEODETIC_DATUM_ASSUMED_WGS84;INSTITUTION_MATCH_FUZZY;COLLECTION_MATCH_NONE"
26.616667,-2.566667,"Asplenium anisophyllum",2516121871,"Région de Kalima.","COD",NA,1957,"PRESERVED_SPECIMEN","INSTITUTION_MATCH_FUZZY;INSTITUTION_COLLECTION_MISMATCH"
36.238,7.3145,"Asplenium anisophyllum",2515989312,"between Jima and Mizan Teferi.","ETH",NA,2003,"PRESERVED_SPECIMEN","INSTITUTION_MATCH_FUZZY;INSTITUTION_COLLECTION_MISMATCH"
-7.633333,7.4,"Asplenium anisophyllum",2517852521,"Mt. Tonkoui, SW of Man","CIV",NA,1959,"PRESERVED_SPECIMEN","INSTITUTION_MATCH_FUZZY;INSTITUTION_COLLECTION_MISMATCH"
48.334444,-18.855833,"Asplenium anisophyllum",4032096065,"Forêt de Berano, direction Est du campement Dynatec, Fokontany Ampitambe, Ambatovy, commune rurale Ambohibary, district Moramanga. Forêt dense humide de moyenne altitude. Echantillons préservés en alcool. Récolté avec Hélène Razanatsoa & F. Edmond.","MDG",NA,2005,"PRESERVED_SPECIMEN","OCCURRENCE_STATUS_INFERRED_FROM_INDIVIDUAL_COUNT;COORDINATE_ROUNDED;GEODETIC_DATUM_ASSUMED_WGS84;INSTITUTION_MATCH_FUZZY;COLLECTION_MATCH_NONE"
12.8,1.5,"Asplenium anisophyllum",1260268583,"Limbali forest.","GAB",NA,1990,"PRESERVED_SPECIMEN","GEODETIC_DATUM_ASSUMED_WGS84;INSTITUTION_MATCH_FUZZY;COLLECTION_MATCH_NONE"
48.313611,-18.808056,"Asplenium anisophyllum",4031687911,"Fivondronana: Moramanga, Commune: Andasibe, Fokontany: Menalamba. Ambatovy forest. Up to Berano village. Récoloté avec J. Andriambololona","MDG",NA,2005,"PRESERVED_SPECIMEN","OCCURRENCE_STATUS_INFERRED_FROM_INDIVIDUAL_COUNT;COORDINATE_ROUNDED;GEODETIC_DATUM_ASSUMED_WGS84;INSTITUTION_MATCH_FUZZY;COLLECTION_MATCH_NONE"
14.073056,-2.118333,"Asplenium anisophyllum",1259232526,"Franceville. Parc National de Plateaux Batéké (Station PPG). Circuit (D). Galerie forestière.","GAB",NA,2004,"PRESERVED_SPECIMEN","OCCURRENCE_STATUS_INFERRED_FROM_INDIVIDUAL_COUNT;COORDINATE_ROUNDED;GEODETIC_DATUM_ASSUMED_WGS84;INSTITUTION_MATCH_FUZZY;COLLECTION_MATCH_NONE"
48.733889,-17.485278,"Asplenium anisophyllum",1259024960,"Ambatondrazaka-Antanandava à 2 km d'Ankosy, le long de la SGR. Parc national de Zahamena. Forêt dense humide de moyenne altitude. Récolté avec: Ratovoson F., Randrianasolo S., Rakotozafy I., Rajoelison O.","MDG",NA,2001,"PRESERVED_SPECIMEN","OCCURRENCE_STATUS_INFERRED_FROM_INDIVIDUAL_COUNT;COORDINATE_ROUNDED;GEODETIC_DATUM_ASSUMED_WGS84;INSTITUTION_MATCH_FUZZY;COLLECTION_MATCH_NONE"
36.083333,7.3,"Asplenium anisophyllum",2313490548,"Kaffa Prov., 25 km along the new road Bonga to Mizan Tefari.","ETH",NA,1970,"PRESERVED_SPECIMEN","OCCURRENCE_STATUS_INFERRED_FROM_INDIVIDUAL_COUNT;COORDINATE_ROUNDED;GEODETIC_DATUM_ASSUMED_WGS84;INSTITUTION_MATCH_FUZZY;COLLECTION_MATCH_NONE"
47.012778,-23.535833,"Asplenium anisophyllum",4031698471,"Midongy du Sud, à 2 km à l'Ouest du village d'Ankaboky. Forêt dense humide. Récolté avec M. Ramanantsoa, M.G. Maminandrasana, W. Lodwige & A. Dama.","MDG",NA,2005,"PRESERVED_SPECIMEN","OCCURRENCE_STATUS_INFERRED_FROM_INDIVIDUAL_COUNT;COORDINATE_ROUNDED;GEODETIC_DATUM_ASSUMED_WGS84;INSTITUTION_MATCH_FUZZY;COLLECTION_MATCH_NONE"
49.106389,-14.201389,"Asplenium anisophyllum",4031592338,"Sur le plateau avant de monter au sommet d'Ambohimirahavavy.","MDG",NA,2005,"PRESERVED_SPECIMEN","OCCURRENCE_STATUS_INFERRED_FROM_INDIVIDUAL_COUNT;COORDINATE_ROUNDED;GEODETIC_DATUM_ASSUMED_WGS84;INSTITUTION_MATCH_FUZZY;COLLECTION_MATCH_NONE"
11.8,-0.033333,"Asplenium anisophyllum",2517631485,"Mont de Casque, ca 20 km NW of Booué.","GAB",NA,1987,"PRESERVED_SPECIMEN","INSTITUTION_MATCH_FUZZY;INSTITUTION_COLLECTION_MISMATCH"
9.2,4.183333,"Asplenium anisophyllum",2515373020,"Cameroon Mountain, path between hut 1 and hut 2.","CMR",NA,1962,"PRESERVED_SPECIMEN","INSTITUTION_MATCH_FUZZY;INSTITUTION_COLLECTION_MISMATCH"
9.1,4.083333,"Asplenium anisophyllum",1261116867,"Forest on the southern slope of Mount Cameroon, above Batoke.","CMR",NA,1983,"PRESERVED_SPECIMEN","OCCURRENCE_STATUS_INFERRED_FROM_INDIVIDUAL_COUNT;COORDINATE_ROUNDED;GEODETIC_DATUM_ASSUMED_WGS84;INSTITUTION_MATCH_FUZZY;COLLECTION_MATCH_NONE"
8.433333,7.55,"Asplenium anisophyllum",2313490757,"Africa. Mount Nimba. On rock, in forest, on E slope.","NGA",NA,1967,"PRESERVED_SPECIMEN","OCCURRENCE_STATUS_INFERRED_FROM_INDIVIDUAL_COUNT;COORDINATE_ROUNDED;COUNTRY_DERIVED_FROM_COORDINATES;GEODETIC_DATUM_ASSUMED_WGS84;CONTINENT_DERIVED_FROM_COORDINATES;INSTITUTION_MATCH_FUZZY;COLLECTION_MATCH_NONE"
28.766667,-1.333333,"Asplenium anisophyllum",2234553076,"FLORA CONGOLANA PROV.: Kivu TERRIT.: Masisi LOC.: Buse, Bukombo","COD",5000,1958,"PRESERVED_SPECIMEN","CONTINENT_DERIVED_FROM_COORDINATES;INSTITUTION_MATCH_FUZZY;COLLECTION_MATCH_FUZZY"
36.633333,-7.083333,"Asplenium anisophyllum",4061549892,"Rubeho Mountains. Ukwiva Forest Reserve pt8 - pt9. Montane forest with grassy glades/hilltops & swamps.","TZA",NA,2005,"PRESERVED_SPECIMEN","OCCURRENCE_STATUS_INFERRED_FROM_INDIVIDUAL_COUNT;COORDINATE_ROUNDED;GEODETIC_DATUM_ASSUMED_WGS84;DIFFERENT_OWNER_INSTITUTION"
9.833333,5.033333,"Asplenium anisophyllum",1258837698,"Grassland and woodland around the crater of Manengouba.","CMR",NA,1984,"PRESERVED_SPECIMEN","OCCURRENCE_STATUS_INFERRED_FROM_INDIVIDUAL_COUNT;COORDINATE_ROUNDED;GEODETIC_DATUM_ASSUMED_WGS84;DIFFERENT_OWNER_INSTITUTION"
49.098333,-15.533333,"Asplenium anisophyllum",1260718098,"Sofia, Mandritsara, Ambilobe, Bandabe. Suivant la piste vers Antsiradava. Cinq Km à l'Est de Bandabe à vol d'oiseau, à l'Ouest de la forêt de Makira. Lohan'Ananjaka et Kiboro. Récoltés avec D. Ravelonarivo, A. Lehavana, Tsiady & Manankaja.","MDG",NA,2007,"PRESERVED_SPECIMEN","OCCURRENCE_STATUS_INFERRED_FROM_INDIVIDUAL_COUNT;COORDINATE_ROUNDED;GEODETIC_DATUM_ASSUMED_WGS84;DIFFERENT_OWNER_INSTITUTION"
24.446944,0.767499,"Asplenium anisophyllum",1840090116,"Yangambi","COD",NA,1958,"PRESERVED_SPECIMEN","GEODETIC_DATUM_ASSUMED_WGS84;CONTINENT_DERIVED_FROM_COORDINATES;INSTITUTION_MATCH_FUZZY;COLLECTION_MATCH_FUZZY"
34.0511,-18.465677,"Asplenium anisophyllum",1839425584,"Mt Gorongosa, Mozambique","MOZ",30,2007,"PRESERVED_SPECIMEN","GEODETIC_DATUM_ASSUMED_WGS84;CONTINENT_DERIVED_FROM_COORDINATES;INSTITUTION_MATCH_FUZZY;COLLECTION_MATCH_FUZZY"
11.2829,-1.2283,"Asplenium anisophyllum",4060963148,"Est du Parc National de Waka, à plus ou moins 5 km au Sud de la rivière Mayi.","GAB",NA,2008,"PRESERVED_SPECIMEN","OCCURRENCE_STATUS_INFERRED_FROM_INDIVIDUAL_COUNT;GEODETIC_DATUM_ASSUMED_WGS84;INSTITUTION_MATCH_NONE"
47.95,-18.466667,"Asplenium anisophyllum",1258703515,"Forêt d'Andranomay à 2 km au NNE d'Andranomay et 13 km au SE d'Ankazobe, Commune et Fivondronana Anjozorobe.","MDG",NA,1996,"PRESERVED_SPECIMEN","OCCURRENCE_STATUS_INFERRED_FROM_INDIVIDUAL_COUNT;COORDINATE_ROUNDED;GEODETIC_DATUM_ASSUMED_WGS84;DIFFERENT_OWNER_INSTITUTION"
48.78583,-14.04722,"Asplenium anisophyllum",4062117996,"Beangona, Réserve Naturelle Integrale n°4 Tsaratanana, 9 km Est Beangona Ambery. Forêt dense humide en moyenne altitude. Relevé sur ruisseau, lit environ 1 m, très encaissé, débit faible mais permanent, lit composé de bloc de rocher et de sable. Quelques petits mares par endroit. Beaucoup d'arbres de grandes diamètres sur les bords (>50 cm) et très haut (environ 25 cm). Canopée continu mais trouée par endroit. Mousse et épiphyte très rares. Sens du courant Ouest-Est. Affluent Antsahaimanara.","MDG",NA,2000,"PRESERVED_SPECIMEN","GEODETIC_DATUM_ASSUMED_WGS84;INSTITUTION_MATCH_NONE"
36.923333,-6.363056,"Asplenium anisophyllum",1257985382,"Mamiwa South Forest Reserve, E part of forest on slopes facing Masenge Village.","TZA",NA,2012,"PRESERVED_SPECIMEN","OCCURRENCE_STATUS_INFERRED_FROM_INDIVIDUAL_COUNT;COORDINATE_ROUNDED;GEODETIC_DATUM_ASSUMED_WGS84;DIFFERENT_OWNER_INSTITUTION"
46.706667,-22.578333,"Asplenium anisophyllum",4061959345,"District Ivohibe. Commune rurale Ivohibe. Fokontany Longoza. Forêt de moyenne altitude à gros arbres élevés et savane herbeuse de Vohibory.","MDG",NA,2016,"PRESERVED_SPECIMEN","OCCURRENCE_STATUS_INFERRED_FROM_INDIVIDUAL_COUNT;COORDINATE_ROUNDED;GEODETIC_DATUM_ASSUMED_WGS84;DIFFERENT_OWNER_INSTITUTION"
10.45,-1.383333,"Asplenium anisophyllum",2313490534,"Koumounabwali Mountains. Along Bendolo river.","GAB",NA,1996,"PRESERVED_SPECIMEN","OCCURRENCE_STATUS_INFERRED_FROM_INDIVIDUAL_COUNT;COORDINATE_ROUNDED;GEODETIC_DATUM_ASSUMED_WGS84;INSTITUTION_MATCH_FUZZY;COLLECTION_MATCH_NONE"
48.333333,-14.083333,"Asplenium anisophyllum",2516715511,"Manogarivo masif, above village of Ambodisakoana, E of Ankaramy.","MDG",NA,1994,"PRESERVED_SPECIMEN","INSTITUTION_MATCH_FUZZY;INSTITUTION_COLLECTION_MISMATCH"
12.716667,-0.75,"Asplenium anisophyllum",2515989315,"Deforestage Eurotrag, ± 20 km N. of Lastoursville.","GAB",NA,1983,"PRESERVED_SPECIMEN","INSTITUTION_MATCH_FUZZY;INSTITUTION_COLLECTION_MISMATCH"
10.6667,1.7167,"Asplenium anisophyllum",1936647861,"Wele-Nzas: Explotación maderera de Añisok - Mongola","GNQ",NA,2000,"PRESERVED_SPECIMEN","GEODETIC_DATUM_ASSUMED_WGS84;CONTINENT_DERIVED_FROM_COORDINATES;INSTITUTION_MATCH_FUZZY;COLLECTION_MATCH_FUZZY"
10.3211,1.5678,"Asplenium anisophyllum",1936648728,"Centro Sur: Parque Nacional de Monte Alén, Engong: senda que va a una gran roca que se ve desde el pueblo","GNQ",NA,2000,"PRESERVED_SPECIMEN","GEODETIC_DATUM_ASSUMED_WGS84;CONTINENT_DERIVED_FROM_COORDINATES;INSTITUTION_MATCH_FUZZY;COLLECTION_MATCH_FUZZY"
-9.733333,8.033333,"Asplenium anisophyllum",2517542878,"North Lorma National Forest.","LBR",NA,2005,"PRESERVED_SPECIMEN","INSTITUTION_MATCH_FUZZY;INSTITUTION_COLLECTION_MISMATCH"
-8.907778,8.561667,"Asplenium anisophyllum",2516157264,"Simandou range, north of Pic de Fon, rocky spur on west-facing slope north of Dabatini hill.","GIN",NA,2008,"PRESERVED_SPECIMEN","INSTITUTION_MATCH_FUZZY;INSTITUTION_COLLECTION_MISMATCH"
11.283333,0.683333,"Asplenium anisophyllum",2516111671,"Primary mountainous forest, ca 4 km NNE of Oveng.","GAB",NA,1987,"PRESERVED_SPECIMEN","INSTITUTION_MATCH_FUZZY;INSTITUTION_COLLECTION_MISMATCH"
36.565,7.536667,"Asplenium anisophyllum",2517628487,"near western edge of Belleta Forest, between Jimma and Bonga.","ETH",NA,2005,"PRESERVED_SPECIMEN","INSTITUTION_MATCH_FUZZY;INSTITUTION_COLLECTION_MISMATCH"
8.8,3.633333,"Asplenium anisophyllum",2515890489,"BIOCO: Malabo-Pico Basilé. estrada km 16.","GNQ",NA,1986,"PRESERVED_SPECIMEN","INSTITUTION_MATCH_FUZZY;INSTITUTION_COLLECTION_MISMATCH"
11.407222,3.971664,"Asplenium anisophyllum",1265215494,"Monts Mbam Minkom, village de Nkolnyada","CMR",NA,2013,"PRESERVED_SPECIMEN","OCCURRENCE_STATUS_INFERRED_FROM_INDIVIDUAL_COUNT;GEODETIC_DATUM_ASSUMED_WGS84;DIFFERENT_OWNER_INSTITUTION"
36.266667,-0.283333,"Asplenium anisophyllum",2517494766,"Kenya. Dundori Ravine (Dundori Area).","KEN",NA,1975,"PRESERVED_SPECIMEN","INSTITUTION_MATCH_FUZZY;INSTITUTION_COLLECTION_MISMATCH"
36.616667,9.133333,"Asplenium anisophyllum",2517659484,"c 5 km NE of Lekemti.","ETH",NA,1965,"PRESERVED_SPECIMEN","INSTITUTION_MATCH_FUZZY;INSTITUTION_COLLECTION_MISMATCH"
13.966667,1.85,"Asplenium anisophyllum",2515959468,"Souanké; on and near summit of Mt. Nabemba along trail from NW side, c. 50 km SSW of Souanké.","COG",NA,1991,"PRESERVED_SPECIMEN","INSTITUTION_MATCH_FUZZY;INSTITUTION_COLLECTION_MISMATCH"
28.616667,-1.583333,"Asplenium anisophyllum",1840090158,"Km 34 route M.I.B. de Kababi - Kikoma, Territoire de Masisi","COD",NA,1958,"PRESERVED_SPECIMEN","GEODETIC_DATUM_ASSUMED_WGS84;CONTINENT_DERIVED_FROM_COORDINATES;INSTITUTION_MATCH_FUZZY;COLLECTION_MATCH_FUZZY"
31.024722,-7.894722,"Asplenium anisophyllum",1261055011,"Tembwa","TZA",NA,2005,"PRESERVED_SPECIMEN","OCCURRENCE_STATUS_INFERRED_FROM_INDIVIDUAL_COUNT;COORDINATE_ROUNDED;GEODETIC_DATUM_ASSUMED_WGS84;INSTITUTION_MATCH_FUZZY;COLLECTION_MATCH_NONE"
-0.6,6.15,"Asplenium anisophyllum",1890107739,"","GHA",NA,1951,"HUMAN_OBSERVATION","CONTINENT_DERIVED_FROM_COORDINATES"
-0.6,6.166667,"Asplenium anisophyllum",1890107737,"","GHA",NA,1971,"HUMAN_OBSERVATION","COORDINATE_ROUNDED;CONTINENT_DERIVED_FROM_COORDINATES"
-2.933333,6.316667,"Asplenium anisophyllum",1890107826,"","GHA",NA,1971,"HUMAN_OBSERVATION","COORDINATE_ROUNDED;CONTINENT_DERIVED_FROM_COORDINATES"
0.433333,6.85,"Asplenium anisophyllum",1890107856,"","GHA",NA,1971,"HUMAN_OBSERVATION","COORDINATE_ROUNDED;CONTINENT_DERIVED_FROM_COORDINATES"
-0.383333,6.383333,"Asplenium anisophyllum",1890107795,"","GHA",NA,1971,"HUMAN_OBSERVATION","COORDINATE_ROUNDED;CONTINENT_DERIVED_FROM_COORDINATES"
35.72,-16.49,"Asplenium anisophyllum",912450099,"Mount Chiperone","MOZ",NA,2006,"PRESERVED_SPECIMEN","GEODETIC_DATUM_ASSUMED_WGS84;CONTINENT_DERIVED_FROM_COORDINATES;INSTITUTION_MATCH_FUZZY;COLLECTION_MATCH_FUZZY"
38.632778,-5.060556,"Asplenium anisophyllum",1260343136,"T3. E Usambara Mountains, Shembangeda Village Forest, managed by village government and supported by Tanzania Forest Conservation Group. Submontane forest with Allanblackia stuhlmannii, Macaranga kilimandscharica and invasive Maeopsis eminii (Mhesi).","TZA",NA,2005,"PRESERVED_SPECIMEN","OCCURRENCE_STATUS_INFERRED_FROM_INDIVIDUAL_COUNT;COORDINATE_ROUNDED;GEODETIC_DATUM_ASSUMED_WGS84;INSTITUTION_MATCH_FUZZY;COLLECTION_MATCH_NONE"
34.583333,-10,"Asplenium anisophyllum",1258664123,"Livingstone Mountains, on ridge top ca. 1.5 km S of Msalaba Mountain above Luana, at edge of grassland and montane forest.","TZA",NA,1992,"PRESERVED_SPECIMEN","OCCURRENCE_STATUS_INFERRED_FROM_INDIVIDUAL_COUNT;COORDINATE_ROUNDED;GEODETIC_DATUM_ASSUMED_WGS84;INSTITUTION_MATCH_FUZZY;COLLECTION_MATCH_NONE"
10.43,6.25,"Asplenium anisophyllum",4066450776,"Oku elal; Mount Oku; Transect KC.","CMR",NA,1996,"PRESERVED_SPECIMEN","CONTINENT_DERIVED_FROM_COORDINATES;INSTITUTION_MATCH_FUZZY;COLLECTION_MATCH_NONE"
11.433333,3.816667,"Asplenium anisophyllum",4066449768,"Mont Eloumden, 10 km au SW de Yaoundé","CMR",NA,1986,"PRESERVED_SPECIMEN","COORDINATE_ROUNDED;CONTINENT_DERIVED_FROM_COORDINATES;INSTITUTION_MATCH_FUZZY;COLLECTION_MATCH_NONE"
12.86,2.66,"Asplenium anisophyllum",4066454756,"Ngongonjie hill, near Akonekye. 2°30 S of Ebolowa.","CMR",NA,1978,"PRESERVED_SPECIMEN","CONTINENT_DERIVED_FROM_COORDINATES;INSTITUTION_MATCH_FUZZY;COLLECTION_MATCH_NONE"
10.52,6.230278,"Asplenium anisophyllum",4066447775,"Oku elak, lower parts of transect KA.","CMR",NA,1996,"PRESERVED_SPECIMEN","COORDINATE_ROUNDED;CONTINENT_DERIVED_FROM_COORDINATES;INSTITUTION_MATCH_FUZZY;COLLECTION_MATCH_NONE"
35.72,-16.5,"Asplenium anisophyllum",912450082,"Mount Chiperone","MOZ",NA,2006,"PRESERVED_SPECIMEN","GEODETIC_DATUM_ASSUMED_WGS84;CONTINENT_DERIVED_FROM_COORDINATES;INSTITUTION_MATCH_FUZZY;COLLECTION_MATCH_FUZZY"
48.945278,-14.174167,"Asplenium anisophyllum",2423892936,"Mangindrano. Massif du Tsaratanana Montagnes au N de Mangindrano, Piste entre Antetikalambazaha (Camp 1) et Matsaborimaiky (Camp 2).","MDG",NA,2005,"PRESERVED_SPECIMEN","OCCURRENCE_STATUS_INFERRED_FROM_INDIVIDUAL_COUNT;COORDINATE_ROUNDED;GEODETIC_DATUM_ASSUMED_WGS84;INSTITUTION_MATCH_FUZZY;COLLECTION_MATCH_NONE"
39.721667,6.756667,"Asplenium anisophyllum",2516145281,"59 km S of Goba along the road across the Sanetti Plateau to Dolo Mena, just below Rira.","ETH",NA,2005,"PRESERVED_SPECIMEN","INSTITUTION_MATCH_FUZZY;INSTITUTION_COLLECTION_MISMATCH"
0.26,6.51,"Asplenium anisophyllum",2252211939,"Amedzofe","GHA",NA,1971,"PRESERVED_SPECIMEN","GEODETIC_DATUM_ASSUMED_WGS84;CONTINENT_DERIVED_FROM_COORDINATES"
0.33,6.15,"Asplenium anisophyllum",2252211959,"Mt. Atewa","GHA",NA,1971,"PRESERVED_SPECIMEN","GEODETIC_DATUM_ASSUMED_WGS84;CONTINENT_DERIVED_FROM_COORDINATES"
-2.56,6.19,"Asplenium anisophyllum",2252211890,"Krokosua Hills F.R.","GHA",NA,1971,"PRESERVED_SPECIMEN","GEODETIC_DATUM_ASSUMED_WGS84;PRESUMED_NEGATED_LONGITUDE;CONTINENT_DERIVED_FROM_COORDINATES"
0.36,6.09,"Asplenium anisophyllum",2252211921,"Apapam","GHA",NA,1951,"PRESERVED_SPECIMEN","GEODETIC_DATUM_ASSUMED_WGS84;CONTINENT_DERIVED_FROM_COORDINATES"
0.23,6.23,"Asplenium anisophyllum",2252211862,"Begoro","GHA",NA,1971,"PRESERVED_SPECIMEN","GEODETIC_DATUM_ASSUMED_WGS84;CONTINENT_DERIVED_FROM_COORDINATES"
36.266667,7.35,"Asplenium anisophyllum",2517843424,"c 10 km E of Bonga, along Jimma road.","ETH",NA,1965,"PRESERVED_SPECIMEN","INSTITUTION_MATCH_FUZZY;INSTITUTION_COLLECTION_MISMATCH"
36.7,-0.483333,"Asplenium anisophyllum",2517854501,"Kenya. Queens Cave, on rock (!) near the entrance of the cave.","KEN",NA,1976,"PRESERVED_SPECIMEN","INSTITUTION_MATCH_FUZZY;INSTITUTION_COLLECTION_MISMATCH"
13.4,-14.833333,"Asplenium anisophyllum",2517631486,"Lubango, cascata de Tundavala, (Cl).","AGO",NA,1960,"PRESERVED_SPECIMEN","INSTITUTION_MATCH_FUZZY;INSTITUTION_COLLECTION_MISMATCH"
10.49115,1.579717,"Asplenium anisophyllum",1144969907,"Bikurga exploitation forestière à l'ouest de l'inselberg de Bikurga (deuxième arrêt)","GNQ",1000,2002,"PRESERVED_SPECIMEN","COORDINATE_ROUNDED;CONTINENT_DERIVED_FROM_COORDINATES;INSTITUTION_MATCH_FUZZY;COLLECTION_MATCH_FUZZY"
36.580833,-6.826389,"Asplenium anisophyllum",1257951085,"Rubeho Mountains.","TZA",NA,2009,"PRESERVED_SPECIMEN","OCCURRENCE_STATUS_INFERRED_FROM_INDIVIDUAL_COUNT;COORDINATE_ROUNDED;GEODETIC_DATUM_ASSUMED_WGS84;INSTITUTION_MATCH_FUZZY;COLLECTION_MATCH_NONE"
26.05,-10.233333,"Asplenium anisophyllum",1840044991,"Shaba, Plateau des Biano, gare Biano - Dilongo Yulu, km 14, rivière Ngule","COD",NA,1985,"PRESERVED_SPECIMEN","GEODETIC_DATUM_ASSUMED_WGS84;CONTINENT_DERIVED_FROM_COORDINATES;INSTITUTION_MATCH_FUZZY;COLLECTION_MATCH_FUZZY"
32.765802,-19.114679,"Asplenium anisophyllum",1839430650,"Bunga Forest, Vumba","ZWE",5000,1998,"PRESERVED_SPECIMEN","GEODETIC_DATUM_ASSUMED_WGS84;CONTINENT_DERIVED_FROM_COORDINATES;INSTITUTION_MATCH_FUZZY;COLLECTION_MATCH_FUZZY"
37.05513,-15.369902,"Asplenium anisophyllum",1840496632,"Forest at base of Namuli Peak, Serra de Guruè","MOZ",30,2008,"PRESERVED_SPECIMEN","GEODETIC_DATUM_ASSUMED_WGS84;CONTINENT_DERIVED_FROM_COORDINATES;INSTITUTION_MATCH_FUZZY;COLLECTION_MATCH_FUZZY"
