"lon","lat","species","gbifID","locality","countryCode","coordinateUncertaintyInMeters","year","basisOfRecord","issue"
-117.892333,35.988722,"Astragalus leucolobus",2565962461,"ca. 60 air miles NW of Barstow, 4 miles NE of Avawatz Pass in Avawatz Mtns., between Arrastre Springs and crest of Avawatz Mtns., ca. 1 1/2 miles E of spring","USA",NA,1978,"PRESERVED_SPECIMEN","COORDINATE_ROUNDED;GEODETIC_DATUM_ASSUMED_WGS84;CONTINENT_DERIVED_FROM_COORDINATES;INSTITUTION_MATCH_FUZZY"
-118.2478,34.5493,"Astragalus leucolobus",2565964470,"N. slope Sierra Pelona; East of Bouquet Canyon.","USA",1600,1953,"PRESERVED_SPECIMEN","CONTINENT_DERIVED_FROM_COORDINATES;INSTITUTION_MATCH_FUZZY"
-114.3875,41.10079,"Astragalus leucolobus",2270498817,"300 yds n of Ut Hwy-30.","USA",NA,1979,"PRESERVED_SPECIMEN","GEODETIC_DATUM_ASSUMED_WGS84;CONTINENT_DERIVED_FROM_COORDINATES;INSTITUTION_MATCH_FUZZY;INSTITUTION_COLLECTION_MISMATCH"
-108.135061,39.808268,"Astragalus leucolobus",2270501184,"2.7 mi SSW of junction of Scandard Gulch and Little Scandard Gulch","USA",969,1982,"PRESERVED_SPECIMEN","CONTINENT_DERIVED_FROM_COORDINATES;INSTITUTION_MATCH_FUZZY;INSTITUTION_COLLECTION_MISMATCH"
-118.59309,37.46307,"Astragalus leucolobus",4022961521,"Old Sherwin Grade, old Hwy 395, north of Bishop","USA",2000,2016,"HUMAN_OBSERVATION","CONTINENT_DERIVED_FROM_COORDINATES"
-118.7983,37.5895,"Astragalus leucolobus",3059687754,"Slope above Lake Crowley, west side of Highway 395, 0.2 mile north of McGee Creek.","USA",1400,1965,"PRESERVED_SPECIMEN","CONTINENT_DERIVED_FROM_COORDINATES;INSTITUTION_MATCH_FUZZY"
-118.688628,47.926635,"Astragalus leucolobus",3059687757,"Kellers Ferry.","USA",3036,1951,"PRESERVED_SPECIMEN","CONTINENT_DERIVED_FROM_COORDINATES;INSTITUTION_MATCH_FUZZY"
-120.66583,39.30911,"Astragalus leucolobus",4022966800,"Sierra Discovery Trail, Bowman Lake Road off Hwy 20","USA",1000,2014,"HUMAN_OBSERVATION","CONTINENT_DERIVED_FROM_COORDINATES"
-118.15413,37.30072,"Astragalus leucolobus",4022966813,"Westgard Pass, Big Pine, Owens Valley, Inyo National Forest","USA",2000,2014,"HUMAN_OBSERVATION","CONTINENT_DERIVED_FROM_COORDINATES"
-120.12233,39.32109,"Astragalus leucolobus",4022967065,"Martis Valley, Truckee, Martis Creek Lake National Recreation Area","USA",1000,2014,"HUMAN_OBSERVATION","CONTINENT_DERIVED_FROM_COORDINATES"
-111.847222,40.9025,"Astragalus leucolobus",2859416131,"7.3 km SSW of Bountiful Peak, Wasatch-Cache National Forest","USA",NA,1998,"PRESERVED_SPECIMEN","COORDINATE_ROUNDED;CONTINENT_DERIVED_FROM_COORDINATES;INSTITUTION_MATCH_FUZZY;INSTITUTION_COLLECTION_MISMATCH"
-111.157355,41.996348,"Astragalus leucolobus",2989912805,"Lake Ridge, ca. 2 mi S of Utah-Idaho border.","USA",1200,1981,"PRESERVED_SPECIMEN","GEODETIC_DATUM_ASSUMED_WGS84;CONTINENT_DERIVED_FROM_COORDINATES;INSTITUTION_MATCH_FUZZY"
-118.4,35.566667,"Astragalus leucolobus",2430293597,"Piute Mts.: Along Erskine Creek Road near the base of a limestone outcrop about the 8th creek crossing in canyon.","USA",NA,1986,"PRESERVED_SPECIMEN","COORDINATE_ROUNDED;GEODETIC_DATUM_ASSUMED_WGS84;CONTINENT_DERIVED_FROM_COORDINATES;INSTITUTION_MATCH_FUZZY"
-116.8028,34.1589,"Astragalus leucolobus",2430394282,"San Bernardino National ForestSanta Ana River Watershed. Barton Flats","USA",365,2009,"PRESERVED_SPECIMEN","CONTINENT_DERIVED_FROM_COORDINATES;INSTITUTION_MATCH_FUZZY"
-108.38644,49.20409,"Astragalus leucolobus",439147226,"","CAN",NA,1958,"PRESERVED_SPECIMEN","GEODETIC_DATUM_ASSUMED_WGS84;CONTINENT_DERIVED_FROM_COORDINATES;COLLECTION_MATCH_FUZZY"
-118.90417,46.08556,"Astragalus leucolobus",4069837921,"Twin Buttes 2 mi. S.W. Wallula Jct.","USA",NA,1975,"PRESERVED_SPECIMEN","GEODETIC_DATUM_ASSUMED_WGS84;CONTINENT_DERIVED_FROM_COORDINATES;INSTITUTION_MATCH_FUZZY;INSTITUTION_COLLECTION_MISMATCH"
-120.519009,47.620236,"Astragalus leucolobus",4069837995,"4 mile down Crecent Barneby Road; 24 miles west of Wenatchee at border of Douglas and Grant counties by roadside.","USA",NA,1988,"PRESERVED_SPECIMEN","GEODETIC_DATUM_ASSUMED_WGS84;CONTINENT_DERIVED_FROM_COORDINATES;INSTITUTION_MATCH_FUZZY;INSTITUTION_COLLECTION_MISMATCH"
-120.788465,46.746036,"Astragalus leucolobus",4069679047,"South bank of Naches River on west side of U.S. Hwy. 12.","USA",NA,1970,"PRESERVED_SPECIMEN","GEODETIC_DATUM_ASSUMED_WGS84;CONTINENT_DERIVED_FROM_COORDINATES;INSTITUTION_MATCH_FUZZY;INSTITUTION_COLLECTION_MISMATCH"
-111.39667,43.44861,"Astragalus leucolobus",4069747349,"On Rainey Creek Road, off hwy 31 between Swan & Teton Valleys.","USA",NA,1973,"PRESERVED_SPECIMEN","GEODETIC_DATUM_ASSUMED_WGS84;CONTINENT_DERIVED_FROM_COORDINATES;INSTITUTION_MATCH_FUZZY;INSTITUTION_COLLECTION_MISMATCH"
-119.375,46.262,"Astragalus leucolobus",4069770300,"West Richland, Candy Mountain.","USA",NA,2010,"PRESERVED_SPECIMEN","GEODETIC_DATUM_ASSUMED_WGS84;CONTINENT_DERIVED_FROM_COORDINATES;INSTITUTION_MATCH_FUZZY;INSTITUTION_COLLECTION_MISMATCH"
-117.75333,46.03944,"Astragalus leucolobus",4069775563,"Twin Buttes.","USA",NA,1975,"PRESERVED_SPECIMEN","GEODETIC_DATUM_ASSUMED_WGS84;CONTINENT_DERIVED_FROM_COORDINATES;INSTITUTION_MATCH_FUZZY;INSTITUTION_COLLECTION_MISMATCH"
-120.795126,46.884418,"Astragalus leucolobus",4069854077,"North of Yakima in the L.T. Murray Management Area for Wildlife Habitat Improvement. Off Buffalo Road (off Gibson and North Wenas Roads).","USA",NA,1998,"PRESERVED_SPECIMEN","GEODETIC_DATUM_ASSUMED_WGS84;CONTINENT_DERIVED_FROM_COORDINATES;INSTITUTION_MATCH_FUZZY;INSTITUTION_COLLECTION_MISMATCH"
-119.13611,46.21139,"Astragalus leucolobus",4069777432,"Jump Off Joe Butte.","USA",NA,1969,"PRESERVED_SPECIMEN","GEODETIC_DATUM_ASSUMED_WGS84;CONTINENT_DERIVED_FROM_COORDINATES;INSTITUTION_MATCH_FUZZY;INSTITUTION_COLLECTION_MISMATCH"
-119.511103,45.341817,"Astragalus leucolobus",4069806264,"Heppner dam site on Willow Creek 1.5 miles east of Heppner on s-facing slope north of creek.","USA",NA,1973,"PRESERVED_SPECIMEN","GEODETIC_DATUM_ASSUMED_WGS84;CONTINENT_DERIVED_FROM_COORDINATES;INSTITUTION_MATCH_FUZZY;INSTITUTION_COLLECTION_MISMATCH"
-117.00583,47.71722,"Astragalus leucolobus",4069752533,"Off interstate at exit 64 on road to Mayfield.","USA",NA,1997,"PRESERVED_SPECIMEN","GEODETIC_DATUM_ASSUMED_WGS84;CONTINENT_DERIVED_FROM_COORDINATES;INSTITUTION_MATCH_FUZZY;INSTITUTION_COLLECTION_MISMATCH"
-117.229,46.513,"Astragalus leucolobus",4069716146,"Nisqually-John Canyon.","USA",NA,2010,"PRESERVED_SPECIMEN","GEODETIC_DATUM_ASSUMED_WGS84;CONTINENT_DERIVED_FROM_COORDINATES;INSTITUTION_MATCH_FUZZY;INSTITUTION_COLLECTION_MISMATCH"
-113.640178,41.991185,"Astragalus leucolobus",4069759705,"Raft River Mountains.","USA",NA,2005,"PRESERVED_SPECIMEN","GEODETIC_DATUM_ASSUMED_WGS84;CONTINENT_DERIVED_FROM_COORDINATES;INSTITUTION_MATCH_FUZZY;INSTITUTION_COLLECTION_MISMATCH"
-117.31667,45.2,"Astragalus leucolobus",4069815568,"Wallowa Mountains; west of Adam Creek near start of Ice Lake Trail south of Wallowa Lake.","USA",NA,1971,"PRESERVED_SPECIMEN","GEODETIC_DATUM_ASSUMED_WGS84;CONTINENT_DERIVED_FROM_COORDINATES;INSTITUTION_MATCH_FUZZY;INSTITUTION_COLLECTION_MISMATCH"
-120.004444,46.869115,"Astragalus leucolobus",4069679307,"N. side of I-90 about 6 mi. W. of Columbia River and 5.3 mi. E. of Ryegrass Summit.","USA",NA,1998,"PRESERVED_SPECIMEN","GEODETIC_DATUM_ASSUMED_WGS84;CONTINENT_DERIVED_FROM_COORDINATES;INSTITUTION_MATCH_FUZZY;INSTITUTION_COLLECTION_MISMATCH"
-112.4175,43.10056,"Astragalus leucolobus",4069714383,"Gibson Jack.","USA",NA,1970,"PRESERVED_SPECIMEN","GEODETIC_DATUM_ASSUMED_WGS84;CONTINENT_DERIVED_FROM_COORDINATES;INSTITUTION_MATCH_FUZZY;INSTITUTION_COLLECTION_MISMATCH"
-117.6169,46.4354,"Astragalus leucolobus",4069703643,"1.5 mi. S. of Marengle on State Highway 126.","USA",NA,1966,"PRESERVED_SPECIMEN","GEODETIC_DATUM_ASSUMED_WGS84;CONTINENT_DERIVED_FROM_COORDINATES;INSTITUTION_MATCH_FUZZY;INSTITUTION_COLLECTION_MISMATCH"
-108.788145,40.471182,"Astragalus leucolobus",2573483392,"Dinosaur National Monument. Schoonover Pasture, ca 0.5 mi S of Schoonover Buttes.","USA",1000,1987,"PRESERVED_SPECIMEN","COORDINATE_ROUNDED;CONTINENT_DERIVED_FROM_COORDINATES;AMBIGUOUS_INSTITUTION"
-113.839852,41.79223,"Astragalus leucolobus",2573386236,"Grouse Creek Mountains, Cotton Creek Fork of Grouse Creek, 6.7 miles NNW of Grouse Creek (town).","USA",1000,1971,"PRESERVED_SPECIMEN","CONTINENT_DERIVED_FROM_COORDINATES;AMBIGUOUS_INSTITUTION"
-105.788611,41.216667,"Astragalus leucolobus",2573387169,"Mortenson Lake National Wildlife Refuge, Laramie Plains. 11 air miles southwest of Laramie.","USA",500,2007,"PRESERVED_SPECIMEN","CONTINENT_DERIVED_FROM_COORDINATES;AMBIGUOUS_INSTITUTION"
-106.200184,40.058707,"Astragalus leucolobus",2573478388,"10 mi. e. of Kremmling.","USA",5000,1952,"PRESERVED_SPECIMEN","COORDINATE_ROUNDED;CONTINENT_DERIVED_FROM_COORDINATES;AMBIGUOUS_INSTITUTION"
-107.5731,44.03194,"Astragalus leucolobus",2573386819,"Bighorn Basin: ca 6 mi W of Tensleep.","USA",1000,1981,"PRESERVED_SPECIMEN","CONTINENT_DERIVED_FROM_COORDINATES;AMBIGUOUS_INSTITUTION"
-105.765278,41.37,"Astragalus leucolobus",2573385884,"Bamforth National Wildlife Refuge, Laramie Plains. 7 air miles northwest of Laramie.","USA",500,2007,"PRESERVED_SPECIMEN","CONTINENT_DERIVED_FROM_COORDINATES;AMBIGUOUS_INSTITUTION"
-108.75449,40.77603,"Astragalus leucolobus",2573475387,"Southeast slope of Cold Spring Mountain on primitive road to Little Joe Basin between Bull Canyon and Irish Canyon.","USA",1000,1965,"PRESERVED_SPECIMEN","CONTINENT_DERIVED_FROM_COORDINATES;AMBIGUOUS_INSTITUTION"
-108.8769,41.8369,"Astragalus leucolobus",2573387130,"Great Divide Basin Area: Great Divide Basin: along the Continental Divide N of Deadman Wash, ca 11.5 air mi NNW of Point of Rocks; ca 24 air mi NE of Rock Springs.","USA",NA,1995,"PRESERVED_SPECIMEN","GEODETIC_DATUM_ASSUMED_WGS84;CONTINENT_DERIVED_FROM_COORDINATES;AMBIGUOUS_INSTITUTION"
-108.74503,40.07839,"Astragalus leucolobus",2573480434,"1.4 miles W of Little Gillam Draw and 1.3 miles SE of County Road 64.","USA",1250,1982,"PRESERVED_SPECIMEN","CONTINENT_DERIVED_FROM_COORDINATES;AMBIGUOUS_INSTITUTION"
-105.416378,44.352506,"Astragalus leucolobus",2573385243,"6 mi NE of Gillette.","USA",5000,1978,"PRESERVED_SPECIMEN","CONTINENT_DERIVED_FROM_COORDINATES;AMBIGUOUS_INSTITUTION"
-110.9056,42.73,"Astragalus leucolobus",2573386426,"Wyoming/Salt River Ranges: Salt River Range: Star Hill 1 air mi ENE of Afton center; north side of Swift Creek.","USA",NA,1992,"PRESERVED_SPECIMEN","GEODETIC_DATUM_ASSUMED_WGS84;CONTINENT_DERIVED_FROM_COORDINATES;AMBIGUOUS_INSTITUTION"
-108.942633,40.161743,"Astragalus leucolobus",2573477405,"Ridge NE of radio towers on Mellen Hill, WNW of Rangely.","USA",500,1979,"PRESERVED_SPECIMEN","COORDINATE_ROUNDED;CONTINENT_DERIVED_FROM_COORDINATES;AMBIGUOUS_INSTITUTION"
-108.0465,43.6628,"Astragalus leucolobus",2573386468,"Bighorn Basin: along Red Hole or BLM Road 1426, ca 13.5 air mi SE of Lucerne and ca 9.8 air mi ENE of Thermopolis.","USA",1000,2002,"PRESERVED_SPECIMEN","CONTINENT_DERIVED_FROM_COORDINATES;AMBIGUOUS_INSTITUTION"
-113.805306,39.852764,"Astragalus leucolobus",2573385161,"Along lower portions of Tom's Creek, just above lower gates; 6 mi SW of Callao, Deep Creek Range.","USA",1000,1979,"PRESERVED_SPECIMEN","CONTINENT_DERIVED_FROM_COORDINATES;AMBIGUOUS_INSTITUTION"
-106.27643,40.61132,"Astragalus leucolobus",2573540087,"Arapaho National Wildlife Refuge, North Park, ca. 9 air miles S of Walden.","USA",100,2007,"PRESERVED_SPECIMEN","CONTINENT_DERIVED_FROM_COORDINATES;AMBIGUOUS_INSTITUTION"
-108.4733,39.80343,"Astragalus leucolobus",2573540181,"Wagonroad Ridge, southwest section of the Piceance Basin.","USA",7500,1982,"PRESERVED_SPECIMEN","CONTINENT_DERIVED_FROM_COORDINATES;AMBIGUOUS_INSTITUTION"
-105.07136,43.23875,"Astragalus leucolobus",2573385307,"10 miles E. of Bill, WY on Dull Center Rd. Peabody Coal Co.; N. Antelope","USA",2000,1980,"PRESERVED_SPECIMEN","CONTINENT_DERIVED_FROM_COORDINATES;AMBIGUOUS_INSTITUTION"
-107.913152,39.968949,"Astragalus leucolobus",2573538185,"Flat Tops/White River Plateau: LO 7 Hill, ca 5 air mi S of Meeker.","USA",1000,1990,"PRESERVED_SPECIMEN","COORDINATE_ROUNDED;CONTINENT_DERIVED_FROM_COORDINATES;AMBIGUOUS_INSTITUTION"
-114.80972,38.36667,"Astragalus leucolobus",2422421519,"Sidehill Pass, one mile (48 10 W to 49 02 W) of the road toward Cave Valley","USA",NA,2005,"PRESERVED_SPECIMEN","GEODETIC_DATUM_ASSUMED_WGS84;CONTINENT_DERIVED_FROM_COORDINATES;AMBIGUOUS_INSTITUTION"
-118.69,34.83722,"Astragalus leucolobus",2422456424,"below mouth of Big Sycamore Canyon, west of 300th St. West, north of reservoir on Calif. Aqueduct, along small stream below stock pond","USA",NA,2010,"PRESERVED_SPECIMEN","GEODETIC_DATUM_ASSUMED_WGS84;CONTINENT_DERIVED_FROM_COORDINATES;AMBIGUOUS_INSTITUTION"
-113.90167,37.89028,"Astragalus leucolobus",2422352698,"South end of the Needle Range; Eightmile Spring, 9 miles (airline) NNE of Modena","USA",NA,1982,"PRESERVED_SPECIMEN","GEODETIC_DATUM_ASSUMED_WGS84;CONTINENT_DERIVED_FROM_COORDINATES;AMBIGUOUS_INSTITUTION"
-118.59639,37.31139,"Astragalus leucolobus",2422285012,"McGee Creek off US Hwy 395","USA",NA,1973,"PRESERVED_SPECIMEN","GEODETIC_DATUM_ASSUMED_WGS84;CONTINENT_DERIVED_FROM_COORDINATES;AMBIGUOUS_INSTITUTION"
-118.31825,35.053,"Astragalus leucolobus",2422493625,"2.2 miles NE of junction of Oak Creek Road and Willow Springs-Tehachapi Road, 0.6 mi. north of Oak Creek Rd., adjacent to utility line right-of-way","USA",NA,2014,"PRESERVED_SPECIMEN","GEODETIC_DATUM_ASSUMED_WGS84;CONTINENT_DERIVED_FROM_COORDINATES;AMBIGUOUS_INSTITUTION"
-117.38083,39.50333,"Astragalus leucolobus",2422353749,"Airy Pass [Mt. Airy Summit], along US Hwy 50, c. 15 miles west of Austin","USA",NA,1995,"PRESERVED_SPECIMEN","GEODETIC_DATUM_ASSUMED_WGS84;CONTINENT_DERIVED_FROM_COORDINATES;AMBIGUOUS_INSTITUTION"
-118.13611,35.25167,"Astragalus leucolobus",2422316330,"c. 1 km SW of Antimony Flat on road to Peeping Tom Spring, c. 3 km south of Cross Mountain","USA",NA,1995,"PRESERVED_SPECIMEN","GEODETIC_DATUM_ASSUMED_WGS84;CONTINENT_DERIVED_FROM_COORDINATES;AMBIGUOUS_INSTITUTION"
-118.48028,35.17472,"Astragalus leucolobus",2422285744,"200 yds. north of Tehachapi Pass summit on the road between Monolith and Woodford, 100 ft. west of road","USA",NA,1965,"PRESERVED_SPECIMEN","GEODETIC_DATUM_ASSUMED_WGS84;CONTINENT_DERIVED_FROM_COORDINATES;AMBIGUOUS_INSTITUTION"
-116.75,39.16667,"Astragalus leucolobus",2422354081,"N end of Toquima Range, Petes Canyon, on Petes Pass Road 2.5 mi west of junction with Hwy 82","USA",NA,1970,"PRESERVED_SPECIMEN","GEODETIC_DATUM_ASSUMED_WGS84;CONTINENT_DERIVED_FROM_COORDINATES;AMBIGUOUS_INSTITUTION"
-119.1725,38.05222,"Astragalus leucolobus",2422507146,"0.8 air mile northwest of junction of Hwy 395 and Hwy 167","USA",NA,1998,"PRESERVED_SPECIMEN","GEODETIC_DATUM_ASSUMED_WGS84;CONTINENT_DERIVED_FROM_COORDINATES;AMBIGUOUS_INSTITUTION"
-119.568,38.6491,"Astragalus leucolobus",1319366298,"Marklee Ville Rd.","USA",NA,1986,"PRESERVED_SPECIMEN","GEODETIC_DATUM_ASSUMED_WGS84"
-108.027807,40.702683,"Astragalus leucolobus",3783623458,"N branch of Red Wash, ca 10 km E of Little Snake River, ca 35 km N of Maybell, T9S R95W S9/10; 40.702683 -108.027807","USA",90,1987,"PRESERVED_SPECIMEN","CONTINENT_DERIVED_FROM_COORDINATES;INSTITUTION_MATCH_FUZZY"
-108.793827,39.677311,"Astragalus leucolobus",3783623470,"Big Foundation Crees and Co. 139","USA",210,1991,"PRESERVED_SPECIMEN","CONTINENT_DERIVED_FROM_COORDINATES;INSTITUTION_MATCH_FUZZY"
-104.04527,43.78911,"Astragalus leucolobus",3023456823,"T3S R1E S18; NE of Newcastle, WY near Boles Canyon in Custer County, SD","USA",NA,2008,"PRESERVED_SPECIMEN","GEODETIC_DATUM_ASSUMED_WGS84;CONTINENT_DERIVED_FROM_COORDINATES;INSTITUTION_MATCH_FUZZY;COLLECTION_MATCH_FUZZY"
-103.742071,45.162366,"Astragalus leucolobus",2598688350,"T14N R3E S22","USA",969,1975,"PRESERVED_SPECIMEN","CONTINENT_DERIVED_FROM_COORDINATES;INSTITUTION_MATCH_FUZZY;COLLECTION_MATCH_FUZZY"
-110.87778,46.677395,"Astragalus leucolobus",2620318979,"Ca. 9 miles north of White Sulphur Springs, along U.S. Highway 89 at milepost 136","USA",248,1968,"PRESERVED_SPECIMEN","CONTINENT_DERIVED_FROM_COORDINATES;INSTITUTION_MATCH_FUZZY;COLLECTION_MATCH_FUZZY"
-119.867814,46.133188,"Astragalus leucolobus",4070522071,"Top of Horse Heaven Hills, S of Prosser.","USA",5324,1984,"PRESERVED_SPECIMEN","CONTINENT_DERIVED_FROM_COORDINATES;INSTITUTION_MATCH_FUZZY;INSTITUTION_COLLECTION_MISMATCH"
-120.215877,45.742907,"Astragalus leucolobus",4070523696,"Roosevelt, 9 mi W on Hwy 14.","USA",496,1974,"PRESERVED_SPECIMEN","CONTINENT_DERIVED_FROM_COORDINATES;INSTITUTION_MATCH_FUZZY;INSTITUTION_COLLECTION_MISMATCH"
-117.4197402,43.8561654,"Astragalus leucolobus",4070526713,"Sand Hollow.","USA",810,1975,"PRESERVED_SPECIMEN","COORDINATE_REPROJECTED;CONTINENT_DERIVED_FROM_COORDINATES;INSTITUTION_MATCH_FUZZY;INSTITUTION_COLLECTION_MISMATCH"
-108.4,39.92,"Astragalus leucolobus",3798048776,"Piceance Basin, SW of Meeker W of Piceance Creek.","USA",NA,2000,"PRESERVED_SPECIMEN","OCCURRENCE_STATUS_INFERRED_FROM_INDIVIDUAL_COUNT;RECORDED_DATE_INVALID;CONTINENT_DERIVED_FROM_COORDINATES;INSTITUTION_MATCH_FUZZY"
-117.3,38.12,"Astragalus leucolobus",3798052770,"5 mi due N of Tonopah.","USA",NA,1980,"PRESERVED_SPECIMEN","OCCURRENCE_STATUS_INFERRED_FROM_INDIVIDUAL_COUNT;CONTINENT_DERIVED_FROM_COORDINATES;INSTITUTION_MATCH_FUZZY"
-108.9,41.82,"Astragalus leucolobus",3798058817,"Great Divide Basin Area: Great Divide Basin: along the Continental Divide N of Deadman Wash, ca 2.5 air mi E of Emmons Cone, ca 12 air mi NW of Point of Rocks; a 23 air mi NE of Rock Springs.","USA",NA,1995,"PRESERVED_SPECIMEN","OCCURRENCE_STATUS_INFERRED_FROM_INDIVIDUAL_COUNT;CONTINENT_DERIVED_FROM_COORDINATES;INSTITUTION_MATCH_FUZZY"
-108.67,41.79,"Astragalus leucolobus",3798058847,"Great Divide Basin Area: Great Divide Basin: Ten Mile Ridge, ca 11 air mi SE of Spring Butte; ca 9 air m Neof Point of Rocks.","USA",NA,1995,"PRESERVED_SPECIMEN","OCCURRENCE_STATUS_INFERRED_FROM_INDIVIDUAL_COUNT;CONTINENT_DERIVED_FROM_COORDINATES;INSTITUTION_MATCH_FUZZY"
-106.33,40.2,"Astragalus leucolobus",3798082588,"At Gunsite Pass.","USA",NA,1993,"PRESERVED_SPECIMEN","OCCURRENCE_STATUS_INFERRED_FROM_INDIVIDUAL_COUNT;CONTINENT_DERIVED_FROM_COORDINATES;INSTITUTION_MATCH_FUZZY"
-111.02,42.85,"Astragalus leucolobus",3798083421,"Lincoln County, WY Wyoming/Salt River Ranges: Caribou Range: 9.5 mi NNW of Afton","USA",NA,1992,"PRESERVED_SPECIMEN","OCCURRENCE_STATUS_INFERRED_FROM_INDIVIDUAL_COUNT;CONTINENT_DERIVED_FROM_COORDINATES;INSTITUTION_MATCH_FUZZY"
-109.95,42.07,"Astragalus leucolobus",3798083418,"Sweetwater County, WY Green River Basin: Fourmile Gulch, ca 6 mi ENE of Fontenelle Dam","USA",NA,1995,"PRESERVED_SPECIMEN","OCCURRENCE_STATUS_INFERRED_FROM_INDIVIDUAL_COUNT;CONTINENT_DERIVED_FROM_COORDINATES;INSTITUTION_MATCH_FUZZY"
-107.51,43.95,"Astragalus leucolobus",3798083420,"Washakie County, WY Bighorn Basin: Castle Gardens about 6.5 mi SW of Tensleep","USA",NA,1980,"PRESERVED_SPECIMEN","OCCURRENCE_STATUS_INFERRED_FROM_INDIVIDUAL_COUNT;CONTINENT_DERIVED_FROM_COORDINATES;INSTITUTION_MATCH_FUZZY"
-109.396,40.433,"Astragalus leucolobus",4010611449,"5.5 miles and 324 deg. from Jensen","USA",NA,2020,"PRESERVED_SPECIMEN","GEODETIC_DATUM_ASSUMED_WGS84;CONTINENT_DERIVED_FROM_COORDINATES;INSTITUTION_MATCH_FUZZY;COLLECTION_MATCH_FUZZY"
-107.44,40.59,"Astragalus leucolobus",3798103414,"North-central Colorado: Wymore Gulch, ca 7 air mi NE of Craig.","USA",NA,2001,"PRESERVED_SPECIMEN","OCCURRENCE_STATUS_INFERRED_FROM_INDIVIDUAL_COUNT;CONTINENT_DERIVED_FROM_COORDINATES;INSTITUTION_MATCH_FUZZY"
-108.3,40.05,"Astragalus leucolobus",3798117436,"ca 2 mi ENE of jct of Pinto Gulch & Yellow Ck","USA",NA,1982,"PRESERVED_SPECIMEN","OCCURRENCE_STATUS_INFERRED_FROM_INDIVIDUAL_COUNT;CONTINENT_DERIVED_FROM_COORDINATES;INSTITUTION_MATCH_FUZZY"
-108.62,40.08,"Astragalus leucolobus",3798117440,"Fletcher Ck, 6 mi E of & 1 mi SE of jct of Gillam Draw & St Hwy 64","USA",NA,1982,"PRESERVED_SPECIMEN","OCCURRENCE_STATUS_INFERRED_FROM_INDIVIDUAL_COUNT;CONTINENT_DERIVED_FROM_COORDINATES;INSTITUTION_MATCH_FUZZY"
-108.43,40.11,"Astragalus leucolobus",3798117478,"0.4 mi SSE of jct of Greasewood Ck & N Greasewood","USA",NA,1982,"PRESERVED_SPECIMEN","OCCURRENCE_STATUS_INFERRED_FROM_INDIVIDUAL_COUNT;CONTINENT_DERIVED_FROM_COORDINATES;INSTITUTION_MATCH_FUZZY"
-107.76,39.87,"Astragalus leucolobus",3798117481,"0.2 mi NE of jct of E & Middle Miller Cks","USA",NA,1982,"PRESERVED_SPECIMEN","OCCURRENCE_STATUS_INFERRED_FROM_INDIVIDUAL_COUNT;CONTINENT_DERIVED_FROM_COORDINATES;INSTITUTION_MATCH_FUZZY"
-108.79,39.64,"Astragalus leucolobus",3798117532,"St Hwy 139, 0.8 km S of Garfield County Line","USA",NA,1978,"PRESERVED_SPECIMEN","OCCURRENCE_STATUS_INFERRED_FROM_INDIVIDUAL_COUNT;CONTINENT_DERIVED_FROM_COORDINATES;INSTITUTION_MATCH_FUZZY"
-108.52,40.18,"Astragalus leucolobus",3798117493,"12 air mi ENE of Rangely, along Hwy 64","USA",NA,1983,"PRESERVED_SPECIMEN","OCCURRENCE_STATUS_INFERRED_FROM_INDIVIDUAL_COUNT;CONTINENT_DERIVED_FROM_COORDINATES;INSTITUTION_MATCH_FUZZY"
