"lon","lat","species","gbifID","locality","countryCode","coordinateUncertaintyInMeters","year","basisOfRecord","issue"
-119.716667,46.5,"Astragalus leucolobus",1846507859,"Rattlesnake Mt. SE facing ridge, near gravel pit","USA",NA,1971,"PRESERVED_SPECIMEN","GEODETIC_DATUM_ASSUMED_WGS84;CONTINENT_DERIVED_FROM_COORDINATES;INSTITUTION_MATCH_FUZZY;COLLECTION_MATCH_NONE"
-114.4503,42.07809,"Astragalus leucolobus",1930943098,"Shoshone Basin Road, near rim rock where road crosses drainage","USA",NA,1979,"PRESERVED_SPECIMEN","GEODETIC_DATUM_ASSUMED_WGS84;COLLECTION_MATCH_FUZZY"
-106.412999,40.164676,"Astragalus leucolobus",2242388196,"Wolford Res., ca. 7.5 mi. N of Kremmling. E of US 40 & reservoir.","USA",NA,2011,"PRESERVED_SPECIMEN","GEODETIC_DATUM_ASSUMED_WGS84;CONTINENT_DERIVED_FROM_COORDINATES;INSTITUTION_MATCH_FUZZY"
-109.4616,40.26699,"Astragalus leucolobus",2242354405,"Along two track rd just W of UT hwy 45, 3.9 road mi. S of bridge crossing Green R.; 2mi. 67° NE of true N from mouth of Baser Wash; type locality of Horseshoe Bend milkvetch","USA",NA,2017,"PRESERVED_SPECIMEN","CONTINENT_DERIVED_FROM_COORDINATES;INSTITUTION_MATCH_FUZZY"
-119.67535,49.01419,"Astragalus leucolobus",3414073404,"Okanagan-Similkameen Regional District, South Okanagan Grassland Provincial Protected Area, roadside & just beyond fence on Nighthawk Road","CAN",NA,2012,"PRESERVED_SPECIMEN","CONTINENT_DERIVED_FROM_COORDINATES;INSTITUTION_MATCH_NONE"
-119.666667,38.316667,"Astragalus leucolobus",1988098069,"Tuolumne County, Sonora Pass","USA",NA,2000,"PRESERVED_SPECIMEN","GEODETIC_DATUM_ASSUMED_WGS84;GEODETIC_DATUM_INVALID;CONTINENT_DERIVED_FROM_COORDINATES;INSTITUTION_MATCH_NONE"
-121.166667,50.416667,"Astragalus leucolobus",1988220024,"42 km northwest of Merritt, Route 8 at turnoff to Chataway Lakes","CAN",NA,1986,"PRESERVED_SPECIMEN","GEODETIC_DATUM_ASSUMED_WGS84;GEODETIC_DATUM_INVALID;CONTINENT_DERIVED_FROM_COORDINATES;INSTITUTION_MATCH_NONE"
-123.233333,49.25,"Astragalus leucolobus",1988206352,"Greater Vancouver Regional District, Vancouver, University of British Columbia Botanical Garden, Alpine Garden","CAN",NA,2009,"PRESERVED_SPECIMEN","GEODETIC_DATUM_ASSUMED_WGS84;GEODETIC_DATUM_INVALID;CONTINENT_DERIVED_FROM_COORDINATES;INSTITUTION_MATCH_NONE"
-119.1205,34.7096,"Astragalus leucolobus",3053351556,"Los Padres National Forest; San Guillermo Mtn area, along drainage parallelling Mutau Rd","USA",200,2015,"PRESERVED_SPECIMEN","CONTINENT_DERIVED_FROM_COORDINATES;INSTITUTION_MATCH_FUZZY;COLLECTION_MATCH_NONE"
-120.644222,36.336917,"Astragalus leucolobus",3053476702,"[San Benito River, ca. 2 km SW of San Benito Mill site]","USA",NA,2017,"PRESERVED_SPECIMEN","CONTINENT_DERIVED_FROM_COORDINATES;INSTITUTION_MATCH_FUZZY;COLLECTION_MATCH_NONE"
-117.73278,34.39944,"Astragalus leucolobus",3330033315,"Boulder Canyon, upper end near Hwy 2","USA",NA,1999,"PRESERVED_SPECIMEN","GEODETIC_DATUM_ASSUMED_WGS84;CONTINENT_DERIVED_FROM_COORDINATES;INSTITUTION_MATCH_FUZZY;COLLECTION_MATCH_NONE"
-120.37312,39.5758,"Astragalus leucolobus",3125063330,"Sierraville.","USA",3000,1967,"PRESERVED_SPECIMEN","CONTINENT_DERIVED_FROM_COORDINATES;INSTITUTION_MATCH_FUZZY;COLLECTION_MATCH_NONE"
-116.4831,33.5435,"Astragalus leucolobus",3125067310,"N side of Santa Rosa Peak","USA",NA,1993,"PRESERVED_SPECIMEN","CONTINENT_DERIVED_FROM_COORDINATES;INSTITUTION_MATCH_FUZZY;COLLECTION_MATCH_NONE"
-118.54167,35.54583,"Astragalus leucolobus",3125196379,"Western slope of the Southern Sierra Nevada. Breckenridge Mountains, Kern River Basin. Along old mining 4WD road between Golf Ranch and Hobo Piute Cypress Grove.","USA",NA,1982,"PRESERVED_SPECIMEN","CONTINENT_DERIVED_FROM_COORDINATES;INSTITUTION_MATCH_FUZZY;COLLECTION_MATCH_NONE"
-111.257959,43.463567,"Astragalus leucolobus",1928701880,"Targhee National Forest, Rainey Creek. Drive along Irwin North Road/ Rainey Creek Road. Location is north of Rocky Ridge and west of Cromwell Canyon along roadside and creek, near forest service exclosure. Uncertainty: 500 m., Datum: WGS 84, Source: GeoLocate.","USA",NA,1979,"PRESERVED_SPECIMEN","GEODETIC_DATUM_ASSUMED_WGS84;COLLECTION_MATCH_FUZZY"
-116.9804,34.2897,"Astragalus leucolobus",2451551435,"Hanna Flat between Holcomb Cr & Fawnskin Valley, San Bernardino Mts","USA",700,1963,"PRESERVED_SPECIMEN","CONTINENT_DERIVED_FROM_COORDINATES;INSTITUTION_MATCH_FUZZY"
-110.6455,41.7315,"Astragalus leucolobus",1986948651,"Sorenson Mine-12UC","USA",1100,1981,"PRESERVED_SPECIMEN","GEODETIC_DATUM_ASSUMED_WGS84;CONTINENT_DERIVED_FROM_COORDINATES;COLLECTION_MATCH_FUZZY"
-119.833333,42.5,"Astragalus leucolobus",1986947219,"Mouth of DeGarno Canyon. Hart Mountain National Antelope Refuge.","USA",NA,1996,"PRESERVED_SPECIMEN","COORDINATE_ROUNDED;GEODETIC_DATUM_ASSUMED_WGS84;CONTINENT_DERIVED_FROM_COORDINATES;COLLECTION_MATCH_FUZZY"
-113.9289,42.194767,"Astragalus leucolobus",1986994938,"Hills above and west of Goose Creek Reservoir","USA",NA,2006,"PRESERVED_SPECIMEN","COORDINATE_ROUNDED;GEODETIC_DATUM_ASSUMED_WGS84;CONTINENT_DERIVED_FROM_COORDINATES;COLLECTION_MATCH_FUZZY"
-111.805472,40.788972,"Astragalus leucolobus",1986994281,"","USA",NA,1972,"PRESERVED_SPECIMEN","GEODETIC_DATUM_ASSUMED_WGS84;CONTINENT_DERIVED_FROM_COORDINATES;COLLECTION_MATCH_FUZZY"
-109.068833,40.357611,"Astragalus leucolobus",1986994140,"Miners Draw","USA",NA,1982,"PRESERVED_SPECIMEN","GEODETIC_DATUM_ASSUMED_WGS84;CONTINENT_DERIVED_FROM_COORDINATES;COLLECTION_MATCH_FUZZY"
-113.625278,41.495833,"Astragalus leucolobus",1986969981,"Grouse Creek Range Bovine Mts ca. 27 miles SW of Rosette on Hwy 30 and 24 miles east of the Nevada state line","USA",NA,1995,"PRESERVED_SPECIMEN","COORDINATE_ROUNDED;GEODETIC_DATUM_ASSUMED_WGS84;CONTINENT_DERIVED_FROM_COORDINATES;COLLECTION_MATCH_FUZZY"
-109.071194,40.197056,"Astragalus leucolobus",1986994612,"E side of Raven Ridge, Uintah Basin","USA",NA,1982,"PRESERVED_SPECIMEN","GEODETIC_DATUM_ASSUMED_WGS84;CONTINENT_DERIVED_FROM_COORDINATES;COLLECTION_MATCH_FUZZY"
-113.454722,41.923333,"Astragalus leucolobus",1986927549,"Road to the Meadows N of George Peak Raft River Mtns","USA",NA,1980,"PRESERVED_SPECIMEN","COORDINATE_ROUNDED;GEODETIC_DATUM_ASSUMED_WGS84;CONTINENT_DERIVED_FROM_COORDINATES;COLLECTION_MATCH_FUZZY"
-113.9512,38.227804,"Astragalus leucolobus",1986868357,"","USA",3,2016,"PRESERVED_SPECIMEN","CONTINENT_DERIVED_FROM_COORDINATES;COLLECTION_MATCH_FUZZY"
-118.35314,35.06515,"Astragalus leucolobus",2565953549,"4.4 miles west of Highway 58 on Cameron Road","USA",800,1972,"PRESERVED_SPECIMEN","CONTINENT_DERIVED_FROM_COORDINATES;INSTITUTION_MATCH_FUZZY"
-117.0584,35.9102,"Astragalus leucolobus",2565956848,"Willow Springs, w. entrance to Anvil Canyon, NE end of Butte Valley, E. of Manley Peak, Panamint Mts. About 3/4 mi. S. of Willow Springs up to the main drainage, then 1/4 mi. E over the saddle.","USA",1200,1954,"PRESERVED_SPECIMEN","GEODETIC_DATUM_ASSUMED_WGS84;CONTINENT_DERIVED_FROM_COORDINATES;INSTITUTION_MATCH_FUZZY"
-119.4975,47.405,"Astragalus leucolobus",441699544,"Above east side of Soap Lake.","USA",NA,1951,"PRESERVED_SPECIMEN","GEODETIC_DATUM_ASSUMED_WGS84;CONTINENT_DERIVED_FROM_COORDINATES;INSTITUTION_MATCH_FUZZY;INSTITUTION_COLLECTION_MISMATCH"
-113.94389,43.423665,"Astragalus leucolobus",441699609,"8 miles north of Carey.","USA",NA,1951,"PRESERVED_SPECIMEN","GEODETIC_DATUM_ASSUMED_WGS84;CONTINENT_DERIVED_FROM_COORDINATES;INSTITUTION_MATCH_FUZZY;INSTITUTION_COLLECTION_MISMATCH"
-116.93278,43.328084,"Astragalus leucolobus",441699627,"Hills about 20 miles south of Homedale.","USA",NA,1957,"PRESERVED_SPECIMEN","GEODETIC_DATUM_ASSUMED_WGS84;CONTINENT_DERIVED_FROM_COORDINATES;INSTITUTION_MATCH_FUZZY;INSTITUTION_COLLECTION_MISMATCH"
-115.175193,42.985276,"Astragalus leucolobus",441699630,"Along Snake River, 2 miles east of King Hill.","USA",NA,1951,"PRESERVED_SPECIMEN","GEODETIC_DATUM_ASSUMED_WGS84;CONTINENT_DERIVED_FROM_COORDINATES;INSTITUTION_MATCH_FUZZY;INSTITUTION_COLLECTION_MISMATCH"
-120.331639,47.567944,"Astragalus leucolobus",441699254,"Swakane Wildlife Area, Swakane Canyon Road, about 8 kilometers, from junction with State Highway Alt. 97. Steep slope, north side of road.","USA",NA,2004,"PRESERVED_SPECIMEN","COORDINATE_ROUNDED;GEODETIC_DATUM_ASSUMED_WGS84;CONTINENT_DERIVED_FROM_COORDINATES;INSTITUTION_MATCH_FUZZY;INSTITUTION_COLLECTION_MISMATCH"
-120.0138,47.14745,"Astragalus leucolobus",441700035,"Colockum Wildlife Area. Collins Spring Canyon. Upper elevation of south wall of canyon.","USA",NA,2007,"PRESERVED_SPECIMEN","GEODETIC_DATUM_ASSUMED_WGS84;CONTINENT_DERIVED_FROM_COORDINATES;INSTITUTION_MATCH_FUZZY;INSTITUTION_COLLECTION_MISMATCH"
-119.073889,47.870278,"Astragalus leucolobus",623658879,"Northrup Canyon.","USA",NA,2009,"PRESERVED_SPECIMEN","COORDINATE_ROUNDED;GEODETIC_DATUM_ASSUMED_WGS84;CONTINENT_DERIVED_FROM_COORDINATES;INSTITUTION_MATCH_FUZZY;INSTITUTION_COLLECTION_MISMATCH"
-117.116667,44.566667,"Astragalus leucolobus",441699557,"Snake River Road 30 miles from Huntington west side of road.","USA",NA,2004,"PRESERVED_SPECIMEN","COORDINATE_ROUNDED;GEODETIC_DATUM_ASSUMED_WGS84;CONTINENT_DERIVED_FROM_COORDINATES;INSTITUTION_MATCH_FUZZY;INSTITUTION_COLLECTION_MISMATCH"
-115.79639,42.634287,"Astragalus leucolobus",441699601,"17 miles south of Bruneau.","USA",NA,1964,"PRESERVED_SPECIMEN","GEODETIC_DATUM_ASSUMED_WGS84;CONTINENT_DERIVED_FROM_COORDINATES;INSTITUTION_MATCH_FUZZY;INSTITUTION_COLLECTION_MISMATCH"
-120.676167,43.175117,"Astragalus leucolobus",441700022,"Bureau of Land Management's Black Hills Preserve. 10 kilometers south of Christmas Valley.","USA",NA,2004,"PRESERVED_SPECIMEN","COORDINATE_ROUNDED;GEODETIC_DATUM_ASSUMED_WGS84;CONTINENT_DERIVED_FROM_COORDINATES;INSTITUTION_MATCH_FUZZY;INSTITUTION_COLLECTION_MISMATCH"
-120.67859,46.48273,"Astragalus leucolobus",441699260,"BLM- Emile Robert Grazing Allotment.","USA",NA,2005,"PRESERVED_SPECIMEN","GEODETIC_DATUM_ASSUMED_WGS84;CONTINENT_DERIVED_FROM_COORDINATES;INSTITUTION_MATCH_FUZZY;INSTITUTION_COLLECTION_MISMATCH"
-113.19937,43.636626,"Astragalus leucolobus",441699604,"5 miles east of Arco.","USA",NA,1951,"PRESERVED_SPECIMEN","GEODETIC_DATUM_ASSUMED_WGS84;CONTINENT_DERIVED_FROM_COORDINATES;INSTITUTION_MATCH_FUZZY;INSTITUTION_COLLECTION_MISMATCH"
-120.1474,47.3291,"Astragalus leucolobus",441700043,"Upper Dry Gulch- DNR Natural Area Preserve (NAP), .5 miles on dirt road from main entrance to NAP (horse corral gate), 20 meters from road on south-facing slope.","USA",NA,2005,"PRESERVED_SPECIMEN","GEODETIC_DATUM_ASSUMED_WGS84;CONTINENT_DERIVED_FROM_COORDINATES;INSTITUTION_MATCH_FUZZY;INSTITUTION_COLLECTION_MISMATCH"
-116.301631,45.862098,"Astragalus leucolobus",441699623,"Nez Perce National Forest; Lucille Bar on Salmon River.","USA",NA,1975,"PRESERVED_SPECIMEN","RECORDED_DATE_INVALID;GEODETIC_DATUM_ASSUMED_WGS84;CONTINENT_DERIVED_FROM_COORDINATES;INSTITUTION_MATCH_FUZZY;INSTITUTION_COLLECTION_MISMATCH"
-113.608332,43.897117,"Astragalus leucolobus",441699606,"Big Lost River, 2 miles south of MacKay.","USA",NA,1951,"PRESERVED_SPECIMEN","GEODETIC_DATUM_ASSUMED_WGS84;CONTINENT_DERIVED_FROM_COORDINATES;INSTITUTION_MATCH_FUZZY;INSTITUTION_COLLECTION_MISMATCH"
-120.75,45.7,"Astragalus leucolobus",441700067,"Circa 1 mile west of Hartley Canyon, Columbia Hills.","USA",NA,2009,"PRESERVED_SPECIMEN","GEODETIC_DATUM_ASSUMED_WGS84;CONTINENT_DERIVED_FROM_COORDINATES;INSTITUTION_MATCH_FUZZY;INSTITUTION_COLLECTION_MISMATCH"
-117.04722,46.252573,"Astragalus leucolobus",441699220,"6 miles south of Asotin, along west side of Columbia River.","USA",NA,1959,"PRESERVED_SPECIMEN","GEODETIC_DATUM_ASSUMED_WGS84;CONTINENT_DERIVED_FROM_COORDINATES;INSTITUTION_MATCH_FUZZY;INSTITUTION_COLLECTION_MISMATCH"
-116.9,44.783333,"Astragalus leucolobus",441699617,"Above Brownlee reservoir off Route 71, half a mile south of the dam.","USA",NA,1994,"PRESERVED_SPECIMEN","COORDINATE_ROUNDED;GEODETIC_DATUM_ASSUMED_WGS84;CONTINENT_DERIVED_FROM_COORDINATES;INSTITUTION_MATCH_FUZZY;INSTITUTION_COLLECTION_MISMATCH"
-119.801129,46.613832,"Astragalus leucolobus",441699752,"Hanford Site, Umtanum Ridge.","USA",NA,1995,"PRESERVED_SPECIMEN","GEODETIC_DATUM_ASSUMED_WGS84;CONTINENT_DERIVED_FROM_COORDINATES;INSTITUTION_MATCH_FUZZY;INSTITUTION_COLLECTION_MISMATCH"
-119.660653,48.756108,"Astragalus leucolobus",441700075,"Washington Department of Fish and Wildlife land. Sinlahekin State Wildlife Recreation Area, west of Sinlahekin County Road and east of Stadium Lake. Ecoregion: O-11, Columbia Plateau.","USA",NA,2010,"PRESERVED_SPECIMEN","COORDINATE_ROUNDED;GEODETIC_DATUM_ASSUMED_WGS84;CONTINENT_DERIVED_FROM_COORDINATES;INSTITUTION_MATCH_FUZZY;INSTITUTION_COLLECTION_MISMATCH"
-117.375,46.633333,"Astragalus leucolobus",441699222,"Wawawai County Park, Wawawai.","USA",NA,1993,"PRESERVED_SPECIMEN","COORDINATE_ROUNDED;GEODETIC_DATUM_ASSUMED_WGS84;CONTINENT_DERIVED_FROM_COORDINATES;INSTITUTION_MATCH_FUZZY;INSTITUTION_COLLECTION_MISMATCH"
-118.93593,47.93413,"Astragalus leucolobus",623658880,"Lake Roosevelt National Recreation Area. Spring Canyon Campground area. East side of campground around parking lot.","USA",NA,2009,"PRESERVED_SPECIMEN","GEODETIC_DATUM_ASSUMED_WGS84;CONTINENT_DERIVED_FROM_COORDINATES;INSTITUTION_MATCH_FUZZY;INSTITUTION_COLLECTION_MISMATCH"
-119.31556,45.94833,"Astragalus leucolobus",623658899,"Sillusi Butte by Wallula Lake.","USA",NA,1980,"PRESERVED_SPECIMEN","GEODETIC_DATUM_ASSUMED_WGS84;CONTINENT_DERIVED_FROM_COORDINATES;INSTITUTION_MATCH_FUZZY;INSTITUTION_COLLECTION_MISMATCH"
-116.250585,43.693393,"Astragalus leucolobus",441699621,"North of Seaman Gulch Road, 1.5 miles northeast of the junction with Hill Road in the Boise Foothills.","USA",NA,1993,"PRESERVED_SPECIMEN","GEODETIC_DATUM_ASSUMED_WGS84;CONTINENT_DERIVED_FROM_COORDINATES;INSTITUTION_MATCH_FUZZY;INSTITUTION_COLLECTION_MISMATCH"
-113.022785,43.39612,"Astragalus leucolobus",1929276600,"Big Southern Butte.","USA",NA,1976,"PRESERVED_SPECIMEN","COLLECTION_MATCH_FUZZY"
-109.7358,41.7625,"Astragalus leucolobus",2270500749,"Seedskadee National Wildlife Refuge, vicinity of Big Island Bridge","USA",5000,1979,"PRESERVED_SPECIMEN","CONTINENT_DERIVED_FROM_COORDINATES;INSTITUTION_MATCH_FUZZY;INSTITUTION_COLLECTION_MISMATCH"
-120.25,50.416667,"Astragalus leucolobus",894988397,"South of Kamloops, between Shuway & Trapp Lakes","CAN",NA,1965,"PRESERVED_SPECIMEN","COORDINATE_ROUNDED;GEODETIC_DATUM_ASSUMED_WGS84;CONTINENT_DERIVED_FROM_COORDINATES;INSTITUTION_MATCH_FUZZY;COLLECTION_MATCH_FUZZY"
-110.591,41.4705,"Astragalus leucolobus",1675860560,"Lincoln & Uinta Counties","USA",NA,2011,"PRESERVED_SPECIMEN","GEODETIC_DATUM_ASSUMED_WGS84"
-105.474,41.7124,"Astragalus leucolobus",1852101932,"Hwy 34 E side of rd, base of slope embankment, near the mouth of Long Canyon.","USA",NA,2017,"PRESERVED_SPECIMEN","GEODETIC_DATUM_ASSUMED_WGS84"
-120.445365,41.556863,"Astragalus leucolobus",3091295146,"Along Hwy 395 northeast of Alturas","USA",NA,2019,"PRESERVED_SPECIMEN","COORDINATE_ROUNDED;CONTINENT_DERIVED_FROM_COORDINATES;INSTITUTION_MATCH_FUZZY;COLLECTION_MATCH_NONE"
-120.094821,39.439837,"Astragalus leucolobus",2421730741,"Nevada County: Near Little Truckee Riv., Tahoe Forest.","USA",969,1991,"PRESERVED_SPECIMEN","GEODETIC_DATUM_ASSUMED_WGS84;CONTINENT_DERIVED_FROM_COORDINATES;INSTITUTION_MATCH_FUZZY"
-120.21128,39.831274,"Astragalus leucolobus",2421731005,"Plumas County: Plumas National Forest, Milford Ranger District. West of Frenchman Lake along FS Rt. 11.","USA",969,1999,"PRESERVED_SPECIMEN","GEODETIC_DATUM_ASSUMED_WGS84;CONTINENT_DERIVED_FROM_COORDINATES;INSTITUTION_MATCH_FUZZY"
-117,34.366667,"Astragalus leucolobus",2421731784,"San Bernardino County: Desert facing slope, above Lucerne Valley: Hillsides, ridgetops and adjacent alluvial fan W of Silver Creek and just S of Pluess-Staufer haul road to White Knob quarry.","USA",NA,1996,"PRESERVED_SPECIMEN","GEODETIC_DATUM_ASSUMED_WGS84;CONTINENT_DERIVED_FROM_COORDINATES;INSTITUTION_MATCH_FUZZY"
-119.650156,40.030894,"Astragalus leucolobus",2626934466,"Washoe Co.: SW of Warrior Point, Pyramid Lake. 11 mi N of junction of Sutcliffe Hwy (Hwy 446) and Hwy 445.","USA",NA,2009,"PRESERVED_SPECIMEN","GEODETIC_DATUM_ASSUMED_WGS84;CONTINENT_DERIVED_FROM_COORDINATES;INSTITUTION_MATCH_FUZZY;COLLECTION_MATCH_FUZZY"
-118.02,35.663056,"Astragalus leucolobus",2421684083,"Kern County: Tehachapi Mountains. Slopes west of Walker Pass along Hwy 178.","USA",NA,2003,"PRESERVED_SPECIMEN","GEODETIC_DATUM_ASSUMED_WGS84;CONTINENT_DERIVED_FROM_COORDINATES;INSTITUTION_MATCH_FUZZY"
-120.38358,39.692444,"Astragalus leucolobus",2421710309,"Sierra County: Sierra Valley, Roen Ranch, along Westside Rd, ca. 2 km N of the intersection of Westside and Calpine Roads, ca. 1 km east of Westside Rd.","USA",NA,2009,"PRESERVED_SPECIMEN","COORDINATE_ROUNDED;CONTINENT_DERIVED_FROM_COORDINATES;INSTITUTION_MATCH_FUZZY"
-119.831944,38.699444,"Astragalus leucolobus",2421713604,"Alpine County: Grover Hot Springs State Park, W of town of Markleeville. Eastern side of park in campground area N of Hot Spirngs Creek.","USA",NA,2010,"PRESERVED_SPECIMEN","CONTINENT_DERIVED_FROM_COORDINATES;INSTITUTION_MATCH_FUZZY"
-118.842,37.5929,"Astragalus leucolobus",2421731176,"Mono County: Southeast of Convict Lake, Convict Creek Basin, Sierra Nevada.","USA",350,1962,"PRESERVED_SPECIMEN","CONTINENT_DERIVED_FROM_COORDINATES;INSTITUTION_MATCH_FUZZY"
-118.953549,44.207571,"Astragalus leucolobus",3820575512,"Malheur National Forest, Starr Ridge; FR 3925, north of road, between spur roads 3925-316 and 3925-946.","USA",805,2010,"PRESERVED_SPECIMEN","GEODETIC_DATUM_ASSUMED_WGS84;CONTINENT_DERIVED_FROM_COORDINATES;DIFFERENT_OWNER_INSTITUTION"
-118.46039,43.77399,"Astragalus leucolobus",3820544233,"House Butte seeding project, just west of Stinkingwater Creek and north of Hwy. 20.","USA",805,1979,"PRESERVED_SPECIMEN","CONTINENT_DERIVED_FROM_COORDINATES;DIFFERENT_OWNER_INSTITUTION"
-117.206975,42.620848,"Astragalus leucolobus",3820539539,"none","USA",201,1978,"PRESERVED_SPECIMEN","COORDINATE_ROUNDED;CONTINENT_DERIVED_FROM_COORDINATES;DIFFERENT_OWNER_INSTITUTION"
-120.098686,42.156453,"Astragalus leucolobus",3820599599,"Sage Hen Butte; take Hwy 140E from Lakeview for 17 mi.; turn right onto Rd 7172; continue for 1.5 miles and cross Sage Hen Creek; after 1mi, continue right and drive 1.7 mi.; keep left at the spilt and drive through shallow water next to a small pond.","USA",805,2016,"PRESERVED_SPECIMEN","COORDINATE_ROUNDED;GEODETIC_DATUM_ASSUMED_WGS84;CONTINENT_DERIVED_FROM_COORDINATES;DIFFERENT_OWNER_INSTITUTION"
-118.707121,43.82841,"Astragalus leucolobus",3820682219,"Malheur National Forest, Pine Creek watershed, southern extent of Malheur NF. Ridgeline above Pine Creek, just SW of Black Butte. Intersection of of FR 951 and unmarked Forest Service road. Wide scabland on ridgeline.","USA",805,2010,"PRESERVED_SPECIMEN","GEODETIC_DATUM_ASSUMED_WGS84;CONTINENT_DERIVED_FROM_COORDINATES;DIFFERENT_OWNER_INSTITUTION"
-117.1257,43.5347,"Astragalus leucolobus",3820699833,"Succor Creek rd, hillsides adjacent to old clay mine NE of BM2810, between Board Corral Gulch & Camp Kettle Creek.","USA",805,1999,"PRESERVED_SPECIMEN","GEODETIC_DATUM_ASSUMED_WGS84;CONTINENT_DERIVED_FROM_COORDINATES;DIFFERENT_OWNER_INSTITUTION"
-119.983333,42.365917,"Astragalus leucolobus",3820733710,"Fish Lake.","USA",805,2017,"PRESERVED_SPECIMEN","COORDINATE_ROUNDED;GEODETIC_DATUM_ASSUMED_WGS84;CONTINENT_DERIVED_FROM_COORDINATES;DIFFERENT_OWNER_INSTITUTION"
-119.676288,42.581799,"Astragalus leucolobus",3820733776,"Hart Mountain Antelope Refuge, Petroglyph Lake; northwest shore of playa.","USA",805,2016,"PRESERVED_SPECIMEN","GEODETIC_DATUM_ASSUMED_WGS84;CONTINENT_DERIVED_FROM_COORDINATES;DIFFERENT_OWNER_INSTITUTION"
-119.590561,44.472564,"Astragalus leucolobus",3820700613,"west of Dayville off of Highway 26 near the cemetery.","USA",805,2014,"PRESERVED_SPECIMEN","COORDINATE_ROUNDED;GEODETIC_DATUM_ASSUMED_WGS84;CONTINENT_DERIVED_FROM_COORDINATES;DIFFERENT_OWNER_INSTITUTION"
-119.59035,42.58184,"Astragalus leucolobus",3820642904,"Hart Mountain National Antelope Refuge, road from Headquarters to French Glen; 3.5 miles northeast of Refuge Headquarters, southwest of where Rock Creek crosses road.","USA",805,1996,"PRESERVED_SPECIMEN","CONTINENT_DERIVED_FROM_COORDINATES;DIFFERENT_OWNER_INSTITUTION"
-117.1361,43.337,"Astragalus leucolobus",3820705524,"in flats N of Leslie Gulch road, N of VABM4104, NW foothills of Bannock Ridge.","USA",805,1999,"PRESERVED_SPECIMEN","GEODETIC_DATUM_ASSUMED_WGS84;CONTINENT_DERIVED_FROM_COORDINATES;DIFFERENT_OWNER_INSTITUTION"
-117.6697,42.8577,"Astragalus leucolobus",3820560597,"Rome cliffs, SW of Happy Valley Ditch, SE of BM3408.","USA",805,1999,"PRESERVED_SPECIMEN","GEODETIC_DATUM_ASSUMED_WGS84;CONTINENT_DERIVED_FROM_COORDINATES;DIFFERENT_OWNER_INSTITUTION"
-119.685394,42.100115,"Astragalus leucolobus",3820603025,"north 0.65 miles on BLM Road 6122-0-00 from Hwy 140, just west of Blizzard Gap.","USA",805,2016,"PRESERVED_SPECIMEN","GEODETIC_DATUM_ASSUMED_WGS84;CONTINENT_DERIVED_FROM_COORDINATES;DIFFERENT_OWNER_INSTITUTION"
-118.90341,44.116171,"Astragalus leucolobus",3820731682,"Malheur National Forest, where FR 1601 enters Antelope Valley.","USA",805,2010,"PRESERVED_SPECIMEN","GEODETIC_DATUM_ASSUMED_WGS84;CONTINENT_DERIVED_FROM_COORDINATES;DIFFERENT_OWNER_INSTITUTION"
-107.62512,40.57622,"Astragalus leucolobus",2573537100,"North-central Colorado: Cedar Mountain, ca 6 air mi NW of Craig.","USA",750,2001,"PRESERVED_SPECIMEN","CONTINENT_DERIVED_FROM_COORDINATES;AMBIGUOUS_INSTITUTION"
-106.28873,40.73153,"Astragalus leucolobus",2573541203,"North Park: western edge of Walden.","USA",1000,1986,"PRESERVED_SPECIMEN","CONTINENT_DERIVED_FROM_COORDINATES;AMBIGUOUS_INSTITUTION"
-105.57139,43.28013,"Astragalus leucolobus",2573384722,"Southeast. Bear Creek","USA",1250,1978,"PRESERVED_SPECIMEN","CONTINENT_DERIVED_FROM_COORDINATES;AMBIGUOUS_INSTITUTION"
-117.965148,47.84668,"Astragalus leucolobus",4070137465,"Spokane Indian Reservation. 3 or 4 miles south of Wellpinit on Little Falls Road..","USA",3000,2016,"PRESERVED_SPECIMEN","GEODETIC_DATUM_ASSUMED_WGS84;CONTINENT_DERIVED_FROM_COORDINATES;INSTITUTION_MATCH_FUZZY;COLLECTION_MATCH_FUZZY"
-117.50775,47.571356,"Astragalus leucolobus",4070145115,"1 kilometer northwest of Marshall.","USA",3807,1983,"PRESERVED_SPECIMEN","CONTINENT_DERIVED_FROM_COORDINATES;INSTITUTION_MATCH_FUZZY;COLLECTION_MATCH_FUZZY"
-117.929533,47.258251,"Astragalus leucolobus",4070145541,"3 mi. se of Sprague.","USA",800,1973,"PRESERVED_SPECIMEN","CONTINENT_DERIVED_FROM_COORDINATES;INSTITUTION_MATCH_FUZZY;COLLECTION_MATCH_FUZZY"
-118.96666,36.76666,"Astragalus leucolobus",4060863393,"Los Padres National Forest. Frazier Mountain Lookout, 10 mi S of Lockwood Valley Road.","USA",NA,1993,"PRESERVED_SPECIMEN","GEODETIC_DATUM_ASSUMED_WGS84;INSTITUTION_MATCH_NONE"
-109.761,40.4162,"Astragalus leucolobus",1852100613,"Ca. 2.5 miles E of LaPointe on US Hwy 121.","USA",NA,2017,"PRESERVED_SPECIMEN","GEODETIC_DATUM_ASSUMED_WGS84"
-121.07311,40.67751,"Astragalus leucolobus",2982046060,"Harvey Valley near Cone Springs","USA",3500,1971,"PRESERVED_SPECIMEN","CONTINENT_DERIVED_FROM_COORDINATES;INSTITUTION_MATCH_FUZZY"
-120.63316,40.30084,"Astragalus leucolobus",2982058332,"Along Hwy. 395 just before the turnoff to Janesville","USA",969,1975,"PRESERVED_SPECIMEN","GEODETIC_DATUM_ASSUMED_WGS84;CONTINENT_DERIVED_FROM_COORDINATES;INSTITUTION_MATCH_FUZZY"
-115.272778,35.317222,"Astragalus leucolobus",2982071654,"NE end of New York Mtns. Slaughterhouse Canyon.","USA",NA,1992,"PRESERVED_SPECIMEN","COORDINATE_ROUNDED;GEODETIC_DATUM_ASSUMED_WGS84;CONTINENT_DERIVED_FROM_COORDINATES;INSTITUTION_MATCH_FUZZY"
-122.725094,41.299717,"Astragalus leucolobus",2982022939,"Klamath National Forest, Hwy. 3, 2.4 mi. from Scott Mtn. summit.","USA",200,1979,"PRESERVED_SPECIMEN","CONTINENT_DERIVED_FROM_COORDINATES;INSTITUTION_MATCH_FUZZY"
-122.850092,41.327032,"Astragalus leucolobus",2982012494,"Along Sugar Creek","USA",647,1970,"PRESERVED_SPECIMEN","CONTINENT_DERIVED_FROM_COORDINATES;INSTITUTION_MATCH_FUZZY"
-123.703333,40.696111,"Astragalus leucolobus",2982025938,"Near Bug Creek Butte","USA",NA,1981,"PRESERVED_SPECIMEN","COORDINATE_ROUNDED;GEODETIC_DATUM_ASSUMED_WGS84;CONTINENT_DERIVED_FROM_COORDINATES;INSTITUTION_MATCH_FUZZY"
-122.658334,41.240717,"Astragalus leucolobus",2982056676,"SR 3, 1/4 mi. above the confluence of the Trinity River and Tangle Blue Creek.","USA",969,1977,"PRESERVED_SPECIMEN","GEODETIC_DATUM_ASSUMED_WGS84;CONTINENT_DERIVED_FROM_COORDINATES;INSTITUTION_MATCH_FUZZY"
-120.201886,41.332435,"Astragalus leucolobus",2982027224,"South Warner Mtns.","USA",969,1980,"PRESERVED_SPECIMEN","GEODETIC_DATUM_ASSUMED_WGS84;CONTINENT_DERIVED_FROM_COORDINATES;INSTITUTION_MATCH_FUZZY"
-122.97902,40.187541,"Astragalus leucolobus",2982018463,"Saddle between N Yolla Bolly Mtn. and Black Rock Mtn., Yolla Bolly Wilderness Area","USA",969,1974,"PRESERVED_SPECIMEN","GEODETIC_DATUM_ASSUMED_WGS84;CONTINENT_DERIVED_FROM_COORDINATES;INSTITUTION_MATCH_FUZZY"
-122.757503,41.733704,"Astragalus leucolobus",2982027356,"Mahogany Point just N of F.S. Rd. 45N28.","USA",969,1980,"PRESERVED_SPECIMEN","GEODETIC_DATUM_ASSUMED_WGS84;CONTINENT_DERIVED_FROM_COORDINATES;INSTITUTION_MATCH_FUZZY"
-123.143702,40.00881,"Astragalus leucolobus",2982014604,"Ukiah District","USA",500,1977,"PRESERVED_SPECIMEN","CONTINENT_DERIVED_FROM_COORDINATES;INSTITUTION_MATCH_FUZZY"
-114.713,43.066167,"Astragalus leucolobus",4070172568,"Little city of Rocks, North of Gooding","USA",NA,2004,"PRESERVED_SPECIMEN","GEODETIC_DATUM_ASSUMED_WGS84;CONTINENT_DERIVED_FROM_COORDINATES;INSTITUTION_MATCH_NONE"
-119.6,49.183333,"Astragalus leucolobus",1949608775,"Fairview: Fairview Road","CAN",NA,1977,"PRESERVED_SPECIMEN","OCCURRENCE_STATUS_INFERRED_FROM_INDIVIDUAL_COUNT;COORDINATE_ROUNDED;GEODETIC_DATUM_ASSUMED_WGS84;DIFFERENT_OWNER_INSTITUTION"
