"lon","lat","species","gbifID","locality","countryCode","coordinateUncertaintyInMeters","year","basisOfRecord","issue"
-114.616944,34.3325,"Astragalus acutirostris",1846555346,"Whipple Mountains: along East Mojave Heritage Trail, NNE of Pyramid Butte.","USA",NA,2005,"PRESERVED_SPECIMEN","GEODETIC_DATUM_ASSUMED_WGS84;CONTINENT_DERIVED_FROM_COORDINATES;INSTITUTION_MATCH_FUZZY;COLLECTION_MATCH_NONE"
-112.943444,34.331056,"Astragalus acutirostris",1846481648,"Sunflower Flat near Hillside-Congress Road, 10.5 airline miles SSW of Hillside.","USA",NA,1973,"PRESERVED_SPECIMEN","GEODETIC_DATUM_ASSUMED_WGS84;CONTINENT_DERIVED_FROM_COORDINATES;INSTITUTION_MATCH_FUZZY;COLLECTION_MATCH_NONE"
-116.070833,32.5125,"Astragalus acutirostris",1846507960,"Sierra Juarez, 4 km SW of La Rumorosa.","MEX",NA,1982,"PRESERVED_SPECIMEN","GEODETIC_DATUM_ASSUMED_WGS84;CONTINENT_DERIVED_FROM_COORDINATES;INSTITUTION_MATCH_FUZZY;COLLECTION_MATCH_NONE"
-117.412222,34.582778,"Astragalus acutirostris",1846507013,"Adelanto 7.5' Quad, ca. 2000 feet W of Hwy 395.","USA",NA,1993,"PRESERVED_SPECIMEN","GEODETIC_DATUM_ASSUMED_WGS84;CONTINENT_DERIVED_FROM_COORDINATES;INSTITUTION_MATCH_FUZZY;COLLECTION_MATCH_NONE"
-118.8,38.854167,"Astragalus acutirostris",1846507093,"Wassuk Range, foothills W of Hwy 95 just N of Walker Lake, W of a large gravel pit.","USA",NA,1986,"PRESERVED_SPECIMEN","GEODETIC_DATUM_ASSUMED_WGS84;CONTINENT_DERIVED_FROM_COORDINATES;INSTITUTION_MATCH_FUZZY;COLLECTION_MATCH_NONE"
-117.16803,37.31339,"Astragalus acutirostris",1928951393,"Gold Mt., 4.3 road miles SW of highway 95 on road to Tokop and the radio towers.","USA",NA,2016,"PRESERVED_SPECIMEN","COLLECTION_MATCH_FUZZY"
-117.5014,35.9636,"Astragalus acutirostris",1930261754,"Argus Range NNE of Ridgecrest, ca. 1½ mi N of head of Mountain Spring Canyon, rocky canyon on NE side of road,","USA",NA,1987,"PRESERVED_SPECIMEN","GEODETIC_DATUM_ASSUMED_WGS84;COLLECTION_MATCH_FUZZY"
-117.967419,37.776061,"Astragalus acutirostris",3802371232,"","USA",NA,2022,"HUMAN_OBSERVATION","COORDINATE_ROUNDED;CONTINENT_DERIVED_FROM_COORDINATES"
-116.5989882,34.6708307,"Astragalus acutirostris",3053375474,"between Camp Rock Mine to the W and Silver Bell Mine to the E; Rodman Mtns","USA",200,2005,"PRESERVED_SPECIMEN","COORDINATE_REPROJECTED;CONTINENT_DERIVED_FROM_COORDINATES;INSTITUTION_MATCH_FUZZY;COLLECTION_MATCH_NONE"
-116.37835,33.03135,"Astragalus acutirostris",3125066343,"Anza-Borrego Desert State Park, Little Blair Valley, in dry lake bed.","USA",402,1998,"PRESERVED_SPECIMEN","CONTINENT_DERIVED_FROM_COORDINATES;INSTITUTION_MATCH_FUZZY;COLLECTION_MATCH_NONE"
-115.10839,30.37169,"Astragalus acutirostris",3125113197,"East slope of Cerro Matomí.","MEX",NA,1973,"PRESERVED_SPECIMEN","CONTINENT_DERIVED_FROM_COORDINATES;INSTITUTION_MATCH_FUZZY;COLLECTION_MATCH_NONE"
-116.57833,34.20417,"Astragalus acutirostris",3125194355,"San Bernardino Mountains: Burns Canyon, 2.1 miles above Rimrock Road just below Burns Spring.","USA",NA,1995,"PRESERVED_SPECIMEN","CONTINENT_DERIVED_FROM_COORDINATES;INSTITUTION_MATCH_FUZZY;COLLECTION_MATCH_NONE"
-117.71667,35.56667,"Astragalus acutirostris",3125195333,"Mojave Desert, 3.0 miles southwest of Ridgecrest; ca. 1.5 miles north of intersection of Highway 395 and China Lake Road.","USA",NA,1991,"PRESERVED_SPECIMEN","CONTINENT_DERIVED_FROM_COORDINATES;INSTITUTION_MATCH_FUZZY;COLLECTION_MATCH_NONE"
-113.5866,28.89516,"Astragalus acutirostris",3125114245,"Sierra San Borja; on east slope, west peak, Cerro Santa Marta.","MEX",NA,1966,"PRESERVED_SPECIMEN","CONTINENT_DERIVED_FROM_COORDINATES;INSTITUTION_MATCH_FUZZY;COLLECTION_MATCH_NONE"
-115.73333,31.41667,"Astragalus acutirostris",3125115233,"2.0 km northwest of Lazaro Cardenas.","MEX",NA,1979,"PRESERVED_SPECIMEN","CONTINENT_DERIVED_FROM_COORDINATES;INSTITUTION_MATCH_FUZZY;COLLECTION_MATCH_NONE"
-116.9319,36.7887,"Astragalus acutirostris",3125191352,"Daylight Pass","USA",100,1983,"PRESERVED_SPECIMEN","CONTINENT_DERIVED_FROM_COORDINATES;INSTITUTION_MATCH_FUZZY;COLLECTION_MATCH_NONE"
-116.7606,36.90803,"Astragalus acutirostris",1927981179,"Hill southeast of Beatty","USA",NA,1978,"PRESERVED_SPECIMEN","GEODETIC_DATUM_ASSUMED_WGS84;COLLECTION_MATCH_FUZZY"
-117.2337,37.68063,"Astragalus acutirostris",1929196926,"1.3 road miles south of Goldfield's right angle road turn along Route 95, between Mira Mountain and Malpais Mesa","USA",NA,1986,"PRESERVED_SPECIMEN","GEODETIC_DATUM_ASSUMED_WGS84;COLLECTION_MATCH_FUZZY"
-117.555,37.3075,"Astragalus acutirostris",1986957820,"Tule Canyon, 0.9 road miles N of Roosevelt Well then1.0 road mile W, bluff to S of road,","USA",NA,2005,"PRESERVED_SPECIMEN","GEODETIC_DATUM_ASSUMED_WGS84;CONTINENT_DERIVED_FROM_COORDINATES;COLLECTION_MATCH_FUZZY"
-117.297222,37.663056,"Astragalus acutirostris",1986957554,"Montezuma Range, 1.1 road miles W of Mt. Jackson Road on Montezuma Range rad them 2.4 road miles N, hills to the W","USA",NA,2005,"PRESERVED_SPECIMEN","COORDINATE_ROUNDED;GEODETIC_DATUM_ASSUMED_WGS84;CONTINENT_DERIVED_FROM_COORDINATES;COLLECTION_MATCH_FUZZY"
-116.4814,37.024,"Astragalus acutirostris",1986957644,"Bullfrog Hills, 2.2 road miles W of highway 95 on the main road to Grapevine Mts.,","USA",NA,2005,"PRESERVED_SPECIMEN","GEODETIC_DATUM_ASSUMED_WGS84;CONTINENT_DERIVED_FROM_COORDINATES;COLLECTION_MATCH_FUZZY"
-118.335495,37.148416,"Astragalus acutirostris",2963901906,"","USA",103,2011,"HUMAN_OBSERVATION","COORDINATE_ROUNDED;CONTINENT_DERIVED_FROM_COORDINATES"
-118.090162,37.332238,"Astragalus acutirostris",2294405033,"","USA",5,2017,"HUMAN_OBSERVATION","CONTINENT_DERIVED_FROM_COORDINATES"
-118.096931,36.599306,"Astragalus acutirostris",2423133036,"","USA",10,2019,"HUMAN_OBSERVATION","COORDINATE_ROUNDED;CONTINENT_DERIVED_FROM_COORDINATES"
-117.629411,36.450869,"Astragalus acutirostris",2423136176,"","USA",5,2019,"HUMAN_OBSERVATION","COORDINATE_ROUNDED;CONTINENT_DERIVED_FROM_COORDINATES"
-116.5896,34.6388,"Astragalus acutirostris",2618313385,"Rodman Mountains, 55km ESE of central Barstow","USA",NA,2017,"PRESERVED_SPECIMEN","GEODETIC_DATUM_ASSUMED_WGS84;CONTINENT_DERIVED_FROM_COORDINATES;INSTITUTION_MATCH_FUZZY;INSTITUTION_COLLECTION_MISMATCH"
-118.9975,39.2841,"Astragalus acutirostris",2270496490,"12km SSW of Red Mountain, 20km SW of Fallon","USA",NA,2017,"PRESERVED_SPECIMEN","GEODETIC_DATUM_ASSUMED_WGS84;CONTINENT_DERIVED_FROM_COORDINATES;INSTITUTION_MATCH_FUZZY;INSTITUTION_COLLECTION_MISMATCH"
-115.069,34.926,"Astragalus acutirostris",3406826963,"Mojave Desert; Goffs. Lanfair Road, ca. 0.1 mi. N of intersection with Goffs Road","USA",10,2013,"PRESERVED_SPECIMEN","CONTINENT_DERIVED_FROM_COORDINATES;INSTITUTION_MATCH_FUZZY"
-117.8985,39.96284,"Astragalus acutirostris",1927952907,"Northwest side of Dixie Valley, 1.6 air miles west of Boyer Ranch","USA",NA,1979,"PRESERVED_SPECIMEN","GEODETIC_DATUM_ASSUMED_WGS84;COLLECTION_MATCH_FUZZY"
-119.0702,39.22105,"Astragalus acutirostris",1928935820,"Desert Mountains, 1.4 road miles south of the road summit on main road through the range to Wabuska","USA",NA,1998,"PRESERVED_SPECIMEN","GEODETIC_DATUM_ASSUMED_WGS84;COLLECTION_MATCH_FUZZY"
-116.851,36.9369,"Astragalus acutirostris",1929187122,"Amargosa. Cent. Bullfrog Hills, 1.5 mi up rd toward Sawtooth Mtn from Bullfrog-Gold Bar Rd","USA",NA,1970,"PRESERVED_SPECIMEN","GEODETIC_DATUM_ASSUMED_WGS84;COLLECTION_MATCH_FUZZY"
-115.38692,34.84778,"Astragalus acutirostris",3091255336,"Essex Road, North of I-40 on road to Mitchell Caverns","USA",NA,2005,"PRESERVED_SPECIMEN","GEODETIC_DATUM_ASSUMED_WGS84;CONTINENT_DERIVED_FROM_COORDINATES;INSTITUTION_MATCH_FUZZY;COLLECTION_MATCH_NONE"
-114.58303,35.84749,"Astragalus acutirostris",4052617315,"Householder Pass Quad: Hwy 93 S of Householder Pass","USA",NA,2011,"PRESERVED_SPECIMEN","GEODETIC_DATUM_ASSUMED_WGS84;CONTINENT_DERIVED_FROM_COORDINATES;INSTITUTION_MATCH_FUZZY;COLLECTION_MATCH_NONE"
-115.1823,35.76042,"Astragalus acutirostris",4071119336,"West side of McCullough Pass","USA",NA,2022,"PRESERVED_SPECIMEN","CONTINENT_DERIVED_FROM_COORDINATES;INSTITUTION_MATCH_FUZZY;COLLECTION_MATCH_NONE"
-116.351196,36.632485,"Astragalus acutirostris",3091294297,"Amargosa Valley, about 3 miles east of Lathrop Wells, on the north side of Hwy. 95","USA",NA,2010,"PRESERVED_SPECIMEN","GEODETIC_DATUM_ASSUMED_WGS84;CONTINENT_DERIVED_FROM_COORDINATES;INSTITUTION_MATCH_FUZZY;COLLECTION_MATCH_NONE"
-114.067733,35.673735,"Astragalus acutirostris",4052613320,"Red Lake Quad: Red Lake","USA",NA,2005,"PRESERVED_SPECIMEN","COORDINATE_ROUNDED;GEODETIC_DATUM_ASSUMED_WGS84;CONTINENT_DERIVED_FROM_COORDINATES;INSTITUTION_MATCH_FUZZY;COLLECTION_MATCH_NONE"
-114.779131,33.696886,"Astragalus acutirostris",3091291403,"Northwest of Blythe, east of the McCoy Mtns, vegetated pockets in desert pavement","USA",NA,2011,"PRESERVED_SPECIMEN","GEODETIC_DATUM_ASSUMED_WGS84;CONTINENT_DERIVED_FROM_COORDINATES;INSTITUTION_MATCH_FUZZY;COLLECTION_MATCH_NONE"
-116.4769956,34.7885694,"Astragalus acutirostris",2421731637,"San Bernardino County: Central Mojave Desert region: Pisgah lava beds just south of old Route 66 and I-40, west of Ludlow and 7.8 miles east of Fort Cady Road.","USA",NA,2004,"PRESERVED_SPECIMEN","COORDINATE_REPROJECTED;CONTINENT_DERIVED_FROM_COORDINATES;INSTITUTION_MATCH_FUZZY"
-118.077147,35.029519,"Astragalus acutirostris",2421731067,"Kern County: Mohave-Randsburg Region. Desert plain 6 miles east of Mojave. Shandon, CA.","USA",5000,1958,"PRESERVED_SPECIMEN","CONTINENT_DERIVED_FROM_COORDINATES;INSTITUTION_MATCH_FUZZY"
-117.537222,34.977222,"Astragalus acutirostris",2421695530,"California, San Bernardino County. Along Hwy 395, 1 road mile S of intersection with Hwy 58 (Kramer Junction).","USA",NA,2005,"PRESERVED_SPECIMEN","CONTINENT_DERIVED_FROM_COORDINATES;INSTITUTION_MATCH_FUZZY"
-116.821681,34.754165,"Astragalus acutirostris",2421682411,"San Bernardino County: 9.6 miles south of Daggett.","USA",900,1955,"PRESERVED_SPECIMEN","CONTINENT_DERIVED_FROM_COORDINATES;INSTITUTION_MATCH_FUZZY"
-116.803889,37.044722,"Astragalus acutirostris",415720180,"Bullfrog Hills, 2.2 road mi W of Hwy 95 on the main road to Grapevine Mountains","USA",NA,2005,"PRESERVED_SPECIMEN","COORDINATE_ROUNDED;AMBIGUOUS_COLLECTION"
-118.249209,37.253174,"Astragalus acutirostris",1929806782,"West face of Black Mountain, 1.9 milesS 67° W of its summit. Owens Valley drainage.","USA",969,1986,"PRESERVED_SPECIMEN","GEODETIC_DATUM_ASSUMED_WGS84;COLLECTION_MATCH_FUZZY"
-119.3128,39.29428,"Astragalus acutirostris",1930356463,"Churchill Butte, 3.5 road miles west of highway 95 on the road past Fort Churchill","USA",NA,1986,"PRESERVED_SPECIMEN","GEODETIC_DATUM_ASSUMED_WGS84;COLLECTION_MATCH_FUZZY"
-115.67,34.8,"Astragalus acutirostris",1928001508,"Mojave Desert, Granite Mts: Cottonwood Basin","USA",NA,1978,"PRESERVED_SPECIMEN","GEODETIC_DATUM_ASSUMED_WGS84;COLLECTION_MATCH_FUZZY"
-114.18895,34.30365,"Astragalus acutirostris",1426280835,"Whipple Mountains: Canyon of light colored granite just N of Gene Pumping Station along Black Meadow Landing/powerline road Elev. given as 881ft.","USA",NA,2003,"PRESERVED_SPECIMEN","GEODETIC_DATUM_ASSUMED_WGS84;COLLECTION_MATCH_FUZZY"
-117.97583,37.4175,"Astragalus acutirostris",2982073374,"White Mountains: Near mouth of dry drainage just E of Wyman Creek, 3.1 mi. N6º E of Deep Springs College, T6S R36E S24; elev. 5800 ft.","USA",NA,1986,"PRESERVED_SPECIMEN","GEODETIC_DATUM_ASSUMED_WGS84;CONTINENT_DERIVED_FROM_COORDINATES;INSTITUTION_MATCH_FUZZY"
-115.29444,30.04944,"Astragalus acutirostris",2629837606,"Near El Arenoso, 25.2 mi south of the hwy bridge over the Rio del Rosario near El Rosario","MEX",80,1985,"PRESERVED_SPECIMEN","TYPE_STATUS_INVALID;OCCURRENCE_STATUS_INFERRED_FROM_INDIVIDUAL_COUNT;GEODETIC_DATUM_ASSUMED_WGS84;CONTINENT_DERIVED_FROM_COORDINATES;ELEVATION_MIN_MAX_SWAPPED;DIFFERENT_OWNER_INSTITUTION"
-117.7258,37.7631,"Astragalus acutirostris",1929060884,"East side of Silver Peak Range, Coyote Spring","USA",NA,1995,"PRESERVED_SPECIMEN","GEODETIC_DATUM_ASSUMED_WGS84;COLLECTION_MATCH_FUZZY"
-117.0218,36.0914,"Astragalus acutirostris",2430393456,"Panamint Mountains; Johnson Canyon. Trail up the creek to Hungry Bill's.","USA",481,1979,"PRESERVED_SPECIMEN","CONTINENT_DERIVED_FROM_COORDINATES;INSTITUTION_MATCH_FUZZY"
-117.565278,35.391389,"Astragalus acutirostris",2418053278,"Mojave Desert; North Mojave Desert region: southwest end of the Lava Mountains, north of Red Mountains, east of Trona Road. Side road off Steam Well Road (RM1444) to Skilling Well. Road ends near mines. General collecting along the lower ridge that climbs toward Klinker Mtn. Than returned down a small draw to to the west of theis ridge. Gentle slopes at base, steeper the farther you climb, with some volanic outcrops. Near 35.39090N, 117.56767W to 35.39745N, 117.56570W. T29S R41E S22 SE1/4 USGS Quadrangle: Klinker Mtn. 1:24,000","USA",201,2005,"PRESERVED_SPECIMEN","CONTINENT_DERIVED_FROM_COORDINATES;AMBIGUOUS_INSTITUTION"
-115.332327,35.157109,"Astragalus acutirostris",2430313784,"11 air miles SE of Cima, 0.4 miles S from Cedar Canyon Road into Pinto Valley Road.","USA",625,1973,"PRESERVED_SPECIMEN","COORDINATE_ROUNDED;CONTINENT_DERIVED_FROM_COORDINATES;INSTITUTION_MATCH_FUZZY"
-109.916168,42.767929,"Astragalus acutirostris",2545465935,"","USA",NA,2013,"HUMAN_OBSERVATION","COORDINATE_ROUNDED;GEODETIC_DATUM_ASSUMED_WGS84"
-116.003669,32.444838,"Astragalus acutirostris",3090568522,"","MEX",5,2019,"HUMAN_OBSERVATION","COORDINATE_ROUNDED;CONTINENT_DERIVED_FROM_COORDINATES"
-117.688891,36.429309,"Astragalus acutirostris",3799676574,"Inyo Mountains, Malpais Mesa Wilderness, near route to Santa Rosa Mine, about 2.25 mi NW from jct with Saline Valley Rd.","USA",NA,2019,"PRESERVED_SPECIMEN","CONTINENT_DERIVED_FROM_COORDINATES;INSTITUTION_MATCH_FUZZY;COLLECTION_MATCH_FUZZY"
-117.939917,36.05,"Astragalus acutirostris",2430492929,"24 air miles SE of Olancha, ca 3-4 miles South of Coso Hot Springs area.","USA",NA,1979,"PRESERVED_SPECIMEN","COORDINATE_ROUNDED;GEODETIC_DATUM_ASSUMED_WGS84;CONTINENT_DERIVED_FROM_COORDINATES;INSTITUTION_MATCH_FUZZY"
-116.632778,36.231111,"Astragalus acutirostris",2430220213,"North end of Greenwater Valley, 3.2 miles S of Dante's View Road, just outside Death Valley National Monument area.","USA",NA,1987,"PRESERVED_SPECIMEN","COORDINATE_ROUNDED;GEODETIC_DATUM_ASSUMED_WGS84;CONTINENT_DERIVED_FROM_COORDINATES;INSTITUTION_MATCH_FUZZY"
-118.088416,34.517053,"Astragalus acutirostris",2430045959,"Foothills of San Gabriel Mountains: 2 miles northeast of Vincent.","USA",1200,1973,"PRESERVED_SPECIMEN","GEODETIC_DATUM_ASSUMED_WGS84;CONTINENT_DERIVED_FROM_COORDINATES;INSTITUTION_MATCH_FUZZY"
-118.4047,37.461354,"Astragalus acutirostris",2270250871,"Fish Slough; a desert wetland system 4.5 mi. north of Bishop at the northern end of Owens Valley; study site includes 14 sq. mi. along a 7 mi. drainage axis; just W of Fish Slough Rd., 2 miles N of Jean Blanc Rd.","USA",1000,1986,"PRESERVED_SPECIMEN","CONTINENT_DERIVED_FROM_COORDINATES;AMBIGUOUS_INSTITUTION"
-116.49715,34.24049,"Astragalus acutirostris",2430366088,"BLMSoutheast end of the Bighorn Mountains; northwest end of Black Lava Butte, near the head of Hondo Wash.; Yucca Valley North","USA",NA,2015,"PRESERVED_SPECIMEN","GEODETIC_DATUM_ASSUMED_WGS84;CONTINENT_DERIVED_FROM_COORDINATES;INSTITUTION_MATCH_FUZZY"
-117.583333,35.033333,"Astragalus acutirostris",2430308525,"NW of Kramer Junction, 1/4 mile W of LUZ project site.","USA",NA,1991,"PRESERVED_SPECIMEN","COORDINATE_ROUNDED;GEODETIC_DATUM_ASSUMED_WGS84;CONTINENT_DERIVED_FROM_COORDINATES;INSTITUTION_MATCH_FUZZY"
-117.88,37.105833,"Astragalus acutirostris",2430363549,"Inyo Mountains: Eureka Valley drainage. Marble Canyon.","USA",NA,1976,"PRESERVED_SPECIMEN","COORDINATE_ROUNDED;GEODETIC_DATUM_ASSUMED_WGS84;CONTINENT_DERIVED_FROM_COORDINATES;INSTITUTION_MATCH_FUZZY"
-117.901111,35.947778,"Astragalus acutirostris",2430096699,"Little Lake.","USA",NA,1958,"PRESERVED_SPECIMEN","COORDINATE_ROUNDED;GEODETIC_DATUM_ASSUMED_WGS84;CONTINENT_DERIVED_FROM_COORDINATES;INSTITUTION_MATCH_FUZZY"
-117.06247,34.50565,"Astragalus acutirostris",2430114040,"Granite Mountains; to the east of Apple Valley, approximately 3.5 air miles northwest of Rabbit Dry Lake, and about 1 air mile south of Amaral Spring.; Fairview Valley Quad.","USA",NA,2014,"PRESERVED_SPECIMEN","GEODETIC_DATUM_ASSUMED_WGS84;CONTINENT_DERIVED_FROM_COORDINATES;INSTITUTION_MATCH_FUZZY"
-116.51278,36.38764,"Astragalus acutirostris",2430211360,"BLMFuneral Mountains, north side of southeast tip; north of Bat Mountain, northwest of Death Valley Junction, west of Amargosa River and Highway 127.; East of Echo Canyon 7.5'","USA",NA,2016,"PRESERVED_SPECIMEN","CONTINENT_DERIVED_FROM_COORDINATES;INSTITUTION_MATCH_FUZZY"
-116.084497,34.021917,"Astragalus acutirostris",2251874751,"","USA",NA,2019,"HUMAN_OBSERVATION","COORDINATE_ROUNDED;CONTINENT_DERIVED_FROM_COORDINATES"
-116.98972,34.66833,"Astragalus acutirostris",2422315403,"Stoddard Ridge at pipeline crossing near Traer Agua Canyon, c. 18 miles SSE of Barstow","USA",NA,1995,"PRESERVED_SPECIMEN","GEODETIC_DATUM_ASSUMED_WGS84;CONTINENT_DERIVED_FROM_COORDINATES;AMBIGUOUS_INSTITUTION"
-114.52028,34.4725,"Astragalus acutirostris",2422403607,"pole line road near Havasu Junction","USA",NA,1979,"PRESERVED_SPECIMEN","GEODETIC_DATUM_ASSUMED_WGS84;CONTINENT_DERIVED_FROM_COORDINATES;AMBIGUOUS_INSTITUTION"
-117.14583,34.47528,"Astragalus acutirostris",2422442520,"SE Apple Valley","USA",NA,1995,"PRESERVED_SPECIMEN","GEODETIC_DATUM_ASSUMED_WGS84;CONTINENT_DERIVED_FROM_COORDINATES;AMBIGUOUS_INSTITUTION"
-116.93073,34.92395,"Astragalus acutirostris",2422468835,"c. 5 mi norhteast of Barstow, on north side of Lead Mountain, 0.4 mi south of Meadow Grove Road (dirt), 1.3 mi west of Ft Irwin Road, 1.5 mi north of Hwy I-15","USA",NA,2011,"PRESERVED_SPECIMEN","GEODETIC_DATUM_ASSUMED_WGS84;CONTINENT_DERIVED_FROM_COORDINATES;AMBIGUOUS_INSTITUTION"
-117.42917,34.77722,"Astragalus acutirostris",2422315606,"3 mi east of Hwy 395 at a point 14.8 mi north of Adelanto (Air Base Road), on a dirt road to scattered residences","USA",NA,1995,"PRESERVED_SPECIMEN","GEODETIC_DATUM_ASSUMED_WGS84;CONTINENT_DERIVED_FROM_COORDINATES;AMBIGUOUS_INSTITUTION"
-117.21667,34.58333,"Astragalus acutirostris",2422403222,"Apple Valley: bajada surface just west of Bell Mtn","USA",NA,2001,"PRESERVED_SPECIMEN","GEODETIC_DATUM_ASSUMED_WGS84;CONTINENT_DERIVED_FROM_COORDINATES;AMBIGUOUS_INSTITUTION"
-114.14725,29.01475,"Astragalus acutirostris",2422370269,"6 mi north of Punta Prieta","MEX",NA,1968,"PRESERVED_SPECIMEN","RECORDED_DATE_INVALID;GEODETIC_DATUM_ASSUMED_WGS84;CONTINENT_DERIVED_FROM_COORDINATES;AMBIGUOUS_INSTITUTION"
-117.32995,34.952167,"Astragalus acutirostris",2430253907,"Several miles S of Harper Lake, along Harper Lake Road, 2.9 mi S of Santa Fe Ave (dirt), approx 2 mi N of Hwy 58, just north of RR tracks.; Twelve Gauge Lake 7.5'","USA",NA,2011,"PRESERVED_SPECIMEN","COORDINATE_ROUNDED;GEODETIC_DATUM_ASSUMED_WGS84;CONTINENT_DERIVED_FROM_COORDINATES;INSTITUTION_MATCH_FUZZY"
-118.2086878,34.8844488,"Astragalus acutirostris",2430194553,"Rosamond Hills 1 mile north of Rosamond Airport on section line road","USA",3875,1991,"PRESERVED_SPECIMEN","COORDINATE_REPROJECTED;COORDINATE_ROUNDED;CONTINENT_DERIVED_FROM_COORDINATES;INSTITUTION_MATCH_FUZZY"
-116.43639,35.55917,"Astragalus acutirostris",2351009166,"60 air miles NE of Barstow, ca 4 miles NE of Avawatz Pass, between Arrastre Spring and crest of Avawatz Mts.; 5000-5500 ft. elev.","USA",NA,1978,"PRESERVED_SPECIMEN","GEODETIC_DATUM_ASSUMED_WGS84;CONTINENT_DERIVED_FROM_COORDINATES;INSTITUTION_MATCH_FUZZY"
-116.5656,36.157,"Astragalus acutirostris",2351009183,"9.5 miles south of Dantes View road, on road through Greenwater Valley, Death Valley National Monument.","USA",800,1978,"PRESERVED_SPECIMEN","GEODETIC_DATUM_ASSUMED_WGS84;CONTINENT_DERIVED_FROM_COORDINATES;INSTITUTION_MATCH_FUZZY"
-114.02,36.7097,"Astragalus acutirostris",2270703375,"1.4 mi southeast of Arizona State line along Rd. between Mesquite, Nev and line Kiln Canyon.","USA",NA,1978,"PRESERVED_SPECIMEN","GEODETIC_DATUM_ASSUMED_WGS84;CONTINENT_DERIVED_FROM_COORDINATES;INSTITUTION_MATCH_FUZZY;INSTITUTION_COLLECTION_MISMATCH"
-117.40002,34.944257,"Astragalus acutirostris",3070670378,"","USA",NA,2020,"HUMAN_OBSERVATION","COORDINATE_ROUNDED;CONTINENT_DERIVED_FROM_COORDINATES"
-115.639386,34.79958,"Astragalus acutirostris",2430063467,"Mojave Desert, Granite Mts: c. 1/2 mi. N of Cove Springs. Mojave Desert, Granite Mts: c. 1/2 mi. N of Cove Springs.","USA",700,1978,"PRESERVED_SPECIMEN","CONTINENT_DERIVED_FROM_COORDINATES;INSTITUTION_MATCH_FUZZY"
-114.23964,36.25603,"Astragalus acutirostris",2610093911,"Gold Butte Area of Critical Environmental Concern. Anderson Ridge. 5 km by air WSW of Gold Butte.","USA",NA,2016,"PRESERVED_SPECIMEN","CONTINENT_DERIVED_FROM_COORDINATES;INSTITUTION_MATCH_FUZZY"
-116.60862,35.07616,"Astragalus acutirostris",2430414717,"BLMMojave Desert; Alvord Mountains: Southeast side of mountains along a main canyon just west of Spanish Canyon.Collected around an elevated lake sediment (tufa) east side of canyon, as far as a saddle near 35.07403N, 116.60715W. And a little north along the main canyon, pass where the canyon opens up with a fault line that runs in a northwest angle, near 35.08417N, 116.60613. Main starting point was near end of old road-trail near 35.07616N, 116.60862W.","USA",NA,2008,"PRESERVED_SPECIMEN","GEODETIC_DATUM_ASSUMED_WGS84;CONTINENT_DERIVED_FROM_COORDINATES;INSTITUTION_MATCH_FUZZY"
-117.772577,36.049234,"Astragalus acutirostris",2430470153,"Vicinity of Coso Hot Springs.; Haiwee Reservoir","USA",1200,1978,"PRESERVED_SPECIMEN","GEODETIC_DATUM_ASSUMED_WGS84;CONTINENT_DERIVED_FROM_COORDINATES;INSTITUTION_MATCH_FUZZY"
-115.083333,35.1,"Astragalus acutirostris",2430086843,"E. Mojave Desert, Vontrigger Hills: N end of hills near mine shafts. 12.5 air mi. N of Goffs.","USA",NA,1978,"PRESERVED_SPECIMEN","COORDINATE_ROUNDED;GEODETIC_DATUM_ASSUMED_WGS84;CONTINENT_DERIVED_FROM_COORDINATES;INSTITUTION_MATCH_FUZZY"
-117.9221605,35.103927,"Astragalus acutirostris",2430148719,"Between Castle and Desert Buttes; 6.0 miles N on California City Road, 0.1 mile E on dirt road.","USA",1219,1988,"PRESERVED_SPECIMEN","COORDINATE_REPROJECTED;COORDINATE_ROUNDED;CONTINENT_DERIVED_FROM_COORDINATES;INSTITUTION_MATCH_FUZZY"
-115.5,31.308333,"Astragalus acutirostris",2430282063,"Head of San Matias Pass: On sandy roadside (Hwy 3), or in sandy wash, N of Hwy 3.","MEX",NA,1985,"PRESERVED_SPECIMEN","COORDINATE_ROUNDED;GEODETIC_DATUM_ASSUMED_WGS84;GEODETIC_DATUM_INVALID;CONTINENT_DERIVED_FROM_COORDINATES;INSTITUTION_MATCH_FUZZY"
-115.934708,32.02085,"Astragalus acutirostris",1897490719,"Base O del Cerro Piñón, 4.8 Km al N de El Álamo","MEX",NA,2013,"PRESERVED_SPECIMEN","TYPE_STATUS_INVALID;OCCURRENCE_STATUS_INFERRED_FROM_INDIVIDUAL_COUNT;COORDINATE_ROUNDED;CONTINENT_DERIVED_FROM_COORDINATES;ELEVATION_MIN_MAX_SWAPPED;INSTITUTION_MATCH_NONE"
-118.26363,36.84387,"Astragalus acutirostris",2422465250,"c. 5 miles north-northwest of town of Independence, just north of Oak Creek Campground","USA",NA,2008,"PRESERVED_SPECIMEN","GEODETIC_DATUM_ASSUMED_WGS84;CONTINENT_DERIVED_FROM_COORDINATES;AMBIGUOUS_INSTITUTION"
-117.92983,37.25372,"Astragalus acutirostris",2422505691,"eastern base of range along Death Valley Road, 27.3 mi east of Big Pine, c. 10 mi east of Little Cowhorn Valley","USA",NA,2014,"PRESERVED_SPECIMEN","GEODETIC_DATUM_ASSUMED_WGS84;CONTINENT_DERIVED_FROM_COORDINATES;AMBIGUOUS_INSTITUTION"
-116.91583,34.63278,"Astragalus acutirostris",2422285135,"West Ord Mountain, canyon c. 1 mile southwest of main peak. Site IIIF","USA",NA,1978,"PRESERVED_SPECIMEN","GEODETIC_DATUM_ASSUMED_WGS84;CONTINENT_DERIVED_FROM_COORDINATES;AMBIGUOUS_INSTITUTION"
-117.70167,34.66056,"Astragalus acutirostris",2422419424,"c. 18 air miles NW of Adelanto, 12.8 miles (air) west of the San Bernardino Co. line, 240th St. East, c. 3.6 miles north of junction with El Mirage Rd (Ave. P) & c. 2.9 miles south of Avenue J","USA",NA,1998,"PRESERVED_SPECIMEN","GEODETIC_DATUM_ASSUMED_WGS84;CONTINENT_DERIVED_FROM_COORDINATES;AMBIGUOUS_INSTITUTION"
-118.01,36.30403,"Astragalus acutirostris",2422503400,"Owens Valley, along transmission line, c. 0.5 mile southeast of Cartago","USA",NA,2003,"PRESERVED_SPECIMEN","GEODETIC_DATUM_ASSUMED_WGS84;CONTINENT_DERIVED_FROM_COORDINATES;AMBIGUOUS_INSTITUTION"
