"lon","lat","species","gbifID","locality","countryCode","coordinateUncertaintyInMeters","year","basisOfRecord","issue"
-84.11,10.16,"Aulonemia patriae",4061874657,"Summit ridge of Cerros Las Marías, NW slope of Volcán Barva.","CRI",NA,1986,"PRESERVED_SPECIMEN","OCCURRENCE_STATUS_INFERRED_FROM_INDIVIDUAL_COUNT;GEODETIC_DATUM_ASSUMED_WGS84;DIFFERENT_OWNER_INSTITUTION"
-82.841667,9.083333,"Aulonemia patriae",1259450573,"Cordillera de Talamanca, headwaters of the Río Culubre, 6 airline km NW of the peak of Cerro Echandi on the Costa Rican-Panamanian international border.","PAN",NA,1984,"PRESERVED_SPECIMEN","OCCURRENCE_STATUS_INFERRED_FROM_INDIVIDUAL_COUNT;COORDINATE_ROUNDED;GEODETIC_DATUM_ASSUMED_WGS84;INSTITUTION_MATCH_FUZZY;COLLECTION_MATCH_NONE"
-83.85778,9.6725,"Aulonemia patriae",2900318005,"","CRI",NA,2008,"PRESERVED_SPECIMEN","GEODETIC_DATUM_ASSUMED_WGS84;DIFFERENT_OWNER_INSTITUTION"
-83.23,9.34,"Aulonemia patriae",4031363486,"Along Quebrada Kuisa (tributary of Río Lori) near crossing of Ujarrás-San José Cabécar trail, Cordillera de Talamanca","CRI",NA,1993,"PRESERVED_SPECIMEN","OCCURRENCE_STATUS_INFERRED_FROM_INDIVIDUAL_COUNT;GEODETIC_DATUM_ASSUMED_WGS84;INSTITUTION_MATCH_FUZZY;COLLECTION_MATCH_NONE"
-84.3,10.2,"Aulonemia patriae",4061173848,"Aprox. 10 km NE de Zarcero, carretera de Pueblo Nuevo a las Minas de azufre","CRI",NA,1983,"PRESERVED_SPECIMEN","GEODETIC_DATUM_ASSUMED_WGS84;DIFFERENT_OWNER_INSTITUTION"
-84.1167,10.1667,"Aulonemia patriae",1318279938,"Summit ridge of cerros las marias, nw slope of volcan barva","CRI",NA,1986,"PRESERVED_SPECIMEN","GEODETIC_DATUM_ASSUMED_WGS84;CONTINENT_DERIVED_FROM_COORDINATES;CONTINENT_INVALID"
-82.63333,8.88333,"Aulonemia patriae",1258704390,"Parque Internacional La Amistad (PILA). Camino a Valle Libre","PAN",NA,1993,"PRESERVED_SPECIMEN","GEODETIC_DATUM_ASSUMED_WGS84;INSTITUTION_MATCH_FUZZY;COLLECTION_MATCH_NONE"
