"lon","lat","species","gbifID","locality","countryCode","coordinateUncertaintyInMeters","year","basisOfRecord","issue"
-67.616667,5.6,"Axonopus anceps",1259573848,"8 km S of Puerto Ayacucho, Estación de Piscicultura de Puerto Ayacucho.","VEN",NA,1978,"PRESERVED_SPECIMEN","OCCURRENCE_STATUS_INFERRED_FROM_INDIVIDUAL_COUNT;COORDINATE_ROUNDED;GEODETIC_DATUM_ASSUMED_WGS84;DIFFERENT_OWNER_INSTITUTION"
-72.387836,3.489019,"Axonopus anceps",3893499302,"Finca El Brasil, vereda Fundación, Serranía de Manacacías","COL",NA,2014,"HUMAN_OBSERVATION","COORDINATE_ROUNDED"
-70.916667,10.516667,"Axonopus anceps",2825646296,"Mauroa Municipality","VEN",NA,1995,"PRESERVED_SPECIMEN","COORDINATE_ROUNDED;COUNTRY_INVALID;GEODETIC_DATUM_ASSUMED_WGS84;GEODETIC_DATUM_INVALID;CONTINENT_DERIVED_FROM_COORDINATES;INSTITUTION_MATCH_FUZZY;COLLECTION_MATCH_NONE"
-61.083333,4.833333,"Axonopus anceps",2825623318,"Canaima National Park","VEN",NA,1995,"PRESERVED_SPECIMEN","COORDINATE_ROUNDED;COUNTRY_INVALID;GEODETIC_DATUM_ASSUMED_WGS84;GEODETIC_DATUM_INVALID;CONTINENT_DERIVED_FROM_COORDINATES;INSTITUTION_MATCH_FUZZY;COLLECTION_MATCH_NONE"
-61,5.03,"Axonopus anceps",1456483362,"San Ignacio de Yuruani, 10-15 km ENE, altiplanicie entre San Francisco de Yurani y Chirimata","VEN",NA,1984,"PRESERVED_SPECIMEN","GEODETIC_DATUM_ASSUMED_WGS84"
-59.4167,3.06667,"Axonopus anceps",1456098412,"Kanuku Mountains; ±12-14 mi. NE of Sand Creek","GUY",NA,1989,"PRESERVED_SPECIMEN","GEODETIC_DATUM_ASSUMED_WGS84"
-67.41666,6.41666,"Axonopus anceps",1259156812,"Dpto. Atures. Puerto Ayacucho. Bosque húmedo del Río Cataniapo. Sector Puente, margen Izquierdo","VEN",NA,1981,"PRESERVED_SPECIMEN","GEODETIC_DATUM_ASSUMED_WGS84;INSTITUTION_MATCH_FUZZY;COLLECTION_MATCH_NONE"
-62.5,5.7,"Axonopus anceps",1259806447,"Distrito Piar: Río Ocoine, Pie de la Roca, southeastern base of Auyan-tepui.","VEN",NA,1982,"PRESERVED_SPECIMEN","OCCURRENCE_STATUS_INFERRED_FROM_INDIVIDUAL_COUNT;GEODETIC_DATUM_ASSUMED_WGS84;INSTITUTION_MATCH_FUZZY;COLLECTION_MATCH_NONE"
-59.25,2.16666,"Axonopus anceps",1257968130,"Kuyuwini Landing, Kuyuwini River. Savanna.","GUY",NA,1991,"PRESERVED_SPECIMEN","GEODETIC_DATUM_ASSUMED_WGS84;INSTITUTION_MATCH_FUZZY;COLLECTION_MATCH_NONE"
-64.41666,10.25,"Axonopus anceps",1259135112,"Entre Barcelona y Cumana, carretera secundaria a 8 km al sur de Santa Fe. Sabanas de cerros con arboles achaparrados y manchas boscosas, en partes intervenidas","VEN",NA,1989,"PRESERVED_SPECIMEN","GEODETIC_DATUM_ASSUMED_WGS84;INSTITUTION_MATCH_FUZZY;COLLECTION_MATCH_NONE"
-61.53333,4.41666,"Axonopus anceps",1258814035,"Selva de galería a lo largo de la quebrada El Cajón, Puente Luis Raúl Vásquez Z., 26.5 Kms al este de Icabarú. Sandy rocky savanna-chaparral bordering gallery forest downstream from bridge","VEN",NA,1978,"PRESERVED_SPECIMEN","GEODETIC_DATUM_ASSUMED_WGS84;INSTITUTION_MATCH_FUZZY;COLLECTION_MATCH_NONE"
-62.533333,5.733333,"Axonopus anceps",1259807024,"Guayaraca, between escarpment and Río Guayaraca, southern base of Auyan-tepui.","VEN",NA,1982,"PRESERVED_SPECIMEN","OCCURRENCE_STATUS_INFERRED_FROM_INDIVIDUAL_COUNT;COORDINATE_ROUNDED;GEODETIC_DATUM_ASSUMED_WGS84;INSTITUTION_MATCH_FUZZY;COLLECTION_MATCH_NONE"
-61.2,2.366667,"Axonopus anceps",1042590425,"Caracaraí, campo.","BRA",NA,1974,"PRESERVED_SPECIMEN","GEODETIC_DATUM_ASSUMED_WGS84;GEODETIC_DATUM_INVALID;INSTITUTION_MATCH_NONE"
-63.13,-0.216667,"Axonopus anceps",1042538309,"Bajo Rio Aracá, Sabana y campina parcialmente inundada sobre arena blanca, ne la ribera izquierda del Río Aracá bajo, cerca del sitio Sauadáua.","BRA",NA,1985,"PRESERVED_SPECIMEN","GEODETIC_DATUM_ASSUMED_WGS84;GEODETIC_DATUM_INVALID;ELEVATION_MIN_MAX_SWAPPED;INSTITUTION_MATCH_NONE"
-61.16,5,"Axonopus anceps",1456262089,"Gran Sabana, San Ignacio de Yuruani","VEN",NA,1988,"PRESERVED_SPECIMEN","GEODETIC_DATUM_ASSUMED_WGS84"
-61.13,5.01,"Axonopus anceps",1456052396,"San Ignacio de Yuruani, 3 km NW, Gran Sabana","VEN",NA,1983,"PRESERVED_SPECIMEN","GEODETIC_DATUM_ASSUMED_WGS84"
-59.58,3.86,"Axonopus anceps",1456029496,"Rupununi, Route de Good Hope","GUY",NA,1956,"PRESERVED_SPECIMEN","GEODETIC_DATUM_ASSUMED_WGS84"
-64.16666,9.66666,"Axonopus anceps",1257967923,"Carretera El Tejero - La Ceiba. Sabannas con chaparros (Bosque muy seco tropical).","VEN",NA,1982,"PRESERVED_SPECIMEN","GEODETIC_DATUM_ASSUMED_WGS84;INSTITUTION_MATCH_FUZZY;COLLECTION_MATCH_NONE"
-59.9167,5,"Axonopus anceps",1455987709,"Southern base of Mt. Kopinang along trail from Kopinang to Orinduik","GUY",NA,1988,"PRESERVED_SPECIMEN","GEODETIC_DATUM_ASSUMED_WGS84"
-61.53333,5.71666,"Axonopus anceps",1259135107,"Distr. Roscio. Sabanas ubicadas entre 1-5 km al NE del Campamento de la C.V.G. en Parupa (Sector norte de la Gran Sabana). Muy frecuente en sabanas algo más húmedas","VEN",NA,1983,"PRESERVED_SPECIMEN","GEODETIC_DATUM_ASSUMED_WGS84;INSTITUTION_MATCH_FUZZY;COLLECTION_MATCH_NONE"
-67.816667,6.966667,"Axonopus anceps",1257967477,"4 km directly (in a straight line) NE of El Betun along the banks of the Río Capanaparo.","VEN",NA,1977,"PRESERVED_SPECIMEN","OCCURRENCE_STATUS_INFERRED_FROM_INDIVIDUAL_COUNT;COORDINATE_ROUNDED;GEODETIC_DATUM_ASSUMED_WGS84;INSTITUTION_MATCH_FUZZY;COLLECTION_MATCH_NONE"
-66.26666,7.83333,"Axonopus anceps",1259135087,"A 37 km al sur de Santa Rita, carretera Las Mercedes-Cabruta. En sabana humeda con Sorghastrum setosum, inundable 50 cm temporalmente","VEN",NA,1995,"PRESERVED_SPECIMEN","GEODETIC_DATUM_ASSUMED_WGS84;INSTITUTION_MATCH_FUZZY;COLLECTION_MATCH_NONE"
-67.283333,6.65,"Axonopus anceps",1257845197,"E side of the Galeras de Cinaruco, 6 km N of the southern-most tip, along Quebrada El Porvenir; ca. 53 airline km NE of Puerto Páez.","VEN",NA,1979,"PRESERVED_SPECIMEN","OCCURRENCE_STATUS_INFERRED_FROM_INDIVIDUAL_COUNT;COORDINATE_ROUNDED;GEODETIC_DATUM_ASSUMED_WGS84;INSTITUTION_MATCH_FUZZY;COLLECTION_MATCH_NONE"
-63.1,8.03333,"Axonopus anceps",1258392974,"Mun. Raul Leoni. Bosque seco tropical Bajo Caroni Pica 31 (Sector III).","VEN",NA,1994,"PRESERVED_SPECIMEN","OCCURRENCE_STATUS_INFERRED_FROM_INDIVIDUAL_COUNT;GEODETIC_DATUM_ASSUMED_WGS84;INSTITUTION_MATCH_FUZZY;COLLECTION_MATCH_NONE"
-64.25,2.7,"Axonopus anceps",4031864577,"Codominante con Bulbostylis paradoxa. Depto. Atabapo, sabanas abiertas sobre colinas en la Sierra Parima, al E de la pista de aterrizaje Parima B (cabeceras del río Putaco, afluente izquierdo del río Ocamo)","VEN",NA,1981,"PRESERVED_SPECIMEN","GEODETIC_DATUM_ASSUMED_WGS84;INSTITUTION_MATCH_FUZZY;COLLECTION_MATCH_NONE"
-60.033333,4.8,"Axonopus anceps",2515465605,"Potaro-Siparuni. Pakaraima Mts, Upper Ireng River, 1.2km E of Cipo Settlement on N end of adjacent ridge.","GUY",NA,1993,"PRESERVED_SPECIMEN","INSTITUTION_MATCH_FUZZY;INSTITUTION_COLLECTION_MISMATCH"
-67.45,4.866667,"Axonopus anceps",2517449568,"Ezpedicion Brewer-Codesur al Cerro Autana, on promontory slopes, Territorio Federal Amazonas, Cumbre del cerro Autana: sabana y afloramientos expuestos.","VEN",NA,1971,"PRESERVED_SPECIMEN","INSTITUTION_MATCH_FUZZY;INSTITUTION_COLLECTION_MISMATCH"
-61.156082,1.780657,"Axonopus anceps",1928668906,"Along BR 174 road. Between Caracaraí and Rio Branco (Raft). Locally frequent. &nf;Savannas (campo). Moist, sandy soil.","BRA",NA,1977,"PRESERVED_SPECIMEN","COORDINATE_ROUNDED;COLLECTION_MATCH_FUZZY"
-62.66666,7.25,"Axonopus anceps",1258817675,"Mpio. Autónomo Piar. El Frio, final vía principal de explotación","VEN",NA,1989,"PRESERVED_SPECIMEN","GEODETIC_DATUM_ASSUMED_WGS84;INSTITUTION_MATCH_FUZZY;COLLECTION_MATCH_NONE"
-68.75,6.166667,"Axonopus anceps",1257967690,"Distrito Pedro Camejo; along the Río Meta at the junction of the Caño Siriaco, 15.4 airline km W of Buena Vista.","VEN",NA,1978,"PRESERVED_SPECIMEN","OCCURRENCE_STATUS_INFERRED_FROM_INDIVIDUAL_COUNT;COORDINATE_ROUNDED;GEODETIC_DATUM_ASSUMED_WGS84;INSTITUTION_MATCH_FUZZY;COLLECTION_MATCH_NONE"
-62.983333,6.983333,"Axonopus anceps",4031367592,"Junction of Río Paragua and Caroni. San Pedro de las Dos Bocas, W bank of river.","VEN",NA,1978,"PRESERVED_SPECIMEN","OCCURRENCE_STATUS_INFERRED_FROM_INDIVIDUAL_COUNT;COORDINATE_ROUNDED;GEODETIC_DATUM_ASSUMED_WGS84;INSTITUTION_MATCH_FUZZY;COLLECTION_MATCH_NONE"
-65.33333,7.48333,"Axonopus anceps",1259135124,"Mpio. Asc. Farreras. Maripa-Aripao. Frecuente en ecotono de sabana graminosa aarbustiva con morichal, espigas de color verde","VEN",NA,1990,"PRESERVED_SPECIMEN","GEODETIC_DATUM_ASSUMED_WGS84;INSTITUTION_MATCH_FUZZY;COLLECTION_MATCH_NONE"
-61.05,5.31666,"Axonopus anceps",1259663058,"Gran Sabana; ca 10 km SW of Karaurin Tepui at junction of Río karaurin and Río Asadon (Río Sanpa). Gallery forest.","VEN",NA,1988,"PRESERVED_SPECIMEN","OCCURRENCE_STATUS_INFERRED_FROM_INDIVIDUAL_COUNT;GEODETIC_DATUM_ASSUMED_WGS84;INSTITUTION_MATCH_FUZZY;COLLECTION_MATCH_NONE"
-66.38333,6.56666,"Axonopus anceps",1258817655,"Mpio. Raul Leoni. Bosque y arbustales sobre lateritas bauxiticas. Cabeceras río Túriba y Caño La Miel, 45 km al Este de Pijiguaos","VEN",NA,1989,"PRESERVED_SPECIMEN","GEODETIC_DATUM_ASSUMED_WGS84;INSTITUTION_MATCH_FUZZY;COLLECTION_MATCH_NONE"
-67.783333,5.25,"Axonopus anceps",4031358577,"Departamento Atures: 3-6 km N of Samariapo.","VEN",NA,1979,"PRESERVED_SPECIMEN","OCCURRENCE_STATUS_INFERRED_FROM_INDIVIDUAL_COUNT;COORDINATE_ROUNDED;GEODETIC_DATUM_ASSUMED_WGS84;INSTITUTION_MATCH_FUZZY;COLLECTION_MATCH_NONE"
-65.61666,3.18333,"Axonopus anceps",4031368603,"Dominante en canal de drenaje en la sabana de vega. Con pelos urticantes sobre las vainas foliares. Depto. Atabapo, sabana de arena blanca a unos 10-12 km al W de Esmeralda, en la ribera derecha (N) del Río Orinoco","VEN",NA,1980,"PRESERVED_SPECIMEN","GEODETIC_DATUM_ASSUMED_WGS84;INSTITUTION_MATCH_FUZZY;COLLECTION_MATCH_NONE"
-64.15,8.833333,"Axonopus anceps",2825611273,"Anzoátegui","VEN",NA,1995,"PRESERVED_SPECIMEN","COORDINATE_ROUNDED;COUNTRY_INVALID;GEODETIC_DATUM_ASSUMED_WGS84;GEODETIC_DATUM_INVALID;CONTINENT_DERIVED_FROM_COORDINATES;INSTITUTION_MATCH_FUZZY;COLLECTION_MATCH_NONE"
-59.5167,3,"Axonopus anceps",1456028121,"Baboon Mountain, ±1 mi. S of Sand Creek","GUY",NA,1989,"PRESERVED_SPECIMEN","GEODETIC_DATUM_ASSUMED_WGS84"
-66.81666,4.05,"Axonopus anceps",1259573187,"En sabana abierta. En sabana inundada con Caraipa y con monticulos con termiteros hasta 2 m. de alto. Depto. Atabapo, sabanas y bosques ribereño en los alrededores de Canaripó, en la margen izquierda (Sur) del bajo Río Ventuari, a unos 20 km al E de la confluencia con el río Orinoco","VEN",NA,1978,"PRESERVED_SPECIMEN","GEODETIC_DATUM_ASSUMED_WGS84;DIFFERENT_OWNER_INSTITUTION"
-67.133333,3.933333,"Axonopus anceps",1259574071,"Santa Bárbara de Orinoco; 3 km W of the junction of the Río Orinoco and Río Ventuari,","VEN",NA,1979,"PRESERVED_SPECIMEN","OCCURRENCE_STATUS_INFERRED_FROM_INDIVIDUAL_COUNT;COORDINATE_ROUNDED;GEODETIC_DATUM_ASSUMED_WGS84;DIFFERENT_OWNER_INSTITUTION"
-59.78333,4.9,"Axonopus anceps",4060973934,"Potaro-Siparuni Region: scrub at the top of Mt. Anandu-baru","GUY",NA,1988,"PRESERVED_SPECIMEN","GEODETIC_DATUM_ASSUMED_WGS84;INSTITUTION_MATCH_NONE"
-67.38333,6.15,"Axonopus anceps",1259573752,"ATURES: 72 km N of Puerto Ayacucho along the road to El Burro; wet, white sand, marshy grassland leading to gallery forest; hummocky.","VEN",NA,1978,"PRESERVED_SPECIMEN","GEODETIC_DATUM_ASSUMED_WGS84;DIFFERENT_OWNER_INSTITUTION"
-59.9167,4.66667,"Axonopus anceps",1456235073,"Kato","GUY",NA,1989,"PRESERVED_SPECIMEN","GEODETIC_DATUM_ASSUMED_WGS84"
-59.85,3.28,"Axonopus anceps",1456327427,"Rupununi Northern Savanna, S bank of Ikuwali R.","GUY",NA,1963,"PRESERVED_SPECIMEN","GEODETIC_DATUM_ASSUMED_WGS84"
-62.28,5.93,"Axonopus anceps",1456073834,"Amaruaytepuí, betw. tepuí and Río Acanan","VEN",NA,1986,"PRESERVED_SPECIMEN","GEODETIC_DATUM_ASSUMED_WGS84"
-62.55,5.533333,"Axonopus anceps",4061143932,"Middle part of Río Purpur, affluent of Río Ambutuir, along trail to Urimán. At base of escarpment.","VEN",NA,1982,"PRESERVED_SPECIMEN","OCCURRENCE_STATUS_INFERRED_FROM_INDIVIDUAL_COUNT;COORDINATE_ROUNDED;GEODETIC_DATUM_ASSUMED_WGS84;DIFFERENT_OWNER_INSTITUTION"
-67.75,6.516667,"Axonopus anceps",4061011938,"27 km directly (in a straight line) WSW of Paso de Cinaruco along the banks of the Río Cinaruco.","VEN",NA,1977,"PRESERVED_SPECIMEN","OCCURRENCE_STATUS_INFERRED_FROM_INDIVIDUAL_COUNT;COORDINATE_ROUNDED;GEODETIC_DATUM_ASSUMED_WGS84;INSTITUTION_MATCH_NONE"
-66.06,7.57,"Axonopus anceps",1456330213,"Caicara, 14 km SW of along Hwy 19 to Ciudad Bolívar","VEN",NA,1973,"PRESERVED_SPECIMEN","GEODETIC_DATUM_ASSUMED_WGS84"
-60.066667,5.466667,"Axonopus anceps",2517478500,"Guyana. Cuyuni-Mazaruni Region: Ayanganna Plateau.","GUY",NA,1987,"PRESERVED_SPECIMEN","INSTITUTION_MATCH_FUZZY;INSTITUTION_COLLECTION_MISMATCH"
-67.710611,6.088333,"Axonopus anceps",1707495941,"Vereda Caño Negro, finca La Pedregoza","COL",NA,2012,"PRESERVED_SPECIMEN","COORDINATE_ROUNDED;GEODETIC_DATUM_ASSUMED_WGS84;INSTITUTION_MATCH_NONE"
-68.860389,5.789806,"Axonopus anceps",1803913626,"Ventana La Florida. Sabana a orilla izquierda subiendo por el río Bita","COL",NA,2016,"PRESERVED_SPECIMEN","COORDINATE_ROUNDED;INSTITUTION_MATCH_FUZZY;COLLECTION_MATCH_FUZZY"
-68.181,5.852056,"Axonopus anceps",1803913238,"Vereda La Libertad, finca Mi Familia, caño Cabezón. Vegetación creciendo en sabaneta rodeada de bosque, arbolada, con abundancia de Poaceae y Tibouchina.","COL",NA,2016,"PRESERVED_SPECIMEN","COORDINATE_ROUNDED;INSTITUTION_MATCH_NONE"
-68.473417,5.74425,"Axonopus anceps",1803913883,"Ventana Rampa vieja. Borde de bosque inundable, aledaño al campamento","COL",NA,2016,"PRESERVED_SPECIMEN","COORDINATE_ROUNDED;INSTITUTION_MATCH_FUZZY;COLLECTION_MATCH_FUZZY"
-60.3021,5.70933,"Axonopus anceps",1455971143,"Imbaimadai, savanna near airstrip","GUY",NA,2009,"PRESERVED_SPECIMEN","GEODETIC_DATUM_ASSUMED_WGS84"
-59.78,3.38,"Axonopus anceps",1455936739,"Rupununi Dist., Lethem","GUY",NA,1956,"PRESERVED_SPECIMEN","GEODETIC_DATUM_ASSUMED_WGS84"
-59.25,2.166667,"Axonopus anceps",2517194565,"Rupununi District. Kuyuwini Landing, Kuyuwini River. Savanna.","GUY",NA,1991,"PRESERVED_SPECIMEN","INSTITUTION_MATCH_FUZZY;INSTITUTION_COLLECTION_MISMATCH"
-65.53,3.16,"Axonopus anceps",1456428192,"Alto Río Orinoco, Esmeralda Savanna","VEN",NA,1953,"PRESERVED_SPECIMEN","GEODETIC_DATUM_ASSUMED_WGS84"
-59.8092,4.66333,"Axonopus anceps",1456322766,"Northern Pakaraimas; Kato Village","GUY",NA,1995,"PRESERVED_SPECIMEN","GEODETIC_DATUM_ASSUMED_WGS84"
-55.759129,-1.164599,"Axonopus anceps",1930606912,"Igarapé Jaramacarú. Campos de Ariramba, campina com afloramento de rochas.","BRA",NA,1987,"PRESERVED_SPECIMEN","COORDINATE_ROUNDED;COLLECTION_MATCH_FUZZY"
-67.616667,5.666667,"Axonopus anceps",1259812096,"Puerto Ayacucho, between the electric power plant and the Río Orinoco.","VEN",NA,1984,"PRESERVED_SPECIMEN","OCCURRENCE_STATUS_INFERRED_FROM_INDIVIDUAL_COUNT;COORDINATE_ROUNDED;GEODETIC_DATUM_ASSUMED_WGS84;INSTITUTION_MATCH_FUZZY;COLLECTION_MATCH_NONE"
-67.48333,3.75,"Axonopus anceps",4031463541,"Departamento Atabapo: Ca. 5 km N of the mouth of Caño Caname along the east bank of the Río Atabapo. Laja, granite outcrop.","VEN",NA,1979,"PRESERVED_SPECIMEN","GEODETIC_DATUM_ASSUMED_WGS84;INSTITUTION_MATCH_FUZZY;COLLECTION_MATCH_NONE"
-59.151389,-0.441389,"Axonopus anceps",2302445992,"Along BR 174 road. Between Caracarai and Rio Branco (raft). Locally frequnt. Savannas (campo), moist, sandy soil.","BRA",NA,1977,"PRESERVED_SPECIMEN","RECORDED_DATE_INVALID;COORDINATE_ROUNDED;GEODETIC_DATUM_ASSUMED_WGS84;CONTINENT_DERIVED_FROM_COORDINATES;INSTITUTION_MATCH_FUZZY;COLLECTION_MATCH_FUZZY"
-68.449778,5.561389,"Axonopus anceps",4026683686,"Vereda La Esmeralda, finca El Tomo, confluencia del Caño Terecay con el río Tomo, flanco norte","COL",NA,2017,"PRESERVED_SPECIMEN","COORDINATE_ROUNDED;INSTITUTION_MATCH_NONE"
-72.01,4.28,"Axonopus anceps",768741172,"carretera hacienda Rubiales, sabanas","COL",NA,1995,"PRESERVED_SPECIMEN","INSTITUTION_MATCH_NONE"
-71.35,4.57,"Axonopus anceps",768743132,"centro de investigación Carimagua","COL",NA,1989,"PRESERVED_SPECIMEN","INSTITUTION_MATCH_NONE"
-67.6295,6.1783,"Axonopus anceps",3068342322,"cerro El Bita, jardín botánico, sabana de ladera","COL",NA,1997,"PRESERVED_SPECIMEN","INSTITUTION_MATCH_NONE"
-61.1,5.95,"Axonopus anceps",1456156953,"Samwarakna-tipu (Holi-tipu), Kamarang River - Wenamu Trail, Pakaraima Mts.","GUY",NA,1951,"PRESERVED_SPECIMEN","GEODETIC_DATUM_ASSUMED_WGS84"
-59.8,3.16,"Axonopus anceps",1456233449,"Rupununi Dist., 12 mi. S of Lethem","GUY",NA,1956,"PRESERVED_SPECIMEN","GEODETIC_DATUM_ASSUMED_WGS84"
-70.725667,5.614361,"Axonopus anceps",2859667815,"San Esteban, Sabana 2 - Borde de Camino","COL",NA,2015,"HUMAN_OBSERVATION","COORDINATE_ROUNDED"
-64.63333,3.08333,"Axonopus anceps",1259156805,"Dpto. Atabapo: Sabana, margen izquierdo. Caño Jayuwapuey, 3 km antes de su desembocadura en río Ocamo","VEN",NA,1990,"PRESERVED_SPECIMEN","GEODETIC_DATUM_ASSUMED_WGS84;INSTITUTION_MATCH_FUZZY;COLLECTION_MATCH_NONE"
-61.06666,4.66666,"Axonopus anceps",1258814026,"Distrito Roscio: laderas pedregosas expuestas en el cerro al lado izquierdo de la carretera principal saliendo al Norte de Santa Elena de Uairén, 7.5 kms al Norested de Santa Elena de Uairén","VEN",NA,1982,"PRESERVED_SPECIMEN","GEODETIC_DATUM_ASSUMED_WGS84;INSTITUTION_MATCH_FUZZY;COLLECTION_MATCH_NONE"
-60.58333,-3.03333,"Axonopus anceps",1258817647,"Campo Amélia (Faz. Belo Horizonte), entre ig. Acajatuba e margem direita do rio Negro. Extenso campo graminoso na terra firme; solo argiloso, impermeável","BRA",NA,1986,"PRESERVED_SPECIMEN","GEODETIC_DATUM_ASSUMED_WGS84;INSTITUTION_MATCH_FUZZY;COLLECTION_MATCH_NONE"
-69.680475,6.269769,"Axonopus anceps",2283948586,"","COL",NA,2015,"HUMAN_OBSERVATION","COORDINATE_ROUNDED;CONTINENT_DERIVED_FROM_COORDINATES"
-67.85101,5.34501,"Axonopus anceps",1055065224,"PNN El Tuparro, centro administrativo, Pozo azul","COL",NA,2012,"HUMAN_OBSERVATION",""
-59.52,2.83,"Axonopus anceps",1322658971,"U. Takutu-U. Esseguibo District, Dadanawa Ranch on the Rupununi River. 312,000 mN 220,000 mE.","GUY",NA,1989,"PRESERVED_SPECIMEN","GEODETIC_DATUM_ASSUMED_WGS84"
-68.777222,2.951667,"Axonopus anceps",1259810567,"Immediately S of Casuarito, lajas along the Río Orinoco.","COL",NA,1984,"PRESERVED_SPECIMEN","OCCURRENCE_STATUS_INFERRED_FROM_INDIVIDUAL_COUNT;COORDINATE_ROUNDED;GEODETIC_DATUM_ASSUMED_WGS84;INSTITUTION_MATCH_FUZZY;COLLECTION_MATCH_NONE"
-64.17,9.67,"Axonopus anceps",3005667325,"Carretera El Tejero - La Ceiba.","VEN",NA,1982,"PRESERVED_SPECIMEN","GEODETIC_DATUM_ASSUMED_WGS84"
-61.46666,5.53333,"Axonopus anceps",1258817659,"Dist. Roscio: sabanas y arbustales sobre cuesta ubicada aprox. 7 km al SSE del Salto aponguao, en la cuenca alta del río Aponguao","VEN",NA,1985,"PRESERVED_SPECIMEN","GEODETIC_DATUM_ASSUMED_WGS84;INSTITUTION_MATCH_FUZZY;COLLECTION_MATCH_NONE"
-69.58,4.517778,"Axonopus anceps",1259131620,"Ca. 25 km E of Cumaribo along the unimproved dirt road between Las Gaviotas and Santa Rita.","COL",NA,1973,"PRESERVED_SPECIMEN","OCCURRENCE_STATUS_INFERRED_FROM_INDIVIDUAL_COUNT;COORDINATE_ROUNDED;GEODETIC_DATUM_ASSUMED_WGS84;INSTITUTION_MATCH_FUZZY;COLLECTION_MATCH_NONE"
-68.31666,6.31666,"Axonopus anceps",1257967584,"Distrito Pedro Camejo; Cano (or Morichal) El Caballo, 16 airline km NW of Mata de Guanábana between the Río Meta and the Río Cinaruco.","VEN",NA,1979,"PRESERVED_SPECIMEN","GEODETIC_DATUM_ASSUMED_WGS84;INSTITUTION_MATCH_FUZZY;COLLECTION_MATCH_NONE"
-62.666667,5.433333,"Axonopus anceps",1259427841,"Lower section of Río Ambutuir, along trail to Uriman.","VEN",NA,1982,"PRESERVED_SPECIMEN","OCCURRENCE_STATUS_INFERRED_FROM_INDIVIDUAL_COUNT;COORDINATE_ROUNDED;GEODETIC_DATUM_ASSUMED_WGS84;INSTITUTION_MATCH_FUZZY;COLLECTION_MATCH_NONE"
