"lon","lat","species","gbifID","locality","countryCode","coordinateUncertaintyInMeters","year","basisOfRecord","issue"
-67.2333,-16.7167,"Begonia juntasensis",1322267979,"Inquisivi","BOL",NA,1988,"PRESERVED_SPECIMEN","GEODETIC_DATUM_ASSUMED_WGS84"
-65.78,-17.17,"Begonia juntasensis",1928301429,"Along highway from Cochabamba to Villa Tunari.","BOL",NA,1998,"PRESERVED_SPECIMEN","GEODETIC_DATUM_ASSUMED_WGS84;COLLECTION_MATCH_FUZZY"
-67.81666,-16.3,"Begonia juntasensis",4061189488,"1.4 km SE of Chuspipata on road to Chulumani. Cloud forest with abundant epiphytes, especially mosses, filmy ferns","BOL",NA,1983,"PRESERVED_SPECIMEN","OCCURRENCE_STATUS_INFERRED_FROM_INDIVIDUAL_COUNT;GEODETIC_DATUM_ASSUMED_WGS84;DIFFERENT_OWNER_INSTITUTION"
-70.99444,-13.71277,"Begonia juntasensis",1260081697,"Dist. Marcapata, Quincemil, Bosque Secundario.","PER",NA,2004,"PRESERVED_SPECIMEN","OCCURRENCE_STATUS_INFERRED_FROM_INDIVIDUAL_COUNT;GEODETIC_DATUM_ASSUMED_WGS84;DIFFERENT_OWNER_INSTITUTION"
-64.692778,-17.843889,"Begonia juntasensis",1259240922,"Entre el Empalme y Locotal.","BOL",NA,2004,"PRESERVED_SPECIMEN","OCCURRENCE_STATUS_INFERRED_FROM_INDIVIDUAL_COUNT;COORDINATE_ROUNDED;GEODETIC_DATUM_ASSUMED_WGS84;DIFFERENT_OWNER_INSTITUTION"
-63.651389,-18.293055,"Begonia juntasensis",1257528253,"Comunidad Bella Vista, quebrada que esta presente en el cerro la piedra bordada, con especies de Cecropia elongata, Myriocarpa stipitata, Senna espectabilis, Piper spp y Urera caracasana.","BOL",NA,2006,"PRESERVED_SPECIMEN","OCCURRENCE_STATUS_INFERRED_FROM_INDIVIDUAL_COUNT;COORDINATE_ROUNDED;GEODETIC_DATUM_ASSUMED_WGS84;DIFFERENT_OWNER_INSTITUTION"
-68.1,-16.133333,"Begonia juntasensis",4061193014,"Río Zongo Valley. 27 km below dam at Lago Zongo. Moist forest with extensive disturbed and burned places.","BOL",NA,1982,"PRESERVED_SPECIMEN","OCCURRENCE_STATUS_INFERRED_FROM_INDIVIDUAL_COUNT;COORDINATE_ROUNDED;GEODETIC_DATUM_ASSUMED_WGS84;DIFFERENT_OWNER_INSTITUTION"
-63.701389,-18.240833,"Begonia juntasensis",4031662811,"Bella Vista, Sedero Ecológico el Cañadon, a orillas de la quebrada el Limon.","BOL",NA,2006,"PRESERVED_SPECIMEN","OCCURRENCE_STATUS_INFERRED_FROM_INDIVIDUAL_COUNT;COORDINATE_ROUNDED;GEODETIC_DATUM_ASSUMED_WGS84;INSTITUTION_MATCH_FUZZY;COLLECTION_MATCH_NONE"
-67.05,-15.316667,"Begonia juntasensis",4031555939,"lower slopes of Serrania Pilón Lajas, 14.3 km N of the bridge over the Río Quiquibey. Moist montane forest with little disturbance on sandstone.","BOL",NA,1985,"PRESERVED_SPECIMEN","OCCURRENCE_STATUS_INFERRED_FROM_INDIVIDUAL_COUNT;COORDINATE_ROUNDED;GEODETIC_DATUM_ASSUMED_WGS84;INSTITUTION_MATCH_FUZZY;COLLECTION_MATCH_NONE"
-65.58861,-17.02722,"Begonia juntasensis",4032063175,"Localidad El Limbo. Ladera con exposición sud de hasta 35º de pendiente. Mesobosque montano humedo, dominado por Weinmannia bangii, W. microphylla, Hedyosmun angustifolium, H. racemosum, Alchornea pearcei, A. cf. latifolia, Didymopanax morototoni, Oreopanax cf trolli y Clethra scabra. El sotobosque dominado por Pteridophytos y Melastomataceas presencia de muchas epifitas.","BOL",NA,2003,"PRESERVED_SPECIMEN","GEODETIC_DATUM_ASSUMED_WGS84;INSTITUTION_MATCH_FUZZY;COLLECTION_MATCH_NONE"
-65.493055,-17.093055,"Begonia juntasensis",4032120147,"Localidad Palmar km 18. Serrania con exposición sud este con pendientes de hasta 35º de inclinación. Bosque alto montano húmedo, dominado por Eschweilera coriaceae, Iriartea deltoidea y Socratea exorrhiza. El sotobosque caracterizdo por rubiaceas y piperaceas.","BOL",NA,2003,"PRESERVED_SPECIMEN","OCCURRENCE_STATUS_INFERRED_FROM_INDIVIDUAL_COUNT;COORDINATE_ROUNDED;GEODETIC_DATUM_ASSUMED_WGS84;INSTITUTION_MATCH_FUZZY;COLLECTION_MATCH_NONE"
-68.9453,-14.7456,"Begonia juntasensis",1318382149,"Pelechuco, Tanhuara Area Natural de Manejo Integrado Apolobamba, Rio Abajo, Apolobamba, Madidi.","BOL",NA,2009,"PRESERVED_SPECIMEN","GEODETIC_DATUM_ASSUMED_WGS84"
-63.9,-18.76,"Begonia juntasensis",1257554044,"Camino de Vallegrande a Masicurí, 3 km antes de la comunidad de Loma Larga, con una vegetación de bosque montano húmedo pluviestacional Tucumano-Boliviano.","BOL",NA,2008,"PRESERVED_SPECIMEN","OCCURRENCE_STATUS_INFERRED_FROM_INDIVIDUAL_COUNT;GEODETIC_DATUM_ASSUMED_WGS84;DIFFERENT_OWNER_INSTITUTION"
-68.1167,-13.7667,"Begonia juntasensis",1321219974,"Abel Iturralde, Ixiamasl, Macachua","BOL",NA,1997,"PRESERVED_SPECIMEN","GEODETIC_DATUM_ASSUMED_WGS84"
-67.66666,-16.03333,"Begonia juntasensis",4061160221,"31.4 km N of (below) Yolosa on road to Caranavi. Very steep, wet roadside.","BOL",NA,1982,"PRESERVED_SPECIMEN","OCCURRENCE_STATUS_INFERRED_FROM_INDIVIDUAL_COUNT;GEODETIC_DATUM_ASSUMED_WGS84;DIFFERENT_OWNER_INSTITUTION"
-64.534722,-17.818056,"Begonia juntasensis",1258363578,"Amboró National Park, Cerro Bravo area; ca. 10 map Km. N of Comarapa, near permanent plot. Cloud forest with Weinmannia spp., Podocarpus rusbyi, Prumnopitys exigua, tree ferns, and a thick epiphyte layer; with a network of cow grazing trails.","BOL",NA,1995,"PRESERVED_SPECIMEN","OCCURRENCE_STATUS_INFERRED_FROM_INDIVIDUAL_COUNT;COORDINATE_ROUNDED;GEODETIC_DATUM_ASSUMED_WGS84;DIFFERENT_OWNER_INSTITUTION"
-64.78833,-17.78861,"Begonia juntasensis",1260779395,"Siberia Oeste, Monte Hotel. Mesobosque montano de yunga . Serie Mesotropical pluviestacional humeda de Blepharocalyx salicifolius - Prumnopitys exigua, entre algunas especies diferenciales: Myrcianthes callicoma, Weinmannia microphylla, W. sorbifolia, Clethra scabra, Oreopanax sp. y Dicksonia sellowiana. Sotobosque denso con melastomataceas y varias familias de pteridophytas","BOL",NA,2003,"PRESERVED_SPECIMEN","GEODETIC_DATUM_ASSUMED_WGS84;DIFFERENT_OWNER_INSTITUTION"
-63.821667,-18.402222,"Begonia juntasensis",1257667502,"Alrededores de la Cascada la P'ajcha. Limítrofe con la provincia Florida.","BOL",NA,2009,"PRESERVED_SPECIMEN","OCCURRENCE_STATUS_INFERRED_FROM_INDIVIDUAL_COUNT;COORDINATE_ROUNDED;GEODETIC_DATUM_ASSUMED_WGS84;DIFFERENT_OWNER_INSTITUTION"
-66.16722,-16.73638,"Begonia juntasensis",1260780414,"Rio Altamachi. Bosque montano pluviestacional, caracterizado por Ceiba boliviana, Triplaris vestita, Aralia soratensis, Zanthoxylum aff rhoifolium y Maclura tinctorea","BOL",NA,2004,"PRESERVED_SPECIMEN","GEODETIC_DATUM_ASSUMED_WGS84;DIFFERENT_OWNER_INSTITUTION"
-68.1167,-15.8667,"Begonia juntasensis",1320655424,"Canron Yanacachi, Mina Chojila","BOL",NA,2000,"PRESERVED_SPECIMEN","GEODETIC_DATUM_ASSUMED_WGS84"
-64.333,-20.7,"Begonia juntasensis",197016546,"South Central Chuquisaca","BOL",NA,1995,"HUMAN_OBSERVATION","GEODETIC_DATUM_ASSUMED_WGS84;CONTINENT_DERIVED_FROM_COORDINATES"
-67.8833,-16.2167,"Begonia juntasensis",1321317078,"Between Choro and Chairo, above Rio Coscapa","BOL",NA,1996,"PRESERVED_SPECIMEN","GEODETIC_DATUM_ASSUMED_WGS84"
-63.8717,-18.0383,"Begonia juntasensis",1322855601,"Florida Prov., amboro National Park, Rio San Rafael, NE of Mariana","BOL",NA,1993,"PRESERVED_SPECIMEN","GEODETIC_DATUM_ASSUMED_WGS84"
-67.6667,-16.0333,"Begonia juntasensis",1936697678,"Departamento of la Paz: 31.4 km N of (below) Yolosa. Very steep, wet roadside","BOL",NA,1982,"PRESERVED_SPECIMEN","GEODETIC_DATUM_ASSUMED_WGS84;CONTINENT_DERIVED_FROM_COORDINATES;INSTITUTION_MATCH_FUZZY;COLLECTION_MATCH_FUZZY"
-65.271389,-17.527222,"Begonia juntasensis",1260531325,"Sehuencas area. Secondary vegetation of medium subperennifolious wet forest with Siparuna, Clusia, Alnus and Psychotria.","BOL",NA,2003,"PRESERVED_SPECIMEN","OCCURRENCE_STATUS_INFERRED_FROM_INDIVIDUAL_COUNT;COORDINATE_ROUNDED;GEODETIC_DATUM_ASSUMED_WGS84;INSTITUTION_MATCH_FUZZY;COLLECTION_MATCH_NONE"
