"lon","lat","species","gbifID","locality","countryCode","coordinateUncertaintyInMeters","year","basisOfRecord","issue"
-70.15,9.1833,"Begonia urophylla",1317456244,"13 km ESE of Boconó, 1 km W of Guaramacal.","VEN",NA,1982,"PRESERVED_SPECIMEN","GEODETIC_DATUM_ASSUMED_WGS84"
-92.09,15.09,"Begonia urophylla",1258658358,"En el volcán Tacaná a 8 km al SW de Unión Juárez, camino a Cacahoatán. sec. de selva alta perennifolia","MEX",NA,1987,"PRESERVED_SPECIMEN","OCCURRENCE_STATUS_INFERRED_FROM_INDIVIDUAL_COUNT;GEODETIC_DATUM_ASSUMED_WGS84;DIFFERENT_OWNER_INSTITUTION"
-72.67,10.7931,"Begonia urophylla",1322427261,"alrededores del Puesto El Bosque de la Guardia Nacional","VEN",NA,1982,"PRESERVED_SPECIMEN","GEODETIC_DATUM_ASSUMED_WGS84"
-72.4917,10.8694,"Begonia urophylla",1319188308,"cuenca del río Guasare, alrededores del Destacamento Guasare Nº1 (La Yolanda), en las laderas del cerro ca. 5 km al SSE del Destaca,ento, entre el caño Indio y la fila arriba de su orilla izquierda","VEN",NA,1983,"PRESERVED_SPECIMEN","GEODETIC_DATUM_ASSUMED_WGS84"
-70.2167,9.25,"Begonia urophylla",1321621303,"Cerro Guaramacal, bajando hacia el caserío de Guaramacal","VEN",NA,1982,"PRESERVED_SPECIMEN","GEODETIC_DATUM_ASSUMED_WGS84"
-84.38,9.89,"Begonia urophylla",4031908807,"Z.P. La Cangreja; Cerros de Puriscal. San Martín de Puriscal; Vara Blanca. Bosque primario falda N Cerro Cangreja","CRI",NA,1994,"PRESERVED_SPECIMEN","OCCURRENCE_STATUS_INFERRED_FROM_INDIVIDUAL_COUNT;GEODETIC_DATUM_ASSUMED_WGS84;INSTITUTION_MATCH_FUZZY;COLLECTION_MATCH_NONE"
-83.25,9.29,"Begonia urophylla",4031818885,"R.I. Ujarrás; Cordillera de Talamanca. Ujarrás. Margen izquierda de Quebrada Dorora. Camino a Río Lori.","CRI",NA,1993,"PRESERVED_SPECIMEN","OCCURRENCE_STATUS_INFERRED_FROM_INDIVIDUAL_COUNT;GEODETIC_DATUM_ASSUMED_WGS84;INSTITUTION_MATCH_FUZZY;COLLECTION_MATCH_NONE"
-84.45111,9.784722,"Begonia urophylla",1257836904,"Cerro Turrubares, por Llano Caite.","CRI",NA,2002,"PRESERVED_SPECIMEN","OCCURRENCE_STATUS_INFERRED_FROM_INDIVIDUAL_COUNT;COORDINATE_ROUNDED;GEODETIC_DATUM_ASSUMED_WGS84;INSTITUTION_MATCH_FUZZY;COLLECTION_MATCH_NONE"
-80.143333,8.621667,"Begonia urophylla",1260203476,"1.5 kms past El Valle on road to La Mesa. [Coordinates on orginal label:8º50'N, 80º07'W.]","PAN",NA,1986,"PRESERVED_SPECIMEN","OCCURRENCE_STATUS_INFERRED_FROM_INDIVIDUAL_COUNT;COORDINATE_ROUNDED;GEODETIC_DATUM_ASSUMED_WGS84;INSTITUTION_MATCH_FUZZY;COLLECTION_MATCH_NONE"
-74.095472,3.538218,"Begonia urophylla",1261532502,"Vereda El Triunfo, camino real, camino a la finca El Diamante.","COL",NA,1991,"PRESERVED_SPECIMEN","OCCURRENCE_STATUS_INFERRED_FROM_INDIVIDUAL_COUNT;GEODETIC_DATUM_ASSUMED_WGS84;INSTITUTION_MATCH_FUZZY;COLLECTION_MATCH_NONE"
-85.11666,10.7,"Begonia urophylla",1259555775,"Evergreen cloud forest with trees about 20 m tall and a distinct understory of dense shrubs 1-2 m tall on the eastern slopes of Volcan Miravalles (Cerro la Giganta) above the town of Rio Naranjo near the Continental Divide. on steep slopes in forest shade,","CRI",NA,1973,"PRESERVED_SPECIMEN","GEODETIC_DATUM_ASSUMED_WGS84;INSTITUTION_MATCH_FUZZY;COLLECTION_MATCH_NONE"
-82.716667,8.816667,"Begonia urophylla",4031481757,"0.5 km W of Qda. La Cruzó Coloradito, 2.5 km (by air) W of Cerro Pando. Brushy second growth premontane rain forest in quebradita along Highway 11. Steep dirt bank with very few ferns, sparse arums and some begonias in leaf litter.","PAN",NA,1975,"PRESERVED_SPECIMEN","OCCURRENCE_STATUS_INFERRED_FROM_INDIVIDUAL_COUNT;COORDINATE_ROUNDED;GEODETIC_DATUM_ASSUMED_WGS84;INSTITUTION_MATCH_FUZZY;COLLECTION_MATCH_NONE"
-82.966667,8.783333,"Begonia urophylla",1260210376,"Somewhat disturbed primary forest along Río Jaba, ca. 1 km SW of Las Cruces Botanical Garden.","CRI",NA,1987,"PRESERVED_SPECIMEN","OCCURRENCE_STATUS_INFERRED_FROM_INDIVIDUAL_COUNT;COORDINATE_ROUNDED;GEODETIC_DATUM_ASSUMED_WGS84;INSTITUTION_MATCH_FUZZY;COLLECTION_MATCH_NONE"
-79.9,8.683333,"Begonia urophylla",1259554068,"Cerro Campana, above Su Lin Motel.","PAN",NA,1969,"PRESERVED_SPECIMEN","OCCURRENCE_STATUS_INFERRED_FROM_INDIVIDUAL_COUNT;COORDINATE_ROUNDED;GEODETIC_DATUM_ASSUMED_WGS84;INSTITUTION_MATCH_FUZZY;COLLECTION_MATCH_NONE"
-83.89222,9.79861,"Begonia urophylla",1259557025,"Between Navarro and Muñeco along roadside and fence posts","CRI",NA,1978,"PRESERVED_SPECIMEN","GEODETIC_DATUM_ASSUMED_WGS84;INSTITUTION_MATCH_FUZZY;COLLECTION_MATCH_NONE"
-83.19,8.81,"Begonia urophylla",4031516931,"Fila Costeña. Cabeceras del Río Piedras Blancas; Cerro Anguciana, faldas al Oeste; bosque en roca de cal.","CRI",NA,1993,"PRESERVED_SPECIMEN","OCCURRENCE_STATUS_INFERRED_FROM_INDIVIDUAL_COUNT;GEODETIC_DATUM_ASSUMED_WGS84;INSTITUTION_MATCH_FUZZY;COLLECTION_MATCH_NONE"
-79.666667,9.383333,"Begonia urophylla",1260216553,"Santa Rita Ridge, near end of old road, 12 road-miles from highway. [Coordinates on original label: 09°20'04N 079°45'04W].","PAN",NA,1987,"PRESERVED_SPECIMEN","OCCURRENCE_STATUS_INFERRED_FROM_INDIVIDUAL_COUNT;COORDINATE_ROUNDED;GEODETIC_DATUM_ASSUMED_WGS84;INSTITUTION_MATCH_FUZZY;COLLECTION_MATCH_NONE"
-82.96,9.02,"Begonia urophylla",1258584151,"P.I. La Amistad. Cordillera de Talamanca. Estación Pittier. Río Gemelo.","CRI",NA,1995,"PRESERVED_SPECIMEN","OCCURRENCE_STATUS_INFERRED_FROM_INDIVIDUAL_COUNT;GEODETIC_DATUM_ASSUMED_WGS84;INSTITUTION_MATCH_FUZZY;COLLECTION_MATCH_NONE"
-74.072342,11.100942,"Begonia urophylla",4046692647,"","COL",34,2023,"HUMAN_OBSERVATION","COORDINATE_ROUNDED;CONTINENT_DERIVED_FROM_COORDINATES"
-74.045833,10.9058,"Begonia urophylla",3499450315,"","COL",210,2017,"HUMAN_OBSERVATION","COORDINATE_ROUNDED;CONTINENT_DERIVED_FROM_COORDINATES"
-73.900078,11.083378,"Begonia urophylla",3759587667,"","COL",4,2022,"HUMAN_OBSERVATION","COORDINATE_ROUNDED;CONTINENT_DERIVED_FROM_COORDINATES"
-69.92,9.47,"Begonia urophylla",1321581420,"50 km WNW of Guanare by air. 15 to 17 km N of Chabasquén.","VEN",NA,1982,"PRESERVED_SPECIMEN","GEODETIC_DATUM_ASSUMED_WGS84"
-70.42,8.83,"Begonia urophylla",3357319408,"5 km W of Mérida-Barinas boundary on road to Barinas.","VEN",NA,1989,"PRESERVED_SPECIMEN","GEODETIC_DATUM_ASSUMED_WGS84"
-78.53333,8.88333,"Begonia urophylla",1260197548,"Serranía de Majé Trail between headwaters Río Ipetí Grande and Charco Rico.","PAN",NA,1984,"PRESERVED_SPECIMEN","OCCURRENCE_STATUS_INFERRED_FROM_INDIVIDUAL_COUNT;GEODETIC_DATUM_ASSUMED_WGS84;INSTITUTION_MATCH_FUZZY;COLLECTION_MATCH_NONE"
-82.2,8.666667,"Begonia urophylla",1259211125,"Along road to Fortuna Dam site, north of Gualaca on Río Chiriqui. 12.9 miles beyond bridge over the Río Estí. (2.8 miles beyond Los Planes de Hornito and 1.7 miles beyond the junction of the road to the tunnel.)","PAN",NA,1979,"PRESERVED_SPECIMEN","OCCURRENCE_STATUS_INFERRED_FROM_INDIVIDUAL_COUNT;COORDINATE_ROUNDED;GEODETIC_DATUM_ASSUMED_WGS84;INSTITUTION_MATCH_FUZZY;COLLECTION_MATCH_NONE"
-80.6,8.66666,"Begonia urophylla",1259554750,"El Copé; on slope and ridge W of sawmill.","PAN",NA,1978,"PRESERVED_SPECIMEN","GEODETIC_DATUM_ASSUMED_WGS84;INSTITUTION_MATCH_FUZZY;COLLECTION_MATCH_NONE"
-80.608333,8.706667,"Begonia urophylla",1260218856,"Caribbean side of divide at El Copé.","PAN",NA,1983,"PRESERVED_SPECIMEN","OCCURRENCE_STATUS_INFERRED_FROM_INDIVIDUAL_COUNT;COORDINATE_ROUNDED;GEODETIC_DATUM_ASSUMED_WGS84;INSTITUTION_MATCH_FUZZY;COLLECTION_MATCH_NONE"
-84.2,10.25,"Begonia urophylla",1260199748,"16.3 km past Zarcero","CRI",NA,1986,"PRESERVED_SPECIMEN","OCCURRENCE_STATUS_INFERRED_FROM_INDIVIDUAL_COUNT;GEODETIC_DATUM_ASSUMED_WGS84;INSTITUTION_MATCH_FUZZY;COLLECTION_MATCH_NONE"
-82.75,8.85,"Begonia urophylla",1260208175,"Ojo de Agua, property of Ratidon Hartmann, vicinity of Santa Clara (between Volcán and Río Sereno).","PAN",NA,1987,"PRESERVED_SPECIMEN","OCCURRENCE_STATUS_INFERRED_FROM_INDIVIDUAL_COUNT;GEODETIC_DATUM_ASSUMED_WGS84;INSTITUTION_MATCH_FUZZY;COLLECTION_MATCH_NONE"
-79.38472,9.18888,"Begonia urophylla",1259555956,"La Eneida, region of Cerro Jefe","PAN",NA,1973,"PRESERVED_SPECIMEN","GEODETIC_DATUM_ASSUMED_WGS84;INSTITUTION_MATCH_FUZZY;COLLECTION_MATCH_NONE"
-84.833333,10.266667,"Begonia urophylla",1260213221,"10 km W Monteverde, road to Interamerican Highway below Santa Elena.","CRI",NA,1990,"PRESERVED_SPECIMEN","OCCURRENCE_STATUS_INFERRED_FROM_INDIVIDUAL_COUNT;COORDINATE_ROUNDED;GEODETIC_DATUM_ASSUMED_WGS84;INSTITUTION_MATCH_FUZZY;COLLECTION_MATCH_NONE"
-80.45,8.7,"Begonia urophylla",1259557102,"Above La Pintada, peak to east of Llano Grande-Toabré highway.","PAN",NA,1981,"PRESERVED_SPECIMEN","OCCURRENCE_STATUS_INFERRED_FROM_INDIVIDUAL_COUNT;GEODETIC_DATUM_ASSUMED_WGS84;INSTITUTION_MATCH_FUZZY;COLLECTION_MATCH_NONE"
-78.423611,8.933611,"Begonia urophylla",1259554088,"Area surrounding Rancho Chorro, mountains above Torti Arriba. Serranía de Cañasas.","PAN",NA,1977,"PRESERVED_SPECIMEN","OCCURRENCE_STATUS_INFERRED_FROM_INDIVIDUAL_COUNT;COORDINATE_ROUNDED;GEODETIC_DATUM_ASSUMED_WGS84;INSTITUTION_MATCH_FUZZY;COLLECTION_MATCH_NONE"
-82.416667,8.733333,"Begonia urophylla",1259555681,"Vicinity of Boquete, from Boquete to 3 miles N.","PAN",NA,1966,"PRESERVED_SPECIMEN","OCCURRENCE_STATUS_INFERRED_FROM_INDIVIDUAL_COUNT;COORDINATE_ROUNDED;GEODETIC_DATUM_ASSUMED_WGS84;INSTITUTION_MATCH_FUZZY;COLLECTION_MATCH_NONE"
-72.66666,10.79305,"Begonia urophylla",1260535287,"Dtto. Mara: alrededores del Puesto El Bosque de la Guardia Nacional., en bosque nublado húmedo.","VEN",NA,1982,"PRESERVED_SPECIMEN","GEODETIC_DATUM_ASSUMED_WGS84;INSTITUTION_MATCH_FUZZY;COLLECTION_MATCH_NONE"
-83.76,9.29,"Begonia urophylla",4031455954,"Fila Costeña, Fila Tinamstes, por la Fila del Farallón, bosque y margen de bosque muy húmedo (nublado) con pocos árboles grandes","CRI",NA,1996,"PRESERVED_SPECIMEN","OCCURRENCE_STATUS_INFERRED_FROM_INDIVIDUAL_COUNT;GEODETIC_DATUM_ASSUMED_WGS84;INSTITUTION_MATCH_FUZZY;COLLECTION_MATCH_NONE"
-68.81666,10.43333,"Begonia urophylla",1258563528,"Sierra de Aroa. Cerro Tigre. 10 km E of Aroa air distance. Río Carabobo and disturbed, primary evergreen forest on adjacent slopes.","VEN",NA,1980,"PRESERVED_SPECIMEN","GEODETIC_DATUM_ASSUMED_WGS84;INSTITUTION_MATCH_FUZZY;COLLECTION_MATCH_NONE"
-83.822222,9.469445,"Begonia urophylla",1257527164,"Río Nuevo. R.F. Los Santos. Camino entre California y Zaragoza.","CRI",NA,2001,"PRESERVED_SPECIMEN","OCCURRENCE_STATUS_INFERRED_FROM_INDIVIDUAL_COUNT;COORDINATE_ROUNDED;GEODETIC_DATUM_ASSUMED_WGS84;INSTITUTION_MATCH_FUZZY;COLLECTION_MATCH_NONE"
-84.1,10.2,"Begonia urophylla",44363337,"P.N. Braulio Carrillo Field Collected ETOH.","CRI",NA,2001,"PRESERVED_SPECIMEN","GEODETIC_DATUM_ASSUMED_WGS84;CONTINENT_DERIVED_FROM_COORDINATES;TAXON_MATCH_HIGHERRANK;INSTITUTION_MATCH_NONE"
-83.06,9.11,"Begonia urophylla",44362882,"Estación Tres Colinas, cerca de la toma de agua nueva en potrero y orilla del río. Cuenca Térraba-Sierpe.","CRI",NA,1996,"PRESERVED_SPECIMEN","GEODETIC_DATUM_ASSUMED_WGS84;CONTINENT_DERIVED_FROM_COORDINATES;TAXON_MATCH_HIGHERRANK;INSTITUTION_MATCH_NONE"
-77.816667,8.933333,"Begonia urophylla",1259554424,"Headwaters of Río Cuadi, Camp Diablo (Drill Site 22), N 82.2, E 87.8","PAN",NA,1967,"PRESERVED_SPECIMEN","OCCURRENCE_STATUS_INFERRED_FROM_INDIVIDUAL_COUNT;COORDINATE_ROUNDED;GEODETIC_DATUM_ASSUMED_WGS84;INSTITUTION_MATCH_FUZZY;COLLECTION_MATCH_NONE"
-85.48,10.93,"Begonia urophylla",1258584113,"P.N. Guanacaste. Cordillera de Guanacaste. Estación Cacao; Bosque ripario, Quebrada Florsita.","CRI",NA,1995,"PRESERVED_SPECIMEN","OCCURRENCE_STATUS_INFERRED_FROM_INDIVIDUAL_COUNT;GEODETIC_DATUM_ASSUMED_WGS84;INSTITUTION_MATCH_FUZZY;COLLECTION_MATCH_NONE"
-80.4,8.4833,"Begonia urophylla",1228576586,"Coclé","PAN",NA,1984,"PRESERVED_SPECIMEN","GEODETIC_DATUM_ASSUMED_WGS84;INSTITUTION_MATCH_FUZZY;AMBIGUOUS_COLLECTION"
-78.5,8.4833,"Begonia urophylla",1228269144,"Panamá","PAN",NA,1984,"PRESERVED_SPECIMEN","GEODETIC_DATUM_ASSUMED_WGS84;INSTITUTION_MATCH_FUZZY;AMBIGUOUS_COLLECTION"
-82.819926,9.014513,"Begonia urophylla",1253672272,"Sendero a Cerro Echandi","CRI",NA,1997,"PRESERVED_SPECIMEN","COORDINATE_ROUNDED;CONTINENT_DERIVED_FROM_COORDINATES;CONTINENT_INVALID;INSTITUTION_MATCH_FUZZY;COLLECTION_MATCH_NONE"
-83.109722,9.386111,"Begonia urophylla",1253600381,"Amubri, Alto Lari, Kivut. Cabeceras del Rio Dapari, margen derecha.","CRI",NA,1992,"PRESERVED_SPECIMEN","COORDINATE_ROUNDED;CONTINENT_DERIVED_FROM_COORDINATES;CONTINENT_INVALID;INSTITUTION_MATCH_FUZZY;COLLECTION_MATCH_NONE"
-73.263333,4.806667,"Begonia urophylla",1934718252,"Carretera a Mambita, cerca a la desembocadura del río Garagoa, colecciones orilla de la carretera y talud.","COL",NA,2008,"PRESERVED_SPECIMEN","GEODETIC_DATUM_ASSUMED_WGS84"
-73.586944,4.267222,"Begonia urophylla",1890914614,"La Salina.","COL",909,1979,"PRESERVED_SPECIMEN","COORDINATE_ROUNDED;GEODETIC_DATUM_ASSUMED_WGS84;GEODETIC_DATUM_INVALID"
-79.16666,-6,"Begonia urophylla",1261512048,"District of Pucará, Caserio Sondor. Medicinal plants collections; guides: Edilberto Carrasco Vera and Omeister Carrasco Carrasco.","PER",NA,1993,"PRESERVED_SPECIMEN","OCCURRENCE_STATUS_INFERRED_FROM_INDIVIDUAL_COUNT;GEODETIC_DATUM_ASSUMED_WGS84;INSTITUTION_MATCH_FUZZY;COLLECTION_MATCH_NONE"
-80.1167,8.83333,"Begonia urophylla",1571030444,"1.5 km past El Valle on road to La Mesa.","PAN",NA,1986,"PRESERVED_SPECIMEN","GEODETIC_DATUM_ASSUMED_WGS84;CONTINENT_DERIVED_FROM_COORDINATES;INSTITUTION_COLLECTION_MISMATCH"
-82.3167,8.5,"Begonia urophylla",1571030211,"8.8 km past Gualaca on road to Chiriquí Grande.","PAN",NA,1986,"PRESERVED_SPECIMEN","GEODETIC_DATUM_ASSUMED_WGS84;CONTINENT_DERIVED_FROM_COORDINATES;INSTITUTION_COLLECTION_MISMATCH"
-90.9668,15.0326,"Begonia urophylla",1571029966,"Finca Armenia near La Trinidad above San Rafael.","GTM",NA,1977,"PRESERVED_SPECIMEN","GEODETIC_DATUM_ASSUMED_WGS84;CONTINENT_DERIVED_FROM_COORDINATES;INSTITUTION_COLLECTION_MISMATCH"
-81.2943,8.43316,"Begonia urophylla",1571030218,"Cerro Campana.","PAN",NA,1987,"PRESERVED_SPECIMEN","GEODETIC_DATUM_ASSUMED_WGS84;CONTINENT_DERIVED_FROM_COORDINATES;INSTITUTION_COLLECTION_MISMATCH"
-69.5667,9.71667,"Begonia urophylla",1571029971,"Distrito Jiménez; Parque Nacional Yacambú, 3 km E of Park headquarters, Quebrada El Blanco.","VEN",NA,1982,"PRESERVED_SPECIMEN","GEODETIC_DATUM_ASSUMED_WGS84;CONTINENT_DERIVED_FROM_COORDINATES;INSTITUTION_COLLECTION_MISMATCH"
-82.6,8.88333,"Begonia urophylla",1571030204,"American Highway on road to Cerro Punta.","PAN",NA,1986,"PRESERVED_SPECIMEN","GEODETIC_DATUM_ASSUMED_WGS84;CONTINENT_DERIVED_FROM_COORDINATES;INSTITUTION_COLLECTION_MISMATCH"
-80.366667,8.603333,"Begonia urophylla",1259557108,"Ca. 15-20 km NE of La Pintada towards Toábre, largest peak in vicinity.","PAN",NA,1981,"PRESERVED_SPECIMEN","OCCURRENCE_STATUS_INFERRED_FROM_INDIVIDUAL_COUNT;COORDINATE_ROUNDED;GEODETIC_DATUM_ASSUMED_WGS84;INSTITUTION_MATCH_FUZZY;COLLECTION_MATCH_NONE"
-84.5808,10.3406,"Begonia urophylla",1571030231,"Between 0.5-1 km NW of Presa above Tigra/Finca La Frosa.","CRI",NA,1988,"PRESERVED_SPECIMEN","GEODETIC_DATUM_ASSUMED_WGS84;CONTINENT_DERIVED_FROM_COORDINATES;INSTITUTION_COLLECTION_MISMATCH"
-82.633333,8.683333,"Begonia urophylla",1260197668,"20 kms from Pan American Highway on road to Cerro Punta. [Coordinates on orginal label: 8º53'N; 82º36'W}","PAN",NA,1986,"PRESERVED_SPECIMEN","OCCURRENCE_STATUS_INFERRED_FROM_INDIVIDUAL_COUNT;COORDINATE_ROUNDED;GEODETIC_DATUM_ASSUMED_WGS84;INSTITUTION_MATCH_FUZZY;COLLECTION_MATCH_NONE"
-91.89527,14.91,"Begonia urophylla",1258658379,"Finca Armenia near La Trinidad above San Rafael","GTM",NA,1977,"PRESERVED_SPECIMEN","GEODETIC_DATUM_ASSUMED_WGS84;INSTITUTION_MATCH_FUZZY;COLLECTION_MATCH_NONE"
-74.683611,10.990278,"Begonia urophylla",4026671272,"Corregimiento Siberia, Vereda El Congo Reserva Ciudad Antigua","COL",NA,2015,"PRESERVED_SPECIMEN","COORDINATE_ROUNDED;INSTITUTION_MATCH_NONE"
-84.195833,9.672222,"Begonia urophylla",1253790859,"Quebrada Laja, ca. 2.5 km al noroeste de Altos El Aguacate","CRI",NA,2003,"PRESERVED_SPECIMEN","COORDINATE_ROUNDED;CONTINENT_DERIVED_FROM_COORDINATES;CONTINENT_INVALID;INSTITUTION_MATCH_FUZZY;COLLECTION_MATCH_NONE"
-72.86,5.25,"Begonia urophylla",3705110811,"Vereda Brisas del Fonce, finca La Garantía, qda. La Honda","COL",NA,2015,"PRESERVED_SPECIMEN","INSTITUTION_MATCH_NONE"
-82.20833,8.65166,"Begonia urophylla",1259155993,"12 mi from Gualaca on road to Cerro Hornito.","PAN",NA,1979,"PRESERVED_SPECIMEN","OCCURRENCE_STATUS_INFERRED_FROM_INDIVIDUAL_COUNT;GEODETIC_DATUM_ASSUMED_WGS84;INSTITUTION_MATCH_FUZZY;COLLECTION_MATCH_NONE"
-80.175923,8.600378,"Begonia urophylla",3499568704,"","PAN",43,2022,"HUMAN_OBSERVATION","COORDINATE_ROUNDED;CONTINENT_DERIVED_FROM_COORDINATES"
-84.75587,10.488292,"Begonia urophylla",2609347971,"","CRI",NA,2007,"HUMAN_OBSERVATION","COORDINATE_ROUNDED;CONTINENT_DERIVED_FROM_COORDINATES"
-75.419135,6.963842,"Begonia urophylla",3859818895,"","COL",6633,2021,"HUMAN_OBSERVATION","COORDINATE_ROUNDED;CONTINENT_DERIVED_FROM_COORDINATES"
-96.53,15.99,"Begonia urophylla",1260039246,"Mpio. San Miguel Suchixtepec. Along Highway 175 between Oaxaca and Pochutla; 55.1 mi S of Miahuatlán, 21.9 mi S of Suchixtepec, 39.7 mi N of turnoff to Pluma Hidalgo.","MEX",NA,1979,"PRESERVED_SPECIMEN","OCCURRENCE_STATUS_INFERRED_FROM_INDIVIDUAL_COUNT;GEODETIC_DATUM_ASSUMED_WGS84;INSTITUTION_MATCH_FUZZY;COLLECTION_MATCH_NONE"
-72.70197,5.42338,"Begonia urophylla",1576175911,"Carretera a Casanare, entre Corinto y el Salto de Candelas","COL",2545,1970,"PRESERVED_SPECIMEN","INSTITUTION_MATCH_NONE"
-79.633333,9.416667,"Begonia urophylla",1257922024,"Stream on north slope of Río Gatún drainage. Along the river's edge","PAN",NA,1980,"PRESERVED_SPECIMEN","OCCURRENCE_STATUS_INFERRED_FROM_INDIVIDUAL_COUNT;COORDINATE_ROUNDED;GEODETIC_DATUM_ASSUMED_WGS84;INSTITUTION_MATCH_FUZZY;COLLECTION_MATCH_NONE"
-77.283333,8.133333,"Begonia urophylla",1259061864,"Cerro Tacarcuna Expedition. Cerro Tacarcuna, south slope, ridge top forest well below summit.","PAN",NA,1975,"PRESERVED_SPECIMEN","OCCURRENCE_STATUS_INFERRED_FROM_INDIVIDUAL_COUNT;COORDINATE_ROUNDED;GEODETIC_DATUM_ASSUMED_WGS84;INSTITUTION_MATCH_FUZZY;COLLECTION_MATCH_NONE"
-83.083333,8.966667,"Begonia urophylla",1259557210,"Above coffee fincas along Río Coto Brus, near Cotón, 23 km north of La Unión (on Panama) border.","CRI",NA,1974,"PRESERVED_SPECIMEN","OCCURRENCE_STATUS_INFERRED_FROM_INDIVIDUAL_COUNT;COORDINATE_ROUNDED;GEODETIC_DATUM_ASSUMED_WGS84;INSTITUTION_MATCH_FUZZY;COLLECTION_MATCH_NONE"
-79.95805,9.23472,"Begonia urophylla",1259557202,"Divide between Rio Piña & Rio Media. Northwestern part of Canal Zone (area west of Limon Bay, Gatun Locks, and Gatun Lake)","PAN",NA,1956,"PRESERVED_SPECIMEN","GEODETIC_DATUM_ASSUMED_WGS84;INSTITUTION_MATCH_FUZZY;COLLECTION_MATCH_NONE"
-82.75,9.378333,"Begonia urophylla",1259554976,"Río Terebe just below Puerto Palenque","PAN",NA,1968,"PRESERVED_SPECIMEN","OCCURRENCE_STATUS_INFERRED_FROM_INDIVIDUAL_COUNT;COORDINATE_ROUNDED;GEODETIC_DATUM_ASSUMED_WGS84;INSTITUTION_MATCH_FUZZY;COLLECTION_MATCH_NONE"
