"lon","lat","species","gbifID","locality","countryCode","coordinateUncertaintyInMeters","year","basisOfRecord","issue"
-70.97,19.03,"Brachythecium ruderale",1928248137,"Just E of La Compartición, along trail up Pico Duarte.","DOM",NA,1987,"PRESERVED_SPECIMEN","GEODETIC_DATUM_ASSUMED_WGS84;COLLECTION_MATCH_FUZZY"
-71.63,19.23,"Brachythecium ruderale",1929880944,"Along Haitian/Dominican International Highway from Pedro Santana to Restauración, at km 89.","HTI",NA,1982,"PRESERVED_SPECIMEN","GEODETIC_DATUM_ASSUMED_WGS84;COLLECTION_MATCH_FUZZY"
-70.53,18.77,"Brachythecium ruderale",1930039353,"Cordillera Central: Valle de Río Nizao, 22 km de Rancho Arriba en el camino a Quita Sueño y Quita Pena, base de Firme Naranjo, Oeste de Quita Pena; en el sendero de Quita Pena a Calderón en el otro lado del río.","DOM",NA,1983,"PRESERVED_SPECIMEN","GEODETIC_DATUM_ASSUMED_WGS84;COLLECTION_MATCH_FUZZY"
-71.75,18.17,"Brachythecium ruderale",1930582815,"Along road paralleling the Haitian border, ca. 1 km N of junction of road to Mencia, at Río Mulito.","DOM",NA,1981,"PRESERVED_SPECIMEN","GEODETIC_DATUM_ASSUMED_WGS84;COLLECTION_MATCH_FUZZY"
-77.53,0.63,"Brachythecium ruderale",1928200699,"Cordillera Occidental, above Río Chingual, ca 8 km S of Santa Barbara, road to La Bonita","ECU",NA,1983,"PRESERVED_SPECIMEN","GEODETIC_DATUM_ASSUMED_WGS84;COLLECTION_MATCH_FUZZY"
-79.15,-2.92,"Brachythecium ruderale",1931186687,"Area Nacional de Recreación Cajas, forested hill S. of Surrochucho (Laguna Llavíuco), SW of Sayausí","ECU",NA,1978,"PRESERVED_SPECIMEN","GEODETIC_DATUM_ASSUMED_WGS84;COLLECTION_MATCH_FUZZY"
-67.73,-16.15,"Brachythecium ruderale",1928329787,"in area of the junction of Río Santa Barbara with Río Coroico, ca. 100 m upstream of bridge over Río Santa Barbara ca. 5 km S of Coroico.","BOL",NA,1984,"PRESERVED_SPECIMEN","GEODETIC_DATUM_ASSUMED_WGS84;COLLECTION_MATCH_FUZZY"
-71.703814,19.548702,"Brachythecium ruderale",1930625421,"Dajabón.","DOM",NA,1978,"PRESERVED_SPECIMEN","COLLECTION_MATCH_FUZZY"
-49.569722,-25.463583,"Brachythecium ruderale",1090163820,"Rua Ceará, Jardim Boa Vista","BRA",NA,2013,"PRESERVED_SPECIMEN","GEODETIC_DATUM_ASSUMED_WGS84;CONTINENT_DERIVED_FROM_COORDINATES;INSTITUTION_MATCH_NONE"
-49.161222,-25.2615,"Brachythecium ruderale",1090161299,"Rua Orlando Ceccon","BRA",NA,2012,"PRESERVED_SPECIMEN","GEODETIC_DATUM_ASSUMED_WGS84;CONTINENT_DERIVED_FROM_COORDINATES;INSTITUTION_MATCH_NONE"
-64.353333,-20.841111,"Brachythecium ruderale",4061587775,"Subiendo a Bufetes ca. 4 km al oeste de El Palmar. Pastizales y galerías de Bosque Tucumano-Boliviano, con Cedrela, Juglans. <2908-2933>","BOL",NA,2007,"PRESERVED_SPECIMEN","OCCURRENCE_STATUS_INFERRED_FROM_INDIVIDUAL_COUNT;COORDINATE_ROUNDED;GEODETIC_DATUM_ASSUMED_WGS84;DIFFERENT_OWNER_INSTITUTION"
-65.812778,-17.234722,"Brachythecium ruderale",4061537425,"Incachaca, carretera Cochabamba-Villa Tunari. Bosque montano de Yungas. <24836-24858>","BOL",NA,2007,"PRESERVED_SPECIMEN","OCCURRENCE_STATUS_INFERRED_FROM_INDIVIDUAL_COUNT;COORDINATE_ROUNDED;GEODETIC_DATUM_ASSUMED_WGS84;DIFFERENT_OWNER_INSTITUTION"
-78.433333,-0.616667,"Brachythecium ruderale",1261693992,"Parque Nacional Cotopaxi, faldas N de Volcán Cotopaxi","ECU",NA,1983,"PRESERVED_SPECIMEN","OCCURRENCE_STATUS_INFERRED_FROM_INDIVIDUAL_COUNT;COORDINATE_ROUNDED;GEODETIC_DATUM_ASSUMED_WGS84;DIFFERENT_OWNER_INSTITUTION"
-77.116667,1.183333,"Brachythecium ruderale",1261694160,"Pasto, El Encano, Vereda El Romerillo.","COL",NA,1991,"PRESERVED_SPECIMEN","OCCURRENCE_STATUS_INFERRED_FROM_INDIVIDUAL_COUNT;COORDINATE_ROUNDED;GEODETIC_DATUM_ASSUMED_WGS84;DIFFERENT_OWNER_INSTITUTION"
-63.9,-21.416667,"Brachythecium ruderale",1261711315,"Ca. 20 km oeste de Palos Blancos (a Entre Rios). Bosque montano Tucumano-Boliviano, remanente. <20740-20756>","BOL",NA,2001,"PRESERVED_SPECIMEN","OCCURRENCE_STATUS_INFERRED_FROM_INDIVIDUAL_COUNT;COORDINATE_ROUNDED;GEODETIC_DATUM_ASSUMED_WGS84;DIFFERENT_OWNER_INSTITUTION"
-64.071111,-19.300833,"Brachythecium ruderale",4061528021,"Próximo a Las Juntas, suviendo al Abra Sta. Cruz. Bosque montano Tucumano-Boliviano, piso medio con Myrtaceas, Lauraceas, Juglandaceas. <1111-1131>","BOL",NA,2004,"PRESERVED_SPECIMEN","OCCURRENCE_STATUS_INFERRED_FROM_INDIVIDUAL_COUNT;COORDINATE_ROUNDED;GEODETIC_DATUM_ASSUMED_WGS84;DIFFERENT_OWNER_INSTITUTION"
-49.633333,-28.15,"Brachythecium ruderale",2575907464,"Parque Nacional de São Joaquim. Próximo ao Alojamento dos Campos de Santa Bárbara.","BRA",NA,2013,"PRESERVED_SPECIMEN","COORDINATE_ROUNDED;GEODETIC_DATUM_ASSUMED_WGS84;CONTINENT_DERIVED_FROM_COORDINATES;AMBIGUOUS_INSTITUTION"
-49.075,-27.920833,"Brachythecium ruderale",1424226537,"Parque Municipal São Francisco de Assis.","BRA",NA,1998,"PRESERVED_SPECIMEN","COORDINATE_ROUNDED;GEODETIC_DATUM_ASSUMED_WGS84;CONTINENT_DERIVED_FROM_COORDINATES;INSTITUTION_MATCH_FUZZY;COLLECTION_MATCH_FUZZY"
-43.031944,-22.604722,"Brachythecium ruderale",1586074068,"Distrito de Santo Aleixo, Jardim Esmeralda, Fazenda das Mercês (antigo Sítio de São Pedro), início da trilha, próximo a casa.","BRA",NA,2017,"PRESERVED_SPECIMEN","COORDINATE_ROUNDED;GEODETIC_DATUM_ASSUMED_WGS84;CONTINENT_DERIVED_FROM_COORDINATES;INSTITUTION_MATCH_FUZZY;COLLECTION_MATCH_FUZZY"
-71.68,19.38,"Brachythecium ruderale",1930831587,"14.7 km desde el Parque Central del Pueblo de Loma de Cabrera en el camino a Capotillo y Loma de Alto de la Paloma: En la cima de La Loma Alto de La Paloma, cerca del Puesto del Ejército Nacional.","DOM",NA,1981,"PRESERVED_SPECIMEN","GEODETIC_DATUM_ASSUMED_WGS84;COLLECTION_MATCH_FUZZY"
-66.75,18.37,"Brachythecium ruderale",1929659103,"Trail at end of Hwy 625, just outside of Observatorio de Arecibo.","PRI",NA,1992,"PRESERVED_SPECIMEN","GEODETIC_DATUM_ASSUMED_WGS84;COLLECTION_MATCH_FUZZY"
-64.13,-21.45,"Brachythecium ruderale",1929788416,"unnamed ridge between Cerro Abra San Simon and Cerro Montoso to north of Entre Rios-Villamontes road, 7 km NE of Entre Ríos.","BOL",NA,1984,"PRESERVED_SPECIMEN","GEODETIC_DATUM_ASSUMED_WGS84;COLLECTION_MATCH_FUZZY"
-66.2,18.283333,"Brachythecium ruderale",1261740704,"Sector Barrio Nuevo. Route 816.","PRI",NA,1990,"PRESERVED_SPECIMEN","OCCURRENCE_STATUS_INFERRED_FROM_INDIVIDUAL_COUNT;COORDINATE_ROUNDED;COUNTRY_MISMATCH;GEODETIC_DATUM_ASSUMED_WGS84;INSTITUTION_MATCH_FUZZY;COLLECTION_MATCH_NONE"
-77.316667,1.1,"Brachythecium ruderale",4032091140,"Corregimiento de Santa Bárbara. Confluencia del Río Bobo con El Río Opongoy.","COL",NA,1995,"PRESERVED_SPECIMEN","OCCURRENCE_STATUS_INFERRED_FROM_INDIVIDUAL_COUNT;COORDINATE_ROUNDED;GEODETIC_DATUM_ASSUMED_WGS84;INSTITUTION_MATCH_FUZZY;COLLECTION_MATCH_NONE"
-65.415,-19.0075,"Brachythecium ruderale",4031783466,"Cerca de Maragua, 43 km oeste de Sucre. Vegetación de puna semihúmeda. <24602-24613>","BOL",NA,2006,"PRESERVED_SPECIMEN","OCCURRENCE_STATUS_INFERRED_FROM_INDIVIDUAL_COUNT;GEODETIC_DATUM_ASSUMED_WGS84;INSTITUTION_MATCH_FUZZY;COLLECTION_MATCH_NONE"
-96.910833,19.688889,"Brachythecium ruderale",2629486778,"Cerca de Tonayan, N de Xalapa","MEX",80,1976,"PRESERVED_SPECIMEN","TYPE_STATUS_INVALID;OCCURRENCE_STATUS_INFERRED_FROM_INDIVIDUAL_COUNT;COORDINATE_ROUNDED;GEODETIC_DATUM_ASSUMED_WGS84;GEODETIC_DATUM_INVALID;CONTINENT_DERIVED_FROM_COORDINATES;INSTITUTION_MATCH_NONE"
-97.226389,18.979167,"Brachythecium ruderale",2629659859,"Volcán Pico de Orizaba, ladera S, cerca del Rancho Puerta del Golfo en el camino de El Pilancon-San Miguel","MEX",90,1982,"PRESERVED_SPECIMEN","TYPE_STATUS_INVALID;OCCURRENCE_STATUS_INFERRED_FROM_INDIVIDUAL_COUNT;COORDINATE_ROUNDED;GEODETIC_DATUM_ASSUMED_WGS84;GEODETIC_DATUM_INVALID;CONTINENT_DERIVED_FROM_COORDINATES;INSTITUTION_MATCH_NONE"
-79.333333,-0.95,"Brachythecium ruderale",2515490397,"","ECU",NA,1968,"PRESERVED_SPECIMEN","INSTITUTION_MATCH_FUZZY;INSTITUTION_COLLECTION_MISMATCH"
-103.833333,20.783333,"Brachythecium ruderale",1258203704,"Cerro de Tequila, a rugged volcanic cone 13 km due S of Tequila.","MEX",NA,1978,"PRESERVED_SPECIMEN","OCCURRENCE_STATUS_INFERRED_FROM_INDIVIDUAL_COUNT;COORDINATE_ROUNDED;GEODETIC_DATUM_ASSUMED_WGS84;INSTITUTION_MATCH_FUZZY;COLLECTION_MATCH_NONE"
-77.466667,1.283333,"Brachythecium ruderale",4032131140,"Parte baja de la población.","COL",NA,1993,"PRESERVED_SPECIMEN","OCCURRENCE_STATUS_INFERRED_FROM_INDIVIDUAL_COUNT;COORDINATE_ROUNDED;GEODETIC_DATUM_ASSUMED_WGS84;INSTITUTION_MATCH_FUZZY;COLLECTION_MATCH_NONE"
-68.7,-15.616667,"Brachythecium ruderale",1261675793,"Along foot trail from Quyiabaya to Cotañani, 15 km E of NW of Sorata.","BOL",NA,1983,"PRESERVED_SPECIMEN","OCCURRENCE_STATUS_INFERRED_FROM_INDIVIDUAL_COUNT;COORDINATE_ROUNDED;GEODETIC_DATUM_ASSUMED_WGS84;INSTITUTION_MATCH_FUZZY;COLLECTION_MATCH_NONE"
-106.566667,32.366667,"Brachythecium ruderale",1261612008,"E side of the Organ Mtns., ca. 1/2 mi S Aquirre Spring.","USA",NA,1979,"PRESERVED_SPECIMEN","OCCURRENCE_STATUS_INFERRED_FROM_INDIVIDUAL_COUNT;COORDINATE_ROUNDED;GEODETIC_DATUM_ASSUMED_WGS84;INSTITUTION_MATCH_FUZZY;COLLECTION_MATCH_NONE"
-45.3,-22.583333,"Brachythecium ruderale",1261788878,"Serra da Mantiqueira, Delfim Moreira. Bei São Francisco dos Campos.","BRA",NA,1988,"PRESERVED_SPECIMEN","OCCURRENCE_STATUS_INFERRED_FROM_INDIVIDUAL_COUNT;COORDINATE_ROUNDED;GEODETIC_DATUM_ASSUMED_WGS84;INSTITUTION_MATCH_FUZZY;COLLECTION_MATCH_NONE"
-79,-0.4,"Brachythecium ruderale",1261576137,"Guava patch, 2 km W of Tandape on Quito-Sto. Domingo road.","ECU",NA,1984,"PRESERVED_SPECIMEN","OCCURRENCE_STATUS_INFERRED_FROM_INDIVIDUAL_COUNT;GEODETIC_DATUM_ASSUMED_WGS84;INSTITUTION_MATCH_FUZZY;COLLECTION_MATCH_NONE"
-88.933333,14.75,"Brachythecium ruderale",1257544001,"On road to San Jose del los Planes, 5 km from Jardines. <14040 & 14043>","HND",NA,1993,"PRESERVED_SPECIMEN","OCCURRENCE_STATUS_INFERRED_FROM_INDIVIDUAL_COUNT;COORDINATE_ROUNDED;GEODETIC_DATUM_ASSUMED_WGS84;INSTITUTION_MATCH_FUZZY;COLLECTION_MATCH_NONE"
-78.416667,-1.416667,"Brachythecium ruderale",1261675814,"14-19 km W of Baños along road 78; slopes above left bank of Río Pastaza. Alt. 1650-1800 m. 1.25 S, 78.25 W.","ECU",NA,1975,"PRESERVED_SPECIMEN","OCCURRENCE_STATUS_INFERRED_FROM_INDIVIDUAL_COUNT;COORDINATE_ROUNDED;GEODETIC_DATUM_ASSUMED_WGS84;INSTITUTION_MATCH_FUZZY;COLLECTION_MATCH_NONE"
-64.080278,-18.857778,"Brachythecium ruderale",4032103249,"Alto Seco. <142-160>","BOL",NA,2009,"PRESERVED_SPECIMEN","OCCURRENCE_STATUS_INFERRED_FROM_INDIVIDUAL_COUNT;COORDINATE_ROUNDED;GEODETIC_DATUM_ASSUMED_WGS84;INSTITUTION_MATCH_FUZZY;COLLECTION_MATCH_NONE"
-82.54125,8.8065,"Brachythecium ruderale",4030724817,"Chiriqui, Baru vulkaani nõlv","PAN",NA,2000,"PRESERVED_SPECIMEN","GEODETIC_DATUM_ASSUMED_WGS84;GEODETIC_DATUM_INVALID;CONTINENT_DERIVED_FROM_COORDINATES"
-99.31831,19.3228,"Brachythecium ruderale",1928175416,"La Cañada, al SW de Huixquilucan.","MEX",NA,2010,"PRESERVED_SPECIMEN","GEODETIC_DATUM_ASSUMED_WGS84;COLLECTION_MATCH_FUZZY"
-72.6025,7.3014,"Brachythecium ruderale",1931323723,"ca. 6 km SE de Pamplona.","COL",NA,1995,"PRESERVED_SPECIMEN","GEODETIC_DATUM_ASSUMED_WGS84;COLLECTION_MATCH_FUZZY"
-71.6,18.1,"Brachythecium ruderale",1930378919,"Sierra de Baoruco: 26 km N desde el Puerto de Cabo Rojo (de la Alcoa Exploration Company) en el camino minero a Las Mercedes y Aceitillar.","DOM",NA,1982,"PRESERVED_SPECIMEN","GEODETIC_DATUM_ASSUMED_WGS84;COLLECTION_MATCH_FUZZY"
-111.74836,34.99531,"Brachythecium ruderale",1930333427,"8 miles north of Sedona to West Fork of Oak Creek. One mile up trail.","USA",NA,2013,"PRESERVED_SPECIMEN","GEODETIC_DATUM_ASSUMED_WGS84;COLLECTION_MATCH_FUZZY"
-42.0722,-20.0764,"Brachythecium ruderale",1930291422,"Sede da Reserva Particuilar de Patrimônio Natural (RPPN) Mata do Sossego","BRA",NA,2013,"PRESERVED_SPECIMEN","GEODETIC_DATUM_ASSUMED_WGS84;COLLECTION_MATCH_FUZZY"
-65.35,-24.58,"Brachythecium ruderale",1931157186,"Km. 1644 along Camino de Cornisa, ca. 2 km S of Jujuy provincial border.","ARG",NA,1994,"PRESERVED_SPECIMEN","GEODETIC_DATUM_ASSUMED_WGS84;COLLECTION_MATCH_FUZZY"
-74.3,4.53,"Brachythecium ruderale",1927847118,"El Charquito. Vereda La Rambla.","COL",NA,1992,"PRESERVED_SPECIMEN","GEODETIC_DATUM_ASSUMED_WGS84;COLLECTION_MATCH_FUZZY"
-45.58,-22.77,"Brachythecium ruderale",1930845278,"Serra da Mantiqueira, Pico do Itapeva, ca. 6 km SE of Campos do Jordao","BRA",NA,1994,"PRESERVED_SPECIMEN","GEODETIC_DATUM_ASSUMED_WGS84;COLLECTION_MATCH_FUZZY"
-91.51447,15.86253,"Brachythecium ruderale",1930215936,"NW portion of Guatemala, N of San Mateo Ixtatan. Cordillera Los Cuchumatanes.","GTM",NA,2007,"PRESERVED_SPECIMEN","GEODETIC_DATUM_ASSUMED_WGS84;COLLECTION_MATCH_FUZZY"
-70.22,18.5,"Brachythecium ruderale",1930464974,"Mano Matuey, 12 km from Cambito Garabito on road to El Cacao.","DOM",NA,1981,"PRESERVED_SPECIMEN","GEODETIC_DATUM_ASSUMED_WGS84;COLLECTION_MATCH_FUZZY"
-78.3,0.25,"Brachythecium ruderale",1927903252,"ca. 2 km west of San Jose de Quichinche on road to Quiroga.","ECU",NA,1985,"PRESERVED_SPECIMEN","GEODETIC_DATUM_ASSUMED_WGS84;COLLECTION_MATCH_FUZZY"
-63.53,-19.1,"Brachythecium ruderale",1928141512,"along quebrada-río flowing through narrow ravine from YPFB Campamento Tatarenda to Río Grande. 28 km SW of Abapo.","BOL",NA,1984,"PRESERVED_SPECIMEN","GEODETIC_DATUM_ASSUMED_WGS84;COLLECTION_MATCH_FUZZY"
-78.18,-0.33,"Brachythecium ruderale",1928530031,"ca. 25 km southeast of Pifo; Paramo Antizana.","ECU",NA,1985,"PRESERVED_SPECIMEN","GEODETIC_DATUM_ASSUMED_WGS84;COLLECTION_MATCH_FUZZY"
-99.7,18.77,"Brachythecium ruderale",1930443957,"Barranca de Malinaltenango; in canyon of río Meyuca","MEX",NA,1995,"PRESERVED_SPECIMEN","GEODETIC_DATUM_ASSUMED_WGS84;COLLECTION_MATCH_FUZZY"
-77.53,18.08,"Brachythecium ruderale",1929605475,"Marshall's Pen, 3 mi WNW of Mandeville.","JAM",NA,1981,"PRESERVED_SPECIMEN","GEODETIC_DATUM_ASSUMED_WGS84;COLLECTION_MATCH_FUZZY"
-64.38,-21.43,"Brachythecium ruderale",1928656271,"S-facing lower slopes of Cerro Sarzo where it meets río Canaletas 1 km S of Estancia Palca Grande. 4 km NW of Canaletas.","BOL",NA,1984,"PRESERVED_SPECIMEN","GEODETIC_DATUM_ASSUMED_WGS84;COLLECTION_MATCH_FUZZY"
-65.38,-17.88,"Brachythecium ruderale",1928994047,"Arani-Mizque jeep road along Quebrada Lakhasa 4 km from its junction with Río Callejas. 8 km NNW of Mizque.","BOL",NA,1984,"PRESERVED_SPECIMEN","GEODETIC_DATUM_ASSUMED_WGS84;COLLECTION_MATCH_FUZZY"
-70.366667,18.466667,"Brachythecium ruderale",2515710227,"","DOM",NA,1982,"PRESERVED_SPECIMEN","INSTITUTION_MATCH_FUZZY;INSTITUTION_COLLECTION_MISMATCH"
-64.47,-22.47,"Brachythecium ruderale",1928018468,"gentle lower slopes of Serranía San Telmo where it meets the Río Bermejo 2 km S of Communidad Salado, 5 km S of Nogalito, near BM 697","BOL",NA,1984,"PRESERVED_SPECIMEN","GEODETIC_DATUM_ASSUMED_WGS84;COLLECTION_MATCH_FUZZY"
-72.2,19.6,"Brachythecium ruderale",1928686515,"Near Milot, along trail from parking lot to Citadelle Laferrière.","HTI",NA,1982,"PRESERVED_SPECIMEN","GEODETIC_DATUM_ASSUMED_WGS84;COLLECTION_MATCH_FUZZY"
-65.35,-26.9,"Brachythecium ruderale",1928426867,"Cumbres de San Javier, WSW of San Miguel de Tucuman on Ruta Provincial 338, E of Villa Nougues.","ARG",NA,1994,"PRESERVED_SPECIMEN","GEODETIC_DATUM_ASSUMED_WGS84;COLLECTION_MATCH_FUZZY"
-67.75,-16.58,"Brachythecium ruderale",1928723200,"lower slope W of Río Challiri 0.5 km S of Estancia Totoral and 7 km NE of summit of Nevado Illamani","BOL",NA,1983,"PRESERVED_SPECIMEN","GEODETIC_DATUM_ASSUMED_WGS84;COLLECTION_MATCH_FUZZY"
-67.2,-16.95,"Brachythecium ruderale",1930384850,"'Quisma Huacullani'. Lower slope of Quisma Huacullani SW of mouth of Río Irupaya along W bank of Río Khatu. 3 km NE of Quime.","BOL",NA,1983,"PRESERVED_SPECIMEN","GEODETIC_DATUM_ASSUMED_WGS84;COLLECTION_MATCH_FUZZY"
-70.5834,18.652188,"Brachythecium ruderale",1930851523,"Near the pyramid, ca. 13 km from Valle Nuevo on the road to San José de Ocoa","DOM",NA,1967,"PRESERVED_SPECIMEN","COLLECTION_MATCH_FUZZY"
-67.970833,-14.349167,"Brachythecium ruderale",4032090300,"Parque Nacional Madidi, río Tuichi, arroyo Rudidi.","BOL",NA,2016,"PRESERVED_SPECIMEN","OCCURRENCE_STATUS_INFERRED_FROM_INDIVIDUAL_COUNT;COORDINATE_ROUNDED;GEODETIC_DATUM_ASSUMED_WGS84;INSTITUTION_MATCH_FUZZY;COLLECTION_MATCH_NONE"
-64.285278,-20.8025,"Brachythecium ruderale",4031676866,"Orocoté, ca. 5 km al norte de El Palmar. Fragmentos de Bosque Tucumano-Boliviano, con Myrtáceas, Leguminosas. <2971-3000>","BOL",NA,2007,"PRESERVED_SPECIMEN","OCCURRENCE_STATUS_INFERRED_FROM_INDIVIDUAL_COUNT;COORDINATE_ROUNDED;GEODETIC_DATUM_ASSUMED_WGS84;INSTITUTION_MATCH_FUZZY;COLLECTION_MATCH_NONE"
-64.2725,-21.0925,"Brachythecium ruderale",4031665577,"5 km al noroeste de Las Abras. Cañón Pirua, sector La Lima. Bosque Tucumano-Boliviano: Cedrela lilloi, Juglans australis, Chrysophyllum gonocarpum. <1585-1595>","BOL",NA,2005,"PRESERVED_SPECIMEN","OCCURRENCE_STATUS_INFERRED_FROM_INDIVIDUAL_COUNT;GEODETIC_DATUM_ASSUMED_WGS84;INSTITUTION_MATCH_FUZZY;COLLECTION_MATCH_NONE"
-75.733333,5.533333,"Brachythecium ruderale",4031984322,"Sur de Jardín 5-10 km. Bosque muy humédo montano. <15695-15726>","COL",NA,1987,"PRESERVED_SPECIMEN","OCCURRENCE_STATUS_INFERRED_FROM_INDIVIDUAL_COUNT;COORDINATE_ROUNDED;GEODETIC_DATUM_ASSUMED_WGS84;INSTITUTION_MATCH_FUZZY;COLLECTION_MATCH_NONE"
-88.933333,16.733333,"Brachythecium ruderale",1261619189,"Along the Monkey Tail Branch, vicinity of Las Cuevas Field Station. <18241-18276>","BLZ",NA,1996,"PRESERVED_SPECIMEN","OCCURRENCE_STATUS_INFERRED_FROM_INDIVIDUAL_COUNT;COORDINATE_ROUNDED;GEODETIC_DATUM_ASSUMED_WGS84;INSTITUTION_MATCH_FUZZY;COLLECTION_MATCH_NONE"
-63.483333,10.2,"Brachythecium ruderale",1261646548,"NE facing mountain slope E of Santa Ines (vicinity of Caripe).","VEN",NA,1967,"PRESERVED_SPECIMEN","OCCURRENCE_STATUS_INFERRED_FROM_INDIVIDUAL_COUNT;COORDINATE_ROUNDED;GEODETIC_DATUM_ASSUMED_WGS84;INSTITUTION_MATCH_FUZZY;COLLECTION_MATCH_NONE"
-77.86666,-5.94472,"Brachythecium ruderale",1261523424,"Trail above highway to Chiclayo & Río Utcubamba. 3-10 km NW of Pedro Ruiz Gallo. Mixed bushes & low trees interspersed with clearings for corn and yuca. Black soil.","PER",NA,1981,"PRESERVED_SPECIMEN","OCCURRENCE_STATUS_INFERRED_FROM_INDIVIDUAL_COUNT;GEODETIC_DATUM_ASSUMED_WGS84;INSTITUTION_MATCH_FUZZY;COLLECTION_MATCH_NONE"
-78.066667,-7.8,"Brachythecium ruderale",2268836431,"La Cabána between Huamachuco and Cajabamba at river Agucasa. <6041-6110>","PER",NA,1973,"PRESERVED_SPECIMEN","OCCURRENCE_STATUS_INFERRED_FROM_INDIVIDUAL_COUNT;COORDINATE_ROUNDED;GEODETIC_DATUM_ASSUMED_WGS84;INSTITUTION_MATCH_FUZZY;COLLECTION_MATCH_NONE"
-77.933333,18.466667,"Brachythecium ruderale",2268996672,"Montego Bay, between Catadupa and Moche. <8193-8222>","JAM",NA,1973,"PRESERVED_SPECIMEN","OCCURRENCE_STATUS_INFERRED_FROM_INDIVIDUAL_COUNT;COORDINATE_ROUNDED;COUNTRY_MISMATCH;GEODETIC_DATUM_ASSUMED_WGS84;INSTITUTION_MATCH_FUZZY;COLLECTION_MATCH_NONE"
-64.233333,-17.833333,"Brachythecium ruderale",4031767241,"Municipal de la Pampa Grande, 30 km norte de Los Negros, al lado de Ríío Santa Rosa (5 km norte de Santa Rosa de Lima). Bosque montano secundario. <20945-20973>","BOL",NA,2001,"PRESERVED_SPECIMEN","OCCURRENCE_STATUS_INFERRED_FROM_INDIVIDUAL_COUNT;COORDINATE_ROUNDED;GEODETIC_DATUM_ASSUMED_WGS84;INSTITUTION_MATCH_FUZZY;COLLECTION_MATCH_NONE"
-76.018611,-9.299444,"Brachythecium ruderale",2268837387,"Tingo Maria. <7765-7916>","PER",NA,1973,"PRESERVED_SPECIMEN","OCCURRENCE_STATUS_INFERRED_FROM_INDIVIDUAL_COUNT;COORDINATE_ROUNDED;GEODETIC_DATUM_ASSUMED_WGS84;INSTITUTION_MATCH_FUZZY;COLLECTION_MATCH_NONE"
-69.070833,-14.818889,"Brachythecium ruderale",4032052573,"Area Natural de Manejo Integrado Apolobamba, Pelechuco, saliendo por el camino a Piara. Matorrales, barbechos y bosques secundarios del bosque yungas en ceja de monte.","BOL",NA,2006,"PRESERVED_SPECIMEN","OCCURRENCE_STATUS_INFERRED_FROM_INDIVIDUAL_COUNT;COORDINATE_ROUNDED;GEODETIC_DATUM_ASSUMED_WGS84;INSTITUTION_MATCH_FUZZY;COLLECTION_MATCH_NONE"
-64.604167,-18.765,"Brachythecium ruderale",4032137644,"Comunidad de Mojocoya. Bosque seco con galerías deciduas, con Tipuana tipu, Myroxylon peruiferum, Tripodantus acutifolius, Duranta serratifolia. <2344-2354>","BOL",NA,2007,"PRESERVED_SPECIMEN","OCCURRENCE_STATUS_INFERRED_FROM_INDIVIDUAL_COUNT;COORDINATE_ROUNDED;GEODETIC_DATUM_ASSUMED_WGS84;INSTITUTION_MATCH_FUZZY;COLLECTION_MATCH_NONE"
-64.458889,-20.220278,"Brachythecium ruderale",4031662609,"Quebrada húmeda al SE de Azurduy, a hora y media camino al valle. Fragmentos de bosque montano de Tucumano-Boliviano; piso superior con Podocarpus, Alnus. <2581-2520>","BOL",NA,2007,"PRESERVED_SPECIMEN","OCCURRENCE_STATUS_INFERRED_FROM_INDIVIDUAL_COUNT;COORDINATE_ROUNDED;GEODETIC_DATUM_ASSUMED_WGS84;INSTITUTION_MATCH_FUZZY;COLLECTION_MATCH_NONE"
-78.416667,-7.816667,"Brachythecium ruderale",2268835888,"Usquil. Along the rd. to Otuzco. <5274-5321>","PER",NA,1973,"PRESERVED_SPECIMEN","OCCURRENCE_STATUS_INFERRED_FROM_INDIVIDUAL_COUNT;COORDINATE_ROUNDED;GEODETIC_DATUM_ASSUMED_WGS84;INSTITUTION_MATCH_FUZZY;COLLECTION_MATCH_NONE"
-92.243889,14.978889,"Brachythecium ruderale",2268860364,"4 miles N of Tapachula, along road to Nueva Alemán.","MEX",NA,1977,"PRESERVED_SPECIMEN","OCCURRENCE_STATUS_INFERRED_FROM_INDIVIDUAL_COUNT;COORDINATE_ROUNDED;GEODETIC_DATUM_ASSUMED_WGS84;INSTITUTION_MATCH_FUZZY;COLLECTION_MATCH_NONE"
-72.533333,-13.15,"Brachythecium ruderale",1261675838,"Macchu Picchu ruins ca. 3 km from Caliente.","PER",NA,1984,"PRESERVED_SPECIMEN","OCCURRENCE_STATUS_INFERRED_FROM_INDIVIDUAL_COUNT;COORDINATE_ROUNDED;GEODETIC_DATUM_ASSUMED_WGS84;INSTITUTION_MATCH_FUZZY;COLLECTION_MATCH_NONE"
-87.8,14.57,"Brachythecium ruderale",1931015767,"Rio Selguapa, ca 4 km southeast of Siguatepeque","HND",NA,1993,"PRESERVED_SPECIMEN","GEODETIC_DATUM_ASSUMED_WGS84;COLLECTION_MATCH_FUZZY"
-65.27,-17.45,"Brachythecium ruderale",1928626324,"'Río Monte Puncu'. Yungas de Totora following the Río Monte Puncu from the cumbre to 5 km N of Estancia Sehuenca.","BOL",NA,1983,"PRESERVED_SPECIMEN","GEODETIC_DATUM_ASSUMED_WGS84;COLLECTION_MATCH_FUZZY"
-64.2,-19.45,"Brachythecium ruderale",1930443617,"Headwater stream of Río Barro on S-facing slope of Mount Padilla 3071, 20 km SE of Padilla.","BOL",NA,1984,"PRESERVED_SPECIMEN","GEODETIC_DATUM_ASSUMED_WGS84;COLLECTION_MATCH_FUZZY"
-86.85,15.666667,"Brachythecium ruderale",4061076484,"Pico Bonito National Park. Along Rio Bonito in vicinity of confluence camp. <17439-17476>","HND",NA,1996,"PRESERVED_SPECIMEN","OCCURRENCE_STATUS_INFERRED_FROM_INDIVIDUAL_COUNT;COORDINATE_ROUNDED;GEODETIC_DATUM_ASSUMED_WGS84;INSTITUTION_MATCH_NONE"
-64.025278,-18.711111,"Brachythecium ruderale",1257951127,"Kasamonte, 20 km al sur de Vallegrande; camino Vallegrande y Loma Larga desviando al lado derecho, del desvio a 5-7 km. <1303-1311>","BOL",NA,2011,"PRESERVED_SPECIMEN","OCCURRENCE_STATUS_INFERRED_FROM_INDIVIDUAL_COUNT;COORDINATE_ROUNDED;GEODETIC_DATUM_ASSUMED_WGS84;DIFFERENT_OWNER_INSTITUTION"
-89.166667,14.866667,"Brachythecium ruderale",4062139470,"Along Quebrada Sesesmil, ca 4.3 km north of Copan Ruinas along road to Agua Caliente. <17675-17723>","HND",NA,1996,"PRESERVED_SPECIMEN","OCCURRENCE_STATUS_INFERRED_FROM_INDIVIDUAL_COUNT;COORDINATE_ROUNDED;GEODETIC_DATUM_ASSUMED_WGS84;INSTITUTION_MATCH_NONE"
-63.898333,-18.485833,"Brachythecium ruderale",1261794386,"1 km sur de Tierras Nuevas. Zona de Tucumano-Boliviano secundario abierto con roca arenoso. <24556-24567>","BOL",NA,2006,"PRESERVED_SPECIMEN","OCCURRENCE_STATUS_INFERRED_FROM_INDIVIDUAL_COUNT;COORDINATE_ROUNDED;GEODETIC_DATUM_ASSUMED_WGS84;DIFFERENT_OWNER_INSTITUTION"
-68.699444,-15.210556,"Brachythecium ruderale",1261724783,"Charazani, ca. 12 km antes de llegar al pueblo, por la carretera a Apolo.","BOL",NA,2002,"PRESERVED_SPECIMEN","OCCURRENCE_STATUS_INFERRED_FROM_INDIVIDUAL_COUNT;COORDINATE_ROUNDED;GEODETIC_DATUM_ASSUMED_WGS84;DIFFERENT_OWNER_INSTITUTION"
-70.5,8.933333,"Brachythecium ruderale",2268837164,"Páramo de Guiriguay, arriba del pueblo de Las Piedras; entre el Río Burate y Peñas Blancas.","VEN",NA,1985,"PRESERVED_SPECIMEN","OCCURRENCE_STATUS_INFERRED_FROM_INDIVIDUAL_COUNT;COORDINATE_ROUNDED;GEODETIC_DATUM_ASSUMED_WGS84;DIFFERENT_OWNER_INSTITUTION"
-75.3925,4.477,"Brachythecium ruderale",3780790354,"Volcán Cerro Machín","COL",NA,2019,"HUMAN_OBSERVATION",""
-73.933333,4.55,"Brachythecium ruderale",4061953205,"Choachi, 2 km NW de Choachi.","COL",NA,1965,"PRESERVED_SPECIMEN","OCCURRENCE_STATUS_INFERRED_FROM_INDIVIDUAL_COUNT;COORDINATE_ROUNDED;GEODETIC_DATUM_ASSUMED_WGS84;DIFFERENT_OWNER_INSTITUTION"
-70.296667,9.349722,"Brachythecium ruderale",2268836643,"Carretera vieja entre Trujillo y Boconó, entre Urbina y San Rafael, 30 km from Boconó.","VEN",NA,1966,"PRESERVED_SPECIMEN","OCCURRENCE_STATUS_INFERRED_FROM_INDIVIDUAL_COUNT;COORDINATE_ROUNDED;GEODETIC_DATUM_ASSUMED_WGS84;DIFFERENT_OWNER_INSTITUTION"
-73.916667,4.75,"Brachythecium ruderale",1261694220,"Santa Fe De Bogota, La Calera, Páramo de Palacio.","COL",NA,1983,"PRESERVED_SPECIMEN","OCCURRENCE_STATUS_INFERRED_FROM_INDIVIDUAL_COUNT;COORDINATE_ROUNDED;GEODETIC_DATUM_ASSUMED_WGS84;INSTITUTION_MATCH_NONE"
-65.391111,-18.95,"Brachythecium ruderale",1261819362,"Comunidad de Cajamarca, ca. 30 km al noroeste de Sucre, camino a Chataquila. Puna húmeda con Alnus acuminata, Polylepis, helechos, poáceas. <2440-2463>","BOL",NA,2007,"PRESERVED_SPECIMEN","OCCURRENCE_STATUS_INFERRED_FROM_INDIVIDUAL_COUNT;COORDINATE_ROUNDED;GEODETIC_DATUM_ASSUMED_WGS84;DIFFERENT_OWNER_INSTITUTION"
-63.656667,-21.858333,"Brachythecium ruderale",1258048103,"Municipio de Yacuiba, Aguairenda, a 3 km del pueblo en dirección nor-oeste. <3370-3404>","BOL",NA,2012,"PRESERVED_SPECIMEN","OCCURRENCE_STATUS_INFERRED_FROM_INDIVIDUAL_COUNT;COORDINATE_ROUNDED;GEODETIC_DATUM_ASSUMED_WGS84;DIFFERENT_OWNER_INSTITUTION"
