"lon","lat","species","gbifID","locality","countryCode","coordinateUncertaintyInMeters","year","basisOfRecord","issue"
-85.97,15.17,"Brachythecium ruderale",3467162175,"Sierra de Algalta, Montana Babilonia trail from La Chorrera to lower gate, 12 km E of Gualaco.","HND",NA,1992,"PRESERVED_SPECIMEN","GEODETIC_DATUM_ASSUMED_WGS84;CONTINENT_DERIVED_FROM_COORDINATES;CONTINENT_INVALID"
-88.63,14.55,"Brachythecium ruderale",3467154008,"Montana de Celaque. Along ridge above La Planta Electrica Statione, 7.5 km SW of Gracias. On bark at base of Oak.","HND",NA,1992,"PRESERVED_SPECIMEN","GEODETIC_DATUM_ASSUMED_WGS84;CONTINENT_DERIVED_FROM_COORDINATES;CONTINENT_INVALID"
-64.32,-22.63,"Brachythecium ruderale",1928315837,"Headwater area of Quebrada Toro, 1 km SE of YPFB Campo Toro, 11 km N of Bermejo.","BOL",NA,1984,"PRESERVED_SPECIMEN","GEODETIC_DATUM_ASSUMED_WGS84;COLLECTION_MATCH_FUZZY"
-106.3839,35.1697,"Brachythecium ruderale",1930184404,"Sandia Mountains, E of Albuquerque along NM 536, Cibola National Forest, Cienega Spring Trail no. 148","USA",NA,2001,"PRESERVED_SPECIMEN","GEODETIC_DATUM_ASSUMED_WGS84;COLLECTION_MATCH_FUZZY"
-66.58181,18.16823,"Brachythecium ruderale",1928896994,"Cordillera Central, Caribbean National Forest, Toro Negro Division, along Hwy 143, 3.5 mi E of junction with Hwy 139.","PRI",NA,1981,"PRESERVED_SPECIMEN","GEODETIC_DATUM_ASSUMED_WGS84;COLLECTION_MATCH_FUZZY"
-78.33,0.37,"Brachythecium ruderale",1928740920,"E. Side of Cerro Cotacachi, NW of Cotacachi","ECU",NA,1978,"PRESERVED_SPECIMEN","GEODETIC_DATUM_ASSUMED_WGS84;COLLECTION_MATCH_FUZZY"
-77.676763,18.332879,"Brachythecium ruderale",1929014516,"Cockpit Country, along mountain road to highway.","JAM",3353,1968,"PRESERVED_SPECIMEN","COLLECTION_MATCH_FUZZY"
-71.72,18.72,"Brachythecium ruderale",1927769769,"La Estrelleta. Sierra de Neiba, along road from La Descubierta to Hondo Valle, 15 km N of Angel Féliz.","DOM",NA,1981,"PRESERVED_SPECIMEN","GEODETIC_DATUM_ASSUMED_WGS84;COLLECTION_MATCH_FUZZY"
-64.32,-21.43,"Brachythecium ruderale",1929084233,"along Río Tambo where headwaters flowing from Cerro Alto Pinos meets the Tarija-Entre Ríos road. 5 km SW of Narvaez.","BOL",NA,1984,"PRESERVED_SPECIMEN","GEODETIC_DATUM_ASSUMED_WGS84;COLLECTION_MATCH_FUZZY"
-99.36658,19.32356,"Brachythecium ruderale",1930227269,"La Cañada, al SW de Huixquilucan.","MEX",NA,2010,"PRESERVED_SPECIMEN","GEODETIC_DATUM_ASSUMED_WGS84;COLLECTION_MATCH_FUZZY"
-71.63,18.35,"Brachythecium ruderale",1930435205,"Along road ca. 6 km NE of El Aguacate.","DOM",NA,1981,"PRESERVED_SPECIMEN","GEODETIC_DATUM_ASSUMED_WGS84;COLLECTION_MATCH_FUZZY"
-79.02,-3.12,"Brachythecium ruderale",1931258851,"Cerro Urucaca, ca. 2 km. S. of Cumbe, S. of Cuenca","ECU",NA,1978,"PRESERVED_SPECIMEN","GEODETIC_DATUM_ASSUMED_WGS84;COLLECTION_MATCH_FUZZY"
-64.48,-19.17,"Brachythecium ruderale",1929728624,"S-facing slope of Cerro Coca Coca along Río Sillani. 8 km W of Padilla.","BOL",NA,1984,"PRESERVED_SPECIMEN","GEODETIC_DATUM_ASSUMED_WGS84;COLLECTION_MATCH_FUZZY"
-75.626877,20.011466,"Brachythecium ruderale",1930566556,"La Gran Piedra","CUB",NA,1982,"PRESERVED_SPECIMEN","GEODETIC_DATUM_ASSUMED_WGS84;COLLECTION_MATCH_FUZZY"
-67.18,-16.8,"Brachythecium ruderale",1929583567,"slopes on the N side of Río de La Plata along an unmarked trail from Rancho Sihuinga to an area above Rancho Alfafiani, trail begins 3 km N, 10° E of Licoma Pampa and followed to 3 km E, 20° N of Licoma Pampa","BOL",NA,1986,"PRESERVED_SPECIMEN","GEODETIC_DATUM_ASSUMED_WGS84;COLLECTION_MATCH_FUZZY"
-44.7,-22.37,"Brachythecium ruderale",1927987123,"Parque Nacional do Itatiaia, Vale dos Lirios, along entry road near border with Minas Gerais near Km 15.","BRA",NA,1991,"PRESERVED_SPECIMEN","GEODETIC_DATUM_ASSUMED_WGS84;COLLECTION_MATCH_FUZZY"
-77.55,17.9,"Brachythecium ruderale",1930466199,"2.7 mi N of Plowden Hill on road to Rest Store.","JAM",NA,1981,"PRESERVED_SPECIMEN","GEODETIC_DATUM_ASSUMED_WGS84;COLLECTION_MATCH_FUZZY"
-71.24316,18.11273,"Brachythecium ruderale",1930983875,"Monteada Nueva, near Polo.","DOM",NA,1976,"PRESERVED_SPECIMEN","GEODETIC_DATUM_ASSUMED_WGS84;COLLECTION_MATCH_FUZZY"
-90.87664,14.53911,"Brachythecium ruderale",2542580050,"Volcán Acatenango, along road from Parramos to Yepocapa, above Aldea Chichoy Bajo, approximately 8.65 km W of San Miguel Dueñas","GTM",NA,2013,"PRESERVED_SPECIMEN","GEODETIC_DATUM_ASSUMED_WGS84;COLLECTION_MATCH_FUZZY"
-63.658333,-21.666111,"Brachythecium ruderale",4061018886,"Bolsa Chica, a 6 km al SE de Nazareno, bajando por la antigua senda hacia el puesto Sanandita. Bosque premontano Tucumano-Boliviano (Eugenia, Jacaranda). <1-65>","BOL",NA,2007,"PRESERVED_SPECIMEN","OCCURRENCE_STATUS_INFERRED_FROM_INDIVIDUAL_COUNT;COORDINATE_ROUNDED;GEODETIC_DATUM_ASSUMED_WGS84;DIFFERENT_OWNER_INSTITUTION"
-77.233333,1.266667,"Brachythecium ruderale",2268898329,"Serranía de Morasurco.","COL",NA,1998,"PRESERVED_SPECIMEN","OCCURRENCE_STATUS_INFERRED_FROM_INDIVIDUAL_COUNT;COORDINATE_ROUNDED;GEODETIC_DATUM_ASSUMED_WGS84;DIFFERENT_OWNER_INSTITUTION"
-64.323611,-18.411389,"Brachythecium ruderale",1257866946,"Cincho Redondo (Tucarillo- Moro Moro), hubicado a 7 km de Moro Moro, ubicado al lado noroeste de Vallegrande a 28 km. <360-411B>","BOL",NA,2011,"PRESERVED_SPECIMEN","OCCURRENCE_STATUS_INFERRED_FROM_INDIVIDUAL_COUNT;COORDINATE_ROUNDED;GEODETIC_DATUM_ASSUMED_WGS84;DIFFERENT_OWNER_INSTITUTION"
-63.846944,-20.512778,"Brachythecium ruderale",1261812670,"Comunidad Villa Hermosa 5 hrs. en bus, Monteagudo-Rosario del Ingre. Cañon Aemi con doseles de 15-20 m. Juglans sp., Lauráceas. <2812-2830>","BOL",NA,2007,"PRESERVED_SPECIMEN","OCCURRENCE_STATUS_INFERRED_FROM_INDIVIDUAL_COUNT;COORDINATE_ROUNDED;GEODETIC_DATUM_ASSUMED_WGS84;DIFFERENT_OWNER_INSTITUTION"
-63.923611,-18.664167,"Brachythecium ruderale",1261824900,"Dionisio. Bosque Tucumano-Boliviano. Vegetación intervenida por agricultura y ganadería. Quebrada con agua permanente. Suelo limoso. <92-102>","BOL",NA,2008,"PRESERVED_SPECIMEN","OCCURRENCE_STATUS_INFERRED_FROM_INDIVIDUAL_COUNT;COORDINATE_ROUNDED;GEODETIC_DATUM_ASSUMED_WGS84;DIFFERENT_OWNER_INSTITUTION"
-63.673056,-21.667222,"Brachythecium ruderale",4060984490,"Ca. 6 km al SE de la comunidad de Nazareno con exposición este. Bosque premontano de Tucumano-Boliviano, con Eugenia, Myrcianthes, Tabebuia. <128-168>","BOL",NA,2007,"PRESERVED_SPECIMEN","OCCURRENCE_STATUS_INFERRED_FROM_INDIVIDUAL_COUNT;COORDINATE_ROUNDED;GEODETIC_DATUM_ASSUMED_WGS84;DIFFERENT_OWNER_INSTITUTION"
-63.726944,-18.699444,"Brachythecium ruderale",1257915214,"A 5 km de Chullcos. <759-833>","BOL",NA,2011,"PRESERVED_SPECIMEN","OCCURRENCE_STATUS_INFERRED_FROM_INDIVIDUAL_COUNT;COORDINATE_ROUNDED;GEODETIC_DATUM_ASSUMED_WGS84;DIFFERENT_OWNER_INSTITUTION"
-86.456333,13.751639,"Brachythecium ruderale",2268863383,"15.3 km N of Mozonte (highway), taking left fork; disturbed cloud forest, on schist","NIC",NA,2017,"PRESERVED_SPECIMEN","OCCURRENCE_STATUS_INFERRED_FROM_INDIVIDUAL_COUNT;COORDINATE_ROUNDED;GEODETIC_DATUM_ASSUMED_WGS84;DIFFERENT_OWNER_INSTITUTION"
-63.733333,-19.866667,"Brachythecium ruderale",1261811000,"West slope of Serrania Inca Huasi. 4 km E of NE from Muyupampa (Vaca Guzman).","BOL",NA,1984,"PRESERVED_SPECIMEN","OCCURRENCE_STATUS_INFERRED_FROM_INDIVIDUAL_COUNT;COORDINATE_ROUNDED;GEODETIC_DATUM_ASSUMED_WGS84;DIFFERENT_OWNER_INSTITUTION"
-63.448889,-21.069167,"Brachythecium ruderale",4061218248,"Municipio de Villamontes, comunidad de Tarairi, 10 km de ida al área protegida del Aguarague. <3504-3536>","BOL",NA,2013,"PRESERVED_SPECIMEN","OCCURRENCE_STATUS_INFERRED_FROM_INDIVIDUAL_COUNT;COORDINATE_ROUNDED;GEODETIC_DATUM_ASSUMED_WGS84;DIFFERENT_OWNER_INSTITUTION"
-63.666667,-18.133333,"Brachythecium ruderale",1261721600,"Municipio Samaipata. Ca. 1 km sur de La Negra (Km 86 carretera Santa Cruz – Cochabamba), 6 km este. Bosque tucumano-boliviano secundario, al lado de quebrada. <21682-21689>","BOL",NA,2002,"PRESERVED_SPECIMEN","OCCURRENCE_STATUS_INFERRED_FROM_INDIVIDUAL_COUNT;COORDINATE_ROUNDED;GEODETIC_DATUM_ASSUMED_WGS84;DIFFERENT_OWNER_INSTITUTION"
-70.966667,8.633333,"Brachythecium ruderale",2268836706,"Quebrada Gavidia, al sur de Mucuchíes, entre la peña La Virgen y el puente de El Portrerito, ca. del pueblo Gavidia.","VEN",NA,1985,"PRESERVED_SPECIMEN","OCCURRENCE_STATUS_INFERRED_FROM_INDIVIDUAL_COUNT;COORDINATE_ROUNDED;GEODETIC_DATUM_ASSUMED_WGS84;DIFFERENT_OWNER_INSTITUTION"
-64.629445,-22.183056,"Brachythecium ruderale",1261762559,"Reserva Natural Alarachi. Zona Alarachi. La Lima, aguas arriba de la Quebrada Los Pinos. Bosque semidecíduo, estacional Tucumano-Boliviano. <23235-23293>","BOL",NA,2004,"PRESERVED_SPECIMEN","OCCURRENCE_STATUS_INFERRED_FROM_INDIVIDUAL_COUNT;COORDINATE_ROUNDED;GEODETIC_DATUM_ASSUMED_WGS84;DIFFERENT_OWNER_INSTITUTION"
-69.6,9.65,"Brachythecium ruderale",2268836574,"Dto. Jiménez: Parque Nacional Yacambú, Sierra de Portuguesa.","VEN",NA,1978,"PRESERVED_SPECIMEN","OCCURRENCE_STATUS_INFERRED_FROM_INDIVIDUAL_COUNT;GEODETIC_DATUM_ASSUMED_WGS84;DIFFERENT_OWNER_INSTITUTION"
-77.833333,-0.383333,"Brachythecium ruderale",1261694053,"Creek 4 km NW of Borja","ECU",NA,1980,"PRESERVED_SPECIMEN","OCCURRENCE_STATUS_INFERRED_FROM_INDIVIDUAL_COUNT;COORDINATE_ROUNDED;GEODETIC_DATUM_ASSUMED_WGS84;DIFFERENT_OWNER_INSTITUTION"
-63.7,-19.8,"Brachythecium ruderale",1261710417,"Canton Villa Vaco Guzman. Serrania Inca Huasi. Ca. 15 km nordeste de Villa Vaco Guzman. Bosque montano de Tucumano-Boliviano. <20675-20709>","BOL",NA,2001,"PRESERVED_SPECIMEN","OCCURRENCE_STATUS_INFERRED_FROM_INDIVIDUAL_COUNT;GEODETIC_DATUM_ASSUMED_WGS84;DIFFERENT_OWNER_INSTITUTION"
-63.433333,-17.933333,"Brachythecium ruderale",4061527800,"Espejillos, entrando 20 km al oeste de San José, Km 24 carretera antigua a Cochabamba.","BOL",NA,1992,"PRESERVED_SPECIMEN","OCCURRENCE_STATUS_INFERRED_FROM_INDIVIDUAL_COUNT;COORDINATE_ROUNDED;GEODETIC_DATUM_ASSUMED_WGS84;DIFFERENT_OWNER_INSTITUTION"
-66.835,-16.951667,"Brachythecium ruderale",1257764921,"Municipio de Independencia. En la subida de Sivingani a Independencia, localidad de Wacaplaza, alrededor del camino. <2134-2147a>","BOL",NA,2010,"PRESERVED_SPECIMEN","OCCURRENCE_STATUS_INFERRED_FROM_INDIVIDUAL_COUNT;COORDINATE_ROUNDED;GEODETIC_DATUM_ASSUMED_WGS84;DIFFERENT_OWNER_INSTITUTION"
-63.855833,-18.783611,"Brachythecium ruderale",1258004704,"","BOL",NA,2013,"PRESERVED_SPECIMEN","OCCURRENCE_STATUS_INFERRED_FROM_INDIVIDUAL_COUNT;COORDINATE_ROUNDED;GEODETIC_DATUM_ASSUMED_WGS84;DIFFERENT_OWNER_INSTITUTION"
-74.133333,4.466667,"Brachythecium ruderale",2268836675,"Santa Fe De Bogota, Usme, 8 km de Usme.","COL",NA,1965,"PRESERVED_SPECIMEN","OCCURRENCE_STATUS_INFERRED_FROM_INDIVIDUAL_COUNT;COORDINATE_ROUNDED;GEODETIC_DATUM_ASSUMED_WGS84;DIFFERENT_OWNER_INSTITUTION"
-48.476133,-22.204289,"Brachythecium ruderale",1826358275,"","BRA",NA,1983,"PRESERVED_SPECIMEN","GEODETIC_DATUM_ASSUMED_WGS84;INSTITUTION_MATCH_FUZZY;INSTITUTION_COLLECTION_MISMATCH"
-51.25,-29.05,"Brachythecium ruderale",1261728718,"Otávio Rocha, Flores da Cunha.","BRA",NA,1986,"PRESERVED_SPECIMEN","OCCURRENCE_STATUS_INFERRED_FROM_INDIVIDUAL_COUNT;GEODETIC_DATUM_ASSUMED_WGS84;INSTITUTION_MATCH_FUZZY;COLLECTION_MATCH_NONE"
-78.666667,-0.333333,"Brachythecium ruderale",1261675815,"Along road 71 toward Santo Domingo de los Colorados.","ECU",NA,1975,"PRESERVED_SPECIMEN","OCCURRENCE_STATUS_INFERRED_FROM_INDIVIDUAL_COUNT;COORDINATE_ROUNDED;GEODETIC_DATUM_ASSUMED_WGS84;INSTITUTION_MATCH_FUZZY;COLLECTION_MATCH_NONE"
-66.366667,-17.316667,"Brachythecium ruderale",1261677113,"NW slope of Mt. Tunari, near Liriuni Aguas Termales Hotel.","BOL",NA,1972,"PRESERVED_SPECIMEN","OCCURRENCE_STATUS_INFERRED_FROM_INDIVIDUAL_COUNT;COORDINATE_ROUNDED;GEODETIC_DATUM_ASSUMED_WGS84;INSTITUTION_MATCH_FUZZY;COLLECTION_MATCH_NONE"
-63.67222,-18.28361,"Brachythecium ruderale",4032098389,"2 km SE de Bella Vista (18 km SE de carretera Santa Cruz). Sendero de cola de mono, base de cerro. Bosque Chiquitano y Tucumano-Boliviano. <23883-23910>","BOL",NA,2005,"PRESERVED_SPECIMEN","GEODETIC_DATUM_ASSUMED_WGS84;INSTITUTION_MATCH_FUZZY;COLLECTION_MATCH_NONE"
-63.648055,-18.125556,"Brachythecium ruderale",4032136334,"Bermejo, 2.5 km al Oeste de ida a Samaipata en los alrededores de Laguna Volcán, pie de monte y colinas montañosas. Codo de los Andes. <1036-1-1052>","BOL",NA,2007,"PRESERVED_SPECIMEN","OCCURRENCE_STATUS_INFERRED_FROM_INDIVIDUAL_COUNT;COORDINATE_ROUNDED;GEODETIC_DATUM_ASSUMED_WGS84;INSTITUTION_MATCH_FUZZY;COLLECTION_MATCH_NONE"
-64.31472,-19.00722,"Brachythecium ruderale",1261775636,"Al lado de Río Alisos. Ca. 19.1 km Villa Serrano por Nuevo Mundo. Bosque montano de Tucumano-Boliviano, con Podocarpus parlatorei y Alnus acuminata. <23072-23086>","BOL",NA,2004,"PRESERVED_SPECIMEN","GEODETIC_DATUM_ASSUMED_WGS84;INSTITUTION_MATCH_FUZZY;COLLECTION_MATCH_NONE"
-64.239167,-19.959167,"Brachythecium ruderale",4032052638,"4 horas a pie sudoeste de San Lorenzo. Laderas con bosque Tucumano-Boliviano a orillas de río Monomayo. Con Myrtáceas, Sapotáceas, Leguminosas. <2701-2757>","BOL",NA,2007,"PRESERVED_SPECIMEN","OCCURRENCE_STATUS_INFERRED_FROM_INDIVIDUAL_COUNT;COORDINATE_ROUNDED;GEODETIC_DATUM_ASSUMED_WGS84;INSTITUTION_MATCH_FUZZY;COLLECTION_MATCH_NONE"
-67.536389,-16.379722,"Brachythecium ruderale",4031729585,"A 500 m de Huancané, camino a Chulumani.","BOL",NA,2011,"PRESERVED_SPECIMEN","OCCURRENCE_STATUS_INFERRED_FROM_INDIVIDUAL_COUNT;COORDINATE_ROUNDED;GEODETIC_DATUM_ASSUMED_WGS84;INSTITUTION_MATCH_FUZZY;COLLECTION_MATCH_NONE"
-67.848055,-16.640556,"Brachythecium ruderale",4031361698,"Sendero entre Pinaya y el campo base para ascender al nevado Illimani. <2218-2249>","BOL",NA,2013,"PRESERVED_SPECIMEN","OCCURRENCE_STATUS_INFERRED_FROM_INDIVIDUAL_COUNT;COORDINATE_ROUNDED;GEODETIC_DATUM_ASSUMED_WGS84;INSTITUTION_MATCH_FUZZY;COLLECTION_MATCH_NONE"
-86.516667,13.5,"Brachythecium ruderale",1261601776,"Cerro Quisuca, summit and upper slopes; steep rocky slopes.","NIC",NA,1979,"PRESERVED_SPECIMEN","OCCURRENCE_STATUS_INFERRED_FROM_INDIVIDUAL_COUNT;COORDINATE_ROUNDED;GEODETIC_DATUM_ASSUMED_WGS84;INSTITUTION_MATCH_FUZZY;COLLECTION_MATCH_NONE"
-78.566667,-0.616667,"Brachythecium ruderale",1261675802,"Just W of NASA tracking station, on lower, western slope of Loma Rumiñahui Central. 3450 m. 0.37 S, 78.34 W.","ECU",NA,1975,"PRESERVED_SPECIMEN","OCCURRENCE_STATUS_INFERRED_FROM_INDIVIDUAL_COUNT;COORDINATE_ROUNDED;GEODETIC_DATUM_ASSUMED_WGS84;INSTITUTION_MATCH_FUZZY;COLLECTION_MATCH_NONE"
-86.529444,13.753333,"Brachythecium ruderale",1257761363,"Along Panamerican Highway, 5 km NW of Dipilto, valley of Río a Laguna.","NIC",NA,2010,"PRESERVED_SPECIMEN","OCCURRENCE_STATUS_INFERRED_FROM_INDIVIDUAL_COUNT;COORDINATE_ROUNDED;GEODETIC_DATUM_ASSUMED_WGS84;INSTITUTION_MATCH_FUZZY;COLLECTION_MATCH_NONE"
32.833333,-18.283333,"Brachythecium ruderale",1258212571,"Rhodes Inyauga National Park. Along dirt road NNW of Mt. Inyangani. Grove of Leucocidea along stream - Nyamziwa. <10234-10251>","ZWE",NA,1991,"PRESERVED_SPECIMEN","OCCURRENCE_STATUS_INFERRED_FROM_INDIVIDUAL_COUNT;COORDINATE_ROUNDED;GEODETIC_DATUM_ASSUMED_WGS84;INSTITUTION_MATCH_FUZZY;COLLECTION_MATCH_NONE"
-77.9,-6.75,"Brachythecium ruderale",2268836881,"Saullamur, 30 + 32 km behind Balsas in the direction of Leimebamba. <6683-6735>","PER",NA,1973,"PRESERVED_SPECIMEN","OCCURRENCE_STATUS_INFERRED_FROM_INDIVIDUAL_COUNT;GEODETIC_DATUM_ASSUMED_WGS84;INSTITUTION_MATCH_FUZZY;COLLECTION_MATCH_NONE"
-64.525556,-22.034444,"Brachythecium ruderale",4031659442,"Municipio Padacaya. Parque Nacional Tariquia – RNFFT. Achirales, Lomo Laja. Bosque premontano de Tucumano-Boliviano, húmido. <23578-23639>","BOL",NA,2004,"PRESERVED_SPECIMEN","OCCURRENCE_STATUS_INFERRED_FROM_INDIVIDUAL_COUNT;COORDINATE_ROUNDED;GEODETIC_DATUM_ASSUMED_WGS84;INSTITUTION_MATCH_FUZZY;COLLECTION_MATCH_NONE"
-63.471667,-21.196667,"Brachythecium ruderale",4031884140,"Municipio de Villamontes, AMNI Parque Aguarague, comunidad de Chimeo.","BOL",NA,2013,"PRESERVED_SPECIMEN","OCCURRENCE_STATUS_INFERRED_FROM_INDIVIDUAL_COUNT;COORDINATE_ROUNDED;GEODETIC_DATUM_ASSUMED_WGS84;INSTITUTION_MATCH_FUZZY;COLLECTION_MATCH_NONE"
-70.483333,9.35,"Brachythecium ruderale",1261675823,"Dist. Bocono: arriba del pueblo de Santa Rita.","VEN",NA,1976,"PRESERVED_SPECIMEN","OCCURRENCE_STATUS_INFERRED_FROM_INDIVIDUAL_COUNT;COORDINATE_ROUNDED;GEODETIC_DATUM_ASSUMED_WGS84;INSTITUTION_MATCH_FUZZY;COLLECTION_MATCH_NONE"
-72.483333,-13.633333,"Brachythecium ruderale",1261675826,"Macchu Picchu ruins ca. 3 km from Caliente.","PER",NA,1984,"PRESERVED_SPECIMEN","OCCURRENCE_STATUS_INFERRED_FROM_INDIVIDUAL_COUNT;COORDINATE_ROUNDED;GEODETIC_DATUM_ASSUMED_WGS84;INSTITUTION_MATCH_FUZZY;COLLECTION_MATCH_NONE"
-77.914917,-7.047167,"Brachythecium ruderale",1257892494,"Dist. Uchumarca.","PER",NA,2012,"PRESERVED_SPECIMEN","OCCURRENCE_STATUS_INFERRED_FROM_INDIVIDUAL_COUNT;COORDINATE_ROUNDED;GEODETIC_DATUM_ASSUMED_WGS84;INSTITUTION_MATCH_FUZZY;COLLECTION_MATCH_NONE"
-78.216667,-7.15,"Brachythecium ruderale",2268836299,"At the lake at San Nicolas. <6227-6241>","PER",NA,1973,"PRESERVED_SPECIMEN","OCCURRENCE_STATUS_INFERRED_FROM_INDIVIDUAL_COUNT;COORDINATE_ROUNDED;GEODETIC_DATUM_ASSUMED_WGS84;INSTITUTION_MATCH_FUZZY;COLLECTION_MATCH_NONE"
-77.366667,1.866667,"Brachythecium ruderale",4032032053,"Alrededores de La Cascada.","COL",NA,1991,"PRESERVED_SPECIMEN","OCCURRENCE_STATUS_INFERRED_FROM_INDIVIDUAL_COUNT;COORDINATE_ROUNDED;GEODETIC_DATUM_ASSUMED_WGS84;INSTITUTION_MATCH_FUZZY;COLLECTION_MATCH_NONE"
-70.26666,9.23333,"Brachythecium ruderale",1261642890,"Laderas pedregosas a lo largo de río, 2 km debajo del pueblo de Niquitao, arriba de Boconó.","VEN",NA,1971,"PRESERVED_SPECIMEN","GEODETIC_DATUM_ASSUMED_WGS84;INSTITUTION_MATCH_FUZZY;COLLECTION_MATCH_NONE"
-96.483333,17.4,"Brachythecium ruderale",1261722692,"3.3 mi S of Ruta Nacional 175 from a point a few km N of turnoff to San Juan Evangelista Analco.","MEX",NA,1986,"PRESERVED_SPECIMEN","OCCURRENCE_STATUS_INFERRED_FROM_INDIVIDUAL_COUNT;COORDINATE_ROUNDED;GEODETIC_DATUM_ASSUMED_WGS84;INSTITUTION_MATCH_FUZZY;COLLECTION_MATCH_NONE"
-64.085278,-18.518056,"Brachythecium ruderale",4032137408,"Huasacañada, 5 km al N de Vallegrande. Valles internos andinos con vegetación degradada, con relictos de bosques en algunas quebradas.","BOL",NA,1993,"PRESERVED_SPECIMEN","OCCURRENCE_STATUS_INFERRED_FROM_INDIVIDUAL_COUNT;COORDINATE_ROUNDED;GEODETIC_DATUM_ASSUMED_WGS84;INSTITUTION_MATCH_FUZZY;COLLECTION_MATCH_NONE"
-77.65,18.35,"Brachythecium ruderale",1928233270,"Vicinity of Windsor Cave.","JAM",NA,1981,"PRESERVED_SPECIMEN","GEODETIC_DATUM_ASSUMED_WGS84;COLLECTION_MATCH_FUZZY"
-91.05742,14.67533,"Brachythecium ruderale",2542531926,"along road from Patzún to Paraíso Chichoy, 350 m W of Xeatzán Bajo, approlximately 4.3 km W of Patzún","GTM",NA,2013,"PRESERVED_SPECIMEN","GEODETIC_DATUM_ASSUMED_WGS84;COLLECTION_MATCH_FUZZY"
-66.448889,18.404,"Brachythecium ruderale",1931260851,"Between Manatí and Morovis along Hwy 672 at Km 1.1","PRI",NA,1988,"PRESERVED_SPECIMEN","COORDINATE_ROUNDED;GEODETIC_DATUM_ASSUMED_WGS84;COLLECTION_MATCH_FUZZY"
-64.75,-20.6,"Brachythecium ruderale",1931041257,"downriver on Río Santa Elena 1-5 km E of Santa Elena ca. 48km E of Camargo.","BOL",NA,1984,"PRESERVED_SPECIMEN","GEODETIC_DATUM_ASSUMED_WGS84;COLLECTION_MATCH_FUZZY"
-64.03,-19.73,"Brachythecium ruderale",1930789655,"Headwaters of Río Heredia just below pass between Río Heredia and Río Pojorques, 3 km N of Comunidad Heredia and 10 km NW of Monteagudo.","BOL",NA,1984,"PRESERVED_SPECIMEN","GEODETIC_DATUM_ASSUMED_WGS84;COLLECTION_MATCH_FUZZY"
-98.38,19.98,"Brachythecium ruderale",1931151267,"3 km SW de Altepemila, cerca de Cuautepec.","MEX",NA,2010,"PRESERVED_SPECIMEN","GEODETIC_DATUM_ASSUMED_WGS84;COLLECTION_MATCH_FUZZY"
-78.17,-0.42,"Brachythecium ruderale",1930655104,"1 km E of mountain pass on road between Quito and Baeza.","ECU",NA,1983,"PRESERVED_SPECIMEN","GEODETIC_DATUM_ASSUMED_WGS84;COLLECTION_MATCH_FUZZY"
-77.78,18.35,"Brachythecium ruderale",1928769274,"4 mi NE of Maroon Town on road to Spring Vale; on western edge of Cockpit country.","JAM",NA,1981,"PRESERVED_SPECIMEN","GEODETIC_DATUM_ASSUMED_WGS84;COLLECTION_MATCH_FUZZY"
-51.12,-28.88,"Brachythecium ruderale",1927983424,"ca. 3 km N of Rio das Antas on BR 116.","BRA",NA,1984,"PRESERVED_SPECIMEN","GEODETIC_DATUM_ASSUMED_WGS84;COLLECTION_MATCH_FUZZY"
-41.5078,-20.2519,"Brachythecium ruderale",1929315827,"Parque Nacional do Caparaó, Vale Verde","BRA",NA,2013,"PRESERVED_SPECIMEN","GEODETIC_DATUM_ASSUMED_WGS84;COLLECTION_MATCH_FUZZY"
-96.93,19.52,"Brachythecium ruderale",1930335242,"Just S of the city of Xalapa on road to Coatepec, Instituto de Ecología, Rancho Guadeloupe","MEX",NA,1999,"PRESERVED_SPECIMEN","GEODETIC_DATUM_ASSUMED_WGS84;COLLECTION_MATCH_FUZZY"
-96.88,19.38,"Brachythecium ruderale",1928932501,"A 1 km de la poblacion de Zimpizahua, cerca de Coatepec","MEX",NA,1975,"PRESERVED_SPECIMEN","GEODETIC_DATUM_ASSUMED_WGS84;COLLECTION_MATCH_FUZZY"
-66.85,-17.07,"Brachythecium ruderale",1930382821,"slopes of ridge 0.5 km W of Río Khari Barranca and dropping into the river, beginning 1 km upstream from the mouth and following the ridgeline about 5 km upstream, between 2 and 7 km NW of Independencia.","BOL",NA,1986,"PRESERVED_SPECIMEN","GEODETIC_DATUM_ASSUMED_WGS84;COLLECTION_MATCH_FUZZY"
-64.7,-21.85,"Brachythecium ruderale",1930902516,"Quebrada 2 km W of Río Waykho forming ravine on E-facing slope of Cerro Rumi Cancha. 4 km N of Padcaya.","BOL",NA,1984,"PRESERVED_SPECIMEN","GEODETIC_DATUM_ASSUMED_WGS84;COLLECTION_MATCH_FUZZY"
-91.12978,14.60844,"Brachythecium ruderale",3422309704,"Private Reserve Santo Tomás Pachuj, 5 km SE of San Lucas Toliman, along dirt road inside preserve","GTM",NA,2006,"PRESERVED_SPECIMEN","GEODETIC_DATUM_ASSUMED_WGS84;COLLECTION_MATCH_FUZZY"
-79.17,-4.05,"Brachythecium ruderale",1930433055,"Parque Nacional Podocarpus, 6-7 km SE of park entrance along Hwy 39, S of city of Loja","ECU",NA,2001,"PRESERVED_SPECIMEN","GEODETIC_DATUM_ASSUMED_WGS84;COLLECTION_MATCH_FUZZY"
-91.55444,14.77631,"Brachythecium ruderale",1928572571,"2 km S of Llano del Pinal (7 km SW of Xela), N slopes of Volcán Santa Maria","GTM",NA,2006,"PRESERVED_SPECIMEN","GEODETIC_DATUM_ASSUMED_WGS84;COLLECTION_MATCH_FUZZY"
-85.4278,10.9906,"Brachythecium ruderale",1928764642,"Parque Nacional Guanacaste La Cruz-9 km al sur de Santa Cecilia Estacion Pitilla.","CRI",NA,1990,"PRESERVED_SPECIMEN","GEODETIC_DATUM_ASSUMED_WGS84;COLLECTION_MATCH_FUZZY"
-87.85,14.78,"Brachythecium ruderale",1929770825,"Quebrada Agua Helado, above San José Del Los Planes, ca 15 km E of Lago Yojoa, Cerro Meámbar","HND",NA,1993,"PRESERVED_SPECIMEN","GEODETIC_DATUM_ASSUMED_WGS84;COLLECTION_MATCH_FUZZY"
-66.97725,18.143942,"Brachythecium ruderale",1928636276,"Cordillera Central, Reserva Forestal Maricao, along Hwy 120 at Km 13.8, near picnic area.","PRI",NA,1981,"PRESERVED_SPECIMEN","COLLECTION_MATCH_FUZZY"
-72.22,18.32,"Brachythecium ruderale",1931284068,"Massif de la Selle, 5 km E of Seguin on road to Mare Rouge.","HTI",NA,1982,"PRESERVED_SPECIMEN","GEODETIC_DATUM_ASSUMED_WGS84;COLLECTION_MATCH_FUZZY"
-64.8,-21.6,"Brachythecium ruderale",1929919284,"prov. Méndez/Prov. Cercado/Prov. Avilés: Canyon 5 mi SW of tablada, SW of Tarija.","BOL",NA,1979,"PRESERVED_SPECIMEN","GEODETIC_DATUM_ASSUMED_WGS84;COLLECTION_MATCH_FUZZY"
-86.13,14.95,"Brachythecium ruderale",1929157264,"Slopes of Montana Pena Blanca, 11.5 km S of Gualaco on road from San Francisco de la Paz to Gualaco.","HND",NA,1992,"PRESERVED_SPECIMEN","GEODETIC_DATUM_ASSUMED_WGS84;COLLECTION_MATCH_FUZZY"
-77.68,18,"Brachythecium ruderale",1930941631,"2.0 mi NE of Malvern on road to Santa Cruz; Santa Cruz Mts.","JAM",NA,1981,"PRESERVED_SPECIMEN","GEODETIC_DATUM_ASSUMED_WGS84;COLLECTION_MATCH_FUZZY"
-91.48933,14.756,"Brachythecium ruderale",3422305469,"road to Aguas AMargas, NW slopes of Pico Zunil","GTM",NA,2006,"PRESERVED_SPECIMEN","GEODETIC_DATUM_ASSUMED_WGS84;COLLECTION_MATCH_FUZZY"
-64.05,-19.65,"Brachythecium ruderale",1930845689,"NE slope of Serranía Los Cazadores 4 km SE of Puente Azero and 20 km NNW of Monteagudo.","BOL",NA,1984,"PRESERVED_SPECIMEN","GEODETIC_DATUM_ASSUMED_WGS84;COLLECTION_MATCH_FUZZY"
-71.55,18.23,"Brachythecium ruderale",1929226476,"Sierra de Baoruco, 30.5 km S of Puerto Escondito.","DOM",NA,1987,"PRESERVED_SPECIMEN","GEODETIC_DATUM_ASSUMED_WGS84;COLLECTION_MATCH_FUZZY"
-44.95,-21.95,"Brachythecium ruderale",2266040895,"near road to north from Caxambu","BRA",NA,1951,"PRESERVED_SPECIMEN","GEODETIC_DATUM_ASSUMED_WGS84;CONTINENT_DERIVED_FROM_COORDINATES;AMBIGUOUS_COLLECTION"
-101.95,19.83333,"Brachythecium ruderale",2266044732,"km. 418 west of Zacapu","MEX",NA,1953,"PRESERVED_SPECIMEN","GEODETIC_DATUM_ASSUMED_WGS84;CONTINENT_DERIVED_FROM_COORDINATES;AMBIGUOUS_COLLECTION"
-99.3,20.783333,"Brachythecium ruderale",2266040755,"Km. 227 Pan-American Highway, north of Zimapan","MEX",NA,1953,"PRESERVED_SPECIMEN","GEODETIC_DATUM_ASSUMED_WGS84;CONTINENT_DERIVED_FROM_COORDINATES;AMBIGUOUS_COLLECTION"
-104.999444,38.045556,"Brachythecium ruderale",2252141826,"Beulah, 35 mi SW of Pueblo, Pueblo Mountain Park, outer foothills of the Wet Mountains, Devil's Canyon; 6750-7000 ft alt., 38° 02' 44 N 104° 59' 58 W","USA",NA,2001,"PRESERVED_SPECIMEN","GEODETIC_DATUM_ASSUMED_WGS84;CONTINENT_DERIVED_FROM_COORDINATES;AMBIGUOUS_INSTITUTION"
-106.483333,35.896111,"Brachythecium ruderale",2252140898,"Valles Caldera National Preserve, along Jaramillo Creek at N end of Valle Grande","USA",NA,2009,"PRESERVED_SPECIMEN","GEODETIC_DATUM_ASSUMED_WGS84;CONTINENT_DERIVED_FROM_COORDINATES;AMBIGUOUS_INSTITUTION"
-105.793333,33.4,"Brachythecium ruderale",2252140930,"White Mts., up stream at entrance to Ski Apache","USA",NA,2001,"PRESERVED_SPECIMEN","GEODETIC_DATUM_ASSUMED_WGS84;CONTINENT_DERIVED_FROM_COORDINATES;AMBIGUOUS_INSTITUTION"
