"lon","lat","species","gbifID","locality","countryCode","coordinateUncertaintyInMeters","year","basisOfRecord","issue"
-77.883333,1.083333,"Brachythecium ruderale",1261641782,"Trayecto La Planada - San Isidro.","COL",NA,1991,"PRESERVED_SPECIMEN","OCCURRENCE_STATUS_INFERRED_FROM_INDIVIDUAL_COUNT;COORDINATE_ROUNDED;GEODETIC_DATUM_ASSUMED_WGS84;DIFFERENT_OWNER_INSTITUTION"
-63.633333,-19.666667,"Brachythecium ruderale",1261795733,"Lagunillas, 2 km al Este de la plaza. Bosque Tucumano-seco Chaqueño, con gradientes de altura, zona montañosa, parcialmente intervenido.","BOL",NA,2006,"PRESERVED_SPECIMEN","OCCURRENCE_STATUS_INFERRED_FROM_INDIVIDUAL_COUNT;COORDINATE_ROUNDED;GEODETIC_DATUM_ASSUMED_WGS84;DIFFERENT_OWNER_INSTITUTION"
-68.533333,-15.366667,"Brachythecium ruderale",1261808554,"NW side of Rio Consata directly across the river from Consata.","BOL",NA,1983,"PRESERVED_SPECIMEN","OCCURRENCE_STATUS_INFERRED_FROM_INDIVIDUAL_COUNT;COORDINATE_ROUNDED;GEODETIC_DATUM_ASSUMED_WGS84;DIFFERENT_OWNER_INSTITUTION"
-64.348611,-20.144444,"Brachythecium ruderale",4062050834,"Zona Chirimolle, 30 km sudeste de Azurduy. Fragmentos de bosque montano de Tucumano-Boliviano; piso superior con Podocarpus, Alnus, Mirtáceas, helechos. <2558-2580>","BOL",NA,2007,"PRESERVED_SPECIMEN","OCCURRENCE_STATUS_INFERRED_FROM_INDIVIDUAL_COUNT;COORDINATE_ROUNDED;GEODETIC_DATUM_ASSUMED_WGS84;DIFFERENT_OWNER_INSTITUTION"
55.466667,-21,"Brachythecium ruderale",1840859686,"Cirque de Salazie, Grand Îlet","REU",5000,1997,"PRESERVED_SPECIMEN","GEODETIC_DATUM_ASSUMED_WGS84;CONTINENT_DERIVED_FROM_COORDINATES;INSTITUTION_MATCH_FUZZY;COLLECTION_MATCH_FUZZY"
29.006111,-2.7,"Brachythecium ruderale",1840829378,"Bugarama, route de Rushubi","RWA",NA,1967,"PRESERVED_SPECIMEN","GEODETIC_DATUM_ASSUMED_WGS84;CONTINENT_DERIVED_FROM_COORDINATES;INSTITUTION_MATCH_FUZZY;COLLECTION_MATCH_FUZZY"
-100.35,25.6,"Brachythecium ruderale",3743475324,"Chipinque Mesa, just above the restaurant, ca. 8.5 miles south of Monterrey","MEX",NA,1982,"PRESERVED_SPECIMEN","GEODETIC_DATUM_ASSUMED_WGS84;COLLECTION_MATCH_FUZZY"
-107.966667,28.266667,"Brachythecium ruderale",3743472321,"20.1 miles east of Basaseachi, 14.7 miles west of Tomochic","MEX",NA,1986,"PRESERVED_SPECIMEN","COORDINATE_ROUNDED;GEODETIC_DATUM_ASSUMED_WGS84;COLLECTION_MATCH_FUZZY"
-99.316667,19.75,"Brachythecium ruderale",3743477322,"Cima de la Sierra de Alcaparrosa; ca. 7 km en linea recta al NW de Tepotzotlan","MEX",NA,1985,"PRESERVED_SPECIMEN","COORDINATE_ROUNDED;GEODETIC_DATUM_ASSUMED_WGS84;COLLECTION_MATCH_FUZZY"
-98.733333,20.183333,"Brachythecium ruderale",3743485321,"Alrededores del Cerro de Las Ventanas","MEX",NA,1983,"PRESERVED_SPECIMEN","COORDINATE_ROUNDED;GEODETIC_DATUM_ASSUMED_WGS84;COLLECTION_MATCH_FUZZY"
-109.283333,31.9,"Brachythecium ruderale",3091679301,"Along trail from Rustler Park to Long Park, SW of Portal","USA",NA,1989,"PRESERVED_SPECIMEN","COORDINATE_ROUNDED;GEODETIC_DATUM_ASSUMED_WGS84;COLLECTION_MATCH_FUZZY"
25.60288,-32.706025,"Brachythecium ruderale",1899842744,"Eastern Cape Province: Somerset East. Boschberg.","ZAF",NA,2013,"PRESERVED_SPECIMEN","GEODETIC_DATUM_ASSUMED_WGS84;GEODETIC_DATUM_INVALID;COLLECTION_MATCH_FUZZY"
-79.05,-0.93,"Brachythecium ruderale",3467332407,"Quevedo-Latacunga road, above Macuchi.","ECU",NA,1973,"PRESERVED_SPECIMEN","GEODETIC_DATUM_ASSUMED_WGS84"
-78.45,0.033333,"Brachythecium ruderale",4061942147,"Cahupi-Sacha, Pululagua.","ECU",NA,1951,"PRESERVED_SPECIMEN","OCCURRENCE_STATUS_INFERRED_FROM_INDIVIDUAL_COUNT;COORDINATE_ROUNDED;GEODETIC_DATUM_ASSUMED_WGS84;DIFFERENT_OWNER_INSTITUTION"
-65.933333,-17.183333,"Brachythecium ruderale",1261739817,"76 km de Villa Tunari, entre Locotal-Corani, carretera nuevo Cochabamba - Santa Cruz. Bosque montano secundario, al lado de carretera y bosque. <22117-22132>","BOL",NA,2002,"PRESERVED_SPECIMEN","OCCURRENCE_STATUS_INFERRED_FROM_INDIVIDUAL_COUNT;COORDINATE_ROUNDED;GEODETIC_DATUM_ASSUMED_WGS84;DIFFERENT_OWNER_INSTITUTION"
-64.133333,-18.383333,"Brachythecium ruderale",1261811128,"Cuchillo de Quiñal between the Villamontes-Mataral Road, 1 km N of Redonda Loma, and the Rio El Bañado, 9 km N of Villamontes. Area also known as Abra Quiña Quiña.","BOL",NA,1985,"PRESERVED_SPECIMEN","OCCURRENCE_STATUS_INFERRED_FROM_INDIVIDUAL_COUNT;COORDINATE_ROUNDED;GEODETIC_DATUM_ASSUMED_WGS84;DIFFERENT_OWNER_INSTITUTION"
-67.633333,10.35,"Brachythecium ruderale",2268836032,"Carratea Maracay-Ocumare. Parque Nacional Henry Pittier.","VEN",NA,1976,"PRESERVED_SPECIMEN","OCCURRENCE_STATUS_INFERRED_FROM_INDIVIDUAL_COUNT;COORDINATE_ROUNDED;GEODETIC_DATUM_ASSUMED_WGS84;DIFFERENT_OWNER_INSTITUTION"
-75.966667,3.75,"Brachythecium ruderale",1261694090,"El Cerrito, Combia, Páramo de Las Hermosas, Combia.","COL",NA,1991,"PRESERVED_SPECIMEN","OCCURRENCE_STATUS_INFERRED_FROM_INDIVIDUAL_COUNT;COORDINATE_ROUNDED;GEODETIC_DATUM_ASSUMED_WGS84;DIFFERENT_OWNER_INSTITUTION"
-75.083333,5.166667,"Brachythecium ruderale",2268836233,"Fresno, 3 km SW de Fresno.","COL",NA,1965,"PRESERVED_SPECIMEN","OCCURRENCE_STATUS_INFERRED_FROM_INDIVIDUAL_COUNT;COORDINATE_ROUNDED;GEODETIC_DATUM_ASSUMED_WGS84;DIFFERENT_OWNER_INSTITUTION"
-71.066667,8.633333,"Brachythecium ruderale",2268837039,"La Mucuy, above the town of Tabay, Parque Nacional de la Sierra Nevada.","VEN",NA,1972,"PRESERVED_SPECIMEN","OCCURRENCE_STATUS_INFERRED_FROM_INDIVIDUAL_COUNT;COORDINATE_ROUNDED;GEODETIC_DATUM_ASSUMED_WGS84;DIFFERENT_OWNER_INSTITUTION"
-78.5,-0.666667,"Brachythecium ruderale",1261694070,"Parque Nacional Cotopaxi, faldas N de Rumiñahui","ECU",NA,1982,"PRESERVED_SPECIMEN","OCCURRENCE_STATUS_INFERRED_FROM_INDIVIDUAL_COUNT;COORDINATE_ROUNDED;GEODETIC_DATUM_ASSUMED_WGS84;DIFFERENT_OWNER_INSTITUTION"
-64.783333,-19.066667,"Brachythecium ruderale",1261811009,"Canyon near mouth of unnamed stream that flows from Taypirani into the Rio Jutun Mayu 1 km W of mouth of Rio Quiscoli Mayu, 14 km NW of Zudañez.","BOL",NA,1984,"PRESERVED_SPECIMEN","OCCURRENCE_STATUS_INFERRED_FROM_INDIVIDUAL_COUNT;COORDINATE_ROUNDED;GEODETIC_DATUM_ASSUMED_WGS84;DIFFERENT_OWNER_INSTITUTION"
-63.861389,-18.878056,"Brachythecium ruderale",1257944704,"Vallegrande a Loma Larga, 26 Km al Sur. Cerro Bocon situado a 18 Km del Sur-este de Loma Larga. <696-792>","BOL",NA,2011,"PRESERVED_SPECIMEN","OCCURRENCE_STATUS_INFERRED_FROM_INDIVIDUAL_COUNT;COORDINATE_ROUNDED;GEODETIC_DATUM_ASSUMED_WGS84;DIFFERENT_OWNER_INSTITUTION"
-63.861111,-19.758333,"Brachythecium ruderale",4060984408,"NE de Taperillas (Cruce Monteagudo-Muyupampa), Cañón Agua Hedionda subiendo al alto El Palmar con fragmentos de bosque Tucumano-Boliviano. <2249-2287>","BOL",NA,2006,"PRESERVED_SPECIMEN","OCCURRENCE_STATUS_INFERRED_FROM_INDIVIDUAL_COUNT;COORDINATE_ROUNDED;GEODETIC_DATUM_ASSUMED_WGS84;DIFFERENT_OWNER_INSTITUTION"
-75.033333,2.783333,"Brachythecium ruderale",4060978332,"Transecto Neiva-San Vicente del Caguán. Valle de Balsillas. Cordillera Oriental. Bosque pluvial montano, con Quercus. <16792-16821>","COL",NA,1990,"PRESERVED_SPECIMEN","OCCURRENCE_STATUS_INFERRED_FROM_INDIVIDUAL_COUNT;COORDINATE_ROUNDED;GEODETIC_DATUM_ASSUMED_WGS84;DIFFERENT_OWNER_INSTITUTION"
-64.485278,-18.728611,"Brachythecium ruderale",4061509477,"Monte Grande, ca. 32 km de Villa Serrano. Bosque montano de yungas. Con Prumnopitys exigua, Podocarpus, Myrcianthes. <22845-22885>","BOL",NA,2004,"PRESERVED_SPECIMEN","OCCURRENCE_STATUS_INFERRED_FROM_INDIVIDUAL_COUNT;COORDINATE_ROUNDED;GEODETIC_DATUM_ASSUMED_WGS84;DIFFERENT_OWNER_INSTITUTION"
-64.6975,-17.789167,"Brachythecium ruderale",1261757932,"Serranía Siberia. Entre Empalme y Locotal. Bosque nublado de montano (Yungueño).","BOL",NA,2004,"PRESERVED_SPECIMEN","OCCURRENCE_STATUS_INFERRED_FROM_INDIVIDUAL_COUNT;COORDINATE_ROUNDED;GEODETIC_DATUM_ASSUMED_WGS84;DIFFERENT_OWNER_INSTITUTION"
-71.95,7.983333,"Brachythecium ruderale",2268837816,"Debajo de Páramo de La Negra en la carretera hacia Pregonero.","VEN",NA,1966,"PRESERVED_SPECIMEN","OCCURRENCE_STATUS_INFERRED_FROM_INDIVIDUAL_COUNT;COORDINATE_ROUNDED;GEODETIC_DATUM_ASSUMED_WGS84;DIFFERENT_OWNER_INSTITUTION"
-64.966667,-17.733333,"Brachythecium ruderale",1261785755,"Canton Pojo. 7 km oeste de La Habana. Matorral de Polylepis. <20633-20637>","BOL",NA,2001,"PRESERVED_SPECIMEN","OCCURRENCE_STATUS_INFERRED_FROM_INDIVIDUAL_COUNT;COORDINATE_ROUNDED;GEODETIC_DATUM_ASSUMED_WGS84;DIFFERENT_OWNER_INSTITUTION"
-63.851944,-19.155278,"Brachythecium ruderale",4062050539,"Serranía de Nahuañanca. Ca. 3 km de Las Frías subiendo hacia la cima de la serranía de Yahuañanca. Bosque semi cauducifolio con arbóreo de 10 m altura.","BOL",NA,2003,"PRESERVED_SPECIMEN","OCCURRENCE_STATUS_INFERRED_FROM_INDIVIDUAL_COUNT;COORDINATE_ROUNDED;GEODETIC_DATUM_ASSUMED_WGS84;DIFFERENT_OWNER_INSTITUTION"
-64.331667,-20.1525,"Brachythecium ruderale",4061016445,"Chirimolle, 30 km sudeste de Azurduy. Fragmentos de bosque montano de Tucumano-Boliviano; piso superior con Podocarpus, Alnus, helechos, poáceas.<2488-2521>","BOL",NA,2007,"PRESERVED_SPECIMEN","OCCURRENCE_STATUS_INFERRED_FROM_INDIVIDUAL_COUNT;COORDINATE_ROUNDED;GEODETIC_DATUM_ASSUMED_WGS84;DIFFERENT_OWNER_INSTITUTION"
-77.6,1.333333,"Brachythecium ruderale",1261694191,"Ricaurte, Cartagena, Rio Guisa.","COL",NA,1990,"PRESERVED_SPECIMEN","OCCURRENCE_STATUS_INFERRED_FROM_INDIVIDUAL_COUNT;COORDINATE_ROUNDED;GEODETIC_DATUM_ASSUMED_WGS84;DIFFERENT_OWNER_INSTITUTION"
-78.666,-0.25,"Brachythecium ruderale",47734530,"Old road Quito - Sto. Domingo 23-27 km west of Chillogallo. Roadbanks and roadsides in montane forest.","ECU",NA,1981,"PRESERVED_SPECIMEN","GEODETIC_DATUM_ASSUMED_WGS84;COORDINATE_PRECISION_INVALID;INSTITUTION_MATCH_FUZZY;INSTITUTION_COLLECTION_MISMATCH"
-79.416,-2.916,"Brachythecium ruderale",47734528,"Angas on western slope of western cordillera (due west of Cuenca). Hedges and dry Polylepis scrub along muletrack.","ECU",NA,1981,"PRESERVED_SPECIMEN","GEODETIC_DATUM_ASSUMED_WGS84;COORDINATE_PRECISION_INVALID;INSTITUTION_MATCH_FUZZY;INSTITUTION_COLLECTION_MISMATCH"
-78.566,0.016,"Brachythecium ruderale",47734815,"Road San Antonio - Calacalí - Nanegal, 20 km W of Calacalí. Pastures and shrub forests on rocky slopes. Cloud forest area.","ECU",NA,1979,"PRESERVED_SPECIMEN","GEODETIC_DATUM_ASSUMED_WGS84;COORDINATE_PRECISION_INVALID;INSTITUTION_MATCH_FUZZY;INSTITUTION_COLLECTION_MISMATCH"
-79.116,-2.833,"Brachythecium ruderale",47734376,"About 5 km NW of Sayausí on road to Cajas. Secondary cloud forest and mountain scrub along road.","ECU",NA,1979,"PRESERVED_SPECIMEN","GEODETIC_DATUM_ASSUMED_WGS84;COORDINATE_PRECISION_INVALID;INSTITUTION_MATCH_FUZZY;INSTITUTION_COLLECTION_MISMATCH"
-78.983,-0.933,"Brachythecium ruderale",47734359,"Latacunga - Quevedo road, 3-5 km above Pilaló. Slopes along road in cloud forest.","ECU",NA,1979,"PRESERVED_SPECIMEN","GEODETIC_DATUM_ASSUMED_WGS84;COORDINATE_PRECISION_INVALID;INSTITUTION_MATCH_FUZZY;INSTITUTION_COLLECTION_MISMATCH"
-43.476667,-20.090278,"Brachythecium ruderale",3900986485,"Reserva Particular do Patimônio Natural - Parque do Caraça, trilha para Gruta de Lourdes, transição entre Cerrado e Mata Atlântica","BRA",NA,2017,"PRESERVED_SPECIMEN","GEODETIC_DATUM_ASSUMED_WGS84;CONTINENT_DERIVED_FROM_COORDINATES;INSTITUTION_MATCH_NONE"
22.58278,-33.65028,"Brachythecium ruderale",1419523075,"","ZAF",NA,2000,"PRESERVED_SPECIMEN","GEODETIC_DATUM_ASSUMED_WGS84;CONTINENT_DERIVED_FROM_COORDINATES;COLLECTION_MATCH_FUZZY"
-50.27,-27.17,"Brachythecium ruderale",1455710111,"","BRA",NA,1980,"PRESERVED_SPECIMEN","GEODETIC_DATUM_ASSUMED_WGS84;CONTINENT_DERIVED_FROM_COORDINATES;COLLECTION_MATCH_FUZZY"
-68.058889,-16.201667,"Brachythecium ruderale",4032040506,"Zongo, a lado del Río Tiquimani a 1 hora de caminata pasando Uma Palca rumbo a las minas 1ro de Mayo, La Joya y Tres Amigos. Páramo yungueño con Polylepis.","BOL",NA,2005,"PRESERVED_SPECIMEN","OCCURRENCE_STATUS_INFERRED_FROM_INDIVIDUAL_COUNT;COORDINATE_ROUNDED;GEODETIC_DATUM_ASSUMED_WGS84;INSTITUTION_MATCH_FUZZY;COLLECTION_MATCH_NONE"
-78.916667,-0.266667,"Brachythecium ruderale",1261669734,"Old road Qutio - Santo Domingo 23-27 km west of Chillogallo.","ECU",NA,1981,"PRESERVED_SPECIMEN","OCCURRENCE_STATUS_INFERRED_FROM_INDIVIDUAL_COUNT;COORDINATE_ROUNDED;GEODETIC_DATUM_ASSUMED_WGS84;INSTITUTION_MATCH_FUZZY;COLLECTION_MATCH_NONE"
-49.418056,-25.751111,"Brachythecium ruderale",2995822873,"","BRA",NA,2016,"PRESERVED_SPECIMEN","RECORDED_DATE_INVALID;COORDINATE_ROUNDED;GEODETIC_DATUM_ASSUMED_WGS84;CONTINENT_DERIVED_FROM_COORDINATES;INSTITUTION_MATCH_FUZZY;COLLECTION_MATCH_FUZZY"
-50.583611,-29.448056,"Brachythecium ruderale",1264708747,"","BRA",NA,1985,"PRESERVED_SPECIMEN","GEODETIC_DATUM_ASSUMED_WGS84;INSTITUTION_MATCH_FUZZY;INSTITUTION_COLLECTION_MISMATCH"
29.226389,-28.961111,"Brachythecium ruderale",1099880659,"Indumeni","ZAF",NA,1953,"PRESERVED_SPECIMEN","OCCURRENCE_STATUS_INFERRED_FROM_INDIVIDUAL_COUNT;COORDINATE_ROUNDED;GEODETIC_DATUM_ASSUMED_WGS84;INSTITUTION_MATCH_FUZZY;COLLECTION_MATCH_NONE"
-75.639933,8.321037,"Brachythecium ruderale",2900563154,"El Almendro","COL",NA,2019,"HUMAN_OBSERVATION","COORDINATE_ROUNDED"
-45.484444,-22.690555,"Brachythecium ruderale",4063469331,"Campos do Jordão, Parque Estadual de Campos do Jordão, Trilha das Pontes","BRA",NA,2009,"PRESERVED_SPECIMEN","CONTINENT_DERIVED_FROM_COORDINATES"
-46.183333,-23.734166,"Brachythecium ruderale",4063469336,"Mogi das Cruzes, Taiaçupeba","BRA",NA,2006,"PRESERVED_SPECIMEN","CONTINENT_DERIVED_FROM_COORDINATES"
-49.478888,-28.12,"Brachythecium ruderale",4063469337,"Urubici, Parque Nacional de São Joaquim, estrada de acesso ao Morro da Igreja","BRA",NA,2009,"PRESERVED_SPECIMEN","CONTINENT_DERIVED_FROM_COORDINATES"
-65.17,-17.72,"Brachythecium ruderale",1930138907,"Kilometer post 210 km from Sucre along Sucre-Epizana Hwy., ca. 10 km S of Totora.","BOL",NA,1983,"PRESERVED_SPECIMEN","GEODETIC_DATUM_ASSUMED_WGS84;COLLECTION_MATCH_FUZZY"
-72.03,18.33,"Brachythecium ruderale",1928757129,"In limber mille town of Mare Rouge (about 20 km E of Seguin), near mill area.","HTI",NA,1981,"PRESERVED_SPECIMEN","GEODETIC_DATUM_ASSUMED_WGS84;COLLECTION_MATCH_FUZZY"
-66.62,-17.67,"Brachythecium ruderale",1928268899,"Oruro-Cochabamba Hiway at 94.5 road kms from Cochabamba, SE of Challa, NW of Estancia Chuñu Chuñuni.","BOL",NA,1984,"PRESERVED_SPECIMEN","GEODETIC_DATUM_ASSUMED_WGS84;COLLECTION_MATCH_FUZZY"
-100.43,19.57,"Brachythecium ruderale",1928630543,"Cerro de La Campana, 4 km E de Tuxpan","MEX",NA,1986,"PRESERVED_SPECIMEN","GEODETIC_DATUM_ASSUMED_WGS84;COLLECTION_MATCH_FUZZY"
-73.92,18.43,"Brachythecium ruderale",1927912470,"Massif de la Hotte, along small stream entering Rivière Glace at junction of road from Beaumont to Camp Perrin; 41 km S of Roseaux.","HTI",NA,1982,"PRESERVED_SPECIMEN","GEODETIC_DATUM_ASSUMED_WGS84;COLLECTION_MATCH_FUZZY"
-65.9,-21.77,"Brachythecium ruderale",1930146861,"Headwaters of Río Los Pinos 1 km W to 3 km SW of Los Pinos, 20 km NW of Padcaya","BOL",NA,1984,"PRESERVED_SPECIMEN","GEODETIC_DATUM_ASSUMED_WGS84;COLLECTION_MATCH_FUZZY"
-78.08,-0.42,"Brachythecium ruderale",1930467169,"6 km E of Papallacta","ECU",NA,1983,"PRESERVED_SPECIMEN","GEODETIC_DATUM_ASSUMED_WGS84;COLLECTION_MATCH_FUZZY"
-86.1508,14.0275,"Brachythecium ruderale",1931282933,"1 km N of (above) La Jungla.","NIC",NA,2010,"PRESERVED_SPECIMEN","GEODETIC_DATUM_ASSUMED_WGS84;COLLECTION_MATCH_FUZZY"
-47.962778,-15.512222,"Brachythecium ruderale",1213595025,"APA de Cafuringa, FERCAL. Pedra do Urubu - Mata de galeria adjacente Pedra.","BRA",NA,2010,"PRESERVED_SPECIMEN","COORDINATE_ROUNDED;GEODETIC_DATUM_ASSUMED_WGS84;CONTINENT_DERIVED_FROM_COORDINATES;INSTITUTION_MATCH_NONE"
-47.852222,-15.486944,"Brachythecium ruderale",1213639085,"Assentamento PA Contagem fercal - Chácara 04. Mata de Galeria do Rio Maranhão.","BRA",NA,2012,"PRESERVED_SPECIMEN","COORDINATE_ROUNDED;GEODETIC_DATUM_ASSUMED_WGS84;CONTINENT_DERIVED_FROM_COORDINATES;INSTITUTION_MATCH_NONE"
-47.983611,-15.697222,"Brachythecium ruderale",1213610085,"Parque Nacional de Brasília.","BRA",NA,2010,"PRESERVED_SPECIMEN","COORDINATE_ROUNDED;GEODETIC_DATUM_ASSUMED_WGS84;CONTINENT_DERIVED_FROM_COORDINATES;INSTITUTION_MATCH_NONE"
-64.87,-19.77,"Brachythecium ruderale",1929426826,"Serranía Iñao, slopes N of a creek flowing west to east and joining the Río Timboy Pampa 3 km S of Rancho Chuhuayco. 10 km S of NW of Monteagudo.","BOL",NA,1984,"PRESERVED_SPECIMEN","GEODETIC_DATUM_ASSUMED_WGS84;COLLECTION_MATCH_FUZZY"
-71.75,18.15,"Brachythecium ruderale",1929147080,"Along paralleling Haitian border ca. 23 km N of Pedernales, ca. 1 km S of intersection of road to Mencia.","DOM",NA,1981,"PRESERVED_SPECIMEN","GEODETIC_DATUM_ASSUMED_WGS84;COLLECTION_MATCH_FUZZY"
-74.289444,4.675833,"Brachythecium ruderale",2013799517,"Región subxerifitica de La Herrera, Alto de Mondoñedo.","COL",1022,1998,"PRESERVED_SPECIMEN","COORDINATE_ROUNDED"
-74.349167,4.577778,"Brachythecium ruderale",2013791173,"Vereda la Rambla.","COL",889,1992,"PRESERVED_SPECIMEN","COORDINATE_ROUNDED"
-66.99,18.19,"Brachythecium ruderale",29408486,"Carretera 357 Este, via Maricao","PRI",NA,2003,"PRESERVED_SPECIMEN","GEODETIC_DATUM_ASSUMED_WGS84;CONTINENT_DERIVED_FROM_COORDINATES;TAXON_MATCH_FUZZY;INSTITUTION_MATCH_FUZZY;COLLECTION_MATCH_NONE"
-44.833333,-23.15,"Brachythecium ruderale",3046094923,"São Paulo: Serra da Bocaina bei Cunha, epiphytisch am Waldrand in einer Waldweide unweit des Sitio da Grama","BRA",NA,1988,"PRESERVED_SPECIMEN","COORDINATE_ROUNDED;GEODETIC_DATUM_ASSUMED_WGS84;CONTINENT_DERIVED_FROM_COORDINATES;INSTITUTION_MATCH_FUZZY;INSTITUTION_COLLECTION_MISMATCH"
-44.633333,-22.783333,"Brachythecium ruderale",3046106416,"SAO PAULO. SERRA DA BOCAINA bei SAO JOSE DO BARREIRO, beim Eingang zum Nationalpark","BRA",NA,1988,"PRESERVED_SPECIMEN","COORDINATE_ROUNDED;GEODETIC_DATUM_ASSUMED_WGS84;CONTINENT_DERIVED_FROM_COORDINATES;INSTITUTION_MATCH_FUZZY;INSTITUTION_COLLECTION_MISMATCH"
-99.33,18.97,"Brachythecium ruderale",1928601738,"Barranca de Mexicapa, km 14 on road from Sta. Mónica de Ocuilán to Cuernavaca","MEX",NA,1995,"PRESERVED_SPECIMEN","GEODETIC_DATUM_ASSUMED_WGS84;COLLECTION_MATCH_FUZZY"
-97,19.03,"Brachythecium ruderale",1928357419,"Alrededores de Tomatlán, 25 km N de Fortín","MEX",NA,1979,"PRESERVED_SPECIMEN","GEODETIC_DATUM_ASSUMED_WGS84;COLLECTION_MATCH_FUZZY"
-64.4,-22.27,"Brachythecium ruderale",1930077360,"along trail from Comunidad Salado to Cambari 3.5 km N of YPFB Campamento Conchas and 53 km N of Bermejo.","BOL",NA,1984,"PRESERVED_SPECIMEN","GEODETIC_DATUM_ASSUMED_WGS84;COLLECTION_MATCH_FUZZY"
-63.583333,10.2,"Brachythecium ruderale",1261646473,"S-facing mountain slope directly N of Caripe.","VEN",NA,1967,"PRESERVED_SPECIMEN","OCCURRENCE_STATUS_INFERRED_FROM_INDIVIDUAL_COUNT;COORDINATE_ROUNDED;GEODETIC_DATUM_ASSUMED_WGS84;INSTITUTION_MATCH_FUZZY;COLLECTION_MATCH_NONE"
-88.23333,15.5,"Brachythecium ruderale",1261595542,"Sierra de Algalta; La Chorrera below Montaña Bibilonia, Rio Lara, 15 km NNW of Catacamas. <12448-12531>","HND",NA,1992,"PRESERVED_SPECIMEN","OCCURRENCE_STATUS_INFERRED_FROM_INDIVIDUAL_COUNT;GEODETIC_DATUM_ASSUMED_WGS84;INSTITUTION_MATCH_FUZZY;COLLECTION_MATCH_NONE"
-63.881111,-19.433056,"Brachythecium ruderale",1261803913,"Cañón del Tigre. Bosque Tucumano-Boliviano, con Cedrela, Eugenia, Lauraceae y Leguminosae. Sotobosque con Acanthaceae, Rubiaceae, Poaceae. <2226-2239>","BOL",NA,2006,"PRESERVED_SPECIMEN","OCCURRENCE_STATUS_INFERRED_FROM_INDIVIDUAL_COUNT;COORDINATE_ROUNDED;GEODETIC_DATUM_ASSUMED_WGS84;INSTITUTION_MATCH_FUZZY;COLLECTION_MATCH_NONE"
-96.84,18.19,"Brachythecium ruderale",1260142946,"Mun. Santa María Chilchotla. Along road from Teotitlán del Camino to Chilchotla, 3.8 mi past turn-off to Huatla de Jiménez. Along ravine; disturbed.","MEX",NA,1979,"PRESERVED_SPECIMEN","OCCURRENCE_STATUS_INFERRED_FROM_INDIVIDUAL_COUNT;GEODETIC_DATUM_ASSUMED_WGS84;INSTITUTION_MATCH_FUZZY;COLLECTION_MATCH_NONE"
-43.177222,-22.504444,"Brachythecium ruderale",1424497923,"Avenida Ipiranga. Encontrada sobre muro próxima ao Colégio São José.","BRA",NA,2014,"PRESERVED_SPECIMEN","COORDINATE_ROUNDED;GEODETIC_DATUM_ASSUMED_WGS84;CONTINENT_DERIVED_FROM_COORDINATES;INSTITUTION_MATCH_FUZZY;COLLECTION_MATCH_FUZZY"
-64.069444,-20.564722,"Brachythecium ruderale",4060970230,"Añimbo. Ca 5 km al NE de la comunidad de Añimbo. Bosque montano subhúmedo, larderas pronunciadas, con Lauraceas, Juglandaceas, Leguminosas. <1006-1045>","BOL",NA,2004,"PRESERVED_SPECIMEN","OCCURRENCE_STATUS_INFERRED_FROM_INDIVIDUAL_COUNT;COORDINATE_ROUNDED;GEODETIC_DATUM_ASSUMED_WGS84;DIFFERENT_OWNER_INSTITUTION"
-63.5,-19.7,"Brachythecium ruderale",1261811030,"East base of Serrania Inca Huasi at headwaters of an unnamed creek called Las Miscas by locals flowing past Aquio about 1 km 7 km SW of Lagunillas.","BOL",NA,1984,"PRESERVED_SPECIMEN","OCCURRENCE_STATUS_INFERRED_FROM_INDIVIDUAL_COUNT;GEODETIC_DATUM_ASSUMED_WGS84;DIFFERENT_OWNER_INSTITUTION"
-69.966667,9.45,"Brachythecium ruderale",2268835413,"Between Paraiso de Chabasquen and Peña Blanca.","VEN",NA,1966,"PRESERVED_SPECIMEN","OCCURRENCE_STATUS_INFERRED_FROM_INDIVIDUAL_COUNT;COORDINATE_ROUNDED;GEODETIC_DATUM_ASSUMED_WGS84;DIFFERENT_OWNER_INSTITUTION"
-71.128333,18.05,"Brachythecium ruderale",2515593490,"","DOM",NA,1982,"PRESERVED_SPECIMEN","INSTITUTION_MATCH_FUZZY;INSTITUTION_COLLECTION_MISMATCH"
-72.6169,7.33833,"Brachythecium ruderale",1315028630,"Ca. 6 KM. SE. DE PAMPLONA","COL",NA,1995,"PRESERVED_SPECIMEN","GEODETIC_DATUM_ASSUMED_WGS84;CONTINENT_DERIVED_FROM_COORDINATES;COORDINATE_PRECISION_INVALID;INSTITUTION_MATCH_FUZZY;COLLECTION_MATCH_FUZZY"
-72.8086,5.70028,"Brachythecium ruderale",1315028631,"Boyacá. Monguí. Páramo al oriente del pueblo, Alto de Oseta","COL",NA,1967,"PRESERVED_SPECIMEN","GEODETIC_DATUM_ASSUMED_WGS84;CONTINENT_DERIVED_FROM_COORDINATES;COORDINATE_PRECISION_INVALID;INSTITUTION_MATCH_FUZZY;COLLECTION_MATCH_FUZZY"
26.533333,-32.45,"Brachythecium ruderale",1840854965,"Katberg Pass area., just S. of turnoff to Riet Vlei Post Office. 85 km WNW of King William's Town","ZAF",NA,1973,"PRESERVED_SPECIMEN","GEODETIC_DATUM_ASSUMED_WGS84;CONTINENT_DERIVED_FROM_COORDINATES;INSTITUTION_MATCH_FUZZY;COLLECTION_MATCH_FUZZY"
-50.133333,-29.016667,"Brachythecium ruderale",1261728710,"Cambará do Sul, Ouro Verde.","BRA",NA,1985,"PRESERVED_SPECIMEN","OCCURRENCE_STATUS_INFERRED_FROM_INDIVIDUAL_COUNT;COORDINATE_ROUNDED;GEODETIC_DATUM_ASSUMED_WGS84;INSTITUTION_MATCH_FUZZY;COLLECTION_MATCH_NONE"
-99.798611,20.216389,"Brachythecium ruderale",1261574165,"In grove of oaks, northern tip of state, at kilometer marker 104, between Mexico City and Quéretaro, highway 57-D.","MEX",NA,1974,"PRESERVED_SPECIMEN","OCCURRENCE_STATUS_INFERRED_FROM_INDIVIDUAL_COUNT;COORDINATE_ROUNDED;GEODETIC_DATUM_ASSUMED_WGS84;INSTITUTION_MATCH_FUZZY;COLLECTION_MATCH_NONE"
-69.081944,-15.433889,"Brachythecium ruderale",4032137479,"Pacoampa. Pajonal altoandino con Deyeuxia spp y Festuca sp, rodeado por pradera altoandina dominada por Aciachne sp. <6631-6665>","BOL",NA,2004,"PRESERVED_SPECIMEN","OCCURRENCE_STATUS_INFERRED_FROM_INDIVIDUAL_COUNT;COORDINATE_ROUNDED;GEODETIC_DATUM_ASSUMED_WGS84;INSTITUTION_MATCH_FUZZY;COLLECTION_MATCH_NONE"
-64.68,-22.15,"Brachythecium ruderale",1927889838,"Following slope of Cerro Nogal parallel to, and 0.5 km N of Quebrada Nogal. 2-5 km NW of Comunidad La Mamora.","BOL",NA,1984,"PRESERVED_SPECIMEN","GEODETIC_DATUM_ASSUMED_WGS84;COLLECTION_MATCH_FUZZY"
26.53276,-33.30422,"Brachythecium ruderale",2028254297,"Grahamstown","ZAF",3036,2002,"PRESERVED_SPECIMEN","GEODETIC_DATUM_ASSUMED_WGS84;CONTINENT_DERIVED_FROM_COORDINATES;INSTITUTION_MATCH_FUZZY;COLLECTION_MATCH_NONE"
-85.716667,12.666667,"Brachythecium ruderale",1261601795,"Ridge along road between La Danta and La Luna, E of Esquipulas.","NIC",NA,1979,"PRESERVED_SPECIMEN","OCCURRENCE_STATUS_INFERRED_FROM_INDIVIDUAL_COUNT;COORDINATE_ROUNDED;GEODETIC_DATUM_ASSUMED_WGS84;INSTITUTION_MATCH_FUZZY;COLLECTION_MATCH_NONE"
-99.116,21.033,"Brachythecium ruderale",1261577355,"In woodlands near highway 85, just S of Cuesta Colorada, Zorra Pass, NE of Jacala and between Jacalilla and Jacala. Pine-oak woodland.","MEX",NA,1974,"PRESERVED_SPECIMEN","OCCURRENCE_STATUS_INFERRED_FROM_INDIVIDUAL_COUNT;GEODETIC_DATUM_ASSUMED_WGS84;INSTITUTION_MATCH_FUZZY;COLLECTION_MATCH_NONE"
-77.916667,0.666667,"Brachythecium ruderale",1261675857,"Near El Angel, on old road to Tulcan.","ECU",NA,1984,"PRESERVED_SPECIMEN","OCCURRENCE_STATUS_INFERRED_FROM_INDIVIDUAL_COUNT;COORDINATE_ROUNDED;GEODETIC_DATUM_ASSUMED_WGS84;INSTITUTION_MATCH_FUZZY;COLLECTION_MATCH_NONE"
-82.916667,9.081944,"Brachythecium ruderale",1253617106,"Sitio Las Huacas, faldas del Cerro Shriro, ca. 2300 m. Bosque primario de Quercus y Chusquea Q. Sombria aledana.","CRI",NA,1995,"PRESERVED_SPECIMEN","COORDINATE_ROUNDED;CONTINENT_DERIVED_FROM_COORDINATES;CONTINENT_INVALID;INSTITUTION_MATCH_FUZZY;COLLECTION_MATCH_NONE"
27.77556,59.15972,"Brachythecium ruderale",3016589690,"","EST",NA,2006,"PRESERVED_SPECIMEN","GEODETIC_DATUM_ASSUMED_WGS84;GEODETIC_DATUM_INVALID;CONTINENT_DERIVED_FROM_COORDINATES;INSTITUTION_MATCH_FUZZY;COLLECTION_MATCH_NONE"
-73.170528,7.099861,"Brachythecium ruderale",1324204096,"Vía a Chimitá","COL",NA,2014,"PRESERVED_SPECIMEN","COORDINATE_ROUNDED;CONTINENT_DERIVED_FROM_COORDINATES;INSTITUTION_MATCH_NONE"
-51.516667,-29.25,"Brachythecium ruderale",1261728690,"Garibaldi, Marcorama, Vila Santana.","BRA",NA,1987,"PRESERVED_SPECIMEN","OCCURRENCE_STATUS_INFERRED_FROM_INDIVIDUAL_COUNT;COORDINATE_ROUNDED;GEODETIC_DATUM_ASSUMED_WGS84;INSTITUTION_MATCH_FUZZY;COLLECTION_MATCH_NONE"
-52.592814,-17.623581,"Brachythecium ruderale",2013847192,"Cachoeira do Luzimar.","BRA",NA,2011,"PRESERVED_SPECIMEN","GEODETIC_DATUM_ASSUMED_WGS84;CONTINENT_DERIVED_FROM_COORDINATES;INSTITUTION_MATCH_NONE"
