"lon","lat","species","gbifID","locality","countryCode","coordinateUncertaintyInMeters","year","basisOfRecord","issue"
-112.089367,36.414533,"Bromus porteri",1846481161,"Kaibab National Forest, Vicinity of East Rim View, near junction of FSRD 427 and 234.","USA",NA,2002,"PRESERVED_SPECIMEN","GEODETIC_DATUM_ASSUMED_WGS84;CONTINENT_DERIVED_FROM_COORDINATES;INSTITUTION_MATCH_FUZZY;COLLECTION_MATCH_NONE"
-111.740111,35.345111,"Bromus porteri",1846546442,"The Nature Conservancy Hart Prairie, 14 miles N of Flagstaff off FR 151, south meadow","USA",NA,2011,"PRESERVED_SPECIMEN","CONTINENT_DERIVED_FROM_COORDINATES;INSTITUTION_MATCH_FUZZY;COLLECTION_MATCH_NONE"
-112.132074,36.582827,"Bromus porteri",1846549160,"Kaibab Plateau, deep sink about 2 miles NE of Red Point and 4 miles NE of Telephone Hill","USA",NA,2012,"PRESERVED_SPECIMEN","CONTINENT_DERIVED_FROM_COORDINATES;INSTITUTION_MATCH_FUZZY;COLLECTION_MATCH_NONE"
-111.1871894,34.4376855,"Bromus porteri",1846515470,"Barbershop Canyon downstream of Trail #91.","USA",NA,2008,"PRESERVED_SPECIMEN","COORDINATE_REPROJECTED;CONTINENT_DERIVED_FROM_COORDINATES;INSTITUTION_MATCH_FUZZY;COLLECTION_MATCH_NONE"
-100.658333,25.341667,"Bromus porteri",1895759198,"Las Vigas, Cañón de Jamé, Sierra de Arteaga","MEX",50,1988,"PRESERVED_SPECIMEN","TYPE_STATUS_INVALID;COORDINATE_ROUNDED;GEODETIC_DATUM_ASSUMED_WGS84;CONTINENT_DERIVED_FROM_COORDINATES;ELEVATION_MIN_MAX_SWAPPED;INSTITUTION_MATCH_NONE"
-101.108333,25.108333,"Bromus porteri",1895759259,"Rancho experimental Los Angeles, 48 Km S de Saltillo, carretera 54 Saltillo-Concepción del Oro, Zacatecas","MEX",50,1977,"PRESERVED_SPECIMEN","TYPE_STATUS_INVALID;COORDINATE_ROUNDED;GEODETIC_DATUM_ASSUMED_WGS84;CONTINENT_DERIVED_FROM_COORDINATES;ELEVATION_MIN_MAX_SWAPPED;INSTITUTION_MATCH_NONE"
-101.958333,25.375,"Bromus porteri",1895759262,"Cañón de San Lorenzo, cerca de 6 Km E de Buenavista, paraje de Los Aguajes","MEX",50,1974,"PRESERVED_SPECIMEN","TYPE_STATUS_INVALID;COORDINATE_ROUNDED;GEODETIC_DATUM_ASSUMED_WGS84;CONTINENT_DERIVED_FROM_COORDINATES;ELEVATION_MIN_MAX_SWAPPED;INSTITUTION_MATCH_NONE"
-100.425,25.241667,"Bromus porteri",1895759130,"La Siberia, Sierra de la Marta, cerca del Ejido de Santa Rita, aproximadamente 20 Km SE de San Antonio de las Alazanas","MEX",50,1983,"PRESERVED_SPECIMEN","TYPE_STATUS_INVALID;COORDINATE_ROUNDED;GEODETIC_DATUM_ASSUMED_WGS84;CONTINENT_DERIVED_FROM_COORDINATES;ELEVATION_MIN_MAX_SWAPPED;INSTITUTION_MATCH_NONE"
-100.775,25.341667,"Bromus porteri",1895759258,"Predio El Cristal","MEX",50,1994,"PRESERVED_SPECIMEN","TYPE_STATUS_INVALID;COORDINATE_ROUNDED;GEODETIC_DATUM_ASSUMED_WGS84;CONTINENT_DERIVED_FROM_COORDINATES;ELEVATION_MIN_MAX_SWAPPED;INSTITUTION_MATCH_NONE"
-100.225,24.875,"Bromus porteri",1895759360,"Cerro El Potosí","MEX",50,1988,"PRESERVED_SPECIMEN","TYPE_STATUS_INVALID;GEODETIC_DATUM_ASSUMED_WGS84;CONTINENT_DERIVED_FROM_COORDINATES;ELEVATION_MIN_MAX_SWAPPED;INSTITUTION_MATCH_NONE"
-104.241667,23.391667,"Bromus porteri",1894527434,"Mesa El Burro, rancho La Peña","MEX",70,1985,"PRESERVED_SPECIMEN","TYPE_STATUS_INVALID;COORDINATE_ROUNDED;GEODETIC_DATUM_ASSUMED_WGS84;CONTINENT_DERIVED_FROM_COORDINATES;ELEVATION_MIN_MAX_SWAPPED;INSTITUTION_MATCH_NONE"
-105.63,26.71,"Bromus porteri",1318223476,"4 mi SW of Villa Matamoros, Sierra de Sta. Barbara","MEX",NA,1959,"PRESERVED_SPECIMEN","GEODETIC_DATUM_ASSUMED_WGS84"
-110.401,31.4389,"Bromus porteri",1321749145,"Huachuca Mts., along Sunnyside Canyon with Quercus, Juniperus deppeana, Pinus cembroides and Platanus wrightii.","USA",NA,2000,"PRESERVED_SPECIMEN","GEODETIC_DATUM_ASSUMED_WGS84"
-105.55438,35.76717,"Bromus porteri",1843843917,"Elk Mountain: Pecos High Country.","USA",3000,1983,"PRESERVED_SPECIMEN","CONTINENT_DERIVED_FROM_COORDINATES;INSTITUTION_MATCH_FUZZY;INSTITUTION_COLLECTION_MISMATCH"
-107.94,34.4,"Bromus porteri",1843843734,"Datil Mountains.","USA",1138,1976,"PRESERVED_SPECIMEN","CONTINENT_DERIVED_FROM_COORDINATES;INSTITUTION_MATCH_FUZZY;INSTITUTION_COLLECTION_MISMATCH"
-104.628991,32.138435,"Bromus porteri",1843882209,"Carlsbad Caverns NP.","USA",100,2000,"PRESERVED_SPECIMEN","COORDINATE_ROUNDED;CONTINENT_DERIVED_FROM_COORDINATES;INSTITUTION_MATCH_FUZZY;INSTITUTION_COLLECTION_MISMATCH"
-106.57608,35.83114,"Bromus porteri",1843845109,"Valles Caldera National Preserve: El Cajete Canyon from NM Hwy 4 at East Fork Jemez River E ca 1.5 trail m.ile","USA",200,2001,"PRESERVED_SPECIMEN","CONTINENT_DERIVED_FROM_COORDINATES;INSTITUTION_MATCH_FUZZY;INSTITUTION_COLLECTION_MISMATCH"
-106.41258,35.866657,"Bromus porteri",1843843909,"Upper Frijoles Meadow.","USA",3200,1982,"PRESERVED_SPECIMEN","GEODETIC_DATUM_ASSUMED_WGS84;CONTINENT_DERIVED_FROM_COORDINATES;INSTITUTION_MATCH_FUZZY;INSTITUTION_COLLECTION_MISMATCH"
-107.608387,35.238648,"Bromus porteri",1843843553,"Just below Mount Taylor Peak.","USA",5000,1961,"PRESERVED_SPECIMEN","CONTINENT_DERIVED_FROM_COORDINATES;INSTITUTION_MATCH_FUZZY;INSTITUTION_COLLECTION_MISMATCH"
-105.382848,36.583303,"Bromus porteri",1843843833,"Along banks of the east fork of the Red River, 5/8 miles below Ditch cabin.","USA",2000,1980,"PRESERVED_SPECIMEN","CONTINENT_DERIVED_FROM_COORDINATES;INSTITUTION_MATCH_FUZZY;INSTITUTION_COLLECTION_MISMATCH"
-106.343198,35.712197,"Bromus porteri",2423866601,"southwest corner of Bandelier (vicinity Sanchez & Medio Canyons, Turkey Springs, San Miguel Ruin) Medio canyon. About 1 mile SE of San Miguel ruin.","USA",NA,1987,"PRESERVED_SPECIMEN","COORDINATE_ROUNDED;GEODETIC_DATUM_ASSUMED_WGS84;CONTINENT_DERIVED_FROM_COORDINATES;DIFFERENT_OWNER_INSTITUTION"
-105.163111,36.885222,"Bromus porteri",1843910940,"Vermejo Park Ranch: meadows 1.5 air mi NNE of northernmost summit of Ash Mountain.","USA",30,2007,"PRESERVED_SPECIMEN","CONTINENT_DERIVED_FROM_COORDINATES;INSTITUTION_MATCH_FUZZY;INSTITUTION_COLLECTION_MISMATCH"
-108.998567,33.495325,"Bromus porteri",1843843905,"Apache National Forest.","USA",8000,1960,"PRESERVED_SPECIMEN","CONTINENT_DERIVED_FROM_COORDINATES;INSTITUTION_MATCH_FUZZY;INSTITUTION_COLLECTION_MISMATCH"
-106.328832,35.757509,"Bromus porteri",2423865650,"Capulin Canyon, vicinity Base Camp (Guard Station) Capulin Canyon, 0.25 miles S of Base Camp, Capulin Canyon trail.","USA",NA,1983,"PRESERVED_SPECIMEN","COORDINATE_ROUNDED;GEODETIC_DATUM_ASSUMED_WGS84;CONTINENT_DERIVED_FROM_COORDINATES;DIFFERENT_OWNER_INSTITUTION"
-103.96883,36.78624,"Bromus porteri",1843913694,"North Slope of Capulin Volcano, USGS Quad: Folsom","USA",NA,2008,"PRESERVED_SPECIMEN","GEODETIC_DATUM_ASSUMED_WGS84;GEODETIC_DATUM_INVALID;CONTINENT_DERIVED_FROM_COORDINATES;INSTITUTION_MATCH_FUZZY;INSTITUTION_COLLECTION_MISMATCH"
-107.486149,33.880896,"Bromus porteri",1843843866,"Top of Mount Withington.","USA",1807,1952,"PRESERVED_SPECIMEN","CONTINENT_DERIVED_FROM_COORDINATES;INSTITUTION_MATCH_FUZZY;INSTITUTION_COLLECTION_MISMATCH"
-106.520087,35.971649,"Bromus porteri",1843913212,"Valle San Antonio","USA",NA,2001,"PRESERVED_SPECIMEN","CONTINENT_DERIVED_FROM_COORDINATES;INSTITUTION_MATCH_FUZZY;INSTITUTION_COLLECTION_MISMATCH"
-104.633333,36.883333,"Bromus porteri",1842918765,"Potato Canyon, Tin Pan Quadrangle.","USA",2000,1982,"PRESERVED_SPECIMEN","GEODETIC_DATUM_ASSUMED_WGS84;CONTINENT_DERIVED_FROM_COORDINATES;INSTITUTION_MATCH_FUZZY;INSTITUTION_COLLECTION_MISMATCH"
-107.932933,34.250475,"Bromus porteri",1843843696,"Datil Mountains.","USA",1138,1976,"PRESERVED_SPECIMEN","CONTINENT_DERIVED_FROM_COORDINATES;INSTITUTION_MATCH_FUZZY;INSTITUTION_COLLECTION_MISMATCH"
-105.764,35.967,"Bromus porteri",1843895307,"Santa Fe National Forest and Vicinity: Sangre de Cristo Mountains: Pecos Wildernss: Rio Medio Trail 155 adjacent to Rio Medio, 6 air miles due west of Truchas Peak, SE 0.3 air miles along trail. Also S15","USA",200,2003,"PRESERVED_SPECIMEN","CONTINENT_DERIVED_FROM_COORDINATES;INSTITUTION_MATCH_FUZZY;INSTITUTION_COLLECTION_MISMATCH"
-106.33333,31.01667,"Bromus porteri",2807566002,"SW slope of Sa de La Ranchería (on Rancho Candelaria) from the top down to a marble quarry at base","MEX",NA,1972,"PRESERVED_SPECIMEN","GEODETIC_DATUM_ASSUMED_WGS84;INSTITUTION_MATCH_FUZZY;INSTITUTION_COLLECTION_MISMATCH"
-108.2429831,30.1064398,"Bromus porteri",1895423250,"14 Km ENE of Colonia Pacheco, on the winding rd to Colonia Juárez","MEX",60,1968,"PRESERVED_SPECIMEN","TYPE_STATUS_INVALID;OCCURRENCE_STATUS_INFERRED_FROM_INDIVIDUAL_COUNT;COORDINATE_REPROJECTED;COORDINATE_ROUNDED;CONTINENT_DERIVED_FROM_COORDINATES;ELEVATION_MIN_MAX_SWAPPED;INSTITUTION_MATCH_NONE"
-105.26087,39.340629,"Bromus porteri",2988251308,"Little Scraggy Peak. Buffalo Creek Recreation Area, northeast slopes of Little Scraggy Peak, fairly close to Little Scraggy trailhead, about 4 mi. south of town of Buffalo Creek by Cty Rd 126, 60 km. south of the GNIS location of Golden.","USA",NA,2019,"PRESERVED_SPECIMEN","COORDINATE_ROUNDED;CONTINENT_DERIVED_FROM_COORDINATES;INSTITUTION_MATCH_FUZZY"
-105.274511,39.541895,"Bromus porteri",2242386975,"Meyer Ranch Park, Jefferson County Open Space, west of the intersection of HWY 285 and Turkey Creek Road","USA",NA,2004,"PRESERVED_SPECIMEN","GEODETIC_DATUM_ASSUMED_WGS84;CONTINENT_DERIVED_FROM_COORDINATES;INSTITUTION_MATCH_FUZZY"
-105.6392,39.34861,"Bromus porteri",2242422984,"Pike National Forest, Long Gulch, ca. 9.5 air miles E of Jefferson. Lost Park Road and Rock Creek.","USA",NA,2015,"PRESERVED_SPECIMEN","CONTINENT_DERIVED_FROM_COORDINATES;INSTITUTION_MATCH_FUZZY"
-105.96585,38.7581,"Bromus porteri",2242353969,"San Isabel National Forest, Browns Canyon National Monument, along county road CR 185 just S of Bassam Spring ca. 0.5 mi. s of Little Cotton Wood Cr. and CR 185d","USA",NA,2016,"PRESERVED_SPECIMEN","CONTINENT_DERIVED_FROM_COORDINATES;INSTITUTION_MATCH_FUZZY"
-106.29826,39.27418,"Bromus porteri",2242361499,"BLM land along E Fork of Arkansas River, near intersection of Hwy 24 and Crystal River Rd, N of Leadville.","USA",NA,2018,"PRESERVED_SPECIMEN","GEODETIC_DATUM_ASSUMED_WGS84;CONTINENT_DERIVED_FROM_COORDINATES;INSTITUTION_MATCH_FUZZY"
-105.25648,38.929893,"Bromus porteri",2242369046,"Upper Twin Rocks Road, E. of Fossil Beds National Monument","USA",NA,1982,"PRESERVED_SPECIMEN","GEODETIC_DATUM_ASSUMED_WGS84;CONTINENT_DERIVED_FROM_COORDINATES;INSTITUTION_MATCH_FUZZY"
-105.437469,39.835021,"Bromus porteri",2242377511,"Hillside above the north shore of Kriley Pond.","USA",NA,2000,"PRESERVED_SPECIMEN","GEODETIC_DATUM_ASSUMED_WGS84;CONTINENT_DERIVED_FROM_COORDINATES;INSTITUTION_MATCH_FUZZY"
-106.578094,38.815954,"Bromus porteri",2242385706,"Taylor Park, Taylor Park about 20 miles above Taylor dam.","USA",5000,1979,"PRESERVED_SPECIMEN","GEODETIC_DATUM_ASSUMED_WGS84;CONTINENT_DERIVED_FROM_COORDINATES;INSTITUTION_MATCH_FUZZY"
-106.13872,38.931577,"Bromus porteri",2242386630,"Mosquito Range, San Isabel National Forest, between USFS road 375 & Four Mile Creek SW. of Buffalo Peaks.","USA",NA,1995,"PRESERVED_SPECIMEN","GEODETIC_DATUM_ASSUMED_WGS84;CONTINENT_DERIVED_FROM_COORDINATES;INSTITUTION_MATCH_FUZZY"
-105.702296,39.668458,"Bromus porteri",2242371960,"Clear Lake","USA",NA,1983,"PRESERVED_SPECIMEN","GEODETIC_DATUM_ASSUMED_WGS84;CONTINENT_DERIVED_FROM_COORDINATES;INSTITUTION_MATCH_FUZZY"
-106.097933,39.024781,"Bromus porteri",2242387339,"Mosquito Range, San Isabel National Forest, N. of Buffalo Peaks, along USFS rd. 431, headwaters of E. fork of Lynch Creek.","USA",NA,1995,"PRESERVED_SPECIMEN","GEODETIC_DATUM_ASSUMED_WGS84;CONTINENT_DERIVED_FROM_COORDINATES;INSTITUTION_MATCH_FUZZY"
-106.985697,38.609421,"Bromus porteri",2242381001,"Ohio Creek; NE corner was S8","USA",5000,1967,"PRESERVED_SPECIMEN","GEODETIC_DATUM_ASSUMED_WGS84;CONTINENT_DERIVED_FROM_COORDINATES;INSTITUTION_MATCH_FUZZY"
-106.73729,38.81874,"Bromus porteri",2242358894,"Gunnison National Forest, Spring Creek and Rd 744 at junction with Bear Creek, 20 air miles NE of Gunnison.","USA",NA,2018,"PRESERVED_SPECIMEN","GEODETIC_DATUM_ASSUMED_WGS84;CONTINENT_DERIVED_FROM_COORDINATES;INSTITUTION_MATCH_FUZZY"
-106.703497,38.993433,"Bromus porteri",2242375096,"Taylor Park, 20 miles above Taylor dam.","USA",NA,1978,"PRESERVED_SPECIMEN","GEODETIC_DATUM_ASSUMED_WGS84;CONTINENT_DERIVED_FROM_COORDINATES;INSTITUTION_MATCH_FUZZY"
-106.542345,39.087794,"Bromus porteri",3775729609,"Brumley. Along the bank of the North Fork of Lake Creek, between the creek and the road to the Sno-Tel station, about 11 road miles generally west on Colorado Highway 82 from the town of Twin Lakes, 175 km. southwest of Golden.","USA",NA,2021,"PRESERVED_SPECIMEN","COORDINATE_ROUNDED;CONTINENT_DERIVED_FROM_COORDINATES;INSTITUTION_MATCH_FUZZY"
-106.85768,37.68009,"Bromus porteri",2242418380,"Rio Grande National Forest, San Juan Mountains; private property (Humphreys Ranch) that includes Lake Humphreys and Hay Press Lake, ca. 6.5 miles S of Wagon Wheel Gap and confluence with Rio Grande.","USA",NA,2014,"PRESERVED_SPECIMEN","CONTINENT_DERIVED_FROM_COORDINATES;INSTITUTION_MATCH_FUZZY"
-105.857289,40.334526,"Bromus porteri",2242370014,"Rocky Mountain National Park; Kawuneeche Valley at Colorado River, ~2 miles north of Bowen Gulch.","USA",NA,1988,"PRESERVED_SPECIMEN","GEODETIC_DATUM_ASSUMED_WGS84;CONTINENT_DERIVED_FROM_COORDINATES;INSTITUTION_MATCH_FUZZY"
-105.49472,39.272504,"Bromus porteri",2242390613,"7.5' Windy Peak quad, Pike Nat'l Forest, Lost Creek drainage between Tarryall and Kenosha Mts., Pikes Peak granite bedrock, along forest trail 609, ca .85 air miles SE of Lost Park Campground.","USA",20,2012,"PRESERVED_SPECIMEN","CONTINENT_DERIVED_FROM_COORDINATES;INSTITUTION_MATCH_FUZZY"
-107.1415,37.3137,"Bromus porteri",2273331216,"Eastern San Juan Mountains: San Juan National Forest: U.S. Hwy 160 W to County Road 600, N to Forest Road 629, W to Forest Road 923 then S; ca 9 air mi from Pagosa Springs. W center","USA",NA,2003,"PRESERVED_SPECIMEN","GEODETIC_DATUM_ASSUMED_WGS84;CONTINENT_DERIVED_FROM_COORDINATES;INSTITUTION_MATCH_FUZZY"
-104.836861,36.898694,"Bromus porteri",2242410354,"Vermejo Park Ranch: flats around small pond on ridgeline between Caliente Canyon and East Fork Chimney Canyon, 8 air mi ENE of Casa Grande and 1.5 air mi S of NM Hwy 555.","USA",5,2007,"PRESERVED_SPECIMEN","COORDINATE_ROUNDED;CONTINENT_DERIVED_FROM_COORDINATES;INSTITUTION_MATCH_FUZZY"
-105.74773,39.38671,"Bromus porteri",2242421283,"Pike National Forest, E edge of S Park, Lost Park Road ca 1.5 air miles E of Jefferson.","USA",NA,2015,"PRESERVED_SPECIMEN","CONTINENT_DERIVED_FROM_COORDINATES;INSTITUTION_MATCH_FUZZY"
-106.26287,37.20322,"Bromus porteri",2242422165,"San Juan Mountains on western side of San Luis Valley. Rajadero Canyon ACEC managed by BLM, ca. 28 miles SW of Alamosa.","USA",NA,2015,"PRESERVED_SPECIMEN","CONTINENT_DERIVED_FROM_COORDINATES;INSTITUTION_MATCH_FUZZY"
-105.862542,39.921558,"Bromus porteri",2242390258,"Arapaho National Forest, St. Louis Creek Campground, SW of Frasier","USA",NA,2011,"PRESERVED_SPECIMEN","GEODETIC_DATUM_ASSUMED_WGS84;CONTINENT_DERIVED_FROM_COORDINATES;INSTITUTION_MATCH_FUZZY"
-122.2,51.616667,"Bromus porteri",1988097730,"Cariboo-Chilcotin, Dog Creek area, grassland north above Dog Creek","CAN",NA,1994,"PRESERVED_SPECIMEN","GEODETIC_DATUM_ASSUMED_WGS84;GEODETIC_DATUM_INVALID;CONTINENT_DERIVED_FROM_COORDINATES;INSTITUTION_MATCH_NONE"
-100.505,50.855,"Bromus porteri",1988074067,"Riding Mountain National Park, central trail, 24.5 km west of junction with Stratchclair Trail, northeast of McTavish Lake","CAN",NA,1979,"PRESERVED_SPECIMEN","GEODETIC_DATUM_ASSUMED_WGS84;GEODETIC_DATUM_INVALID;CONTINENT_DERIVED_FROM_COORDINATES;INSTITUTION_MATCH_NONE"
-121.525,50.633333,"Bromus porteri",1988084861,"Thompson-Okanagan, Hat Creek, along Hat Creek Road","CAN",NA,1989,"PRESERVED_SPECIMEN","GEODETIC_DATUM_ASSUMED_WGS84;GEODETIC_DATUM_INVALID;CONTINENT_DERIVED_FROM_COORDINATES;INSTITUTION_MATCH_NONE"
-122.566667,51,"Bromus porteri",1988082244,"Farwell Creek","CAN",NA,1972,"PRESERVED_SPECIMEN","GEODETIC_DATUM_ASSUMED_WGS84;CONTINENT_DERIVED_FROM_COORDINATES;INSTITUTION_MATCH_NONE"
-130.833333,58.25,"Bromus porteri",1988086604,"Stikine River (Ranch)","CAN",NA,1977,"PRESERVED_SPECIMEN","GEODETIC_DATUM_ASSUMED_WGS84;GEODETIC_DATUM_INVALID;CONTINENT_DERIVED_FROM_COORDINATES;INSTITUTION_MATCH_NONE"
-110.083889,49.660278,"Bromus porteri",1988176675,"Reesor Lake","CAN",NA,2004,"PRESERVED_SPECIMEN","GEODETIC_DATUM_ASSUMED_WGS84;GEODETIC_DATUM_INVALID;CONTINENT_DERIVED_FROM_COORDINATES;INSTITUTION_MATCH_NONE"
-123,51.133333,"Bromus porteri",1988147188,"on east facing slope of Relay Creek basin","CAN",NA,1977,"PRESERVED_SPECIMEN","GEODETIC_DATUM_ASSUMED_WGS84;GEODETIC_DATUM_INVALID;CONTINENT_DERIVED_FROM_COORDINATES;INSTITUTION_MATCH_NONE"
-122.55,51.6,"Bromus porteri",1988133845,"Chilcotin plot no. 55","CAN",NA,1967,"PRESERVED_SPECIMEN","GEODETIC_DATUM_ASSUMED_WGS84;GEODETIC_DATUM_INVALID;CONTINENT_DERIVED_FROM_COORDINATES;INSTITUTION_MATCH_NONE"
-123.033333,51.766667,"Bromus porteri",1988081563,"Chilcotin plot no. 105","CAN",NA,1968,"PRESERVED_SPECIMEN","GEODETIC_DATUM_ASSUMED_WGS84;GEODETIC_DATUM_INVALID;CONTINENT_DERIVED_FROM_COORDINATES;INSTITUTION_MATCH_NONE"
-120.03,51.866667,"Bromus porteri",1988128103,"Wells Gray Provincial Park, Edgewood West","CAN",NA,2004,"PRESERVED_SPECIMEN","GEODETIC_DATUM_ASSUMED_WGS84;GEODETIC_DATUM_INVALID;CONTINENT_DERIVED_FROM_COORDINATES;INSTITUTION_MATCH_NONE"
-109.179,31.8794,"Bromus porteri",1322106261,"Chiricahua Mts., South Fork Cave Creek usually above high water mark.","USA",NA,2000,"PRESERVED_SPECIMEN","GEODETIC_DATUM_ASSUMED_WGS84"
-111.468105,44.337977,"Bromus porteri",1930038743,"Harriman Ranch. Uncertainty: 6780 m., Datum: WGS 84, Source: GeoLocate.","USA",NA,1975,"PRESERVED_SPECIMEN","GEODETIC_DATUM_ASSUMED_WGS84;COLLECTION_MATCH_FUZZY"
-106.62892,37.27698,"Bromus porteri",1930995535,"Rio Grande National Forest; ~8 miles SW of Platoro; just up start of N Fork Trail from Three Forks (of the Conejos River) area","USA",NA,2013,"PRESERVED_SPECIMEN","GEODETIC_DATUM_ASSUMED_WGS84;COLLECTION_MATCH_FUZZY"
-107.230833,39.999,"Bromus porteri",1986907130,"Clearing along White River, near source at Trappers Lake","USA",NA,1955,"PRESERVED_SPECIMEN","COORDINATE_ROUNDED;GEODETIC_DATUM_ASSUMED_WGS84;CONTINENT_DERIVED_FROM_COORDINATES;COLLECTION_MATCH_FUZZY"
-106.389333,40.3575,"Bromus porteri",1986917448,"20 miles southeast of Steamboat Springs, Harrisons picnic area","USA",NA,1966,"PRESERVED_SPECIMEN","COORDINATE_ROUNDED;GEODETIC_DATUM_ASSUMED_WGS84;CONTINENT_DERIVED_FROM_COORDINATES;COLLECTION_MATCH_FUZZY"
-112.7482,37.6523,"Bromus porteri",1987013663,"Mammoth Cr., Markagunt Plateau","USA",969,1978,"PRESERVED_SPECIMEN","CONTINENT_DERIVED_FROM_COORDINATES;COLLECTION_MATCH_FUZZY"
-110.812222,38.049167,"Bromus porteri",1986991083,"BLM, Hwy 24 E to Notom Rd., turn S, go S to Sandy Ranch, turn left (E) onto the Henry Mountain Road, go 20 miles to McClellan Springs Junction, site is 30 min NE of Nasty Flat.","USA",NA,2009,"PRESERVED_SPECIMEN","GEODETIC_DATUM_ASSUMED_WGS84;CONTINENT_DERIVED_FROM_COORDINATES;COLLECTION_MATCH_FUZZY"
-111.790833,38.518056,"Bromus porteri",1986990698,"BLM, Hwy 24, Hwy 25 E, turn onto Fishlake Shortcut Rd. across from Quakey Haven, S 0.5 mi. past 2 cabins on right (W).","USA",NA,2009,"PRESERVED_SPECIMEN","GEODETIC_DATUM_ASSUMED_WGS84;CONTINENT_DERIVED_FROM_COORDINATES;COLLECTION_MATCH_FUZZY"
-111.486,39.193667,"Bromus porteri",1986908107,"13 miles up Manti Canyon","USA",NA,1965,"PRESERVED_SPECIMEN","COORDINATE_ROUNDED;GEODETIC_DATUM_ASSUMED_WGS84;CONTINENT_DERIVED_FROM_COORDINATES;COLLECTION_MATCH_FUZZY"
-109.8468,39.4016,"Bromus porteri",1986910116,"Uintah And Ouray Indian Reservation; Hill Creek Extension of reservation; ridge top between Chandler Canyon and Hill Creek drainage, 60 miles South of Ouray along Weaver Reservoir road.","USA",NA,1965,"PRESERVED_SPECIMEN","GEODETIC_DATUM_ASSUMED_WGS84;CONTINENT_DERIVED_FROM_COORDINATES;COLLECTION_MATCH_FUZZY"
-111.2254,43.2752,"Bromus porteri",1986922314,"","USA",NA,1973,"PRESERVED_SPECIMEN","GEODETIC_DATUM_ASSUMED_WGS84;CONTINENT_DERIVED_FROM_COORDINATES;COLLECTION_MATCH_FUZZY"
-110.449,44.941833,"Bromus porteri",1986938564,"Yellowstone National Park; 50 m. east of Floating Island Lake. Stand SC-2","USA",NA,1986,"PRESERVED_SPECIMEN","COORDINATE_ROUNDED;GEODETIC_DATUM_ASSUMED_WGS84;CONTINENT_DERIVED_FROM_COORDINATES;COLLECTION_MATCH_FUZZY"
-111.85,38.679,"Bromus porteri",1986908250,"12 mi SE of Glenwood","USA",NA,1965,"PRESERVED_SPECIMEN","GEODETIC_DATUM_ASSUMED_WGS84;CONTINENT_DERIVED_FROM_COORDINATES;COLLECTION_MATCH_FUZZY"
-112.3367,37.5302,"Bromus porteri",1986922000,"Clay Ck","USA",NA,1976,"PRESERVED_SPECIMEN","GEODETIC_DATUM_ASSUMED_WGS84;CONTINENT_DERIVED_FROM_COORDINATES;COLLECTION_MATCH_FUZZY"
-112.2782,38.259,"Bromus porteri",1986935864,"Tushar Mountains, City Creek.","USA",NA,1984,"PRESERVED_SPECIMEN","GEODETIC_DATUM_ASSUMED_WGS84;CONTINENT_DERIVED_FROM_COORDINATES;COLLECTION_MATCH_FUZZY"
-109.6002,37.8076,"Bromus porteri",1986936078,"Cliff Dwellers Pasture, ca. 15 mi. WSW of Monticello","USA",NA,1984,"PRESERVED_SPECIMEN","GEODETIC_DATUM_ASSUMED_WGS84;CONTINENT_DERIVED_FROM_COORDINATES;COLLECTION_MATCH_FUZZY"
-104.76627,32.0008,"Bromus porteri",1986969872,"Lincoln National Forest; Near Wilderness Ridge Trail, 3 km north of Guadalupe National Park","USA",1864,1991,"PRESERVED_SPECIMEN","CONTINENT_DERIVED_FROM_COORDINATES;COLLECTION_MATCH_FUZZY"
-110.5517,42.3702,"Bromus porteri",1986924975,"LaBarge Creek, 1 mile within Forest Boundary","USA",NA,1978,"PRESERVED_SPECIMEN","GEODETIC_DATUM_ASSUMED_WGS84;CONTINENT_DERIVED_FROM_COORDINATES;COLLECTION_MATCH_FUZZY"
-105.987333,39.601,"Bromus porteri",1986926442,"Above Snake River on slope north of Keystone","USA",NA,1976,"PRESERVED_SPECIMEN","COORDINATE_ROUNDED;GEODETIC_DATUM_ASSUMED_WGS84;CONTINENT_DERIVED_FROM_COORDINATES;COLLECTION_MATCH_FUZZY"
-115.1652,36.7046,"Bromus porteri",1986919609,"Desert National Wildlife Refuge ; Perkins Spring Sheep Range.","USA",NA,1973,"PRESERVED_SPECIMEN","GEODETIC_DATUM_ASSUMED_WGS84;CONTINENT_DERIVED_FROM_COORDINATES;COLLECTION_MATCH_FUZZY"
-110.541,42.5125,"Bromus porteri",1986924383,"Lodgepole clear cut between Snider Basin and Mt. Darby; 1.6 miles from Lander Cut Off crossing of Darby Creek.","USA",NA,1978,"PRESERVED_SPECIMEN","GEODETIC_DATUM_ASSUMED_WGS84;CONTINENT_DERIVED_FROM_COORDINATES;COLLECTION_MATCH_FUZZY"
-100.082085,50.116227,"Bromus porteri",1986926217,"Rapid City: 2 mi west of town","CAN",2175,1976,"PRESERVED_SPECIMEN","CONTINENT_DERIVED_FROM_COORDINATES;COLLECTION_MATCH_FUZZY"
-111.6134,41.7472,"Bromus porteri",1987008810,"Cache-Wasatch National Forest [locality given only as TRS]","USA",969,1981,"PRESERVED_SPECIMEN","CONTINENT_DERIVED_FROM_COORDINATES;COLLECTION_MATCH_FUZZY"
-111.1996,42.453,"Bromus porteri",1987013614,"Beaver Cr., Preuss Range","USA",969,1978,"PRESERVED_SPECIMEN","CONTINENT_DERIVED_FROM_COORDINATES;COLLECTION_MATCH_FUZZY"
-116.622333,38.864333,"Bromus porteri",1986923692,"Toiyabe National Foest; Monitor Range; Morgan Creek","USA",NA,1977,"PRESERVED_SPECIMEN","COORDINATE_ROUNDED;GEODETIC_DATUM_ASSUMED_WGS84;CONTINENT_DERIVED_FROM_COORDINATES;COLLECTION_MATCH_FUZZY"
-104.437333,44.1005,"Bromus porteri",1986960552,"Black Hills, near Dry Cr. Rd. on Pine Ridge W of Skull Cr., ca. 10 air miles N of Osage","USA",NA,1984,"PRESERVED_SPECIMEN","COORDINATE_ROUNDED;GEODETIC_DATUM_ASSUMED_WGS84;CONTINENT_DERIVED_FROM_COORDINATES;COLLECTION_MATCH_FUZZY"
-112.6574,37.7102,"Bromus porteri",1986960816,"West side of Panguitch Lake in forest service campground and adjacent pasture","USA",NA,1984,"PRESERVED_SPECIMEN","GEODETIC_DATUM_ASSUMED_WGS84;CONTINENT_DERIVED_FROM_COORDINATES;COLLECTION_MATCH_FUZZY"
-112.2174,37.5833,"Bromus porteri",1986968124,"Bryce Canyon National Park ; Plot 39","USA",NA,1986,"PRESERVED_SPECIMEN","GEODETIC_DATUM_ASSUMED_WGS84;CONTINENT_DERIVED_FROM_COORDINATES;COLLECTION_MATCH_FUZZY"
-115.3685,40.617,"Bromus porteri",1986915200,"Humboldt National Forest; Lamoille Canyon, 1 mile above Terrace G. S.","USA",NA,1969,"PRESERVED_SPECIMEN","GEODETIC_DATUM_ASSUMED_WGS84;CONTINENT_DERIVED_FROM_COORDINATES;COLLECTION_MATCH_FUZZY"
-115.495833,38.889667,"Bromus porteri",1986929396,"Broom Canyon, at the old mine, White Pine Range","USA",NA,1979,"PRESERVED_SPECIMEN","COORDINATE_ROUNDED;GEODETIC_DATUM_ASSUMED_WGS84;CONTINENT_DERIVED_FROM_COORDINATES;COLLECTION_MATCH_FUZZY"
-111.088,39.5716,"Bromus porteri",1986933719,"Manti LaSal National Forest ; Second Water Canyon","USA",NA,1983,"PRESERVED_SPECIMEN","GEODETIC_DATUM_ASSUMED_WGS84;CONTINENT_DERIVED_FROM_COORDINATES;COLLECTION_MATCH_FUZZY"
-110.947667,43.754333,"Bromus porteri",1986897802,"Targhee National Forest; Treasure Mtn. Scout Camp, Teton Canyon.","USA",NA,1956,"PRESERVED_SPECIMEN","COORDINATE_ROUNDED;GEODETIC_DATUM_ASSUMED_WGS84;CONTINENT_DERIVED_FROM_COORDINATES;COLLECTION_MATCH_FUZZY"
-111.4495,39.3625,"Bromus porteri",1986922798,"Manti-La Sal National Forest ; Head of N Fork of Ephraim Canyon","USA",NA,1977,"PRESERVED_SPECIMEN","GEODETIC_DATUM_ASSUMED_WGS84;CONTINENT_DERIVED_FROM_COORDINATES;COLLECTION_MATCH_FUZZY"
-115.6216,36.3113,"Bromus porteri",1986929364,"Near Deer Creek picnic area, Spring Mtns.","USA",NA,1979,"PRESERVED_SPECIMEN","GEODETIC_DATUM_ASSUMED_WGS84;CONTINENT_DERIVED_FROM_COORDINATES;COLLECTION_MATCH_FUZZY"
-115.498833,38.337833,"Bromus porteri",1986936403,"Grant Range, ridge between Timber Mt. and Troy Peak","USA",NA,1984,"PRESERVED_SPECIMEN","COORDINATE_ROUNDED;GEODETIC_DATUM_ASSUMED_WGS84;CONTINENT_DERIVED_FROM_COORDINATES;COLLECTION_MATCH_FUZZY"
-107.688167,38.5445,"Bromus porteri",1986933572,"Black Canyon Of The Gunnison National Monument; South rim; ranger residence and utility area","USA",NA,1983,"PRESERVED_SPECIMEN","COORDINATE_ROUNDED;GEODETIC_DATUM_ASSUMED_WGS84;CONTINENT_DERIVED_FROM_COORDINATES;COLLECTION_MATCH_FUZZY"
