"lon","lat","species","gbifID","locality","countryCode","coordinateUncertaintyInMeters","year","basisOfRecord","issue"
-122.511667,51.858333,"Bromus porteri",1949579171,"Riske Creek: limestone knolls S of Toosey Indian Reserve","CAN",NA,1983,"PRESERVED_SPECIMEN","OCCURRENCE_STATUS_INFERRED_FROM_INDIVIDUAL_COUNT;COORDINATE_ROUNDED;GEODETIC_DATUM_ASSUMED_WGS84;DIFFERENT_OWNER_INSTITUTION"
-124.716667,54.933333,"Bromus porteri",1949554868,"Tatla Lake: 10 km W of Tatla Lake Village","CAN",NA,1980,"PRESERVED_SPECIMEN","OCCURRENCE_STATUS_INFERRED_FROM_INDIVIDUAL_COUNT;COORDINATE_ROUNDED;GEODETIC_DATUM_ASSUMED_WGS84;DIFFERENT_OWNER_INSTITUTION"
-123.433333,52.1,"Bromus porteri",1949578693,"Alexis Creek; Bull Canyon: 2 km W of; Alexis Creek area","CAN",NA,1983,"PRESERVED_SPECIMEN","OCCURRENCE_STATUS_INFERRED_FROM_INDIVIDUAL_COUNT;COORDINATE_ROUNDED;GEODETIC_DATUM_ASSUMED_WGS84;DIFFERENT_OWNER_INSTITUTION"
-124.986667,53.791667,"Bromus porteri",1949632053,"Skins Lake: NW corner","CAN",NA,2000,"PRESERVED_SPECIMEN","OCCURRENCE_STATUS_INFERRED_FROM_INDIVIDUAL_COUNT;COORDINATE_ROUNDED;GEODETIC_DATUM_ASSUMED_WGS84;DIFFERENT_OWNER_INSTITUTION"
-125.240556,56.078333,"Bromus porteri",1949654428,"Omineca Mountains; Swannell Ranges; Uslika Lake: forest service campsite W side of lake","CAN",NA,2009,"PRESERVED_SPECIMEN","OCCURRENCE_STATUS_INFERRED_FROM_INDIVIDUAL_COUNT;COORDINATE_ROUNDED;GEODETIC_DATUM_ASSUMED_WGS84;DIFFERENT_OWNER_INSTITUTION"
-121.466667,50.666667,"Bromus porteri",1949632631,"Cornwall Hills: along Cornwall Hills road","CAN",NA,1989,"PRESERVED_SPECIMEN","OCCURRENCE_STATUS_INFERRED_FROM_INDIVIDUAL_COUNT;COORDINATE_ROUNDED;GEODETIC_DATUM_ASSUMED_WGS84;DIFFERENT_OWNER_INSTITUTION"
-121.866667,51.4,"Bromus porteri",1949525820,"White Lake: NW of Clinton","CAN",NA,1969,"PRESERVED_SPECIMEN","OCCURRENCE_STATUS_INFERRED_FROM_INDIVIDUAL_COUNT;COORDINATE_ROUNDED;GEODETIC_DATUM_ASSUMED_WGS84;DIFFERENT_OWNER_INSTITUTION"
-120.1375,56.075,"Bromus porteri",1949649133,"","CAN",NA,1981,"PRESERVED_SPECIMEN","OCCURRENCE_STATUS_INFERRED_FROM_INDIVIDUAL_COUNT;GEODETIC_DATUM_ASSUMED_WGS84;DIFFERENT_OWNER_INSTITUTION"
-123.7,51.6,"Bromus porteri",1949542009,"Taseko River: Taseko River area; valley side on E by Taseko River Road","CAN",NA,1978,"PRESERVED_SPECIMEN","OCCURRENCE_STATUS_INFERRED_FROM_INDIVIDUAL_COUNT;GEODETIC_DATUM_ASSUMED_WGS84;DIFFERENT_OWNER_INSTITUTION"
-120.233333,50.233333,"Bromus porteri",1949652665,"Douglas Lake: N of lake","CAN",NA,1982,"PRESERVED_SPECIMEN","OCCURRENCE_STATUS_INFERRED_FROM_INDIVIDUAL_COUNT;COORDINATE_ROUNDED;GEODETIC_DATUM_ASSUMED_WGS84;DIFFERENT_OWNER_INSTITUTION"
-115.85,51.233333,"Bromus porteri",1211528452,"","CAN",301,1969,"PRESERVED_SPECIMEN","CONTINENT_DERIVED_FROM_COORDINATES;INSTITUTION_MATCH_NONE"
-107.540206,27.603813,"Bromus porteri",1893777721,"Cusarare; South of Cusarare, South of road vado of Arroyo Cusarare.","MEX",4300,1972,"PRESERVED_SPECIMEN","TYPE_STATUS_INVALID;OCCURRENCE_STATUS_INFERRED_FROM_INDIVIDUAL_COUNT;COORDINATE_ROUNDED;CONTINENT_DERIVED_FROM_COORDINATES;ELEVATION_MIN_MAX_SWAPPED;DIFFERENT_OWNER_INSTITUTION"
-107.633889,27.723889,"Bromus porteri",1893777732,"San Ignacio Arareco; South of San Ignacio and Creel airstrip","MEX",60,1972,"PRESERVED_SPECIMEN","TYPE_STATUS_INVALID;OCCURRENCE_STATUS_INFERRED_FROM_INDIVIDUAL_COUNT;COORDINATE_ROUNDED;GEODETIC_DATUM_ASSUMED_WGS84;CONTINENT_DERIVED_FROM_COORDINATES;ELEVATION_MIN_MAX_SWAPPED;DIFFERENT_OWNER_INSTITUTION"
-122.5975,38.62,"Bromus porteri",2417981457,"On Hwy 29, 4.5 miles west of Robert Lewis Stevenson State Park.","USA",402,1980,"PRESERVED_SPECIMEN","CONTINENT_DERIVED_FROM_COORDINATES;AMBIGUOUS_INSTITUTION"
-122.663611,39.8375,"Bromus porteri",2418008167,"On the south side of the Nomalaki Trail, about 1/4 mile southeast of Bowers Creek, about 1/2 mile northwest of Forest Road 23N69 (Mud Flat Road), about 6 1/2 miles (air) southwest of Paskenta. T23N R07W S20 SE1/4","USA",NA,2004,"PRESERVED_SPECIMEN","GEODETIC_DATUM_ASSUMED_WGS84;CONTINENT_DERIVED_FROM_COORDINATES;AMBIGUOUS_INSTITUTION"
-118.4525,37.520833,"Bromus porteri",2418035869,"White Mountains, Poison Creek drainage; ca. 2.5 miles east-southeast of Sheep Mountain.","USA",NA,2012,"PRESERVED_SPECIMEN","GEODETIC_DATUM_ASSUMED_WGS84;CONTINENT_DERIVED_FROM_COORDINATES;AMBIGUOUS_INSTITUTION"
-105.9294,40.1822,"Bromus porteri",3892754584,"Arapaho National Forest, Front Range, along Grand County Rd. 41, ca. 2 mi. W of US Hwy. 14, ca. 4 - 4.5 mi. NNW of Granby","USA",500,2003,"PRESERVED_SPECIMEN","GEODETIC_DATUM_ASSUMED_WGS84;GEODETIC_DATUM_INVALID;CONTINENT_DERIVED_FROM_COORDINATES;AMBIGUOUS_INSTITUTION"
-105.608625,40.371994,"Bromus porteri",3892755488,"Rocky Mountain National Park; Upper Beaver Meadows. Site 1, control.","USA",1500,2001,"PRESERVED_SPECIMEN","CONTINENT_DERIVED_FROM_COORDINATES;AMBIGUOUS_INSTITUTION"
-107.2708,38.2065,"Bromus porteri",1842867542,"Gunnison, 13 mi. N of Lake City on Hwy 149 & 2.3 mi. N of Alpine Rd turnoff. Flats and along Lake Fork Gunnison River","USA",NA,2009,"PRESERVED_SPECIMEN","GEODETIC_DATUM_ASSUMED_WGS84;CONTINENT_DERIVED_FROM_COORDINATES;INSTITUTION_MATCH_NONE"
-111.952,38.5265,"Bromus porteri",1842871785,"Sevier, 6.5 mi. W of Koosharem at Milos Kitchen","USA",NA,2009,"PRESERVED_SPECIMEN","GEODETIC_DATUM_ASSUMED_WGS84;CONTINENT_DERIVED_FROM_COORDINATES;INSTITUTION_MATCH_NONE"
-97.394958,49.869724,"Bromus porteri",3759505679,"","CAN",65,2021,"HUMAN_OBSERVATION","COORDINATE_ROUNDED;CONTINENT_DERIVED_FROM_COORDINATES"
-106.017485,50.247812,"Bromus porteri",2283455752,"","CAN",6,2017,"HUMAN_OBSERVATION","COORDINATE_ROUNDED;CONTINENT_DERIVED_FROM_COORDINATES"
-108.859259,40.524245,"Bromus porteri",3428566235,"Dinosaur National Monument; Ridgetop S of Starvation Valley, ca 2 Lower Big Joe Draw near confluence with Starvation Valley.","USA",500,1987,"PRESERVED_SPECIMEN","CONTINENT_DERIVED_FROM_COORDINATES;INSTITUTION_MATCH_FUZZY;INSTITUTION_COLLECTION_MISMATCH"
-118.56351,34.60738,"Bromus porteri",3897611908,"Western Transverse Ranges, Angeles National Forest, Warm Springs Mountain, Warm Springs Canyon. Warm Springs Fish Canyon Truck Trail, E entrance. Roadside.","USA",4,2022,"PRESERVED_SPECIMEN","CONTINENT_DERIVED_FROM_COORDINATES;INSTITUTION_MATCH_FUZZY"
-104.706375,44.594368,"Bromus porteri",2294449246,"","USA",NA,2019,"HUMAN_OBSERVATION","COORDINATE_ROUNDED;CONTINENT_DERIVED_FROM_COORDINATES"
-106.060751,39.535989,"Bromus porteri",3335074314,"","USA",9,2019,"HUMAN_OBSERVATION","COORDINATE_ROUNDED;CONTINENT_DERIVED_FROM_COORDINATES"
-107.3043,27.3232,"Bromus porteri",1895113121,"Sierra Madre Occidental, 20.3 mi S of Creel on road towards Rocheachic","MEX",60,2000,"PRESERVED_SPECIMEN","TYPE_STATUS_INVALID;OCCURRENCE_STATUS_INFERRED_FROM_INDIVIDUAL_COUNT;GEODETIC_DATUM_ASSUMED_WGS84;CONTINENT_DERIVED_FROM_COORDINATES;ELEVATION_MIN_MAX_SWAPPED;INSTITUTION_MATCH_NONE"
-108.166,28.2126,"Bromus porteri",1895113100,"Sierra Madre Occidental, 16.7 mi W of Baquiriachic on Hwy 16 towards Maycoba","MEX",60,2000,"PRESERVED_SPECIMEN","TYPE_STATUS_INVALID;OCCURRENCE_STATUS_INFERRED_FROM_INDIVIDUAL_COUNT;GEODETIC_DATUM_ASSUMED_WGS84;CONTINENT_DERIVED_FROM_COORDINATES;ELEVATION_MIN_MAX_SWAPPED;INSTITUTION_MATCH_NONE"
-107.141667,28.425,"Bromus porteri",1895113290,"Entre Cuauhtémoc y La Junta","MEX",60,1976,"PRESERVED_SPECIMEN","TYPE_STATUS_INVALID;OCCURRENCE_STATUS_INFERRED_FROM_INDIVIDUAL_COUNT;COORDINATE_ROUNDED;GEODETIC_DATUM_ASSUMED_WGS84;CONTINENT_DERIVED_FROM_COORDINATES;ELEVATION_MIN_MAX_SWAPPED;DIFFERENT_OWNER_INSTITUTION"
-107.74425,27.280861,"Bromus porteri",1895113107,"5.5 mi E of Cieneguita de Barranca on road towards Creel","MEX",60,2003,"PRESERVED_SPECIMEN","TYPE_STATUS_INVALID;OCCURRENCE_STATUS_INFERRED_FROM_INDIVIDUAL_COUNT;COORDINATE_ROUNDED;GEODETIC_DATUM_ASSUMED_WGS84;CONTINENT_DERIVED_FROM_COORDINATES;ELEVATION_MIN_MAX_SWAPPED;INSTITUTION_MATCH_NONE"
-107.4562,27.574,"Bromus porteri",1895113135,"Sierra Madre Occidental, 12.1 mi W of San Juanito on road towards Baquiriachic","MEX",60,2000,"PRESERVED_SPECIMEN","TYPE_STATUS_INVALID;OCCURRENCE_STATUS_INFERRED_FROM_INDIVIDUAL_COUNT;GEODETIC_DATUM_ASSUMED_WGS84;CONTINENT_DERIVED_FROM_COORDINATES;ELEVATION_MIN_MAX_SWAPPED;INSTITUTION_MATCH_NONE"
-102.506072,49.70093,"Bromus porteri",4046438369,"","CAN",5,2020,"HUMAN_OBSERVATION","COORDINATE_ROUNDED;CONTINENT_DERIVED_FROM_COORDINATES"
-114.1922,47.3037,"Bromus porteri",4069883280,"Trisky Creek, National Bison Range; ca. 2 mi NW of Ravalli.","USA",NA,1981,"PRESERVED_SPECIMEN","GEODETIC_DATUM_ASSUMED_WGS84;CONTINENT_DERIVED_FROM_COORDINATES;INSTITUTION_MATCH_FUZZY;INSTITUTION_COLLECTION_MISMATCH"
-113.73225,46.51036,"Bromus porteri",4069900649,"Butte Creek, two miles up creek from Rock creek. Trail ends at 46.51519 N. 113.732255 W.","USA",NA,2008,"PRESERVED_SPECIMEN","GEODETIC_DATUM_ASSUMED_WGS84;CONTINENT_DERIVED_FROM_COORDINATES;INSTITUTION_MATCH_FUZZY;INSTITUTION_COLLECTION_MISMATCH"
-107.393147,45.129411,"Bromus porteri",4069904977,"Wyola; about 8 miles south near state line.","USA",NA,1955,"PRESERVED_SPECIMEN","GEODETIC_DATUM_ASSUMED_WGS84;CONTINENT_DERIVED_FROM_COORDINATES;INSTITUTION_MATCH_FUZZY;INSTITUTION_COLLECTION_MISMATCH"
-112.7494,48.1384,"Bromus porteri",4069918540,"Sheep Creek; Above Creek 1 miles southwest of Tedson Reservoir.","USA",NA,1999,"PRESERVED_SPECIMEN","GEODETIC_DATUM_ASSUMED_WGS84;CONTINENT_DERIVED_FROM_COORDINATES;INSTITUTION_MATCH_FUZZY;INSTITUTION_COLLECTION_MISMATCH"
-112.7438,47.8642,"Bromus porteri",4069932137,"Rierdon Gulch, Pine Butte Swamp Preserve; Above Gulch.","USA",NA,1995,"PRESERVED_SPECIMEN","GEODETIC_DATUM_ASSUMED_WGS84;CONTINENT_DERIVED_FROM_COORDINATES;INSTITUTION_MATCH_FUZZY;INSTITUTION_COLLECTION_MISMATCH"
-120.427757,39.599835,"Bromus porteri",2610101181,"Sierra Valley, Martinetti Ranch, up Barry Creek.","USA",1200,1992,"PRESERVED_SPECIMEN","GEODETIC_DATUM_ASSUMED_WGS84;CONTINENT_DERIVED_FROM_COORDINATES;INSTITUTION_MATCH_FUZZY"
-112.0561157,44.8607198,"Bromus porteri",4068833183,"NRM Forest and Range Expt. Sta. Beaverhead National Forest. Beaver Creek.","USA",805,1953,"PRESERVED_SPECIMEN","RECORDED_DATE_INVALID;COORDINATE_REPROJECTED;CONTINENT_DERIVED_FROM_COORDINATES;INSTITUTION_MATCH_FUZZY;INSTITUTION_COLLECTION_MISMATCH"
-111.53,44.79,"Bromus porteri",4068868204,"Beaverhead Forest. Cliff Lake Bench Natural Area.","USA",NA,1968,"PRESERVED_SPECIMEN","RECORDED_DATE_INVALID;GEODETIC_DATUM_ASSUMED_WGS84;CONTINENT_DERIVED_FROM_COORDINATES;INSTITUTION_MATCH_FUZZY;INSTITUTION_COLLECTION_MISMATCH"
-111.315,39.8574,"Bromus porteri",1320852356,"Manti-LaSal National Forest. 0.6 mi. E of Garret Ridge Road on Forest Service 150 (Skyline Drive).","USA",NA,2009,"PRESERVED_SPECIMEN","GEODETIC_DATUM_ASSUMED_WGS84"
-117.689444,34.216667,"Bromus porteri",2610092139,"San Gabriel Mountains: Sunset Peak summit, just NE of San Dimas Experimental Forest.; Mount Baldy 7.5'","USA",100,2015,"PRESERVED_SPECIMEN","COORDINATE_ROUNDED;GEODETIC_DATUM_ASSUMED_WGS84;CONTINENT_DERIVED_FROM_COORDINATES;INSTITUTION_MATCH_FUZZY"
-123.267389,40.195806,"Bromus porteri",3320794664,"Local landmark: Barry Creek. Kettenpom Quad.","USA",NA,1979,"PRESERVED_SPECIMEN","GEODETIC_DATUM_ASSUMED_WGS84;CONTINENT_DERIVED_FROM_COORDINATES;INSTITUTION_MATCH_FUZZY"
-109.37,31.7581,"Bromus porteri",1320477542,"Chiricahua Mts., at junction of F.S. 74 & F.S. 74E at Rucker Canyon.","USA",NA,2000,"PRESERVED_SPECIMEN","GEODETIC_DATUM_ASSUMED_WGS84"
-108.98222,31.51972,"Bromus porteri",2422364307,"Coronado National Forest, upper Clanton Draw, 1 mile above the forest boundary along the road to Douglas","USA",NA,1982,"PRESERVED_SPECIMEN","GEODETIC_DATUM_ASSUMED_WGS84;CONTINENT_DERIVED_FROM_COORDINATES;AMBIGUOUS_INSTITUTION"
-119.02911,37.65756,"Bromus porteri",2422523392,"Mammoth Mountain, north branch Dry Creek, c. 0.1 mile east of Forest Service Rd 3S94","USA",NA,2017,"PRESERVED_SPECIMEN","GEODETIC_DATUM_ASSUMED_WGS84;CONTINENT_DERIVED_FROM_COORDINATES;AMBIGUOUS_INSTITUTION"
-110.934128,33.819835,"Bromus porteri",2610085328,"Tonto National Forest; Sierra Ancha Mountains; Workman Creek, below falls.","USA",NA,2017,"PRESERVED_SPECIMEN","GEODETIC_DATUM_ASSUMED_WGS84;CONTINENT_DERIVED_FROM_COORDINATES;INSTITUTION_MATCH_FUZZY"
-105.723167,33.392833,"Bromus porteri",1889159393,"Eagle Creek at junction of Highway 532 with Forest Service Road 157","USA",NA,1999,"PRESERVED_SPECIMEN","COORDINATE_ROUNDED;GEODETIC_DATUM_ASSUMED_WGS84;GEODETIC_DATUM_INVALID;CONTINENT_DERIVED_FROM_COORDINATES;INSTITUTION_MATCH_FUZZY;COLLECTION_MATCH_FUZZY"
-109.978931,31.478801,"Bromus porteri",3122397022,"Banning Creek Canyon, Mule Mountains, ca. 2.5 miles NW ofBisbee on Highway 80","USA",1119,1979,"PRESERVED_SPECIMEN","CONTINENT_DERIVED_FROM_COORDINATES;INSTITUTION_MATCH_FUZZY;COLLECTION_MATCH_FUZZY"
-99.892267,50.681522,"Bromus porteri",3335170457,"","CAN",11,2021,"HUMAN_OBSERVATION","COORDINATE_ROUNDED;CONTINENT_DERIVED_FROM_COORDINATES"
-110.787,34.5932,"Bromus porteri",2270684316,"Chevelon drainage above Woods Canyon Lake","USA",NA,1972,"PRESERVED_SPECIMEN","GEODETIC_DATUM_ASSUMED_WGS84;CONTINENT_DERIVED_FROM_COORDINATES;INSTITUTION_MATCH_FUZZY;INSTITUTION_COLLECTION_MISMATCH"
-112.276,34.2568,"Bromus porteri",2270638185,"5 miles northeast of Crown King.","USA",NA,1969,"PRESERVED_SPECIMEN","GEODETIC_DATUM_ASSUMED_WGS84;CONTINENT_DERIVED_FROM_COORDINATES;INSTITUTION_MATCH_FUZZY;INSTITUTION_COLLECTION_MISMATCH"
-103.396113,44.198911,"Bromus porteri",176897572,"Piedmont, 3 mi S; Stagebarn Canyon","USA",3819,1980,"PRESERVED_SPECIMEN","AMBIGUOUS_COLLECTION"
-103.547267,44.127139,"Bromus porteri",176897568,"Pactola Lake, 4.5 mi N","USA",6013,1970,"PRESERVED_SPECIMEN","AMBIGUOUS_COLLECTION"
-113.290992,46.207122,"Bromus porteri",318050328,"Phillipsburg Bay Campground Area on NW side of Georgetown Lake","USA",674,1989,"PRESERVED_SPECIMEN","AMBIGUOUS_COLLECTION"
-103.735163,44.244154,"Bromus porteri",176897570,"Lead, 7 mi S, 1 mi E; top of Custer Peak","USA",411,1970,"PRESERVED_SPECIMEN","AMBIGUOUS_COLLECTION"
-112.283967,46.642217,"Bromus porteri",3426578330,"USFS Road 4005 at boundary of Helena National Forest on road to Dog Creek, Clark's Canyon Road.","USA",50,2021,"PRESERVED_SPECIMEN","COORDINATE_ROUNDED;GEODETIC_DATUM_ASSUMED_WGS84;CONTINENT_DERIVED_FROM_COORDINATES;INSTITUTION_MATCH_FUZZY;COLLECTION_MATCH_NONE"
-112.424886,44.718002,"Bromus porteri",2464627922,"Basin Creek Valley, exclosure by spring ca 0.8 miles S of confluence of Basin Creek and Little Basin Creek, ca 4.2 air miles N of Red Rock River, ca 9 air miles NE of Lima. T13S R7W S11 SW4 SE4 NW4","USA",NA,2017,"PRESERVED_SPECIMEN","CONTINENT_DERIVED_FROM_COORDINATES;INSTITUTION_MATCH_FUZZY;COLLECTION_MATCH_NONE"
-118.8801,37.5289,"Bromus porteri",1426265215,"Above Bighorn Lake. Convict Creek Basin, Sierra Nevada.","USA",500,1962,"PRESERVED_SPECIMEN","COLLECTION_MATCH_FUZZY"
-96.99175,18.056556,"Bromus porteri",1894567412,"17.5 km al NE de San Juan de los Cués, cerca de Santiago Nopala","MEX",90,2006,"PRESERVED_SPECIMEN","TYPE_STATUS_INVALID;OCCURRENCE_STATUS_INFERRED_FROM_INDIVIDUAL_COUNT;COORDINATE_ROUNDED;GEODETIC_DATUM_ASSUMED_WGS84;CONTINENT_DERIVED_FROM_COORDINATES;ELEVATION_MIN_MAX_SWAPPED;INSTITUTION_MATCH_NONE"
-100.15,50.78333,"Bromus porteri",1259816889,"Wasagaming. Road to Audy Lake: Jackfish Creek. Riding mountain national park. Prairie between willow thicket & half grown trembling aspen.","CAN",NA,1966,"PRESERVED_SPECIMEN","GEODETIC_DATUM_ASSUMED_WGS84;INSTITUTION_MATCH_FUZZY;COLLECTION_MATCH_NONE"
-109.111359,33.938301,"Bromus porteri",2573397673,"Common in mountain meadow, clay loam soil; saddle below Escudilla Mountain, 8 miles east of Nutrioso.","USA",500,1951,"PRESERVED_SPECIMEN","CONTINENT_DERIVED_FROM_COORDINATES;AMBIGUOUS_INSTITUTION"
-108.11008,39.787131,"Bromus porteri",2573444139,"0.8 miles SW of Clubine Ranch (Piceance Creek Ranch).","USA",500,1982,"PRESERVED_SPECIMEN","COORDINATE_ROUNDED;CONTINENT_DERIVED_FROM_COORDINATES;AMBIGUOUS_INSTITUTION"
-106.77684,39.820249,"Bromus porteri",2573442063,"Bureau of Land Management; Edges Lake outflow, 4.5 miles northeast of Castle Peak.","USA",1000,1993,"PRESERVED_SPECIMEN","COORDINATE_ROUNDED;CONTINENT_DERIVED_FROM_COORDINATES;AMBIGUOUS_INSTITUTION"
-106.23862,39.41213,"Bromus porteri",2573460914,"Central Colorado: Sawatch Range, West Slope Continental Divide: off Forest Road 714, just below Sheep Mountain, ca 6 air mi NE of Tennessee Pass.","USA",800,2001,"PRESERVED_SPECIMEN","CONTINENT_DERIVED_FROM_COORDINATES;AMBIGUOUS_INSTITUTION"
-104.889685,38.992563,"Bromus porteri",2573444172,"US Air Force Academy. SW of Pine Drive X Academy Drive.","USA",100,1991,"PRESERVED_SPECIMEN","COORDINATE_ROUNDED;CONTINENT_DERIVED_FROM_COORDINATES;AMBIGUOUS_INSTITUTION"
-105.545727,39.913208,"Bromus porteri",2573445725,"Between Tolland and Rollinsville.","USA",5000,2011,"PRESERVED_SPECIMEN","COORDINATE_ROUNDED;CONTINENT_DERIVED_FROM_COORDINATES;AMBIGUOUS_INSTITUTION"
-106.530005,40.143833,"Bromus porteri",2573442841,"Sierra Madre/Park Ranges: Park Range: above North Fork Pass Creek on Red Dirt Road, ca 9 air mi NW of Kremmling.","USA",NA,1989,"PRESERVED_SPECIMEN","COORDINATE_ROUNDED;CONTINENT_DERIVED_FROM_COORDINATES;AMBIGUOUS_INSTITUTION"
-107.10004,38.04444,"Bromus porteri",2573443379,"Cebolla Creek Campground, between Cathedral and Slumgullion Pass.","USA",1000,1964,"PRESERVED_SPECIMEN","CONTINENT_DERIVED_FROM_COORDINATES;AMBIGUOUS_INSTITUTION"
-104.49229,37.00993,"Bromus porteri",3067054365,"Crazy French Ranch, Raton Mesa and vicinity; east side of I-25 approx. 6 miles south of the town of Trinidad and just north of New Mexico; along Old Raton Pass Road south of McBride Creek;","USA",1750,2019,"PRESERVED_SPECIMEN","CONTINENT_DERIVED_FROM_COORDINATES;AMBIGUOUS_INSTITUTION"
-104.738238,39.012732,"Bromus porteri",2573442782,"La Foret, Black Forest. Vic. of ball field on Milam Road.","USA",1000,1992,"PRESERVED_SPECIMEN","COORDINATE_ROUNDED;CONTINENT_DERIVED_FROM_COORDINATES;AMBIGUOUS_INSTITUTION"
-106.359849,38.929849,"Bromus porteri",2573443865,"San Isabel National Forest, Collegiate Peaks Wilderness Area, Missouri Basin.","USA",5000,1993,"PRESERVED_SPECIMEN","COORDINATE_ROUNDED;CONTINENT_DERIVED_FROM_COORDINATES;AMBIGUOUS_INSTITUTION"
-104.51764,37.03396,"Bromus porteri",3067047365,"Crazy French Ranch, Raton Mesa and vicinity; east side of I-25 approx. 6 miles south of the town of Trinidad and just north of New Mexico; hillsides just south of main ranch house;","USA",250,2019,"PRESERVED_SPECIMEN","CONTINENT_DERIVED_FROM_COORDINATES;AMBIGUOUS_INSTITUTION"
-107.4143,38.45219,"Bromus porteri",2573445759,"Curecanti National Recreation Area. Upper part of Curecanti Creek Trail. GPS waypoint: BC7.","USA",100,2003,"PRESERVED_SPECIMEN","CONTINENT_DERIVED_FROM_COORDINATES;AMBIGUOUS_INSTITUTION"
-107.0323,41.1854,"Bromus porteri",2573394674,"Medicine Bow Mountains: Sawmill Park, S of intersection of Forest roads 120 and 120.2F, ca 8 air mi SW of Arlington; ca 19 air mi NW of Centennial.","USA",3200,2008,"PRESERVED_SPECIMEN","CONTINENT_DERIVED_FROM_COORDINATES;AMBIGUOUS_INSTITUTION"
-107.24283,38.37677,"Bromus porteri",2573444527,"Curecanti National Recreation Area. South from Gateview Campground along Lake Fork of the Gunnison River. GPS waypoint: BC5.","USA",100,2003,"PRESERVED_SPECIMEN","CONTINENT_DERIVED_FROM_COORDINATES;AMBIGUOUS_INSTITUTION"
-106.7622,37.17063,"Bromus porteri",2573462742,"San Juan National Forest; ~10 miles NNE of Chromo; ~3 miles SW of Flattop Mt.","USA",100,2014,"PRESERVED_SPECIMEN","CONTINENT_DERIVED_FROM_COORDINATES;AMBIGUOUS_INSTITUTION"
-109.038188,40.957173,"Bromus porteri",2573444121,"Cold Spring Mountain; Wiggins Hunting Camp, vic. of O-Wi-Yu-Kuts Spring.","USA",1000,1970,"PRESERVED_SPECIMEN","COORDINATE_ROUNDED;CONTINENT_DERIVED_FROM_COORDINATES;AMBIGUOUS_INSTITUTION"
-105.5888,39.8122,"Bromus porteri",2573443735,"Arapaho National Forest: Front Range, ca 4 air mi WNW of Central City; ca 6.5 air mi NE of Empire, between Sheridan Hill and Mount Pisgah.","USA",100,2003,"PRESERVED_SPECIMEN","CONTINENT_DERIVED_FROM_COORDINATES;AMBIGUOUS_INSTITUTION"
-105.307005,39.986587,"Bromus porteri",2573443053,"Boulder Mt. Parks. Panther Canyon, NW side of Green Mt.","USA",1000,1992,"PRESERVED_SPECIMEN","COORDINATE_ROUNDED;CONTINENT_DERIVED_FROM_COORDINATES;AMBIGUOUS_INSTITUTION"
-107.346641,39.835667,"Bromus porteri",2573443693,"Flat Tops/ White River Plateau: South Fork White River, Budges Resort, ca 20 air mi N of Glenwood Springs.","USA",1000,1991,"PRESERVED_SPECIMEN","COORDINATE_ROUNDED;CONTINENT_DERIVED_FROM_COORDINATES;AMBIGUOUS_INSTITUTION"
-105.55044,37.618039,"Bromus porteri",2573445607,"Sangre de Cristo Range, South Zapata Creek drainage.","USA",1000,1998,"PRESERVED_SPECIMEN","COORDINATE_ROUNDED;CONTINENT_DERIVED_FROM_COORDINATES;AMBIGUOUS_INSTITUTION"
-109.01419,31.5215,"Bromus porteri",2422362120,"Coronado National Forest, upper Clanton Draw, 2.6 mi above the forest boundary along the road to Douglas","USA",NA,1982,"PRESERVED_SPECIMEN","GEODETIC_DATUM_ASSUMED_WGS84;CONTINENT_DERIVED_FROM_COORDINATES;AMBIGUOUS_INSTITUTION"
-106.712265,51.98118,"Bromus porteri",2868226822,"","CAN",500,2008,"HUMAN_OBSERVATION","COORDINATE_ROUNDED;CONTINENT_DERIVED_FROM_COORDINATES"
-110.556,31.5147,"Bromus porteri",1320121335,"Canelo Hills, 14.4 mi SW of HWY 83 on F.S. 799, just N of Canelo Pass.","USA",NA,2000,"PRESERVED_SPECIMEN","GEODETIC_DATUM_ASSUMED_WGS84"
-105.8,26.8333,"Bromus porteri",1319674637,"Near Arroyo de Granadeña, W side of Sierras near San Francisco de Oro","MEX",NA,1959,"PRESERVED_SPECIMEN","GEODETIC_DATUM_ASSUMED_WGS84"
-103.96528,43.84698,"Bromus porteri",2512284883,"T2S R1E S26 NE1/4","USA",NA,1984,"PRESERVED_SPECIMEN","GEODETIC_DATUM_ASSUMED_WGS84;CONTINENT_DERIVED_FROM_COORDINATES;INSTITUTION_MATCH_FUZZY;COLLECTION_MATCH_FUZZY"
-103.944033,44.461004,"Bromus porteri",2512330378,"Black Hills National Forest; approximately 5 air miles southwest (245 degrees) from Spearfish, in the vicinity of Higgins and Griggs Gulches","USA",NA,2010,"PRESERVED_SPECIMEN","CONTINENT_DERIVED_FROM_COORDINATES;INSTITUTION_MATCH_NONE"
-104.034189,44.470193,"Bromus porteri",2512285947,"Bear/Beaver Gulches Botanical Area, near northern edge of botanical area","USA",NA,2009,"PRESERVED_SPECIMEN","CONTINENT_DERIVED_FROM_COORDINATES;INSTITUTION_MATCH_NONE"
-103.512036,44.293693,"Bromus porteri",2815654349,"Ca. 7 miles north of Nemo and 1 mile west of U.S. Forest Service Road 151","USA",458,1991,"PRESERVED_SPECIMEN","CONTINENT_DERIVED_FROM_COORDINATES;INSTITUTION_MATCH_FUZZY;COLLECTION_MATCH_FUZZY"
-103.787585,44.335572,"Bromus porteri",2815654352,"Terry Peak Road","USA",43,1960,"PRESERVED_SPECIMEN","CONTINENT_DERIVED_FROM_COORDINATES;INSTITUTION_MATCH_FUZZY;COLLECTION_MATCH_FUZZY"
-103.951667,43.74,"Bromus porteri",2512286824,"Ca. 5 miles west of Jewel Cave National Monument","USA",NA,2018,"PRESERVED_SPECIMEN","GEODETIC_DATUM_ASSUMED_WGS84;CONTINENT_DERIVED_FROM_COORDINATES;INSTITUTION_MATCH_FUZZY;COLLECTION_MATCH_FUZZY"
-106.55,38.37,"Bromus porteri",3798053423,"Southern Gunnison Basin: Cochetopa Hills: ca 1.8 air mi N of Needle Creek Reservoir; ca 4.9 air mi E of Lions Head; ca 7.7 air mi WSW of Sargents along Needle Creek.","USA",NA,1998,"PRESERVED_SPECIMEN","OCCURRENCE_STATUS_INFERRED_FROM_INDIVIDUAL_COUNT;CONTINENT_DERIVED_FROM_COORDINATES;INSTITUTION_MATCH_FUZZY"
-106.31,39.83,"Bromus porteri",3798066114,"Gore Range: Arapaho National Forest: vicinity of Surprise Trailhead near the end of Cataract Creek Road, ca 19 air mi Nw of Silverthorne at I-70.","USA",NA,2011,"PRESERVED_SPECIMEN","OCCURRENCE_STATUS_INFERRED_FROM_INDIVIDUAL_COUNT;CONTINENT_DERIVED_FROM_COORDINATES;INSTITUTION_MATCH_FUZZY"
-108.84,38.69,"Bromus porteri",3798136476,"Pine Mt, Northend District","USA",NA,1962,"PRESERVED_SPECIMEN","OCCURRENCE_STATUS_INFERRED_FROM_INDIVIDUAL_COUNT;CONTINENT_DERIVED_FROM_COORDINATES;INSTITUTION_MATCH_FUZZY"
-106.72,40.56,"Bromus porteri",3798136479,"near head of Walton Ck, 0.8 mi N of US Hwy 40","USA",NA,1983,"PRESERVED_SPECIMEN","OCCURRENCE_STATUS_INFERRED_FROM_INDIVIDUAL_COUNT;CONTINENT_DERIVED_FROM_COORDINATES;INSTITUTION_MATCH_FUZZY"
-108.51,37.24,"Bromus porteri",3798136485,"near Far View Ruin, Mesa Verde Natl Park","USA",NA,1958,"PRESERVED_SPECIMEN","OCCURRENCE_STATUS_INFERRED_FROM_INDIVIDUAL_COUNT;CONTINENT_DERIVED_FROM_COORDINATES;INSTITUTION_MATCH_FUZZY"
-106.55,38.23,"Bromus porteri",3798136488,"divide on Spanish Ck Rd","USA",NA,1971,"PRESERVED_SPECIMEN","OCCURRENCE_STATUS_INFERRED_FROM_INDIVIDUAL_COUNT;CONTINENT_DERIVED_FROM_COORDINATES;INSTITUTION_MATCH_FUZZY"
-106.65,38.01,"Bromus porteri",3798136491,"Lake Fk of Saguache Ck","USA",NA,1952,"PRESERVED_SPECIMEN","OCCURRENCE_STATUS_INFERRED_FROM_INDIVIDUAL_COUNT;CONTINENT_DERIVED_FROM_COORDINATES;INSTITUTION_MATCH_FUZZY"
-106.67,38.2,"Bromus porteri",3798136492,"Cochetopa Park, S of W Pass Ck & E of Cochetopa Dome","USA",NA,1959,"PRESERVED_SPECIMEN","OCCURRENCE_STATUS_INFERRED_FROM_INDIVIDUAL_COUNT;CONTINENT_DERIVED_FROM_COORDINATES;INSTITUTION_MATCH_FUZZY"
-106.12,37.08,"Bromus porteri",3798137276,"3.5 mi ENE of Los Magotes, 1.5 mi NNW of Las Mesitas","USA",NA,1988,"PRESERVED_SPECIMEN","OCCURRENCE_STATUS_INFERRED_FROM_INDIVIDUAL_COUNT;CONTINENT_DERIVED_FROM_COORDINATES;INSTITUTION_MATCH_FUZZY"
-105.08,39.42,"Bromus porteri",3798137274,"SSW of Carpenter Peak","USA",NA,1985,"PRESERVED_SPECIMEN","OCCURRENCE_STATUS_INFERRED_FROM_INDIVIDUAL_COUNT;CONTINENT_DERIVED_FROM_COORDINATES;INSTITUTION_MATCH_FUZZY"
-107.967,39.6333,"Bromus porteri",1804373469,"Rio Blanco","USA",NA,1988,"PRESERVED_SPECIMEN","OCCURRENCE_STATUS_INFERRED_FROM_INDIVIDUAL_COUNT;GEODETIC_DATUM_ASSUMED_WGS84;CONTINENT_DERIVED_FROM_COORDINATES;COLLECTION_MATCH_FUZZY"
