"lon","lat","species","gbifID","locality","countryCode","coordinateUncertaintyInMeters","year","basisOfRecord","issue"
-109.694,40.8825,"Bromus porteri",1986907332,"Uinta Mts 3 mi E of Summit Springs Ranger Station","USA",NA,1955,"PRESERVED_SPECIMEN","GEODETIC_DATUM_ASSUMED_WGS84;CONTINENT_DERIVED_FROM_COORDINATES;COLLECTION_MATCH_FUZZY"
-111.736603,35.024248,"Bromus porteri",1986961884,"Oak Creek Canyon, 14 mi. north of Sedona","USA",5017,1985,"PRESERVED_SPECIMEN","CONTINENT_DERIVED_FROM_COORDINATES;COLLECTION_MATCH_FUZZY"
-107.484167,38.844667,"Bromus porteri",1986912349,"Dry road bed 20 feet above Lake Fork stream","USA",NA,1961,"PRESERVED_SPECIMEN","COORDINATE_ROUNDED;GEODETIC_DATUM_ASSUMED_WGS84;CONTINENT_DERIVED_FROM_COORDINATES;COLLECTION_MATCH_FUZZY"
-110.459333,42.934,"Bromus porteri",1986923880,"North Horse Creek Road, 6.8 miles W of Merna Junction and 4 miles W of Sherman Guard Station, Wyoming Mountain Range","USA",NA,1978,"PRESERVED_SPECIMEN","COORDINATE_ROUNDED;GEODETIC_DATUM_ASSUMED_WGS84;CONTINENT_DERIVED_FROM_COORDINATES;COLLECTION_MATCH_FUZZY"
-111.0584,40.3229,"Bromus porteri",1986935228,"Slopes 3/4 mi S of Currant Ck Dam 23 mi SE of Heber City","USA",NA,1984,"PRESERVED_SPECIMEN","GEODETIC_DATUM_ASSUMED_WGS84;CONTINENT_DERIVED_FROM_COORDINATES;COLLECTION_MATCH_FUZZY"
-106.323,38.924333,"Bromus porteri",1986936811,"San Isabel National Forest; 1.5 miles northeast of gunnison, Chaffee County Line, west face of Mt. Harvard, Sawatch Range, along Continental Divide, SE of Pine Creek, above Missouri Basin","USA",NA,1984,"PRESERVED_SPECIMEN","COORDINATE_ROUNDED;GEODETIC_DATUM_ASSUMED_WGS84;CONTINENT_DERIVED_FROM_COORDINATES;COLLECTION_MATCH_FUZZY"
-110.6455,41.7315,"Bromus porteri",1986937420,"Green River Basin, near Elkol, 6 air miles SW of Kemmerer","USA",NA,1982,"PRESERVED_SPECIMEN","GEODETIC_DATUM_ASSUMED_WGS84;CONTINENT_DERIVED_FROM_COORDINATES;COLLECTION_MATCH_FUZZY"
-107.428333,40.0595,"Bromus porteri",1986902346,"12 miles NE Buford","USA",NA,1955,"PRESERVED_SPECIMEN","COORDINATE_ROUNDED;GEODETIC_DATUM_ASSUMED_WGS84;CONTINENT_DERIVED_FROM_COORDINATES;COLLECTION_MATCH_FUZZY"
-110.855667,39.873333,"Bromus porteri",1986918674,"Ashley National Forest; Duchesne District, junction of Fossil and Reservation Ridges","USA",NA,1973,"PRESERVED_SPECIMEN","COORDINATE_ROUNDED;GEODETIC_DATUM_ASSUMED_WGS84;CONTINENT_DERIVED_FROM_COORDINATES;COLLECTION_MATCH_FUZZY"
-110.7013,40.5033,"Bromus porteri",1986919424,"Ashley National Forest; Duchesne District, Burnt Ridge","USA",NA,1974,"PRESERVED_SPECIMEN","GEODETIC_DATUM_ASSUMED_WGS84;CONTINENT_DERIVED_FROM_COORDINATES;COLLECTION_MATCH_FUZZY"
-111.141833,39.4555,"Bromus porteri",1986921564,"Manti-LaSal National Forest ; Mouth of Tie Fork, Huntington Canyon","USA",NA,1976,"PRESERVED_SPECIMEN","COORDINATE_ROUNDED;GEODETIC_DATUM_ASSUMED_WGS84;CONTINENT_DERIVED_FROM_COORDINATES;COLLECTION_MATCH_FUZZY"
-116.9168,38.7363,"Bromus porteri",1986933776,"Toquima Mountain Range","USA",NA,1979,"PRESERVED_SPECIMEN","GEODETIC_DATUM_ASSUMED_WGS84;CONTINENT_DERIVED_FROM_COORDINATES;COLLECTION_MATCH_FUZZY"
-112.241661,36.768233,"Bromus porteri",1986993064,"East flank of La Fevre Ridge, ca 1 mile E of US Hwy Alt 89, ca 6 miles NW of Jacob Lake, 22 miles SE of Fredonia","USA",NA,2011,"PRESERVED_SPECIMEN","GEODETIC_DATUM_ASSUMED_WGS84;CONTINENT_DERIVED_FROM_COORDINATES;COLLECTION_MATCH_FUZZY"
-114.3093,39.0198,"Bromus porteri",1987008818,"Humboldt National Forest [locality given only as TRS]","USA",969,1984,"PRESERVED_SPECIMEN","CONTINENT_DERIVED_FROM_COORDINATES;COLLECTION_MATCH_FUZZY"
-111.438,39.041,"Bromus porteri",1986922452,"Manti LaSal Nat For; Head of south fork of Muddy Creek","USA",NA,1976,"PRESERVED_SPECIMEN","GEODETIC_DATUM_ASSUMED_WGS84;CONTINENT_DERIVED_FROM_COORDINATES;COLLECTION_MATCH_FUZZY"
-114.3143,38.6983,"Bromus porteri",1986938177,"Snake Range, Murphys Wash at the south end of the range, 4.9 road miles N of Big Springs Wash road, canyon west of the road","USA",NA,1985,"PRESERVED_SPECIMEN","GEODETIC_DATUM_ASSUMED_WGS84;CONTINENT_DERIVED_FROM_COORDINATES;COLLECTION_MATCH_FUZZY"
-116.6437,38.6942,"Bromus porteri",1987009021,"Toiyabe National Forest [locality given as TRS]","USA",969,1984,"PRESERVED_SPECIMEN","CONTINENT_DERIVED_FROM_COORDINATES;COLLECTION_MATCH_FUZZY"
-108.092167,39.038833,"Bromus porteri",1986906004,"Lost Lake","USA",NA,1955,"PRESERVED_SPECIMEN","COORDINATE_ROUNDED;GEODETIC_DATUM_ASSUMED_WGS84;CONTINENT_DERIVED_FROM_COORDINATES;COLLECTION_MATCH_FUZZY"
-116.4731,37.4724,"Bromus porteri",1986915172,"U.S. Atomic Energy Commission's Nevada Test Site; Gold Flat, base of cliffs, Columbine (Silent) Canyon, no. Pahute Mesa","USA",NA,1967,"PRESERVED_SPECIMEN","GEODETIC_DATUM_ASSUMED_WGS84;CONTINENT_DERIVED_FROM_COORDINATES;COLLECTION_MATCH_FUZZY"
-112.6392,37.5509,"Bromus porteri",1987013396,"Duck Cr. Sinks, Markagunt Plateau","USA",969,1978,"PRESERVED_SPECIMEN","CONTINENT_DERIVED_FROM_COORDINATES;COLLECTION_MATCH_FUZZY"
-111.2168,39.0539,"Bromus porteri",1986932821,"Nelson Mtn. top, NE side of pt 9070; ca. 6 mi. SW Ferron","USA",NA,1983,"PRESERVED_SPECIMEN","GEODETIC_DATUM_ASSUMED_WGS84;CONTINENT_DERIVED_FROM_COORDINATES;COLLECTION_MATCH_FUZZY"
-111.55177,40.71232,"Bromus porteri",1986982614,"Slopes below Snydermill Lodge (E of Olympic ski jump, NNW of Park City).","USA",NA,2008,"PRESERVED_SPECIMEN","GEODETIC_DATUM_ASSUMED_WGS84;CONTINENT_DERIVED_FROM_COORDINATES;COLLECTION_MATCH_FUZZY"
-111.670576,38.148698,"Bromus porteri",1986982801,"Aquarius Plateau: Sage Hen Draw on west side of FS Road ca 0.5 miles N of Dixie NF boundary and 1 mile N of Timbered Knoll, ca 17 air miles S of Loa.","USA",NA,2005,"PRESERVED_SPECIMEN","GEODETIC_DATUM_ASSUMED_WGS84;CONTINENT_DERIVED_FROM_COORDINATES;COLLECTION_MATCH_FUZZY"
-109.768194,37.766361,"Bromus porteri",1987020849,"Manti-La Sal National Forest, west of the Abajo mountains on Elk Ridge, near FR 170","USA",NA,2014,"PRESERVED_SPECIMEN","GEODETIC_DATUM_ASSUMED_WGS84;CONTINENT_DERIVED_FROM_COORDINATES;COLLECTION_MATCH_FUZZY"
-110.3799,40.9668,"Bromus porteri",1986908709,"West side of Bridger Lake","USA",NA,1965,"PRESERVED_SPECIMEN","GEODETIC_DATUM_ASSUMED_WGS84;CONTINENT_DERIVED_FROM_COORDINATES;COLLECTION_MATCH_FUZZY"
-106.046667,39.491167,"Bromus porteri",1986927004,"Dry flats above the river near Breckenridge","USA",NA,1976,"PRESERVED_SPECIMEN","COORDINATE_ROUNDED;GEODETIC_DATUM_ASSUMED_WGS84;CONTINENT_DERIVED_FROM_COORDINATES;COLLECTION_MATCH_FUZZY"
-104.058167,43.669,"Bromus porteri",1986960523,"Black Hills, Elk Mountains at the state line, ca. 14 air miles SE of Newcastle","USA",NA,1982,"PRESERVED_SPECIMEN","COORDINATE_ROUNDED;GEODETIC_DATUM_ASSUMED_WGS84;CONTINENT_DERIVED_FROM_COORDINATES;COLLECTION_MATCH_FUZZY"
-113.736917,41.638689,"Bromus porteri",1986857561,"Grouse Creek Mountains; along Ingham Pass Road, about 5000 feet below pass","USA",301,2016,"PRESERVED_SPECIMEN","CONTINENT_DERIVED_FROM_COORDINATES;COLLECTION_MATCH_FUZZY"
-115.207667,36.631667,"Bromus porteri",1986971936,"Desert National Wildlife Refuge ; Hidden Forest, Sheep Range","USA",NA,1979,"PRESERVED_SPECIMEN","COORDINATE_ROUNDED;GEODETIC_DATUM_ASSUMED_WGS84;CONTINENT_DERIVED_FROM_COORDINATES;COLLECTION_MATCH_FUZZY"
-109.9713,45.006,"Bromus porteri",1986933163,"Silvergate, northeast of town along Soda Butte Creek, approx. 1/2 mi. north of Montana-Wyoming state line, along Hwy. 212","USA",NA,1983,"PRESERVED_SPECIMEN","GEODETIC_DATUM_ASSUMED_WGS84;CONTINENT_DERIVED_FROM_COORDINATES;COLLECTION_MATCH_FUZZY"
-112.304722,38.081667,"Bromus porteri",1986989624,"BLM, From Circleville travel S on Center Street 7 mi, take Fremont ATV trail to site (population to S of road).","USA",NA,2009,"PRESERVED_SPECIMEN","GEODETIC_DATUM_ASSUMED_WGS84;CONTINENT_DERIVED_FROM_COORDINATES;COLLECTION_MATCH_FUZZY"
-101.850536,50.694963,"Bromus porteri",2574224820,"","CAN",416,2009,"HUMAN_OBSERVATION","COORDINATE_ROUNDED;CONTINENT_DERIVED_FROM_COORDINATES"
-118.164378,37.527331,"Bromus porteri",2826268849,"","USA",4,2015,"HUMAN_OBSERVATION","COORDINATE_ROUNDED;CONTINENT_DERIVED_FROM_COORDINATES"
-110.497242,44.712773,"Bromus porteri",3407988367,"","USA",22,2020,"HUMAN_OBSERVATION","COORDINATE_ROUNDED;CONTINENT_DERIVED_FROM_COORDINATES"
-112.046431,46.564373,"Bromus porteri",4034714609,"","USA",1000,2022,"HUMAN_OBSERVATION","COORDINATE_ROUNDED;CONTINENT_DERIVED_FROM_COORDINATES"
-108.348726,38.511753,"Bromus porteri",3013890329,"","USA",5,2018,"HUMAN_OBSERVATION","COORDINATE_ROUNDED;CONTINENT_DERIVED_FROM_COORDINATES"
-107.408,27.68961,"Bromus porteri",3308021871,"Guechochi, ca. 2.5 km W of Panalachi, on road to sisoguichi and Bocoyna","MEX",60,2003,"PRESERVED_SPECIMEN","TYPE_STATUS_INVALID;OCCURRENCE_STATUS_INFERRED_FROM_INDIVIDUAL_COUNT;GEODETIC_DATUM_ASSUMED_WGS84;CONTINENT_DERIVED_FROM_COORDINATES;INSTITUTION_MATCH_FUZZY;INSTITUTION_COLLECTION_MISMATCH"
-109.356,32.0044,"Bromus porteri",2270637870,"Chiricahua National Monument; East Whitetail Canyon.","USA",NA,1975,"PRESERVED_SPECIMEN","GEODETIC_DATUM_ASSUMED_WGS84;CONTINENT_DERIVED_FROM_COORDINATES;INSTITUTION_MATCH_FUZZY;INSTITUTION_COLLECTION_MISMATCH"
-110.201,32.8818,"Bromus porteri",2270586958,"Cottonwood Mountain","USA",700,1999,"PRESERVED_SPECIMEN","GEODETIC_DATUM_ASSUMED_WGS84;CONTINENT_DERIVED_FROM_COORDINATES;INSTITUTION_MATCH_FUZZY;INSTITUTION_COLLECTION_MISMATCH"
-111.920056,51.729667,"Bromus porteri",4035732727,"Antelope Hill Provincial Park","CAN",180,2015,"PRESERVED_SPECIMEN","OCCURRENCE_STATUS_INFERRED_FROM_INDIVIDUAL_COUNT;GEODETIC_DATUM_ASSUMED_WGS84;GEODETIC_DATUM_INVALID;INSTITUTION_MATCH_FUZZY;COLLECTION_MATCH_NONE"
-113.784358,52.281269,"Bromus porteri",883419578,"Gaetz Lakes","CAN",900,1979,"PRESERVED_SPECIMEN","OCCURRENCE_STATUS_INFERRED_FROM_INDIVIDUAL_COUNT;INSTITUTION_MATCH_FUZZY;COLLECTION_MATCH_NONE"
-115.452818,52.399446,"Bromus porteri",883419949,"Phoenix","CAN",1138,1979,"PRESERVED_SPECIMEN","OCCURRENCE_STATUS_INFERRED_FROM_INDIVIDUAL_COUNT;INSTITUTION_MATCH_FUZZY;COLLECTION_MATCH_NONE"
-106.11667,30.66667,"Bromus porteri",2807259115,"Ca 23 (air) mi ENE of Villa Ahumada, in NW canyon of Sa de la Alcaparra NE of Rancho El Palmar","MEX",NA,1973,"PRESERVED_SPECIMEN","GEODETIC_DATUM_ASSUMED_WGS84;INSTITUTION_MATCH_FUZZY;INSTITUTION_COLLECTION_MISMATCH"
-107.229012,52.667892,"Bromus porteri",3383932188,"","CAN",5,2021,"HUMAN_OBSERVATION","COORDINATE_ROUNDED;CONTINENT_DERIVED_FROM_COORDINATES"
-111.5427,34.7887,"Bromus porteri",3091229008,"Coconino National Forest, Beaver Creek Watershed, old burn about 2 mi E of K-T Ranch, 4 mi NW of Happy Jack.","USA",NA,1967,"PRESERVED_SPECIMEN","GEODETIC_DATUM_ASSUMED_WGS84;CONTINENT_DERIVED_FROM_COORDINATES;INSTITUTION_MATCH_FUZZY;COLLECTION_MATCH_NONE"
-109.38167,31.92972,"Bromus porteri",3091302121,"Chiricahua Mountains, Mountain Canyon","USA",NA,1966,"PRESERVED_SPECIMEN","GEODETIC_DATUM_ASSUMED_WGS84;CONTINENT_DERIVED_FROM_COORDINATES;INSTITUTION_MATCH_FUZZY;COLLECTION_MATCH_NONE"
-111.52556,35.40167,"Bromus porteri",3091201987,"O'Leary Peak, near road","USA",NA,1976,"PRESERVED_SPECIMEN","GEODETIC_DATUM_ASSUMED_WGS84;CONTINENT_DERIVED_FROM_COORDINATES;INSTITUTION_MATCH_FUZZY;COLLECTION_MATCH_NONE"
-111.566589,41.601987,"Bromus porteri",3091225959,"Curtis Creek Canyon, 22 mi E of Logan","USA",210,1979,"PRESERVED_SPECIMEN","CONTINENT_DERIVED_FROM_COORDINATES;INSTITUTION_MATCH_FUZZY;COLLECTION_MATCH_NONE"
-111.0921,34.4258,"Bromus porteri",3091273975,"Coconino National Forest, Knoll Hill, along Mogollon Rim, west slope of Leonard Canyon;","USA",1250,1980,"PRESERVED_SPECIMEN","GEODETIC_DATUM_ASSUMED_WGS84;CONTINENT_DERIVED_FROM_COORDINATES;INSTITUTION_MATCH_FUZZY;COLLECTION_MATCH_NONE"
-110.869586,37.034162,"Bromus porteri",3091225975,"E.I.S. Study Kaiparowits Basin, Navajo Mt., site 56B","USA",NA,1971,"PRESERVED_SPECIMEN","GEODETIC_DATUM_ASSUMED_WGS84;CONTINENT_DERIVED_FROM_COORDINATES;INSTITUTION_MATCH_FUZZY;COLLECTION_MATCH_NONE"
-109.439583,33.920361,"Bromus porteri",3091187262,"South of parking area at trailhead north of Basin Lake, just off of Hwy 273, White Mountains.","USA",10,2012,"PRESERVED_SPECIMEN","CONTINENT_DERIVED_FROM_COORDINATES;INSTITUTION_MATCH_FUZZY;COLLECTION_MATCH_NONE"
-111.50444,35.16667,"Bromus porteri",3091229054,"Coconino National Forest, West canyon half, Walnut Canyon National Monument","USA",10,1973,"PRESERVED_SPECIMEN","CONTINENT_DERIVED_FROM_COORDINATES;DIFFERENT_OWNER_INSTITUTION"
-111.74139,35.33306,"Bromus porteri",3091262124,"Hart Prairie Road, N of Flagstaff","USA",10,1971,"PRESERVED_SPECIMEN","CONTINENT_DERIVED_FROM_COORDINATES;INSTITUTION_MATCH_FUZZY;COLLECTION_MATCH_NONE"
-112.41087,34.55537,"Bromus porteri",3091186311,"West side of Prescott Lakes Parkway about 1/2 mile north of Highway 69","USA",400,2012,"PRESERVED_SPECIMEN","CONTINENT_DERIVED_FROM_COORDINATES;INSTITUTION_MATCH_FUZZY;COLLECTION_MATCH_NONE"
-108.46475,37.723967,"Bromus porteri",3091222996,"Lone Mesa State Park, 3.7 miles north of southern entrance at FS 514.","USA",NA,2011,"PRESERVED_SPECIMEN","GEODETIC_DATUM_ASSUMED_WGS84;CONTINENT_DERIVED_FROM_COORDINATES;INSTITUTION_MATCH_FUZZY;COLLECTION_MATCH_NONE"
-109.14214,36.1719,"Bromus porteri",3091254948,"Talus slope with NW aspect above upper Wheatfields Creek.","USA",NA,2001,"PRESERVED_SPECIMEN","GEODETIC_DATUM_ASSUMED_WGS84;CONTINENT_DERIVED_FROM_COORDINATES;DIFFERENT_OWNER_INSTITUTION"
-109.04583,33.73333,"Bromus porteri",3091210664,"FR 281 (Blue River Rd.) along Campbell Blue Creek","USA",NA,1998,"PRESERVED_SPECIMEN","GEODETIC_DATUM_ASSUMED_WGS84;CONTINENT_DERIVED_FROM_COORDINATES;INSTITUTION_MATCH_FUZZY;COLLECTION_MATCH_NONE"
-111.747778,34.988611,"Bromus porteri",3091217020,"Coconino National Forest, Lower West Fork Canyon of Oak Creek, about 9 miles N of Sedona. At crossing abaout 500 ft about canyon mouth; within northern section of Red Rock/ Secret Mountain Wilderness;","USA",NA,2000,"PRESERVED_SPECIMEN","GEODETIC_DATUM_ASSUMED_WGS84;CONTINENT_DERIVED_FROM_COORDINATES;INSTITUTION_MATCH_FUZZY;COLLECTION_MATCH_NONE"
-111.8693,35.3914,"Bromus porteri",3091201993,"Kendrick Peak, collected on mt side between Trail #22, USFS Rds 171, 171A, and Eanst Newman Hill.","USA",NA,1983,"PRESERVED_SPECIMEN","GEODETIC_DATUM_ASSUMED_WGS84;CONTINENT_DERIVED_FROM_COORDINATES;INSTITUTION_MATCH_FUZZY;COLLECTION_MATCH_NONE"
-120.113121,39.226947,"Bromus porteri",2421686783,"Placer County: Lake Tahoe Basin; Watson Creek. UTM's 10 748155E; 4346076N.","USA",2480,1999,"PRESERVED_SPECIMEN","CONTINENT_DERIVED_FROM_COORDINATES;INSTITUTION_MATCH_FUZZY"
-118.114859,37.498782,"Bromus porteri",2421697228,"Mono Co.: Below University of California Research Station. White Mountains.","USA",500,1951,"PRESERVED_SPECIMEN","CONTINENT_DERIVED_FROM_COORDINATES;INSTITUTION_MATCH_FUZZY"
-118.18332,37.45759,"Bromus porteri",2421697748,"Inyo Co.: Head of Wyman Canyon. White Mts.","USA",NA,1951,"PRESERVED_SPECIMEN","GEODETIC_DATUM_ASSUMED_WGS84;CONTINENT_DERIVED_FROM_COORDINATES;INSTITUTION_MATCH_FUZZY"
-119.2989,37.9498,"Bromus porteri",2421697704,"Mono Co.: Above Bighorn Lake. Convict Creek Basin. Sierra Nevada.","USA",350,1962,"PRESERVED_SPECIMEN","CONTINENT_DERIVED_FROM_COORDINATES;INSTITUTION_MATCH_FUZZY"
-120.200963,39.100292,"Bromus porteri",2421686073,"Placer County: Lake Tahoe Basin; Blackwood Canyon. UTM's 10 743067E, 4332664N.","USA",3966,1999,"PRESERVED_SPECIMEN","CONTINENT_DERIVED_FROM_COORDINATES;INSTITUTION_MATCH_FUZZY"
-118.232,36.5869,"Bromus porteri",2421698042,"Inyo Co.: Sierra Nevada. Whitney Portal.","USA",800,1963,"PRESERVED_SPECIMEN","CONTINENT_DERIVED_FROM_COORDINATES;INSTITUTION_MATCH_FUZZY"
-103.34787,43.97353,"Bromus porteri",176897578,"Sheridan Lake, 6 mi E","USA",8648,1966,"PRESERVED_SPECIMEN","AMBIGUOUS_COLLECTION"
-103.835671,44.32764,"Bromus porteri",176897559,"Lead, 1 mi S, 3 mi W; Terry Peak","USA",1807,1969,"PRESERVED_SPECIMEN","AMBIGUOUS_COLLECTION"
-104.367888,44.501722,"Bromus porteri",176897564,"Sundance, ca 6.5 air mi N","USA",1784,1983,"PRESERVED_SPECIMEN","GEODETIC_DATUM_ASSUMED_WGS84;GEODETIC_DATUM_INVALID;AMBIGUOUS_COLLECTION"
-105.024444,37.348333,"Bromus porteri",3462128317,"Cuchara, 1.5 mi S, 4.5 mi E","USA",NA,2000,"PRESERVED_SPECIMEN","COORDINATE_ROUNDED;AMBIGUOUS_COLLECTION"
-111.2069972,45.2120236,"Bromus porteri",176897563,"West Yellowstone, 37.5 mi N, 3.5 mi W","USA",0.19,1997,"PRESERVED_SPECIMEN","COORDINATE_REPROJECTED;AMBIGUOUS_COLLECTION"
-103.73934,43.8245,"Bromus porteri",176897567,"Custer, 4 mi N, 7 mi W; Bear Mountain road","USA",8924,1969,"PRESERVED_SPECIMEN","AMBIGUOUS_COLLECTION"
-115.502193,38.335518,"Bromus porteri",318050416,"Grant Range, ridge between Timber Mountain & Troy Peak","USA",1807,1984,"PRESERVED_SPECIMEN","AMBIGUOUS_COLLECTION"
-103.826788,44.070706,"Bromus porteri",176897571,"Deerfield, 3.5 mi N; top of Flag Mountain","USA",1807,1970,"PRESERVED_SPECIMEN","AMBIGUOUS_COLLECTION"
-103.743961,43.869807,"Bromus porteri",176897565,"Hill City, 4 mi S, 8 mi W; top of Bear Mountain","USA",1807,1970,"PRESERVED_SPECIMEN","AMBIGUOUS_COLLECTION"
-111.15453,45.090554,"Bromus porteri",176897573,"West Yellowstone, 29 mi N, 1.5 mi W","USA",611,1997,"PRESERVED_SPECIMEN","AMBIGUOUS_COLLECTION"
-103.558749,43.679737,"Bromus porteri",176897557,"Custer, 6 mi S, 2 mi E, near top of Cicero Peak","USA",1784,1969,"PRESERVED_SPECIMEN","AMBIGUOUS_COLLECTION"
-103.8338,44.09018,"Bromus porteri",176897555,"Deerfield, 5 mi N","USA",4.38,1978,"PRESERVED_SPECIMEN","GEODETIC_DATUM_ASSUMED_WGS84;AMBIGUOUS_COLLECTION"
-103.45451,42.71375,"Bromus porteri",318050366,"Crawford, 3 mi NW","USA",4000,1971,"PRESERVED_SPECIMEN","AMBIGUOUS_COLLECTION"
-111.083336,44.941666,"Bromus porteri",176897575,"West Yellowstone, 18.5 mi N, 0.5 mi E","USA",NA,1997,"PRESERVED_SPECIMEN","COORDINATE_ROUNDED;GEODETIC_DATUM_ASSUMED_WGS84;GEODETIC_DATUM_INVALID;AMBIGUOUS_COLLECTION"
-110.396156,43.853776,"Bromus porteri",176897569,"Jackson, 25 mi N, 17.5 mi E","USA",845,1997,"PRESERVED_SPECIMEN","AMBIGUOUS_COLLECTION"
-108.45074,37.13432,"Bromus porteri",2573442072,"Mesa Verde National Park, open glade at tip of Moccasin Mesa.","USA",1500,1954,"PRESERVED_SPECIMEN","CONTINENT_DERIVED_FROM_COORDINATES;AMBIGUOUS_INSTITUTION"
-107.124267,39.662473,"Bromus porteri",2573443408,"White River Plateau. Coffee Pot Road, 8 miles west of Hwy. 301.","USA",1000,1963,"PRESERVED_SPECIMEN","COORDINATE_ROUNDED;CONTINENT_DERIVED_FROM_COORDINATES;AMBIGUOUS_INSTITUTION"
-107.08001,39.03122,"Bromus porteri",3776192192,"Gothic. Rocky Mountain Biological Laboratory. North Pole Basin, above Schofield Park. Site 7. Below spruce island on steep slope above road ca. 1/4 mile above upper lake.","USA",50,2014,"PRESERVED_SPECIMEN","CONTINENT_DERIVED_FROM_COORDINATES;INSTITUTION_MATCH_FUZZY"
-106.9708,38.96604,"Bromus porteri",3776194255,"Copper Creek Trail. Second large, open meadow above Judd Falls. Corresponds roughly to Langenheim (1953) sagebrush sampling site SB-24.","USA",50,2012,"PRESERVED_SPECIMEN","CONTINENT_DERIVED_FROM_COORDINATES;INSTITUTION_MATCH_FUZZY"
-106.935564,38.495437,"Bromus porteri",3776198313,"Granite hills, 3-4 mi S of Gunnison [along Gold Basin Creek].","USA",1000,1957,"PRESERVED_SPECIMEN","CONTINENT_DERIVED_FROM_COORDINATES;INSTITUTION_MATCH_FUZZY"
-107.182145,38.133586,"Bromus porteri",3776198421,"Shore of Lower Powderhorn Lake, just S of the Gunnison County line.","USA",200,1962,"PRESERVED_SPECIMEN","CONTINENT_DERIVED_FROM_COORDINATES;INSTITUTION_MATCH_FUZZY"
-99.718333,20.833333,"Bromus porteri",1893739787,"CUATRO KM AL S DE VIZARRON, CARRETERA CADEREYTA-JALPAN","MEX",80,1993,"PRESERVED_SPECIMEN","TYPE_STATUS_INVALID;OCCURRENCE_STATUS_INFERRED_FROM_INDIVIDUAL_COUNT;COORDINATE_ROUNDED;GEODETIC_DATUM_ASSUMED_WGS84;CONTINENT_DERIVED_FROM_COORDINATES;INSTITUTION_MATCH_NONE"
-118.176528,37.53568,"Bromus porteri",1426265216,"White Mountains. South fork of Cottonwood Creek.","USA",450,1961,"PRESERVED_SPECIMEN","COLLECTION_MATCH_FUZZY"
-119.075222,38.247417,"Bromus porteri",4071320302,"East of Sierra Nevada. Bodie Hills, north base of rocky ridge that extends northeast from Potato Peak, c. 0.4 mile above Geiger Grade.","USA",NA,2018,"PRESERVED_SPECIMEN","COORDINATE_ROUNDED;GEODETIC_DATUM_ASSUMED_WGS84;PRESUMED_NEGATED_LONGITUDE;COLLECTION_MATCH_FUZZY"
-105.517,40.0527,"Bromus porteri",3391920327,"Peak-to Peak Hwy from Nederland, 0.32 km past mile marker 42. On road out of Aspen/Limber Pine forest","USA",NA,2008,"PRESERVED_SPECIMEN","GEODETIC_DATUM_ASSUMED_WGS84"
-107.532222,37.976389,"Bromus porteri",4062034104,"At 4 miles E of Engineer Pass along Henson Creek on road towards Lake City.","USA",NA,2009,"PRESERVED_SPECIMEN","OCCURRENCE_STATUS_INFERRED_FROM_INDIVIDUAL_COUNT;COORDINATE_ROUNDED;GEODETIC_DATUM_ASSUMED_WGS84;DIFFERENT_OWNER_INSTITUTION"
-110.711,31.5161,"Bromus porteri",1322593963,"3.7 mi SE of Patagonia on Harshaw Creek Rd. at Harshaw Creek.","USA",NA,2000,"PRESERVED_SPECIMEN","GEODETIC_DATUM_ASSUMED_WGS84"
-112.068,38.5364,"Bromus porteri",1317710491,"Fishlake National Forest, 0.4 mi. below Monroe Peak, S facing slopes.","USA",NA,2009,"PRESERVED_SPECIMEN","GEODETIC_DATUM_ASSUMED_WGS84"
-109.212,38.4712,"Bromus porteri",1319850244,"Manti-La Sal National Forest, La Sal Mountains. 1.9 mi. E of Geyser Pass on Forest Service Road 071.","USA",NA,2009,"PRESERVED_SPECIMEN","GEODETIC_DATUM_ASSUMED_WGS84"
-97.568417,50.86425,"Bromus porteri",2028085724,"Poplarfield Alvar - 4km SE of Poplarfield. On west side of unnamed road between Hwy 17 (at the bend for mile 126N) and Hwy 68. 14U 0600743 5635712 [Datum WGS84, GPS] Site 16.","CAN",10,2014,"PRESERVED_SPECIMEN","COORDINATE_ROUNDED;INSTITUTION_MATCH_FUZZY;COLLECTION_MATCH_FUZZY"
-97.395944,51.241306,"Bromus porteri",2564817355,"Peguis alvar - 14 km ENE of Hodgson. N of Hwy 325, at Hubar Road turn N on grassy road, walk 1 km along ATV trails to the alvar. 51°14'28.7N, 97°23'45.4W [Datum NAD83, GPS] 14U 0611969 5677875 [Datum WGS84, GPS]","CAN",10,2014,"PRESERVED_SPECIMEN","COORDINATE_ROUNDED;INSTITUTION_MATCH_FUZZY;COLLECTION_MATCH_FUZZY"
-97.625639,51.183556,"Bromus porteri",2564817149,"Marble Ridge Alvar - 5 km SW of Hodgson off Marble Ridge Road. Off Hwy 17 turn west on Marble Ridge Road. Site is on S side of road on the plateau. 51°11'00.8N, 97°37'32.3W [Datum NAD83, GPS] 14U 0596055 5671136 [Datum WGS84, GPS]","CAN",100,2014,"PRESERVED_SPECIMEN","COORDINATE_ROUNDED;INSTITUTION_MATCH_FUZZY;COLLECTION_MATCH_FUZZY"
-97.47975,50.591,"Bromus porteri",2028085508,"Clematis Alvar - 8km ESE of CLematis. Turn east into SAndridge Wildlife Management Area. Continue straight onto grassy road. Follow east then curve north. 14U 0607607 5605446 [Datum WGS84, GPS] Plot 31.","CAN",10,2014,"PRESERVED_SPECIMEN","INSTITUTION_MATCH_FUZZY;COLLECTION_MATCH_FUZZY"
-97.5755,51.632389,"Bromus porteri",2028085515,"Clematis Alvar - 2.5 km NNE of Clematis, unnamed road on W side of Hwy 17 at bend between Sandridge and Narcisse. Continue W 3.5km along ATV road until it intersects a N-S ATV road then go N 0.5km. 51°37'56.6N, 97°34'31.8W [Datum NAD83, GPS]. 14U","CAN",10,2014,"PRESERVED_SPECIMEN","COORDINATE_ROUNDED;INSTITUTION_MATCH_FUZZY;COLLECTION_MATCH_FUZZY"
-107.368108,27.914519,"Bromus porteri",3306400333,"Bahuinocachi","MEX",NA,2016,"HUMAN_OBSERVATION","TYPE_STATUS_INVALID;OCCURRENCE_STATUS_INFERRED_FROM_INDIVIDUAL_COUNT;COORDINATE_ROUNDED;CONTINENT_DERIVED_FROM_COORDINATES;ELEVATION_MIN_MAX_SWAPPED"
-100.041667,19.043333,"Bromus porteri",1893739791,"3 KM SOBRE LA DESVIACION A RANCHO VIEJO, CARR. TOLUCA-TEMASCALTEPEC","MEX",90,1983,"PRESERVED_SPECIMEN","TYPE_STATUS_INVALID;OCCURRENCE_STATUS_INFERRED_FROM_INDIVIDUAL_COUNT;COORDINATE_ROUNDED;GEODETIC_DATUM_ASSUMED_WGS84;CONTINENT_DERIVED_FROM_COORDINATES;ELEVATION_MIN_MAX_SWAPPED;INSTITUTION_MATCH_NONE"
-121.316667,50.366667,"Bromus porteri",1949604167,"Soap Lake: just S of enclosures 1 & 3","CAN",NA,1991,"PRESERVED_SPECIMEN","OCCURRENCE_STATUS_INFERRED_FROM_INDIVIDUAL_COUNT;COORDINATE_ROUNDED;GEODETIC_DATUM_ASSUMED_WGS84;DIFFERENT_OWNER_INSTITUTION"
-123.866667,51.483333,"Bromus porteri",1949649650,"","CAN",NA,1981,"PRESERVED_SPECIMEN","OCCURRENCE_STATUS_INFERRED_FROM_INDIVIDUAL_COUNT;COORDINATE_ROUNDED;GEODETIC_DATUM_ASSUMED_WGS84;DIFFERENT_OWNER_INSTITUTION"
-109.663889,39.342222,"Bromus porteri",1949586589,"E Willow Creek: cc Book Mountain, T18S, R21E, SEC 18; 19 miles NNE of Thompson, middle Willow Creek","USA",NA,1977,"PRESERVED_SPECIMEN","OCCURRENCE_STATUS_INFERRED_FROM_INDIVIDUAL_COUNT;COORDINATE_ROUNDED;GEODETIC_DATUM_ASSUMED_WGS84;DIFFERENT_OWNER_INSTITUTION"
-121.413333,56.238333,"Bromus porteri",1949632329,"Halfway River: slide","CAN",NA,2001,"PRESERVED_SPECIMEN","OCCURRENCE_STATUS_INFERRED_FROM_INDIVIDUAL_COUNT;COORDINATE_ROUNDED;GEODETIC_DATUM_ASSUMED_WGS84;DIFFERENT_OWNER_INSTITUTION"
-122.066667,51.433333,"Bromus porteri",1949544705,"Canoe Creek: near Indian Reserve #2; Canoe Creek area","CAN",NA,1978,"PRESERVED_SPECIMEN","OCCURRENCE_STATUS_INFERRED_FROM_INDIVIDUAL_COUNT;COORDINATE_ROUNDED;GEODETIC_DATUM_ASSUMED_WGS84;DIFFERENT_OWNER_INSTITUTION"
-121.491667,51.333333,"Bromus porteri",1949627184,"70 Mile House; Alberta Lake; Cunningham Lake: half way between highway & Alberta Lake, S of Cunningham Lake","CAN",NA,1981,"PRESERVED_SPECIMEN","OCCURRENCE_STATUS_INFERRED_FROM_INDIVIDUAL_COUNT;COORDINATE_ROUNDED;GEODETIC_DATUM_ASSUMED_WGS84;DIFFERENT_OWNER_INSTITUTION"
-124.033333,51.533333,"Bromus porteri",1949652640,"Tsuniah Lake: above W shore of lake","CAN",NA,1979,"PRESERVED_SPECIMEN","OCCURRENCE_STATUS_INFERRED_FROM_INDIVIDUAL_COUNT;COORDINATE_ROUNDED;GEODETIC_DATUM_ASSUMED_WGS84;DIFFERENT_OWNER_INSTITUTION"
-122.4,51.883333,"Bromus porteri",1949638367,"Riske Creek: area 2 - forested","CAN",NA,1975,"PRESERVED_SPECIMEN","OCCURRENCE_STATUS_INFERRED_FROM_INDIVIDUAL_COUNT;COORDINATE_ROUNDED;GEODETIC_DATUM_ASSUMED_WGS84;DIFFERENT_OWNER_INSTITUTION"
