"lon","lat","species","gbifID","locality","countryCode","coordinateUncertaintyInMeters","year","basisOfRecord","issue"
49.6464,-13.1608,"Byttneria bernieri",2397721592,"De la région de Daraina. Province de Diego-Suarez, sous-préfecture de Vohemar, commune rurale de Daraina. Daraina, forêt d'Ambilondomba. A 710 m du point côté 544, au 86°. (WGS 84).","MDG",NA,2004,"PRESERVED_SPECIMEN","GEODETIC_DATUM_ASSUMED_WGS84"
49.36111,-12.25027,"Byttneria bernieri",4062235682,"Fivondronana: Diego II, Commune: Ramena. Forêt d'Orangea, à 2 km à l'Est du village de Ramena. Forêt sèche. Récolté avec S. Rakotonandrasana, A. Rakotondrafara, V. Benjara & C. Christian.","MDG",NA,2004,"PRESERVED_SPECIMEN","OCCURRENCE_STATUS_INFERRED_FROM_INDIVIDUAL_COUNT;GEODETIC_DATUM_ASSUMED_WGS84;DIFFERENT_OWNER_INSTITUTION"
49.43,-12.61,"Byttneria bernieri",2618599415,"Madagascar, Diana Region, Antsiranana II District, Sahafary forest, Andonandravina.","MDG",NA,2017,"PRESERVED_SPECIMEN","GEODETIC_DATUM_ASSUMED_WGS84;INSTITUTION_COLLECTION_MISMATCH"
49.83,-13.27,"Byttneria bernieri",3776360312,"Madagascar, Diana Region, Vohemar District, between Daraina and Vohemar.","MDG",NA,2020,"PRESERVED_SPECIMEN","GEODETIC_DATUM_ASSUMED_WGS84;INSTITUTION_COLLECTION_MISMATCH"
48.637222,-19.235555,"Byttneria bernieri",4031735477,"Atsinanana, Vatomandry, Ambalabe. Trail N of Mahatsara village, along Talaviana river.","MDG",NA,2011,"PRESERVED_SPECIMEN","OCCURRENCE_STATUS_INFERRED_FROM_INDIVIDUAL_COUNT;COORDINATE_ROUNDED;GEODETIC_DATUM_ASSUMED_WGS84;INSTITUTION_MATCH_FUZZY;COLLECTION_MATCH_NONE"
49.43805,-12.39,"Byttneria bernieri",1260143471,"Mahavanona, entre Ivovona et Ambodivahibe, 1 km au Nord ouest d'Ambodivahibe. Forêt sur sable et sur tsingy. Récolté avec J. Razafitsalama, J.B. Leopold & C. Randrianarivelo.","MDG",NA,2005,"PRESERVED_SPECIMEN","OCCURRENCE_STATUS_INFERRED_FROM_INDIVIDUAL_COUNT;GEODETIC_DATUM_ASSUMED_WGS84;DIFFERENT_OWNER_INSTITUTION"
49.521111,-13.217222,"Byttneria bernieri",1257978023,"Daraina, forêt d'Antsahabe. Forêt semi-décidue. Pente: 12, orientation: 10, situation: bas-versant. A 1960 m du point côté 1008, au 301°.","MDG",NA,2006,"PRESERVED_SPECIMEN","OCCURRENCE_STATUS_INFERRED_FROM_INDIVIDUAL_COUNT;COORDINATE_ROUNDED;GEODETIC_DATUM_ASSUMED_WGS84;DIFFERENT_OWNER_INSTITUTION"
49.15417,-12.96139,"Byttneria bernieri",814312432,"Mahamasina","MDG",NA,2003,"PRESERVED_SPECIMEN","GEODETIC_DATUM_ASSUMED_WGS84;CONTINENT_DERIVED_FROM_COORDINATES;COLLECTION_MATCH_FUZZY"
49.328,-12.361,"Byttneria bernieri",2013685399,"","MDG",5,2018,"HUMAN_OBSERVATION","CONTINENT_DERIVED_FROM_COORDINATES"
