"lon","lat","species","gbifID","locality","countryCode","coordinateUncertaintyInMeters","year","basisOfRecord","issue"
-78.18,-0.52,"Calamagrostis intermedia",1096723956,"Prov. Napo, lake at origin of Rio Antisana on SW slope of Volcán Antisana (Laguna Micacocha), surrounding páramos, swampy and rocky areas, heavily grazed by cattle, sheep and rabbits","ECU",NA,1976,"PRESERVED_SPECIMEN","GEODETIC_DATUM_ASSUMED_WGS84;CONTINENT_DERIVED_FROM_COORDINATES;CONTINENT_INVALID;INSTITUTION_COLLECTION_MISMATCH"
-78.85,-1.78,"Calamagrostis intermedia",1096723967,"Prov. Chimborazo, road Pallatanga-Cajabamba, 47 km from Pallatanga","ECU",NA,1976,"PRESERVED_SPECIMEN","GEODETIC_DATUM_ASSUMED_WGS84;CONTINENT_DERIVED_FROM_COORDINATES;CONTINENT_INVALID;INSTITUTION_COLLECTION_MISMATCH"
-78.41666,-0.93333,"Calamagrostis intermedia",1259403056,"Páramo de Laguna Salayampe, E of Latacunga. Moist paramo-swamps.","ECU",NA,1985,"PRESERVED_SPECIMEN","GEODETIC_DATUM_ASSUMED_WGS84;DIFFERENT_OWNER_INSTITUTION"
-79.26666,-4,"Calamagrostis intermedia",4062104419,"Between Loja and La Toma (at pass on old road). Dry, light, open slopes. Cerro Villonaco.","ECU",NA,1984,"PRESERVED_SPECIMEN","GEODETIC_DATUM_ASSUMED_WGS84;INSTITUTION_MATCH_NONE"
-78.51666,-0.45,"Calamagrostis intermedia",1259403145,"Volcán Pasochoa. Above house of Fundacion Natura. Grass-fields, mountain-forest and paramo.","ECU",NA,1985,"PRESERVED_SPECIMEN","GEODETIC_DATUM_ASSUMED_WGS84;DIFFERENT_OWNER_INSTITUTION"
-79.3,-2.88333,"Calamagrostis intermedia",1259405128,"Paramo de Soldados.","ECU",NA,1985,"PRESERVED_SPECIMEN","GEODETIC_DATUM_ASSUMED_WGS84;DIFFERENT_OWNER_INSTITUTION"
-78.3,-0.7,"Calamagrostis intermedia",1259407330,"At El Tambo SE of Volcán Cotopaxi.","ECU",NA,1985,"PRESERVED_SPECIMEN","GEODETIC_DATUM_ASSUMED_WGS84;DIFFERENT_OWNER_INSTITUTION"
-78.98333,-2.4,"Calamagrostis intermedia",1259402483,"Road Cañar - Chunchi, at pass. Roadside and grass-paramo.","ECU",NA,1985,"PRESERVED_SPECIMEN","GEODETIC_DATUM_ASSUMED_WGS84;DIFFERENT_OWNER_INSTITUTION"
-78.23333,-0.3,"Calamagrostis intermedia",1259404569,"Road Pifo - Papallacta, 3 km W of Paso de la Virgen. Grass-paramo, swamp and Polylepis-forest.","ECU",NA,1985,"PRESERVED_SPECIMEN","GEODETIC_DATUM_ASSUMED_WGS84;DIFFERENT_OWNER_INSTITUTION"
-78.33333,0.58333,"Calamagrostis intermedia",1258509929,"Slopes of Volcan Cotacachi.","ECU",NA,1987,"PRESERVED_SPECIMEN","GEODETIC_DATUM_ASSUMED_WGS84;INSTITUTION_MATCH_NONE"
-78.66666,-3,"Calamagrostis intermedia",4061058360,"In pass Cuenca - Limon","ECU",NA,1999,"PRESERVED_SPECIMEN","GEODETIC_DATUM_ASSUMED_WGS84;INSTITUTION_MATCH_NONE"
-78.16666,-0.5,"Calamagrostis intermedia",1260021545,"Volc·n Tungurahua, N side of the mountain, steep slope to the right of the trail to the summit, upper superp·ramo with rich bryophyte cover.","ECU",NA,1998,"PRESERVED_SPECIMEN","GEODETIC_DATUM_ASSUMED_WGS84;DIFFERENT_OWNER_INSTITUTION"
-78.08333,0.36666,"Calamagrostis intermedia",4061172362,"Timber line vegetation on Hacienda Yura Cruz, 10 km N of Ibarra. Paramo dominated by grass.","ECU",NA,1973,"PRESERVED_SPECIMEN","GEODETIC_DATUM_ASSUMED_WGS84;DIFFERENT_OWNER_INSTITUTION"
-77.95,0.81666,"Calamagrostis intermedia",1258507611,"Southern slopes of Volcan Chiles","ECU",NA,1987,"PRESERVED_SPECIMEN","GEODETIC_DATUM_ASSUMED_WGS84;INSTITUTION_MATCH_NONE"
-83.49007,9.465437,"Calamagrostis intermedia",4061090422,"Colectado a orilla del Sendero a Valle Los Leones.","CRI",NA,2002,"PRESERVED_SPECIMEN","OCCURRENCE_STATUS_INFERRED_FROM_INDIVIDUAL_COUNT;COORDINATE_ROUNDED;GEODETIC_DATUM_ASSUMED_WGS84;INSTITUTION_MATCH_NONE"
-75.88333,-11.45,"Calamagrostis intermedia",1259782890,"summit of Tarma-La Oroya Hwy. Natural grassland; gentle, NE-facing slopes; severely overgrazed.","PER",NA,1983,"PRESERVED_SPECIMEN","OCCURRENCE_STATUS_INFERRED_FROM_INDIVIDUAL_COUNT;GEODETIC_DATUM_ASSUMED_WGS84;INSTITUTION_MATCH_FUZZY;COLLECTION_MATCH_NONE"
-78.96666,-1.38333,"Calamagrostis intermedia",4031938854,"Reserva de Producción Faunística Chimborazo. Guanujo El-Sinche. Bosque húmedo Subalpino (Puna). Matorral y pajonal. Suelo negro arenoso de origen volcánico.","ECU",NA,1992,"PRESERVED_SPECIMEN","IDENTIFIED_DATE_UNLIKELY;GEODETIC_DATUM_ASSUMED_WGS84;INSTITUTION_MATCH_FUZZY;COLLECTION_MATCH_NONE"
-82.87361,9.11305,"Calamagrostis intermedia",1260115790,"Cerro Fábrega: peak. Paramo vegetation, grass dominated with small shrubs and large boulders.","PAN",NA,2003,"PRESERVED_SPECIMEN","GEODETIC_DATUM_ASSUMED_WGS84;INSTITUTION_MATCH_FUZZY;COLLECTION_MATCH_NONE"
-78.884722,-1.544722,"Calamagrostis intermedia",4032106382,"Reserva Faunistica Chimborazo. Bosque de Polylepis y alrededores (Paramo).","ECU",NA,2006,"PRESERVED_SPECIMEN","OCCURRENCE_STATUS_INFERRED_FROM_INDIVIDUAL_COUNT;COORDINATE_ROUNDED;GEODETIC_DATUM_ASSUMED_WGS84;INSTITUTION_MATCH_FUZZY;COLLECTION_MATCH_NONE"
-83.755167,9.562667,"Calamagrostis intermedia",2268951814,"Páramo Cerro Buena Vista, antitos de llegar a las torres del ICE.","CRI",NA,2008,"PRESERVED_SPECIMEN","OCCURRENCE_STATUS_INFERRED_FROM_INDIVIDUAL_COUNT;COORDINATE_ROUNDED;GEODETIC_DATUM_ASSUMED_WGS84;INSTITUTION_MATCH_FUZZY;COLLECTION_MATCH_NONE"
-77.722217,-6.89805,"Calamagrostis intermedia",1257559024,"Distrito Leymebamba. Valley Quebrada Agua Blanca, infrequently burned páramo on steep limestone slopes on Cerro Pacra Pacra.","PER",NA,2009,"PRESERVED_SPECIMEN","OCCURRENCE_STATUS_INFERRED_FROM_INDIVIDUAL_COUNT;COORDINATE_ROUNDED;GEODETIC_DATUM_ASSUMED_WGS84;INSTITUTION_MATCH_FUZZY;COLLECTION_MATCH_NONE"
-77.41666,-9.3,"Calamagrostis intermedia",1259763529,"Huascarán National Park. N-side of main valley, Quebrada Honda. Brushfields with a few open stands of Polylepis sericea.","PER",NA,1985,"PRESERVED_SPECIMEN","OCCURRENCE_STATUS_INFERRED_FROM_INDIVIDUAL_COUNT;GEODETIC_DATUM_ASSUMED_WGS84;INSTITUTION_MATCH_FUZZY;COLLECTION_MATCH_NONE"
-77.68333,-8.88333,"Calamagrostis intermedia",1259797838,"Huascarán National Park. Quebrada Alpamayo at foot of snow- free peak above Lago Jancarurish. Grassy slopes and bottoms on morainal material. Parts appear pear to be frequently burned.","PER",NA,1985,"PRESERVED_SPECIMEN","OCCURRENCE_STATUS_INFERRED_FROM_INDIVIDUAL_COUNT;GEODETIC_DATUM_ASSUMED_WGS84;INSTITUTION_MATCH_FUZZY;COLLECTION_MATCH_NONE"
-79.2667,-2.186,"Calamagrostis intermedia",1260181380,"Páramo de Las Cajas, E slope.","ECU",NA,1985,"PRESERVED_SPECIMEN","GEODETIC_DATUM_ASSUMED_WGS84;INSTITUTION_MATCH_FUZZY;COLLECTION_MATCH_NONE"
-79.220109,-2.774934,"Calamagrostis intermedia",1839275530,"","ECU",265,2012,"HUMAN_OBSERVATION","CONTINENT_DERIVED_FROM_COORDINATES"
-78.300697,-0.483604,"Calamagrostis intermedia",2596194900,"","ECU",NA,2019,"HUMAN_OBSERVATION","CONTINENT_DERIVED_FROM_COORDINATES"
-78.180833,0.260833,"Calamagrostis intermedia",2626275688,"","ECU",2169,2016,"HUMAN_OBSERVATION","COORDINATE_ROUNDED;CONTINENT_DERIVED_FROM_COORDINATES"
-83.03333,9.25833,"Calamagrostis intermedia",1259807505,"Cordillera de Talamanca, peak of Cerro Kamuk.","CRI",NA,1984,"PRESERVED_SPECIMEN","OCCURRENCE_STATUS_INFERRED_FROM_INDIVIDUAL_COUNT;GEODETIC_DATUM_ASSUMED_WGS84;INSTITUTION_MATCH_FUZZY;COLLECTION_MATCH_NONE"
-78.366667,-1.166667,"Calamagrostis intermedia",4031468497,"Cordillera de Llanganatis, Páramo de Jaramillo.","ECU",NA,1984,"PRESERVED_SPECIMEN","OCCURRENCE_STATUS_INFERRED_FROM_INDIVIDUAL_COUNT;COORDINATE_ROUNDED;GEODETIC_DATUM_ASSUMED_WGS84;INSTITUTION_MATCH_FUZZY;COLLECTION_MATCH_NONE"
-78.583333,-6.916667,"Calamagrostis intermedia",1259785642,"Cajamarca-Bambamarca road, 55 km N of Cajamarca. Glaciated terrain.","PER",NA,1984,"PRESERVED_SPECIMEN","OCCURRENCE_STATUS_INFERRED_FROM_INDIVIDUAL_COUNT;COORDINATE_ROUNDED;GEODETIC_DATUM_ASSUMED_WGS84;INSTITUTION_MATCH_FUZZY;COLLECTION_MATCH_NONE"
-97.159722,19.516667,"Calamagrostis intermedia",2629643254,"1.75 km al S de El Conejo","MEX",80,1992,"PRESERVED_SPECIMEN","TYPE_STATUS_INVALID;OCCURRENCE_STATUS_INFERRED_FROM_INDIVIDUAL_COUNT;COORDINATE_ROUNDED;GEODETIC_DATUM_ASSUMED_WGS84;GEODETIC_DATUM_INVALID;CONTINENT_DERIVED_FROM_COORDINATES;INSTITUTION_MATCH_NONE"
-79.333333,-3.7,"Calamagrostis intermedia",2517110847,"Loja, between the old campment and Fierro Urco.","ECU",NA,1998,"PRESERVED_SPECIMEN","INSTITUTION_MATCH_FUZZY;INSTITUTION_COLLECTION_MISMATCH"
-77.96666,-0.11666,"Calamagrostis intermedia",4031878655,"Laguna San Marcos, NE of Volcán Cayambe. Extensive flat plain S of the lake, predominantly marshy.","ECU",NA,1980,"PRESERVED_SPECIMEN","GEODETIC_DATUM_ASSUMED_WGS84;INSTITUTION_MATCH_FUZZY;COLLECTION_MATCH_NONE"
-78.53333,-1.8,"Calamagrostis intermedia",4031985572,"Daldal Valley, 10 Km E of Licto","ECU",NA,1987,"PRESERVED_SPECIMEN","GEODETIC_DATUM_ASSUMED_WGS84;INSTITUTION_MATCH_FUZZY;COLLECTION_MATCH_NONE"
-78.29861,-1.22861,"Calamagrostis intermedia",4031491024,"Parque Nacional Llanganates. Base of Cerro Hermoso on western side, near lake. Metamorphic rock substrate. Páramo and shrubby thickets.","ECU",NA,1999,"PRESERVED_SPECIMEN","GEODETIC_DATUM_ASSUMED_WGS84;INSTITUTION_MATCH_FUZZY;COLLECTION_MATCH_NONE"
-77.233333,-9.683333,"Calamagrostis intermedia",1259701511,"Huascarán National Park. 5 km below Cahuis Tunnel.","PER",NA,1985,"PRESERVED_SPECIMEN","OCCURRENCE_STATUS_INFERRED_FROM_INDIVIDUAL_COUNT;COORDINATE_ROUNDED;GEODETIC_DATUM_ASSUMED_WGS84;INSTITUTION_MATCH_FUZZY;COLLECTION_MATCH_NONE"
-68.01666,-16.31666,"Calamagrostis intermedia",1259827367,"6.5 km al este de La Cumbre (vieja estación de ferrocarril) por el camino a Unduavi. Puna húmeda.","BOL",NA,1988,"PRESERVED_SPECIMEN","OCCURRENCE_STATUS_INFERRED_FROM_INDIVIDUAL_COUNT;GEODETIC_DATUM_ASSUMED_WGS84;INSTITUTION_MATCH_FUZZY;COLLECTION_MATCH_NONE"
-74.031501,5.207676,"Calamagrostis intermedia",781068998,"Georeference googlemaps in colaboration with A. Cleef. Precision calculated as the longest distance from the chosen central point to the maximum and minimun altitudinal range","COL",5000,1984,"HUMAN_OBSERVATION","GEODETIC_DATUM_ASSUMED_WGS84;CONTINENT_DERIVED_FROM_COORDINATES"
-79.166667,-3.5,"Calamagrostis intermedia",2516682193,"Loja, along road Ona-Saraguro ca 5km N of Carboncillo.","ECU",NA,1998,"PRESERVED_SPECIMEN","INSTITUTION_MATCH_FUZZY;INSTITUTION_COLLECTION_MISMATCH"
-78.266667,0.133333,"Calamagrostis intermedia",3946783264,"Laguna Mojanda.","ECU",NA,1980,"PRESERVED_SPECIMEN","OCCURRENCE_STATUS_INFERRED_FROM_INDIVIDUAL_COUNT;COORDINATE_ROUNDED;GEODETIC_DATUM_ASSUMED_WGS84;INSTITUTION_MATCH_FUZZY;COLLECTION_MATCH_NONE"
-78.31666,-1.13333,"Calamagrostis intermedia",4032026621,"Parque Nacional Llanganates, camino desde el Páramo de Soguillas hasta Aucacocha. Páramo húmedo, parches de bosque alto-andino, roca metamórfica.","ECU",NA,1999,"PRESERVED_SPECIMEN","GEODETIC_DATUM_ASSUMED_WGS84;INSTITUTION_MATCH_FUZZY;COLLECTION_MATCH_NONE"
-77.6666,0.61667,"Calamagrostis intermedia",1260181193,"Playon de San Francisco, El Mirador. Espeletia paramo.","ECU",NA,1978,"PRESERVED_SPECIMEN","GEODETIC_DATUM_ASSUMED_WGS84;INSTITUTION_MATCH_FUZZY;COLLECTION_MATCH_NONE"
-78.35,-1.15,"Calamagrostis intermedia",4031366488,"Cordillera de Llanganates, Achiriqui, Páramo de Jaramillo, 13 km NW of Cerro Hermoso","ECU",NA,1980,"PRESERVED_SPECIMEN","OCCURRENCE_STATUS_INFERRED_FROM_INDIVIDUAL_COUNT;GEODETIC_DATUM_ASSUMED_WGS84;INSTITUTION_MATCH_FUZZY;COLLECTION_MATCH_NONE"
-77.41666,-9.53333,"Calamagrostis intermedia",1259701448,"Huascarán National Park. Mouth of Quebrada Rajucolta Natural grasslands,bunchgrasses, S-and W-facing slopes, steep; morainal materi- al of granitic origin.","PER",NA,1986,"PRESERVED_SPECIMEN","OCCURRENCE_STATUS_INFERRED_FROM_INDIVIDUAL_COUNT;GEODETIC_DATUM_ASSUMED_WGS84;INSTITUTION_MATCH_FUZZY;COLLECTION_MATCH_NONE"
-78.45444,0.52527,"Calamagrostis intermedia",4031367646,"Reserva Ecológica Cotacachi Cayapas. Alrededores de la laguna Piñán o Donoso. Bosque muy húmedo montano. Sucesión de pajonal. Suelo franco-limoso.","ECU",NA,1994,"PRESERVED_SPECIMEN","GEODETIC_DATUM_ASSUMED_WGS84;INSTITUTION_MATCH_FUZZY;COLLECTION_MATCH_NONE"
-78.3,-7,"Calamagrostis intermedia",1228311591,"Sorochuco. Carretera Michiquillay - El Punre","PER",NA,2004,"PRESERVED_SPECIMEN","GEODETIC_DATUM_ASSUMED_WGS84;INSTITUTION_MATCH_FUZZY;AMBIGUOUS_COLLECTION"
-77.7,-7.13,"Calamagrostis intermedia",1424784810,"Ascenso ao Nevado de Cajamarquilla","PER",NA,2004,"PRESERVED_SPECIMEN","GEODETIC_DATUM_ASSUMED_WGS84;INSTITUTION_MATCH_FUZZY;AMBIGUOUS_COLLECTION"
-78.45,-0.61666,"Calamagrostis intermedia",1259400612,"Parque Nacional Cotopaxi. NW of Limpio Punga.","ECU",NA,1984,"PRESERVED_SPECIMEN","GEODETIC_DATUM_ASSUMED_WGS84;DIFFERENT_OWNER_INSTITUTION"
-79.03333,-4.61666,"Calamagrostis intermedia",4061036817,"Surroundings of Lag. Chuquiragua E of Amaluza","ECU",NA,1998,"PRESERVED_SPECIMEN","GEODETIC_DATUM_ASSUMED_WGS84;INSTITUTION_MATCH_NONE"
-77.98333,0.06666,"Calamagrostis intermedia",1259399140,"Volcán Cayambe, northern slope near the radiostation. Strongly exposed cushion paramo.","ECU",NA,1980,"PRESERVED_SPECIMEN","GEODETIC_DATUM_ASSUMED_WGS84;DIFFERENT_OWNER_INSTITUTION"
-77.95,-2.81666,"Calamagrostis intermedia",1258509973,"Southern slopes of Volcan Chiles","ECU",NA,1987,"PRESERVED_SPECIMEN","GEODETIC_DATUM_ASSUMED_WGS84;INSTITUTION_MATCH_NONE"
-78.88333,-2.9,"Calamagrostis intermedia",4061792375,"5 km along small road going E from the highway 10 km S of Cuenca Center. Dry scrub, grassland, cattle-trails.","ECU",NA,1992,"PRESERVED_SPECIMEN","GEODETIC_DATUM_ASSUMED_WGS84;INSTITUTION_MATCH_NONE"
-78.5,-2.23333,"Calamagrostis intermedia",1260020555,"Cerro Yanaurcu, on the western side of the N ridge of the mountain, wet cushion superpáramo with scattered shrubs and bunchgrasses. Original numbering of this specimen and numbering of duplicates: 148-23","ECU",NA,1995,"PRESERVED_SPECIMEN","GEODETIC_DATUM_ASSUMED_WGS84;DIFFERENT_OWNER_INSTITUTION"
-78.55,-0.63333,"Calamagrostis intermedia",1259408106,"Cotopaxi National Park, between railroadstation and southern entrance. Plantation of Pinus radiata and small rivergorges in areas of bunchgrass páramo.","ECU",NA,1988,"PRESERVED_SPECIMEN","GEODETIC_DATUM_ASSUMED_WGS84;DIFFERENT_OWNER_INSTITUTION"
-78.8,-2.71666,"Calamagrostis intermedia",1259408217,"Km 10 on road Azogues-Bulán. Along trail in low scrub, fields.","ECU",NA,1988,"PRESERVED_SPECIMEN","GEODETIC_DATUM_ASSUMED_WGS84;DIFFERENT_OWNER_INSTITUTION"
-79.16666,-4.11666,"Calamagrostis intermedia",4061032197,"El Tiro. Along trail through scrub to the pçramo. 2800-3000 m","ECU",NA,1999,"PRESERVED_SPECIMEN","GEODETIC_DATUM_ASSUMED_WGS84;INSTITUTION_MATCH_NONE"
-78.81666,-1.48333,"Calamagrostis intermedia",4061047891,"Carihuahuasco, above Mashahuasca, 4400-4600 m.","ECU",NA,1999,"PRESERVED_SPECIMEN","GEODETIC_DATUM_ASSUMED_WGS84;INSTITUTION_MATCH_NONE"
-78.4,-1.66666,"Calamagrostis intermedia",1258507882,"Crater, Páramo de los Altares","ECU",NA,1987,"PRESERVED_SPECIMEN","GEODETIC_DATUM_ASSUMED_WGS84;INSTITUTION_MATCH_NONE"
-78.5,-1.86666,"Calamagrostis intermedia",1259406120,"Near Alao, along Río Alao.","ECU",NA,1985,"PRESERVED_SPECIMEN","GEODETIC_DATUM_ASSUMED_WGS84;DIFFERENT_OWNER_INSTITUTION"
-78,0.33333,"Calamagrostis intermedia",1259409752,"Páramo de Mariano Acosta, km 20 Yahuarcocha - Mariano Acosta","ECU",NA,1992,"PRESERVED_SPECIMEN","GEODETIC_DATUM_ASSUMED_WGS84;DIFFERENT_OWNER_INSTITUTION"
-78.68333,-0.63333,"Calamagrostis intermedia",1259403928,"Volcán Iliñiza, N-side.","ECU",NA,1985,"PRESERVED_SPECIMEN","GEODETIC_DATUM_ASSUMED_WGS84;DIFFERENT_OWNER_INSTITUTION"
-78.33333,0.36666,"Calamagrostis intermedia",1259403808,"Volcán Cotocachi. Superparamo.","ECU",NA,1985,"PRESERVED_SPECIMEN","GEODETIC_DATUM_ASSUMED_WGS84;DIFFERENT_OWNER_INSTITUTION"
-78.48333,-0.73333,"Calamagrostis intermedia",1259407782,"Paramo at Hacienda Pauzacha south of Volcan Cotopaxi.","ECU",NA,1985,"PRESERVED_SPECIMEN","GEODETIC_DATUM_ASSUMED_WGS84;DIFFERENT_OWNER_INSTITUTION"
-77.83333,0.71666,"Calamagrostis intermedia",1259410948,"Km 13 along road Las Juntas (Tulcán) - El Angel. Grass-páramo.","ECU",NA,1992,"PRESERVED_SPECIMEN","GEODETIC_DATUM_ASSUMED_WGS84;DIFFERENT_OWNER_INSTITUTION"
-78.15,-0.48333,"Calamagrostis intermedia",1259411943,"SW slopes of Vólcan Antisana, 2-3 km N of Hacienda El Hato and 5-6 km NNE of Laguna Nicacocha. Grass páramo with open sandy areas, ravines, and rock outcrops.","ECU",NA,1979,"PRESERVED_SPECIMEN","GEODETIC_DATUM_ASSUMED_WGS84;DIFFERENT_OWNER_INSTITUTION"
-79.166667,-4.45,"Calamagrostis intermedia",4061169872,"Exposed ridge W of Paso de Sabanillas on road Yangana - Valladolid.","ECU",NA,1985,"PRESERVED_SPECIMEN","OCCURRENCE_STATUS_INFERRED_FROM_INDIVIDUAL_COUNT;COORDINATE_ROUNDED;GEODETIC_DATUM_ASSUMED_WGS84;DIFFERENT_OWNER_INSTITUTION"
-78.41666,-1.8,"Calamagrostis intermedia",1259406904,"East of pass Alao - Huamboya.","ECU",NA,1985,"PRESERVED_SPECIMEN","GEODETIC_DATUM_ASSUMED_WGS84;DIFFERENT_OWNER_INSTITUTION"
-79.43333,-4.71666,"Calamagrostis intermedia",4061778269,"At Las Lagunas N of km 17.1 on road Jimbura - Zumba","ECU",NA,2001,"PRESERVED_SPECIMEN","GEODETIC_DATUM_ASSUMED_WGS84;INSTITUTION_MATCH_NONE"
-79.16666,-3.33333,"Calamagrostis intermedia",4061593095,"Along new road Cuenca - Saraguro, app. 18 km S of sideroad to Nabon. Around small pond, partly in seeping water.","ECU",NA,1992,"PRESERVED_SPECIMEN","GEODETIC_DATUM_ASSUMED_WGS84;INSTITUTION_MATCH_NONE"
-74.207828,4.312078,"Calamagrostis intermedia",779870607,"Chisacá, páramo seco, la laguna seca","COL",NA,1972,"PRESERVED_SPECIMEN","GEODETIC_DATUM_ASSUMED_WGS84;INSTITUTION_MATCH_NONE"
-83.63,9.58,"Calamagrostis intermedia",44460876,"E.B. Cuericí San José-Cartago. Cordillera de Talamanca. Cerros Cuericí, Continental divide. Chusquea-Hypericum-ericad shrub páramo with open areas with tussock grasses (dominated by Cortaderia near the summit).","CRI",NA,1983,"PRESERVED_SPECIMEN","GEODETIC_DATUM_ASSUMED_WGS84;CONTINENT_DERIVED_FROM_COORDINATES;TAXON_MATCH_HIGHERRANK;INSTITUTION_MATCH_NONE"
-82.81,9.03,"Calamagrostis intermedia",44460808,"Costa Rica/Panamá. Bocas del Toro. Cordillera de Talamanca, Cerro Echandi on the international border. Páramo with Chusquea-Hypericum-grasses-sedges dominant.","CRI",NA,1983,"PRESERVED_SPECIMEN","GEODETIC_DATUM_ASSUMED_WGS84;CONTINENT_DERIVED_FROM_COORDINATES;TAXON_MATCH_HIGHERRANK;INSTITUTION_MATCH_NONE"
-78.03333,-1,"Calamagrostis intermedia",4061052202,"Ca 5 km SE of Lag. Pisayambo, Las Tolas. Paramo and paramo-swamps","ECU",NA,1999,"PRESERVED_SPECIMEN","GEODETIC_DATUM_ASSUMED_WGS84;INSTITUTION_MATCH_NONE"
-78.56666,-0.11666,"Calamagrostis intermedia",1259403669,"N-side of Volcán Pichincha above Hacienda Yanacocha. Polylepis forest.","ECU",NA,1985,"PRESERVED_SPECIMEN","GEODETIC_DATUM_ASSUMED_WGS84;DIFFERENT_OWNER_INSTITUTION"
-79.03333,-1.45,"Calamagrostis intermedia",1259406245,"Km 5-10. Salinas - Guaranda. Roadside and grass-fields.","ECU",NA,1985,"PRESERVED_SPECIMEN","GEODETIC_DATUM_ASSUMED_WGS84;DIFFERENT_OWNER_INSTITUTION"
-79.46666,-3.56666,"Calamagrostis intermedia",4062092084,"Cerro de Arcos W of road Manu - Zaruma. 3250 - 3600 m.","ECU",NA,1999,"PRESERVED_SPECIMEN","GEODETIC_DATUM_ASSUMED_WGS84;INSTITUTION_MATCH_NONE"
-78.43333,0.26666,"Calamagrostis intermedia",4061759106,"Road Otavalo - Selva Alegre, 5 km W of Hacienda Sigsicunga. Heavily grazed and burnt paramo.","ECU",NA,1980,"PRESERVED_SPECIMEN","GEODETIC_DATUM_ASSUMED_WGS84;INSTITUTION_MATCH_NONE"
-69.105278,-14.583056,"Calamagrostis intermedia",1260059031,"Parque Nacional Madidi, Puina Viejo, ca. 3 km río abajo por camino al E del río. Plantas alcoholizadas.","BOL",NA,2005,"PRESERVED_SPECIMEN","OCCURRENCE_STATUS_INFERRED_FROM_INDIVIDUAL_COUNT;COORDINATE_ROUNDED;GEODETIC_DATUM_ASSUMED_WGS84;DIFFERENT_OWNER_INSTITUTION"
-77.88333,0.66666,"Calamagrostis intermedia",1259401287,"Páramo del Angel, c. 20 km NE of El Angel. Burned paramo and swamps.","ECU",NA,1984,"PRESERVED_SPECIMEN","GEODETIC_DATUM_ASSUMED_WGS84;DIFFERENT_OWNER_INSTITUTION"
-79.08333,-3.56666,"Calamagrostis intermedia",4062092102,"Along trail Saraguro - Yacuambi. Cordillera Condorcillo","ECU",NA,1999,"PRESERVED_SPECIMEN","GEODETIC_DATUM_ASSUMED_WGS84;INSTITUTION_MATCH_NONE"
-78.8,-0.9,"Calamagrostis intermedia",1260016800,"Latacunga-Zumbahua rd. Grass-páramo.","ECU",NA,1992,"PRESERVED_SPECIMEN","GEODETIC_DATUM_ASSUMED_WGS84;DIFFERENT_OWNER_INSTITUTION"
-78.16666,-0.2,"Calamagrostis intermedia",1259404260,"N side of Volcán Los Puntos. Paramo.","ECU",NA,1985,"PRESERVED_SPECIMEN","GEODETIC_DATUM_ASSUMED_WGS84;DIFFERENT_OWNER_INSTITUTION"
-79.58333,-3.51666,"Calamagrostis intermedia",4061032207,"Paramo de Chilla near the antennas ca 10 km above Chilla.","ECU",NA,1999,"PRESERVED_SPECIMEN","GEODETIC_DATUM_ASSUMED_WGS84;INSTITUTION_MATCH_NONE"
-78.16666,0.25,"Calamagrostis intermedia",1260020657,"Cerro Imbabura, grass páramo with Puya and cushions of Azorella on the S side of the volcano, slope just below rocky escarpment. Original numbering of this specimen and numbering of duplicates: 33-4","ECU",NA,1995,"PRESERVED_SPECIMEN","GEODETIC_DATUM_ASSUMED_WGS84;DIFFERENT_OWNER_INSTITUTION"
-73.254194,5.377444,"Calamagrostis intermedia",2576162689,"Vereda El Plan, zona fronteriza entre las veredas de El Plan y Albañil","COL",NA,2018,"HUMAN_OBSERVATION","COORDINATE_ROUNDED"
-79.16666,-4.38333,"Calamagrostis intermedia",1259402278,"Along road Yangana - Cerro Toledo. Secondary, burned paramo.","ECU",NA,1985,"PRESERVED_SPECIMEN","GEODETIC_DATUM_ASSUMED_WGS84;DIFFERENT_OWNER_INSTITUTION"
-78.33333,-0.98333,"Calamagrostis intermedia",1258509062,"Parque Nacional Llanganates. Vía Salcedo-Tena, km 45-55. Cabecera del Río Anatenorio, Siete Vueltas. Páramo húmedo con restos de vegetación arbustiva; roca volcánica.","ECU",NA,1998,"PRESERVED_SPECIMEN","GEODETIC_DATUM_ASSUMED_WGS84;INSTITUTION_MATCH_NONE"
-79.16666,-2.88333,"Calamagrostis intermedia",1258508047,"Totorococha-Masan valley, Area Nacional de Recreación Cajas","ECU",NA,1987,"PRESERVED_SPECIMEN","GEODETIC_DATUM_ASSUMED_WGS84;INSTITUTION_MATCH_NONE"
-78.91666,-1,"Calamagrostis intermedia",4062092233,"Angamarca-road, km 5 from junction to road Latacunga - La Maná. Páramo with some rocky outcrops.","ECU",NA,1992,"PRESERVED_SPECIMEN","GEODETIC_DATUM_ASSUMED_WGS84;INSTITUTION_MATCH_NONE"
-67.33333,-16.95,"Calamagrostis intermedia",1259434170,"Pacuni - - Along the road between Sayaquita and the mining camp of Pacuni. 9-11 km NW of Quime. High altitude rocky areas.","BOL",NA,1990,"PRESERVED_SPECIMEN","OCCURRENCE_STATUS_INFERRED_FROM_INDIVIDUAL_COUNT;GEODETIC_DATUM_ASSUMED_WGS84;INSTITUTION_MATCH_FUZZY;COLLECTION_MATCH_NONE"
-77.63333,-8.98333,"Calamagrostis intermedia",1259747599,"Huascarán National Park. Parón Valley, E of lake. Bottom; grassland withwidely scattered shrubs; alluvially sorted morainal mate- rial.","PER",NA,1985,"PRESERVED_SPECIMEN","OCCURRENCE_STATUS_INFERRED_FROM_INDIVIDUAL_COUNT;GEODETIC_DATUM_ASSUMED_WGS84;INSTITUTION_MATCH_FUZZY;COLLECTION_MATCH_NONE"
-78.783333,-1.6333,"Calamagrostis intermedia",1260181493,"Páramo de Tililac (above San Juan).","ECU",NA,1968,"PRESERVED_SPECIMEN","GEODETIC_DATUM_ASSUMED_WGS84;INSTITUTION_MATCH_FUZZY;COLLECTION_MATCH_NONE"
-74.121881,4.159002,"Calamagrostis intermedia",781037402,"georeference from original publication","COL",3000,1989,"HUMAN_OBSERVATION","COORDINATE_ROUNDED;GEODETIC_DATUM_ASSUMED_WGS84;CONTINENT_DERIVED_FROM_COORDINATES"
-97.720444,18.521667,"Calamagrostis intermedia",3306199888,"A 1.5 km de Zamarrilla, por la terracería a la colonia Miguel Hidalgo y Juan N. Méndez (rancho Llano Redondo).","MEX",NA,2003,"PRESERVED_SPECIMEN","TYPE_STATUS_INVALID;OCCURRENCE_STATUS_INFERRED_FROM_INDIVIDUAL_COUNT;COORDINATE_ROUNDED;GEODETIC_DATUM_ASSUMED_WGS84;GEODETIC_DATUM_INVALID;CONTINENT_DERIVED_FROM_COORDINATES;ELEVATION_MIN_MAX_SWAPPED;INSTITUTION_MATCH_NONE"
-72.318039,6.406102,"Calamagrostis intermedia",781035683,"Long-Lat data by C. Londono and A. Cleef releve numbers list. A negative value to meet the DarwinCore Archive requirements when exporting the data","COL",NA,1973,"HUMAN_OBSERVATION","COORDINATE_ROUNDED;GEODETIC_DATUM_ASSUMED_WGS84;CONTINENT_DERIVED_FROM_COORDINATES"
-75.347222,4.738611,"Calamagrostis intermedia",1890920067,"Sin Datos.","COL",3500,1980,"PRESERVED_SPECIMEN","COORDINATE_ROUNDED"
-72.883333,10.4,"Calamagrostis intermedia",2013793669,"Cerro del Avión.","COL",NA,1993,"PRESERVED_SPECIMEN","GEODETIC_DATUM_ASSUMED_WGS84"
-73.986977,4.558328,"Calamagrostis intermedia",1844943379,"Paramo entre Bogota y Choachi.","COL",1954,1974,"PRESERVED_SPECIMEN","COORDINATE_ROUNDED"
-76.256389,-11.676667,"Calamagrostis intermedia",1259734287,"Carretera Central near Casapalca.","PER",NA,1984,"PRESERVED_SPECIMEN","OCCURRENCE_STATUS_INFERRED_FROM_INDIVIDUAL_COUNT;COORDINATE_ROUNDED;GEODETIC_DATUM_ASSUMED_WGS84;INSTITUTION_MATCH_FUZZY;COLLECTION_MATCH_NONE"
-78.058611,-0.026389,"Calamagrostis intermedia",2626515255,"","ECU",NA,2018,"HUMAN_OBSERVATION","COORDINATE_ROUNDED;CONTINENT_DERIVED_FROM_COORDINATES"
-78.35,0.366667,"Calamagrostis intermedia",2517088833,"Province: Imbabura. Southwestern slopes of the volcano Cotacachi.","ECU",NA,1983,"PRESERVED_SPECIMEN","INSTITUTION_MATCH_FUZZY;INSTITUTION_COLLECTION_MISMATCH"
-83.516667,9.5,"Calamagrostis intermedia",1424364519,"Valle de los Conejos (upper Río Talari) and trails to Cerro Chirripó and the Valle de los Lagos.","CRI",NA,1970,"PRESERVED_SPECIMEN","COORDINATE_ROUNDED;GEODETIC_DATUM_ASSUMED_WGS84;CONTINENT_DERIVED_FROM_COORDINATES;INSTITUTION_MATCH_FUZZY;COLLECTION_MATCH_FUZZY"
-77.91583,-0.86694,"Calamagrostis intermedia",1258509984,"Southern slopes of Volcan Chiles","ECU",NA,1987,"PRESERVED_SPECIMEN","GEODETIC_DATUM_ASSUMED_WGS84;PRESUMED_NEGATED_LATITUDE;INSTITUTION_MATCH_NONE"
-79.31666,-3.11666,"Calamagrostis intermedia",4061039424,"Along new road app. 7 km S of road to Nabon. Scrub-páramo, grass-páramo and páramo-swamp.","ECU",NA,1992,"PRESERVED_SPECIMEN","GEODETIC_DATUM_ASSUMED_WGS84;INSTITUTION_MATCH_NONE"
