"lon","lat","species","gbifID","locality","countryCode","coordinateUncertaintyInMeters","year","basisOfRecord","issue"
-78.66666,-2,"Calamagrostis intermedia",4061046091,"Guamote - Macas (in construction) ca km 15. Paramo.","ECU",NA,1999,"PRESERVED_SPECIMEN","GEODETIC_DATUM_ASSUMED_WGS84;INSTITUTION_MATCH_NONE"
-74.0765,4.46438,"Calamagrostis intermedia",1315024952,"El Boqueron de Chipaque.","COL",NA,1957,"PRESERVED_SPECIMEN","GEODETIC_DATUM_ASSUMED_WGS84;CONTINENT_DERIVED_FROM_COORDINATES;COORDINATE_PRECISION_INVALID;INSTITUTION_MATCH_FUZZY;COLLECTION_MATCH_FUZZY"
-72.3251,6.54674,"Calamagrostis intermedia",1315024992,"Sierra Nevada del Cocuy.","COL",NA,1978,"PRESERVED_SPECIMEN","GEODETIC_DATUM_ASSUMED_WGS84;CONTINENT_DERIVED_FROM_COORDINATES;COORDINATE_PRECISION_INVALID;INSTITUTION_MATCH_FUZZY;COLLECTION_MATCH_FUZZY"
-76.6828,1.88333,"Calamagrostis intermedia",1315024967,"Macizo Colombiano,Valle de las Papas,alrededor de Valencia.","COL",NA,1958,"PRESERVED_SPECIMEN","GEODETIC_DATUM_ASSUMED_WGS84;CONTINENT_DERIVED_FROM_COORDINATES;COORDINATE_PRECISION_INVALID;INSTITUTION_MATCH_FUZZY;COLLECTION_MATCH_FUZZY"
-77.41666,-9.38333,"Calamagrostis intermedia",1259769026,"Huascarán National Park. lateral valley of Quebrada Ishinca, trail to Lago Ishinca. Morainal material, mostly granitic; low vegetative cover.","PER",NA,1985,"PRESERVED_SPECIMEN","OCCURRENCE_STATUS_INFERRED_FROM_INDIVIDUAL_COUNT;GEODETIC_DATUM_ASSUMED_WGS84;INSTITUTION_MATCH_FUZZY;COLLECTION_MATCH_NONE"
-68.416667,-16.333333,"Calamagrostis intermedia",1424296514,"Near Cumbre (La Paz-Coroico).","BOL",NA,2002,"PRESERVED_SPECIMEN","COORDINATE_ROUNDED;GEODETIC_DATUM_ASSUMED_WGS84;CONTINENT_DERIVED_FROM_COORDINATES;INSTITUTION_MATCH_FUZZY;COLLECTION_MATCH_FUZZY"
-79.08333,-1.58333,"Calamagrostis intermedia",1259408884,"Km 14 Guaranda (sideroad to Riobamba) - Puebloviejo. Degraded and grazed, cloudforest.","ECU",NA,1988,"PRESERVED_SPECIMEN","GEODETIC_DATUM_ASSUMED_WGS84;DIFFERENT_OWNER_INSTITUTION"
-77.66666,0.7,"Calamagrostis intermedia",1259685883,"About 2 km W of Frailejón between Cruce Cordillera on the Pan American Highway and El Carmelo. Open swamp in Espeletia paramo.","ECU",NA,1979,"PRESERVED_SPECIMEN","GEODETIC_DATUM_ASSUMED_WGS84;DIFFERENT_OWNER_INSTITUTION"
-78.8,-1.26666,"Calamagrostis intermedia",1259404033,"Near Calamaca, app. 20 km W of Ambato along old road Ambato - Guaranda.","ECU",NA,1985,"PRESERVED_SPECIMEN","GEODETIC_DATUM_ASSUMED_WGS84;DIFFERENT_OWNER_INSTITUTION"
-67.96666,-16.3,"Calamagrostis intermedia",1259834757,"Mina Lourdes. 2.7 km al N del camino entre La Paz y Unduavi, a lo largo del Río Kkota Khuchu (ca. 14 km al E de la cumbre). Puna húmeda.","BOL",NA,1987,"PRESERVED_SPECIMEN","OCCURRENCE_STATUS_INFERRED_FROM_INDIVIDUAL_COUNT;GEODETIC_DATUM_ASSUMED_WGS84;INSTITUTION_MATCH_FUZZY;COLLECTION_MATCH_NONE"
-72.832528,5.666,"Calamagrostis intermedia",4026686635,"Vereda Hato Viejo, camino al púlpito.","COL",NA,2019,"PRESERVED_SPECIMEN","COORDINATE_ROUNDED;ELEVATION_MIN_MAX_SWAPPED;INSTITUTION_MATCH_NONE"
-72.939778,10.276333,"Calamagrostis intermedia",3872860313,"San José de Oriente, Sabana Rubia","COL",NA,1993,"HUMAN_OBSERVATION","COORDINATE_ROUNDED"
-78.213611,-0.108889,"Calamagrostis intermedia",1257569078,"Parroquia El Quinche, comunidad Chumillos. Quito Loma. Sitio arqueológico, en la cima del Cerro Quito Loma, a 10 km al este de El Quinche. Páramo de pajonal en los alrededores de las ruinas incaicas. Proyecto Qhapaq Ñan - Red Vial Prehispánica, del Ministerio Coordinador del Patrimonio Natural y Cultural.","ECU",NA,2009,"PRESERVED_SPECIMEN","OCCURRENCE_STATUS_INFERRED_FROM_INDIVIDUAL_COUNT;COORDINATE_ROUNDED;GEODETIC_DATUM_ASSUMED_WGS84;INSTITUTION_MATCH_NONE"
-77.83333,-1.5,"Calamagrostis intermedia",1258510045,"Western slopes of Volcan Chimborazo.","ECU",NA,1987,"PRESERVED_SPECIMEN","GEODETIC_DATUM_ASSUMED_WGS84;INSTITUTION_MATCH_NONE"
-78.01666,-1.31666,"Calamagrostis intermedia",4062104697,"Along ridge S of Paso de la Virgen. Plain at ca 4000 m, swamp and grass-páramo.","ECU",NA,1998,"PRESERVED_SPECIMEN","GEODETIC_DATUM_ASSUMED_WGS84;INSTITUTION_MATCH_NONE"
-78.45,-1.45,"Calamagrostis intermedia",1260021047,"Cajas National Park, E flanks of Cerro Amarillo (4451 m a.s.l.), transition from the grass p·ramo of Calamagrostis intermedia and lower superp·ramo formed by shrubs of Loricaria spp. and cushions of Azorella aretioides, and Werneria humilis.","ECU",NA,1997,"PRESERVED_SPECIMEN","GEODETIC_DATUM_ASSUMED_WGS84;DIFFERENT_OWNER_INSTITUTION"
-100.138694,17.469917,"Calamagrostis intermedia",1895728878,"Cima del Teotepec","MEX",100,1998,"PRESERVED_SPECIMEN","TYPE_STATUS_INVALID;COORDINATE_ROUNDED;GEODETIC_DATUM_ASSUMED_WGS84;CONTINENT_DERIVED_FROM_COORDINATES;ELEVATION_MIN_MAX_SWAPPED;INSTITUTION_MATCH_NONE"
-79.03333,-3.7,"Calamagrostis intermedia",4061772759,"Between the old campment and Fierro Urco","ECU",NA,1998,"PRESERVED_SPECIMEN","GEODETIC_DATUM_ASSUMED_WGS84;INSTITUTION_MATCH_NONE"
-73.610472,5.430167,"Calamagrostis intermedia",1269531004,"Vereda Firita Peña Arriba, carretera de Guachetá a Samacá, casa de Anatilde Buitrago","COL",NA,2013,"HUMAN_OBSERVATION","OCCURRENCE_STATUS_INFERRED_FROM_INDIVIDUAL_COUNT;COORDINATE_ROUNDED;GEODETIC_DATUM_ASSUMED_WGS84"
-76.686556,5.133361,"Calamagrostis intermedia",1563414070,"Páramo de Tatamá","COL",NA,2012,"HUMAN_OBSERVATION","COORDINATE_ROUNDED"
-98.407986,20.079798,"Calamagrostis intermedia",1419206269,"Ejido Emiliano Zapata, mpio. Santiago Tulantepec de Lugo Guerrero.","MEX",738,1992,"PRESERVED_SPECIMEN","TYPE_STATUS_INVALID;OCCURRENCE_STATUS_INFERRED_FROM_INDIVIDUAL_COUNT;COORDINATE_ROUNDED;CONTINENT_DERIVED_FROM_COORDINATES;ELEVATION_MIN_MAX_SWAPPED;INSTITUTION_MATCH_NONE"
-96.509444,17.581111,"Calamagrostis intermedia",1419218179,"Los Tanques, parte alta de los terrenos de San Pablo Macuiltianguis, mpio. San Pablo Macuiltianguis.","MEX",90,1984,"PRESERVED_SPECIMEN","TYPE_STATUS_INVALID;OCCURRENCE_STATUS_INFERRED_FROM_INDIVIDUAL_COUNT;COORDINATE_ROUNDED;GEODETIC_DATUM_ASSUMED_WGS84;CONTINENT_DERIVED_FROM_COORDINATES;ELEVATION_MIN_MAX_SWAPPED;INSTITUTION_MATCH_NONE"
-79.365053,-3.968212,"Calamagrostis intermedia",4067888061,"Trapichillo","ECU",NA,2004,"PRESERVED_SPECIMEN","GEODETIC_DATUM_ASSUMED_WGS84;CONTINENT_DERIVED_FROM_COORDINATES;DIFFERENT_OWNER_INSTITUTION"
-78.35,-0.35,"Calamagrostis intermedia",3413677948,"Nevado Cotacachi, on the south-western side of the SE ridge of the volcano","ECU",NA,1995,"PRESERVED_SPECIMEN","CONTINENT_DERIVED_FROM_COORDINATES;INSTITUTION_MATCH_FUZZY;COLLECTION_MATCH_NONE"
-78.7,-0.66667,"Calamagrostis intermedia",3413677947,"Pichincha/Cotopaxi Volcan Iliniza Sur, E side of the mountain, sandy slope with rocks to the left from the trail to the refuge, transition from the shrub and cushion páramo to the superpáramo vegetation.","ECU",NA,1995,"PRESERVED_SPECIMEN","CONTINENT_DERIVED_FROM_COORDINATES;INSTITUTION_MATCH_FUZZY;COLLECTION_MATCH_NONE"
-78.01667,0.01667,"Calamagrostis intermedia",3413677949,"Nevado Cayambe, W side of the volcano, grazed and burned grass páramo with scattered Gynoxys trees","ECU",NA,1995,"PRESERVED_SPECIMEN","CONTINENT_DERIVED_FROM_COORDINATES;INSTITUTION_MATCH_FUZZY;COLLECTION_MATCH_NONE"
-78.9666,-3.2333,"Calamagrostis intermedia",1260181510,"About 7 km SE of Jima on road towards San Miguel de Cuyes, grasslands and secondary scrub.","ECU",NA,1985,"PRESERVED_SPECIMEN","GEODETIC_DATUM_ASSUMED_WGS84;INSTITUTION_MATCH_FUZZY;COLLECTION_MATCH_NONE"
-78.6,-0.16667,"Calamagrostis intermedia",1260184231,"Mount Pichincha.","ECU",NA,1985,"PRESERVED_SPECIMEN","GEODETIC_DATUM_ASSUMED_WGS84;INSTITUTION_MATCH_FUZZY;COLLECTION_MATCH_NONE"
