"lon","lat","species","gbifID","locality","countryCode","coordinateUncertaintyInMeters","year","basisOfRecord","issue"
10.2,3.25,"Calpocalyx ngouniensis",4062059557,"Près de Bella (45 km NE de Kribi)","CMR",NA,1962,"PRESERVED_SPECIMEN","GEODETIC_DATUM_ASSUMED_WGS84;DIFFERENT_OWNER_INSTITUTION"
10.3667,0.716667,"Calpocalyx ngouniensis",4061296737,"Crystal Mountains, near Assok.","GAB",NA,1994,"PRESERVED_SPECIMEN","GEODETIC_DATUM_ASSUMED_WGS84;DIFFERENT_OWNER_INSTITUTION"
11.9833,2.93333,"Calpocalyx ngouniensis",4061826942,"Pres Evelessi, 30km W. Sangme lima feuille IGN 1/200.000 Ebolowa.","CMR",NA,1970,"PRESERVED_SPECIMEN","GEODETIC_DATUM_ASSUMED_WGS84;DIFFERENT_OWNER_INSTITUTION"
9.96667,3.05,"Calpocalyx ngouniensis",4062020614,"2 km S. of Longii.","CMR",NA,1969,"PRESERVED_SPECIMEN","GEODETIC_DATUM_ASSUMED_WGS84;DIFFERENT_OWNER_INSTITUTION"
13.3012,-0.23658,"Calpocalyx ngouniensis",2268878203,"Concession SEEF, north crest of Mount Ngouadi.","GAB",NA,2017,"PRESERVED_SPECIMEN","OCCURRENCE_STATUS_INFERRED_FROM_INDIVIDUAL_COUNT;GEODETIC_DATUM_ASSUMED_WGS84;DIFFERENT_OWNER_INSTITUTION"
11.75,-0.45,"Calpocalyx ngouniensis",2517631122,"Forêt des Abeilles, E of Lopé Reserve; in NSG forestry concession.","GAB",NA,1993,"PRESERVED_SPECIMEN","INSTITUTION_MATCH_FUZZY;INSTITUTION_COLLECTION_MISMATCH"
12.233333,-0.266667,"Calpocalyx ngouniensis",2517857140,"Foret des Abeilles. 14 km SSE of confluence Ogooue-Ivindo.","GAB",NA,1993,"PRESERVED_SPECIMEN","INSTITUTION_MATCH_FUZZY;INSTITUTION_COLLECTION_MISMATCH"
9.9442,0.5598,"Calpocalyx ngouniensis",4061851696,"Proche de la rivière Noya, à environ 30 km au nord-est de Ntoum.","GAB",NA,2009,"PRESERVED_SPECIMEN","GEODETIC_DATUM_ASSUMED_WGS84;INSTITUTION_MATCH_NONE"
10.3667,0.4995,"Calpocalyx ngouniensis",4060996060,"Monts du Cristal.","GAB",NA,2001,"PRESERVED_SPECIMEN","GEODETIC_DATUM_ASSUMED_WGS84;INSTITUTION_MATCH_NONE"
10.2025,0.5691,"Calpocalyx ngouniensis",4061148353,"Monts de Cristal, montagnes de Mvé Lakéné","GAB",NA,2006,"PRESERVED_SPECIMEN","GEODETIC_DATUM_ASSUMED_WGS84;INSTITUTION_MATCH_NONE"
12.85,-0.783333,"Calpocalyx ngouniensis",4061285748,"14 km WSW of Bambidie.","GAB",NA,1994,"PRESERVED_SPECIMEN","GEODETIC_DATUM_ASSUMED_WGS84;DIFFERENT_OWNER_INSTITUTION"
11.28752,-1.22596,"Calpocalyx ngouniensis",4061895750,"Est du Parc National de Waka, à plus ou moins 5 km au Sud de la rivière Mayi.","GAB",NA,2008,"PRESERVED_SPECIMEN","OCCURRENCE_STATUS_INFERRED_FROM_INDIVIDUAL_COUNT;GEODETIC_DATUM_ASSUMED_WGS84;INSTITUTION_MATCH_NONE"
11.16557,0.53178,"Calpocalyx ngouniensis",2268999804,"Rougier Concession in Haut-Abanga.","GAB",NA,2014,"PRESERVED_SPECIMEN","GEODETIC_DATUM_ASSUMED_WGS84;DIFFERENT_OWNER_INSTITUTION"
10.8931,-1.2744,"Calpocalyx ngouniensis",4061673980,"Ouest du Parc National de Waka (hors du Parc).","GAB",NA,2006,"PRESERVED_SPECIMEN","GEODETIC_DATUM_ASSUMED_WGS84;INSTITUTION_MATCH_NONE"
10.0811,1.62032,"Calpocalyx ngouniensis",4061103098,"SO du Parc National de Monte Alén, 2km au NE du site de traversée du rio Uolo pour aller aux cataractas","GNQ",NA,2002,"PRESERVED_SPECIMEN","GEODETIC_DATUM_ASSUMED_WGS84;INSTITUTION_MATCH_NONE"
13.0916,-3.45686,"Calpocalyx ngouniensis",4062059613,"Mambana et Komono.","COG",NA,2012,"PRESERVED_SPECIMEN","GEODETIC_DATUM_ASSUMED_WGS84;DIFFERENT_OWNER_INSTITUTION"
10.385,0.6105,"Calpocalyx ngouniensis",4061841022,"Monts de Cristal, proche de Tchimbélé, montagne de Ngol Madouaka","GAB",NA,2007,"PRESERVED_SPECIMEN","GEODETIC_DATUM_ASSUMED_WGS84;INSTITUTION_MATCH_NONE"
15.166667,-4.383333,"Calpocalyx ngouniensis",2517659130,"environs de Brazzaville, plateau des Cataractes. Djoumouna.","COG",NA,1968,"PRESERVED_SPECIMEN","INSTITUTION_MATCH_FUZZY;INSTITUTION_COLLECTION_MISMATCH"
10.1,0.883333,"Calpocalyx ngouniensis",2013870720,"Crystal Mountains, 50m on transect H6.","GAB",NA,2001,"PRESERVED_SPECIMEN","GEODETIC_DATUM_ASSUMED_WGS84;INSTITUTION_MATCH_FUZZY;COLLECTION_MATCH_FUZZY"
11.833333,-0.666667,"Calpocalyx ngouniensis",2013874210,"probably Forêt des Abeilles.","GAB",NA,1989,"PRESERVED_SPECIMEN","GEODETIC_DATUM_ASSUMED_WGS84;INSTITUTION_MATCH_FUZZY;COLLECTION_MATCH_FUZZY"
10.194,0.45657,"Calpocalyx ngouniensis",2268968497,"Zone d'exploration de Lonmin, au Nord de Andok Foula, à l'est de la route reliant la route de Medouneu à la route de kinguélé.","GAB",NA,2009,"PRESERVED_SPECIMEN","OCCURRENCE_STATUS_INFERRED_FROM_INDIVIDUAL_COUNT;GEODETIC_DATUM_ASSUMED_WGS84;DIFFERENT_OWNER_INSTITUTION"
11.2138,0.4338,"Calpocalyx ngouniensis",4061126098,"Concession Rougier du Haut-Abanga, Sud-Est de Mikongo, partie Nord des montagnes Mekié.","GAB",NA,2008,"PRESERVED_SPECIMEN","GEODETIC_DATUM_ASSUMED_WGS84;INSTITUTION_MATCH_NONE"
9.883333,1.783333,"Calpocalyx ngouniensis",2517841049,"'Bata - Bicomo: Central electric. Bosque existente entre os kms 7-8 de Nkoantoma e Ayelon.'.","GNQ",NA,1991,"PRESERVED_SPECIMEN","INSTITUTION_MATCH_FUZZY;INSTITUTION_COLLECTION_MISMATCH"
10.635,2.62028,"Calpocalyx ngouniensis",2269011259,"Campo Ma'an area, Onoyong, in the National Park.","CMR",NA,2001,"PRESERVED_SPECIMEN","GEODETIC_DATUM_ASSUMED_WGS84;DIFFERENT_OWNER_INSTITUTION"
