"lon","lat","species","gbifID","locality","countryCode","coordinateUncertaintyInMeters","year","basisOfRecord","issue"
-120.3537024,35.3949147,"Chorizanthe rectispina",3053334691,"Black Mtn, Highland District","USA",2500,1961,"PRESERVED_SPECIMEN","COORDINATE_REPROJECTED;CONTINENT_DERIVED_FROM_COORDINATES;INSTITUTION_MATCH_FUZZY;COLLECTION_MATCH_NONE"
-120.6427094,35.4359115,"Chorizanthe rectispina",3053388000,"Santa Barbara Rd, Atascadero","USA",1250,1959,"PRESERVED_SPECIMEN","COORDINATE_REPROJECTED;CONTINENT_DERIVED_FROM_COORDINATES;INSTITUTION_MATCH_FUZZY;COLLECTION_MATCH_NONE"
-120.972621,35.903143,"Chorizanthe rectispina",3053404376,"Jolon Rd.","USA",NA,2020,"PRESERVED_SPECIMEN","CONTINENT_DERIVED_FROM_COORDINATES;INSTITUTION_MATCH_FUZZY;COLLECTION_MATCH_NONE"
-121.05688,35.891471,"Chorizanthe rectispina",3827649306,"San Antonio River bed, 3.16 air km ESE of intersection of Tule and Interlake Road, 2.09 air km WSW of Tule Road Eastern Boundary Gate; Ft Hunter Liggett Training Area 29","USA",200,2021,"PRESERVED_SPECIMEN","CONTINENT_DERIVED_FROM_COORDINATES;INSTITUTION_MATCH_FUZZY;COLLECTION_MATCH_NONE"
-120.288496,35.706866,"Chorizanthe rectispina",2421726095,"San Luis Obispo County: on roadcut along Bitterwater road south of intersection with Highway 46.","USA",1500,2000,"PRESERVED_SPECIMEN","CONTINENT_DERIVED_FROM_COORDINATES;INSTITUTION_MATCH_FUZZY"
-120.754167,35.852778,"Chorizanthe rectispina",2421726418,"Monterey County: Camp Roberts, East Garrison.","USA",NA,2005,"PRESERVED_SPECIMEN","GEODETIC_DATUM_ASSUMED_WGS84;CONTINENT_DERIVED_FROM_COORDINATES;INSTITUTION_MATCH_FUZZY"
-120.863889,35.540278,"Chorizanthe rectispina",2845673318,"Along Santa Rosa Creek road maybe 1 mile from Highway 46. Hillside opposite 11710","USA",NA,2006,"PRESERVED_SPECIMEN","COORDINATE_ROUNDED;COLLECTION_MATCH_FUZZY"
-120.3375,35.015278,"Chorizanthe rectispina",1896063647,"Santa Barbara road, Atascadero","USA",NA,1959,"PRESERVED_SPECIMEN","TYPE_STATUS_INVALID;OCCURRENCE_STATUS_INFERRED_FROM_INDIVIDUAL_COUNT;COORDINATE_ROUNDED;GEODETIC_DATUM_ASSUMED_WGS84;CONTINENT_DERIVED_FROM_COORDINATES;DIFFERENT_OWNER_INSTITUTION"
