"lon","lat","species","gbifID","locality","countryCode","coordinateUncertaintyInMeters","year","basisOfRecord","issue"
47.97,-13.67,"Combretum obscurum",4061954413,"Ampasindava, forêt de Andranomatavy. A 400 m du point côté 543, au 94°.","MDG",NA,2009,"PRESERVED_SPECIMEN","OCCURRENCE_STATUS_INFERRED_FROM_INDIVIDUAL_COUNT;GEODETIC_DATUM_ASSUMED_WGS84;DIFFERENT_OWNER_INSTITUTION"
45.278208,-16.459196,"Combretum obscurum",4061242623,"Namoroka National Park. W. part of park near Lake Amparialimy.","MDG",NA,2016,"PRESERVED_SPECIMEN","OCCURRENCE_STATUS_INFERRED_FROM_INDIVIDUAL_COUNT;GEODETIC_DATUM_ASSUMED_WGS84;DIFFERENT_OWNER_INSTITUTION"
49.125,-12.95444,"Combretum obscurum",1260435395,"Ankarana Special Reserve; ca. 5 km NW of Park Village near Besaboba stream. Collections from surrounding forest and encampment. Primary forest, closed, on deep volcanic soils, well weathered red soils.","MDG",NA,1993,"PRESERVED_SPECIMEN","OCCURRENCE_STATUS_INFERRED_FROM_INDIVIDUAL_COUNT;GEODETIC_DATUM_ASSUMED_WGS84;INSTITUTION_MATCH_FUZZY;COLLECTION_MATCH_NONE"
49.701111,-16.769722,"Combretum obscurum",4031708667,"Soanierana Ivongo, Manompana. Le long de la rivière Antsohy.","MDG",NA,2010,"PRESERVED_SPECIMEN","OCCURRENCE_STATUS_INFERRED_FROM_INDIVIDUAL_COUNT;COORDINATE_ROUNDED;GEODETIC_DATUM_ASSUMED_WGS84;INSTITUTION_MATCH_FUZZY;COLLECTION_MATCH_NONE"
48.711944,-13.589722,"Combretum obscurum",4031882546,"Ambilobe, Beramanja, Anketrabe Belinta. Forêt de Galoko.","MDG",NA,2013,"PRESERVED_SPECIMEN","OCCURRENCE_STATUS_INFERRED_FROM_INDIVIDUAL_COUNT;COORDINATE_ROUNDED;GEODETIC_DATUM_ASSUMED_WGS84;INSTITUTION_MATCH_FUZZY;COLLECTION_MATCH_NONE"
46.24444,-16.53222,"Combretum obscurum",4061591529,"Ambato-Boeni, Sitampiky, Ambatolafia. Récolté avec N.L. Ravalimanarivo, Tombo & Haja.","MDG",NA,2005,"PRESERVED_SPECIMEN","OCCURRENCE_STATUS_INFERRED_FROM_INDIVIDUAL_COUNT;GEODETIC_DATUM_ASSUMED_WGS84;DIFFERENT_OWNER_INSTITUTION"
49.0675,-17.961389,"Combretum obscurum",2268902299,"District Toamasina II, Commune Rurale Sahambala, Fokontany Ambodirafia.","MDG",NA,2017,"PRESERVED_SPECIMEN","OCCURRENCE_STATUS_INFERRED_FROM_INDIVIDUAL_COUNT;COORDINATE_ROUNDED;GEODETIC_DATUM_ASSUMED_WGS84;DIFFERENT_OWNER_INSTITUTION"
49.18694,-13.24167,"Combretum obscurum",1144632966,"Ambahatra, cours moyen - Vallée de l'Ambahatra (cours moyen): Befalafa-Beantrandra (rive gauche)/Faritanin Antsiranana","MDG",1500,2000,"PRESERVED_SPECIMEN","GEODETIC_DATUM_ASSUMED_WGS84;CONTINENT_DERIVED_FROM_COORDINATES;INSTITUTION_MATCH_FUZZY;COLLECTION_MATCH_NONE"
44.45,-18.85,"Combretum obscurum",1260429357,"S.W. of Antsalova, forest between Ambereny and Lac Masama.","MDG",NA,1987,"PRESERVED_SPECIMEN","OCCURRENCE_STATUS_INFERRED_FROM_INDIVIDUAL_COUNT;GEODETIC_DATUM_ASSUMED_WGS84;INSTITUTION_MATCH_FUZZY;COLLECTION_MATCH_NONE"
