"lon","lat","species","gbifID","locality","countryCode","coordinateUncertaintyInMeters","year","basisOfRecord","issue"
46.86,-25.07,"Croton trichotomus",2618571138,"Madagascar, Toliara Province, Anosy Region, Fort-Dauphin District, Fihary Commune, Petriky forest.","MDG",NA,2016,"PRESERVED_SPECIMEN","GEODETIC_DATUM_ASSUMED_WGS84;INSTITUTION_COLLECTION_MISMATCH"
47.038056,-24.957778,"Croton trichotomus",4061184464,"District de Fort-Dauphin, Commune de Mandrombondromotra. Forêt Ambavarano 2 km à l'Est du site minier QMM.","MDG",NA,2013,"PRESERVED_SPECIMEN","OCCURRENCE_STATUS_INFERRED_FROM_INDIVIDUAL_COUNT;COORDINATE_ROUNDED;GEODETIC_DATUM_ASSUMED_WGS84;DIFFERENT_OWNER_INSTITUTION"
49.12075,-18.893533,"Croton trichotomus",1258101140,"Road from Brickaville to Ambila Lemaitso.","MDG",NA,2009,"PRESERVED_SPECIMEN","OCCURRENCE_STATUS_INFERRED_FROM_INDIVIDUAL_COUNT;COORDINATE_ROUNDED;GEODETIC_DATUM_ASSUMED_WGS84;DIFFERENT_OWNER_INSTITUTION"
49.256667,-18.565556,"Croton trichotomus",4031532787,"Fivondronana: Brickaville, Firaisana: Andranonkoditra, Fokontany: Ankanin'ny nofy. Forêt de Vohibola.","MDG",NA,2003,"PRESERVED_SPECIMEN","OCCURRENCE_STATUS_INFERRED_FROM_INDIVIDUAL_COUNT;COORDINATE_ROUNDED;GEODETIC_DATUM_ASSUMED_WGS84;INSTITUTION_MATCH_FUZZY;COLLECTION_MATCH_NONE"
45.843889,-16.25,"Croton trichotomus",1844448093,"NE du ruisseau Ambovobe;","MDG",NA,1995,"PRESERVED_SPECIMEN","COORDINATE_ROUNDED;GEODETIC_DATUM_ASSUMED_WGS84;TAXON_MATCH_HIGHERRANK;INSTITUTION_MATCH_FUZZY;COLLECTION_MATCH_NONE"
49.6844,-16.7886,"Croton trichotomus",1317946840,"Analanjirofo, Manompana, Fandrarazana, Antanambao.","MDG",NA,2007,"PRESERVED_SPECIMEN","GEODETIC_DATUM_ASSUMED_WGS84"
47.207222,-24.569444,"Croton trichotomus",4031998011,"Iabakoho, Antsotso Avaratra, Ivohibe. Low elevation humid forest. Specimens preserved in alcohol.","MDG",NA,2006,"PRESERVED_SPECIMEN","OCCURRENCE_STATUS_INFERRED_FROM_INDIVIDUAL_COUNT;COORDINATE_ROUNDED;GEODETIC_DATUM_ASSUMED_WGS84;INSTITUTION_MATCH_FUZZY;COLLECTION_MATCH_NONE"
47.17222,-24.76805,"Croton trichotomus",4031693306,"Fokontany Sainte Luce, Fore|ts littorales sur sables le long de la piste, Fort-Dauphin. Echantillons préservés en alcool. Récoltés avec Johny Rabenantoandro et Edmond Ramisy.","MDG",NA,2000,"PRESERVED_SPECIMEN","OCCURRENCE_STATUS_INFERRED_FROM_INDIVIDUAL_COUNT;GEODETIC_DATUM_ASSUMED_WGS84;INSTITUTION_MATCH_FUZZY;COLLECTION_MATCH_NONE"
47.151389,-24.790278,"Croton trichotomus",4031847396,"Anosy, Fort-Dauphin, Mahatalaky. Forêt littorale de Sainte Luce (S7).","MDG",NA,2012,"PRESERVED_SPECIMEN","OCCURRENCE_STATUS_INFERRED_FROM_INDIVIDUAL_COUNT;COORDINATE_ROUNDED;GEODETIC_DATUM_ASSUMED_WGS84;INSTITUTION_MATCH_FUZZY;COLLECTION_MATCH_NONE"
46.8,-24.666667,"Croton trichotomus",2517681616,"Madagascar, Toliara, Intégrale Réserve # 11, Andohahela, Parcelle 1, vicinity of Eminiminy","MDG",NA,1993,"PRESERVED_SPECIMEN","INSTITUTION_MATCH_FUZZY;INSTITUTION_COLLECTION_MISMATCH"
49.30139,-14.32556,"Croton trichotomus",731313471,"","MDG",NA,2006,"PRESERVED_SPECIMEN","GEODETIC_DATUM_ASSUMED_WGS84;CONTINENT_DERIVED_FROM_COORDINATES;COLLECTION_MATCH_FUZZY"
46.91667,-22.21667,"Croton trichotomus",437533194,"Ankazomby","MDG",NA,1967,"PRESERVED_SPECIMEN","GEODETIC_DATUM_ASSUMED_WGS84;CONTINENT_DERIVED_FROM_COORDINATES;TAXON_MATCH_FUZZY;COLLECTION_MATCH_FUZZY"
46.13333,-18.8,"Croton trichotomus",439531865,"Ambohiby","MDG",NA,1952,"PRESERVED_SPECIMEN","GEODETIC_DATUM_ASSUMED_WGS84;CONTINENT_DERIVED_FROM_COORDINATES;COLLECTION_MATCH_FUZZY"
49.766667,-13.2,"Croton trichotomus",1258629353,"Diego Suarez region, SE of town and SE of Ambilobe, near Daraina on road to Vohemar (Iharana); forest; D. Meyer's lemur study site.","MDG",NA,1989,"PRESERVED_SPECIMEN","OCCURRENCE_STATUS_INFERRED_FROM_INDIVIDUAL_COUNT;COORDINATE_ROUNDED;GEODETIC_DATUM_ASSUMED_WGS84;INSTITUTION_MATCH_FUZZY;COLLECTION_MATCH_NONE"
47.085278,-23.539722,"Croton trichotomus",4061566261,"Midongy du Sud, à 2 km au Sud du village de Beharena II. Forêt dense humide, tendance à la sclérophylie. Habitat plus sec. Récolté avec M. Ramanantsoa, M.G. Maminandrasana, W. Lodwige, Nestor & Zafy.","MDG",NA,2005,"PRESERVED_SPECIMEN","OCCURRENCE_STATUS_INFERRED_FROM_INDIVIDUAL_COUNT;COORDINATE_ROUNDED;GEODETIC_DATUM_ASSUMED_WGS84;DIFFERENT_OWNER_INSTITUTION"
47.143056,-24.575,"Croton trichotomus",1258116569,"District Fort Dauphin, Commune Iaboakoho, Fokontany Iaboakoho. Forêt d'Ampasina.","MDG",NA,2015,"PRESERVED_SPECIMEN","OCCURRENCE_STATUS_INFERRED_FROM_INDIVIDUAL_COUNT;COORDINATE_ROUNDED;GEODETIC_DATUM_ASSUMED_WGS84;DIFFERENT_OWNER_INSTITUTION"
47.940556,-21.388333,"Croton trichotomus",4061258184,"Middle and upper slopes of Mt. Vatovavy (the Impenetrable Maiden), an erosion remnant of a crystalline metamorphic rock promontory 2-3 km E of Ambolotara.","MDG",NA,1998,"PRESERVED_SPECIMEN","OCCURRENCE_STATUS_INFERRED_FROM_INDIVIDUAL_COUNT;COORDINATE_ROUNDED;GEODETIC_DATUM_ASSUMED_WGS84;DIFFERENT_OWNER_INSTITUTION"
46.78333,-22.31667,"Croton trichotomus",439311594,"Antambohobe","MDG",NA,1962,"PRESERVED_SPECIMEN","GEODETIC_DATUM_ASSUMED_WGS84;CONTINENT_DERIVED_FROM_COORDINATES;COLLECTION_MATCH_FUZZY"
47.96667,-22,"Croton trichotomus",438289841,"Ambila","MDG",NA,1951,"PRESERVED_SPECIMEN","GEODETIC_DATUM_ASSUMED_WGS84;CONTINENT_DERIVED_FROM_COORDINATES;COLLECTION_MATCH_FUZZY"
46.305,-25.0075,"Croton trichotomus",4067854314,"","MDG",NA,1998,"PRESERVED_SPECIMEN","GEODETIC_DATUM_ASSUMED_WGS84;CONTINENT_DERIVED_FROM_COORDINATES;COLLECTION_MATCH_FUZZY"
46.71667,-25.15,"Croton trichotomus",437956785,"Ranofotsy","MDG",NA,1955,"PRESERVED_SPECIMEN","GEODETIC_DATUM_ASSUMED_WGS84;CONTINENT_DERIVED_FROM_COORDINATES;COLLECTION_MATCH_FUZZY"
50.13333,-14.3,"Croton trichotomus",438622650,"Andranomatavy","MDG",NA,1958,"PRESERVED_SPECIMEN","GEODETIC_DATUM_ASSUMED_WGS84;CONTINENT_DERIVED_FROM_COORDINATES;COLLECTION_MATCH_FUZZY"
47.73167,-19.66139,"Croton trichotomus",1265104756,"","MDG",NA,2009,"PRESERVED_SPECIMEN","GEODETIC_DATUM_ASSUMED_WGS84;CONTINENT_DERIVED_FROM_COORDINATES;COLLECTION_MATCH_FUZZY"
44.53722,-18.08722,"Croton trichotomus",1144643116,"Melaky - Maintirano, Belitsaky, Antsakoabe. Forêt d'Amboloando.","MDG",10,2012,"PRESERVED_SPECIMEN","GEODETIC_DATUM_ASSUMED_WGS84;CONTINENT_DERIVED_FROM_COORDINATES;INSTITUTION_MATCH_FUZZY;COLLECTION_MATCH_NONE"
