"lon","lat","species","gbifID","locality","countryCode","coordinateUncertaintyInMeters","year","basisOfRecord","issue"
-79.38,9.23,"Cryptochloa variana",1318483992,"E of Cerro Jefe.","PAN",NA,2002,"PRESERVED_SPECIMEN","GEODETIC_DATUM_ASSUMED_WGS84;CONTINENT_DERIVED_FROM_COORDINATES;CONTINENT_INVALID"
-88.879883,17.020131,"Cryptochloa variana",1057525813,"","BLZ",NA,1955,"PRESERVED_SPECIMEN","GEODETIC_DATUM_ASSUMED_WGS84;INSTITUTION_MATCH_FUZZY;INSTITUTION_COLLECTION_MISMATCH"
-81.15416,8.52222,"Cryptochloa variana",1259243281,"Ridge east of Cerro Tute, about 8 km NW of Santa Fe","PAN",NA,1975,"PRESERVED_SPECIMEN","GEODETIC_DATUM_ASSUMED_WGS84;INSTITUTION_MATCH_FUZZY;COLLECTION_MATCH_NONE"
-80.111667,8.625,"Cryptochloa variana",1259243994,"NE slopes of Cerro Caracoral, N rim of El Valle.","PAN",NA,1981,"PRESERVED_SPECIMEN","OCCURRENCE_STATUS_INFERRED_FROM_INDIVIDUAL_COUNT;COORDINATE_ROUNDED;GEODETIC_DATUM_ASSUMED_WGS84;INSTITUTION_MATCH_FUZZY;COLLECTION_MATCH_NONE"
-80.591111,8.668611,"Cryptochloa variana",4031838031,"El Copé. Parque Nacional Omar Torrijos Herrera. Sendero cuerpo de paz.","PAN",NA,2012,"PRESERVED_SPECIMEN","OCCURRENCE_STATUS_INFERRED_FROM_INDIVIDUAL_COUNT;COORDINATE_ROUNDED;GEODETIC_DATUM_ASSUMED_WGS84;INSTITUTION_MATCH_FUZZY;COLLECTION_MATCH_NONE"
-79.791667,9.325,"Cryptochloa variana",1259246542,"Santa Rita, ca. 25 km antes de Colón por la carretera Transistimica. Terminación del camino maderero, al final del desvio del camino.","PAN",NA,1968,"PRESERVED_SPECIMEN","OCCURRENCE_STATUS_INFERRED_FROM_INDIVIDUAL_COUNT;COORDINATE_ROUNDED;GEODETIC_DATUM_ASSUMED_WGS84;INSTITUTION_MATCH_FUZZY;COLLECTION_MATCH_NONE"
-79.92083,8.69055,"Cryptochloa variana",1259244321,"Cerro Campana in forest along trail from 2700 ft. to top (ca. 3200 ft.)","PAN",NA,1978,"PRESERVED_SPECIMEN","GEODETIC_DATUM_ASSUMED_WGS84;INSTITUTION_MATCH_FUZZY;COLLECTION_MATCH_NONE"
-79.541667,9.441667,"Cryptochloa variana",1259243502,"Trail from headwaters of Río Boquerón back to fork with Río Escandaloso, area route of abandoned railroad.","PAN",NA,1978,"PRESERVED_SPECIMEN","OCCURRENCE_STATUS_INFERRED_FROM_INDIVIDUAL_COUNT;COORDINATE_ROUNDED;GEODETIC_DATUM_ASSUMED_WGS84;INSTITUTION_MATCH_FUZZY;COLLECTION_MATCH_NONE"
-79.775,9.34166,"Cryptochloa variana",4031594882,"Carretera Santa Rita-Sierra Llorona. Bosque secundario, remanente?","PAN",NA,1994,"PRESERVED_SPECIMEN","GEODETIC_DATUM_ASSUMED_WGS84;INSTITUTION_MATCH_FUZZY;COLLECTION_MATCH_NONE"
-79,9.2,"Cryptochloa variana",1259535954,"6-7 miles from Pan American Highway on El Llano-Carti Road.","PAN",NA,1982,"PRESERVED_SPECIMEN","OCCURRENCE_STATUS_INFERRED_FROM_INDIVIDUAL_COUNT;GEODETIC_DATUM_ASSUMED_WGS84;INSTITUTION_MATCH_FUZZY;COLLECTION_MATCH_NONE"
-80.458333,8.686111,"Cryptochloa variana",1259573561,"South of Cascajal along Continental Divide. [Coordinates on orginal label: 08º45'N, 080º25'W]","PAN",NA,1981,"PRESERVED_SPECIMEN","OCCURRENCE_STATUS_INFERRED_FROM_INDIVIDUAL_COUNT;COORDINATE_ROUNDED;GEODETIC_DATUM_ASSUMED_WGS84;INSTITUTION_MATCH_FUZZY;COLLECTION_MATCH_NONE"
-79.31388,9.275,"Cryptochloa variana",1259245451,"Altos de Pacora, ca. 20 km northeast of Cerro Azul","PAN",NA,1972,"PRESERVED_SPECIMEN","GEODETIC_DATUM_ASSUMED_WGS84;INSTITUTION_MATCH_FUZZY;COLLECTION_MATCH_NONE"
-79.1,9.4,"Cryptochloa variana",1259652861,"Río Cangandí, hills W of river from the village to the confluence of Río Titamibe.","PAN",NA,1985,"PRESERVED_SPECIMEN","OCCURRENCE_STATUS_INFERRED_FROM_INDIVIDUAL_COUNT;GEODETIC_DATUM_ASSUMED_WGS84;INSTITUTION_MATCH_FUZZY;COLLECTION_MATCH_NONE"
-78.81666,9.38333,"Cryptochloa variana",1259246238,"Cerro Habú, trail from Río Sidro, primary wet forest","PAN",NA,1980,"PRESERVED_SPECIMEN","GEODETIC_DATUM_ASSUMED_WGS84;INSTITUTION_MATCH_FUZZY;COLLECTION_MATCH_NONE"
-81.09805,8.48222,"Cryptochloa variana",1260067433,"Vicinity of Escuela de Agricultura Alto Piedra, near Santa Fé. Along trail to the top of Cerro Tute","PAN",NA,1980,"PRESERVED_SPECIMEN","GEODETIC_DATUM_ASSUMED_WGS84;INSTITUTION_MATCH_FUZZY;COLLECTION_MATCH_NONE"
-78.48333,9.41666,"Cryptochloa variana",1259245550,"Niatuppu [Niatupo] and vicinity, hillside","PAN",NA,1975,"PRESERVED_SPECIMEN","GEODETIC_DATUM_ASSUMED_WGS84;ELEVATION_NON_NUMERIC;INSTITUTION_MATCH_FUZZY;COLLECTION_MATCH_NONE"
-77.4167,6.25,"Cryptochloa variana",1320588095,"MeCana, Serrania de Baudo","COL",NA,1983,"PRESERVED_SPECIMEN","GEODETIC_DATUM_ASSUMED_WGS84"
-77.09722,8.04305,"Cryptochloa variana",1259079128,"Lower slopes of Serranía del Darien, W of Unguia.","COL",NA,1975,"PRESERVED_SPECIMEN","OCCURRENCE_STATUS_INFERRED_FROM_INDIVIDUAL_COUNT;GEODETIC_DATUM_ASSUMED_WGS84;INSTITUTION_MATCH_FUZZY;COLLECTION_MATCH_NONE"
-78.966667,9.366667,"Cryptochloa variana",1259656576,"El Llano-Cartí Road. Km. 26.5, trail to Río Cartí Chico and up ridge on E side. [Coordinates on original label: 9º19'N, 78º55'W]","PAN",NA,1985,"PRESERVED_SPECIMEN","OCCURRENCE_STATUS_INFERRED_FROM_INDIVIDUAL_COUNT;COORDINATE_ROUNDED;GEODETIC_DATUM_ASSUMED_WGS84;INSTITUTION_MATCH_FUZZY;COLLECTION_MATCH_NONE"
-82.537778,9.302778,"Cryptochloa variana",1259244980,"Bosque lateral a campamento Changuinola 1.","PAN",NA,1980,"PRESERVED_SPECIMEN","OCCURRENCE_STATUS_INFERRED_FROM_INDIVIDUAL_COUNT;COORDINATE_ROUNDED;GEODETIC_DATUM_ASSUMED_WGS84;INSTITUTION_MATCH_FUZZY;COLLECTION_MATCH_NONE"
-79.466667,9.441667,"Cryptochloa variana",1259088660,"At base of Cerro Bruja along Río Escandaloso, above Mina Boquerón #2 (manganese mine), 19 miles from Transisthmian Highway on road to Salamanca. [Coordinates on original label: 09º50'N, 079º32'W]","PAN",NA,1982,"PRESERVED_SPECIMEN","OCCURRENCE_STATUS_INFERRED_FROM_INDIVIDUAL_COUNT;COORDINATE_ROUNDED;GEODETIC_DATUM_ASSUMED_WGS84;INSTITUTION_MATCH_FUZZY;COLLECTION_MATCH_NONE"
-77.4,8.641667,"Cryptochloa variana",1258948809,"Trail from Puerto Obaldía to La Bonga, tributary of the Río Armila, ca. 2 hours walk from Puerto Obaldía. [Coordinates on original label: 08º40'N, 077º25'W]","PAN",NA,1982,"PRESERVED_SPECIMEN","OCCURRENCE_STATUS_INFERRED_FROM_INDIVIDUAL_COUNT;COORDINATE_ROUNDED;GEODETIC_DATUM_ASSUMED_WGS84;ELEVATION_NON_NUMERIC;INSTITUTION_MATCH_FUZZY;COLLECTION_MATCH_NONE"
-77.816667,7.75,"Cryptochloa variana",1260067430,"Loma Cuasi, behind Manene.","PAN",NA,1967,"PRESERVED_SPECIMEN","OCCURRENCE_STATUS_INFERRED_FROM_INDIVIDUAL_COUNT;COORDINATE_ROUNDED;GEODETIC_DATUM_ASSUMED_WGS84;INSTITUTION_MATCH_FUZZY;COLLECTION_MATCH_NONE"
-79.134444,9.256944,"Cryptochloa variana",1259244819,"10 km N of Magarita on road to Madroño then 3 km W on ridgetop road.","PAN",NA,1979,"PRESERVED_SPECIMEN","OCCURRENCE_STATUS_INFERRED_FROM_INDIVIDUAL_COUNT;COORDINATE_ROUNDED;GEODETIC_DATUM_ASSUMED_WGS84;INSTITUTION_MATCH_FUZZY;COLLECTION_MATCH_NONE"
