"lon","lat","species","gbifID","locality","countryCode","coordinateUncertaintyInMeters","year","basisOfRecord","issue"
-76.6,0.95,"Cryptochloa unispiculata",1317450239,"Mun. VillaGarzon (?), Santa Marta Trail","COL",NA,1987,"PRESERVED_SPECIMEN","GEODETIC_DATUM_ASSUMED_WGS84"
-72,-2.6667,"Cryptochloa unispiculata",1317824021,"Rio yaguasyacu, affluent of rio ampiyacu, brillo nuevo and vicinity","PER",NA,1977,"PRESERVED_SPECIMEN","GEODETIC_DATUM_ASSUMED_WGS84"
-71.8167,-3.1667,"Cryptochloa unispiculata",1321768640,"Rio ampiyacu, pebas","PER",NA,1977,"PRESERVED_SPECIMEN","GEODETIC_DATUM_ASSUMED_WGS84"
-71.25,-11.9333,"Cryptochloa unispiculata",1319310741,"Parque nacional manu, rio manu, pakitza, trocha castanal, estaca 30-31, a 1.55 km del campamento","PER",NA,1991,"PRESERVED_SPECIMEN","GEODETIC_DATUM_ASSUMED_WGS84"
-75.8667,1.3833,"Cryptochloa unispiculata",1317586883,"Km 3.5 of the Andaquies-Albania road","COL",NA,1987,"PRESERVED_SPECIMEN","GEODETIC_DATUM_ASSUMED_WGS84"
-72.049474,-0.763403,"Cryptochloa unispiculata",1258669916,"Rio Caqueta. Isla Mariname, Extremo este. Bosque alto abierto. Plano aluvial inundado.","COL",NA,1990,"PRESERVED_SPECIMEN","GEODETIC_DATUM_ASSUMED_WGS84;INSTITUTION_MATCH_FUZZY;COLLECTION_MATCH_NONE"
-77.45,0.13333,"Cryptochloa unispiculata",1259051779,"Parroquia Puerto Libre (San Pedro de los Cofanes). Comunidad Cofán de Sinangüe. Bosque húmedo premontano. Informantes Jose Umendo (60 años), y Calix to Umenda (35 años). Bosque aluvial. Topografia plana. Vegetación primaria y secundaria.","ECU",NA,1992,"PRESERVED_SPECIMEN","OCCURRENCE_STATUS_INFERRED_FROM_INDIVIDUAL_COUNT;GEODETIC_DATUM_ASSUMED_WGS84;INSTITUTION_MATCH_FUZZY;COLLECTION_MATCH_NONE"
-76.63333,-0.48333,"Cryptochloa unispiculata",1260198344,"An hour up the Indillana River by motor canoe from its mouth on the Napo River.","ECU",NA,1980,"PRESERVED_SPECIMEN","OCCURRENCE_STATUS_INFERRED_FROM_INDIVIDUAL_COUNT;GEODETIC_DATUM_ASSUMED_WGS84;INSTITUTION_MATCH_FUZZY;COLLECTION_MATCH_NONE"
-71.81666,-3.16666,"Cryptochloa unispiculata",1260198683,"Rio Ampiyacu, Pebas, & vicinity. Trail north from Pebas in primary forest on terra firme.","PER",NA,1977,"PRESERVED_SPECIMEN","GEODETIC_DATUM_ASSUMED_WGS84;INSTITUTION_MATCH_FUZZY;COLLECTION_MATCH_NONE"
-76.4,-0.666667,"Cryptochloa unispiculata",2515454755,"","ECU",NA,1996,"PRESERVED_SPECIMEN","INSTITUTION_MATCH_FUZZY;INSTITUTION_COLLECTION_MISMATCH"
-75.21666,-10.2,"Cryptochloa unispiculata",1259763925,"1-2 km W of Iscozacin. Primary forest on poor (some sandy) soils.","PER",NA,1984,"PRESERVED_SPECIMEN","OCCURRENCE_STATUS_INFERRED_FROM_INDIVIDUAL_COUNT;GEODETIC_DATUM_ASSUMED_WGS84;INSTITUTION_MATCH_FUZZY;COLLECTION_MATCH_NONE"
-76.4,-0.5,"Cryptochloa unispiculata",4031469536,"Trail to Laguna Añangu from Río Napo. Tall rain forest on low level ground.","ECU",NA,1985,"PRESERVED_SPECIMEN","GEODETIC_DATUM_ASSUMED_WGS84;INSTITUTION_MATCH_FUZZY;COLLECTION_MATCH_NONE"
-75.815,1.44722,"Cryptochloa unispiculata",1259139565,"13 km SE of Morelia along the road to the Río Pescado (SW of Florencia); forested area along streamlet.","COL",NA,1974,"PRESERVED_SPECIMEN","OCCURRENCE_STATUS_INFERRED_FROM_INDIVIDUAL_COUNT;GEODETIC_DATUM_ASSUMED_WGS84;INSTITUTION_MATCH_FUZZY;COLLECTION_MATCH_NONE"
-77.6,-1.06666,"Cryptochloa unispiculata",1259629925,"Canton Tena Estación Biológica Jatun Sacha. 8 km al este de Misahuallí. Bosque muy húmedo Tropical.","ECU",NA,1989,"PRESERVED_SPECIMEN","OCCURRENCE_STATUS_INFERRED_FROM_INDIVIDUAL_COUNT;GEODETIC_DATUM_ASSUMED_WGS84;INSTITUTION_MATCH_FUZZY;COLLECTION_MATCH_NONE"
-77.533333,-0.716667,"Cryptochloa unispiculata",2516825975,"Prov. Napo: Canton Archidona. Carretera Hollin- loreto. Rio Huataraco.","ECU",NA,1989,"PRESERVED_SPECIMEN","INSTITUTION_MATCH_FUZZY;INSTITUTION_COLLECTION_MISMATCH"
-70.25,-3.78333,"Cryptochloa unispiculata",1259651414,"Parque Nacional Natural Amacayacu. Centro Administrivo Amacayacu INDERENA; a la orilla del Río Amacayacu; vegetación dominada por Botryospora. Bosque alto sobre maduro sobre suelos arcillosos.","COL",NA,1991,"PRESERVED_SPECIMEN","OCCURRENCE_STATUS_INFERRED_FROM_INDIVIDUAL_COUNT;GEODETIC_DATUM_ASSUMED_WGS84;INSTITUTION_MATCH_FUZZY;COLLECTION_MATCH_NONE"
-76.183333,-0.916667,"Cryptochloa unispiculata",1259625588,"Parque Nacional Yasuní. Pozo petrolero Daimi 2.","ECU",NA,1988,"PRESERVED_SPECIMEN","OCCURRENCE_STATUS_INFERRED_FROM_INDIVIDUAL_COUNT;COORDINATE_ROUNDED;GEODETIC_DATUM_ASSUMED_WGS84;INSTITUTION_MATCH_FUZZY;COLLECTION_MATCH_NONE"
-63.666667,-17.733333,"Cryptochloa unispiculata",1259381374,"Parque Nacional Amboró. Ca. 15 km (SE) up the Río Pitasama from the Río Surutú. Sandstone.","BOL",NA,1985,"PRESERVED_SPECIMEN","OCCURRENCE_STATUS_INFERRED_FROM_INDIVIDUAL_COUNT;COORDINATE_ROUNDED;GEODETIC_DATUM_ASSUMED_WGS84;INSTITUTION_MATCH_FUZZY;COLLECTION_MATCH_NONE"
-67.8167,-9.6833,"Cryptochloa unispiculata",1318516182,"Rio branco, sena madureira","BRA",NA,1976,"PRESERVED_SPECIMEN","GEODETIC_DATUM_ASSUMED_WGS84"
-76.9167,-2.1167,"Cryptochloa unispiculata",1319537661,"Rio bobonaza rain forest below montalvo (Limon)","ECU",NA,1980,"PRESERVED_SPECIMEN","GEODETIC_DATUM_ASSUMED_WGS84;PRESUMED_NEGATED_LATITUDE"
-74.1667,2.6667,"Cryptochloa unispiculata",1318729023,"Tinigua National Park, bank of Duda River, ca 20 km N of the junct. of Duda River and the Guyabero River, c-400","COL",NA,1991,"PRESERVED_SPECIMEN","GEODETIC_DATUM_ASSUMED_WGS84"
-77.4,-0.63333,"Cryptochloa unispiculata",1259531914,"Junction (Archidona) Coca km 68. Secondary forest.","ECU",NA,1988,"PRESERVED_SPECIMEN","GEODETIC_DATUM_ASSUMED_WGS84;DIFFERENT_OWNER_INSTITUTION"
-76.03333,-0.06666,"Cryptochloa unispiculata",1260017715,"Yasuni National Park, Estacíon Cientifica Yasuni, at Rio Tiputini and surroundings, wet forest (plot 12).","ECU",NA,1996,"PRESERVED_SPECIMEN","GEODETIC_DATUM_ASSUMED_WGS84;DIFFERENT_OWNER_INSTITUTION"
-77.21666,-0.63333,"Cryptochloa unispiculata",1259532667,"Km 14 Loreto - Coca. Small forest remain.","ECU",NA,1988,"PRESERVED_SPECIMEN","GEODETIC_DATUM_ASSUMED_WGS84;DIFFERENT_OWNER_INSTITUTION"
-78.446111,-3.571667,"Cryptochloa unispiculata",1260804734,"Cordillera del Cóndor region. Río Wawaime watershed, tributary of Río Quimi. Below site of proposed EcuaCorriente copper mine, on ridge near 1-ha forest inventory Wawaime Plot. Tall cloud forest on ridge, on substrate of mixed sand and clay soil, below sandstone plateau.","ECU",NA,2007,"PRESERVED_SPECIMEN","OCCURRENCE_STATUS_INFERRED_FROM_INDIVIDUAL_COUNT;COORDINATE_ROUNDED;GEODETIC_DATUM_ASSUMED_WGS84;INSTITUTION_MATCH_NONE"
-76.433,-0.25,"Cryptochloa unispiculata",47751743,"In and around San Pablo.","ECU",NA,1984,"PRESERVED_SPECIMEN","GEODETIC_DATUM_ASSUMED_WGS84;COORDINATE_PRECISION_INVALID;INSTITUTION_MATCH_FUZZY;INSTITUTION_COLLECTION_MISMATCH"
-78.2,-3.016,"Cryptochloa unispiculata",47751736,"Along road Patuca-Santiago km 44","ECU",NA,1998,"PRESERVED_SPECIMEN","GEODETIC_DATUM_ASSUMED_WGS84;COORDINATE_PRECISION_INVALID;INSTITUTION_MATCH_FUZZY;INSTITUTION_COLLECTION_MISMATCH"
-76.55,-0.766,"Cryptochloa unispiculata",47751772,"CONOCO landing site at Rio Tivacuno. Rain forest.","ECU",NA,1988,"PRESERVED_SPECIMEN","GEODETIC_DATUM_ASSUMED_WGS84;COORDINATE_PRECISION_INVALID;INSTITUTION_MATCH_FUZZY;INSTITUTION_COLLECTION_MISMATCH"
-76.783,-0.466,"Cryptochloa unispiculata",47751767,"At basecamp Waimo of Conoco. Rainforest.","ECU",NA,1988,"PRESERVED_SPECIMEN","GEODETIC_DATUM_ASSUMED_WGS84;COORDINATE_PRECISION_INVALID;INSTITUTION_MATCH_FUZZY;INSTITUTION_COLLECTION_MISMATCH"
-76.333,-0.25,"Cryptochloa unispiculata",47751745,"San Pablo at Río Aguarico. In and close to the community.","ECU",NA,1984,"PRESERVED_SPECIMEN","GEODETIC_DATUM_ASSUMED_WGS84;COORDINATE_PRECISION_INVALID;INSTITUTION_MATCH_FUZZY;INSTITUTION_COLLECTION_MISMATCH"
-77.433,-0.116,"Cryptochloa unispiculata",47750935,"Sinangue, upstream from Lumbaqui on Río Aguarico, ca 1 km W of village. Tall mature forest in flat terrain.","ECU",NA,1996,"PRESERVED_SPECIMEN","GEODETIC_DATUM_ASSUMED_WGS84;COORDINATE_PRECISION_INVALID;INSTITUTION_MATCH_FUZZY;INSTITUTION_COLLECTION_MISMATCH"
-76.7,-1.816667,"Cryptochloa unispiculata",1259602750,"Pozo petrolero Garza de TENNECO. 35 km (aprox.) al noreste de Montalvo.","ECU",NA,1989,"PRESERVED_SPECIMEN","OCCURRENCE_STATUS_INFERRED_FROM_INDIVIDUAL_COUNT;COORDINATE_ROUNDED;GEODETIC_DATUM_ASSUMED_WGS84;INSTITUTION_MATCH_FUZZY;COLLECTION_MATCH_NONE"
-65.833333,-11.083333,"Cryptochloa unispiculata",1259424967,"18.4 km E of Riberalta, then 1 km NE on old road to Cachuela Esperanza. Primary forest. Trail on right side of road.","BOL",NA,1982,"PRESERVED_SPECIMEN","OCCURRENCE_STATUS_INFERRED_FROM_INDIVIDUAL_COUNT;COORDINATE_ROUNDED;GEODETIC_DATUM_ASSUMED_WGS84;INSTITUTION_MATCH_FUZZY;COLLECTION_MATCH_NONE"
-76.8,-2.51666,"Cryptochloa unispiculata",1259627423,"Comuna Shuar AMUNTAY (KAPAWI). Bosque húmedo Tropical.","ECU",NA,1988,"PRESERVED_SPECIMEN","OCCURRENCE_STATUS_INFERRED_FROM_INDIVIDUAL_COUNT;GEODETIC_DATUM_ASSUMED_WGS84;INSTITUTION_MATCH_FUZZY;COLLECTION_MATCH_NONE"
-73.943981,2.543731,"Cryptochloa unispiculata",1707530134,"Río Duda","COL",NA,1991,"PRESERVED_SPECIMEN","COORDINATE_ROUNDED;GEODETIC_DATUM_ASSUMED_WGS84;INSTITUTION_MATCH_NONE"
-76.45,-8.15,"Cryptochloa unispiculata",1321778387,"Dist tocache nuevo, quebrada de huaquisha","PER",NA,1981,"PRESERVED_SPECIMEN","GEODETIC_DATUM_ASSUMED_WGS84"
-72.3167,-8.5667,"Cryptochloa unispiculata",1320000505,"","BRA",NA,1976,"PRESERVED_SPECIMEN","GEODETIC_DATUM_ASSUMED_WGS84"
-74.21736,3.018497,"Cryptochloa unispiculata",2013783988,"Parque Nacional Natural Tinigua, Rio Duda, Serrania Chamusa.","COL",1988,1996,"PRESERVED_SPECIMEN","COORDINATE_PRECISION_INVALID"
-72.7333,-9.2667,"Cryptochloa unispiculata",1318502179,"","BRA",NA,1976,"PRESERVED_SPECIMEN","GEODETIC_DATUM_ASSUMED_WGS84"
-77.39,-1.083611,"Cryptochloa unispiculata",3019570338,"Parroquia Chontapunta, Comunidad Garena","ECU",NA,2020,"PRESERVED_SPECIMEN","OCCURRENCE_STATUS_INFERRED_FROM_INDIVIDUAL_COUNT;COORDINATE_ROUNDED;GEODETIC_DATUM_ASSUMED_WGS84;DIFFERENT_OWNER_INSTITUTION"
-71.07,2.67,"Cryptochloa unispiculata",768740619,"sector laguna Pavón II, territorío Nukak, 10.7km a 43° de lag. Pavón II, bosque maduro","COL",NA,1996,"PRESERVED_SPECIMEN","INSTITUTION_MATCH_NONE"
-71.14,2.6,"Cryptochloa unispiculata",768740621,"sector laguna Pavón II, territorío Nukak, 16.5km a 91° E de San José, bosque maduro","COL",NA,1996,"PRESERVED_SPECIMEN","INSTITUTION_MATCH_NONE"
-72.8,-3.41666,"Cryptochloa unispiculata",1260196489,"Lowland terra firma rainforest, vicinity of Explorama Lodge, near confluence of Napo and Amazon Rivers, opposite Yanamono I.,","PER",NA,1978,"PRESERVED_SPECIMEN","GEODETIC_DATUM_ASSUMED_WGS84;INSTITUTION_MATCH_FUZZY;COLLECTION_MATCH_NONE"
-75.516667,-9.066667,"Cryptochloa unispiculata",1260697103,"Distrito Padre Abad. Carretera al Rio Yurac, Fundo ganadero Nuevo San Juan. Bosque primario, con mucha sombra","PER",NA,2004,"PRESERVED_SPECIMEN","OCCURRENCE_STATUS_INFERRED_FROM_INDIVIDUAL_COUNT;COORDINATE_ROUNDED;GEODETIC_DATUM_ASSUMED_WGS84;INSTITUTION_MATCH_FUZZY;COLLECTION_MATCH_NONE"
-78.01666,-3.01666,"Cryptochloa unispiculata",4061036807,"Along road Patuca-Santiago km 44","ECU",NA,1998,"PRESERVED_SPECIMEN","GEODETIC_DATUM_ASSUMED_WGS84;INSTITUTION_MATCH_NONE"
-75.9833,-9.3,"Cryptochloa unispiculata",1321693443,"Distrito Rupa Rupa, Tingo María","PER",NA,1981,"PRESERVED_SPECIMEN","GEODETIC_DATUM_ASSUMED_WGS84"
-76.516667,-0.633333,"Cryptochloa unispiculata",1057213813,"Parque Nacional Yasuní - Estación Científica Yasuní","ECU",NA,2000,"PRESERVED_SPECIMEN","COORDINATE_ROUNDED;GEODETIC_DATUM_ASSUMED_WGS84;INSTITUTION_MATCH_FUZZY;INSTITUTION_COLLECTION_MISMATCH"
-71.9167,-3.0833,"Cryptochloa unispiculata",1321780505,"Rio ampiyacu, puca urquillo","PER",NA,1977,"PRESERVED_SPECIMEN","GEODETIC_DATUM_ASSUMED_WGS84"
-77.9453,-3.0622,"Cryptochloa unispiculata",1321742160,"Parroquia: Santiago. Cordillera Winchinkiaim Naint #19. South of Centro Shuar Kusumas. Ridge and border between Ecuador and Peru (border @ 03°05'26.49S 077°52'06.29).","ECU",NA,2005,"PRESERVED_SPECIMEN","GEODETIC_DATUM_ASSUMED_WGS84"
-70.25,3.783,"Cryptochloa unispiculata",3308092988,"Amazonas","COL",NA,1991,"PRESERVED_SPECIMEN","TYPE_STATUS_INVALID;OCCURRENCE_STATUS_INFERRED_FROM_INDIVIDUAL_COUNT;GEODETIC_DATUM_ASSUMED_WGS84;CONTINENT_DERIVED_FROM_COORDINATES;INSTITUTION_MATCH_FUZZY;INSTITUTION_COLLECTION_MISMATCH"
-71.3,-12.58333,"Cryptochloa unispiculata",1260198543,"Cerro de Pantiacolla: Rio Palotoa. 10-15 km NNW of Shintuya, transect to ridgetop. Lower to middle mountain slopes; soil sandy.","PER",NA,1985,"PRESERVED_SPECIMEN","GEODETIC_DATUM_ASSUMED_WGS84;INSTITUTION_MATCH_FUZZY;COLLECTION_MATCH_NONE"
-75.833333,-3.25,"Cryptochloa unispiculata",1259436357,"Pampa Hermosa and vicinity, Río Corrientes, 1 km S of jct. with Río Macusari. Low rainforest, mostly firma with scattered white sand. Mayna Jívaro","PER",NA,1986,"PRESERVED_SPECIMEN","OCCURRENCE_STATUS_INFERRED_FROM_INDIVIDUAL_COUNT;COORDINATE_ROUNDED;GEODETIC_DATUM_ASSUMED_WGS84;INSTITUTION_MATCH_FUZZY;COLLECTION_MATCH_NONE"
