"lon","lat","species","gbifID","locality","countryCode","coordinateUncertaintyInMeters","year","basisOfRecord","issue"
-85.477775,12.116667,"Dalbergia retusa",1988325037,"Along road to Hacienda Corpus, 13.5km W of Juilgalpa","NIC",NA,1984,"PRESERVED_SPECIMEN","GEODETIC_DATUM_ASSUMED_WGS84;INSTITUTION_MATCH_FUZZY;INSTITUTION_COLLECTION_MISMATCH"
-89.4011,14.3628,"Dalbergia retusa",3306079303,"Montecristo Trifinio National Park, San José Ingenio, near the footbal stadium","SLV",NA,2016,"PRESERVED_SPECIMEN","GEODETIC_DATUM_ASSUMED_WGS84;INSTITUTION_MATCH_FUZZY;INSTITUTION_COLLECTION_MISMATCH"
-84.06264,9.35975,"Dalbergia retusa",4061649126,"Quepos, Manuel Antonio. 2 km de la entrada a Playa Rey. Bosque secundario y lagunas junto al mar.","CRI",NA,2006,"PRESERVED_SPECIMEN","OCCURRENCE_STATUS_INFERRED_FROM_INDIVIDUAL_COUNT;COUNTRY_DERIVED_FROM_COORDINATES;GEODETIC_DATUM_ASSUMED_WGS84;CONTINENT_DERIVED_FROM_COORDINATES;ELEVATION_NON_NUMERIC;INSTITUTION_MATCH_NONE"
-85.779722,11.127222,"Dalbergia retusa",1257738064,"1.6 km SE of Río La Flor bridge on road between San Juan del Sur and El Ostional; dry forest on shale slopes","NIC",NA,2011,"PRESERVED_SPECIMEN","OCCURRENCE_STATUS_INFERRED_FROM_INDIVIDUAL_COUNT;COORDINATE_ROUNDED;GEODETIC_DATUM_ASSUMED_WGS84;DIFFERENT_OWNER_INSTITUTION"
-85.495083,12.284194,"Dalbergia retusa",1258052917,"1.6 km E of Comalapa along road to Cuapa; dry forest patch","NIC",NA,2014,"PRESERVED_SPECIMEN","OCCURRENCE_STATUS_INFERRED_FROM_INDIVIDUAL_COUNT;COORDINATE_ROUNDED;GEODETIC_DATUM_ASSUMED_WGS84;DIFFERENT_OWNER_INSTITUTION"
-86.760944,12.922306,"Dalbergia retusa",2332698192,"10.2 km E of Nicaragua Highway 24 (Chinandega-Guasaule) along road to El Sauce, 2.2 km E of Rincón de La García; dry forest","NIC",NA,2019,"PRESERVED_SPECIMEN","OCCURRENCE_STATUS_INFERRED_FROM_INDIVIDUAL_COUNT;COORDINATE_ROUNDED;GEODETIC_DATUM_ASSUMED_WGS84;DIFFERENT_OWNER_INSTITUTION"
-84.933333,9.783333,"Dalbergia retusa",1988171281,"Nicoya Peninsula, Curu, Along road to footbridge over estuary, sandy wooded ridge between beach and mangroves.","CRI",NA,1996,"PRESERVED_SPECIMEN","GEODETIC_DATUM_ASSUMED_WGS84;GEODETIC_DATUM_INVALID;CONTINENT_DERIVED_FROM_COORDINATES;INSTITUTION_MATCH_NONE"
-84.983333,11.75,"Dalbergia retusa",1988325029,"ca. 6.3 km SE of bridge over Quebrada Niscala along road between Acoyapa and Rio Oyate; NE side of Cerros Animas","NIC",NA,1981,"PRESERVED_SPECIMEN","GEODETIC_DATUM_ASSUMED_WGS84;INSTITUTION_MATCH_FUZZY;INSTITUTION_COLLECTION_MISMATCH"
-86.13,11.57,"Dalbergia retusa",1988325041,"At convergence of Rio La Pita and Rio Escalante, at border of Department Carazo and Granada","NIC",NA,1978,"PRESERVED_SPECIMEN","GEODETIC_DATUM_ASSUMED_WGS84;INSTITUTION_MATCH_FUZZY;INSTITUTION_COLLECTION_MISMATCH"
-89.56667,14.05,"Dalbergia retusa",2446664422,"El Salvador: Depto. Santa Ana, El Pinalito, Santa Ana. Árbol de aprox. 7 m altura. Cultivado por su madera preciosa. Alt.: 900 m.1994-09-01, Leg.: González,J.C. & Villacorta,R. 180 [JCG00180].","SLV",NA,1994,"PRESERVED_SPECIMEN","GEODETIC_DATUM_ASSUMED_WGS84;CONTINENT_DERIVED_FROM_COORDINATES;INSTITUTION_MATCH_FUZZY"
-85.333333,12.133333,"Dalbergia retusa",1258545553,"Paso de Lajas, 2-3 km NE of Juigalpa; Crescentia-Tabebuia savanna.","NIC",NA,1982,"PRESERVED_SPECIMEN","OCCURRENCE_STATUS_INFERRED_FROM_INDIVIDUAL_COUNT;COORDINATE_ROUNDED;GEODETIC_DATUM_ASSUMED_WGS84;INSTITUTION_MATCH_FUZZY;COLLECTION_MATCH_NONE"
-84.7,9.99,"Dalbergia retusa",1258545000,"Near Río Barranca where highway branches off to Puntarenas","CRI",NA,1965,"PRESERVED_SPECIMEN","GEODETIC_DATUM_ASSUMED_WGS84;INSTITUTION_MATCH_FUZZY;COLLECTION_MATCH_NONE"
-84.94555,10.18694,"Dalbergia retusa",1259777896,"22.9 miles north of the turnoff into Puntarenas, on the Pan-American highway","CRI",NA,1971,"PRESERVED_SPECIMEN","GEODETIC_DATUM_ASSUMED_WGS84;INSTITUTION_MATCH_FUZZY;COLLECTION_MATCH_NONE"
-79.380556,9.126945,"Dalbergia retusa",1257767204,"Cerro Azul, ± 7 km desde la Interamericana. Area poblada.","PAN",NA,2009,"PRESERVED_SPECIMEN","OCCURRENCE_STATUS_INFERRED_FROM_INDIVIDUAL_COUNT;COORDINATE_ROUNDED;GEODETIC_DATUM_ASSUMED_WGS84;INSTITUTION_MATCH_FUZZY;COLLECTION_MATCH_NONE"
-85.54,10.26,"Dalbergia retusa",4031965794,"Península de Nicoya. Falda S. Cerro Peor es Nada.","CRI",NA,1994,"PRESERVED_SPECIMEN","OCCURRENCE_STATUS_INFERRED_FROM_INDIVIDUAL_COUNT;GEODETIC_DATUM_ASSUMED_WGS84;INSTITUTION_MATCH_FUZZY;COLLECTION_MATCH_NONE"
-85.806944,10.304167,"Dalbergia retusa",4031723758,"R.V.S. Bosque Dirrá. Peninsula de Nicoya. Villareal, por Tamarindo.","CRI",NA,2008,"PRESERVED_SPECIMEN","OCCURRENCE_STATUS_INFERRED_FROM_INDIVIDUAL_COUNT;COORDINATE_ROUNDED;GEODETIC_DATUM_ASSUMED_WGS84;INSTITUTION_MATCH_FUZZY;COLLECTION_MATCH_NONE"
-83.121,8.402667,"Dalbergia retusa",4031746604,"Playa Delfin, Rain Forest Reserve and Research Station. Edge of field at Entry Trail.","CRI",NA,2011,"PRESERVED_SPECIMEN","OCCURRENCE_STATUS_INFERRED_FROM_INDIVIDUAL_COUNT;COORDINATE_ROUNDED;GEODETIC_DATUM_ASSUMED_WGS84;INSTITUTION_MATCH_FUZZY;COLLECTION_MATCH_NONE"
-85.31666,10.53333,"Dalbergia retusa",1259433493,"Comelco Ranch, west of Bagaces","CRI",NA,1972,"PRESERVED_SPECIMEN","GEODETIC_DATUM_ASSUMED_WGS84;INSTITUTION_MATCH_FUZZY;COLLECTION_MATCH_NONE"
-85.78333,12.63333,"Dalbergia retusa",1261905842,"24 km al E del Caserío Puertas Viejas sobre la carretera a San José de los Remates","NIC",NA,1980,"PRESERVED_SPECIMEN","GEODETIC_DATUM_ASSUMED_WGS84;INSTITUTION_MATCH_FUZZY;COLLECTION_MATCH_NONE"
-86,12.583333,"Dalbergia retusa",1258315113,"Camino a Puertas Viejas, Santa Juana","NIC",NA,1983,"PRESERVED_SPECIMEN","OCCURRENCE_STATUS_INFERRED_FROM_INDIVIDUAL_COUNT;COORDINATE_ROUNDED;GEODETIC_DATUM_ASSUMED_WGS84;INSTITUTION_MATCH_FUZZY;COLLECTION_MATCH_NONE"
-85.516667,12.216667,"Dalbergia retusa",1258545584,"7.0 km NE of Hwy. 7 on road to Comalapa.","NIC",NA,1980,"PRESERVED_SPECIMEN","OCCURRENCE_STATUS_INFERRED_FROM_INDIVIDUAL_COUNT;COORDINATE_ROUNDED;GEODETIC_DATUM_ASSUMED_WGS84;INSTITUTION_MATCH_FUZZY;COLLECTION_MATCH_NONE"
-85.61666,10.83333,"Dalbergia retusa",1259398396,"Santa Rosa National Park. Park headquarters to Questa 200 to 300 m.","CRI",NA,1978,"PRESERVED_SPECIMEN","GEODETIC_DATUM_ASSUMED_WGS84;INSTITUTION_MATCH_FUZZY;COLLECTION_MATCH_NONE"
-85.69,10.55,"Dalbergia retusa",1259777244,"Playas del Coco","CRI",NA,1972,"PRESERVED_SPECIMEN","GEODETIC_DATUM_ASSUMED_WGS84;ELEVATION_NON_NUMERIC;INSTITUTION_MATCH_FUZZY;COLLECTION_MATCH_NONE"
-85.72,10.87,"Dalbergia retusa",3997853665,"","CRI",1091,2012,"HUMAN_OBSERVATION","COUNTRY_DERIVED_FROM_COORDINATES;CONTINENT_DERIVED_FROM_COORDINATES"
-85.32,10.94,"Dalbergia retusa",3997800813,"","CRI",1091,2015,"HUMAN_OBSERVATION","COUNTRY_DERIVED_FROM_COORDINATES;CONTINENT_DERIVED_FROM_COORDINATES"
-87.717,14.533,"Dalbergia retusa",3307834970,"Los Empates, along Quebrada Agua Salada","HND",NA,1991,"PRESERVED_SPECIMEN","TYPE_STATUS_INVALID;OCCURRENCE_STATUS_INFERRED_FROM_INDIVIDUAL_COUNT;GEODETIC_DATUM_ASSUMED_WGS84;CONTINENT_DERIVED_FROM_COORDINATES;INSTITUTION_MATCH_FUZZY;INSTITUTION_COLLECTION_MISMATCH"
-85.35,10.367,"Dalbergia retusa",3308370543,"Close to the eastern shore of the Nicoya Peninsula about 5 km south-east of Playa Ttamarindo on the road towards Santa Cruz","CRI",NA,1986,"PRESERVED_SPECIMEN","TYPE_STATUS_INVALID;OCCURRENCE_STATUS_INFERRED_FROM_INDIVIDUAL_COUNT;GEODETIC_DATUM_ASSUMED_WGS84;CONTINENT_DERIVED_FROM_COORDINATES;INSTITUTION_MATCH_FUZZY;INSTITUTION_COLLECTION_MISMATCH"
-85.61,10.84,"Dalbergia retusa",2265456623,"Guanacaste, Liberia,","CRI",NA,2011,"PRESERVED_SPECIMEN","GEODETIC_DATUM_ASSUMED_WGS84;CONTINENT_DERIVED_FROM_COORDINATES;AMBIGUOUS_COLLECTION"
-86.8,12.566667,"Dalbergia retusa",1826194432,"Volcán Santa Clara","NIC",NA,2007,"PRESERVED_SPECIMEN","COORDINATE_ROUNDED;GEODETIC_DATUM_ASSUMED_WGS84;INSTITUTION_MATCH_FUZZY;INSTITUTION_COLLECTION_MISMATCH"
-84.68666,10.00166,"Dalbergia retusa",1259777583,"Banks of Río Barranca, Vicinity of Esparta","CRI",NA,1965,"PRESERVED_SPECIMEN","GEODETIC_DATUM_ASSUMED_WGS84;INSTITUTION_MATCH_FUZZY;COLLECTION_MATCH_NONE"
-79.65611,8.95,"Dalbergia retusa",1258545024,"Approach to Arraijan checkpoint on Pan American Highway","PAN",NA,1969,"PRESERVED_SPECIMEN","GEODETIC_DATUM_ASSUMED_WGS84;INSTITUTION_MATCH_FUZZY;COLLECTION_MATCH_NONE"
-85.537389,12.575872,"Dalbergia retusa",4031429719,"Along road to Cerro Masigüe from Km 110.5 of Boaco-Muy Muy highway, 0.4 km from highway; pasture","NIC",NA,2022,"PRESERVED_SPECIMEN","OCCURRENCE_STATUS_INFERRED_FROM_INDIVIDUAL_COUNT;COORDINATE_ROUNDED;GEODETIC_DATUM_ASSUMED_WGS84;INSTITUTION_MATCH_FUZZY;COLLECTION_MATCH_NONE"
-79.848055,9.159722,"Dalbergia retusa",2629640656,"Barro Colorado, Island N corner of Laboratory building","PAN",NA,1982,"PRESERVED_SPECIMEN","TYPE_STATUS_INVALID;OCCURRENCE_STATUS_INFERRED_FROM_INDIVIDUAL_COUNT;COORDINATE_ROUNDED;GEODETIC_DATUM_ASSUMED_WGS84;GEODETIC_DATUM_INVALID;CONTINENT_DERIVED_FROM_COORDINATES;INSTITUTION_MATCH_NONE"
-85.982306,11.390889,"Dalbergia retusa",4031790807,"8.5 km SW of Tola along road to El Coyol; roadside","NIC",NA,2018,"PRESERVED_SPECIMEN","OCCURRENCE_STATUS_INFERRED_FROM_INDIVIDUAL_COUNT;COORDINATE_ROUNDED;GEODETIC_DATUM_ASSUMED_WGS84;INSTITUTION_MATCH_FUZZY;COLLECTION_MATCH_NONE"
-86.033333,11.683333,"Dalbergia retusa",4031817662,"Municipio de Nandaime, Reserva Privada Cielos y Praderas, área núcleo","NIC",NA,2014,"PRESERVED_SPECIMEN","OCCURRENCE_STATUS_INFERRED_FROM_INDIVIDUAL_COUNT;COORDINATE_ROUNDED;GEODETIC_DATUM_ASSUMED_WGS84;INSTITUTION_MATCH_FUZZY;COLLECTION_MATCH_NONE"
-86.05,12.616667,"Dalbergia retusa",1258314670,"Sector de Puertas Viejas","NIC",NA,1983,"PRESERVED_SPECIMEN","OCCURRENCE_STATUS_INFERRED_FROM_INDIVIDUAL_COUNT;COORDINATE_ROUNDED;GEODETIC_DATUM_ASSUMED_WGS84;INSTITUTION_MATCH_FUZZY;COLLECTION_MATCH_NONE"
-79.15888,9.1575,"Dalbergia retusa",1259431690,"Chichebre near Chepo","PAN",NA,1971,"PRESERVED_SPECIMEN","GEODETIC_DATUM_ASSUMED_WGS84;INSTITUTION_MATCH_FUZZY;COLLECTION_MATCH_NONE"
-86.11666,12.48333,"Dalbergia retusa",1258314314,"Las Maderas, camino a San Francisco","NIC",NA,1983,"PRESERVED_SPECIMEN","OCCURRENCE_STATUS_INFERRED_FROM_INDIVIDUAL_COUNT;GEODETIC_DATUM_ASSUMED_WGS84;INSTITUTION_MATCH_FUZZY;COLLECTION_MATCH_NONE"
-85.13972,10.41944,"Dalbergia retusa",1259434135,"[Finca] La Pacífica, 4 km NW of Cañas. Riparian forest","CRI",NA,1973,"PRESERVED_SPECIMEN","GEODETIC_DATUM_ASSUMED_WGS84;INSTITUTION_MATCH_FUZZY;COLLECTION_MATCH_NONE"
-85.983333,11.65,"Dalbergia retusa",1259040117,"2 km del Puente Ochomogo sobre el camino hacia El Astillero","NIC",NA,1999,"PRESERVED_SPECIMEN","OCCURRENCE_STATUS_INFERRED_FROM_INDIVIDUAL_COUNT;COORDINATE_ROUNDED;GEODETIC_DATUM_ASSUMED_WGS84;INSTITUTION_MATCH_FUZZY;COLLECTION_MATCH_NONE"
-84.86,10.43,"Dalbergia retusa",4031448751,"On the road from Tilaran to Canas, 18 km from Tilaran in the department of Guanacaste. Growing with Gliricidia sepium and Bursera sp. Myriads of small black bees doing the pollination. Larger yellow bees also present.","CRI",NA,1991,"PRESERVED_SPECIMEN","GEODETIC_DATUM_ASSUMED_WGS84;INSTITUTION_MATCH_FUZZY;COLLECTION_MATCH_NONE"
-85.766667,12.666667,"Dalbergia retusa",1988324878,"Quebrada Caulapa","NIC",NA,1985,"PRESERVED_SPECIMEN","GEODETIC_DATUM_ASSUMED_WGS84;INSTITUTION_MATCH_FUZZY;INSTITUTION_COLLECTION_MISMATCH"
-86.279361,12.590139,"Dalbergia retusa",4031995367,"2.1 km N of San Blas along road to San José de la Montaña; low dry forest on basalt","NIC",NA,2018,"PRESERVED_SPECIMEN","OCCURRENCE_STATUS_INFERRED_FROM_INDIVIDUAL_COUNT;COORDINATE_ROUNDED;GEODETIC_DATUM_ASSUMED_WGS84;INSTITUTION_MATCH_FUZZY;COLLECTION_MATCH_NONE"
-85.329417,12.294972,"Dalbergia retusa",4031899597,"2.2 km NW of Río Cuapa bridge below Cuapa, then 6.7 km E; semi-evergreen forest along streams in a broad barranca, breccia","NIC",NA,2015,"PRESERVED_SPECIMEN","OCCURRENCE_STATUS_INFERRED_FROM_INDIVIDUAL_COUNT;COORDINATE_ROUNDED;GEODETIC_DATUM_ASSUMED_WGS84;INSTITUTION_MATCH_FUZZY;COLLECTION_MATCH_NONE"
-86.21666,12.48333,"Dalbergia retusa",1258311414,"Rancho Grande, al N de Río Pacora; bosque tropical muy seco, caducifolio, suelos ventisoles los más predominantes","NIC",NA,1983,"PRESERVED_SPECIMEN","OCCURRENCE_STATUS_INFERRED_FROM_INDIVIDUAL_COUNT;GEODETIC_DATUM_ASSUMED_WGS84;INSTITUTION_MATCH_FUZZY;COLLECTION_MATCH_NONE"
-85.35,9.88,"Dalbergia retusa",4031508787,"Península de Nicoya. Bejuco. Cerro La Picuda. Finca de Tina López.","CRI",NA,1994,"PRESERVED_SPECIMEN","OCCURRENCE_STATUS_INFERRED_FROM_INDIVIDUAL_COUNT;GEODETIC_DATUM_ASSUMED_WGS84;INSTITUTION_MATCH_FUZZY;COLLECTION_MATCH_NONE"
-86.416667,12.7,"Dalbergia retusa",4031883482,"Municipio de El Jicaral, Km 155.5 carretera entre Telica y San Isidro, Reserva Lost Canyon.","NIC",NA,2012,"PRESERVED_SPECIMEN","OCCURRENCE_STATUS_INFERRED_FROM_INDIVIDUAL_COUNT;COORDINATE_ROUNDED;GEODETIC_DATUM_ASSUMED_WGS84;INSTITUTION_MATCH_FUZZY;COLLECTION_MATCH_NONE"
-85.65,12.383333,"Dalbergia retusa",1261532563,"San Lorenzo, 2 km al E, Sierra el Espino.","NIC",NA,1982,"PRESERVED_SPECIMEN","OCCURRENCE_STATUS_INFERRED_FROM_INDIVIDUAL_COUNT;COORDINATE_ROUNDED;GEODETIC_DATUM_ASSUMED_WGS84;INSTITUTION_MATCH_FUZZY;COLLECTION_MATCH_NONE"
-84.19,9.78,"Dalbergia retusa",4031407843,"Valle del Candelaria. San Ignacio; parches remanentes y ladera pedregosas en las márgenes del río.","CRI",NA,1994,"PRESERVED_SPECIMEN","OCCURRENCE_STATUS_INFERRED_FROM_INDIVIDUAL_COUNT;GEODETIC_DATUM_ASSUMED_WGS84;INSTITUTION_MATCH_FUZZY;COLLECTION_MATCH_NONE"
-85.289111,11.865,"Dalbergia retusa",4032103654,"2.7 km S of Hacienda San José along road between La Palma and Las Plazuelas; thorn forest on vertisol","NIC",NA,2015,"PRESERVED_SPECIMEN","OCCURRENCE_STATUS_INFERRED_FROM_INDIVIDUAL_COUNT;COORDINATE_ROUNDED;GEODETIC_DATUM_ASSUMED_WGS84;INSTITUTION_MATCH_FUZZY;COLLECTION_MATCH_NONE"
-86.2,11.58333,"Dalbergia retusa",1261521258,"Refugio de Vida Silvestre Chococente; Bosque tropical seco","NIC",NA,1984,"PRESERVED_SPECIMEN","OCCURRENCE_STATUS_INFERRED_FROM_INDIVIDUAL_COUNT;GEODETIC_DATUM_ASSUMED_WGS84;INSTITUTION_MATCH_FUZZY;COLLECTION_MATCH_NONE"
-84.6799,11.360933,"Dalbergia retusa",1258116395,"Municipio de San Miguelito, comunidad de El Roble","NIC",NA,2013,"PRESERVED_SPECIMEN","OCCURRENCE_STATUS_INFERRED_FROM_INDIVIDUAL_COUNT;COORDINATE_ROUNDED;GEODETIC_DATUM_ASSUMED_WGS84;DIFFERENT_OWNER_INSTITUTION"
-86.184805,11.735778,"Dalbergia retusa",2268847850,"10.9 km S of Panamerican Highway along road to La Conquista, 0.5 km N of La Conquista, at bridge over a small stream; semi-evergreen forest on tuff","NIC",NA,2016,"PRESERVED_SPECIMEN","OCCURRENCE_STATUS_INFERRED_FROM_INDIVIDUAL_COUNT;COORDINATE_ROUNDED;GEODETIC_DATUM_ASSUMED_WGS84;DIFFERENT_OWNER_INSTITUTION"
-85.246111,11.831945,"Dalbergia retusa",1257778508,"Around Guásimo, 20.0 km SW of Acoyapa-San Carlos road (from 10 km S of Acoyapa); dry forest","NIC",NA,2011,"PRESERVED_SPECIMEN","OCCURRENCE_STATUS_INFERRED_FROM_INDIVIDUAL_COUNT;COORDINATE_ROUNDED;GEODETIC_DATUM_ASSUMED_WGS84;DIFFERENT_OWNER_INSTITUTION"
-85.77,10.5,"Dalbergia retusa",44964105,"Faja Costeña del Golfo de Papagayo, camino entre Nuevo Colón y Zapotal, cerca del cerro Matapalo.","CRI",NA,1995,"PRESERVED_SPECIMEN","GEODETIC_DATUM_ASSUMED_WGS84;CONTINENT_DERIVED_FROM_COORDINATES;INSTITUTION_MATCH_NONE"
-84.66,9.86,"Dalbergia retusa",44963810,"Punta Loros y alrededores, 3 km E de Río Cuarros puente.","CRI",NA,1993,"PRESERVED_SPECIMEN","GEODETIC_DATUM_ASSUMED_WGS84;CONTINENT_DERIVED_FROM_COORDINATES;INSTITUTION_MATCH_NONE"
-85.36,10.16,"Dalbergia retusa",44964384,"P.N. Barra Honda Península de Nicoya. Estación Barra Honda. Sendero río Nacaome y mesones.","CRI",NA,1993,"PRESERVED_SPECIMEN","GEODETIC_DATUM_ASSUMED_WGS84;CONTINENT_DERIVED_FROM_COORDINATES;INSTITUTION_MATCH_NONE"
-85.63,11.06,"Dalbergia retusa",44961803,"8 km southwest of La Cruz.","CRI",NA,1978,"PRESERVED_SPECIMEN","GEODETIC_DATUM_ASSUMED_WGS84;CONTINENT_DERIVED_FROM_COORDINATES;INSTITUTION_MATCH_NONE"
-84.888055,11.626111,"Dalbergia retusa",1261023410,"Along Acoyapa-San Carlos road, 11 km SW of Morrito empalme; rocky slope above road","NIC",NA,2009,"PRESERVED_SPECIMEN","OCCURRENCE_STATUS_INFERRED_FROM_INDIVIDUAL_COUNT;COORDINATE_ROUNDED;GEODETIC_DATUM_ASSUMED_WGS84;DIFFERENT_OWNER_INSTITUTION"
-85.75,11.33333,"Dalbergia retusa",415950523,"Rio Gonzalez, ca. 98 km. Pan-American highway from Granada towards Rivas, Nicaragua.","NIC",5000,1991,"PRESERVED_SPECIMEN","GEODETIC_DATUM_ASSUMED_WGS84;CONTINENT_DERIVED_FROM_COORDINATES;INSTITUTION_MATCH_NONE"
-85.66666,11.25,"Dalbergia retusa",415949290,"San Juan del Sur","NIC",5000,1993,"PRESERVED_SPECIMEN","GEODETIC_DATUM_ASSUMED_WGS84;CONTINENT_DERIVED_FROM_COORDINATES;INSTITUTION_MATCH_NONE"
-85.83333,11.5,"Dalbergia retusa",415949492,"along Pan-American Highway 50 km. from Granada Towards Rivas, Nicaragua.","NIC",5000,1991,"PRESERVED_SPECIMEN","GEODETIC_DATUM_ASSUMED_WGS84;CONTINENT_DERIVED_FROM_COORDINATES;INSTITUTION_MATCH_NONE"
-83.956944,12.258611,"Dalbergia retusa",4032099081,"Along road from El Rama to Laguna de Perlas, 4 km E of Río Kama bridge; remnant wet forest along small stream amid land being cleared for African palm plantations","NIC",NA,2009,"PRESERVED_SPECIMEN","OCCURRENCE_STATUS_INFERRED_FROM_INDIVIDUAL_COUNT;COORDINATE_ROUNDED;GEODETIC_DATUM_ASSUMED_WGS84;INSTITUTION_MATCH_FUZZY;COLLECTION_MATCH_NONE"
-85.95,11.76666,"Dalbergia retusa",1261546726,"Río Manares, Hacienda Mecatepe; bosque de galería","NIC",NA,1983,"PRESERVED_SPECIMEN","OCCURRENCE_STATUS_INFERRED_FROM_INDIVIDUAL_COUNT;GEODETIC_DATUM_ASSUMED_WGS84;INSTITUTION_MATCH_FUZZY;COLLECTION_MATCH_NONE"
-85.13333,12.01666,"Dalbergia retusa",1261558622,"Santo Tomás, Cuesta Los Buñuelos, entre el Empalme de Acoyapa y Santo Tomás","NIC",NA,1984,"PRESERVED_SPECIMEN","OCCURRENCE_STATUS_INFERRED_FROM_INDIVIDUAL_COUNT;GEODETIC_DATUM_ASSUMED_WGS84;INSTITUTION_MATCH_FUZZY;COLLECTION_MATCH_NONE"
-85.38333,10.83055,"Dalbergia retusa",1259775985,"Parque Nacional Santa Rosa. Camino a Playa Naranjo. Creciendo a orilla del camino.","CRI",NA,1996,"PRESERVED_SPECIMEN","GEODETIC_DATUM_ASSUMED_WGS84;INSTITUTION_MATCH_FUZZY;COLLECTION_MATCH_NONE"
-66.3242,18.2761,"Dalbergia retusa",1228365081,"Puerto Rico","PRI",NA,1994,"PRESERVED_SPECIMEN","GEODETIC_DATUM_ASSUMED_WGS84;INSTITUTION_MATCH_FUZZY;AMBIGUOUS_COLLECTION"
-89.29242,13.84398,"Dalbergia retusa",4066821951,"El Salvador: Depto. La Libertad, Municipio Quezaltepeque, plantaciones contiguas a la Toma de Quezaltepeque. Plantación en sistema agroforestal . Arbol de 12 años en plantación pura, semilla procedente de Costa Rica, altura de 14 m y DAP de 17 cm; en fructificación , vainas de 1 a 4 semillas, de color verde oscuro. . Alt.: 418 m.2020-06-23, Leg.: Aquino,A. 16 [JBL08166].","SLV",NA,2020,"PRESERVED_SPECIMEN","GEODETIC_DATUM_ASSUMED_WGS84;CONTINENT_DERIVED_FROM_COORDINATES;INSTITUTION_MATCH_FUZZY"
-84.469444,9.891667,"Dalbergia retusa",1253598395,"Sitio Cerro Rayos. Entre San Pablo y San Pedro, camino a Llano Bonito.","CRI",NA,1991,"PRESERVED_SPECIMEN","COORDINATE_ROUNDED;CONTINENT_DERIVED_FROM_COORDINATES;CONTINENT_INVALID;INSTITUTION_MATCH_FUZZY;COLLECTION_MATCH_NONE"
-85.595444,10.162056,"Dalbergia retusa",1253901153,"P.N. Diriá. Orillas del río Enmedio.","CRI",NA,2011,"PRESERVED_SPECIMEN","COORDINATE_ROUNDED;CONTINENT_DERIVED_FROM_COORDINATES;CONTINENT_INVALID;INSTITUTION_MATCH_FUZZY;COLLECTION_MATCH_NONE"
-85.366667,10.166667,"Dalbergia retusa",1253634999,"Estacion Barra Honda. Sendero Rio Nacaome y mesones","CRI",NA,1993,"PRESERVED_SPECIMEN","COORDINATE_ROUNDED;CONTINENT_DERIVED_FROM_COORDINATES;CONTINENT_INVALID;INSTITUTION_MATCH_FUZZY;COLLECTION_MATCH_NONE"
-89.5908,13.8258,"Dalbergia retusa",1055547917,"Cooperativa Las Lajas","SLV",NA,2000,"PRESERVED_SPECIMEN","GEODETIC_DATUM_ASSUMED_WGS84;INSTITUTION_MATCH_FUZZY;INSTITUTION_COLLECTION_MISMATCH"
-88.3975,13.805278,"Dalbergia retusa",4031394613,"Cerro o Peña El Flor. Área no protegida. San Gerardo.","SLV",NA,2011,"PRESERVED_SPECIMEN","OCCURRENCE_STATUS_INFERRED_FROM_INDIVIDUAL_COUNT;COORDINATE_ROUNDED;GEODETIC_DATUM_ASSUMED_WGS84;INSTITUTION_MATCH_FUZZY;COLLECTION_MATCH_NONE"
-85.357333,11.976695,"Dalbergia retusa",1258011103,"12.5 km SW of La Palma (on Rama highway) along road to Las Plazuelas; dry forest along small stream","NIC",NA,2014,"PRESERVED_SPECIMEN","OCCURRENCE_STATUS_INFERRED_FROM_INDIVIDUAL_COUNT;COORDINATE_ROUNDED;GEODETIC_DATUM_ASSUMED_WGS84;DIFFERENT_OWNER_INSTITUTION"
-86.6,13.433333,"Dalbergia retusa",2268918786,"Municipio de Somoto, camino a las comunidades Los Canales y San Francisco","NIC",NA,2015,"PRESERVED_SPECIMEN","OCCURRENCE_STATUS_INFERRED_FROM_INDIVIDUAL_COUNT;COORDINATE_ROUNDED;GEODETIC_DATUM_ASSUMED_WGS84;DIFFERENT_OWNER_INSTITUTION"
-86.86666,12.43333,"Dalbergia retusa",1258722904,"Municipio de León. Barrio Hermita de Dolores. Quinta Santa Delfina.","NIC",NA,2000,"PRESERVED_SPECIMEN","OCCURRENCE_STATUS_INFERRED_FROM_INDIVIDUAL_COUNT;GEODETIC_DATUM_ASSUMED_WGS84;INSTITUTION_MATCH_FUZZY;COLLECTION_MATCH_NONE"
-89.53593,13.62936,"Dalbergia retusa",1657194719,"Depto. Sonsonate, Cordillera del Balsamo, Mpio. Santa Isabel Ishuatán, Ctón. El Paraiso, Finca Estasuche (Colombia)","SLV",3,2017,"PRESERVED_SPECIMEN","CONTINENT_DERIVED_FROM_COORDINATES;INSTITUTION_MATCH_FUZZY;COLLECTION_MATCH_NONE"
-90.00128,13.82275,"Dalbergia retusa",1667272572,"Depto. Ahuachapán, Mpio. San Francisco Menéndez, El Corozo, El Mariposario, Bosque Nuevo","SLV",3,2017,"PRESERVED_SPECIMEN","CONTINENT_DERIVED_FROM_COORDINATES;INSTITUTION_MATCH_FUZZY;COLLECTION_MATCH_NONE"
-84.00361,10.43138,"Dalbergia retusa",4061794194,"La Selva Biological Station. De la esquina Sureste del edificio el Ceiba, 20 m. y 100 m. Sur. (Posiblemente plantada con cacao)","CRI",NA,2006,"PRESERVED_SPECIMEN","GEODETIC_DATUM_ASSUMED_WGS84;INSTITUTION_MATCH_NONE"
-85.869444,10.358333,"Dalbergia retusa",1258102002,"P.N. Baulas. Península de Nicoya. Cabo Velas. Hacienda Cabo Velas. Cerro El Morro","CRI",NA,1997,"PRESERVED_SPECIMEN","OCCURRENCE_STATUS_INFERRED_FROM_INDIVIDUAL_COUNT;COORDINATE_ROUNDED;GEODETIC_DATUM_ASSUMED_WGS84;INSTITUTION_MATCH_FUZZY;COLLECTION_MATCH_NONE"
-84.866667,11.5,"Dalbergia retusa",1261527089,"10 km N del empalme a San Miguelito, sobre la carretera a San Carlos; bosque tropical seco","NIC",NA,1984,"PRESERVED_SPECIMEN","OCCURRENCE_STATUS_INFERRED_FROM_INDIVIDUAL_COUNT;COORDINATE_ROUNDED;GEODETIC_DATUM_ASSUMED_WGS84;INSTITUTION_MATCH_FUZZY;COLLECTION_MATCH_NONE"
-83.235556,9.097778,"Dalbergia retusa",1253749794,"Buenos Aires.","CRI",NA,2000,"PRESERVED_SPECIMEN","COORDINATE_ROUNDED;CONTINENT_DERIVED_FROM_COORDINATES;CONTINENT_INVALID;INSTITUTION_MATCH_FUZZY;COLLECTION_MATCH_NONE"
-84.805278,11.620833,"Dalbergia retusa",4031710198,"6.1 km NE of Pajaro Negro along road to El Almendro; inundated jícaro savanna","NIC",NA,2011,"PRESERVED_SPECIMEN","OCCURRENCE_STATUS_INFERRED_FROM_INDIVIDUAL_COUNT;COORDINATE_ROUNDED;GEODETIC_DATUM_ASSUMED_WGS84;INSTITUTION_MATCH_FUZZY;COLLECTION_MATCH_NONE"
-85.016667,11.583333,"Dalbergia retusa",1261545592,"Carretera a San Miguelito, entre Río Oyate y San Miguelito; bosque pluvioso","NIC",NA,1984,"PRESERVED_SPECIMEN","OCCURRENCE_STATUS_INFERRED_FROM_INDIVIDUAL_COUNT;COORDINATE_ROUNDED;GEODETIC_DATUM_ASSUMED_WGS84;INSTITUTION_MATCH_FUZZY;COLLECTION_MATCH_NONE"
-76.024556,8.214944,"Dalbergia retusa",1086984168,"Vereda Los Arapios, finca El Cerro","COL",NA,2011,"PRESERVED_SPECIMEN","COORDINATE_ROUNDED;INSTITUTION_MATCH_NONE"
-86.8583,14.14861,"Dalbergia retusa",3307990106,"Quebrada Grande, ± 3.9 km al N de Morocelí","HND",NA,2002,"PRESERVED_SPECIMEN","TYPE_STATUS_INVALID;OCCURRENCE_STATUS_INFERRED_FROM_INDIVIDUAL_COUNT;GEODETIC_DATUM_ASSUMED_WGS84;CONTINENT_DERIVED_FROM_COORDINATES;INSTITUTION_MATCH_FUZZY;INSTITUTION_COLLECTION_MISMATCH"
-86.667,12.183,"Dalbergia retusa",3308358697,"Along Hwy. 12 (Carretera vieja a Leon) ca. 4 km SE of intersection with Hwy 52 (to Puerto Somoza), ca. km 53","NIC",NA,1978,"PRESERVED_SPECIMEN","TYPE_STATUS_INVALID;OCCURRENCE_STATUS_INFERRED_FROM_INDIVIDUAL_COUNT;GEODETIC_DATUM_ASSUMED_WGS84;CONTINENT_DERIVED_FROM_COORDINATES;INSTITUTION_MATCH_FUZZY;INSTITUTION_COLLECTION_MISMATCH"
-81.816667,8.533333,"Dalbergia retusa",1259431221,"Cerro Colorado, 100 mi W of Canal near new copper discovery","PAN",NA,1968,"PRESERVED_SPECIMEN","OCCURRENCE_STATUS_INFERRED_FROM_INDIVIDUAL_COUNT;COORDINATE_ROUNDED;GEODETIC_DATUM_ASSUMED_WGS84;INSTITUTION_MATCH_FUZZY;COLLECTION_MATCH_NONE"
-84.2975,9.914778,"Dalbergia retusa",3946788509,"Colón. Bajo El Limonal. Finca de Guillermo Quirós.","CRI",NA,2009,"PRESERVED_SPECIMEN","OCCURRENCE_STATUS_INFERRED_FROM_INDIVIDUAL_COUNT;COORDINATE_ROUNDED;GEODETIC_DATUM_ASSUMED_WGS84;INSTITUTION_MATCH_FUZZY;COLLECTION_MATCH_NONE"
-92.19,15,"Dalbergia retusa",1258544996,"Carrillo Puerto. Matorral; terreno plano; parcela de cultivo","MEX",NA,1986,"PRESERVED_SPECIMEN","GEODETIC_DATUM_ASSUMED_WGS84;INSTITUTION_MATCH_FUZZY;COLLECTION_MATCH_NONE"
-85.08333,11.88333,"Dalbergia retusa",1261856409,"Carretera Acoyapa-San Carlos, entre Acoyapa y el Río Oyate","NIC",NA,1993,"PRESERVED_SPECIMEN","OCCURRENCE_STATUS_INFERRED_FROM_INDIVIDUAL_COUNT;GEODETIC_DATUM_ASSUMED_WGS84;INSTITUTION_MATCH_FUZZY;COLLECTION_MATCH_NONE"
