"lon","lat","species","gbifID","locality","countryCode","coordinateUncertaintyInMeters","year","basisOfRecord","issue"
-53.29,3.61,"Deguelia scandens",1456276436,"Inini: Saül and vicinity, W-WSW of Saül; south-side of summit of the northwestern peak of Mont Galbao","GUF",NA,1997,"PRESERVED_SPECIMEN","GEODETIC_DATUM_ASSUMED_WGS84"
-60.323634,-2.623595,"Deguelia scandens",1928838221,"Rio Cuieiras, 50 km upstream, farm of Sr. Nemerio.","BRA",NA,1974,"PRESERVED_SPECIMEN","COORDINATE_ROUNDED;COLLECTION_MATCH_FUZZY"
-63.575,2.763,"Deguelia scandens",1929396409,"Serra dos Surucucus, NW of Mission station","BRA",NA,1969,"PRESERVED_SPECIMEN","GEODETIC_DATUM_ASSUMED_WGS84;COLLECTION_MATCH_FUZZY"
-75.251111,-10.3375,"Deguelia scandens",1257710400,"Dist. Palcazu. Estación Biológica Paujil.","PER",NA,2005,"PRESERVED_SPECIMEN","OCCURRENCE_STATUS_INFERRED_FROM_INDIVIDUAL_COUNT;COORDINATE_ROUNDED;GEODETIC_DATUM_ASSUMED_WGS84;DIFFERENT_OWNER_INSTITUTION"
-67.908528,-13.429694,"Deguelia scandens",1258071466,"Ixiamas, concesión de la empresa forestal Bosques del Norte, arroyo Muri","BOL",NA,2014,"PRESERVED_SPECIMEN","OCCURRENCE_STATUS_INFERRED_FROM_INDIVIDUAL_COUNT;COORDINATE_ROUNDED;GEODETIC_DATUM_ASSUMED_WGS84;DIFFERENT_OWNER_INSTITUTION"
-65.166667,-9.716667,"Deguelia scandens",2998212437,"At hwy BR 364, 20km ENE of junction with hwy. BR 32, 22km (by air) E of Abuna.","BRA",NA,1987,"PRESERVED_SPECIMEN","COORDINATE_ROUNDED;GEODETIC_DATUM_ASSUMED_WGS84;CONTINENT_DERIVED_FROM_COORDINATES;INSTITUTION_MATCH_FUZZY;COLLECTION_MATCH_FUZZY"
-54.0901,5.05125,"Deguelia scandens",1321311984,"Auberge des Chutes Voltaire. Trail to Chutes Voltaire","GUF",NA,2015,"PRESERVED_SPECIMEN","GEODETIC_DATUM_ASSUMED_WGS84"
-70.75,-13.216667,"Deguelia scandens",1261924876,"Quince mil, forested hills 292 km from Cusco.","PER",NA,1991,"PRESERVED_SPECIMEN","OCCURRENCE_STATUS_INFERRED_FROM_INDIVIDUAL_COUNT;COORDINATE_ROUNDED;GEODETIC_DATUM_ASSUMED_WGS84;INSTITUTION_MATCH_FUZZY;COLLECTION_MATCH_NONE"
-75.08666,-10.39527,"Deguelia scandens",4031736537,"Dist. Palcazú. Evaluación de los Recursos del Bosque 0.5ha en la Reserva Comunal Yanesha. Comunidad Nativa Lomalinda-Laguna, Sector Nueva Aldea","PER",NA,2005,"PRESERVED_SPECIMEN","OCCURRENCE_STATUS_INFERRED_FROM_INDIVIDUAL_COUNT;GEODETIC_DATUM_ASSUMED_WGS84;INSTITUTION_MATCH_FUZZY;COLLECTION_MATCH_NONE"
-75.3,-10.333333,"Deguelia scandens",1261832362,"Cabeza de Mono, Río Iscozacin, 10 km SW of Iscozasin, Palcazu Valley, sandy river terraces. Tree Plot.","PER",NA,1983,"PRESERVED_SPECIMEN","OCCURRENCE_STATUS_INFERRED_FROM_INDIVIDUAL_COUNT;COORDINATE_ROUNDED;GEODETIC_DATUM_ASSUMED_WGS84;INSTITUTION_MATCH_FUZZY;COLLECTION_MATCH_NONE"
-65.1,2,"Deguelia scandens",1260574743,"Misión Rio Mavaca. Selvas hómedas siempre-verdes de tierra firme y planicie, con buen drenaje.","VEN",NA,1991,"PRESERVED_SPECIMEN","GEODETIC_DATUM_ASSUMED_WGS84;INSTITUTION_MATCH_FUZZY;COLLECTION_MATCH_NONE"
-70.25,-3.783333,"Deguelia scandens",1261473236,"Municipio de Leticia. Parque Nacional Natural Amacayacu. Sector de Mata-matá; a la orilla de la guebrada Bacaba.","COL",NA,1992,"PRESERVED_SPECIMEN","OCCURRENCE_STATUS_INFERRED_FROM_INDIVIDUAL_COUNT;COORDINATE_ROUNDED;GEODETIC_DATUM_ASSUMED_WGS84;INSTITUTION_MATCH_FUZZY;COLLECTION_MATCH_NONE"
-77.33333,-1.41666,"Deguelia scandens",1258214243,"Pozo Villano 2 de Arco. 2 km del pueblo de Villano. Bosque Húmedo Tropical. Bosque primario. Arboles cortados por las obras petroleras.","ECU",NA,1991,"PRESERVED_SPECIMEN","OCCURRENCE_STATUS_INFERRED_FROM_INDIVIDUAL_COUNT;GEODETIC_DATUM_ASSUMED_WGS84;INSTITUTION_MATCH_FUZZY;COLLECTION_MATCH_NONE"
-72.83333,-3.46666,"Deguelia scandens",1261836335,"Yanamono. Explorama Tourist Camp, halfway between Indiana and mouth of Río Napo. Mature upland forest on yellowish lateritic soil. Tree Plot.","PER",NA,1983,"PRESERVED_SPECIMEN","OCCURRENCE_STATUS_INFERRED_FROM_INDIVIDUAL_COUNT;GEODETIC_DATUM_ASSUMED_WGS84;INSTITUTION_MATCH_FUZZY;COLLECTION_MATCH_NONE"
-55.059354,-3.396906,"Deguelia scandens",1931048538,"Parque-Nacional do Tapajós, km 60 da estrada Itaituba-Jacarecanga; ilha em frente ao Pimental","BRA",NA,1978,"PRESERVED_SPECIMEN","COORDINATE_ROUNDED;COLLECTION_MATCH_FUZZY"
-57.041523,-1.097643,"Deguelia scandens",1929961796,"Rio Trombetas shore, Porteira cemetery","BRA",NA,1974,"PRESERVED_SPECIMEN","COORDINATE_ROUNDED;COLLECTION_MATCH_FUZZY"
-63.026951,-9.253256,"Deguelia scandens",1930554965,"Porto Velho to Cuiabá highway. Vicinity of Santa Barbara, 15 Km east of Km 117","BRA",NA,1968,"PRESERVED_SPECIMEN","COORDINATE_ROUNDED;COLLECTION_MATCH_FUZZY"
-63,-8.816667,"Deguelia scandens",1042665034,"Represa Samuel: forest along PR-3 road, ca 10 km SE of dam.","BRA",NA,1986,"PRESERVED_SPECIMEN","GEODETIC_DATUM_ASSUMED_WGS84;GEODETIC_DATUM_INVALID;INSTITUTION_MATCH_NONE"
-63.55,-4.1677,"Deguelia scandens",1042601622,"Serra dos Surucucus, Serra dos Surucucus, Northwest of Mission Station.","BRA",NA,1969,"PRESERVED_SPECIMEN","GEODETIC_DATUM_ASSUMED_WGS84;GEODETIC_DATUM_INVALID;PRESUMED_NEGATED_LATITUDE;INSTITUTION_MATCH_NONE"
-67.07,-0.146944,"Deguelia scandens",1042676625,"Coletado na Ilha da Juíza, no rio Negro, a jusante da cidade de São Gabriel da Cachoeira.","BRA",NA,2009,"PRESERVED_SPECIMEN","GEODETIC_DATUM_ASSUMED_WGS84;GEODETIC_DATUM_INVALID;INSTITUTION_MATCH_NONE"
-63,-9.166667,"Deguelia scandens",1042662830,"Rodovia BR-364, km 120; 10 km ao Norte da Sede da Mineração,","BRA",NA,1982,"PRESERVED_SPECIMEN","GEODETIC_DATUM_ASSUMED_WGS84;GEODETIC_DATUM_INVALID;INSTITUTION_MATCH_NONE"
-62,-11.283333,"Deguelia scandens",1042518879,"Travessão entre as linhas do INCRA 40 e 44 a 06 km da BR-429 e a 10 km da cidade.","BRA",NA,1987,"PRESERVED_SPECIMEN","GEODETIC_DATUM_ASSUMED_WGS84;GEODETIC_DATUM_INVALID;INSTITUTION_MATCH_NONE"
-63,-8.916667,"Deguelia scandens",1042664320,"Side roads near S end of E dike, in area to be flooded.","BRA",NA,1986,"PRESERVED_SPECIMEN","GEODETIC_DATUM_ASSUMED_WGS84;GEODETIC_DATUM_INVALID;INSTITUTION_MATCH_NONE"
-70.164656,6.323519,"Deguelia scandens",1570684643,"Vereda Samuco, predio Malvinas","COL",31,2012,"PRESERVED_SPECIMEN","COORDINATE_ROUNDED;INSTITUTION_MATCH_FUZZY;COLLECTION_MATCH_FUZZY"
-54.977222,-3.370556,"Deguelia scandens",2451448459,"BR 163. Ramal do Km 117. Base da Coomflona, ca. 4 km do alojamento da Coomflona. Floresta Nacional do Tapajós","BRA",NA,2019,"PRESERVED_SPECIMEN","COORDINATE_ROUNDED;GEODETIC_DATUM_ASSUMED_WGS84;CONTINENT_DERIVED_FROM_COORDINATES;INSTITUTION_MATCH_FUZZY;COLLECTION_MATCH_FUZZY"
-48.502361,-1.455,"Deguelia scandens",1090595583,".","BRA",NA,1957,"PRESERVED_SPECIMEN","OCCURRENCE_STATUS_INFERRED_FROM_INDIVIDUAL_COUNT;COORDINATE_ROUNDED;GEODETIC_DATUM_ASSUMED_WGS84;INSTITUTION_MATCH_NONE"
-72.121667,-0.086389,"Deguelia scandens",1929867652,"región de Araracuara, río Yaviyari","COL",NA,2010,"PRESERVED_SPECIMEN","COORDINATE_ROUNDED;GEODETIC_DATUM_ASSUMED_WGS84;COLLECTION_MATCH_FUZZY"
-37.423203,-9.617808,"Deguelia scandens",1587306236,"Serra da Camonga.","BRA",NA,2008,"PRESERVED_SPECIMEN","GEODETIC_DATUM_ASSUMED_WGS84;CONTINENT_DERIVED_FROM_COORDINATES;DIFFERENT_OWNER_INSTITUTION"
-70,-3.03333,"Deguelia scandens",1261517682,"Corregimiento de Tarapacá. Parque Nacional Natural Amaycayacu. Sector Lorena (R. Cotuhé) bosque de terra-firme. Parcela permanente #2. Transecto U18-U17.","COL",NA,1992,"PRESERVED_SPECIMEN","OCCURRENCE_STATUS_INFERRED_FROM_INDIVIDUAL_COUNT;GEODETIC_DATUM_ASSUMED_WGS84;INSTITUTION_MATCH_FUZZY;COLLECTION_MATCH_NONE"
-72.9,-3.25,"Deguelia scandens",1258284301,"Sucusari. Bosque Primario.","PER",NA,1992,"PRESERVED_SPECIMEN","OCCURRENCE_STATUS_INFERRED_FROM_INDIVIDUAL_COUNT;GEODETIC_DATUM_ASSUMED_WGS84;INSTITUTION_MATCH_FUZZY;COLLECTION_MATCH_NONE"
101.9,12.666667,"Deguelia scandens",2514154239,"Camp Samae San (US Army) Sattahip distr. Chonburi Prov., Thailand.","THA",NA,1969,"PRESERVED_SPECIMEN","INSTITUTION_MATCH_FUZZY;INSTITUTION_COLLECTION_MISMATCH"
-70.5,-0.33,"Deguelia scandens",1828930561,"Rio Popeyaca (tributary of Apaporis between Rio Piraparana and Raudal Yayacopi), near mouth","COL",NA,1952,"PRESERVED_SPECIMEN","GEODETIC_DATUM_ASSUMED_WGS84"
-76.916667,-2.833333,"Deguelia scandens",1258281953,"Puranchim, río Sinchiyacu. Rainforest, terra firma and palm lowlands.","PER",NA,1988,"PRESERVED_SPECIMEN","OCCURRENCE_STATUS_INFERRED_FROM_INDIVIDUAL_COUNT;COORDINATE_ROUNDED;GEODETIC_DATUM_ASSUMED_WGS84;INSTITUTION_MATCH_FUZZY;COLLECTION_MATCH_NONE"
100.85,12.7,"Deguelia scandens",2514210246,"Thailand, 1 mile E Thung Prong","THA",NA,1969,"PRESERVED_SPECIMEN","INSTITUTION_MATCH_FUZZY;INSTITUTION_COLLECTION_MISMATCH"
-55.121333,4.804,"Deguelia scandens",2845783384,"van Blommesteijn Lake, Island North-West.","SUR",NA,2011,"PRESERVED_SPECIMEN","INSTITUTION_MATCH_FUZZY;INSTITUTION_COLLECTION_MISMATCH"
100.811185,13.14389,"Deguelia scandens",2515317159,"Thailand, Province Chonburi, District Siracha, Si Chang Island, east side, SE side, SE side of Kow Kwang.","THA",NA,1993,"PRESERVED_SPECIMEN","INSTITUTION_MATCH_FUZZY;INSTITUTION_COLLECTION_MISMATCH"
-65.2,3.03333,"Deguelia scandens",1260575175,"Rio Metacuni. Selva humedas de tierra baja de rebalse y de lomerio bajo, de laja y peidra","VEN",NA,1990,"PRESERVED_SPECIMEN","GEODETIC_DATUM_ASSUMED_WGS84;INSTITUTION_MATCH_FUZZY;COLLECTION_MATCH_NONE"
-65.16666,-9.71666,"Deguelia scandens",1260571922,"Medium tall forest on very slight slope above Corrego Raiz, at hwy. BR 364, 20 km. ENE of junction with hwy. BR 325, 22 km. (by air) E of Abuna, Mun. Porto Velho.","BRA",NA,1987,"PRESERVED_SPECIMEN","GEODETIC_DATUM_ASSUMED_WGS84;INSTITUTION_MATCH_FUZZY;COLLECTION_MATCH_NONE"
-73.23333,-3.71666,"Deguelia scandens",1260589533,"Dtto. Punchana. Río Nanay, Carretera del caserio de Santo Tomás hasta el Río Mazán, en terreno alto y arenoso.","PER",NA,1995,"PRESERVED_SPECIMEN","GEODETIC_DATUM_ASSUMED_WGS84;INSTITUTION_MATCH_FUZZY;COLLECTION_MATCH_NONE"
-62.42,-11.283333,"Deguelia scandens",2997971785,"Travessão entre as linhas do INCRA 40 e 44 a 06 km da BR-429 e a 10 km da cidade.","BRA",NA,1987,"PRESERVED_SPECIMEN","COORDINATE_ROUNDED;GEODETIC_DATUM_ASSUMED_WGS84;CONTINENT_DERIVED_FROM_COORDINATES;INSTITUTION_MATCH_FUZZY;COLLECTION_MATCH_FUZZY"
-63.58,-10.583333,"Deguelia scandens",2997969794,"Mineração Mibrasa, Setor Alto Candeias, km 128, Sudoeste de Ariquemes.","BRA",NA,1982,"PRESERVED_SPECIMEN","COORDINATE_ROUNDED;GEODETIC_DATUM_ASSUMED_WGS84;CONTINENT_DERIVED_FROM_COORDINATES;INSTITUTION_MATCH_FUZZY;COLLECTION_MATCH_FUZZY"
-74.929306,6.303056,"Deguelia scandens",3436486228,"Vereda La Aguada, Sector la Granja, arriba de la vía, entrando por la trocha, cerca de la Caseta Rosada","COL",NA,2018,"HUMAN_OBSERVATION",""
-73.75,-4.91666,"Deguelia scandens",1258326071,"J. Herrera, Río Ucayali; upland forest on well-drained soil. Transect 4","PER",NA,1987,"PRESERVED_SPECIMEN","OCCURRENCE_STATUS_INFERRED_FROM_INDIVIDUAL_COUNT;GEODETIC_DATUM_ASSUMED_WGS84;INSTITUTION_MATCH_FUZZY;COLLECTION_MATCH_NONE"
-73.03333,-3.5,"Deguelia scandens",1261901637,"Exp. Inn, ca. 2 km W of Indiana on Río Amazonas. Well-drained forest on good soil. Transect 4","PER",NA,1987,"PRESERVED_SPECIMEN","OCCURRENCE_STATUS_INFERRED_FROM_INDIVIDUAL_COUNT;GEODETIC_DATUM_ASSUMED_WGS84;INSTITUTION_MATCH_FUZZY;COLLECTION_MATCH_NONE"
-66.83333,5.81666,"Deguelia scandens",1258693240,"Dpto. Atabapo. Lomerío granítico del río Padamo).","VEN",NA,1989,"PRESERVED_SPECIMEN","GEODETIC_DATUM_ASSUMED_WGS84;INSTITUTION_MATCH_FUZZY;COLLECTION_MATCH_NONE"
-59.966667,-2.883333,"Deguelia scandens",2517115110,"","BRA",NA,1995,"PRESERVED_SPECIMEN","INSTITUTION_MATCH_FUZZY;INSTITUTION_COLLECTION_MISMATCH"
-71.164139,2.20525,"Deguelia scandens",1707512165,"Inspec. del Tomachipán. Río Inírida, Caño Cocui, Cerro Cocui, Abajo de Santa Marta (Cocui).","COL",NA,1996,"PRESERVED_SPECIMEN","COORDINATE_ROUNDED;GEODETIC_DATUM_ASSUMED_WGS84;INSTITUTION_MATCH_NONE"
-72.608611,0.181944,"Deguelia scandens",1707553942,"Río Sararamano","COL",NA,2000,"PRESERVED_SPECIMEN","COORDINATE_ROUNDED;GEODETIC_DATUM_ASSUMED_WGS84;INSTITUTION_MATCH_NONE"
-58.8333,7.3333,"Deguelia scandens",1228319055,"Pomeroon-Supenaam","GUY",NA,2005,"PRESERVED_SPECIMEN","GEODETIC_DATUM_ASSUMED_WGS84;INSTITUTION_MATCH_FUZZY;AMBIGUOUS_COLLECTION"
-67.6667,-11.3333,"Deguelia scandens",1228411559,"Pando","BOL",NA,2001,"PRESERVED_SPECIMEN","GEODETIC_DATUM_ASSUMED_WGS84;INSTITUTION_MATCH_FUZZY;AMBIGUOUS_COLLECTION"
-68.2016,-13.9293,"Deguelia scandens",1936655751,"Departamento La Paz, Provincia Abel Iturralde.","BOL",NA,2001,"PRESERVED_SPECIMEN","GEODETIC_DATUM_ASSUMED_WGS84;CONTINENT_DERIVED_FROM_COORDINATES;INSTITUTION_MATCH_FUZZY;COLLECTION_MATCH_FUZZY"
-72.7458528,-8.2720662,"Deguelia scandens",1928002253,"Cruzeiro do Sul, Rio Juruá & Rio Moá, Porangaba, Rio Juruá-Mirim","BRA",NA,1971,"PRESERVED_SPECIMEN","COORDINATE_REPROJECTED;COLLECTION_MATCH_FUZZY"
-69.517944,-1.080111,"Deguelia scandens",1934688606,"Estación biológica Mosiro Itajura Caparú.","COL",5115,2004,"PRESERVED_SPECIMEN","COORDINATE_ROUNDED;COORDINATE_PRECISION_INVALID"
-75.052002,7.216667,"Deguelia scandens",1890902414,"Planta Providencia, 26 kilómetros al sur y 23 kilómetros al occidente por aire de Zaragoza, en el valle del río Anorí entre Dos Bocas y Anorí.","COL",3615,1976,"PRESERVED_SPECIMEN","COORDINATE_ROUNDED;COORDINATE_PRECISION_INVALID"
-59.984695,-3.196117,"Deguelia scandens",1930574926,"Rio Negro below Manaus, opposite Ponta Pelado.","BRA",NA,1971,"PRESERVED_SPECIMEN","COLLECTION_MATCH_FUZZY"
-67.13333,5.55,"Deguelia scandens",1258693282,"Dpto. Atures. Serranía Batata, 2 km al NE de Slato Colorado, Caño Colorado sobre corazas lateríticas, 55 km SE Puerto Ayacucho.","VEN",NA,1989,"PRESERVED_SPECIMEN","GEODETIC_DATUM_ASSUMED_WGS84;INSTITUTION_MATCH_FUZZY;COLLECTION_MATCH_NONE"
-75.000533,7.000867,"Deguelia scandens",1260574246,"Municipio, Anori, Corregimiento de Providencia, Valle del Rio Anori, entre Dos Bocas y Anori. Zona transicional entre bosque humedo y muy humedo troical montanoso. Buena aires primary forest trail, steep slope, above the bridge, vic. of the camp, ca. 4 km from Providencia, upriver.","COL",NA,1973,"PRESERVED_SPECIMEN","COORDINATE_ROUNDED;GEODETIC_DATUM_ASSUMED_WGS84;INSTITUTION_MATCH_FUZZY;COLLECTION_MATCH_NONE"
124.45228,11.55348,"Deguelia scandens",2515306989,"Philippines Leyte Biliran Libtong","PHL",NA,1992,"PRESERVED_SPECIMEN","INSTITUTION_MATCH_FUZZY;INSTITUTION_COLLECTION_MISMATCH"
105.95827,13.960037,"Deguelia scandens",2515313846,"Laos, Province: Champasak, District: Khong, Sahong Island, east side, along the banks of Mekong River.","LAO",NA,1997,"PRESERVED_SPECIMEN","INSTITUTION_MATCH_FUZZY;INSTITUTION_COLLECTION_MISMATCH"
-72.116667,-0.616667,"Deguelia scandens",2514956325,"Al lado occidental del rio Caquetá entre las comunidades indiginas de Villa azul y Pena Roja.","COL",NA,1994,"PRESERVED_SPECIMEN","INSTITUTION_MATCH_FUZZY;INSTITUTION_COLLECTION_MISMATCH"
98.833333,9,"Deguelia scandens",2514256368,"Thailand, Peninsular: Koh Kaw Khao Island.","THA",NA,1972,"PRESERVED_SPECIMEN","INSTITUTION_MATCH_FUZZY;INSTITUTION_COLLECTION_MISMATCH"
102.833333,16.466667,"Deguelia scandens",2515311418,"Thailand, Northeastern: Khon Kaen.","THA",NA,1967,"PRESERVED_SPECIMEN","INSTITUTION_MATCH_FUZZY;INSTITUTION_COLLECTION_MISMATCH"
-51.624444,0.945556,"Deguelia scandens",2565879445,"Rio Araguari. Floresta Estadual do Amapá","BRA",NA,2019,"PRESERVED_SPECIMEN","COORDINATE_ROUNDED;GEODETIC_DATUM_ASSUMED_WGS84;CONTINENT_DERIVED_FROM_COORDINATES;INSTITUTION_MATCH_FUZZY;COLLECTION_MATCH_FUZZY"
-57.783333,-9.766667,"Deguelia scandens",1424471352,"Estrada para Fazenda Novo Horizonte.","BRA",NA,1997,"PRESERVED_SPECIMEN","COORDINATE_ROUNDED;GEODETIC_DATUM_ASSUMED_WGS84;CONTINENT_DERIVED_FROM_COORDINATES;INSTITUTION_MATCH_FUZZY;COLLECTION_MATCH_FUZZY"
-77.266667,-2.2,"Deguelia scandens",1257944622,"Orilla del Río Pastaza. Puerto Yurinkios. Aqua RAP Conservation International PE09 P99-E-BOT-09.","ECU",NA,1999,"PRESERVED_SPECIMEN","OCCURRENCE_STATUS_INFERRED_FROM_INDIVIDUAL_COUNT;COORDINATE_ROUNDED;GEODETIC_DATUM_ASSUMED_WGS84;INSTITUTION_MATCH_NONE"
-77.963056,-2.834722,"Deguelia scandens",1258056385,"Parroquia Yaupi. Cordillera de Cutucú. Laguna Kumpaka, an oligotrophic blackwater lake, 2 km NW of the Salesian mission and Shuar community at Yaupi. Aquatic plants and lacustrine forest along the lakeshore. Fieldwork associated with pollen core project by Mark Bush lab, Florida Institute of Technology. With Alex Rosillo, Universidad Estatal Amazónica.","ECU",NA,2014,"PRESERVED_SPECIMEN","OCCURRENCE_STATUS_INFERRED_FROM_INDIVIDUAL_COUNT;COORDINATE_ROUNDED;GEODETIC_DATUM_ASSUMED_WGS84;DIFFERENT_OWNER_INSTITUTION"
-66.36666,2.08333,"Deguelia scandens",4061701691,"Dpto. Río Negro. Río Siapa. 500 m al NE de la boca del Caño Chimoni. Bosques medios con emergentes en la Planicie Aluvial.","VEN",NA,1992,"PRESERVED_SPECIMEN","GEODETIC_DATUM_ASSUMED_WGS84;INSTITUTION_MATCH_NONE"
-72.116667,0.5,"Deguelia scandens",2516868299,"Coah, al sur de ladesembocadura de la quebrada Bocaduché en el río Caquetá, frente a la isla Sumaeta, Departamento Amazonas, Colombia, bosque maduro de la terraza alta del rio Caquetá.","COL",NA,1994,"PRESERVED_SPECIMEN","INSTITUTION_MATCH_FUZZY;INSTITUTION_COLLECTION_MISMATCH"
101.4167,14.7,"Deguelia scandens",2515311453,"Thailand, Eastern: Nakhon Rachasima, Pak Chawng.","THA",NA,1958,"PRESERVED_SPECIMEN","INSTITUTION_MATCH_FUZZY;INSTITUTION_COLLECTION_MISMATCH"
-78.33972,-5.05555,"Deguelia scandens",1258373700,"Distrito Imaza, Yamayakat. Bosque secundario, purma ca. 15 años, transecto 2 x 500 m.","PER",NA,1996,"PRESERVED_SPECIMEN","OCCURRENCE_STATUS_INFERRED_FROM_INDIVIDUAL_COUNT;GEODETIC_DATUM_ASSUMED_WGS84;INSTITUTION_MATCH_FUZZY;COLLECTION_MATCH_NONE"
-67.824056,-14.093417,"Deguelia scandens",1258071046,"Tumupasa, Infierno, Río Siriuna","BOL",NA,2014,"PRESERVED_SPECIMEN","OCCURRENCE_STATUS_INFERRED_FROM_INDIVIDUAL_COUNT;COORDINATE_ROUNDED;GEODETIC_DATUM_ASSUMED_WGS84;DIFFERENT_OWNER_INSTITUTION"
-70.24,1.25,"Deguelia scandens",3068327373,"río Vaupés, (Localizado en la cabecera municipal de Mitú)","COL",NA,1976,"PRESERVED_SPECIMEN","INSTITUTION_MATCH_NONE"
-71.55,-1.02,"Deguelia scandens",1932876596,"aproximadamente 50m bajando en dirección 110° de la margen izq. río Caquetá, 8km arriba de la isla Guadual","COL",NA,1997,"PRESERVED_SPECIMEN","INSTITUTION_MATCH_NONE"
-71.61,-0.89,"Deguelia scandens",768749077,"aproximadamente 400m en dirección 260° de la margen der. (bajando) del quebradón del Meta, a 4.7km de la boca en el río Caquetá","COL",NA,1997,"PRESERVED_SPECIMEN","INSTITUTION_MATCH_NONE"
-72.92,0.27,"Deguelia scandens",1147300208,"Parque Nacional Natural serranía de Chiribiquete, cuenca alta del río Mesay, bosque inundable","COL",NA,2000,"PRESERVED_SPECIMEN","INSTITUTION_MATCH_NONE"
-71.73,-0.96,"Deguelia scandens",768748787,"aproximadamente 250m en dirección 160° de la margen der. (bajando) del río Caquetá, 1.8km aguas abajo de la boca del quebradón La Culebra","COL",NA,1997,"PRESERVED_SPECIMEN","INSTITUTION_MATCH_NONE"
-72.26,0.04,"Deguelia scandens",768734704,"margen del río Mesay","COL",NA,1993,"PRESERVED_SPECIMEN","INSTITUTION_MATCH_NONE"
-72.24,-0.18,"Deguelia scandens",1932888976,"río Mesay, raudal Masaca (Bmh-T)","COL",NA,1995,"PRESERVED_SPECIMEN","INSTITUTION_MATCH_NONE"
-69.94,-4.08,"Deguelia scandens",768765034,"resguardo indígena Ticuna-Uitoto, km 6-11, comunidad indígena Casilla Naira+, margen izq. qda. Tacana, sector km 11","COL",NA,2003,"PRESERVED_SPECIMEN","INSTITUTION_MATCH_NONE"
-70.09,-2.49,"Deguelia scandens",3068337958,"Vereda El Porvenir, en vegas bajas del río Putumayo, relieve liegera a moderadamente ondulado","COL",NA,1999,"PRESERVED_SPECIMEN","INSTITUTION_MATCH_NONE"
-73.56,1.66,"Deguelia scandens",1932884001,"resguardo indígena Yaguara, Vereda la Tunia, margen der., bosque intervenido con pendiente hasta de 45º","COL",NA,2016,"PRESERVED_SPECIMEN","INSTITUTION_MATCH_NONE"
-67.98,3.82,"Deguelia scandens",1324651057,"Caño Cunuven a la comunidad de Matraca","COL",NA,2015,"PRESERVED_SPECIMEN","INSTITUTION_MATCH_NONE"
-70.03,-3.01,"Deguelia scandens",768748141,"Parque Nacional Natural Amacayacu, río Cotuhé, entre la cabaña de Lorena (Inderena) y Caña Brava, margen izq. río","COL",NA,1991,"PRESERVED_SPECIMEN","INSTITUTION_MATCH_NONE"
-72.166667,7.583333,"Deguelia scandens",1258518632,"Río Negro. 0.5 to 2 km from main highway, road adjacent to river. Secondary forest on slope above river.","VEN",NA,1981,"PRESERVED_SPECIMEN","OCCURRENCE_STATUS_INFERRED_FROM_INDIVIDUAL_COUNT;COORDINATE_ROUNDED;GEODETIC_DATUM_ASSUMED_WGS84;INSTITUTION_MATCH_FUZZY;COLLECTION_MATCH_NONE"
-72.425,-0.2456,"Deguelia scandens",3004074760,"Gamitana 2, Bosque de tierra firme alta","COL",NA,2011,"HUMAN_OBSERVATION","OCCURRENCE_STATUS_INFERRED_FROM_INDIVIDUAL_COUNT;COORDINATE_ROUNDED"
99.4,12.8,"Deguelia scandens",2515729571,"Thailand, Province: Phetchaburi, Kaeng Kra Chan National Park.","THA",NA,1995,"PRESERVED_SPECIMEN","INSTITUTION_MATCH_FUZZY;INSTITUTION_COLLECTION_MISMATCH"
-51.608611,-0.962778,"Deguelia scandens",1264702707,"Floresta Nacional do Amapá. Rio Falsino.","BRA",NA,2019,"PRESERVED_SPECIMEN","GEODETIC_DATUM_ASSUMED_WGS84;CONTINENT_DERIVED_FROM_COORDINATES;DIFFERENT_OWNER_INSTITUTION"
99.616667,12.05,"Deguelia scandens",2514156259,"Thailand, Prachuap Khiri Khan: Amphoe Kui Buri: Kui Buri National Park. Trail from Park headquarters.","THA",NA,2002,"PRESERVED_SPECIMEN","INSTITUTION_MATCH_FUZZY;INSTITUTION_COLLECTION_MISMATCH"
98.33,7.77,"Deguelia scandens",2514194267,"Thailand, Ao Sane Beach, Puket","THA",NA,1979,"PRESERVED_SPECIMEN","INSTITUTION_MATCH_FUZZY;INSTITUTION_COLLECTION_MISMATCH"
-63.27,-8.916667,"Deguelia scandens",2997421790,"Side roads near S end of E dike, in area to be flooded","BRA",NA,1986,"PRESERVED_SPECIMEN","RECORDED_DATE_INVALID;COORDINATE_ROUNDED;GEODETIC_DATUM_ASSUMED_WGS84;CONTINENT_DERIVED_FROM_COORDINATES;INSTITUTION_MATCH_FUZZY;COLLECTION_MATCH_FUZZY"
-52.732222,-0.9025,"Deguelia scandens",2997421814,"estrada de São Miguel, Km 23.","BRA",NA,1969,"PRESERVED_SPECIMEN","RECORDED_DATE_INVALID;COORDINATE_ROUNDED;GEODETIC_DATUM_ASSUMED_WGS84;CONTINENT_DERIVED_FROM_COORDINATES;INSTITUTION_MATCH_FUZZY;COLLECTION_MATCH_FUZZY"
-63.43,-8.766667,"Deguelia scandens",2997440775,"Represa Samuel: 14 km E of dam on dike rd. then 2 km S on JL-7 rd","BRA",NA,1986,"PRESERVED_SPECIMEN","RECORDED_DATE_INVALID;COORDINATE_ROUNDED;GEODETIC_DATUM_ASSUMED_WGS84;CONTINENT_DERIVED_FROM_COORDINATES;INSTITUTION_MATCH_FUZZY;COLLECTION_MATCH_FUZZY"
-56.448889,-1.694167,"Deguelia scandens",2997682517,"Rio Trombetas, margem direita, estrada da Mineraçao Santa Patricia, ramal 22.","BRA",NA,1980,"PRESERVED_SPECIMEN","RECORDED_DATE_INVALID;COORDINATE_ROUNDED;GEODETIC_DATUM_ASSUMED_WGS84;CONTINENT_DERIVED_FROM_COORDINATES;INSTITUTION_MATCH_FUZZY;COLLECTION_MATCH_FUZZY"
-61.42,-9.17,"Deguelia scandens",2997665824,"Mun. de Novo Aripuana. Rod. do Estanho km 120, estr. da mineraçao Sao Francisco a 50 km do entroc. com mineraçao Igarapé Preto","BRA",NA,1985,"PRESERVED_SPECIMEN","COORDINATE_ROUNDED;GEODETIC_DATUM_ASSUMED_WGS84;CONTINENT_DERIVED_FROM_COORDINATES;INSTITUTION_MATCH_FUZZY;COLLECTION_MATCH_FUZZY"
-73.724167,-7.514444,"Deguelia scandens",1260572222,"Mâncio Lima: Bacia do Alto Juruá, Rio Moa, Parque Nacional da Serra do Divisor, subindo após foz do Ramón. Floresta de várzea.","BRA",NA,1996,"PRESERVED_SPECIMEN","OCCURRENCE_STATUS_INFERRED_FROM_INDIVIDUAL_COUNT;COORDINATE_ROUNDED;GEODETIC_DATUM_ASSUMED_WGS84;INSTITUTION_MATCH_FUZZY;COLLECTION_MATCH_NONE"
-72.138889,8.3,"Deguelia scandens",1258044106,"Forest remnant, north of Carretera Panamerica, southwest of Hacienda La Madera, ca. 6 km southwest of Coloncito.","VEN",NA,1979,"PRESERVED_SPECIMEN","OCCURRENCE_STATUS_INFERRED_FROM_INDIVIDUAL_COUNT;COORDINATE_ROUNDED;GEODETIC_DATUM_ASSUMED_WGS84;INSTITUTION_MATCH_FUZZY;COLLECTION_MATCH_NONE"
-73.4222,3.53151,"Deguelia scandens",2512273704,"","COL",NA,2018,"HUMAN_OBSERVATION",""
-53.90449,3.5355,"Deguelia scandens",3310483078,"","GUF",5000,2011,"HUMAN_OBSERVATION","COUNTRY_MISMATCH;GEODETIC_DATUM_ASSUMED_WGS84;CONTINENT_DERIVED_FROM_COORDINATES;TAXON_MATCH_HIGHERRANK"
102,16.9,"Deguelia scandens",2515729273,"Thailand, Northeastern: Udon Thani, Non Sang.","THA",NA,1968,"PRESERVED_SPECIMEN","INSTITUTION_MATCH_FUZZY;INSTITUTION_COLLECTION_MISMATCH"
-68.165528,-13.9005,"Deguelia scandens",1936654939,"Departamento La Paz, Provincia Abel Iturralde.","BOL",NA,2001,"PRESERVED_SPECIMEN","COORDINATE_ROUNDED;GEODETIC_DATUM_ASSUMED_WGS84;CONTINENT_DERIVED_FROM_COORDINATES;INSTITUTION_MATCH_FUZZY;COLLECTION_MATCH_FUZZY"
-62.916667,7.166667,"Deguelia scandens",1258595433,"20 to 35 km SW of Monteco on road to San Pedro de las Dos Bocas; disturbed primary forest.","VEN",NA,1978,"PRESERVED_SPECIMEN","OCCURRENCE_STATUS_INFERRED_FROM_INDIVIDUAL_COUNT;COORDINATE_ROUNDED;GEODETIC_DATUM_ASSUMED_WGS84;INSTITUTION_MATCH_FUZZY;COLLECTION_MATCH_NONE"
102.5,12.233333,"Deguelia scandens",2515305876,"Thailand, Southeastern, Trat. Trat: between Trat and Roem Ngop.","THA",NA,1973,"PRESERVED_SPECIMEN","INSTITUTION_MATCH_FUZZY;INSTITUTION_COLLECTION_MISMATCH"
99.583333,12.866667,"Deguelia scandens",2515317269,"Thailand: Phetchaburi: Amphoe Kaeng Krachan: Kaeng Krachan National Park. Along road towards National Park headquarters.","THA",NA,2002,"PRESERVED_SPECIMEN","INSTITUTION_MATCH_FUZZY;INSTITUTION_COLLECTION_MISMATCH"
-65.75,3.66666,"Deguelia scandens",1260576998,"Departmento Atabapo: Caño Negro. Río arriba desde la confluencia con el río Cunucunuma,","VEN",NA,1982,"PRESERVED_SPECIMEN","GEODETIC_DATUM_ASSUMED_WGS84;INSTITUTION_MATCH_FUZZY;COLLECTION_MATCH_NONE"
-55.6667,3.58333,"Deguelia scandens",1456259809,"In vicinity of Kajana village on Gran Rio","SUR",NA,1998,"PRESERVED_SPECIMEN","GEODETIC_DATUM_ASSUMED_WGS84"
