"lon","lat","species","gbifID","locality","countryCode","coordinateUncertaintyInMeters","year","basisOfRecord","issue"
-77.68333,-8.88333,"Deschampsia aurea",1259796051,"Huascarán National Park. Quebrada Alpamayo, at foot of Quitaraju. Wet bottom with dark, silty soil.","PER",NA,1985,"PRESERVED_SPECIMEN","OCCURRENCE_STATUS_INFERRED_FROM_INDIVIDUAL_COUNT;GEODETIC_DATUM_ASSUMED_WGS84;INSTITUTION_MATCH_FUZZY;COLLECTION_MATCH_NONE"
-77.51666,-9.11666,"Deschampsia aurea",1259727924,"Huascarán National Park. Quebrada Ulta, below Ulta Pass Marshy spot, saturated to flooded soil.","PER",NA,1985,"PRESERVED_SPECIMEN","OCCURRENCE_STATUS_INFERRED_FROM_INDIVIDUAL_COUNT;GEODETIC_DATUM_ASSUMED_WGS84;INSTITUTION_MATCH_FUZZY;COLLECTION_MATCH_NONE"
-78.21666,-0.31666,"Deschampsia aurea",1259575142,"Along road from Paso de La Virgen to the Antenas","ECU",NA,1992,"PRESERVED_SPECIMEN","GEODETIC_DATUM_ASSUMED_WGS84;DIFFERENT_OWNER_INSTITUTION"
-78.16666,-0.5,"Deschampsia aurea",1260020044,"El Altar, N side of the volcano, humid cushion superp·ramo with scattered bunchgrasses on the ridge below the Canoningo peak.","ECU",NA,1995,"PRESERVED_SPECIMEN","GEODETIC_DATUM_ASSUMED_WGS84;DIFFERENT_OWNER_INSTITUTION"
-78.16666,0.25,"Deschampsia aurea",1260019776,"Cerro Imbabura, in a gully on the S side of the volcano, páramo vegetation between rocks.","ECU",NA,1995,"PRESERVED_SPECIMEN","GEODETIC_DATUM_ASSUMED_WGS84;DIFFERENT_OWNER_INSTITUTION"
-78.33333,0.36666,"Deschampsia aurea",1259574558,"Volcán Cotocachi. Superparamo.","ECU",NA,1985,"PRESERVED_SPECIMEN","GEODETIC_DATUM_ASSUMED_WGS84;DIFFERENT_OWNER_INSTITUTION"
-78.83333,-1.46666,"Deschampsia aurea",1259574772,"Volc. Chimborazo, just below the lower Refúgio (4840 m)","ECU",NA,1992,"PRESERVED_SPECIMEN","GEODETIC_DATUM_ASSUMED_WGS84;DIFFERENT_OWNER_INSTITUTION"
-77.95,-0.066,"Deschampsia aurea",47737365,"At the Refugia, Vulc. Cayambe. Gravel.","ECU",NA,1988,"PRESERVED_SPECIMEN","GEODETIC_DATUM_ASSUMED_WGS84;COORDINATE_PRECISION_INVALID;INSTITUTION_MATCH_FUZZY;INSTITUTION_COLLECTION_MISMATCH"
-78.216,-0.35,"Deschampsia aurea",47737347,"Paramo de Guamani. Small peak c. 6 km south of Paso de la Virgen. Paramo.","ECU",NA,1985,"PRESERVED_SPECIMEN","GEODETIC_DATUM_ASSUMED_WGS84;COORDINATE_PRECISION_INVALID;INSTITUTION_MATCH_FUZZY;INSTITUTION_COLLECTION_MISMATCH"
-78.85,-1.483,"Deschampsia aurea",47737240,"Reserva Ecologica Chimborazo, around and below lower Refugio","ECU",NA,2001,"PRESERVED_SPECIMEN","GEODETIC_DATUM_ASSUMED_WGS84;COORDINATE_PRECISION_INVALID;INSTITUTION_MATCH_FUZZY;INSTITUTION_COLLECTION_MISMATCH"
-78.25,0.116,"Deschampsia aurea",47737248,"At highest pass on road Mojanda - Tabacundo","ECU",NA,2001,"PRESERVED_SPECIMEN","GEODETIC_DATUM_ASSUMED_WGS84;COORDINATE_PRECISION_INVALID;INSTITUTION_MATCH_FUZZY;INSTITUTION_COLLECTION_MISMATCH"
-78.166,-0.45,"Deschampsia aurea",47737149,"On N-side of Volc. Antisana app. 12 km along dirt-road from Hac. Antisana","ECU",NA,1992,"PRESERVED_SPECIMEN","GEODETIC_DATUM_ASSUMED_WGS84;COORDINATE_PRECISION_INVALID;INSTITUTION_MATCH_FUZZY;INSTITUTION_COLLECTION_MISMATCH"
-78.45,-1.45,"Deschampsia aurea",47737080,"Cerros Yuibug - Pailacajas (4730 m a.s.l.), E side of the mountain ridge, species rich humid cushion superp·ramo with Plantago rigida, Werneria humilis, and Azorella spp., traces of trampling.","ECU",NA,1997,"PRESERVED_SPECIMEN","GEODETIC_DATUM_ASSUMED_WGS84;COORDINATE_PRECISION_INVALID;INSTITUTION_MATCH_FUZZY;INSTITUTION_COLLECTION_MISMATCH"
-78.366,-1.15,"Deschampsia aurea",47737077,"Cajas National Park, sparse upper superp·ramo vegetation of the sand/scree summit area of Cerro Parag¸llas (4410 m a.s.l., ca 1.5 km to the N of the mountain pass of the road Cuenca - Miguir).","ECU",NA,1997,"PRESERVED_SPECIMEN","GEODETIC_DATUM_ASSUMED_WGS84;COORDINATE_PRECISION_INVALID;INSTITUTION_MATCH_FUZZY;INSTITUTION_COLLECTION_MISMATCH"
-78.01666,-0.03333,"Deschampsia aurea",4061073402,"Paso de la Virgen","ECU",NA,1999,"PRESERVED_SPECIMEN","GEODETIC_DATUM_ASSUMED_WGS84;INSTITUTION_MATCH_NONE"
-77.25,-10.03333,"Deschampsia aurea",1259770801,"Huascarán National Park. mouth of Quebrada Quenua Ragra. Severely overgrazed rangeland.","PER",NA,1985,"PRESERVED_SPECIMEN","OCCURRENCE_STATUS_INFERRED_FROM_INDIVIDUAL_COUNT;GEODETIC_DATUM_ASSUMED_WGS84;INSTITUTION_MATCH_FUZZY;COLLECTION_MATCH_NONE"
-78.6605,-0.531917,"Deschampsia aurea",4069066518,"Corazon","ECU",NA,2020,"PRESERVED_SPECIMEN","DIFFERENT_OWNER_INSTITUTION"
-78.16667,-0.5,"Deschampsia aurea",3413677855,"Volcán Antisana, W side of the mountain, sparse upper superpáramo vegetation on the terminal moraine","ECU",NA,1997,"PRESERVED_SPECIMEN","CONTINENT_DERIVED_FROM_COORDINATES;INSTITUTION_MATCH_FUZZY;COLLECTION_MATCH_NONE"
-78.7,-0.66667,"Deschampsia aurea",3413679973,"Pichincha/Cotopaxi Volcán Iliniza, superpáramo vegetation on the N slope below the refuge.","ECU",NA,1995,"PRESERVED_SPECIMEN","CONTINENT_DERIVED_FROM_COORDINATES;INSTITUTION_MATCH_FUZZY;COLLECTION_MATCH_NONE"
-78.01667,0.01667,"Deschampsia aurea",3413679974,"Nevado Cayambe, SW side, sparse superpáramo vegetation on sandy slope with rocks","ECU",NA,1995,"PRESERVED_SPECIMEN","CONTINENT_DERIVED_FROM_COORDINATES;INSTITUTION_MATCH_FUZZY;COLLECTION_MATCH_NONE"
-78.84417,-1.08639,"Deschampsia aurea",3413680796,"Paramo de Quispicacha, eastern slope of Loma Pucyucuchu","ECU",NA,2006,"PRESERVED_SPECIMEN","CONTINENT_DERIVED_FROM_COORDINATES;INSTITUTION_MATCH_FUZZY;COLLECTION_MATCH_NONE"
