"lon","lat","species","gbifID","locality","countryCode","coordinateUncertaintyInMeters","year","basisOfRecord","issue"
-100.1125,25.183333,"Desmodium molliculum",1894423465,"Los Puertos, Ejido La Trinidad, Montemorelos","MEX",50,2003,"PRESERVED_SPECIMEN","TYPE_STATUS_INVALID;OCCURRENCE_STATUS_INFERRED_FROM_INDIVIDUAL_COUNT;COORDINATE_ROUNDED;GEODETIC_DATUM_ASSUMED_WGS84;CONTINENT_DERIVED_FROM_COORDINATES;ELEVATION_MIN_MAX_SWAPPED;INSTITUTION_MATCH_NONE"
-74.02558,4.78844,"Desmodium molliculum",2244394642,"Localidad de Usaquén, Cerros de Torca, Colegio Distrital Nuevo Horizonte","COL",NA,2017,"PRESERVED_SPECIMEN","OCCURRENCE_STATUS_INFERRED_FROM_INDIVIDUAL_COUNT;INSTITUTION_MATCH_FUZZY;COLLECTION_MATCH_FUZZY"
-68.296667,-14.524444,"Desmodium molliculum",1259122734,"Senda Apolo-San José de Uchupiamonas, cruzando el río Huacataya. Pastizal viejo de 50 cm de altura, con algunos arbustos dispersos de compuestas. Linea de Intercepcion 27.","BOL",NA,2002,"PRESERVED_SPECIMEN","OCCURRENCE_STATUS_INFERRED_FROM_INDIVIDUAL_COUNT;COORDINATE_ROUNDED;GEODETIC_DATUM_ASSUMED_WGS84;DIFFERENT_OWNER_INSTITUTION"
-78.516667,-1.5,"Desmodium molliculum",1257803127,"Parroquia Puela, Carretera Penipe-Baños.","ECU",NA,1997,"PRESERVED_SPECIMEN","OCCURRENCE_STATUS_INFERRED_FROM_INDIVIDUAL_COUNT;COORDINATE_ROUNDED;GEODETIC_DATUM_ASSUMED_WGS84;DIFFERENT_OWNER_INSTITUTION"
-101.333611,19.629445,"Desmodium molliculum",1257648161,"Cerro El Águila,por el lado de San Nicolás de Obispo.","MEX",NA,2008,"PRESERVED_SPECIMEN","OCCURRENCE_STATUS_INFERRED_FROM_INDIVIDUAL_COUNT;COORDINATE_ROUNDED;GEODETIC_DATUM_ASSUMED_WGS84;DIFFERENT_OWNER_INSTITUTION"
-78.37,-0.3,"Desmodium molliculum",1096625119,"Prov. Imbabura. road Otavalo - A.N.C.O., about 3 km SSW Lago Cuicocha, xerophytic slopes. Iter Regnellianum nonum. Flora aequadoriensis","ECU",NA,1966,"PRESERVED_SPECIMEN","GEODETIC_DATUM_ASSUMED_WGS84;CONTINENT_DERIVED_FROM_COORDINATES;CONTINENT_INVALID;INSTITUTION_COLLECTION_MISMATCH"
-99.542,22.3983,"Desmodium molliculum",2807626815,"4 mi E of Cd del Maíz","MEX",NA,1963,"PRESERVED_SPECIMEN","GEODETIC_DATUM_ASSUMED_WGS84;INSTITUTION_MATCH_FUZZY;COLLECTION_MATCH_FUZZY"
-100.7205888,19.6608381,"Desmodium molliculum",1895385796,"20 Km al W de Cd Hidalgo, sobre la carr a Morelia","MEX",4410,1977,"PRESERVED_SPECIMEN","TYPE_STATUS_INVALID;OCCURRENCE_STATUS_INFERRED_FROM_INDIVIDUAL_COUNT;COORDINATE_REPROJECTED;COORDINATE_ROUNDED;CONTINENT_DERIVED_FROM_COORDINATES;ELEVATION_MIN_MAX_SWAPPED;INSTITUTION_MATCH_NONE"
-92.689176,16.787502,"Desmodium molliculum",1895385867,"San Juan Chamula","MEX",1190,1987,"PRESERVED_SPECIMEN","TYPE_STATUS_INVALID;OCCURRENCE_STATUS_INFERRED_FROM_INDIVIDUAL_COUNT;COORDINATE_ROUNDED;CONTINENT_DERIVED_FROM_COORDINATES;ELEVATION_MIN_MAX_SWAPPED;INSTITUTION_MATCH_NONE"
-92.2693741,15.3330563,"Desmodium molliculum",1895385853,"Buenos Aires","MEX",10,1987,"PRESERVED_SPECIMEN","TYPE_STATUS_INVALID;OCCURRENCE_STATUS_INFERRED_FROM_INDIVIDUAL_COUNT;COORDINATE_REPROJECTED;COORDINATE_ROUNDED;CONTINENT_DERIVED_FROM_COORDINATES;ELEVATION_MIN_MAX_SWAPPED;INSTITUTION_MATCH_NONE"
-58.5667,6.13333,"Desmodium molliculum",1456334818,"Confluence of Arakwai River & Essequibo River, at loading dock and near home of guard (Ivan Rodriguez)","GUY",NA,1990,"PRESERVED_SPECIMEN","GEODETIC_DATUM_ASSUMED_WGS84"
-104.275,19.608333,"Desmodium molliculum",1893960834,"Arroyo de Las Tecatas","MEX",90,1985,"PRESERVED_SPECIMEN","TYPE_STATUS_INVALID;COORDINATE_ROUNDED;GEODETIC_DATUM_ASSUMED_WGS84;CONTINENT_DERIVED_FROM_COORDINATES;ELEVATION_MIN_MAX_SWAPPED;INSTITUTION_MATCH_NONE"
-77.97,0.58,"Desmodium molliculum",1096625097,"Prov. Carchi: Páramo El Angel, Quebrada del Rio Angel, 3 km NE San Isidro on road to El Angel. Iter Regnellianum nonum. Flora aequadoriensis","ECU",NA,1967,"PRESERVED_SPECIMEN","GEODETIC_DATUM_ASSUMED_WGS84;CONTINENT_DERIVED_FROM_COORDINATES;CONTINENT_INVALID;INSTITUTION_COLLECTION_MISMATCH"
-99.992778,19.436667,"Desmodium molliculum",1259416908,"Villa Victoria.","MEX",NA,1978,"PRESERVED_SPECIMEN","OCCURRENCE_STATUS_INFERRED_FROM_INDIVIDUAL_COUNT;COORDINATE_ROUNDED;GEODETIC_DATUM_ASSUMED_WGS84;INSTITUTION_MATCH_FUZZY;COLLECTION_MATCH_NONE"
-77.89775,-7.000417,"Desmodium molliculum",1258007391,"Uchumarca, Sañambal.","PER",NA,2013,"PRESERVED_SPECIMEN","OCCURRENCE_STATUS_INFERRED_FROM_INDIVIDUAL_COUNT;COORDINATE_ROUNDED;GEODETIC_DATUM_ASSUMED_WGS84;INSTITUTION_MATCH_FUZZY;COLLECTION_MATCH_NONE"
-78.51666,0.01666,"Desmodium molliculum",4031448841,"Pululahua crater. El Mirador, southern side of crater. Dry grazed place.","ECU",NA,1991,"PRESERVED_SPECIMEN","GEODETIC_DATUM_ASSUMED_WGS84;INSTITUTION_MATCH_FUZZY;COLLECTION_MATCH_NONE"
-109.98306,23.55056,"Desmodium molliculum",3125258311,"Sierra de la Laguna: NE of Todos Santos: vicinity of Valle La Laguna at top of the Sierra; NE of Cañon La Burrera and Rancho Corral Grande","MEX",NA,1998,"PRESERVED_SPECIMEN","CONTINENT_DERIVED_FROM_COORDINATES;INSTITUTION_MATCH_FUZZY;COLLECTION_MATCH_NONE"
-73.009544,5.803381,"Desmodium molliculum",2540730130,"","COL",227,2019,"HUMAN_OBSERVATION","COORDINATE_ROUNDED;CONTINENT_DERIVED_FROM_COORDINATES"
-92.659533,16.720606,"Desmodium molliculum",2992760761,"","MEX",4,2020,"HUMAN_OBSERVATION","COORDINATE_ROUNDED;CONTINENT_DERIVED_FROM_COORDINATES"
-78.597412,-1.27602,"Desmodium molliculum",3859466478,"","ECU",8,2022,"HUMAN_OBSERVATION","COORDINATE_ROUNDED;CONTINENT_DERIVED_FROM_COORDINATES"
-99.8119,17.665,"Desmodium molliculum",3308000658,"Campo de Aviación, 1 km al NE","MEX",90,1997,"PRESERVED_SPECIMEN","TYPE_STATUS_INVALID;OCCURRENCE_STATUS_INFERRED_FROM_INDIVIDUAL_COUNT;GEODETIC_DATUM_ASSUMED_WGS84;CONTINENT_DERIVED_FROM_COORDINATES;INSTITUTION_MATCH_FUZZY;INSTITUTION_COLLECTION_MISMATCH"
-105.045,23.88472,"Desmodium molliculum",3308040506,"Km. 2, camino Navios a Regocijo","MEX",70,1994,"PRESERVED_SPECIMEN","TYPE_STATUS_INVALID;OCCURRENCE_STATUS_INFERRED_FROM_INDIVIDUAL_COUNT;RECORDED_DATE_INVALID;GEODETIC_DATUM_ASSUMED_WGS84;CONTINENT_DERIVED_FROM_COORDINATES;INSTITUTION_MATCH_FUZZY;INSTITUTION_COLLECTION_MISMATCH"
-103.893,21.79806,"Desmodium molliculum",3308050914,"Los Amoles, 10 km al SO de Las Banderitas, Tuxpan de Bolaños","MEX",80,1996,"PRESERVED_SPECIMEN","TYPE_STATUS_INVALID;OCCURRENCE_STATUS_INFERRED_FROM_INDIVIDUAL_COUNT;GEODETIC_DATUM_ASSUMED_WGS84;CONTINENT_DERIVED_FROM_COORDINATES;INSTITUTION_MATCH_FUZZY;INSTITUTION_COLLECTION_MISMATCH"
-99.8922,17.74194,"Desmodium molliculum",3307964061,"Verde Rico, 3.92 km al N","MEX",90,1999,"PRESERVED_SPECIMEN","TYPE_STATUS_INVALID;OCCURRENCE_STATUS_INFERRED_FROM_INDIVIDUAL_COUNT;GEODETIC_DATUM_ASSUMED_WGS84;CONTINENT_DERIVED_FROM_COORDINATES;INSTITUTION_MATCH_FUZZY;INSTITUTION_COLLECTION_MISMATCH"
-75.3,5.733,"Desmodium molliculum",3308415819,"Km 4 of road Sonsón-La Unión (52 km from La Unión)","COL",NA,1987,"PRESERVED_SPECIMEN","TYPE_STATUS_INVALID;OCCURRENCE_STATUS_INFERRED_FROM_INDIVIDUAL_COUNT;GEODETIC_DATUM_ASSUMED_WGS84;CONTINENT_DERIVED_FROM_COORDINATES;INSTITUTION_MATCH_FUZZY;INSTITUTION_COLLECTION_MISMATCH"
-100.1318,19.9939,"Desmodium molliculum",1894488387,"Cerro Altamirano","MEX",80,2005,"PRESERVED_SPECIMEN","TYPE_STATUS_INVALID;OCCURRENCE_STATUS_INFERRED_FROM_INDIVIDUAL_COUNT;GEODETIC_DATUM_ASSUMED_WGS84;CONTINENT_DERIVED_FROM_COORDINATES;ELEVATION_MIN_MAX_SWAPPED;INSTITUTION_MATCH_NONE"
-63.693333,-18.256944,"Desmodium molliculum",1257975084,"Bella Vista","BOL",NA,2005,"PRESERVED_SPECIMEN","OCCURRENCE_STATUS_INFERRED_FROM_INDIVIDUAL_COUNT;COORDINATE_ROUNDED;GEODETIC_DATUM_ASSUMED_WGS84;DIFFERENT_OWNER_INSTITUTION"
-108.706,28.4278,"Desmodium molliculum",2270486050,"Arroyo Agua Caliente (La Soledad), 8 km south of Maycoba on road to Moris","MEX",NA,1997,"PRESERVED_SPECIMEN","GEODETIC_DATUM_ASSUMED_WGS84;CONTINENT_DERIVED_FROM_COORDINATES;INSTITUTION_MATCH_FUZZY;INSTITUTION_COLLECTION_MISMATCH"
-106.766328,26.218739,"Desmodium molliculum",2270509761,"Agua Amarillo, about 5 miles northwest of Chinatu.","MEX",8000,1959,"PRESERVED_SPECIMEN","GEODETIC_DATUM_ASSUMED_WGS84;CONTINENT_DERIVED_FROM_COORDINATES;INSTITUTION_MATCH_FUZZY;INSTITUTION_COLLECTION_MISMATCH"
-102.785,19.9609,"Desmodium molliculum",1989174534,"Las Ánimas; 8-10 km SW of Jiquilpan and 5 km NE of Quitupan, Jal. Cerro Santa María","MEX",NA,1959,"PRESERVED_SPECIMEN","GEODETIC_DATUM_ASSUMED_WGS84"
-97.78333,19.7,"Desmodium molliculum",2807583594,"Tilapa, 9 Km al E de Tetela","MEX",NA,1987,"PRESERVED_SPECIMEN","GEODETIC_DATUM_ASSUMED_WGS84;INSTITUTION_MATCH_FUZZY;COLLECTION_MATCH_FUZZY"
-70.22,9.2439,"Desmodium molliculum",1321022272,"Parque Nacional Guaramacal, potrero adyacente a la Laguna de Los Cedros","VEN",NA,1995,"PRESERVED_SPECIMEN","GEODETIC_DATUM_ASSUMED_WGS84"
-100.151944,20.904444,"Desmodium molliculum",1897345836,"Cerro Zamorano, vertiente SW, exposición S, ladera con exposición W a 200 m al N de el pueblo El Fuenteño","MEX",80,1998,"PRESERVED_SPECIMEN","TYPE_STATUS_INVALID;OCCURRENCE_STATUS_INFERRED_FROM_INDIVIDUAL_COUNT;COORDINATE_ROUNDED;GEODETIC_DATUM_ASSUMED_WGS84;CONTINENT_DERIVED_FROM_COORDINATES;ELEVATION_MIN_MAX_SWAPPED;INSTITUTION_MATCH_NONE"
-100.149167,20.001667,"Desmodium molliculum",1897345842,"2.5 km hacia el NW de Santa María la Ahogada","MEX",80,2005,"PRESERVED_SPECIMEN","TYPE_STATUS_INVALID;OCCURRENCE_STATUS_INFERRED_FROM_INDIVIDUAL_COUNT;COORDINATE_ROUNDED;GEODETIC_DATUM_ASSUMED_WGS84;CONTINENT_DERIVED_FROM_COORDINATES;ELEVATION_MIN_MAX_SWAPPED;INSTITUTION_MATCH_NONE"
-109.025,28.345556,"Desmodium molliculum",1897345985,"Mesa del Campanero, Arroyo Largo at the head of Barranca El Salto","MEX",60,1996,"PRESERVED_SPECIMEN","TYPE_STATUS_INVALID;OCCURRENCE_STATUS_INFERRED_FROM_INDIVIDUAL_COUNT;COORDINATE_ROUNDED;GEODETIC_DATUM_ASSUMED_WGS84;CONTINENT_DERIVED_FROM_COORDINATES;ELEVATION_MIN_MAX_SWAPPED;INSTITUTION_MATCH_NONE"
-77.86666,-0.58333,"Desmodium molliculum",4031447906,"Tena-Baeza road,walking from Cosanga in direction to Baeza. Farms and pastures.","ECU",NA,1991,"PRESERVED_SPECIMEN","GEODETIC_DATUM_ASSUMED_WGS84;INSTITUTION_MATCH_FUZZY;COLLECTION_MATCH_NONE"
-70.9,-13.416667,"Desmodium molliculum",1261918228,"Entre Abra Walla Walla y Marcapata a 210 km de Cusco.","PER",NA,1988,"PRESERVED_SPECIMEN","OCCURRENCE_STATUS_INFERRED_FROM_INDIVIDUAL_COUNT;COORDINATE_ROUNDED;GEODETIC_DATUM_ASSUMED_WGS84;INSTITUTION_MATCH_FUZZY;COLLECTION_MATCH_NONE"
-78.53333,-0.96666,"Desmodium molliculum",1261544009,"Cantón Latacunga. Parroquia Belisario Quevedo. Bosque seco Montano Bajo.","ECU",NA,1989,"PRESERVED_SPECIMEN","OCCURRENCE_STATUS_INFERRED_FROM_INDIVIDUAL_COUNT;GEODETIC_DATUM_ASSUMED_WGS84;INSTITUTION_MATCH_FUZZY;COLLECTION_MATCH_NONE"
-90.95277,14.65194,"Desmodium molliculum",1259419935,"7.6 km. E. of Patzún. Collection from pine-oak woodland along a small creek","GTM",NA,1970,"PRESERVED_SPECIMEN","GEODETIC_DATUM_ASSUMED_WGS84;INSTITUTION_MATCH_FUZZY;COLLECTION_MATCH_NONE"
-92.307222,16.641667,"Desmodium molliculum",2629660133,"6.7 km antes de Chanal, desde San Cristóbal","MEX",100,1987,"PRESERVED_SPECIMEN","TYPE_STATUS_INVALID;OCCURRENCE_STATUS_INFERRED_FROM_INDIVIDUAL_COUNT;COORDINATE_ROUNDED;GEODETIC_DATUM_ASSUMED_WGS84;GEODETIC_DATUM_INVALID;CONTINENT_DERIVED_FROM_COORDINATES;INSTITUTION_MATCH_NONE"
-102.316667,21.233333,"Desmodium molliculum",2629674378,"Between San Juan de los Lagos and Lagos de Moreno, on road to Guadalajara","MEX",80,1963,"PRESERVED_SPECIMEN","TYPE_STATUS_INVALID;OCCURRENCE_STATUS_INFERRED_FROM_INDIVIDUAL_COUNT;COORDINATE_ROUNDED;GEODETIC_DATUM_ASSUMED_WGS84;GEODETIC_DATUM_INVALID;CONTINENT_DERIVED_FROM_COORDINATES;INSTITUTION_MATCH_NONE"
-98.445,20.516667,"Desmodium molliculum",2629686262,"Rancho quemado","MEX",80,1970,"PRESERVED_SPECIMEN","TYPE_STATUS_INVALID;OCCURRENCE_STATUS_INFERRED_FROM_INDIVIDUAL_COUNT;COORDINATE_ROUNDED;GEODETIC_DATUM_ASSUMED_WGS84;GEODETIC_DATUM_INVALID;CONTINENT_DERIVED_FROM_COORDINATES;INSTITUTION_MATCH_NONE"
-74.097361,4.497389,"Desmodium molliculum",3744840529,"Usme Parque Ecológico de Montaña EntreNubes","COL",3,2021,"HUMAN_OBSERVATION","COORDINATE_ROUNDED"
-89.121389,14.381111,"Desmodium molliculum",1258545581,"Bosque humedo de El Pital.","SLV",NA,1976,"PRESERVED_SPECIMEN","OCCURRENCE_STATUS_INFERRED_FROM_INDIVIDUAL_COUNT;COORDINATE_ROUNDED;GEODETIC_DATUM_ASSUMED_WGS84;INSTITUTION_MATCH_FUZZY;COLLECTION_MATCH_NONE"
-99.804444,17.678333,"Desmodium molliculum",1259418558,"A 34 km al SW de Xochipala, carretera a Filo de Caballo.","MEX",NA,1983,"PRESERVED_SPECIMEN","COORDINATE_ROUNDED;GEODETIC_DATUM_ASSUMED_WGS84;INSTITUTION_MATCH_FUZZY;COLLECTION_MATCH_NONE"
-78.18333,0.15,"Desmodium molliculum",1258488941,"Entre Otavalo y Quito. Dry hillside above road, bordering cultivated fields. Between Otavalo and Cayambe","ECU",NA,1959,"PRESERVED_SPECIMEN","GEODETIC_DATUM_ASSUMED_WGS84;INSTITUTION_MATCH_FUZZY;COLLECTION_MATCH_NONE"
-64.0775,-19.09416,"Desmodium molliculum",1260725152,"Rancho Temporalcillo. Área de Influencia del Parque Nacional y Área de Manejo Integrado Serranía del Iñao. Bosque semihúmedo Tucumano- Boliviano. Piso superior. Rodales de Blepharocalyx salicifolius, Cinnamomum porphyrium y Myrcianthes pseudomato.","BOL",NA,2005,"PRESERVED_SPECIMEN","GEODETIC_DATUM_ASSUMED_WGS84;INSTITUTION_MATCH_FUZZY;COLLECTION_MATCH_NONE"
-63.923889,-18.665833,"Desmodium molliculum",4031886328,"Camino a Masicurí, Rio Guayabo.","BOL",NA,2009,"PRESERVED_SPECIMEN","OCCURRENCE_STATUS_INFERRED_FROM_INDIVIDUAL_COUNT;COORDINATE_ROUNDED;GEODETIC_DATUM_ASSUMED_WGS84;INSTITUTION_MATCH_FUZZY;COLLECTION_MATCH_NONE"
-78.25,0.21666,"Desmodium molliculum",4031452850,"Otavalo, outskirts of the city, west side. Path going through farms and Eucalyptus plantations.","ECU",NA,1991,"PRESERVED_SPECIMEN","GEODETIC_DATUM_ASSUMED_WGS84;INSTITUTION_MATCH_FUZZY;COLLECTION_MATCH_NONE"
-78.5,0.08333,"Desmodium molliculum",1261519420,"Reserva Geobotánica Pululahua. Camino a Lulumbamba, alrededor del Pan de Azúcar. Bosque húmedo Bosque seco Montano Bajo; Montano Bajo; Bosque húmedo Premontano.","ECU",NA,1987,"PRESERVED_SPECIMEN","OCCURRENCE_STATUS_INFERRED_FROM_INDIVIDUAL_COUNT;GEODETIC_DATUM_ASSUMED_WGS84;INSTITUTION_MATCH_FUZZY;COLLECTION_MATCH_NONE"
-108.2123579,28.1514505,"Desmodium molliculum",3091262559,"Municipio de Ocampo, Parque Nacional Cascada de Basaseachi, Cañón de La Zorra","MEX",NA,2009,"PRESERVED_SPECIMEN","COORDINATE_REPROJECTED;CONTINENT_DERIVED_FROM_COORDINATES;INSTITUTION_MATCH_FUZZY;COLLECTION_MATCH_NONE"
-101.8044,19.9102,"Desmodium molliculum",437223378,"","MEX",NA,1983,"PRESERVED_SPECIMEN","GEODETIC_DATUM_ASSUMED_WGS84;CONTINENT_DERIVED_FROM_COORDINATES;COLLECTION_MATCH_FUZZY"
-78.48333,-0.46666,"Desmodium molliculum",4031754844,"Pasochoa, road leading to the main road. Pastures and Eucalyptus plantations, plants collected on the roadside.","ECU",NA,1991,"PRESERVED_SPECIMEN","GEODETIC_DATUM_ASSUMED_WGS84;INSTITUTION_MATCH_FUZZY;COLLECTION_MATCH_NONE"
-90.96277,14.7275,"Desmodium molliculum",1259416557,"13.6 miles W of Chimaltenango. Along roadside in cultivated area. Pine-oak forest","GTM",NA,1975,"PRESERVED_SPECIMEN","GEODETIC_DATUM_ASSUMED_WGS84;INSTITUTION_MATCH_FUZZY;COLLECTION_MATCH_NONE"
-68.363611,-14.607222,"Desmodium molliculum",1259157593,"Parque Nacional-ANMI Madidi, Senda Apolo-San José de Uchupiamonas, a media hora antes de llegar al Naranja. Línea de intercepcion No 3 Apolo 3.","BOL",NA,2003,"PRESERVED_SPECIMEN","OCCURRENCE_STATUS_INFERRED_FROM_INDIVIDUAL_COUNT;COORDINATE_ROUNDED;GEODETIC_DATUM_ASSUMED_WGS84;DIFFERENT_OWNER_INSTITUTION"
-63.9,-19.566667,"Desmodium molliculum",4061071743,"Tichucha. Aprox a 12 km al NW de la comunidad de Ticucha, en el alto Iñao. Bosque Boliviano-Tucumano. A 400 m aprox del campamento base, bajando hacia el rio jarca mayu, en la ladera del rio, al borde de un sendero transitorio.","BOL",NA,2003,"PRESERVED_SPECIMEN","OCCURRENCE_STATUS_INFERRED_FROM_INDIVIDUAL_COUNT;COORDINATE_ROUNDED;GEODETIC_DATUM_ASSUMED_WGS84;DIFFERENT_OWNER_INSTITUTION"
-78.98333,-0.93333,"Desmodium molliculum",1258214267,"Latacunga-Quevedo road, 3-5 km above Pilaló. Slopes along road in cloud forest.","ECU",NA,1979,"PRESERVED_SPECIMEN","GEODETIC_DATUM_ASSUMED_WGS84;DIFFERENT_OWNER_INSTITUTION"
-64.082778,-18.561944,"Desmodium molliculum",1257845037,"Guadalupe, ca. 1 km E del pueblo de Guadalupe, por el unico camino grande hacia el río.","BOL",NA,2003,"PRESERVED_SPECIMEN","OCCURRENCE_STATUS_INFERRED_FROM_INDIVIDUAL_COUNT;COORDINATE_ROUNDED;GEODETIC_DATUM_ASSUMED_WGS84;DIFFERENT_OWNER_INSTITUTION"
-100.073333,19.361667,"Desmodium molliculum",1893752454,"CRIADERO SAN CAYETANO, 4 KM AL N DE AGUA ESCONDIDA, MPIO. VILLA DE ALLENDE","MEX",90,1982,"PRESERVED_SPECIMEN","TYPE_STATUS_INVALID;OCCURRENCE_STATUS_INFERRED_FROM_INDIVIDUAL_COUNT;COORDINATE_ROUNDED;GEODETIC_DATUM_ASSUMED_WGS84;CONTINENT_DERIVED_FROM_COORDINATES;ELEVATION_MIN_MAX_SWAPPED;INSTITUTION_MATCH_NONE"
-104.901667,21.443333,"Desmodium molliculum",1893752446,"9 KM AL W, CAMINO A COMPOSTELA","MEX",80,1985,"PRESERVED_SPECIMEN","TYPE_STATUS_INVALID;OCCURRENCE_STATUS_INFERRED_FROM_INDIVIDUAL_COUNT;COORDINATE_ROUNDED;GEODETIC_DATUM_ASSUMED_WGS84;CONTINENT_DERIVED_FROM_COORDINATES;ELEVATION_MIN_MAX_SWAPPED;INSTITUTION_MATCH_NONE"
-101.181667,19.57,"Desmodium molliculum",1893752447,"Se de agua zarca","MEX",80,1987,"PRESERVED_SPECIMEN","TYPE_STATUS_INVALID;OCCURRENCE_STATUS_INFERRED_FROM_INDIVIDUAL_COUNT;COORDINATE_ROUNDED;GEODETIC_DATUM_ASSUMED_WGS84;CONTINENT_DERIVED_FROM_COORDINATES;ELEVATION_MIN_MAX_SWAPPED;INSTITUTION_MATCH_NONE"
-102.933,18.75,"Desmodium molliculum",3308411143,"Cloud forest area locally called 'Cerritos de Agua', ca. 3 miles below the lumber camp at Dos Aguas; nearly west of Aguililla","MEX",90,1958,"PRESERVED_SPECIMEN","TYPE_STATUS_INVALID;OCCURRENCE_STATUS_INFERRED_FROM_INDIVIDUAL_COUNT;GEODETIC_DATUM_ASSUMED_WGS84;CONTINENT_DERIVED_FROM_COORDINATES;INSTITUTION_MATCH_FUZZY;INSTITUTION_COLLECTION_MISMATCH"
-97.2589,16.72033,"Desmodium molliculum",3308720421,"Distrito: Sola de Vega. Paraje Río Tigre","MEX",100,2006,"PRESERVED_SPECIMEN","TYPE_STATUS_INVALID;OCCURRENCE_STATUS_INFERRED_FROM_INDIVIDUAL_COUNT;GEODETIC_DATUM_ASSUMED_WGS84;CONTINENT_DERIVED_FROM_COORDINATES;INSTITUTION_MATCH_FUZZY;INSTITUTION_COLLECTION_MISMATCH"
-97.325,17.612,"Desmodium molliculum",3307939646,"20 km M of Asunción Nochixtlán on Hwy 135, 75 km S of state border, 156 km from Tehucan","MEX",90,1997,"PRESERVED_SPECIMEN","TYPE_STATUS_INVALID;OCCURRENCE_STATUS_INFERRED_FROM_INDIVIDUAL_COUNT;GEODETIC_DATUM_ASSUMED_WGS84;CONTINENT_DERIVED_FROM_COORDINATES;INSTITUTION_MATCH_FUZZY;INSTITUTION_COLLECTION_MISMATCH"
-84.11,9.82,"Desmodium molliculum",45010105,"Near Tarbaca, along ridge with drainage and exposure to the south.","CRI",NA,1971,"PRESERVED_SPECIMEN","GEODETIC_DATUM_ASSUMED_WGS84;CONTINENT_DERIVED_FROM_COORDINATES;TAXON_MATCH_HIGHERRANK;INSTITUTION_MATCH_NONE"
-87.08333,14.01666,"Desmodium molliculum",415989753,"Cerro Uyuca","HND",NA,1960,"PRESERVED_SPECIMEN","RECORDED_DATE_INVALID;GEODETIC_DATUM_ASSUMED_WGS84;CONTINENT_DERIVED_FROM_COORDINATES;INSTITUTION_MATCH_NONE"
-64.4775,-19.638889,"Desmodium molliculum",4061870202,"Muncipio Sopachuy. Comunidad San Pedro. Camino de Herradura, Borde del río Molino Mayu.","BOL",NA,2008,"PRESERVED_SPECIMEN","OCCURRENCE_STATUS_INFERRED_FROM_INDIVIDUAL_COUNT;COORDINATE_ROUNDED;GEODETIC_DATUM_ASSUMED_WGS84;DIFFERENT_OWNER_INSTITUTION"
-78,-5.91666,"Desmodium molliculum",4061743043,"Río Utcubamba. 4 km from Camp Ingenio up Shipasbamba road.","PER",NA,1964,"PRESERVED_SPECIMEN","GEODETIC_DATUM_ASSUMED_WGS84;INSTITUTION_MATCH_NONE"
-78.58333,-0.16666,"Desmodium molliculum",1258192697,"Quito, Av. de la Florida. Roadside vegetation and disturbed area.","ECU",NA,1983,"PRESERVED_SPECIMEN","GEODETIC_DATUM_ASSUMED_WGS84;DIFFERENT_OWNER_INSTITUTION"
-77.71666,0.8,"Desmodium molliculum",1257791106,"Tulcán, carretera de circunvalación, behind the airport. Farms and pastures with scattered bushes, plants collected on the roadside.","ECU",NA,1991,"PRESERVED_SPECIMEN","GEODETIC_DATUM_ASSUMED_WGS84;DIFFERENT_OWNER_INSTITUTION"
-79.3,-3.96666,"Desmodium molliculum",1257815807,"Old road La Toma-Loja, at la Y de La Toma. Windy slopes with bushy vegetation and scattered Eucalyptus trees.","ECU",NA,1991,"PRESERVED_SPECIMEN","GEODETIC_DATUM_ASSUMED_WGS84;DIFFERENT_OWNER_INSTITUTION"
-78.425554,-7.189909,"Desmodium molliculum",4028907401,"","PER",4,2020,"HUMAN_OBSERVATION","COORDINATE_ROUNDED;CONTINENT_DERIVED_FROM_COORDINATES"
-78.483,-1.383,"Desmodium molliculum",47756638,"Puento Velasco Ibarra.","ECU",NA,1968,"PRESERVED_SPECIMEN","GEODETIC_DATUM_ASSUMED_WGS84;COORDINATE_PRECISION_INVALID;INSTITUTION_MATCH_FUZZY;INSTITUTION_COLLECTION_MISMATCH"
-79.416,-3.916,"Desmodium molliculum",47755980,"Road San Pedro de la Bendita (W of Catamayo)-El Cisne, c. km 8. Northern extension of the Catamayo valley.","ECU",NA,1989,"PRESERVED_SPECIMEN","GEODETIC_DATUM_ASSUMED_WGS84;COORDINATE_PRECISION_INVALID;INSTITUTION_MATCH_FUZZY;INSTITUTION_COLLECTION_MISMATCH"
-99.994444,17.641667,"Desmodium molliculum",1893911218,"Yextla, 7.55 km al NO","MEX",90,1998,"PRESERVED_SPECIMEN","TYPE_STATUS_INVALID;OCCURRENCE_STATUS_INFERRED_FROM_INDIVIDUAL_COUNT;COORDINATE_ROUNDED;GEODETIC_DATUM_ASSUMED_WGS84;CONTINENT_DERIVED_FROM_COORDINATES;ELEVATION_MIN_MAX_SWAPPED;DIFFERENT_OWNER_INSTITUTION"
-100.021944,17.758889,"Desmodium molliculum",1893911220,"Tlacotepec, 6.11 km al SO","MEX",90,1998,"PRESERVED_SPECIMEN","TYPE_STATUS_INVALID;OCCURRENCE_STATUS_INFERRED_FROM_INDIVIDUAL_COUNT;COORDINATE_ROUNDED;GEODETIC_DATUM_ASSUMED_WGS84;CONTINENT_DERIVED_FROM_COORDINATES;ELEVATION_MIN_MAX_SWAPPED;DIFFERENT_OWNER_INSTITUTION"
-99.681944,18.663611,"Desmodium molliculum",1893911196,"Pilcaya, 7 km al SE, cruce de río Pilcaya, camino a Tetipac","MEX",90,1997,"PRESERVED_SPECIMEN","TYPE_STATUS_INVALID;OCCURRENCE_STATUS_INFERRED_FROM_INDIVIDUAL_COUNT;COORDINATE_ROUNDED;GEODETIC_DATUM_ASSUMED_WGS84;CONTINENT_DERIVED_FROM_COORDINATES;ELEVATION_MIN_MAX_SWAPPED;INSTITUTION_MATCH_NONE"
-97.6276,19.7703,"Desmodium molliculum",3898332394,"Rosa de Castilla, En un lugar llamado Minastate.","MEX",NA,2014,"PRESERVED_SPECIMEN",""
-88.8,14.483333,"Desmodium molliculum",1259419094,"Aldea de Belén Gualcho y alrededores; 40 km al E de Nueva Ocotepeque.","HND",NA,1976,"PRESERVED_SPECIMEN","OCCURRENCE_STATUS_INFERRED_FROM_INDIVIDUAL_COUNT;COORDINATE_ROUNDED;GEODETIC_DATUM_ASSUMED_WGS84;INSTITUTION_MATCH_FUZZY;COLLECTION_MATCH_NONE"
-91.131944,14.741389,"Desmodium molliculum",1258545605,"3 miles above Panajachel on road to Patzicía around Lake Atitlán.","GTM",NA,1977,"PRESERVED_SPECIMEN","OCCURRENCE_STATUS_INFERRED_FROM_INDIVIDUAL_COUNT;COORDINATE_ROUNDED;GEODETIC_DATUM_ASSUMED_WGS84;INSTITUTION_MATCH_FUZZY;COLLECTION_MATCH_NONE"
-103.533,19.6426,"Desmodium molliculum",1989376609,"La Tepamera; 1.5 km E of El Deposito, 10 km WSW of Cd. Guzmán, Volcán de Colima","MEX",NA,1978,"PRESERVED_SPECIMEN","GEODETIC_DATUM_ASSUMED_WGS84"
-109.947107,23.490408,"Desmodium molliculum",2629923801,"Sierra La Laguna Portezuelo de San Francisquito, Paraje Las Hornillitas","MEX",80,1987,"PRESERVED_SPECIMEN","TYPE_STATUS_INVALID;COORDINATE_ROUNDED;GEODETIC_DATUM_ASSUMED_WGS84;CONTINENT_DERIVED_FROM_COORDINATES;ELEVATION_MIN_MAX_SWAPPED;DIFFERENT_OWNER_INSTITUTION"
-101.61944,19.81056,"Desmodium molliculum",437556180,"","MEX",NA,1983,"PRESERVED_SPECIMEN","GEODETIC_DATUM_ASSUMED_WGS84;CONTINENT_DERIVED_FROM_COORDINATES;COLLECTION_MATCH_FUZZY"
-73.536278,5.604889,"Desmodium molliculum",1707569502,"Vereda Ritoque, finca Andalucia","COL",NA,2004,"PRESERVED_SPECIMEN","COORDINATE_ROUNDED;GEODETIC_DATUM_ASSUMED_WGS84;INSTITUTION_MATCH_NONE"
-75.133333,4.833333,"Desmodium molliculum",1707505336,"Guaymaral","COL",NA,1994,"PRESERVED_SPECIMEN","COORDINATE_ROUNDED;GEODETIC_DATUM_ASSUMED_WGS84;INSTITUTION_MATCH_NONE"
-73.835889,5.303389,"Desmodium molliculum",1707489439,"Ubate","COL",NA,2003,"PRESERVED_SPECIMEN","COORDINATE_ROUNDED;GEODETIC_DATUM_ASSUMED_WGS84;INSTITUTION_MATCH_NONE"
-73.511667,5.708056,"Desmodium molliculum",1707596588,"Vereda Llano Blanco. Finca Nido de Las Aguilas","COL",NA,2011,"PRESERVED_SPECIMEN","COORDINATE_ROUNDED;GEODETIC_DATUM_ASSUMED_WGS84;INSTITUTION_MATCH_NONE"
-108.861,28.39222,"Desmodium molliculum",3308019296,"18 km east of Yecora on Mex. 16","MEX",60,1997,"PRESERVED_SPECIMEN","TYPE_STATUS_INVALID;OCCURRENCE_STATUS_INFERRED_FROM_INDIVIDUAL_COUNT;GEODETIC_DATUM_ASSUMED_WGS84;CONTINENT_DERIVED_FROM_COORDINATES;INSTITUTION_MATCH_FUZZY;INSTITUTION_COLLECTION_MISMATCH"
-98.283,17.233,"Desmodium molliculum",3308611467,"Region: Sierra Sur Dto. Juxtlahuaca cima de Xiki Nuusavia, al S de Coicoyán","MEX",100,1989,"PRESERVED_SPECIMEN","TYPE_STATUS_INVALID;OCCURRENCE_STATUS_INFERRED_FROM_INDIVIDUAL_COUNT;GEODETIC_DATUM_ASSUMED_WGS84;CONTINENT_DERIVED_FROM_COORDINATES;INSTITUTION_MATCH_FUZZY;INSTITUTION_COLLECTION_MISMATCH"
-108.1,28.217,"Desmodium molliculum",3308498278,"Tonachic, on Arroyo Chorro de Agua","MEX",60,1986,"PRESERVED_SPECIMEN","TYPE_STATUS_INVALID;OCCURRENCE_STATUS_INFERRED_FROM_INDIVIDUAL_COUNT;GEODETIC_DATUM_ASSUMED_WGS84;CONTINENT_DERIVED_FROM_COORDINATES;INSTITUTION_MATCH_FUZZY;INSTITUTION_COLLECTION_MISMATCH"
-89.35,14.41667,"Desmodium molliculum",3913401769,"El Salvador: Depto. Santa Ana, Municipio Metapán, San José Ingenio, P.N. Montecristo, El Pino, camino a Los Planes. Vegetación secundaria. . Hierba rastrera; flores azul-marino. . Alt.: 1900 m.2002-09-03, Leg.: Monterrosa,J. & Carballo,R.A. 316 [JMS00316].","SLV",NA,2002,"PRESERVED_SPECIMEN","GEODETIC_DATUM_ASSUMED_WGS84;CONTINENT_DERIVED_FROM_COORDINATES;INSTITUTION_MATCH_FUZZY"
-97.387705,17.488057,"Desmodium molliculum",2235560267,"","MEX",930,2012,"HUMAN_OBSERVATION","COORDINATE_ROUNDED;CONTINENT_DERIVED_FROM_COORDINATES"
