"lon","lat","species","gbifID","locality","countryCode","coordinateUncertaintyInMeters","year","basisOfRecord","issue"
-36,-8.3,"Dichanthelium sciurotoides",2998296860,"Murici, Brejo dos Cavalos, Parque Ecologico Municipal.","BRA",NA,1994,"PRESERVED_SPECIMEN","RECORDED_DATE_INVALID;GEODETIC_DATUM_ASSUMED_WGS84;CONTINENT_DERIVED_FROM_COORDINATES;INSTITUTION_MATCH_FUZZY;COLLECTION_MATCH_FUZZY"
-39.07,-15.3,"Dichanthelium sciurotoides",2998292961,"Fazenda Cascata, Km 4 da rod Una/Santa Luzia.","BRA",NA,1983,"PRESERVED_SPECIMEN","GEODETIC_DATUM_ASSUMED_WGS84;CONTINENT_DERIVED_FROM_COORDINATES;INSTITUTION_MATCH_FUZZY;COLLECTION_MATCH_FUZZY"
-38.3,-12.48,"Dichanthelium sciurotoides",2998298961,"Area Controle da Caraiba Metais.","BRA",NA,1982,"PRESERVED_SPECIMEN","RECORDED_DATE_INVALID;GEODETIC_DATUM_ASSUMED_WGS84;CONTINENT_DERIVED_FROM_COORDINATES;INSTITUTION_MATCH_FUZZY;COLLECTION_MATCH_FUZZY"
-39.03,-16.28,"Dichanthelium sciurotoides",2998295909,"ESPAB, Area de pousio.","BRA",NA,1981,"PRESERVED_SPECIMEN","COORDINATE_ROUNDED;GEODETIC_DATUM_ASSUMED_WGS84;CONTINENT_DERIVED_FROM_COORDINATES;INSTITUTION_MATCH_FUZZY;COLLECTION_MATCH_FUZZY"
-39.02,-14.95,"Dichanthelium sciurotoides",2998561936,"Beside track through restinga forest.","BRA",NA,1982,"PRESERVED_SPECIMEN","COORDINATE_ROUNDED;GEODETIC_DATUM_ASSUMED_WGS84;CONTINENT_DERIVED_FROM_COORDINATES;INSTITUTION_MATCH_FUZZY;COLLECTION_MATCH_FUZZY"
-40.65,-11.1,"Dichanthelium sciurotoides",2998562903,"Serra do Tombador, Northe-west of Jacobina on Br 234 highway to Ouro Branco.","BRA",NA,1974,"PRESERVED_SPECIMEN","RECORDED_DATE_INVALID;COORDINATE_ROUNDED;GEODETIC_DATUM_ASSUMED_WGS84;CONTINENT_DERIVED_FROM_COORDINATES;INSTITUTION_MATCH_FUZZY;COLLECTION_MATCH_FUZZY"
-35.796667,-8.233333,"Dichanthelium sciurotoides",1090951783,"Pedra Pintada; Serra Negra de Bezerros","BRA",NA,1999,"PRESERVED_SPECIMEN","GEODETIC_DATUM_ASSUMED_WGS84;CONTINENT_DERIVED_FROM_COORDINATES;INSTITUTION_MATCH_NONE"
-43.478333,-20.094167,"Dichanthelium sciurotoides",1291005645,"Serra do Caraça, Caminho para Capelinha e Gruta de Lurdes.","BRA",NA,2004,"PRESERVED_SPECIMEN","GEODETIC_DATUM_ASSUMED_WGS84;CONTINENT_DERIVED_FROM_COORDINATES;DIFFERENT_OWNER_INSTITUTION"
-48.518333,-27.126111,"Dichanthelium sciurotoides",2575907488,"APA (Área de Proteção Ambiental) da Ponta do Araçá. (Nota FLOR: Latitude impressa na ficha (27°7348S) contém erro. Foi corrigida para um valor condizente com a descrição do local)","BRA",NA,2011,"PRESERVED_SPECIMEN","COORDINATE_ROUNDED;GEODETIC_DATUM_ASSUMED_WGS84;CONTINENT_DERIVED_FROM_COORDINATES;AMBIGUOUS_INSTITUTION"
-48.5525,-27.1875,"Dichanthelium sciurotoides",2575907881,"Área de Relevante Interesse Ecológico (ARIE) Costeira de Zimbros.","BRA",NA,2012,"PRESERVED_SPECIMEN","GEODETIC_DATUM_ASSUMED_WGS84;CONTINENT_DERIVED_FROM_COORDINATES;AMBIGUOUS_INSTITUTION"
-61.05,5.31666,"Dichanthelium sciurotoides",1259485326,"Gran Sabana; ca 10 km SW of Karaurin Tepui at junction of Río Karaurin and Río Asadon (Río Sanpa).","VEN",NA,1988,"PRESERVED_SPECIMEN","OCCURRENCE_STATUS_INFERRED_FROM_INDIVIDUAL_COUNT;GEODETIC_DATUM_ASSUMED_WGS84;INSTITUTION_MATCH_FUZZY;COLLECTION_MATCH_NONE"
-43.514722,-20.154722,"Dichanthelium sciurotoides",1087183143,"Mina Samarco","BRA",NA,2009,"PRESERVED_SPECIMEN","GEODETIC_DATUM_ASSUMED_WGS84;CONTINENT_DERIVED_FROM_COORDINATES;INSTITUTION_MATCH_NONE"
-39.133333,-16.383333,"Dichanthelium sciurotoides",1090435406,"Área da Estação Ecológica do Pau-brasil (ESPAB). CEPLAC. 16Km ao W Porto Seguro, BR-367. Prox. ao plantio puro de Jacarandá.","BRA",NA,1984,"PRESERVED_SPECIMEN","GEODETIC_DATUM_ASSUMED_WGS84;CONTINENT_DERIVED_FROM_COORDINATES;INSTITUTION_MATCH_NONE"
-39.016667,-14.416667,"Dichanthelium sciurotoides",1944968134,"Distrito de Serra Grande. 7.3Km na estarda Serra Grande/Itacaré. Conh. Fazenda Santa Cruz.","BRA",NA,1992,"PRESERVED_SPECIMEN","GEODETIC_DATUM_ASSUMED_WGS84;CONTINENT_DERIVED_FROM_COORDINATES;INSTITUTION_MATCH_NONE"
-39.565278,-15.391667,"Dichanthelium sciurotoides",1090507498,"RPPN Serra Bonita. Trilha da Pousada.","BRA",NA,2001,"PRESERVED_SPECIMEN","GEODETIC_DATUM_ASSUMED_WGS84;CONTINENT_DERIVED_FROM_COORDINATES;INSTITUTION_MATCH_NONE"
-48.9,-27.1,"Dichanthelium sciurotoides",3005698482,"Mun. Brusque: shady banks Azambuja, Brusque.","BRA",NA,1952,"PRESERVED_SPECIMEN","GEODETIC_DATUM_ASSUMED_WGS84"
-89.09527,16.54055,"Dichanthelium sciurotoides",4031503436,"Ceibo Grande to Main Divide track, by old repeater site, ridge-top. Montane forest to 16-18 m, dbh ca. 20 cm, dominated by Ilex guianensis and Purdea belizensis; slopes from ridge of semi-evergreen forest; sandy quartz soils","BLZ",NA,2000,"PRESERVED_SPECIMEN","GEODETIC_DATUM_ASSUMED_WGS84;INSTITUTION_MATCH_FUZZY;COLLECTION_MATCH_NONE"
-67.616667,-15.966667,"Dichanthelium sciurotoides",1259785022,"13.7 km NW of San Pedro on road through Incahuara-Mejillones, and along trail to 12 de Octubre.","BOL",NA,1983,"PRESERVED_SPECIMEN","OCCURRENCE_STATUS_INFERRED_FROM_INDIVIDUAL_COUNT;COORDINATE_ROUNDED;GEODETIC_DATUM_ASSUMED_WGS84;INSTITUTION_MATCH_FUZZY;COLLECTION_MATCH_NONE"
-68.03333,-16.06666,"Dichanthelium sciurotoides",1259431757,"Valle del Río Zongo. 39.3 km al norte (abajo) de la cumbre. Bosque húmedo, muy intervenido con campos de cultivos.","BOL",NA,1990,"PRESERVED_SPECIMEN","OCCURRENCE_STATUS_INFERRED_FROM_INDIVIDUAL_COUNT;GEODETIC_DATUM_ASSUMED_WGS84;INSTITUTION_MATCH_FUZZY;COLLECTION_MATCH_NONE"
-47.918333,-14.218889,"Dichanthelium sciurotoides",3461456418,"Fazenda Oréades, Região da Chapada dos Veadeiros - Náiades. Trilhas até o Rio São Joaquim","BRA",NA,2020,"PRESERVED_SPECIMEN","GEODETIC_DATUM_ASSUMED_WGS84;INSTITUTION_MATCH_FUZZY;COLLECTION_MATCH_FUZZY"
-43.48,-20.38,"Dichanthelium sciurotoides",3005660089,"Município de Ouro Prêto: city of Ouro Prêto, northeastern outskirts, Rua Antonio Pereira.","BRA",NA,1965,"PRESERVED_SPECIMEN","GEODETIC_DATUM_ASSUMED_WGS84"
-61.41,6,"Dichanthelium sciurotoides",1456159425,"Gran Sabana, entre Piedra de la Virgen y la parte alta de la Escalera, carretera a la Gran Sabana","VEN",NA,1989,"PRESERVED_SPECIMEN","GEODETIC_DATUM_ASSUMED_WGS84"
-83.95833,14.74166,"Dichanthelium sciurotoides",4060966966,"Between Waspam and Ulwás; brushy area along a creek","NIC",NA,1970,"PRESERVED_SPECIMEN","GEODETIC_DATUM_ASSUMED_WGS84;INSTITUTION_MATCH_NONE"
-61.45,5.83,"Dichanthelium sciurotoides",1456337299,"Gran Sabana, 12 km N de La Ciudadela","VEN",NA,1989,"PRESERVED_SPECIMEN","GEODETIC_DATUM_ASSUMED_WGS84"
-43.88925,-19.443639,"Dichanthelium sciurotoides",4037875338,"Serra do Cipó, Parque Nacional da Serra do Cipó, nas proximidades da Portaria Alto Palácio.","BRA",NA,2021,"PRESERVED_SPECIMEN","GEODETIC_DATUM_ASSUMED_WGS84;AMBIGUOUS_INSTITUTION"
-40.049278,-16.413889,"Dichanthelium sciurotoides",1087631441,"Fazenda Duas Barras","BRA",NA,2004,"PRESERVED_SPECIMEN","GEODETIC_DATUM_ASSUMED_WGS84;AMBIGUOUS_INSTITUTION"
-43.791822,-20.182717,"Dichanthelium sciurotoides",1935008988,"RPPN Santuário do Caraça, Trilha para o Pico do Sol","BRA",NA,2010,"PRESERVED_SPECIMEN","GEODETIC_DATUM_ASSUMED_WGS84;AMBIGUOUS_INSTITUTION"
-61.48333,4.68333,"Dichanthelium sciurotoides",1259436420,"Along road from Icarabú to Santa Elena, 70 km north of Icabarú; in forest.","VEN",NA,1982,"PRESERVED_SPECIMEN","OCCURRENCE_STATUS_INFERRED_FROM_INDIVIDUAL_COUNT;GEODETIC_DATUM_ASSUMED_WGS84;INSTITUTION_MATCH_FUZZY;COLLECTION_MATCH_NONE"
-37.416667,-10.539444,"Dichanthelium sciurotoides",2464813472,"","BRA",NA,2014,"PRESERVED_SPECIMEN","GEODETIC_DATUM_ASSUMED_WGS84;INSTITUTION_MATCH_NONE"
-38.55,-12.666667,"Dichanthelium sciurotoides",1077179730,"Região Metropolitana Salvador","BRA",NA,1974,"PRESERVED_SPECIMEN","GEODETIC_DATUM_ASSUMED_WGS84;INSTITUTION_MATCH_FUZZY;INSTITUTION_COLLECTION_MISMATCH"
-40.530278,-19.971389,"Dichanthelium sciurotoides",1123784233,"Estação Biológica de Santa Lúcia","BRA",NA,1985,"PRESERVED_SPECIMEN","GEODETIC_DATUM_ASSUMED_WGS84;CONTINENT_DERIVED_FROM_COORDINATES;DIFFERENT_OWNER_INSTITUTION"
-41.101944,-20.5275,"Dichanthelium sciurotoides",1123821990,"Parque Estadual do Forno Grande. Trilha da Balança.","BRA",NA,2008,"PRESERVED_SPECIMEN","GEODETIC_DATUM_ASSUMED_WGS84;CONTINENT_DERIVED_FROM_COORDINATES;DIFFERENT_OWNER_INSTITUTION"
-37.966667,-12.166667,"Dichanthelium sciurotoides",3990978365,"Algodão","BRA",NA,2014,"PRESERVED_SPECIMEN","COORDINATE_ROUNDED;GEODETIC_DATUM_ASSUMED_WGS84;CONTINENT_DERIVED_FROM_COORDINATES;INSTITUTION_MATCH_NONE"
-37.940742,-11.607408,"Dichanthelium sciurotoides",4007830348,"Algodão","BRA",NA,2014,"PRESERVED_SPECIMEN","GEODETIC_DATUM_ASSUMED_WGS84;CONTINENT_DERIVED_FROM_COORDINATES;INSTITUTION_MATCH_NONE"
-59.5,5.15,"Dichanthelium sciurotoides",1455951303,"Potaro River, ca. 4 mi. above Kaieteur Falls","GUY",NA,1962,"PRESERVED_SPECIMEN","GEODETIC_DATUM_ASSUMED_WGS84"
-42.396944,-9.738055,"Dichanthelium sciurotoides",1424331292,"Caminho para Pau Ferro, entrada à esquerda para subir a serra.","BRA",NA,2000,"PRESERVED_SPECIMEN","COORDINATE_ROUNDED;GEODETIC_DATUM_ASSUMED_WGS84;CONTINENT_DERIVED_FROM_COORDINATES;INSTITUTION_MATCH_FUZZY;COLLECTION_MATCH_FUZZY"
-47.8875,-24.622778,"Dichanthelium sciurotoides",2452873762,"Estação Experimental do Instituto Agronômico de Campinas. Beira da rodovia Régis Bittencourt","BRA",NA,1994,"PRESERVED_SPECIMEN","GEODETIC_DATUM_ASSUMED_WGS84;CONTINENT_DERIVED_FROM_COORDINATES;INSTITUTION_MATCH_NONE"
-68.58333,10.2,"Dichanthelium sciurotoides",4061719454,"Distrito Nirgua and Distrito San Felipe border; Cerro La Chapa, 7 km N of Nirgua by road. Cloud forest.","VEN",NA,1982,"PRESERVED_SPECIMEN","GEODETIC_DATUM_ASSUMED_WGS84;INSTITUTION_MATCH_NONE"
-53.33,3.58,"Dichanthelium sciurotoides",1456223947,"Mont Galbao. Secteur Sud. Versant Nord","GUF",NA,1986,"PRESERVED_SPECIMEN","GEODETIC_DATUM_ASSUMED_WGS84"
-37.25,-10.322222,"Dichanthelium sciurotoides",2995795899,"","BRA",NA,2014,"PRESERVED_SPECIMEN","COORDINATE_ROUNDED;GEODETIC_DATUM_ASSUMED_WGS84;CONTINENT_DERIVED_FROM_COORDINATES;INSTITUTION_MATCH_FUZZY;COLLECTION_MATCH_FUZZY"
-39.533333,-12.75,"Dichanthelium sciurotoides",1094841728,"Serra da Jibóia. Serra da Pioneira.","BRA",NA,2007,"PRESERVED_SPECIMEN","GEODETIC_DATUM_ASSUMED_WGS84;CONTINENT_DERIVED_FROM_COORDINATES;DIFFERENT_OWNER_INSTITUTION"
-43.966667,-23.05,"Dichanthelium sciurotoides",1094898554,"Ilha da Marambaia, trilha da Senzala, área parcialmente sombreada de solo argiloso, na margem da trilha.","BRA",NA,2011,"PRESERVED_SPECIMEN","GEODETIC_DATUM_ASSUMED_WGS84;CONTINENT_DERIVED_FROM_COORDINATES;DIFFERENT_OWNER_INSTITUTION"
-40.414722,-13.410833,"Dichanthelium sciurotoides",1094859812,"Ca. De 2 km do Cruzeiro, estrada a esquerda da 1ª bifurcação.","BRA",NA,2008,"PRESERVED_SPECIMEN","GEODETIC_DATUM_ASSUMED_WGS84;CONTINENT_DERIVED_FROM_COORDINATES;DIFFERENT_OWNER_INSTITUTION"
-41.434444,-12.465556,"Dichanthelium sciurotoides",1993827528,"Mucugezinho, na base da descida da pista para o rio","BRA",NA,2018,"PRESERVED_SPECIMEN","GEODETIC_DATUM_ASSUMED_WGS84;CONTINENT_DERIVED_FROM_COORDINATES;DIFFERENT_OWNER_INSTITUTION"
-39.116667,-13.816667,"Dichanthelium sciurotoides",1094862726,"Reserva Ecológica da Michelin. Vila 5.","BRA",NA,2008,"PRESERVED_SPECIMEN","GEODETIC_DATUM_ASSUMED_WGS84;CONTINENT_DERIVED_FROM_COORDINATES;DIFFERENT_OWNER_INSTITUTION"
-41.509167,-12.730833,"Dichanthelium sciurotoides",1094898323,"Serra do Esbarrancado.","BRA",NA,2011,"PRESERVED_SPECIMEN","GEODETIC_DATUM_ASSUMED_WGS84;CONTINENT_DERIVED_FROM_COORDINATES;DIFFERENT_OWNER_INSTITUTION"
-39.194722,-13.816111,"Dichanthelium sciurotoides",1094921818,"Reserva Ecológica da Michelin. Região alagada.","BRA",NA,2012,"PRESERVED_SPECIMEN","GEODETIC_DATUM_ASSUMED_WGS84;CONTINENT_DERIVED_FROM_COORDINATES;DIFFERENT_OWNER_INSTITUTION"
-39.484444,-12.846944,"Dichanthelium sciurotoides",1270106895,"Estrada para o Morro da Antena.","BRA",NA,2015,"PRESERVED_SPECIMEN","GEODETIC_DATUM_ASSUMED_WGS84;CONTINENT_DERIVED_FROM_COORDINATES;DIFFERENT_OWNER_INSTITUTION"
-38.996667,-14.2775,"Dichanthelium sciurotoides",1094898448,"Na estrada para Ilhéus, cachoeira de Tijuípe. Mata Atlântica, trilha para a cachoeira.","BRA",NA,2012,"PRESERVED_SPECIMEN","GEODETIC_DATUM_ASSUMED_WGS84;CONTINENT_DERIVED_FROM_COORDINATES;DIFFERENT_OWNER_INSTITUTION"
-40.961944,-11.664444,"Dichanthelium sciurotoides",1094849972,"Rio Ventura.","BRA",NA,2007,"PRESERVED_SPECIMEN","GEODETIC_DATUM_ASSUMED_WGS84;CONTINENT_DERIVED_FROM_COORDINATES;DIFFERENT_OWNER_INSTITUTION"
-39.456667,-13.905833,"Dichanthelium sciurotoides",1094898423,"APA de Pratigi, Serra da Papuã. Mata Atlântica em regeneração.","BRA",NA,2011,"PRESERVED_SPECIMEN","GEODETIC_DATUM_ASSUMED_WGS84;CONTINENT_DERIVED_FROM_COORDINATES;DIFFERENT_OWNER_INSTITUTION"
-41.633333,-12.45,"Dichanthelium sciurotoides",1094758966,"Catolés Catolés: Mata do Curião","BRA",NA,1999,"PRESERVED_SPECIMEN","GEODETIC_DATUM_ASSUMED_WGS84;CONTINENT_DERIVED_FROM_COORDINATES;DIFFERENT_OWNER_INSTITUTION"
-43.503475,-20.357758,"Dichanthelium sciurotoides",3800677664,"Serra da Brígida","BRA",NA,2010,"PRESERVED_SPECIMEN","GEODETIC_DATUM_ASSUMED_WGS84;CONTINENT_DERIVED_FROM_COORDINATES;INSTITUTION_MATCH_NONE"
-43.869444,-20.613889,"Dichanthelium sciurotoides",3897213571,"Serra da Brígida","BRA",NA,2010,"PRESERVED_SPECIMEN","GEODETIC_DATUM_ASSUMED_WGS84;CONTINENT_DERIVED_FROM_COORDINATES;INSTITUTION_MATCH_NONE"
-43.58333,-18.41666,"Dichanthelium sciurotoides",1260203523,"Rodovia de Serro a Diamantina, 20 km despues de Serro, campo rupestre.","BRA",NA,1993,"PRESERVED_SPECIMEN","GEODETIC_DATUM_ASSUMED_WGS84;INSTITUTION_MATCH_FUZZY;COLLECTION_MATCH_NONE"
-61.21,7.61,"Dichanthelium sciurotoides",1456268840,"Cerro El Picacho and vicinity, E of Hato de Nuria, E of Miamo, Altiplanicie de Nuria; between Cerro Rancho Carata and Cerro El Picacho","VEN",NA,1961,"PRESERVED_SPECIMEN","GEODETIC_DATUM_ASSUMED_WGS84"
-69.63333,11.13333,"Dichanthelium sciurotoides",1259442502,"Serrania de San Luis: Along road between Curimagua and San Luis, on road to microwave station 6.1 km S of Curimagua, .7 km above turnoff to station.","VEN",NA,1993,"PRESERVED_SPECIMEN","OCCURRENCE_STATUS_INFERRED_FROM_INDIVIDUAL_COUNT;GEODETIC_DATUM_ASSUMED_WGS84;INSTITUTION_MATCH_FUZZY;COLLECTION_MATCH_NONE"
-48.5131,-26.0306,"Dichanthelium sciurotoides",1095320815,"km 9 BR 101 (a esquerda de quem vai para o Paraná). Lat. 26°03'06 S long. 48°51'31 W","BRA",NA,2005,"PRESERVED_SPECIMEN","GEODETIC_DATUM_ASSUMED_WGS84;CONTINENT_COORDINATE_MISMATCH;DIFFERENT_OWNER_INSTITUTION"
-45.459444,-22.668611,"Dichanthelium sciurotoides",4037828374,"Parque Estadual de Campos do Jordão","BRA",NA,2022,"PRESERVED_SPECIMEN","GEODETIC_DATUM_ASSUMED_WGS84;DIFFERENT_OWNER_INSTITUTION"
