"lon","lat","species","gbifID","locality","countryCode","coordinateUncertaintyInMeters","year","basisOfRecord","issue"
48.791389,-13.813611,"Dombeya rottleroides",4061319218,"Fragments of low-elevation humid evergreen forest, river Antsaharatsy, Tsaratanana RNI. Specimen preserved in alcohol.","MDG",NA,2000,"PRESERVED_SPECIMEN","OCCURRENCE_STATUS_INFERRED_FROM_INDIVIDUAL_COUNT;COORDINATE_ROUNDED;GEODETIC_DATUM_ASSUMED_WGS84;DIFFERENT_OWNER_INSTITUTION"
48.291111,-14.061111,"Dombeya rottleroides",4032112239,"Besinkara. Ambalafary, Andavakevana: premier cours d'eau sur le chemin du Bekolosy","MDG",NA,1995,"PRESERVED_SPECIMEN","OCCURRENCE_STATUS_INFERRED_FROM_INDIVIDUAL_COUNT;GEODETIC_DATUM_ASSUMED_WGS84;INSTITUTION_MATCH_FUZZY;COLLECTION_MATCH_NONE"
48.56166,-13.46694,"Dombeya rottleroides",1258526371,"Fiv. Ambanja. Forêt classée d'Ambato, village d'Ambodinambato, à 35 km au Nord d'Ambanja, au pied Sud du mont Ambato. Forêt dense humide et sempervirente du Domaine de Sambirano.","MDG",NA,1998,"PRESERVED_SPECIMEN","OCCURRENCE_STATUS_INFERRED_FROM_INDIVIDUAL_COUNT;GEODETIC_DATUM_ASSUMED_WGS84;INSTITUTION_MATCH_FUZZY;COLLECTION_MATCH_NONE"
48.096111,-13.765556,"Dombeya rottleroides",4031776278,"Ampasindava, foret de Bongomihiravavy. A 500 m au NE du camp Bekobila","MDG",NA,2012,"PRESERVED_SPECIMEN","OCCURRENCE_STATUS_INFERRED_FROM_INDIVIDUAL_COUNT;GEODETIC_DATUM_ASSUMED_WGS84;INSTITUTION_MATCH_FUZZY;COLLECTION_MATCH_NONE"
48.45,-13.933333,"Dombeya rottleroides",4061253116,"Ambahatra, cours moyen. Ambahatra, cours moyen, Antafia Be - Ambatolary","MDG",NA,1999,"PRESERVED_SPECIMEN","OCCURRENCE_STATUS_INFERRED_FROM_INDIVIDUAL_COUNT;GEODETIC_DATUM_ASSUMED_WGS84;DIFFERENT_OWNER_INSTITUTION"
48.316667,-13.4,"Dombeya rottleroides",1260923317,"Sambirano: Nossibé, forêt de Lokobé","MDG",NA,1966,"PRESERVED_SPECIMEN","OCCURRENCE_STATUS_INFERRED_FROM_INDIVIDUAL_COUNT;COORDINATE_ROUNDED;GEODETIC_DATUM_ASSUMED_WGS84;INSTITUTION_MATCH_FUZZY;COLLECTION_MATCH_NONE"
