"lon","lat","species","gbifID","locality","countryCode","coordinateUncertaintyInMeters","year","basisOfRecord","issue"
-81.8986,29.3707,"Echinochloa paludigena",1258119735,"east of Eureka, east side of the Ocklawaha River bridge on south side of C.R. 316, near parking area at public boat ramp.","USA",NA,2008,"PRESERVED_SPECIMEN","GEODETIC_DATUM_ASSUMED_WGS84;INSTITUTION_MATCH_FUZZY;COLLECTION_MATCH_NONE"
-82.40829,29.61367,"Echinochloa paludigena",1457744675,"","USA",NA,2004,"PRESERVED_SPECIMEN","CONTINENT_DERIVED_FROM_COORDINATES;INSTITUTION_MATCH_FUZZY;COLLECTION_MATCH_NONE"
-82.28622,27.24633,"Echinochloa paludigena",1457810196,"","USA",NA,2003,"PRESERVED_SPECIMEN","GEODETIC_DATUM_ASSUMED_WGS84;CONTINENT_DERIVED_FROM_COORDINATES;INSTITUTION_MATCH_FUZZY;COLLECTION_MATCH_NONE"
-81.14596,26.269147,"Echinochloa paludigena",4003194308,"","USA",NA,2021,"PRESERVED_SPECIMEN","GEODETIC_DATUM_ASSUMED_WGS84;CONTINENT_DERIVED_FROM_COORDINATES;INSTITUTION_MATCH_FUZZY;COLLECTION_MATCH_NONE"
-81.9794,26.9983,"Echinochloa paludigena",1503262207,"Prairie/Shell Creek (Southwest Florida Water Management District property); 1.6 km W of US 17, 0.35 km S of Royal Palm Drive.","USA",NA,2010,"PRESERVED_SPECIMEN","GEODETIC_DATUM_ASSUMED_WGS84;CONTINENT_DERIVED_FROM_COORDINATES;INSTITUTION_COLLECTION_MISMATCH"
-82.0223,26.449,"Echinochloa paludigena",1503181915,"Western Sanibel.","USA",NA,1974,"PRESERVED_SPECIMEN","GEODETIC_DATUM_ASSUMED_WGS84;CONTINENT_DERIVED_FROM_COORDINATES;INSTITUTION_COLLECTION_MISMATCH"
-81.9167,29.0333,"Echinochloa paludigena",1503215355,"Beneath the Oklawaha River bridge (Eureka Mountain) along C-316, just E of Eureka. T13S, R24E, Sec. 9, NW¼ of SE¼.","USA",NA,1985,"PRESERVED_SPECIMEN","GEODETIC_DATUM_ASSUMED_WGS84;CONTINENT_DERIVED_FROM_COORDINATES;INSTITUTION_COLLECTION_MISMATCH"
-81.1114,29.3489,"Echinochloa paludigena",1503259570,"Bulow Creek State Park, Ca. 2.5 km WNW of the Old Dixie Highway bridge over the Tomoka River.","USA",NA,2007,"PRESERVED_SPECIMEN","GEODETIC_DATUM_ASSUMED_WGS84;CONTINENT_DERIVED_FROM_COORDINATES;INSTITUTION_COLLECTION_MISMATCH"
-85.0667,30.7,"Echinochloa paludigena",1503303621,"Big Cypress; Miles City, E of FL 29; S off Cross State Turnpike.","USA",NA,1966,"PRESERVED_SPECIMEN","GEODETIC_DATUM_ASSUMED_WGS84;CONTINENT_DERIVED_FROM_COORDINATES;INSTITUTION_COLLECTION_MISMATCH"
-81.35,27.3667,"Echinochloa paludigena",1503296466,"Highlands Hammock State Park","USA",NA,1963,"PRESERVED_SPECIMEN","GEODETIC_DATUM_ASSUMED_WGS84;CONTINENT_DERIVED_FROM_COORDINATES;INSTITUTION_COLLECTION_MISMATCH"
-80.9337,26.7542,"Echinochloa paludigena",1503199439,"Along US 27, 0.3 mi. S of Glades Co. line; ca. 9 mi. W of Clewiston. T43S, R32E, Sec. 12, NE¼.","USA",NA,1981,"PRESERVED_SPECIMEN","GEODETIC_DATUM_ASSUMED_WGS84;CONTINENT_DERIVED_FROM_COORDINATES;INSTITUTION_COLLECTION_MISMATCH"
-81.4202,26.4194,"Echinochloa paludigena",1503307333,"E of Immokalee off FL 846.","USA",NA,1967,"PRESERVED_SPECIMEN","GEODETIC_DATUM_ASSUMED_WGS84;CONTINENT_DERIVED_FROM_COORDINATES;INSTITUTION_COLLECTION_MISMATCH"
-80.9586,28.47,"Echinochloa paludigena",1503272347,"Tosohatchee Wildlife Management Area, Ca. 25 mi. E of Orlando; Cedar Swamp Trail off Fish Hole Road.","USA",NA,2013,"PRESERVED_SPECIMEN","GEODETIC_DATUM_ASSUMED_WGS84;CONTINENT_DERIVED_FROM_COORDINATES;INSTITUTION_COLLECTION_MISMATCH"
-81.4892,25.8684,"Echinochloa paludigena",1503306883,"Scenic Drive NW of Copeland, off FL 29, vicinity of Fakahatchee, NE side of road.","USA",NA,1967,"PRESERVED_SPECIMEN","GEODETIC_DATUM_ASSUMED_WGS84;CONTINENT_DERIVED_FROM_COORDINATES;INSTITUTION_COLLECTION_MISMATCH"
-82.8231,29.0315,"Echinochloa paludigena",1503181647,"Yankeetown, Withlacoochee River.","USA",NA,1959,"PRESERVED_SPECIMEN","GEODETIC_DATUM_ASSUMED_WGS84;CONTINENT_DERIVED_FROM_COORDINATES;INSTITUTION_COLLECTION_MISMATCH"
-81.2,29.0833,"Echinochloa paludigena",1503215442,"Zinder Point, on W end of Hitchens Island, SE shore of Lake George; ca. 4 mi. NW of Volusia. T14s, R27E, Sec. 11.","USA",NA,1985,"PRESERVED_SPECIMEN","GEODETIC_DATUM_ASSUMED_WGS84;CONTINENT_DERIVED_FROM_COORDINATES;INSTITUTION_COLLECTION_MISMATCH"
-81.4833,26.1333,"Echinochloa paludigena",1503241549,"Collier-Seminole State Park, N of US 41; along service road. T51S, R27E, Sec. 26.","USA",NA,1998,"PRESERVED_SPECIMEN","GEODETIC_DATUM_ASSUMED_WGS84;CONTINENT_DERIVED_FROM_COORDINATES;INSTITUTION_COLLECTION_MISMATCH"
-82.3278,27.1175,"Echinochloa paludigena",1503253024,"Churchill Ranch, Part of Deer Prairie Creek Preserve, Border Road, ca. 2.3 km ENE of junction I-75 and C-777 (River Road). T39S, R20E, Sec. 5.","USA",NA,2007,"PRESERVED_SPECIMEN","GEODETIC_DATUM_ASSUMED_WGS84;CONTINENT_DERIVED_FROM_COORDINATES;INSTITUTION_COLLECTION_MISMATCH"
-81.290454,25.993437,"Echinochloa paludigena",3408159893,"","USA",4,2021,"HUMAN_OBSERVATION","COORDINATE_ROUNDED;CONTINENT_DERIVED_FROM_COORDINATES"
