"lon","lat","species","gbifID","locality","countryCode","coordinateUncertaintyInMeters","year","basisOfRecord","issue"
-78.72,-1.98,"Eragrostis condensata",1096750180,"Flora of Ecuador. Chimborazo. Km 22 Alausi-Riobamba, along road.","ECU",NA,1998,"PRESERVED_SPECIMEN","GEODETIC_DATUM_ASSUMED_WGS84;CONTINENT_DERIVED_FROM_COORDINATES;CONTINENT_INVALID;INSTITUTION_COLLECTION_MISMATCH"
-78.43,-1.38,"Eragrostis condensata",1260233527,"West of Banos where the bridge crosses the Río Chambo. Growing on dry, rocky slopes above the Río Chambo.","ECU",NA,1990,"PRESERVED_SPECIMEN","GEODETIC_DATUM_ASSUMED_WGS84;INSTITUTION_MATCH_FUZZY;COLLECTION_MATCH_NONE"
-78.5,0.08333,"Eragrostis condensata",1259003370,"Reserva Geobotánica del Puluhua. Sendero El Hospital-Manca Quito.","ECU",NA,1992,"PRESERVED_SPECIMEN","OCCURRENCE_STATUS_INFERRED_FROM_INDIVIDUAL_COUNT;GEODETIC_DATUM_ASSUMED_WGS84;INSTITUTION_MATCH_FUZZY;COLLECTION_MATCH_NONE"
-78.5,-1.50861,"Eragrostis condensata",4060974287,"San José de Chazo. Estepa espinosa Montano Bajo. Informantes: D. Olmedo & N. Carrasca.","ECU",NA,1991,"PRESERVED_SPECIMEN","OCCURRENCE_STATUS_INFERRED_FROM_INDIVIDUAL_COUNT;GEODETIC_DATUM_ASSUMED_WGS84;INSTITUTION_MATCH_NONE"
-78.73333,-2,"Eragrostis condensata",1259600643,"Arenales de Palmiras, ca 9 km N of Palmiras. Imiras, ca 9 km N of Palmiras.","ECU",NA,1992,"PRESERVED_SPECIMEN","GEODETIC_DATUM_ASSUMED_WGS84;DIFFERENT_OWNER_INSTITUTION"
-79.16666,-3.53333,"Eragrostis condensata",1259599549,"20 km S of Oña. Roadside.","ECU",NA,1984,"PRESERVED_SPECIMEN","GEODETIC_DATUM_ASSUMED_WGS84;DIFFERENT_OWNER_INSTITUTION"
-78.3,-0.25,"Eragrostis condensata",1259600389,"Pifo (road-junction to Ibarra) - Papallacta km 7.Roadside with some shrubs.","ECU",NA,1992,"PRESERVED_SPECIMEN","GEODETIC_DATUM_ASSUMED_WGS84;DIFFERENT_OWNER_INSTITUTION"
-78.88333,-2.9,"Eragrostis condensata",1259600867,"5 km along small road going E from the highway 10 km S of Cuenca Center. Dry scrub, grassland, cattle-trails.","ECU",NA,1992,"PRESERVED_SPECIMEN","GEODETIC_DATUM_ASSUMED_WGS84;DIFFERENT_OWNER_INSTITUTION"
-78.916,-1.616,"Eragrostis condensata",47765924,"Ca km 20 Guaranda - Riobamba. Roadbanks.","ECU",NA,1990,"PRESERVED_SPECIMEN","GEODETIC_DATUM_ASSUMED_WGS84;COORDINATE_PRECISION_INVALID;INSTITUTION_MATCH_FUZZY;INSTITUTION_COLLECTION_MISMATCH"
-79.016,-2.466,"Eragrostis condensata",47765728,"Near Zhud. Roadside.","ECU",NA,1984,"PRESERVED_SPECIMEN","GEODETIC_DATUM_ASSUMED_WGS84;COORDINATE_PRECISION_INVALID;INSTITUTION_MATCH_FUZZY;INSTITUTION_COLLECTION_MISMATCH"
-78.066667,-1.983333,"Eragrostis condensata",1260002766,"Km 22 Alausi-Riobamba, along road","ECU",NA,1998,"PRESERVED_SPECIMEN","OCCURRENCE_STATUS_INFERRED_FROM_INDIVIDUAL_COUNT;COORDINATE_ROUNDED;GEODETIC_DATUM_ASSUMED_WGS84;INSTITUTION_MATCH_FUZZY;COLLECTION_MATCH_NONE"
-77.66666,0.83333,"Eragrostis condensata",1260230216,"Vicinity of Hotel Rumichaca at border with Colombia. Slopes overlooking Río Carchi.","ECU",NA,1985,"PRESERVED_SPECIMEN","GEODETIC_DATUM_ASSUMED_WGS84;INSTITUTION_MATCH_FUZZY;COLLECTION_MATCH_NONE"
-79,-3.3,"Eragrostis condensata",1260233319,"71 km SW of Cuenca on road to Loja, 12 km N of Río León bridge. Growing on steep, dry roadside cliff with Baccharis, Cortaderia, & Stipa ichu.","ECU",NA,1990,"PRESERVED_SPECIMEN","GEODETIC_DATUM_ASSUMED_WGS84;INSTITUTION_MATCH_FUZZY;COLLECTION_MATCH_NONE"
