"lon","lat","species","gbifID","locality","countryCode","coordinateUncertaintyInMeters","year","basisOfRecord","issue"
-44.4044451,-19.2781957,"Eragrostis polytricha",1929795445,"Paraopeba","BRA",NA,1965,"PRESERVED_SPECIMEN","COORDINATE_REPROJECTED;COLLECTION_MATCH_FUZZY"
-55.78333,-27.76666,"Eragrostis polytricha",1259545287,"San José, Escuela Agrotécnica Pascual Gentilini","ARG",NA,1978,"PRESERVED_SPECIMEN","GEODETIC_DATUM_ASSUMED_WGS84;DIFFERENT_OWNER_INSTITUTION"
-51.833333,-26.95,"Eragrostis polytricha",2998249237,"Campo de Irani.","BRA",NA,1964,"PRESERVED_SPECIMEN","COORDINATE_ROUNDED;GEODETIC_DATUM_ASSUMED_WGS84;CONTINENT_DERIVED_FROM_COORDINATES;INSTITUTION_MATCH_FUZZY;COLLECTION_MATCH_FUZZY"
-47.966667,-23.583333,"Eragrostis polytricha",2998254109,"Sorocaba to Itapetininga.","BRA",NA,1965,"PRESERVED_SPECIMEN","RECORDED_DATE_INVALID;COORDINATE_ROUNDED;GEODETIC_DATUM_ASSUMED_WGS84;CONTINENT_DERIVED_FROM_COORDINATES;INSTITUTION_MATCH_FUZZY;COLLECTION_MATCH_FUZZY"
-51.783333,-17.2,"Eragrostis polytricha",2998541074,"Ca. 60km S of Caiaponia on road to Jataí.","BRA",NA,1964,"PRESERVED_SPECIMEN","COORDINATE_ROUNDED;GEODETIC_DATUM_ASSUMED_WGS84;CONTINENT_DERIVED_FROM_COORDINATES;INSTITUTION_MATCH_FUZZY;COLLECTION_MATCH_FUZZY"
-47.133333,-22.3,"Eragrostis polytricha",2998557156,"Along the road from Conchal to Padua Sales. 24km WNW of city of Moji-Mirim.","BRA",NA,1959,"PRESERVED_SPECIMEN","COORDINATE_ROUNDED;GEODETIC_DATUM_ASSUMED_WGS84;CONTINENT_DERIVED_FROM_COORDINATES;INSTITUTION_MATCH_FUZZY;COLLECTION_MATCH_FUZZY"
-54.466944,-21.675556,"Eragrostis polytricha",2237736178,"BR-163.","BRA",NA,2009,"PRESERVED_SPECIMEN","COORDINATE_ROUNDED;GEODETIC_DATUM_ASSUMED_WGS84;CONTINENT_DERIVED_FROM_COORDINATES;INSTITUTION_MATCH_FUZZY;INSTITUTION_COLLECTION_MISMATCH"
-54.705833,-20.431944,"Eragrostis polytricha",2237734475,"Embrapa Gado de Corte,Lagoão,cerca de 1km leste da sede.","BRA",NA,2006,"PRESERVED_SPECIMEN","COORDINATE_ROUNDED;GEODETIC_DATUM_ASSUMED_WGS84;CONTINENT_DERIVED_FROM_COORDINATES;INSTITUTION_MATCH_FUZZY;INSTITUTION_COLLECTION_MISMATCH"
-43.633139,-20.506111,"Eragrostis polytricha",1090848873,"Serra de Ouro Branco - Área 1, Campo graminoso quartzítico.","BRA",NA,2007,"PRESERVED_SPECIMEN","GEODETIC_DATUM_ASSUMED_WGS84;CONTINENT_DERIVED_FROM_COORDINATES;DIFFERENT_OWNER_INSTITUTION"
-43.674222,-20.501556,"Eragrostis polytricha",1090848852,"Serra de Ouro Branco - Área 2, Beira de estrada, alterada. Campo graminoso arenoso.","BRA",NA,2006,"PRESERVED_SPECIMEN","GEODETIC_DATUM_ASSUMED_WGS84;CONTINENT_DERIVED_FROM_COORDINATES;DIFFERENT_OWNER_INSTITUTION"
-43.719833,-20.480944,"Eragrostis polytricha",1090848851,"Serra de Ouro Branco - Área 3, Campo seco após a mata.","BRA",NA,2006,"PRESERVED_SPECIMEN","GEODETIC_DATUM_ASSUMED_WGS84;CONTINENT_DERIVED_FROM_COORDINATES;DIFFERENT_OWNER_INSTITUTION"
-62.45,7.46666,"Eragrostis polytricha",1259727453,"Distr. Piar: sabanas en los alrededores del Hato Terecay, aprox. 16 km al N de El Manteco.","VEN",NA,1982,"PRESERVED_SPECIMEN","GEODETIC_DATUM_ASSUMED_WGS84;INSTITUTION_MATCH_FUZZY;COLLECTION_MATCH_NONE"
-55.55,-27.28333,"Eragrostis polytricha",1258813668,"Dpto. San Ignacio, Teyú Cuaré, camino al paraje Payal. Campos, con vegetación arborea aislada, suelo rocoso","ARG",NA,1995,"PRESERVED_SPECIMEN","GEODETIC_DATUM_ASSUMED_WGS84;INSTITUTION_MATCH_FUZZY;COLLECTION_MATCH_NONE"
-39.05,-16.26666,"Eragrostis polytricha",1260297503,"Município de Santa Cruz de Cabrália. A 5 km a W de Sta. Cruz. Retinga.","BRA",NA,1979,"PRESERVED_SPECIMEN","GEODETIC_DATUM_ASSUMED_WGS84;INSTITUTION_MATCH_FUZZY;COLLECTION_MATCH_NONE"
-47.8,-15.71666,"Eragrostis polytricha",1260297747,"Lago Norte. Campo umido.","BRA",NA,1992,"PRESERVED_SPECIMEN","GEODETIC_DATUM_ASSUMED_WGS84;INSTITUTION_MATCH_FUZZY;COLLECTION_MATCH_NONE"
-51.991393,-26.4882834,"Eragrostis polytricha",1930819167,"15 km do trevo de Palmas p/ Br 153. Folha SG.22-YB. Ponto 43","BRA",NA,1981,"PRESERVED_SPECIMEN","COORDINATE_REPROJECTED;COLLECTION_MATCH_FUZZY"
-52.4166152,-25.4119671,"Eragrostis polytricha",1927867256,"Km.127","BRA",NA,1969,"PRESERVED_SPECIMEN","COORDINATE_REPROJECTED;COLLECTION_MATCH_FUZZY"
-49.998722,-25.236806,"Eragrostis polytricha",1090158632,"Fortaleza, Parque Estadual de Vila Velha","BRA",NA,2010,"PRESERVED_SPECIMEN","GEODETIC_DATUM_ASSUMED_WGS84;CONTINENT_DERIVED_FROM_COORDINATES;INSTITUTION_MATCH_NONE"
-64.5,-20.73333,"Eragrostis polytricha",4062176771,"Puca Pampa, Aproximadamente a 5 km de Puesto ganadero, en la parte NW del Río Alborniyoj. Bosque Tucumano-Bolivianom rico en Podocarpaceas, Poaceas, cyperaceas, Helechos y Musgos. Bajando hacia el río alborniyoj, suelo arenoso café-negro con contenido de materia orgánica, especie muy frecuente.","BOL",NA,2004,"PRESERVED_SPECIMEN","GEODETIC_DATUM_ASSUMED_WGS84;DIFFERENT_OWNER_INSTITUTION"
-49.0525,-24.073611,"Eragrostis polytricha",1291004451,"Estação Experimental de Itapeva","BRA",NA,1994,"PRESERVED_SPECIMEN","GEODETIC_DATUM_ASSUMED_WGS84;CONTINENT_DERIVED_FROM_COORDINATES;DIFFERENT_OWNER_INSTITUTION"
-47.460278,-20.247778,"Eragrostis polytricha",1291005862,"Parque Estadual das Furnas do Bom Jesus","BRA",NA,2003,"PRESERVED_SPECIMEN","GEODETIC_DATUM_ASSUMED_WGS84;CONTINENT_DERIVED_FROM_COORDINATES;DIFFERENT_OWNER_INSTITUTION"
-44.1,-21.4,"Eragrostis polytricha",1291003771,"","BRA",NA,1989,"PRESERVED_SPECIMEN","GEODETIC_DATUM_ASSUMED_WGS84;CONTINENT_DERIVED_FROM_COORDINATES;DIFFERENT_OWNER_INSTITUTION"
-43.322111,-18.165111,"Eragrostis polytricha",1291006093,"Parque Estadual do Rio Preto","BRA",NA,2007,"PRESERVED_SPECIMEN","GEODETIC_DATUM_ASSUMED_WGS84;CONTINENT_DERIVED_FROM_COORDINATES;DIFFERENT_OWNER_INSTITUTION"
-48.508889,-27.681111,"Eragrostis polytricha",2575903983,"Terreno no Loteamento Marinas do Campeche próximo à SC-405, Campeche, Ilha de Santa Catarina.","BRA",NA,2013,"PRESERVED_SPECIMEN","COORDINATE_ROUNDED;GEODETIC_DATUM_ASSUMED_WGS84;CONTINENT_DERIVED_FROM_COORDINATES;AMBIGUOUS_INSTITUTION"
-49.331389,-27.949444,"Eragrostis polytricha",2575897039,"Fazenda do Sr. Arno Philippe, proximidade da casa da Fazenda, Campo dos Padres.","BRA",NA,2006,"PRESERVED_SPECIMEN","COORDINATE_ROUNDED;GEODETIC_DATUM_ASSUMED_WGS84;CONTINENT_DERIVED_FROM_COORDINATES;AMBIGUOUS_INSTITUTION"
-51.585555,-26.513056,"Eragrostis polytricha",2575905542,"Refúgio de Vida Silvestre (REVIS) dos Campos de Palmas.","BRA",NA,2013,"PRESERVED_SPECIMEN","COORDINATE_ROUNDED;GEODETIC_DATUM_ASSUMED_WGS84;CONTINENT_DERIVED_FROM_COORDINATES;AMBIGUOUS_INSTITUTION"
-40.25,-10.3,"Eragrostis polytricha",1424325547,"Serra da Jacobina. West of Estiva, c. 12 km. N of Senhor do Bonfim on the BA 130 highway to Juazeiro. lower west facing slopes of serra with television mast. .","BRA",NA,1974,"PRESERVED_SPECIMEN","GEODETIC_DATUM_ASSUMED_WGS84;CONTINENT_DERIVED_FROM_COORDINATES;INSTITUTION_MATCH_FUZZY;COLLECTION_MATCH_FUZZY"
-46.564722,-21.838888,"Eragrostis polytricha",1265918964,"Campo do Saco.","BRA",NA,1980,"PRESERVED_SPECIMEN","OCCURRENCE_STATUS_INFERRED_FROM_INDIVIDUAL_COUNT;GEODETIC_DATUM_ASSUMED_WGS84;CONTINENT_DERIVED_FROM_COORDINATES;INSTITUTION_MATCH_NONE"
-49.205277,-24.268333,"Eragrostis polytricha",1265925489,"Unidade de Pesquisa e Desenvolimento de Itararé.","BRA",NA,2005,"PRESERVED_SPECIMEN","OCCURRENCE_STATUS_INFERRED_FROM_INDIVIDUAL_COUNT;GEODETIC_DATUM_ASSUMED_WGS84;CONTINENT_DERIVED_FROM_COORDINATES;INSTITUTION_MATCH_NONE"
-41.174166,-11.544444,"Eragrostis polytricha",3127349135,"2,3 km a oeste do acesso principal a Morro do Chapéu, na estrada de Salvador - Irecê.","BRA",NA,1987,"PRESERVED_SPECIMEN","OCCURRENCE_STATUS_INFERRED_FROM_INDIVIDUAL_COUNT;GEODETIC_DATUM_ASSUMED_WGS84;CONTINENT_DERIVED_FROM_COORDINATES;INSTITUTION_MATCH_NONE"
-48.80722,-15.80306,"Eragrostis polytricha",1265923401,"Condomínio Belo Horizonte, entrada para a Ermida Dom Bosco, ao lado da QL 28, lago sul.","BRA",NA,2001,"PRESERVED_SPECIMEN","OCCURRENCE_STATUS_INFERRED_FROM_INDIVIDUAL_COUNT;GEODETIC_DATUM_ASSUMED_WGS84;CONTINENT_DERIVED_FROM_COORDINATES;INSTITUTION_MATCH_NONE"
-47.998611,-15.6525,"Eragrostis polytricha",1265927786,"Parque Nacional de Brasília - Sentido portão CAESB, aproximadamente 5 km da barragem Santa Maria.","BRA",NA,2013,"PRESERVED_SPECIMEN","OCCURRENCE_STATUS_INFERRED_FROM_INDIVIDUAL_COUNT;GEODETIC_DATUM_ASSUMED_WGS84;CONTINENT_DERIVED_FROM_COORDINATES;INSTITUTION_MATCH_NONE"
-50.174444,-29.480833,"Eragrostis polytricha",1090603884,"CPCN Pró-Mata","BRA",NA,2003,"PRESERVED_SPECIMEN","OCCURRENCE_STATUS_INFERRED_FROM_INDIVIDUAL_COUNT;COORDINATE_ROUNDED;GEODETIC_DATUM_ASSUMED_WGS84;INSTITUTION_MATCH_NONE"
-48.888796,-25.118389,"Eragrostis polytricha",1929045636,"Bocaiuva do Sul","BRA",NA,1965,"PRESERVED_SPECIMEN","COLLECTION_MATCH_FUZZY"
-48.560275,-16.310278,"Eragrostis polytricha",1077587266,"Proximidades da Escola Fazendária.","BRA",NA,1981,"PRESERVED_SPECIMEN","GEODETIC_DATUM_ASSUMED_WGS84;CONTINENT_DERIVED_FROM_COORDINATES;DIFFERENT_OWNER_INSTITUTION"
-50.03,-28.17,"Eragrostis polytricha",3062075331,"Mun. São Joaquim: rocky campo, border of small woods, east of Rio Lava Todo.","BRA",NA,1975,"PRESERVED_SPECIMEN","GEODETIC_DATUM_ASSUMED_WGS84"
-99.084778,21.403028,"Eragrostis polytricha",1897368648,"Llano del Conejo","MEX",70,2000,"PRESERVED_SPECIMEN","TYPE_STATUS_INVALID;OCCURRENCE_STATUS_INFERRED_FROM_INDIVIDUAL_COUNT;COORDINATE_ROUNDED;GEODETIC_DATUM_ASSUMED_WGS84;CONTINENT_DERIVED_FROM_COORDINATES;ELEVATION_MIN_MAX_SWAPPED;INSTITUTION_MATCH_NONE"
-43.844722,-20.421667,"Eragrostis polytricha",1087182514,"Próximo a mina de fábrica","BRA",NA,2008,"PRESERVED_SPECIMEN","GEODETIC_DATUM_ASSUMED_WGS84;CONTINENT_DERIVED_FROM_COORDINATES;INSTITUTION_MATCH_NONE"
-62,-16.166667,"Eragrostis polytricha",2515838283,"Santa Cruz, Nuflo de Chavez, Concepción.","BOL",NA,1984,"PRESERVED_SPECIMEN","INSTITUTION_MATCH_FUZZY;INSTITUTION_COLLECTION_MISMATCH"
-91.85,16.42,"Eragrostis polytricha",4031468643,"6-10 km NNE of La Soledad along logging road from Las Margaritas to Campo Alegre.","MEX",NA,1981,"PRESERVED_SPECIMEN","OCCURRENCE_STATUS_INFERRED_FROM_INDIVIDUAL_COUNT;GEODETIC_DATUM_ASSUMED_WGS84;INSTITUTION_MATCH_FUZZY;COLLECTION_MATCH_NONE"
-47.6667,-15.57151,"Eragrostis polytricha",1927826211,"Brasília. Ca. 5 km N. of Planaltina, on road to São Gabriela","BRA",5000,1965,"PRESERVED_SPECIMEN","COLLECTION_MATCH_FUZZY"
-59.52,2.82,"Eragrostis polytricha",1928381135,"Rupununi. Dadanawa","GUY",NA,1995,"PRESERVED_SPECIMEN","GEODETIC_DATUM_ASSUMED_WGS84;COLLECTION_MATCH_FUZZY"
-51.4588489,-25.399472,"Eragrostis polytricha",1928443907,"Morro Grande","BRA",NA,1973,"PRESERVED_SPECIMEN","COORDINATE_REPROJECTED;COLLECTION_MATCH_FUZZY"
-52.398611,-28.227222,"Eragrostis polytricha",2996674675,"Universidade de Passo Fundo","BRA",NA,2010,"PRESERVED_SPECIMEN","RECORDED_DATE_INVALID;COORDINATE_ROUNDED;GEODETIC_DATUM_ASSUMED_WGS84;CONTINENT_DERIVED_FROM_COORDINATES;ELEVATION_MIN_MAX_SWAPPED;INSTITUTION_MATCH_FUZZY;COLLECTION_MATCH_FUZZY"
-56.693889,-21.285833,"Eragrostis polytricha",2996692366,"A_x0019__x0006_","BRA",NA,2005,"PRESERVED_SPECIMEN","RECORDED_DATE_INVALID;COORDINATE_ROUNDED;GEODETIC_DATUM_ASSUMED_WGS84;CONTINENT_DERIVED_FROM_COORDINATES;INSTITUTION_MATCH_FUZZY;COLLECTION_MATCH_FUZZY"
-50.0070484,-25.4332793,"Eragrostis polytricha",1930491676,"Rod. BR-277","BRA",NA,1981,"PRESERVED_SPECIMEN","COORDINATE_REPROJECTED;COLLECTION_MATCH_FUZZY"
-47.60183,-14.03362,"Eragrostis polytricha",1928648120,"Chapada dos Veadeiros, ca. 13 km N.W. of Veadeiros","BRA",5000,1965,"PRESERVED_SPECIMEN","COLLECTION_MATCH_FUZZY"
-64.283333,10.033333,"Eragrostis polytricha",1259727540,"Distrito Bolívar: Rocky mountain savanna, just S of El Zamuro, Fila El Purgatorio, 9 airline km NE of Bergantín.","VEN",NA,1981,"PRESERVED_SPECIMEN","OCCURRENCE_STATUS_INFERRED_FROM_INDIVIDUAL_COUNT;COORDINATE_ROUNDED;GEODETIC_DATUM_ASSUMED_WGS84;INSTITUTION_MATCH_FUZZY;COLLECTION_MATCH_NONE"
-73.033183,-37.716635,"Eragrostis polytricha",1928949643,"near southern boundary, Fundo Solano, Los Alpes, Cordillera de Nahuelbuta","CHL",NA,1958,"PRESERVED_SPECIMEN","GEODETIC_DATUM_ASSUMED_WGS84;COLLECTION_MATCH_FUZZY"
-48.0502045,-23.5941602,"Eragrostis polytricha",1930332003,"10 km. NE da vila Alambaia, km. 145 da estrada Sorocaba-Itapetininga (S.P. 4)","BRA",NA,1959,"PRESERVED_SPECIMEN","COORDINATE_REPROJECTED;COLLECTION_MATCH_FUZZY"
-52.33,-26.53,"Eragrostis polytricha",3062102374,"Mun. Abelardo Luz: Campo, 12 km north of Abelardo Luz.","BRA",NA,1964,"PRESERVED_SPECIMEN","GEODETIC_DATUM_ASSUMED_WGS84"
-92.7,16.75,"Eragrostis polytricha",1320603446,"Paréja Pasté","MEX",NA,1972,"PRESERVED_SPECIMEN","GEODETIC_DATUM_ASSUMED_WGS84"
-51.4,-26.75,"Eragrostis polytricha",3062110576,"Mun. Agua Doce: Campo, Campos de Palmas, 30 km. southeast of Horizonte.","BRA",NA,1964,"PRESERVED_SPECIMEN","GEODETIC_DATUM_ASSUMED_WGS84"
-48.440278,-22.880556,"Eragrostis polytricha",1090889243,"","BRA",NA,1971,"PRESERVED_SPECIMEN","GEODETIC_DATUM_ASSUMED_WGS84;CONTINENT_DERIVED_FROM_COORDINATES;INSTITUTION_MATCH_FUZZY;COLLECTION_MATCH_FUZZY"
-64.8922,-18.7017,"Eragrostis polytricha",3062105404,"Zudañez, A.N.M.I. El Palmar. Along trail from Thuruthuru towards El Palmar climbing above crossing of Rio Missiones.","BOL",NA,2007,"PRESERVED_SPECIMEN","GEODETIC_DATUM_ASSUMED_WGS84"
-62.08,-16.13,"Eragrostis polytricha",3062069615,"Nuflo de Chavez, Est. La Pachanga, 5km S of Concepción.","BOL",NA,1986,"PRESERVED_SPECIMEN","GEODETIC_DATUM_ASSUMED_WGS84"
-41.837139,-20.482167,"Eragrostis polytricha",1087647715,"Parque Nacional do Caparaó, Parque Nacional do Caparaó, entrada do ES, Caminho entre Macieira e Cachoeira do Aurélio.","BRA",NA,2010,"PRESERVED_SPECIMEN","GEODETIC_DATUM_ASSUMED_WGS84;AMBIGUOUS_INSTITUTION"
-44.675833,-20.091944,"Eragrostis polytricha",1455401127,"Serra do Rola Moça, Próximo a entrada do parque","BRA",NA,2015,"PRESERVED_SPECIMEN","GEODETIC_DATUM_ASSUMED_WGS84;AMBIGUOUS_INSTITUTION"
-43.883889,-20.095278,"Eragrostis polytricha",1949963636,"Rio do Peixe","BRA",NA,2015,"PRESERVED_SPECIMEN","GEODETIC_DATUM_ASSUMED_WGS84;AMBIGUOUS_INSTITUTION"
-46.678408,-23.342508,"Eragrostis polytricha",3900987733,"Parque Estadual do Juquery, Setor A, próximo à torre de observação","BRA",NA,2018,"PRESERVED_SPECIMEN","GEODETIC_DATUM_ASSUMED_WGS84;CONTINENT_DERIVED_FROM_COORDINATES;INSTITUTION_MATCH_NONE"
-96.3837,16.8526,"Eragrostis polytricha",1988879299,"El Calvarío; just S of Matatlán on road to microwave tower","MEX",NA,1972,"PRESERVED_SPECIMEN","GEODETIC_DATUM_ASSUMED_WGS84"
-46.483333,-20.235278,"Eragrostis polytricha",1931778603,"Parque Naciona da Serra da Canastra","BRA",NA,2013,"PRESERVED_SPECIMEN","GEODETIC_DATUM_ASSUMED_WGS84;CONTINENT_DERIVED_FROM_COORDINATES;DIFFERENT_OWNER_INSTITUTION"
-50.4,-27.88,"Eragrostis polytricha",3062103313,"Mun. Lajes: flooded campo, north of Rio Caveiras on main road south.","BRA",NA,1975,"PRESERVED_SPECIMEN","GEODETIC_DATUM_ASSUMED_WGS84"
-48.135556,-18.011944,"Eragrostis polytricha",1090720170,"Fazenda do Chapéu. Cerrado.","BRA",NA,2004,"PRESERVED_SPECIMEN","GEODETIC_DATUM_ASSUMED_WGS84;CONTINENT_DERIVED_FROM_COORDINATES;INSTITUTION_MATCH_FUZZY;COLLECTION_MATCH_FUZZY"
-44.016667,-20.05,"Eragrostis polytricha",2995893665,"Sa. do Rola-Moça","BRA",NA,2001,"PRESERVED_SPECIMEN","COORDINATE_ROUNDED;GEODETIC_DATUM_ASSUMED_WGS84;CONTINENT_DERIVED_FROM_COORDINATES;INSTITUTION_MATCH_FUZZY;COLLECTION_MATCH_FUZZY"
-47.423056,-15.353056,"Eragrostis polytricha",1213532079,"CPAC - Chapada.","BRA",NA,1983,"PRESERVED_SPECIMEN","COORDINATE_ROUNDED;GEODETIC_DATUM_ASSUMED_WGS84;CONTINENT_DERIVED_FROM_COORDINATES;INSTITUTION_MATCH_NONE"
-73.0167,-37.9,"Eragrostis polytricha",1936640999,"IX Región. Prov. Malleco. Camino hacia el Parque Nacional Nahuelbuta, San Ramón, sector El Molino.","CHL",NA,1997,"PRESERVED_SPECIMEN","GEODETIC_DATUM_ASSUMED_WGS84;CONTINENT_DERIVED_FROM_COORDINATES;INSTITUTION_MATCH_FUZZY;COLLECTION_MATCH_FUZZY"
-96.4906,17.4397,"Eragrostis polytricha",1989104539,"Llano de las Flores; 12 km N of Ixtlán de Juárez on the road to Valle Nacional, along route 175.","MEX",NA,1959,"PRESERVED_SPECIMEN","GEODETIC_DATUM_ASSUMED_WGS84"
-51.5565661,-27.0019923,"Eragrostis polytricha",1930529917,"7 km south of turn to the south in road east of Palmas","BRA",NA,1971,"PRESERVED_SPECIMEN","COORDINATE_REPROJECTED;COLLECTION_MATCH_FUZZY"
-62,-16.16666,"Eragrostis polytricha",1260298664,"Concepción. Eroded tertiary planation surface overlying precambriam shield; mosaic of semideciduous forest, wooded savanna and savanna wetlands.","BOL",NA,1985,"PRESERVED_SPECIMEN","GEODETIC_DATUM_ASSUMED_WGS84;INSTITUTION_MATCH_FUZZY;COLLECTION_MATCH_NONE"
-63.143899,-17.649523,"Eragrostis polytricha",1258214875,"Pampa de Viru-Viru a 17 km al N de ciudad Sta. Cruz, Aeropuerto Int. Viru-Viru, zona N. Sabana con islas de bosque, sartenejales y quemas frecuentes. Suelos arenosos.","BOL",NA,1994,"PRESERVED_SPECIMEN","OCCURRENCE_STATUS_INFERRED_FROM_INDIVIDUAL_COUNT;GEODETIC_DATUM_ASSUMED_WGS84;DIFFERENT_OWNER_INSTITUTION"
-82.3879,28.5553,"Eragrostis polytricha",1503247116,"Lake Lindsay Cemetery on FL 476 (Lake Lindsey Road), ca. 6 mi. N of Brooksville.","USA",NA,2004,"PRESERVED_SPECIMEN","GEODETIC_DATUM_ASSUMED_WGS84;CONTINENT_DERIVED_FROM_COORDINATES;INSTITUTION_COLLECTION_MISMATCH"
-47.2667,-19.3833,"Eragrostis polytricha",1828868593,"Rio dos Perdizes.","BRA",NA,1968,"PRESERVED_SPECIMEN","GEODETIC_DATUM_ASSUMED_WGS84;CONTINENT_DERIVED_FROM_COORDINATES;INSTITUTION_COLLECTION_MISMATCH"
-49.93,-28.33,"Eragrostis polytricha",3062107474,"Mun. São Joaquim: Brook bank and pasture, near Encruzilhada de Boava, 7 km south of São Joaquim.","BRA",NA,1965,"PRESERVED_SPECIMEN","GEODETIC_DATUM_ASSUMED_WGS84"
-49.3317,-24.1125,"Eragrostis polytricha",1090576599,"Unidade de Pesquisa e Desenvolvimento de Itararé","BRA",NA,2005,"PRESERVED_SPECIMEN","GEODETIC_DATUM_ASSUMED_WGS84;CONTINENT_DERIVED_FROM_COORDINATES;INSTITUTION_MATCH_FUZZY;COLLECTION_MATCH_FUZZY"
-43.7467,-21.3181,"Eragrostis polytricha",1090560192,"Fazenda da Borda do Campo","BRA",NA,1988,"PRESERVED_SPECIMEN","GEODETIC_DATUM_ASSUMED_WGS84;CONTINENT_DERIVED_FROM_COORDINATES;INSTITUTION_MATCH_FUZZY;COLLECTION_MATCH_FUZZY"
-48.41666,-22.75,"Eragrostis polytricha",1260299031,"Municipio de Botucatu: 18 km north of Botucatu, (14 km east of São Manuel). Along the S. Manuel-Piracicaba highway. Near ex-RR station, 13 de Maio. Cerrado vegetation xeromorphie tree & scrub woodland form, on gentle slope.","BRA",NA,1971,"PRESERVED_SPECIMEN","GEODETIC_DATUM_ASSUMED_WGS84;INSTITUTION_MATCH_FUZZY;COLLECTION_MATCH_NONE"
-64.3025,-19.15055,"Eragrostis polytricha",1260208114,"Comunidad Huerta Mayu, 3 Km al S de la localidad de V. Serrano. Cima de serranía Llantha apana; suelos arcillosos.","BOL",NA,1994,"PRESERVED_SPECIMEN","GEODETIC_DATUM_ASSUMED_WGS84;INSTITUTION_MATCH_FUZZY;COLLECTION_MATCH_NONE"
-86.96611,14.49638,"Eragrostis polytricha",4031469626,"Along Hwy. 3, between Guiamaca and Talanga. Pine forests","HND",NA,1978,"PRESERVED_SPECIMEN","GEODETIC_DATUM_ASSUMED_WGS84;INSTITUTION_MATCH_FUZZY;COLLECTION_MATCH_NONE"
-63.25,-17.95,"Eragrostis polytricha",1258396795,"On road to lSanta Cruz to LCamiri, 1 km N of Pedro Lorenzo. Sandy roadside and grazed brushy savannas on sand, with Acrocomia totai, etc.","BOL",NA,1992,"PRESERVED_SPECIMEN","OCCURRENCE_STATUS_INFERRED_FROM_INDIVIDUAL_COUNT;GEODETIC_DATUM_ASSUMED_WGS84;INSTITUTION_MATCH_FUZZY;COLLECTION_MATCH_NONE"
-49.236944,-22.791667,"Eragrostis polytricha",1435461393,"campo cerrado. Estação Ecológica de Santa Bárbara","BRA",NA,2014,"PRESERVED_SPECIMEN","COORDINATE_ROUNDED;GEODETIC_DATUM_ASSUMED_WGS84;CONTINENT_DERIVED_FROM_COORDINATES;INSTITUTION_MATCH_FUZZY;COLLECTION_MATCH_FUZZY"
-48.954444,-26.039167,"Eragrostis polytricha",2996109254,"Alto Quiriri.","BRA",NA,2015,"PRESERVED_SPECIMEN","COORDINATE_ROUNDED;GEODETIC_DATUM_ASSUMED_WGS84;CONTINENT_DERIVED_FROM_COORDINATES;INSTITUTION_MATCH_FUZZY;COLLECTION_MATCH_FUZZY"
-55.76666,-27.91666,"Eragrostis polytricha",1259545333,"Apóstoles, Ruta 14","ARG",NA,1978,"PRESERVED_SPECIMEN","GEODETIC_DATUM_ASSUMED_WGS84;DIFFERENT_OWNER_INSTITUTION"
-87.851944,14.585556,"Eragrostis polytricha",1258951556,"Pinewoods around Escuela Nacional de Ciencias Forestales, Siguatepeque","HND",NA,1972,"PRESERVED_SPECIMEN","OCCURRENCE_STATUS_INFERRED_FROM_INDIVIDUAL_COUNT;COORDINATE_ROUNDED;GEODETIC_DATUM_ASSUMED_WGS84;INSTITUTION_MATCH_FUZZY;COLLECTION_MATCH_NONE"
-86.72944,14.06194,"Eragrostis polytricha",1258951578,"Along Hwy 4, 23 km W of Danli. Open pine savanna on a hill","HND",NA,1971,"PRESERVED_SPECIMEN","GEODETIC_DATUM_ASSUMED_WGS84;INSTITUTION_MATCH_FUZZY;COLLECTION_MATCH_NONE"
-59.151389,-0.441389,"Eragrostis polytricha",2302426018,"Igarapé Água Boa; campo da fazenda Bom Intento.","BRA",NA,1951,"PRESERVED_SPECIMEN","COORDINATE_ROUNDED;GEODETIC_DATUM_ASSUMED_WGS84;CONTINENT_DERIVED_FROM_COORDINATES;INSTITUTION_MATCH_FUZZY;COLLECTION_MATCH_FUZZY"
-40.3042,-20.2767,"Eragrostis polytricha",3920702398,"Campus da UFES, Goiabeiras","BRA",NA,1987,"PRESERVED_SPECIMEN","GEODETIC_DATUM_ASSUMED_WGS84;CONTINENT_DERIVED_FROM_COORDINATES;INSTITUTION_MATCH_NONE"
-64.1,10.05,"Eragrostis polytricha",3062051712,"Distrito Freites: Burro trail between San Durrial and Los Pajaritos, 30 airline km ENE of Bergantín and N of Mundo Nuevo.","VEN",NA,1981,"PRESERVED_SPECIMEN","GEODETIC_DATUM_ASSUMED_WGS84"
-41.514722,-12.438333,"Eragrostis polytricha",1094879206,"Próximo ao povoado de Campo São João, Chapada Diamantina.","BRA",NA,2010,"PRESERVED_SPECIMEN","GEODETIC_DATUM_ASSUMED_WGS84;CONTINENT_DERIVED_FROM_COORDINATES;DIFFERENT_OWNER_INSTITUTION"
-41.061667,-11.583333,"Eragrostis polytricha",1094836458,"ca. 15 km de Morro do Chapéu, Na BA 052, em direção a Mundo Novo.","BRA",NA,2007,"PRESERVED_SPECIMEN","GEODETIC_DATUM_ASSUMED_WGS84;CONTINENT_DERIVED_FROM_COORDINATES;DIFFERENT_OWNER_INSTITUTION"
-51.555833,-26.998056,"Eragrostis polytricha",2998007485,"7 km south of turn to the south in road east of Palmas","BRA",NA,1971,"PRESERVED_SPECIMEN","RECORDED_DATE_INVALID;COORDINATE_ROUNDED;GEODETIC_DATUM_ASSUMED_WGS84;CONTINENT_DERIVED_FROM_COORDINATES;INSTITUTION_MATCH_FUZZY;COLLECTION_MATCH_FUZZY"
-40.420833,-20.605556,"Eragrostis polytricha",3971162328,"Trilha do Alagado. Parque Estadual Paulo César Vinha","BRA",NA,2021,"PRESERVED_SPECIMEN","COORDINATE_ROUNDED;GEODETIC_DATUM_ASSUMED_WGS84;CONTINENT_DERIVED_FROM_COORDINATES;INSTITUTION_MATCH_NONE"
-48.6,-16.65,"Eragrostis polytricha",1424325507,"Cerrado situado a 400 metros da sede da Estação Florestal Experimental (EFLEX) de Silvânia.","BRA",NA,1989,"PRESERVED_SPECIMEN","GEODETIC_DATUM_ASSUMED_WGS84;CONTINENT_DERIVED_FROM_COORDINATES;INSTITUTION_MATCH_FUZZY;COLLECTION_MATCH_FUZZY"
-48.613611,-28.023889,"Eragrostis polytricha",2996468236,"Siriú.","BRA",NA,1970,"PRESERVED_SPECIMEN","COORDINATE_ROUNDED;GEODETIC_DATUM_ASSUMED_WGS84;CONTINENT_DERIVED_FROM_COORDINATES;INSTITUTION_MATCH_FUZZY;COLLECTION_MATCH_FUZZY"
-48.25,-22.45,"Eragrostis polytricha",2996877115,"18km north of Botucatu, (14km east of São Manuel)","BRA",NA,1971,"PRESERVED_SPECIMEN","RECORDED_DATE_INVALID;GEODETIC_DATUM_ASSUMED_WGS84;CONTINENT_DERIVED_FROM_COORDINATES;ELEVATION_MIN_MAX_SWAPPED;INSTITUTION_MATCH_FUZZY;COLLECTION_MATCH_FUZZY"
-46.38,-23.36,"Eragrostis polytricha",2996877122,"Parque do Estado (on old maps Parque de Agua Funda), grounds of the Instituto de Botânica. 10 km south and 0,8-1,0 km east of center of São Paulo (Praça da Sé).","BRA",NA,1963,"PRESERVED_SPECIMEN","RECORDED_DATE_INVALID;COORDINATE_ROUNDED;GEODETIC_DATUM_ASSUMED_WGS84;CONTINENT_DERIVED_FROM_COORDINATES;INSTITUTION_MATCH_FUZZY;COLLECTION_MATCH_FUZZY"
-47.595556,-15.390833,"Eragrostis polytricha",2996887815,"Parque Nacional de Brasília, Sentido portão CAESB, aproximadamente 5 Km da barragem Santa Maria,","BRA",NA,2013,"PRESERVED_SPECIMEN","RECORDED_DATE_INVALID;COORDINATE_ROUNDED;GEODETIC_DATUM_ASSUMED_WGS84;CONTINENT_DERIVED_FROM_COORDINATES;INSTITUTION_MATCH_FUZZY;COLLECTION_MATCH_FUZZY"
-41.0342,-11.35,"Eragrostis polytricha",1095337788,"ca. 15 km de Morro do Chapéu na BA 052 em direção a Mundo Novo 11°35'79 S 41°3'42 W","BRA",NA,2007,"PRESERVED_SPECIMEN","GEODETIC_DATUM_ASSUMED_WGS84;DIFFERENT_OWNER_INSTITUTION"
-43.3747,-20.3029,"Eragrostis polytricha",1095343195,"Serra do Ouro Branco área 1 20°30'29 1 S 43°37'47 3 W","BRA",NA,2007,"PRESERVED_SPECIMEN","GEODETIC_DATUM_ASSUMED_WGS84;DIFFERENT_OWNER_INSTITUTION"
-46.2834,-20.1251,"Eragrostis polytricha",1234553751,"Parque Nacional da Serra da Canastra","BRA",NA,2014,"PRESERVED_SPECIMEN","GEODETIC_DATUM_ASSUMED_WGS84;DIFFERENT_OWNER_INSTITUTION"
-49.1952,-27.5657,"Eragrostis polytricha",1095332700,"Campo dos Padres Fazenda do Sr. Arno Philippe proximidades da casa da Fazenda 27°56'96 S 49°19'88 W","BRA",NA,2006,"PRESERVED_SPECIMEN","GEODETIC_DATUM_ASSUMED_WGS84;DIFFERENT_OWNER_INSTITUTION"
-52.0652,-26.2007,"Eragrostis polytricha",1095315317,"perto Rio Chopin PR449","BRA",NA,2004,"PRESERVED_SPECIMEN","GEODETIC_DATUM_ASSUMED_WGS84;DIFFERENT_OWNER_INSTITUTION"
-46.74996,-15.8,"Eragrostis polytricha",1930851473,"Serra do Rio Preto. 25 km E. of Cabeceiras (ca. 4 km E. of Goiás-Minas Gerais border)","BRA",5000,1965,"PRESERVED_SPECIMEN","COLLECTION_MATCH_FUZZY"
-54.208056,-28.216944,"Eragrostis polytricha",3331976206,"Cerro do Tigre.","BRA",NA,2007,"PRESERVED_SPECIMEN","COORDINATE_ROUNDED;GEODETIC_DATUM_ASSUMED_WGS84;PRESUMED_NEGATED_LATITUDE;PRESUMED_NEGATED_LONGITUDE;CONTINENT_DERIVED_FROM_COORDINATES;INSTITUTION_MATCH_NONE"
-49.357972,-25.345136,"Eragrostis polytricha",3461560331,"Juruqui, morro ao lado do observatório astronômico","BRA",NA,2020,"PRESERVED_SPECIMEN","GEODETIC_DATUM_ASSUMED_WGS84;DIFFERENT_OWNER_INSTITUTION"
-50.478056,-29.047778,"Eragrostis polytricha",2382969196,"RS 020","BRA",NA,2016,"PRESERVED_SPECIMEN","GEODETIC_DATUM_ASSUMED_WGS84;CONTINENT_DERIVED_FROM_COORDINATES;INSTITUTION_MATCH_NONE"
