"lon","lat","species","gbifID","locality","countryCode","coordinateUncertaintyInMeters","year","basisOfRecord","issue"
-112.646896,37.272241,"Eriogonum subreniforme",1846530312,"Ca 1/2 mile south of Orderville.","USA",1589,1975,"PRESERVED_SPECIMEN","GEODETIC_DATUM_ASSUMED_WGS84;CONTINENT_DERIVED_FROM_COORDINATES;INSTITUTION_MATCH_FUZZY;COLLECTION_MATCH_NONE"
-109.151381,35.29579,"Eriogonum subreniforme",1846539906,"Navajo Nation.At dam ca 1 km ENE of Allentown.","USA",NA,2010,"PRESERVED_SPECIMEN","CONTINENT_DERIVED_FROM_COORDINATES;INSTITUTION_MATCH_FUZZY;COLLECTION_MATCH_NONE"
-111.831948,36.907281,"Eriogonum subreniforme",1846541238,"Paria Plateau, Sand Hills, at Lower Reservoir.","USA",NA,2011,"PRESERVED_SPECIMEN","GEODETIC_DATUM_ASSUMED_WGS84;CONTINENT_DERIVED_FROM_COORDINATES;INSTITUTION_MATCH_FUZZY;COLLECTION_MATCH_NONE"
-113.7805,37.19271,"Eriogonum subreniforme",1929803424,"Camp Spring","USA",NA,1986,"PRESERVED_SPECIMEN","GEODETIC_DATUM_ASSUMED_WGS84;COLLECTION_MATCH_FUZZY"
-112.1572,37.55848,"Eriogonum subreniforme",1928129287,"About 4 airline miles southwest of Cannonville, Sheep Creek drainage, Dixie National Forest, 7.7 miles up the Sheep Creek Road from the Cottonwood Wash Road, on low ridges 1/4 mile north of the road.","USA",NA,1967,"PRESERVED_SPECIMEN","GEODETIC_DATUM_ASSUMED_WGS84;COLLECTION_MATCH_FUZZY"
-109.71715,35.188304,"Eriogonum subreniforme",1930236196,"on silty flats of the Rio Puerco reached by Pinta Rd. off of US 66, about 16 mi. W of Chambers.","USA",NA,1973,"PRESERVED_SPECIMEN","COLLECTION_MATCH_FUZZY"
-113.43,37.16375,"Eriogonum subreniforme",1929040241,"Harrisburg Junction near mile post #1","USA",NA,1986,"PRESERVED_SPECIMEN","GEODETIC_DATUM_ASSUMED_WGS84;COLLECTION_MATCH_FUZZY"
-108.546747,35.449889,"Eriogonum subreniforme",1843853645,"Cibola National Forest; about 1.25 miles southwest of Fort Wingate, pediment fan above Bear Spring.","USA",8120,1995,"PRESERVED_SPECIMEN","CONTINENT_DERIVED_FROM_COORDINATES;INSTITUTION_MATCH_FUZZY;INSTITUTION_COLLECTION_MISMATCH"
-113.3747,37.23616,"Eriogonum subreniforme",1929351149,"Road between Leeds cemetery and Harrisbury.","USA",NA,1986,"PRESERVED_SPECIMEN","GEODETIC_DATUM_ASSUMED_WGS84;COLLECTION_MATCH_FUZZY"
-111.76,37.3294,"Eriogonum subreniforme",1929411488,"Cottonwood Canyon, 23 road miles southeast of Cannonville.","USA",5000,1966,"PRESERVED_SPECIMEN","COLLECTION_MATCH_FUZZY"
-113.026442,37.294612,"Eriogonum subreniforme",1929588627,"Ca. 1/4 mile south of Zion National Park.","USA",NA,1969,"PRESERVED_SPECIMEN","COLLECTION_MATCH_FUZZY"
-112.259,37.0581,"Eriogonum subreniforme",1986952488,"Grand Staircase; Vermilion Cliffs- toe slope at east base of Flag Point mesa, ca 0.5 miles W of Seaman Wash Road and ca 1.6 miles N of US Hwy 89, 4.2 miles N of the AZ state line.","USA",NA,2003,"PRESERVED_SPECIMEN","GEODETIC_DATUM_ASSUMED_WGS84;CONTINENT_DERIVED_FROM_COORDINATES;COLLECTION_MATCH_FUZZY"
-112.02394,37.03672,"Eriogonum subreniforme",1986982134,"Colorado Plateau: East flank of Buckskin Mountain, W of House Rocky Valley Road, ca 2.6 air miles N of the AZ state line, ca 1 mile N of Coyote Wash, Grand Staircase-Escalante National Monument.","USA",15,2008,"PRESERVED_SPECIMEN","GEODETIC_DATUM_ASSUMED_WGS84;CONTINENT_DERIVED_FROM_COORDINATES;COLLECTION_MATCH_FUZZY"
-111.976061,37.562761,"Eriogonum subreniforme",1928565438,"1 mile east of Henrieville on highway 54","USA",NA,1969,"PRESERVED_SPECIMEN","COLLECTION_MATCH_FUZZY"
-109.656659,35.068029,"Eriogonum subreniforme",2270606084,"Rio Puerco reached by Pinta Rd. off of US 66, about 16 miles west of Chambers.","USA",3000,1973,"PRESERVED_SPECIMEN","CONTINENT_DERIVED_FROM_COORDINATES;INSTITUTION_MATCH_FUZZY;INSTITUTION_COLLECTION_MISMATCH"
-112.71561,36.97557,"Eriogonum subreniforme",2270606151,"Between Moccasin and the Coral Pink sand dunes.","USA",4000,1972,"PRESERVED_SPECIMEN","CONTINENT_DERIVED_FROM_COORDINATES;INSTITUTION_MATCH_FUZZY;INSTITUTION_COLLECTION_MISMATCH"
-112.561097,37.013211,"Eriogonum subreniforme",2270570867,"Colorado Plateau: drainage bottom on south side of Vermilion Cliffs, SE of Bunting Mesa, ca 1.3 miles W of Kanab Creek, ca 1 mile N of AZ state line.","USA",NA,2013,"PRESERVED_SPECIMEN","GEODETIC_DATUM_ASSUMED_WGS84;CONTINENT_DERIVED_FROM_COORDINATES;INSTITUTION_MATCH_FUZZY;INSTITUTION_COLLECTION_MISMATCH"
-112.03,36.96,"Eriogonum subreniforme",1930016820,"On west side of Coyote Wash Coyote Valley, about 3 miles south of Utah border.","USA",NA,1978,"PRESERVED_SPECIMEN","GEODETIC_DATUM_ASSUMED_WGS84;COLLECTION_MATCH_FUZZY"
-113.274502,33.58792,"Eriogonum subreniforme",2265437075,"...road which goes south out of Chinle and through Beautiful Valley to Ganado; T3N, R10W, Sec. 22;Navaho Indian Reservation;003N;10W;22","USA",969,1971,"PRESERVED_SPECIMEN","GEODETIC_DATUM_ASSUMED_WGS84;CONTINENT_DERIVED_FROM_COORDINATES;AMBIGUOUS_COLLECTION"
-112.12,37.2,"Eriogonum subreniforme",1929823713,"Kitchen Corral Wash.","USA",NA,1999,"PRESERVED_SPECIMEN","GEODETIC_DATUM_ASSUMED_WGS84;COLLECTION_MATCH_FUZZY"
-113.763886,35.194006,"Eriogonum subreniforme",1930058869,"Head of Olsen Canyon","USA",NA,1969,"PRESERVED_SPECIMEN","COLLECTION_MATCH_FUZZY"
-110.046,35.2464,"Eriogonum subreniforme",3091226790,"20 mi W of St Highway 77, 6 mi N of Nav Res boundary.","USA",NA,1993,"PRESERVED_SPECIMEN","GEODETIC_DATUM_ASSUMED_WGS84;CONTINENT_DERIVED_FROM_COORDINATES;INSTITUTION_MATCH_FUZZY;COLLECTION_MATCH_NONE"
-111.857111,37.374028,"Eriogonum subreniforme",3091189516,"Cottonwood Canyon Road about 2/3 the distance from Hwy. 89 to Cannonville, Utah in Grand Staircase Escalante National Monument","USA",NA,2010,"PRESERVED_SPECIMEN","CONTINENT_DERIVED_FROM_COORDINATES;INSTITUTION_MATCH_FUZZY;COLLECTION_MATCH_NONE"
-110.603361,35.286427,"Eriogonum subreniforme",3091285070,"Navajo Nation; Arrowhead Butte NE quad. E of county line and 10 mi W of road","USA",6000,1991,"PRESERVED_SPECIMEN","CONTINENT_DERIVED_FROM_COORDINATES;INSTITUTION_MATCH_FUZZY;COLLECTION_MATCH_NONE"
-109.452073,35.711357,"Eriogonum subreniforme",3091232118,"5 mi W Ganado.","USA",2000,1973,"PRESERVED_SPECIMEN","CONTINENT_DERIVED_FROM_COORDINATES;INSTITUTION_MATCH_FUZZY;COLLECTION_MATCH_NONE"
-109.566653,35.7319,"Eriogonum subreniforme",3091232121,"2 mi NW Ganado-Round top Knob","USA",800,1977,"PRESERVED_SPECIMEN","CONTINENT_DERIVED_FROM_COORDINATES;INSTITUTION_MATCH_FUZZY;COLLECTION_MATCH_NONE"
-110.8332781,37.1179691,"Eriogonum subreniforme",3091293735,"On the lower north slopes of Navajo Mountain","USA",NA,2010,"PRESERVED_SPECIMEN","COORDINATE_REPROJECTED;CONTINENT_DERIVED_FROM_COORDINATES;INSTITUTION_MATCH_FUZZY;COLLECTION_MATCH_NONE"
-109.86667,36.275,"Eriogonum subreniforme",3091301754,"Black Mountain, W of Black Mountain Trading Post.","USA",2000,1952,"PRESERVED_SPECIMEN","CONTINENT_DERIVED_FROM_COORDINATES;INSTITUTION_MATCH_FUZZY;COLLECTION_MATCH_NONE"
-109.544,36.078,"Eriogonum subreniforme",3091215869,"Canyon de Chelly National Monument. S out of Chinle and through Beautiful Valley to Ganado","USA",NA,1971,"PRESERVED_SPECIMEN","GEODETIC_DATUM_ASSUMED_WGS84;CONTINENT_DERIVED_FROM_COORDINATES;INSTITUTION_MATCH_FUZZY;COLLECTION_MATCH_NONE"
-109.166962,35.297299,"Eriogonum subreniforme",3091285068,"Ca 1 km NW of Allentown.; 35.297299 -109.166962","USA",NA,2010,"PRESERVED_SPECIMEN","GEODETIC_DATUM_ASSUMED_WGS84;CONTINENT_DERIVED_FROM_COORDINATES;INSTITUTION_MATCH_FUZZY;COLLECTION_MATCH_NONE"
-109.273439,35.711093,"Eriogonum subreniforme",3091226787,"17 mi from Ganado.","USA",3000,1966,"PRESERVED_SPECIMEN","CONTINENT_DERIVED_FROM_COORDINATES;INSTITUTION_MATCH_FUZZY;COLLECTION_MATCH_NONE"
-112.494,37.02863,"Eriogonum subreniforme",1929902293,"Ca. 1 mile east of Kanab","USA",NA,1985,"PRESERVED_SPECIMEN","GEODETIC_DATUM_ASSUMED_WGS84;COLLECTION_MATCH_FUZZY"
-109.556667,35.993611,"Eriogonum subreniforme",1896061680,"11 mi. S of Chinle on limy soil, Hwy 63","USA",NA,1973,"PRESERVED_SPECIMEN","TYPE_STATUS_INVALID;OCCURRENCE_STATUS_INFERRED_FROM_INDIVIDUAL_COUNT;COORDINATE_ROUNDED;GEODETIC_DATUM_ASSUMED_WGS84;CONTINENT_DERIVED_FROM_COORDINATES;DIFFERENT_OWNER_INSTITUTION"
-104.6,34.4333,"Eriogonum subreniforme",2005998788,"16 mi. S Fort Sumner; bank of Yeso Arroyo.","USA",NA,1968,"PRESERVED_SPECIMEN","GEODETIC_DATUM_ASSUMED_WGS84;CONTINENT_DERIVED_FROM_COORDINATES;INSTITUTION_COLLECTION_MISMATCH"
-113.098,37.13478,"Eriogonum subreniforme",1929350754,"Northwest of Smithsonian Butte","USA",NA,1985,"PRESERVED_SPECIMEN","GEODETIC_DATUM_ASSUMED_WGS84;COLLECTION_MATCH_FUZZY"
-113.6514,37.1203,"Eriogonum subreniforme",1928634593,"Hills west of Santa Clara Reservoir","USA",NA,1988,"PRESERVED_SPECIMEN","GEODETIC_DATUM_ASSUMED_WGS84;COLLECTION_MATCH_FUZZY"
-112.8882,36.87935,"Eriogonum subreniforme",2270537075,"along Hwy 389, 22.2 mi. west of Fredonia, just east of Cedar Ridge, approx. 9 mi. west of Pipe Spring Natl. Mon., just south of Vermilion Cliffs","USA",NA,2013,"PRESERVED_SPECIMEN","CONTINENT_DERIVED_FROM_COORDINATES;INSTITUTION_MATCH_FUZZY;INSTITUTION_COLLECTION_MISMATCH"
-109.594972,38.687983,"Eriogonum subreniforme",2573411807,"Arches National Park, Moab Quadr.","USA",7000,1973,"PRESERVED_SPECIMEN","CONTINENT_DERIVED_FROM_COORDINATES;AMBIGUOUS_INSTITUTION"
-109.875125,35.150884,"Eriogonum subreniforme",2573411669,"Petrified Forest National Park. Southeast slope of Pilot Rock.","USA",350,1963,"PRESERVED_SPECIMEN","CONTINENT_DERIVED_FROM_COORDINATES;AMBIGUOUS_INSTITUTION"
