"lon","lat","species","gbifID","locality","countryCode","coordinateUncertaintyInMeters","year","basisOfRecord","issue"
-113.47,38.88,"Eriogonum ammophilum",1927941468,"Confusion Range, Blind valley, 41 airline miles northwest of Milford","USA",NA,1970,"PRESERVED_SPECIMEN","GEODETIC_DATUM_ASSUMED_WGS84;COLLECTION_MATCH_FUZZY"
-113.622778,38.918889,"Eriogonum ammophilum",1931383429,"Ferguson Desert, along the road from Probst Pond to Snake Pass, 1.2 miles southeast of Probst Corral, about 22 air miles east of Garrison, 10 air miles west-northwest of Ibex and 2.2 air miles northeast of Shotgun Knoll","USA",NA,2001,"PRESERVED_SPECIMEN","COORDINATE_ROUNDED;GEODETIC_DATUM_ASSUMED_WGS84;COLLECTION_MATCH_FUZZY"
-112.2434,39.7211,"Eriogonum ammophilum",2417210604,"Little Sahara Recreation Area, Sevier Desert, south of west Tintic Mountains.","USA",NA,1996,"PRESERVED_SPECIMEN","GEODETIC_DATUM_ASSUMED_WGS84;CONTINENT_DERIVED_FROM_COORDINATES;COLLECTION_MATCH_FUZZY"
-113.2239,38.8933,"Eriogonum ammophilum",1928167528,"On a side road 0.6 mile southwest of Sand Pass Road and 1.4 miles northeast of the jeep road to Ecks Knoll, 3.1 air miles northwest of Snake Pass and 3.1 air mile east southeast of Shotgun Knoll","USA",NA,2008,"PRESERVED_SPECIMEN","GEODETIC_DATUM_ASSUMED_WGS84;COLLECTION_MATCH_FUZZY"
-113.525014,39.09454,"Eriogonum ammophilum",1569807276,"No locality information available","USA",NA,1970,"PRESERVED_SPECIMEN","OCCURRENCE_STATUS_INFERRED_FROM_INDIVIDUAL_COUNT;GEODETIC_DATUM_ASSUMED_WGS84;INSTITUTION_MATCH_FUZZY;COLLECTION_MATCH_NONE"
