"lon","lat","species","gbifID","locality","countryCode","coordinateUncertaintyInMeters","year","basisOfRecord","issue"
49.2347,-18.5925,"Erythroxylum ferrugineum",2284269890,"Fivondronana: Brickaville, Firaisana: Ambinaninony, Fokontany: Andranonkoditra. Forêt littorale sur sables de Vohibola du côte de l'hôtel Pangalane.","MDG",NA,2003,"PRESERVED_SPECIMEN","GEODETIC_DATUM_ASSUMED_WGS84"
49.95277,-16.85305,"Erythroxylum ferrugineum",1259160258,"Fivondronana: Sainte Marie, Firaisana: Lonkintsy, Fokontany: Sahasifotra. Forêt littorale sur sables d'Ambohidena. Echantillon préservé en alcool. Récolté avec G.McPherson, R.Razakamalala & Poity (Guide)","MDG",NA,2003,"PRESERVED_SPECIMEN","OCCURRENCE_STATUS_INFERRED_FROM_INDIVIDUAL_COUNT;GEODETIC_DATUM_ASSUMED_WGS84;DIFFERENT_OWNER_INSTITUTION"
49.176944,-12.505278,"Erythroxylum ferrugineum",4061291507,"Montagne d'Ambre, partie nord. A 1274 m du point cote 1008, au 290?","MDG",NA,2006,"PRESERVED_SPECIMEN","OCCURRENCE_STATUS_INFERRED_FROM_INDIVIDUAL_COUNT;GEODETIC_DATUM_ASSUMED_WGS84;DIFFERENT_OWNER_INSTITUTION"
47.166945,-24.779444,"Erythroxylum ferrugineum",1257807373,"Fort-Dauphin, Commune: Mahatalaky, Fokontany: Sainte-Luce, village le plus proche: Ambandrika.","MDG",NA,2012,"PRESERVED_SPECIMEN","OCCURRENCE_STATUS_INFERRED_FROM_INDIVIDUAL_COUNT;COORDINATE_ROUNDED;GEODETIC_DATUM_ASSUMED_WGS84;DIFFERENT_OWNER_INSTITUTION"
48.419445,-18.942222,"Erythroxylum ferrugineum",1258008474,"Alaotra-Mangoro, Moramanga, Andasibe, Réserve Spécial d'Analamazaotra, Circuit Indri 1. Echantillon préservé en alcool.","MDG",NA,2013,"PRESERVED_SPECIMEN","OCCURRENCE_STATUS_INFERRED_FROM_INDIVIDUAL_COUNT;COORDINATE_ROUNDED;GEODETIC_DATUM_ASSUMED_WGS84;DIFFERENT_OWNER_INSTITUTION"
48.816389,-18.405833,"Erythroxylum ferrugineum",4061117102,"Brickaville, Anjahamamy, Anivoranokely, Ankerana forest.","MDG",NA,2012,"PRESERVED_SPECIMEN","OCCURRENCE_STATUS_INFERRED_FROM_INDIVIDUAL_COUNT;COORDINATE_ROUNDED;GEODETIC_DATUM_ASSUMED_WGS84;DIFFERENT_OWNER_INSTITUTION"
48.342778,-18.799167,"Erythroxylum ferrugineum",1257739594,"Analamay Nord","MDG",NA,2011,"PRESERVED_SPECIMEN","OCCURRENCE_STATUS_INFERRED_FROM_INDIVIDUAL_COUNT;COORDINATE_ROUNDED;GEODETIC_DATUM_ASSUMED_WGS84;DIFFERENT_OWNER_INSTITUTION"
48.33166,-18.82277,"Erythroxylum ferrugineum",4061502095,"Toamasina, Moramanga, Ambohibary, Ampitambe, Ambatovy. Forêt d'Analamay Sud . Echantillons préservés en alcool. Récolté avec P. Antilahimena & R. Ranaivojaona.","MDG",NA,2004,"PRESERVED_SPECIMEN","OCCURRENCE_STATUS_INFERRED_FROM_INDIVIDUAL_COUNT;GEODETIC_DATUM_ASSUMED_WGS84;DIFFERENT_OWNER_INSTITUTION"
49.146944,-12.544167,"Erythroxylum ferrugineum",4061291496,"Montagne d'Ambre, partie centrale. A 467 m du point cote 1343, au 286?","MDG",NA,2006,"PRESERVED_SPECIMEN","OCCURRENCE_STATUS_INFERRED_FROM_INDIVIDUAL_COUNT;GEODETIC_DATUM_ASSUMED_WGS84;DIFFERENT_OWNER_INSTITUTION"
48.583889,-19.151111,"Erythroxylum ferrugineum",4061798449,"Atsinanana, Vatomandry, Ambalabe, Ambinanindrano II. Forêt de Vohibe, à l'Est de la rivière Ambatomahazo. Récoltés avec Honoré. Échantillons préservés en alcool.","MDG",NA,2017,"PRESERVED_SPECIMEN","OCCURRENCE_STATUS_INFERRED_FROM_INDIVIDUAL_COUNT;COORDINATE_ROUNDED;GEODETIC_DATUM_ASSUMED_WGS84;DIFFERENT_OWNER_INSTITUTION"
49.73972,-16.78361,"Erythroxylum ferrugineum",1259373039,"Fivondronana: Soanierana Ivongo, Firaisana: Manompana, Fokontany: Antanambaon'Ambodimanga. Forêt d'Andakibe. Echantillon préservé en alcool.","MDG",NA,2003,"PRESERVED_SPECIMEN","OCCURRENCE_STATUS_INFERRED_FROM_INDIVIDUAL_COUNT;GEODETIC_DATUM_ASSUMED_WGS84;DIFFERENT_OWNER_INSTITUTION"
48.28444,-21.47416,"Erythroxylum ferrugineum",1259410530,"Fivondronana: Mananjary, Firaisana: Ankatafana, Fokontany: Marohita, Village: Anato. Forêt littorale d'Analamalemy. Echantillon préservé an alcool. Récolté avec R. Ranaivojaona & Velomaro.","MDG",NA,2004,"PRESERVED_SPECIMEN","OCCURRENCE_STATUS_INFERRED_FROM_INDIVIDUAL_COUNT;GEODETIC_DATUM_ASSUMED_WGS84;DIFFERENT_OWNER_INSTITUTION"
48.27472,-18.86861,"Erythroxylum ferrugineum",1261017470,"Alaotra Mangoro, Moramanga, Ambohibary, Ampitambe, Ambatovy. Forêt d'Ampanadiofanantsy, route vers Befotsy. Récoltés avec H. Radona & J. Ramampisandry.","MDG",NA,2008,"PRESERVED_SPECIMEN","OCCURRENCE_STATUS_INFERRED_FROM_INDIVIDUAL_COUNT;GEODETIC_DATUM_ASSUMED_WGS84;DIFFERENT_OWNER_INSTITUTION"
47.121667,-24.869167,"Erythroxylum ferrugineum",1257812473,"Fort Dauphin, Mahatalaky, Belavenoko, S17 ou Agnalavao, 2,5 km à l’est de Belavenoko.","MDG",NA,2012,"PRESERVED_SPECIMEN","OCCURRENCE_STATUS_INFERRED_FROM_INDIVIDUAL_COUNT;COORDINATE_ROUNDED;GEODETIC_DATUM_ASSUMED_WGS84;DIFFERENT_OWNER_INSTITUTION"
48.67388,-13.65027,"Erythroxylum ferrugineum",4062241529,"Ambilobe, Beramanja, Anketrabe, forêt de Kalabenono, sur la chaïne de Galoko, 9 km au Sud-Est d'Anketrabe. Forêt dense humide.","MDG",NA,2006,"PRESERVED_SPECIMEN","OCCURRENCE_STATUS_INFERRED_FROM_INDIVIDUAL_COUNT;GEODETIC_DATUM_ASSUMED_WGS84;DIFFERENT_OWNER_INSTITUTION"
47.8075,-19.271389,"Erythroxylum ferrugineum",1257705727,"Andramasina, Ambohimiadana, Iaramalaza Inselberg.","MDG",NA,2011,"PRESERVED_SPECIMEN","OCCURRENCE_STATUS_INFERRED_FROM_INDIVIDUAL_COUNT;COORDINATE_ROUNDED;GEODETIC_DATUM_ASSUMED_WGS84;DIFFERENT_OWNER_INSTITUTION"
46.305278,-24.268611,"Erythroxylum ferrugineum",1257936871,"Amboasary Sud, Mahaly, Mahazoarivo, village d'Andovobe. Forêt d'Anadabolava - Betsimalaho.","MDG",NA,2013,"PRESERVED_SPECIMEN","OCCURRENCE_STATUS_INFERRED_FROM_INDIVIDUAL_COUNT;COORDINATE_ROUNDED;GEODETIC_DATUM_ASSUMED_WGS84;DIFFERENT_OWNER_INSTITUTION"
43.390278,-21.769722,"Erythroxylum ferrugineum",1257721698,"Alan Analalava. SE of Morombe.","MDG",NA,2002,"PRESERVED_SPECIMEN","OCCURRENCE_STATUS_INFERRED_FROM_INDIVIDUAL_COUNT;COORDINATE_ROUNDED;GEODETIC_DATUM_ASSUMED_WGS84;INSTITUTION_MATCH_FUZZY;COLLECTION_MATCH_NONE"
48.60555,-20.35916,"Erythroxylum ferrugineum",4031537220,"Fivondronana: Mahanoro, Firaisana: Ambodibonara, Fokontany: Ambalavontaka. Forêt de Nankinana. Echantillon préservé en alcool.","MDG",NA,2004,"PRESERVED_SPECIMEN","OCCURRENCE_STATUS_INFERRED_FROM_INDIVIDUAL_COUNT;GEODETIC_DATUM_ASSUMED_WGS84;INSTITUTION_MATCH_FUZZY;COLLECTION_MATCH_NONE"
48.311944,-19.539722,"Erythroxylum ferrugineum",4032066663,"District Anosibe an'Ala, Commune rurale Tratramarina, Fokontany Ambonihiboka, forêt Ambatofotsy, accompagné de M. Christophe Rahaingonirina de l'association Ambarakaly","MDG",NA,2010,"PRESERVED_SPECIMEN","OCCURRENCE_STATUS_INFERRED_FROM_INDIVIDUAL_COUNT;COORDINATE_ROUNDED;GEODETIC_DATUM_ASSUMED_WGS84;INSTITUTION_MATCH_FUZZY;COLLECTION_MATCH_NONE"
47.243056,-21.340278,"Erythroxylum ferrugineum",4031682004,"Lalangina, Alakamisy Ambohimaha, Tsangana II, inselberg Ambatomisoratra. Existence de trace de feu et de culture.","MDG",NA,2010,"PRESERVED_SPECIMEN","OCCURRENCE_STATUS_INFERRED_FROM_INDIVIDUAL_COUNT;COORDINATE_ROUNDED;GEODETIC_DATUM_ASSUMED_WGS84;INSTITUTION_MATCH_FUZZY;COLLECTION_MATCH_NONE"
49.538056,-13.231667,"Erythroxylum ferrugineum",1257990746,"Daraina, forêt d'Antsahabe.","MDG",NA,2004,"PRESERVED_SPECIMEN","OCCURRENCE_STATUS_INFERRED_FROM_INDIVIDUAL_COUNT;COORDINATE_ROUNDED;GEODETIC_DATUM_ASSUMED_WGS84;DIFFERENT_OWNER_INSTITUTION"
49.36694,-14.17972,"Erythroxylum ferrugineum",4032009268,"Région SAVA, District Andapa, Commune rurale d'Anjialavabe, Fokontany d'Ankiakabe, Village Andohan'Anjialava, rivière d'Antsahaberaoka. Le long de la ligne de crête vers le sommet d'Ambatofitatra. Récoltés avec C. Rakotovao & R. Razakamalala. Echantillons préservés en alcool.","MDG",NA,2007,"PRESERVED_SPECIMEN","OCCURRENCE_STATUS_INFERRED_FROM_INDIVIDUAL_COUNT;GEODETIC_DATUM_ASSUMED_WGS84;INSTITUTION_MATCH_FUZZY;COLLECTION_MATCH_NONE"
48.383333,-14.083333,"Erythroxylum ferrugineum",2517738570,"Antsiranana, East of Ankaramy, Reserve Special Manongarivo, Antstatrotro, ridge East of summit, leading to massif.","MDG",NA,1992,"PRESERVED_SPECIMEN","INSTITUTION_MATCH_FUZZY;INSTITUTION_COLLECTION_MISMATCH"
48.433333,-13.983333,"Erythroxylum ferrugineum",2516089244,"Diego-Suarez/Antsiranama, Ambahatra, cours supérieur. Crête entre les deux bras de l'Ambahatra, 1.3 Km au N du point côte 1528, relevé TL3. Coord. Laborde. 615500/1341270.","MDG",NA,1999,"PRESERVED_SPECIMEN","INSTITUTION_MATCH_FUZZY;INSTITUTION_COLLECTION_MISMATCH"
47.0264,-24.6058,"Erythroxylum ferrugineum",2284202237,"Emagnobo, Malamamay. Vohimena Forest. Along the Ramisily river, at the water table. Humid Forest.","MDG",NA,2014,"PRESERVED_SPECIMEN","GEODETIC_DATUM_ASSUMED_WGS84"
46.1425,-24.248889,"Erythroxylum ferrugineum",4032144188,"Amboasary Sud, Marotsiraka, Besavoa. Forêt d'Anadabolava Betsimalaho.","MDG",NA,2013,"PRESERVED_SPECIMEN","OCCURRENCE_STATUS_INFERRED_FROM_INDIVIDUAL_COUNT;COORDINATE_ROUNDED;GEODETIC_DATUM_ASSUMED_WGS84;INSTITUTION_MATCH_FUZZY;COLLECTION_MATCH_NONE"
47.15,-24.76666,"Erythroxylum ferrugineum",1258363329,"Préfecture Tôlan|2aro (Fort- Dauphin); Forêt à 5 km de Ste. Luce, au Nord de Mahatalaky. Avec N. Dumetz & R.E. Gereau.","MDG",NA,1989,"PRESERVED_SPECIMEN","OCCURRENCE_STATUS_INFERRED_FROM_INDIVIDUAL_COUNT;GEODETIC_DATUM_ASSUMED_WGS84;ELEVATION_NON_NUMERIC;INSTITUTION_MATCH_FUZZY;COLLECTION_MATCH_NONE"
47.2,-24.58333,"Erythroxylum ferrugineum",4031604256,"Fort-Dauphin, Iabakoho, Antsotso. Forêt humide sur sable.","MDG",NA,2007,"PRESERVED_SPECIMEN","OCCURRENCE_STATUS_INFERRED_FROM_INDIVIDUAL_COUNT;GEODETIC_DATUM_ASSUMED_WGS84;INSTITUTION_MATCH_FUZZY;COLLECTION_MATCH_NONE"
46.673333,-24.798889,"Erythroxylum ferrugineum",4031799673,"Fort Dauphin, Ambatoabo, Ankoba, 2 km est d’Imonty","MDG",NA,2009,"PRESERVED_SPECIMEN","OCCURRENCE_STATUS_INFERRED_FROM_INDIVIDUAL_COUNT;COORDINATE_ROUNDED;GEODETIC_DATUM_ASSUMED_WGS84;INSTITUTION_MATCH_FUZZY;COLLECTION_MATCH_NONE"
49.005,-14.24083,"Erythroxylum ferrugineum",1260240409,"Sofia, Bealanana. Forêt de moyenne altitude située à 7 Km au Nord est de la Commune Rurale de Mangindrano. Zone dégradée à Psiadia altissima, Psidium guyava, près de la rivière Antsahivo. Echantillon préservé en alcool.","MDG",NA,2005,"PRESERVED_SPECIMEN","OCCURRENCE_STATUS_INFERRED_FROM_INDIVIDUAL_COUNT;GEODETIC_DATUM_ASSUMED_WGS84;DIFFERENT_OWNER_INSTITUTION"
48.06944,-22.02805,"Erythroxylum ferrugineum",1258791621,"Manakara. Vestiges forestiers sublittoraux sur sables sis à 13 Km environ au Nord de Manakara","MDG",NA,2001,"PRESERVED_SPECIMEN","GEODETIC_DATUM_ASSUMED_WGS84;DIFFERENT_OWNER_INSTITUTION"
47.055556,-20.646667,"Erythroxylum ferrugineum",2268829861,"Amoron'i Mania, Faliarivo Anjoman'Ankona, Andakatanikely, Inselberg côté gauche de la route RN 35 d'Ivato vers Anjoman'Ankona, ouest d'Andakatanikely. Ancienne carrière, très dégradée.","MDG",NA,2015,"PRESERVED_SPECIMEN","OCCURRENCE_STATUS_INFERRED_FROM_INDIVIDUAL_COUNT;COORDINATE_ROUNDED;GEODETIC_DATUM_ASSUMED_WGS84;DIFFERENT_OWNER_INSTITUTION"
48.538889,-19.175278,"Erythroxylum ferrugineum",1260705665,"Vatomandry, Ambalabe, Sahanionaka, village: Vodiriana au Nord Ouest du Toby Lemazava. Direction Tsitondroina, au bord du rivière Talaviana. Echantillons préservés en alcool.","MDG",NA,2007,"PRESERVED_SPECIMEN","OCCURRENCE_STATUS_INFERRED_FROM_INDIVIDUAL_COUNT;COORDINATE_ROUNDED;GEODETIC_DATUM_ASSUMED_WGS84;DIFFERENT_OWNER_INSTITUTION"
47.74138,-18.92583,"Erythroxylum ferrugineum",4061714400,"Fiv. Manjakandriana, commune Carion. Station forestière d'Angavokely, bord de route au Sud du mont Angavokely. Formation forestière arbustive à Weinmannia, Polyscias & Cassinopsis.","MDG",NA,2001,"PRESERVED_SPECIMEN","OCCURRENCE_STATUS_INFERRED_FROM_INDIVIDUAL_COUNT;GEODETIC_DATUM_ASSUMED_WGS84;INSTITUTION_MATCH_NONE"
49.19222,-13.00916,"Erythroxylum ferrugineum",4061656752,"Ambilobe, Marivorahona, Marivorahona, Ankoampatrana, Ampondrabe à 1h 30 mn au Sud-Est du village Mahamasina, Ankarana. Forêt sèche. Récolté avec R. Randrianaivo, M. Bezara, V. Benjara, Eugène & Beravo.","MDG",NA,2007,"PRESERVED_SPECIMEN","OCCURRENCE_STATUS_INFERRED_FROM_INDIVIDUAL_COUNT;GEODETIC_DATUM_ASSUMED_WGS84;DIFFERENT_OWNER_INSTITUTION"
47.666667,-23.066667,"Erythroxylum ferrugineum",1426112014,"Fivondronana de Farafangana, Commune d'Ankarana, Foret classee de Manombo, Foret de Rianambo.","MDG",NA,2003,"PRESERVED_SPECIMEN","COORDINATE_ROUNDED;GEODETIC_DATUM_ASSUMED_WGS84;COLLECTION_MATCH_FUZZY"
48.482222,-20.801944,"Erythroxylum ferrugineum",4061454079,"Fivondronana: Nosy Varika Firaisana: Ambahy, Fokontany: Ambahy. Forêt d'Andohan'I Martin. Echantillon préservé en alcool.","MDG",NA,2004,"PRESERVED_SPECIMEN","OCCURRENCE_STATUS_INFERRED_FROM_INDIVIDUAL_COUNT;COORDINATE_ROUNDED;GEODETIC_DATUM_ASSUMED_WGS84;DIFFERENT_OWNER_INSTITUTION"
49.959444,-14.108889,"Erythroxylum ferrugineum",1258047272,"Diego, Vohemar, Antsirabe-Nord, Andravinambo. Forêt d'Antsaolatra (Ouest). Sur crête.","MDG",NA,2014,"PRESERVED_SPECIMEN","OCCURRENCE_STATUS_INFERRED_FROM_INDIVIDUAL_COUNT;COORDINATE_ROUNDED;GEODETIC_DATUM_ASSUMED_WGS84;DIFFERENT_OWNER_INSTITUTION"
49.40861,-17.28944,"Erythroxylum ferrugineum",4061714480,"Fiv. Fénérive Est, Fir. Ampasimaningoro, Fkt. Tampolo. Forêt littorale sur sable de Tampolo. Récolté avec R. Razakamalala, H. Razafindrainibe, R. Ludovic & F. Joma. (Préservés en alcool).","MDG",NA,2001,"PRESERVED_SPECIMEN","OCCURRENCE_STATUS_INFERRED_FROM_INDIVIDUAL_COUNT;GEODETIC_DATUM_ASSUMED_WGS84;INSTITUTION_MATCH_NONE"
46.53805,-24.83888,"Erythroxylum ferrugineum",4061558157,"Andohahela (parcel 1). Site touristique de Tsimelahy au bord de la rivière de Taransty au Sud-ouest du village.","MDG",NA,1996,"PRESERVED_SPECIMEN","GEODETIC_DATUM_ASSUMED_WGS84;INSTITUTION_MATCH_NONE"
49.38527,-12.31805,"Erythroxylum ferrugineum",1258368646,"Vovo Village Distr.: Coastal forest on either brown or white sands. Ca. 6 km from Diego Suarez on Diego Suarez-Vovo village road, and ca. 1.5 km S of beach on Indian Ocean.","MDG",NA,1993,"PRESERVED_SPECIMEN","OCCURRENCE_STATUS_INFERRED_FROM_INDIVIDUAL_COUNT;GEODETIC_DATUM_ASSUMED_WGS84;INSTITUTION_MATCH_FUZZY;COLLECTION_MATCH_NONE"
49.13333,-18.85,"Erythroxylum ferrugineum",1258366280,"Eastern Domain: 1 km N. of Ambila-Lemaitso which is 10 km E. of Brickaville. Coastal dune forest.","MDG",NA,1987,"PRESERVED_SPECIMEN","OCCURRENCE_STATUS_INFERRED_FROM_INDIVIDUAL_COUNT;GEODETIC_DATUM_ASSUMED_WGS84;ELEVATION_NON_NUMERIC;INSTITUTION_MATCH_FUZZY;COLLECTION_MATCH_NONE"
47.328333,-20.323333,"Erythroxylum ferrugineum",4031954032,"Forêt d'Itanjona, commune Sandrandahy, district Fandriana.","MDG",NA,2014,"PRESERVED_SPECIMEN","OCCURRENCE_STATUS_INFERRED_FROM_INDIVIDUAL_COUNT;COORDINATE_ROUNDED;GEODETIC_DATUM_ASSUMED_WGS84;INSTITUTION_MATCH_FUZZY;COLLECTION_MATCH_NONE"
46.557854,-20.617197,"Erythroxylum ferrugineum",2576301255,"","MDG",NA,2019,"HUMAN_OBSERVATION","COORDINATE_ROUNDED;CONTINENT_DERIVED_FROM_COORDINATES"
46.816642,-20.438165,"Erythroxylum ferrugineum",2823247362,"","MDG",15,2019,"HUMAN_OBSERVATION","COORDINATE_ROUNDED;CONTINENT_DERIVED_FROM_COORDINATES"
47.18277,-20.76527,"Erythroxylum ferrugineum",4060905803,"Sud d'Ambalamanakana. Collected with K. Sikes, C. Rasolomanana, S. Andrianasolo, J. Raharilala & T. Rakotomamonjy.","MDG",NA,1996,"PRESERVED_SPECIMEN","OCCURRENCE_STATUS_INFERRED_FROM_INDIVIDUAL_COUNT;GEODETIC_DATUM_ASSUMED_WGS84;INSTITUTION_MATCH_NONE"
48.88972,-17.55416,"Erythroxylum ferrugineum",1259039796,"District: Vavatenina, Commune: Ambodimangavalo, Fokontany: Mahasoa. Forêt dégradée de basse altitude. Récolté avec F. Ratovoson, L. Randrianjanaka, J. Randriamanarivo, S. Rakotonandrasana.","MDG",NA,2000,"PRESERVED_SPECIMEN","OCCURRENCE_STATUS_INFERRED_FROM_INDIVIDUAL_COUNT;GEODETIC_DATUM_ASSUMED_WGS84;INSTITUTION_MATCH_FUZZY;COLLECTION_MATCH_NONE"
47,-20.08,"Erythroxylum ferrugineum",2618618869,"Madagascar, Antananarivo Province, Vakinankaratra Region, Antsirabe District, Commune Ibity, 25 km south of Antsirabe, northern end of Mount Ibity.","MDG",NA,2018,"PRESERVED_SPECIMEN","GEODETIC_DATUM_ASSUMED_WGS84;INSTITUTION_COLLECTION_MISMATCH"
49.15,-18.81666,"Erythroxylum ferrugineum",1258364865,"Sand forest along coast at Ambilañ Lemaitso.","MDG",NA,1989,"PRESERVED_SPECIMEN","OCCURRENCE_STATUS_INFERRED_FROM_INDIVIDUAL_COUNT;GEODETIC_DATUM_ASSUMED_WGS84;INSTITUTION_MATCH_FUZZY;COLLECTION_MATCH_NONE"
47.84166,-18.44166,"Erythroxylum ferrugineum",1258363870,"Forest near Anjozorobe.","MDG",NA,1991,"PRESERVED_SPECIMEN","OCCURRENCE_STATUS_INFERRED_FROM_INDIVIDUAL_COUNT;GEODETIC_DATUM_ASSUMED_WGS84;INSTITUTION_MATCH_FUZZY;COLLECTION_MATCH_NONE"
47.41666,-21.26666,"Erythroxylum ferrugineum",1258367303,"7 km W of Ranomafana S of the Namorona River at Duke University Primate Center study site and along road N of river. Eastern Domain.","MDG",NA,1987,"PRESERVED_SPECIMEN","OCCURRENCE_STATUS_INFERRED_FROM_INDIVIDUAL_COUNT;GEODETIC_DATUM_ASSUMED_WGS84;INSTITUTION_MATCH_FUZZY;COLLECTION_MATCH_NONE"
46.86666,-24.78333,"Erythroxylum ferrugineum",1258369686,"Ca. 22 km N of Ifarantsa and ca. 30 km N of RN 13 (Ambovombe - Tolanaro hwy.) along trail to Ranomafana Sud via Col de Tanana, E boundary of Parcel No. 1, Reserve No. 11 (Andohahela). Slightly disturbed wet forest.","MDG",NA,1988,"PRESERVED_SPECIMEN","OCCURRENCE_STATUS_INFERRED_FROM_INDIVIDUAL_COUNT;GEODETIC_DATUM_ASSUMED_WGS84;INSTITUTION_MATCH_FUZZY;COLLECTION_MATCH_NONE"
48.3,-14.033333,"Erythroxylum ferrugineum",2517747671,"Bekolosy, Environs du capement France.","MDG",NA,1996,"PRESERVED_SPECIMEN","INSTITUTION_MATCH_FUZZY;INSTITUTION_COLLECTION_MISMATCH"
49.68111,-16.86722,"Erythroxylum ferrugineum",1259222461,"Fivondronana: Soanierana-Ivongo. Vestige forestier aux alentours du village d'Andrangazaha. Bureau Dette Nature Andrangazaha. Echantillon préservé en alcool.","MDG",NA,2004,"PRESERVED_SPECIMEN","OCCURRENCE_STATUS_INFERRED_FROM_INDIVIDUAL_COUNT;GEODETIC_DATUM_ASSUMED_WGS84;DIFFERENT_OWNER_INSTITUTION"
49.18694,-13.24167,"Erythroxylum ferrugineum",1144675881,"Diego-Suarez / Antsiranana - Massif de Manongarivo: Crête bordant la cuvette d'Antsahakolana/Faritanin Antsiranana","MDG",1500,2000,"PRESERVED_SPECIMEN","GEODETIC_DATUM_ASSUMED_WGS84;CONTINENT_DERIVED_FROM_COORDINATES;INSTITUTION_MATCH_FUZZY;COLLECTION_MATCH_NONE"
