"lon","lat","species","gbifID","locality","countryCode","coordinateUncertaintyInMeters","year","basisOfRecord","issue"
49.12,-12.97,"Erythroxylum platyclados",3776355298,"Madagascar, Diana Region, Ambilobe District, Ankarana National Park.","MDG",NA,2020,"PRESERVED_SPECIMEN","GEODETIC_DATUM_ASSUMED_WGS84;PRESUMED_NEGATED_LONGITUDE;INSTITUTION_COLLECTION_MISMATCH"
49.368611,-12.276667,"Erythroxylum platyclados",4062027620,"Comm. Ramena, Fok. Ramena Forêt d'Ambararata, Orangea Peninsula, shrubland on sand with scattered trees to 4 m tall.","MDG",NA,2005,"PRESERVED_SPECIMEN","OCCURRENCE_STATUS_INFERRED_FROM_INDIVIDUAL_COUNT;COORDINATE_ROUNDED;GEODETIC_DATUM_ASSUMED_WGS84;DIFFERENT_OWNER_INSTITUTION"
49.52861,-12.63333,"Erythroxylum platyclados",4061581331,"Ankarongana (Karongana), Irodo, Analafondro forest. Dry deciduous forest on sand. Collected with M. Andrianjafy & E. Rafaralahy. Specimens preserved in alcohol.","MDG",NA,2006,"PRESERVED_SPECIMEN","OCCURRENCE_STATUS_INFERRED_FROM_INDIVIDUAL_COUNT;GEODETIC_DATUM_ASSUMED_WGS84;DIFFERENT_OWNER_INSTITUTION"
49.434722,-12.588055,"Erythroxylum platyclados",4062172582,"Commune Sadjoavato, Fok. Saharenana. For|5et de Sahafary, severely degraded with shrub understory remaining and occasional tree to 20 m tall.","MDG",NA,2005,"PRESERVED_SPECIMEN","OCCURRENCE_STATUS_INFERRED_FROM_INDIVIDUAL_COUNT;COORDINATE_ROUNDED;GEODETIC_DATUM_ASSUMED_WGS84;DIFFERENT_OWNER_INSTITUTION"
40.616667,-2.5,"Erythroxylum platyclados",4061765161,"Nairobi Ranch, along the sea. Kipini.","KEN",NA,2006,"PRESERVED_SPECIMEN","OCCURRENCE_STATUS_INFERRED_FROM_INDIVIDUAL_COUNT;COORDINATE_ROUNDED;GEODETIC_DATUM_ASSUMED_WGS84;DIFFERENT_OWNER_INSTITUTION"
49.966667,-15.683333,"Erythroxylum platyclados",2332697453,"Masoala Peninsula, S of Ambanizana, costal path S of Andranobe.","MDG",NA,1999,"PRESERVED_SPECIMEN","OCCURRENCE_STATUS_INFERRED_FROM_INDIVIDUAL_COUNT;COORDINATE_ROUNDED;GEODETIC_DATUM_ASSUMED_WGS84;DIFFERENT_OWNER_INSTITUTION"
49.37,-12.42,"Erythroxylum platyclados",2618599409,"Madagascar, Diana Region, Antsiranana II District, Montagne des Francais.","MDG",NA,2017,"PRESERVED_SPECIMEN","GEODETIC_DATUM_ASSUMED_WGS84;INSTITUTION_COLLECTION_MISMATCH"
49.117222,-12.3725,"Erythroxylum platyclados",4032056089,"Antsahampano, Andranotsimaty, 3 km à l'Ouest d'Andranotsimaty. Forêt d'Amboboka. Forêt humide dégradée. Récolté avec R. Guittou & H. Jaomanjary.","MDG",NA,2005,"PRESERVED_SPECIMEN","OCCURRENCE_STATUS_INFERRED_FROM_INDIVIDUAL_COUNT;COORDINATE_ROUNDED;GEODETIC_DATUM_ASSUMED_WGS84;INSTITUTION_MATCH_FUZZY;COLLECTION_MATCH_NONE"
49.174722,-13.087222,"Erythroxylum platyclados",4031979008,"Ambilobe, Marivorahona, 500 m, à l'Ouest du mont Andavakoera. Récolté avec J. Razafitsalama & R. Guittou.","MDG",NA,2005,"PRESERVED_SPECIMEN","OCCURRENCE_STATUS_INFERRED_FROM_INDIVIDUAL_COUNT;COORDINATE_ROUNDED;GEODETIC_DATUM_ASSUMED_WGS84;INSTITUTION_MATCH_FUZZY;COLLECTION_MATCH_NONE"
49.567778,-12.494167,"Erythroxylum platyclados",4031570099,"Andrafiabe, presqu'île entre Ambolobozobe et Ambolobozokely. Forêt sèche décidue. Récolté avec R. Guittou & D. Elifara.","MDG",NA,2005,"PRESERVED_SPECIMEN","OCCURRENCE_STATUS_INFERRED_FROM_INDIVIDUAL_COUNT;COORDINATE_ROUNDED;GEODETIC_DATUM_ASSUMED_WGS84;INSTITUTION_MATCH_FUZZY;COLLECTION_MATCH_NONE"
49.89444,-13.07055,"Erythroxylum platyclados",4031641384,"Fivondronana: Vohémar, Commune rurale: Nosy be. Lieu de campement au bord du lac Sahaka. Près de la forêt d'Analabe. Echantillon préservé en alcool. Récolté avec J. Rabenantoandro & R. Razakamalala.","MDG",NA,2003,"PRESERVED_SPECIMEN","GEODETIC_DATUM_ASSUMED_WGS84;INSTITUTION_MATCH_FUZZY;COLLECTION_MATCH_NONE"
49.794722,-12.880833,"Erythroxylum platyclados",4031885513,"District Vohemar, Commune Ampisikina, Fokontany Antsapilay, Andrafianivo-Antafianivony.","MDG",NA,2013,"PRESERVED_SPECIMEN","OCCURRENCE_STATUS_INFERRED_FROM_INDIVIDUAL_COUNT;COORDINATE_ROUNDED;GEODETIC_DATUM_ASSUMED_WGS84;INSTITUTION_MATCH_FUZZY;COLLECTION_MATCH_NONE"
47.774064,-14.892056,"Erythroxylum platyclados",1993745216,"","MDG",4,2019,"HUMAN_OBSERVATION","COORDINATE_ROUNDED;CONTINENT_DERIVED_FROM_COORDINATES"
49.20343,-17.93115,"Erythroxylum platyclados",3762895606,"Betampona","MDG",NA,2010,"PRESERVED_SPECIMEN","GEODETIC_DATUM_ASSUMED_WGS84;CONTINENT_DERIVED_FROM_COORDINATES;INSTITUTION_MATCH_FUZZY;INSTITUTION_COLLECTION_MISMATCH"
49.485833,-13.115278,"Erythroxylum platyclados",4031991213,"Vohemar, Maromokotra, Ankijomantsina, Antsahatitezana, 4 km à l'Est d'Ankijomantsina. Forê sèche. Récolté avec S. Rakotonandrasana, F. Ratovoson & Tomboravo.","MDG",NA,2005,"PRESERVED_SPECIMEN","OCCURRENCE_STATUS_INFERRED_FROM_INDIVIDUAL_COUNT;COORDINATE_ROUNDED;GEODETIC_DATUM_ASSUMED_WGS84;INSTITUTION_MATCH_FUZZY;COLLECTION_MATCH_NONE"
49.326945,-12.368056,"Erythroxylum platyclados",4032054034,"Sous préfecture: Antsiranana II, Commune: Mahavanona, Fokontany: Andranomanitra. Forêt dense sèche sur calcaire de la Montagne des Français. Echantillons préservés en alcool. Récolté avec A. Ravoahangy, H. Rasoamiafara, A. Razanakolona, Jomazandry, V. Soazafy, J. Rasolofoson.","MDG",NA,2005,"PRESERVED_SPECIMEN","OCCURRENCE_STATUS_INFERRED_FROM_INDIVIDUAL_COUNT;COORDINATE_ROUNDED;GEODETIC_DATUM_ASSUMED_WGS84;INSTITUTION_MATCH_FUZZY;COLLECTION_MATCH_NONE"
49.330278,-12.146111,"Erythroxylum platyclados",4031597759,"Andranovondronina, Anjiabe, au Nord de Antsaravy, Bobaomby, versant Est. Petite colline toujours sur sable profond.","MDG",NA,2006,"PRESERVED_SPECIMEN","OCCURRENCE_STATUS_INFERRED_FROM_INDIVIDUAL_COUNT;COORDINATE_ROUNDED;GEODETIC_DATUM_ASSUMED_WGS84;INSTITUTION_MATCH_FUZZY;COLLECTION_MATCH_NONE"
49.666667,-14.333333,"Erythroxylum platyclados",4031939251,"Andapa, Doany, Antsahaberoka, Ambalanaomby, aux environs du borne numéro 34 de la réserve, suivant la rivière d'Antsahaberoka. Dans la Réserve Naturelle Intégrale de Marojejy.","MDG",NA,1994,"PRESERVED_SPECIMEN","OCCURRENCE_STATUS_INFERRED_FROM_INDIVIDUAL_COUNT;COORDINATE_ROUNDED;GEODETIC_DATUM_ASSUMED_WGS84;INSTITUTION_MATCH_FUZZY;COLLECTION_MATCH_NONE"
49.467222,-14.337222,"Erythroxylum platyclados",4031597772,"Sava, Andapa, Doany, Anjialavahely. Forêt humide de moyenne altitude d'Ankarongameloka. Echantillon préservé en alcool. Récolté avec Jacky, Mobel & José.","MDG",NA,2006,"PRESERVED_SPECIMEN","OCCURRENCE_STATUS_INFERRED_FROM_INDIVIDUAL_COUNT;COORDINATE_ROUNDED;GEODETIC_DATUM_ASSUMED_WGS84;INSTITUTION_MATCH_FUZZY;COLLECTION_MATCH_NONE"
47.498611,-15.566667,"Erythroxylum platyclados",4061533502,"Boriziny, Port-Berge, Tsiningia, Andranomena II. Forêt dense sèche sur un substrat basaltique. Récolté avec R. Razakamalala & A. Tombomarina. Echantillons préservés en alcool.","MDG",NA,2004,"PRESERVED_SPECIMEN","OCCURRENCE_STATUS_INFERRED_FROM_INDIVIDUAL_COUNT;COORDINATE_ROUNDED;GEODETIC_DATUM_ASSUMED_WGS84;DIFFERENT_OWNER_INSTITUTION"
49.319722,-12.909722,"Erythroxylum platyclados",4061294803,"Andrafiamena, forets aux alentours d'Anjahankely. A 700 m du point cote 307, au 86?","MDG",NA,2011,"PRESERVED_SPECIMEN","OCCURRENCE_STATUS_INFERRED_FROM_INDIVIDUAL_COUNT;GEODETIC_DATUM_ASSUMED_WGS84;DIFFERENT_OWNER_INSTITUTION"
45.061667,-21.567222,"Erythroxylum platyclados",4061112367,"District & Commune: Beroroha. Fokontany: Betorabato. Abotorabatorano.","MDG",NA,2011,"PRESERVED_SPECIMEN","OCCURRENCE_STATUS_INFERRED_FROM_INDIVIDUAL_COUNT;COORDINATE_ROUNDED;GEODETIC_DATUM_ASSUMED_WGS84;DIFFERENT_OWNER_INSTITUTION"
44.473056,-17.856667,"Erythroxylum platyclados",4061979922,"Beanka, partie nord. Andranovorimena","MDG",NA,2011,"PRESERVED_SPECIMEN","OCCURRENCE_STATUS_INFERRED_FROM_INDIVIDUAL_COUNT;GEODETIC_DATUM_ASSUMED_WGS84;DIFFERENT_OWNER_INSTITUTION"
49.645833,-13.160556,"Erythroxylum platyclados",1257991445,"Daraina, forêt d'Ambilondamba","MDG",NA,2004,"PRESERVED_SPECIMEN","OCCURRENCE_STATUS_INFERRED_FROM_INDIVIDUAL_COUNT;COORDINATE_ROUNDED;GEODETIC_DATUM_ASSUMED_WGS84;DIFFERENT_OWNER_INSTITUTION"
47.1638,-24.803,"Erythroxylum platyclados",4061677537,"Anosy, Tolagnaro, Mahatalaky, Sainte Luce. Forêt littorale S 17, zone de conservation. Récoltés avec J. Rabenantoandro & D. Rabehevitra.","MDG",NA,2006,"PRESERVED_SPECIMEN","OCCURRENCE_STATUS_INFERRED_FROM_INDIVIDUAL_COUNT;GEODETIC_DATUM_ASSUMED_WGS84;DIFFERENT_OWNER_INSTITUTION"
44.491944,-18.006944,"Erythroxylum platyclados",4061785531,"Beanka, partie sud. Andoloposa","MDG",NA,2011,"PRESERVED_SPECIMEN","OCCURRENCE_STATUS_INFERRED_FROM_INDIVIDUAL_COUNT;GEODETIC_DATUM_ASSUMED_WGS84;DIFFERENT_OWNER_INSTITUTION"
46.24444,-16.53222,"Erythroxylum platyclados",4062097884,"Ambato-Boeni, Sitampiky, Ambatolafia. Récolté avec N.L. Ravalimanarivo, Tombo & Haja.","MDG",NA,2005,"PRESERVED_SPECIMEN","OCCURRENCE_STATUS_INFERRED_FROM_INDIVIDUAL_COUNT;GEODETIC_DATUM_ASSUMED_WGS84;DIFFERENT_OWNER_INSTITUTION"
46.175,-15.758333,"Erythroxylum platyclados",4061681563,"Antrema.","MDG",NA,2012,"PRESERVED_SPECIMEN","OCCURRENCE_STATUS_INFERRED_FROM_INDIVIDUAL_COUNT;COORDINATE_ROUNDED;GEODETIC_DATUM_ASSUMED_WGS84;INSTITUTION_MATCH_NONE"
48.46931,-13.418164,"Erythroxylum platyclados",1455567125,"","MDG",8,2015,"HUMAN_OBSERVATION","COORDINATE_ROUNDED;CONTINENT_DERIVED_FROM_COORDINATES"
49.65861,-12.89805,"Erythroxylum platyclados",4062192467,"Vohemar, Ampisikina, Antsampilay, forêt d'Antsaharengy, 3 km au Nord ouest d'Ankaramy. Forêt sèche sur latérite à dominance d'Androstachys (Euphorbiaceae). Récolté avec A. Rakotondrafara, J. Be, Z. Iamba & Zamany.","MDG",NA,2005,"PRESERVED_SPECIMEN","OCCURRENCE_STATUS_INFERRED_FROM_INDIVIDUAL_COUNT;GEODETIC_DATUM_ASSUMED_WGS84;DIFFERENT_OWNER_INSTITUTION"
47.003611,-22.227778,"Erythroxylum platyclados",4061611685,"Andringitra, Camp II, ca. 43 km S of Ambalavao, Andringitra Reserve, junction of the Sahanivoraky and Sahavatoy Rivers. Collected with J. Raharimalala, G. Rahajasoa, M. Randriambololona & J. McDonagh.","MDG",NA,1993,"PRESERVED_SPECIMEN","OCCURRENCE_STATUS_INFERRED_FROM_INDIVIDUAL_COUNT;COORDINATE_ROUNDED;GEODETIC_DATUM_ASSUMED_WGS84;INSTITUTION_MATCH_NONE"
47.21027,-24.56777,"Erythroxylum platyclados",4031602249,"Anosy, Iabakoho, Antsotso. Ivohibe, 60 Km au Nord de Tolagnaro. Echantillon préservé en alcool. Récolté avec J. Rabenantoandro, P. Lowry, E. Lowry & B. Mara.","MDG",NA,2006,"PRESERVED_SPECIMEN","OCCURRENCE_STATUS_INFERRED_FROM_INDIVIDUAL_COUNT;GEODETIC_DATUM_ASSUMED_WGS84;INSTITUTION_MATCH_FUZZY;COLLECTION_MATCH_NONE"
38.9,-6.96666,"Erythroxylum platyclados",4060869424,"","TZA",NA,1991,"PRESERVED_SPECIMEN","GEODETIC_DATUM_ASSUMED_WGS84;INSTITUTION_MATCH_NONE"
49.685556,-13.083611,"Erythroxylum platyclados",1257977043,"Daraina, Fokontany Amparihirano, Ambararatabe.","MDG",NA,2004,"PRESERVED_SPECIMEN","OCCURRENCE_STATUS_INFERRED_FROM_INDIVIDUAL_COUNT;COORDINATE_ROUNDED;GEODETIC_DATUM_ASSUMED_WGS84;DIFFERENT_OWNER_INSTITUTION"
48.45,-13.93333,"Erythroxylum platyclados",1144675985,"Ambahatra, cours moyen - Befalafa, sentier de Jaosolo à Zaman'i Mary/Faritanin Antsiranana","MDG",1500,1999,"PRESERVED_SPECIMEN","GEODETIC_DATUM_ASSUMED_WGS84;CONTINENT_DERIVED_FROM_COORDINATES;INSTITUTION_MATCH_FUZZY;COLLECTION_MATCH_NONE"
48.28333,-14.06667,"Erythroxylum platyclados",1144675990,"Besinkara - Chemin d'Ambodisakoana à Ambalafary/Faritanin Antsiranana","MDG",1500,1994,"PRESERVED_SPECIMEN","GEODETIC_DATUM_ASSUMED_WGS84;CONTINENT_DERIVED_FROM_COORDINATES;INSTITUTION_MATCH_FUZZY;COLLECTION_MATCH_NONE"
41.31666,-1.93333,"Erythroxylum platyclados",1258364573,"K7, Lamu District: Mvundeni to Stesheni. Sitangi Hill. Coastal thicket and sand dunes.","KEN",NA,1988,"PRESERVED_SPECIMEN","OCCURRENCE_STATUS_INFERRED_FROM_INDIVIDUAL_COUNT;GEODETIC_DATUM_ASSUMED_WGS84;INSTITUTION_MATCH_FUZZY;COLLECTION_MATCH_NONE"
