"lon","lat","species","gbifID","locality","countryCode","coordinateUncertaintyInMeters","year","basisOfRecord","issue"
48.96777,-14.14805,"Erythroxylum corymbosum",4062113338,"Fivondronana: Ambanja, Commune: Marotolana. Forêt de Matsabory, aux environs d'Ampitsinjovantany. Forêt sclerophylle sur crête, substrat rocheux. Récolté avec S. Rapanarivo, A. Andriamaniry, Bariny & F. Ndriamifaly.","MDG",NA,2003,"PRESERVED_SPECIMEN","OCCURRENCE_STATUS_INFERRED_FROM_INDIVIDUAL_COUNT;GEODETIC_DATUM_ASSUMED_WGS84;DIFFERENT_OWNER_INSTITUTION"
48.27027,-18.88722,"Erythroxylum corymbosum",4060987055,"Alaotra Mangoro, Moramanga, Ambohibary, Befotsy, Ambatovy. Antaralava Besalampy forest. Collected with D. Ravelonarivo, B.A. Ratodimanana, M. Ratovomanana & F. Edmond.","MDG",NA,2008,"PRESERVED_SPECIMEN","OCCURRENCE_STATUS_INFERRED_FROM_INDIVIDUAL_COUNT;GEODETIC_DATUM_ASSUMED_WGS84;DIFFERENT_OWNER_INSTITUTION"
45.311224,-16.407514,"Erythroxylum corymbosum",4061957905,"Namoroka National Park. N. part of park to E. of Namoroka village.","MDG",NA,2016,"PRESERVED_SPECIMEN","OCCURRENCE_STATUS_INFERRED_FROM_INDIVIDUAL_COUNT;GEODETIC_DATUM_ASSUMED_WGS84;DIFFERENT_OWNER_INSTITUTION"
49.316111,-17.957778,"Erythroxylum corymbosum",4061958033,"District Toamasina II, Commune Rurale Ambodiriana, Fokontany de Sasandana, village d'Ambodihasina, Rivière de Rokalava.","MDG",NA,2017,"PRESERVED_SPECIMEN","OCCURRENCE_STATUS_INFERRED_FROM_INDIVIDUAL_COUNT;COORDINATE_ROUNDED;GEODETIC_DATUM_ASSUMED_WGS84;DIFFERENT_OWNER_INSTITUTION"
47.20166,-24.57111,"Erythroxylum corymbosum",1260916379,"Toliara, Anosy, Taolagnaro, Iaboko, Antsotso Avaratra. Récoltés avec D. Rabehevitra, M. Maka, Roger & B. Mara.","MDG",NA,2007,"PRESERVED_SPECIMEN","OCCURRENCE_STATUS_INFERRED_FROM_INDIVIDUAL_COUNT;GEODETIC_DATUM_ASSUMED_WGS84;DIFFERENT_OWNER_INSTITUTION"
48.73583,-17.47916,"Erythroxylum corymbosum",4061531826,"Antanandava, à 2 km au nord du village d'Ankosy, juste en dehors de la limite du Parc National de Zahamena. Forêt dense humide de moyenne altitude, peu dégradée, sur pente. Récolté avec S. Randrianasolo, C. Birkinshaw & P. Antilahimena.","MDG",NA,1999,"PRESERVED_SPECIMEN","OCCURRENCE_STATUS_INFERRED_FROM_INDIVIDUAL_COUNT;GEODETIC_DATUM_ASSUMED_WGS84;INSTITUTION_MATCH_NONE"
48.150556,-19.031944,"Erythroxylum corymbosum",1257890065,"Moramanga, Ambohibary, Antsily, Andakana, forêt de Bekomy.","MDG",NA,2012,"PRESERVED_SPECIMEN","OCCURRENCE_STATUS_INFERRED_FROM_INDIVIDUAL_COUNT;COORDINATE_ROUNDED;GEODETIC_DATUM_ASSUMED_WGS84;DIFFERENT_OWNER_INSTITUTION"
48.33388,-18.85972,"Erythroxylum corymbosum",1260985847,"Alaotra Mangoro, Moramanga, Andasibe, Menalamba. Sahaviarina forest. Collected with M. Ratovomanana, B.A. Ratodimanana & F. Edmond.","MDG",NA,2008,"PRESERVED_SPECIMEN","OCCURRENCE_STATUS_INFERRED_FROM_INDIVIDUAL_COUNT;GEODETIC_DATUM_ASSUMED_WGS84;DIFFERENT_OWNER_INSTITUTION"
50.051944,-14.102778,"Erythroxylum corymbosum",1258039371,"Sambava, Anjangoveratra, Ambavala, forêt de Tsihomanaomby, Antsahakasaka. En haut versant.","MDG",NA,2014,"PRESERVED_SPECIMEN","OCCURRENCE_STATUS_INFERRED_FROM_INDIVIDUAL_COUNT;COORDINATE_ROUNDED;GEODETIC_DATUM_ASSUMED_WGS84;DIFFERENT_OWNER_INSTITUTION"
48.577222,-19.158889,"Erythroxylum corymbosum",4061884455,"Atsinanana, Vatomandry, Ambalabe, Ambinanindrano II. Forêt de Vohibe, Sahamahirana.","MDG",NA,2012,"PRESERVED_SPECIMEN","OCCURRENCE_STATUS_INFERRED_FROM_INDIVIDUAL_COUNT;COORDINATE_ROUNDED;GEODETIC_DATUM_ASSUMED_WGS84;DIFFERENT_OWNER_INSTITUTION"
50.088056,-14.178056,"Erythroxylum corymbosum",3339842333,"District de Sambava, Commune de Bemanevika, Fokontany d' Antsahakajohy, formation végétale, foret de basse altitude, d' Anjombavolo . Collecté avec Zerimisy Belalahy et Andry PBZT. Herbier conservé en alcool.","MDG",NA,2021,"PRESERVED_SPECIMEN","OCCURRENCE_STATUS_INFERRED_FROM_INDIVIDUAL_COUNT;COORDINATE_ROUNDED;GEODETIC_DATUM_ASSUMED_WGS84;DIFFERENT_OWNER_INSTITUTION"
47.988056,-13.760278,"Erythroxylum corymbosum",4060985776,"Diana, Ambanja, Bemanevika, Bandrakorony. Forêt primaire subhumide de basse altitude de Bandrakorony, près du ruisseau de Betsitsiky sur la presqu'île Ampasindava. Echantillon préservé en alcool.","MDG",NA,2009,"PRESERVED_SPECIMEN","OCCURRENCE_STATUS_INFERRED_FROM_INDIVIDUAL_COUNT;COORDINATE_ROUNDED;GEODETIC_DATUM_ASSUMED_WGS84;DIFFERENT_OWNER_INSTITUTION"
47.4925,-23.515833,"Erythroxylum corymbosum",1261022986,"Région Atsimo Antsinanana, Vangaindrano, Matanga. Forêt dégradée sur latérite de Menafoza, Lavahifika.","MDG",NA,2008,"PRESERVED_SPECIMEN","OCCURRENCE_STATUS_INFERRED_FROM_INDIVIDUAL_COUNT;COORDINATE_ROUNDED;GEODETIC_DATUM_ASSUMED_WGS84;DIFFERENT_OWNER_INSTITUTION"
44.486944,-17.931389,"Erythroxylum corymbosum",2268877161,"Beanka, partie centrale. Ambinda-Nord","MDG",NA,2012,"PRESERVED_SPECIMEN","OCCURRENCE_STATUS_INFERRED_FROM_INDIVIDUAL_COUNT;GEODETIC_DATUM_ASSUMED_WGS84;DIFFERENT_OWNER_INSTITUTION"
49.676389,-16.759444,"Erythroxylum corymbosum",4061192005,"Manompana, Voafiny, Sahafandrano. Forêt de basse altitude, PPS de Sahafandrano. Echantillons préservés en alcool. Récolté avec Jean Théo & Mario Kalobe (guides locaux).","MDG",NA,2014,"PRESERVED_SPECIMEN","OCCURRENCE_STATUS_INFERRED_FROM_INDIVIDUAL_COUNT;COORDINATE_ROUNDED;GEODETIC_DATUM_ASSUMED_WGS84;DIFFERENT_OWNER_INSTITUTION"
49.09611,-14.2025,"Erythroxylum corymbosum",4031979215,"","MDG",NA,2005,"PRESERVED_SPECIMEN","OCCURRENCE_STATUS_INFERRED_FROM_INDIVIDUAL_COUNT;GEODETIC_DATUM_ASSUMED_WGS84;INSTITUTION_MATCH_FUZZY;COLLECTION_MATCH_NONE"
47.00166,-24.95166,"Erythroxylum corymbosum",4031678974,"Forêt littorale sur sable à Mandena, Ampasy, Taolagnaro. Echantillon préservé en alcool; récolté avec Faliniaina Lucien.","MDG",NA,2000,"PRESERVED_SPECIMEN","OCCURRENCE_STATUS_INFERRED_FROM_INDIVIDUAL_COUNT;GEODETIC_DATUM_ASSUMED_WGS84;ELEVATION_NON_NUMERIC;INSTITUTION_MATCH_FUZZY;COLLECTION_MATCH_NONE"
45.575556,-21.566111,"Erythroxylum corymbosum",4031915485,"District & Commune: Beroroha. Fokontany: Betorabato. Abotorabatorano.","MDG",NA,2011,"PRESERVED_SPECIMEN","OCCURRENCE_STATUS_INFERRED_FROM_INDIVIDUAL_COUNT;COORDINATE_ROUNDED;GEODETIC_DATUM_ASSUMED_WGS84;INSTITUTION_MATCH_FUZZY;COLLECTION_MATCH_NONE"
48.401111,-18.783611,"Erythroxylum corymbosum",4031849895,"Moramanga, Andasibe, Andasifahatelo, Marinjo. Corridor Forestier Analamay Mantadia.","MDG",NA,2012,"PRESERVED_SPECIMEN","OCCURRENCE_STATUS_INFERRED_FROM_INDIVIDUAL_COUNT;COORDINATE_ROUNDED;GEODETIC_DATUM_ASSUMED_WGS84;INSTITUTION_MATCH_FUZZY;COLLECTION_MATCH_NONE"
45.1487,-12.91917,"Erythroxylum corymbosum",4052092317,"","MYT",5356,2020,"HUMAN_OBSERVATION","COUNTRY_MISMATCH;CONTINENT_DERIVED_FROM_COORDINATES"
48.637222,-19.235555,"Erythroxylum corymbosum",4061866729,"Atsinanana, Vatomandry, Ambalabe. Le long de la route Ambalabe-Mahatsara. Echantillons préservés en alcool.","MDG",NA,2011,"PRESERVED_SPECIMEN","OCCURRENCE_STATUS_INFERRED_FROM_INDIVIDUAL_COUNT;COORDINATE_ROUNDED;GEODETIC_DATUM_ASSUMED_WGS84;DIFFERENT_OWNER_INSTITUTION"
49.41666,-17.26666,"Erythroxylum corymbosum",4031989294,"Station Forestiere de Tampolo, 10 km N. of Fenoarivo. Littoral Forest. Plant preserved in alcohol and collected under the second Madagasacar Field Botany Training Course and students from ESSA.","MDG",NA,1997,"PRESERVED_SPECIMEN","OCCURRENCE_STATUS_INFERRED_FROM_INDIVIDUAL_COUNT;GEODETIC_DATUM_ASSUMED_WGS84;INSTITUTION_MATCH_FUZZY;COLLECTION_MATCH_NONE"
47.71166,-23.02611,"Erythroxylum corymbosum",4031507075,"Fivondronana: Farafangana, Fokontany: Mananivo. Forêt Classée de Manombo, bloc d'Analambotaka (Anambotaka). Forêt dense humide de basse altitude sur latérite. Echantillon préservé dans l'alcool.","MDG",NA,2001,"PRESERVED_SPECIMEN","OCCURRENCE_STATUS_INFERRED_FROM_INDIVIDUAL_COUNT;GEODETIC_DATUM_ASSUMED_WGS84;INSTITUTION_MATCH_FUZZY;COLLECTION_MATCH_NONE"
49.431945,-14.922778,"Erythroxylum corymbosum",4031640661,"Fokotany Tsaravilona Amparihy Androva, suivant la ligne de crête au nord du campII vers sud est. Echantillons préservés en alcool","MDG",NA,2008,"PRESERVED_SPECIMEN","OCCURRENCE_STATUS_INFERRED_FROM_INDIVIDUAL_COUNT;COORDINATE_ROUNDED;GEODETIC_DATUM_ASSUMED_WGS84;INSTITUTION_MATCH_FUZZY;COLLECTION_MATCH_NONE"
47.45,-21.25,"Erythroxylum corymbosum",2517881572,"Fianarantsoa, Between Fianarantsoa and Ifandiana. Route Nationale 45, Parc National Ranomafana; trail S from Cabine de Reserche to Vato camp.","MDG",NA,1991,"PRESERVED_SPECIMEN","INSTITUTION_MATCH_FUZZY;INSTITUTION_COLLECTION_MISMATCH"
47.683333,-23.183333,"Erythroxylum corymbosum",4031634359,"Région Sud-Est, Farafangana, Mahabo Mananivo. Forêt d'Analazaha à l'Est du fokontany Nosiala, forêt dégradée à dominance de Agarista salicifolia. Echantillons préservés en alcool.","MDG",NA,2004,"PRESERVED_SPECIMEN","OCCURRENCE_STATUS_INFERRED_FROM_INDIVIDUAL_COUNT;COORDINATE_ROUNDED;GEODETIC_DATUM_ASSUMED_WGS84;INSTITUTION_MATCH_FUZZY;COLLECTION_MATCH_NONE"
48.555,-13.43388,"Erythroxylum corymbosum",4031987932,"Forêt d'Ambato à 400 m à l'Ouest du campement, Antsatsaka, Ambanja. Echantillon récolté avec C. Birkinshaw, P. Antilahimena, R. Randrianaivo, H. Ralimanana et H. Ravololonanahary; préservé en alcool.","MDG",NA,1996,"PRESERVED_SPECIMEN","OCCURRENCE_STATUS_INFERRED_FROM_INDIVIDUAL_COUNT;GEODETIC_DATUM_ASSUMED_WGS84;ELEVATION_NON_NUMERIC;INSTITUTION_MATCH_FUZZY;COLLECTION_MATCH_NONE"
49.36361,-14.385,"Erythroxylum corymbosum",4031782713,"Sava, Andapa, Doany, Andranomololo. Forêt humide d'Andramanalana. Echantillon préservé en alcool. Récolté avec D. Ravelonarivo & C. Rakotovao.","MDG",NA,2006,"PRESERVED_SPECIMEN","OCCURRENCE_STATUS_INFERRED_FROM_INDIVIDUAL_COUNT;GEODETIC_DATUM_ASSUMED_WGS84;INSTITUTION_MATCH_FUZZY;COLLECTION_MATCH_NONE"
48.283333,-14.066667,"Erythroxylum corymbosum",2516219770,"Besinkara, Ambalafary, Andavakena: premier cours d'eau sur le chemin du Bekolosy, Coord. précised (laborde): 600640/1334630.","MDG",NA,1995,"PRESERVED_SPECIMEN","INSTITUTION_MATCH_FUZZY;INSTITUTION_COLLECTION_MISMATCH"
47.172222,-24.775,"Erythroxylum corymbosum",2515087143,"Toliara. Foret littorale a Sainte-Luce (Manafiafy), S9, Mahatalaky, Taolagnaro. Echantillon preserve en alcool.","MDG",NA,2000,"PRESERVED_SPECIMEN","INSTITUTION_MATCH_FUZZY;INSTITUTION_COLLECTION_MISMATCH"
47.140278,-24.568333,"Erythroxylum corymbosum",4031760613,"District Fort Dauphin, Commune Iaboakoho, Fokontany Iaboakoho. Forêt d'Ampasina, Ambohibatondrebora.","MDG",NA,2015,"PRESERVED_SPECIMEN","OCCURRENCE_STATUS_INFERRED_FROM_INDIVIDUAL_COUNT;COORDINATE_ROUNDED;GEODETIC_DATUM_ASSUMED_WGS84;INSTITUTION_MATCH_FUZZY;COLLECTION_MATCH_NONE"
44.529444,-18.062222,"Erythroxylum corymbosum",4031381104,"Beanka, partie sud. Sarodrano","MDG",NA,2011,"PRESERVED_SPECIMEN","OCCURRENCE_STATUS_INFERRED_FROM_INDIVIDUAL_COUNT;GEODETIC_DATUM_ASSUMED_WGS84;INSTITUTION_MATCH_FUZZY;COLLECTION_MATCH_NONE"
44.136389,-22.703056,"Erythroxylum corymbosum",4031391558,"Sakaraha, Mikoboka, Fanjakà Mahabo, forêt d'Analavelona, forêt de Vohimary.","MDG",NA,2017,"PRESERVED_SPECIMEN","OCCURRENCE_STATUS_INFERRED_FROM_INDIVIDUAL_COUNT;COORDINATE_ROUNDED;GEODETIC_DATUM_ASSUMED_WGS84;INSTITUTION_MATCH_FUZZY;COLLECTION_MATCH_NONE"
47.16666,-24.78333,"Erythroxylum corymbosum",4061529338,"Province: Toliara, Région: Anosy, Fokontany: Ambandrika, Direction Nord à partir du campement QMM, parcelle S9. Forêt littorale sur sable blanc de Sainte Luce. Récolté avec D. Rabehevitra & E. Ramisy. Echantillon préservé en alcool.","MDG",NA,2004,"PRESERVED_SPECIMEN","OCCURRENCE_STATUS_INFERRED_FROM_INDIVIDUAL_COUNT;GEODETIC_DATUM_ASSUMED_WGS84;DIFFERENT_OWNER_INSTITUTION"
48.79833,-13.85055,"Erythroxylum corymbosum",4061012927,"Tsaratanana Massif. River Bepaka, close to junction north River Ramena. Low elevation. Humid evergreen forest. Granite. Recolt|4e avec Patrice Antilahimena.","MDG",NA,2001,"PRESERVED_SPECIMEN","OCCURRENCE_STATUS_INFERRED_FROM_INDIVIDUAL_COUNT;GEODETIC_DATUM_ASSUMED_WGS84;INSTITUTION_MATCH_NONE"
49.517778,-13.215278,"Erythroxylum corymbosum",1257990752,"Daraina, forêt d'Antsahabe.","MDG",NA,2006,"PRESERVED_SPECIMEN","OCCURRENCE_STATUS_INFERRED_FROM_INDIVIDUAL_COUNT;COORDINATE_ROUNDED;GEODETIC_DATUM_ASSUMED_WGS84;DIFFERENT_OWNER_INSTITUTION"
48.71472,-13.58833,"Erythroxylum corymbosum",4061594597,"Chaïne Galoka, Mont Galoka, Galoka relevé 1, Anketrabe-Belinta, Ambilobe, Beramanja. Forêt dense humide. Récolté avec Tonga, M.S. Ravokatra, A. Lang, N. Manasse, C. Claude & G. Bocksberger.","MDG",NA,2005,"PRESERVED_SPECIMEN","OCCURRENCE_STATUS_INFERRED_FROM_INDIVIDUAL_COUNT;GEODETIC_DATUM_ASSUMED_WGS84;DIFFERENT_OWNER_INSTITUTION"
48.32277,-18.80916,"Erythroxylum corymbosum",1260137277,"Moramanga, Andasibe, Berano. Ambatovy forest. Récolté avec C. Rakotovao, Félix & Félix (guide).","MDG",NA,2005,"PRESERVED_SPECIMEN","OCCURRENCE_STATUS_INFERRED_FROM_INDIVIDUAL_COUNT;GEODETIC_DATUM_ASSUMED_WGS84;DIFFERENT_OWNER_INSTITUTION"
50.462222,-15.258611,"Erythroxylum corymbosum",1259775844,"Préfecture d'Antalaha, Commune d'Ambohitralanana et Cap Est (Ambodirafia). Forêt littorale sur sable blanc, dégradée par le cyclone et par le passage d'un feu sauvage en Décembre 2001. Récolté avec D. Rabehevitra & B. Roger. Echantillons préservés en alcool.","MDG",NA,2002,"PRESERVED_SPECIMEN","OCCURRENCE_STATUS_INFERRED_FROM_INDIVIDUAL_COUNT;COORDINATE_ROUNDED;GEODETIC_DATUM_ASSUMED_WGS84;DIFFERENT_OWNER_INSTITUTION"
47.00944,-20.08388,"Erythroxylum corymbosum",4061571044,"Antsirabe, Ibity, Beapombo, à 400 m avant d'arriver au sommet d'Ibity.","MDG",NA,2003,"PRESERVED_SPECIMEN","OCCURRENCE_STATUS_INFERRED_FROM_INDIVIDUAL_COUNT;GEODETIC_DATUM_ASSUMED_WGS84;DIFFERENT_OWNER_INSTITUTION"
46.845,-24.63638,"Erythroxylum corymbosum",4061704064,"Andohahela (parcel 1). Plot de Suivi- à Marovoalavo (Ebaketra). 200 x 25 m. Forêt humide. Plante conservée en Alcool.","MDG",NA,1996,"PRESERVED_SPECIMEN","GEODETIC_DATUM_ASSUMED_WGS84;INSTITUTION_MATCH_NONE"
49.290556,-12.913889,"Erythroxylum corymbosum",4061860466,"Andrafiamena, forets aux alentours d'Anjahankely. A 1260 m du point cote 554, au 38?","MDG",NA,2011,"PRESERVED_SPECIMEN","OCCURRENCE_STATUS_INFERRED_FROM_INDIVIDUAL_COUNT;GEODETIC_DATUM_ASSUMED_WGS84;DIFFERENT_OWNER_INSTITUTION"
47.940556,-21.388333,"Erythroxylum corymbosum",1426064232,"Approach to Mt. Vatovavy (the Impenetrable Maiden), 2-3 km E of Ambolotara, just off RN#25 up to the concrete tomb.","MDG",NA,1998,"PRESERVED_SPECIMEN","COORDINATE_ROUNDED;GEODETIC_DATUM_ASSUMED_WGS84;COLLECTION_MATCH_FUZZY"
48.101667,-13.769167,"Erythroxylum corymbosum",4061243154,"Ampasindava, foret de Bongomihiravavy.","MDG",NA,2013,"PRESERVED_SPECIMEN","OCCURRENCE_STATUS_INFERRED_FROM_INDIVIDUAL_COUNT;GEODETIC_DATUM_ASSUMED_WGS84;DIFFERENT_OWNER_INSTITUTION"
46.767222,-20.516111,"Erythroxylum corymbosum",4061020697,"Fivondronana Ambatofinandrahana, Fokontany Ranomafana. Forêt sclérophylle de moyenne altitude ou forêt de Tapia dégradée à 4 Km au NW d'Ambatofinandrahana. Echantillons préservés en alcool.","MDG",NA,1999,"PRESERVED_SPECIMEN","OCCURRENCE_STATUS_INFERRED_FROM_INDIVIDUAL_COUNT;COORDINATE_ROUNDED;GEODETIC_DATUM_ASSUMED_WGS84;INSTITUTION_MATCH_NONE"
46.75,-24.68333,"Erythroxylum corymbosum",4061005124,"Andohahela PN. Emalio. Récoltes générales. Andranolava. Site de Suivi-eco-tourisme.","MDG",NA,1996,"PRESERVED_SPECIMEN","GEODETIC_DATUM_ASSUMED_WGS84;INSTITUTION_MATCH_NONE"
48.93611,-18.82444,"Erythroxylum corymbosum",4061576450,"Brickaville, Anivorano Sud, Ambalatenina, forêt de Sahafina, environ 12 km au Nord d'Anivorano Sud, Mahalila. Forêt dense humide de basse altitude. Echantillons préservées en alcool. Récolté avec D. Rabehevitra, T. Rabefarihy, F. Sampy & R. Sampialina.","MDG",NA,2006,"PRESERVED_SPECIMEN","OCCURRENCE_STATUS_INFERRED_FROM_INDIVIDUAL_COUNT;GEODETIC_DATUM_ASSUMED_WGS84;DIFFERENT_OWNER_INSTITUTION"
49.13333,-18.85,"Erythroxylum corymbosum",1258367393,"Eastern Domain: 1 km N. of Ambila-Lemaitso which is 10 km E. of Brickaville. Coastal dune forest.","MDG",NA,1987,"PRESERVED_SPECIMEN","OCCURRENCE_STATUS_INFERRED_FROM_INDIVIDUAL_COUNT;GEODETIC_DATUM_ASSUMED_WGS84;ELEVATION_NON_NUMERIC;INSTITUTION_MATCH_FUZZY;COLLECTION_MATCH_NONE"
45.10717,-12.80354,"Erythroxylum corymbosum",3073545921,"","MYT",5000,2015,"HUMAN_OBSERVATION","COUNTRY_MISMATCH;GEODETIC_DATUM_ASSUMED_WGS84;CONTINENT_DERIVED_FROM_COORDINATES"
47.500556,-23.439167,"Erythroxylum corymbosum",4061210151,"Vangaindrano, Tsanofana, Andasibe, à 3 km au Nord de Mandratsira, AP Agnakatrika.","MDG",NA,2016,"PRESERVED_SPECIMEN","OCCURRENCE_STATUS_INFERRED_FROM_INDIVIDUAL_COUNT;COORDINATE_ROUNDED;GEODETIC_DATUM_ASSUMED_WGS84;DIFFERENT_OWNER_INSTITUTION"
45.18478,-12.97893,"Erythroxylum corymbosum",3310129876,"","MYT",5000,2010,"HUMAN_OBSERVATION","COUNTRY_MISMATCH;GEODETIC_DATUM_ASSUMED_WGS84;CONTINENT_DERIVED_FROM_COORDINATES"
45.1834,-12.76532,"Erythroxylum corymbosum",3310339910,"","MYT",5000,2018,"HUMAN_OBSERVATION","COUNTRY_MISMATCH;GEODETIC_DATUM_ASSUMED_WGS84;CONTINENT_DERIVED_FROM_COORDINATES"
47.73111,-22.98916,"Erythroxylum corymbosum",1260260113,"Farafangana, Ankarana, village le plus proche Manombo. Forêt dense humide de basse altitude de la réserve spéciale de Manombo sur latérite, parcelle 1, forêt de Manararano. Echantillon préservé en alcool. Récolté avec M. Rabarimanarivo, R. Razakamalala, F. Rambo, Larzé & J. Andriamarohavana.","MDG",NA,2005,"PRESERVED_SPECIMEN","OCCURRENCE_STATUS_INFERRED_FROM_INDIVIDUAL_COUNT;GEODETIC_DATUM_ASSUMED_WGS84;DIFFERENT_OWNER_INSTITUTION"
49.743611,-14.436944,"Erythroxylum corymbosum",4061625688,"Marojejy RNI no. 12. Path from Mandena to the summit of Marojejy. Collections around camp 3. Ridge-top forest. Plants preserved in alcohol.","MDG",NA,1994,"PRESERVED_SPECIMEN","OCCURRENCE_STATUS_INFERRED_FROM_INDIVIDUAL_COUNT;COORDINATE_ROUNDED;GEODETIC_DATUM_ASSUMED_WGS84;INSTITUTION_MATCH_NONE"
48.578,-18.198,"Erythroxylum corymbosum",197092216,"Didy","MDG",NA,1998,"HUMAN_OBSERVATION","GEODETIC_DATUM_ASSUMED_WGS84;CONTINENT_DERIVED_FROM_COORDINATES"
48.813,-18.695,"Erythroxylum corymbosum",197092245,"Andriantantely","MDG",NA,1998,"HUMAN_OBSERVATION","GEODETIC_DATUM_ASSUMED_WGS84;CONTINENT_DERIVED_FROM_COORDINATES"
47.143,-16.229,"Erythroxylum corymbosum",197092176,"Lac Tsimaloto","MDG",NA,1997,"HUMAN_OBSERVATION","GEODETIC_DATUM_ASSUMED_WGS84;CONTINENT_DERIVED_FROM_COORDINATES;TAXON_MATCH_FUZZY"
46.53805,-24.83888,"Erythroxylum corymbosum",4061028423,"Andohahela (parcel 1). Site touristique de Tsimelahy au bord de la rivière de Taransty au Sud-ouest du village.","MDG",NA,1996,"PRESERVED_SPECIMEN","GEODETIC_DATUM_ASSUMED_WGS84;INSTITUTION_MATCH_NONE"
44.27417,-18.00056,"Erythroxylum corymbosum",1144675893,"Beanka, partie centrale - Prov.Mahajanga, Melaky, Belitsaka","MDG",50,2009,"PRESERVED_SPECIMEN","GEODETIC_DATUM_ASSUMED_WGS84;CONTINENT_DERIVED_FROM_COORDINATES;INSTITUTION_MATCH_FUZZY;COLLECTION_MATCH_NONE"
