"lon","lat","species","gbifID","locality","countryCode","coordinateUncertaintyInMeters","year","basisOfRecord","issue"
-84.55,75.683333,"Festuca hyperborea",1988098611,"basecamp lowlands, Devon Island","CAN",NA,1967,"PRESERVED_SPECIMEN","GEODETIC_DATUM_ASSUMED_WGS84;GEODETIC_DATUM_INVALID;CONTINENT_DERIVED_FROM_COORDINATES;INSTITUTION_MATCH_NONE"
-17.666667,80.816667,"Festuca hyperborea",1988162871,"north greenland, amdrup land, north of ingolf fjord","GRL",NA,1993,"PRESERVED_SPECIMEN","COUNTRY_DERIVED_FROM_COORDINATES;GEODETIC_DATUM_ASSUMED_WGS84;GEODETIC_DATUM_INVALID;CONTINENT_DERIVED_FROM_COORDINATES;INSTITUTION_MATCH_NONE"
-103.55,78.766667,"Festuca hyperborea",1988127462,"isachsen, 1 miles south of station, ellef ringnes Island, Franklin District","CAN",NA,1960,"PRESERVED_SPECIMEN","GEODETIC_DATUM_ASSUMED_WGS84;GEODETIC_DATUM_INVALID;CONTINENT_DERIVED_FROM_COORDINATES;INSTITUTION_MATCH_NONE"
-178.420372,70.989915,"Festuca hyperborea",1697184494,"","RUS",1000,1970,"PRESERVED_SPECIMEN","CONTINENT_DERIVED_FROM_COORDINATES;INSTITUTION_MATCH_FUZZY;COLLECTION_MATCH_FUZZY"
17.0366452,78.3416289,"Festuca hyperborea",1701999771,"Sassendalen: Coloradofjella, N slope towards Storgjelet, snowbed slope","SJM",1118,1997,"PRESERVED_SPECIMEN","COORDINATE_REPROJECTED;COUNTRY_DERIVED_FROM_COORDINATES;CONTINENT_DERIVED_FROM_COORDINATES"
16.355022,78.184341,"Festuca hyperborea",2382965454,"Adventdalen","SJM",1000,1997,"HUMAN_OBSERVATION","COORDINATE_ROUNDED;COUNTRY_DERIVED_FROM_COORDINATES;CONTINENT_DERIVED_FROM_COORDINATES"
17.1015526,78.332129,"Festuca hyperborea",1323812217,"Sassen, Coloradofjella","SJM",707,1987,"PRESERVED_SPECIMEN","COORDINATE_REPROJECTED;COUNTRY_DERIVED_FROM_COORDINATES;CONTINENT_DERIVED_FROM_COORDINATES"
16.5664644,78.0563114,"Festuca hyperborea",1323826589,"Upper Reindalen, N side: Largest pingo below Merckollfjell, summit hillocks.","SJM",71,1985,"PRESERVED_SPECIMEN","COORDINATE_REPROJECTED;COUNTRY_DERIVED_FROM_COORDINATES;CONTINENT_DERIVED_FROM_COORDINATES"
16.644,77.8888,"Festuca hyperborea",1837334688,"Sveagruva i Van Mijenfjorden.","SJM",707,1990,"PRESERVED_SPECIMEN","COUNTRY_DERIVED_FROM_COORDINATES;CONTINENT_DERIVED_FROM_COORDINATES"
-56.909722,51.480556,"Festuca hyperborea",1248736896,"Forteau Bay, 1 kilomètre au sud-est de English Point, 100 mètres au nord de la route 138.","CAN",NA,1994,"PRESERVED_SPECIMEN","GEODETIC_DATUM_ASSUMED_WGS84;GEODETIC_DATUM_INVALID;INSTITUTION_MATCH_FUZZY;COLLECTION_MATCH_FUZZY"
-57.066667,51.45,"Festuca hyperborea",1248736943,"Sud du Labrador (détroit de Belle-Isle): entre L'Anse-au-Clair et Forteau. Le long d'un chemin secondaire, du coté sud de la route principale, donnant accès à une gravière.","CAN",NA,1994,"PRESERVED_SPECIMEN","INSTITUTION_MATCH_FUZZY;COLLECTION_MATCH_FUZZY"
-57.169722,51.422222,"Festuca hyperborea",1248736938,"Basse-Côte-Nord; Lourdes-de-Blanc-Sablon, mont Parent","CAN",NA,2004,"PRESERVED_SPECIMEN","GEODETIC_DATUM_ASSUMED_WGS84;GEODETIC_DATUM_INVALID;INSTITUTION_MATCH_FUZZY;COLLECTION_MATCH_FUZZY"
-62.01825,82.461333,"Festuca hyperborea",3340932488,"Île d'Ellesmere. Station des Forces canadiennes Alert.","CAN",NA,2019,"PRESERVED_SPECIMEN","GEODETIC_DATUM_ASSUMED_WGS84;GEODETIC_DATUM_INVALID;INSTITUTION_MATCH_FUZZY;COLLECTION_MATCH_FUZZY"
-82.779999,74.529999,"Festuca hyperborea",3817780972,"Nunavut, Devon Island, Croker Bay, E side near entrance","CAN",NA,1999,"PRESERVED_SPECIMEN","COORDINATE_ROUNDED;GEODETIC_DATUM_ASSUMED_WGS84;CONTINENT_DERIVED_FROM_COORDINATES"
-98.419998,75.730003,"Festuca hyperborea",3350173673,"Nunavut, Bathurst Island, Polar Bear Pass, Research Station","CAN",NA,2000,"PRESERVED_SPECIMEN","COORDINATE_ROUNDED;GEODETIC_DATUM_ASSUMED_WGS84;CONTINENT_DERIVED_FROM_COORDINATES"
15.4595,78.6468,"Festuca hyperborea",1837335244,"Dicksonfjorden, Lyckholmdalen.","SJM",100,2017,"PRESERVED_SPECIMEN","COUNTRY_DERIVED_FROM_COORDINATES;GEODETIC_DATUM_ASSUMED_WGS84;CONTINENT_DERIVED_FROM_COORDINATES;INSTITUTION_MATCH_FUZZY;INSTITUTION_COLLECTION_MISMATCH"
21.2351,78.6013,"Festuca hyperborea",1701775912,"Frankenhalvøya.","SJM",7071,1977,"PRESERVED_SPECIMEN","COUNTRY_DERIVED_FROM_COORDINATES;GEODETIC_DATUM_ASSUMED_WGS84;CONTINENT_DERIVED_FROM_COORDINATES;INSTITUTION_MATCH_FUZZY;INSTITUTION_COLLECTION_MISMATCH"
151.30285,60.67064,"Festuca hyperborea",3988417427,"","RUS",NA,1970,"PRESERVED_SPECIMEN","CONTINENT_DERIVED_FROM_COORDINATES;DIFFERENT_OWNER_INSTITUTION"
-90,79.4167,"Festuca hyperborea",1804511090,"Port Hendrigan Bellevue nunatak Axel Heiberg Island.","CAN",NA,1962,"PRESERVED_SPECIMEN","OCCURRENCE_STATUS_INFERRED_FROM_INDIVIDUAL_COUNT;GEODETIC_DATUM_ASSUMED_WGS84;CONTINENT_DERIVED_FROM_COORDINATES;COLLECTION_MATCH_FUZZY"
-107.55,70.6667,"Festuca hyperborea",1806447842,"Kitikmeot Region: Victoria Island, Namaycush Lake.","CAN",NA,1987,"PRESERVED_SPECIMEN","OCCURRENCE_STATUS_INFERRED_FROM_INDIVIDUAL_COUNT;GEODETIC_DATUM_ASSUMED_WGS84;CONTINENT_DERIVED_FROM_COORDINATES;COLLECTION_MATCH_FUZZY"
-94.9,74.6833,"Festuca hyperborea",1804385283,"Resolute Bay Old town site, beside lake N of major archaeological excavation and Queen\'s Platform site highly disturbed alkaline beach gravel and silt.","CAN",NA,1986,"PRESERVED_SPECIMEN","OCCURRENCE_STATUS_INFERRED_FROM_INDIVIDUAL_COUNT;GEODETIC_DATUM_ASSUMED_WGS84;CONTINENT_DERIVED_FROM_COORDINATES;COLLECTION_MATCH_FUZZY"
-98.2,75.7167,"Festuca hyperborea",1804498483,"Bathurst Island: Polar Bear Pass. High Arctic Station.","CAN",NA,1991,"PRESERVED_SPECIMEN","OCCURRENCE_STATUS_INFERRED_FROM_INDIVIDUAL_COUNT;GEODETIC_DATUM_ASSUMED_WGS84;CONTINENT_DERIVED_FROM_COORDINATES;COLLECTION_MATCH_FUZZY"
-101,75.5833,"Festuca hyperborea",1806447173,"Qikiqtaaluk Region: Bathurst Island, Bracebridge Inlet.","CAN",NA,1975,"PRESERVED_SPECIMEN","OCCURRENCE_STATUS_INFERRED_FROM_INDIVIDUAL_COUNT;GEODETIC_DATUM_ASSUMED_WGS84;CONTINENT_DERIVED_FROM_COORDINATES;COLLECTION_MATCH_FUZZY"
-105.604,77.5151,"Festuca hyperborea",1804565466,"Lougheed Island. Site 56, weakly alkaline to neutral sandy marine reworked into vague flights of beaches.","CAN",NA,1979,"PRESERVED_SPECIMEN","OCCURRENCE_STATUS_INFERRED_FROM_INDIVIDUAL_COUNT;CONTINENT_DERIVED_FROM_COORDINATES;COLLECTION_MATCH_FUZZY"
-82.7167,79.9,"Festuca hyperborea",1804607513,"Sawtooth Range Site 201. Sandstone cobbles and sand of a steep fluvial outwash terrace from the northernmost ice field ice field on Fosheim Peninsula","CAN",NA,1988,"PRESERVED_SPECIMEN","OCCURRENCE_STATUS_INFERRED_FROM_INDIVIDUAL_COUNT;GEODETIC_DATUM_ASSUMED_WGS84;CONTINENT_DERIVED_FROM_COORDINATES;COLLECTION_MATCH_FUZZY"
-107.633,75.1,"Festuca hyperborea",1804372699,"Melville Island, SE. NE of head of Beverley Inlet, E of river, 0.5 - 2.5 km from sea.","CAN",NA,1999,"PRESERVED_SPECIMEN","OCCURRENCE_STATUS_INFERRED_FROM_INDIVIDUAL_COUNT;GEODETIC_DATUM_ASSUMED_WGS84;CONTINENT_DERIVED_FROM_COORDINATES;COLLECTION_MATCH_FUZZY"
-94.6833,77.75,"Festuca hyperborea",1804433569,"Nicolay Bay Cornwall Island.","CAN",NA,1961,"PRESERVED_SPECIMEN","OCCURRENCE_STATUS_INFERRED_FROM_INDIVIDUAL_COUNT;GEODETIC_DATUM_ASSUMED_WGS84;CONTINENT_DERIVED_FROM_COORDINATES;COLLECTION_MATCH_FUZZY"
-71.3333,81.8167,"Festuca hyperborea",1804418019,"Hazen Camp, N shore of Lake Hazen. Blister hill, ~2 km west of camp, channel to southwest of Hill, Quttinirpaaq National Park Reserve.","CAN",NA,1999,"PRESERVED_SPECIMEN","OCCURRENCE_STATUS_INFERRED_FROM_INDIVIDUAL_COUNT;GEODETIC_DATUM_ASSUMED_WGS84;CONTINENT_DERIVED_FROM_COORDINATES;COLLECTION_MATCH_FUZZY"
-71.5146,81.8359,"Festuca hyperborea",1913349441,"Ellesmere Island: Quttinirpaaq National Park, SE face of McGill Mountain, vicinity of \seep # 5\, approximately 3 km NW of Lake Hazen Camp.","CAN",NA,2017,"PRESERVED_SPECIMEN","OCCURRENCE_STATUS_INFERRED_FROM_INDIVIDUAL_COUNT;CONTINENT_DERIVED_FROM_COORDINATES;COLLECTION_MATCH_FUZZY"
-71.3994,81.8501,"Festuca hyperborea",1913350402,"Ellesmere Island: Quttinirpaaq National Park, valley on east side of McGill Mountain, approximately 3.5 km N of Lake Hazen Camp.","CAN",NA,2017,"PRESERVED_SPECIMEN","OCCURRENCE_STATUS_INFERRED_FROM_INDIVIDUAL_COUNT;CONTINENT_DERIVED_FROM_COORDINATES;COLLECTION_MATCH_FUZZY"
-106.233,71.7833,"Festuca hyperborea",1806446866,"Kitikmeot Region: Victoria Island, Storkerson Peninsula, Site 51.","CAN",NA,1986,"PRESERVED_SPECIMEN","OCCURRENCE_STATUS_INFERRED_FROM_INDIVIDUAL_COUNT;GEODETIC_DATUM_ASSUMED_WGS84;CONTINENT_DERIVED_FROM_COORDINATES;COLLECTION_MATCH_FUZZY"
-113.367,74.8333,"Festuca hyperborea",1913352605,"Inuvik Region: Melville Island, Shellabear Point.","CAN",NA,1980,"PRESERVED_SPECIMEN","OCCURRENCE_STATUS_INFERRED_FROM_INDIVIDUAL_COUNT;GEODETIC_DATUM_ASSUMED_WGS84;CONTINENT_DERIVED_FROM_COORDINATES;COLLECTION_MATCH_FUZZY"
-89.9911,77.4455,"Festuca hyperborea",1913352708,"Qikiqtaaluk Region: Graham Island, Site 26-7-2.","CAN",NA,1974,"PRESERVED_SPECIMEN","OCCURRENCE_STATUS_INFERRED_FROM_INDIVIDUAL_COUNT;GEODETIC_DATUM_ASSUMED_WGS84;CONTINENT_DERIVED_FROM_COORDINATES;COLLECTION_MATCH_FUZZY"
-70.75,82.1167,"Festuca hyperborea",1804505142,"Quttinirpaaq National Park Reserve. Gilman Glacier Nunatak east of glacier Lake Hazen area northern Ellesmere Island.","CAN",NA,1957,"PRESERVED_SPECIMEN","OCCURRENCE_STATUS_INFERRED_FROM_INDIVIDUAL_COUNT;GEODETIC_DATUM_ASSUMED_WGS84;CONTINENT_DERIVED_FROM_COORDINATES;COLLECTION_MATCH_FUZZY"
-119.508,76.3583,"Festuca hyperborea",1804377479,"Head of bay, 14 km N of the abandoned Mould Bay weather station.","CAN",NA,2000,"PRESERVED_SPECIMEN","OCCURRENCE_STATUS_INFERRED_FROM_INDIVIDUAL_COUNT;GEODETIC_DATUM_ASSUMED_WGS84;CONTINENT_DERIVED_FROM_COORDINATES;COLLECTION_MATCH_FUZZY"
-118.885,76.5611,"Festuca hyperborea",1804402181,"Green Bay, valley at head of north arm of bay.","CAN",NA,2000,"PRESERVED_SPECIMEN","OCCURRENCE_STATUS_INFERRED_FROM_INDIVIDUAL_COUNT;GEODETIC_DATUM_ASSUMED_WGS84;CONTINENT_DERIVED_FROM_COORDINATES;COLLECTION_MATCH_FUZZY"
-95.0667,74.75,"Festuca hyperborea",1806446096,"Resolute, beside road to radio station; on hill, about 1 km from the tower.","CAN",NA,1992,"PRESERVED_SPECIMEN","OCCURRENCE_STATUS_INFERRED_FROM_INDIVIDUAL_COUNT;GEODETIC_DATUM_ASSUMED_WGS84;CONTINENT_DERIVED_FROM_COORDINATES;COLLECTION_MATCH_FUZZY"
-85.8164,79.9976,"Festuca hyperborea",1913349924,"Ellesmere Island: Fosheim Peninsula, Eureka Airport, tundra expanse immediately north of runway.","CAN",NA,2017,"PRESERVED_SPECIMEN","OCCURRENCE_STATUS_INFERRED_FROM_INDIVIDUAL_COUNT;CONTINENT_DERIVED_FROM_COORDINATES;COLLECTION_MATCH_FUZZY"
-94.0619,61.11,"Festuca hyperborea",1913352954,"Arviat, sandy slope on east embankment under Nunavut Research Institute research trailer","CAN",NA,2016,"PRESERVED_SPECIMEN","OCCURRENCE_STATUS_INFERRED_FROM_INDIVIDUAL_COUNT;GEODETIC_DATUM_ASSUMED_WGS84;CONTINENT_DERIVED_FROM_COORDINATES;COLLECTION_MATCH_FUZZY"
-71.4628,81.8288,"Festuca hyperborea",1913348347,"Ellesmere Island: Quttinirpaaq National Park, small pond on Blister Hill, approximately 2 km NW of Lake Hazen Camp.","CAN",NA,2017,"PRESERVED_SPECIMEN","OCCURRENCE_STATUS_INFERRED_FROM_INDIVIDUAL_COUNT;CONTINENT_DERIVED_FROM_COORDINATES;COLLECTION_MATCH_FUZZY"
-84.8079,80.1211,"Festuca hyperborea",1913350410,"Ellesmere Island: Fosheim Peninsula, sandstone foothills north of Black Top Range, approximately 25 km NE of Eureka.","CAN",NA,2017,"PRESERVED_SPECIMEN","OCCURRENCE_STATUS_INFERRED_FROM_INDIVIDUAL_COUNT;CONTINENT_DERIVED_FROM_COORDINATES;COLLECTION_MATCH_FUZZY"
-97.8614,76,"Festuca hyperborea",1804552179,"Bathurst Island: Near Walker River, 10 km west of Frank Miller\'s C.W.S. Camp.","CAN",NA,1992,"PRESERVED_SPECIMEN","OCCURRENCE_STATUS_INFERRED_FROM_INDIVIDUAL_COUNT;GEODETIC_DATUM_ASSUMED_WGS84;CONTINENT_DERIVED_FROM_COORDINATES;COLLECTION_MATCH_FUZZY"
-110.533,74.7667,"Festuca hyperborea",1804428212,"Winter Harbour Area of.","CAN",NA,1971,"PRESERVED_SPECIMEN","OCCURRENCE_STATUS_INFERRED_FROM_INDIVIDUAL_COUNT;GEODETIC_DATUM_ASSUMED_WGS84;CONTINENT_DERIVED_FROM_COORDINATES;COLLECTION_MATCH_FUZZY"
-116.583,75.8167,"Festuca hyperborea",1804469813,"Melville Island: Ibbett Bay near Humphries Head on south shore.","CAN",NA,1986,"PRESERVED_SPECIMEN","OCCURRENCE_STATUS_INFERRED_FROM_INDIVIDUAL_COUNT;GEODETIC_DATUM_ASSUMED_WGS84;CONTINENT_DERIVED_FROM_COORDINATES;COLLECTION_MATCH_FUZZY"
-84.4386,79.9711,"Festuca hyperborea",1804577491,"Ellesmere Island: Sawtooth Range, W side.","CAN",NA,1999,"PRESERVED_SPECIMEN","OCCURRENCE_STATUS_INFERRED_FROM_INDIVIDUAL_COUNT;GEODETIC_DATUM_ASSUMED_WGS84;CONTINENT_DERIVED_FROM_COORDINATES;COLLECTION_MATCH_FUZZY"
-82.5583,74.5217,"Festuca hyperborea",1804407967,"Devon Island: Dundas Harbour, W of harbour mouth.","CAN",NA,1999,"PRESERVED_SPECIMEN","OCCURRENCE_STATUS_INFERRED_FROM_INDIVIDUAL_COUNT;GEODETIC_DATUM_ASSUMED_WGS84;CONTINENT_DERIVED_FROM_COORDINATES;COLLECTION_MATCH_FUZZY"
-89,80.9833,"Festuca hyperborea",1804549823,"Otto Fjord Ellesmere Island.","CAN",NA,1961,"PRESERVED_SPECIMEN","OCCURRENCE_STATUS_INFERRED_FROM_INDIVIDUAL_COUNT;GEODETIC_DATUM_ASSUMED_WGS84;CONTINENT_DERIVED_FROM_COORDINATES;COLLECTION_MATCH_FUZZY"
-116.95,75.3833,"Festuca hyperborea",1804370306,"Purchase Bay, S of; Site 291, SW Melville Island. Plateau midway along the river exiting at Comfort Cove.","CAN",NA,1985,"PRESERVED_SPECIMEN","OCCURRENCE_STATUS_INFERRED_FROM_INDIVIDUAL_COUNT;GEODETIC_DATUM_ASSUMED_WGS84;CONTINENT_DERIVED_FROM_COORDINATES;COLLECTION_MATCH_FUZZY"
-75.75,78.8833,"Festuca hyperborea",1806445379,"ELLESMERE ISLAND: RCMP Post, Alexandra Fiord","CAN",NA,1991,"PRESERVED_SPECIMEN","OCCURRENCE_STATUS_INFERRED_FROM_INDIVIDUAL_COUNT;GEODETIC_DATUM_ASSUMED_WGS84;CONTINENT_DERIVED_FROM_COORDINATES;COLLECTION_MATCH_FUZZY"
-84.6667,75.6833,"Festuca hyperborea",1804550656,"Truelove Inlet Devon Island.","CAN",NA,1974,"PRESERVED_SPECIMEN","OCCURRENCE_STATUS_INFERRED_FROM_INDIVIDUAL_COUNT;GEODETIC_DATUM_ASSUMED_WGS84;CONTINENT_DERIVED_FROM_COORDINATES;COLLECTION_MATCH_FUZZY"
-86.15,80.1833,"Festuca hyperborea",1804602801,"Fosheim Peninsula, Northwestern area of; Weathered bedrock ridge north-facing slope with numerous solifluction lobes and local snow paths. Site 249.","CAN",NA,1988,"PRESERVED_SPECIMEN","OCCURRENCE_STATUS_INFERRED_FROM_INDIVIDUAL_COUNT;GEODETIC_DATUM_ASSUMED_WGS84;CONTINENT_DERIVED_FROM_COORDINATES;COLLECTION_MATCH_FUZZY"
-109.59,74.9072,"Festuca hyperborea",1804377142,"Approximately 5 km from the south-central coastline.","CAN",NA,2009,"PRESERVED_SPECIMEN","OCCURRENCE_STATUS_INFERRED_FROM_INDIVIDUAL_COUNT;GEODETIC_DATUM_ASSUMED_WGS84;CONTINENT_DERIVED_FROM_COORDINATES;COLLECTION_MATCH_FUZZY"
-76.9167,81.4167,"Festuca hyperborea",1804587517,"Quttinirpaaq National Park Reserve. Tanquary Fiord Head of ca 7 km SW of Tanquary Camp.","CAN",NA,1967,"PRESERVED_SPECIMEN","OCCURRENCE_STATUS_INFERRED_FROM_INDIVIDUAL_COUNT;GEODETIC_DATUM_ASSUMED_WGS84;CONTINENT_DERIVED_FROM_COORDINATES;COLLECTION_MATCH_FUZZY"
-116.333944,71.219417,"Festuca hyperborea",1417514199,"Victoria Island: Minto Inlet. Gentle slope below steep scree below a large conical hill, E of Fish lake on lower Kuujjua River, 17 km SE of Minto Inlet.","CAN",NA,2010,"PRESERVED_SPECIMEN","COORDINATE_ROUNDED;DIFFERENT_OWNER_INSTITUTION"
161.481416,70.90304,"Festuca hyperborea",1697184473,"","RUS",4500,1971,"PRESERVED_SPECIMEN","CONTINENT_DERIVED_FROM_COORDINATES;INSTITUTION_MATCH_FUZZY;COLLECTION_MATCH_FUZZY"
99.70921,74.46246,"Festuca hyperborea",1697184503,"","RUS",NA,2004,"PRESERVED_SPECIMEN","CONTINENT_DERIVED_FROM_COORDINATES;INSTITUTION_MATCH_FUZZY;COLLECTION_MATCH_FUZZY"
21.101111,78.574444,"Festuca hyperborea",3004103384,"","SJM",NA,2011,"PRESERVED_SPECIMEN","CONTINENT_DERIVED_FROM_COORDINATES;INSTITUTION_MATCH_FUZZY;COLLECTION_MATCH_FUZZY"
112.709,75.62715,"Festuca hyperborea",1949917818,"","RUS",NA,2016,"PRESERVED_SPECIMEN","CONTINENT_DERIVED_FROM_COORDINATES;INSTITUTION_MATCH_FUZZY;COLLECTION_MATCH_FUZZY"
-21.033333,78.5,"Festuca hyperborea",1146320196,"Hertugen af Orleans Land, Norre Mellemland, N","GRL",1,1989,"PRESERVED_SPECIMEN","COORDINATE_ROUNDED;CONTINENT_DERIVED_FROM_COORDINATES;AMBIGUOUS_INSTITUTION"
-51.516667,81.533333,"Festuca hyperborea",1946175380,"Warming Land, GGU Base Camp","GRL",NA,1985,"PRESERVED_SPECIMEN","COORDINATE_ROUNDED;CONTINENT_DERIVED_FROM_COORDINATES;AMBIGUOUS_INSTITUTION"
21.6877593,79.7842336,"Festuca hyperborea",1702049399,"Wahlenbergfjorden: Kloverbladbukta","SJM",1118,1965,"PRESERVED_SPECIMEN","COORDINATE_REPROJECTED;COUNTRY_DERIVED_FROM_COORDINATES;CONTINENT_DERIVED_FROM_COORDINATES"
-30.5,82.17,"Festuca hyperborea",2848460366,"Vasculares Groenlandicae. Groenlandia septentrionalis: Heilprin Land, Brøn-lund Fjord.","GRL",NA,1963,"PRESERVED_SPECIMEN","GEODETIC_DATUM_ASSUMED_WGS84"
-118.949997,76.230003,"Festuca hyperborea",3350215640,"Northwest Territories, Prince Patrick Island, Mould Bay, Mould Bay Peninsula, east side, ca 10 km E of Mould Bay","CAN",NA,2000,"PRESERVED_SPECIMEN","COORDINATE_ROUNDED;GEODETIC_DATUM_ASSUMED_WGS84;CONTINENT_DERIVED_FROM_COORDINATES"
-92.059998,80.519997,"Festuca hyperborea",3350200748,"Nunavut, Axel Heiberg Island, Bukken River, High altitude meadow above Bukken River headwaters","CAN",NA,1999,"PRESERVED_SPECIMEN","COORDINATE_ROUNDED;GEODETIC_DATUM_ASSUMED_WGS84;CONTINENT_DERIVED_FROM_COORDINATES"
-115.25,71.3,"Festuca hyperborea",1804596802,"Kuujjua River, between river and Minto Inlet; high (1000 feet) plateau; weathered carbonate rubble and patches of thin silty till.","CAN",NA,1982,"PRESERVED_SPECIMEN","OCCURRENCE_STATUS_INFERRED_FROM_INDIVIDUAL_COUNT;GEODETIC_DATUM_ASSUMED_WGS84;CONTINENT_DERIVED_FROM_COORDINATES;COLLECTION_MATCH_FUZZY"
-65.5333,81.7483,"Festuca hyperborea",1806446661,"Qikiqtaaluk Region: Ellesmere Island, Tanquary Fiord, Site T88.","CAN",NA,1989,"PRESERVED_SPECIMEN","OCCURRENCE_STATUS_INFERRED_FROM_INDIVIDUAL_COUNT;GEODETIC_DATUM_ASSUMED_WGS84;CONTINENT_DERIVED_FROM_COORDINATES;COLLECTION_MATCH_FUZZY"
-122.779,71.0939,"Festuca hyperborea",1804477066,"Southernmost tip of Banks Island.","CAN",NA,2003,"PRESERVED_SPECIMEN","OCCURRENCE_STATUS_INFERRED_FROM_INDIVIDUAL_COUNT;GEODETIC_DATUM_ASSUMED_WGS84;CONTINENT_DERIVED_FROM_COORDINATES;COLLECTION_MATCH_FUZZY"
-95.8292,74.6958,"Festuca hyperborea",1804565152,"Cornwallis Island: Resolute.","CAN",NA,1992,"PRESERVED_SPECIMEN","OCCURRENCE_STATUS_INFERRED_FROM_INDIVIDUAL_COUNT;GEODETIC_DATUM_ASSUMED_WGS84;COLLECTION_MATCH_FUZZY"
-95.5333,77.4833,"Festuca hyperborea",1913352709,"Qikiqtaaluk Region: Cornwall Island.","CAN",NA,1979,"PRESERVED_SPECIMEN","OCCURRENCE_STATUS_INFERRED_FROM_INDIVIDUAL_COUNT;GEODETIC_DATUM_ASSUMED_WGS84;CONTINENT_DERIVED_FROM_COORDINATES;COLLECTION_MATCH_FUZZY"
-97.9167,75.75,"Festuca hyperborea",1804374158,"Bathurst Island: Goodsir Inlet, 12 miles west.","CAN",NA,1968,"PRESERVED_SPECIMEN","OCCURRENCE_STATUS_INFERRED_FROM_INDIVIDUAL_COUNT;GEODETIC_DATUM_ASSUMED_WGS84;CONTINENT_DERIVED_FROM_COORDINATES;COLLECTION_MATCH_FUZZY"
-83.0667,79.4667,"Festuca hyperborea",1806445426,"Qikiqtaaluk Region: Ellesmere Island, Fosheim Peninsula, Site 226.","CAN",NA,1988,"PRESERVED_SPECIMEN","OCCURRENCE_STATUS_INFERRED_FROM_INDIVIDUAL_COUNT;GEODETIC_DATUM_ASSUMED_WGS84;CONTINENT_DERIVED_FROM_COORDINATES;COLLECTION_MATCH_FUZZY"
-90.7481,79.4151,"Festuca hyperborea",1913349157,"Axel Heiberg Island: Expedition Fiord, vicinity of McGill Arctic Research Station.","CAN",NA,2017,"PRESERVED_SPECIMEN","OCCURRENCE_STATUS_INFERRED_FROM_INDIVIDUAL_COUNT;CONTINENT_DERIVED_FROM_COORDINATES;COLLECTION_MATCH_FUZZY"
-114.267,76.3333,"Festuca hyperborea",1804480193,"Sproule Peninsula Site 247, interfluve between two rivers west of Depot Island.","CAN",NA,1985,"PRESERVED_SPECIMEN","OCCURRENCE_STATUS_INFERRED_FROM_INDIVIDUAL_COUNT;GEODETIC_DATUM_ASSUMED_WGS84;CONTINENT_DERIVED_FROM_COORDINATES;COLLECTION_MATCH_FUZZY"
-82.65,78.8167,"Festuca hyperborea",1804497474,"Ellesmere Island: Mount Bell, adjacent to Bay Fiord, and opposite Martyr Island.","CAN",NA,1993,"PRESERVED_SPECIMEN","OCCURRENCE_STATUS_INFERRED_FROM_INDIVIDUAL_COUNT;GEODETIC_DATUM_ASSUMED_WGS84;CONTINENT_DERIVED_FROM_COORDINATES;COLLECTION_MATCH_FUZZY"
-113.417,75.375,"Festuca hyperborea",1804513380,"Murray Inlet Site 269. South of east arm morainic mounds of rubble from Hecla Bay Fm.","CAN",NA,1985,"PRESERVED_SPECIMEN","OCCURRENCE_STATUS_INFERRED_FROM_INDIVIDUAL_COUNT;GEODETIC_DATUM_ASSUMED_WGS84;CONTINENT_DERIVED_FROM_COORDINATES;COLLECTION_MATCH_FUZZY"
-90.8567,79.3933,"Festuca hyperborea",1804562470,"Axel Heiberg Island: Expedition Fiord, N side of Expedition River. Across river from Bastion Ridge, 10-20 m from current river level, on sand flats with large patches of salt coating.","CAN",NA,1999,"PRESERVED_SPECIMEN","OCCURRENCE_STATUS_INFERRED_FROM_INDIVIDUAL_COUNT;GEODETIC_DATUM_ASSUMED_WGS84;CONTINENT_DERIVED_FROM_COORDINATES;COLLECTION_MATCH_FUZZY"
-82.755,78.31,"Festuca hyperborea",1913352637,"Qikiqtaaluk Region: Ellesmere Island [southern Fosheim Peninsula], Site 24-7-13.","CAN",NA,1974,"PRESERVED_SPECIMEN","OCCURRENCE_STATUS_INFERRED_FROM_INDIVIDUAL_COUNT;GEODETIC_DATUM_ASSUMED_WGS84;CONTINENT_DERIVED_FROM_COORDINATES;COLLECTION_MATCH_FUZZY"
-96.8978,75.4367,"Festuca hyperborea",1804418400,"Little Cornwallis Island: 3 miles from mine on slope about 300 feet above sealevel.","CAN",NA,1992,"PRESERVED_SPECIMEN","OCCURRENCE_STATUS_INFERRED_FROM_INDIVIDUAL_COUNT;GEODETIC_DATUM_ASSUMED_WGS84;CONTINENT_DERIVED_FROM_COORDINATES;COLLECTION_MATCH_FUZZY"
-86.8833,79.2,"Festuca hyperborea",1806446286,"Qikiqtaaluk Region: Axel Heiberg Island [Eureka Sound], Site 282.","CAN",NA,1988,"PRESERVED_SPECIMEN","OCCURRENCE_STATUS_INFERRED_FROM_INDIVIDUAL_COUNT;GEODETIC_DATUM_ASSUMED_WGS84;CONTINENT_DERIVED_FROM_COORDINATES;COLLECTION_MATCH_FUZZY"
-114.2,76.4333,"Festuca hyperborea",1804499623,"Sproule Peninsula Site 248, main terraces near east coast between Depot Island and Cleverly Point sand primarily derived from Isachsen Fm. sandstone.","CAN",NA,1985,"PRESERVED_SPECIMEN","OCCURRENCE_STATUS_INFERRED_FROM_INDIVIDUAL_COUNT;GEODETIC_DATUM_ASSUMED_WGS84;CONTINENT_DERIVED_FROM_COORDINATES;COLLECTION_MATCH_FUZZY"
-83.2667,68.5333,"Festuca hyperborea",1804514551,"Sarcpa Lake 50 miles west of Hall Beach.","CAN",NA,1976,"PRESERVED_SPECIMEN","OCCURRENCE_STATUS_INFERRED_FROM_INDIVIDUAL_COUNT;GEODETIC_DATUM_ASSUMED_WGS84;CONTINENT_DERIVED_FROM_COORDINATES;COLLECTION_MATCH_FUZZY"
-104.717,73.6333,"Festuca hyperborea",1804546089,"Stefansson Island Site 150. Northeast corner of island. Silty marine deposit adjacent to and up to 0.25 km from the modern tidal zone.","CAN",NA,1986,"PRESERVED_SPECIMEN","OCCURRENCE_STATUS_INFERRED_FROM_INDIVIDUAL_COUNT;GEODETIC_DATUM_ASSUMED_WGS84;CONTINENT_DERIVED_FROM_COORDINATES;COLLECTION_MATCH_FUZZY"
-94.8333,74.6833,"Festuca hyperborea",1804378633,"Resolute Bay Cornwallis Island.","CAN",NA,1958,"PRESERVED_SPECIMEN","OCCURRENCE_STATUS_INFERRED_FROM_INDIVIDUAL_COUNT;GEODETIC_DATUM_ASSUMED_WGS84;CONTINENT_DERIVED_FROM_COORDINATES;COLLECTION_MATCH_FUZZY"
-114.2,75.4917,"Festuca hyperborea",1804383836,"Murray Inlet Site 255. West side of northwest arm, plateau on ancient lake on marine deposit in valley.","CAN",NA,1985,"PRESERVED_SPECIMEN","OCCURRENCE_STATUS_INFERRED_FROM_INDIVIDUAL_COUNT;GEODETIC_DATUM_ASSUMED_WGS84;CONTINENT_DERIVED_FROM_COORDINATES;COLLECTION_MATCH_FUZZY"
-116.163,71.0499,"Festuca hyperborea",1804435635,"Base of north-facing cliffs 68 km ENE of Uluhkatok, south of Minto Inlet","CAN",NA,2010,"PRESERVED_SPECIMEN","OCCURRENCE_STATUS_INFERRED_FROM_INDIVIDUAL_COUNT;CONTINENT_DERIVED_FROM_COORDINATES;COLLECTION_MATCH_FUZZY"
-68.5833,70,"Festuca hyperborea",1804558829,"S side of Inugsuin Fiord","CAN",NA,1965,"PRESERVED_SPECIMEN","OCCURRENCE_STATUS_INFERRED_FROM_INDIVIDUAL_COUNT;GEODETIC_DATUM_ASSUMED_WGS84;CONTINENT_DERIVED_FROM_COORDINATES;COLLECTION_MATCH_FUZZY"
-68.5,76.5833,"Festuca hyperborea",1804613102,"Greenland: NW part. Thule Air Base.","GRL",NA,1999,"PRESERVED_SPECIMEN","OCCURRENCE_STATUS_INFERRED_FROM_INDIVIDUAL_COUNT;COUNTRY_DERIVED_FROM_COORDINATES;GEODETIC_DATUM_ASSUMED_WGS84;CONTINENT_DERIVED_FROM_COORDINATES;COLLECTION_MATCH_FUZZY"
-112.933,75.8,"Festuca hyperborea",1804363484,"McCormick Inlet Site 14, west side. Lower slope with materials derived from Canyon Fjord Fm.","CAN",NA,1984,"PRESERVED_SPECIMEN","OCCURRENCE_STATUS_INFERRED_FROM_INDIVIDUAL_COUNT;GEODETIC_DATUM_ASSUMED_WGS84;CONTINENT_DERIVED_FROM_COORDINATES;COLLECTION_MATCH_FUZZY"
-104.633,78.9167,"Festuca hyperborea",1804543276,"Ellef Ringnes Island. W side. Reindeer Peninsula, central part.","CAN",NA,1999,"PRESERVED_SPECIMEN","OCCURRENCE_STATUS_INFERRED_FROM_INDIVIDUAL_COUNT;GEODETIC_DATUM_ASSUMED_WGS84;CONTINENT_DERIVED_FROM_COORDINATES;COLLECTION_MATCH_FUZZY"
-89.9218,77.265,"Festuca hyperborea",1913352976,"Qikiqtaaluk Region: Graham Island, Site 27-7-2.","CAN",NA,1974,"PRESERVED_SPECIMEN","OCCURRENCE_STATUS_INFERRED_FROM_INDIVIDUAL_COUNT;GEODETIC_DATUM_ASSUMED_WGS84;CONTINENT_DERIVED_FROM_COORDINATES;COLLECTION_MATCH_FUZZY"
