"lon","lat","species","gbifID","locality","countryCode","coordinateUncertaintyInMeters","year","basisOfRecord","issue"
130.64607,-12.8067,"Fimbristylis A-Kimberley-Flora",1633151100,"Utric survey. Dundee Beach Rd, before Venture Rd. Melaleuca nervosa woodland with Dapsilanthus, Eriachne burkittii; broad drainage depression on sand","AUS",20,2003,"HUMAN_OBSERVATION","CONTINENT_DERIVED_FROM_COORDINATES"
131.10735,-12.51264,"Fimbristylis A-Kimberley-Flora",1633039864,"Howard Sand Plain: HSP39. Water: 0%. Water Typical Depth: N/A. Water Max Depth: N/A. Flow: N/A. Worm Mounds: Nil. Location: North of Girraween Rd, West of Howard River, east of mine access track.","AUS",1,2011,"HUMAN_OBSERVATION","CONTINENT_DERIVED_FROM_COORDINATES"
132.45952,-14.01851,"Fimbristylis A-Kimberley-Flora",1633161325,"Nitmiluk. Murrawal Plateau","AUS",4,2002,"HUMAN_OBSERVATION","CONTINENT_DERIVED_FROM_COORDINATES"
132.51255,-13.95409,"Fimbristylis A-Kimberley-Flora",1633115015,"Nitmiluk. Murrawal Plateau North","AUS",4,2002,"HUMAN_OBSERVATION","CONTINENT_DERIVED_FROM_COORDINATES"
129.03458,-15.73926,"Fimbristylis A-Kimberley-Flora",1633063817,"Keep River N.P. Site No. 43","AUS",5,2011,"HUMAN_OBSERVATION","CONTINENT_DERIVED_FROM_COORDINATES"
130.65761,-13.13796,"Fimbristylis A-Kimberley-Flora",1633151037,"Utric survey. Litchfield NP, N of Wangi Falls TO. Grevillea pteridifolia/ Parinari nonda open woodland with perennial grasses & sedges; upper margin of creek flat","AUS",20,2003,"HUMAN_OBSERVATION","CONTINENT_DERIVED_FROM_COORDINATES"
132.51876,-14.24859,"Fimbristylis A-Kimberley-Flora",1633159874,"Nitmiluk. Seepage swamp","AUS",6,2001,"HUMAN_OBSERVATION","CONTINENT_DERIVED_FROM_COORDINATES"
131.08083,-12.46557,"Fimbristylis A-Kimberley-Flora",1633038840,"Howard Sand Plain: HSP6. Water: 75%. Water Typical Depth: 1cm. Water max Depth 20cm. Flow: Yes. Worm Mounds: >100. Location: North of Gunn Pt Rd, west of Howard River, east of mango plantation.","AUS",20,2011,"HUMAN_OBSERVATION","CONTINENT_DERIVED_FROM_COORDINATES"
132.48504,-13.93237,"Fimbristylis A-Kimberley-Flora",1633161150,"Nitmiluk. Murrawal Plateau North","AUS",4,2002,"HUMAN_OBSERVATION","CONTINENT_DERIVED_FROM_COORDINATES"
131.18352,-12.52498,"Fimbristylis A-Kimberley-Flora",1633150470,"Utric Survey. Edge Adelaide R floodplain, N of Black Jungle; Melaleuca nervosa woodland w Er.triseta & Fimb.nutans; poorly drained grey loam.","AUS",20,2001,"HUMAN_OBSERVATION","CONTINENT_DERIVED_FROM_COORDINATES"
134.735833,-12.763056,"Fimbristylis A-Kimberley-Flora",1633016180,"Maningrida area M.nervosa/ G.pteridifolia woodland with sedges; poorly drained sand fringing creek.","AUS",20,2000,"HUMAN_OBSERVATION","CONTINENT_DERIVED_FROM_COORDINATES"
132.3632,-12.73003,"Fimbristylis A-Kimberley-Flora",1633151526,"Utric survey. Kakadu NP, just W of Flying Fox Ck. Melaleuca nervosa / Asteromyrtus woodland with Dapsilanthus; on damp white sandy loam","AUS",20,2003,"HUMAN_OBSERVATION","CONTINENT_DERIVED_FROM_COORDINATES"
129.86966,-15.59076,"Fimbristylis A-Kimberley-Flora",2827376704,"Bullo River Station towards Pinkerton Range, north east boundary of property.","AUS",NA,2009,"PRESERVED_SPECIMEN","COORDINATE_ROUNDED;CONTINENT_DERIVED_FROM_COORDINATES;INSTITUTION_MATCH_FUZZY;COLLECTION_MATCH_FUZZY"
128.15493,-15.10795,"Fimbristylis A-Kimberley-Flora",2854100791,"Adolphus Island (Site 1). Adjacent/E of Trapline 4","AUS",100,2009,"PRESERVED_SPECIMEN","COORDINATE_ROUNDED;CONTINENT_DERIVED_FROM_COORDINATES;INSTITUTION_MATCH_FUZZY;COLLECTION_MATCH_FUZZY"
130.8533,-14.1097,"Fimbristylis A-Kimberley-Flora",2827545174,"Approximately 47 km south west of Douglas Daly Research Farm, Fish River Station.","AUS",NA,2012,"PRESERVED_SPECIMEN","COORDINATE_ROUNDED;CONTINENT_DERIVED_FROM_COORDINATES;INSTITUTION_MATCH_FUZZY;COLLECTION_MATCH_FUZZY"
126.529444,-14.783056,"Fimbristylis A-Kimberley-Flora",3777338538,"3.8 km E of (new) Theda Station Homestead, north Kimberley region","AUS",100,2011,"PRESERVED_SPECIMEN","COORDINATE_ROUNDED;CONTINENT_DERIVED_FROM_COORDINATES;INSTITUTION_MATCH_FUZZY;COLLECTION_MATCH_FUZZY"
128.30366,-14.744303,"Fimbristylis A-Kimberley-Flora",2854008019,"Lacrosse Island. Veg. Quadrat 1","AUS",100,2014,"PRESERVED_SPECIMEN","COORDINATE_ROUNDED;CONTINENT_DERIVED_FROM_COORDINATES;INSTITUTION_MATCH_FUZZY;COLLECTION_MATCH_FUZZY"
132.61354,-14.04072,"Fimbristylis A-Kimberley-Flora",1633160477,"Nitmiluk.","AUS",4,2001,"HUMAN_OBSERVATION","CONTINENT_DERIVED_FROM_COORDINATES"
132.70392,-14.24344,"Fimbristylis A-Kimberley-Flora",1633109413,"Nitmiluk. South-eastern corner of Park","AUS",4,2002,"HUMAN_OBSERVATION","CONTINENT_DERIVED_FROM_COORDINATES"
134.72702,-15.27049,"Fimbristylis A-Kimberley-Flora",1633072983,"Limmen NP Survey, Field Site No. 249","AUS",20,2009,"HUMAN_OBSERVATION","CONTINENT_DERIVED_FROM_COORDINATES"
134.560278,-12.907778,"Fimbristylis A-Kimberley-Flora",1633155942,"Maningrida area Melaleuca nervosa/ Banksia/ G.pteridifolia woodland with sedges; waterlogged sand on drainage flat.","AUS",20,2000,"HUMAN_OBSERVATION","CONTINENT_DERIVED_FROM_COORDINATES"
131.78337,-12.65682,"Fimbristylis A-Kimberley-Flora",1633151248,"Utric survey. Mary River NP, Bryan Ck rainforest. Melaleuca nervosa / Verticordia low open woodland with Tricostularia; on wet sand","AUS",20,2003,"HUMAN_OBSERVATION","CONTINENT_DERIVED_FROM_COORDINATES"
130.84346,-13.09586,"Fimbristylis A-Kimberley-Flora",1633163574,"Utric survey. Litchfield NP, near Termite Mounds. Sorghum / Germainia grassland on broad drainage depression; damp loam","AUS",20,2003,"HUMAN_OBSERVATION","CONTINENT_DERIVED_FROM_COORDINATES"
132.55722,-14.3609,"Fimbristylis A-Kimberley-Flora",1633124263,"Nitmiluk. MHOW E. alba, C. ptychocarpa, G. pteridifolia & B. dentata seepage swamp. Southern Boundary","AUS",4,2002,"HUMAN_OBSERVATION","CONTINENT_DERIVED_FROM_COORDINATES"
125.1,-17.133333,"Fimbristylis A-Kimberley-Flora",2853788395,"1.5 km W of Lennard River Gorge turnoff, Gibb River Road, Kimberley","AUS",NA,1974,"PRESERVED_SPECIMEN","COORDINATE_ROUNDED;CONTINENT_DERIVED_FROM_COORDINATES;INSTITUTION_MATCH_FUZZY;COLLECTION_MATCH_FUZZY"
128.778192,-15.774398,"Fimbristylis A-Kimberley-Flora",2853767460,"Mirima National Park (damp area, E side of park) IBRA Region: VB","AUS",100,2000,"PRESERVED_SPECIMEN","COORDINATE_ROUNDED;CONTINENT_DERIVED_FROM_COORDINATES;INSTITUTION_MATCH_FUZZY;COLLECTION_MATCH_FUZZY"
126.916667,-15.033333,"Fimbristylis A-Kimberley-Flora",2854263067,"Mogurnda Creek, near Drysdale River, Drysdale River National Park","AUS",NA,1975,"PRESERVED_SPECIMEN","COORDINATE_ROUNDED;CONTINENT_DERIVED_FROM_COORDINATES;INSTITUTION_MATCH_FUZZY;COLLECTION_MATCH_FUZZY"
129.71461,-15.5667,"Fimbristylis A-Kimberley-Flora",2826655585,"Bullo River Station.","AUS",NA,2009,"PRESERVED_SPECIMEN","CONTINENT_DERIVED_FROM_COORDINATES;INSTITUTION_MATCH_FUZZY;COLLECTION_MATCH_FUZZY"
129.65767,-15.66415,"Fimbristylis A-Kimberley-Flora",2829683653,"Bullo River Station.","AUS",NA,2008,"PRESERVED_SPECIMEN","COORDINATE_ROUNDED;CONTINENT_DERIVED_FROM_COORDINATES;INSTITUTION_MATCH_FUZZY;COLLECTION_MATCH_FUZZY"
130.3678,-15.6008,"Fimbristylis A-Kimberley-Flora",2826792193,"Gregory National Park, Big Horse Creek region , 3.5 km W of bridge Vic Hwy. Bush fire plot 29","AUS",100,2003,"PRESERVED_SPECIMEN","CONTINENT_DERIVED_FROM_COORDINATES;INSTITUTION_MATCH_FUZZY;COLLECTION_MATCH_FUZZY"
130.50476,-15.40287,"Fimbristylis A-Kimberley-Flora",2826702311,"Bradshaw military training area c. 28 km N of Timber Ck.","AUS",5,2017,"PRESERVED_SPECIMEN","CONTINENT_DERIVED_FROM_COORDINATES;INSTITUTION_MATCH_FUZZY;COLLECTION_MATCH_FUZZY"
130.81937,-13.52597,"Fimbristylis A-Kimberley-Flora",2826891228,"Litchfield National Park, southern entrance gate off Daly River Rd.","AUS",5,2011,"PRESERVED_SPECIMEN","CONTINENT_DERIVED_FROM_COORDINATES;INSTITUTION_MATCH_FUZZY;COLLECTION_MATCH_FUZZY"
135.35367,-15.3669,"Fimbristylis A-Kimberley-Flora",2826780696,"Limmen NP; c. 25 km NNW of Ranger Station","AUS",NA,2008,"PRESERVED_SPECIMEN","CONTINENT_DERIVED_FROM_COORDINATES;INSTITUTION_MATCH_FUZZY;COLLECTION_MATCH_FUZZY"
130.746422,-14.01204,"Fimbristylis A-Kimberley-Flora",2826920213,"Fish River Stn; headwaters of Survey Creek","AUS",10,2012,"PRESERVED_SPECIMEN","COORDINATE_ROUNDED;CONTINENT_DERIVED_FROM_COORDINATES;INSTITUTION_MATCH_FUZZY;COLLECTION_MATCH_FUZZY"
129.23009,-15.57203,"Fimbristylis A-Kimberley-Flora",2826945963,"Keep River NP, Spirit Hills area, c 22 km SE of Kneebone.","AUS",100,2007,"PRESERVED_SPECIMEN","CONTINENT_DERIVED_FROM_COORDINATES;INSTITUTION_MATCH_FUZZY;COLLECTION_MATCH_FUZZY"
