"lon","lat","species","gbifID","locality","countryCode","coordinateUncertaintyInMeters","year","basisOfRecord","issue"
45.181389,-21.341667,"Hyalocalyx setifer",4061608868,"Forêt d'Anosilamy, Fokontany Beronono, Commune Beronono.","MDG",NA,2010,"PRESERVED_SPECIMEN","OCCURRENCE_STATUS_INFERRED_FROM_INDIVIDUAL_COUNT;COORDINATE_ROUNDED;GEODETIC_DATUM_ASSUMED_WGS84;DIFFERENT_OWNER_INSTITUTION"
44.989444,-21.671111,"Hyalocalyx setifer",1257813022,"Beroroha, fokontany Betorabato. Village le plus proche Ambalamanga. Forêt Akolitsika (rivière).","MDG",NA,2011,"PRESERVED_SPECIMEN","OCCURRENCE_STATUS_INFERRED_FROM_INDIVIDUAL_COUNT;COORDINATE_ROUNDED;GEODETIC_DATUM_ASSUMED_WGS84;DIFFERENT_OWNER_INSTITUTION"
47.43583,-15.95138,"Hyalocalyx setifer",4031669927,"Faritany: Mahajanga, Fivondronana: Port Bergé, Mampikony, Bongolava, Betaramahamay. Forêt sèche sur sable d'Ambohimanga. Récolté avec R. Ramananjanahary & Mirôvisy (guide).","MDG",NA,2004,"PRESERVED_SPECIMEN","OCCURRENCE_STATUS_INFERRED_FROM_INDIVIDUAL_COUNT;GEODETIC_DATUM_ASSUMED_WGS84;INSTITUTION_MATCH_FUZZY;COLLECTION_MATCH_NONE"
44.472222,-17.874167,"Hyalocalyx setifer",4031812871,"Beanka, partie nord. Ambatosoa","MDG",NA,2012,"PRESERVED_SPECIMEN","OCCURRENCE_STATUS_INFERRED_FROM_INDIVIDUAL_COUNT;GEODETIC_DATUM_ASSUMED_WGS84;INSTITUTION_MATCH_FUZZY;COLLECTION_MATCH_NONE"
46.838056,-21.836389,"Hyalocalyx setifer",4031798904,"Haute Matsiatra, Iarintsena, Tananomby. Inselberg Ambalalova. Echantillons préservés en alcool.","MDG",NA,2010,"PRESERVED_SPECIMEN","OCCURRENCE_STATUS_INFERRED_FROM_INDIVIDUAL_COUNT;COORDINATE_ROUNDED;GEODETIC_DATUM_ASSUMED_WGS84;INSTITUTION_MATCH_FUZZY;COLLECTION_MATCH_NONE"
45.283333,-22.4,"Hyalocalyx setifer",2268901787,"Plateaux et vallees de l'Isalo a l'est de Ranohira. Gres et sable siliceux.","MDG",NA,1955,"PRESERVED_SPECIMEN","OCCURRENCE_STATUS_INFERRED_FROM_INDIVIDUAL_COUNT;COORDINATE_ROUNDED;GEODETIC_DATUM_ASSUMED_WGS84;DIFFERENT_OWNER_INSTITUTION"
47.558889,-15.553056,"Hyalocalyx setifer",2268902284,"Sofia/Boriziny, Bongolava, c. 15 km N of Boriziny (Port Berge), adjacent to RN 6.","MDG",NA,2009,"PRESERVED_SPECIMEN","OCCURRENCE_STATUS_INFERRED_FROM_INDIVIDUAL_COUNT;COORDINATE_ROUNDED;GEODETIC_DATUM_ASSUMED_WGS84;DIFFERENT_OWNER_INSTITUTION"
46.351111,-22.388889,"Hyalocalyx setifer",4061030531,"Dct Ihosy, CR Sakalalina, Fkt Mararanovily, Inselberg en gros cailloux (rochers stratifiés) de Parapaky. Echantillons préservés en alcool.","MDG",NA,2010,"PRESERVED_SPECIMEN","OCCURRENCE_STATUS_INFERRED_FROM_INDIVIDUAL_COUNT;COORDINATE_ROUNDED;GEODETIC_DATUM_ASSUMED_WGS84;DIFFERENT_OWNER_INSTITUTION"
45.358333,-16.433333,"Hyalocalyx setifer",2268901906,"RN 8, Andranomavo, Soalala.","MDG",NA,1953,"PRESERVED_SPECIMEN","OCCURRENCE_STATUS_INFERRED_FROM_INDIVIDUAL_COUNT;COORDINATE_ROUNDED;GEODETIC_DATUM_ASSUMED_WGS84;DIFFERENT_OWNER_INSTITUTION"
