"lon","lat","species","gbifID","locality","countryCode","coordinateUncertaintyInMeters","year","basisOfRecord","issue"
49.436111,-14.233611,"Impatiens lyallii",1260294392,"Sava, Andapa, Ambodivohitra. Forêt humide de moyenne altitude de Tsaralanto située à 12 Km au Sud Ouest de la commune rurale d'Anjialavabe et au Nord d'Anjialavahely. Echantillon préservé en alcool. Récolté avec J. Ihasotra & J. Rabevazaha.","MDG",NA,2006,"PRESERVED_SPECIMEN","OCCURRENCE_STATUS_INFERRED_FROM_INDIVIDUAL_COUNT;COORDINATE_ROUNDED;GEODETIC_DATUM_ASSUMED_WGS84;DIFFERENT_OWNER_INSTITUTION"
47.26666,-19.38333,"Impatiens lyallii",1259048192,"Ankaratra, 15 km W of Ambatolampy.","MDG",NA,1974,"PRESERVED_SPECIMEN","GEODETIC_DATUM_ASSUMED_WGS84;DIFFERENT_OWNER_INSTITUTION"
49.592222,-13.238333,"Impatiens lyallii",1257974963,"Daraina, forêt de Binara.","MDG",NA,2005,"PRESERVED_SPECIMEN","OCCURRENCE_STATUS_INFERRED_FROM_INDIVIDUAL_COUNT;COORDINATE_ROUNDED;GEODETIC_DATUM_ASSUMED_WGS84;DIFFERENT_OWNER_INSTITUTION"
49.183889,-12.598611,"Impatiens lyallii",4061239781,"Montagne d'Ambre, partie centrale. A 1130 m du point cote 924, au 267?","MDG",NA,2008,"PRESERVED_SPECIMEN","OCCURRENCE_STATUS_INFERRED_FROM_INDIVIDUAL_COUNT;GEODETIC_DATUM_ASSUMED_WGS84;DIFFERENT_OWNER_INSTITUTION"
49.0925,-14.205278,"Impatiens lyallii",1260219173,"Bealanana, Forêt de crête au Nord Est de Mangindrano. Echantillon préservé en alcool.","MDG",NA,2005,"PRESERVED_SPECIMEN","OCCURRENCE_STATUS_INFERRED_FROM_INDIVIDUAL_COUNT;COORDINATE_ROUNDED;GEODETIC_DATUM_ASSUMED_WGS84;DIFFERENT_OWNER_INSTITUTION"
49.56666,-14.45,"Impatiens lyallii",1258336801,"Andapa, Doany, Betsomanga, environ à 11,2km à vol d'oiseau au sud-est (14) de Doany et à 7,5km à vol d'oiseau au nord-est (1) d'Ambalamanasy II, entre la rivière d'Ampandrana et Betsomanga, au nord de Marojejy.","MDG",NA,1995,"PRESERVED_SPECIMEN","OCCURRENCE_STATUS_INFERRED_FROM_INDIVIDUAL_COUNT;GEODETIC_DATUM_ASSUMED_WGS84;DIFFERENT_OWNER_INSTITUTION"
47.088889,-17.896944,"Impatiens lyallii",4062003240,"Ankazobe, Manerinerina, 35 km North of Manerinerina, on the road to Mahajanga.","MDG",NA,2009,"PRESERVED_SPECIMEN","OCCURRENCE_STATUS_INFERRED_FROM_INDIVIDUAL_COUNT;COORDINATE_ROUNDED;GEODETIC_DATUM_ASSUMED_WGS84;DIFFERENT_OWNER_INSTITUTION"
47.18333,-20.81666,"Impatiens lyallii",1260640464,"Ambatofitorahana entre Ambositra et Fianarantsoa dans sous bois, forêt ombrophie à sous bois herbacé","MDG",NA,1960,"PRESERVED_SPECIMEN","GEODETIC_DATUM_ASSUMED_WGS84;DIFFERENT_OWNER_INSTITUTION"
47.950556,-17.771389,"Impatiens lyallii",4031792152,"SW of Lac Alaotra, ca. 25km west of Morarano Chrome, Forest of Manohilahy.","MDG",NA,1995,"PRESERVED_SPECIMEN","OCCURRENCE_STATUS_INFERRED_FROM_INDIVIDUAL_COUNT;COORDINATE_ROUNDED;GEODETIC_DATUM_ASSUMED_WGS84;INSTITUTION_MATCH_FUZZY;COLLECTION_MATCH_NONE"
49.356389,-14.389444,"Impatiens lyallii",4031584738,"Sava, Andapa, Doany, Andranomololo. Vallée d'Andramanalana suivant le piste vers le sommet. Echantillon préservé en alcool. Récolté avec C. Rakotovao & R. Razakamalala.","MDG",NA,2006,"PRESERVED_SPECIMEN","OCCURRENCE_STATUS_INFERRED_FROM_INDIVIDUAL_COUNT;COORDINATE_ROUNDED;GEODETIC_DATUM_ASSUMED_WGS84;INSTITUTION_MATCH_FUZZY;COLLECTION_MATCH_NONE"
44.205278,-22.666667,"Impatiens lyallii",4031648956,"Atsimo Andrefana, Sakaraha, Mahaboboka, Marotsiraka. Forêt d'Analavelona, le long de la rivière Manasay. Echantillon préservé en alcool. Collecté avec L. Rockiman, F. Rakotonasolo, A. Tsiheheha & Bruno.","MDG",NA,2009,"PRESERVED_SPECIMEN","OCCURRENCE_STATUS_INFERRED_FROM_INDIVIDUAL_COUNT;COORDINATE_ROUNDED;GEODETIC_DATUM_ASSUMED_WGS84;INSTITUTION_MATCH_FUZZY;COLLECTION_MATCH_NONE"
48.454054,-18.853377,"Impatiens lyallii",2856494965,"","MDG",5369,2015,"HUMAN_OBSERVATION","COORDINATE_ROUNDED;CONTINENT_DERIVED_FROM_COORDINATES"
46.78333,-25.0775,"Impatiens lyallii",4031580771,"Forêt de transition d'Ambatorongorongo, Amboavola, Sarisambo, Taolagnaro. Echantillon récolté avec L. Randrihasipara et E. Ramisy, préservé en alcool.","MDG",NA,1999,"PRESERVED_SPECIMEN","OCCURRENCE_STATUS_INFERRED_FROM_INDIVIDUAL_COUNT;GEODETIC_DATUM_ASSUMED_WGS84;INSTITUTION_MATCH_FUZZY;COLLECTION_MATCH_NONE"
46.826111,-20.047778,"Impatiens lyallii",4032060079,"Betafo, Alakamisy Marososona, Ranomainty, au bord de la rizière.","MDG",NA,2004,"PRESERVED_SPECIMEN","OCCURRENCE_STATUS_INFERRED_FROM_INDIVIDUAL_COUNT;COORDINATE_ROUNDED;GEODETIC_DATUM_ASSUMED_WGS84;INSTITUTION_MATCH_FUZZY;COLLECTION_MATCH_NONE"
46.765556,-24.634167,"Impatiens lyallii",4031675899,"Région d'Anosy, District de Fort-Dauphin, Commune rurale d'Enaniliha, FKT d'Enosiary, Forêt entre Eminiminy et le pic Trafonaomby, parcelle 1 du Parc National Andohahela, parcelle permanente à 400 m d'altitude.","MDG",NA,2009,"PRESERVED_SPECIMEN","OCCURRENCE_STATUS_INFERRED_FROM_INDIVIDUAL_COUNT;COORDINATE_ROUNDED;GEODETIC_DATUM_ASSUMED_WGS84;INSTITUTION_MATCH_FUZZY;COLLECTION_MATCH_NONE"
46.856389,-19.825278,"Impatiens lyallii",4032165562,"Antsirabe, Betafo, Antsapanimahazo. Ruisseau.","MDG",NA,2015,"PRESERVED_SPECIMEN","OCCURRENCE_STATUS_INFERRED_FROM_INDIVIDUAL_COUNT;COORDINATE_ROUNDED;GEODETIC_DATUM_ASSUMED_WGS84;INSTITUTION_MATCH_FUZZY;COLLECTION_MATCH_NONE"
49.31805,-14.30944,"Impatiens lyallii",4031607834,"SAVA, Andapa, Doany, Andranomilolo. Forêt dense humide de moyenne altitude située à 10 Km au Nord-Ouest d'Andranopositra. Récoltés avec R. Razakamalala, D. Ravelonarivo, Rambimison (Ambalamasay) & josé (Ambalamanasy). Echantillons prélevés en alcool.","MDG",NA,2006,"PRESERVED_SPECIMEN","OCCURRENCE_STATUS_INFERRED_FROM_INDIVIDUAL_COUNT;GEODETIC_DATUM_ASSUMED_WGS84;INSTITUTION_MATCH_FUZZY;COLLECTION_MATCH_NONE"
47.096111,-23.5175,"Impatiens lyallii",1260276957,"Midongy du Sud, à 1,5 km au Nord-est du village de Beharena. Forêt dense humide sur crête. Récolté avec M. Ramanantsoa, M.G. Maminandrasana, W. Lodwige & Zafy.","MDG",NA,2005,"PRESERVED_SPECIMEN","OCCURRENCE_STATUS_INFERRED_FROM_INDIVIDUAL_COUNT;COORDINATE_ROUNDED;GEODETIC_DATUM_ASSUMED_WGS84;DIFFERENT_OWNER_INSTITUTION"
49.159722,-12.596389,"Impatiens lyallii",4061294921,"Montagne d'Ambre, partie centrale. A 430 m du point cote 1445, au 267?","MDG",NA,2007,"PRESERVED_SPECIMEN","OCCURRENCE_STATUS_INFERRED_FROM_INDIVIDUAL_COUNT;GEODETIC_DATUM_ASSUMED_WGS84;DIFFERENT_OWNER_INSTITUTION"
48.93333,-14.26666,"Impatiens lyallii",1260455192,"Escarpement rive droite de la Bemafo (affluent de l'Androranga). Montagnesau Nord de Mangindrano (Haute Maevarano) jusqu'aux sommets d'Ambohimirahavavy (partage des eaux Mahavavy-Androranga : Centre-Nord)Sylve à Lichens sur gneiss.","MDG",NA,1951,"PRESERVED_SPECIMEN","OCCURRENCE_STATUS_INFERRED_FROM_INDIVIDUAL_COUNT;GEODETIC_DATUM_ASSUMED_WGS84;DIFFERENT_OWNER_INSTITUTION"
49.3525,-15.126389,"Impatiens lyallii",1260899150,"Sofia, Befandrina nord, Matsoandakana, à 4 km vol d'oiseau à l'est du Fokotany d'Andranomena, forêt d'Anjiabe, suivant la piste vers le sommet 1446 m d'altitude. Echantillons préservés en alcool.","MDG",NA,2008,"PRESERVED_SPECIMEN","OCCURRENCE_STATUS_INFERRED_FROM_INDIVIDUAL_COUNT;COORDINATE_ROUNDED;GEODETIC_DATUM_ASSUMED_WGS84;DIFFERENT_OWNER_INSTITUTION"
48.296944,-18.8675,"Impatiens lyallii",4062195009,"Moramanga, Andasibe, Menalamba, Ambatovy forest, Ampangadiantrandraka. Soil without crust. Samples preserved in alcohol. Collected with H. Razafindraibe , F. Edmond & Tojo.","MDG",NA,2005,"PRESERVED_SPECIMEN","OCCURRENCE_STATUS_INFERRED_FROM_INDIVIDUAL_COUNT;COORDINATE_ROUNDED;GEODETIC_DATUM_ASSUMED_WGS84;DIFFERENT_OWNER_INSTITUTION"
47.803333,-18.431944,"Impatiens lyallii",1257973069,"Anjozorobe, Ambohitsaratany, inselberg: Andomotra.","MDG",NA,2013,"PRESERVED_SPECIMEN","OCCURRENCE_STATUS_INFERRED_FROM_INDIVIDUAL_COUNT;COORDINATE_ROUNDED;GEODETIC_DATUM_ASSUMED_WGS84;DIFFERENT_OWNER_INSTITUTION"
48.980556,-14.127778,"Impatiens lyallii",1258834935,"Tsaratanana massif, N of Mangindrano. Along trail from camp at Mahatsabory to Be Pia. Montane forest with bamboo. Collected with R. Razakamalala & R. Lala. (Specimens preserved in alcohol).","MDG",NA,2001,"PRESERVED_SPECIMEN","OCCURRENCE_STATUS_INFERRED_FROM_INDIVIDUAL_COUNT;COORDINATE_ROUNDED;GEODETIC_DATUM_ASSUMED_WGS84;DIFFERENT_OWNER_INSTITUTION"
49.441667,-14.741667,"Impatiens lyallii",1261859548,"Réserve Spéciale d'Anjanaharibe-Sud, 11 km WSW Befingotra.","MDG",NA,1995,"PRESERVED_SPECIMEN","OCCURRENCE_STATUS_INFERRED_FROM_INDIVIDUAL_COUNT;COORDINATE_ROUNDED;GEODETIC_DATUM_ASSUMED_WGS84;DIFFERENT_OWNER_INSTITUTION"
48.424708,-19.004224,"Impatiens lyallii",3912297321,"","MDG",10,2022,"HUMAN_OBSERVATION","COORDINATE_ROUNDED;CONTINENT_DERIVED_FROM_COORDINATES"
47.66666,-18.86666,"Impatiens lyallii",1260640431,"Vallée de Soavina. P.K. 23 Route Tamatave bord de ruisseau","MDG",NA,1960,"PRESERVED_SPECIMEN","GEODETIC_DATUM_ASSUMED_WGS84;DIFFERENT_OWNER_INSTITUTION"
49.643056,-14.580556,"Impatiens lyallii",1260293936,"Sava, Andapa, Ambodivohitra. Forêt GELOSE à 1,5 Km Est du village de Marovato. Echantillon préservé en alcool. Récolté avec P. Antilahimena & Patriode.","MDG",NA,2006,"PRESERVED_SPECIMEN","OCCURRENCE_STATUS_INFERRED_FROM_INDIVIDUAL_COUNT;COORDINATE_ROUNDED;GEODETIC_DATUM_ASSUMED_WGS84;DIFFERENT_OWNER_INSTITUTION"
49.491667,-14.658333,"Impatiens lyallii",1258432729,"Fivondronana d'Andapa. Commune Ambodiangezoka. Quartier Antsavokabe. Réserve Spéciale d'Anjanaharibe-Sud, environ 8 km près du village d'Antsavokabe, suivant la piste vers le sommet 1210 m de hauteur. Forêt humide montagneuse. Echantillons conservés en alcool.","MDG",NA,1995,"PRESERVED_SPECIMEN","OCCURRENCE_STATUS_INFERRED_FROM_INDIVIDUAL_COUNT;COORDINATE_ROUNDED;GEODETIC_DATUM_ASSUMED_WGS84;DIFFERENT_OWNER_INSTITUTION"
49.15,-12.333333,"Impatiens lyallii",1260640456,"Environs de Diego-Suarez : Forêt d'Ambre","MDG",NA,1959,"PRESERVED_SPECIMEN","OCCURRENCE_STATUS_INFERRED_FROM_INDIVIDUAL_COUNT;COORDINATE_ROUNDED;GEODETIC_DATUM_ASSUMED_WGS84;DIFFERENT_OWNER_INSTITUTION"
47.06666,-17.7,"Impatiens lyallii",1260636910,"Nationale 4. Tampoketsa d'Ankazobe. Reste de forêt primaire.","MDG",NA,2001,"PRESERVED_SPECIMEN","GEODETIC_DATUM_ASSUMED_WGS84;DIFFERENT_OWNER_INSTITUTION"
48.73333,-13.81666,"Impatiens lyallii",1260640478,"Massif du Tsaratanana. Vallée de la Mahavavy","MDG",NA,1966,"PRESERVED_SPECIMEN","GEODETIC_DATUM_ASSUMED_WGS84;DIFFERENT_OWNER_INSTITUTION"
46.46666,-17.86666,"Impatiens lyallii",1260640470,"Vallée de la Saonjo. Moyen Ouest lambeaux forêt","MDG",NA,1964,"PRESERVED_SPECIMEN","GEODETIC_DATUM_ASSUMED_WGS84;DIFFERENT_OWNER_INSTITUTION"
49.18694,-13.24167,"Impatiens lyallii",1144700762,"Diego-Suarez / Antsiranana - Massif de Manongarivo: Sources de l'Andranomalaza/Faritanin Antsiranana","MDG",1500,2000,"PRESERVED_SPECIMEN","GEODETIC_DATUM_ASSUMED_WGS84;CONTINENT_DERIVED_FROM_COORDINATES;INSTITUTION_MATCH_FUZZY;COLLECTION_MATCH_NONE"
