"lon","lat","species","gbifID","locality","countryCode","coordinateUncertaintyInMeters","year","basisOfRecord","issue"
-86.03,11.95,"Indigofera subulata",1563325755,"Departamento de Granada: Santa Isabel, al S de la Laguna de Apoyo","NIC",NA,1981,"PRESERVED_SPECIMEN","GEODETIC_DATUM_ASSUMED_WGS84;CONTINENT_DERIVED_FROM_COORDINATES;CONTINENT_INVALID"
-70.7417,19.575,"Indigofera subulata",1928920552,"Cordillera Septentrional: subida de parada de Piche a Loma Diego de Ocampo: un hombro de la Loma.","DOM",NA,1983,"PRESERVED_SPECIMEN","GEODETIC_DATUM_ASSUMED_WGS84;COLLECTION_MATCH_FUZZY"
-71.68,19.48,"Indigofera subulata",1930409083,"En la zona rural denominado Tamarindo, 6 km norte de Pueblo Nuevo en el camino a Dajabon.","DOM",NA,1981,"PRESERVED_SPECIMEN","GEODETIC_DATUM_ASSUMED_WGS84;COLLECTION_MATCH_FUZZY"
-70.7417,18.9,"Indigofera subulata",1928892229,"Cordillera Central: Hotel Nueva Suiza, 3 Km sur de la calle principal de Constanza: en la zona fuera el parqueo del hotel , de Malezas y hierbas perbnnes.","DOM",NA,1983,"PRESERVED_SPECIMEN","GEODETIC_DATUM_ASSUMED_WGS84;COLLECTION_MATCH_FUZZY"
-70.5,19.05,"Indigofera subulata",1930538412,"Cordillera Central: (Vieja Prov. La Vega): en paso del Alto (Altar) de Casabito, (en la carretera de Bonao oeste a El Rio y Constanza).","DOM",NA,1989,"PRESERVED_SPECIMEN","GEODETIC_DATUM_ASSUMED_WGS84;COLLECTION_MATCH_FUZZY"
43.41388,-22.89305,"Indigofera subulata",4061345283,"9 km N of Manombo along coast near Fiserenamasay. Spiny/deciduous bush on dunes adjacent to the sea.","MDG",NA,1993,"PRESERVED_SPECIMEN","OCCURRENCE_STATUS_INFERRED_FROM_INDIVIDUAL_COUNT;GEODETIC_DATUM_ASSUMED_WGS84;DIFFERENT_OWNER_INSTITUTION"
-84.779167,13.725,"Indigofera subulata",1257994011,"Vicinity of La Luz-Siuna","NIC",NA,1961,"PRESERVED_SPECIMEN","OCCURRENCE_STATUS_INFERRED_FROM_INDIVIDUAL_COUNT;COORDINATE_ROUNDED;GEODETIC_DATUM_ASSUMED_WGS84;DIFFERENT_OWNER_INSTITUTION"
-111.053861,28.0155,"Indigofera subulata",4061145385,"Cañón Nacapule.","MEX",NA,2010,"PRESERVED_SPECIMEN","OCCURRENCE_STATUS_INFERRED_FROM_INDIVIDUAL_COUNT;COORDINATE_ROUNDED;GEODETIC_DATUM_ASSUMED_WGS84;DIFFERENT_OWNER_INSTITUTION"
34.91388,-5.05277,"Indigofera subulata",4061705014,"10.2 km S from Makiungu-Mungaa rd en route to Ntuntu. Slightly rolling terrain, rather sandy soil. Dense bushland (thicket) 2-4m high with shrubby acanth, Combretum, Burttia, Grewia, Dichrostachys, Vitex, Senna, Maerua, others.","TZA",NA,2000,"PRESERVED_SPECIMEN","GEODETIC_DATUM_ASSUMED_WGS84;INSTITUTION_MATCH_NONE"
-89.45,14.25,"Indigofera subulata",4061125159,"Cantón San Diego, calle a Metapán, orilla de la carretera.","SLV",NA,2010,"PRESERVED_SPECIMEN","OCCURRENCE_STATUS_INFERRED_FROM_INDIVIDUAL_COUNT;GEODETIC_DATUM_ASSUMED_WGS84;DIFFERENT_OWNER_INSTITUTION"
-85.430278,14.1,"Indigofera subulata",1257603621,"Municipio de Wiwilí, Comunidad Boca de Plis, Reserva Bosawas, Territorio Tasbaika Kum, parcela 3, finca de Arnulfo Hernández 800 m al oeste de la comunidad","NIC",NA,2007,"PRESERVED_SPECIMEN","OCCURRENCE_STATUS_INFERRED_FROM_INDIVIDUAL_COUNT;COORDINATE_ROUNDED;GEODETIC_DATUM_ASSUMED_WGS84;DIFFERENT_OWNER_INSTITUTION"
-86.166667,11.783333,"Indigofera subulata",4061387810,"Santa Teresa, Route 2; high clay bank and shrine [Seymour series]","NIC",NA,1968,"PRESERVED_SPECIMEN","OCCURRENCE_STATUS_INFERRED_FROM_INDIVIDUAL_COUNT;COORDINATE_ROUNDED;GEODETIC_DATUM_ASSUMED_WGS84;DIFFERENT_OWNER_INSTITUTION"
79.073334,12.743846,"Indigofera subulata",2598660156,"","IND",NA,2017,"HUMAN_OBSERVATION","COORDINATE_ROUNDED;COUNTRY_DERIVED_FROM_COORDINATES;GEODETIC_DATUM_ASSUMED_WGS84;CONTINENT_DERIVED_FROM_COORDINATES"
-92.329406,17.161102,"Indigofera subulata",1895379755,"Cerro Azufre","MEX",10,1982,"PRESERVED_SPECIMEN","TYPE_STATUS_INVALID;OCCURRENCE_STATUS_INFERRED_FROM_INDIVIDUAL_COUNT;COORDINATE_ROUNDED;CONTINENT_DERIVED_FROM_COORDINATES;ELEVATION_MIN_MAX_SWAPPED;INSTITUTION_MATCH_NONE"
-93.916667,16.25,"Indigofera subulata",1895379731,"Afuera del poblado de Arriaga","MEX",100,1992,"PRESERVED_SPECIMEN","TYPE_STATUS_INVALID;OCCURRENCE_STATUS_INFERRED_FROM_INDIVIDUAL_COUNT;COORDINATE_ROUNDED;GEODETIC_DATUM_ASSUMED_WGS84;CONTINENT_DERIVED_FROM_COORDINATES;INSTITUTION_MATCH_NONE"
-46.486667,-14.066111,"Indigofera subulata",2998483325,"Fazenda Sabonete Prop Silvio Santos Lacerda.","BRA",NA,2001,"PRESERVED_SPECIMEN","RECORDED_DATE_INVALID;COORDINATE_ROUNDED;GEODETIC_DATUM_ASSUMED_WGS84;CONTINENT_DERIVED_FROM_COORDINATES;INSTITUTION_MATCH_FUZZY;COLLECTION_MATCH_FUZZY"
-93.212222,18.395556,"Indigofera subulata",1895131608,"1 km al NO del Paraiso, sobre el camino a Barra de Topilco","MEX",90,1987,"PRESERVED_SPECIMEN","TYPE_STATUS_INVALID;OCCURRENCE_STATUS_INFERRED_FROM_INDIVIDUAL_COUNT;COORDINATE_ROUNDED;GEODETIC_DATUM_ASSUMED_WGS84;GEODETIC_DATUM_INVALID;CONTINENT_DERIVED_FROM_COORDINATES;ELEVATION_MIN_MAX_SWAPPED;INSTITUTION_MATCH_NONE"
-91.130278,16.760555,"Indigofera subulata",1895131641,"LACANJA-CHANSAYAB","MEX",90,1991,"PRESERVED_SPECIMEN","TYPE_STATUS_INVALID;OCCURRENCE_STATUS_INFERRED_FROM_INDIVIDUAL_COUNT;COORDINATE_ROUNDED;GEODETIC_DATUM_ASSUMED_WGS84;GEODETIC_DATUM_INVALID;CONTINENT_DERIVED_FROM_COORDINATES;ELEVATION_MIN_MAX_SWAPPED;INSTITUTION_MATCH_NONE"
-89.316389,19.213889,"Indigofera subulata",2807245578,"A 3 km al S de X-naben, camibo a Xcan-ha.","MEX",NA,1998,"PRESERVED_SPECIMEN","COORDINATE_ROUNDED;GEODETIC_DATUM_ASSUMED_WGS84;INSTITUTION_MATCH_FUZZY;COLLECTION_MATCH_FUZZY"
-89.171111,17.885,"Indigofera subulata",2807245114,"Pioneros del Río Xno-ha.","MEX",NA,1999,"PRESERVED_SPECIMEN","COORDINATE_ROUNDED;GEODETIC_DATUM_ASSUMED_WGS84;INSTITUTION_MATCH_FUZZY;COLLECTION_MATCH_FUZZY"
-95.973889,15.841944,"Indigofera subulata",2807281303,"Municipio de Santiago Astata. Distrito Tehuantepec. Barra de la Cruz, laguna del Potreron, lado N.","MEX",NA,1999,"PRESERVED_SPECIMEN","COORDINATE_ROUNDED;GEODETIC_DATUM_ASSUMED_WGS84;INSTITUTION_MATCH_FUZZY;COLLECTION_MATCH_FUZZY"
-95.678833,15.990194,"Indigofera subulata",3332161317,"Distrito Tehuantepec, Municipio Santiago Astata. Agauaje de Astata Flora de la Región Chontal.","MEX",NA,2009,"PRESERVED_SPECIMEN","COORDINATE_ROUNDED;GEODETIC_DATUM_ASSUMED_WGS84;INSTITUTION_MATCH_FUZZY;COLLECTION_MATCH_FUZZY"
-89.93333,13.81667,"Indigofera subulata",3913392074,"El Salvador: Depto. Ahuachapán, Municipio San Francisco Menéndez, P.N. El Imposible, al pie de la Huerta de Juan Díaz. Hierba de aprox. 1.5 m; hojas con folíolos de hasta 3.5c m de largo y 1.5 cm de ancho; flores rosadas. Alt.: 500 m.1995-10-19, Leg.: Sandoval,M. & Sandoval,E. 189 [MS-00189].","SLV",NA,1995,"PRESERVED_SPECIMEN","GEODETIC_DATUM_ASSUMED_WGS84;CONTINENT_DERIVED_FROM_COORDINATES;INSTITUTION_MATCH_FUZZY"
-75.92,6.67,"Indigofera subulata",1675854233,"Municipio Giraldo: Corregimiento Manglares, 8 Kms. N S, de Manglares, via Santa Fé-Mutatá","COL",NA,1987,"PRESERVED_SPECIMEN","GEODETIC_DATUM_ASSUMED_WGS84"
-85.95,11.85,"Indigofera subulata",1261871719,"Volcán Mombacho, camino hacia Cutirre, desvio entre Santa Isabel y Cutirre","NIC",NA,1980,"PRESERVED_SPECIMEN","OCCURRENCE_STATUS_INFERRED_FROM_INDIVIDUAL_COUNT;GEODETIC_DATUM_ASSUMED_WGS84;INSTITUTION_MATCH_FUZZY;COLLECTION_MATCH_NONE"
-88.65,17.76666,"Indigofera subulata",1259436164,"Indian Church","BLZ",NA,1977,"PRESERVED_SPECIMEN","GEODETIC_DATUM_ASSUMED_WGS84;INSTITUTION_MATCH_FUZZY;COLLECTION_MATCH_NONE"
-94.945278,16.574722,"Indigofera subulata",1259437328,"2 miles N of junction of MEX 185 with MEX 190 at Tehuantepec.","MEX",NA,1971,"PRESERVED_SPECIMEN","COORDINATE_ROUNDED;GEODETIC_DATUM_ASSUMED_WGS84;INSTITUTION_MATCH_FUZZY;COLLECTION_MATCH_NONE"
-76.7,17.95,"Indigofera subulata",1259675100,"Gorge of the Cane River below the falls. Gravelly herb.","JAM",NA,1964,"PRESERVED_SPECIMEN","COUNTRY_MISMATCH;GEODETIC_DATUM_ASSUMED_WGS84;INSTITUTION_MATCH_FUZZY;COLLECTION_MATCH_NONE"
-85.192028,12.359917,"Indigofera subulata",4031845197,"3.5 km S of S fork on road E of Betulia, along road from Betulia to La Libertad; roadside in pastures","NIC",NA,2014,"PRESERVED_SPECIMEN","OCCURRENCE_STATUS_INFERRED_FROM_INDIVIDUAL_COUNT;COORDINATE_ROUNDED;GEODETIC_DATUM_ASSUMED_WGS84;INSTITUTION_MATCH_FUZZY;COLLECTION_MATCH_NONE"
-85.133333,14.4,"Indigofera subulata",4032053168,"Municipio de Wiwili, Reserva de la Biósfera de Bosawas, comunidad de Inipuwas, alrededor del transecto Yalu.","NIC",NA,2008,"PRESERVED_SPECIMEN","OCCURRENCE_STATUS_INFERRED_FROM_INDIVIDUAL_COUNT;COORDINATE_ROUNDED;GEODETIC_DATUM_ASSUMED_WGS84;INSTITUTION_MATCH_FUZZY;COLLECTION_MATCH_NONE"
-94.60833,16.925,"Indigofera subulata",1259439134,"Mpio. Sta. María Chimalapa: Penidientes del cañon del Río del Corte, ca. 0.4 Km. al E. del Paso Venado en la subida hacia Chimalapilla, ca. 11-12 Km. al E. de Sta. María: pendientes con encinar, suelo gris.","MEX",NA,1984,"PRESERVED_SPECIMEN","GEODETIC_DATUM_ASSUMED_WGS84;INSTITUTION_MATCH_FUZZY;COLLECTION_MATCH_NONE"
-91.185278,16.979167,"Indigofera subulata",1257727622,"Ejido Mariscal (antes Santa Clara).","MEX",NA,2003,"PRESERVED_SPECIMEN","OCCURRENCE_STATUS_INFERRED_FROM_INDIVIDUAL_COUNT;COORDINATE_ROUNDED;GEODETIC_DATUM_ASSUMED_WGS84;INSTITUTION_MATCH_FUZZY;COLLECTION_MATCH_NONE"
-85.353333,12.320278,"Indigofera subulata",4031674680,"7.5 km NNE of Cuapa along road toward Muy Muy, just before Matayagual; remnant moist forest in deep, narrow valleys","NIC",NA,2010,"PRESERVED_SPECIMEN","OCCURRENCE_STATUS_INFERRED_FROM_INDIVIDUAL_COUNT;COORDINATE_ROUNDED;GEODETIC_DATUM_ASSUMED_WGS84;INSTITUTION_MATCH_FUZZY;COLLECTION_MATCH_NONE"
-86.05,12.683333,"Indigofera subulata",1261541235,"Carretera Panamericana, de la Cuesta del Venado, 4 km al E Las Delicias","NIC",NA,1982,"PRESERVED_SPECIMEN","OCCURRENCE_STATUS_INFERRED_FROM_INDIVIDUAL_COUNT;COORDINATE_ROUNDED;GEODETIC_DATUM_ASSUMED_WGS84;INSTITUTION_MATCH_FUZZY;COLLECTION_MATCH_NONE"
36.69555,-3.36666,"Indigofera subulata",1260058499,"National Natural History Museum, lawns.","TZA",NA,2004,"PRESERVED_SPECIMEN","OCCURRENCE_STATUS_INFERRED_FROM_INDIVIDUAL_COUNT;GEODETIC_DATUM_ASSUMED_WGS84;INSTITUTION_MATCH_FUZZY;COLLECTION_MATCH_NONE"
-85.320833,14.230278,"Indigofera subulata",4031666240,"Municipio de Wiwilí, Comunidad La Esperanza, Reserva Bosawas, Territorio Miskito Tasbaika Kum, parcela 1, 1 km al oeste de la finca de Leonidas Bodin","NIC",NA,2007,"PRESERVED_SPECIMEN","OCCURRENCE_STATUS_INFERRED_FROM_INDIVIDUAL_COUNT;COORDINATE_ROUNDED;GEODETIC_DATUM_ASSUMED_WGS84;INSTITUTION_MATCH_FUZZY;COLLECTION_MATCH_NONE"
-86.583333,13.25,"Indigofera subulata",1261898893,"Valle San Juan de Tranquera, entre San Juan de Limay y Pueblo Nuevo, Municipio San Juan de Limay","NIC",NA,1980,"PRESERVED_SPECIMEN","OCCURRENCE_STATUS_INFERRED_FROM_INDIVIDUAL_COUNT;COORDINATE_ROUNDED;GEODETIC_DATUM_ASSUMED_WGS84;INSTITUTION_MATCH_FUZZY;COLLECTION_MATCH_NONE"
-93.401667,16.565556,"Indigofera subulata",1259435144,"Steep slopes, Cerro Brujo, 20 km S of Ocozocoautla.","MEX",NA,1972,"PRESERVED_SPECIMEN","OCCURRENCE_STATUS_INFERRED_FROM_INDIVIDUAL_COUNT;COORDINATE_ROUNDED;GEODETIC_DATUM_ASSUMED_WGS84;INSTITUTION_MATCH_FUZZY;COLLECTION_MATCH_NONE"
-99.3425,16.766945,"Indigofera subulata",1259438212,"6 km SE of Marcos.","MEX",NA,1980,"PRESERVED_SPECIMEN","OCCURRENCE_STATUS_INFERRED_FROM_INDIVIDUAL_COUNT;COORDINATE_ROUNDED;GEODETIC_DATUM_ASSUMED_WGS84;INSTITUTION_MATCH_FUZZY;COLLECTION_MATCH_NONE"
-80.98166,8.10305,"Indigofera subulata",1259435570,"Santiago; roadside; brown-red soil. +/-2300mm/yr. rainfall","PAN",NA,1971,"PRESERVED_SPECIMEN","GEODETIC_DATUM_ASSUMED_WGS84;INSTITUTION_MATCH_FUZZY;COLLECTION_MATCH_NONE"
-83.52,8.61,"Indigofera subulata",1261545212,"Reserva Indígena Guaymí Alto Laguna, Osa. Bosque Primario alterado y charrales.","CRI",NA,1991,"PRESERVED_SPECIMEN","OCCURRENCE_STATUS_INFERRED_FROM_INDIVIDUAL_COUNT;GEODETIC_DATUM_ASSUMED_WGS84;INSTITUTION_MATCH_FUZZY;COLLECTION_MATCH_NONE"
-87.24638,13.85361,"Indigofera subulata",1258546692,"Collected along CA-5, 21 mi S of Tegucigalpa. Pine trees on knolls and steep slopes on grade down","HND",NA,1979,"PRESERVED_SPECIMEN","GEODETIC_DATUM_ASSUMED_WGS84;INSTITUTION_MATCH_FUZZY;COLLECTION_MATCH_NONE"
-86.435278,13.731889,"Indigofera subulata",4031476573,"12.4 km N of Mozonte (highway), 5.6 km beyond Mojón 14 on right fork; pine forest on granite, along a fast, clear stream","NIC",NA,2016,"PRESERVED_SPECIMEN","OCCURRENCE_STATUS_INFERRED_FROM_INDIVIDUAL_COUNT;COORDINATE_ROUNDED;GEODETIC_DATUM_ASSUMED_WGS84;INSTITUTION_MATCH_FUZZY;COLLECTION_MATCH_NONE"
-89.716389,16.996111,"Indigofera subulata",1261455862,"El Remate. SE of Cerro Cauhui [Cahui].","GTM",NA,1989,"PRESERVED_SPECIMEN","OCCURRENCE_STATUS_INFERRED_FROM_INDIVIDUAL_COUNT;COORDINATE_ROUNDED;GEODETIC_DATUM_ASSUMED_WGS84;INSTITUTION_MATCH_FUZZY;COLLECTION_MATCH_NONE"
-86.1,13.733333,"Indigofera subulata",1261542723,"El Jícaro, El Quebracho al Sur","NIC",NA,1981,"PRESERVED_SPECIMEN","OCCURRENCE_STATUS_INFERRED_FROM_INDIVIDUAL_COUNT;COORDINATE_ROUNDED;GEODETIC_DATUM_ASSUMED_WGS84;INSTITUTION_MATCH_FUZZY;COLLECTION_MATCH_NONE"
-79.63555,9.04361,"Indigofera subulata",1258547809,"1 mile north of Paraiso, near Gaillard cut","PAN",NA,1970,"PRESERVED_SPECIMEN","GEODETIC_DATUM_ASSUMED_WGS84;INSTITUTION_MATCH_FUZZY;COLLECTION_MATCH_NONE"
-89.59,21.09,"Indigofera subulata",1259437455,"En los alrededores de la zona arqueológica de Dzibilchaltún, a 17 km al NE de Mérida.","MEX",NA,1985,"PRESERVED_SPECIMEN","OCCURRENCE_STATUS_INFERRED_FROM_INDIVIDUAL_COUNT;GEODETIC_DATUM_ASSUMED_WGS84;INSTITUTION_MATCH_FUZZY;COLLECTION_MATCH_NONE"
-92.238055,16.896667,"Indigofera subulata",1261551503,"Along dirt road between San Fernando (NW of Tuxtla Gutierrez) and Las Maravillas (near Lago Malpaso), 2.2-3.5 miles NW of San Fernando.","MEX",NA,1987,"PRESERVED_SPECIMEN","OCCURRENCE_STATUS_INFERRED_FROM_INDIVIDUAL_COUNT;COORDINATE_ROUNDED;GEODETIC_DATUM_ASSUMED_WGS84;INSTITUTION_MATCH_FUZZY;COLLECTION_MATCH_NONE"
-104.16666,21.41666,"Indigofera subulata",1259438565,"6 km al SW deTecuitata, camino Tecuitata-El Cora, o 4 km antes de El Cora.","MEX",NA,1990,"PRESERVED_SPECIMEN","GEODETIC_DATUM_ASSUMED_WGS84;INSTITUTION_MATCH_FUZZY;COLLECTION_MATCH_NONE"
-96.141389,15.9075,"Indigofera subulata",4032122649,"Mpio.San Miguel del Puerto. Rancho Copalitilla, 9 km al W de Santa María Xadani.","MEX",NA,2000,"PRESERVED_SPECIMEN","OCCURRENCE_STATUS_INFERRED_FROM_INDIVIDUAL_COUNT;COORDINATE_ROUNDED;GEODETIC_DATUM_ASSUMED_WGS84;INSTITUTION_MATCH_FUZZY;COLLECTION_MATCH_NONE"
-75.18333,2.86666,"Indigofera subulata",1261546357,"Along road NE past El Caguan toward Cerro Neiva (NE of Neiva); 9 km above El Caguan, 17 km beyond jct. of main road turn-off at bridge S edge of Neiva.","COL",NA,1983,"PRESERVED_SPECIMEN","OCCURRENCE_STATUS_INFERRED_FROM_INDIVIDUAL_COUNT;GEODETIC_DATUM_ASSUMED_WGS84;INSTITUTION_MATCH_FUZZY;COLLECTION_MATCH_NONE"
-86.80722,15.76972,"Indigofera subulata",1259435929,"Colectado en los alrededores de La Ceiba. Clima lluvioso tropical.","HND",NA,1981,"PRESERVED_SPECIMEN","GEODETIC_DATUM_ASSUMED_WGS84;INSTITUTION_MATCH_FUZZY;COLLECTION_MATCH_NONE"
-88.203889,13.763611,"Indigofera subulata",4031766258,"Mun. Chilanga, Ctón. Joya del Matazano, Crío. Los Cimientos, A.N.P. San Carlos-Cacahuatique, lindero bajando Loma de Peña Blanca.","SLV",NA,2014,"PRESERVED_SPECIMEN","OCCURRENCE_STATUS_INFERRED_FROM_INDIVIDUAL_COUNT;COORDINATE_ROUNDED;GEODETIC_DATUM_ASSUMED_WGS84;INSTITUTION_MATCH_FUZZY;COLLECTION_MATCH_NONE"
-111.06667,27.96667,"Indigofera subulata",3125261362,"San Carlos Bay west of Guaymas, canyon north of the bay along the road to Rancho La Manga","MEX",NA,1982,"PRESERVED_SPECIMEN","CONTINENT_DERIVED_FROM_COORDINATES;INSTITUTION_MATCH_FUZZY;COLLECTION_MATCH_NONE"
-70.62,18.57,"Indigofera subulata",1928142361,"16 Km. desde San José de Ocoa en el camino a El Pinar y el Cercado. En el Arroyo Demajagua.","DOM",NA,1981,"PRESERVED_SPECIMEN","GEODETIC_DATUM_ASSUMED_WGS84;COLLECTION_MATCH_FUZZY"
-75.707032,4.81076,"Indigofera subulata",2603427964,"","COL",NA,2020,"HUMAN_OBSERVATION","COORDINATE_ROUNDED;CONTINENT_DERIVED_FROM_COORDINATES"
-80.980625,24.747075,"Indigofera subulata",3455434877,"","USA",NA,2021,"HUMAN_OBSERVATION","CONTINENT_DERIVED_FROM_COORDINATES"
30.05442,-22.353412,"Indigofera subulata",3456021616,"","ZAF",4,2019,"HUMAN_OBSERVATION","COORDINATE_ROUNDED;CONTINENT_DERIVED_FROM_COORDINATES"
31.968922,-26.342488,"Indigofera subulata",2563486408,"","SWZ",100,2020,"HUMAN_OBSERVATION","COORDINATE_ROUNDED;CONTINENT_DERIVED_FROM_COORDINATES"
-99.5522,17.81778,"Indigofera subulata",3308000534,"Venta Vieja, 0.9 km al E","MEX",90,1994,"PRESERVED_SPECIMEN","TYPE_STATUS_INVALID;OCCURRENCE_STATUS_INFERRED_FROM_INDIVIDUAL_COUNT;GEODETIC_DATUM_ASSUMED_WGS84;CONTINENT_DERIVED_FROM_COORDINATES;INSTITUTION_MATCH_FUZZY;INSTITUTION_COLLECTION_MISMATCH"
-93.6397,16.15083,"Indigofera subulata",3308040586,"Nuevo Centro de Población 'Nuevo Costarica'","MEX",100,2002,"PRESERVED_SPECIMEN","TYPE_STATUS_INVALID;OCCURRENCE_STATUS_INFERRED_FROM_INDIVIDUAL_COUNT;GEODETIC_DATUM_ASSUMED_WGS84;CONTINENT_DERIVED_FROM_COORDINATES;INSTITUTION_MATCH_FUZZY;INSTITUTION_COLLECTION_MISMATCH"
-99.433,18.9,"Indigofera subulata",3308080523,"Carretera Chalma-Malinalco","MEX",90,2008,"PRESERVED_SPECIMEN","TYPE_STATUS_INVALID;OCCURRENCE_STATUS_INFERRED_FROM_INDIVIDUAL_COUNT;GEODETIC_DATUM_ASSUMED_WGS84;CONTINENT_DERIVED_FROM_COORDINATES;INSTITUTION_MATCH_FUZZY;INSTITUTION_COLLECTION_MISMATCH"
-89.1781,19.5875,"Indigofera subulata",3307892224,"A 2.5 km al SO de Xnoh Cruz","MEX",80,2005,"PRESERVED_SPECIMEN","TYPE_STATUS_INVALID;OCCURRENCE_STATUS_INFERRED_FROM_INDIVIDUAL_COUNT;GEODETIC_DATUM_ASSUMED_WGS84;CONTINENT_DERIVED_FROM_COORDINATES;INSTITUTION_MATCH_FUZZY;INSTITUTION_COLLECTION_MISMATCH"
-103.999,20.05972,"Indigofera subulata",3308015724,"6 km al este de San José de los Guajes pasando los Llanos y antes de los encinos","MEX",90,1997,"PRESERVED_SPECIMEN","TYPE_STATUS_INVALID;OCCURRENCE_STATUS_INFERRED_FROM_INDIVIDUAL_COUNT;GEODETIC_DATUM_ASSUMED_WGS84;CONTINENT_DERIVED_FROM_COORDINATES;INSTITUTION_MATCH_FUZZY;INSTITUTION_COLLECTION_MISMATCH"
-91.2578,17.03806,"Indigofera subulata",3308035576,"A 6.26 km al NE del poblado de Nuevo Guerrero","MEX",90,2003,"PRESERVED_SPECIMEN","TYPE_STATUS_INVALID;OCCURRENCE_STATUS_INFERRED_FROM_INDIVIDUAL_COUNT;GEODETIC_DATUM_ASSUMED_WGS84;CONTINENT_DERIVED_FROM_COORDINATES;INSTITUTION_MATCH_FUZZY;INSTITUTION_COLLECTION_MISMATCH"
-90.0047,14.93333,"Indigofera subulata",3308045544,"Trnasecto El Rancho Norte","GTM",NA,2003,"PRESERVED_SPECIMEN","TYPE_STATUS_INVALID;OCCURRENCE_STATUS_INFERRED_FROM_INDIVIDUAL_COUNT;GEODETIC_DATUM_ASSUMED_WGS84;CONTINENT_DERIVED_FROM_COORDINATES;INSTITUTION_MATCH_FUZZY;INSTITUTION_COLLECTION_MISMATCH"
-97.717,16.85892,"Indigofera subulata",3308123212,"Loma Larga, Agencia de Santiago el Meson, San Andrés Cabecera Nueva, Putla.","MEX",100,2013,"PRESERVED_SPECIMEN","TYPE_STATUS_INVALID;OCCURRENCE_STATUS_INFERRED_FROM_INDIVIDUAL_COUNT;GEODETIC_DATUM_ASSUMED_WGS84;CONTINENT_DERIVED_FROM_COORDINATES;INSTITUTION_MATCH_FUZZY;INSTITUTION_COLLECTION_MISMATCH"
-93.4122,16.00944,"Indigofera subulata",3308068649,"Rancho Corpus Christi.","MEX",100,2003,"PRESERVED_SPECIMEN","TYPE_STATUS_INVALID;OCCURRENCE_STATUS_INFERRED_FROM_INDIVIDUAL_COUNT;GEODETIC_DATUM_ASSUMED_WGS84;CONTINENT_DERIVED_FROM_COORDINATES;INSTITUTION_MATCH_FUZZY;INSTITUTION_COLLECTION_MISMATCH"
-89.9594,14.89611,"Indigofera subulata",3308063547,"Sn Agustín AC Transecto Paso de los Jalapa","GTM",NA,2003,"PRESERVED_SPECIMEN","TYPE_STATUS_INVALID;OCCURRENCE_STATUS_INFERRED_FROM_INDIVIDUAL_COUNT;GEODETIC_DATUM_ASSUMED_WGS84;CONTINENT_DERIVED_FROM_COORDINATES;INSTITUTION_MATCH_FUZZY;INSTITUTION_COLLECTION_MISMATCH"
-86.067,12.5,"Indigofera subulata",3307727195,"carretera Panamericana en la base de la Cuesta del Coyol, Km 56;","NIC",NA,1980,"PRESERVED_SPECIMEN","TYPE_STATUS_INVALID;OCCURRENCE_STATUS_INFERRED_FROM_INDIVIDUAL_COUNT;GEODETIC_DATUM_ASSUMED_WGS84;CONTINENT_DERIVED_FROM_COORDINATES;INSTITUTION_MATCH_FUZZY;INSTITUTION_COLLECTION_MISMATCH"
-90.067,13.8,"Indigofera subulata",3308062835,"A.P. Santa Rita, corredor biológico. 20 m.","SLV",NA,2004,"PRESERVED_SPECIMEN","TYPE_STATUS_INVALID;OCCURRENCE_STATUS_INFERRED_FROM_INDIVIDUAL_COUNT;GEODETIC_DATUM_ASSUMED_WGS84;CONTINENT_DERIVED_FROM_COORDINATES;INSTITUTION_MATCH_FUZZY;INSTITUTION_COLLECTION_MISMATCH"
-89.3528,18.61806,"Indigofera subulata",3308502065,"km 6 rumbo a Nuevo Becal.","MEX",80,1997,"PRESERVED_SPECIMEN","TYPE_STATUS_INVALID;OCCURRENCE_STATUS_INFERRED_FROM_INDIVIDUAL_COUNT;GEODETIC_DATUM_ASSUMED_WGS84;CONTINENT_DERIVED_FROM_COORDINATES;INSTITUTION_MATCH_FUZZY;INSTITUTION_COLLECTION_MISMATCH"
-91.3953,16.985,"Indigofera subulata",3308617565,"A 4.93 km al SE de Santo Domingo.","MEX",90,2003,"PRESERVED_SPECIMEN","TYPE_STATUS_INVALID;OCCURRENCE_STATUS_INFERRED_FROM_INDIVIDUAL_COUNT;GEODETIC_DATUM_ASSUMED_WGS84;CONTINENT_DERIVED_FROM_COORDINATES;INSTITUTION_MATCH_FUZZY;INSTITUTION_COLLECTION_MISMATCH"
-85.6,11.533,"Indigofera subulata",3308350667,"Isla Ometepe, Volcán Concepción, pueblo de Altagracia","NIC",NA,1984,"PRESERVED_SPECIMEN","TYPE_STATUS_INVALID;OCCURRENCE_STATUS_INFERRED_FROM_INDIVIDUAL_COUNT;GEODETIC_DATUM_ASSUMED_WGS84;CONTINENT_DERIVED_FROM_COORDINATES;INSTITUTION_MATCH_FUZZY;INSTITUTION_COLLECTION_MISMATCH"
-96.1611,15.72222,"Indigofera subulata",3308434515,"Estero de Cacaluta","MEX",100,1992,"PRESERVED_SPECIMEN","TYPE_STATUS_INVALID;OCCURRENCE_STATUS_INFERRED_FROM_INDIVIDUAL_COUNT;GEODETIC_DATUM_ASSUMED_WGS84;CONTINENT_DERIVED_FROM_COORDINATES;INSTITUTION_MATCH_FUZZY;INSTITUTION_COLLECTION_MISMATCH"
43.7,-24.06666,"Indigofera subulata",4061789893,"Efoetsy (S.O.), anciennes dunes.","MDG",NA,1951,"PRESERVED_SPECIMEN","GEODETIC_DATUM_ASSUMED_WGS84;DIFFERENT_OWNER_INSTITUTION"
-109.519,28.6389,"Indigofera subulata",2270510204,"Mpio. de Soyopa. 3.8 km west of Río Yaqui bridge, 10.5 km east of La Barranca on MEX 16.","MEX",NA,2004,"PRESERVED_SPECIMEN","GEODETIC_DATUM_ASSUMED_WGS84;CONTINENT_DERIVED_FROM_COORDINATES;INSTITUTION_MATCH_FUZZY;INSTITUTION_COLLECTION_MISMATCH"
-11.15,9.17,"Indigofera subulata",912497714,"Morea N.P.","SLE",NA,1964,"PRESERVED_SPECIMEN","GEODETIC_DATUM_ASSUMED_WGS84;CONTINENT_DERIVED_FROM_COORDINATES;INSTITUTION_MATCH_FUZZY;COLLECTION_MATCH_FUZZY"
30.25,-15.27,"Indigofera subulata",912497690,"Flder north Rhodesia; Katondwe","ZMB",NA,1965,"PRESERVED_SPECIMEN","GEODETIC_DATUM_ASSUMED_WGS84;CONTINENT_DERIVED_FROM_COORDINATES;INSTITUTION_MATCH_FUZZY;COLLECTION_MATCH_FUZZY"
37.3,26.25,"Indigofera subulata",912497722,"Wadi Kharat. foot of the Makkah taif escarpment","SAU",NA,1990,"PRESERVED_SPECIMEN","GEODETIC_DATUM_ASSUMED_WGS84;CONTINENT_DERIVED_FROM_COORDINATES;INSTITUTION_MATCH_FUZZY;COLLECTION_MATCH_FUZZY"
3.016667,13.766667,"Indigofera subulata",2515849489,"Niamey - Filingué. 'Mares' near Tabla, 7 km from Baleyara.","NER",NA,1986,"PRESERVED_SPECIMEN","INSTITUTION_MATCH_FUZZY;INSTITUTION_COLLECTION_MISMATCH"
29.3,-3.2,"Indigofera subulata",2517266743,"Gihanga.","BDI",NA,1981,"PRESERVED_SPECIMEN","INSTITUTION_MATCH_FUZZY;INSTITUTION_COLLECTION_MISMATCH"
-85.006667,10.173333,"Indigofera subulata",2517126149,"! zul Guanacaste Province, ! lary growth near village.","CRI",NA,1991,"PRESERVED_SPECIMEN","INSTITUTION_MATCH_FUZZY;INSTITUTION_COLLECTION_MISMATCH"
-70.73,19.78,"Indigofera subulata",1927936250,"Cordillera Septentrional: aprox. 4 Km oeste de a ciudad de Puerto Plato y 3 Km sur en la carretera a Copey y la subida a Loma Isabel de Torre.","DOM",NA,1983,"PRESERVED_SPECIMEN","GEODETIC_DATUM_ASSUMED_WGS84;COLLECTION_MATCH_FUZZY"
-95.953611,15.830833,"Indigofera subulata",2807648866,"Municipio de Santiago Astata, Distrito Tehuantepec. Las tres peladas, 3 km al SE de Barra de la Cruz cerca de la playa.","MEX",NA,2000,"PRESERVED_SPECIMEN","COORDINATE_ROUNDED;GEODETIC_DATUM_ASSUMED_WGS84;INSTITUTION_MATCH_FUZZY;COLLECTION_MATCH_FUZZY"
-92.9114,16.7963,"Indigofera subulata",2807430310,"Along Mexican Highway 190 in the Zinacantán paraje of Muctajoc.","MEX",NA,1965,"PRESERVED_SPECIMEN","GEODETIC_DATUM_ASSUMED_WGS84;INSTITUTION_MATCH_FUZZY;INSTITUTION_COLLECTION_MISMATCH"
-96.066389,16.033611,"Indigofera subulata",2807268936,"Mpio. San Miguel del Puerto, Distrito Pochutla. Santa Maria Xadani, 12.3 km N hacia la Merced del Potrero.","MEX",NA,1999,"PRESERVED_SPECIMEN","COORDINATE_ROUNDED;GEODETIC_DATUM_ASSUMED_WGS84;INSTITUTION_MATCH_FUZZY;COLLECTION_MATCH_FUZZY"
-97.046,18.134,"Indigofera subulata",2807402270,"1-2 Km al E del entronque de la carr. 135, por la terraceria rumbo a Quiotepec.","MEX",NA,1988,"PRESERVED_SPECIMEN","GEODETIC_DATUM_ASSUMED_WGS84;INSTITUTION_MATCH_FUZZY;COLLECTION_MATCH_FUZZY"
-104.991667,19.433333,"Indigofera subulata",2807463063,"Rancho Cuixmala, ca 2 Km inland on the rd to Cumbres 1 from Station 45, [Km 45 of the Puerto Vallarta-Barra de Navidad (Méx 200) Hwy].","MEX",NA,1991,"PRESERVED_SPECIMEN","COORDINATE_ROUNDED;GEODETIC_DATUM_ASSUMED_WGS84;INSTITUTION_MATCH_FUZZY;COLLECTION_MATCH_FUZZY"
-99.158333,23.158333,"Indigofera subulata",1894240105,"EJIDO LA LIBERTAD, 4 KM AL W DE EL ENCINO BOSQUE TROPICAL SUBCADUCIFOLIO, SUELO SOMERO","MEX",70,1984,"PRESERVED_SPECIMEN","TYPE_STATUS_INVALID;COORDINATE_ROUNDED;GEODETIC_DATUM_ASSUMED_WGS84;CONTINENT_DERIVED_FROM_COORDINATES;ELEVATION_MIN_MAX_SWAPPED;INSTITUTION_MATCH_NONE"
-86.511667,11.862778,"Indigofera subulata",4031710491,"Municipio San Rafael del Sur, Reserva Natura, parcela 4.","NIC",NA,2010,"PRESERVED_SPECIMEN","OCCURRENCE_STATUS_INFERRED_FROM_INDIVIDUAL_COUNT;COORDINATE_ROUNDED;GEODETIC_DATUM_ASSUMED_WGS84;INSTITUTION_MATCH_FUZZY;COLLECTION_MATCH_NONE"
-95.88,16.47,"Indigofera subulata",1259436400,"[Mun. Oaxaca de Juárez]. Along Highway 190, 93 mi SE of Oaxaca","MEX",NA,1977,"PRESERVED_SPECIMEN","GEODETIC_DATUM_ASSUMED_WGS84;INSTITUTION_MATCH_FUZZY;COLLECTION_MATCH_NONE"
2.10715,6.870635,"Indigofera subulata",2549153035,"Toffo","BEN",NA,2003,"HUMAN_OBSERVATION","GEODETIC_DATUM_ASSUMED_WGS84"
