"lon","lat","species","gbifID","locality","countryCode","coordinateUncertaintyInMeters","year","basisOfRecord","issue"
-78.38,1.03,"Inga coruscans",1096710185,"Flora of Ecuador. Province Carchi. Gualpí Alto area. Disturbed wet forest.","ECU",NA,1985,"PRESERVED_SPECIMEN","GEODETIC_DATUM_ASSUMED_WGS84;CONTINENT_DERIVED_FROM_COORDINATES;CONTINENT_INVALID;INSTITUTION_COLLECTION_MISMATCH"
-67.4775,-15.461389,"Inga coruscans",4061391203,"Alto Beni. Centro de Investigación y Capacitación Sara Ana a la carretera, a 30 min del Km 73 camino a Sararía-Mayaya.","BOL",NA,2008,"PRESERVED_SPECIMEN","OCCURRENCE_STATUS_INFERRED_FROM_INDIVIDUAL_COUNT;COORDINATE_ROUNDED;GEODETIC_DATUM_ASSUMED_WGS84;DIFFERENT_OWNER_INSTITUTION"
-74.24305,-5.12833,"Inga coruscans",4061642134,"Dist. Contamana, comunidad de Bretaña y Manco Capac. Bosque secundario","PER",NA,2006,"PRESERVED_SPECIMEN","OCCURRENCE_STATUS_INFERRED_FROM_INDIVIDUAL_COUNT;GEODETIC_DATUM_ASSUMED_WGS84;DIFFERENT_OWNER_INSTITUTION"
-64.516389,-17.188333,"Inga coruscans",4062001029,"Entre Ríos. Dist. tres, Sector Coop.","BOL",NA,2006,"PRESERVED_SPECIMEN","OCCURRENCE_STATUS_INFERRED_FROM_INDIVIDUAL_COUNT;COORDINATE_ROUNDED;GEODETIC_DATUM_ASSUMED_WGS84;DIFFERENT_OWNER_INSTITUTION"
-84.00361,10.43138,"Inga coruscans",4061010300,"Near La Selva Biological Station.","CRI",NA,1981,"PRESERVED_SPECIMEN","OCCURRENCE_STATUS_INFERRED_FROM_INDIVIDUAL_COUNT;GEODETIC_DATUM_ASSUMED_WGS84;INSTITUTION_MATCH_NONE"
-72.972222,-7.509722,"Inga coruscans",2998214724,"Basin of Rio Juruá, Rio Moa, Volta da Aurora.","BRA",NA,1996,"PRESERVED_SPECIMEN","RECORDED_DATE_INVALID;COORDINATE_ROUNDED;GEODETIC_DATUM_ASSUMED_WGS84;CONTINENT_DERIVED_FROM_COORDINATES;INSTITUTION_MATCH_FUZZY;COLLECTION_MATCH_FUZZY"
-51.093083,-13.077056,"Inga coruscans",1090845629,"Fazenda Tracajá, Mara ciliar inundável do Rio das Mortes.","BRA",NA,2000,"PRESERVED_SPECIMEN","GEODETIC_DATUM_ASSUMED_WGS84;CONTINENT_DERIVED_FROM_COORDINATES;DIFFERENT_OWNER_INSTITUTION"
-77,-0.416667,"Inga coruscans",1261862267,"Estación Experimental INIAP-Payamino, 5 km al N de Coca. Reserva Florística El Chuncho. Suelo predominante oxisol rojo.","ECU",NA,1986,"PRESERVED_SPECIMEN","OCCURRENCE_STATUS_INFERRED_FROM_INDIVIDUAL_COUNT;COORDINATE_ROUNDED;GEODETIC_DATUM_ASSUMED_WGS84;INSTITUTION_MATCH_FUZZY;COLLECTION_MATCH_NONE"
-79.36666,-0.58333,"Inga coruscans",1260257124,"Rio Palenque Biological Station Km 56 Quevedo-Santo Domingo.","ECU",NA,1973,"PRESERVED_SPECIMEN","GEODETIC_DATUM_ASSUMED_WGS84;INSTITUTION_MATCH_FUZZY;COLLECTION_MATCH_NONE"
-83.56666,8.66666,"Inga coruscans",1259922354,"Osa Peninsula, Rancho Quemadol Pasture.","CRI",NA,1992,"PRESERVED_SPECIMEN","GEODETIC_DATUM_ASSUMED_WGS84;INSTITUTION_MATCH_FUZZY;COLLECTION_MATCH_NONE"
-73.35,-3.8,"Inga coruscans",1261543352,"Puerto Almendras (Río Nanay). Bosque primario.","PER",NA,1990,"PRESERVED_SPECIMEN","OCCURRENCE_STATUS_INFERRED_FROM_INDIVIDUAL_COUNT;GEODETIC_DATUM_ASSUMED_WGS84;INSTITUTION_MATCH_FUZZY;COLLECTION_MATCH_NONE"
-77.6,-0.71666,"Inga coruscans",1261919700,"Carretera Hollín-Loreto. Km 40, 5 km al oeste del Caserío de Huamaní, faldas del volcan Sumaco. Bosque pluvial Premontano.","ECU",NA,1988,"PRESERVED_SPECIMEN","OCCURRENCE_STATUS_INFERRED_FROM_INDIVIDUAL_COUNT;GEODETIC_DATUM_ASSUMED_WGS84;INSTITUTION_MATCH_FUZZY;COLLECTION_MATCH_NONE"
-65.157222,-16.996389,"Inga coruscans",1258461822,"Chimore, Chapare. Entre la vegetacion alta.","BOL",NA,1966,"PRESERVED_SPECIMEN","GEODETIC_DATUM_ASSUMED_WGS84;INSTITUTION_MATCH_FUZZY;COLLECTION_MATCH_NONE"
-78.15,-1.43333,"Inga coruscans",1261546507,"Along road from Puyo to Baños, 5.7 km W of shell; ca 1º26'S, 78º09'W, elev. 1070 m.","ECU",NA,1984,"PRESERVED_SPECIMEN","OCCURRENCE_STATUS_INFERRED_FROM_INDIVIDUAL_COUNT;GEODETIC_DATUM_ASSUMED_WGS84;INSTITUTION_MATCH_FUZZY;COLLECTION_MATCH_NONE"
-68.479444,-15.442222,"Inga coruscans",4062261446,"Alto Beni, Sara Ana, a 30 minutos de la Escuela San Juan Suapi, camino Sararia-Mayaya.","BOL",NA,2014,"PRESERVED_SPECIMEN","OCCURRENCE_STATUS_INFERRED_FROM_INDIVIDUAL_COUNT;COORDINATE_ROUNDED;GEODETIC_DATUM_ASSUMED_WGS84;INSTITUTION_MATCH_FUZZY;COLLECTION_MATCH_NONE"
-74.321244,7.977419,"Inga coruscans",1273758478,"Serranía de San Lucas, La Libertad","COL",NA,1987,"PRESERVED_SPECIMEN","COORDINATE_ROUNDED;INSTITUTION_MATCH_FUZZY;COLLECTION_MATCH_FUZZY"
-74.561356,8.339856,"Inga coruscans",1273758486,"La Raya","COL",NA,1988,"PRESERVED_SPECIMEN","COORDINATE_ROUNDED;INSTITUTION_MATCH_FUZZY;COLLECTION_MATCH_FUZZY"
-69.48632,-12.96773,"Inga coruscans",3762879301,"Tambopata 1; TAM1","PER",NA,2008,"PRESERVED_SPECIMEN","GEODETIC_DATUM_ASSUMED_WGS84;CONTINENT_DERIVED_FROM_COORDINATES;INSTITUTION_MATCH_FUZZY;INSTITUTION_COLLECTION_MISMATCH"
-70.10941,-12.55205,"Inga coruscans",3762880702,"Los Amigos; T1","PER",NA,2011,"PRESERVED_SPECIMEN","GEODETIC_DATUM_ASSUMED_WGS84;CONTINENT_DERIVED_FROM_COORDINATES;INSTITUTION_MATCH_FUZZY;INSTITUTION_COLLECTION_MISMATCH"
-69.51756,-12.93409,"Inga coruscans",3762878324,"Tambopata 2; TAM2","PER",NA,2008,"PRESERVED_SPECIMEN","GEODETIC_DATUM_ASSUMED_WGS84;CONTINENT_DERIVED_FROM_COORDINATES;INSTITUTION_MATCH_FUZZY;INSTITUTION_COLLECTION_MISMATCH"
-60.18,2.416667,"Inga coruscans",1042601098,"Serra da Lua, Lower slopes of Serra da Lua.","BRA",NA,1969,"PRESERVED_SPECIMEN","GEODETIC_DATUM_ASSUMED_WGS84;GEODETIC_DATUM_INVALID;INSTITUTION_MATCH_NONE"
-67.9358,-14.2133,"Inga coruscans",1936655683,"Departamento La Paz, Provincia Abel Iturralde.","BOL",NA,2001,"PRESERVED_SPECIMEN","GEODETIC_DATUM_ASSUMED_WGS84;CONTINENT_DERIVED_FROM_COORDINATES;INSTITUTION_MATCH_FUZZY;COLLECTION_MATCH_FUZZY"
-76.194639,-1.02625,"Inga coruscans",1936563783,"Provincia de Orellana, Parque Nacional Yasuní. Tierra firme Km. 114,1","ECU",NA,1998,"PRESERVED_SPECIMEN","COORDINATE_ROUNDED;GEODETIC_DATUM_ASSUMED_WGS84;CONTINENT_DERIVED_FROM_COORDINATES;INSTITUTION_MATCH_FUZZY;COLLECTION_MATCH_FUZZY"
-89.93333,13.81666,"Inga coruscans",1259564750,"P.N. El Imposible, Transecto # 4, San Benito. Creciendo en un bosque secundario, pendiente de 35 grados. Vegetación alrededor: 1 zapato de mico, 2 pepeto guamito, 1 saúco, 3 chilindrón, 1 vara ceniza, 1 cirin, 1 caimito, 2 chorcha de pava, 1 guayacán de tierra fría, 1 sapuyulo, 1 limonario, 1 chirimoya.","SLV",NA,1990,"PRESERVED_SPECIMEN","GEODETIC_DATUM_ASSUMED_WGS84;INSTITUTION_MATCH_FUZZY;COLLECTION_MATCH_NONE"
-77.583333,8.466667,"Inga coruscans",1259571084,"Between Quebrada Venado and Peje Swamp on the headwaters of Río Tuqueza [Tuquesa].","PAN",NA,1967,"PRESERVED_SPECIMEN","OCCURRENCE_STATUS_INFERRED_FROM_INDIVIDUAL_COUNT;COORDINATE_ROUNDED;GEODETIC_DATUM_ASSUMED_WGS84;INSTITUTION_MATCH_FUZZY;COLLECTION_MATCH_NONE"
-77.7,-1.05,"Inga coruscans",4031541765,"Puerto Napo-Jatun Sacha. Mixed lowland forest.","ECU",NA,1992,"PRESERVED_SPECIMEN","GEODETIC_DATUM_ASSUMED_WGS84;INSTITUTION_MATCH_FUZZY;COLLECTION_MATCH_NONE"
-76.8,-2.51666,"Inga coruscans",1261544153,"Comuna Shuar AMUNTAY (KAPAWI). Bosque húmedo Tropical.","ECU",NA,1988,"PRESERVED_SPECIMEN","OCCURRENCE_STATUS_INFERRED_FROM_INDIVIDUAL_COUNT;GEODETIC_DATUM_ASSUMED_WGS84;INSTITUTION_MATCH_FUZZY;COLLECTION_MATCH_NONE"
-77.71666,8.13333,"Inga coruscans",1259568777,"Vicinity of El Real, Río Tuira. Woodlands and pasture margins near El Real","PAN",NA,1959,"PRESERVED_SPECIMEN","GEODETIC_DATUM_ASSUMED_WGS84;INSTITUTION_MATCH_FUZZY;COLLECTION_MATCH_NONE"
-64.98333,6.35,"Inga coruscans",1260259078,"Nombre Yekuana: Kudami. Cuadrícula de investigación, campamento Dedemai, Río Tabaro,","VEN",NA,1991,"PRESERVED_SPECIMEN","GEODETIC_DATUM_ASSUMED_WGS84;INSTITUTION_MATCH_FUZZY;COLLECTION_MATCH_NONE"
-74.8,6.05,"Inga coruscans",4031663837,"Vereda Las Confusas. Finca Las Confusas. Bosque primario.","COL",NA,1990,"PRESERVED_SPECIMEN","OCCURRENCE_STATUS_INFERRED_FROM_INDIVIDUAL_COUNT;GEODETIC_DATUM_ASSUMED_WGS84;INSTITUTION_MATCH_FUZZY;COLLECTION_MATCH_NONE"
-76.316667,6.533333,"Inga coruscans",1261542739,"Vereda Calles. Parque Nacional Natural Las Orquídeas. Margen derecha del Río Calles, en el filo NW de la Cabaña de Calles. bp-PM. Colectado con A. Duque, F. Giraldo, W. Rodriguez & E. Alvarez","COL",NA,1993,"PRESERVED_SPECIMEN","OCCURRENCE_STATUS_INFERRED_FROM_INDIVIDUAL_COUNT;COORDINATE_ROUNDED;GEODETIC_DATUM_ASSUMED_WGS84;INSTITUTION_MATCH_FUZZY;COLLECTION_MATCH_NONE"
-78.30444,-2.46805,"Inga coruscans",4031536899,"Parroquia Sinai. Sector Huaorani, topografía colinada, dosel abierto con árboles de 20 m, suelo con abundante humedad. Río Tuturnanguza, bosque alternado con pastizales.","ECU",NA,1999,"PRESERVED_SPECIMEN","GEODETIC_DATUM_ASSUMED_WGS84;INSTITUTION_MATCH_FUZZY;COLLECTION_MATCH_NONE"
-73.66666,-3.91666,"Inga coruscans",1258236833,"Dtto. Santa Maria de Nanay, Quebrada Yarina. Bosque primario (orilla de quebrada).","PER",NA,1989,"PRESERVED_SPECIMEN","OCCURRENCE_STATUS_INFERRED_FROM_INDIVIDUAL_COUNT;GEODETIC_DATUM_ASSUMED_WGS84;INSTITUTION_MATCH_FUZZY;COLLECTION_MATCH_NONE"
-83.483333,8.6,"Inga coruscans",2515525587,"Flora of Costa Rica. Puntarenas, Osa Peninsula, confluence of R Pavon & R Rincon.","CRI",NA,1992,"PRESERVED_SPECIMEN","INSTITUTION_MATCH_FUZZY;INSTITUTION_COLLECTION_MISMATCH"
-79.83,0.5,"Inga coruscans",1929138388,"Community San Salvador, 10 km E of Puerto Nuevo, along the Sucio River.","ECU",NA,1996,"PRESERVED_SPECIMEN","GEODETIC_DATUM_ASSUMED_WGS84;COLLECTION_MATCH_FUZZY"
-75.033333,-9.666667,"Inga coruscans",1260251581,"Unidad Modelo de manejo y Producción Forestal Dantas. Dtto. Yuyapichis, Prov. Puerto Inca, Dpto. Huánuco. Bosque húmedo tropical, 2500 PMA, 23.5°C TMA. Bosque de lomadas, colinas bajas y terrazas altas.","PER",NA,1990,"PRESERVED_SPECIMEN","OCCURRENCE_STATUS_INFERRED_FROM_INDIVIDUAL_COUNT;COORDINATE_ROUNDED;GEODETIC_DATUM_ASSUMED_WGS84;INSTITUTION_MATCH_FUZZY;COLLECTION_MATCH_NONE"
-78.88333,0.71666,"Inga coruscans",4031540803,"Reserva Ecológica Cotacachi-Cayapas. Charco Vicente. Río San Miguel, afluente del Río Cayapas. Bosque primario. Parcela Permanente y vegetación circundante.","ECU",NA,1993,"PRESERVED_SPECIMEN","GEODETIC_DATUM_ASSUMED_WGS84;INSTITUTION_MATCH_FUZZY;COLLECTION_MATCH_NONE"
-71.40888,-12.87638,"Inga coruscans",4031729201,"Distrito Kosñipata. Quebrada Piñi Piñi. Bosque secundario en una trocha de extracción de madera.","PER",NA,2007,"PRESERVED_SPECIMEN","OCCURRENCE_STATUS_INFERRED_FROM_INDIVIDUAL_COUNT;GEODETIC_DATUM_ASSUMED_WGS84;INSTITUTION_MATCH_FUZZY;COLLECTION_MATCH_NONE"
-75.416667,7.583333,"Inga coruscans",1261485531,"Correg. 12, 212 km NE of Medellín, Río Cauca, right margin on road from El Doce to Barro Blanco, Río Purí","COL",NA,1987,"PRESERVED_SPECIMEN","OCCURRENCE_STATUS_INFERRED_FROM_INDIVIDUAL_COUNT;COORDINATE_ROUNDED;GEODETIC_DATUM_ASSUMED_WGS84;INSTITUTION_MATCH_FUZZY;COLLECTION_MATCH_NONE"
-77.16666,3.83333,"Inga coruscans",1258246282,"Bajo Calima Concession. Ca 16 km NW of Buenaventura, at end of Gasolina Rd, Juanchaco area, BV-82. Wet tropical forest.","COL",NA,1987,"PRESERVED_SPECIMEN","OCCURRENCE_STATUS_INFERRED_FROM_INDIVIDUAL_COUNT;GEODETIC_DATUM_ASSUMED_WGS84;INSTITUTION_MATCH_FUZZY;COLLECTION_MATCH_NONE"
-80.7,-1.6,"Inga coruscans",1261902902,"Machalilla National Park, zona de San Sebastian, ridgetop. TRANSECT # 9-10","ECU",NA,1991,"PRESERVED_SPECIMEN","OCCURRENCE_STATUS_INFERRED_FROM_INDIVIDUAL_COUNT;GEODETIC_DATUM_ASSUMED_WGS84;INSTITUTION_MATCH_FUZZY;COLLECTION_MATCH_NONE"
-73.5,-4.16666,"Inga coruscans",1258297757,"Dtto. Iquitos, Allpahuayo. Estación Experimental del Instituto de Investigaciones de la Amazonía Peruana - IIAP. Bosque primario, vegetación sobre suelo arcillo-arenoso (arena blanca), estrato inferior con dominancia de Lepidocaryum tessmannii (irapay), y esøtrato medio con relativa abundancia de Jessenia bataua subsp. bataua (huangurahui); drenaje irregular, pequeøñas y lígeras ondulaciones del terreno. Levantamiento florístico de la parcela A de 1 Ha; 500 X 20 m; correspondiente al inventario de 2 Has. SUBPARCELA No. 1","PER",NA,1990,"PRESERVED_SPECIMEN","OCCURRENCE_STATUS_INFERRED_FROM_INDIVIDUAL_COUNT;GEODETIC_DATUM_ASSUMED_WGS84;INSTITUTION_MATCH_FUZZY;COLLECTION_MATCH_NONE"
-80.61666,-1.88333,"Inga coruscans",1258482494,"Reserva Comunal Loma Alta, 5 km NW of Suspiro. Fog Forest.","ECU",NA,1997,"PRESERVED_SPECIMEN","OCCURRENCE_STATUS_INFERRED_FROM_INDIVIDUAL_COUNT;GEODETIC_DATUM_ASSUMED_WGS84;INSTITUTION_MATCH_FUZZY;COLLECTION_MATCH_NONE"
-77,3.916667,"Inga coruscans",4031568884,"Concesión Pulpapel/Buenaventura. Bosque pluvial tropical. Suelos deficientes en nutrientes principalmente en P, Ca, K, Mg, Cu, B, Mn, Zn y un alto porcentaje de saturación de Al. Carretera a San Isidro.","COL",NA,1987,"PRESERVED_SPECIMEN","OCCURRENCE_STATUS_INFERRED_FROM_INDIVIDUAL_COUNT;COORDINATE_ROUNDED;GEODETIC_DATUM_ASSUMED_WGS84;INSTITUTION_MATCH_FUZZY;COLLECTION_MATCH_NONE"
-68.9,-12.766667,"Inga coruscans",1261461044,"Pampas del Heath. Forest near edge of savannah. TRANSECT # 6","PER",NA,1990,"PRESERVED_SPECIMEN","OCCURRENCE_STATUS_INFERRED_FROM_INDIVIDUAL_COUNT;COORDINATE_ROUNDED;GEODETIC_DATUM_ASSUMED_WGS84;INSTITUTION_MATCH_FUZZY;COLLECTION_MATCH_NONE"
-80.0833,-0.6667,"Inga coruscans",1228162612,"Manabí","ECU",NA,1992,"PRESERVED_SPECIMEN","GEODETIC_DATUM_ASSUMED_WGS84;INSTITUTION_MATCH_FUZZY;AMBIGUOUS_COLLECTION"
-83.58,8.71,"Inga coruscans",1261566602,"R.F. Golfo Dulce; Península de Osa. Rancho Quemado, camino a Drake.","CRI",NA,1993,"PRESERVED_SPECIMEN","OCCURRENCE_STATUS_INFERRED_FROM_INDIVIDUAL_COUNT;GEODETIC_DATUM_ASSUMED_WGS84;DIFFERENT_OWNER_INSTITUTION"
-79.58333,-2.41666,"Inga coruscans",4060996143,"Reserva Ecológica Manglares - Churute. Cerca a la Cumbre del Cerro Pancho Diablo de frente al Puerto del Gallo. Topografía colinada. Suelo claro con esacasas piedras. Transectos de 50 x 2 m x 5 (0.5 Ha.).","ECU",NA,1992,"PRESERVED_SPECIMEN","OCCURRENCE_STATUS_INFERRED_FROM_INDIVIDUAL_COUNT;GEODETIC_DATUM_ASSUMED_WGS84;ELEVATION_MIN_MAX_SWAPPED;INSTITUTION_MATCH_NONE"
-76.869444,3.828056,"Inga coruscans",4061653665,"Corregimiento Córdoba, Vereda San Cipriano, Reserva Natural Escalerete. Parcela E.","COL",NA,1996,"PRESERVED_SPECIMEN","OCCURRENCE_STATUS_INFERRED_FROM_INDIVIDUAL_COUNT;COORDINATE_ROUNDED;GEODETIC_DATUM_ASSUMED_WGS84;INSTITUTION_MATCH_NONE"
-77.55,8.001944,"Inga coruscans",4060965938,"1-4 miles N of Pucro.","PAN",NA,1967,"PRESERVED_SPECIMEN","OCCURRENCE_STATUS_INFERRED_FROM_INDIVIDUAL_COUNT;COORDINATE_ROUNDED;GEODETIC_DATUM_ASSUMED_WGS84;ELEVATION_NON_NUMERIC;INSTITUTION_MATCH_NONE"
-74.3625,-5.33472,"Inga coruscans",4061602267,"Dist. Contamana, San Carlos, alrededores del pueblo. Bosque Inundable","PER",NA,2006,"PRESERVED_SPECIMEN","OCCURRENCE_STATUS_INFERRED_FROM_INDIVIDUAL_COUNT;GEODETIC_DATUM_ASSUMED_WGS84;DIFFERENT_OWNER_INSTITUTION"
-84.27,10.24,"Inga coruscans",45330059,"Cordillera Central. Bajos del Toro. Bosque primario y zonas alteradas. Cerca del río Agrio.","CRI",NA,1995,"PRESERVED_SPECIMEN","GEODETIC_DATUM_ASSUMED_WGS84;CONTINENT_DERIVED_FROM_COORDINATES;TAXON_MATCH_HIGHERRANK;INSTITUTION_MATCH_NONE"
-83.77,9.29,"Inga coruscans",45330044,"Faldas de Fila Tinamaste. Finca de los suizos.","CRI",NA,1998,"PRESERVED_SPECIMEN","GEODETIC_DATUM_ASSUMED_WGS84;CONTINENT_DERIVED_FROM_COORDINATES;TAXON_MATCH_HIGHERRANK;INSTITUTION_MATCH_NONE"
-77.6,-1.066667,"Inga coruscans",1258247085,"Estación Biológica Jatun Sacha. Río Napo, 8 km al este de Misahuallí. Bosque primario. Suelo rojo arcilloso, en colinas.","ECU",NA,1991,"PRESERVED_SPECIMEN","OCCURRENCE_STATUS_INFERRED_FROM_INDIVIDUAL_COUNT;COORDINATE_ROUNDED;GEODETIC_DATUM_ASSUMED_WGS84;DIFFERENT_OWNER_INSTITUTION"
-78.18333,0.83333,"Inga coruscans",1258292484,"El Carmen. Cerro Golondrinas. Bosque Montano. Bosque primario en colinas.","ECU",NA,1994,"PRESERVED_SPECIMEN","GEODETIC_DATUM_ASSUMED_WGS84;INSTITUTION_MATCH_NONE"
-79.07,-3.9666,"Inga coruscans",1260717888,"Area of the Estación Cientifica San Francisco, road Loja-Zamora, ca. 35 km from Loja, montane tropical forest.","ECU",NA,2001,"PRESERVED_SPECIMEN","GEODETIC_DATUM_ASSUMED_WGS84;INSTITUTION_MATCH_FUZZY;COLLECTION_MATCH_NONE"
-76.91666,0.03333,"Inga coruscans",1259040553,"Río Pucino, first major tributary of Río Aguarico above bridge at Aguarico (near Lago Agrio).","ECU",NA,1974,"PRESERVED_SPECIMEN","GEODETIC_DATUM_ASSUMED_WGS84;INSTITUTION_MATCH_FUZZY;COLLECTION_MATCH_NONE"
-75.350314,6.406322,"Inga coruscans",3780833489,"Vereda la Chorrera y vereda la Tolda","COL",NA,2020,"HUMAN_OBSERVATION",""
-73.916667,11.066667,"Inga coruscans",1707514359,"Alto río Guachaca, por el camino real de la Tagua a la Escuela La María (Macho Solo), mitad de camino cerca al boquerón","COL",NA,1989,"PRESERVED_SPECIMEN","COORDINATE_ROUNDED;GEODETIC_DATUM_ASSUMED_WGS84;INSTITUTION_MATCH_NONE"
-84.8333,10,"Inga coruscans",1228423134,"Puntarenas","CRI",NA,1996,"PRESERVED_SPECIMEN","GEODETIC_DATUM_ASSUMED_WGS84;INSTITUTION_MATCH_FUZZY;AMBIGUOUS_COLLECTION"
-82.961389,8.29,"Inga coruscans",1990273422,"San Bartolo Límite","PAN",NA,1973,"PRESERVED_SPECIMEN","OCCURRENCE_STATUS_INFERRED_FROM_INDIVIDUAL_COUNT;COORDINATE_ROUNDED;GEODETIC_DATUM_ASSUMED_WGS84;CONTINENT_DERIVED_FROM_COORDINATES;CONTINENT_INVALID;INSTITUTION_MATCH_FUZZY;COLLECTION_MATCH_NONE"
-76.574861,3.614666,"Inga coruscans",1416608635,"Predio La Liberia","COL",NA,2015,"HUMAN_OBSERVATION","OCCURRENCE_STATUS_INFERRED_FROM_INDIVIDUAL_COUNT"
-74.799915,6.304242,"Inga coruscans",1848590647,"","COL",NA,2012,"HUMAN_OBSERVATION",""
-83.21667,8.68333,"Inga coruscans",1135448797,"","CRI",500,2000,"PRESERVED_SPECIMEN","CONTINENT_DERIVED_FROM_COORDINATES;INSTITUTION_MATCH_FUZZY;COLLECTION_MATCH_NONE"
-74.385651,4.688816,"Inga coruscans",2013792104,"Laguna Pedro Palo.","COL",350,1983,"PRESERVED_SPECIMEN","COORDINATE_ROUNDED"
-75.037048,7.321941,"Inga coruscans",1844925073,"Corregimiento de Providencia, Valle del rio Anori, entre Dos Bocas y Anori. Zona Transicional entre bosques humedo y muy humedo tropical montañoso.","COL",310,1973,"PRESERVED_SPECIMEN","COORDINATE_ROUNDED"
-74.770556,8,"Inga coruscans",1934703537,"Vereda el 14, Entre mina el 14 y la roca del camino.","COL",NA,2010,"PRESERVED_SPECIMEN","GEODETIC_DATUM_ASSUMED_WGS84"
-75.310879,6.793795,"Inga coruscans",4029357848,"Tenche","COL",NA,2021,"HUMAN_OBSERVATION",""
-82.233333,8.783333,"Inga coruscans",1259568871,"On Chiriquí Trail, east slope of La Zorra to Divide.","PAN",NA,1968,"PRESERVED_SPECIMEN","OCCURRENCE_STATUS_INFERRED_FROM_INDIVIDUAL_COUNT;COORDINATE_ROUNDED;GEODETIC_DATUM_ASSUMED_WGS84;INSTITUTION_MATCH_FUZZY;COLLECTION_MATCH_NONE"
-76.75,-1.4,"Inga coruscans",4031354874,"Río Curaray; dos horas río abajo del pueblo Curaray, en la boca del Río Namoyacu.","ECU",NA,1985,"PRESERVED_SPECIMEN","OCCURRENCE_STATUS_INFERRED_FROM_INDIVIDUAL_COUNT;GEODETIC_DATUM_ASSUMED_WGS84;INSTITUTION_MATCH_FUZZY;COLLECTION_MATCH_NONE"
-75.328056,-10.415278,"Inga coruscans",1258094745,"Distrito Palcazú. Parque Nacional Yanachaga Chemillén - Sector Catarata Rocio.","PER",NA,2013,"PRESERVED_SPECIMEN","OCCURRENCE_STATUS_INFERRED_FROM_INDIVIDUAL_COUNT;COORDINATE_ROUNDED;GEODETIC_DATUM_ASSUMED_WGS84;DIFFERENT_OWNER_INSTITUTION"
-78.866667,0.166667,"Inga coruscans",2268882571,"Bosque Protector Mashpi.","ECU",NA,2014,"PRESERVED_SPECIMEN","OCCURRENCE_STATUS_INFERRED_FROM_INDIVIDUAL_COUNT;COORDINATE_ROUNDED;GEODETIC_DATUM_ASSUMED_WGS84;DIFFERENT_OWNER_INSTITUTION"
-76.455967,-0.600133,"Inga coruscans",4061070314,"Parque Nacional Yasuní. Carretera Pompeya Sur - Iro Km 32,4. En territorio de la comunidad Huaorani de Tiputini. Parcela temporal de muestreo (0.1 ha) Nº 12.","ECU",NA,1997,"PRESERVED_SPECIMEN","OCCURRENCE_STATUS_INFERRED_FROM_INDIVIDUAL_COUNT;COORDINATE_ROUNDED;GEODETIC_DATUM_ASSUMED_WGS84;DIFFERENT_OWNER_INSTITUTION"
-70.68333,-12.45,"Inga coruscans",4061455400,"Blanquillo Forests; Río Madre de Dios. Upland, Scheelea butyracea and floodplain.","PER",NA,1993,"PRESERVED_SPECIMEN","OCCURRENCE_STATUS_INFERRED_FROM_INDIVIDUAL_COUNT;GEODETIC_DATUM_ASSUMED_WGS84;INSTITUTION_MATCH_NONE"
-73.653,4.18384,"Inga coruscans",1314980446,"Reserva Bavaria.","COL",NA,1995,"PRESERVED_SPECIMEN","GEODETIC_DATUM_ASSUMED_WGS84;CONTINENT_DERIVED_FROM_COORDINATES;COORDINATE_PRECISION_INVALID;INSTITUTION_MATCH_FUZZY;COLLECTION_MATCH_FUZZY"
-77.966667,1.133333,"Inga coruscans",1890971865,"La Planada, Finca Salazar,7 Km above Ricaurte.","COL",NA,1981,"PRESERVED_SPECIMEN","GEODETIC_DATUM_ASSUMED_WGS84"
-77.5011,5.586174,"Inga coruscans",2013780771,"Cabo Corrientes, Estacion Biologica El Amargal.","COL",250,1996,"PRESERVED_SPECIMEN",""
-75.416664,8.583333,"Inga coruscans",2013785196,"Corregimiento 12, 212 km NE de Medellín, río Cauca, margen derecha sobre la vía desde El Doce a Barro Blanco, río Purí.","COL",NA,1987,"PRESERVED_SPECIMEN","GEODETIC_DATUM_ASSUMED_WGS84"
-77.78333,8.38333,"Inga coruscans",1259571847,"Vicinity of Campamento Buena Vista, Río Chucunaque above confluence with Río Tuquesa.","PAN",NA,1959,"PRESERVED_SPECIMEN","GEODETIC_DATUM_ASSUMED_WGS84;INSTITUTION_MATCH_FUZZY;COLLECTION_MATCH_NONE"
-64.75,6.58333,"Inga coruscans",1260259855,"N.V.: Asekú yanadu. Proc.: Ye'kwana guamo comestible. Vegetación: Bosque tropical siempreverde Ubicación: Municipio Cedeño Río Caura, Boca de Río Nachare.","VEN",NA,1995,"PRESERVED_SPECIMEN","GEODETIC_DATUM_ASSUMED_WGS84;INSTITUTION_MATCH_FUZZY;COLLECTION_MATCH_NONE"
-68.76666,-13.58333,"Inga coruscans",1261929839,"Alto Madidi ridge top, 7 km NE of camp. Transect 6.","BOL",NA,1990,"PRESERVED_SPECIMEN","OCCURRENCE_STATUS_INFERRED_FROM_INDIVIDUAL_COUNT;GEODETIC_DATUM_ASSUMED_WGS84;INSTITUTION_MATCH_FUZZY;COLLECTION_MATCH_NONE"
-60.183333,-2.416667,"Inga coruscans",1930436478,"Lower slopes of Serra da Lua, Igarapé Camarão.","BRA",NA,1969,"PRESERVED_SPECIMEN","GEODETIC_DATUM_ASSUMED_WGS84;COLLECTION_MATCH_FUZZY"
-68.2325,-14.4986,"Inga coruscans",1563233086,"Franz Tamayo: Parque Nacional Madidi, quebrada Jatun Chiriuno, 31 km en linea recta al este de Apolo por el camino a San Jose de Uchupiamonas.","BOL",NA,2002,"PRESERVED_SPECIMEN","GEODETIC_DATUM_ASSUMED_WGS84"
-79.708555,-0.381534,"Inga coruscans",1978523417,"Pambilar","ECU",30,2012,"HUMAN_OBSERVATION",""
-79.884647,-0.714735,"Inga coruscans",1978523545,"Bajada de Cusuca","ECU",30,2012,"HUMAN_OBSERVATION",""
-80.022712,-0.580447,"Inga coruscans",1978525682,"Hacienda en la antena de claro en Flavio Alfaro","ECU",30,2012,"HUMAN_OBSERVATION",""
-79.764156,-0.924387,"Inga coruscans",1978530435,"Represa Marcel Laniado de Wind. Sendero los Monos","ECU",30,2012,"HUMAN_OBSERVATION",""
-77.289716,-2.316432,"Inga coruscans",1978518798,"Pakintza","ECU",30,2011,"HUMAN_OBSERVATION",""
-79.13823,-2.219294,"Inga coruscans",1978532067,"Propiedad de Isabel Noboa,Rancho Equs.","ECU",30,2012,"HUMAN_OBSERVATION",""
-77.264373,-2.336034,"Inga coruscans",1978520461,"2 km de Pakintza","ECU",30,2011,"HUMAN_OBSERVATION",""
-77.350972,-0.118222,"Inga coruscans",1978526696,"Gonzalo Pizarro","ECU",30,2011,"HUMAN_OBSERVATION",""
-79.183997,0.623703,"Inga coruscans",1978525691,"Sendero Pambilar","ECU",30,2012,"HUMAN_OBSERVATION",""
-82.959505,8.795077,"Inga coruscans",1253751431,"Jardín Botanico Las Cruces","CRI",NA,1998,"PRESERVED_SPECIMEN","COORDINATE_ROUNDED;CONTINENT_DERIVED_FROM_COORDINATES;CONTINENT_INVALID;INSTITUTION_MATCH_FUZZY;COLLECTION_MATCH_NONE"
-69.83333,-13.5,"Inga coruscans",1261911661,"Río Candamo fila at mouth of Río Guacamayo, ridge top forest with cloud forest aspects. Transect 1","PER",NA,1992,"PRESERVED_SPECIMEN","OCCURRENCE_STATUS_INFERRED_FROM_INDIVIDUAL_COUNT;GEODETIC_DATUM_ASSUMED_WGS84;INSTITUTION_MATCH_FUZZY;COLLECTION_MATCH_NONE"
-79.85,9.15,"Inga coruscans",1259569731,"Barro Colorado Island","PAN",NA,1968,"PRESERVED_SPECIMEN","GEODETIC_DATUM_ASSUMED_WGS84;INSTITUTION_MATCH_FUZZY;COLLECTION_MATCH_NONE"
-79.617,-0.9,"Inga coruscans",197132923,"Cerro Mutiles","ECU",NA,1991,"HUMAN_OBSERVATION","GEODETIC_DATUM_ASSUMED_WGS84;CONTINENT_DERIVED_FROM_COORDINATES;ELEVATION_NON_NUMERIC;TAXON_MATCH_FUZZY"
-64.423,5.93,"Inga coruscans",197133027,"Upper Caura. Above Salto Para.","VEN",NA,2000,"HUMAN_OBSERVATION","GEODETIC_DATUM_ASSUMED_WGS84;CONTINENT_DERIVED_FROM_COORDINATES"
-78.208056,-1.3575,"Inga coruscans",1260557118,"Rio Negro. Resinto Azuay, orillas del rio Topo y alrededores , bosque secundario.","ECU",NA,2006,"PRESERVED_SPECIMEN","OCCURRENCE_STATUS_INFERRED_FROM_INDIVIDUAL_COUNT;COORDINATE_ROUNDED;GEODETIC_DATUM_ASSUMED_WGS84;DIFFERENT_OWNER_INSTITUTION"
-75.26633,7.44375,"Inga coruscans",931006908,"Corregimiento El Doce. vereda Barroblanco. quebrada Puri","COL",3711,1987,"PRESERVED_SPECIMEN","INSTITUTION_MATCH_FUZZY;COLLECTION_MATCH_FUZZY"
-75.57825,3.810056,"Inga coruscans",930994451,"Vereda Agua Bonita","COL",896,2008,"PRESERVED_SPECIMEN","COORDINATE_ROUNDED;INSTITUTION_MATCH_FUZZY;COLLECTION_MATCH_FUZZY"
-74.894444,5.55,"Inga coruscans",930988123,"Río La Miel. aguas arriba de la confluencia del río Moro con el río La Miel","COL",859,2001,"PRESERVED_SPECIMEN","COORDINATE_ROUNDED;INSTITUTION_MATCH_FUZZY;COLLECTION_MATCH_FUZZY"
-74.959722,7.2625,"Inga coruscans",930991026,"Vereda Tenche. sector Tenche medio","COL",1158,2002,"PRESERVED_SPECIMEN","COORDINATE_ROUNDED;INSTITUTION_MATCH_FUZZY;COLLECTION_MATCH_FUZZY"
-75.133333,6.033333,"Inga coruscans",931014579,"Vereda La Piñuela. carretera a San Francisco","COL",4607,1992,"PRESERVED_SPECIMEN","COORDINATE_ROUNDED;INSTITUTION_MATCH_FUZZY;COLLECTION_MATCH_FUZZY"
-74.537222,6.390278,"Inga coruscans",930987527,"Hacienda La Unión","COL",5145,2001,"PRESERVED_SPECIMEN","COORDINATE_ROUNDED;INSTITUTION_MATCH_FUZZY;COLLECTION_MATCH_FUZZY"
-75.166667,7.55,"Inga coruscans",931016161,"Vereda Cacerí. carretera Cáceres - Zaragoza. km 43 + 560","COL",7632,1994,"PRESERVED_SPECIMEN","COORDINATE_ROUNDED;INSTITUTION_MATCH_FUZZY;COLLECTION_MATCH_FUZZY"
-76.198525,4.750814,"Inga coruscans",930989297,"Vereda Buenos Aires. finca El Pital","COL",1373,2003,"PRESERVED_SPECIMEN","COORDINATE_ROUNDED;INSTITUTION_MATCH_FUZZY;COLLECTION_MATCH_FUZZY"
