"lon","lat","species","gbifID","locality","countryCode","coordinateUncertaintyInMeters","year","basisOfRecord","issue"
-74.853746,5.939009,"Inga coruscans",930981846,"Río Claro. sendero ecológico","COL",1550,1997,"PRESERVED_SPECIMEN","COORDINATE_ROUNDED;INSTITUTION_MATCH_FUZZY;COLLECTION_MATCH_FUZZY"
-76.18333,-6.6,"Inga coruscans",1258232211,"hills to NW of Chazuta. Remnants of tropical moist forest and second growth.","PER",NA,1986,"PRESERVED_SPECIMEN","OCCURRENCE_STATUS_INFERRED_FROM_INDIVIDUAL_COUNT;GEODETIC_DATUM_ASSUMED_WGS84;INSTITUTION_MATCH_FUZZY;COLLECTION_MATCH_NONE"
-75.003884,5.987299,"Inga coruscans",3395542515,"Santa Rosa","COL",NA,2018,"HUMAN_OBSERVATION",""
-76.180667,3.931611,"Inga coruscans",923968069,"Microcuenca San Pedro o Artrieta","COL",NA,2013,"HUMAN_OBSERVATION","COORDINATE_ROUNDED;GEODETIC_DATUM_ASSUMED_WGS84;CONTINENT_DERIVED_FROM_COORDINATES"
-68.165056,-13.89725,"Inga coruscans",1936655985,"Departamento La Paz, Provincia Abel Iturralde.","BOL",NA,2001,"PRESERVED_SPECIMEN","COORDINATE_ROUNDED;GEODETIC_DATUM_ASSUMED_WGS84;CONTINENT_DERIVED_FROM_COORDINATES;INSTITUTION_MATCH_FUZZY;COLLECTION_MATCH_FUZZY"
-75.202799,5.164199,"Inga coruscans",1576173133,"Vereda Montebonito","COL",2214,1964,"PRESERVED_SPECIMEN","COORDINATE_ROUNDED;INSTITUTION_MATCH_NONE"
-73.42101,-3.96381,"Inga coruscans",3762891779,"Allpahuayo 3; ALP3-cal","PER",NA,2012,"PRESERVED_SPECIMEN","GEODETIC_DATUM_ASSUMED_WGS84;CONTINENT_DERIVED_FROM_COORDINATES;INSTITUTION_MATCH_FUZZY;INSTITUTION_COLLECTION_MISMATCH"
-69.66666,-13.35,"Inga coruscans",1261516953,"Río Távara base camp, moist lowland forest on ridge. Transect 9","PER",NA,1992,"PRESERVED_SPECIMEN","OCCURRENCE_STATUS_INFERRED_FROM_INDIVIDUAL_COUNT;GEODETIC_DATUM_ASSUMED_WGS84;INSTITUTION_MATCH_FUZZY;COLLECTION_MATCH_NONE"
-77.333333,6.333333,"Inga coruscans",1261894801,"Parque Nacional de Utría: Colecciones realizadas en la playa ubicada al surñ este de la Ensenada de Utría y alredeø dor de la casa del Señor Montes.","COL",NA,1990,"PRESERVED_SPECIMEN","OCCURRENCE_STATUS_INFERRED_FROM_INDIVIDUAL_COUNT;COORDINATE_ROUNDED;GEODETIC_DATUM_ASSUMED_WGS84;ELEVATION_NON_NUMERIC;INSTITUTION_MATCH_FUZZY;COLLECTION_MATCH_NONE"
-76.674469,3.738269,"Inga coruscans",1061294179,"Atuncela","COL",90,2003,"PRESERVED_SPECIMEN","INSTITUTION_MATCH_FUZZY;COLLECTION_MATCH_FUZZY"
-74.8341,5.3205,"Inga coruscans",1061293715,"","COL",90,1993,"PRESERVED_SPECIMEN","INSTITUTION_MATCH_FUZZY;COLLECTION_MATCH_FUZZY"
-73.73054,7.348472,"Inga coruscans",3419408412,"Comuneros","COL",5,2021,"HUMAN_OBSERVATION","COORDINATE_ROUNDED"
-70.18,-2.58,"Inga coruscans",3923750155,"Tarapacá","COL",NA,1984,"HUMAN_OBSERVATION",""
-76.76,0.87,"Inga coruscans",3923784535,"Villagarzón","COL",NA,1984,"HUMAN_OBSERVATION",""
-77.47615,5.59564,"Inga coruscans",3390901250,"Corregimiento de Arusí, Estación Biológica El Amargal","COL",2050.87,1992,"PRESERVED_SPECIMEN","INSTITUTION_MATCH_FUZZY;COLLECTION_MATCH_FUZZY"
-77.31681,6.04135,"Inga coruscans",3390902376,"Parque Nacional Natural Ensenada de Utría, Colecciones realizadas en la playa ubicada al sur - este de la Ensenada de Utría y alrededor de la casa del señor Montes","COL",8003.52,1990,"PRESERVED_SPECIMEN","INSTITUTION_MATCH_FUZZY;COLLECTION_MATCH_FUZZY"
-73.547363,6.94601,"Inga coruscans",3821090465,"Parcelas de fustales en Bosque Denso Alto de Tierra Firme en el municipio de San Vicente de Chucurí en la unidad territorial La Tempestuosa","COL",NA,2019,"HUMAN_OBSERVATION",""
-73.741069,6.976243,"Inga coruscans",3821093653,"Parcelas de fustales en Bosque fragmentado en el municipio de Barrancabermeja en la unidad territorial La María","COL",NA,2019,"HUMAN_OBSERVATION",""
-73.5618,7.024528,"Inga coruscans",3821096472,"Parcelas de fustales en Bosque Denso Bajo de Tierra Firme en el municipio de San Vicente de Chucurí en la unidad territorial Vizcaína","COL",NA,2019,"HUMAN_OBSERVATION",""
-79.21,-0.2,"Inga coruscans",4064252359,"Recinto Union Cariamanga","ECU",NA,2019,"PRESERVED_SPECIMEN","GEODETIC_DATUM_ASSUMED_WGS84;GEODETIC_DATUM_INVALID;DIFFERENT_OWNER_INSTITUTION"
-82.983333,8.35,"Inga coruscans",1259572475,"West of San Bartolo Limité near Costa Rican border. Primary forest (freshly cut)","PAN",NA,1973,"PRESERVED_SPECIMEN","OCCURRENCE_STATUS_INFERRED_FROM_INDIVIDUAL_COUNT;COORDINATE_ROUNDED;GEODETIC_DATUM_ASSUMED_WGS84;INSTITUTION_MATCH_FUZZY;COLLECTION_MATCH_NONE"
-79.61666,0.9,"Inga coruscans",1258221754,"Reserva Forestal de Jardin Tropical, Universidad Tecnica Luis Vargas Torres. TRANSECT # 6","ECU",NA,1991,"PRESERVED_SPECIMEN","OCCURRENCE_STATUS_INFERRED_FROM_INDIVIDUAL_COUNT;GEODETIC_DATUM_ASSUMED_WGS84;INSTITUTION_MATCH_FUZZY;COLLECTION_MATCH_NONE"
-77.033333,3.916667,"Inga coruscans",1261869592,"BAJO CALIMA: road to Juanchaco Palmeras. Mature pluvial forest. Transect # 6","COL",NA,1984,"PRESERVED_SPECIMEN","OCCURRENCE_STATUS_INFERRED_FROM_INDIVIDUAL_COUNT;COORDINATE_ROUNDED;GEODETIC_DATUM_ASSUMED_WGS84;INSTITUTION_MATCH_FUZZY;COLLECTION_MATCH_NONE"
-72.83333,-4.16666,"Inga coruscans",1258610330,"Quebrada Tamshiyacu, E of Tamshiyacu below Serafin Filomene, upper limits of regularly inundated forest and non-inundated riverside forest.","PER",NA,1979,"PRESERVED_SPECIMEN","GEODETIC_DATUM_ASSUMED_WGS84;INSTITUTION_MATCH_FUZZY;COLLECTION_MATCH_NONE"
-78.76,9.10583,"Inga coruscans",1259572902,"Along trail between Río Majé and Quebrada Brava beginning at Finca of Choco Indian Eduardo Maycha, ca. 2 miles upstream from waterfalls near edge of Bayano Lake","PAN",NA,1976,"PRESERVED_SPECIMEN","GEODETIC_DATUM_ASSUMED_WGS84;INSTITUTION_MATCH_FUZZY;COLLECTION_MATCH_NONE"
