"lon","lat","species","gbifID","locality","countryCode","coordinateUncertaintyInMeters","year","basisOfRecord","issue"
-54.433333,-0.916667,"Inga velutina",2998180179,"Lageira, airstrip on Rio Maicuru.","BRA",NA,1981,"PRESERVED_SPECIMEN","COORDINATE_ROUNDED;GEODETIC_DATUM_ASSUMED_WGS84;CONTINENT_DERIVED_FROM_COORDINATES;INSTITUTION_MATCH_FUZZY;COLLECTION_MATCH_FUZZY"
-72.833333,-2.466667,"Inga velutina",1258266916,"Indiana, Reserva Explorama. Quebrada de Yanamono (Río Amazonas). Bosque primario.","PER",NA,1990,"PRESERVED_SPECIMEN","OCCURRENCE_STATUS_INFERRED_FROM_INDIVIDUAL_COUNT;COORDINATE_ROUNDED;GEODETIC_DATUM_ASSUMED_WGS84;INSTITUTION_MATCH_FUZZY;COLLECTION_MATCH_NONE"
-78.09722,-2.27833,"Inga velutina",4031434779,"Santiago Zamora, Macas-Puyo km 6. Roadside, cultivated land.","ECU",NA,1993,"PRESERVED_SPECIMEN","GEODETIC_DATUM_ASSUMED_WGS84;INSTITUTION_MATCH_FUZZY;COLLECTION_MATCH_NONE"
-69.8739,-8.1778,"Inga velutina",1928569601,"Rio jurupari, igarapé macipira","BRA",NA,2010,"PRESERVED_SPECIMEN","GEODETIC_DATUM_ASSUMED_WGS84;COLLECTION_MATCH_FUZZY"
-75.4,-10.5667,"Inga velutina",1228210123,"Oxapampa","PER",NA,1997,"PRESERVED_SPECIMEN","GEODETIC_DATUM_ASSUMED_WGS84;INSTITUTION_MATCH_FUZZY;AMBIGUOUS_COLLECTION"
-55.769672,-12.434642,"Inga velutina",1913596334,"FazendaSilva. Represa.","BRA",NA,2008,"PRESERVED_SPECIMEN","GEODETIC_DATUM_ASSUMED_WGS84;CONTINENT_DERIVED_FROM_COORDINATES;AMBIGUOUS_INSTITUTION"
-58.258722,-9.81975,"Inga velutina",1077302703,"Fazenda São Nicolau. Módulo IV, PPBio.","BRA",NA,2011,"PRESERVED_SPECIMEN","GEODETIC_DATUM_ASSUMED_WGS84;CONTINENT_DERIVED_FROM_COORDINATES;AMBIGUOUS_INSTITUTION"
-59.95,-2.366667,"Inga velutina",1042563508,"Distrito Agropecuário, ZF3, Distrito Agropecuário da Suframa, rodovia BR-174, km 64 depois 7 km Leste na ZF3, Fazenda Porto Alegre.","BRA",NA,1984,"PRESERVED_SPECIMEN","GEODETIC_DATUM_ASSUMED_WGS84;GEODETIC_DATUM_INVALID;INSTITUTION_MATCH_NONE"
-51.52,-0.066667,"Inga velutina",1042585877,"Estrada Macapá/Jari.","BRA",NA,2001,"PRESERVED_SPECIMEN","GEODETIC_DATUM_ASSUMED_WGS84;GEODETIC_DATUM_INVALID;INSTITUTION_MATCH_NONE"
-62.25,-4.372,"Inga velutina",1042682545,"Divisa de municipio Beruri;RDS Piagaçu-Purus; baixo rio Purus; Floresta de várzea; margem Paranã Ferreira. Lago Ferreira. Paranã Cauá-Cuiuanã.","BRA",NA,2009,"PRESERVED_SPECIMEN","GEODETIC_DATUM_ASSUMED_WGS84;GEODETIC_DATUM_INVALID;INSTITUTION_MATCH_NONE"
-64,-0.466667,"Inga velutina",1042631840,"","BRA",NA,1999,"PRESERVED_SPECIMEN","GEODETIC_DATUM_ASSUMED_WGS84;GEODETIC_DATUM_INVALID;INSTITUTION_MATCH_NONE"
-55.63,-11.716667,"Inga velutina",1042664271,"19 km W of BR163 on MT225 to Porto dos Gaúchos., 19 km W of BR-163 on road to Porto dos Gaúchos (MT 220).","BRA",NA,1985,"PRESERVED_SPECIMEN","GEODETIC_DATUM_ASSUMED_WGS84;GEODETIC_DATUM_INVALID;INSTITUTION_MATCH_NONE"
-55.916389,-9.642222,"Inga velutina",1090662058,"Parque Estadual Cristalino, Mata inundável com dossel semi aberto, altura média de 10m. Presença de murundas. Poucas plântulas. Serrapilheira abundante.","BRA",NA,2008,"PRESERVED_SPECIMEN","GEODETIC_DATUM_ASSUMED_WGS84;CONTINENT_DERIVED_FROM_COORDINATES;INSTITUTION_MATCH_NONE"
-57.038333,-9.192222,"Inga velutina",1889176962,"UHE São Manoel - pedreira","BRA",NA,2016,"PRESERVED_SPECIMEN","GEODETIC_DATUM_ASSUMED_WGS84;CONTINENT_DERIVED_FROM_COORDINATES;INSTITUTION_MATCH_NONE"
-64.879166,-9.544167,"Inga velutina",1095255903,"Margem esquerda do rio Madeira.","BRA",NA,2011,"PRESERVED_SPECIMEN","OCCURRENCE_STATUS_INFERRED_FROM_INDIVIDUAL_COUNT;COORDINATE_ROUNDED;GEODETIC_DATUM_ASSUMED_WGS84;CONTINENT_DERIVED_FROM_COORDINATES;INSTITUTION_MATCH_NONE"
-77.6,-1.06666,"Inga velutina",4031517596,"Jatun Sacha Biological Station. Napo River, 8 km east of Misahuall. Tropical Wet Forest. Primary forest. Alluvial soil, on river terrace. Marked trees in Permanent Plot No. 5.","ECU",NA,1994,"PRESERVED_SPECIMEN","GEODETIC_DATUM_ASSUMED_WGS84;INSTITUTION_MATCH_FUZZY;COLLECTION_MATCH_NONE"
-76.46666,-0.61666,"Inga velutina",4031473006,"Yasuni National Park. Maxus/YPF pipeline road, km 34. Terra firme forest on highest ridgeline between the Tiputini and Capiron rivers, W of road.","ECU",NA,1998,"PRESERVED_SPECIMEN","GEODETIC_DATUM_ASSUMED_WGS84;INSTITUTION_MATCH_FUZZY;COLLECTION_MATCH_NONE"
-73.5,-4.16666,"Inga velutina",1258273725,"Dtto. Iquitos, Allpahuayo. Estación Experimental del Instituto de Investigaciones de la Amazonía Peruana (IIAP). Bosque primario, vegetación sobre suelo arcillo-arenoso, con dominancia de arena blanca, en las elevaciones del terreno y de arcilla en los declives, estrato inferior sin dominancia observándose Lepidocaryum tessmannii y Scheelea morenii; buen drenaje, pequeñas ondulaciones del terreno. Levantamiento florístico de la parcela Y de 1 ha. de 500 X 20 m., correspondiente al inventario de 25 has. SUBPARCELA No. 20","PER",NA,1990,"PRESERVED_SPECIMEN","OCCURRENCE_STATUS_INFERRED_FROM_INDIVIDUAL_COUNT;GEODETIC_DATUM_ASSUMED_WGS84;INSTITUTION_MATCH_FUZZY;COLLECTION_MATCH_NONE"
-72.83333,-4.16666,"Inga velutina",1258610192,"Quebrada Tamshiyacu, E of Tamshiyacu below Serafin Filomene, upper limits of regularly inundated forest and non-inundated riverside forest.","PER",NA,1979,"PRESERVED_SPECIMEN","OCCURRENCE_STATUS_INFERRED_FROM_INDIVIDUAL_COUNT;GEODETIC_DATUM_ASSUMED_WGS84;INSTITUTION_MATCH_FUZZY;COLLECTION_MATCH_NONE"
-67.666667,-16.033333,"Inga velutina",2517368058,"Dpto. La Paz; Prov. Nor Yungas. 30.3 km N of (below) Yolosa on road to Caranavi.","BOL",NA,1984,"PRESERVED_SPECIMEN","INSTITUTION_MATCH_FUZZY;INSTITUTION_COLLECTION_MISMATCH"
-69.4264,-1.3994,"Inga velutina",1928669185,"Vila Bittencourt, rio Japurá, margem direita","BRA",NA,1982,"PRESERVED_SPECIMEN","COLLECTION_MATCH_FUZZY"
-52.483535,-0.88681,"Inga velutina",1930804515,"Rio Jarí; entre Monte Dourado e Munguba.","BRA",NA,1968,"PRESERVED_SPECIMEN","COORDINATE_ROUNDED;COLLECTION_MATCH_FUZZY"
-72.91666,-3.25,"Inga velutina",1258274628,"Quebrada Sucursari, Río Napo across from Mazan. Seasonally inundated, tahuampa forest.","PER",NA,1983,"PRESERVED_SPECIMEN","OCCURRENCE_STATUS_INFERRED_FROM_INDIVIDUAL_COUNT;GEODETIC_DATUM_ASSUMED_WGS84;INSTITUTION_MATCH_FUZZY;COLLECTION_MATCH_NONE"
-76.7,-0.03333,"Inga velutina",1258254252,"Cantón Lago Agrio, Dureno. Comunidad indígena Cofán. Bosque Húmedo Tropical. Cofán 'Acho fino' Esp. Guaba.","ECU",NA,1986,"PRESERVED_SPECIMEN","GEODETIC_DATUM_ASSUMED_WGS84;INSTITUTION_MATCH_FUZZY;COLLECTION_MATCH_NONE"
-77.45,-1.45,"Inga velutina",4031859747,"Río Lliquino, 1 km al norte del Pozo Villano 2 de ARCO. Bosque primario en terraza aluvial. Bosque húmedo tropical. Parcela temporal de 0.25 ha.","ECU",NA,1997,"PRESERVED_SPECIMEN","GEODETIC_DATUM_ASSUMED_WGS84;INSTITUTION_MATCH_FUZZY;COLLECTION_MATCH_NONE"
-67.066667,-15.283333,"Inga velutina",4031353753,"Carretera Carinavi-San Borja, cumbre de la Serrania del Pilón Lajas. Bosque primario subandino; suelos de arenisca. Especimenes preservados en alcohol.","BOL",NA,1989,"PRESERVED_SPECIMEN","OCCURRENCE_STATUS_INFERRED_FROM_INDIVIDUAL_COUNT;COORDINATE_ROUNDED;GEODETIC_DATUM_ASSUMED_WGS84;ELEVATION_MIN_MAX_SWAPPED;INSTITUTION_MATCH_FUZZY;COLLECTION_MATCH_NONE"
-68.0108,-9.641374,"Inga velutina",1930600344,"Riozinho do Andirá. Varzea do Lago Branco.","BRA",NA,1994,"PRESERVED_SPECIMEN","COORDINATE_ROUNDED;COLLECTION_MATCH_FUZZY"
-49.673567,-3.764569,"Inga velutina",1929716947,"PA-149, área de desmatamento, ramal da massa fálida.","BRA",NA,1983,"PRESERVED_SPECIMEN","COORDINATE_ROUNDED;COLLECTION_MATCH_FUZZY"
-72.626122,5.227975,"Inga velutina",3498330466,"Vereda Cupiagua, predio Lote Rural","COL",NA,2021,"HUMAN_OBSERVATION","COORDINATE_ROUNDED"
-76.18333,0.01666,"Inga velutina",1258295790,"Reserva Faunistica Cuyabeno. Río Cuyabeno from outlet of Laguna Grande and 5 km upstream. Tropical rain forest along mixed black- and white-water river.","ECU",NA,1989,"PRESERVED_SPECIMEN","GEODETIC_DATUM_ASSUMED_WGS84;DIFFERENT_OWNER_INSTITUTION"
-67.6,-15.033333,"Inga velutina",1259107960,"Alto Beni. Concesión de la Cooperativa San Luis, cerca de Mayaya. Monte alto","BOL",NA,1996,"PRESERVED_SPECIMEN","OCCURRENCE_STATUS_INFERRED_FROM_INDIVIDUAL_COUNT;COORDINATE_ROUNDED;GEODETIC_DATUM_ASSUMED_WGS84;DIFFERENT_OWNER_INSTITUTION"
-76.466667,-0.75,"Inga velutina",4061750978,"Parque Nacional Yasuní. Carretera y oleoducto de Maxus, en construcción, Km 45. Bosque húmedo Tropical. Bosque primario sobre colinas, suelo rojo.","ECU",NA,1993,"PRESERVED_SPECIMEN","OCCURRENCE_STATUS_INFERRED_FROM_INDIVIDUAL_COUNT;COORDINATE_ROUNDED;GEODETIC_DATUM_ASSUMED_WGS84;DIFFERENT_OWNER_INSTITUTION"
-75.392222,-10.151944,"Inga velutina",4061881579,"Dist. Palcazú. Comunidad nativa Alto Lagarto - Reserva Comunal Yanesha.","PER",NA,2009,"PRESERVED_SPECIMEN","OCCURRENCE_STATUS_INFERRED_FROM_INDIVIDUAL_COUNT;COORDINATE_ROUNDED;GEODETIC_DATUM_ASSUMED_WGS84;DIFFERENT_OWNER_INSTITUTION"
-78.22805,-3.04861,"Inga velutina",1260182494,"Cordillera del Cóndor region. Centro Shuar Kuankus. Tropical pre-montane wet forest. Tall, undisturbed forest on slope; clay soil derived from limestone/shale. Permanent one-hectare forest inventory plot: Parcela Kuankus. Trees > 10 cm DBH tagged and measured.","ECU",NA,2005,"PRESERVED_SPECIMEN","OCCURRENCE_STATUS_INFERRED_FROM_INDIVIDUAL_COUNT;GEODETIC_DATUM_ASSUMED_WGS84;INSTITUTION_MATCH_NONE"
-77.51666,-1.46666,"Inga velutina",1258569413,"Cantón Arajuno, Parroquia Villano. Línea propuesta por ARCO para el oleoducto. Campamentos 4 a 5, km 10 de Villano. Bosque Primario.","ECU",NA,1998,"PRESERVED_SPECIMEN","GEODETIC_DATUM_ASSUMED_WGS84;INSTITUTION_MATCH_NONE"
-78.04,-2.36138,"Inga velutina",1259086267,"Cordillera de Cutucú. Centro Shuar Angel Roubi. Pie de la Cordillera. Bosque húmedo.","ECU",NA,2002,"PRESERVED_SPECIMEN","GEODETIC_DATUM_ASSUMED_WGS84;INSTITUTION_MATCH_NONE"
-74.038611,-11.37,"Inga velutina",1258114008,"Distrito Río Tambo. Comunidad Nativa Pichiquia. Parque Nacional Otishi.","PER",NA,2013,"PRESERVED_SPECIMEN","OCCURRENCE_STATUS_INFERRED_FROM_INDIVIDUAL_COUNT;COORDINATE_ROUNDED;GEODETIC_DATUM_ASSUMED_WGS84;DIFFERENT_OWNER_INSTITUTION"
-77.533333,-0.65,"Inga velutina",4061846437,"Parque Nacional Napo-Galeras. Cordillera de Galeras. Sendero hacia el Río Pucuno. Bosque primario. Bosque pluvial Pre-Montano.","ECU",NA,1997,"PRESERVED_SPECIMEN","OCCURRENCE_STATUS_INFERRED_FROM_INDIVIDUAL_COUNT;COORDINATE_ROUNDED;GEODETIC_DATUM_ASSUMED_WGS84;DIFFERENT_OWNER_INSTITUTION"
-76.16666,-0.03333,"Inga velutina",1258295696,"Cuyabeno Nature Reserve. Río Cuyabeno and Laguna Cuñangueno. Collections made from canoe going up to the along Río Cuyabeno.","ECU",NA,1982,"PRESERVED_SPECIMEN","GEODETIC_DATUM_ASSUMED_WGS84;DIFFERENT_OWNER_INSTITUTION"
-77.45333,-0.63666,"Inga velutina",1258270444,"Loreto. Faldas del volcán Sumaco. Al oeste de Avila viejo. Bloque 19, línea sísmica 8. Compañía Triton. Bosque húmedo Tropical. Bosque primario. Suelo en roca sedimentaria.","ECU",NA,1996,"PRESERVED_SPECIMEN","GEODETIC_DATUM_ASSUMED_WGS84;INSTITUTION_MATCH_NONE"
-78.78555,0.31972,"Inga velutina",1260312563,"Parroquia García Moreno. Reserva Biológica Los Cedros. Sendero El Oso. Bosque muy húmedo montano bajo. Bosque primario.","ECU",NA,2005,"PRESERVED_SPECIMEN","OCCURRENCE_STATUS_INFERRED_FROM_INDIVIDUAL_COUNT;GEODETIC_DATUM_ASSUMED_WGS84;INSTITUTION_MATCH_NONE"
-76.166,0.033,"Inga velutina",185099530,"Cuyabeno Nature Reserve. Río Cuyabeno and Laguna Cuñangueno. Collections made from canoe going up to the along Río Cuyabeno.","ECU",NA,1982,"PRESERVED_SPECIMEN","GEODETIC_DATUM_ASSUMED_WGS84;COORDINATE_PRECISION_INVALID;INSTITUTION_MATCH_FUZZY;INSTITUTION_COLLECTION_MISMATCH"
-71.16666,-11.75,"Inga velutina",1261898524,"Manu Park, Cocha cashu uplands. Calpa guacamayas vicinity.","PER",NA,1986,"PRESERVED_SPECIMEN","OCCURRENCE_STATUS_INFERRED_FROM_INDIVIDUAL_COUNT;GEODETIC_DATUM_ASSUMED_WGS84;INSTITUTION_MATCH_FUZZY;COLLECTION_MATCH_NONE"
-78.7,-4.26666,"Inga velutina",1258220559,"Miazi. Márgen derecha Río Nangaritza. Bosque primario. Rocas calizas afloran. Dosel del bosque 30 m. Suelos entisoles.","ECU",NA,1991,"PRESERVED_SPECIMEN","OCCURRENCE_STATUS_INFERRED_FROM_INDIVIDUAL_COUNT;GEODETIC_DATUM_ASSUMED_WGS84;INSTITUTION_MATCH_FUZZY;COLLECTION_MATCH_NONE"
-71.6,-11.68333,"Inga velutina",1260273884,"Parque Nacional Manu. Rio Manu: Tayakome. MOstly disturbed forest on high terrace.","PER",NA,1986,"PRESERVED_SPECIMEN","GEODETIC_DATUM_ASSUMED_WGS84;INSTITUTION_MATCH_FUZZY;COLLECTION_MATCH_NONE"
-71.164139,2.20525,"Inga velutina",1707511477,"Inspec. del Tomachipán. Río Inírida, Caño Cocui, Cerro Cocui, 1.5 km al E de Santa Marta (Cocui).","COL",NA,1996,"PRESERVED_SPECIMEN","COORDINATE_ROUNDED;GEODETIC_DATUM_ASSUMED_WGS84;INSTITUTION_MATCH_NONE"
-76.316667,6.516667,"Inga velutina",1707551061,"Sector de Calles, camino de la Encarnación al Parque de las Orquídeas","COL",NA,1991,"PRESERVED_SPECIMEN","COORDINATE_ROUNDED;GEODETIC_DATUM_ASSUMED_WGS84;INSTITUTION_MATCH_NONE"
-75,7.833333,"Inga velutina",2013776543,"Antioquia. Caucasia. Vía Caucasia-El Bagre. Km 9-16. Alt. 60-90 m.","COL",NA,1987,"PRESERVED_SPECIMEN","COORDINATE_ROUNDED"
-74.849444,5.935833,"Inga velutina",1891006577,"Antioquia. San Luís. Canón del Río Claro. Sector central. Margen derecha. Alt. 325 m.","COL",870,1983,"PRESERVED_SPECIMEN","COORDINATE_ROUNDED"
-48.953333,-2.947222,"Inga velutina",2447820175,"Fazenda Beira Rio","BRA",NA,2011,"PRESERVED_SPECIMEN","GEODETIC_DATUM_ASSUMED_WGS84;CONTINENT_DERIVED_FROM_COORDINATES;INSTITUTION_MATCH_NONE"
-76.58,-0.43,"Inga velutina",1563285362,"Orellanca Canton. Yasun National Park. Maxus petroleum pipeline road, under construction. At beginning of road, near Pompeya village.","ECU",NA,1994,"PRESERVED_SPECIMEN","GEODETIC_DATUM_ASSUMED_WGS84"
-78.66666,-4.35,"Inga velutina",4031354751,"Hill about 1 km upstream from Shaime, along Rio Nangaritza, partly disturbed forest on clay soil.","ECU",NA,1994,"PRESERVED_SPECIMEN","OCCURRENCE_STATUS_INFERRED_FROM_INDIVIDUAL_COUNT;GEODETIC_DATUM_ASSUMED_WGS84;INSTITUTION_MATCH_FUZZY;COLLECTION_MATCH_NONE"
-71.805986,-0.892499,"Inga velutina",1258474115,"Margen derecha del Rio Caqueta (sur). 3 Km. arriba del Q. del Quinche. Bosque mal drenado. Llanura aluvial.","COL",NA,1990,"PRESERVED_SPECIMEN","GEODETIC_DATUM_ASSUMED_WGS84;INSTITUTION_MATCH_FUZZY;COLLECTION_MATCH_NONE"
-77.890333,-1.276333,"Inga velutina",2517144079,"Pastaza, Tena-Puyo km 444.","ECU",NA,1993,"PRESERVED_SPECIMEN","INSTITUTION_MATCH_FUZZY;INSTITUTION_COLLECTION_MISMATCH"
-76.9603,7.65333,"Inga velutina",1314980653,"Antioquia. Turbo. Corregimiento Lomas Aisladas. Alt. 50 m.","COL",NA,1985,"PRESERVED_SPECIMEN","GEODETIC_DATUM_ASSUMED_WGS84;CONTINENT_DERIVED_FROM_COORDINATES;COORDINATE_PRECISION_INVALID;INSTITUTION_MATCH_FUZZY;COLLECTION_MATCH_FUZZY"
-72.597041,7.431339,"Inga velutina",1934702600,"Vereda El Páramo.","COL",NA,2011,"PRESERVED_SPECIMEN","GEODETIC_DATUM_ASSUMED_WGS84"
-75.3,-10.73333,"Inga velutina",1261545304,"Villa Rica-Yesú road. Second growth.","PER",NA,1983,"PRESERVED_SPECIMEN","OCCURRENCE_STATUS_INFERRED_FROM_INDIVIDUAL_COUNT;GEODETIC_DATUM_ASSUMED_WGS84;INSTITUTION_MATCH_FUZZY;COLLECTION_MATCH_NONE"
-70.68333,-12.45,"Inga velutina",4060896380,"Blanquillo Forests; Río Madre de Dios. Upland, Scheelea butyracea and floodplain.","PER",NA,1993,"PRESERVED_SPECIMEN","OCCURRENCE_STATUS_INFERRED_FROM_INDIVIDUAL_COUNT;GEODETIC_DATUM_ASSUMED_WGS84;INSTITUTION_MATCH_NONE"
-48.201111,-1.362222,"Inga velutina",2302480490,"Alça viária","BRA",NA,2013,"PRESERVED_SPECIMEN","RECORDED_DATE_INVALID;COORDINATE_ROUNDED;GEODETIC_DATUM_ASSUMED_WGS84;CONTINENT_DERIVED_FROM_COORDINATES;INSTITUTION_MATCH_FUZZY;COLLECTION_MATCH_FUZZY"
-64.524444,-9.323889,"Inga velutina",2302453093,"Margem esquerda do rio Madeira. Floresta Ombrófila Densa, relevo Inclinado; Substrato: Solo argiloso. Área de influência direta da UHE Jirau.","BRA",NA,2011,"PRESERVED_SPECIMEN","COORDINATE_ROUNDED;GEODETIC_DATUM_ASSUMED_WGS84;CONTINENT_DERIVED_FROM_COORDINATES;INSTITUTION_MATCH_FUZZY;COLLECTION_MATCH_FUZZY"
-80.140685,-3.984272,"Inga velutina",1978517795,"Limo","ECU",30,2012,"HUMAN_OBSERVATION",""
-77.341731,-2.595786,"Inga velutina",1978529120,"Rio Shinkiatam","ECU",30,2011,"HUMAN_OBSERVATION",""
-74.067167,10.989306,"Inga velutina",4026671733,"Corregimiento Siberia, Vereda El Congo, cañada de la quebrada El Congo","COL",NA,2015,"PRESERVED_SPECIMEN","COORDINATE_ROUNDED;INSTITUTION_MATCH_NONE"
-78.316667,-4.916667,"Inga velutina",1261917342,"Distrito Imaza: Región del Marañon. Comunidad de Yamayakat, Quebrada Kusu - Chapi, Río Marañon.","PER",NA,1995,"PRESERVED_SPECIMEN","OCCURRENCE_STATUS_INFERRED_FROM_INDIVIDUAL_COUNT;COORDINATE_ROUNDED;GEODETIC_DATUM_ASSUMED_WGS84;INSTITUTION_MATCH_FUZZY;COLLECTION_MATCH_NONE"
-75.084926,6.009836,"Inga velutina",3395546624,"La Veta","COL",NA,2018,"HUMAN_OBSERVATION",""
-55.989722,-1.475833,"Inga velutina",2565882846,"Porto Trombetas. Rio Erepecuru.","BRA",NA,2002,"PRESERVED_SPECIMEN","COORDINATE_ROUNDED;GEODETIC_DATUM_ASSUMED_WGS84;CONTINENT_DERIVED_FROM_COORDINATES;INSTITUTION_MATCH_FUZZY;COLLECTION_MATCH_FUZZY"
-69.06666,-12.58333,"Inga velutina",1258301608,"Cusco Amazónico, trail to Lago Sandoø val across Río Madre de Dios, ca. 12 km E of Puerto Maldonado.","PER",NA,1990,"PRESERVED_SPECIMEN","OCCURRENCE_STATUS_INFERRED_FROM_INDIVIDUAL_COUNT;GEODETIC_DATUM_ASSUMED_WGS84;INSTITUTION_MATCH_FUZZY;COLLECTION_MATCH_NONE"
-76.602833,-0.031667,"Inga velutina",2517405043,"Sucumbios (formerly Napo), Lago Agrio-Tarapoa.","ECU",NA,1993,"PRESERVED_SPECIMEN","INSTITUTION_MATCH_FUZZY;INSTITUTION_COLLECTION_MISMATCH"
-73.71256,7.321228,"Inga velutina",3419405184,"Tapazon","COL",5,2021,"HUMAN_OBSERVATION",""
-77.25397,5.69036,"Inga velutina",3390901467,"Camino que conduce al estero del Sena","COL",370.6,2008,"PRESERVED_SPECIMEN","INSTITUTION_MATCH_FUZZY;COLLECTION_MATCH_FUZZY"
-78.66666,-4.3,"Inga velutina",1261854327,"Río Nangaritza, upper valley. 3 km east of Miazi, near disputed Peru-Ecuador border. Primary forest. Premontane Wet Forest.","ECU",NA,1990,"PRESERVED_SPECIMEN","OCCURRENCE_STATUS_INFERRED_FROM_INDIVIDUAL_COUNT;GEODETIC_DATUM_ASSUMED_WGS84;INSTITUTION_MATCH_FUZZY;COLLECTION_MATCH_NONE"
-54.43333,0.91666,"Inga velutina",1260274068,"Macau airstrip, 1 1/2 hrs. upstream from Lageira airstrip, on Rio Maicuru. Secondary vegetation, at Macau.","BRA",NA,1981,"PRESERVED_SPECIMEN","GEODETIC_DATUM_ASSUMED_WGS84;INSTITUTION_MATCH_FUZZY;COLLECTION_MATCH_NONE"
-69.183333,-12.633333,"Inga velutina",1258274545,"Ca. 5 km from Puerto Maldonado near Río Tambopata.","PER",NA,1976,"PRESERVED_SPECIMEN","OCCURRENCE_STATUS_INFERRED_FROM_INDIVIDUAL_COUNT;COORDINATE_ROUNDED;GEODETIC_DATUM_ASSUMED_WGS84;INSTITUTION_MATCH_FUZZY;COLLECTION_MATCH_NONE"
-41.2,-12.85,"Inga velutina",2517430953,"Brazil: Estado da Bahia, Serra do SincorÁ, 15-20 km from Ardaraí, along the road to Itaeté which branches East off the road to Mucugé.","BRA",NA,1977,"PRESERVED_SPECIMEN","INSTITUTION_MATCH_FUZZY;INSTITUTION_COLLECTION_MISMATCH"
