"lon","lat","species","gbifID","locality","countryCode","coordinateUncertaintyInMeters","year","basisOfRecord","issue"
-66.25,-11.033333,"Inga stipulacea",1261546932,"Along Río Madre de Dios at Puerto Candelaria, 21 km (by air) WSW of Riberalta. Flat, non-inundated evergreen forest dominated by scattered emergent Bertholletia excelsa.","BOL",NA,1985,"PRESERVED_SPECIMEN","OCCURRENCE_STATUS_INFERRED_FROM_INDIVIDUAL_COUNT;COORDINATE_ROUNDED;GEODETIC_DATUM_ASSUMED_WGS84;DIFFERENT_OWNER_INSTITUTION"
-62.983333,-10,"Inga stipulacea",2998219431,"9.5 km. SE of Ariquemes on hwy. BR 364, then 3.6km. E on Linea 55.","BRA",NA,1987,"PRESERVED_SPECIMEN","COORDINATE_ROUNDED;GEODETIC_DATUM_ASSUMED_WGS84;CONTINENT_DERIVED_FROM_COORDINATES;INSTITUTION_MATCH_FUZZY;COLLECTION_MATCH_FUZZY"
-55.666667,-5.916667,"Inga stipulacea",2998497755,"Estrada Santarém-Cuiabá, BR 163, Km1222.","BRA",NA,1983,"PRESERVED_SPECIMEN","COORDINATE_ROUNDED;GEODETIC_DATUM_ASSUMED_WGS84;CONTINENT_DERIVED_FROM_COORDINATES;INSTITUTION_MATCH_FUZZY;COLLECTION_MATCH_FUZZY"
-76.36666,-0.13333,"Inga stipulacea",1261542862,"Parroquia Tarapoa. 1 km del Pozo Petrolero Mariann 3 hacia la Reserva Faunística de Cuyabeno. Bosque húmedo Tropical. Bosque primario, suelo inundado. Transectos.","ECU",NA,1990,"PRESERVED_SPECIMEN","OCCURRENCE_STATUS_INFERRED_FROM_INDIVIDUAL_COUNT;GEODETIC_DATUM_ASSUMED_WGS84;INSTITUTION_MATCH_FUZZY;COLLECTION_MATCH_NONE"
-77,0.083333,"Inga stipulacea",4031350888,"Santa Cecilia at Muñozlandia (on Río Aguarico).","ECU",NA,1972,"PRESERVED_SPECIMEN","OCCURRENCE_STATUS_INFERRED_FROM_INDIVIDUAL_COUNT;COORDINATE_ROUNDED;GEODETIC_DATUM_ASSUMED_WGS84;INSTITUTION_MATCH_FUZZY;COLLECTION_MATCH_NONE"
-73.75,-2.66666,"Inga stipulacea",1261505080,"Río Tacsha Curaray.","PER",NA,1972,"PRESERVED_SPECIMEN","OCCURRENCE_STATUS_INFERRED_FROM_INDIVIDUAL_COUNT;GEODETIC_DATUM_ASSUMED_WGS84;INSTITUTION_MATCH_FUZZY;COLLECTION_MATCH_NONE"
-75,-9.3,"Inga stipulacea",1261890376,"Puerto Inca to Sungaro, foot trail between Río Pachitea and Río Sungaro. Forested low hills & ravines.","PER",NA,1982,"PRESERVED_SPECIMEN","OCCURRENCE_STATUS_INFERRED_FROM_INDIVIDUAL_COUNT;GEODETIC_DATUM_ASSUMED_WGS84;INSTITUTION_MATCH_FUZZY;COLLECTION_MATCH_NONE"
-69.6581,-10.9531,"Inga stipulacea",1928980698,"Basin of Rio Purus, upper Rio Acre, left bank. Seringal Sao Francisco, Colônia Ipiranga.","BRA",NA,1998,"PRESERVED_SPECIMEN","GEODETIC_DATUM_ASSUMED_WGS84;COLLECTION_MATCH_FUZZY"
-76.85,0.21666,"Inga stipulacea",4031938557,"Carretera Lago Agrio-La Punta. Bosque húmedo Tropical.","ECU",NA,1996,"PRESERVED_SPECIMEN","GEODETIC_DATUM_ASSUMED_WGS84;INSTITUTION_MATCH_FUZZY;COLLECTION_MATCH_NONE"
-76.83333,6.58333,"Inga stipulacea",1258285781,"Murrí La Blanquita, Río Murrí hills above village, mature cloud forest. Transect 6","COL",NA,1992,"PRESERVED_SPECIMEN","OCCURRENCE_STATUS_INFERRED_FROM_INDIVIDUAL_COUNT;GEODETIC_DATUM_ASSUMED_WGS84;INSTITUTION_MATCH_FUZZY;COLLECTION_MATCH_NONE"
-78.91666,-4.08333,"Inga stipulacea",4031974334,"Jamboe Bajo. Eastern border of Podocarpus National Park. Mature forest near cow pasture.","ECU",NA,1996,"PRESERVED_SPECIMEN","OCCURRENCE_STATUS_INFERRED_FROM_INDIVIDUAL_COUNT;GEODETIC_DATUM_ASSUMED_WGS84;INSTITUTION_MATCH_FUZZY;COLLECTION_MATCH_NONE"
-73.25,-3.58333,"Inga stipulacea",1258256975,"Sinchicuy; Río Amazonas. Bosque primario.","PER",NA,1986,"PRESERVED_SPECIMEN","OCCURRENCE_STATUS_INFERRED_FROM_INDIVIDUAL_COUNT;GEODETIC_DATUM_ASSUMED_WGS84;INSTITUTION_MATCH_FUZZY;COLLECTION_MATCH_NONE"
-72.75,-3.416667,"Inga stipulacea",1261561220,"Yanamono, Campamento Explorama Lodge, zona Bushmaster, terreno de altura.","PER",NA,1979,"PRESERVED_SPECIMEN","OCCURRENCE_STATUS_INFERRED_FROM_INDIVIDUAL_COUNT;COORDINATE_ROUNDED;GEODETIC_DATUM_ASSUMED_WGS84;INSTITUTION_MATCH_FUZZY;COLLECTION_MATCH_NONE"
-68.849387,-3.453451,"Inga stipulacea",1930457195,"Rio Jandiatuba, from mouth to 10km upstream. Whitewater varzea forest.","BRA",NA,1977,"PRESERVED_SPECIMEN","COORDINATE_ROUNDED;COLLECTION_MATCH_FUZZY"
-76.81666,-1.71666,"Inga stipulacea",4031843803,"Pozo petrolero Corrientes de UNOCAL. 35 km al sur-oriente de Curaray. Bosque húmedo Tropical, primario. Arboles cortadas por las obras petroleras. Suelo rojo, colinas.","ECU",NA,1990,"PRESERVED_SPECIMEN","OCCURRENCE_STATUS_INFERRED_FROM_INDIVIDUAL_COUNT;GEODETIC_DATUM_ASSUMED_WGS84;INSTITUTION_MATCH_FUZZY;COLLECTION_MATCH_NONE"
-77.66666,-0.66666,"Inga stipulacea",1257988113,"Huamani Centro Calluhua Yacu, 31 km E of Tena-Baeza Road, on new road to Coca. TRANSECT 7","ECU",NA,1988,"PRESERVED_SPECIMEN","OCCURRENCE_STATUS_INFERRED_FROM_INDIVIDUAL_COUNT;GEODETIC_DATUM_ASSUMED_WGS84;INSTITUTION_MATCH_FUZZY;COLLECTION_MATCH_NONE"
-73.41666,-3.83333,"Inga stipulacea",1258289083,"Allpahuayo, Km 20 Iquitos-Nauta, ca. 35 km Southwest of Iquitos. Rich soil forest. Transect 1","PER",NA,1987,"PRESERVED_SPECIMEN","OCCURRENCE_STATUS_INFERRED_FROM_INDIVIDUAL_COUNT;GEODETIC_DATUM_ASSUMED_WGS84;INSTITUTION_MATCH_FUZZY;COLLECTION_MATCH_NONE"
-76.91666,-0.58333,"Inga stipulacea",1261878830,"15 km al S de Coca, vía de Los Aucas. Bosque húmedo tropical. Suelo rojo laterítico.","ECU",NA,1985,"PRESERVED_SPECIMEN","OCCURRENCE_STATUS_INFERRED_FROM_INDIVIDUAL_COUNT;GEODETIC_DATUM_ASSUMED_WGS84;INSTITUTION_MATCH_FUZZY;COLLECTION_MATCH_NONE"
-69.05,-12.58333,"Inga stipulacea",1261917454,"10 km NE of Puerto Maldonado, Lago Sanø dobal, lake edge, ravines; aguajal.","PER",NA,1990,"PRESERVED_SPECIMEN","OCCURRENCE_STATUS_INFERRED_FROM_INDIVIDUAL_COUNT;GEODETIC_DATUM_ASSUMED_WGS84;INSTITUTION_MATCH_FUZZY;COLLECTION_MATCH_NONE"
-72.833333,-2.466667,"Inga stipulacea",1258267189,"Indiana, Reserva Explorama. Quebrada de Yanamono (Río Amazonas). Bosque primario.","PER",NA,1990,"PRESERVED_SPECIMEN","OCCURRENCE_STATUS_INFERRED_FROM_INDIVIDUAL_COUNT;COORDINATE_ROUNDED;GEODETIC_DATUM_ASSUMED_WGS84;INSTITUTION_MATCH_FUZZY;COLLECTION_MATCH_NONE"
-77.66666,-0.71666,"Inga stipulacea",1258231803,"Cantón Archidona. Faldas al sur del Volcán Sumaco. Carretera Hollín-Loreto, km 31. Comuna Challua Yacu. Bosque pluvial Pre Montano. Bosque primario. Suelos volcánicos.","ECU",NA,1989,"PRESERVED_SPECIMEN","OCCURRENCE_STATUS_INFERRED_FROM_INDIVIDUAL_COUNT;GEODETIC_DATUM_ASSUMED_WGS84;INSTITUTION_MATCH_FUZZY;COLLECTION_MATCH_NONE"
-75.8333,-9.5,"Inga stipulacea",1228164901,"Huánuco","PER",NA,1997,"PRESERVED_SPECIMEN","GEODETIC_DATUM_ASSUMED_WGS84;INSTITUTION_MATCH_FUZZY;AMBIGUOUS_COLLECTION"
-77.88333,-1.58333,"Inga stipulacea",1258295580,"Mera. Road and muletracks to approx. 4 km N of the village (along Río San Jorge and Río Tigre). Road banks and rain forest.","ECU",NA,1976,"PRESERVED_SPECIMEN","GEODETIC_DATUM_ASSUMED_WGS84;DIFFERENT_OWNER_INSTITUTION"
-76.2797,-0.864067,"Inga stipulacea",4061119192,"Parque Nacional Yasuní. Carretera Pompeya Sur - Iro Km 84,9. En territorio de la comunidad Huaorani de Dicaro. Parcela temporal de muestreo (0.1 ha) Nº 23.","ECU",NA,1998,"PRESERVED_SPECIMEN","OCCURRENCE_STATUS_INFERRED_FROM_INDIVIDUAL_COUNT;COORDINATE_ROUNDED;GEODETIC_DATUM_ASSUMED_WGS84;DIFFERENT_OWNER_INSTITUTION"
-76.5,-0.63,"Inga stipulacea",1563339063,"Prov.: Francisco De Orellana. Estación Científica Yasuní. Río Tiputini, al noroeste de la confluencia con el R. Tivacuno; Este de la carretera Repsol-YPF, km 7 desvío hacia el pozo Tivacuno","ECU",NA,2002,"PRESERVED_SPECIMEN","GEODETIC_DATUM_ASSUMED_WGS84"
-69.22,-10.12,"Inga stipulacea",2997912311,"Basin of Rio Purus, Rio Iaco, right bank, Nova Olinda, between Igarapé Santo Antõnio and Ig. Boa Esperança","BRA",NA,1993,"PRESERVED_SPECIMEN","COORDINATE_ROUNDED;GEODETIC_DATUM_ASSUMED_WGS84;CONTINENT_DERIVED_FROM_COORDINATES;INSTITUTION_MATCH_FUZZY;COLLECTION_MATCH_FUZZY"
-76.85,-0.06666,"Inga stipulacea",4061280795,"Lago Agrio-Tarapoa Km 26. Bosque muy húmedo Tropical.","ECU",NA,1975,"PRESERVED_SPECIMEN","GEODETIC_DATUM_ASSUMED_WGS84;DIFFERENT_OWNER_INSTITUTION"
-71.988,-3.339,"Inga stipulacea",185099524,"Amazonian tropical rain forest, plot 18","PER",NA,1998,"PRESERVED_SPECIMEN","GEODETIC_DATUM_ASSUMED_WGS84;COORDINATE_PRECISION_INVALID;INSTITUTION_MATCH_FUZZY;INSTITUTION_COLLECTION_MISMATCH"
-76.6,-0.46666,"Inga stipulacea",4031925670,"Yasuni National Park. Community of Pompeya, on the southern banks of the Ro Napo. Tropical Moist Forest. Secondary forest at roadsides.","ECU",NA,1994,"PRESERVED_SPECIMEN","GEODETIC_DATUM_ASSUMED_WGS84;INSTITUTION_MATCH_FUZZY;COLLECTION_MATCH_NONE"
-72.3207,-9.043764,"Inga stipulacea",3867492376,"Bacia do Rio Juruá. Rio Tejo. Reserva Extrativista do Alto Juruá, ca. 10km antes da Vila Restauração.","BRA",NA,2013,"PRESERVED_SPECIMEN","GEODETIC_DATUM_ASSUMED_WGS84;COLLECTION_MATCH_FUZZY"
-73.42138,-3.95333,"Inga stipulacea",1258464430,"Distrito Iquitos, Allpahuayo-IIAP. Bosque primario, suelo arcilloso Yarinal, transecto 2 x 500 m.","PER",NA,1997,"PRESERVED_SPECIMEN","OCCURRENCE_STATUS_INFERRED_FROM_INDIVIDUAL_COUNT;GEODETIC_DATUM_ASSUMED_WGS84;INSTITUTION_MATCH_FUZZY;COLLECTION_MATCH_NONE"
-69.504361,-1.080139,"Inga stipulacea",1934690868,"Estación Biológica Mosiro Itajura Caparú, lago del Grillo o lago Taraira.","COL",3615,2004,"PRESERVED_SPECIMEN","COORDINATE_ROUNDED;COORDINATE_PRECISION_INVALID"
-67.874,-9.957,"Inga stipulacea",1930475468,"Parque Zoobotânico.","BRA",NA,1993,"PRESERVED_SPECIMEN","GEODETIC_DATUM_ASSUMED_WGS84;COLLECTION_MATCH_FUZZY"
-76.31666,-6.45,"Inga stipulacea",1258236372,"Km 28 of Tarapoto-Yurimaguas road. Tropical wet forest/premontane rainforest.","PER",NA,1986,"PRESERVED_SPECIMEN","OCCURRENCE_STATUS_INFERRED_FROM_INDIVIDUAL_COUNT;GEODETIC_DATUM_ASSUMED_WGS84;INSTITUTION_MATCH_FUZZY;COLLECTION_MATCH_NONE"
-77.396694,-0.021806,"Inga stipulacea",1978523913,"Gonzalo Pizarro","ECU",30,2011,"HUMAN_OBSERVATION",""
-71.63,-0.93,"Inga stipulacea",1147295944,"aproximadamente 30m en dirección 340° de la margen izq. (bajando) del río Caquetá, en frente de la punta S de Dos islas","COL",NA,1997,"PRESERVED_SPECIMEN","INSTITUTION_MATCH_NONE"
-71.88,-0.76,"Inga stipulacea",768726338,"qda. El Engaño (aguas claras), plano de inundación en bosque alto","COL",NA,1991,"PRESERVED_SPECIMEN","INSTITUTION_MATCH_NONE"
-72.36556,-0.60666,"Inga stipulacea",768737050,"río Caquetá, plano de inundación en bosque alto","COL",NA,1991,"PRESERVED_SPECIMEN","INSTITUTION_MATCH_NONE"
-71.82,-0.84,"Inga stipulacea",768733710,"margen der. río Caquetá (S), 4km W de la qda. El Quinché, bosque alto, plano aluvial parcialmente inundado.","COL",NA,1990,"PRESERVED_SPECIMEN","INSTITUTION_MATCH_NONE"
-71.8,-0.82,"Inga stipulacea",768733304,"margen der. río Caquetá (sur), antes de la boca de la qda. El Quinché, bosque primario bien drenado.","COL",NA,1989,"PRESERVED_SPECIMEN","INSTITUTION_MATCH_NONE"
-74.22,2.65,"Inga stipulacea",3068344433,"inspección La Julia, Parque Nacional Natural Tinigua, sendero ecológico por La Paz, trocha que va del río Duda a río Guayabero","COL",NA,2019,"PRESERVED_SPECIMEN","INSTITUTION_MATCH_NONE"
-75.92389,-0.6925,"Inga stipulacea",1701528351,"Ecuador, Orellana, Vía de acceso Chiruisla-Río Tiputini, colecciones en los alrededores del Km 12+500 - Puende de Dosel Huagrashi. Bosque Húmedo Tropical, áreas de Tierra firme y Plano Temporalmente Inundable. Especies representativas: Faramea capillipes, Caryocar glabrum, Matisia bracteolosa, Aniba hostmanniana, Alt 200 - 220 m, 00º41'33S 75º55'26W","ECU",NA,2005,"PRESERVED_SPECIMEN","CONTINENT_DERIVED_FROM_COORDINATES;INSTITUTION_MATCH_FUZZY;COLLECTION_MATCH_NONE"
-77.45,-1.48333,"Inga stipulacea",1258311209,"PUYO: Comunidad Sta. Cecilia. Bosque húmedo Tropical. Bosque primario. Suelo aluvial (bahial), plano.","ECU",NA,1992,"PRESERVED_SPECIMEN","OCCURRENCE_STATUS_INFERRED_FROM_INDIVIDUAL_COUNT;GEODETIC_DATUM_ASSUMED_WGS84;INSTITUTION_MATCH_FUZZY;COLLECTION_MATCH_NONE"
-71.57,-1.04,"Inga stipulacea",3923762999,"Santander. Araracuara","COL",NA,1984,"HUMAN_OBSERVATION",""
-71.16666,-11.75,"Inga stipulacea",1261919271,"Manu Park, Cocha Cashu uplands.","PER",NA,1986,"PRESERVED_SPECIMEN","OCCURRENCE_STATUS_INFERRED_FROM_INDIVIDUAL_COUNT;GEODETIC_DATUM_ASSUMED_WGS84;INSTITUTION_MATCH_FUZZY;COLLECTION_MATCH_NONE"
-72.9,-3.25,"Inga stipulacea",1258284108,"Sucusari. Bosque Primario.","PER",NA,1992,"PRESERVED_SPECIMEN","OCCURRENCE_STATUS_INFERRED_FROM_INDIVIDUAL_COUNT;GEODETIC_DATUM_ASSUMED_WGS84;INSTITUTION_MATCH_FUZZY;COLLECTION_MATCH_NONE"
