"lon","lat","species","gbifID","locality","countryCode","coordinateUncertaintyInMeters","year","basisOfRecord","issue"
-49.3,-8.25,"Isachne polygonoides",1929823505,"2 Km west of town along highway PA-287. Roadside marsh.","BRA",NA,1980,"PRESERVED_SPECIMEN","GEODETIC_DATUM_ASSUMED_WGS84;COLLECTION_MATCH_FUZZY"
-54.9644,-8.7367,"Isachne polygonoides",1930995741,"Serra do Cachimbo, BR 163, Cuiabá-Santarém Highway, Cachoeira de Curuá; north slope of Serra Cachimbo.","BRA",NA,1977,"PRESERVED_SPECIMEN","COLLECTION_MATCH_FUZZY"
-84.79,10.27,"Isachne polygonoides",1261568641,"Cordillera de Tilarán. San Luis; Finca Buen Amigo, Apelto, Trapiche. Monteverde.","CRI",NA,1993,"PRESERVED_SPECIMEN","OCCURRENCE_STATUS_INFERRED_FROM_INDIVIDUAL_COUNT;GEODETIC_DATUM_ASSUMED_WGS84;DIFFERENT_OWNER_INSTITUTION"
115.35,26.33,"Isachne polygonoides",4043484672,"","CHN",NA,1960,"PRESERVED_SPECIMEN","COUNTRY_INVALID;GEODETIC_DATUM_ASSUMED_WGS84;CONTINENT_DERIVED_FROM_COORDINATES;INSTITUTION_MATCH_FUZZY;COLLECTION_MATCH_NONE"
-63.166667,-7.516667,"Isachne polygonoides",2998273404,"Igarapé de Mangabal BR 230 km 4,5.","BRA",NA,1980,"PRESERVED_SPECIMEN","COORDINATE_ROUNDED;GEODETIC_DATUM_ASSUMED_WGS84;CONTINENT_DERIVED_FROM_COORDINATES;INSTITUTION_MATCH_FUZZY;COLLECTION_MATCH_FUZZY"
-59.41,2.66,"Isachne polygonoides",1456213175,"Dadanawa, southern Rupununi Savanna, E side of Rupununi R.","GUY",NA,1995,"PRESERVED_SPECIMEN","GEODETIC_DATUM_ASSUMED_WGS84"
-70.5,-0.08,"Isachne polygonoides",3062092323,"Amazonas-Vaupes. Río Apaporis: Raudal Yayacopi (La Playa) and vicinity.","COL",NA,1952,"PRESERVED_SPECIMEN","GEODETIC_DATUM_ASSUMED_WGS84"
-83.32,9.18,"Isachne polygonoides",1259414856,"Cantón de Buenos Aires Buenos Aires, Barrio Los Badilla, Laguna La Redonda.","CRI",NA,1989,"PRESERVED_SPECIMEN","OCCURRENCE_STATUS_INFERRED_FROM_INDIVIDUAL_COUNT;GEODETIC_DATUM_ASSUMED_WGS84;INSTITUTION_MATCH_FUZZY;COLLECTION_MATCH_NONE"
-85.5,11.03,"Isachne polygonoides",1259579666,"Along road between the Panamerican Highway and Santa Cecilia, in pastures ca. 2 km E of Finca Los Inocentes.","CRI",NA,1989,"PRESERVED_SPECIMEN","OCCURRENCE_STATUS_INFERRED_FROM_INDIVIDUAL_COUNT;GEODETIC_DATUM_ASSUMED_WGS84;INSTITUTION_MATCH_FUZZY;COLLECTION_MATCH_NONE"
-79.84138,9.13833,"Isachne polygonoides",1259258161,"Barro Colorado Island. Burrunga Point","PAN",NA,1971,"PRESERVED_SPECIMEN","GEODETIC_DATUM_ASSUMED_WGS84;ELEVATION_NON_NUMERIC;INSTITUTION_MATCH_FUZZY;COLLECTION_MATCH_NONE"
-66.75,6.58333,"Isachne polygonoides",1260315420,"Among grasses and sedges wet margin of small swamp in open savanna at base of mountain. Serranía de Pijiguao, 160km. SW of Caicara del Orinoco,","VEN",NA,1985,"PRESERVED_SPECIMEN","GEODETIC_DATUM_ASSUMED_WGS84;INSTITUTION_MATCH_FUZZY;COLLECTION_MATCH_NONE"
-84.846944,11.588611,"Isachne polygonoides",4032152835,"21.7 km SW of Río Oyate bridge on Acoyapa-San Carlos road; pasture/savanna on vertisol, with scattered Curatella, Crescentia and Tabebuia","NIC",NA,2010,"PRESERVED_SPECIMEN","OCCURRENCE_STATUS_INFERRED_FROM_INDIVIDUAL_COUNT;COORDINATE_ROUNDED;GEODETIC_DATUM_ASSUMED_WGS84;INSTITUTION_MATCH_FUZZY;COLLECTION_MATCH_NONE"
-87,14.00805,"Isachne polygonoides",1259184167,"3 km E of El Zamorano. Open marsh along a stream","HND",NA,1970,"PRESERVED_SPECIMEN","GEODETIC_DATUM_ASSUMED_WGS84;INSTITUTION_MATCH_FUZZY;COLLECTION_MATCH_NONE"
-52.512492,-9.915,"Isachne polygonoides",4037823657,"Parque Estadual do Xingu. Acesso à Trilha de Monitoramento III - Projeto Monitora ICMBio.","BRA",NA,2022,"PRESERVED_SPECIMEN","GEODETIC_DATUM_ASSUMED_WGS84;CONTINENT_DERIVED_FROM_COORDINATES;AMBIGUOUS_INSTITUTION"
-85.329417,12.294972,"Isachne polygonoides",1258104843,"2.2 km NW of Río Cuapa bridge below Cuapa, then 6.7 km E; semi-evergreen forest along streams in a broad barranca, breccia","NIC",NA,2015,"PRESERVED_SPECIMEN","OCCURRENCE_STATUS_INFERRED_FROM_INDIVIDUAL_COUNT;COORDINATE_ROUNDED;GEODETIC_DATUM_ASSUMED_WGS84;DIFFERENT_OWNER_INSTITUTION"
-56.13,-9.985167,"Isachne polygonoides",1042696886,"Bacia hidrográfica do rio Teles Pires, Igarapé de cabeceira na microbacia Mariana","BRA",NA,2011,"PRESERVED_SPECIMEN","GEODETIC_DATUM_ASSUMED_WGS84;GEODETIC_DATUM_INVALID;ELEVATION_MIN_MAX_SWAPPED;INSTITUTION_MATCH_NONE"
-69.28,-12.816667,"Isachne polygonoides",1042479286,"Province Tambopata: ca. 30 air Km or 70-80 river Km SSW Puerto Maldonado at effluence Rio La Torre (Rio D'Orbigny)/ Rio Tambopata (SE bank); Tambopata Nature Reserve; Tropical Moist forest; along exposed lake margins.","PER",NA,1980,"PRESERVED_SPECIMEN","GEODETIC_DATUM_ASSUMED_WGS84;GEODETIC_DATUM_INVALID;ELEVATION_MIN_MAX_SWAPPED;INSTITUTION_MATCH_NONE"
-60.43,-3.755278,"Isachne polygonoides",1042541961,"Lago do Castanho, Lago do Castanho.","BRA",NA,1974,"PRESERVED_SPECIMEN","GEODETIC_DATUM_ASSUMED_WGS84;GEODETIC_DATUM_INVALID;ELEVATION_MIN_MAX_SWAPPED;INSTITUTION_MATCH_NONE"
-64.36,-8.657361,"Isachne polygonoides",1042667336,"Joana D'Arce, Campina ca. 20 km depois de Joana D'Arce, de estrada de barro. Formação savânica. Mancha de cerrado.","BRA",NA,2007,"PRESERVED_SPECIMEN","GEODETIC_DATUM_ASSUMED_WGS84;GEODETIC_DATUM_INVALID;ELEVATION_MIN_MAX_SWAPPED;INSTITUTION_MATCH_NONE"
-86.315305,13.724176,"Isachne polygonoides",2859275573,"ca 5.2 km N of San Fernando, valley of Río San Fernando, NE to Portillo Los Coyoles, SW up narrow","NIC",5932,1977,"PRESERVED_SPECIMEN","RECORDED_DATE_INVALID;CONTINENT_DERIVED_FROM_COORDINATES;INSTITUTION_MATCH_FUZZY;INSTITUTION_COLLECTION_MISMATCH"
-41.703199,-4.085043,"Isachne polygonoides",2248070561,"Sete Cidades.","BRA",NA,1973,"PRESERVED_SPECIMEN","GEODETIC_DATUM_ASSUMED_WGS84;GEODETIC_DATUM_INVALID;CONTINENT_DERIVED_FROM_COORDINATES;INSTITUTION_MATCH_FUZZY;COLLECTION_MATCH_FUZZY"
-44.628889,-22.430556,"Isachne polygonoides",2252521554,"Trilha-BR-485. Próximo da Cachoeira da Maromba. Parque Nacional de Itatiaia","BRA",NA,2019,"PRESERVED_SPECIMEN","COORDINATE_ROUNDED;GEODETIC_DATUM_ASSUMED_WGS84;CONTINENT_DERIVED_FROM_COORDINATES;INSTITUTION_MATCH_FUZZY;COLLECTION_MATCH_FUZZY"
-48.929167,-1.003056,"Isachne polygonoides",1990853038,"Ilha do Arari, ca. de 10 km da entrada de cachoeira do Arari.","BRA",NA,2015,"PRESERVED_SPECIMEN","COORDINATE_ROUNDED;GEODETIC_DATUM_ASSUMED_WGS84;CONTINENT_DERIVED_FROM_COORDINATES;INSTITUTION_MATCH_FUZZY;COLLECTION_MATCH_FUZZY"
-52.744444,-9.8225,"Isachne polygonoides",1095257265,"Parque Estadual do Xingu, limite sul do Parque.","BRA",NA,2011,"PRESERVED_SPECIMEN","OCCURRENCE_STATUS_INFERRED_FROM_INDIVIDUAL_COUNT;GEODETIC_DATUM_ASSUMED_WGS84;CONTINENT_DERIVED_FROM_COORDINATES;INSTITUTION_MATCH_NONE"
-63.166666,-7.516667,"Isachne polygonoides",1095190133,"Igarapé de Mangabal, km 4,5 Transamazônica. E do Aamazonas.","BRA",NA,1980,"PRESERVED_SPECIMEN","OCCURRENCE_STATUS_INFERRED_FROM_INDIVIDUAL_COUNT;COORDINATE_ROUNDED;GEODETIC_DATUM_ASSUMED_WGS84;CONTINENT_DERIVED_FROM_COORDINATES;INSTITUTION_MATCH_NONE"
-47.793333,-14.188888,"Isachne polygonoides",1095241323,"Chapada dos Veadeiros, Vale da Lua.","BRA",NA,2007,"PRESERVED_SPECIMEN","OCCURRENCE_STATUS_INFERRED_FROM_INDIVIDUAL_COUNT;GEODETIC_DATUM_ASSUMED_WGS84;CONTINENT_DERIVED_FROM_COORDINATES;INSTITUTION_MATCH_NONE"
-56.46,3.1,"Isachne polygonoides",1456371074,"Kayser Airstrip, Zuid R., 45 km above confl. with Lucie R., Wilhelmina Gebergte","SUR",NA,1963,"PRESERVED_SPECIMEN","GEODETIC_DATUM_ASSUMED_WGS84"
-68.688889,-12.588333,"Isachne polygonoides",1258512616,"Parque Nacional Bahuaja-Sonere. Ex Santuario Nacional Pampas del Heath. Estación Guarda Parques: Juliaca, Quebrada Shuyo.","PER",NA,1997,"PRESERVED_SPECIMEN","OCCURRENCE_STATUS_INFERRED_FROM_INDIVIDUAL_COUNT;COORDINATE_ROUNDED;GEODETIC_DATUM_ASSUMED_WGS84;INSTITUTION_MATCH_FUZZY;COLLECTION_MATCH_NONE"
-81.157222,8.540833,"Isachne polygonoides",1259259286,"To 12 km NW of Santa Fé de Veraguas","PAN",NA,1975,"PRESERVED_SPECIMEN","OCCURRENCE_STATUS_INFERRED_FROM_INDIVIDUAL_COUNT;COORDINATE_ROUNDED;GEODETIC_DATUM_ASSUMED_WGS84;INSTITUTION_MATCH_FUZZY;COLLECTION_MATCH_NONE"
-64.83333,8.41666,"Isachne polygonoides",1259446293,"Morichal El Piñal, San Diego de Cabrutica.","VEN",NA,1987,"PRESERVED_SPECIMEN","OCCURRENCE_STATUS_INFERRED_FROM_INDIVIDUAL_COUNT;GEODETIC_DATUM_ASSUMED_WGS84;INSTITUTION_MATCH_FUZZY;COLLECTION_MATCH_NONE"
-59.333333,2.516667,"Isachne polygonoides",2517098930,"Region: U. Takutu-U. Essequibo, South Rupununi savanna; Aishalton village.","GUY",NA,1993,"PRESERVED_SPECIMEN","INSTITUTION_MATCH_FUZZY;INSTITUTION_COLLECTION_MISMATCH"
-69.81666,9.06666,"Isachne polygonoides",1259184002,"Dtto. Guanare, terrenos de la UNELLEZ","VEN",NA,1983,"PRESERVED_SPECIMEN","GEODETIC_DATUM_ASSUMED_WGS84;INSTITUTION_MATCH_FUZZY;COLLECTION_MATCH_NONE"
-85.5825,15.44,"Isachne polygonoides",1259690766,"Municipio San Estebán: Santa Maria del Carbón, 23 mi NE of San Estebán along road to Bonito Oriental. Marsh in pine forest dominated by Eriochrysis, Rhynchospora spp., Eleocharis spp., and Cyperus spp.","HND",NA,1994,"PRESERVED_SPECIMEN","OCCURRENCE_STATUS_INFERRED_FROM_INDIVIDUAL_COUNT;GEODETIC_DATUM_ASSUMED_WGS84;INSTITUTION_MATCH_FUZZY;COLLECTION_MATCH_NONE"
-66.5,6.83333,"Isachne polygonoides",1260315585,"Dtto Cedeño. Entre los kms 12-120 de la carretera Caicara del Orinoco-Pto. Ayacucho. Al sur de Caicara del Orinoco.","VEN",NA,1984,"PRESERVED_SPECIMEN","GEODETIC_DATUM_ASSUMED_WGS84;INSTITUTION_MATCH_FUZZY;COLLECTION_MATCH_NONE"
-61.1625,-14.69722,"Isachne polygonoides",1258302863,"Large, horseshoe-shaped curichi, ca. 3 km to the NE of the buildings at La Toledo.","BOL",NA,1995,"PRESERVED_SPECIMEN","OCCURRENCE_STATUS_INFERRED_FROM_INDIVIDUAL_COUNT;GEODETIC_DATUM_ASSUMED_WGS84;INSTITUTION_MATCH_FUZZY;COLLECTION_MATCH_NONE"
-80.944722,8.047778,"Isachne polygonoides",1259259348,"2 km NW of Atalaya.","PAN",NA,1973,"PRESERVED_SPECIMEN","OCCURRENCE_STATUS_INFERRED_FROM_INDIVIDUAL_COUNT;COORDINATE_ROUNDED;GEODETIC_DATUM_ASSUMED_WGS84;INSTITUTION_MATCH_FUZZY;COLLECTION_MATCH_NONE"
-71.91666,7.45,"Isachne polygonoides",1259130888,"Distrito Libertador: 10 km S of El Piñal. Seasonally, partially inundated forest remnant with slow stream and pools of standing water.","VEN",NA,1982,"PRESERVED_SPECIMEN","GEODETIC_DATUM_ASSUMED_WGS84;INSTITUTION_MATCH_FUZZY;COLLECTION_MATCH_NONE"
-85.346389,12.315833,"Isachne polygonoides",4031662057,"10 km NNE of Cuapa along road toward Muy Muy, 2 km past Matayagual; pasture with scattered epiphyte-laden trees and patches of exposed basalt, on a mesa dissected by narrow gorges","NIC",NA,2009,"PRESERVED_SPECIMEN","OCCURRENCE_STATUS_INFERRED_FROM_INDIVIDUAL_COUNT;COORDINATE_ROUNDED;GEODETIC_DATUM_ASSUMED_WGS84;INSTITUTION_MATCH_FUZZY;COLLECTION_MATCH_NONE"
-50.45,-5.9,"Isachne polygonoides",1928830109,"N1, 25 Km NW of camp at Serra Norte. Marshy area and nearby scrub on outcrop of ferrous rock.","BRA",NA,1981,"PRESERVED_SPECIMEN","GEODETIC_DATUM_ASSUMED_WGS84;COLLECTION_MATCH_FUZZY"
-52.316667,4.883333,"Isachne polygonoides",2515485362,"Route de Cabassou.","GUF",NA,1955,"PRESERVED_SPECIMEN","INSTITUTION_MATCH_FUZZY;INSTITUTION_COLLECTION_MISMATCH"
-50.385278,-6.393889,"Isachne polygonoides",2365706227,"Campo Hidromórfico","BRA",NA,2016,"PRESERVED_SPECIMEN","COORDINATE_ROUNDED;GEODETIC_DATUM_ASSUMED_WGS84;INSTITUTION_MATCH_FUZZY;COLLECTION_MATCH_NONE"
-56.483333,3.166667,"Isachne polygonoides",1314803711,"Suriname","SUR",NA,1963,"PRESERVED_SPECIMEN","COORDINATE_ROUNDED;GEODETIC_DATUM_ASSUMED_WGS84;INSTITUTION_MATCH_FUZZY;COLLECTION_MATCH_NONE"
-66.5,6.3,"Isachne polygonoides",1260317045,"Chaparral inundado al SW del puente Suapure, en planicie aluvial. Planicie aluvial, piedemonte y altiplanicie entre el margen derecho del Rio Orinoco medio y el borde NW de la Serrania de Los Pijiguaos (Bajo Río Suapure).","VEN",NA,1987,"PRESERVED_SPECIMEN","GEODETIC_DATUM_ASSUMED_WGS84;INSTITUTION_MATCH_FUZZY;COLLECTION_MATCH_NONE"
-66.66666,6.83333,"Isachne polygonoides",1260315984,"Swamp below rocky igneous slopes, 130 km. SW of Caicara del Orinoco,","VEN",NA,1985,"PRESERVED_SPECIMEN","GEODETIC_DATUM_ASSUMED_WGS84;INSTITUTION_MATCH_FUZZY;COLLECTION_MATCH_NONE"
-83.616667,10.8,"Isachne polygonoides",1259498199,"Margin of Laguna de Atras, between Barra del Colorado and the mouth of the Río San Juan.","CRI",NA,1986,"PRESERVED_SPECIMEN","OCCURRENCE_STATUS_INFERRED_FROM_INDIVIDUAL_COUNT;COORDINATE_ROUNDED;GEODETIC_DATUM_ASSUMED_WGS84;INSTITUTION_MATCH_FUZZY;COLLECTION_MATCH_NONE"
-60.90444,-13.595,"Isachne polygonoides",4031442024,"Parque Nacional Noel Kempff Mercado. Lago Caimán, sistema que recibe agua del Río Itenez, con poca agua en tiempo seco.","BOL",NA,1996,"PRESERVED_SPECIMEN","OCCURRENCE_STATUS_INFERRED_FROM_INDIVIDUAL_COUNT;GEODETIC_DATUM_ASSUMED_WGS84;INSTITUTION_MATCH_FUZZY;COLLECTION_MATCH_NONE"
-84.25972,13.50833,"Isachne polygonoides",1259806628,"Camino a Limbaika, ca 5 km al SE de El Empalme; bosque húmedo tropical","NIC",NA,1982,"PRESERVED_SPECIMEN","OCCURRENCE_STATUS_INFERRED_FROM_INDIVIDUAL_COUNT;GEODETIC_DATUM_ASSUMED_WGS84;INSTITUTION_MATCH_FUZZY;COLLECTION_MATCH_NONE"
-92.028056,17.593333,"Isachne polygonoides",4031874468,"12 km north of Palenque along road to Catazajá. [250 m elevation on original specimen].","MEX",NA,1980,"PRESERVED_SPECIMEN","OCCURRENCE_STATUS_INFERRED_FROM_INDIVIDUAL_COUNT;COORDINATE_ROUNDED;GEODETIC_DATUM_ASSUMED_WGS84;INSTITUTION_MATCH_FUZZY;COLLECTION_MATCH_NONE"
-60.77055,-14.56083,"Isachne polygonoides",4031939033,"Parque Nacional Noel Kempff Mercado. The Meseta. A small arroyo below the trail to the camp at Huanchaca II.","BOL",NA,1996,"PRESERVED_SPECIMEN","OCCURRENCE_STATUS_INFERRED_FROM_INDIVIDUAL_COUNT;GEODETIC_DATUM_ASSUMED_WGS84;INSTITUTION_MATCH_FUZZY;COLLECTION_MATCH_NONE"
-67.63333,9.23333,"Isachne polygonoides",1260316228,"Dtto. Infante: Parque Nacional Aguaro-Guariquito: Morichal Charcote.","VEN",NA,1981,"PRESERVED_SPECIMEN","GEODETIC_DATUM_ASSUMED_WGS84;INSTITUTION_MATCH_FUZZY;COLLECTION_MATCH_NONE"
-71.344633,4.581395,"Isachne polygonoides",1260314304,"Carimagua. Grassland with palm forest along the rivers, mostly flat countryside with few trees, burnt at intervals.","COL",NA,1992,"PRESERVED_SPECIMEN","GEODETIC_DATUM_ASSUMED_WGS84;INSTITUTION_MATCH_FUZZY;COLLECTION_MATCH_NONE"
-67.633333,5.65,"Isachne polygonoides",1259598202,"Vicinity of Puerto Ayacucho on laja (granitic outcrops) and adjacent sandy savannas near airport and herbarium of Ministerio de Ambiente.","VEN",NA,1984,"PRESERVED_SPECIMEN","OCCURRENCE_STATUS_INFERRED_FROM_INDIVIDUAL_COUNT;COORDINATE_ROUNDED;GEODETIC_DATUM_ASSUMED_WGS84;INSTITUTION_MATCH_FUZZY;COLLECTION_MATCH_NONE"
-67.63333,9.8,"Isachne polygonoides",1260316433,"Dtto. Infante: Parque Nacional Aguaro-Guariquito: Sabanas de Juan Paulino, via Los Arroyuelos.","VEN",NA,1981,"PRESERVED_SPECIMEN","GEODETIC_DATUM_ASSUMED_WGS84;INSTITUTION_MATCH_FUZZY;COLLECTION_MATCH_NONE"
-66.056944,-11.034444,"Isachne polygonoides",1262926326,"Town of Riberalta. A large wetland SE of the airport.","BOL",NA,1996,"PRESERVED_SPECIMEN","OCCURRENCE_STATUS_INFERRED_FROM_INDIVIDUAL_COUNT;COORDINATE_ROUNDED;GEODETIC_DATUM_ASSUMED_WGS84;INSTITUTION_MATCH_FUZZY;COLLECTION_MATCH_NONE"
-59.51,2.95,"Isachne polygonoides",1456206112,"Rupununi Northern Savanna, Wichabai, 5 mi. N of","GUY",NA,1963,"PRESERVED_SPECIMEN","GEODETIC_DATUM_ASSUMED_WGS84"
-84.33,15.5,"Isachne polygonoides",3062080314,"La Mosquitia. Ahuas, departamento de Gracias a Dios.","HND",NA,1972,"PRESERVED_SPECIMEN","GEODETIC_DATUM_ASSUMED_WGS84;CONTINENT_DERIVED_FROM_COORDINATES;CONTINENT_INVALID"
-87.006111,14.010278,"Isachne polygonoides",1259401324,"Vic. of Escuela Agricola Panamericana (EAP), El Zamorano near Tegucigalpa.","HND",NA,1951,"PRESERVED_SPECIMEN","OCCURRENCE_STATUS_INFERRED_FROM_INDIVIDUAL_COUNT;COORDINATE_ROUNDED;GEODETIC_DATUM_ASSUMED_WGS84;DIFFERENT_OWNER_INSTITUTION"
-84.015,10.46305,"Isachne polygonoides",4061659528,"Near Puerto Viejo de Sarapiquí","CRI",NA,1981,"PRESERVED_SPECIMEN","OCCURRENCE_STATUS_INFERRED_FROM_INDIVIDUAL_COUNT;GEODETIC_DATUM_ASSUMED_WGS84;INSTITUTION_MATCH_NONE"
-62.5,5.7,"Isachne polygonoides",1259424298,"Distrito Piar: Río Ocoine, Pie de la Roca, southeastern base of Auyan-tepui.","VEN",NA,1982,"PRESERVED_SPECIMEN","OCCURRENCE_STATUS_INFERRED_FROM_INDIVIDUAL_COUNT;GEODETIC_DATUM_ASSUMED_WGS84;DIFFERENT_OWNER_INSTITUTION"
-99.08,16.98,"Isachne polygonoides",1259401631,"San Miguel, N of Ayutla; gallery forest and open sandbars in river","MEX",NA,1983,"PRESERVED_SPECIMEN","GEODETIC_DATUM_ASSUMED_WGS84;DIFFERENT_OWNER_INSTITUTION"
-67.566667,6.683333,"Isachne polygonoides",4061005448,"Between Caño La Guardia and the Río Cinaruco.","VEN",NA,1979,"PRESERVED_SPECIMEN","OCCURRENCE_STATUS_INFERRED_FROM_INDIVIDUAL_COUNT;COORDINATE_ROUNDED;GEODETIC_DATUM_ASSUMED_WGS84;INSTITUTION_MATCH_NONE"
-67.25,-13.083333,"Isachne polygonoides",1259120100,"Luisita. Sabana húmeda, al W del río Beni. Sartenejal","BOL",NA,1984,"PRESERVED_SPECIMEN","OCCURRENCE_STATUS_INFERRED_FROM_INDIVIDUAL_COUNT;COORDINATE_ROUNDED;GEODETIC_DATUM_ASSUMED_WGS84;DIFFERENT_OWNER_INSTITUTION"
-84.69,11.04,"Isachne polygonoides",45351865,"Medio Queso. Charca a la orilla de un arrozal.","CRI",NA,2001,"PRESERVED_SPECIMEN","GEODETIC_DATUM_ASSUMED_WGS84;CONTINENT_DERIVED_FROM_COORDINATES;TAXON_MATCH_HIGHERRANK;INSTITUTION_MATCH_NONE"
-59.56,3.41,"Isachne polygonoides",1456320450,"Rupununi Northern Savanna, Mountain View, Nappi","GUY",NA,1963,"PRESERVED_SPECIMEN","GEODETIC_DATUM_ASSUMED_WGS84"
-49.909722,-6.315,"Isachne polygonoides",1913568300,"Serra da Bocaina","BRA",NA,2010,"PRESERVED_SPECIMEN","GEODETIC_DATUM_ASSUMED_WGS84;AMBIGUOUS_INSTITUTION"
-50.283333,-6.1,"Isachne polygonoides",1913569294,"Floresta Nacional de Carajás, N1.","BRA",NA,2012,"PRESERVED_SPECIMEN","GEODETIC_DATUM_ASSUMED_WGS84;AMBIGUOUS_INSTITUTION"
-50.452778,-6.320833,"Isachne polygonoides",1913567908,"Floresta Nacional de Carajás, S11A.","BRA",NA,2010,"PRESERVED_SPECIMEN","GEODETIC_DATUM_ASSUMED_WGS84;AMBIGUOUS_INSTITUTION"
-68.816667,6.216667,"Isachne polygonoides",1259095952,"Near the Río Meta at Fundo El Algarrobo, 25 airline km WNW of Buena Vista, Morichal de La Madera.","VEN",NA,1978,"PRESERVED_SPECIMEN","OCCURRENCE_STATUS_INFERRED_FROM_INDIVIDUAL_COUNT;COORDINATE_ROUNDED;GEODETIC_DATUM_ASSUMED_WGS84;INSTITUTION_MATCH_FUZZY;COLLECTION_MATCH_NONE"
-86.55,13.75,"Isachne polygonoides",1259558414,"Santa María de los Pinos, 5 km al NE de Dipilto","NIC",NA,1984,"PRESERVED_SPECIMEN","OCCURRENCE_STATUS_INFERRED_FROM_INDIVIDUAL_COUNT;GEODETIC_DATUM_ASSUMED_WGS84;INSTITUTION_MATCH_FUZZY;COLLECTION_MATCH_NONE"
-79.083333,9.45,"Isachne polygonoides",1258739189,"Along canal just north of Mandinga Airport.","PAN",NA,1967,"PRESERVED_SPECIMEN","OCCURRENCE_STATUS_INFERRED_FROM_INDIVIDUAL_COUNT;COORDINATE_ROUNDED;GEODETIC_DATUM_ASSUMED_WGS84;INSTITUTION_MATCH_FUZZY;COLLECTION_MATCH_NONE"
-67.36,6.03,"Isachne polygonoides",1456476673,"Cerro San Borja, Río Orinoco","VEN",NA,1955,"PRESERVED_SPECIMEN","GEODETIC_DATUM_ASSUMED_WGS84"
-54.03,5.5,"Isachne polygonoides",1456149964,"St. Laurent","GUF",NA,1955,"PRESERVED_SPECIMEN","GEODETIC_DATUM_ASSUMED_WGS84"
-51.09569,-0.04072,"Isachne polygonoides",1931214262,"Parque Florestal da Fazendinha, 12 km S of Macapá","BRA",NA,1983,"PRESERVED_SPECIMEN","GEODETIC_DATUM_ASSUMED_WGS84;COLLECTION_MATCH_FUZZY"
-49.478972,-8.036111,"Isachne polygonoides",1989561737,"Proximo a Represa","BRA",NA,2017,"PRESERVED_SPECIMEN","GEODETIC_DATUM_ASSUMED_WGS84;CONTINENT_DERIVED_FROM_COORDINATES;INSTITUTION_MATCH_NONE"
-49.609511,-0.056878,"Isachne polygonoides",1090154929,"Ilha de Marajó, Unidade de Conservação de Chaves, Costa Norte da Ilha.","BRA",NA,2013,"PRESERVED_SPECIMEN","GEODETIC_DATUM_ASSUMED_WGS84;CONTINENT_DERIVED_FROM_COORDINATES;INSTITUTION_MATCH_NONE"
-56.03,2.1,"Isachne polygonoides",1456127589,"Sipaliwini Savanna","SUR",NA,1966,"PRESERVED_SPECIMEN","GEODETIC_DATUM_ASSUMED_WGS84"
-75.25,-0.116667,"Isachne polygonoides",1259662399,"Inmediaciones de la Guarnicion militar de Gueppi, sobre la Margen izquierda del Río Putumayo, border with Ecuador.","PER",NA,1978,"PRESERVED_SPECIMEN","OCCURRENCE_STATUS_INFERRED_FROM_INDIVIDUAL_COUNT;COORDINATE_ROUNDED;GEODETIC_DATUM_ASSUMED_WGS84;INSTITUTION_MATCH_FUZZY;COLLECTION_MATCH_NONE"
-50.088333,-6.040555,"Isachne polygonoides",2565879885,"FLONA de Carajás - Serra dos Carajás. Trilha da Lagoa da Mata - entrada da Mina no N5. Lagoa da mata","BRA",NA,2015,"PRESERVED_SPECIMEN","COORDINATE_ROUNDED;GEODETIC_DATUM_ASSUMED_WGS84;CONTINENT_DERIVED_FROM_COORDINATES;INSTITUTION_MATCH_FUZZY;COLLECTION_MATCH_FUZZY"
112.28,24.72,"Isachne polygonoides",4043980175,"","CHN",NA,1958,"PRESERVED_SPECIMEN","COUNTRY_INVALID;GEODETIC_DATUM_ASSUMED_WGS84;CONTINENT_DERIVED_FROM_COORDINATES;INSTITUTION_MATCH_FUZZY;COLLECTION_MATCH_NONE"
-67.86666,9.86666,"Isachne polygonoides",1260317871,"Dtto. Infante: Parque Nacional Aguaro-Guariquito: Morichal Lamedero.","VEN",NA,1981,"PRESERVED_SPECIMEN","GEODETIC_DATUM_ASSUMED_WGS84;INSTITUTION_MATCH_FUZZY;COLLECTION_MATCH_NONE"
-85.541111,11.040278,"Isachne polygonoides",1259257820,"Seasonal pools 7.5 km E of Río Animas.","CRI",NA,1982,"PRESERVED_SPECIMEN","OCCURRENCE_STATUS_INFERRED_FROM_INDIVIDUAL_COUNT;COORDINATE_ROUNDED;GEODETIC_DATUM_ASSUMED_WGS84;INSTITUTION_MATCH_FUZZY;COLLECTION_MATCH_NONE"
114.52,26.33,"Isachne polygonoides",4045183015,"","CHN",NA,1963,"PRESERVED_SPECIMEN","COUNTRY_INVALID;GEODETIC_DATUM_ASSUMED_WGS84;CONTINENT_DERIVED_FROM_COORDINATES;INSTITUTION_MATCH_FUZZY;COLLECTION_MATCH_NONE"
117.9,28.44,"Isachne polygonoides",2417272364,"","CHN",NA,1958,"PRESERVED_SPECIMEN","GEODETIC_DATUM_ASSUMED_WGS84;CONTINENT_DERIVED_FROM_COORDINATES;INSTITUTION_MATCH_FUZZY;COLLECTION_MATCH_NONE"
116.02,25.88,"Isachne polygonoides",2417744676,"","CHN",NA,1958,"PRESERVED_SPECIMEN","GEODETIC_DATUM_ASSUMED_WGS84;CONTINENT_DERIVED_FROM_COORDINATES;INSTITUTION_MATCH_FUZZY;COLLECTION_MATCH_NONE"
-52.68,5.13,"Isachne polygonoides",1456361475,"Kourou, fond savane Passoura","GUF",NA,1962,"PRESERVED_SPECIMEN","GEODETIC_DATUM_ASSUMED_WGS84"
-84.48333,13.66666,"Isachne polygonoides",1259453943,"5.1 km W of El Empalme by road to Siuna, near crossing of Río Baka; shallow of gravelly borrow pit marsh","NIC",NA,1982,"PRESERVED_SPECIMEN","GEODETIC_DATUM_ASSUMED_WGS84;INSTITUTION_MATCH_FUZZY;COLLECTION_MATCH_NONE"
-84.8125,13.71666,"Isachne polygonoides",1259486292,"Municipio de Siuna, Río Matís","NIC",NA,1982,"PRESERVED_SPECIMEN","GEODETIC_DATUM_ASSUMED_WGS84;INSTITUTION_MATCH_FUZZY;COLLECTION_MATCH_NONE"
-59.151389,-0.441389,"Isachne polygonoides",2302426686,"Rio Cantá; campina.","BRA",NA,1951,"PRESERVED_SPECIMEN","RECORDED_DATE_INVALID;COORDINATE_ROUNDED;GEODETIC_DATUM_ASSUMED_WGS84;CONTINENT_DERIVED_FROM_COORDINATES;INSTITUTION_MATCH_FUZZY;COLLECTION_MATCH_FUZZY"
-49.54,-6.18,"Isachne polygonoides",2302453410,"Serra da Bocaina","BRA",NA,2010,"PRESERVED_SPECIMEN","COORDINATE_ROUNDED;GEODETIC_DATUM_ASSUMED_WGS84;CONTINENT_DERIVED_FROM_COORDINATES;INSTITUTION_MATCH_FUZZY;COLLECTION_MATCH_FUZZY"
-59.416667,2.666667,"Isachne polygonoides",2573131966,"Southern Rupununi Savanna, east side of Rupununi River. Dadanawa. Due NE of Dadanawa ranch compound.","GUY",NA,1995,"PRESERVED_SPECIMEN","GEODETIC_DATUM_ASSUMED_WGS84;CONTINENT_DERIVED_FROM_COORDINATES;INSTITUTION_MATCH_FUZZY;COLLECTION_MATCH_NONE"
100.83,24.45,"Isachne polygonoides",4043471758,"","CHN",NA,1956,"PRESERVED_SPECIMEN","COUNTRY_INVALID;GEODETIC_DATUM_ASSUMED_WGS84;CONTINENT_DERIVED_FROM_COORDINATES;INSTITUTION_MATCH_FUZZY;COLLECTION_MATCH_NONE"
116.33,26.33,"Isachne polygonoides",4044573983,"","CHN",NA,1958,"PRESERVED_SPECIMEN","COUNTRY_INVALID;GEODETIC_DATUM_ASSUMED_WGS84;CONTINENT_DERIVED_FROM_COORDINATES;INSTITUTION_MATCH_FUZZY;COLLECTION_MATCH_NONE"
117.37,24.52,"Isachne polygonoides",4045009560,"","CHN",NA,1957,"PRESERVED_SPECIMEN","COUNTRY_INVALID;GEODETIC_DATUM_ASSUMED_WGS84;CONTINENT_DERIVED_FROM_COORDINATES;INSTITUTION_MATCH_FUZZY;COLLECTION_MATCH_NONE"
-56.65,3.25,"Isachne polygonoides",3062097498,"Exploration of the Wilhelmina Gebergte. Zuid Rivier. Locally abundant in partially exposed abandoned road bed, vic. Kayser Savanna, 45 km above confluence with Lucie Rivier.","SUR",NA,1963,"PRESERVED_SPECIMEN","GEODETIC_DATUM_ASSUMED_WGS84"
-59.65,3.28,"Isachne polygonoides",1455940472,"Rupununi Northern Savanna, Nappi Flats","GUY",NA,1963,"PRESERVED_SPECIMEN","GEODETIC_DATUM_ASSUMED_WGS84"
-38.786944,-13.103889,"Isachne polygonoides",1094917211,"Ilha de Itaparica, Catu, córrego que atravessa a estrada para Catu, através de uma manilha.","BRA",NA,2010,"PRESERVED_SPECIMEN","GEODETIC_DATUM_ASSUMED_WGS84;CONTINENT_DERIVED_FROM_COORDINATES;DIFFERENT_OWNER_INSTITUTION"
-65.28,-9.798889,"Isachne polygonoides",2997923306,"Km 217-9 Madeira-Mamoré railroad, 2-4 Km east of Abunã. Savanna; growing in large clumps.","BRA",NA,1968,"PRESERVED_SPECIMEN","COORDINATE_ROUNDED;GEODETIC_DATUM_ASSUMED_WGS84;CONTINENT_DERIVED_FROM_COORDINATES;INSTITUTION_MATCH_FUZZY;COLLECTION_MATCH_FUZZY"
-67.86666,9.66666,"Isachne polygonoides",1260317793,"Dtto. Infante: Parque Nacional Aguaro-Guriquito: Morichal San Ramón.","VEN",NA,1981,"PRESERVED_SPECIMEN","GEODETIC_DATUM_ASSUMED_WGS84;INSTITUTION_MATCH_FUZZY;COLLECTION_MATCH_NONE"
-70.1,-12.57,"Isachne polygonoides",80089004,"","PER",NA,2003,"PRESERVED_SPECIMEN","GEODETIC_DATUM_ASSUMED_WGS84;INSTITUTION_MATCH_FUZZY;COLLECTION_MATCH_FUZZY"
-69.71666,-12.81666,"Isachne polygonoides",1259726081,"Explorer's Inn Tourist Camp, near junction of Ríos La Torre and Tambopata, inundated area at edge of Cocacocha Lake.","PER",NA,1985,"PRESERVED_SPECIMEN","OCCURRENCE_STATUS_INFERRED_FROM_INDIVIDUAL_COUNT;GEODETIC_DATUM_ASSUMED_WGS84;INSTITUTION_MATCH_FUZZY;COLLECTION_MATCH_NONE"
-50.201111,-6.170278,"Isachne polygonoides",2996896573,"FLONA de Carajás- caminho para a Serra Sul.","BRA",NA,2011,"PRESERVED_SPECIMEN","COORDINATE_ROUNDED;GEODETIC_DATUM_ASSUMED_WGS84;CONTINENT_DERIVED_FROM_COORDINATES;ELEVATION_MIN_MAX_SWAPPED;INSTITUTION_MATCH_FUZZY;COLLECTION_MATCH_FUZZY"
