"lon","lat","species","gbifID","locality","countryCode","coordinateUncertaintyInMeters","year","basisOfRecord","issue"
37.92,-6.87,"Lomariopsis warneckei",1322280239,"T6, Morogoro District, Mkungwe Hill, N. E. part of Northern Uluguru Mountains","TZA",NA,1970,"PRESERVED_SPECIMEN","GEODETIC_DATUM_ASSUMED_WGS84"
38.616667,-5.1,"Lomariopsis warneckei",4031824102,"Eastern Usambara Mt., Amani area. Bomole Hill.","TZA",NA,1970,"PRESERVED_SPECIMEN","OCCURRENCE_STATUS_INFERRED_FROM_INDIVIDUAL_COUNT;COORDINATE_ROUNDED;GEODETIC_DATUM_ASSUMED_WGS84;INSTITUTION_MATCH_FUZZY;COLLECTION_MATCH_NONE"
32.97556,0.42528,"Lomariopsis warneckei",1417437079,"","UGA",10,2010,"HUMAN_OBSERVATION","CONTINENT_DERIVED_FROM_COORDINATES"
33.53,-9.67,"Lomariopsis warneckei",912107635,"Misuku Hills. [MAL-N].","MWI",NA,1959,"PRESERVED_SPECIMEN","GEODETIC_DATUM_ASSUMED_WGS84;CONTINENT_DERIVED_FROM_COORDINATES;INSTITUTION_MATCH_FUZZY;COLLECTION_MATCH_FUZZY"
35.83,-15.7,"Lomariopsis warneckei",912107592,"S Reg., Mulanje District. Maudzi Hill, western side, above gardens. [MAL-S].","MWI",NA,1983,"PRESERVED_SPECIMEN","GEODETIC_DATUM_ASSUMED_WGS84;CONTINENT_DERIVED_FROM_COORDINATES;INSTITUTION_MATCH_FUZZY;COLLECTION_MATCH_FUZZY"
37.8,-6.8,"Lomariopsis warneckei",925149053,"T6, Morogoro Reg; Uluguru Mts, Maunga Valley above Mzinga Village; W slopes of Bondwa-Luhunga Ridge.","TZA",NA,1970,"PRESERVED_SPECIMEN","GEODETIC_DATUM_ASSUMED_WGS84;CONTINENT_DERIVED_FROM_COORDINATES;INSTITUTION_MATCH_FUZZY;COLLECTION_MATCH_FUZZY"
37.67,-6.88,"Lomariopsis warneckei",925149071,"T6, Morogoro Reg; Uluguru Mts, Mwere Valley.","TZA",NA,1970,"PRESERVED_SPECIMEN","GEODETIC_DATUM_ASSUMED_WGS84;CONTINENT_DERIVED_FROM_COORDINATES;INSTITUTION_MATCH_FUZZY;COLLECTION_MATCH_FUZZY"
38.67,-3.83,"Lomariopsis warneckei",925149170,"K7, Taita Dist; Mt Kasigau, S side above Bungule.","KEN",NA,1970,"PRESERVED_SPECIMEN","GEODETIC_DATUM_ASSUMED_WGS84;CONTINENT_DERIVED_FROM_COORDINATES;INSTITUTION_MATCH_FUZZY;COLLECTION_MATCH_FUZZY"
29.75,-0.87,"Lomariopsis warneckei",925149189,"U2, Kigezi Dist; Kinkizi County. 7km S of Kirima along Ishasha River. GR RJ-02-99","UGA",NA,1969,"PRESERVED_SPECIMEN","GEODETIC_DATUM_ASSUMED_WGS84;CONTINENT_DERIVED_FROM_COORDINATES;INSTITUTION_MATCH_FUZZY;COLLECTION_MATCH_FUZZY"
35.45,-15.12,"Lomariopsis warneckei",912107665,"S. Region, Liwonde Hills: Chikala Hill Forest. [MAL-S].","MWI",NA,1983,"PRESERVED_SPECIMEN","GEODETIC_DATUM_ASSUMED_WGS84;CONTINENT_DERIVED_FROM_COORDINATES;INSTITUTION_MATCH_FUZZY;COLLECTION_MATCH_FUZZY"
36.85,-7.8,"Lomariopsis warneckei",912107674,"Uzungwa ountain NP Sonjo-Mwanihana Route. T7.","TZA",NA,1997,"PRESERVED_SPECIMEN","GEODETIC_DATUM_ASSUMED_WGS84;CONTINENT_DERIVED_FROM_COORDINATES;INSTITUTION_MATCH_FUZZY;COLLECTION_MATCH_FUZZY"
38.62,-4.7,"Lomariopsis warneckei",925149090,"T3, Tanga Reg; Muheza Dist, E Usambara Mts, Lutindi For Res, Nilo peak area.","TZA",NA,1987,"PRESERVED_SPECIMEN","GEODETIC_DATUM_ASSUMED_WGS84;CONTINENT_DERIVED_FROM_COORDINATES;INSTITUTION_MATCH_FUZZY;COLLECTION_MATCH_FUZZY"
33.85,-11.85,"Lomariopsis warneckei",912107620,"N. Region, South Viphya, Chamambo Forest. [MAL-N].","MWI",NA,1982,"PRESERVED_SPECIMEN","GEODETIC_DATUM_ASSUMED_WGS84;CONTINENT_DERIVED_FROM_COORDINATES;INSTITUTION_MATCH_FUZZY;COLLECTION_MATCH_FUZZY"
37.45,-0.35,"Lomariopsis warneckei",912107657,"Embu District. Mt. Kenya, S.E. Irangi Forest Station. [K4].","KEN",NA,1972,"PRESERVED_SPECIMEN","GEODETIC_DATUM_ASSUMED_WGS84;CONTINENT_DERIVED_FROM_COORDINATES;INSTITUTION_MATCH_FUZZY;COLLECTION_MATCH_FUZZY"
30.22,-0.35,"Lomariopsis warneckei",925149195,"Kasyoha-Kitomi For Res, NE of Kyambura.","UGA",NA,1994,"PRESERVED_SPECIMEN","GEODETIC_DATUM_ASSUMED_WGS84;CONTINENT_DERIVED_FROM_COORDINATES;INSTITUTION_MATCH_FUZZY;COLLECTION_MATCH_FUZZY"
37.980556,-4.303333,"Lomariopsis warneckei",2859016354,"South Pare Mountains, Chome Forest Reserve (Shengena Forest), E side of Reserve above Gonja","TZA",NA,1999,"PRESERVED_SPECIMEN","COORDINATE_ROUNDED;GEODETIC_DATUM_ASSUMED_WGS84;CONTINENT_DERIVED_FROM_COORDINATES;INSTITUTION_MATCH_FUZZY;INSTITUTION_COLLECTION_MISMATCH"
38.333333,-3.366667,"Lomariopsis warneckei",2516115159,"K7, Taita-Taveta District. Nganao Forest.","KEN",NA,1985,"PRESERVED_SPECIMEN","INSTITUTION_MATCH_FUZZY;INSTITUTION_COLLECTION_MISMATCH"
49.159444,-12.596667,"Lomariopsis warneckei",4061771771,"Montagne d'Ambre, grand Lac, piste menant au sommet d'Ambre. Forêt dense humide sempervirente primaire un peu perturbée.","MDG",NA,2004,"PRESERVED_SPECIMEN","OCCURRENCE_STATUS_INFERRED_FROM_INDIVIDUAL_COUNT;COORDINATE_ROUNDED;GEODETIC_DATUM_ASSUMED_WGS84;DIFFERENT_OWNER_INSTITUTION"
34.5257,0.0231,"Lomariopsis warneckei",1257707160,"K5. Yala nature reserve next toYala river.","KEN",NA,2008,"PRESERVED_SPECIMEN","OCCURRENCE_STATUS_INFERRED_FROM_INDIVIDUAL_COUNT;GEODETIC_DATUM_ASSUMED_WGS84;DIFFERENT_OWNER_INSTITUTION"
46.766667,-24.631944,"Lomariopsis warneckei",2521339525,"Tolanaro (fort dauphin), parcelle 1, R.N.I. n° 11 d'Andohahela, versant Est et sommet du Trafon'omby : 8 km au NW du village d'Eminiminy Andohahela AP. Forêt dense humide sempervirente. Bord d'un torrent.","MDG",NA,1995,"PRESERVED_SPECIMEN","OCCURRENCE_STATUS_INFERRED_FROM_INDIVIDUAL_COUNT;COORDINATE_ROUNDED;GEODETIC_DATUM_ASSUMED_WGS84;DIFFERENT_OWNER_INSTITUTION"
47.346667,-21.776667,"Lomariopsis warneckei",2521340145,"Forêt de Vinanitelo au pied de la montagne d'Ambodivohitra, à 15,5 km au sud-est du village de Vohitrafeno. Forêt dense humide sempervirente.","MDG",NA,2000,"PRESERVED_SPECIMEN","OCCURRENCE_STATUS_INFERRED_FROM_INDIVIDUAL_COUNT;COORDINATE_ROUNDED;GEODETIC_DATUM_ASSUMED_WGS84;DIFFERENT_OWNER_INSTITUTION"
38.45,-3.32,"Lomariopsis warneckei",1675775847,"Kenya K7, Taita-Taveta District, Taita Hills, Mbololo Forest.","KEN",NA,1985,"PRESERVED_SPECIMEN","GEODETIC_DATUM_ASSUMED_WGS84"
10.038889,1.603611,"Lomariopsis warneckei",1936560826,"Centro Sur: Parque Nacional de Monte Alen, cataratas del río Wele, Mosumu","GNQ",NA,1999,"PRESERVED_SPECIMEN","COORDINATE_ROUNDED;GEODETIC_DATUM_ASSUMED_WGS84;CONTINENT_DERIVED_FROM_COORDINATES;INSTITUTION_MATCH_FUZZY;COLLECTION_MATCH_FUZZY"
37.42,-3.25,"Lomariopsis warneckei",1563160631,"Mt. Kilimanjaro","TZA",NA,2012,"HUMAN_OBSERVATION","GEODETIC_DATUM_ASSUMED_WGS84;CONTINENT_DERIVED_FROM_COORDINATES"
49.166667,-12.533333,"Lomariopsis warneckei",2521339593,"Parc National de la Montagne d'Ambre, Forêt d'Ambre, versant ouest.","MDG",NA,1992,"PRESERVED_SPECIMEN","OCCURRENCE_STATUS_INFERRED_FROM_INDIVIDUAL_COUNT;COORDINATE_ROUNDED;GEODETIC_DATUM_ASSUMED_WGS84;DIFFERENT_OWNER_INSTITUTION"
34.87,0.18,"Lomariopsis warneckei",925149172,"K5, Kakamega Dist; Kakamega Forest, Kibiri Block S side of Yala River.","KEN",NA,1970,"PRESERVED_SPECIMEN","GEODETIC_DATUM_ASSUMED_WGS84;CONTINENT_DERIVED_FROM_COORDINATES;INSTITUTION_MATCH_FUZZY;COLLECTION_MATCH_FUZZY"
36.4,-16.28,"Lomariopsis warneckei",912493993,"Mt Mabu.","MOZ",NA,2008,"PRESERVED_SPECIMEN","GEODETIC_DATUM_ASSUMED_WGS84;CONTINENT_DERIVED_FROM_COORDINATES;INSTITUTION_MATCH_FUZZY;COLLECTION_MATCH_FUZZY"
34.12,-10.87,"Lomariopsis warneckei",912107569,"N. Region, North Viphya, Uzumara Forest. [MAL-N].","MWI",NA,1983,"PRESERVED_SPECIMEN","GEODETIC_DATUM_ASSUMED_WGS84;CONTINENT_DERIVED_FROM_COORDINATES;INSTITUTION_MATCH_FUZZY;COLLECTION_MATCH_FUZZY"
36.83,-7.75,"Lomariopsis warneckei",925149178,"T7, Udzundwa Mt Nat Pk.;","TZA",NA,2001,"PRESERVED_SPECIMEN","GEODETIC_DATUM_ASSUMED_WGS84;CONTINENT_DERIVED_FROM_COORDINATES;INSTITUTION_MATCH_FUZZY;COLLECTION_MATCH_FUZZY"
35.05,-16.07,"Lomariopsis warneckei",912107597,"S. Region, Thyolo (Cholo) Mt Forest. [MAL-S].","MWI",NA,1983,"PRESERVED_SPECIMEN","GEODETIC_DATUM_ASSUMED_WGS84;CONTINENT_DERIVED_FROM_COORDINATES;INSTITUTION_MATCH_FUZZY;COLLECTION_MATCH_FUZZY"
33.15,-19.02,"Lomariopsis warneckei",912107571,"Manica e Sofala, Garuso, Jaegersberg, Bandula Mtn. [MAL-MS].","MOZ",NA,1955,"PRESERVED_SPECIMEN","GEODETIC_DATUM_ASSUMED_WGS84;CONTINENT_DERIVED_FROM_COORDINATES;INSTITUTION_MATCH_FUZZY;COLLECTION_MATCH_FUZZY"
32.7,-20.43,"Lomariopsis warneckei",912107681,"Chipinga District. Chirinda Forest, near the road leading to the brickfield. [ZIM-E].","ZWE",NA,1970,"PRESERVED_SPECIMEN","GEODETIC_DATUM_ASSUMED_WGS84;CONTINENT_DERIVED_FROM_COORDINATES;INSTITUTION_MATCH_FUZZY;COLLECTION_MATCH_FUZZY"
37.67,-7.17,"Lomariopsis warneckei",925149098,"T6, Morogoro Dist.; Uluguru Mts, Morningside to Bondwa, along road.","TZA",NA,1970,"PRESERVED_SPECIMEN","GEODETIC_DATUM_ASSUMED_WGS84;CONTINENT_DERIVED_FROM_COORDINATES;INSTITUTION_MATCH_FUZZY;COLLECTION_MATCH_FUZZY"
45.15833,-12.875,"Lomariopsis warneckei",438244118,"Massifs de Bénara et de Bépilipili","MYT",NA,2002,"PRESERVED_SPECIMEN","GEODETIC_DATUM_ASSUMED_WGS84;CONTINENT_DERIVED_FROM_COORDINATES;COLLECTION_MATCH_FUZZY"
34.0523,-18.464216,"Lomariopsis warneckei",1839424435,"Mt Gorongosa, Mozambique","MOZ",30,2007,"PRESERVED_SPECIMEN","GEODETIC_DATUM_ASSUMED_WGS84;CONTINENT_DERIVED_FROM_COORDINATES;INSTITUTION_MATCH_FUZZY;COLLECTION_MATCH_FUZZY"
9.74935,1.83104,"Lomariopsis warneckei",2515979580,"Bata - Bome.","GNQ",NA,1993,"PRESERVED_SPECIMEN","INSTITUTION_MATCH_FUZZY;INSTITUTION_COLLECTION_MISMATCH"
48.29611,-18.83972,"Lomariopsis warneckei",1587341201,"","MDG",NA,2015,"PRESERVED_SPECIMEN","GEODETIC_DATUM_ASSUMED_WGS84;CONTINENT_DERIVED_FROM_COORDINATES;COLLECTION_MATCH_FUZZY"
