"lon","lat","species","gbifID","locality","countryCode","coordinateUncertaintyInMeters","year","basisOfRecord","issue"
-68.68625,-14.54725,"Luetzelburgia andina",4061472677,"Área Natural de Manejo Integrado Madidi.NW de Apolo","BOL",NA,2005,"PRESERVED_SPECIMEN","OCCURRENCE_STATUS_INFERRED_FROM_INDIVIDUAL_COUNT;GEODETIC_DATUM_ASSUMED_WGS84;DIFFERENT_OWNER_INSTITUTION"
-68.550278,-14.350167,"Luetzelburgia andina",4062040335,"Área Natural de Manejo Integrado Madidi, Azariamas al Norte de Apolo.","BOL",NA,2005,"PRESERVED_SPECIMEN","OCCURRENCE_STATUS_INFERRED_FROM_INDIVIDUAL_COUNT;COORDINATE_ROUNDED;GEODETIC_DATUM_ASSUMED_WGS84;DIFFERENT_OWNER_INSTITUTION"
-68.519167,-14.317222,"Luetzelburgia andina",4031684287,"Area Natural de Manejo Integrado Madidi, Azariamas, arroyo Huanechaquimayu. Bosque de yungas subandino pluviestacional con Phyllostylon rhamnoides y Capparis polyantha. Terraza antigua. Parcela temporal de muestreo #20. Plantas NO alcoholizadas.","BOL",NA,2005,"PRESERVED_SPECIMEN","OCCURRENCE_STATUS_INFERRED_FROM_INDIVIDUAL_COUNT;COORDINATE_ROUNDED;GEODETIC_DATUM_ASSUMED_WGS84;INSTITUTION_MATCH_FUZZY;COLLECTION_MATCH_NONE"
-75.612278,5.726444,"Luetzelburgia andina",1052765571,"Bosque al interior de la Finca Montenegro. Entre el cerro la Paz ( El Farallón) y la carretera que comunica a La Pintada con el municipio de Támesis. Parcela 3 y 4.","COL",NA,2014,"HUMAN_OBSERVATION","COORDINATE_ROUNDED"
-64.092778,-18.969167,"Luetzelburgia andina",1257746797,"Entre la comunidad Pampillas y Alto Seco.","BOL",NA,2011,"PRESERVED_SPECIMEN","OCCURRENCE_STATUS_INFERRED_FROM_INDIVIDUAL_COUNT;COORDINATE_ROUNDED;GEODETIC_DATUM_ASSUMED_WGS84;DIFFERENT_OWNER_INSTITUTION"
-75.886556,5.912333,"Luetzelburgia andina",1707498751,"Margen derecha de la quebrada El Guineo","COL",NA,2014,"PRESERVED_SPECIMEN","COORDINATE_ROUNDED;GEODETIC_DATUM_ASSUMED_WGS84;INSTITUTION_MATCH_NONE"
