"lon","lat","species","gbifID","locality","countryCode","coordinateUncertaintyInMeters","year","basisOfRecord","issue"
-77.431969,-9.333303,"Lupinus weberbaueri",3070283698,"","PER",28,2019,"HUMAN_OBSERVATION","COORDINATE_ROUNDED;CONTINENT_DERIVED_FROM_COORDINATES"
-77.45,-9.45,"Lupinus weberbaueri",1261541664,"Huascar치n National Park. Quebrada Llaca, N side of lake Grassy bottoms and slopes with scattered Polylepis weberbauerii trees.","PER",NA,1985,"PRESERVED_SPECIMEN","OCCURRENCE_STATUS_INFERRED_FROM_INDIVIDUAL_COUNT;GEODETIC_DATUM_ASSUMED_WGS84;INSTITUTION_MATCH_FUZZY;COLLECTION_MATCH_NONE"
-77.602859,-9.014153,"Lupinus weberbaueri",4046367623,"","PER",NA,2017,"HUMAN_OBSERVATION","COORDINATE_ROUNDED;CONTINENT_DERIVED_FROM_COORDINATES"
-78.0425,-7.901944,"Lupinus weberbaueri",1257646214,"Dist. Huamachuco, communidad Campesino Juan Velasco Alvarado-Yamobamba, caserio de la Florida, sector Huaylillas, around Lagunas Negra and Verdes.","PER",NA,2009,"PRESERVED_SPECIMEN","OCCURRENCE_STATUS_INFERRED_FROM_INDIVIDUAL_COUNT;COORDINATE_ROUNDED;GEODETIC_DATUM_ASSUMED_WGS84;INSTITUTION_MATCH_FUZZY;COLLECTION_MATCH_NONE"
-77.38333,-9.5,"Lupinus weberbaueri",1261544625,"Huascar치n National Park. Quebrada Shallap. Overgrazed bottom, grassland with some shrubs.","PER",NA,1985,"PRESERVED_SPECIMEN","OCCURRENCE_STATUS_INFERRED_FROM_INDIVIDUAL_COUNT;GEODETIC_DATUM_ASSUMED_WGS84;INSTITUTION_MATCH_FUZZY;COLLECTION_MATCH_NONE"
-77.68333,-8.88333,"Lupinus weberbaueri",1261545253,"Huascar치n National Park. Quebrada Alpamayo at foot of snow- free peak above Lago Jancarurish. Grassy slopes and bottoms on morainal material. Parts appear pear to be frequently burned.","PER",NA,1985,"PRESERVED_SPECIMEN","OCCURRENCE_STATUS_INFERRED_FROM_INDIVIDUAL_COUNT;GEODETIC_DATUM_ASSUMED_WGS84;INSTITUTION_MATCH_FUZZY;COLLECTION_MATCH_NONE"
-77.28333,-9.38333,"Lupinus weberbaueri",1261543060,"Huascar치n National Park. Upper terrace, Quebrada Pachachaca a lateral valley of Quebrada Rurichinchay Bogs, streamsides, and grassland in bottom, Lupinus shrubland, and Polylepis weberbauerii on slopes.","PER",NA,1986,"PRESERVED_SPECIMEN","OCCURRENCE_STATUS_INFERRED_FROM_INDIVIDUAL_COUNT;GEODETIC_DATUM_ASSUMED_WGS84;INSTITUTION_MATCH_FUZZY;COLLECTION_MATCH_NONE"
-77.58,-9.17,"Lupinus weberbaueri",3398714577,"","PER",2141,2007,"HUMAN_OBSERVATION","CONTINENT_DERIVED_FROM_COORDINATES"
