"lon","lat","species","gbifID","locality","countryCode","coordinateUncertaintyInMeters","year","basisOfRecord","issue"
-61.0667,5.81667,"Macrolobium bifolium",1456293672,"Paruima, vic.; along Kamarang & Paruima Rivers","GUY",NA,1996,"PRESERVED_SPECIMEN","GEODETIC_DATUM_ASSUMED_WGS84"
-58.5833,6.41667,"Macrolobium bifolium",1455995975,"Essequibo River, E bank, upstream 2-4 km from Bartica, island shore and mainland","GUY",NA,1993,"PRESERVED_SPECIMEN","GEODETIC_DATUM_ASSUMED_WGS84"
-51.65,3.3,"Macrolobium bifolium",2998216664,"BR156, road between Calçoene and Oiapoque, 60 km SSE of Oiapoque.","BRA",NA,1984,"PRESERVED_SPECIMEN","RECORDED_DATE_INVALID;GEODETIC_DATUM_ASSUMED_WGS84;CONTINENT_DERIVED_FROM_COORDINATES;INSTITUTION_MATCH_FUZZY;COLLECTION_MATCH_FUZZY"
-49.933333,-0.95,"Macrolobium bifolium",2998221326,"Rio Mocoões. 2km up river from Anajás.","BRA",NA,1987,"PRESERVED_SPECIMEN","COORDINATE_ROUNDED;GEODETIC_DATUM_ASSUMED_WGS84;CONTINENT_DERIVED_FROM_COORDINATES;INSTITUTION_MATCH_FUZZY;COLLECTION_MATCH_FUZZY"
-60,-1.033333,"Macrolobium bifolium",2998212481,"Canteiro de obras da Hidrelétrica de Balbina, a montante da barragem, Linha D-01 margem dir. do rio Uatumã.","BRA",NA,1986,"PRESERVED_SPECIMEN","RECORDED_DATE_INVALID;COORDINATE_ROUNDED;GEODETIC_DATUM_ASSUMED_WGS84;CONTINENT_DERIVED_FROM_COORDINATES;INSTITUTION_MATCH_FUZZY;COLLECTION_MATCH_FUZZY"
-60.366667,5.133333,"Macrolobium bifolium",2998185014,"Vicinity of the Ingaricó Indian village of Manalai on the Rio Panari.","BRA",NA,1994,"PRESERVED_SPECIMEN","RECORDED_DATE_INVALID;COORDINATE_ROUNDED;GEODETIC_DATUM_ASSUMED_WGS84;CONTINENT_DERIVED_FROM_COORDINATES;INSTITUTION_MATCH_FUZZY;COLLECTION_MATCH_FUZZY"
-63.333333,-8.816667,"Macrolobium bifolium",2998485204,"Represa Samuel: along igarapé Japím, ca. 2 hours upstream from dam by boat.","BRA",NA,1986,"PRESERVED_SPECIMEN","COORDINATE_ROUNDED;GEODETIC_DATUM_ASSUMED_WGS84;CONTINENT_DERIVED_FROM_COORDINATES;INSTITUTION_MATCH_FUZZY;COLLECTION_MATCH_FUZZY"
-51.816667,3.75,"Macrolobium bifolium",2998491996,"Road between Calçoene and Oiapoque (BR156) 7Km SSE of Oiapoque.","BRA",NA,1984,"PRESERVED_SPECIMEN","RECORDED_DATE_INVALID;COORDINATE_ROUNDED;GEODETIC_DATUM_ASSUMED_WGS84;CONTINENT_DERIVED_FROM_COORDINATES;INSTITUTION_MATCH_FUZZY;COLLECTION_MATCH_FUZZY"
-59.4833,5.16667,"Macrolobium bifolium",1456473171,"Kaieteur Falls National Park; along river above falls","GUY",NA,1988,"PRESERVED_SPECIMEN","GEODETIC_DATUM_ASSUMED_WGS84"
-52.93,4.63,"Macrolobium bifolium",1456272624,"Saut Mouches, Bassin du Sinnamary; le long de la rive gauche","GUF",NA,1989,"PRESERVED_SPECIMEN","GEODETIC_DATUM_ASSUMED_WGS84"
-58.6667,4.66667,"Macrolobium bifolium",1456207797,"Fairview Landing E bank of Essequibo River, near end of Mabura road","GUY",NA,1990,"PRESERVED_SPECIMEN","GEODETIC_DATUM_ASSUMED_WGS84"
-59.8092,4.66333,"Macrolobium bifolium",1456445120,"Northern Pakaraimas; Kato Village, Koa Valley, Koa River","GUY",NA,1995,"PRESERVED_SPECIMEN","GEODETIC_DATUM_ASSUMED_WGS84"
-65.5,3.71666,"Macrolobium bifolium",1258293818,"ATABAPO Cerro Marahuaca. Slopes. Sima area. Medium height forest.","VEN",NA,1988,"PRESERVED_SPECIMEN","OCCURRENCE_STATUS_INFERRED_FROM_INDIVIDUAL_COUNT;GEODETIC_DATUM_ASSUMED_WGS84;INSTITUTION_MATCH_FUZZY;COLLECTION_MATCH_NONE"
-61.16666,9.33333,"Macrolobium bifolium",1260654349,"Floodplain, Tarasona channel tidally influenced affluent of the Winikina River, left bank, north of the village of Morichito.","VEN",NA,1997,"PRESERVED_SPECIMEN","GEODETIC_DATUM_ASSUMED_WGS84;INSTITUTION_MATCH_FUZZY;COLLECTION_MATCH_NONE"
-64.15,4.26666,"Macrolobium bifolium",1260651991,"Expedición Proyecto. I.R.N.R.S. a la cuenca alto del Río Caura (Hoja NB-20-14). Convenio UNELLEZ-C.V.G. (Tecmin, C.A.), Unidad de Vegetación. Selvas ribereñas del Caño El Pavo hasta arriba de la boca del Caño Marevene.","VEN",NA,1988,"PRESERVED_SPECIMEN","GEODETIC_DATUM_ASSUMED_WGS84;INSTITUTION_MATCH_FUZZY;COLLECTION_MATCH_NONE"
-73.58333,-3.91666,"Macrolobium bifolium",1258311226,"Estacion Biológica Callicebus Rio Nanay-Mishana. Bosque primario, suelos de arena blanca.","PER",NA,1982,"PRESERVED_SPECIMEN","OCCURRENCE_STATUS_INFERRED_FROM_INDIVIDUAL_COUNT;GEODETIC_DATUM_ASSUMED_WGS84;INSTITUTION_MATCH_FUZZY;COLLECTION_MATCH_NONE"
-61.1,9.16666,"Macrolobium bifolium",1260652329,"Depto. Antonio Díaz: riverine forest with varied tree growth of 15-30 meters tall, along Caño Araguabisi, 2-3 km. above mouth.","VEN",NA,1977,"PRESERVED_SPECIMEN","GEODETIC_DATUM_ASSUMED_WGS84;INSTITUTION_MATCH_FUZZY;COLLECTION_MATCH_NONE"
-54.75,2.51666,"Macrolobium bifolium",1260750920,"Haut Litany - Bassin du Litany. Forêt ripicole primaire. Rives du Litany, en amont du camp.","SUR",NA,1993,"PRESERVED_SPECIMEN","GEODETIC_DATUM_ASSUMED_WGS84;INSTITUTION_MATCH_FUZZY;COLLECTION_MATCH_NONE"
-70.3,-3.8,"Macrolobium bifolium",1258322744,"Parque Nacional Amacayacu, near Tikuna Village of Mocagua. Non-inundated forest.","COL",NA,1988,"PRESERVED_SPECIMEN","OCCURRENCE_STATUS_INFERRED_FROM_INDIVIDUAL_COUNT;GEODETIC_DATUM_ASSUMED_WGS84;INSTITUTION_MATCH_FUZZY;COLLECTION_MATCH_NONE"
-55.867051,-1.7689043,"Macrolobium bifolium",1930731992,"Rio Mapuera, Campina das Três Ilhas.","BRA",NA,1987,"PRESERVED_SPECIMEN","COORDINATE_REPROJECTED;COLLECTION_MATCH_FUZZY"
-52.57,3.98,"Macrolobium bifolium",1931033724,"Camp Arataï on Arataye River, a short distance from the mouth of the Arataye River at junction with the Approuague River. Sentier Botanique.","GUF",NA,2003,"PRESERVED_SPECIMEN","GEODETIC_DATUM_ASSUMED_WGS84;COLLECTION_MATCH_FUZZY"
-58.55069,2.24531,"Macrolobium bifolium",1931036205,"Kuyuwini River.","GUY",NA,2004,"PRESERVED_SPECIMEN","GEODETIC_DATUM_ASSUMED_WGS84;COLLECTION_MATCH_FUZZY"
-73.63323,-4.90308,"Macrolobium bifolium",3762888445,"Jenaro Herrera 2; JH2","PER",NA,2009,"PRESERVED_SPECIMEN","GEODETIC_DATUM_ASSUMED_WGS84;CONTINENT_DERIVED_FROM_COORDINATES;INSTITUTION_MATCH_FUZZY;INSTITUTION_COLLECTION_MISMATCH"
-73.42672,-3.95433,"Macrolobium bifolium",3762896772,"Allpahuayo; ALP-30","PER",NA,2011,"PRESERVED_SPECIMEN","GEODETIC_DATUM_ASSUMED_WGS84;CONTINENT_DERIVED_FROM_COORDINATES;INSTITUTION_MATCH_FUZZY;INSTITUTION_COLLECTION_MISMATCH"
-74.899644,-3.412936,"Macrolobium bifolium",3762872897,"Intuto","PER",NA,2015,"PRESERVED_SPECIMEN","COORDINATE_ROUNDED;GEODETIC_DATUM_ASSUMED_WGS84;CONTINENT_DERIVED_FROM_COORDINATES;INSTITUTION_MATCH_FUZZY;INSTITUTION_COLLECTION_MISMATCH"
-57.45,2.7399,"Macrolobium bifolium",1042527027,"E. Berbice-Corentyne Region : Canje River between Baracara and Ikuruwa.","GUY",NA,1989,"PRESERVED_SPECIMEN","GEODETIC_DATUM_ASSUMED_WGS84;GEODETIC_DATUM_INVALID;INSTITUTION_MATCH_NONE"
-60.37,-5.133333,"Macrolobium bifolium",1042568708,"Vicinity of the Ingaricó Indian village of Manalai on the Rio Panari","BRA",NA,1994,"PRESERVED_SPECIMEN","GEODETIC_DATUM_ASSUMED_WGS84;GEODETIC_DATUM_INVALID;INSTITUTION_MATCH_NONE"
-64.12,-12.3,"Macrolobium bifolium",1042699524,"São Domingos a +/- 3 Km da cidade, margem direita do Rio Guaporé.","BRA",NA,1987,"PRESERVED_SPECIMEN","GEODETIC_DATUM_ASSUMED_WGS84;GEODETIC_DATUM_INVALID;INSTITUTION_MATCH_NONE"
-62.04,1.110556,"Macrolobium bifolium",1042478602,"Dunas de areia (Dunas do Flamarion) situadas próximas do Igarapé Preto (Igarapé Água Branca pelo mapa do IBGE), um dos afluentes do Rio Capivara, que por sua vez deságua no Rio Água Boa do Univini. Dunas de areia situadas em ambientes de campina com","BRA",NA,2005,"PRESERVED_SPECIMEN","GEODETIC_DATUM_ASSUMED_WGS84;GEODETIC_DATUM_INVALID;INSTITUTION_MATCH_NONE"
-67.25,0.833333,"Macrolobium bifolium",1042634708,"Carapanã, margem do rio Negro acima de S.Gabriel.","BRA",NA,1987,"PRESERVED_SPECIMEN","GEODETIC_DATUM_ASSUMED_WGS84;GEODETIC_DATUM_INVALID;INSTITUTION_MATCH_NONE"
-49.65,-3.75,"Macrolobium bifolium",1042592193,"16 Km. east of Reprêsa Tucuruí (Rio Tocantins) along new road (PA-263).","BRA",NA,1980,"PRESERVED_SPECIMEN","GEODETIC_DATUM_ASSUMED_WGS84;GEODETIC_DATUM_INVALID;ELEVATION_MIN_MAX_SWAPPED;INSTITUTION_MATCH_NONE"
-67.53,0.818056,"Macrolobium bifolium",1042675788,"Rio Içana, Comunidade Assunção, 3 km abaixo da comunidade, transição Igapó e Terra firme.","BRA",NA,2008,"PRESERVED_SPECIMEN","GEODETIC_DATUM_ASSUMED_WGS84;GEODETIC_DATUM_INVALID;INSTITUTION_MATCH_NONE"
-67.17,-0.083333,"Macrolobium bifolium",1042593568,"São Gabriel da Cachoeira., Between Manaus and São Gabriel . NW of São Gabriel, near mouth of the Rio Uaupes.","BRA",NA,1979,"PRESERVED_SPECIMEN","GEODETIC_DATUM_ASSUMED_WGS84;GEODETIC_DATUM_INVALID;INSTITUTION_MATCH_NONE"
-59.28,2.0094,"Macrolobium bifolium",1042685674,"","GUY",NA,2010,"PRESERVED_SPECIMEN","GEODETIC_DATUM_ASSUMED_WGS84;GEODETIC_DATUM_INVALID;ELEVATION_MIN_MAX_SWAPPED;INSTITUTION_MATCH_NONE"
-66.83,0.154314,"Macrolobium bifolium",1042634852,"Cucuí, Igarapé Bonte.","BRA",NA,1987,"PRESERVED_SPECIMEN","GEODETIC_DATUM_ASSUMED_WGS84;GEODETIC_DATUM_INVALID;INSTITUTION_MATCH_NONE"
-61.85,-1.000163,"Macrolobium bifolium",1042685281,"Reserva Popular Xixuaú-Xiparina, Acampamento no Rio Xipariná","BRA",NA,2010,"PRESERVED_SPECIMEN","GEODETIC_DATUM_ASSUMED_WGS84;GEODETIC_DATUM_INVALID;ELEVATION_MIN_MAX_SWAPPED;INSTITUTION_MATCH_NONE"
-60.25,6.15,"Macrolobium bifolium",1936438529,"Region: Cuyuni-Mazaruni. Pakaraima Mts. Kurupung R Takuba Creek, near Kurupung Landing","GUY",NA,1992,"PRESERVED_SPECIMEN","GEODETIC_DATUM_ASSUMED_WGS84;CONTINENT_DERIVED_FROM_COORDINATES;INSTITUTION_MATCH_FUZZY;COLLECTION_MATCH_FUZZY"
-54.920295,5.270603,"Macrolobium bifolium",2515846376,"70 km SE of Paramaribo, after a creek turned to the right","SUR",NA,1995,"PRESERVED_SPECIMEN","INSTITUTION_MATCH_FUZZY;INSTITUTION_COLLECTION_MISMATCH"
-56.777778,-9.356667,"Macrolobium bifolium",2027495854,"Afloramento Rochoso.","BRA",NA,2012,"PRESERVED_SPECIMEN","GEODETIC_DATUM_ASSUMED_WGS84;CONTINENT_DERIVED_FROM_COORDINATES;INSTITUTION_MATCH_NONE"
-73.097778,-4.001944,"Macrolobium bifolium",1665151327,"Tamshiyacu","PER",NA,2012,"PRESERVED_SPECIMEN","GEODETIC_DATUM_ASSUMED_WGS84;CONTINENT_DERIVED_FROM_COORDINATES;INSTITUTION_MATCH_FUZZY;COLLECTION_MATCH_FUZZY"
-76.261111,-6.247778,"Macrolobium bifolium",1665151317,"Davicillo, along road with oil palm plantations. 20 minutes from Pongo de Cainarachi town.","PER",NA,2012,"PRESERVED_SPECIMEN","GEODETIC_DATUM_ASSUMED_WGS84;CONTINENT_DERIVED_FROM_COORDINATES;INSTITUTION_MATCH_FUZZY;COLLECTION_MATCH_FUZZY"
-48.754722,-2.186944,"Macrolobium bifolium",2858869498,"Vila Lírios do Vale.","BRA",NA,2016,"PRESERVED_SPECIMEN","OCCURRENCE_STATUS_INFERRED_FROM_INDIVIDUAL_COUNT;COORDINATE_ROUNDED;GEODETIC_DATUM_ASSUMED_WGS84;CONTINENT_DERIVED_FROM_COORDINATES;INSTITUTION_MATCH_NONE"
-60.696111,-11.965,"Macrolobium bifolium",1944854438,"Campo Fitogeografia. UHE Rondon II.","BRA",NA,2015,"PRESERVED_SPECIMEN","OCCURRENCE_STATUS_INFERRED_FROM_INDIVIDUAL_COUNT;GEODETIC_DATUM_ASSUMED_WGS84;CONTINENT_DERIVED_FROM_COORDINATES;INSTITUTION_MATCH_NONE"
-64.389166,-9.256389,"Macrolobium bifolium",1095256024,"Margem esquerda do rio Jaci Paraná.","BRA",NA,2011,"PRESERVED_SPECIMEN","OCCURRENCE_STATUS_INFERRED_FROM_INDIVIDUAL_COUNT;COORDINATE_ROUNDED;GEODETIC_DATUM_ASSUMED_WGS84;CONTINENT_DERIVED_FROM_COORDINATES;INSTITUTION_MATCH_NONE"
-64.848611,-9.364722,"Macrolobium bifolium",1095257206,"Várzea do igarapé São Lourenço.","BRA",NA,2012,"PRESERVED_SPECIMEN","OCCURRENCE_STATUS_INFERRED_FROM_INDIVIDUAL_COUNT;COORDINATE_ROUNDED;GEODETIC_DATUM_ASSUMED_WGS84;CONTINENT_DERIVED_FROM_COORDINATES;INSTITUTION_MATCH_NONE"
-49.639546,-1.612315,"Macrolobium bifolium",1929645057,"Ilha do Marajó, Sitio Campina on river Pracuuba-mirím, ca. 1 hour by boat upstream from São Sebastião de Boa Vista","BRA",NA,1984,"PRESERVED_SPECIMEN","COORDINATE_ROUNDED;COLLECTION_MATCH_FUZZY"
-49.6730661,-3.7695206,"Macrolobium bifolium",1929461727,"Campina de Santa Rosa","BRA",NA,1983,"PRESERVED_SPECIMEN","COORDINATE_REPROJECTED;COLLECTION_MATCH_FUZZY"
-46.537506,-1.765546,"Macrolobium bifolium",1931153739,"Road BR 22, Capanema to Maranhão. Vicinity of Cachoeira, km. 96.","BRA",NA,1965,"PRESERVED_SPECIMEN","COLLECTION_MATCH_FUZZY"
-52.360994,-3.344622,"Macrolobium bifolium",1077586095,"Estação Experimental da Embrapa.","BRA",NA,1978,"PRESERVED_SPECIMEN","GEODETIC_DATUM_ASSUMED_WGS84;CONTINENT_DERIVED_FROM_COORDINATES;DIFFERENT_OWNER_INSTITUTION"
-60.6717,6.08131,"Macrolobium bifolium",1456047051,"Pakaraima Mts., Mazaruni River. W bank at Surwakwima Falls. W. of Base Camp 6","GUY",NA,2004,"PRESERVED_SPECIMEN","GEODETIC_DATUM_ASSUMED_WGS84"
-58.3667,6.56667,"Macrolobium bifolium",1456108837,"Arawak Amerindian land, 2 km up Pokerero River above junction with Warakabra River","GUY",NA,1992,"PRESERVED_SPECIMEN","GEODETIC_DATUM_ASSUMED_WGS84"
-54.0696,5.43494,"Macrolobium bifolium",1456335457,"Maroni River near St. Larent.","GUF",NA,2007,"PRESERVED_SPECIMEN","GEODETIC_DATUM_ASSUMED_WGS84"
-70.31666,-3.2,"Macrolobium bifolium",1261476805,"Municipio de Leticia; Corregimiento de Tarapacá; Parque Nacional Natural Amacayacu; Cabaña Pamaté (extremo nor-occidental del parque); Caño Pamaté; a orillas del caño.","COL",NA,1991,"PRESERVED_SPECIMEN","OCCURRENCE_STATUS_INFERRED_FROM_INDIVIDUAL_COUNT;GEODETIC_DATUM_ASSUMED_WGS84;INSTITUTION_MATCH_FUZZY;COLLECTION_MATCH_NONE"
-64.01666,4.73333,"Macrolobium bifolium",1260651140,"Selvas húmedas de tierra firme )terrazal). Rio Caura, 2 km abajo del Caño Guacamaya (Guaya).","VEN",NA,1988,"PRESERVED_SPECIMEN","GEODETIC_DATUM_ASSUMED_WGS84;INSTITUTION_MATCH_FUZZY;COLLECTION_MATCH_NONE"
-58.63333,7.25,"Macrolobium bifolium",1260651533,"Pomeroon-Supenaam: Araplako River, near confluence with Pomeroon River.","GUY",NA,1989,"PRESERVED_SPECIMEN","GEODETIC_DATUM_ASSUMED_WGS84;INSTITUTION_MATCH_FUZZY;COLLECTION_MATCH_NONE"
-53.286114,5.306928,"Macrolobium bifolium",3963544157,"","GUF",NA,2022,"HUMAN_OBSERVATION","COORDINATE_ROUNDED;CONTINENT_DERIVED_FROM_COORDINATES"
-52.85,2.283333,"Macrolobium bifolium",2517385032,"","GUF",NA,1976,"PRESERVED_SPECIMEN","INSTITUTION_MATCH_FUZZY;INSTITUTION_COLLECTION_MISMATCH"
-59.9667,5,"Macrolobium bifolium",1455976591,"Pakaraima Mtns; upper Ireng River; 1-2 km up steam from Catch-a-Cow","GUY",NA,1994,"PRESERVED_SPECIMEN","GEODETIC_DATUM_ASSUMED_WGS84"
-61.5,7.3,"Macrolobium bifolium",1456137641,"Tumeremo, camino Tumeremo - Bochinche, entre Puesto (GN) Corumo and Caño Matuco del Rio Negro","VEN",NA,1982,"PRESERVED_SPECIMEN","GEODETIC_DATUM_ASSUMED_WGS84"
-58.721,6.28489,"Macrolobium bifolium",1456436460,"Marshall Falls, Mazaruni River","GUY",NA,2004,"PRESERVED_SPECIMEN","GEODETIC_DATUM_ASSUMED_WGS84"
-53.0526,5.27253,"Macrolobium bifolium",1456342853,"St. Elie research station of IRD.","GUF",NA,2007,"PRESERVED_SPECIMEN","GEODETIC_DATUM_ASSUMED_WGS84"
-60.2134,5.59683,"Macrolobium bifolium",1456053706,"Pakaraima Mts., Mazaruni River. Unnamed creek off Mazaruni River","GUY",NA,2004,"PRESERVED_SPECIMEN","GEODETIC_DATUM_ASSUMED_WGS84"
-51.883333,3.8,"Macrolobium bifolium",2517401081,"Territorio Amapa, Brasil Rio Oiapoque. Disturbes forest 4 km southeast of Clevelandia.","BRA",NA,1960,"PRESERVED_SPECIMEN","INSTITUTION_MATCH_FUZZY;INSTITUTION_COLLECTION_MISMATCH"
-52.4,4.15,"Macrolobium bifolium",2514211225,"Approuague, sur la crique Ipoucin à 4,300km en amont du premier camp Salvat.","GUF",NA,1969,"PRESERVED_SPECIMEN","INSTITUTION_MATCH_FUZZY;INSTITUTION_COLLECTION_MISMATCH"
-48.8125,-1.618889,"Macrolobium bifolium",1314931348,"Abaetetuba","BRA",NA,2002,"PRESERVED_SPECIMEN","COORDINATE_ROUNDED;GEODETIC_DATUM_ASSUMED_WGS84;INSTITUTION_MATCH_FUZZY;COLLECTION_MATCH_NONE"
-52.366667,2.883333,"Macrolobium bifolium",1314820778,"Amapá","BRA",NA,1960,"PRESERVED_SPECIMEN","COORDINATE_ROUNDED;GEODETIC_DATUM_ASSUMED_WGS84;INSTITUTION_MATCH_FUZZY;COLLECTION_MATCH_NONE"
-63.366667,0.7,"Macrolobium bifolium",1314877206,"Barcelos","BRA",NA,1985,"PRESERVED_SPECIMEN","COORDINATE_ROUNDED;GEODETIC_DATUM_ASSUMED_WGS84;INSTITUTION_MATCH_FUZZY;COLLECTION_MATCH_NONE"
-51.583333,-1.95,"Macrolobium bifolium",1314919893,"Flona de Caxiuanã","BRA",NA,2010,"PRESERVED_SPECIMEN","COORDINATE_ROUNDED;GEODETIC_DATUM_ASSUMED_WGS84;INSTITUTION_MATCH_FUZZY;COLLECTION_MATCH_NONE"
-52.4,-1.233333,"Macrolobium bifolium",1314920490,"Monte Dourado","BRA",NA,2010,"PRESERVED_SPECIMEN","COORDINATE_ROUNDED;GEODETIC_DATUM_ASSUMED_WGS84;INSTITUTION_MATCH_FUZZY;COLLECTION_MATCH_NONE"
-48.873611,-1.728611,"Macrolobium bifolium",1314921410,"Abaetetuba","BRA",NA,2013,"PRESERVED_SPECIMEN","COORDINATE_ROUNDED;GEODETIC_DATUM_ASSUMED_WGS84;INSTITUTION_MATCH_FUZZY;COLLECTION_MATCH_NONE"
-51.765218,0.615266,"Macrolobium bifolium",1929577826,"Cupixi, margem E.F. Amapá.","BRA",NA,1976,"PRESERVED_SPECIMEN","COORDINATE_ROUNDED;COLLECTION_MATCH_FUZZY"
-59.473414,-1.915556,"Macrolobium bifolium",1931232261,"Canteiro de obras da Hidrelétrica de Balbina, estr.p/ Cachoeira Morena, 11 Km a jusante a barragem, margem esq. do rio Uatumã.","BRA",NA,1986,"PRESERVED_SPECIMEN","COORDINATE_ROUNDED;COLLECTION_MATCH_FUZZY"
-67.25,0.083333,"Macrolobium bifolium",1928443789,"Carapanã, margem do Rio Negro acima de São Gabriel","BRA",NA,1987,"PRESERVED_SPECIMEN","GEODETIC_DATUM_ASSUMED_WGS84;COLLECTION_MATCH_FUZZY"
-73.5,-4.16666,"Macrolobium bifolium",1258326415,"Dtto. Iquitos, Allpahuayo. Estación Experimental del Instituto de Investigaciones de la Amazonía Peruana - IIAP. Bosque primario, vegetación sobre suelo arcillo-arenoso (arena blanca), estrato inferior con dominancia de Lepidocaryum tessmannii (irapay), y esøtrato medio con relativa abundancia de Jessenia bataua subsp. bataua (huangurahui); drenaje irregular, pequeøñas y lígeras ondulaciones del terreno. Levantamiento florístico de la parcela A de 1 Ha; 500 x 20 m; correspondienø te al inventario de 2 Has. SUBPARCELA No. 15","PER",NA,1990,"PRESERVED_SPECIMEN","OCCURRENCE_STATUS_INFERRED_FROM_INDIVIDUAL_COUNT;GEODETIC_DATUM_ASSUMED_WGS84;INSTITUTION_MATCH_FUZZY;COLLECTION_MATCH_NONE"
-67.58333,5.4,"Macrolobium bifolium",1260654448,"Dpto. Atures. Serrania de la Coromoto. Sector El Tobogán a 37 Km al S de Pto. Ayacucho. Bosques sobre lomerios entre afloramientos graniticos de la Formación Parguaza. Hoja NB-19-11.","VEN",NA,1989,"PRESERVED_SPECIMEN","GEODETIC_DATUM_ASSUMED_WGS84;INSTITUTION_MATCH_FUZZY;COLLECTION_MATCH_NONE"
-73.228056,-3.639444,"Macrolobium bifolium",1258268583,"Santa María de Nanay. Mishana (Río Nanay). Bosque primario (suelo de arena blanca).","PER",NA,1990,"PRESERVED_SPECIMEN","OCCURRENCE_STATUS_INFERRED_FROM_INDIVIDUAL_COUNT;COORDINATE_ROUNDED;GEODETIC_DATUM_ASSUMED_WGS84;INSTITUTION_MATCH_FUZZY;COLLECTION_MATCH_NONE"
-54.10805,5.31988,"Macrolobium bifolium",3310259475,"","GUF",5000,2010,"HUMAN_OBSERVATION","COUNTRY_MISMATCH;GEODETIC_DATUM_ASSUMED_WGS84;CONTINENT_DERIVED_FROM_COORDINATES"
-60.28166,5.69333,"Macrolobium bifolium",1260653959,"Imbaimadai vicinity. Partang River. 0.11 miles West of base camp. Riverside Alluvial soil.","GUY",NA,2002,"PRESERVED_SPECIMEN","GEODETIC_DATUM_ASSUMED_WGS84;INSTITUTION_MATCH_FUZZY;COLLECTION_MATCH_NONE"
-61.56666,4.45,"Macrolobium bifolium",1261912988,"ROSCIO: El Abismo; 2-3 km upstream to the E on the Río Samay from Samay Camp. Tall forest along river; 550-600 m; 4º27'N, 61º34'W.","VEN",NA,1985,"PRESERVED_SPECIMEN","OCCURRENCE_STATUS_INFERRED_FROM_INDIVIDUAL_COUNT;GEODETIC_DATUM_ASSUMED_WGS84;INSTITUTION_MATCH_FUZZY;COLLECTION_MATCH_NONE"
-59.56666,5,"Macrolobium bifolium",1260652962,"Potaro-Siparuni Region: Chenapou, Amerindian village (Patumona ) 50 km upstream from Kaieteur Falls. Riverbank vegetation.","GUY",NA,1987,"PRESERVED_SPECIMEN","GEODETIC_DATUM_ASSUMED_WGS84;INSTITUTION_MATCH_FUZZY;COLLECTION_MATCH_NONE"
-66,-1.03333,"Macrolobium bifolium",1260653507,"Mun. de Limoeiro (Japurá). Rio Japurá margem direita entre a sede do Municipio e a localidade Matupirí. Mata alta de várzea, solo argilo-arenoso.","BRA",NA,1986,"PRESERVED_SPECIMEN","GEODETIC_DATUM_ASSUMED_WGS84;PRESUMED_NEGATED_LATITUDE;INSTITUTION_MATCH_FUZZY;COLLECTION_MATCH_NONE"
-59.6372,5.10831,"Macrolobium bifolium",1931324711,"Potaro River, right bank 200-500 m downstream from 4th set of rapids above Chenapau","GUY",NA,2014,"PRESERVED_SPECIMEN","GEODETIC_DATUM_ASSUMED_WGS84;COLLECTION_MATCH_FUZZY"
-58.61,6.61,"Macrolobium bifolium",1802575579,"Essequibo; Groete Creek, 27 km from Bartica","GUY",NA,1992,"PRESERVED_SPECIMEN","GEODETIC_DATUM_ASSUMED_WGS84"
-75.285,-10.354167,"Macrolobium bifolium",1257996830,"Dist. Palcazu. Parque Nacional Yanachaga-Chemillen. Parcela permanente TEAM 3.","PER",NA,2012,"PRESERVED_SPECIMEN","OCCURRENCE_STATUS_INFERRED_FROM_INDIVIDUAL_COUNT;COORDINATE_ROUNDED;GEODETIC_DATUM_ASSUMED_WGS84;DIFFERENT_OWNER_INSTITUTION"
-67.32,0.4906,"Macrolobium bifolium",1318841307,"Rio Icana, Comunidade Assuncao, 3 km abaixo da comunidade, transicao Igapo e Terra firme.","BRA",NA,2008,"PRESERVED_SPECIMEN","GEODETIC_DATUM_ASSUMED_WGS84"
-64.326111,-9.231667,"Macrolobium bifolium",2998682649,"Ao longo da BR-364 9 Km E de Jaci-Paraná, ramal 1 Km ao sul. Linha de Transmissão Jirau-Porto Velho.","BRA",NA,2011,"PRESERVED_SPECIMEN","COORDINATE_ROUNDED;GEODETIC_DATUM_ASSUMED_WGS84;CONTINENT_DERIVED_FROM_COORDINATES;INSTITUTION_MATCH_FUZZY;INSTITUTION_COLLECTION_MISMATCH"
-50.18,-0.7,"Macrolobium bifolium",2997933237,"Ilha de Marajó; foz do rio Mucuons.","BRA",NA,1987,"PRESERVED_SPECIMEN","GEODETIC_DATUM_ASSUMED_WGS84;CONTINENT_DERIVED_FROM_COORDINATES;INSTITUTION_MATCH_FUZZY;COLLECTION_MATCH_FUZZY"
-63.298611,-8.8625,"Macrolobium bifolium",2997933238,"Área do reservatório da Usina Hidrelétrica de Samuel, próximo ao igarapé Japiim","BRA",NA,1986,"PRESERVED_SPECIMEN","COORDINATE_ROUNDED;GEODETIC_DATUM_ASSUMED_WGS84;CONTINENT_DERIVED_FROM_COORDINATES;INSTITUTION_MATCH_FUZZY;COLLECTION_MATCH_FUZZY"
-60.508889,-2.8275,"Macrolobium bifolium",2997932257,"Rio Cuieras just below mouth of Rio Brancinho","BRA",NA,1971,"PRESERVED_SPECIMEN","COORDINATE_ROUNDED;GEODETIC_DATUM_ASSUMED_WGS84;CONTINENT_DERIVED_FROM_COORDINATES;INSTITUTION_MATCH_FUZZY;COLLECTION_MATCH_FUZZY"
-52.26,4.51,"Macrolobium bifolium",1456448404,"Counana R., Dégrad Lalanne","GUF",NA,2000,"PRESERVED_SPECIMEN","GEODETIC_DATUM_ASSUMED_WGS84"
-52.17795,4.24215,"Macrolobium bifolium",3944306644,"","GUF",12,2021,"HUMAN_OBSERVATION","COUNTRY_MISMATCH;CONTINENT_DERIVED_FROM_COORDINATES;DEPTH_UNLIKELY"
-57.5167,5.81667,"Macrolobium bifolium",1456116120,"Torani Canal; ±5-12 km W of Canje River, 12-17 km E of Berbice River","GUY",NA,1987,"PRESERVED_SPECIMEN","GEODETIC_DATUM_ASSUMED_WGS84"
-59.144,5.33472,"Macrolobium bifolium",1456273595,"Bartica-Potaro Road, 1.4 miles south of Base camp 2","GUY",NA,2004,"PRESERVED_SPECIMEN","GEODETIC_DATUM_ASSUMED_WGS84"
-51.8,3.91,"Macrolobium bifolium",1802588420,"Crique Gabaret, Bassin de l'Oyapock, saut plat 51º55', rive gauche","GUF",NA,1988,"PRESERVED_SPECIMEN","GEODETIC_DATUM_ASSUMED_WGS84"
-61.75,8.41666,"Macrolobium bifolium",1258274896,"Diaz. Bosques Húmedos primarios del medio Río Grande. 60 km al N-E de EL Palmar.","VEN",NA,1987,"PRESERVED_SPECIMEN","OCCURRENCE_STATUS_INFERRED_FROM_INDIVIDUAL_COUNT;GEODETIC_DATUM_ASSUMED_WGS84;INSTITUTION_MATCH_FUZZY;COLLECTION_MATCH_NONE"
-59.85,7.83333,"Macrolobium bifolium",1260651254,"Barima-Waini. Lower 3 km of Sebai River, tributary of Kaituma River. Tall riparian, swamp forest.","GUY",NA,1991,"PRESERVED_SPECIMEN","GEODETIC_DATUM_ASSUMED_WGS84;INSTITUTION_MATCH_FUZZY;COLLECTION_MATCH_NONE"
-50.18333,0.7,"Macrolobium bifolium",1260651544,"Faz. do Rio Mucuons. Anajás. Ilha do Marajó. Margem de rio.","BRA",NA,1987,"PRESERVED_SPECIMEN","GEODETIC_DATUM_ASSUMED_WGS84;INSTITUTION_MATCH_FUZZY;COLLECTION_MATCH_NONE"
-61.63333,8.08333,"Macrolobium bifolium",1260651065,"Bosque Pluvial, Este de Río Grande. Este-Noreste de El Palmar, cerca de los límites del Estado Bolívar.","VEN",NA,1975,"PRESERVED_SPECIMEN","GEODETIC_DATUM_ASSUMED_WGS84;INSTITUTION_MATCH_FUZZY;COLLECTION_MATCH_NONE"
-39.171667,-14.795,"Macrolobium bifolium",4007866429,"Salobrinho, campus da UESC. Arboreto.","BRA",NA,2019,"PRESERVED_SPECIMEN","GEODETIC_DATUM_ASSUMED_WGS84;INSTITUTION_MATCH_FUZZY;INSTITUTION_COLLECTION_MISMATCH"
-52.333333,4.933333,"Macrolobium bifolium",2513376347,"","GUF",NA,1957,"PRESERVED_SPECIMEN","INSTITUTION_MATCH_FUZZY;INSTITUTION_COLLECTION_MISMATCH"
-53.23333,4.91667,"Macrolobium bifolium",437973086,"","GUF",NA,1994,"PRESERVED_SPECIMEN","GEODETIC_DATUM_ASSUMED_WGS84;CONTINENT_DERIVED_FROM_COORDINATES;COLLECTION_MATCH_FUZZY"
-47.675353,-1.32249,"Macrolobium bifolium",1929924341,"Vic. Rodobras Station, Km 92, Belem-Brasilia Highway","BRA",3553,1963,"PRESERVED_SPECIMEN","COORDINATE_ROUNDED;COLLECTION_MATCH_FUZZY"
-48.239325,-2.672933,"Macrolobium bifolium",1801352827,"","BRA",NA,2017,"PRESERVED_SPECIMEN","GEODETIC_DATUM_ASSUMED_WGS84;CONTINENT_DERIVED_FROM_COORDINATES;INSTITUTION_MATCH_NONE"
-49.498481,-2.241489,"Macrolobium bifolium",1090155574,"Campo de natureza.","BRA",NA,2014,"PRESERVED_SPECIMEN","GEODETIC_DATUM_ASSUMED_WGS84;CONTINENT_DERIVED_FROM_COORDINATES;INSTITUTION_MATCH_NONE"
-60.0333,4.8,"Macrolobium bifolium",1456020558,"Pakaraima Mtns; Upper Ireng River","GUY",NA,1994,"PRESERVED_SPECIMEN","GEODETIC_DATUM_ASSUMED_WGS84"
6.26613,45.5166,"Macrolobium bifolium",3932593930,"","FRA",10,2020,"HUMAN_OBSERVATION","CONTINENT_DERIVED_FROM_COORDINATES"
-72.812333,-7.595081,"Macrolobium bifolium",3991065867,"Ramal Mariana 1, área sul.","BRA",NA,2013,"PRESERVED_SPECIMEN","GEODETIC_DATUM_ASSUMED_WGS84;COLLECTION_MATCH_FUZZY"
-61.91666,8.58333,"Macrolobium bifolium",1260653784,"Depto. A. Diaz. Bosques Húmedos primarios a lo largo del caño Orocoima. 75 km. al N-E de EL Palmar.","VEN",NA,1987,"PRESERVED_SPECIMEN","GEODETIC_DATUM_ASSUMED_WGS84;INSTITUTION_MATCH_FUZZY;COLLECTION_MATCH_NONE"
-58.616667,5.016667,"Macrolobium bifolium",2517373127,"","GUY",NA,1996,"PRESERVED_SPECIMEN","INSTITUTION_MATCH_FUZZY;INSTITUTION_COLLECTION_MISMATCH"
