"lon","lat","species","gbifID","locality","countryCode","coordinateUncertaintyInMeters","year","basisOfRecord","issue"
-62.283333,5.933333,"Macrolobium bifolium",2515285600,"Estado Bolivar: Distr. Piar. Río Acanán, Guarumo, 4 to 7 km SW of Amaruay-tepui. 5 to 3 km S of base camp at Guadequen. Edge forest of and savanna.","VEN",NA,1986,"PRESERVED_SPECIMEN","INSTITUTION_MATCH_FUZZY;INSTITUTION_COLLECTION_MISMATCH"
-58.95,1.416667,"Macrolobium bifolium",2515482438,"Guyana. Region: U.Takutu-U.Essequibo. Sipu River, area near camp.","GUY",NA,1998,"PRESERVED_SPECIMEN","INSTITUTION_MATCH_FUZZY;INSTITUTION_COLLECTION_MISMATCH"
-52.46494,4.62556,"Macrolobium bifolium",3310193298,"","GUF",5000,2011,"HUMAN_OBSERVATION","COUNTRY_MISMATCH;GEODETIC_DATUM_ASSUMED_WGS84;CONTINENT_DERIVED_FROM_COORDINATES"
-53.90449,3.5355,"Macrolobium bifolium",3310346267,"","GUF",5000,2011,"HUMAN_OBSERVATION","COUNTRY_MISMATCH;GEODETIC_DATUM_ASSUMED_WGS84;CONTINENT_DERIVED_FROM_COORDINATES"
-53.42478,2.82588,"Macrolobium bifolium",3310362250,"","GUF",5000,2002,"HUMAN_OBSERVATION","COUNTRY_MISMATCH;GEODETIC_DATUM_ASSUMED_WGS84;CONTINENT_DERIVED_FROM_COORDINATES"
-53.31341,4.55545,"Macrolobium bifolium",3310331067,"","GUF",5000,2006,"HUMAN_OBSERVATION","COUNTRY_MISMATCH;GEODETIC_DATUM_ASSUMED_WGS84;CONTINENT_DERIVED_FROM_COORDINATES"
-60.5875,5.730861,"Macrolobium bifolium",2515398993,"Guyana. Cuyuni-Mazaruni Region. Pakaraima Mts., Mazaruni River. 9.21 GPS miles W of Imbaimadai to Kamarang, near Jawalla and Baimapai.","GUY",NA,2004,"PRESERVED_SPECIMEN","INSTITUTION_MATCH_FUZZY;INSTITUTION_COLLECTION_MISMATCH"
-51.834444,-0.338611,"Macrolobium bifolium",3912830483,"Campina na beira da BR-156, a cerca de 23.4 Km após Maracá.","BRA",NA,2022,"PRESERVED_SPECIMEN","COORDINATE_ROUNDED;GEODETIC_DATUM_ASSUMED_WGS84;CONTINENT_DERIVED_FROM_COORDINATES;INSTITUTION_MATCH_FUZZY;COLLECTION_MATCH_FUZZY"
-48.080278,-1.388055,"Macrolobium bifolium",1424450940,"Santa Isabel. Conceição do Itá.","BRA",NA,2012,"PRESERVED_SPECIMEN","COORDINATE_ROUNDED;GEODETIC_DATUM_ASSUMED_WGS84;CONTINENT_DERIVED_FROM_COORDINATES;INSTITUTION_MATCH_FUZZY;COLLECTION_MATCH_FUZZY"
-60.958333,9.25,"Macrolobium bifolium",2517038098,"Terr. Fed. Delta Amacuro: Depto. Antonio Díaz: riverine forest with varies tree growth, along Cano Atoiba, tributary of Boca Araguao.","VEN",NA,1977,"PRESERVED_SPECIMEN","INSTITUTION_MATCH_FUZZY;INSTITUTION_COLLECTION_MISMATCH"
-68.366669,2.266667,"Macrolobium bifolium",1898896843,"Caño Colorado, Aeropuerto La Esperanza.","COL",NA,1993,"PRESERVED_SPECIMEN","GEODETIC_DATUM_ASSUMED_WGS84"
-50.263611,-3.003056,"Macrolobium bifolium",1090577029,"Fazenda Jataituba (Martins S/A), ao longo do Rio Pacajá","BRA",NA,2008,"PRESERVED_SPECIMEN","GEODETIC_DATUM_ASSUMED_WGS84;CONTINENT_DERIVED_FROM_COORDINATES;INSTITUTION_MATCH_FUZZY;COLLECTION_MATCH_FUZZY"
-73.03333,-3.5,"Macrolobium bifolium",1258265778,"Explorama Inn, ca. 2 km W of Indiana on Río Amazonas. Well-drained forest on good soil. Transect 9","PER",NA,1987,"PRESERVED_SPECIMEN","OCCURRENCE_STATUS_INFERRED_FROM_INDIVIDUAL_COUNT;GEODETIC_DATUM_ASSUMED_WGS84;INSTITUTION_MATCH_FUZZY;COLLECTION_MATCH_NONE"
-63.68555,5.73444,"Macrolobium bifolium",1260653106,"cumbre de Cerro Guaiquinima, Salto del Río Szczerbanari (Río Carapo), 1-2 km. río arriba del Salto Szczerbanarai, parte central del cerro.","VEN",NA,1977,"PRESERVED_SPECIMEN","GEODETIC_DATUM_ASSUMED_WGS84;INSTITUTION_MATCH_FUZZY;COLLECTION_MATCH_NONE"
-61.00055,8.98333,"Macrolobium bifolium",1260654733,"Depto. Antonio Díaz: varied riverine forest along Caño Joba-Saburu, west of Caño Guayo and east of Caño Sacupan.","VEN",NA,1977,"PRESERVED_SPECIMEN","GEODETIC_DATUM_ASSUMED_WGS84;INSTITUTION_MATCH_FUZZY;COLLECTION_MATCH_NONE"
-53.08333,5.43333,"Macrolobium bifolium",1260650591,"Crique Yiyi: forêt marécageuse de bord de crique.","GUF",NA,1994,"PRESERVED_SPECIMEN","GEODETIC_DATUM_ASSUMED_WGS84;INSTITUTION_MATCH_FUZZY;COLLECTION_MATCH_NONE"
-59,-1.03333,"Macrolobium bifolium",1260654739,"Mun. Pres. Figueredo, AM. Canteiro de obras da hidreletrica de Balbina, a montante da barragem. Linha D-01 margem dir. do rio Uatumã. Campina, solo areno so branco.","BRA",NA,1986,"PRESERVED_SPECIMEN","GEODETIC_DATUM_ASSUMED_WGS84;INSTITUTION_MATCH_FUZZY;COLLECTION_MATCH_NONE"
-64.4,6.23333,"Macrolobium bifolium",1261509605,"Caño Pablo, tributario del Río Caura, 5-5.5 km al S de Salto Para, (Campamento Las Pavas). Bosque húmedo riparino.","VEN",NA,1982,"PRESERVED_SPECIMEN","OCCURRENCE_STATUS_INFERRED_FROM_INDIVIDUAL_COUNT;GEODETIC_DATUM_ASSUMED_WGS84;INSTITUTION_MATCH_FUZZY;COLLECTION_MATCH_NONE"
-52.43035,3.7973,"Macrolobium bifolium",3310227044,"","GUF",5000,2008,"HUMAN_OBSERVATION","COUNTRY_MISMATCH;GEODETIC_DATUM_ASSUMED_WGS84;CONTINENT_DERIVED_FROM_COORDINATES"
-53.21884,3.58007,"Macrolobium bifolium",3072766186,"","GUF",5000,2008,"HUMAN_OBSERVATION","COUNTRY_MISMATCH;GEODETIC_DATUM_ASSUMED_WGS84;CONTINENT_DERIVED_FROM_COORDINATES"
-53.7546,5.15062,"Macrolobium bifolium",3310305930,"","GUF",5000,2013,"HUMAN_OBSERVATION","COUNTRY_MISMATCH;GEODETIC_DATUM_ASSUMED_WGS84;CONTINENT_DERIVED_FROM_COORDINATES"
-57.110833,-2.656944,"Macrolobium bifolium",1424398846,"Lago do Iripixi, Igarapé grande.","BRA",NA,2011,"PRESERVED_SPECIMEN","COORDINATE_ROUNDED;GEODETIC_DATUM_ASSUMED_WGS84;CONTINENT_DERIVED_FROM_COORDINATES;INSTITUTION_MATCH_FUZZY;COLLECTION_MATCH_FUZZY"
-59.353611,-2.068056,"Macrolobium bifolium",1424406168,"Entorno. Estrada Balbina direção sul-Ramal da Morena.","BRA",NA,2007,"PRESERVED_SPECIMEN","COORDINATE_ROUNDED;GEODETIC_DATUM_ASSUMED_WGS84;CONTINENT_DERIVED_FROM_COORDINATES;INSTITUTION_MATCH_FUZZY;COLLECTION_MATCH_FUZZY"
-52.9,4.11,"Macrolobium bifolium",2643486437,"","GUF",NA,2013,"HUMAN_OBSERVATION","COUNTRY_DERIVED_FROM_COORDINATES;CONTINENT_DERIVED_FROM_COORDINATES"
-59.025,4.72222,"Macrolobium bifolium",1456342131,"Iwokrama; Siparuni R, Pakatau Falls and 2 km upstream","GUY",NA,1994,"PRESERVED_SPECIMEN","GEODETIC_DATUM_ASSUMED_WGS84"
-60.3455,6.46892,"Macrolobium bifolium",1456216313,"Isseneru Creek. Unable to get exact GPS; used closest from 2-Nov-06.","GUY",NA,2006,"PRESERVED_SPECIMEN","GEODETIC_DATUM_ASSUMED_WGS84"
-57.45,5.75,"Macrolobium bifolium",1455964354,"Canje River between Baracara and Ikuruwa","GUY",NA,1989,"PRESERVED_SPECIMEN","GEODETIC_DATUM_ASSUMED_WGS84"
-51.375278,-1.573611,"Macrolobium bifolium",2302472105,"Igarapé Caquajó. Flona do Caxiuanã.","BRA",NA,2007,"PRESERVED_SPECIMEN","COORDINATE_ROUNDED;GEODETIC_DATUM_ASSUMED_WGS84;CONTINENT_DERIVED_FROM_COORDINATES;INSTITUTION_MATCH_FUZZY;COLLECTION_MATCH_FUZZY"
-48.045,-1.231667,"Macrolobium bifolium",2302472415,"Conceição do Itá, Comunidade de Conceição do Itá, na beira do igarapé. Planta dentro do igarapé.","BRA",NA,2012,"PRESERVED_SPECIMEN","COORDINATE_ROUNDED;GEODETIC_DATUM_ASSUMED_WGS84;CONTINENT_DERIVED_FROM_COORDINATES;INSTITUTION_MATCH_FUZZY;COLLECTION_MATCH_FUZZY"
-46.520278,-1.060833,"Macrolobium bifolium",2302480341,"Cajueiro Grande, igapó ao lado sudeste do ramal entre cajueirinho e cajueiro grande, aproximadamente 5 km ao sudeste de Tracuateua.","BRA",NA,2012,"PRESERVED_SPECIMEN","COORDINATE_ROUNDED;GEODETIC_DATUM_ASSUMED_WGS84;CONTINENT_DERIVED_FROM_COORDINATES;INSTITUTION_MATCH_FUZZY;COLLECTION_MATCH_FUZZY"
-51.58,1.47,"Macrolobium bifolium",2302459876,"Rio Araguari. Along river between camps 4 and 5.","BRA",NA,1961,"PRESERVED_SPECIMEN","RECORDED_DATE_INVALID;COORDINATE_ROUNDED;GEODETIC_DATUM_ASSUMED_WGS84;CONTINENT_DERIVED_FROM_COORDINATES;INSTITUTION_MATCH_FUZZY;COLLECTION_MATCH_FUZZY"
-51.53,3.48,"Macrolobium bifolium",2302461016,"Rio Oiapoque. Disturbed forest 4 kilometers southeast of Clevelandia.","BRA",NA,1960,"PRESERVED_SPECIMEN","GEODETIC_DATUM_ASSUMED_WGS84;CONTINENT_DERIVED_FROM_COORDINATES;INSTITUTION_MATCH_FUZZY;COLLECTION_MATCH_FUZZY"
-52.22,2.53,"Macrolobium bifolium",2302459808,"At margin of river. Second cachoeira on Rio Iaue, 3 km east of confluence with Rio Oiapoque. Common.","BRA",NA,1960,"PRESERVED_SPECIMEN","GEODETIC_DATUM_ASSUMED_WGS84;CONTINENT_DERIVED_FROM_COORDINATES;INSTITUTION_MATCH_FUZZY;COLLECTION_MATCH_FUZZY"
-52.55,2.08,"Macrolobium bifolium",2302459321,"Rio Oiapoque. In forest on island in cachoeira. Cachoeira Utussansain. Common.","BRA",NA,1960,"PRESERVED_SPECIMEN","RECORDED_DATE_INVALID;GEODETIC_DATUM_ASSUMED_WGS84;CONTINENT_DERIVED_FROM_COORDINATES;INSTITUTION_MATCH_FUZZY;COLLECTION_MATCH_FUZZY"
-48.281389,-1.306389,"Macrolobium bifolium",2302470009,"Ilha do Cumbu. Solo argiloso, mata de várzea, luminosidade intensa, freqüência abundante.","BRA",NA,2001,"PRESERVED_SPECIMEN","RECORDED_DATE_INVALID;COORDINATE_ROUNDED;GEODETIC_DATUM_ASSUMED_WGS84;CONTINENT_DERIVED_FROM_COORDINATES;INSTITUTION_MATCH_FUZZY;COLLECTION_MATCH_FUZZY"
-50.58,1.45,"Macrolobium bifolium",2302461766,"Coastal region. Frequent in forested border of Rio Flechal.","BRA",NA,1962,"PRESERVED_SPECIMEN","RECORDED_DATE_INVALID;COORDINATE_ROUNDED;GEODETIC_DATUM_ASSUMED_WGS84;CONTINENT_DERIVED_FROM_COORDINATES;INSTITUTION_MATCH_FUZZY;COLLECTION_MATCH_FUZZY"
-74.95,0.01,"Macrolobium bifolium",3705116904,"Parque Nacional Natural La Paya, qda. La Peinilla, bosque de tierra firme, alto grado de epifitismo, lianas y bejucos, abundancia de Iriartea deltoidea, Euterpe precatoria y Socratea exhorriza, sotobosque abierto y poco diverso","COL",NA,2014,"PRESERVED_SPECIMEN","INSTITUTION_MATCH_NONE"
-68.23,2.21,"Macrolobium bifolium",3068341884,"serranía de Naquén, cerca del helipuerto 15, parcela 1","COL",NA,1992,"PRESERVED_SPECIMEN","INSTITUTION_MATCH_NONE"
-52.498018,4.827768,"Macrolobium bifolium",2988578173,"","GUF",NA,2020,"HUMAN_OBSERVATION","COORDINATE_ROUNDED;CONTINENT_DERIVED_FROM_COORDINATES"
-58.3833,6.5,"Macrolobium bifolium",1318008904,"Along pokerero creek, near santa mission","GUY",NA,1992,"PRESERVED_SPECIMEN","GEODETIC_DATUM_ASSUMED_WGS84"
-61.11666,4.55,"Macrolobium bifolium",1260653329,"distrito roscio: selva ribereña a lo largo de la Quebrada Saunay (Pozo Negro), afluente del Río Uairén, 6 kms al Oeste de Santa Elena de Uairén.","VEN",NA,1982,"PRESERVED_SPECIMEN","GEODETIC_DATUM_ASSUMED_WGS84;INSTITUTION_MATCH_FUZZY;COLLECTION_MATCH_NONE"
-61.15,6.33333,"Macrolobium bifolium",1260652203,"Reserva Forestal Imataca. Selva pluvial del río Venamo, entre Isla Anacoco y Araguay; Puesto (GN) Araguay.","VEN",NA,1981,"PRESERVED_SPECIMEN","GEODETIC_DATUM_ASSUMED_WGS84;INSTITUTION_MATCH_FUZZY;COLLECTION_MATCH_NONE"
-52.633333,5.15,"Macrolobium bifolium",4031540328,"Fleuve Kourou.","GUF",NA,1993,"PRESERVED_SPECIMEN","OCCURRENCE_STATUS_INFERRED_FROM_INDIVIDUAL_COUNT;COORDINATE_ROUNDED;GEODETIC_DATUM_ASSUMED_WGS84;INSTITUTION_MATCH_FUZZY;COLLECTION_MATCH_NONE"
-51.840436,3.842835,"Macrolobium bifolium",3988523595,"","BRA",39,2022,"HUMAN_OBSERVATION","COORDINATE_ROUNDED;CONTINENT_DERIVED_FROM_COORDINATES"
-53.1,4.09,"Macrolobium bifolium",1456329875,"Crique Neptune, embouchure, Bassin du Sinnamary","GUF",NA,1992,"PRESERVED_SPECIMEN","GEODETIC_DATUM_ASSUMED_WGS84"
-58.8,5.216667,"Macrolobium bifolium",2516120607,"15 km. S. of Mabura Hill. Primary forest along creek.","GUY",NA,1997,"PRESERVED_SPECIMEN","INSTITUTION_MATCH_FUZZY;INSTITUTION_COLLECTION_MISMATCH"
-52.9,5.383333,"Macrolobium bifolium",2515164986,"Paracou.","GUF",NA,1994,"PRESERVED_SPECIMEN","INSTITUTION_MATCH_FUZZY;INSTITUTION_COLLECTION_MISMATCH"
-51.765278,-0.615278,"Macrolobium bifolium",2997394216,"Cupixi, margem E.F. Amapá.","BRA",NA,1976,"PRESERVED_SPECIMEN","COORDINATE_ROUNDED;GEODETIC_DATUM_ASSUMED_WGS84;CONTINENT_DERIVED_FROM_COORDINATES;INSTITUTION_MATCH_FUZZY;COLLECTION_MATCH_FUZZY"
-58.088611,-0.491667,"Macrolobium bifolium",2997394217,"Rio Mapuera, Campina das Três Ilhas.","BRA",NA,1987,"PRESERVED_SPECIMEN","COORDINATE_ROUNDED;GEODETIC_DATUM_ASSUMED_WGS84;CONTINENT_DERIVED_FROM_COORDINATES;INSTITUTION_MATCH_FUZZY;COLLECTION_MATCH_FUZZY"
-66.83,-1.35,"Macrolobium bifolium",2997903266,"Cucuí, Igarapé Bonte","BRA",NA,1987,"PRESERVED_SPECIMEN","GEODETIC_DATUM_ASSUMED_WGS84;PRESUMED_NEGATED_LATITUDE;CONTINENT_DERIVED_FROM_COORDINATES;INSTITUTION_MATCH_FUZZY;COLLECTION_MATCH_FUZZY"
-53.36744,3.18012,"Macrolobium bifolium",3310497359,"","GUF",5000,2012,"HUMAN_OBSERVATION","COUNTRY_MISMATCH;GEODETIC_DATUM_ASSUMED_WGS84;CONTINENT_DERIVED_FROM_COORDINATES"
-53.21477,2.34632,"Macrolobium bifolium",3310469301,"","GUF",5000,2012,"HUMAN_OBSERVATION","COUNTRY_MISMATCH;GEODETIC_DATUM_ASSUMED_WGS84;CONTINENT_DERIVED_FROM_COORDINATES"
-53.43138,3.73168,"Macrolobium bifolium",3310570275,"","GUF",5000,2012,"HUMAN_OBSERVATION","COUNTRY_MISMATCH;GEODETIC_DATUM_ASSUMED_WGS84;CONTINENT_DERIVED_FROM_COORDINATES"
-67.41666,6.41666,"Macrolobium bifolium",1260652791,"Tobogan de la Silva.","VEN",NA,1995,"PRESERVED_SPECIMEN","GEODETIC_DATUM_ASSUMED_WGS84;INSTITUTION_MATCH_FUZZY;COLLECTION_MATCH_NONE"
-54.32644,2.23803,"Macrolobium bifolium",3310655403,"","GUF",5000,2013,"HUMAN_OBSERVATION","COUNTRY_MISMATCH;GEODETIC_DATUM_ASSUMED_WGS84;CONTINENT_DERIVED_FROM_COORDINATES"
-52.13713,4.58023,"Macrolobium bifolium",3310560476,"","GUF",5000,2010,"HUMAN_OBSERVATION","COUNTRY_MISMATCH;GEODETIC_DATUM_ASSUMED_WGS84;CONTINENT_DERIVED_FROM_COORDINATES"
-54.18722,4.84694,"Macrolobium bifolium",3310503767,"","GUF",5000,2012,"HUMAN_OBSERVATION","COUNTRY_MISMATCH;GEODETIC_DATUM_ASSUMED_WGS84;CONTINENT_DERIVED_FROM_COORDINATES"
-52.23741,4.0561,"Macrolobium bifolium",3310444828,"","GUF",5000,2008,"HUMAN_OBSERVATION","COUNTRY_MISMATCH;GEODETIC_DATUM_ASSUMED_WGS84;CONTINENT_DERIVED_FROM_COORDINATES"
-57.056667,-1.089722,"Macrolobium bifolium",2565883554,"Porto Trombetas. Cachoeira da Porteira.","BRA",NA,1999,"PRESERVED_SPECIMEN","COORDINATE_ROUNDED;GEODETIC_DATUM_ASSUMED_WGS84;CONTINENT_DERIVED_FROM_COORDINATES;INSTITUTION_MATCH_FUZZY;COLLECTION_MATCH_FUZZY"
-56.356111,-2.171389,"Macrolobium bifolium",2565883244,"Balneário curussambá. Igarapé. Mata de igapó.","BRA",NA,2014,"PRESERVED_SPECIMEN","RECORDED_DATE_INVALID;COORDINATE_ROUNDED;GEODETIC_DATUM_ASSUMED_WGS84;CONTINENT_DERIVED_FROM_COORDINATES;INSTITUTION_MATCH_FUZZY;COLLECTION_MATCH_FUZZY"
-73.5,-3.83333,"Macrolobium bifolium",1258734156,"Mishana, Río Nanay halfway between Iquitos and Santa María de Nanay. Upland forest on white sand. Transect 11","PER",NA,1982,"PRESERVED_SPECIMEN","GEODETIC_DATUM_ASSUMED_WGS84;INSTITUTION_MATCH_FUZZY;COLLECTION_MATCH_NONE"
-61.08333,8.41666,"Macrolobium bifolium",1260650894,"Dpto Antonio Diaz Río Acure, entre la Piedrita y Baruma.","VEN",NA,1987,"PRESERVED_SPECIMEN","GEODETIC_DATUM_ASSUMED_WGS84;INSTITUTION_MATCH_FUZZY;COLLECTION_MATCH_NONE"
-77.25397,5.69036,"Macrolobium bifolium",3390899377,"Estero Montero","COL",370.6,2008,"PRESERVED_SPECIMEN","INSTITUTION_MATCH_FUZZY;COLLECTION_MATCH_FUZZY"
-53.35,4.58333,"Macrolobium bifolium",1828832374,"Réserve Naturelle des Montagnes de la Trinité","GUF",NA,2001,"PRESERVED_SPECIMEN","GEODETIC_DATUM_ASSUMED_WGS84;CONTINENT_DERIVED_FROM_COORDINATES;COLLECTION_MATCH_FUZZY"
-61.16666,5,"Macrolobium bifolium",1258297318,"Gran Sabana; San Ignacio de Yuruaní. Forest edge, along savanna.","VEN",NA,1988,"PRESERVED_SPECIMEN","OCCURRENCE_STATUS_INFERRED_FROM_INDIVIDUAL_COUNT;GEODETIC_DATUM_ASSUMED_WGS84;INSTITUTION_MATCH_FUZZY;COLLECTION_MATCH_NONE"
-53.01,5.01,"Macrolobium bifolium",1456298586,"Crique Plomb, Bassin du Sinnamary","GUF",NA,1991,"PRESERVED_SPECIMEN","GEODETIC_DATUM_ASSUMED_WGS84"
-54,2.8833,"Macrolobium bifolium",1317620818,"Camp no. 1 ouman fou langa soula - bassin du haut-marouini","GUF",NA,1987,"PRESERVED_SPECIMEN","GEODETIC_DATUM_ASSUMED_WGS84"
-49.5333,-3.5,"Macrolobium bifolium",1317577817,"Tucurui and rio tocantins, approx 18 km e of","BRA",NA,1981,"PRESERVED_SPECIMEN","GEODETIC_DATUM_ASSUMED_WGS84"
-58.833333,1.4,"Macrolobium bifolium",2517421176,"Guyana. Upper Takutu - Upper Essequibo Region. Sipu River.","GUY",NA,2004,"PRESERVED_SPECIMEN","INSTITUTION_MATCH_FUZZY;INSTITUTION_COLLECTION_MISMATCH"
-62.73333,4.6,"Macrolobium bifolium",1260651729,"Municipio Raul Leoni. Bosque en peniplanicie 85Km (por aire) al sur de Uriman Helipuerto Tepuy,","VEN",NA,1986,"PRESERVED_SPECIMEN","GEODETIC_DATUM_ASSUMED_WGS84;INSTITUTION_MATCH_FUZZY;COLLECTION_MATCH_NONE"
