"lon","lat","species","gbifID","locality","countryCode","coordinateUncertaintyInMeters","year","basisOfRecord","issue"
-76.2229,-0.975317,"Macrolobium archeri",4061081353,"Parque Nacional Yasuní. Carretera Pompeya Sur - Iro Km 105,8 . En territorio de la comunidad Huaorani de Dicaro. Parcela temporal de muestreo (0.1 ha) Nº 18.","ECU",NA,1998,"PRESERVED_SPECIMEN","OCCURRENCE_STATUS_INFERRED_FROM_INDIVIDUAL_COUNT;COORDINATE_ROUNDED;GEODETIC_DATUM_ASSUMED_WGS84;DIFFERENT_OWNER_INSTITUTION"
-77.13333,3.93333,"Macrolobium archeri",1258730245,"Bajo Calima, ca. 10 km due N of Buenaventura, Carton de Colombia concession. Transect 1.","COL",NA,1981,"PRESERVED_SPECIMEN","GEODETIC_DATUM_ASSUMED_WGS84;INSTITUTION_MATCH_FUZZY;COLLECTION_MATCH_NONE"
-76.58333,3.83333,"Macrolobium archeri",1261904871,"Corregimiento Cordoba, San Cipriano, Reserva Natural del Río Escalerete, Bosque Pluvial Tropical, Región Fitogeográfica del Chocó. Transecto 16.","COL",NA,1993,"PRESERVED_SPECIMEN","OCCURRENCE_STATUS_INFERRED_FROM_INDIVIDUAL_COUNT;GEODETIC_DATUM_ASSUMED_WGS84;INSTITUTION_MATCH_FUZZY;COLLECTION_MATCH_NONE"
-76.2,-1.05,"Macrolobium archeri",4031958854,"Reserva Etnica Huaorani. Carretera y oleoducto de Maxus, Km 116+6. Ramal de carretera a Plataforma IRO. Bosque húmedo Tropical. Bosque primario. Colinas de suelos rojos.","ECU",NA,1995,"PRESERVED_SPECIMEN","GEODETIC_DATUM_ASSUMED_WGS84;INSTITUTION_MATCH_FUZZY;COLLECTION_MATCH_NONE"
-76.63333,5.53333,"Macrolobium archeri",1258672061,"Road (under construction) to Llora from Yuto, pluvial forest, along creek ca. 2 km E of Yuto.","COL",NA,1979,"PRESERVED_SPECIMEN","OCCURRENCE_STATUS_INFERRED_FROM_INDIVIDUAL_COUNT;GEODETIC_DATUM_ASSUMED_WGS84;INSTITUTION_MATCH_FUZZY;COLLECTION_MATCH_NONE"
-76.58333,5.76666,"Macrolobium archeri",1258695384,"Halfway between Quibdo and Tutunendo, tropical pluvial forest. Line 4.","COL",NA,1981,"PRESERVED_SPECIMEN","OCCURRENCE_STATUS_INFERRED_FROM_INDIVIDUAL_COUNT;GEODETIC_DATUM_ASSUMED_WGS84;INSTITUTION_MATCH_FUZZY;COLLECTION_MATCH_NONE"
-76.43333,-0.65,"Macrolobium archeri",4031444736,"Sacha Lodge, 3 km NW of the village Añangu, near the Napo river. Tropical Moist Forest.","ECU",NA,1995,"PRESERVED_SPECIMEN","GEODETIC_DATUM_ASSUMED_WGS84;INSTITUTION_MATCH_FUZZY;COLLECTION_MATCH_NONE"
-76.33361,-0.3375,"Macrolobium archeri",4032004783,"Comunidad San Isla. Línea Oleoducto Eden-Yuturi - Lago Agrio OXY. Bosque Primario. Derecho de Vía.","ECU",NA,2002,"PRESERVED_SPECIMEN","GEODETIC_DATUM_ASSUMED_WGS84;INSTITUTION_MATCH_FUZZY;COLLECTION_MATCH_NONE"
-77,3.91666,"Macrolobium archeri",1260651468,"Bajo Calima; Concesión Pulpapel / Buenaventura. Bosque Pluvial Tropical. Suelos deficientes en nutrientes principalmente en P, C, K, Mg, Cu, B, Mn, Zn, y un alto porcentaje de saturación de Al.","COL",NA,1984,"PRESERVED_SPECIMEN","GEODETIC_DATUM_ASSUMED_WGS84;INSTITUTION_MATCH_FUZZY;COLLECTION_MATCH_NONE"
-76.45,-0.68333,"Macrolobium archeri",4031833403,"Parque Nacional Yasuní. Carretera y oleoducto de Maxus, Km 44. Faja # 3, de 0.1 hectárea y áreas aledañas. Bosque húmedo Tropical. Bosque primario. Colinas de suelo rojo.","ECU",NA,1994,"PRESERVED_SPECIMEN","GEODETIC_DATUM_ASSUMED_WGS84;INSTITUTION_MATCH_FUZZY;COLLECTION_MATCH_NONE"
-77.33333,-0.66666,"Macrolobium archeri",1259858486,"Napa y Pastaza. Rain forest at Araki on Río Guataracu 10 hours west of Coca.","ECU",NA,1960,"PRESERVED_SPECIMEN","GEODETIC_DATUM_ASSUMED_WGS84;DIFFERENT_OWNER_INSTITUTION"
-79.383,-0.516,"Macrolobium archeri",47801778,"Añangu, Río Napo. Tropical rain forest. Terra firme.","ECU",NA,1983,"PRESERVED_SPECIMEN","GEODETIC_DATUM_ASSUMED_WGS84;COORDINATE_PRECISION_INVALID;INSTITUTION_MATCH_FUZZY;INSTITUTION_COLLECTION_MISMATCH"
-75.41666,-11.16666,"Macrolobium archeri",1261520959,"Waterfall and quebrada above Río Chanchamayo, c. 14 km W of San Ramón on road to Tarma.","PER",NA,1985,"PRESERVED_SPECIMEN","OCCURRENCE_STATUS_INFERRED_FROM_INDIVIDUAL_COUNT;GEODETIC_DATUM_ASSUMED_WGS84;INSTITUTION_MATCH_FUZZY;COLLECTION_MATCH_NONE"
-76.433333,6.35,"Macrolobium archeri",1707534008,"Serranía al O de la ensenada. Cima entre punta Diego y la trocha a Cocalito","COL",NA,1990,"PRESERVED_SPECIMEN","COORDINATE_ROUNDED;GEODETIC_DATUM_ASSUMED_WGS84;INSTITUTION_MATCH_NONE"
-77.166667,6.083331,"Macrolobium archeri",1707533357,"Quebrada (Derecha) por la entrada a Boroboro","COL",NA,1990,"PRESERVED_SPECIMEN","COORDINATE_ROUNDED;GEODETIC_DATUM_ASSUMED_WGS84;INSTITUTION_MATCH_NONE"
-77.16795,3.9431,"Macrolobium archeri",1707495995,"Bahia malaga, comunidad de la plata","COL",NA,2014,"PRESERVED_SPECIMEN","GEODETIC_DATUM_ASSUMED_WGS84;INSTITUTION_MATCH_NONE"
-76.602056,5.309306,"Macrolobium archeri",3924105480,"Salero","COL",NA,1998,"HUMAN_OBSERVATION",""
-77.589722,2.850556,"Macrolobium archeri",2978380712,"Resguardo Indígena Calle Santa Rosa","COL",NA,2018,"HUMAN_OBSERVATION","COORDINATE_ROUNDED"
-68.916667,2.666667,"Macrolobium archeri",2013789948,"Nabuquén - Raudal.","COL",NA,1995,"PRESERVED_SPECIMEN","GEODETIC_DATUM_ASSUMED_WGS84"
-79.173008,0.61607,"Macrolobium archeri",1978525220,"Pambilar","ECU",30,2012,"HUMAN_OBSERVATION",""
-79.200541,0.482955,"Macrolobium archeri",1978522428,"Toma de agua Canandé","ECU",30,2012,"HUMAN_OBSERVATION",""
-77.2,4.25,"Macrolobium archeri",3946224907,"Taparalito","COL",NA,1983,"PRESERVED_SPECIMEN","INSTITUTION_MATCH_FUZZY;COLLECTION_MATCH_FUZZY"
-77,3.66666,"Macrolobium archeri",1261560586,"Bajo Calima Concession. Ca 16 km N of Buenaventura, behind Pulpapel Forestry Station. 18 year old Secondary Forest on slightly hilly (10-20º slopes) terrain-clay.","COL",NA,1987,"PRESERVED_SPECIMEN","OCCURRENCE_STATUS_INFERRED_FROM_INDIVIDUAL_COUNT;GEODETIC_DATUM_ASSUMED_WGS84;INSTITUTION_MATCH_FUZZY;COLLECTION_MATCH_NONE"
