"lon","lat","species","gbifID","locality","countryCode","coordinateUncertaintyInMeters","year","basisOfRecord","issue"
47.195278,-24.564444,"Melanophylla crenata",1260382331,"Fort-Dauphin, Iaboko, Antsotso. Forêt Ivohibe. Echantillon préservé en alcool. Récolté avec E. Ramisa & B. Mara.","MDG",NA,2005,"PRESERVED_SPECIMEN","OCCURRENCE_STATUS_INFERRED_FROM_INDIVIDUAL_COUNT;COORDINATE_ROUNDED;GEODETIC_DATUM_ASSUMED_WGS84;DIFFERENT_OWNER_INSTITUTION"
48.46666,-18.93333,"Melanophylla crenata",4061302288,"Est : Massif d'Andriandavibe, près d'Anevoka, à l'Est de Périnet, entre 850 et 1000 m d'altitude.","MDG",NA,1965,"PRESERVED_SPECIMEN","GEODETIC_DATUM_ASSUMED_WGS84;DIFFERENT_OWNER_INSTITUTION"
48.311944,-19.539722,"Melanophylla crenata",4061835603,"District Anosibe an'Ala, Commune rurale Tratramarina, Fokontany Ambonihiboka, forêt Ambatofotsy, accompagné de M. Christophe Rahaingonirina de l'association Ambarakaly","MDG",NA,2010,"PRESERVED_SPECIMEN","OCCURRENCE_STATUS_INFERRED_FROM_INDIVIDUAL_COUNT;COORDINATE_ROUNDED;GEODETIC_DATUM_ASSUMED_WGS84;DIFFERENT_OWNER_INSTITUTION"
49.199722,-17.918611,"Melanophylla crenata",1257678191,"Ambodiriana, Andrantambe, Rendrirendry.","MDG",NA,2010,"PRESERVED_SPECIMEN","OCCURRENCE_STATUS_INFERRED_FROM_INDIVIDUAL_COUNT;COORDINATE_ROUNDED;GEODETIC_DATUM_ASSUMED_WGS84;DIFFERENT_OWNER_INSTITUTION"
48.5,-18.86666,"Melanophylla crenata",4031879237,"D'Ambatondrazaka Dist. Vicinity of 15 KM marker on mine road to Tsaravoniana encampment, NE of Izuard main processing station. Steep muddy roadcut through disturbed primary forest. Collected with D.K. Harder, E.A. Rakotobe, T.G. Razafindrabeaza, M.I.L. Rakotozafy & J.P. Abraham.","MDG",NA,1992,"PRESERVED_SPECIMEN","OCCURRENCE_STATUS_INFERRED_FROM_INDIVIDUAL_COUNT;GEODETIC_DATUM_ASSUMED_WGS84;INSTITUTION_MATCH_FUZZY;COLLECTION_MATCH_NONE"
47.5333,-21.15,"Melanophylla crenata",1936641803,"Fianarantsoa. Ranomafana National Park, Parcelle I, SW of Miaranony.","MDG",NA,1992,"PRESERVED_SPECIMEN","GEODETIC_DATUM_ASSUMED_WGS84;CONTINENT_DERIVED_FROM_COORDINATES;INSTITUTION_MATCH_FUZZY;COLLECTION_MATCH_FUZZY"
47.818865,-19.720876,"Melanophylla crenata",2561484069,"Ankadivory, Tsinjoarivo.","MDG",NA,2017,"PRESERVED_SPECIMEN","OCCURRENCE_STATUS_INFERRED_FROM_INDIVIDUAL_COUNT;COORDINATE_ROUNDED;GEODETIC_DATUM_ASSUMED_WGS84;INSTITUTION_MATCH_FUZZY;COLLECTION_MATCH_NONE"
47.003611,-22.227778,"Melanophylla crenata",4031922484,"Andringitra, Camp II, ca. 43 km S of Ambalavao, Andringitra Reserve, junction of the Sahanivoraky and Sahavatoy Rivers. Collected with J. Raharimalala, G. Rahajasoa, M. Randriambololona & J. McDonagh.","MDG",NA,1993,"PRESERVED_SPECIMEN","OCCURRENCE_STATUS_INFERRED_FROM_INDIVIDUAL_COUNT;COORDINATE_ROUNDED;GEODETIC_DATUM_ASSUMED_WGS84;INSTITUTION_MATCH_FUZZY;COLLECTION_MATCH_NONE"
47.45,-21.28333,"Melanophylla crenata",4031364190,"Parc National de Ranomafana, Parcelle I. Au Nord de Ranomafana autour de Ranomena. Plantes preservées en alcool.","MDG",NA,1992,"PRESERVED_SPECIMEN","OCCURRENCE_STATUS_INFERRED_FROM_INDIVIDUAL_COUNT;GEODETIC_DATUM_ASSUMED_WGS84;INSTITUTION_MATCH_FUZZY;COLLECTION_MATCH_NONE"
47.0975,-24.511111,"Melanophylla crenata",4032122528,"Toliara, Taolagnaro, Région Anosy, Commune rurale de Bevoay. Fkt: Fenoambony. Forêt subhumide de basse altitude à l'Est du village Androangabe, vers le sommet d'Ampanola.","MDG",NA,2009,"PRESERVED_SPECIMEN","OCCURRENCE_STATUS_INFERRED_FROM_INDIVIDUAL_COUNT;COORDINATE_ROUNDED;GEODETIC_DATUM_ASSUMED_WGS84;INSTITUTION_MATCH_FUZZY;COLLECTION_MATCH_NONE"
48.574722,-19.158889,"Melanophylla crenata",4031639351,"Atsinanana, Vatomandry, Ambalabe, Ambinanindrano II. Echantillon préservé en alcool.","MDG",NA,2007,"PRESERVED_SPECIMEN","OCCURRENCE_STATUS_INFERRED_FROM_INDIVIDUAL_COUNT;COORDINATE_ROUNDED;GEODETIC_DATUM_ASSUMED_WGS84;INSTITUTION_MATCH_FUZZY;COLLECTION_MATCH_NONE"
48.23333,-19.11667,"Melanophylla crenata",437537224,"Sandrangato","MDG",NA,1952,"PRESERVED_SPECIMEN","GEODETIC_DATUM_ASSUMED_WGS84;CONTINENT_DERIVED_FROM_COORDINATES;COLLECTION_MATCH_FUZZY"
46.96,-22.47,"Melanophylla crenata",4031500565,"Fiv. & Fir. Ivohibe, limite nord de Réserve Spéciale d'Ivohibe, 7.5 km ENE d'Ivohibe. Dans une ouverture de la forêt. Echantillon préservé en alcool.","MDG",NA,1997,"PRESERVED_SPECIMEN","OCCURRENCE_STATUS_INFERRED_FROM_INDIVIDUAL_COUNT;GEODETIC_DATUM_ASSUMED_WGS84;INSTITUTION_MATCH_FUZZY;COLLECTION_MATCH_NONE"
47.401667,-21.501944,"Melanophylla crenata",4062106670,"2 km Ouest de la gare Andrambovato, côte Riv. Tatamaly. Forêt de moyenne altitude. Echantillon préservé en alcool.","MDG",NA,2000,"PRESERVED_SPECIMEN","OCCURRENCE_STATUS_INFERRED_FROM_INDIVIDUAL_COUNT;COORDINATE_ROUNDED;GEODETIC_DATUM_ASSUMED_WGS84;DIFFERENT_OWNER_INSTITUTION"
48.4,-19.11666,"Melanophylla crenata",1258454353,"Sahataimboalavo, village d'Ambodigavo, canton de Lakato, sous-préfecture de Moramanga. Sol humifère. Station: bas fond.","MDG",NA,1965,"PRESERVED_SPECIMEN","GEODETIC_DATUM_ASSUMED_WGS84;DIFFERENT_OWNER_INSTITUTION"
48.73333,-17.96666,"Melanophylla crenata",1258455438,"Rahobevava","MDG",NA,1951,"PRESERVED_SPECIMEN","GEODETIC_DATUM_ASSUMED_WGS84;DIFFERENT_OWNER_INSTITUTION"
46.78333,-24.76666,"Melanophylla crenata",4062001124,"Est (Sud) : Environs Nord du col du Maningotry (Fort-Dauphin)","MDG",NA,1963,"PRESERVED_SPECIMEN","GEODETIC_DATUM_ASSUMED_WGS84;DIFFERENT_OWNER_INSTITUTION"
48.90027,-17.56361,"Melanophylla crenata",1259163105,"Fivondronana: Vavatenina, Commune: Ambodimangavalo, Fokontany: Mahasoa/Ambatoharanana, Rivière Moango. A l'intérieur du Parc National de Zahamena. Forêt dense humide de basse altitude. Récolté avec S. Rakotonandrasana, R. Rakotondrajaona, J. Randriamanarivo, L.M. Randrianjanaka, A. Belalahy & J. Rapaoly mananjara.","MDG",NA,2000,"PRESERVED_SPECIMEN","OCCURRENCE_STATUS_INFERRED_FROM_INDIVIDUAL_COUNT;GEODETIC_DATUM_ASSUMED_WGS84;DIFFERENT_OWNER_INSTITUTION"
48.83333,-17.63333,"Melanophylla crenata",439536024,"Zahamena","MDG",NA,1953,"PRESERVED_SPECIMEN","GEODETIC_DATUM_ASSUMED_WGS84;CONTINENT_DERIVED_FROM_COORDINATES;COLLECTION_MATCH_FUZZY"
48.2,-19.28333,"Melanophylla crenata",4061312644,"Est (confins du Centre) : forêt à mousses et sous-bois herbacé aux environs Ouest du village d'Antanandava (PK. 45 de la route Moramanga- Anosibe)","MDG",NA,1968,"PRESERVED_SPECIMEN","GEODETIC_DATUM_ASSUMED_WGS84;DIFFERENT_OWNER_INSTITUTION"
48.01,-18.49,"Melanophylla crenata",1451073439,"Fivondronana: Moramange, Fokontany: Ambongabe, Folret humide de moyenne altitude d'Ambodikija","MDG",0.2,2005,"PRESERVED_SPECIMEN","GEODETIC_DATUM_ASSUMED_WGS84;CONTINENT_DERIVED_FROM_COORDINATES;INSTITUTION_MATCH_FUZZY;COLLECTION_MATCH_FUZZY"
48.43,-17.9,"Melanophylla crenata",912322874,"","MDG",NA,2002,"PRESERVED_SPECIMEN","GEODETIC_DATUM_ASSUMED_WGS84;CONTINENT_DERIVED_FROM_COORDINATES;INSTITUTION_MATCH_FUZZY;COLLECTION_MATCH_FUZZY"
49.666667,-14.516667,"Melanophylla crenata",2517758369,"Antsiranana. Andapa, Belaoko Lokoho, au nord d'Andapa. Réserve Naturelle Intégrale de Marojejy.","MDG",NA,1995,"PRESERVED_SPECIMEN","INSTITUTION_MATCH_FUZZY;INSTITUTION_COLLECTION_MISMATCH"
46.833333,-21.766667,"Melanophylla crenata",2517741363,"Fianarantsoa. Au pied de la colline Ambodivohitra, 15.5 km SE de Vohitrafeno.","MDG",NA,2000,"PRESERVED_SPECIMEN","INSTITUTION_MATCH_FUZZY;INSTITUTION_COLLECTION_MISMATCH"
47.46667,-21.75,"Melanophylla crenata",439203038,"","MDG",NA,1986,"PRESERVED_SPECIMEN","GEODETIC_DATUM_ASSUMED_WGS84;CONTINENT_DERIVED_FROM_COORDINATES;COLLECTION_MATCH_FUZZY"
