"lon","lat","species","gbifID","locality","countryCode","coordinateUncertaintyInMeters","year","basisOfRecord","issue"
49.753611,-13.230556,"Memecylon minimifolium",4062177233,"Antsiranana, Vohemar, Daraina, Forêt de Bobankora. Récolté avec F. Ratovoson, J.B. Leopold & Narcisse. Echantillons préservés en alcool.","MDG",NA,2005,"PRESERVED_SPECIMEN","OCCURRENCE_STATUS_INFERRED_FROM_INDIVIDUAL_COUNT;COORDINATE_ROUNDED;GEODETIC_DATUM_ASSUMED_WGS84;DIFFERENT_OWNER_INSTITUTION"
47.098056,-17.858611,"Memecylon minimifolium",4061338293,"District Ankazobe, Commune Tsaramasoandro, Fokontany Irindravato, Village Antokonana. Herbier conservé en alcool. Collecté avec Rakotonirina Celestin.","MDG",NA,2021,"PRESERVED_SPECIMEN","OCCURRENCE_STATUS_INFERRED_FROM_INDIVIDUAL_COUNT;COORDINATE_ROUNDED;GEODETIC_DATUM_ASSUMED_WGS84;DIFFERENT_OWNER_INSTITUTION"
47.171389,-18.081667,"Memecylon minimifolium",4031983018,"District Ankazobe. Commune Talatan'Angavo. FKT Manitanitsiloza. Andrefan'ny tetezana Andranofeno Sud","MDG",NA,2017,"PRESERVED_SPECIMEN","OCCURRENCE_STATUS_INFERRED_FROM_INDIVIDUAL_COUNT;COORDINATE_ROUNDED;GEODETIC_DATUM_ASSUMED_WGS84;INSTITUTION_MATCH_FUZZY;COLLECTION_MATCH_NONE"
44.477056,-17.911444,"Memecylon minimifolium",4031703528,"Maintirano, Belitsaka, Ambinda","MDG",NA,2009,"PRESERVED_SPECIMEN","OCCURRENCE_STATUS_INFERRED_FROM_INDIVIDUAL_COUNT;COORDINATE_ROUNDED;GEODETIC_DATUM_ASSUMED_WGS84;INSTITUTION_MATCH_FUZZY;COLLECTION_MATCH_NONE"
47.052938,-18.076398,"Memecylon minimifolium",4032170223,"District Ankazobe, Commune Kiangara, Fonkotany Tsiafahy, Village Antanetibe, Forêt Analafasika. Herbier conservé en alcool. Guide Rakotoarivelo Jean Philbert et Razafintsalama Jean Pierre.","MDG",NA,2022,"PRESERVED_SPECIMEN","OCCURRENCE_STATUS_INFERRED_FROM_INDIVIDUAL_COUNT;COORDINATE_ROUNDED;GEODETIC_DATUM_ASSUMED_WGS84;INSTITUTION_MATCH_FUZZY;COLLECTION_MATCH_NONE"
44.513333,-18.061944,"Memecylon minimifolium",4061243275,"Beanka, partie sud. Sarodrano","MDG",NA,2011,"PRESERVED_SPECIMEN","OCCURRENCE_STATUS_INFERRED_FROM_INDIVIDUAL_COUNT;GEODETIC_DATUM_ASSUMED_WGS84;DIFFERENT_OWNER_INSTITUTION"
47.315556,-20.744722,"Memecylon minimifolium",1257653970,"Fatihita.","MDG",NA,2010,"PRESERVED_SPECIMEN","OCCURRENCE_STATUS_INFERRED_FROM_INDIVIDUAL_COUNT;COORDINATE_ROUNDED;GEODETIC_DATUM_ASSUMED_WGS84;DIFFERENT_OWNER_INSTITUTION"
