"lon","lat","species","gbifID","locality","countryCode","coordinateUncertaintyInMeters","year","basisOfRecord","issue"
48.830278,-18.3975,"Mendoncia cowanii",4061658335,"Commune rurale de Maroseranana, fokontany Ambatolampy, piste vers Beravidravina","MDG",NA,2012,"PRESERVED_SPECIMEN","OCCURRENCE_STATUS_INFERRED_FROM_INDIVIDUAL_COUNT;COORDINATE_ROUNDED;GEODETIC_DATUM_ASSUMED_WGS84;DIFFERENT_OWNER_INSTITUTION"
49.120278,-18.028056,"Mendoncia cowanii",2268916283,"District de Toamasina II, Commune Rurale de Sahambala, Fokontany de Sahavongo, village de Sahavongo, forêt d'Andasibe.","MDG",NA,2017,"PRESERVED_SPECIMEN","OCCURRENCE_STATUS_INFERRED_FROM_INDIVIDUAL_COUNT;COORDINATE_ROUNDED;GEODETIC_DATUM_ASSUMED_WGS84;DIFFERENT_OWNER_INSTITUTION"
49.185833,-12.600556,"Mendoncia cowanii",4061257580,"Montagne d'Ambre, partie centrale. A 960 m du point cote 924, au 254?","MDG",NA,2008,"PRESERVED_SPECIMEN","OCCURRENCE_STATUS_INFERRED_FROM_INDIVIDUAL_COUNT;GEODETIC_DATUM_ASSUMED_WGS84;DIFFERENT_OWNER_INSTITUTION"
48.31444,-18.80805,"Mendoncia cowanii",1260122327,"District: Moramanga, Commune: Ambohibary, Fokontany: Ampitambe. Ambatovy, NE de Moramanga, environ 22 km de Moramanga. Forêt sur marécage saisonnière. Sol cuirasse. Echantillons préservé en alcool. Récolté avec F. Edmond, R. Razafindasy, P. Antilahimena & M. Razanatsoa","MDG",NA,2005,"PRESERVED_SPECIMEN","OCCURRENCE_STATUS_INFERRED_FROM_INDIVIDUAL_COUNT;GEODETIC_DATUM_ASSUMED_WGS84;DIFFERENT_OWNER_INSTITUTION"
49.186944,-13.241667,"Mendoncia cowanii",4061292083,"Antsatrotro. Massif de Manongarivo: Bassin de Maitsamalaza, nord-est d'Antsatrotro","MDG",NA,2000,"PRESERVED_SPECIMEN","OCCURRENCE_STATUS_INFERRED_FROM_INDIVIDUAL_COUNT;GEODETIC_DATUM_ASSUMED_WGS84;DIFFERENT_OWNER_INSTITUTION"
49.432778,-14.745,"Mendoncia cowanii",4060883685,"Camp 3. Summit vegetation of Anjanaharibe-Sud (amongst Phillipia, Asteraceae, Symphonia and bamboo).","MDG",NA,1995,"PRESERVED_SPECIMEN","OCCURRENCE_STATUS_INFERRED_FROM_INDIVIDUAL_COUNT;COORDINATE_ROUNDED;GEODETIC_DATUM_ASSUMED_WGS84;INSTITUTION_MATCH_NONE"
48.374722,-14.0825,"Mendoncia cowanii",4060996871,"Reserve Special de Manongarivo, Massif d'Antsatrotro. 1er camp. Piste longument la rivière en remontant, la rivier|9e près du campement. Avec: B. Lewis, P. Derleth, M. Andrianarijata, G.M. Rahajasoa, F. Andriatsiferana, M. Randriambololona & D.D. Fenozara.","MDG",NA,1994,"PRESERVED_SPECIMEN","OCCURRENCE_STATUS_INFERRED_FROM_INDIVIDUAL_COUNT;COORDINATE_ROUNDED;GEODETIC_DATUM_ASSUMED_WGS84;INSTITUTION_MATCH_NONE"
48.55527,-19.13861,"Mendoncia cowanii",1260890257,"Antsinanana, Vatomandry, Ambalabe, Ambinanindrano II, direction au bord de la rivière Zanaky Salampona. Echantillons préservés en alcool.","MDG",NA,2008,"PRESERVED_SPECIMEN","OCCURRENCE_STATUS_INFERRED_FROM_INDIVIDUAL_COUNT;GEODETIC_DATUM_ASSUMED_WGS84;DIFFERENT_OWNER_INSTITUTION"
49.066389,-17.959444,"Mendoncia cowanii",2268901404,"District Toamasina II, Commune Rurale de Sahambala, Fkt Ambodiara.","MDG",NA,2017,"PRESERVED_SPECIMEN","OCCURRENCE_STATUS_INFERRED_FROM_INDIVIDUAL_COUNT;COORDINATE_ROUNDED;GEODETIC_DATUM_ASSUMED_WGS84;DIFFERENT_OWNER_INSTITUTION"
48.154722,-19.031667,"Mendoncia cowanii",4062154134,"Région Alaotra-Mangoro, District de Moramanga, Commune Amboasary, FKT Antsily, forêt d'Antadina","MDG",NA,2012,"PRESERVED_SPECIMEN","OCCURRENCE_STATUS_INFERRED_FROM_INDIVIDUAL_COUNT;COORDINATE_ROUNDED;GEODETIC_DATUM_ASSUMED_WGS84;DIFFERENT_OWNER_INSTITUTION"
49.2,-17.85,"Mendoncia cowanii",4060883443,"East Coast. Betampona Rèserve Naturelle Intègrale, 40 km NW of Toamasina.","MDG",NA,1993,"PRESERVED_SPECIMEN","OCCURRENCE_STATUS_INFERRED_FROM_INDIVIDUAL_COUNT;GEODETIC_DATUM_ASSUMED_WGS84;INSTITUTION_MATCH_NONE"
48.27805,-18.86777,"Mendoncia cowanii",4061542217,"Moramanga, Andasibe, Menalamba,Ambatovy, Sahavira forest, disturbed forest. Forest without crust. Samples preserved in alcohol.","MDG",NA,2005,"PRESERVED_SPECIMEN","OCCURRENCE_STATUS_INFERRED_FROM_INDIVIDUAL_COUNT;GEODETIC_DATUM_ASSUMED_WGS84;DIFFERENT_OWNER_INSTITUTION"
47.515833,-23.445,"Mendoncia cowanii",1257625502,"Atsimo-Atsinanana, Vangaindrano, Sianofana, Ambatomalama, forêt de Vohipaho.","MDG",NA,2009,"PRESERVED_SPECIMEN","OCCURRENCE_STATUS_INFERRED_FROM_INDIVIDUAL_COUNT;COORDINATE_ROUNDED;GEODETIC_DATUM_ASSUMED_WGS84;DIFFERENT_OWNER_INSTITUTION"
47.42,-21.2569,"Mendoncia cowanii",1319448269,"Prov. Fianarantsoa, Ranomafana Natural Reserve","MDG",NA,2005,"PRESERVED_SPECIMEN","GEODETIC_DATUM_ASSUMED_WGS84"
47.93333,-18.91666,"Mendoncia cowanii",1261207686,"Mandraka. P.K. 69, route d'Antananarivo à Toamasina. Forêt Humide.","MDG",NA,1984,"PRESERVED_SPECIMEN","OCCURRENCE_STATUS_INFERRED_FROM_INDIVIDUAL_COUNT;GEODETIC_DATUM_ASSUMED_WGS84;INSTITUTION_MATCH_FUZZY;COLLECTION_MATCH_NONE"
48.416667,-18.933333,"Mendoncia cowanii",1261207539,"Environs d'Andasibe-Périnet. Higher areas with Weinmannia (Cunoniaceae) + Tambourissa (Monimiaceae). Low, moist areas with Ficus (Moraceae).","MDG",NA,1984,"PRESERVED_SPECIMEN","OCCURRENCE_STATUS_INFERRED_FROM_INDIVIDUAL_COUNT;COORDINATE_ROUNDED;GEODETIC_DATUM_ASSUMED_WGS84;INSTITUTION_MATCH_FUZZY;COLLECTION_MATCH_NONE"
49.6,-14.416667,"Mendoncia cowanii",4031781183,"Marojejy, NW, camp I. 0,2 km au N du camp I","MDG",NA,2001,"PRESERVED_SPECIMEN","OCCURRENCE_STATUS_INFERRED_FROM_INDIVIDUAL_COUNT;GEODETIC_DATUM_ASSUMED_WGS84;INSTITUTION_MATCH_FUZZY;COLLECTION_MATCH_NONE"
49.283333,-14.45,"Mendoncia cowanii",1212475317,"Reserve Naturelle de Marojejy; Reserve Naturelle Marojejy , along the trail to the summit of Marojejy Est , NW of Mandena .","MDG",NA,1988,"PRESERVED_SPECIMEN","OCCURRENCE_STATUS_INFERRED_FROM_INDIVIDUAL_COUNT;COORDINATE_ROUNDED;INSTITUTION_MATCH_FUZZY;COLLECTION_MATCH_NONE"
49.783333,-14.45,"Mendoncia cowanii",1212475320,"Reserve Naturelle de Marojejy; Reserve Naturelle Marojejy , western slopes of Mt. Beondroka .","MDG",NA,1989,"PRESERVED_SPECIMEN","OCCURRENCE_STATUS_INFERRED_FROM_INDIVIDUAL_COUNT;COORDINATE_ROUNDED;INSTITUTION_MATCH_FUZZY;COLLECTION_MATCH_NONE"
47.533333,-21.15,"Mendoncia cowanii",1212475321,"Ranomafana Natioal Parc , Parcelle I , near village of Miaranomy , Anosimasina .","MDG",NA,1992,"PRESERVED_SPECIMEN","OCCURRENCE_STATUS_INFERRED_FROM_INDIVIDUAL_COUNT;COORDINATE_ROUNDED;INSTITUTION_MATCH_FUZZY;COLLECTION_MATCH_NONE"
49.651389,-14.600278,"Mendoncia cowanii",1212475306,"Marojejy RN I , Andapa . Environ 3.5 km à vol d' oiseau de Marovato (80° nord -est ) et 2 km à vol d' oiseau de Sarahandrano (60° nord -est ) soit 8 km environ à pied .","MDG",NA,1995,"PRESERVED_SPECIMEN","OCCURRENCE_STATUS_INFERRED_FROM_INDIVIDUAL_COUNT;COORDINATE_ROUNDED;INSTITUTION_MATCH_FUZZY;COLLECTION_MATCH_NONE"
47.7,-23.033333,"Mendoncia cowanii",1212475152,"Reserve Speciale # 7 , Manombo , 37 km S of Farafangana , parcel W of Route Nationale 12 on laterite .","MDG",NA,1991,"PRESERVED_SPECIMEN","OCCURRENCE_STATUS_INFERRED_FROM_INDIVIDUAL_COUNT;COORDINATE_ROUNDED;INSTITUTION_MATCH_FUZZY;COLLECTION_MATCH_NONE"
46.883333,-24.766667,"Mendoncia cowanii",1212475220,"NW of town , along road to Ranomafana .","MDG",NA,1990,"PRESERVED_SPECIMEN","OCCURRENCE_STATUS_INFERRED_FROM_INDIVIDUAL_COUNT;COORDINATE_ROUNDED;INSTITUTION_MATCH_FUZZY;COLLECTION_MATCH_NONE"
46.96,-22.47,"Mendoncia cowanii",1212475279,"Ivohibe; Limite nord de la Réserve Spéciale d' Ivohibe le long de la rivière Ifefitany , 7.5 km Est -Nord-Est d' Ivohibe . Campement 1 .","MDG",NA,1997,"PRESERVED_SPECIMEN","OCCURRENCE_STATUS_INFERRED_FROM_INDIVIDUAL_COUNT;INSTITUTION_MATCH_FUZZY;COLLECTION_MATCH_NONE"
48.133333,-18.883333,"Mendoncia cowanii",1212475287,"Ankarahara","MDG",NA,1961,"PRESERVED_SPECIMEN","OCCURRENCE_STATUS_INFERRED_FROM_INDIVIDUAL_COUNT;COORDINATE_ROUNDED;INSTITUTION_MATCH_FUZZY;COLLECTION_MATCH_NONE"
46.766667,-24.633333,"Mendoncia cowanii",1212475288,"NW of Tolanaro , Reserve Naturelle Integrale #11 ( Andohahela ) parcelle I , NW of Eminiminy , beside River Itrotroky .","MDG",NA,1993,"PRESERVED_SPECIMEN","OCCURRENCE_STATUS_INFERRED_FROM_INDIVIDUAL_COUNT;COORDINATE_ROUNDED;INSTITUTION_MATCH_FUZZY;COLLECTION_MATCH_NONE"
48.454068,-19.0132,"Mendoncia cowanii",2873989632,"","MDG",1719,2019,"HUMAN_OBSERVATION","CONTINENT_DERIVED_FROM_COORDINATES"
48.432257,-18.829705,"Mendoncia cowanii",2237421394,"","MDG",8,2019,"HUMAN_OBSERVATION","COORDINATE_ROUNDED;CONTINENT_DERIVED_FROM_COORDINATES"
47.016667,-22.216667,"Mendoncia cowanii",2517508015,"Fianarantsoa. Ivohibe, Ivongo, Ambarongy. RNI. Andringitra.","MDG",NA,1994,"PRESERVED_SPECIMEN","INSTITUTION_MATCH_FUZZY;INSTITUTION_COLLECTION_MISMATCH"
49.133333,-12.516667,"Mendoncia cowanii",2517839709,"Antsiranana. Roussettes SF. Echantillon preserve en alcool. recolte avec Bezana Roch.","MDG",NA,1993,"PRESERVED_SPECIMEN","INSTITUTION_MATCH_FUZZY;INSTITUTION_COLLECTION_MISMATCH"
49.37833,-14.23194,"Mendoncia cowanii",4031701466,"Sava, Andapa, Doany, Anjialavahely, Antsahabalika situé à 10 Km vol d'oiseau au Nord d'Anjialava. Echantillon préservé en alcool. Récolté avec Patriode, Mobel & Germain.","MDG",NA,2006,"PRESERVED_SPECIMEN","OCCURRENCE_STATUS_INFERRED_FROM_INDIVIDUAL_COUNT;GEODETIC_DATUM_ASSUMED_WGS84;INSTITUTION_MATCH_FUZZY;COLLECTION_MATCH_NONE"
48.311944,-19.539722,"Mendoncia cowanii",4032117703,"District Anosibe an'Ala, Commune rurale Tratramarina, Fokontany Ambonihiboka, forêt Ambatofotsy, accompagné de M. Christophe Rahaingonirina de l'association Ambarakaly","MDG",NA,2010,"PRESERVED_SPECIMEN","OCCURRENCE_STATUS_INFERRED_FROM_INDIVIDUAL_COUNT;COORDINATE_ROUNDED;GEODETIC_DATUM_ASSUMED_WGS84;INSTITUTION_MATCH_FUZZY;COLLECTION_MATCH_NONE"
49.174444,-12.684167,"Mendoncia cowanii",4032152131,"Montagne d'Ambre, partie sud.","MDG",NA,2012,"PRESERVED_SPECIMEN","OCCURRENCE_STATUS_INFERRED_FROM_INDIVIDUAL_COUNT;GEODETIC_DATUM_ASSUMED_WGS84;INSTITUTION_MATCH_FUZZY;COLLECTION_MATCH_NONE"
49.533333,-14.705556,"Mendoncia cowanii",2517649723,"Antsiranana. Andranotsarabe, Befingotra, Bealampona, Andapa.","MDG",NA,1994,"PRESERVED_SPECIMEN","INSTITUTION_MATCH_FUZZY;INSTITUTION_COLLECTION_MISMATCH"
46.8,-24.666667,"Mendoncia cowanii",2515993992,"Intégrale Réserve # 11, Andohahela, Parcelle 1, southwest of Eminiminy, Manatavona River.","MDG",NA,1993,"PRESERVED_SPECIMEN","INSTITUTION_MATCH_FUZZY;INSTITUTION_COLLECTION_MISMATCH"
49.446111,-14.919444,"Mendoncia cowanii",4031634754,"Fokotany Tsaravilona Amparihy Androva, Champ d'exploitation minière. Echantillons préservés en alcool","MDG",NA,2008,"PRESERVED_SPECIMEN","OCCURRENCE_STATUS_INFERRED_FROM_INDIVIDUAL_COUNT;COORDINATE_ROUNDED;GEODETIC_DATUM_ASSUMED_WGS84;INSTITUTION_MATCH_FUZZY;COLLECTION_MATCH_NONE"
47.941944,-18.423333,"Mendoncia cowanii",4031946743,"District d'Anjozorobe, Commune d'Anjozorobe, Fokontany d'Antsahabe, Forêt d'Anjozorobe-Angavo, Andasin'i Jonera.","MDG",NA,2023,"PRESERVED_SPECIMEN","OCCURRENCE_STATUS_INFERRED_FROM_INDIVIDUAL_COUNT;COORDINATE_ROUNDED;GEODETIC_DATUM_ASSUMED_WGS84;INSTITUTION_MATCH_FUZZY;COLLECTION_MATCH_NONE"
48.87555,-17.64083,"Mendoncia cowanii",4031509639,"Fivondronana: Vavatenina, Commune: Ambodimangavalo. Limite Parc National de Zahamena. Rivière de Sahamora. Récolté avec F. Ratovoson, S. Rakotonandrasana, L. Randrianjanaka, R. Mananjara & Goalaka.","MDG",NA,2001,"PRESERVED_SPECIMEN","OCCURRENCE_STATUS_INFERRED_FROM_INDIVIDUAL_COUNT;GEODETIC_DATUM_ASSUMED_WGS84;INSTITUTION_MATCH_FUZZY;COLLECTION_MATCH_NONE"
48.819722,-18.525,"Mendoncia cowanii",4061095065,"Brickaville, Maroseranana, Ambodilendemy. Forêt orientale de la NAP Ankerana.","MDG",NA,2011,"PRESERVED_SPECIMEN","OCCURRENCE_STATUS_INFERRED_FROM_INDIVIDUAL_COUNT;COORDINATE_ROUNDED;GEODETIC_DATUM_ASSUMED_WGS84;DIFFERENT_OWNER_INSTITUTION"
48.783333,-14.016667,"Mendoncia cowanii",2423593671,"Réserve Naturelle Intégrale de Tsaratanana, Beangona, along the crest above the Antsahabe River. Fok. Ambinany Beangona, Fir. Marotolana, Fiv. Ambanja","MDG",NA,2000,"PRESERVED_SPECIMEN","COORDINATE_ROUNDED;GEODETIC_DATUM_ASSUMED_WGS84;COLLECTION_MATCH_FUZZY"
47.06,-24.556944,"Mendoncia cowanii",2268993883,"Fort Dauphin, Bevoay, Enakara. Forêt de Tsitongambarika, direction à l'Ouest de la rivière Ampasy. Échantillons préservés en alcool.","MDG",NA,2018,"PRESERVED_SPECIMEN","OCCURRENCE_STATUS_INFERRED_FROM_INDIVIDUAL_COUNT;COORDINATE_ROUNDED;GEODETIC_DATUM_ASSUMED_WGS84;DIFFERENT_OWNER_INSTITUTION"
49.45555,-17.70944,"Mendoncia cowanii",4062077956,"Sous/Préfecture Tamatave II, commune Foulpointe, Fokontany Morarano, forêt d'Analalava, à 7 km du SO de Foulpointe. Forêt dense humide de basse altitude sur latérite. Echantillons préservés en alcool. Récolté avec A. Lehavana, F. Levitason & Remy.","MDG",NA,2005,"PRESERVED_SPECIMEN","OCCURRENCE_STATUS_INFERRED_FROM_INDIVIDUAL_COUNT;GEODETIC_DATUM_ASSUMED_WGS84;DIFFERENT_OWNER_INSTITUTION"
48.631389,-19.230556,"Mendoncia cowanii",1257817550,"Atsinanana, Vatomandry, Ambalabe, Mahatsara. Forêt d'Antsofotra. Echantillons préservés en alcool.","MDG",NA,2012,"PRESERVED_SPECIMEN","OCCURRENCE_STATUS_INFERRED_FROM_INDIVIDUAL_COUNT;COORDINATE_ROUNDED;GEODETIC_DATUM_ASSUMED_WGS84;DIFFERENT_OWNER_INSTITUTION"
48.73333,-17.96667,"Mendoncia cowanii",438203177,"","MDG",NA,1951,"PRESERVED_SPECIMEN","GEODETIC_DATUM_ASSUMED_WGS84;CONTINENT_DERIVED_FROM_COORDINATES;COLLECTION_MATCH_FUZZY"
48.58333,-17.43333,"Mendoncia cowanii",438535912,"","MDG",NA,1959,"PRESERVED_SPECIMEN","GEODETIC_DATUM_ASSUMED_WGS84;CONTINENT_DERIVED_FROM_COORDINATES;COLLECTION_MATCH_FUZZY"
49.21667,-12.45,"Mendoncia cowanii",437654797,"","MDG",NA,1993,"PRESERVED_SPECIMEN","GEODETIC_DATUM_ASSUMED_WGS84;CONTINENT_DERIVED_FROM_COORDINATES;COLLECTION_MATCH_FUZZY"
49,-17.73333,"Mendoncia cowanii",439320759,"","MDG",NA,1993,"PRESERVED_SPECIMEN","GEODETIC_DATUM_ASSUMED_WGS84;CONTINENT_DERIVED_FROM_COORDINATES;COLLECTION_MATCH_FUZZY"
49.92722,-15.49944,"Mendoncia cowanii",4061006140,"Fiv: Maroantsetra. Comm: Anjahana. Fok: Hiaraka.","MDG",NA,2002,"PRESERVED_SPECIMEN","OCCURRENCE_STATUS_INFERRED_FROM_INDIVIDUAL_COUNT;GEODETIC_DATUM_ASSUMED_WGS84;INSTITUTION_MATCH_NONE"
49.43666,-13.68444,"Mendoncia cowanii",1260846148,"Diana, Vohemar, Andrafainkona. Forêt dense humide de moyenne altitude de Sorata. Echantillons traités en alcool.","MDG",NA,2007,"PRESERVED_SPECIMEN","OCCURRENCE_STATUS_INFERRED_FROM_INDIVIDUAL_COUNT;GEODETIC_DATUM_ASSUMED_WGS84;DIFFERENT_OWNER_INSTITUTION"
48.99527,-17.68555,"Mendoncia cowanii",4060992545,"Vavantenina. Commum: Miarinarivo, FKT Anamborano, Savaharina, PN Zahamena. Forêt dense humide de basse altitude, à côté de la rivière Ihofika, limite de PN. Récolté avec: Ratovoson F., Rasolohery A., Randriamanarivo J., Randrianjanaka L., Rakotozafy I., Bemalaza R. (ACZ), Tataina A. (guide).","MDG",NA,2001,"PRESERVED_SPECIMEN","OCCURRENCE_STATUS_INFERRED_FROM_INDIVIDUAL_COUNT;GEODETIC_DATUM_ASSUMED_WGS84;INSTITUTION_MATCH_NONE"
48.7,-19.1,"Mendoncia cowanii",2517682720,"Fianarantsoa Ranomafana, cloud forest.","MDG",NA,1992,"PRESERVED_SPECIMEN","INSTITUTION_MATCH_FUZZY;INSTITUTION_COLLECTION_MISMATCH"
45.526111,-18.291111,"Mendoncia cowanii",2423593943,"Tsiroanomandidy, fierenana, environ à 164 km à l'ouest de Tsiroanomandidy, région de Bongolava, Fokotany Ambaravaranala, Antsinainondry","MDG",NA,2008,"PRESERVED_SPECIMEN","COORDINATE_ROUNDED;GEODETIC_DATUM_ASSUMED_WGS84;COLLECTION_MATCH_FUZZY"
46.8,-17.05,"Mendoncia cowanii",437654796,"","MDG",NA,1955,"PRESERVED_SPECIMEN","GEODETIC_DATUM_ASSUMED_WGS84;CONTINENT_DERIVED_FROM_COORDINATES;COLLECTION_MATCH_FUZZY"
49.11667,-17.51667,"Mendoncia cowanii",439320761,"","MDG",NA,1993,"PRESERVED_SPECIMEN","GEODETIC_DATUM_ASSUMED_WGS84;CONTINENT_DERIVED_FROM_COORDINATES;COLLECTION_MATCH_FUZZY"
50.283333,-15.291667,"Mendoncia cowanii",1259079585,"Fivondronana: Antalaha. Commune: Ambohitralanana. Fokontany: Tanandavahely.","MDG",NA,2001,"PRESERVED_SPECIMEN","OCCURRENCE_STATUS_INFERRED_FROM_INDIVIDUAL_COUNT;COORDINATE_ROUNDED;GEODETIC_DATUM_ASSUMED_WGS84;INSTITUTION_MATCH_FUZZY;COLLECTION_MATCH_NONE"
