"lon","lat","species","gbifID","locality","countryCode","coordinateUncertaintyInMeters","year","basisOfRecord","issue"
49.359444,-12.360833,"Mimusops antsiranensis",1260396745,"Sous préfecture: Antsiranana II, Commune: Mahavanona, Fokontany: Andranomanitra, campement Antafiankoroka 3 km à l'Est du village d'Andranomanitra. Forêt dense sèche de la Montagne des Français sur substrat calcaire (Tsingy). Echantillons préservés en alcool. Récolté avec O. Randriambololomamonjy & J. Rasolofoson.","MDG",NA,2004,"PRESERVED_SPECIMEN","OCCURRENCE_STATUS_INFERRED_FROM_INDIVIDUAL_COUNT;COORDINATE_ROUNDED;GEODETIC_DATUM_ASSUMED_WGS84;DIFFERENT_OWNER_INSTITUTION"
49.34,-12.32,"Mimusops antsiranensis",1096816000,"Madagascar, Province de Antsiranana: Montagne des Français.","MDG",NA,2010,"PRESERVED_SPECIMEN","GEODETIC_DATUM_ASSUMED_WGS84;INSTITUTION_COLLECTION_MISMATCH"
49.45,-12.58,"Mimusops antsiranensis",1096816004,"Madagascar, Province de Antsiranana: Forêt de Sahafary.","MDG",NA,2010,"PRESERVED_SPECIMEN","GEODETIC_DATUM_ASSUMED_WGS84;INSTITUTION_COLLECTION_MISMATCH"
49.333333,-12.316667,"Mimusops antsiranensis",2517623233,"Madagascar. Ouest (Nord): Massif calcaire de la Montagne des Français: sommet d'Anosiravo.","MDG",NA,1962,"PRESERVED_SPECIMEN","INSTITUTION_MATCH_FUZZY;INSTITUTION_COLLECTION_MISMATCH"
49.2732,-12.343,"Mimusops antsiranensis",2425061790,"Andrafiabe","MDG",NA,2004,"PRESERVED_SPECIMEN","INSTITUTION_MATCH_FUZZY;COLLECTION_MATCH_NONE"
