"lon","lat","species","gbifID","locality","countryCode","coordinateUncertaintyInMeters","year","basisOfRecord","issue"
-86.87055,13.93361,"Monnina ferreyrae",1258820075,"Ciudad de Yuscarán, Cerro Monserrat","HND",NA,1978,"PRESERVED_SPECIMEN","GEODETIC_DATUM_ASSUMED_WGS84;INSTITUTION_MATCH_FUZZY;COLLECTION_MATCH_NONE"
-87.12444,14.06194,"Monnina ferreyrae",1258820052,"Cerro Triquilapa (La Montañita), 15 km E. de Tegucigalpa.","HND",NA,1977,"PRESERVED_SPECIMEN","GEODETIC_DATUM_ASSUMED_WGS84;INSTITUTION_MATCH_FUZZY;COLLECTION_MATCH_NONE"
-86.4655,13.756083,"Monnina ferreyrae",4031910908,"17.7 km N of Mozonte (highway), taking left fork, Finca Santa Gema; along stream in cafetal","NIC",NA,2017,"PRESERVED_SPECIMEN","OCCURRENCE_STATUS_INFERRED_FROM_INDIVIDUAL_COUNT;COORDINATE_ROUNDED;GEODETIC_DATUM_ASSUMED_WGS84;INSTITUTION_MATCH_FUZZY;COLLECTION_MATCH_NONE"
-87.10611,14.20611,"Monnina ferreyrae",1258820064,"Along road leading to San Juancito; about 20 km NE of Tegucigalpa","HND",NA,1975,"PRESERVED_SPECIMEN","GEODETIC_DATUM_ASSUMED_WGS84;INSTITUTION_MATCH_FUZZY;COLLECTION_MATCH_NONE"
-86.6,13.3,"Monnina ferreyrae",1258575574,"San José de Cusmapa, 1 km al E del Cerro de Buenavista.","NIC",NA,1982,"PRESERVED_SPECIMEN","OCCURRENCE_STATUS_INFERRED_FROM_INDIVIDUAL_COUNT;GEODETIC_DATUM_ASSUMED_WGS84;INSTITUTION_MATCH_FUZZY;COLLECTION_MATCH_NONE"
-87.86666,14.78333,"Monnina ferreyrae",1258588543,"Ridge of Cerro El Maneadero, along trail from San José de Los Planes, ca. 12-13 km E of Lago Yojoa, Parque Nacional Azúl Meámbar.","HND",NA,1993,"PRESERVED_SPECIMEN","OCCURRENCE_STATUS_INFERRED_FROM_INDIVIDUAL_COUNT;GEODETIC_DATUM_ASSUMED_WGS84;DIFFERENT_OWNER_INSTITUTION"
