"lon","lat","species","gbifID","locality","countryCode","coordinateUncertaintyInMeters","year","basisOfRecord","issue"
-78.5,0.35,"Monnina pichinchensis",4062104911,"Road to Intag valley at Río Cenepa above Apuela. Lower montane forest.","ECU",NA,1980,"PRESERVED_SPECIMEN","OCCURRENCE_STATUS_INFERRED_FROM_INDIVIDUAL_COUNT;GEODETIC_DATUM_ASSUMED_WGS84;INSTITUTION_MATCH_NONE"
-78.65,0.03333,"Monnina pichinchensis",1260270764,"Steep hillsides with disturbed cloud forest, c. 9 km by road SE of Nanegalito.","ECU",NA,1990,"PRESERVED_SPECIMEN","GEODETIC_DATUM_ASSUMED_WGS84;INSTITUTION_MATCH_FUZZY;COLLECTION_MATCH_NONE"
-78.8,0.216667,"Monnina pichinchensis",1260270099,"Reserva Floristica Ecologica Rio Guajalito Km. 59 de la antigua carretera Quito-Sto. Domingo de los Colorados, 3.5 km. al. Ne de la carretera, estribaciones occidentales del volcán Pichincha, Colecciones en bosque nublado de vegetation primaria y alrededores.","ECU",NA,1986,"PRESERVED_SPECIMEN","OCCURRENCE_STATUS_INFERRED_FROM_INDIVIDUAL_COUNT;COORDINATE_ROUNDED;GEODETIC_DATUM_ASSUMED_WGS84;INSTITUTION_MATCH_FUZZY;COLLECTION_MATCH_NONE"
-78.466667,-1.466667,"Monnina pichinchensis",4031717355,"NW slopes of Volcan Tungurahua below the refuge.","ECU",NA,1988,"PRESERVED_SPECIMEN","OCCURRENCE_STATUS_INFERRED_FROM_INDIVIDUAL_COUNT;COORDINATE_ROUNDED;GEODETIC_DATUM_ASSUMED_WGS84;INSTITUTION_MATCH_FUZZY;COLLECTION_MATCH_NONE"
-78.666667,-0.05,"Monnina pichinchensis",1258588710,"Carretera Quito-Lloa- Mindo. En bosque primario intervenido en zona mesotermica higrófila (muy húmeda), con vegetación representativa de Alnus, Weinmannia, Cedrela, Clusia, Palicourea, etc.","ECU",NA,1987,"PRESERVED_SPECIMEN","OCCURRENCE_STATUS_INFERRED_FROM_INDIVIDUAL_COUNT;COORDINATE_ROUNDED;GEODETIC_DATUM_ASSUMED_WGS84;INSTITUTION_MATCH_FUZZY;COLLECTION_MATCH_NONE"
-78.581389,-0.070556,"Monnina pichinchensis",1258655033,"Cerro el Castillo, carretera Nono-Tandayapa. Bosque húmedo montano bajo. Matorral junto al carretero.","ECU",NA,2000,"PRESERVED_SPECIMEN","OCCURRENCE_STATUS_INFERRED_FROM_INDIVIDUAL_COUNT;COORDINATE_ROUNDED;GEODETIC_DATUM_ASSUMED_WGS84;INSTITUTION_MATCH_NONE"
-78.8028,-0.2314,"Monnina pichinchensis",2284198574,"Reserva Floristica-Ecológica Rio Guajalito, km 59 de la carr. antigua Quito-Sto Domingo de los Colorados, 3.5 km al NE de la carretera.","ECU",NA,1985,"PRESERVED_SPECIMEN","GEODETIC_DATUM_ASSUMED_WGS84"
-78.483333,0.2,"Monnina pichinchensis",1260269492,"Valle del Lloa y Palmira, faldas SO del Volcán Pichincha 20-29 km. del carretero Quito-Lloa-Mindo. Vegetación de bosque nublado y Andino. Area lluviosa con suelo humífero, géneros representativos: Cedrela, Miconia, Eugenia, Buddleja, Solanum, Saurauia, Oreopanax, etc. Fech:","ECU",NA,1986,"PRESERVED_SPECIMEN","OCCURRENCE_STATUS_INFERRED_FROM_INDIVIDUAL_COUNT;COORDINATE_ROUNDED;GEODETIC_DATUM_ASSUMED_WGS84;INSTITUTION_MATCH_FUZZY;COLLECTION_MATCH_NONE"
