"lon","lat","species","gbifID","locality","countryCode","coordinateUncertaintyInMeters","year","basisOfRecord","issue"
-64.218056,-17.768056,"Mucuna mitis",1258965615,"PARQUE NACIONAL AMBORÓ. La Playa, 15-20 km al N de Santa Rosa de Lima. Riberas del Río Agua Dulce y juntas con el Río Moija.","BOL",NA,1993,"PRESERVED_SPECIMEN","OCCURRENCE_STATUS_INFERRED_FROM_INDIVIDUAL_COUNT;COORDINATE_ROUNDED;GEODETIC_DATUM_ASSUMED_WGS84;DIFFERENT_OWNER_INSTITUTION"
-77.616667,-1.066667,"Mucuna mitis",4061164267,"ESTACION BIOLOGICA JATUN SACHA Margen derecho del Río Napo, 8 km de Puerto Misahuallí. Bosque muy húmedo Tropical. Suelos rojos de colinas por bosque primario.","ECU",NA,1988,"PRESERVED_SPECIMEN","OCCURRENCE_STATUS_INFERRED_FROM_INDIVIDUAL_COUNT;COORDINATE_ROUNDED;GEODETIC_DATUM_ASSUMED_WGS84;DIFFERENT_OWNER_INSTITUTION"
-78.441389,-3.566389,"Mucuna mitis",4060953484,"Región de la Cordillera del Cóndor, vertiente occidental. Cantón El Pangui. Parroquia Tundayme. Valle del Río Quimi. Bosque húmedo premontano.","ECU",NA,2008,"PRESERVED_SPECIMEN","OCCURRENCE_STATUS_INFERRED_FROM_INDIVIDUAL_COUNT;COORDINATE_ROUNDED;GEODETIC_DATUM_ASSUMED_WGS84;DIFFERENT_OWNER_INSTITUTION"
-75.8333,-9.5,"Mucuna mitis",1228554837,"Huánuco","PER",NA,2012,"PRESERVED_SPECIMEN","GEODETIC_DATUM_ASSUMED_WGS84;INSTITUTION_MATCH_FUZZY;AMBIGUOUS_COLLECTION"
-77.68333,-1.05,"Mucuna mitis",4031857873,"Mishuallí. Rain forest in the surroundings of the junction Río Mishuallí - Río Napo.","ECU",NA,1979,"PRESERVED_SPECIMEN","GEODETIC_DATUM_ASSUMED_WGS84;INSTITUTION_MATCH_FUZZY;COLLECTION_MATCH_NONE"
-78.68638,-4.30638,"Mucuna mitis",4031920718,"Región de la Cordillera del Cóndor; cuenca alta del Río Nangaritza. Centro Shuar Shaime, por la unión de los Ríos Nangaritza y Numpatakaime. Cerca de la cueva de los tayos. Bosque muy húmedo premontano; substrato de roca calcárea.","ECU",NA,2002,"PRESERVED_SPECIMEN","GEODETIC_DATUM_ASSUMED_WGS84;INSTITUTION_MATCH_FUZZY;COLLECTION_MATCH_NONE"
-77.5,-2.38333,"Mucuna mitis",1258296125,"Taisha. Río Guambime. Riverside forest.","ECU",NA,1980,"PRESERVED_SPECIMEN","GEODETIC_DATUM_ASSUMED_WGS84;DIFFERENT_OWNER_INSTITUTION"
-78.03333,-1.65,"Mucuna mitis",1258234460,"Puento Santana.","ECU",NA,1968,"PRESERVED_SPECIMEN","GEODETIC_DATUM_ASSUMED_WGS84;DIFFERENT_OWNER_INSTITUTION"
-76.65,-1.483333,"Mucuna mitis",4061171495,"Río Curaray, costado sur, alrededores de la Laguna Garzayacu. Bosque Húmedo Tropical. Bosque primario, suelo aluvial, de mal drenaje.","ECU",NA,1985,"PRESERVED_SPECIMEN","OCCURRENCE_STATUS_INFERRED_FROM_INDIVIDUAL_COUNT;COORDINATE_ROUNDED;GEODETIC_DATUM_ASSUMED_WGS84;DIFFERENT_OWNER_INSTITUTION"
-76.583333,-0.466667,"Mucuna mitis",1261549905,"Parque Nacional Yasuní. Carretera y oleoducto de Maxus en construcción, Km 5. Bosque húmedo Tropical. Bosque primario. Suelos rojos.","ECU",NA,1993,"PRESERVED_SPECIMEN","OCCURRENCE_STATUS_INFERRED_FROM_INDIVIDUAL_COUNT;COORDINATE_ROUNDED;GEODETIC_DATUM_ASSUMED_WGS84;INSTITUTION_MATCH_NONE"
-77.45,0.13333,"Mucuna mitis",1259054043,"Parroquia Pto. Libre (San Pedro de los Cofanes). Comunidad Cofán de Sinangüe. Entra la Parcela Permanenta, Charcras y Jardin de la Cominidad Cofá de sinanque. Bosque Húmedo Premontano. Consuela Montalvo, Jose Umenda, Calixto Umenda y Jorge Criollo.","ECU",NA,1992,"PRESERVED_SPECIMEN","OCCURRENCE_STATUS_INFERRED_FROM_INDIVIDUAL_COUNT;GEODETIC_DATUM_ASSUMED_WGS84;INSTITUTION_MATCH_FUZZY;COLLECTION_MATCH_NONE"
-75.416667,-9.666667,"Mucuna mitis",1261890258,"Codo de Pozuzo: Alluvial fan floodplain of Río Pozuzo after it emerges from mountains, trail E of settlement.","PER",NA,1982,"PRESERVED_SPECIMEN","OCCURRENCE_STATUS_INFERRED_FROM_INDIVIDUAL_COUNT;COORDINATE_ROUNDED;GEODETIC_DATUM_ASSUMED_WGS84;INSTITUTION_MATCH_FUZZY;COLLECTION_MATCH_NONE"
-78.31666,-4.91666,"Mucuna mitis",1261839345,"Distrito Imaza: Región Nororiental del Marañon. Comunidad de Yamayakat, Río Marañon. Bosque de transición.","PER",NA,1994,"PRESERVED_SPECIMEN","OCCURRENCE_STATUS_INFERRED_FROM_INDIVIDUAL_COUNT;GEODETIC_DATUM_ASSUMED_WGS84;INSTITUTION_MATCH_FUZZY;COLLECTION_MATCH_NONE"
-78.66666,-4.33333,"Mucuna mitis",1261842989,"Río Nangaritza. Shaime. Confluence of Nangaritza and Numpatakaime rivers. Tropical Premontane Wet Forest. Primary and disturbed forest. Limestone bedrock exposed in places.","ECU",NA,1990,"PRESERVED_SPECIMEN","OCCURRENCE_STATUS_INFERRED_FROM_INDIVIDUAL_COUNT;GEODETIC_DATUM_ASSUMED_WGS84;INSTITUTION_MATCH_FUZZY;COLLECTION_MATCH_NONE"
-71.53432,-13.05084,"Mucuna mitis",3762889529,"San Pedro 1; SP1","PER",NA,2009,"PRESERVED_SPECIMEN","GEODETIC_DATUM_ASSUMED_WGS84;CONTINENT_DERIVED_FROM_COORDINATES;INSTITUTION_MATCH_FUZZY;INSTITUTION_COLLECTION_MISMATCH"
-77.5,-0.9666,"Mucuna mitis",1260596442,"Chonta Punta at Rio Napo, in the vicinity of Santa Rosa.","ECU",NA,1972,"PRESERVED_SPECIMEN","OCCURRENCE_STATUS_INFERRED_FROM_INDIVIDUAL_COUNT;GEODETIC_DATUM_ASSUMED_WGS84;INSTITUTION_MATCH_FUZZY;COLLECTION_MATCH_NONE"
-74.916667,-10.25,"Mucuna mitis",1143435867,"Pachitea; Codo de Pozuzo.&nf;Alluvial fan floodplains of Río Pozuzo after it emerges from mountain. Trail to E of settlement.","PER",NA,1982,"PRESERVED_SPECIMEN","GEODETIC_DATUM_ASSUMED_WGS84;CONTINENT_DERIVED_FROM_COORDINATES;INSTITUTION_MATCH_NONE"
-76.83333,-0.06666,"Mucuna mitis",1260101392,"Chonta Punta at Río Napo, in the vicinity of Santa Rosa.","ECU",NA,1972,"PRESERVED_SPECIMEN","GEODETIC_DATUM_ASSUMED_WGS84;INSTITUTION_MATCH_FUZZY;COLLECTION_MATCH_NONE"
-77.754722,-0.943889,"Mucuna mitis",1259155895,"Along road between Archidona and San Vincente Para, vic. San Pablo, 6.5 Km E of Archidona, along Río Ollín.","ECU",NA,2003,"PRESERVED_SPECIMEN","OCCURRENCE_STATUS_INFERRED_FROM_INDIVIDUAL_COUNT;COORDINATE_ROUNDED;GEODETIC_DATUM_ASSUMED_WGS84;INSTITUTION_MATCH_FUZZY;COLLECTION_MATCH_NONE"
