"lon","lat","species","gbifID","locality","countryCode","coordinateUncertaintyInMeters","year","basisOfRecord","issue"
49.126111,-12.947778,"Muellerargia jeffreyana",4032071249,"Mahamasina Reserve Speciale d'Ankarana, chemin tourelles des tsingy. Foret seche caducifoliee. Sol reduit dans les fissures du calcaire lapiezes. Melange de plantes xerophytes de rochers et arbustes.","MDG",NA,2007,"PRESERVED_SPECIMEN","OCCURRENCE_STATUS_INFERRED_FROM_INDIVIDUAL_COUNT;COORDINATE_ROUNDED;GEODETIC_DATUM_ASSUMED_WGS84;INSTITUTION_MATCH_FUZZY;COLLECTION_MATCH_NONE"
46.75,-19.066667,"Muellerargia jeffreyana",4061620516,"Vestige de végétation primaire. Eboulis de Trachyte. Lac Itasy.","MDG",NA,1964,"PRESERVED_SPECIMEN","OCCURRENCE_STATUS_INFERRED_FROM_INDIVIDUAL_COUNT;COORDINATE_ROUNDED;GEODETIC_DATUM_ASSUMED_WGS84;DIFFERENT_OWNER_INSTITUTION"
44.136389,-22.683333,"Muellerargia jeffreyana",4061830687,"Sakaraha, Mikoboka, Milenaky, village le plus proche: Fanjakà-Mahabo. Forêt sacrée d'Analavelona, à Ambotakebo. Récoltés avec Milasoa, Faeo et Rebesa. Échantillons préservés en alcool.","MDG",NA,2019,"PRESERVED_SPECIMEN","OCCURRENCE_STATUS_INFERRED_FROM_INDIVIDUAL_COUNT;COORDINATE_ROUNDED;GEODETIC_DATUM_ASSUMED_WGS84;DIFFERENT_OWNER_INSTITUTION"
44.476389,-17.913889,"Muellerargia jeffreyana",4061785541,"Beanka, partie centrale. Bord de la riviere Bokarano","MDG",NA,2012,"PRESERVED_SPECIMEN","OCCURRENCE_STATUS_INFERRED_FROM_INDIVIDUAL_COUNT;GEODETIC_DATUM_ASSUMED_WGS84;DIFFERENT_OWNER_INSTITUTION"
49.340278,-12.329722,"Muellerargia jeffreyana",4061101062,"Montagne des Français, descente du canyon partant des ruines du camp militaire. Foret seche caducifoliee. Sol argileux reduit sur substrat calcaire eocene, des blocs affleurants. Vegetation de lianes et herbacees sur les rochers ensoleilles dans le canyon.","MDG",NA,2007,"PRESERVED_SPECIMEN","OCCURRENCE_STATUS_INFERRED_FROM_INDIVIDUAL_COUNT;COORDINATE_ROUNDED;GEODETIC_DATUM_ASSUMED_WGS84;DIFFERENT_OWNER_INSTITUTION"
49.216667,-12.85,"Muellerargia jeffreyana",1257596905,"Canton d'Anivorano Nord, Forêt d'Antenampandrana, Km 89,500 de la route d'Ambilobe, calcaires de l'Ankarana","MDG",NA,1960,"PRESERVED_SPECIMEN","OCCURRENCE_STATUS_INFERRED_FROM_INDIVIDUAL_COUNT;COORDINATE_ROUNDED;GEODETIC_DATUM_ASSUMED_WGS84;DIFFERENT_OWNER_INSTITUTION"
48.71667,-14.61667,"Muellerargia jeffreyana",437986190,"Betainkankana","MDG",NA,1952,"PRESERVED_SPECIMEN","GEODETIC_DATUM_ASSUMED_WGS84;CONTINENT_DERIVED_FROM_COORDINATES;COLLECTION_MATCH_FUZZY"
