"lon","lat","species","gbifID","locality","countryCode","coordinateUncertaintyInMeters","year","basisOfRecord","issue"
-65.81666,1.53333,"Myriocladus grandifolius",1259483628,"RIO NEGRO: Cerro Aracamui, summit. Proa camp. Medium height, semi-open forest.","VEN",NA,1987,"PRESERVED_SPECIMEN","OCCURRENCE_STATUS_INFERRED_FROM_INDIVIDUAL_COUNT;GEODETIC_DATUM_ASSUMED_WGS84;INSTITUTION_MATCH_FUZZY;COLLECTION_MATCH_NONE"
-63.35,0.85,"Myriocladus grandifolius",1042588976,"Serra de Aracá, Plateau of northern massif of Serra Aracá. Southern extremity of Northern Plateau of Serra Aracá. Cloud forest. Growing in humid stream gorge.","BRA",NA,1984,"PRESERVED_SPECIMEN","GEODETIC_DATUM_ASSUMED_WGS84;GEODETIC_DATUM_INVALID;ELEVATION_MIN_MAX_SWAPPED;INSTITUTION_MATCH_NONE"
-66.9,4.9,"Myriocladus grandifolius",1259456657,"Dpto. Atures; Lomas graníticas, caño Piedra. 115 km al SE de Pto. Ayacucho","VEN",NA,1989,"PRESERVED_SPECIMEN","GEODETIC_DATUM_ASSUMED_WGS84;INSTITUTION_MATCH_FUZZY;COLLECTION_MATCH_NONE"
-63.358056,-0.9,"Myriocladus grandifolius",2997937279,"Plateau of northern massif of Serra Aracá. Southern extremity of Northen Plateau of Serra Aracá","BRA",NA,1984,"PRESERVED_SPECIMEN","COORDINATE_ROUNDED;GEODETIC_DATUM_ASSUMED_WGS84;CONTINENT_DERIVED_FROM_COORDINATES;INSTITUTION_MATCH_FUZZY;COLLECTION_MATCH_FUZZY"
-65.98333,0.82777,"Myriocladus grandifolius",1259444827,"Cerro de la Neblina camp 2, Neblina massif, 2.8 km NE of Pico Phelps. Elev. 2100 m. 0º49'40N, 65º59'W. Low woodland on saturated soil.","VEN",NA,1984,"PRESERVED_SPECIMEN","OCCURRENCE_STATUS_INFERRED_FROM_INDIVIDUAL_COUNT;GEODETIC_DATUM_ASSUMED_WGS84;INSTITUTION_MATCH_FUZZY;COLLECTION_MATCH_NONE"
-65.78333,1.43333,"Myriocladus grandifolius",1259469373,"RIO NEGRO: Cerro Aracamuni, summit. Popa camp. Savanna with small to large patches of forest and stream.","VEN",NA,1987,"PRESERVED_SPECIMEN","OCCURRENCE_STATUS_INFERRED_FROM_INDIVIDUAL_COUNT;GEODETIC_DATUM_ASSUMED_WGS84;INSTITUTION_MATCH_FUZZY;COLLECTION_MATCH_NONE"
