"lon","lat","species","gbifID","locality","countryCode","coordinateUncertaintyInMeters","year","basisOfRecord","issue"
49.116667,-12.533333,"Ocotea ambrensis",1258606657,"Montagne d'Ambre PN. Plants preserved in alcohol.","MDG",NA,1993,"PRESERVED_SPECIMEN","OCCURRENCE_STATUS_INFERRED_FROM_INDIVIDUAL_COUNT;COORDINATE_ROUNDED;GEODETIC_DATUM_ASSUMED_WGS84;DIFFERENT_OWNER_INSTITUTION"
49.216667,-12.45,"Ocotea ambrensis",1261512025,"Au sud D'Antsiranana, près de Joffre-Ville dans le Parc National de Montagne d'Ambre, au campement de Ben Freed. Echantillons préservés dans l'alcool.","MDG",NA,1993,"PRESERVED_SPECIMEN","OCCURRENCE_STATUS_INFERRED_FROM_INDIVIDUAL_COUNT;COORDINATE_ROUNDED;GEODETIC_DATUM_ASSUMED_WGS84;DIFFERENT_OWNER_INSTITUTION"
49.183333,-12.533333,"Ocotea ambrensis",4031349607,"Southwest of Antsiranana, Joffreville, Parc National de Montagne d'Ambre. Plants preserved in alcohol. Collected with A. Leeuwenberg, M. van Bergen, J. Andriatiana & B. Randriamampionona.","MDG",NA,1992,"PRESERVED_SPECIMEN","OCCURRENCE_STATUS_INFERRED_FROM_INDIVIDUAL_COUNT;COORDINATE_ROUNDED;GEODETIC_DATUM_ASSUMED_WGS84;INSTITUTION_MATCH_FUZZY;COLLECTION_MATCH_NONE"
49.154167,-12.491111,"Ocotea ambrensis",4031778211,"Montagne d'Ambre, partie nord. A 330 m du point cote 708, au 151?","MDG",NA,2008,"PRESERVED_SPECIMEN","OCCURRENCE_STATUS_INFERRED_FROM_INDIVIDUAL_COUNT;GEODETIC_DATUM_ASSUMED_WGS84;INSTITUTION_MATCH_FUZZY;COLLECTION_MATCH_NONE"
48.541111,-19.180833,"Ocotea ambrensis",4061739101,"Atsinanana, Vatomandry, Ambalabe, Sahanionaka, village de Vodiriana, Ambatovaky. Forêt de Vohibe, direction chute Tsitondroina. Echantillons préservés en alcool.","MDG",NA,2016,"PRESERVED_SPECIMEN","OCCURRENCE_STATUS_INFERRED_FROM_INDIVIDUAL_COUNT;COORDINATE_ROUNDED;GEODETIC_DATUM_ASSUMED_WGS84;DIFFERENT_OWNER_INSTITUTION"
49.1375,-12.70639,"Ocotea ambrensis",2270292408,"","MDG",NA,2011,"PRESERVED_SPECIMEN","GEODETIC_DATUM_ASSUMED_WGS84;CONTINENT_DERIVED_FROM_COORDINATES;COLLECTION_MATCH_FUZZY"
