"lon","lat","species","gbifID","locality","countryCode","coordinateUncertaintyInMeters","year","basisOfRecord","issue"
38.57,-6.28,"Olax dissitiflora",1096657058,"Tanzania. Pwani: Bagamoyo District. T6. Zaraninge Forets Reserve, near WWF office, Gongo Village, Banda Moja, forest guards camp along to village nursery).","TZA",NA,1999,"PRESERVED_SPECIMEN","GEODETIC_DATUM_ASSUMED_WGS84;INSTITUTION_COLLECTION_MISMATCH"
38.78,-6.03,"Olax dissitiflora",1096700691,"Tanzania. Pwani: Bagamoyo District. Along Indian Ocean.","TZA",NA,1998,"PRESERVED_SPECIMEN","GEODETIC_DATUM_ASSUMED_WGS84;INSTITUTION_COLLECTION_MISMATCH"
45.38,-22.54,"Olax dissitiflora",2618423299,"Madagascar, Ihorombe Region, Ihosy District, Isalo National Park, Namazaha.","MDG",NA,2017,"PRESERVED_SPECIMEN","GEODETIC_DATUM_ASSUMED_WGS84;INSTITUTION_COLLECTION_MISMATCH"
39.22638,-8.27055,"Olax dissitiflora",4061617027,"Ca. 3 km E of Malendego Village. Salt marsh edge woodland dominated by Maprounea aficana, Phoenix reclinata, Lamprothamnus zanguebarica and Salvadora persica.","TZA",NA,2003,"PRESERVED_SPECIMEN","OCCURRENCE_STATUS_INFERRED_FROM_INDIVIDUAL_COUNT;GEODETIC_DATUM_ASSUMED_WGS84;ELEVATION_NON_NUMERIC;INSTITUTION_MATCH_NONE"
48.283333,-15.133333,"Olax dissitiflora",4062158420,"Analarezy, Ankobakobaka, canton et Sous-Préf. Befandriana-Nord. Station: forêt sèche. [also numbered 573-R-187]","MDG",NA,1970,"PRESERVED_SPECIMEN","OCCURRENCE_STATUS_INFERRED_FROM_INDIVIDUAL_COUNT;COORDINATE_ROUNDED;GEODETIC_DATUM_ASSUMED_WGS84;DIFFERENT_OWNER_INSTITUTION"
49.110833,-12.911944,"Olax dissitiflora",4061754286,"Ambilobe, Matsaborimanga, Réserve Spéciale d'Ankarana, tsingy au dessus de la grotte à proximité du camp des anglais. Forêt sèche caducifoliée. Sol squelettique dans les creux et les fissures sur calcaire du jurassique moyen. Sommet de tsingy, végétation en mosaïque, arbres rabougris et plantes xérophytes.","MDG",NA,1997,"PRESERVED_SPECIMEN","OCCURRENCE_STATUS_INFERRED_FROM_INDIVIDUAL_COUNT;COORDINATE_ROUNDED;GEODETIC_DATUM_ASSUMED_WGS84;DIFFERENT_OWNER_INSTITUTION"
46.91666,-22.31666,"Olax dissitiflora",1258584360,"Lieu de récolte: Ankorovana, dans la forêt. Village le plus proche: Ankazomby; Canton Antambohobe, District Ivohibe.","MDG",NA,1967,"PRESERVED_SPECIMEN","GEODETIC_DATUM_ASSUMED_WGS84;DIFFERENT_OWNER_INSTITUTION"
44.433333,-20.15,"Olax dissitiflora",1258584052,"Ouest: forêt d'Andranomena-Marofandilia (Morondava).","MDG",NA,1969,"PRESERVED_SPECIMEN","OCCURRENCE_STATUS_INFERRED_FROM_INDIVIDUAL_COUNT;COORDINATE_ROUNDED;GEODETIC_DATUM_ASSUMED_WGS84;DIFFERENT_OWNER_INSTITUTION"
43.76666,-23.45,"Olax dissitiflora",1258595083,"Route de Sarodrano, Tuléar.","MDG",NA,1962,"PRESERVED_SPECIMEN","GEODETIC_DATUM_ASSUMED_WGS84;DIFFERENT_OWNER_INSTITUTION"
49.366667,-12.233333,"Olax dissitiflora",1259578844,"Sur sable rose. Orangea à l'Est de Diego-Suarez","MDG",NA,1975,"PRESERVED_SPECIMEN","OCCURRENCE_STATUS_INFERRED_FROM_INDIVIDUAL_COUNT;COORDINATE_ROUNDED;GEODETIC_DATUM_ASSUMED_WGS84;DIFFERENT_OWNER_INSTITUTION"
43.616667,-23.2,"Olax dissitiflora",1261447600,"N coastral road out of Tulear, 35-50 km N (road to Morambe).","MDG",NA,1989,"PRESERVED_SPECIMEN","OCCURRENCE_STATUS_INFERRED_FROM_INDIVIDUAL_COUNT;COORDINATE_ROUNDED;GEODETIC_DATUM_ASSUMED_WGS84;ELEVATION_NON_NUMERIC;DIFFERENT_OWNER_INSTITUTION"
49.7,-13.133333,"Olax dissitiflora",4061227358,"Mantamena, part of Bekaroaka Range, 7 km NE of Daraina (Vohemar), Faritany Antsiranana.","MDG",NA,1990,"PRESERVED_SPECIMEN","OCCURRENCE_STATUS_INFERRED_FROM_INDIVIDUAL_COUNT;COORDINATE_ROUNDED;GEODETIC_DATUM_ASSUMED_WGS84;DIFFERENT_OWNER_INSTITUTION"
45.409167,-16.467778,"Olax dissitiflora",1257889026,"District Soalala, Commune Rurale Andranomavo, Fokontany Vilanandro. Tsingy Namoroka. Forêt d'Ambatofolaka.","MDG",NA,2012,"PRESERVED_SPECIMEN","OCCURRENCE_STATUS_INFERRED_FROM_INDIVIDUAL_COUNT;COORDINATE_ROUNDED;GEODETIC_DATUM_ASSUMED_WGS84;DIFFERENT_OWNER_INSTITUTION"
32.433333,-8.483333,"Olax dissitiflora",1257968790,"Ntungwa Village, Ivuna Ward, Kamsamba Division. Miombo woodland in Ivuna Forest Reserve between Ntungwa and Utambalila Villages.","TZA",NA,2011,"PRESERVED_SPECIMEN","OCCURRENCE_STATUS_INFERRED_FROM_INDIVIDUAL_COUNT;COORDINATE_ROUNDED;GEODETIC_DATUM_ASSUMED_WGS84;DIFFERENT_OWNER_INSTITUTION"
49.466667,-12.416667,"Olax dissitiflora",1259578870,"Forêt d'Ampondrahazo, canton de Mahavanona","MDG",NA,1975,"PRESERVED_SPECIMEN","OCCURRENCE_STATUS_INFERRED_FROM_INDIVIDUAL_COUNT;COORDINATE_ROUNDED;GEODETIC_DATUM_ASSUMED_WGS84;ELEVATION_NON_NUMERIC;DIFFERENT_OWNER_INSTITUTION"
44.481667,-18.046389,"Olax dissitiflora",4061175763,"Beanka, partie sud.","MDG",NA,2012,"PRESERVED_SPECIMEN","OCCURRENCE_STATUS_INFERRED_FROM_INDIVIDUAL_COUNT;COORDINATE_ROUNDED;GEODETIC_DATUM_ASSUMED_WGS84;DIFFERENT_OWNER_INSTITUTION"
44.633333,-20.083333,"Olax dissitiflora",1261448735,"Préfecture Morondava; approximately 60 km (by road) NE of Morondava, in the Kirindy Swiss forestry concession.","MDG",NA,1990,"PRESERVED_SPECIMEN","OCCURRENCE_STATUS_INFERRED_FROM_INDIVIDUAL_COUNT;COORDINATE_ROUNDED;GEODETIC_DATUM_ASSUMED_WGS84;DIFFERENT_OWNER_INSTITUTION"
49.683333,-13.183333,"Olax dissitiflora",1259579173,"Sur plateau calcaire. Daraina Vohémar","MDG",NA,1988,"PRESERVED_SPECIMEN","OCCURRENCE_STATUS_INFERRED_FROM_INDIVIDUAL_COUNT;COORDINATE_ROUNDED;GEODETIC_DATUM_ASSUMED_WGS84;DIFFERENT_OWNER_INSTITUTION"
46.200833,-15.709722,"Olax dissitiflora",2268870707,"Mitsinjo. Katsepy Forêt classée d'Antrema.","MDG",NA,2005,"PRESERVED_SPECIMEN","OCCURRENCE_STATUS_INFERRED_FROM_INDIVIDUAL_COUNT;COORDINATE_ROUNDED;GEODETIC_DATUM_ASSUMED_WGS84;DIFFERENT_OWNER_INSTITUTION"
45.298056,-16.401944,"Olax dissitiflora",3946859059,"Tsingy de Namoroka. Sur tsingy.","MDG",NA,2016,"PRESERVED_SPECIMEN","OCCURRENCE_STATUS_INFERRED_FROM_INDIVIDUAL_COUNT;COORDINATE_ROUNDED;GEODETIC_DATUM_ASSUMED_WGS84;DIFFERENT_OWNER_INSTITUTION"
49.633333,-13.25,"Olax dissitiflora",1258314055,"Analamazava, part of Binara Range, SW of Daraina (Vohemar), Faritany Antsiranana.","MDG",NA,1990,"PRESERVED_SPECIMEN","OCCURRENCE_STATUS_INFERRED_FROM_INDIVIDUAL_COUNT;COORDINATE_ROUNDED;GEODETIC_DATUM_ASSUMED_WGS84;DIFFERENT_OWNER_INSTITUTION"
49.906667,-13.068333,"Olax dissitiflora",1260428947,"Sous Préfecture: Vohemar, Commune: Nosibe, Fokontany: Anjiabe, Village: Anaborano. Forêt littorale d'Analabe, Andrangana, substrat: sable. Echantillons préservés en alcool.","MDG",NA,2004,"PRESERVED_SPECIMEN","OCCURRENCE_STATUS_INFERRED_FROM_INDIVIDUAL_COUNT;COORDINATE_ROUNDED;GEODETIC_DATUM_ASSUMED_WGS84;DIFFERENT_OWNER_INSTITUTION"
49.592222,-12.978611,"Olax dissitiflora",1257998468,"District: Vohemar, Commune Rurale: Ampisikina, quartier: Ambararata Misakana, Lieu de collecte: Misoribe.","MDG",NA,2013,"PRESERVED_SPECIMEN","OCCURRENCE_STATUS_INFERRED_FROM_INDIVIDUAL_COUNT;COORDINATE_ROUNDED;GEODETIC_DATUM_ASSUMED_WGS84;DIFFERENT_OWNER_INSTITUTION"
47.58,-17.65,"Olax dissitiflora",1096892305,"Madagascar, Mahajanga. Faritany: Mahajanga, Fivondronana: Port Bergé, Bongolava. Forêt sèche de Marosely.","MDG",NA,2004,"PRESERVED_SPECIMEN","GEODETIC_DATUM_ASSUMED_WGS84;INSTITUTION_COLLECTION_MISMATCH"
36.47,-8.67,"Olax dissitiflora",1096675268,"Tanzania, Morogoro: Ulanga District. T6. Itete Frontier Camp. Mlombo woodland.","TZA",NA,1998,"PRESERVED_SPECIMEN","GEODETIC_DATUM_ASSUMED_WGS84;INSTITUTION_COLLECTION_MISMATCH"
28.705058,-22.16915,"Olax dissitiflora",2311296807,"","BWA",6,2019,"HUMAN_OBSERVATION","COORDINATE_ROUNDED;CONTINENT_DERIVED_FROM_COORDINATES"
46.81,-16.3,"Olax dissitiflora",2618601403,"Madagascar, Boeny Region, Marovoay District, Ankarafantsika National Park.","MDG",NA,2017,"PRESERVED_SPECIMEN","GEODETIC_DATUM_ASSUMED_WGS84;INSTITUTION_COLLECTION_MISMATCH"
44.333333,-23.7,"Olax dissitiflora",4031475156,"Bush, à l'W de Betioky sur la route Betioky - Soalara.","MDG",NA,1953,"PRESERVED_SPECIMEN","OCCURRENCE_STATUS_INFERRED_FROM_INDIVIDUAL_COUNT;COORDINATE_ROUNDED;GEODETIC_DATUM_ASSUMED_WGS84;INSTITUTION_MATCH_FUZZY;COLLECTION_MATCH_NONE"
46.306944,-24.243889,"Olax dissitiflora",4031632231,"Anosy, Amboasary Sud, Mahaly, Anadabolava. Forêt dense sèche caducifoliée sur basalte. Forêt classée. Forêt galérie. Echantillon préservé en alcool. Collecté avec T. Randrianarivony, F. Rakotoarivony, A. Josso, Relia, Voreomby, Remanasy & Mahafeha.","MDG",NA,2007,"PRESERVED_SPECIMEN","OCCURRENCE_STATUS_INFERRED_FROM_INDIVIDUAL_COUNT;COORDINATE_ROUNDED;GEODETIC_DATUM_ASSUMED_WGS84;INSTITUTION_MATCH_FUZZY;COLLECTION_MATCH_NONE"
46.5,-24.766667,"Olax dissitiflora",4031888077,"Amparehitsy, Ambovombe.","MDG",NA,1955,"PRESERVED_SPECIMEN","OCCURRENCE_STATUS_INFERRED_FROM_INDIVIDUAL_COUNT;COORDINATE_ROUNDED;GEODETIC_DATUM_ASSUMED_WGS84;INSTITUTION_MATCH_FUZZY;COLLECTION_MATCH_NONE"
44.471667,-17.872222,"Olax dissitiflora",4032094566,"Beanka, partie nord; Ambatosoa.","MDG",NA,2011,"PRESERVED_SPECIMEN","OCCURRENCE_STATUS_INFERRED_FROM_INDIVIDUAL_COUNT;COORDINATE_ROUNDED;GEODETIC_DATUM_ASSUMED_WGS84;INSTITUTION_MATCH_FUZZY;COLLECTION_MATCH_NONE"
44.633333,-23.65,"Olax dissitiflora",1261448985,"Southern Domain; 40 km NE of Betioky, in hamlet of Ambalatsindro near Analafaly.","MDG",NA,1987,"PRESERVED_SPECIMEN","OCCURRENCE_STATUS_INFERRED_FROM_INDIVIDUAL_COUNT;COORDINATE_ROUNDED;GEODETIC_DATUM_ASSUMED_WGS84;INSTITUTION_MATCH_FUZZY;COLLECTION_MATCH_NONE"
46.633333,-16.116667,"Olax dissitiflora",4032016141,"Ouest: Madirokely (Stat. agricole/ Marovoay), lisière forestière.","MDG",NA,1955,"PRESERVED_SPECIMEN","OCCURRENCE_STATUS_INFERRED_FROM_INDIVIDUAL_COUNT;COORDINATE_ROUNDED;GEODETIC_DATUM_ASSUMED_WGS84;INSTITUTION_MATCH_FUZZY;COLLECTION_MATCH_NONE"
45.383333,-24.183333,"Olax dissitiflora",4031982902,"Marofana (Morafeno ). Bekily District","MDG",NA,1954,"PRESERVED_SPECIMEN","OCCURRENCE_STATUS_INFERRED_FROM_INDIVIDUAL_COUNT;COORDINATE_ROUNDED;GEODETIC_DATUM_ASSUMED_WGS84;INSTITUTION_MATCH_FUZZY;COLLECTION_MATCH_NONE"
34.11666,-9.56666,"Olax dissitiflora",1261449255,"Nkanda village, SW slopes of Livingstone Mountains on E edge of Lake Nyasa in environs of Kasero River.","TZA",NA,1992,"PRESERVED_SPECIMEN","OCCURRENCE_STATUS_INFERRED_FROM_INDIVIDUAL_COUNT;GEODETIC_DATUM_ASSUMED_WGS84;INSTITUTION_MATCH_FUZZY;COLLECTION_MATCH_NONE"
44.816667,-19.15,"Olax dissitiflora",4032015443,"Tsingy de Bemaraha north of the Manambolo river.","MDG",NA,1996,"PRESERVED_SPECIMEN","OCCURRENCE_STATUS_INFERRED_FROM_INDIVIDUAL_COUNT;COORDINATE_ROUNDED;GEODETIC_DATUM_ASSUMED_WGS84;INSTITUTION_MATCH_FUZZY;COLLECTION_MATCH_NONE"
34.100278,-10.450556,"Olax dissitiflora",1932388575,"Dindindi Point 1, Nyika National Park","MWI",NA,2007,"HUMAN_OBSERVATION","COORDINATE_ROUNDED;GEODETIC_DATUM_ASSUMED_WGS84;GEODETIC_DATUM_INVALID;CONTINENT_DERIVED_FROM_COORDINATES"
47.484317,-15.690925,"Olax dissitiflora",3067612205,"","MDG",NA,2020,"HUMAN_OBSERVATION","COORDINATE_ROUNDED;CONTINENT_DERIVED_FROM_COORDINATES"
47.596699,-15.463813,"Olax dissitiflora",3068009323,"","MDG",NA,2020,"HUMAN_OBSERVATION","COORDINATE_ROUNDED;CONTINENT_DERIVED_FROM_COORDINATES"
49.326779,-12.09785,"Olax dissitiflora",4055017302,"","MDG",23,2016,"HUMAN_OBSERVATION","COORDINATE_ROUNDED;CONTINENT_DERIVED_FROM_COORDINATES"
49.332222,-12.314167,"Olax dissitiflora",4061604891,"Coastal road running between Diego-Suarez and Orangea on Andovobazaha Bay. Dry scrub. Specimens preserved in alcohol.","MDG",NA,2006,"PRESERVED_SPECIMEN","OCCURRENCE_STATUS_INFERRED_FROM_INDIVIDUAL_COUNT;COORDINATE_ROUNDED;GEODETIC_DATUM_ASSUMED_WGS84;DIFFERENT_OWNER_INSTITUTION"
44.515833,-18.072778,"Olax dissitiflora",1257922878,"Maintirano, Belitsaky, Antsakoabe. Près de la rivière Andafiha.","MDG",NA,2012,"PRESERVED_SPECIMEN","OCCURRENCE_STATUS_INFERRED_FROM_INDIVIDUAL_COUNT;COORDINATE_ROUNDED;GEODETIC_DATUM_ASSUMED_WGS84;DIFFERENT_OWNER_INSTITUTION"
39.163889,-10.073611,"Olax dissitiflora",1257969336,"Rondo Plateau Forest Reserve, NE part of forest near Naniolo Valley.","TZA",NA,2012,"PRESERVED_SPECIMEN","OCCURRENCE_STATUS_INFERRED_FROM_INDIVIDUAL_COUNT;COORDINATE_ROUNDED;GEODETIC_DATUM_ASSUMED_WGS84;DIFFERENT_OWNER_INSTITUTION"
48.949722,-12.69,"Olax dissitiflora",4060894892,"Mosorolava, Ampombiantambo, 1 km au Nord d'Ampombiantambo. Forêt sèche. Récolté avec R. Guittou, R. Andrianjaka & Toibiana.","MDG",NA,2007,"PRESERVED_SPECIMEN","OCCURRENCE_STATUS_INFERRED_FROM_INDIVIDUAL_COUNT;COORDINATE_ROUNDED;GEODETIC_DATUM_ASSUMED_WGS84;DIFFERENT_OWNER_INSTITUTION"
32.952008,-26.091992,"Olax dissitiflora",2626100400,"","MOZ",165,2019,"HUMAN_OBSERVATION","COORDINATE_ROUNDED;CONTINENT_DERIVED_FROM_COORDINATES"
37.5833,-6.8333,"Olax dissitiflora",1936687192,"Morogoro Morogoro Rural district. T6. Mindu Forest Reserve, ca. 200m N of main road to Mikumi N of Mindu Lake","TZA",NA,2000,"PRESERVED_SPECIMEN","GEODETIC_DATUM_ASSUMED_WGS84;CONTINENT_DERIVED_FROM_COORDINATES;INSTITUTION_MATCH_FUZZY;COLLECTION_MATCH_FUZZY"
33.2167,-8.9333,"Olax dissitiflora",1936687371,"Mbeya: Mbeya Rural district. Songwe","TZA",NA,1990,"PRESERVED_SPECIMEN","GEODETIC_DATUM_ASSUMED_WGS84;CONTINENT_DERIVED_FROM_COORDINATES;INSTITUTION_MATCH_FUZZY;COLLECTION_MATCH_FUZZY"
24.08,-18.55,"Olax dissitiflora",912273090,"Chobe National Park. BOT-N","BWA",NA,1972,"PRESERVED_SPECIMEN","GEODETIC_DATUM_ASSUMED_WGS84;CONTINENT_DERIVED_FROM_COORDINATES;INSTITUTION_MATCH_FUZZY;COLLECTION_MATCH_FUZZY"
32.416667,-26.583333,"Olax dissitiflora",2515613074,"Matutuíne. Reserva florestal Licuati.","MOZ",NA,1983,"PRESERVED_SPECIMEN","INSTITUTION_MATCH_FUZZY;INSTITUTION_COLLECTION_MISMATCH"
31.478317,-22.471472,"Olax dissitiflora",2429278503,"","MOZ",8,2019,"HUMAN_OBSERVATION","COORDINATE_ROUNDED;CONTINENT_DERIVED_FROM_COORDINATES"
47.451103,-15.946443,"Olax dissitiflora",2864694319,"","MDG",2,2018,"HUMAN_OBSERVATION","COORDINATE_ROUNDED;CONTINENT_DERIVED_FROM_COORDINATES"
44.65,-23.67,"Olax dissitiflora",2426915454,"Prov. de Tulear: Near Beza Mahafaly Reserve near Betioky. Valley of the Ehazoara River, east of Sakamana.","MDG",NA,1987,"PRESERVED_SPECIMEN","GEODETIC_DATUM_ASSUMED_WGS84"
47.2,-16.608333,"Olax dissitiflora",4031581018,"Route Andilamena. Miarinarivo. Vestige de forêt sur collines.","MDG",NA,1962,"PRESERVED_SPECIMEN","OCCURRENCE_STATUS_INFERRED_FROM_INDIVIDUAL_COUNT;COORDINATE_ROUNDED;GEODETIC_DATUM_ASSUMED_WGS84;INSTITUTION_MATCH_FUZZY;COLLECTION_MATCH_NONE"
45.945,-25.098055,"Olax dissitiflora",4031598153,"Ambovombe, Analamary, Analamary, Analasoa, Mahatomotsy, aux environs du bush de Mahatomotsy. Récolté avec J.M. Tovondraoky, Manamia & R. Ludovic.","MDG",NA,2004,"PRESERVED_SPECIMEN","OCCURRENCE_STATUS_INFERRED_FROM_INDIVIDUAL_COUNT;COORDINATE_ROUNDED;GEODETIC_DATUM_ASSUMED_WGS84;INSTITUTION_MATCH_FUZZY;COLLECTION_MATCH_NONE"
34.845004,-13.378392,"Olax dissitiflora",4020497579,"North of Meponda, inland from shore. Arrived by boat and walked inland.","MOZ",NA,2016,"PRESERVED_SPECIMEN","INSTITUTION_MATCH_FUZZY;INSTITUTION_COLLECTION_MISMATCH"
46.666667,-25,"Olax dissitiflora",4031494208,"Préfecture de Fort Dauphin; Réserve Integrale d'Andohahela; parcelle 3.","MDG",NA,1990,"PRESERVED_SPECIMEN","OCCURRENCE_STATUS_INFERRED_FROM_INDIVIDUAL_COUNT;COORDINATE_ROUNDED;GEODETIC_DATUM_ASSUMED_WGS84;INSTITUTION_MATCH_FUZZY;COLLECTION_MATCH_NONE"
49.668611,-12.875,"Olax dissitiflora",4031594251,"Vohemar, Ampisikina(na), Antsaharaingy, Antsapile, forêt d'Analabelambo au Sud est du village d'Ankaramy, à 60 km au Nord de Daraina. Forêt sèche sur sol sableux. Récolté avec L.J. Razafitsalama, J. Be, Zamany & Ambazoky.","MDG",NA,2005,"PRESERVED_SPECIMEN","OCCURRENCE_STATUS_INFERRED_FROM_INDIVIDUAL_COUNT;COORDINATE_ROUNDED;GEODETIC_DATUM_ASSUMED_WGS84;INSTITUTION_MATCH_FUZZY;COLLECTION_MATCH_NONE"
49.472222,-13.132222,"Olax dissitiflora",4032059435,"Vohemar, Daraina, Andranovaka, Ankijomantsina, le long de la rivière Ankijomantsina, à 2 km au Sud du village d'Ankijomantsina. Forêt sèche dégradée. Récolté avec F. Ratovoson, R. Guittou & Tomboravo.","MDG",NA,2005,"PRESERVED_SPECIMEN","OCCURRENCE_STATUS_INFERRED_FROM_INDIVIDUAL_COUNT;COORDINATE_ROUNDED;GEODETIC_DATUM_ASSUMED_WGS84;INSTITUTION_MATCH_FUZZY;COLLECTION_MATCH_NONE"
44.678861,-22.889528,"Olax dissitiflora",4031846810,"Sakaraha. Bosque del Parque Nacional Zombitse-Vohibasia. A los márgenes de la carretera RN 7.","MDG",NA,2019,"PRESERVED_SPECIMEN","OCCURRENCE_STATUS_INFERRED_FROM_INDIVIDUAL_COUNT;COORDINATE_ROUNDED;GEODETIC_DATUM_ASSUMED_WGS84;INSTITUTION_MATCH_FUZZY;COLLECTION_MATCH_NONE"
47.58416,-15.64944,"Olax dissitiflora",4032042223,"Faritany: Mahajanga, Fivondronana: Port Bergé, Bongolava. Forêt sèche de Marosely. Récolté avec R. Ramananjanahary & A. Rabezafy (guide).","MDG",NA,2004,"PRESERVED_SPECIMEN","OCCURRENCE_STATUS_INFERRED_FROM_INDIVIDUAL_COUNT;GEODETIC_DATUM_ASSUMED_WGS84;INSTITUTION_MATCH_FUZZY;COLLECTION_MATCH_NONE"
32.133333,-26.2,"Olax dissitiflora",2517687706,"Namaacha, Changalane, Coba, Estaçâo picada em direcçâo a machamba de Sr. Aguiar, margem esquerda de Rio Umbelusi.","MOZ",NA,1983,"PRESERVED_SPECIMEN","INSTITUTION_MATCH_FUZZY;INSTITUTION_COLLECTION_MISMATCH"
32.033333,-27.116667,"Olax dissitiflora",2515613075,"Ingwavuma Gorge. 2732Aa.","ZAF",NA,1971,"PRESERVED_SPECIMEN","INSTITUTION_MATCH_FUZZY;INSTITUTION_COLLECTION_MISMATCH"
32.7,-15.583333,"Olax dissitiflora",2517414766,"Cabora Bassa, rio Mecangádzi (futura albufeira), ao longo do leito, margem e vertente esquerdas, para juzante, a partir da cota 330 m e num percurso de + 500 m (Cf).","MOZ",NA,1973,"PRESERVED_SPECIMEN","INSTITUTION_MATCH_FUZZY;INSTITUTION_COLLECTION_MISMATCH"
25.85,-17.966667,"Olax dissitiflora",2516951127,"Flora of Rhodesia. District Wankie. Victoria Falls Rain Forest.","ZWE",NA,1973,"PRESERVED_SPECIMEN","INSTITUTION_MATCH_FUZZY;INSTITUTION_COLLECTION_MISMATCH"
39.294549,-6.987952,"Olax dissitiflora",4014174713,"Fungoni forest reserve","TZA",NA,1978,"PRESERVED_SPECIMEN","OCCURRENCE_STATUS_INFERRED_FROM_INDIVIDUAL_COUNT;COLLECTION_MATCH_NONE"
39.421187,-7.010526,"Olax dissitiflora",3863876634,"Fungoni village.","TZA",NA,1961,"PRESERVED_SPECIMEN","OCCURRENCE_STATUS_INFERRED_FROM_INDIVIDUAL_COUNT;COLLECTION_MATCH_NONE"
39.078267,-6.908145,"Olax dissitiflora",3863878509,"Kurekese forest reserve.","TZA",NA,1953,"PRESERVED_SPECIMEN","OCCURRENCE_STATUS_INFERRED_FROM_INDIVIDUAL_COUNT;COLLECTION_MATCH_NONE"
39.290682,-10.899745,"Olax dissitiflora",3863880078,"","TZA",NA,1953,"PRESERVED_SPECIMEN","OCCURRENCE_STATUS_INFERRED_FROM_INDIVIDUAL_COUNT;COLLECTION_MATCH_NONE"
38.738083,-6.445593,"Olax dissitiflora",3863884041,"Kikoka forest reserve","TZA",NA,1954,"PRESERVED_SPECIMEN","OCCURRENCE_STATUS_INFERRED_FROM_INDIVIDUAL_COUNT;COLLECTION_MATCH_NONE"
38.899574,-6.679456,"Olax dissitiflora",3863886587,"Ruvu south Kisarawe","TZA",NA,1953,"PRESERVED_SPECIMEN","OCCURRENCE_STATUS_INFERRED_FROM_INDIVIDUAL_COUNT;COLLECTION_MATCH_NONE"
32.25,-25.6,"Olax dissitiflora",2517678711,"wide environments of Moamba.","MOZ",NA,1980,"PRESERVED_SPECIMEN","INSTITUTION_MATCH_FUZZY;INSTITUTION_COLLECTION_MISMATCH"
49.191667,-13.0825,"Olax dissitiflora",4031963292,"Fivondronana: Ambilobe, Commune: Tanambao-Marivorahona, Fokontany: Ananjaka. Forêt de Tsiandrotonana près du village d'Ankatsaka Andavakoera, à 45 mn à l'Est de Tanambao. Fore|t dégradée sur laterite à Sarcolaenaceae et Asteropeiaceae. Récolté avec S. Randrianasolo, R. Rakotondrajaona, B. Modeste & J.B. Leopaul","MDG",NA,2004,"PRESERVED_SPECIMEN","OCCURRENCE_STATUS_INFERRED_FROM_INDIVIDUAL_COUNT;COORDINATE_ROUNDED;GEODETIC_DATUM_ASSUMED_WGS84;INSTITUTION_MATCH_FUZZY;COLLECTION_MATCH_NONE"
49.011667,-12.762778,"Olax dissitiflora",4031649699,"Diana, Masorolava, Mahagaga, partie Nord-Ouest de la forêt d'Analabe, près de Matsabory Ambondro. Echantillon preservé en alcool. Récolté avec A. Ravoahangy, Joma Bernard, Noor Salam & Yvon Razafindrainibe.","MDG",NA,2007,"PRESERVED_SPECIMEN","OCCURRENCE_STATUS_INFERRED_FROM_INDIVIDUAL_COUNT;COORDINATE_ROUNDED;GEODETIC_DATUM_ASSUMED_WGS84;INSTITUTION_MATCH_FUZZY;COLLECTION_MATCH_NONE"
36.716667,-8.784167,"Olax dissitiflora",4031758168,"Mselezi Forest Reserve, Work Unit 1, Dry evergreen forest","TZA",NA,2005,"PRESERVED_SPECIMEN","OCCURRENCE_STATUS_INFERRED_FROM_INDIVIDUAL_COUNT;COORDINATE_ROUNDED;GEODETIC_DATUM_ASSUMED_WGS84;INSTITUTION_MATCH_FUZZY;COLLECTION_MATCH_NONE"
45.395556,-21.144444,"Olax dissitiflora",4031429972,"District de Beroroha, commune d'Antanamary, fokontany d'Antanamary, Rivière Mahasoa (Makay). Collectés avec Zafimahefa Brunot et Mahereza.","MDG",NA,2022,"PRESERVED_SPECIMEN","OCCURRENCE_STATUS_INFERRED_FROM_INDIVIDUAL_COUNT;COORDINATE_ROUNDED;GEODETIC_DATUM_ASSUMED_WGS84;INSTITUTION_MATCH_FUZZY;COLLECTION_MATCH_NONE"
39.496267,-8.961183,"Olax dissitiflora",4031749031,"Kilwa Masoko, Kisiwani Village, Mbuyunkuta area. Transect 1. Plot 8.","TZA",NA,2003,"PRESERVED_SPECIMEN","OCCURRENCE_STATUS_INFERRED_FROM_INDIVIDUAL_COUNT;COORDINATE_ROUNDED;GEODETIC_DATUM_ASSUMED_WGS84;INSTITUTION_MATCH_FUZZY;COLLECTION_MATCH_NONE"
43.75,-24.05,"Olax dissitiflora",1258590042,"Environs du lac Tsimanampetsa (Sud-Ouest). Bush à Euphorbes et Adansonia. Vers l'aven de Mitoho.","MDG",NA,1960,"PRESERVED_SPECIMEN","GEODETIC_DATUM_ASSUMED_WGS84;ELEVATION_NON_NUMERIC;DIFFERENT_OWNER_INSTITUTION"
43.70638,-23.05638,"Olax dissitiflora",4062091291,"Tuléar II, Belalanda, Ranobe. Forêt de Ranobe, Forêt dense sèche sur sable roux non consolidé.","MDG",NA,2006,"PRESERVED_SPECIMEN","OCCURRENCE_STATUS_INFERRED_FROM_INDIVIDUAL_COUNT;GEODETIC_DATUM_ASSUMED_WGS84;DIFFERENT_OWNER_INSTITUTION"
45.666667,-24.2,"Olax dissitiflora",1258584072,"Ouest (Sud): Barres rocheuses au Sud de Beraketa.","MDG",NA,1967,"PRESERVED_SPECIMEN","OCCURRENCE_STATUS_INFERRED_FROM_INDIVIDUAL_COUNT;COORDINATE_ROUNDED;GEODETIC_DATUM_ASSUMED_WGS84;DIFFERENT_OWNER_INSTITUTION"
45.68333,-15.78333,"Olax dissitiflora",4062000698,"Cap Tanjona, Mitsinjo, sable blanc.","MDG",NA,1963,"PRESERVED_SPECIMEN","GEODETIC_DATUM_ASSUMED_WGS84;ELEVATION_NON_NUMERIC;DIFFERENT_OWNER_INSTITUTION"
49.530833,-12.633056,"Olax dissitiflora",4061410438,"Ampitsinjovana, 2 km au Nord d'Irodo. Forêt sèche sur sable. Récolté avec L.J. Razafitsalama, J. Be, B. Raymond & B. Mbala.","MDG",NA,2004,"PRESERVED_SPECIMEN","OCCURRENCE_STATUS_INFERRED_FROM_INDIVIDUAL_COUNT;COORDINATE_ROUNDED;GEODETIC_DATUM_ASSUMED_WGS84;DIFFERENT_OWNER_INSTITUTION"
46.933333,-25.05,"Olax dissitiflora",4061240724,"Préfecture de Fort Dauphin; forêt sèche de Vinanibe; bush.","MDG",NA,1990,"PRESERVED_SPECIMEN","OCCURRENCE_STATUS_INFERRED_FROM_INDIVIDUAL_COUNT;COORDINATE_ROUNDED;GEODETIC_DATUM_ASSUMED_WGS84;DIFFERENT_OWNER_INSTITUTION"
44.01666,-18.06666,"Olax dissitiflora",1259579705,"Dans un bouquet de forêt sis au nord est du village de Mangabe, canton et district de Maintirano.","MDG",NA,1954,"PRESERVED_SPECIMEN","GEODETIC_DATUM_ASSUMED_WGS84;DIFFERENT_OWNER_INSTITUTION"
44.034444,-20.734722,"Olax dissitiflora",1257968321,"Morondava, Belo sur Mer, un kilomètre à la sortie du village.","MDG",NA,2004,"PRESERVED_SPECIMEN","OCCURRENCE_STATUS_INFERRED_FROM_INDIVIDUAL_COUNT;COORDINATE_ROUNDED;GEODETIC_DATUM_ASSUMED_WGS84;DIFFERENT_OWNER_INSTITUTION"
43.98333,-23.26666,"Olax dissitiflora",4062030704,"Km 45 - Route de Tananarive - Tuléar","MDG",NA,1961,"PRESERVED_SPECIMEN","GEODETIC_DATUM_ASSUMED_WGS84;DIFFERENT_OWNER_INSTITUTION"
49.1,-13.16666,"Olax dissitiflora",1258584373,"Ouest (Nord): Grès, à la base Sud de l'Ambohipiraka (Ambilobe).","MDG",NA,1966,"PRESERVED_SPECIMEN","GEODETIC_DATUM_ASSUMED_WGS84;DIFFERENT_OWNER_INSTITUTION"
39.15583,-10.20527,"Olax dissitiflora",4061045039,"T8. Mtama Division; Namiupa Ward; Rondo Forest Reserve; NW of Mihima Village, miombo woodland, dominated by Parini sp., Albizia sp., Milicia excelsa. Disturbed by uncontrolled burning.","TZA",NA,2005,"PRESERVED_SPECIMEN","OCCURRENCE_STATUS_INFERRED_FROM_INDIVIDUAL_COUNT;GEODETIC_DATUM_ASSUMED_WGS84;INSTITUTION_MATCH_NONE"
49.319722,-12.909722,"Olax dissitiflora",1258160122,"Andrafiamena, forêts aux alentours d'Anjahankely.","MDG",NA,2010,"PRESERVED_SPECIMEN","OCCURRENCE_STATUS_INFERRED_FROM_INDIVIDUAL_COUNT;COORDINATE_ROUNDED;GEODETIC_DATUM_ASSUMED_WGS84;DIFFERENT_OWNER_INSTITUTION"
44.7,-22.35,"Olax dissitiflora",1259579696,"Forêt de Betsako, à 6 km environ au Sud du village de Tanandava, canton et district d'Ankazoabo. Station: Arbre croissant en bordure d'une rivière à côté du barrage, sol: sable alluvionnaire.","MDG",NA,1955,"PRESERVED_SPECIMEN","OCCURRENCE_STATUS_INFERRED_FROM_INDIVIDUAL_COUNT;GEODETIC_DATUM_ASSUMED_WGS84;DIFFERENT_OWNER_INSTITUTION"
44.533333,-20.783333,"Olax dissitiflora",1258354932,"1 km à l'Est du village de Betoboro, canton et district Befasy Morondava. Station: pente moyenne, sol argileux.","MDG",NA,1956,"PRESERVED_SPECIMEN","OCCURRENCE_STATUS_INFERRED_FROM_INDIVIDUAL_COUNT;COORDINATE_ROUNDED;GEODETIC_DATUM_ASSUMED_WGS84;ELEVATION_NON_NUMERIC;DIFFERENT_OWNER_INSTITUTION"
46.083333,-25.166667,"Olax dissitiflora",1258595154,"Environs d'Ambovombe (Sud). Bush dégradé.","MDG",NA,1956,"PRESERVED_SPECIMEN","OCCURRENCE_STATUS_INFERRED_FROM_INDIVIDUAL_COUNT;COORDINATE_ROUNDED;GEODETIC_DATUM_ASSUMED_WGS84;DIFFERENT_OWNER_INSTITUTION"
47.498611,-15.566667,"Olax dissitiflora",1260008731,"Boriziny, Port-Berge, Tsiningia, Andranomena II. Forêt dense sèche sur un substrat basaltique. Récolté avec R. Razakamalala & A. Tombomarina. Echantillons préservés en alcool.","MDG",NA,2004,"PRESERVED_SPECIMEN","OCCURRENCE_STATUS_INFERRED_FROM_INDIVIDUAL_COUNT;COORDINATE_ROUNDED;GEODETIC_DATUM_ASSUMED_WGS84;DIFFERENT_OWNER_INSTITUTION"
44.7,-18.633333,"Olax dissitiflora",1258583584,"Environs rivière Ambodiria, 1 km à l'Ambinda (RN 9, près d'Antsalova)","MDG",NA,1992,"PRESERVED_SPECIMEN","OCCURRENCE_STATUS_INFERRED_FROM_INDIVIDUAL_COUNT;COORDINATE_ROUNDED;GEODETIC_DATUM_ASSUMED_WGS84;DIFFERENT_OWNER_INSTITUTION"
