"lon","lat","species","gbifID","locality","countryCode","coordinateUncertaintyInMeters","year","basisOfRecord","issue"
-59.066667,-4.033333,"Ormosia discolor",2998215737,"Lower Rio Canumã, at Vila de Canumã.","BRA",NA,1983,"PRESERVED_SPECIMEN","COORDINATE_ROUNDED;GEODETIC_DATUM_ASSUMED_WGS84;CONTINENT_DERIVED_FROM_COORDINATES;INSTITUTION_MATCH_FUZZY;COLLECTION_MATCH_FUZZY"
-58.966667,-4.116667,"Ormosia discolor",2998185888,"Mun. de Axinim, basin of Rio Abacaxis, lower Rio Paca ca. 1km from its confluence with the Rio Marimari.","BRA",NA,1983,"PRESERVED_SPECIMEN","RECORDED_DATE_INVALID;COORDINATE_ROUNDED;GEODETIC_DATUM_ASSUMED_WGS84;CONTINENT_DERIVED_FROM_COORDINATES;INSTITUTION_MATCH_FUZZY;COLLECTION_MATCH_FUZZY"
-72.460528,0.065861,"Ormosia discolor",1328368120,"Estación Biológica de Puerto Abeja. P.N.N. Chiribiquete. Bosque DAN-2","COL",NA,2002,"PRESERVED_SPECIMEN","OCCURRENCE_STATUS_INFERRED_FROM_INDIVIDUAL_COUNT;COORDINATE_ROUNDED;GEODETIC_DATUM_ASSUMED_WGS84;CONTINENT_DERIVED_FROM_COORDINATES;INSTITUTION_MATCH_NONE"
-61.280102,-4.682967,"Ormosia discolor",1928437588,"Estrada Manaus-Porto Velho, BR-319 km 245; margem da estrada","BRA",NA,1979,"PRESERVED_SPECIMEN","COORDINATE_ROUNDED;COLLECTION_MATCH_FUZZY"
-67.0908182,-0.1335691,"Ormosia discolor",1930072200,"Rio Negro.","BRA",NA,1975,"PRESERVED_SPECIMEN","COORDINATE_REPROJECTED;COLLECTION_MATCH_FUZZY"
-58,-4.333333,"Ormosia discolor",1042673312,"Axinim, Along Rio Abacaxis, vicinity of Terra Preta.","BRA",NA,1983,"PRESERVED_SPECIMEN","GEODETIC_DATUM_ASSUMED_WGS84;GEODETIC_DATUM_INVALID;INSTITUTION_MATCH_NONE"
-61.02,-5.371428,"Ormosia discolor",1042712793,"Parque Estadual do Matupiri","BRA",NA,2012,"PRESERVED_SPECIMEN","GEODETIC_DATUM_ASSUMED_WGS84;GEODETIC_DATUM_INVALID;ELEVATION_MIN_MAX_SWAPPED;INSTITUTION_MATCH_NONE"
-65.33,-4.969722,"Ormosia discolor",1042674563,"Coletada na Base Petrolífera de Urucu, na estrada SUC.","BRA",NA,2008,"PRESERVED_SPECIMEN","GEODETIC_DATUM_ASSUMED_WGS84;GEODETIC_DATUM_INVALID;INSTITUTION_MATCH_NONE"
-72.76,-7.3993,"Ormosia discolor",1042713119,"Estrada do Badejo","BRA",NA,1998,"PRESERVED_SPECIMEN","GEODETIC_DATUM_ASSUMED_WGS84;GEODETIC_DATUM_INVALID;INSTITUTION_MATCH_NONE"
-58,-4.116667,"Ormosia discolor",1042673310,"Axinim, Basin of Rio Abacaxis, lower Rio Paca, ca 1 km from its confluence with the Rio Marimari.","BRA",NA,1983,"PRESERVED_SPECIMEN","GEODETIC_DATUM_ASSUMED_WGS84;GEODETIC_DATUM_INVALID;INSTITUTION_MATCH_NONE"
-76.632667,1.084,"Ormosia discolor",3397176819,"Centro Experimental Amazónico, Corpoamazonia","COL",NA,2016,"PRESERVED_SPECIMEN","COORDINATE_ROUNDED;INSTITUTION_MATCH_NONE"
-71.760556,0.093333,"Ormosia discolor",1929246135,"región de Araracuara, sector Chiribiquete, río Yavilla","COL",NA,2010,"PRESERVED_SPECIMEN","COORDINATE_ROUNDED;GEODETIC_DATUM_ASSUMED_WGS84;COLLECTION_MATCH_FUZZY"
-60.5886,-4.0139,"Ormosia discolor",1929495056,"Manaus-Porto Velho Highway, km 130","BRA",NA,1974,"PRESERVED_SPECIMEN","COLLECTION_MATCH_FUZZY"
-58.666667,-4.333333,"Ormosia discolor",1928389558,"Axinim. Along rio Abacaxis, vicinity of Terra Preta.","BRA",NA,1983,"PRESERVED_SPECIMEN","GEODETIC_DATUM_ASSUMED_WGS84;COLLECTION_MATCH_FUZZY"
-73.75,-4.833333,"Ormosia discolor",1258282699,"Saquena. Jenaro Herrera. Bosque primario inundable por rebalse (sacha aguajal).","PER",NA,1987,"PRESERVED_SPECIMEN","OCCURRENCE_STATUS_INFERRED_FROM_INDIVIDUAL_COUNT;COORDINATE_ROUNDED;GEODETIC_DATUM_ASSUMED_WGS84;INSTITUTION_MATCH_FUZZY;COLLECTION_MATCH_NONE"
-60.140556,-2.969167,"Ormosia discolor",2421818161,"Reserva de desenvolvimento sustentável do Tupé.","BRA",NA,2013,"PRESERVED_SPECIMEN","GEODETIC_DATUM_ASSUMED_WGS84;INSTITUTION_MATCH_FUZZY;INSTITUTION_COLLECTION_MISMATCH"
-74.115556,3.428611,"Ormosia discolor",1707557340,"Sector La Carbonera, cuenca del río Berriador, en la microcuenca de la quebrada de la bocatoma del acueducto que abastece de agua al Municipio de Mesetas","COL",NA,2002,"PRESERVED_SPECIMEN","COORDINATE_ROUNDED;GEODETIC_DATUM_ASSUMED_WGS84;INSTITUTION_MATCH_NONE"
-61.644167,-9.636111,"Ormosia discolor",1852375600,"Reserva Biológica do Jaru, Unidade amostral 2 (Ponto amostral Sul).","BRA",NA,2017,"PRESERVED_SPECIMEN","COORDINATE_ROUNDED;GEODETIC_DATUM_ASSUMED_WGS84;CONTINENT_DERIVED_FROM_COORDINATES;INSTITUTION_MATCH_FUZZY;COLLECTION_MATCH_FUZZY"
-72.4,-0.59,"Ormosia discolor",768735199,"Araracuara, alrededores de la pista aérea","COL",NA,1991,"PRESERVED_SPECIMEN","INSTITUTION_MATCH_NONE"
-68.41,1.92,"Ormosia discolor",1932886735,"río Cuyarí, trayecto fluvial de las comunidades de Miraflores a comunidad de Sejal","COL",NA,2014,"PRESERVED_SPECIMEN","INSTITUTION_MATCH_NONE"
-69.89,-3.98,"Ormosia discolor",3068329159,"km 27.4, en el límíte E entre Colombia y Brasil, varillal T4-26","COL",NA,2005,"PRESERVED_SPECIMEN","INSTITUTION_MATCH_NONE"
-72.87,-1.43,"Ormosia discolor",768755687,"inmediaciones del Internado indígena Casa del conocimiento, cerca de la pista aérea de la Chorrera","COL",NA,2000,"PRESERVED_SPECIMEN","INSTITUTION_MATCH_NONE"
-70.1,1.26,"Ormosia discolor",3705116991,"comunidad Macaquiño, 20km de Mitú, río abajo","COL",NA,2014,"PRESERVED_SPECIMEN","INSTITUTION_MATCH_NONE"
-72.33,-0.91,"Ormosia discolor",768727676,"sabanas de Aduche, SW de Araracuara, cabecera de la qda. Tibeye, trocha a La Chorrera, bosque de arenisca","COL",NA,1993,"PRESERVED_SPECIMEN","INSTITUTION_MATCH_NONE"
-67.82,3.8,"Ormosia discolor",1324651203,"comunidad indígena de Caño Vitina","COL",NA,2015,"PRESERVED_SPECIMEN","INSTITUTION_MATCH_NONE"
-72.29,-0.65,"Ormosia discolor",768729675,"sabanas de Aduche, SW de Araracuara, cabecera de la qda. Tibeye, trocha a La Chorrera, bosque de arenisca","COL",NA,1993,"PRESERVED_SPECIMEN","INSTITUTION_MATCH_NONE"
-72.1253,-0.0072,"Ormosia discolor",3004065685,"Parque Nacional Natural Serranía de Chiribiquete, Yavilla 4, Bosque de tierra firme alta","COL",NA,2011,"HUMAN_OBSERVATION","OCCURRENCE_STATUS_INFERRED_FROM_INDIVIDUAL_COUNT;COORDINATE_ROUNDED"
-72.4075,-0.2606,"Ormosia discolor",3004065909,"Gamitana 4, Vegetación sobre afloramiento rocoso","COL",NA,2011,"HUMAN_OBSERVATION","OCCURRENCE_STATUS_INFERRED_FROM_INDIVIDUAL_COUNT;COORDINATE_ROUNDED"
-65.1939,-4.5771,"Ormosia discolor",1095267648,"Coletada na Base Petrolífera de Urucu, na estrada SUC.","BRA",NA,2008,"PRESERVED_SPECIMEN","GEODETIC_DATUM_ASSUMED_WGS84;CONTINENT_DERIVED_FROM_COORDINATES;INSTITUTION_MATCH_NONE"
-70.45,0.5,"Ormosia discolor",3923793460,"Mitá","COL",NA,1984,"HUMAN_OBSERVATION",""
