"lon","lat","species","gbifID","locality","countryCode","coordinateUncertaintyInMeters","year","basisOfRecord","issue"
97.83,3,"Oryza meyeriana",3897799066,"Gunung Leuser Nature Reserves, Atjeh, North Sumatra. Southern part of the reserves, Alas River valley, near the mouth of the Bengkong/Renun River, c. 50 km. S. of Kutacane.","IDN",NA,1979,"PRESERVED_SPECIMEN","GEODETIC_DATUM_ASSUMED_WGS84"
79.834599,11.931789,"Oryza meyeriana",4035433262,"","IND",NA,1960,"PRESERVED_SPECIMEN","CONTINENT_DERIVED_FROM_COORDINATES;INSTITUTION_MATCH_FUZZY;COLLECTION_MATCH_FUZZY"
127.666667,0.85,"Oryza meyeriana",2513581178,"Plants of Indonesia. N. Moluccas, Halmahera, Isthmus of Dodinga.","IDN",NA,1974,"PRESERVED_SPECIMEN","INSTITUTION_MATCH_FUZZY;INSTITUTION_COLLECTION_MISMATCH"
114.75,-3.8,"Oryza meyeriana",2513578448,"South Kalimantan Prov., Pleihari-Martapura Game Reserve along the Amurau River","IDN",NA,1987,"PRESERVED_SPECIMEN","INSTITUTION_MATCH_FUZZY;INSTITUTION_COLLECTION_MISMATCH"
98.916667,18.783333,"Oryza meyeriana",2513581673,"Thailand, Province: Chiang Mai, District: Muang, Doi Sutep-Pui National Park; east side Palaht Temple area.","THA",NA,1993,"PRESERVED_SPECIMEN","INSTITUTION_MATCH_FUZZY;INSTITUTION_COLLECTION_MISMATCH"
99.302194,18.490667,"Oryza meyeriana",2513581786,"Thailand, Province: Lampoon, District: Mae Tah, Doi Kuhn Dahn National Park, along the trail to Mah Meun station.","THA",NA,1993,"PRESERVED_SPECIMEN","INSTITUTION_MATCH_FUZZY;INSTITUTION_COLLECTION_MISMATCH"
98.633333,18.3,"Oryza meyeriana",2513583025,"Thailand, Province: Chiang Mai, District: Jawn Tong, Mae Soi Valley, Mae Soi Subdistrict, near Mae Soi Stream.","THA",NA,1991,"PRESERVED_SPECIMEN","INSTITUTION_MATCH_FUZZY;INSTITUTION_COLLECTION_MISMATCH"
99.75,19.0667,"Oryza meyeriana",2513581668,"Thailand, Province: Chiang Rai, District: Pan, Doi Luang National Park, east side, Bu Gang Falls.","THA",NA,1997,"PRESERVED_SPECIMEN","INSTITUTION_MATCH_FUZZY;INSTITUTION_COLLECTION_MISMATCH"
98.881944,10.558333,"Oryza meyeriana",3111975369,"Viphavadee, Ta Kuk Tai, Viphavadee Waterfall, Viphawadee waterfall, level 2, Ban Wang Phak Wan.","THA",NA,2012,"PRESERVED_SPECIMEN","INSTITUTION_MATCH_FUZZY;INSTITUTION_COLLECTION_MISMATCH"
123.666667,13.796667,"Oryza meyeriana",2515064145,"Philippines, Island: Luzon, Province: Camarines Sur, Barangay Caputatan, Caramoan.","PHL",NA,1995,"PRESERVED_SPECIMEN","INSTITUTION_MATCH_FUZZY;INSTITUTION_COLLECTION_MISMATCH"
116,5.166667,"Oryza meyeriana",2513581054,"Sabah, Tenom district, east of Agricultural Research Station","MYS",NA,2001,"PRESERVED_SPECIMEN","INSTITUTION_MATCH_FUZZY;INSTITUTION_COLLECTION_MISMATCH"
99.866667,18.333333,"Oryza meyeriana",2513581606,"Thailand, Province: Lampang, District: Muang Bahn (Pan), Jae Sawn National Park, headquarters area.","THA",NA,1995,"PRESERVED_SPECIMEN","INSTITUTION_MATCH_FUZZY;INSTITUTION_COLLECTION_MISMATCH"
118.566667,9.533333,"Oryza meyeriana",2513580839,"Philippines, Palawan, Aborlan, Sagpañgan.","PHL",NA,1963,"PRESERVED_SPECIMEN","INSTITUTION_MATCH_FUZZY;INSTITUTION_COLLECTION_MISMATCH"
98.866,18.9,"Oryza meyeriana",47817345,"Above Training Center of Queen Sirikit Botanical Garden","THA",NA,2001,"PRESERVED_SPECIMEN","GEODETIC_DATUM_ASSUMED_WGS84;COORDINATE_PRECISION_INVALID;INSTITUTION_MATCH_FUZZY;INSTITUTION_COLLECTION_MISMATCH"
100.2,7,"Oryza meyeriana",47816940,"Boripath waterfall","THA",NA,1991,"PRESERVED_SPECIMEN","GEODETIC_DATUM_ASSUMED_WGS84;COORDINATE_PRECISION_INVALID;INSTITUTION_MATCH_FUZZY;INSTITUTION_COLLECTION_MISMATCH"
100.833,18.3,"Oryza meyeriana",47816944,"Khun Mo Tom E of Na Noi. Km 14 - 16 on road 1083","THA",NA,1992,"PRESERVED_SPECIMEN","GEODETIC_DATUM_ASSUMED_WGS84;COORDINATE_PRECISION_INVALID;INSTITUTION_MATCH_FUZZY;INSTITUTION_COLLECTION_MISMATCH"
98.633333,14.733333,"Oryza meyeriana",2513579907,"Thailand, Kanchanaburi, Thong Pha Phum, Huai Khayeng, Thong Pa Phum National Park, Phong Phu Roen substation.","THA",NA,2003,"PRESERVED_SPECIMEN","INSTITUTION_MATCH_FUZZY;INSTITUTION_COLLECTION_MISMATCH"
117.216666,5.816666,"Oryza meyeriana",2513580724,"Sabah, Sandakan district, Sg. Meliau near Kiabau","MYS",NA,1965,"PRESERVED_SPECIMEN","INSTITUTION_MATCH_FUZZY;INSTITUTION_COLLECTION_MISMATCH"
99.25,18.766667,"Oryza meyeriana",2513581783,"Thailand, Province: Chiang Mai, District: Sanganpang, Doi Muang Awn (cave), Sahagohn Subdistrict.","THA",NA,1990,"PRESERVED_SPECIMEN","INSTITUTION_MATCH_FUZZY;INSTITUTION_COLLECTION_MISMATCH"
101.06275,13.253584,"Oryza meyeriana",2513581734,"Thailand (Siam), Kow Kieo, Siricha District, Chonburi Province.","THA",NA,1975,"PRESERVED_SPECIMEN","INSTITUTION_MATCH_FUZZY;INSTITUTION_COLLECTION_MISMATCH"
116.716667,6.201853,"Oryza meyeriana",2513580559,"Sabah, Ranau district, c. 3 miles NE of Kg. Takutan.","MYS",NA,1973,"PRESERVED_SPECIMEN","INSTITUTION_MATCH_FUZZY;INSTITUTION_COLLECTION_MISMATCH"
99.16666,8.91667,"Oryza meyeriana",465163584,"","THA",NA,1955,"PRESERVED_SPECIMEN","GEODETIC_DATUM_ASSUMED_WGS84;CONTINENT_DERIVED_FROM_COORDINATES;COLLECTION_MATCH_FUZZY"
101.85708,16.88791,"Oryza meyeriana",437571836,"","THA",NA,1951,"PRESERVED_SPECIMEN","GEODETIC_DATUM_ASSUMED_WGS84;CONTINENT_DERIVED_FROM_COORDINATES;COLLECTION_MATCH_FUZZY"
100.283333,18.3,"Oryza meyeriana",2515074835,"Thailand, Province: Prae, District: Song. Mae Yom National Park, SW part, Lohm Dohng pond area; Dow Boon Subdistrict.","THA",NA,2006,"PRESERVED_SPECIMEN","INSTITUTION_MATCH_FUZZY;INSTITUTION_COLLECTION_MISMATCH"
97.95,19.516667,"Oryza meyeriana",2513581712,"Thailand, Province: Chiang Mai, District: Mae Dtang, Doi Sahng Liang, south side, near Pah Dang (red Lahu) village, upper Gu Gahp valley, Geut Chang subdistrict.","THA",NA,1997,"PRESERVED_SPECIMEN","INSTITUTION_MATCH_FUZZY;INSTITUTION_COLLECTION_MISMATCH"
115.883333,1.416666,"Oryza meyeriana",2513581450,"Indonesian East Borneo, Berau, Mt. Njapa on Kelai River","IDN",NA,1963,"PRESERVED_SPECIMEN","INSTITUTION_MATCH_FUZZY;INSTITUTION_COLLECTION_MISMATCH"
122.8507,10.2706,"Oryza meyeriana",2513582403,"Philippines, Negros Occidental, Candumarao, about 16 km from Hinigaran on the eastern side.","PHL",NA,1963,"PRESERVED_SPECIMEN","INSTITUTION_MATCH_FUZZY;INSTITUTION_COLLECTION_MISMATCH"
98.916667,19.35,"Oryza meyeriana",2513580891,"Thailand, Prov. Chiang Mai, distr. Chiang Dao, Doi Chiang Dao Animal Sanctuary, southern part, Ban Yang Toong Bong Station.","THA",NA,1990,"PRESERVED_SPECIMEN","INSTITUTION_MATCH_FUZZY;INSTITUTION_COLLECTION_MISMATCH"
99.866667,7.666667,"Oryza meyeriana",2513582463,"Thailand, Province: Pattalung, District: See Bahn Poht, Kao Boo-Kao Yah National Park, near Mat Cha Cave.","THA",NA,1986,"PRESERVED_SPECIMEN","INSTITUTION_MATCH_FUZZY;INSTITUTION_COLLECTION_MISMATCH"
120,-0.883333,"Oryza meyeriana",2513580650,"Malesia, Celebes, northern peninsula, between Palu and Parigi, 30 - 40 km from Palu.","IDN",NA,1975,"PRESERVED_SPECIMEN","INSTITUTION_MATCH_FUZZY;INSTITUTION_COLLECTION_MISMATCH"
97.91666,18.1,"Oryza meyeriana",464857003,"","THA",NA,1968,"PRESERVED_SPECIMEN","GEODETIC_DATUM_ASSUMED_WGS84;CONTINENT_DERIVED_FROM_COORDINATES;COLLECTION_MATCH_FUZZY"
102.7333,20.95,"Oryza meyeriana",2513582297,"Laos, Province: Sayaboury, District: Phiang, hill west of Nampouy Village.","LAO",NA,1999,"PRESERVED_SPECIMEN","INSTITUTION_MATCH_FUZZY;INSTITUTION_COLLECTION_MISMATCH"
98.486306,18.587834,"Oryza meyeriana",2513581532,"Thailand, N, Prov. Chiang Mai; along Mae Klang river (RS-8), Doi Inthanon.","THA",NA,1988,"PRESERVED_SPECIMEN","INSTITUTION_MATCH_FUZZY;INSTITUTION_COLLECTION_MISMATCH"
99.233333,7.85,"Oryza meyeriana",2513579763,"Thailand. Provine: Krabi, District: Klong Tawm, Kow Pra - Bahng Krahm Wildlife Sanctuary, Headquarters area near Klong (stream) Bahng Dtiew, Klong Tawm Nua Subdistrict.","THA",NA,2006,"PRESERVED_SPECIMEN","INSTITUTION_MATCH_FUZZY;INSTITUTION_COLLECTION_MISMATCH"
99.91857,20.42253,"Oryza meyeriana",464703637,"","THA",NA,1991,"PRESERVED_SPECIMEN","GEODETIC_DATUM_ASSUMED_WGS84;CONTINENT_DERIVED_FROM_COORDINATES;COLLECTION_MATCH_FUZZY"
98.833333,19.583333,"Oryza meyeriana",2513582773,"Thailand, Province: Chiang Mai, District: Chiang Dao, Doi Chiang Dao, east side, Pa Blawng Cave area.","THA",NA,1989,"PRESERVED_SPECIMEN","INSTITUTION_MATCH_FUZZY;INSTITUTION_COLLECTION_MISMATCH"
127.866667,0.816667,"Oryza meyeriana",2513582572,"Plants of Indonesia. N. Moluccas, Halmahera, Ekor, Gunung Panjang.","IDN",NA,1974,"PRESERVED_SPECIMEN","INSTITUTION_MATCH_FUZZY;INSTITUTION_COLLECTION_MISMATCH"
101.75,16.933333,"Oryza meyeriana",2513581341,"Thailand, Northeastern, Prov. Loei: along trail from Samhaek (RS-5) to Samkokwa (RS-6), Phu Kradung.","THA",NA,1988,"PRESERVED_SPECIMEN","INSTITUTION_MATCH_FUZZY;INSTITUTION_COLLECTION_MISMATCH"
99.816667,20.183333,"Oryza meyeriana",2513580695,"Thailand, Province: Chiang Rai, District: Mae Chan, Ban Mai Pattana, Nawng Bah Gaw Subdistrict.","THA",NA,1988,"PRESERVED_SPECIMEN","INSTITUTION_MATCH_FUZZY;INSTITUTION_COLLECTION_MISMATCH"
99.86419,7.6649,"Oryza meyeriana",465163586,"","THA",NA,1986,"PRESERVED_SPECIMEN","GEODETIC_DATUM_ASSUMED_WGS84;CONTINENT_DERIVED_FROM_COORDINATES;COLLECTION_MATCH_FUZZY"
