"lon","lat","species","gbifID","locality","countryCode","coordinateUncertaintyInMeters","year","basisOfRecord","issue"
-145.75,61.17,"Oxytropis huddelsonii",1096676257,"Alaska: Mile 25.2 Richardson Hwy. Chugach Mts., Thomson Pass.","USA",NA,1967,"PRESERVED_SPECIMEN","GEODETIC_DATUM_ASSUMED_WGS84;INSTITUTION_COLLECTION_MISMATCH"
-137.05,59.916667,"Oxytropis huddelsonii",1988179583,"Tatshenshini River Valley, Headwaters of Kudwat Creek.","CAN",NA,1992,"PRESERVED_SPECIMEN","GEODETIC_DATUM_ASSUMED_WGS84;GEODETIC_DATUM_INVALID;CONTINENT_DERIVED_FROM_COORDINATES;INSTITUTION_MATCH_NONE"
-138.566667,61,"Oxytropis huddelsonii",1988206118,"Sheep Mountain, east slopes, near Kluane Lake","CAN",NA,1970,"PRESERVED_SPECIMEN","GEODETIC_DATUM_ASSUMED_WGS84;GEODETIC_DATUM_INVALID;CONTINENT_DERIVED_FROM_COORDINATES;INSTITUTION_MATCH_NONE"
-137.95,60.833333,"Oxytropis huddelsonii",1988107723,"Kluane Range, Mount Decoeli east of Kimberley Creek","CAN",NA,1980,"PRESERVED_SPECIMEN","GEODETIC_DATUM_ASSUMED_WGS84;GEODETIC_DATUM_INVALID;CONTINENT_DERIVED_FROM_COORDINATES;INSTITUTION_MATCH_NONE"
-135.230117,60.748883,"Oxytropis huddelsonii",3414087416,"Whitehorse area, top of Haeckel Hill","CAN",NA,2017,"PRESERVED_SPECIMEN","GEODETIC_DATUM_ASSUMED_WGS84;GEODETIC_DATUM_INVALID;CONTINENT_DERIVED_FROM_COORDINATES;INSTITUTION_MATCH_NONE"
-135.286807,60.631579,"Oxytropis huddelsonii",3994167582,"","CAN",4,2022,"HUMAN_OBSERVATION","COORDINATE_ROUNDED;CONTINENT_DERIVED_FROM_COORDINATES"
-135.539703,60.7833,"Oxytropis huddelsonii",1703173807,"","CAN",3906,2015,"HUMAN_OBSERVATION","COORDINATE_ROUNDED;CONTINENT_DERIVED_FROM_COORDINATES"
-134.898403,60.66879,"Oxytropis huddelsonii",1848810935,"","CAN",NA,2018,"HUMAN_OBSERVATION","COORDINATE_ROUNDED;CONTINENT_DERIVED_FROM_COORDINATES"
-137.533867,60.605772,"Oxytropis huddelsonii",2814324365,"","CAN",122,2020,"HUMAN_OBSERVATION","COORDINATE_ROUNDED;CONTINENT_DERIVED_FROM_COORDINATES"
-136.873023,60.072947,"Oxytropis huddelsonii",2856749462,"","CAN",244,2020,"HUMAN_OBSERVATION","COORDINATE_ROUNDED;CONTINENT_DERIVED_FROM_COORDINATES"
-128.807116,57.709044,"Oxytropis huddelsonii",4018197474,"","CAN",1198,2021,"HUMAN_OBSERVATION","COORDINATE_ROUNDED;CONTINENT_DERIVED_FROM_COORDINATES"
-136.7,59.9,"Oxytropis huddelsonii",441796757,"Mount Mansfield.","CAN",NA,1979,"PRESERVED_SPECIMEN","GEODETIC_DATUM_ASSUMED_WGS84;CONTINENT_DERIVED_FROM_COORDINATES;INSTITUTION_MATCH_FUZZY;INSTITUTION_COLLECTION_MISMATCH"
-136.552226,60.87607,"Oxytropis huddelsonii",1948749766,"","CAN",1953,2018,"HUMAN_OBSERVATION","COORDINATE_ROUNDED;CONTINENT_DERIVED_FROM_COORDINATES"
-134.083,60.2,"Oxytropis huddelsonii",1804371372,"Jubilee Mountain Approx. 16 km SE of Tagish","CAN",NA,1979,"PRESERVED_SPECIMEN","OCCURRENCE_STATUS_INFERRED_FROM_INDIVIDUAL_COUNT;GEODETIC_DATUM_ASSUMED_WGS84;CONTINENT_DERIVED_FROM_COORDINATES;COLLECTION_MATCH_FUZZY"
-145.461515,63.234921,"Oxytropis huddelsonii",2814210527,"","USA",24,2020,"HUMAN_OBSERVATION","COORDINATE_ROUNDED;CONTINENT_DERIVED_FROM_COORDINATES"
-143.75944,64.54583,"Oxytropis huddelsonii",1658232171,"Yukon-Charley National Preserve, Mt. Frosty 2 camp pass at upper Good Pasture Creek and Upper Charley River","USA",NA,2002,"PRESERVED_SPECIMEN","GEODETIC_DATUM_ASSUMED_WGS84"
-138.03427,62.25906,"Oxytropis huddelsonii",1658232190,"Langham Mountain","CAN",NA,2012,"PRESERVED_SPECIMEN","GEODETIC_DATUM_ASSUMED_WGS84"
-140.2341,61.5177,"Oxytropis huddelsonii",1658232234,"Asi Keyi SMA, Wolverine Plateau creek near camp","CAN",NA,2004,"PRESERVED_SPECIMEN","GEODETIC_DATUM_ASSUMED_WGS84"
-135.07,60.3583,"Oxytropis huddelsonii",1658232246,"Red Ridge","CAN",NA,1999,"PRESERVED_SPECIMEN","GEODETIC_DATUM_ASSUMED_WGS84"
-143.56656,65.06906,"Oxytropis huddelsonii",1658232225,"Yukon-Charley Rivers National Preserve, Twin Mountain","USA",NA,2008,"PRESERVED_SPECIMEN","GEODETIC_DATUM_ASSUMED_WGS84"
-137.535981,60.025289,"Oxytropis huddelsonii",2575020340,"Kluane National Park, Alsek Range","CAN",NA,2017,"PRESERVED_SPECIMEN","COORDINATE_ROUNDED;GEODETIC_DATUM_ASSUMED_WGS84"
-143.23861,64.84111,"Oxytropis huddelsonii",1658232263,"Yukon-Charley National Preserve, Bluff Site","USA",NA,2002,"PRESERVED_SPECIMEN","GEODETIC_DATUM_ASSUMED_WGS84"
-138.924514,60.974286,"Oxytropis huddelsonii",2575020608,"Kluane National Park, Duke River headwaters","CAN",NA,2019,"PRESERVED_SPECIMEN","COORDINATE_ROUNDED;GEODETIC_DATUM_ASSUMED_WGS84"
-141.304444,61.754167,"Oxytropis huddelsonii",1658232161,"Wrangell-St. Elias National Preserve, Ping Pong Mountain, highwest peak in rear ridge","USA",NA,2003,"PRESERVED_SPECIMEN","COORDINATE_ROUNDED;GEODETIC_DATUM_ASSUMED_WGS84"
-131.457778,58.473889,"Oxytropis huddelsonii",1949641250,"Level Mountain Range; Meszah Peak: small valley 1.5 km SW of Meszah summit","CAN",NA,2004,"PRESERVED_SPECIMEN","OCCURRENCE_STATUS_INFERRED_FROM_INDIVIDUAL_COUNT;COORDINATE_ROUNDED;GEODETIC_DATUM_ASSUMED_WGS84;DIFFERENT_OWNER_INSTITUTION"
-134.658889,59.731389,"Oxytropis huddelsonii",1949651441,"Tagish Highland; Teepee Peak: summit 7 km NNW of Teepee Peak, E of Racine Lake","CAN",NA,2008,"PRESERVED_SPECIMEN","OCCURRENCE_STATUS_INFERRED_FROM_INDIVIDUAL_COUNT;COORDINATE_ROUNDED;GEODETIC_DATUM_ASSUMED_WGS84;DIFFERENT_OWNER_INSTITUTION"
-128.414528,57.720361,"Oxytropis huddelsonii",1949658911,"Spatsizi Plateau; Hyland Post; Diamond Creek: High ridge north of Spatsizi River, south of Diamond Creek; ca. 20 km WNW of Hyland Post","CAN",NA,2013,"PRESERVED_SPECIMEN","COORDINATE_ROUNDED;GEODETIC_DATUM_ASSUMED_WGS84;DIFFERENT_OWNER_INSTITUTION"
-129.912917,57.570417,"Oxytropis huddelsonii",1949659441,"Skeena Mountains; Tsatia Mountain: E of Kinaskan Lake; S of Todagin Creek","CAN",NA,2013,"PRESERVED_SPECIMEN","COORDINATE_ROUNDED;GEODETIC_DATUM_ASSUMED_WGS84;DIFFERENT_OWNER_INSTITUTION"
-138.05,59.866667,"Oxytropis huddelsonii",1949527907,"Alsek River; Easy Creek: Easy Creek campsite","CAN",NA,1975,"PRESERVED_SPECIMEN","OCCURRENCE_STATUS_INFERRED_FROM_INDIVIDUAL_COUNT;COORDINATE_ROUNDED;GEODETIC_DATUM_ASSUMED_WGS84;DIFFERENT_OWNER_INSTITUTION"
-134.423889,59.805556,"Oxytropis huddelsonii",1949652532,"Brown, Mount; Racine Lake: summit area; north of lake","CAN",NA,2008,"PRESERVED_SPECIMEN","OCCURRENCE_STATUS_INFERRED_FROM_INDIVIDUAL_COUNT;COORDINATE_ROUNDED;GEODETIC_DATUM_ASSUMED_WGS84;DIFFERENT_OWNER_INSTITUTION"
-136.5,59.65,"Oxytropis huddelsonii",1949556821,"Kusawak Range: ca 3 km E of mile 64 Haines Road","CAN",NA,1975,"PRESERVED_SPECIMEN","OCCURRENCE_STATUS_INFERRED_FROM_INDIVIDUAL_COUNT;GEODETIC_DATUM_ASSUMED_WGS84;DIFFERENT_OWNER_INSTITUTION"
-132.510556,59.038611,"Oxytropis huddelsonii",1949652570,"Nimbus Mountain; Nakina Lake: SW of summit area; mountain W of lake","CAN",NA,2008,"PRESERVED_SPECIMEN","OCCURRENCE_STATUS_INFERRED_FROM_INDIVIDUAL_COUNT;COORDINATE_ROUNDED;GEODETIC_DATUM_ASSUMED_WGS84;DIFFERENT_OWNER_INSTITUTION"
-136.95,59.483333,"Oxytropis huddelsonii",1949625090,"Tkope River: E side of; Haines Triangle","CAN",NA,1992,"PRESERVED_SPECIMEN","OCCURRENCE_STATUS_INFERRED_FROM_INDIVIDUAL_COUNT;COORDINATE_ROUNDED;GEODETIC_DATUM_ASSUMED_WGS84;DIFFERENT_OWNER_INSTITUTION"
-134.859444,59.938056,"Oxytropis huddelsonii",1949651750,"Paddy Pass: peak on plateau 7-8 km N of pass; E of Bennett Lake","CAN",NA,2008,"PRESERVED_SPECIMEN","OCCURRENCE_STATUS_INFERRED_FROM_INDIVIDUAL_COUNT;COORDINATE_ROUNDED;GEODETIC_DATUM_ASSUMED_WGS84;DIFFERENT_OWNER_INSTITUTION"
-128.783333,57.583333,"Oxytropis huddelsonii",1949531188,"","CAN",NA,1975,"PRESERVED_SPECIMEN","OCCURRENCE_STATUS_INFERRED_FROM_INDIVIDUAL_COUNT;COORDINATE_ROUNDED;GEODETIC_DATUM_ASSUMED_WGS84;DIFFERENT_OWNER_INSTITUTION"
-137.683333,59.65,"Oxytropis huddelsonii",1949606353,"Tatshenshini Lake: 2 kilometers N of Lake","CAN",NA,1992,"PRESERVED_SPECIMEN","OCCURRENCE_STATUS_INFERRED_FROM_INDIVIDUAL_COUNT;COORDINATE_ROUNDED;GEODETIC_DATUM_ASSUMED_WGS84;DIFFERENT_OWNER_INSTITUTION"
-130.08775,57.362194,"Oxytropis huddelsonii",1949659654,"Skeena Mountains; Eastman Creek: Ridge north and east of headwaters of Eastman Creek; ca. 8 km east of Stewart-Cassiar Hiway","CAN",NA,2013,"PRESERVED_SPECIMEN","COORDINATE_ROUNDED;GEODETIC_DATUM_ASSUMED_WGS84;DIFFERENT_OWNER_INSTITUTION"
-134.683611,59.747778,"Oxytropis huddelsonii",1949652435,"Tagish Highland; Teepee Peak: mountain 8 km NNW of Teepee Peak, E of Racine Lake","CAN",NA,2008,"PRESERVED_SPECIMEN","OCCURRENCE_STATUS_INFERRED_FROM_INDIVIDUAL_COUNT;COORDINATE_ROUNDED;GEODETIC_DATUM_ASSUMED_WGS84;DIFFERENT_OWNER_INSTITUTION"
-132.95,59.116667,"Oxytropis huddelsonii",1949570464,"Sinawa Eddy Mountain; Taku River: above Taku and Nakina Rivers","CAN",NA,1982,"PRESERVED_SPECIMEN","OCCURRENCE_STATUS_INFERRED_FROM_INDIVIDUAL_COUNT;COORDINATE_ROUNDED;GEODETIC_DATUM_ASSUMED_WGS84;DIFFERENT_OWNER_INSTITUTION"
-136.572222,59.841944,"Oxytropis huddelsonii",1949651604,"Coast Mountains; Kelsall Lake: E of Haines highway; slopes on mountain N of W end of lake","CAN",NA,2008,"PRESERVED_SPECIMEN","OCCURRENCE_STATUS_INFERRED_FROM_INDIVIDUAL_COUNT;COORDINATE_ROUNDED;GEODETIC_DATUM_ASSUMED_WGS84;DIFFERENT_OWNER_INSTITUTION"
-130.666667,57.733333,"Oxytropis huddelsonii",1949636818,"","CAN",NA,1982,"PRESERVED_SPECIMEN","OCCURRENCE_STATUS_INFERRED_FROM_INDIVIDUAL_COUNT;COORDINATE_ROUNDED;GEODETIC_DATUM_ASSUMED_WGS84;DIFFERENT_OWNER_INSTITUTION"
-137.366667,59.783333,"Oxytropis huddelsonii",1949624235,"Sediments Ridge: Haines Triangle","CAN",NA,1992,"PRESERVED_SPECIMEN","OCCURRENCE_STATUS_INFERRED_FROM_INDIVIDUAL_COUNT;COORDINATE_ROUNDED;GEODETIC_DATUM_ASSUMED_WGS84;DIFFERENT_OWNER_INSTITUTION"
-134.448333,59.989444,"Oxytropis huddelsonii",1949652710,"Charlie Peak; White Range: 5 km N Tutshi Lake","CAN",NA,2008,"PRESERVED_SPECIMEN","OCCURRENCE_STATUS_INFERRED_FROM_INDIVIDUAL_COUNT;COORDINATE_ROUNDED;GEODETIC_DATUM_ASSUMED_WGS84;DIFFERENT_OWNER_INSTITUTION"
-130.211667,59.413333,"Oxytropis huddelsonii",1949641180,"Stikine Ranges; Cassiar Mountains; Blue River: saddle of mount 2 km S of 4 km long lake, head of N fork Blue River","CAN",NA,2004,"PRESERVED_SPECIMEN","OCCURRENCE_STATUS_INFERRED_FROM_INDIVIDUAL_COUNT;COORDINATE_ROUNDED;GEODETIC_DATUM_ASSUMED_WGS84;DIFFERENT_OWNER_INSTITUTION"
-143.7,65.15,"Oxytropis huddelsonii",1146250672,"Yukon-Tanana Uplands, Yukon Fork of South Fork of Birch Cr. headwaters, ridgetops and alpine slopes above headwaters, Charley River Quad, Steese National Conservation Area","USA",3615,1996,"PRESERVED_SPECIMEN","GEODETIC_DATUM_ASSUMED_WGS84;GEODETIC_DATUM_INVALID;CONTINENT_DERIVED_FROM_COORDINATES;AMBIGUOUS_INSTITUTION"
-145.43,65.48,"Oxytropis huddelsonii",1146396143,"Yukon-Tanana Uplands, Mi 106 Steese Hwy., Eagle Summit, Circle Quad","USA",3615,1976,"PRESERVED_SPECIMEN","GEODETIC_DATUM_ASSUMED_WGS84;GEODETIC_DATUM_INVALID;CONTINENT_DERIVED_FROM_COORDINATES;AMBIGUOUS_INSTITUTION"
-149,63.45,"Oxytropis huddelsonii",1146388613,"Alaska Range, Windy Creek near Cantwell, UTMzone 6, E399969, N7038108, Healy Quad, Denali National Park and Preserve","USA",3615,2000,"PRESERVED_SPECIMEN","GEODETIC_DATUM_ASSUMED_WGS84;GEODETIC_DATUM_INVALID;CONTINENT_DERIVED_FROM_COORDINATES;AMBIGUOUS_INSTITUTION"
-142.01,60.99,"Oxytropis huddelsonii",1146330388,"Chugach Mts., Granite Range, slopes and ridges E of Goat Cr., Bering Glacier Quad, Wrangell-St. Elias National Park and Preserve","USA",3615,1996,"PRESERVED_SPECIMEN","GEODETIC_DATUM_ASSUMED_WGS84;GEODETIC_DATUM_INVALID;CONTINENT_DERIVED_FROM_COORDINATES;AMBIGUOUS_INSTITUTION"
-152.83,61.35,"Oxytropis huddelsonii",1146361473,"Alaska Range, ridge S of Max Lake, Tyonek Quad","USA",3615,2002,"PRESERVED_SPECIMEN","GEODETIC_DATUM_ASSUMED_WGS84;GEODETIC_DATUM_INVALID;CONTINENT_DERIVED_FROM_COORDINATES;AMBIGUOUS_INSTITUTION"
-144.333333,61.983333,"Oxytropis huddelsonii",1146320638,"Valdez Quad.: headwaters of the Chetaslina River","USA",1,1978,"PRESERVED_SPECIMEN","COORDINATE_ROUNDED;GEODETIC_DATUM_ASSUMED_WGS84;GEODETIC_DATUM_INVALID;CONTINENT_DERIVED_FROM_COORDINATES;AMBIGUOUS_INSTITUTION"
-143.154003,64.704291,"Oxytropis huddelsonii",1146323080,"No specific locality recorded., Big Delta Quad, Yukon-Charley Rivers National Preserve","USA",50,2014,"PRESERVED_SPECIMEN","COORDINATE_ROUNDED;CONTINENT_DERIVED_FROM_COORDINATES;AMBIGUOUS_INSTITUTION"
-142.76,62.68,"Oxytropis huddelsonii",1146370237,"Mentasta Mts., Tetlin Mts., T10N, R14E, S3, Nabesna Quad, Tetlin National Wildlife Refuge","USA",3615,1983,"PRESERVED_SPECIMEN","GEODETIC_DATUM_ASSUMED_WGS84;GEODETIC_DATUM_INVALID;CONTINENT_DERIVED_FROM_COORDINATES;AMBIGUOUS_INSTITUTION"
-143.185449,64.70429,"Oxytropis huddelsonii",1146323115,"No specific locality recorded., Big Delta Quad, Yukon-Charley Rivers National Preserve","USA",50,2014,"PRESERVED_SPECIMEN","COORDINATE_ROUNDED;CONTINENT_DERIVED_FROM_COORDINATES;AMBIGUOUS_INSTITUTION"
-142.467222,61.186944,"Oxytropis huddelsonii",1146248888,"St. Elias Mts., Maccoll Ridge, middle Chitina R. valley, VABM Parry, vic. NPS transmitter station, McCarthy Quad, Wrangell-St. Elias National Park and Preserve","USA",NA,2006,"PRESERVED_SPECIMEN","COORDINATE_ROUNDED;GEODETIC_DATUM_ASSUMED_WGS84;GEODETIC_DATUM_INVALID;CONTINENT_DERIVED_FROM_COORDINATES;AMBIGUOUS_INSTITUTION"
-147.6732115,62.0465004,"Oxytropis huddelsonii",1455550678,"Limestone Gap, limestone ridge west of camp, Talkeetna Mts. Quad","USA",300,2016,"PRESERVED_SPECIMEN","COORDINATE_REPROJECTED;COORDINATE_ROUNDED;CONTINENT_DERIVED_FROM_COORDINATES;AMBIGUOUS_INSTITUTION"
-142.66,61.43,"Oxytropis huddelsonii",1146330392,"Wrangell Mts., Nikolai Pass area, W of Nizina R., McCarthy Quad, Wrangell-St. Elias National Park and Preserve","USA",3615,1996,"PRESERVED_SPECIMEN","GEODETIC_DATUM_ASSUMED_WGS84;GEODETIC_DATUM_INVALID;CONTINENT_DERIVED_FROM_COORDINATES;AMBIGUOUS_INSTITUTION"
-146.25,63.08,"Oxytropis huddelsonii",1146372583,"Alaska Range, Mi 30 Denali Hwy., S of hwy., Mt. Hayes Quad","USA",3615,1968,"PRESERVED_SPECIMEN","GEODETIC_DATUM_ASSUMED_WGS84;GEODETIC_DATUM_INVALID;CONTINENT_DERIVED_FROM_COORDINATES;AMBIGUOUS_INSTITUTION"
-138.583333,60.8,"Oxytropis huddelsonii",1146251204,"Kaskawulsh nunatak, jct. N and central arms Kaskawulsh Glacier, W of Kluane Lake","CAN",587,1965,"PRESERVED_SPECIMEN","GEODETIC_DATUM_ASSUMED_WGS84;CONTINENT_DERIVED_FROM_COORDINATES;AMBIGUOUS_INSTITUTION"
-142.53,61.65,"Oxytropis huddelsonii",1146330372,"Wrangell Mts., VABM Sentinel and ridge to N, W of Nizina Gl., McCarthy Quad, Wrangell-St. Elias National Park and Preserve","USA",3615,1996,"PRESERVED_SPECIMEN","GEODETIC_DATUM_ASSUMED_WGS84;GEODETIC_DATUM_INVALID;CONTINENT_DERIVED_FROM_COORDINATES;AMBIGUOUS_INSTITUTION"
-145.78,63.05,"Oxytropis huddelsonii",1146372785,"Alaska Range, Mi 13 Denali Hwy., Mt. Hayes Quad","USA",3615,1964,"PRESERVED_SPECIMEN","GEODETIC_DATUM_ASSUMED_WGS84;GEODETIC_DATUM_INVALID;CONTINENT_DERIVED_FROM_COORDINATES;AMBIGUOUS_INSTITUTION"
-141.33,64.13,"Oxytropis huddelsonii",1146385055,"Yukon-Tanana Upland, Mile 96 Taylor Hwy., Jack Wade Jct., TAYLOR HWY. NEAR JCT. SIXTY-MI ROAD, Eagle Quad","USA",3615,1965,"PRESERVED_SPECIMEN","GEODETIC_DATUM_ASSUMED_WGS84;GEODETIC_DATUM_INVALID;CONTINENT_DERIVED_FROM_COORDINATES;AMBIGUOUS_INSTITUTION"
-141.75,61.7,"Oxytropis huddelsonii",1146363281,"Russell Gl. terminus, upper White R. valley, McCarthy Quad, Wrangell-St. Elias National Park and Preserve","USA",3615,1968,"PRESERVED_SPECIMEN","GEODETIC_DATUM_ASSUMED_WGS84;GEODETIC_DATUM_INVALID;CONTINENT_DERIVED_FROM_COORDINATES;AMBIGUOUS_INSTITUTION"
-134.750272,60.446487,"Oxytropis huddelsonii",2422913736,"","CAN",NA,2019,"HUMAN_OBSERVATION","COORDINATE_ROUNDED;CONTINENT_DERIVED_FROM_COORDINATES"
-140.198818,61.2717,"Oxytropis huddelsonii",3330652657,"","CAN",8,2021,"HUMAN_OBSERVATION","COORDINATE_ROUNDED;CONTINENT_DERIVED_FROM_COORDINATES"
-134.741511,60.764334,"Oxytropis huddelsonii",3314386519,"","CAN",2160,2021,"HUMAN_OBSERVATION","COORDINATE_ROUNDED;CONTINENT_DERIVED_FROM_COORDINATES"
-145.494167,63.021389,"Oxytropis huddelsonii",788509281,"Paxson","USA",NA,1968,"PRESERVED_SPECIMEN","OCCURRENCE_STATUS_INFERRED_FROM_INDIVIDUAL_COUNT;COORDINATE_ROUNDED;GEODETIC_DATUM_ASSUMED_WGS84;INSTITUTION_MATCH_FUZZY;COLLECTION_MATCH_NONE"
-149.82,63.29,"Oxytropis huddelsonii",1146302020,"Alaska Range, West Fork Chulitna R. , S slopes of canyon on N branch of W Fork Chulitna R., 3.9 km E of Ruby Peak, Healy Quad, Denali National Park and Preserve","USA",3615,1998,"PRESERVED_SPECIMEN","GEODETIC_DATUM_ASSUMED_WGS84;GEODETIC_DATUM_INVALID;CONTINENT_DERIVED_FROM_COORDINATES;AMBIGUOUS_INSTITUTION"
-149.51,61.12,"Oxytropis huddelsonii",1146263584,"Chugach Mts., North Campbell Creek Canyon, ridge NE of Long Lake, Anchorage Quad, Fort Richardson Military Reservation","USA",3615,1994,"PRESERVED_SPECIMEN","GEODETIC_DATUM_ASSUMED_WGS84;GEODETIC_DATUM_INVALID;CONTINENT_DERIVED_FROM_COORDINATES;AMBIGUOUS_INSTITUTION"
-145.58,63.33,"Oxytropis huddelsonii",1146373098,"Alaska Range, Rainbow Mtn., Mile 212 Richardson Hwy., Mt. Hayes Quad","USA",3615,1953,"PRESERVED_SPECIMEN","GEODETIC_DATUM_ASSUMED_WGS84;GEODETIC_DATUM_INVALID;CONTINENT_DERIVED_FROM_COORDINATES;AMBIGUOUS_INSTITUTION"
-142.1510959,62.2024644,"Oxytropis huddelsonii",1146235976,"Nutzotin Mts., Chisana River, lower alpine slopes at base of Mt Allen, N of Medicine Man Cr, Nabesna Quad, Wrangell-St. Elias National Park and Preserve","USA",NA,2003,"PRESERVED_SPECIMEN","COORDINATE_REPROJECTED;CONTINENT_DERIVED_FROM_COORDINATES;AMBIGUOUS_INSTITUTION"
-147.2,63.03,"Oxytropis huddelsonii",1146370945,"Alaska Range, Clearwater Mts., Mtn. W of Waterfall Cr. near Denali Hwy., Healy Quad","USA",3615,1998,"PRESERVED_SPECIMEN","GEODETIC_DATUM_ASSUMED_WGS84;GEODETIC_DATUM_INVALID;CONTINENT_DERIVED_FROM_COORDINATES;AMBIGUOUS_INSTITUTION"
-138.224444,60.137778,"Oxytropis huddelsonii",1146318627,"Kluane National Park, Fisher Glacier near Alsek, W-facing slope above valley glacier lading into Fisher Glacier","CAN",1,2003,"PRESERVED_SPECIMEN","COORDINATE_ROUNDED;CONTINENT_DERIVED_FROM_COORDINATES;AMBIGUOUS_INSTITUTION"
-141.08,61.61,"Oxytropis huddelsonii",1146363227,"Wrangell Mts., Guerin Gl. terminus, upper White R. drainage, McCarthy Quad, Wrangell-St. Elias National Park and Preserve","USA",3615,1968,"PRESERVED_SPECIMEN","GEODETIC_DATUM_ASSUMED_WGS84;GEODETIC_DATUM_INVALID;CONTINENT_DERIVED_FROM_COORDINATES;AMBIGUOUS_INSTITUTION"
-142.2781544,61.3147559,"Oxytropis huddelsonii",1146233511,"St. Elias Mts., Canyon Creek, near the headwaters, McCarthy Quad, Wrangell-St. Elias National Park and Preserve","USA",NA,2003,"PRESERVED_SPECIMEN","COORDINATE_REPROJECTED;COORDINATE_ROUNDED;CONTINENT_DERIVED_FROM_COORDINATES;AMBIGUOUS_INSTITUTION"
-140.41,63.91,"Oxytropis huddelsonii",1146341585,"Mt. Hart, Stewart River","CAN",3615,1984,"PRESERVED_SPECIMEN","GEODETIC_DATUM_ASSUMED_WGS84;GEODETIC_DATUM_INVALID;CONTINENT_DERIVED_FROM_COORDINATES;AMBIGUOUS_INSTITUTION"
-143.27,64.66,"Oxytropis huddelsonii",1146387801,"Yukon-Tanana Uplands, Copper Hills, 1.5 km S of VABM Copper, Eagle Quad, Yukon-Charley Rivers National Preserve","USA",3615,2002,"PRESERVED_SPECIMEN","GEODETIC_DATUM_ASSUMED_WGS84;GEODETIC_DATUM_INVALID;CONTINENT_DERIVED_FROM_COORDINATES;AMBIGUOUS_INSTITUTION"
-145.33,63.3,"Oxytropis huddelsonii",1146373060,"Alaska Range, Gulkana Gl., Mt. Hayes Quad","USA",3615,1957,"PRESERVED_SPECIMEN","GEODETIC_DATUM_ASSUMED_WGS84;GEODETIC_DATUM_INVALID;CONTINENT_DERIVED_FROM_COORDINATES;AMBIGUOUS_INSTITUTION"
-159.832717,68.004212,"Oxytropis huddelsonii",1146315798,"Noatak National Preserve; Ampitheater Mtn","USA",2289,2005,"PRESERVED_SPECIMEN","GEODETIC_DATUM_ASSUMED_WGS84;CONTINENT_DERIVED_FROM_COORDINATES;AMBIGUOUS_INSTITUTION"
-142.25,63.683333,"Oxytropis huddelsonii",1801074333,"","USA",NA,1960,"PRESERVED_SPECIMEN","COORDINATE_ROUNDED;CONTINENT_DERIVED_FROM_COORDINATES;INSTITUTION_MATCH_FUZZY;COLLECTION_MATCH_FUZZY"
-134.738078,60.085212,"Oxytropis huddelsonii",3892272500,"","CAN",NA,2022,"HUMAN_OBSERVATION","COORDINATE_ROUNDED;CONTINENT_DERIVED_FROM_COORDINATES"
