"lon","lat","species","gbifID","locality","countryCode","coordinateUncertaintyInMeters","year","basisOfRecord","issue"
47.147222,-24.769722,"Paropsia humblotii",1257886852,"Toliara, Anosy, Commune: Mahatalaky, Fokontany: Sainte Luce. Village le plus proche Ambandrika.","MDG",NA,2012,"PRESERVED_SPECIMEN","OCCURRENCE_STATUS_INFERRED_FROM_INDIVIDUAL_COUNT;COORDINATE_ROUNDED;GEODETIC_DATUM_ASSUMED_WGS84;DIFFERENT_OWNER_INSTITUTION"
49.116945,-18.028889,"Paropsia humblotii",2268917090,"District de Toamasina II, Commune Rurale de Sahambala, Fokontany de Sahavongo, village de Sahavongo, forêt de Lohanisahavongo.","MDG",NA,2017,"PRESERVED_SPECIMEN","OCCURRENCE_STATUS_INFERRED_FROM_INDIVIDUAL_COUNT;COORDINATE_ROUNDED;GEODETIC_DATUM_ASSUMED_WGS84;DIFFERENT_OWNER_INSTITUTION"
47.085,-24.503611,"Paropsia humblotii",4061230857,"Fort Dauphin, Bevoay, Fenoambany, Androangabe. Forêt de la chaîne de Vohimena, rivière près du campement à Androangabe, bord de la rivière Mahalao. Récolté avec Dauphin & Mamy.","MDG",NA,2016,"PRESERVED_SPECIMEN","OCCURRENCE_STATUS_INFERRED_FROM_INDIVIDUAL_COUNT;COORDINATE_ROUNDED;GEODETIC_DATUM_ASSUMED_WGS84;DIFFERENT_OWNER_INSTITUTION"
48.539722,-19.178056,"Paropsia humblotii",1257728773,"Atsinanana, Vatomandry, Ambalabe, Sahanionaka. At the Tsitondroina waterfall camping site. Specimens preserved in alcohol.","MDG",NA,2010,"PRESERVED_SPECIMEN","OCCURRENCE_STATUS_INFERRED_FROM_INDIVIDUAL_COUNT;COORDINATE_ROUNDED;GEODETIC_DATUM_ASSUMED_WGS84;DIFFERENT_OWNER_INSTITUTION"
47.094167,-24.494167,"Paropsia humblotii",4061786965,"Taolagnaro, Anosy, Commune Bevoay, Fokontany Fenoambany, Androranga. Forêt dense humide de basse altitude d'Akofa.","MDG",NA,2009,"PRESERVED_SPECIMEN","OCCURRENCE_STATUS_INFERRED_FROM_INDIVIDUAL_COUNT;COORDINATE_ROUNDED;GEODETIC_DATUM_ASSUMED_WGS84;DIFFERENT_OWNER_INSTITUTION"
47.171667,-24.774722,"Paropsia humblotii",1257887668,"Fort-Dauphin, Sainte Luce, village le plus proche: Ambandrika. Récolté avec Mara Mahatsiaro Emilson et Monja Foara (Tsy Afaka).","MDG",NA,2012,"PRESERVED_SPECIMEN","OCCURRENCE_STATUS_INFERRED_FROM_INDIVIDUAL_COUNT;COORDINATE_ROUNDED;GEODETIC_DATUM_ASSUMED_WGS84;DIFFERENT_OWNER_INSTITUTION"
49.55,-15.3,"Paropsia humblotii",3776337315,"Madgascar. Toamasina. Fiv: Maroantsetra. Comm: Ambinanitelo. Fok: Marovovonana. Village: Ambodivato.","MDG",NA,2002,"PRESERVED_SPECIMEN","GEODETIC_DATUM_ASSUMED_WGS84;INSTITUTION_COLLECTION_MISMATCH"
48.29527,-21.46777,"Paropsia humblotii",4031960222,"Fivondronana: Mananjary, Firaisana: Ankatafana, Fokontany: Marohita. Forêt littorale d'Alimamba. Echantillon préservé en alcool. Récolté avec R. Ranaivojaona et Berlin.","MDG",NA,2004,"PRESERVED_SPECIMEN","OCCURRENCE_STATUS_INFERRED_FROM_INDIVIDUAL_COUNT;GEODETIC_DATUM_ASSUMED_WGS84;INSTITUTION_MATCH_FUZZY;COLLECTION_MATCH_NONE"
47.20166,-24.57111,"Paropsia humblotii",4032082233,"Toliara, Anosy, Taolagnaro, Iaboko, Antsotso Avaratra. Récoltés avec D. Rabehevitra, M. Maka, Roger & B. Mara.","MDG",NA,2007,"PRESERVED_SPECIMEN","OCCURRENCE_STATUS_INFERRED_FROM_INDIVIDUAL_COUNT;GEODETIC_DATUM_ASSUMED_WGS84;INSTITUTION_MATCH_FUZZY;COLLECTION_MATCH_NONE"
47.71166,-23.02611,"Paropsia humblotii",4031504983,"Fivondronana: Farafangana, Fokontany: Mananivo. Forêt Classée de Manombo, bloc d'Analambotaka (Anambotaka). Forêt dense humide de basse altitude sur latérite. Echantillon préservé dans l'alcool.","MDG",NA,2001,"PRESERVED_SPECIMEN","OCCURRENCE_STATUS_INFERRED_FROM_INDIVIDUAL_COUNT;GEODETIC_DATUM_ASSUMED_WGS84;INSTITUTION_MATCH_FUZZY;COLLECTION_MATCH_NONE"
47.19,-24.468889,"Paropsia humblotii",4031983264,"District: Fort-Dauphin, Commune Rurale: Manantenina, Fokontany: Antanitsara, village le plus proche: Antsapa. Forêt de Rianabo.","MDG",NA,2017,"PRESERVED_SPECIMEN","OCCURRENCE_STATUS_INFERRED_FROM_INDIVIDUAL_COUNT;COORDINATE_ROUNDED;GEODETIC_DATUM_ASSUMED_WGS84;INSTITUTION_MATCH_FUZZY;COLLECTION_MATCH_NONE"
50.071945,-14.192778,"Paropsia humblotii",4031521847,"District de Sambava, Commune de Bemanevika, Fokontany d' Antsahakajohy, foret de basse altitude d' Anjombavolo .Avec guide local Belalahy Gerard Herbier conservé en alcool.","MDG",NA,2022,"PRESERVED_SPECIMEN","OCCURRENCE_STATUS_INFERRED_FROM_INDIVIDUAL_COUNT;COORDINATE_ROUNDED;GEODETIC_DATUM_ASSUMED_WGS84;INSTITUTION_MATCH_FUZZY;COLLECTION_MATCH_NONE"
46.983333,-24.983333,"Paropsia humblotii",2515896736,"Toliara, Fort-Dauphin Fivondronana. Lakandava forest, near the JIRAMA Basin.","MDG",NA,1993,"PRESERVED_SPECIMEN","INSTITUTION_MATCH_FUZZY;INSTITUTION_COLLECTION_MISMATCH"
49.407222,-17.286389,"Paropsia humblotii",2517255433,"Toamasina, Tampolo Forestry Station. ca. 10 km N of Fenerive Est. Littoral forest on white sand.","MDG",NA,1996,"PRESERVED_SPECIMEN","INSTITUTION_MATCH_FUZZY;INSTITUTION_COLLECTION_MISMATCH"
49.673445,-16.783611,"Paropsia humblotii",4031979656,"District de Soanerana Ivongo, Commune de Manompana, Fokontany de Vohijiny, Village d'Ambohitsara. Collectés avec Gérand et Sèrge.","MDG",NA,2022,"PRESERVED_SPECIMEN","OCCURRENCE_STATUS_INFERRED_FROM_INDIVIDUAL_COUNT;COORDINATE_ROUNDED;GEODETIC_DATUM_ASSUMED_WGS84;INSTITUTION_MATCH_FUZZY;COLLECTION_MATCH_NONE"
47.13638,-24.32555,"Paropsia humblotii",4031685551,"Fort Dauphin, Manantenina, Ampasimena. Fourré basse sur sable blanc quartzitique, dominé par Sarcolaena humbertiana, Uapaca sp. et Philipia sp. Localisé sur le pic de Vohimavo.","MDG",NA,2001,"PRESERVED_SPECIMEN","OCCURRENCE_STATUS_INFERRED_FROM_INDIVIDUAL_COUNT;GEODETIC_DATUM_ASSUMED_WGS84;INSTITUTION_MATCH_FUZZY;COLLECTION_MATCH_NONE"
49.966667,-15.65,"Paropsia humblotii",1839539084,"Toamasina, Masoala Peninsula, Ambanizana; trail along coast, 1-3 km S of Ambanizana","MDG",NA,1992,"PRESERVED_SPECIMEN","GEODETIC_DATUM_ASSUMED_WGS84;CONTINENT_DERIVED_FROM_COORDINATES;INSTITUTION_MATCH_FUZZY;COLLECTION_MATCH_FUZZY"
48.554722,-19.135833,"Paropsia humblotii",1257639303,"Atsinanana, Vatomandry, Ambalabe, Ambinanindrano II, forêt de Vohibe, Nord de Sahalampona. Zone de conservation stricte.","MDG",NA,2009,"PRESERVED_SPECIMEN","OCCURRENCE_STATUS_INFERRED_FROM_INDIVIDUAL_COUNT;COORDINATE_ROUNDED;GEODETIC_DATUM_ASSUMED_WGS84;DIFFERENT_OWNER_INSTITUTION"
49.141667,-18.816667,"Paropsia humblotii",4061638680,"J.B Ambila-Lemaitso","MDG",NA,1963,"PRESERVED_SPECIMEN","OCCURRENCE_STATUS_INFERRED_FROM_INDIVIDUAL_COUNT;COORDINATE_ROUNDED;GEODETIC_DATUM_ASSUMED_WGS84;INSTITUTION_MATCH_NONE"
49.401111,-17.693055,"Paropsia humblotii",4061331762,"District de Toamasina II, Commune d’Andodabe, Fokontany d’Analabemazava, Village d’Ambodivintanona, Forêt de Marofitehina. Herbier conserver en alcool. Collecté avec Jaonarivelo.","MDG",NA,2019,"PRESERVED_SPECIMEN","OCCURRENCE_STATUS_INFERRED_FROM_INDIVIDUAL_COUNT;COORDINATE_ROUNDED;GEODETIC_DATUM_ASSUMED_WGS84;DIFFERENT_OWNER_INSTITUTION"
49.2425,-18.56083,"Paropsia humblotii",1259212749,"Vohibola. District de Brickaville. Commune Ambinaninony. Foktontany d'Andranokoditra. East of the trail going to Andranokoditra. Area badly burned. Littoral forest on sand. Collected with R. Ludovic, C. Birkinshaw, R. Ranaivojaona & Fortunat.","MDG",NA,2002,"PRESERVED_SPECIMEN","GEODETIC_DATUM_ASSUMED_WGS84;DIFFERENT_OWNER_INSTITUTION"
46.933333,-24.816667,"Paropsia humblotii",4061844683,"Fort-Dauphin, Ifarantsa, Ivorona, forêt de Mamoareny. Récolté avec Ramison Roger (QMM), Miakamara (guide), Damizandriana (guide)","MDG",NA,2009,"PRESERVED_SPECIMEN","OCCURRENCE_STATUS_INFERRED_FROM_INDIVIDUAL_COUNT;COORDINATE_ROUNDED;GEODETIC_DATUM_ASSUMED_WGS84;DIFFERENT_OWNER_INSTITUTION"
47.330285,-22.810918,"Paropsia humblotii",1640027422,"","MDG",838,2014,"HUMAN_OBSERVATION","CONTINENT_DERIVED_FROM_COORDINATES"
49.795,-16.446667,"Paropsia humblotii",2515927343,"6.4 km W of Antanambe, Mananara National Park.","MDG",NA,1997,"PRESERVED_SPECIMEN","INSTITUTION_MATCH_FUZZY;INSTITUTION_COLLECTION_MISMATCH"
48.98333,-17.71666,"Paropsia humblotii",4060890477,"Réserve Naturelle Intégrale 3, Zahamena. Aud Nord=Ouest du village Andratanantsoitra. Montagne d'Amboditamenaka. Plantes préservées dans l'alcool.","MDG",NA,1993,"PRESERVED_SPECIMEN","OCCURRENCE_STATUS_INFERRED_FROM_INDIVIDUAL_COUNT;GEODETIC_DATUM_ASSUMED_WGS84;INSTITUTION_MATCH_NONE"
47.35,-24.21666,"Paropsia humblotii",1260152410,"Fort Dauphin (Tôlan|2aro) region; a few km NW of Manantenina; in Forêt d'Analalava; on laterite.","MDG",NA,1989,"PRESERVED_SPECIMEN","OCCURRENCE_STATUS_INFERRED_FROM_INDIVIDUAL_COUNT;GEODETIC_DATUM_ASSUMED_WGS84;INSTITUTION_MATCH_FUZZY;COLLECTION_MATCH_NONE"
49.95,-15.43333,"Paropsia humblotii",1260131501,"environs de la baie d'Antongil, massif d'Ambohitsitondroina, Est de Mahavelona (Est de Maroantsetra)","MDG",NA,1953,"PRESERVED_SPECIMEN","GEODETIC_DATUM_ASSUMED_WGS84;INSTITUTION_MATCH_FUZZY;COLLECTION_MATCH_NONE"
