"lon","lat","species","gbifID","locality","countryCode","coordinateUncertaintyInMeters","year","basisOfRecord","issue"
-56.81,3.33,"Paspalum riparium",1455967876,"Zuid River, near confluence with Lucie River, Wilhelmina Gebergte","SUR",NA,1963,"PRESERVED_SPECIMEN","GEODETIC_DATUM_ASSUMED_WGS84"
-47.53,-6.533333,"Paspalum riparium",1042592429,"Transamazonian highway (BR 230), 6 Km west of Estreito (Rio Tocantins). Grassy roadside in cerrado region.","BRA",NA,1980,"PRESERVED_SPECIMEN","GEODETIC_DATUM_ASSUMED_WGS84;GEODETIC_DATUM_INVALID;ELEVATION_MIN_MAX_SWAPPED;INSTITUTION_MATCH_NONE"
-37.25028,-6.59222,"Paspalum riparium",2248069817,"","BRA",NA,2006,"PRESERVED_SPECIMEN","GEODETIC_DATUM_ASSUMED_WGS84;GEODETIC_DATUM_INVALID;CONTINENT_DERIVED_FROM_COORDINATES;INSTITUTION_MATCH_FUZZY;COLLECTION_MATCH_FUZZY"
-64.645833,-9.2775,"Paspalum riparium",1095245622,"Estrada de acesso à ensecadeira, margem direita do rio Madeira.","BRA",NA,2009,"PRESERVED_SPECIMEN","OCCURRENCE_STATUS_INFERRED_FROM_INDIVIDUAL_COUNT;GEODETIC_DATUM_ASSUMED_WGS84;CONTINENT_DERIVED_FROM_COORDINATES;INSTITUTION_MATCH_NONE"
-46.983333,-1.066667,"Paspalum riparium",1314810068,"Capanema","BRA",NA,1980,"PRESERVED_SPECIMEN","COORDINATE_ROUNDED;GEODETIC_DATUM_ASSUMED_WGS84;INSTITUTION_MATCH_FUZZY;COLLECTION_MATCH_NONE"
-37.325556,-5.201667,"Paspalum riparium",1291821616,"Estação Ecológica do Seridó, próximo a estrada para o alojamento","BRA",NA,2006,"PRESERVED_SPECIMEN","GEODETIC_DATUM_ASSUMED_WGS84;INSTITUTION_MATCH_FUZZY;COLLECTION_MATCH_FUZZY"
-55.316944,-5.525,"Paspalum riparium",3695997347,"Margem da rodovia, logo após a divisa com Placas.","BRA",NA,2020,"PRESERVED_SPECIMEN","GEODETIC_DATUM_ASSUMED_WGS84;DIFFERENT_OWNER_INSTITUTION"
-67.8,4.41666,"Paspalum riparium",1260346500,"Dpto. Atures Orincoco, Isla Hormiga, entre Caño Grulla Caño Ucata, terreno inundable.","VEN",NA,1989,"PRESERVED_SPECIMEN","GEODETIC_DATUM_ASSUMED_WGS84;INSTITUTION_MATCH_FUZZY;COLLECTION_MATCH_NONE"
-45.066667,-7.383333,"Paspalum riparium",2452958087,"Ilha de Balsas, Ilha de Balsas region between the Balsas and Parnaíba Rivers. &nf;Ca. 100 m SE of main house of Fazenda Morros, about 35 km south of Loreto.","BRA",NA,1962,"PRESERVED_SPECIMEN","GEODETIC_DATUM_ASSUMED_WGS84;CONTINENT_DERIVED_FROM_COORDINATES;INSTITUTION_MATCH_NONE"
