"lon","lat","species","gbifID","locality","countryCode","coordinateUncertaintyInMeters","year","basisOfRecord","issue"
-77.82,-0.37,"Persicaria punctata",1096722795,"Flora of Ecuador. Prov. Napo: Road Baeza-Lago Agrio, 18 km from Baeza (Puente Sardinas Grandes).","ECU",NA,1976,"PRESERVED_SPECIMEN","GEODETIC_DATUM_ASSUMED_WGS84;CONTINENT_DERIVED_FROM_COORDINATES;CONTINENT_INVALID;INSTITUTION_COLLECTION_MISMATCH"
-76.97,0.07,"Persicaria punctata",1096622373,"Prov. Napo: Rio Aguarrico, Santa Cecilia, tropical rain forest. Iter Regnellianum nonum. Flora aequadoriensis","ECU",NA,1966,"PRESERVED_SPECIMEN","GEODETIC_DATUM_ASSUMED_WGS84;CONTINENT_DERIVED_FROM_COORDINATES;CONTINENT_INVALID;INSTITUTION_COLLECTION_MISMATCH"
-80.08,0.08,"Persicaria punctata",1096622348,"Manabi: Pedernales, at the border of Rio Pedernales. Flora of Ecuador. 11th Regnellian Expedition","ECU",NA,1981,"PRESERVED_SPECIMEN","GEODETIC_DATUM_ASSUMED_WGS84;CONTINENT_DERIVED_FROM_COORDINATES;CONTINENT_INVALID;INSTITUTION_COLLECTION_MISMATCH"
-78.37,-1.38,"Persicaria punctata",1096722817,"Flora of Ecuador. Prov. Tungurahua. Montana Agoyan, 10 km E of Banos.","ECU",NA,1968,"PRESERVED_SPECIMEN","GEODETIC_DATUM_ASSUMED_WGS84;CONTINENT_DERIVED_FROM_COORDINATES;CONTINENT_INVALID;INSTITUTION_COLLECTION_MISMATCH"
-111.343,34.3086,"Persicaria punctata",1846529864,"Rt. 87 north of Payson at the East Verde crossing.","USA",NA,1967,"PRESERVED_SPECIMEN","GEODETIC_DATUM_ASSUMED_WGS84;CONTINENT_DERIVED_FROM_COORDINATES;INSTITUTION_MATCH_FUZZY;COLLECTION_MATCH_NONE"
-75.144178,40.999269,"Persicaria punctata",1846530324,"Dried pond beside Brodhead Creek, Minisink Hills","USA",567,1974,"PRESERVED_SPECIMEN","GEODETIC_DATUM_ASSUMED_WGS84;CONTINENT_DERIVED_FROM_COORDINATES;INSTITUTION_MATCH_FUZZY;COLLECTION_MATCH_NONE"
-93.587617,38.754051,"Persicaria punctata",1846530258,"Knob Noster State Park, N.W. of Public campground","USA",396,1972,"PRESERVED_SPECIMEN","CONTINENT_DERIVED_FROM_COORDINATES;INSTITUTION_MATCH_FUZZY;COLLECTION_MATCH_NONE"
-110.45609,31.634168,"Persicaria punctata",2572936138,"Babacomari Ranch, within cienega bounded by railroad grade to the north and creek to the south","USA",NA,2015,"PRESERVED_SPECIMEN","GEODETIC_DATUM_ASSUMED_WGS84;CONTINENT_DERIVED_FROM_COORDINATES;INSTITUTION_MATCH_FUZZY;COLLECTION_MATCH_NONE"
-112.041831,34.781931,"Persicaria punctata",1846530832,"Pecks Lake Prescott National Forest, 3 mi E of Clarksdale","USA",1078,1965,"PRESERVED_SPECIMEN","GEODETIC_DATUM_ASSUMED_WGS84;CONTINENT_DERIVED_FROM_COORDINATES;INSTITUTION_MATCH_FUZZY;COLLECTION_MATCH_NONE"
-74.04111,4.80583,"Persicaria punctata",2244395594,"Localidad de Usaquén, Humedal Torca-Guaymaral","COL",NA,2017,"PRESERVED_SPECIMEN","OCCURRENCE_STATUS_INFERRED_FROM_INDIVIDUAL_COUNT;INSTITUTION_MATCH_FUZZY;COLLECTION_MATCH_FUZZY"
-50.940833,-27.449722,"Persicaria punctata",2996299861,"Lagoa dos Patos / Marundim.","BRA",NA,2008,"PRESERVED_SPECIMEN","COORDINATE_ROUNDED;GEODETIC_DATUM_ASSUMED_WGS84;CONTINENT_DERIVED_FROM_COORDINATES;INSTITUTION_MATCH_FUZZY;COLLECTION_MATCH_FUZZY"
-46.95,-22.2,"Persicaria punctata",1930256927,"Km 51 N. of Aragarças.","BRA",NA,1968,"PRESERVED_SPECIMEN","GEODETIC_DATUM_ASSUMED_WGS84;COLLECTION_MATCH_FUZZY"
-92.839017,34.390347,"Persicaria punctata",1928862241,"4 air km NNW of Malvern and NW of Interstate 30, along Ouachita River and Riverview Dr.","USA",NA,2012,"PRESERVED_SPECIMEN","GEODETIC_DATUM_ASSUMED_WGS84;COLLECTION_MATCH_FUZZY"
-77.670775,36.363761,"Persicaria punctata",1931142922,"8.5 air km WNW of Halifax town center","USA",NA,2012,"PRESERVED_SPECIMEN","GEODETIC_DATUM_ASSUMED_WGS84;COLLECTION_MATCH_FUZZY"
-37.0547,-10.5369,"Persicaria punctata",1928502386,"RVS Mata do Junco: Clareira. Próximo ao córrego de piscina velha.","BRA",NA,2013,"PRESERVED_SPECIMEN","GEODETIC_DATUM_ASSUMED_WGS84;COLLECTION_MATCH_FUZZY"
-67.702391,-10.280034,"Persicaria punctata",1930487663,"Km 42 from Rio Branco on Rio Branco-Brasileia road","BRA",NA,1980,"PRESERVED_SPECIMEN","COORDINATE_ROUNDED;COLLECTION_MATCH_FUZZY"
-81.40211,22.38369,"Persicaria punctata",1928741122,"Ca. 20 km WNW of Playa Larga on road to Santo Tomas.","CUB",NA,2009,"PRESERVED_SPECIMEN","GEODETIC_DATUM_ASSUMED_WGS84;COLLECTION_MATCH_FUZZY"
-55.897858,-9.450131,"Persicaria punctata",1928163053,"Parque Estadual Cristalino. Próximo ao médio Rio Cristalino, entre a pousada e Limão. Vegetação marginal do Rio Cristalino.","BRA",NA,2008,"PRESERVED_SPECIMEN","GEODETIC_DATUM_ASSUMED_WGS84;COLLECTION_MATCH_FUZZY"
-95.18636,38.804001,"Persicaria punctata",1927876854,"Baldwin Woods, ca 2 mi N of Baldwin City. Kansas Ecological Reserves; Rice Woodland","USA",5565,1991,"PRESERVED_SPECIMEN","COLLECTION_MATCH_FUZZY"
-56.74527,-28.07888,"Persicaria punctata",1259759174,"Laguna Galarza, costa occidental","ARG",NA,2000,"PRESERVED_SPECIMEN","GEODETIC_DATUM_ASSUMED_WGS84;DIFFERENT_OWNER_INSTITUTION"
-92.67194,39.52416,"Persicaria punctata",1260935606,"Thomas Hill Reservoir, S; along State Highway 3; Middle Fork Chariton River in shallow water of marsh","USA",NA,1985,"PRESERVED_SPECIMEN","GEODETIC_DATUM_ASSUMED_WGS84;DIFFERENT_OWNER_INSTITUTION"
-92.956389,37.3475,"Persicaria punctata",1260962579,"Small prairie ca 1 mi W of Marshfield in roadside ditch","USA",NA,1978,"PRESERVED_SPECIMEN","OCCURRENCE_STATUS_INFERRED_FROM_INDIVIDUAL_COUNT;COORDINATE_ROUNDED;GEODETIC_DATUM_ASSUMED_WGS84;DIFFERENT_OWNER_INSTITUTION"
-84.00361,10.43138,"Persicaria punctata",1259977676,"La Selva Biological Station.","CRI",NA,1984,"PRESERVED_SPECIMEN","OCCURRENCE_STATUS_INFERRED_FROM_INDIVIDUAL_COUNT;GEODETIC_DATUM_ASSUMED_WGS84;DIFFERENT_OWNER_INSTITUTION"
-57.41666,-25.6,"Persicaria punctata",1261452283,"Arroyo Yuquyty, 7 km E of Nueva Italia. Inundated savanna.","PRY",NA,1989,"PRESERVED_SPECIMEN","OCCURRENCE_STATUS_INFERRED_FROM_INDIVIDUAL_COUNT;GEODETIC_DATUM_ASSUMED_WGS84;DIFFERENT_OWNER_INSTITUTION"
-63.880278,-18.781944,"Persicaria punctata",1257660787,"3 km al sur-este de Loma Larga, herbazal al lado del camino.","BOL",NA,2010,"PRESERVED_SPECIMEN","OCCURRENCE_STATUS_INFERRED_FROM_INDIVIDUAL_COUNT;COORDINATE_ROUNDED;GEODETIC_DATUM_ASSUMED_WGS84;DIFFERENT_OWNER_INSTITUTION"
-57.15,-25.9,"Persicaria punctata",4061227382,"Macizo Acahay. Forest on eastern most peak, mostly on rocks.","PRY",NA,1989,"PRESERVED_SPECIMEN","OCCURRENCE_STATUS_INFERRED_FROM_INDIVIDUAL_COUNT;GEODETIC_DATUM_ASSUMED_WGS84;DIFFERENT_OWNER_INSTITUTION"
-64.73333,-17.73333,"Persicaria punctata",4062070056,"Khara Huasi. Márgenes del Río Khara Huasi, subiendo 2 km arriba del pueblo. Márgenes del Río Khara Huasi. Sitio arenoso entre las piedras.","BOL",NA,2000,"PRESERVED_SPECIMEN","GEODETIC_DATUM_ASSUMED_WGS84;DIFFERENT_OWNER_INSTITUTION"
-57.25,-25.133333,"Persicaria punctata",1261453799,"5 km SE of Emboscada. Isla Alta. On a hill.","PRY",NA,1990,"PRESERVED_SPECIMEN","OCCURRENCE_STATUS_INFERRED_FROM_INDIVIDUAL_COUNT;COORDINATE_ROUNDED;GEODETIC_DATUM_ASSUMED_WGS84;DIFFERENT_OWNER_INSTITUTION"
-57.166667,-26.166667,"Persicaria punctata",4061227374,"35 km N of Caapucu. Arroyo Apichapa. Riparian forest and surrounding shrubs in valley of open grassland.","PRY",NA,1984,"PRESERVED_SPECIMEN","OCCURRENCE_STATUS_INFERRED_FROM_INDIVIDUAL_COUNT;COORDINATE_ROUNDED;GEODETIC_DATUM_ASSUMED_WGS84;DIFFERENT_OWNER_INSTITUTION"
-64.496944,-19.746944,"Persicaria punctata",4060915843,"Segunda seccion Tarvita. Comunidad Cuñiripampa. Bosque montano del Tucumano-Boliviano predominando las Acacias spp., Cedrela sp., colect., Erithryna y Tipuana tipu. Colectado en bosque con doseles de 25 m, junto al Rio.","BOL",NA,2007,"PRESERVED_SPECIMEN","OCCURRENCE_STATUS_INFERRED_FROM_INDIVIDUAL_COUNT;COORDINATE_ROUNDED;GEODETIC_DATUM_ASSUMED_WGS84;DIFFERENT_OWNER_INSTITUTION"
-91.191111,15.9025,"Persicaria punctata",4061810380,"Río Espiritu (orilla). Aldea Nuevo Amanecer.","GTM",NA,2006,"PRESERVED_SPECIMEN","OCCURRENCE_STATUS_INFERRED_FROM_INDIVIDUAL_COUNT;COORDINATE_ROUNDED;GEODETIC_DATUM_ASSUMED_WGS84;DIFFERENT_OWNER_INSTITUTION"
-77.883333,-0.466667,"Persicaria punctata",1261453331,"Baeza. Dense vegetation along river and adjacent pastures SW of the village.","ECU",NA,1976,"PRESERVED_SPECIMEN","OCCURRENCE_STATUS_INFERRED_FROM_INDIVIDUAL_COUNT;COORDINATE_ROUNDED;GEODETIC_DATUM_ASSUMED_WGS84;DIFFERENT_OWNER_INSTITUTION"
-75.416667,-0.95,"Persicaria punctata",1259962618,"Río Yasuní, 3-4 km from Río Napo. Rain forest.","ECU",NA,1979,"PRESERVED_SPECIMEN","OCCURRENCE_STATUS_INFERRED_FROM_INDIVIDUAL_COUNT;COORDINATE_ROUNDED;GEODETIC_DATUM_ASSUMED_WGS84;DIFFERENT_OWNER_INSTITUTION"
-97.583333,16.833333,"Persicaria punctata",2268888056,"Santiago Yosondúa. Cercanías del río Yutamá, 300 m al SO de la desviación Plumas-Yerbasanta.","MEX",NA,2014,"PRESERVED_SPECIMEN","OCCURRENCE_STATUS_INFERRED_FROM_INDIVIDUAL_COUNT;COORDINATE_ROUNDED;GEODETIC_DATUM_ASSUMED_WGS84;DIFFERENT_OWNER_INSTITUTION"
-85.8,12.416667,"Persicaria punctata",4061388874,"Teustepe, Route 7; south side of road in scrubby growth and north side across Río Malacatoya [Seymour series]","NIC",NA,1969,"PRESERVED_SPECIMEN","OCCURRENCE_STATUS_INFERRED_FROM_INDIVIDUAL_COUNT;COORDINATE_ROUNDED;GEODETIC_DATUM_ASSUMED_WGS84;DIFFERENT_OWNER_INSTITUTION"
-93.411111,15.98,"Persicaria punctata",4061066499,"Area de Proteccion de Flora y Fauna la Frailescana. Sierra Madre de Chiapas. Finca La Alianza.","MEX",NA,2003,"PRESERVED_SPECIMEN","OCCURRENCE_STATUS_INFERRED_FROM_INDIVIDUAL_COUNT;COORDINATE_ROUNDED;GEODETIC_DATUM_ASSUMED_WGS84;DIFFERENT_OWNER_INSTITUTION"
-57.53333,-27.4,"Persicaria punctata",1261453941,"Estero del Ypoá, 15 km SW of Nueva Italia, coast in front Isla Guazú. Inundated savanna.","PRY",NA,1990,"PRESERVED_SPECIMEN","OCCURRENCE_STATUS_INFERRED_FROM_INDIVIDUAL_COUNT;GEODETIC_DATUM_ASSUMED_WGS84;DIFFERENT_OWNER_INSTITUTION"
-93.73583,38.76277,"Persicaria punctata",1260999761,"Cave Hollow Park - Warrensburg","USA",NA,2005,"PRESERVED_SPECIMEN","GEODETIC_DATUM_ASSUMED_WGS84;INSTITUTION_MATCH_NONE"
-64.045556,-20.333056,"Persicaria punctata",4061740163,"Serranía Los Milagros. Pendiente media al sur de la Laguna. Ladera con exposición sur. Bosque Tucumano-Boliviano, dominado por Nectandra angusta, Pisonia ambigua, Cordia trichotoma. En el sotobosque Myrsine spp. Estrato arbustivo dominado por Piper tucumanum, Bohemeria caudata y entre las herbáceas helechos terrestres como Blechnum occidentale.","BOL",NA,2005,"PRESERVED_SPECIMEN","OCCURRENCE_STATUS_INFERRED_FROM_INDIVIDUAL_COUNT;COORDINATE_ROUNDED;GEODETIC_DATUM_ASSUMED_WGS84;DIFFERENT_OWNER_INSTITUTION"
-63.666667,-17.466667,"Persicaria punctata",4061333790,"2.5 km SW of Buena Vista on road to Rio Surutu. Marshes and marshy pasture on flat.","BOL",NA,1990,"PRESERVED_SPECIMEN","OCCURRENCE_STATUS_INFERRED_FROM_INDIVIDUAL_COUNT;COORDINATE_ROUNDED;GEODETIC_DATUM_ASSUMED_WGS84;DIFFERENT_OWNER_INSTITUTION"
-85.126667,10.95,"Persicaria punctata",2268835621,"Llanura de los Guatusos. Near San jose de Upala, 14 KM W of Upala on road to Santa Cecilia.","CRI",NA,1999,"PRESERVED_SPECIMEN","OCCURRENCE_STATUS_INFERRED_FROM_INDIVIDUAL_COUNT;COORDINATE_ROUNDED;GEODETIC_DATUM_ASSUMED_WGS84;DIFFERENT_OWNER_INSTITUTION"
-62.01666,-16.11666,"Persicaria punctata",4062016282,"Wetland; o.5 km NE of Concepción, on the road towards San Ignacio. The front half of the system is dominated by Pontederia cordata. The back half contains a large pond, with a floating mat dominated by Eleocharis.","BOL",NA,1996,"PRESERVED_SPECIMEN","OCCURRENCE_STATUS_INFERRED_FROM_INDIVIDUAL_COUNT;GEODETIC_DATUM_ASSUMED_WGS84;DIFFERENT_OWNER_INSTITUTION"
-155.8,20.1667,"Persicaria punctata",37978089,"North Kohala District; Hawi Quadrangle, Parker Ranch. Stock ponds in vicinity of Kehena Reservoir","USA",NA,1992,"PRESERVED_SPECIMEN","GEODETIC_DATUM_ASSUMED_WGS84;CONTINENT_DERIVED_FROM_COORDINATES;INSTITUTION_MATCH_FUZZY;COLLECTION_MATCH_FUZZY"
-155.583,20.1,"Persicaria punctata",37975395,"Hamakua District, Kukuihaele quad, Waipio Valley","USA",NA,2001,"PRESERVED_SPECIMEN","GEODETIC_DATUM_ASSUMED_WGS84;CONTINENT_DERIVED_FROM_COORDINATES;INSTITUTION_MATCH_FUZZY;COLLECTION_MATCH_FUZZY"
-156.134,20.8169,"Persicaria punctata",37977567,"East Maui, Hana District, Kopiliula, near Hana Hwy.","USA",NA,2002,"PRESERVED_SPECIMEN","GEODETIC_DATUM_ASSUMED_WGS84;CONTINENT_DERIVED_FROM_COORDINATES;INSTITUTION_MATCH_FUZZY;COLLECTION_MATCH_FUZZY"
-79.9,-1.33,"Persicaria punctata",1096722796,"Flora of Ecuador. Prov. Guayas. Hacienda Piedad, 5 km N of Balzar.","ECU",NA,1968,"PRESERVED_SPECIMEN","GEODETIC_DATUM_ASSUMED_WGS84;CONTINENT_DERIVED_FROM_COORDINATES;CONTINENT_INVALID;INSTITUTION_COLLECTION_MISMATCH"
-105.958333,25.025,"Persicaria punctata",1894527189,"Puente El Cajón de San Antonio, 10 Km de Los Altares, camino Santiago-Cuevecillas","MEX",50,1990,"PRESERVED_SPECIMEN","TYPE_STATUS_INVALID;COORDINATE_ROUNDED;GEODETIC_DATUM_ASSUMED_WGS84;CONTINENT_DERIVED_FROM_COORDINATES;ELEVATION_MIN_MAX_SWAPPED;INSTITUTION_MATCH_NONE"
-104.508333,23.308333,"Persicaria punctata",1894527192,"Temoaya, 1 Km por el camino a El Mezquital","MEX",70,1984,"PRESERVED_SPECIMEN","TYPE_STATUS_INVALID;COORDINATE_ROUNDED;GEODETIC_DATUM_ASSUMED_WGS84;CONTINENT_DERIVED_FROM_COORDINATES;ELEVATION_MIN_MAX_SWAPPED;INSTITUTION_MATCH_NONE"
-108.879,31.537,"Persicaria punctata",1843914434,"Adjacent to Animas Creek at the headquarters of Gray Ranch.","USA",1000,1993,"PRESERVED_SPECIMEN","CONTINENT_DERIVED_FROM_COORDINATES;INSTITUTION_MATCH_FUZZY;INSTITUTION_COLLECTION_MISMATCH"
-80.766667,35.733333,"Persicaria punctata",2437062891,"2.3 miles north of Amity Hill. Iredell County. North Carolina.","USA",1000,1958,"PRESERVED_SPECIMEN","INSTITUTION_MATCH_FUZZY;COLLECTION_MATCH_FUZZY"
-58.804558,-33.500718,"Persicaria punctata",3337452757,"","ARG",1498,2011,"HUMAN_OBSERVATION","CONTINENT_DERIVED_FROM_COORDINATES"
-97.402844,30.167636,"Persicaria punctata",2807548917,"Colorado River where crossed by FM 969.","USA",NA,1967,"PRESERVED_SPECIMEN","GEODETIC_DATUM_ASSUMED_WGS84;INSTITUTION_MATCH_FUZZY;INSTITUTION_COLLECTION_MISMATCH"
-98.16417,29.09944,"Persicaria punctata",2807586999,"Center of Rancho de las Cabras NHS, ca. 0.9-1.1 airmiles SE to SSE of St. Rt. 97 bridge over San Antonio River, SW of Floresville. [Flora of San Antonio Missions NHP.].","USA",NA,2001,"PRESERVED_SPECIMEN","GEODETIC_DATUM_ASSUMED_WGS84;INSTITUTION_MATCH_FUZZY;COLLECTION_MATCH_FUZZY"
-97.32415,28.55942,"Persicaria punctata",2807540220,"SE corner of Gibson Lake, on terrace on S side of San Antonio River floodplain, 0.4-0.5 mi. N of St. Rt. 239 from a point 1.0 mi. NW of Refugio-Goliad county line. Lott Lake Quadrangle.","USA",NA,2004,"PRESERVED_SPECIMEN","GEODETIC_DATUM_ASSUMED_WGS84;INSTITUTION_MATCH_FUZZY;COLLECTION_MATCH_FUZZY"
-100.99528,29.88889,"Persicaria punctata",2807626522,"E bank of Devils River, 0.1-0.5 mi N of mouth of Dolan Creek, Dolan Falls Ranch. Dolan Springs Quadrangle.","USA",NA,1992,"PRESERVED_SPECIMEN","GEODETIC_DATUM_ASSUMED_WGS84;INSTITUTION_MATCH_FUZZY;COLLECTION_MATCH_FUZZY"
-94.96103,29.19781,"Persicaria punctata",2807329695,"About .5km NW of the bay side entrance to the park (management unit 5) along the caracara trail.","USA",NA,2011,"PRESERVED_SPECIMEN","GEODETIC_DATUM_ASSUMED_WGS84;INSTITUTION_MATCH_FUZZY;COLLECTION_MATCH_FUZZY"
-98.54115,32.53077,"Persicaria punctata",2807458206,"Ca. 1000 ft. S of F. M. 2372, ca. 2.5-2.6 airmiles W of jct. St. Rt. 16 and R. M. 2372 in Strawn. Palo Pinto Mountains State Park.","USA",NA,2012,"PRESERVED_SPECIMEN","GEODETIC_DATUM_ASSUMED_WGS84;INSTITUTION_MATCH_FUZZY;COLLECTION_MATCH_FUZZY"
-95.54778,33.78056,"Persicaria punctata",2807556266,"N end of Lamar Lake, 100 ft. S of culvert on gravel road at N end of lake. Camp Maxey (Texas National Guard). Pat Mayse Lake East Quadrangle.","USA",NA,1993,"PRESERVED_SPECIMEN","GEODETIC_DATUM_ASSUMED_WGS84;INSTITUTION_MATCH_FUZZY;COLLECTION_MATCH_FUZZY"
-92.7139437,16.8847575,"Persicaria punctata",1895426491,"San Andrés Larráinzar, Chiapas","MEX",150,1987,"PRESERVED_SPECIMEN","TYPE_STATUS_INVALID;OCCURRENCE_STATUS_INFERRED_FROM_INDIVIDUAL_COUNT;COORDINATE_REPROJECTED;CONTINENT_DERIVED_FROM_COORDINATES;INSTITUTION_MATCH_NONE"
-92.3707716,16.89243,"Persicaria punctata",1895426483,"San Juan Cancuc","MEX",1140,1991,"PRESERVED_SPECIMEN","TYPE_STATUS_INVALID;OCCURRENCE_STATUS_INFERRED_FROM_INDIVIDUAL_COUNT;COORDINATE_REPROJECTED;COORDINATE_ROUNDED;CONTINENT_DERIVED_FROM_COORDINATES;INSTITUTION_MATCH_NONE"
-92.638336,16.736672,"Persicaria punctata",1895426456,"E edge of San Cristóbal de Las Casas, along Río Amarillo","MEX",3960,1981,"PRESERVED_SPECIMEN","TYPE_STATUS_INVALID;OCCURRENCE_STATUS_INFERRED_FROM_INDIVIDUAL_COUNT;COORDINATE_ROUNDED;CONTINENT_DERIVED_FROM_COORDINATES;ELEVATION_MIN_MAX_SWAPPED;INSTITUTION_MATCH_NONE"
-99.191111,23.098889,"Persicaria punctata",1895426540,"Rancho El Cielo","MEX",70,1968,"PRESERVED_SPECIMEN","TYPE_STATUS_INVALID;OCCURRENCE_STATUS_INFERRED_FROM_INDIVIDUAL_COUNT;COORDINATE_ROUNDED;GEODETIC_DATUM_ASSUMED_WGS84;CONTINENT_DERIVED_FROM_COORDINATES;INSTITUTION_MATCH_NONE"
-100.655583,19.8453177,"Persicaria punctata",1895426510,"Ojo de agua, 1.5 Km al SW de Jeráhuaro, El Derramadero","MEX",840,1988,"PRESERVED_SPECIMEN","TYPE_STATUS_INVALID;OCCURRENCE_STATUS_INFERRED_FROM_INDIVIDUAL_COUNT;COORDINATE_REPROJECTED;COORDINATE_ROUNDED;CONTINENT_DERIVED_FROM_COORDINATES;ELEVATION_MIN_MAX_SWAPPED;INSTITUTION_MATCH_NONE"
-100.912185,28.7312274,"Persicaria punctata",1895426497,"Río San Rodrigo aprox 23 Km al N de Zaragoza, carr 29","MEX",140,1999,"PRESERVED_SPECIMEN","TYPE_STATUS_INVALID;OCCURRENCE_STATUS_INFERRED_FROM_INDIVIDUAL_COUNT;COORDINATE_REPROJECTED;CONTINENT_DERIVED_FROM_COORDINATES;ELEVATION_MIN_MAX_SWAPPED;INSTITUTION_MATCH_NONE"
-108.2254578,30.2805041,"Persicaria punctata",1895426506,"5 mi SW of Rancho Los Nogales along Piedras Verdes River","MEX",3790,1997,"PRESERVED_SPECIMEN","TYPE_STATUS_INVALID;OCCURRENCE_STATUS_INFERRED_FROM_INDIVIDUAL_COUNT;COORDINATE_REPROJECTED;COORDINATE_ROUNDED;CONTINENT_DERIVED_FROM_COORDINATES;ELEVATION_MIN_MAX_SWAPPED;INSTITUTION_MATCH_NONE"
-92.270219,16.815764,"Persicaria punctata",1895426555,"Bumil Ja', 5 Km al E de Oxchuc, carr internacional","MEX",10,1987,"PRESERVED_SPECIMEN","TYPE_STATUS_INVALID;OCCURRENCE_STATUS_INFERRED_FROM_INDIVIDUAL_COUNT;COORDINATE_REPROJECTED;COORDINATE_ROUNDED;CONTINENT_DERIVED_FROM_COORDINATES;ELEVATION_MIN_MAX_SWAPPED;INSTITUTION_MATCH_NONE"
-103.7,19.453333,"Persicaria punctata",1895426495,"Rancho El Jabalí, 22 Km (airline) NNW of Colima in the SW foothills of the Vol de Colima; Colima/Jalisco line passes through ranch","MEX",90,1991,"PRESERVED_SPECIMEN","TYPE_STATUS_INVALID;OCCURRENCE_STATUS_INFERRED_FROM_INDIVIDUAL_COUNT;COORDINATE_ROUNDED;GEODETIC_DATUM_ASSUMED_WGS84;CONTINENT_DERIVED_FROM_COORDINATES;ELEVATION_MIN_MAX_SWAPPED;INSTITUTION_MATCH_NONE"
-100.4515987,21.8455936,"Persicaria punctata",1895426517,"+ - 4 Km al E de San José Albuquerque","MEX",3870,1963,"PRESERVED_SPECIMEN","TYPE_STATUS_INVALID;OCCURRENCE_STATUS_INFERRED_FROM_INDIVIDUAL_COUNT;COORDINATE_REPROJECTED;COORDINATE_ROUNDED;CONTINENT_DERIVED_FROM_COORDINATES;ELEVATION_MIN_MAX_SWAPPED;INSTITUTION_MATCH_NONE"
-96.933333,19.5,"Persicaria punctata",1895426473,"Parque Ecologico, Jardín Botanico Fco Javier Clavijero, 3 Km SW of Xalapa on old rd to Coatepec","MEX",80,1984,"PRESERVED_SPECIMEN","TYPE_STATUS_INVALID;OCCURRENCE_STATUS_INFERRED_FROM_INDIVIDUAL_COUNT;COORDINATE_ROUNDED;GEODETIC_DATUM_ASSUMED_WGS84;CONTINENT_DERIVED_FROM_COORDINATES;ELEVATION_MIN_MAX_SWAPPED;INSTITUTION_MATCH_NONE"
-100.6731234,19.8549232,"Persicaria punctata",1895426508,"3 Km W of Jerahuaro","MEX",2830,1988,"PRESERVED_SPECIMEN","TYPE_STATUS_INVALID;OCCURRENCE_STATUS_INFERRED_FROM_INDIVIDUAL_COUNT;COORDINATE_REPROJECTED;COORDINATE_ROUNDED;CONTINENT_DERIVED_FROM_COORDINATES;ELEVATION_MIN_MAX_SWAPPED;INSTITUTION_MATCH_NONE"
-99.1406679,19.7650363,"Persicaria punctata",1895426465,"Laguna de Zumpango","MEX",3800,1975,"PRESERVED_SPECIMEN","TYPE_STATUS_INVALID;OCCURRENCE_STATUS_INFERRED_FROM_INDIVIDUAL_COUNT;COORDINATE_REPROJECTED;COORDINATE_ROUNDED;CONTINENT_DERIVED_FROM_COORDINATES;INSTITUTION_MATCH_NONE"
-96.7575544,19.4699512,"Persicaria punctata",1895426513,"Barranca de San Antonio, 1 Km N and NE of Corral Falso, Mpio Dos Ríos","MEX",1470,1986,"PRESERVED_SPECIMEN","TYPE_STATUS_INVALID;OCCURRENCE_STATUS_INFERRED_FROM_INDIVIDUAL_COUNT;COORDINATE_REPROJECTED;COORDINATE_ROUNDED;CONTINENT_DERIVED_FROM_COORDINATES;INSTITUTION_MATCH_NONE"
-97.0309665,19.0411455,"Persicaria punctata",1895426501,"Barranca between Coscomatepec and Chocaman along Hwy Méx 143, 9 Km (by air) SSE of Coscomatepec","MEX",4130,1985,"PRESERVED_SPECIMEN","TYPE_STATUS_INVALID;OCCURRENCE_STATUS_INFERRED_FROM_INDIVIDUAL_COUNT;COORDINATE_REPROJECTED;COORDINATE_ROUNDED;CONTINENT_DERIVED_FROM_COORDINATES;ELEVATION_MIN_MAX_SWAPPED;INSTITUTION_MATCH_NONE"
-100.6871085,19.7980928,"Persicaria punctata",1895426439,"Laguna Larga, Los Azufres","MEX",250,1957,"PRESERVED_SPECIMEN","TYPE_STATUS_INVALID;OCCURRENCE_STATUS_INFERRED_FROM_INDIVIDUAL_COUNT;COORDINATE_REPROJECTED;COORDINATE_ROUNDED;CONTINENT_DERIVED_FROM_COORDINATES;INSTITUTION_MATCH_NONE"
-103.9878275,23.7473275,"Persicaria punctata",1895426486,"A 2 Km de Vicente Guerrero ca a Durango Mpio de Vicente Guerrero","MEX",2870,1984,"PRESERVED_SPECIMEN","TYPE_STATUS_INVALID;OCCURRENCE_STATUS_INFERRED_FROM_INDIVIDUAL_COUNT;COORDINATE_REPROJECTED;COORDINATE_ROUNDED;CONTINENT_DERIVED_FROM_COORDINATES;INSTITUTION_MATCH_NONE"
-102.0789415,19.353279,"Persicaria punctata",1895426533,"Lado poniente de la Cascada Tzarácuara, cerca de Uruapan","MEX",10,1964,"PRESERVED_SPECIMEN","TYPE_STATUS_INVALID;OCCURRENCE_STATUS_INFERRED_FROM_INDIVIDUAL_COUNT;COORDINATE_REPROJECTED;COORDINATE_ROUNDED;CONTINENT_DERIVED_FROM_COORDINATES;ELEVATION_MIN_MAX_SWAPPED;INSTITUTION_MATCH_NONE"
-58.019444,-28.005833,"Persicaria punctata",2248043964,"Parque Nacional Mburucuyá","ARG",NA,2003,"PRESERVED_SPECIMEN","COORDINATE_ROUNDED;INSTITUTION_MATCH_FUZZY;COLLECTION_MATCH_NONE"
-61.322778,-25.150278,"Persicaria punctata",2248045862,"El Colchón","ARG",NA,2005,"PRESERVED_SPECIMEN","COORDINATE_ROUNDED;INSTITUTION_MATCH_FUZZY;COLLECTION_MATCH_NONE"
-64.591944,-31.355,"Persicaria punctata",2248050378,"Tanti","ARG",610,1963,"PRESERVED_SPECIMEN","RECORDED_DATE_INVALID;COORDINATE_ROUNDED;INSTITUTION_MATCH_FUZZY;COLLECTION_MATCH_NONE"
-63.931944,-30.095278,"Persicaria punctata",2248047776,"Cerro Colorado","ARG",3000,1962,"PRESERVED_SPECIMEN","COORDINATE_ROUNDED;INSTITUTION_MATCH_FUZZY;COLLECTION_MATCH_NONE"
-62.676667,-33.193056,"Persicaria punctata",2248050510,"A orillas del Río Saladillo (=Río Cuarto), unos 8 Km antes de W. Escalante, en el camino que viene de Monte Maíz","ARG",8000,1971,"PRESERVED_SPECIMEN","COORDINATE_ROUNDED;INSTITUTION_MATCH_FUZZY;COLLECTION_MATCH_NONE"
-64.296389,-31.137222,"Persicaria punctata",2248046916,"Salsipuedes","ARG",1130,1980,"PRESERVED_SPECIMEN","COORDINATE_ROUNDED;INSTITUTION_MATCH_FUZZY;COLLECTION_MATCH_NONE"
-63.878611,-31.678056,"Persicaria punctata",2248048192,"Pilar","ARG",2150,1978,"PRESERVED_SPECIMEN","COORDINATE_ROUNDED;INSTITUTION_MATCH_FUZZY;COLLECTION_MATCH_NONE"
-62.553056,-31.325556,"Persicaria punctata",2248046766,"A ca. 10 km al N de La Francia, Ayo. de los Guevara","ARG",1000,1964,"PRESERVED_SPECIMEN","COORDINATE_ROUNDED;INSTITUTION_MATCH_FUZZY;COLLECTION_MATCH_NONE"
-65.428889,-24.976111,"Persicaria punctata",2248047822,"Ruta 9, de Salta a Cerrillos, 1 km antes de la Est. Exp. INTA","ARG",NA,1977,"PRESERVED_SPECIMEN","COORDINATE_ROUNDED;INSTITUTION_MATCH_FUZZY;COLLECTION_MATCH_NONE"
-97.049034,28.798262,"Persicaria punctata",2444973928,"","USA",NA,2019,"HUMAN_OBSERVATION","COORDINATE_ROUNDED;CONTINENT_DERIVED_FROM_COORDINATES"
-75.035705,40.301455,"Persicaria punctata",3888814907,"","USA",8,2022,"HUMAN_OBSERVATION","COORDINATE_ROUNDED;CONTINENT_DERIVED_FROM_COORDINATES"
-104.40469,38.409722,"Persicaria punctata",2242423204,"Black Squirrel Creek drainage, Chico Basin Ranch, 1/4mi SE of Bar JH Ranch.","USA",500,2013,"PRESERVED_SPECIMEN","COORDINATE_ROUNDED;GEODETIC_DATUM_ASSUMED_WGS84;CONTINENT_DERIVED_FROM_COORDINATES;INSTITUTION_MATCH_FUZZY"
-105.08667,40.70333,"Persicaria punctata",2242419581,"Brett Gray Ranch, Douglas Reservoir. On edge of reservoir, in muddy soil.","USA",873,2009,"PRESERVED_SPECIMEN","CONTINENT_DERIVED_FROM_COORDINATES;INSTITUTION_MATCH_FUZZY"
-104.64532,39.0149,"Persicaria punctata",2242422489,"Black Forest, Pineries Open Space, ca. 16 miles NE of Colorado Springs; ca. 0.15 miles N of Shoup Road.","USA",NA,2015,"PRESERVED_SPECIMEN","CONTINENT_DERIVED_FROM_COORDINATES;INSTITUTION_MATCH_FUZZY"
-83.662377,35.174116,"Persicaria punctata",2242410107,"Nantahala Lake.","USA",3478,1962,"PRESERVED_SPECIMEN","CONTINENT_DERIVED_FROM_COORDINATES;INSTITUTION_MATCH_FUZZY"
-57.685639,-16.05625,"Persicaria punctata",1090669562,"Baía do Malheiros","BRA",NA,2009,"PRESERVED_SPECIMEN","GEODETIC_DATUM_ASSUMED_WGS84;CONTINENT_DERIVED_FROM_COORDINATES;CONTINENT_INVALID;INSTITUTION_MATCH_FUZZY;INSTITUTION_COLLECTION_MISMATCH"
-98.72292,34.0547,"Persicaria punctata",3978873858,"Hieserman Place. About 0.7 km. SE intersection FM 2345 and Prairie Cottage Rd. 34.05471N, 98.72292W.","USA",NA,2006,"PRESERVED_SPECIMEN","GEODETIC_DATUM_ASSUMED_WGS84;CONTINENT_DERIVED_FROM_COORDINATES;INSTITUTION_MATCH_FUZZY;COLLECTION_MATCH_NONE"
-123.083333,49.083333,"Persicaria punctata",1988139197,"Greater Vancouver Regional District, Delta","CAN",NA,1971,"PRESERVED_SPECIMEN","GEODETIC_DATUM_ASSUMED_WGS84;GEODETIC_DATUM_INVALID;CONTINENT_DERIVED_FROM_COORDINATES;INSTITUTION_MATCH_NONE"
-122.75,49.116667,"Persicaria punctata",1988110633,"Greater Vancouver Regional District, Surrey, under sky train, Scott Road","CAN",NA,1989,"PRESERVED_SPECIMEN","GEODETIC_DATUM_ASSUMED_WGS84;GEODETIC_DATUM_INVALID;CONTINENT_DERIVED_FROM_COORDINATES;INSTITUTION_MATCH_NONE"
