"lon","lat","species","gbifID","locality","countryCode","coordinateUncertaintyInMeters","year","basisOfRecord","issue"
-111.496824,35.067399,"Persicaria pensylvanica",1846530013,"East side Lake Mary.","USA",6488,1972,"PRESERVED_SPECIMEN","GEODETIC_DATUM_ASSUMED_WGS84;CONTINENT_DERIVED_FROM_COORDINATES;INSTITUTION_MATCH_FUZZY;COLLECTION_MATCH_NONE"
-110.5975,31.5191,"Persicaria pensylvanica",1846485992,"Arizona National Scenic Trail, Redrock Canyon, at Down Under Tank.","USA",NA,2004,"PRESERVED_SPECIMEN","GEODETIC_DATUM_ASSUMED_WGS84;CONTINENT_DERIVED_FROM_COORDINATES;INSTITUTION_MATCH_FUZZY;COLLECTION_MATCH_NONE"
-110.440922,32.895019,"Persicaria pensylvanica",1846530499,"Aravaipa Creek","USA",969,1978,"PRESERVED_SPECIMEN","GEODETIC_DATUM_ASSUMED_WGS84;CONTINENT_DERIVED_FROM_COORDINATES;TAXON_MATCH_FUZZY;INSTITUTION_MATCH_FUZZY;COLLECTION_MATCH_NONE"
-109.72844,34.04646,"Persicaria pensylvanica",1846530384,"North fork White River at Rte 473","USA",NA,1971,"PRESERVED_SPECIMEN","GEODETIC_DATUM_ASSUMED_WGS84;CONTINENT_DERIVED_FROM_COORDINATES;INSTITUTION_MATCH_FUZZY;COLLECTION_MATCH_NONE"
-109.927182,33.933946,"Persicaria pensylvanica",1846530451,"Rd. to Alchesay Fish Hatchery at North Fork White River crossing.","USA",3177,1973,"PRESERVED_SPECIMEN","GEODETIC_DATUM_ASSUMED_WGS84;CONTINENT_DERIVED_FROM_COORDINATES;INSTITUTION_MATCH_FUZZY;COLLECTION_MATCH_NONE"
-93.372131,36.003871,"Persicaria pensylvanica",1846530357,"In Clark Creek near junction of Buffalo River.","USA",969,1974,"PRESERVED_SPECIMEN","GEODETIC_DATUM_ASSUMED_WGS84;CONTINENT_DERIVED_FROM_COORDINATES;INSTITUTION_MATCH_FUZZY;COLLECTION_MATCH_NONE"
-93.218299,39.174267,"Persicaria pensylvanica",1846530303,"3 miles north of Marshall.","USA",3854,1975,"PRESERVED_SPECIMEN","GEODETIC_DATUM_ASSUMED_WGS84;CONTINENT_DERIVED_FROM_COORDINATES;INSTITUTION_MATCH_FUZZY;COLLECTION_MATCH_NONE"
-109.437544,34.04195,"Persicaria pensylvanica",1846530215,"Rt. 373 at Little Colorado River, 1 1/2 mi. north of Greer","USA",1621,1974,"PRESERVED_SPECIMEN","GEODETIC_DATUM_ASSUMED_WGS84;CONTINENT_DERIVED_FROM_COORDINATES;INSTITUTION_MATCH_FUZZY;COLLECTION_MATCH_NONE"
-112.38375,34.516861,"Persicaria pensylvanica",1846530113,"Lynx Lake","USA",NA,1973,"PRESERVED_SPECIMEN","GEODETIC_DATUM_ASSUMED_WGS84;CONTINENT_DERIVED_FROM_COORDINATES;TAXON_MATCH_FUZZY;INSTITUTION_MATCH_FUZZY;COLLECTION_MATCH_NONE"
-111.726787,34.063479,"Persicaria pensylvanica",2861409325,"Tonto National Forest, West side of Verde River, base of cliffs across from Chalk mountain and Ister Flat at the end of fire road 573.","USA",NA,2018,"PRESERVED_SPECIMEN","CONTINENT_DERIVED_FROM_COORDINATES;INSTITUTION_MATCH_FUZZY;COLLECTION_MATCH_NONE"
-110.688166,32.244695,"Persicaria pensylvanica",1846474978,"La Cebadilla Cienega, East of Tanque Verde, AZ.","USA",NA,2013,"PRESERVED_SPECIMEN","GEODETIC_DATUM_ASSUMED_WGS84;CONTINENT_DERIVED_FROM_COORDINATES;INSTITUTION_MATCH_FUZZY;COLLECTION_MATCH_NONE"
-110.807978,34.099363,"Persicaria pensylvanica",1846531884,"Tonto N. F.; Pleasant Valley R.D. Gentry Creek.","USA",210,1992,"PRESERVED_SPECIMEN","GEODETIC_DATUM_ASSUMED_WGS84;CONTINENT_DERIVED_FROM_COORDINATES;TAXON_MATCH_FUZZY;INSTITUTION_MATCH_FUZZY;COLLECTION_MATCH_NONE"
-110.302718,31.525017,"Persicaria pensylvanica",1846531830,"DMC ^5 66200/^34 88000. Boston 11th Brigade Signal Corps Site, immediately SW of Buffalo Soldier Road, 2.4 km S of Main Gate, 2.5 km NE of Stone Ridge.","USA",1000,1992,"PRESERVED_SPECIMEN","GEODETIC_DATUM_ASSUMED_WGS84;CONTINENT_DERIVED_FROM_COORDINATES;TAXON_MATCH_FUZZY;INSTITUTION_MATCH_FUZZY;COLLECTION_MATCH_NONE"
-100.78,22.37833,"Persicaria pensylvanica",1846530760,"Villa Hidalgo, S.L.P., ejido El Leoncito.","MEX",5000,1961,"PRESERVED_SPECIMEN","GEODETIC_DATUM_ASSUMED_WGS84;CONTINENT_DERIVED_FROM_COORDINATES;INSTITUTION_MATCH_FUZZY;COLLECTION_MATCH_NONE"
-110.585138,31.825781,"Persicaria pensylvanica",3051655512,"Las Cienegas National Conservation Area, seasonal wetland reclaiming an abandoned agricultural field just E of Cienega Creek and W of Hilton Ranch Rd","USA",NA,2020,"PRESERVED_SPECIMEN","GEODETIC_DATUM_ASSUMED_WGS84;CONTINENT_DERIVED_FROM_COORDINATES;INSTITUTION_MATCH_FUZZY;COLLECTION_MATCH_NONE"
-94.619477,30.322783,"Persicaria pensylvanica",1929181375,"Batson oil field, north of Batson. East of Mayhaw Slough near salt flats","USA",NA,1970,"PRESERVED_SPECIMEN","COLLECTION_MATCH_FUZZY"
-75.31861,38.71389,"Persicaria pensylvanica",1931114662,"along US Rt. 9 DE Rt.404, just west of DE Rt. 30","USA",NA,2008,"PRESERVED_SPECIMEN","GEODETIC_DATUM_ASSUMED_WGS84;COLLECTION_MATCH_FUZZY"
-75.592058,38.723453,"Persicaria pensylvanica",1928905456,"Town of Bridgeville, at the intersection of US Rt. 13, Sussex Highway (Road 4) and DE Rt. 404, Seashore Highway (Road 6), growing in sediment control pond on west side of highway by drug storebesde the supermarket","USA",NA,2011,"PRESERVED_SPECIMEN","GEODETIC_DATUM_ASSUMED_WGS84;COLLECTION_MATCH_FUZZY"
-77.51297,38.13492,"Persicaria pensylvanica",1928045300,"Town of Thornburg, near Exit 118 of I-95, Dan Bell Lane, N of Rt. 606, Mudd Tavern Road.","USA",NA,2011,"PRESERVED_SPECIMEN","GEODETIC_DATUM_ASSUMED_WGS84;COLLECTION_MATCH_FUZZY"
-94.355862,33.940157,"Persicaria pensylvanica",1929476452,"10 mi. S. of DeQueen","USA",NA,1956,"PRESERVED_SPECIMEN","COLLECTION_MATCH_FUZZY"
-96.490981,40.666652,"Persicaria pensylvanica",1928925263,"13 mi SE of Lincoln, W of Roca along a small creek NW of rock quarry","USA",NA,1971,"PRESERVED_SPECIMEN","COLLECTION_MATCH_FUZZY"
-75.67556,38.24778,"Persicaria pensylvanica",1930700128,"North of Princess Anne, along US Rt. 13 at Allen Road, MD Rt. 529","USA",NA,2008,"PRESERVED_SPECIMEN","GEODETIC_DATUM_ASSUMED_WGS84;COLLECTION_MATCH_FUZZY"
-89.518148,37.305884,"Persicaria pensylvanica",1260992112,"Bluebell Island","USA",NA,1967,"PRESERVED_SPECIMEN","COORDINATE_ROUNDED;GEODETIC_DATUM_ASSUMED_WGS84;DIFFERENT_OWNER_INSTITUTION"
-91.691667,37.459444,"Persicaria pensylvanica",1260953710,"Montauk State Park wasteground near park dump","USA",NA,1974,"PRESERVED_SPECIMEN","OCCURRENCE_STATUS_INFERRED_FROM_INDIVIDUAL_COUNT;COORDINATE_ROUNDED;GEODETIC_DATUM_ASSUMED_WGS84;DIFFERENT_OWNER_INSTITUTION"
-90.278333,36.894167,"Persicaria pensylvanica",1260990808,"Missouri Army National Guard Training Site (WETS), growing behind main buildings of training site complex primarily an area of dry, upland, Oak-Hickory woods, but with several low-lying sites along seasonal streams, corolla pink","USA",NA,1994,"PRESERVED_SPECIMEN","OCCURRENCE_STATUS_INFERRED_FROM_INDIVIDUAL_COUNT;COORDINATE_ROUNDED;GEODETIC_DATUM_ASSUMED_WGS84;DIFFERENT_OWNER_INSTITUTION"
-89.65532,36.29011,"Persicaria pensylvanica",4061744284,"Black Island Conservation Area botanical survey, Cottonwood Hunt Club Unit. North side of Robinson Lake and Robinson Bayou below dam.","USA",NA,2015,"PRESERVED_SPECIMEN","OCCURRENCE_STATUS_INFERRED_FROM_INDIVIDUAL_COUNT;GEODETIC_DATUM_ASSUMED_WGS84;INSTITUTION_MATCH_NONE"
-85.538666,36.346169,"Persicaria pensylvanica",3886931763,"3871 Roaring River Road- Roaring River watershed","USA",NA,1998,"PRESERVED_SPECIMEN","GEODETIC_DATUM_ASSUMED_WGS84;CONTINENT_DERIVED_FROM_COORDINATES;INSTITUTION_MATCH_FUZZY"
-85.504558,36.052097,"Persicaria pensylvanica",3886960095,"Side entrance into Hitchcock Property (will eventually become state natural area)","USA",NA,2018,"PRESERVED_SPECIMEN","GEODETIC_DATUM_ASSUMED_WGS84;CONTINENT_DERIVED_FROM_COORDINATES;INSTITUTION_MATCH_FUZZY"
-103.341314,33.823597,"Persicaria pensylvanica",1843878195,"Collected west Pep, (25 miles south Portales).","USA",NA,1960,"PRESERVED_SPECIMEN","COORDINATE_ROUNDED;GEODETIC_DATUM_ASSUMED_WGS84;CONTINENT_DERIVED_FROM_COORDINATES;INSTITUTION_MATCH_FUZZY;INSTITUTION_COLLECTION_MISMATCH"
-103.317625,34.38671,"Persicaria pensylvanica",1842928814,"Cannon Air Force Base, east side, E edge of sewage overflow pond.","USA",NA,1993,"PRESERVED_SPECIMEN","COORDINATE_ROUNDED;GEODETIC_DATUM_ASSUMED_WGS84;CONTINENT_DERIVED_FROM_COORDINATES;INSTITUTION_MATCH_FUZZY;INSTITUTION_COLLECTION_MISMATCH"
-106.252998,35.753575,"Persicaria pensylvanica",1843822800,"Cochiti Quad. White Rock Canyon, along banks of Rio Grande, vicinity mouth of Frijoles Canyon. In area previously inundated by Cochiti Lake.","USA",30,1988,"PRESERVED_SPECIMEN","COORDINATE_ROUNDED;CONTINENT_DERIVED_FROM_COORDINATES;INSTITUTION_MATCH_FUZZY;INSTITUTION_COLLECTION_MISMATCH"
-106.152604,35.571031,"Persicaria pensylvanica",1843852806,"National Guard Camel Tracks training site, about 2 miles due west of the Santa Fe Airport.","USA",285,2001,"PRESERVED_SPECIMEN","CONTINENT_DERIVED_FROM_COORDINATES;INSTITUTION_MATCH_FUZZY;INSTITUTION_COLLECTION_MISMATCH"
-103.731111,34.266712,"Persicaria pensylvanica",1842928763,"Melrose Bombing Range, Tule Canada.","USA",1138,1990,"PRESERVED_SPECIMEN","COORDINATE_ROUNDED;CONTINENT_DERIVED_FROM_COORDINATES;INSTITUTION_MATCH_FUZZY;INSTITUTION_COLLECTION_MISMATCH"
-106.7178,34.8053,"Persicaria pensylvanica",1843858306,"Village of Los Lunas, east side of Rio Grande, about 0.5 miles north of NM 6 bridge.","USA",208,2002,"PRESERVED_SPECIMEN","CONTINENT_DERIVED_FROM_COORDINATES;INSTITUTION_MATCH_FUZZY;INSTITUTION_COLLECTION_MISMATCH"
-103.181088,36.57508,"Persicaria pensylvanica",1843870772,"Seneca Creek, north of Clayton.","USA",NA,1952,"PRESERVED_SPECIMEN","COORDINATE_ROUNDED;GEODETIC_DATUM_ASSUMED_WGS84;CONTINENT_DERIVED_FROM_COORDINATES;INSTITUTION_MATCH_FUZZY;INSTITUTION_COLLECTION_MISMATCH"
-108,36.836,"Persicaria pensylvanica",1843905077,"Aztec Ruins National Monunment, orchard and small irrigation ditch.","USA",2000,2002,"PRESERVED_SPECIMEN","CONTINENT_DERIVED_FROM_COORDINATES;INSTITUTION_MATCH_FUZZY;INSTITUTION_COLLECTION_MISMATCH"
-87.238196,32.691754,"Persicaria pensylvanica",3079564079,"","USA",196,2010,"HUMAN_OBSERVATION","COORDINATE_ROUNDED;CONTINENT_DERIVED_FROM_COORDINATES"
-98.93412,30.83394,"Persicaria pensylvanica",2807483226,"Northwest of Llano and north of Castell, along County Road 405, 1.5 miles north of junction with County Road 409, near a branch of San Fernando Creek.","USA",NA,2015,"PRESERVED_SPECIMEN","GEODETIC_DATUM_ASSUMED_WGS84;INSTITUTION_MATCH_FUZZY;COLLECTION_MATCH_FUZZY"
-99.33358,31.1376,"Persicaria pensylvanica",2807452377,"In Brady, 0.2 mi NE of the Courthouse Square, along Elm Street at Brady Creek Crossing.","USA",NA,2013,"PRESERVED_SPECIMEN","GEODETIC_DATUM_ASSUMED_WGS84;INSTITUTION_MATCH_FUZZY;COLLECTION_MATCH_FUZZY"
-100.08556,35.80083,"Persicaria pensylvanica",4003256648,"TX 33 - 1.6 Mi. E. of Ranch Road 654.","USA",NA,1999,"PRESERVED_SPECIMEN","GEODETIC_DATUM_ASSUMED_WGS84;INSTITUTION_MATCH_FUZZY;COLLECTION_MATCH_FUZZY"
-97.17,30.087,"Persicaria pensylvanica",3336599330,"City of Smithville; Stengl Lost Pines.","USA",NA,2018,"PRESERVED_SPECIMEN","GEODETIC_DATUM_ASSUMED_WGS84;INSTITUTION_MATCH_FUZZY;COLLECTION_MATCH_FUZZY"
-97.823334,29.004684,"Persicaria pensylvanica",2807236534,"Along road 3.5 miles north of Helena.","USA",NA,1958,"PRESERVED_SPECIMEN","GEODETIC_DATUM_ASSUMED_WGS84;INSTITUTION_MATCH_FUZZY;INSTITUTION_COLLECTION_MISMATCH"
-99.38333,29.33333,"Persicaria pensylvanica",2807270223,"Ca. 3 mi. E of Sabinal.","USA",NA,2003,"PRESERVED_SPECIMEN","GEODETIC_DATUM_ASSUMED_WGS84;INSTITUTION_MATCH_FUZZY;COLLECTION_MATCH_FUZZY"
-101.07139,34.41778,"Persicaria pensylvanica",2807476474,"Upper portions of Lake Theo, Caprock Canyons State Park. Lake Theo Quadrangle.","USA",NA,1989,"PRESERVED_SPECIMEN","GEODETIC_DATUM_ASSUMED_WGS84;INSTITUTION_MATCH_FUZZY;COLLECTION_MATCH_FUZZY"
-98.76519,28.11978,"Persicaria pensylvanica",2807584788,"NW part of U. S. Navy's Escondido Ranch, 5.8-5.9 airmiles WNW of confluence of Mirasol and Ygnacio creeks, 4.8 airmiles NNE of SW corner of county, at N28o07'11.2, W098o45'54.7. Piedra Creek SE Quadrangle.","USA",NA,2006,"PRESERVED_SPECIMEN","GEODETIC_DATUM_ASSUMED_WGS84;INSTITUTION_MATCH_FUZZY;COLLECTION_MATCH_FUZZY"
-83.182419,41.6108,"Persicaria pensylvanica",3892347539,"","USA",3,2022,"HUMAN_OBSERVATION","COORDINATE_ROUNDED;CONTINENT_DERIVED_FROM_COORDINATES"
-75.541714,40.342797,"Persicaria pensylvanica",3415866541,"","USA",188,2015,"HUMAN_OBSERVATION","COORDINATE_ROUNDED;CONTINENT_DERIVED_FROM_COORDINATES"
-83.570851,41.049642,"Persicaria pensylvanica",2851181492,"","USA",8,2020,"HUMAN_OBSERVATION","COORDINATE_ROUNDED;CONTINENT_DERIVED_FROM_COORDINATES"
-102.41505,40.5939,"Persicaria pensylvanica",2242353480,"Frenchman Creek State Wildlife Area, 5 miles W of Holyoke between County Roads 27 and 29, 0.5 mile S of Highway 6. Frenchman Creek SWA is approximately 71 acres and ranges from 3,804 to 3,847 ft in elevation.","USA",NA,2016,"PRESERVED_SPECIMEN","CONTINENT_DERIVED_FROM_COORDINATES;INSTITUTION_MATCH_FUZZY"
-104.294964,39.557092,"Persicaria pensylvanica",2242376997,"Plains Conservation Center; West Bijou Creek property, Plains Conservation Center, West Bijou Creek property; 5,760 acres in Denver Basin along West Bijou Creek, 38 miles SE of downtown Denver and 12 miles S of Strasburg, CO.","USA",NA,2003,"PRESERVED_SPECIMEN","GEODETIC_DATUM_ASSUMED_WGS84;CONTINENT_DERIVED_FROM_COORDINATES;INSTITUTION_MATCH_FUZZY"
-105.212497,39.892964,"Persicaria pensylvanica",2242377014,"7 miles south of Boulder on Rocky Flats Pediment.","USA",NA,1995,"PRESERVED_SPECIMEN","GEODETIC_DATUM_ASSUMED_WGS84;CONTINENT_DERIVED_FROM_COORDINATES;INSTITUTION_MATCH_FUZZY"
-103.6053,40.2623,"Persicaria pensylvanica",2242422874,"Morgan county roadside, along rd S @ 1/8 mile west of Rd 29, 0.5 miles NE of Brush CO.","USA",NA,2015,"PRESERVED_SPECIMEN","GEODETIC_DATUM_ASSUMED_WGS84;CONTINENT_DERIVED_FROM_COORDINATES;INSTITUTION_MATCH_FUZZY"
-96.289685,37.825273,"Persicaria pensylvanica",2242410717,"Eureka.","USA",2139,1975,"PRESERVED_SPECIMEN","CONTINENT_DERIVED_FROM_COORDINATES;INSTITUTION_MATCH_FUZZY"
-105.503328,39.918624,"Persicaria pensylvanica",2242365851,"3/4 mile N of Rollinsville on US 119, near edge of Mud Lake","USA",NA,1965,"PRESERVED_SPECIMEN","GEODETIC_DATUM_ASSUMED_WGS84;CONTINENT_DERIVED_FROM_COORDINATES;INSTITUTION_MATCH_FUZZY"
-105.096378,39.547801,"Persicaria pensylvanica",2242384120,"Chatfield Arboretum, Chatfield Arboretum Site, located at junction of Highway75 and Deer Creek Road.Area by Deer Creek.","USA",615,1982,"PRESERVED_SPECIMEN","CONTINENT_DERIVED_FROM_COORDINATES;INSTITUTION_MATCH_FUZZY"
-98.10245,32.215017,"Persicaria pensylvanica",3978871903,"Hunewell Ranch, 2.6 m E intersection Hwy 67 and CR 182, 32°12.901N, 98°06.147W at gate entrance.","USA",NA,2006,"PRESERVED_SPECIMEN","GEODETIC_DATUM_ASSUMED_WGS84;CONTINENT_DERIVED_FROM_COORDINATES;INSTITUTION_MATCH_FUZZY;COLLECTION_MATCH_NONE"
-98.210033,32.24815,"Persicaria pensylvanica",3978872293,"Tarleton Agricultural Center. 0.1 miles from intersection of Hwy 8 and College Farm Road. Coordinates from disturbed area near last entrance gate into pasture land: 32° 14.889 N, 98° 12.602 W.","USA",NA,2007,"PRESERVED_SPECIMEN","GEODETIC_DATUM_ASSUMED_WGS84;CONTINENT_DERIVED_FROM_COORDINATES;INSTITUTION_MATCH_FUZZY;COLLECTION_MATCH_NONE"
-122.140833,49.0875,"Persicaria pensylvanica",1988069436,"Fraser Valley, 10 km northeast of Abbotsford, field southeast of lake below Sumas Mountain, 350 m southwest of foot of No 3 Road","CAN",NA,2008,"PRESERVED_SPECIMEN","GEODETIC_DATUM_ASSUMED_WGS84;GEODETIC_DATUM_INVALID;CONTINENT_DERIVED_FROM_COORDINATES;INSTITUTION_MATCH_NONE"
-98.01744,29.73933,"Persicaria pensylvanica",2807508399,"Freedom Lake on Comal - Guadalupe county line, ca. 0.3-0.4 airmiles SE of F. M. 1101 from a point ca. 3.7 roadmiles NE of its jct. with R. M. 306 near Freiheit. Mesquite Creek Habitat Area.","USA",NA,2009,"PRESERVED_SPECIMEN","GEODETIC_DATUM_ASSUMED_WGS84;INSTITUTION_MATCH_FUZZY;COLLECTION_MATCH_FUZZY"
-95.58044,29.23242,"Persicaria pensylvanica",2807276294,"Nash Ranch, Smalley Pasture, just S of Co. Rd. 26, 0.9 km E of its jct. with Co. Rd. 25, ca. 5 km S of Co. Rd. 18. Ca. 12 km NE of the town of West Columbia.","USA",NA,2006,"PRESERVED_SPECIMEN","GEODETIC_DATUM_ASSUMED_WGS84;INSTITUTION_MATCH_FUZZY;COLLECTION_MATCH_FUZZY"
-104.03905,30.3653,"Persicaria pensylvanica",2807635514,"Ca. 3.9-4.0 airmiles N to NNW of jct. US Rt. 90 and St. Rt. 17 in downtown Marfa. Northern part of Mimms Ranch (Dixon Water Foundation). Marfa Quadrangle.","USA",NA,2012,"PRESERVED_SPECIMEN","GEODETIC_DATUM_ASSUMED_WGS84;INSTITUTION_MATCH_FUZZY;COLLECTION_MATCH_FUZZY"
-96.237642,31.786169,"Persicaria pensylvanica",2807655230,"6 miles northwest of Fairfield.","USA",NA,1965,"PRESERVED_SPECIMEN","GEODETIC_DATUM_ASSUMED_WGS84;INSTITUTION_MATCH_FUZZY;INSTITUTION_COLLECTION_MISMATCH"
-96.95027,28.6055,"Persicaria pensylvanica",2807659303,"Along S side of Linn Bayou just upstream from its confluence with Guadalupe River, 50 -1000 ft W of RR trestle, 5.0-5.3 airmiles NE of RR crossing of F.M. 445 at McFaddin, McFaddin Ranch. Bloomington SW Quadrangle.","USA",NA,2003,"PRESERVED_SPECIMEN","GEODETIC_DATUM_ASSUMED_WGS84;INSTITUTION_MATCH_FUZZY;COLLECTION_MATCH_FUZZY"
-97.39745,25.85113,"Persicaria pensylvanica",2807260843,"W side of main resaca S of HQ, ca. 1.2-1.3 airmiles SSE of jct. Southmost Rd. (FM 1419) and Indiana Ave. (FM 3068) on Southmost Ranch Preserve. Southmost Quadrangle.","USA",NA,2003,"PRESERVED_SPECIMEN","GEODETIC_DATUM_ASSUMED_WGS84;INSTITUTION_MATCH_FUZZY;COLLECTION_MATCH_FUZZY"
-97.29912,30.22242,"Persicaria pensylvanica",2807331017,"Ca. 1.1-1.2 airmiles ENE of jct. St. Rt. 95 and F. M. 2336. Camp Swift Training Center (Texas Army National Guard). Elgin East Quadrangle.","USA",NA,2012,"PRESERVED_SPECIMEN","GEODETIC_DATUM_ASSUMED_WGS84;INSTITUTION_MATCH_FUZZY;COLLECTION_MATCH_FUZZY"
-97.0601,27.823,"Persicaria pensylvanica",2807334238,"Mustang Island. Between Park Rd. P53 and the beach along Avenue G.","USA",NA,1996,"PRESERVED_SPECIMEN","GEODETIC_DATUM_ASSUMED_WGS84;INSTITUTION_MATCH_FUZZY;COLLECTION_MATCH_FUZZY"
-97.129,30.37717,"Persicaria pensylvanica",2807363756,"Along CR 309, 1.3 mi S of junction with FM 696.","USA",NA,2004,"PRESERVED_SPECIMEN","GEODETIC_DATUM_ASSUMED_WGS84;INSTITUTION_MATCH_FUZZY;COLLECTION_MATCH_FUZZY"
-96.255182,30.625254,"Persicaria pensylvanica",2807191924,"E of College Station, in roadside ditch.","USA",NA,1971,"PRESERVED_SPECIMEN","GEODETIC_DATUM_ASSUMED_WGS84;INSTITUTION_MATCH_FUZZY;COLLECTION_MATCH_FUZZY"
-98.68333,29.37778,"Persicaria pensylvanica",2807323919,"Ca. 500-100 ft W of NW corner of revetment around arsenal within Lackland AFB Training Annex, ca. 2.5 airmiles WSW of center of cloverleaf at I-410/US Rt. 90 interchange. Culebra Hill Quadrangle.","USA",NA,1993,"PRESERVED_SPECIMEN","GEODETIC_DATUM_ASSUMED_WGS84;INSTITUTION_MATCH_FUZZY;COLLECTION_MATCH_FUZZY"
-97.98043,29.5795,"Persicaria pensylvanica",3866876615,"Walnut Branch, Seguin.","USA",NA,2017,"PRESERVED_SPECIMEN","GEODETIC_DATUM_ASSUMED_WGS84;INSTITUTION_MATCH_FUZZY;COLLECTION_MATCH_FUZZY"
-97.92352,29.49623,"Persicaria pensylvanica",3866877437,"Reeves Ranchm south of Seguin, off Schneider Road.","USA",NA,2017,"PRESERVED_SPECIMEN","GEODETIC_DATUM_ASSUMED_WGS84;PRESUMED_NEGATED_LONGITUDE;INSTITUTION_MATCH_FUZZY;COLLECTION_MATCH_FUZZY"
-97.91667,29.9,"Persicaria pensylvanica",2807341348,"0.4 km. N from Jct. Post Rd. and TX 82 in San Marcos. Ditch along railroad tracks.","USA",NA,1993,"PRESERVED_SPECIMEN","GEODETIC_DATUM_ASSUMED_WGS84;INSTITUTION_MATCH_FUZZY;COLLECTION_MATCH_FUZZY"
-97.59722,25.98611,"Persicaria pensylvanica",2807295751,"0-500 ft. E of Old Carmen Road, ca. 2.5 airmiles E to ESE of jct. US Rt. 281 and F.M.1421, NW of Brownsville. Resaca de la Palma State Park. West Brownsville Quadrangle.","USA",NA,1994,"PRESERVED_SPECIMEN","GEODETIC_DATUM_ASSUMED_WGS84;INSTITUTION_MATCH_FUZZY;COLLECTION_MATCH_FUZZY"
-93.83259,34.450079,"Persicaria pensylvanica",3435792946,"Ouachita Mountains. USGS Polk Creek Mountain 7.5' Quad. Caddo River north of AR 8 bridge. TRS: T3S R27W S25 Se4","USA",NA,2002,"PRESERVED_SPECIMEN","GEODETIC_DATUM_ASSUMED_WGS84;CONTINENT_DERIVED_FROM_COORDINATES;INSTITUTION_MATCH_FUZZY"
-93.569459,34.649468,"Persicaria pensylvanica",3435793006,"Ouachita Mountains. USGS Story 7.5' Quad. Big Branch arm of Lake Ouachita. TRS: T1S R24W S16 SE4","USA",NA,2002,"PRESERVED_SPECIMEN","GEODETIC_DATUM_ASSUMED_WGS84;CONTINENT_DERIVED_FROM_COORDINATES;INSTITUTION_MATCH_FUZZY"
-94.23306,36.06868,"Persicaria pensylvanica",3435796745,"Ozark Highlands. Springfield Plateau Ecoregion. USGS Fayetteville 7.5' Quad. Fayetteville. Woolsey Prairie (wetland mitigation site for Westside Wastewater Treatment Plant), W of Broyles Rd. & S of Persimmon St. NE corner of wetland cell W-1. Site owned by the City of Fayetteville.","USA",100,2009,"PRESERVED_SPECIMEN","GEODETIC_DATUM_ASSUMED_WGS84;CONTINENT_DERIVED_FROM_COORDINATES;INSTITUTION_MATCH_FUZZY"
-74.201256,40.609826,"Persicaria pensylvanica",3341250091,"Prall's Island","USA",301,1986,"PRESERVED_SPECIMEN","CONTINENT_DERIVED_FROM_COORDINATES;INSTITUTION_MATCH_FUZZY;COLLECTION_MATCH_NONE"
-71.5732,41.4403,"Persicaria pensylvanica",3053363045,"edge of Worden Pond, Worden Pond Rd, S Kingstown","USA",1900,1978,"PRESERVED_SPECIMEN","CONTINENT_DERIVED_FROM_COORDINATES;TAXON_MATCH_FUZZY;INSTITUTION_MATCH_FUZZY;COLLECTION_MATCH_NONE"
-75.9883,39.48499,"Persicaria pensylvanica",3053362122,"Elk Neck State Park","USA",1000,1975,"PRESERVED_SPECIMEN","CONTINENT_DERIVED_FROM_COORDINATES;TAXON_MATCH_FUZZY;INSTITUTION_MATCH_FUZZY;COLLECTION_MATCH_NONE"
-77.7111,38.8242,"Persicaria pensylvanica",1318130287,"Broad Run flood Plain near Bridge on Rt. 211","USA",NA,1952,"PRESERVED_SPECIMEN","GEODETIC_DATUM_ASSUMED_WGS84"
-146.75,64.48,"Persicaria pensylvanica",2397795290,"Big Delta Quad.: Salcha River. 12 km up the Salcha river from the bridge at mile 323. 1 Richardson Hwy.","USA",NA,1990,"PRESERVED_SPECIMEN","GEODETIC_DATUM_ASSUMED_WGS84"
-75.738725,40.149242,"Persicaria pensylvanica",3759857612,"","USA",4,2021,"HUMAN_OBSERVATION","COORDINATE_ROUNDED;CONTINENT_DERIVED_FROM_COORDINATES"
-88.262695,49.007922,"Persicaria pensylvanica",1935580324,"","CAN",500,2018,"HUMAN_OBSERVATION","COORDINATE_ROUNDED;CONTINENT_DERIVED_FROM_COORDINATES"
-78.707297,48.427145,"Persicaria pensylvanica",2999034473,"","CAN",7,2020,"HUMAN_OBSERVATION","COORDINATE_ROUNDED;CONTINENT_DERIVED_FROM_COORDINATES"
-79.065614,42.949412,"Persicaria pensylvanica",3912079855,"","CAN",NA,2022,"HUMAN_OBSERVATION","COORDINATE_ROUNDED;CONTINENT_DERIVED_FROM_COORDINATES"
-84.029051,43.354524,"Persicaria pensylvanica",2397695396,"","USA",NA,2019,"HUMAN_OBSERVATION","COORDINATE_ROUNDED;CONTINENT_DERIVED_FROM_COORDINATES"
-77.715,39.1367,"Persicaria pensylvanica",1319004363,"Purcellville","USA",NA,1960,"PRESERVED_SPECIMEN","GEODETIC_DATUM_ASSUMED_WGS84"
-76.535,38.6861,"Persicaria pensylvanica",1321978921,"Chesapeake Beach","USA",NA,1963,"PRESERVED_SPECIMEN","GEODETIC_DATUM_ASSUMED_WGS84"
-94.157433,36.062856,"Persicaria pensylvanica",3698775294,"College Ave. Fayetteville.","USA",1588,1956,"PRESERVED_SPECIMEN","CONTINENT_DERIVED_FROM_COORDINATES;INSTITUTION_MATCH_FUZZY"
-91.496389,40.043889,"Persicaria pensylvanica",1258136461,"La Grange, city park between the railroad and the Mississippi River.","USA",NA,2013,"PRESERVED_SPECIMEN","OCCURRENCE_STATUS_INFERRED_FROM_INDIVIDUAL_COUNT;COORDINATE_ROUNDED;GEODETIC_DATUM_ASSUMED_WGS84;INSTITUTION_MATCH_FUZZY;COLLECTION_MATCH_NONE"
-97.351111,42.3725,"Persicaria pensylvanica",1258093576,"Randolph, SE side of town along Sholes Road.","USA",NA,2014,"PRESERVED_SPECIMEN","OCCURRENCE_STATUS_INFERRED_FROM_INDIVIDUAL_COUNT;COORDINATE_ROUNDED;GEODETIC_DATUM_ASSUMED_WGS84;INSTITUTION_MATCH_FUZZY;COLLECTION_MATCH_NONE"
-90.634167,42.9825,"Persicaria pensylvanica",2268833903,"Fennimore, eastern outskirts, north of Hwy. Q. T6N; R2W; center of sect. 20.","USA",NA,2014,"PRESERVED_SPECIMEN","OCCURRENCE_STATUS_INFERRED_FROM_INDIVIDUAL_COUNT;COORDINATE_ROUNDED;GEODETIC_DATUM_ASSUMED_WGS84;INSTITUTION_MATCH_FUZZY;COLLECTION_MATCH_NONE"
-91.679444,39.463889,"Persicaria pensylvanica",1258138072,"Mark Twain Lake, Duane Whelan Recreation Area, 2 mi. N of Perry.","USA",NA,2013,"PRESERVED_SPECIMEN","OCCURRENCE_STATUS_INFERRED_FROM_INDIVIDUAL_COUNT;COORDINATE_ROUNDED;GEODETIC_DATUM_ASSUMED_WGS84;INSTITUTION_MATCH_FUZZY;COLLECTION_MATCH_NONE"
-92.173333,38.576667,"Persicaria pensylvanica",1260961969,"Jefferson City waste ground","USA",NA,1984,"PRESERVED_SPECIMEN","OCCURRENCE_STATUS_INFERRED_FROM_INDIVIDUAL_COUNT;COORDINATE_ROUNDED;GEODETIC_DATUM_ASSUMED_WGS84;INSTITUTION_MATCH_FUZZY;COLLECTION_MATCH_NONE"
-90.898206,38.431925,"Persicaria pensylvanica",4032017271,"Gravel bar and adjacent river bank, Bourbeuse River. Property of Natalie Mueller. Moselle Quadrangle.","USA",NA,2022,"PRESERVED_SPECIMEN","OCCURRENCE_STATUS_INFERRED_FROM_INDIVIDUAL_COUNT;GEODETIC_DATUM_ASSUMED_WGS84;INSTITUTION_MATCH_FUZZY;COLLECTION_MATCH_NONE"
-93.335555,39.710556,"Persicaria pensylvanica",1260952509,"Fountain Grove Conservation Area; ca. 5 mi S of Meadville","USA",NA,2000,"PRESERVED_SPECIMEN","OCCURRENCE_STATUS_INFERRED_FROM_INDIVIDUAL_COUNT;COORDINATE_ROUNDED;GEODETIC_DATUM_ASSUMED_WGS84;INSTITUTION_MATCH_FUZZY;COLLECTION_MATCH_NONE"
-91.402778,37.280278,"Persicaria pensylvanica",1260962718,"Botanical Survey of the Ozark National Scenic Riverways, Round Spring; Station 37, Site 1 gravel bar on Current River, low wet areas; abundant","USA",NA,1969,"PRESERVED_SPECIMEN","OCCURRENCE_STATUS_INFERRED_FROM_INDIVIDUAL_COUNT;COORDINATE_ROUNDED;GEODETIC_DATUM_ASSUMED_WGS84;INSTITUTION_MATCH_FUZZY;COLLECTION_MATCH_NONE"
-90.556389,38.859167,"Persicaria pensylvanica",4031632265,"1 1/2 mi W of Kampville, ca. 6 mi NW of St. Charles at the Golden Eagle Ferry dried weedy mud flats in sloughs along the Mississippi RiverLeptochloa spp., Cyperus spp., Ammania coccinea, Rorippa sessiliflora, Leersia oryzoides, Lindernia, Amaranthus spp.","USA",NA,1974,"PRESERVED_SPECIMEN","OCCURRENCE_STATUS_INFERRED_FROM_INDIVIDUAL_COUNT;COORDINATE_ROUNDED;GEODETIC_DATUM_ASSUMED_WGS84;INSTITUTION_MATCH_FUZZY;COLLECTION_MATCH_NONE"
