"lon","lat","species","gbifID","locality","countryCode","coordinateUncertaintyInMeters","year","basisOfRecord","issue"
48.73333,-17.96666,"Phyllanthus lokohensis",1260887786,"Rahobevava","MDG",NA,1951,"PRESERVED_SPECIMEN","GEODETIC_DATUM_ASSUMED_WGS84;DIFFERENT_OWNER_INSTITUTION"
48.806667,-18.403333,"Phyllanthus lokohensis",1257831648,"Brickaville, Anjahamamy, Anivoranokely, Ankerana forest, Belalogno river.","MDG",NA,2012,"PRESERVED_SPECIMEN","OCCURRENCE_STATUS_INFERRED_FROM_INDIVIDUAL_COUNT;COORDINATE_ROUNDED;GEODETIC_DATUM_ASSUMED_WGS84;DIFFERENT_OWNER_INSTITUTION"
49.28888,-16.86111,"Phyllanthus lokohensis",4031636746,"Soanerana Ivongo, entre Ambatovaky et Amberomanitra","MDG",NA,2003,"PRESERVED_SPECIMEN","GEODETIC_DATUM_ASSUMED_WGS84;INSTITUTION_MATCH_FUZZY;COLLECTION_MATCH_NONE"
48.313333,-19.537778,"Phyllanthus lokohensis",4032113551,"District Anosibe an'Ala, Commune rurale Tratramarina, Fokontany Ambonihiboka, forêt Ambatofotsy, accompagné de M. Christophe Rahaingonirina de l'association Ambarakaly","MDG",NA,2010,"PRESERVED_SPECIMEN","OCCURRENCE_STATUS_INFERRED_FROM_INDIVIDUAL_COUNT;COORDINATE_ROUNDED;GEODETIC_DATUM_ASSUMED_WGS84;INSTITUTION_MATCH_FUZZY;COLLECTION_MATCH_NONE"
49.439167,-14.255833,"Phyllanthus lokohensis",4062152774,"Andapa, Doany, Anjialavahely. Ankijanindambo forest. Specimen preserved in alcohol.","MDG",NA,2006,"PRESERVED_SPECIMEN","OCCURRENCE_STATUS_INFERRED_FROM_INDIVIDUAL_COUNT;COORDINATE_ROUNDED;GEODETIC_DATUM_ASSUMED_WGS84;DIFFERENT_OWNER_INSTITUTION"
49.55305,-15.30444,"Phyllanthus lokohensis",1260887791,"Ankirondro, sur crête, Maroantsetra","MDG",NA,2007,"PRESERVED_SPECIMEN","GEODETIC_DATUM_ASSUMED_WGS84;DIFFERENT_OWNER_INSTITUTION"
48.34,-18.86055,"Phyllanthus lokohensis",1260985812,"Alaotra Mangoro, Moramanga, Andasibe, Menalamba. Sahaviarina forest. Collected with M. Ratovomanana, B.A. Ratodimanana & F. Edmond.","MDG",NA,2008,"PRESERVED_SPECIMEN","OCCURRENCE_STATUS_INFERRED_FROM_INDIVIDUAL_COUNT;GEODETIC_DATUM_ASSUMED_WGS84;DIFFERENT_OWNER_INSTITUTION"
49.20583,-17.90528,"Phyllanthus lokohensis",3923955409,"","MDG",NA,2005,"PRESERVED_SPECIMEN","GEODETIC_DATUM_ASSUMED_WGS84;CONTINENT_DERIVED_FROM_COORDINATES;COLLECTION_MATCH_FUZZY"
49.766667,-14.433333,"Phyllanthus lokohensis",1258733374,"Reserve Naturelle de Marojejy; along the Manantenina River, N of the 2nd camp on the trail to the summit of Marojejy Est; rheophytic vegetation along river and adjacent periodically inundated forest.","MDG",NA,1989,"PRESERVED_SPECIMEN","OCCURRENCE_STATUS_INFERRED_FROM_INDIVIDUAL_COUNT;COORDINATE_ROUNDED;GEODETIC_DATUM_ASSUMED_WGS84;INSTITUTION_MATCH_FUZZY;COLLECTION_MATCH_NONE"
