"lon","lat","species","gbifID","locality","countryCode","coordinateUncertaintyInMeters","year","basisOfRecord","issue"
6.54744,0.268818,"Pilea rivularis",4061149048,"Côté ouest du Pico Sao Tomé. Relévé R-IDU 15 (10 x 10 m).","STP",NA,2021,"PRESERVED_SPECIMEN","OCCURRENCE_STATUS_INFERRED_FROM_INDIVIDUAL_COUNT;GEODETIC_DATUM_ASSUMED_WGS84;INSTITUTION_MATCH_NONE"
49.137222,-14.228056,"Pilea rivularis",4061536172,"Andapa, Doany, forêt d'altitude d'Ambohimirahavavy, 22Km à l'Est du chef lieu de la commune Mangindrano, Bealanana. Montagne de Beampoko. Substrat argileux riche en humus. Récolté avec J. Randriantiavina & Torize.","MDG",NA,2005,"PRESERVED_SPECIMEN","OCCURRENCE_STATUS_INFERRED_FROM_INDIVIDUAL_COUNT;COORDINATE_ROUNDED;GEODETIC_DATUM_ASSUMED_WGS84;DIFFERENT_OWNER_INSTITUTION"
49.140833,-12.512734,"Pilea rivularis",3759930397,"","MDG",2118,2022,"HUMAN_OBSERVATION","COORDINATE_ROUNDED;CONTINENT_DERIVED_FROM_COORDINATES"
47.28,-19.37,"Pilea rivularis",2565406119,"Eastern slope of Ankaratra, west of Ambatolampy.","MDG",NA,1987,"PRESERVED_SPECIMEN","GEODETIC_DATUM_ASSUMED_WGS84"
46.93333,-22.16666,"Pilea rivularis",1261434079,"Reserve Naturelle Integrale d'Andringitra. 50 km S of Ambalavao. Near abandoned meteorological station above Ambalamarina. High altitude moss/lichen rainforest-ericaceous bush. Phillippia dominant above 1975 m. Canopy 5-25 m tall. Grassy/rocky summit with orchids.","MDG",NA,1987,"PRESERVED_SPECIMEN","OCCURRENCE_STATUS_INFERRED_FROM_INDIVIDUAL_COUNT;GEODETIC_DATUM_ASSUMED_WGS84;INSTITUTION_MATCH_FUZZY;COLLECTION_MATCH_NONE"
36.45,-7.75,"Pilea rivularis",1258776535,"Ndundulu, Udzungwa Mountains","TZA",NA,1999,"PRESERVED_SPECIMEN","OCCURRENCE_STATUS_INFERRED_FROM_INDIVIDUAL_COUNT;GEODETIC_DATUM_ASSUMED_WGS84;INSTITUTION_MATCH_FUZZY;COLLECTION_MATCH_NONE"
49.43861,-14.24888,"Pilea rivularis",4032064717,"Andapa, Doany, Anjialavahely. Ankarongameloka forest. Specimen preserved in alcohol.","MDG",NA,2006,"PRESERVED_SPECIMEN","OCCURRENCE_STATUS_INFERRED_FROM_INDIVIDUAL_COUNT;GEODETIC_DATUM_ASSUMED_WGS84;INSTITUTION_MATCH_FUZZY;COLLECTION_MATCH_NONE"
40.1824,6.928967,"Pilea rivularis",1257596479,"Oromiya. Surroundings of Odo-Bulu hunting camp.","ETH",NA,2009,"PRESERVED_SPECIMEN","OCCURRENCE_STATUS_INFERRED_FROM_INDIVIDUAL_COUNT;COORDINATE_ROUNDED;GEODETIC_DATUM_ASSUMED_WGS84;INSTITUTION_MATCH_FUZZY;COLLECTION_MATCH_NONE"
47.416667,-21.258333,"Pilea rivularis",4061243578,"Ranomafana National Park, parcelle 3, S of National Road 25 at 7 km W of Ranomafana; Talatakely trail system.","MDG",NA,1993,"PRESERVED_SPECIMEN","OCCURRENCE_STATUS_INFERRED_FROM_INDIVIDUAL_COUNT;COORDINATE_ROUNDED;GEODETIC_DATUM_ASSUMED_WGS84;DIFFERENT_OWNER_INSTITUTION"
10.6,6.35,"Pilea rivularis",912468941,"Dom, in Noni subdivision (Bui Division), NW Province. Forest around Kinjinjang Rock.","CMR",NA,2006,"PRESERVED_SPECIMEN","GEODETIC_DATUM_ASSUMED_WGS84;CONTINENT_DERIVED_FROM_COORDINATES;INSTITUTION_MATCH_FUZZY;COLLECTION_MATCH_FUZZY"
9.7,4.8,"Pilea rivularis",912320721,"At the summit eastwards towards the base camp.","CMR",NA,1995,"PRESERVED_SPECIMEN","GEODETIC_DATUM_ASSUMED_WGS84;CONTINENT_DERIVED_FROM_COORDINATES;INSTITUTION_MATCH_FUZZY;COLLECTION_MATCH_FUZZY"
34.45,-9.85,"Pilea rivularis",1261437370,"Livingstone Mountains, at and near summit of Ligala Mountain along foot trail from mission at Madunda, in rocky grassland and montane forest.","TZA",NA,1991,"PRESERVED_SPECIMEN","OCCURRENCE_STATUS_INFERRED_FROM_INDIVIDUAL_COUNT;GEODETIC_DATUM_ASSUMED_WGS84;INSTITUTION_MATCH_FUZZY;COLLECTION_MATCH_NONE"
47.028056,-20.1,"Pilea rivularis",4032001737,"Antsirabe, Ibity, forêt galérie assez dégradée.","MDG",NA,2003,"PRESERVED_SPECIMEN","OCCURRENCE_STATUS_INFERRED_FROM_INDIVIDUAL_COUNT;COORDINATE_ROUNDED;GEODETIC_DATUM_ASSUMED_WGS84;INSTITUTION_MATCH_FUZZY;COLLECTION_MATCH_NONE"
36.52333,-7.75277,"Pilea rivularis",1258775236,"Ndundulu, Udzungwa Mountains. West Kilombero Forest Reserve.","TZA",NA,2000,"PRESERVED_SPECIMEN","OCCURRENCE_STATUS_INFERRED_FROM_INDIVIDUAL_COUNT;GEODETIC_DATUM_ASSUMED_WGS84;INSTITUTION_MATCH_FUZZY;COLLECTION_MATCH_NONE"
34.35,-9.75,"Pilea rivularis",1261437235,"Livingstone Mountains; saddle between two highest peaks of Masusa Mountain, in grassland and montane forest.","TZA",NA,1991,"PRESERVED_SPECIMEN","OCCURRENCE_STATUS_INFERRED_FROM_INDIVIDUAL_COUNT;GEODETIC_DATUM_ASSUMED_WGS84;INSTITUTION_MATCH_FUZZY;COLLECTION_MATCH_NONE"
39.725177,6.714354,"Pilea rivularis",1801080487,"","ETH",NA,1996,"PRESERVED_SPECIMEN","CONTINENT_DERIVED_FROM_COORDINATES;INSTITUTION_MATCH_FUZZY;COLLECTION_MATCH_FUZZY"
37.55,-0.25,"Pilea rivularis",2515921176,"Mt. Kenya, chuka tracka track.","KEN",NA,1985,"PRESERVED_SPECIMEN","INSTITUTION_MATCH_FUZZY;INSTITUTION_COLLECTION_MISMATCH"
9.883333,4.966667,"Pilea rivularis",2517740799,"Manengouba Mts. base, 4 km WNW of Nkongsamba.4.58 N 9.53 E","CMR",NA,1972,"PRESERVED_SPECIMEN","INSTITUTION_MATCH_FUZZY;INSTITUTION_COLLECTION_MISMATCH"
36.75,-0.766667,"Pilea rivularis",2515844585,"K4 Fort Hall District, Bamboo forest on valcano rock.","KEN",NA,1965,"PRESERVED_SPECIMEN","INSTITUTION_MATCH_FUZZY;INSTITUTION_COLLECTION_MISMATCH"
37.945539,-6.906139,"Pilea rivularis",3863878200,"uluguru mountain","TZA",NA,1971,"PRESERVED_SPECIMEN","OCCURRENCE_STATUS_INFERRED_FROM_INDIVIDUAL_COUNT;COLLECTION_MATCH_NONE"
35.40388,-4.527085,"Pilea rivularis",3863879272,"hanang mountain","TZA",NA,1966,"PRESERVED_SPECIMEN","OCCURRENCE_STATUS_INFERRED_FROM_INDIVIDUAL_COUNT;COLLECTION_MATCH_NONE"
38.479685,-5.163435,"Pilea rivularis",4014174455,"Kwamngumi forest reserve","TZA",NA,1968,"PRESERVED_SPECIMEN","OCCURRENCE_STATUS_INFERRED_FROM_INDIVIDUAL_COUNT;COLLECTION_MATCH_NONE"
33.3,-8.833333,"Pilea rivularis",2517480865,"Mbeya: Mbeya District, Mbeya Peak above Lunji Farm.","TZA",NA,1991,"PRESERVED_SPECIMEN","INSTITUTION_MATCH_FUZZY;INSTITUTION_COLLECTION_MISMATCH"
10.516667,6.183333,"Pilea rivularis",2517727730,"Cameroun Ouest, Région Est. Kumbo, Mt. Okou.","CMR",NA,1970,"PRESERVED_SPECIMEN","INSTITUTION_MATCH_FUZZY;INSTITUTION_COLLECTION_MISMATCH"
9.71666,5.05,"Pilea rivularis",1261436802,"Just W. of Mejelet Ehumseh. Along path from Mejelet Ehumseh to Mejelet Nteho I. Approximately 6 km W. of Bongem.","CMR",NA,1986,"PRESERVED_SPECIMEN","OCCURRENCE_STATUS_INFERRED_FROM_INDIVIDUAL_COUNT;GEODETIC_DATUM_ASSUMED_WGS84;INSTITUTION_MATCH_FUZZY;COLLECTION_MATCH_NONE"
48.95555,-14.15416,"Pilea rivularis",4031536558,"Fivondronana: Bealanana, Commune: Mangindrano. Forêt d'Analamalalaka à 12 km au Nord du village Mangindrano. Forêt dense humide de moyenne altitude.","MDG",NA,2003,"PRESERVED_SPECIMEN","OCCURRENCE_STATUS_INFERRED_FROM_INDIVIDUAL_COUNT;GEODETIC_DATUM_ASSUMED_WGS84;INSTITUTION_MATCH_FUZZY;COLLECTION_MATCH_NONE"
33.666667,-10.583333,"Pilea rivularis",1258656380,"Nyika Plateau, Chowo Forest. At stream side.","ZMB",NA,1988,"PRESERVED_SPECIMEN","OCCURRENCE_STATUS_INFERRED_FROM_INDIVIDUAL_COUNT;COORDINATE_ROUNDED;GEODETIC_DATUM_ASSUMED_WGS84;INSTITUTION_MATCH_FUZZY;COLLECTION_MATCH_NONE"
49.166667,-12.5,"Pilea rivularis",1261917923,"Environs de Diego-Suarez : Forêt d'Ambre Forêt ombrophile sur argile latéritique de basalte","MDG",NA,1959,"PRESERVED_SPECIMEN","OCCURRENCE_STATUS_INFERRED_FROM_INDIVIDUAL_COUNT;COORDINATE_ROUNDED;GEODETIC_DATUM_ASSUMED_WGS84;DIFFERENT_OWNER_INSTITUTION"
46.85,-24.73333,"Pilea rivularis",1261917921,"8km. N of Isaka on road to Ramanafana in wet places by stream","MDG",NA,1968,"PRESERVED_SPECIMEN","GEODETIC_DATUM_ASSUMED_WGS84;DIFFERENT_OWNER_INSTITUTION"
47.26666,-18.13333,"Pilea rivularis",4061268210,"Forêt d'Ambohitantely, district d'Ankazobe Sous-bois","MDG",NA,1959,"PRESERVED_SPECIMEN","GEODETIC_DATUM_ASSUMED_WGS84;DIFFERENT_OWNER_INSTITUTION"
36.58027,-6.925,"Pilea rivularis",4061773254,"Rubeho Mountains, Mafwemera Forest Reserve, along river valley. Forest dominated by Cussonia sp., Albizia sp. and Polysias fulva, ca. 2 km W of Thom Bayerner Hill.","TZA",NA,2005,"PRESERVED_SPECIMEN","OCCURRENCE_STATUS_INFERRED_FROM_INDIVIDUAL_COUNT;GEODETIC_DATUM_ASSUMED_WGS84;INSTITUTION_MATCH_NONE"
34.95,0.05,"Pilea rivularis",1840389286,"South Nandu Forest, 5 km W de Kobujoi","KEN",NA,1979,"PRESERVED_SPECIMEN","GEODETIC_DATUM_ASSUMED_WGS84;CONTINENT_DERIVED_FROM_COORDINATES;INSTITUTION_MATCH_FUZZY;COLLECTION_MATCH_FUZZY"
28.633333,-2.266667,"Pilea rivularis",1840389400,"Contreforts Mt Kahusi Km 22 route Kavumu-Walikale","COD",NA,1956,"PRESERVED_SPECIMEN","GEODETIC_DATUM_ASSUMED_WGS84;CONTINENT_DERIVED_FROM_COORDINATES;INSTITUTION_MATCH_FUZZY;COLLECTION_MATCH_FUZZY"
36.25,7.266667,"Pilea rivularis",1840389341,"Kefa, behind the Catholic Mission at Bonga","ETH",NA,1974,"PRESERVED_SPECIMEN","GEODETIC_DATUM_ASSUMED_WGS84;CONTINENT_DERIVED_FROM_COORDINATES;INSTITUTION_MATCH_FUZZY;COLLECTION_MATCH_FUZZY"
29.5,-3.216667,"Pilea rivularis",1840389443,"Prov. Bubanza: Mugomero (Rugazi)","BDI",NA,1981,"PRESERVED_SPECIMEN","GEODETIC_DATUM_ASSUMED_WGS84;CONTINENT_DERIVED_FROM_COORDINATES;INSTITUTION_MATCH_FUZZY;COLLECTION_MATCH_FUZZY"
10.333333,6.283333,"Pilea rivularis",1840389275,"West Cameroon. Division: Boyo, Gazatte: Laikom, GPS: 6 05.37N, Forest patch towards foot of waterfall above Akwamofu sacred forest","CMR",NA,1998,"PRESERVED_SPECIMEN","GEODETIC_DATUM_ASSUMED_WGS84;CONTINENT_DERIVED_FROM_COORDINATES;INSTITUTION_MATCH_FUZZY;COLLECTION_MATCH_FUZZY"
49.098333,-15.533333,"Pilea rivularis",4061437653,"Sofia, Mandritsara, Ambilobe, Bandabe. Suivant la piste vers Antsiradava. Cinq Km à l'Est de Bandabe à vol d'oiseau, à l'Ouest de la forêt de Makira. Lohan'Ananjaka et Kiboro. Récoltés avec D. Ravelonarivo, A. Lehavana, Tsiady & Manankaja.","MDG",NA,2007,"PRESERVED_SPECIMEN","OCCURRENCE_STATUS_INFERRED_FROM_INDIVIDUAL_COUNT;COORDINATE_ROUNDED;GEODETIC_DATUM_ASSUMED_WGS84;DIFFERENT_OWNER_INSTITUTION"
49.53777,-13.63861,"Pilea rivularis",1260847036,"Sava, Vohemar, Andrafainkona, Ampisarahina. Forêt dense sub-humide de moyenne altitude de Maromaniry, située à 5 km au Nord d'Ampisarahina. Echantillons traités en alcool.","MDG",NA,2007,"PRESERVED_SPECIMEN","OCCURRENCE_STATUS_INFERRED_FROM_INDIVIDUAL_COUNT;GEODETIC_DATUM_ASSUMED_WGS84;DIFFERENT_OWNER_INSTITUTION"
48.945,-14.17416,"Pilea rivularis",1259142629,"Fiv. Bealanana. Commune Mangindrano. Forêt Antetikalambazaha, aux environ de riviére Befosa, dans le massif de Tsaratanana, 9 km au Nord de Mangindrano. Forêt dense humide de moyenne altitude.","MDG",NA,2003,"PRESERVED_SPECIMEN","OCCURRENCE_STATUS_INFERRED_FROM_INDIVIDUAL_COUNT;GEODETIC_DATUM_ASSUMED_WGS84;DIFFERENT_OWNER_INSTITUTION"
47.16666,-20.76666,"Pilea rivularis",1261918822,"Environs d'Ambatofitoharana (Betsileo) au Km 300 de la route Tananarive- Fianarantsoa Restes de forêt ombrophile sur argiles latéritiques","MDG",NA,1955,"PRESERVED_SPECIMEN","GEODETIC_DATUM_ASSUMED_WGS84;DIFFERENT_OWNER_INSTITUTION"
33.35,-8.83333,"Pilea rivularis",4061943206,"Forest in gully on Mt. Mbeya facing southwest.","TZA",NA,1991,"PRESERVED_SPECIMEN","OCCURRENCE_STATUS_INFERRED_FROM_INDIVIDUAL_COUNT;GEODETIC_DATUM_ASSUMED_WGS84;INSTITUTION_MATCH_NONE"
47.01277,-23.53583,"Pilea rivularis",1260277536,"Midongy du Sud, à 2 km à l'Ouest du village d'Ankaboky. Forêt dense humide. Récolté avec M. Ramanantsoa, M.G. Maminandrasana, W. Lodwige & A. Dama.","MDG",NA,2005,"PRESERVED_SPECIMEN","OCCURRENCE_STATUS_INFERRED_FROM_INDIVIDUAL_COUNT;GEODETIC_DATUM_ASSUMED_WGS84;DIFFERENT_OWNER_INSTITUTION"
35.916667,-8.05,"Pilea rivularis",1258774754,"New Dabaga/Ulangambi","TZA",NA,1999,"PRESERVED_SPECIMEN","OCCURRENCE_STATUS_INFERRED_FROM_INDIVIDUAL_COUNT;COORDINATE_ROUNDED;GEODETIC_DATUM_ASSUMED_WGS84;INSTITUTION_MATCH_FUZZY;COLLECTION_MATCH_NONE"
38.716667,6.216667,"Pilea rivularis",1840389229,"Sidamo Prov., 64 km. NW of Kebre Mengist, along the road to Yirgalem","ETH",NA,1969,"PRESERVED_SPECIMEN","GEODETIC_DATUM_ASSUMED_WGS84;CONTINENT_DERIVED_FROM_COORDINATES;INSTITUTION_MATCH_FUZZY;COLLECTION_MATCH_FUZZY"
35.505278,-4.135833,"Pilea rivularis",2268967443,"Bashnet Division, Madunga Ward, Madounga Village, Endalah Subvillage, Nou Forest Reserve, E side of Madunga Village at Tlaano.","TZA",NA,2017,"PRESERVED_SPECIMEN","OCCURRENCE_STATUS_INFERRED_FROM_INDIVIDUAL_COUNT;COORDINATE_ROUNDED;GEODETIC_DATUM_ASSUMED_WGS84;INSTITUTION_MATCH_FUZZY;COLLECTION_MATCH_NONE"
10.46666,6.18333,"Pilea rivularis",1261433994,"Forest, scrublands and grasslands around Lake Oku and Mount Oku.","CMR",NA,1986,"PRESERVED_SPECIMEN","OCCURRENCE_STATUS_INFERRED_FROM_INDIVIDUAL_COUNT;GEODETIC_DATUM_ASSUMED_WGS84;INSTITUTION_MATCH_FUZZY;COLLECTION_MATCH_NONE"
31.692977,-7.900333,"Pilea rivularis",1288083079,"Rukwa;Sumbawanga;Mbizi Forest Reserve","TZA",NA,2012,"HUMAN_OBSERVATION","COORDINATE_ROUNDED;GEODETIC_DATUM_ASSUMED_WGS84;CONTINENT_DERIVED_FROM_COORDINATES"
35.55,6.216667,"Pilea rivularis",2515637731,"Gobe, a village c. 2 hours walking distance NW. of Maji.","ETH",NA,1970,"PRESERVED_SPECIMEN","INSTITUTION_MATCH_FUZZY;INSTITUTION_COLLECTION_MISMATCH"
30.716667,-24.933333,"Pilea rivularis",2513922346,"Planten van: Transvaal, Mt Sheba, Sw. of Pilgrimsrest.","ZAF",NA,1975,"PRESERVED_SPECIMEN","INSTITUTION_MATCH_FUZZY;INSTITUTION_COLLECTION_MISMATCH"
46.76666,-22.11666,"Pilea rivularis",1261917971,"Imaitso. Canton : Sendrisoa. District : Ambalavao","MDG",NA,1957,"PRESERVED_SPECIMEN","GEODETIC_DATUM_ASSUMED_WGS84;DIFFERENT_OWNER_INSTITUTION"
36.63333,-7.1,"Pilea rivularis",4061511650,"Rubeho Mountains. Ukwiva Forest Reserve SW of 2nd camp. Montane forest with grassy glades/hilltops & swamps.","TZA",NA,2005,"PRESERVED_SPECIMEN","OCCURRENCE_STATUS_INFERRED_FROM_INDIVIDUAL_COUNT;GEODETIC_DATUM_ASSUMED_WGS84;DIFFERENT_OWNER_INSTITUTION"
36.683333,7.583333,"Pilea rivularis",2517733727,"c. 20 km W of Jimma.","ETH",NA,1965,"PRESERVED_SPECIMEN","INSTITUTION_MATCH_FUZZY;INSTITUTION_COLLECTION_MISMATCH"
28.683333,-2.25,"Pilea rivularis",2517744846,"Prov.: Kivu, Territ. Kalehe, Kahusi.","COD",NA,1959,"PRESERVED_SPECIMEN","INSTITUTION_MATCH_FUZZY;INSTITUTION_COLLECTION_MISMATCH"
9.7,5,"Pilea rivularis",912109421,"Base of Ndip waterfall.","CMR",NA,1998,"PRESERVED_SPECIMEN","GEODETIC_DATUM_ASSUMED_WGS84;CONTINENT_DERIVED_FROM_COORDINATES;INSTITUTION_MATCH_FUZZY;COLLECTION_MATCH_FUZZY"
10.42,6.02,"Pilea rivularis",912167312,"Above lake Oku.","CMR",NA,1951,"PRESERVED_SPECIMEN","GEODETIC_DATUM_ASSUMED_WGS84;CONTINENT_DERIVED_FROM_COORDINATES;INSTITUTION_MATCH_FUZZY;COLLECTION_MATCH_FUZZY"
37.684167,-6.9025,"Pilea rivularis",4031753526,"Uluguru North Forest Reserve, permanent sample plot 1 (near Mwele River).","TZA",NA,2009,"PRESERVED_SPECIMEN","OCCURRENCE_STATUS_INFERRED_FROM_INDIVIDUAL_COUNT;COORDINATE_ROUNDED;GEODETIC_DATUM_ASSUMED_WGS84;INSTITUTION_MATCH_FUZZY;COLLECTION_MATCH_NONE"
10.11,5.85,"Pilea rivularis",912180406,"Near Sham-n-gum rockface by cave used during the 1952 Bah-Widdekum war.","CMR",NA,2001,"PRESERVED_SPECIMEN","GEODETIC_DATUM_ASSUMED_WGS84;CONTINENT_DERIVED_FROM_COORDINATES;INSTITUTION_MATCH_FUZZY;COLLECTION_MATCH_FUZZY"
9.18,4.17,"Pilea rivularis",912087018,"","CMR",NA,1992,"PRESERVED_SPECIMEN","GEODETIC_DATUM_ASSUMED_WGS84;CONTINENT_DERIVED_FROM_COORDINATES;INSTITUTION_MATCH_FUZZY;COLLECTION_MATCH_FUZZY"
37.04,-15.39,"Pilea rivularis",912493508,"Mt Namuli. Muretha Plateau","MOZ",NA,2007,"PRESERVED_SPECIMEN","GEODETIC_DATUM_ASSUMED_WGS84;CONTINENT_DERIVED_FROM_COORDINATES;INSTITUTION_MATCH_FUZZY;COLLECTION_MATCH_FUZZY"
9.13,4.1,"Pilea rivularis",912087024,"","CMR",NA,1992,"PRESERVED_SPECIMEN","GEODETIC_DATUM_ASSUMED_WGS84;CONTINENT_DERIVED_FROM_COORDINATES;INSTITUTION_MATCH_FUZZY;COLLECTION_MATCH_FUZZY"
9.95,5.63,"Pilea rivularis",912468607,"Ntoo forest at Fosimondi Forest.","CMR",NA,2006,"PRESERVED_SPECIMEN","GEODETIC_DATUM_ASSUMED_WGS84;CONTINENT_DERIVED_FROM_COORDINATES;INSTITUTION_MATCH_FUZZY;COLLECTION_MATCH_FUZZY"
29.12,-2.29,"Pilea rivularis",1098572831,"Uwinka","RWA",NA,1959,"PRESERVED_SPECIMEN","CONTINENT_DERIVED_FROM_COORDINATES;INSTITUTION_MATCH_FUZZY;COLLECTION_MATCH_NONE"
28.41,-2.15,"Pilea rivularis",1098573216,"Mont Kahuzi","COD",NA,1971,"PRESERVED_SPECIMEN","CONTINENT_DERIVED_FROM_COORDINATES;INSTITUTION_MATCH_FUZZY;COLLECTION_MATCH_NONE"
29.394535,-2.529165,"Pilea rivularis",3456816259,"","RWA",NA,2021,"HUMAN_OBSERVATION","CONTINENT_DERIVED_FROM_COORDINATES"
47.18333,-20.81666,"Pilea rivularis",1261917965,"Forêt d'Ambatofitorahana, route de Fianarantsoa à Ambositra","MDG",NA,1960,"PRESERVED_SPECIMEN","GEODETIC_DATUM_ASSUMED_WGS84;DIFFERENT_OWNER_INSTITUTION"
36.14,7.16,"Pilea rivularis",2252208963,"Bonga","ETH",NA,1965,"PRESERVED_SPECIMEN","GEODETIC_DATUM_ASSUMED_WGS84;CONTINENT_DERIVED_FROM_COORDINATES"
36.633333,7.583333,"Pilea rivularis",2515888486,"Kaffa prov. Belleta forest, some 40 km S.W. of Jimma along Bonga road.","ETH",NA,1970,"PRESERVED_SPECIMEN","INSTITUTION_MATCH_FUZZY;INSTITUTION_COLLECTION_MISMATCH"
37.066667,-1.033333,"Pilea rivularis",2517440842,"Thika, near Chania Falls, below Blue Posts Hotel.","KEN",NA,1970,"PRESERVED_SPECIMEN","INSTITUTION_MATCH_FUZZY;INSTITUTION_COLLECTION_MISMATCH"
28.4,-2.23,"Pilea rivularis",1835599707,"Mont Biega","COD",NA,1973,"PRESERVED_SPECIMEN","CONTINENT_DERIVED_FROM_COORDINATES;INSTITUTION_MATCH_FUZZY;COLLECTION_MATCH_NONE;MULTIMEDIA_URI_INVALID"
28.883333,-1.783333,"Pilea rivularis",1840389345,"Numbi-Tshandje Territoire de Kalehe","COD",NA,1959,"PRESERVED_SPECIMEN","GEODETIC_DATUM_ASSUMED_WGS84;CONTINENT_DERIVED_FROM_COORDINATES;INSTITUTION_MATCH_FUZZY;COLLECTION_MATCH_FUZZY"
29.366667,-1.866667,"Pilea rivularis",1840389444,"Gisenyi-Kibuye Km 40, Préfect. Gisenyi","RWA",NA,1972,"PRESERVED_SPECIMEN","GEODETIC_DATUM_ASSUMED_WGS84;CONTINENT_DERIVED_FROM_COORDINATES;INSTITUTION_MATCH_FUZZY;COLLECTION_MATCH_FUZZY"
30.366667,0.566667,"Pilea rivularis",1839546996,"District: Kabarole District, Burahya County. Kibale National Park. Near Kanyawara. In forest on trail no. 8, in valley","UGA",NA,1995,"PRESERVED_SPECIMEN","GEODETIC_DATUM_ASSUMED_WGS84;CONTINENT_DERIVED_FROM_COORDINATES;INSTITUTION_MATCH_FUZZY;COLLECTION_MATCH_FUZZY"
8.85,3.666667,"Pilea rivularis",2517307004,"","GNQ",NA,1986,"PRESERVED_SPECIMEN","INSTITUTION_MATCH_FUZZY;INSTITUTION_COLLECTION_MISMATCH"
29.8,0.35,"Pilea rivularis",1840389290,"Parc National Virunga, massif du Ruwenzori, entre Mutwanga et le gîte Kalonge","COD",NA,1977,"PRESERVED_SPECIMEN","GEODETIC_DATUM_ASSUMED_WGS84;CONTINENT_DERIVED_FROM_COORDINATES;INSTITUTION_MATCH_FUZZY;COLLECTION_MATCH_FUZZY"
29.15,-2.5,"Pilea rivularis",1839532805,"Kamiranzovu","RWA",NA,1956,"PRESERVED_SPECIMEN","GEODETIC_DATUM_ASSUMED_WGS84;CONTINENT_DERIVED_FROM_COORDINATES;INSTITUTION_MATCH_FUZZY;COLLECTION_MATCH_FUZZY"
35.45,8.05,"Pilea rivularis",1840389278,"About 20 km S of Gore, along the Gore-Moccha-track","ETH",NA,1972,"PRESERVED_SPECIMEN","GEODETIC_DATUM_ASSUMED_WGS84;CONTINENT_DERIVED_FROM_COORDINATES;INSTITUTION_MATCH_FUZZY;COLLECTION_MATCH_FUZZY"
28.616667,-2,"Pilea rivularis",1840389394,"Mulungu, Forêt de la Tshinganda, Km 42 route Kavumu-Walikale, Territoire de Kalehe","COD",NA,1999,"PRESERVED_SPECIMEN","GEODETIC_DATUM_ASSUMED_WGS84;CONTINENT_DERIVED_FROM_COORDINATES;INSTITUTION_MATCH_FUZZY;COLLECTION_MATCH_FUZZY"
37.15656,-0.27489,"Pilea rivularis",2397828498,"Thegu Upper","KEN",NA,2018,"HUMAN_OBSERVATION",""
36.80864,-0.49586,"Pilea rivularis",2397827178,"Gura Upper","KEN",NA,2018,"HUMAN_OBSERVATION",""
37.17047,-0.29444,"Pilea rivularis",2397828819,"Sagana Upper","KEN",NA,2018,"HUMAN_OBSERVATION",""
