"lon","lat","species","gbifID","locality","countryCode","coordinateUncertaintyInMeters","year","basisOfRecord","issue"
-132.433333,53.583333,"Poa laxiflora",2242331725,"Queen Charlotte Islands [Haida Gwaii], Moresby Island, Towustasin Hill, Collinson Lake","CAN",NA,1997,"PRESERVED_SPECIMEN","GEODETIC_DATUM_ASSUMED_WGS84;GEODETIC_DATUM_INVALID;CONTINENT_DERIVED_FROM_COORDINATES;INSTITUTION_MATCH_NONE"
-130.366667,53.916667,"Poa laxiflora",1988219750,"Porcher Island, Egeria Mountain, southern bowl","CAN",NA,1987,"PRESERVED_SPECIMEN","GEODETIC_DATUM_ASSUMED_WGS84;GEODETIC_DATUM_INVALID;CONTINENT_DERIVED_FROM_COORDINATES;INSTITUTION_MATCH_NONE"
-123.9302,43.2216,"Poa laxiflora",1986959371,"Cherry Creek Research Natural Area and Big Tree Recreation Area;","USA",NA,1998,"PRESERVED_SPECIMEN","GEODETIC_DATUM_ASSUMED_WGS84;CONTINENT_DERIVED_FROM_COORDINATES;COLLECTION_MATCH_FUZZY"
-123.386667,45.441667,"Poa laxiflora",1986958298,"In the Coast Range ca. 6.5 miles W of Cherry grove on the SW side of Barney Reservoir.","USA",NA,1990,"PRESERVED_SPECIMEN","COORDINATE_ROUNDED;GEODETIC_DATUM_ASSUMED_WGS84;CONTINENT_DERIVED_FROM_COORDINATES;COLLECTION_MATCH_FUZZY"
-116.616667,60.85,"Poa laxiflora",883385115,"Heart Lake Biological Station","CAN",2216,1972,"PRESERVED_SPECIMEN","OCCURRENCE_STATUS_INFERRED_FROM_INDIVIDUAL_COUNT;GEODETIC_DATUM_ASSUMED_WGS84;GEODETIC_DATUM_INVALID;INSTITUTION_MATCH_FUZZY;COLLECTION_MATCH_NONE"
-123.57,53.950001,"Poa laxiflora",3968999052,"British Columbia, Along Finmore Road, W of Prince George, S of Stuart River Provincial park, N of Beverly Lake Forest Service Road","CAN",NA,2007,"PRESERVED_SPECIMEN","COORDINATE_ROUNDED;GEODETIC_DATUM_ASSUMED_WGS84;CONTINENT_DERIVED_FROM_COORDINATES"
-123.662721,44.136321,"Poa laxiflora",3820547612,"1.2 miles SW of Windy Peak; Coast Range.","USA",201,1988,"PRESERVED_SPECIMEN","COORDINATE_ROUNDED;CONTINENT_DERIVED_FROM_COORDINATES;DIFFERENT_OWNER_INSTITUTION"
-123.8788,46.1292,"Poa laxiflora",3820544120,"Ecola-Tillamook Head; Lewis and Clark National Historical Park.","USA",805,2009,"PRESERVED_SPECIMEN","CONTINENT_DERIVED_FROM_COORDINATES;DIFFERENT_OWNER_INSTITUTION"
-123.814053,44.410116,"Poa laxiflora",3820530187,"west of Alsea, along Scott Cr.","USA",201,1980,"PRESERVED_SPECIMEN","COORDINATE_ROUNDED;CONTINENT_DERIVED_FROM_COORDINATES;DIFFERENT_OWNER_INSTITUTION"
-123.60444,44.475318,"Poa laxiflora",3820549923,"Bureau of Land Management ()&C) land, near North Fork of Alsea River, ca. 3.25 airline miles southwest of Mary's Peak.","USA",201,1979,"PRESERVED_SPECIMEN","COORDINATE_ROUNDED;CONTINENT_DERIVED_FROM_COORDINATES;DIFFERENT_OWNER_INSTITUTION"
-123.55,44.5044,"Poa laxiflora",3820536060,"Mary's Peak, Siuslaw National Forest campground, near the summit grassland bald.","USA",1609,1980,"PRESERVED_SPECIMEN","GEODETIC_DATUM_ASSUMED_WGS84;CONTINENT_DERIVED_FROM_COORDINATES;DIFFERENT_OWNER_INSTITUTION"
-123.680053,44.23239,"Poa laxiflora",3820671581,"about 16 miles northeast of Swisshome along Deadwood Cr.","USA",402,1980,"PRESERVED_SPECIMEN","COORDINATE_ROUNDED;CONTINENT_DERIVED_FROM_COORDINATES;DIFFERENT_OWNER_INSTITUTION"
-123.553508,45.232554,"Poa laxiflora",3820659936,"near Rye Mountain.","USA",201,1978,"PRESERVED_SPECIMEN","COORDINATE_ROUNDED;CONTINENT_DERIVED_FROM_COORDINATES;DIFFERENT_OWNER_INSTITUTION"
-123.89432,45.09484,"Poa laxiflora",3820655270,"Siuslaw National Forest, Hebo Ranger Distr.; near FS Rd. 116.","USA",805,1991,"PRESERVED_SPECIMEN","CONTINENT_DERIVED_FROM_COORDINATES;DIFFERENT_OWNER_INSTITUTION"
-123.92909,43.48223,"Poa laxiflora",3820665978,"Golden and Silver Falls state Park, 10 mi. NE of Allegany at end of Co. 48.","USA",805,1988,"PRESERVED_SPECIMEN","CONTINENT_DERIVED_FROM_COORDINATES;DIFFERENT_OWNER_INSTITUTION"
-121.833951,45.307578,"Poa laxiflora",3820640203,"Mt. Hood National Forest, Camp Creek south of Laurel Hill.","USA",402,1987,"PRESERVED_SPECIMEN","COORDINATE_ROUNDED;CONTINENT_DERIVED_FROM_COORDINATES;DIFFERENT_OWNER_INSTITUTION"
-123.912267,44.851964,"Poa laxiflora",3820540539,"along the north bank of Cedar Creek, ca. 6 miles SE of Siletz Bay.","USA",402,1988,"PRESERVED_SPECIMEN","COORDINATE_ROUNDED;CONTINENT_DERIVED_FROM_COORDINATES;DIFFERENT_OWNER_INSTITUTION"
-123.900619,44.369712,"Poa laxiflora",3820661971,"Siuslaw Natl. For., Waldport Distr.; near Cannibal Mtn., ca. 3 mi. s. of Tidwater on Alsea River; [betw. corner of rd. 58 and Rd. 5862].","USA",402,1990,"PRESERVED_SPECIMEN","COORDINATE_ROUNDED;CONTINENT_DERIVED_FROM_COORDINATES;DIFFERENT_OWNER_INSTITUTION"
-123.496578,45.318536,"Poa laxiflora",3820684324,"Bureau of Land Management Nestucca ACEC (Area of Critical Environmental Concern).","USA",201,1987,"PRESERVED_SPECIMEN","COORDINATE_ROUNDED;CONTINENT_DERIVED_FROM_COORDINATES;DIFFERENT_OWNER_INSTITUTION"
-123.69823,45.13786,"Poa laxiflora",3820704862,"ca. 3 miles east of Little Hebo Mtn., Ead Creek drainage.","USA",805,1987,"PRESERVED_SPECIMEN","CONTINENT_DERIVED_FROM_COORDINATES;DIFFERENT_OWNER_INSTITUTION"
-122.652,44.8678,"Poa laxiflora",1318735068,"Ca. 12 km NE of Stayton. Silver Falls St. Park, South Falls","USA",NA,2000,"PRESERVED_SPECIMEN","GEODETIC_DATUM_ASSUMED_WGS84"
-134.337653,57.148027,"Poa laxiflora",2859276766,"Admirality Island, S part, Chapin Bay, W side near tip of N-S oriented peninsula","USA",650,1981,"PRESERVED_SPECIMEN","CONTINENT_DERIVED_FROM_COORDINATES;INSTITUTION_MATCH_FUZZY;INSTITUTION_COLLECTION_MISMATCH"
-132.566667,53.266667,"Poa laxiflora",1949554784,"Queen Charlotte Islands: N of Van Inlet","CAN",NA,1980,"PRESERVED_SPECIMEN","OCCURRENCE_STATUS_INFERRED_FROM_INDIVIDUAL_COUNT;COORDINATE_ROUNDED;GEODETIC_DATUM_ASSUMED_WGS84;DIFFERENT_OWNER_INSTITUTION"
-131.8,54.066667,"Poa laxiflora",1949619595,"Graham Island; Tow Hill: At base of Tow Hill.","CAN",NA,1997,"PRESERVED_SPECIMEN","OCCURRENCE_STATUS_INFERRED_FROM_INDIVIDUAL_COUNT;COORDINATE_ROUNDED;GEODETIC_DATUM_ASSUMED_WGS84;DIFFERENT_OWNER_INSTITUTION"
-119.133333,53.883333,"Poa laxiflora",1949612708,"Grande Cache; Caw Ridge: Caw Ridge ca 20 miles NW of Grande Cache","CAN",NA,1975,"PRESERVED_SPECIMEN","OCCURRENCE_STATUS_INFERRED_FROM_INDIVIDUAL_COUNT;COORDINATE_ROUNDED;GEODETIC_DATUM_ASSUMED_WGS84;DIFFERENT_OWNER_INSTITUTION"
-132.416667,53.333333,"Poa laxiflora",1949649095,"Port Chanal: Graham Island, Queen Charlotte Islands","CAN",NA,1979,"PRESERVED_SPECIMEN","OCCURRENCE_STATUS_INFERRED_FROM_INDIVIDUAL_COUNT;COORDINATE_ROUNDED;GEODETIC_DATUM_ASSUMED_WGS84;DIFFERENT_OWNER_INSTITUTION"
-128.430556,50.783333,"Poa laxiflora",1949571662,"Cape Scott: near lighthouse","CAN",NA,1982,"PRESERVED_SPECIMEN","OCCURRENCE_STATUS_INFERRED_FROM_INDIVIDUAL_COUNT;COORDINATE_ROUNDED;GEODETIC_DATUM_ASSUMED_WGS84;DIFFERENT_OWNER_INSTITUTION"
-127.25,55.266667,"Poa laxiflora",1949654549,"Babine Mountains, British Columbia: Babine Mountains, Mt. Harvey","CAN",NA,2009,"PRESERVED_SPECIMEN","OCCURRENCE_STATUS_INFERRED_FROM_INDIVIDUAL_COUNT;COORDINATE_ROUNDED;GEODETIC_DATUM_ASSUMED_WGS84;DIFFERENT_OWNER_INSTITUTION"
-131.166667,57.9,"Poa laxiflora",1949613470,"Telegraph Creek: slopes above Day's Ranch","CAN",NA,1980,"PRESERVED_SPECIMEN","OCCURRENCE_STATUS_INFERRED_FROM_INDIVIDUAL_COUNT;COORDINATE_ROUNDED;GEODETIC_DATUM_ASSUMED_WGS84;DIFFERENT_OWNER_INSTITUTION"
-123,50.483333,"Poa laxiflora",1949649380,"Lilloet River: ca. 15 miles W of Pemberton","CAN",NA,1980,"PRESERVED_SPECIMEN","OCCURRENCE_STATUS_INFERRED_FROM_INDIVIDUAL_COUNT;COORDINATE_ROUNDED;GEODETIC_DATUM_ASSUMED_WGS84;DIFFERENT_OWNER_INSTITUTION"
-132.483333,53.35,"Poa laxiflora",1949652647,"Graham Island; Shields Bay: 10 km SW of","CAN",NA,1980,"PRESERVED_SPECIMEN","OCCURRENCE_STATUS_INFERRED_FROM_INDIVIDUAL_COUNT;COORDINATE_ROUNDED;GEODETIC_DATUM_ASSUMED_WGS84;DIFFERENT_OWNER_INSTITUTION"
-132.066667,52.933333,"Poa laxiflora",1949610981,"Moresby Island; Takakia Lake: avalanche chute, N face of ridge near lake","CAN",NA,1980,"PRESERVED_SPECIMEN","OCCURRENCE_STATUS_INFERRED_FROM_INDIVIDUAL_COUNT;COORDINATE_ROUNDED;GEODETIC_DATUM_ASSUMED_WGS84;DIFFERENT_OWNER_INSTITUTION"
-142.917617,60.094367,"Poa laxiflora",1146266318,"vic. Kaliakh R. mouth, Bering Glacier Quad","USA",1000,2008,"PRESERVED_SPECIMEN","COORDINATE_ROUNDED;CONTINENT_DERIVED_FROM_COORDINATES;AMBIGUOUS_INSTITUTION"
-134.58,57.31,"Poa laxiflora",1146335765,"Alexander Archipelago, Chaik Bay, Admiralty I., N side of bay about 1.25 mile E of the mouth of bay (Village Pt.), Sitka Quad, Admiralty Island National Monument, Alexander Archipelago, Admiralty Island","USA",3615,1981,"PRESERVED_SPECIMEN","GEODETIC_DATUM_ASSUMED_WGS84;GEODETIC_DATUM_INVALID;CONTINENT_DERIVED_FROM_COORDINATES;AMBIGUOUS_INSTITUTION"
-143.8731388,59.9880063,"Poa laxiflora",1146242632,"Kiklukh R. mouth, just E of Cape Suckling, Icy Bay Quad","USA",NA,2004,"PRESERVED_SPECIMEN","COORDINATE_REPROJECTED;COORDINATE_ROUNDED;CONTINENT_DERIVED_FROM_COORDINATES;AMBIGUOUS_INSTITUTION"
-133.25,57.28,"Poa laxiflora",1146222046,"Port Houghton near Sandborn Canal, S side, ca. 1 mile upstream from tidal flats, Sumdum Quad, Tongass National Forest, Alexander Archipelago","USA",3615,1981,"PRESERVED_SPECIMEN","GEODETIC_DATUM_ASSUMED_WGS84;GEODETIC_DATUM_INVALID;CONTINENT_DERIVED_FROM_COORDINATES;AMBIGUOUS_INSTITUTION"
-133.6524,55.73844,"Poa laxiflora",1146315940,"W coast of island, beach N of White Cliff Island - Sea Otter Sound, Craig Quad, Alexander Archipelago, Heceta Island","USA",NA,2010,"PRESERVED_SPECIMEN","CONTINENT_DERIVED_FROM_COORDINATES;AMBIGUOUS_INSTITUTION"
-143.64,60.03,"Poa laxiflora",1146386222,"Bering Gl. foreland, Tasalich R. mouth, Bering Glacier Quad","USA",3615,2003,"PRESERVED_SPECIMEN","GEODETIC_DATUM_ASSUMED_WGS84;GEODETIC_DATUM_INVALID;CONTINENT_DERIVED_FROM_COORDINATES;AMBIGUOUS_INSTITUTION"
-134.540738,57.338675,"Poa laxiflora",1259979226,"Tongass National Forest Admiralty Island SW side. Chaik Bay. N side of bay about 1 1/4 mile E of the mouth of the bay (Village Pt.) Steep gravelly beach adjacent to forest, almost no ecotone.","USA",NA,1981,"PRESERVED_SPECIMEN","GEODETIC_DATUM_ASSUMED_WGS84;INSTITUTION_MATCH_FUZZY;COLLECTION_MATCH_NONE"
-134.31,57.13,"Poa laxiflora",1146335735,"Alexander Archipelago, Chapin Bay, Admiralty I., W side, near tip of N-S oriented peninsula, Sitka Quad, Admiralty Island National Monument, Alexander Archipelago, Admiralty Island","USA",3615,1981,"PRESERVED_SPECIMEN","GEODETIC_DATUM_ASSUMED_WGS84;GEODETIC_DATUM_INVALID;CONTINENT_DERIVED_FROM_COORDINATES;AMBIGUOUS_INSTITUTION"
-135.783333,57.316667,"Poa laxiflora",1146228834,"Kruzof I., Kalinin Bay, E side of Bay, Sitka Quad, Tongass National Forest","USA",NA,2002,"PRESERVED_SPECIMEN","COORDINATE_ROUNDED;GEODETIC_DATUM_ASSUMED_WGS84;GEODETIC_DATUM_INVALID;CONTINENT_DERIVED_FROM_COORDINATES;AMBIGUOUS_INSTITUTION"
-139.495256,59.586042,"Poa laxiflora",1146322096,"Yakutat area, just past 9 Mile Bog where Hw 10 crosses the Situk R., S side of road, parking area for Situk boat launch, Yakutat Quad","USA",NA,1995,"PRESERVED_SPECIMEN","CONTINENT_DERIVED_FROM_COORDINATES;AMBIGUOUS_INSTITUTION"
-133.11,57.33,"Poa laxiflora",1146335713,"Coast Mts., Port Houghton Head, near head where river enters the bay from S, Sumdum Quad, Tongass National Forest, Alexander Archipelago","USA",3615,1981,"PRESERVED_SPECIMEN","GEODETIC_DATUM_ASSUMED_WGS84;GEODETIC_DATUM_INVALID;CONTINENT_DERIVED_FROM_COORDINATES;AMBIGUOUS_INSTITUTION"
-134.8,56.87,"Poa laxiflora",1146393988,"Alexander Archipelago, Red Bluff Bay, E coast Baranof I., at head of bay, Port Alexander Quad","USA",3615,2003,"PRESERVED_SPECIMEN","TYPE_STATUS_INVALID;GEODETIC_DATUM_ASSUMED_WGS84;GEODETIC_DATUM_INVALID;CONTINENT_DERIVED_FROM_COORDINATES;AMBIGUOUS_INSTITUTION"
-139.56,59.45,"Poa laxiflora",1146352131,"Yakutat Foreland, Situk R. landing, Yakutat Quad, Tongass National Forest","USA",3615,1991,"PRESERVED_SPECIMEN","GEODETIC_DATUM_ASSUMED_WGS84;GEODETIC_DATUM_INVALID;CONTINENT_DERIVED_FROM_COORDINATES;AMBIGUOUS_INSTITUTION"
