"lon","lat","species","gbifID","locality","countryCode","coordinateUncertaintyInMeters","year","basisOfRecord","issue"
-110.222,34.0482,"Polygonum ramosissimum",2270606841,"US Hwy 60, 5.3 mi northeast Carrizo.","USA",NA,1975,"PRESERVED_SPECIMEN","GEODETIC_DATUM_ASSUMED_WGS84;CONTINENT_DERIVED_FROM_COORDINATES;INSTITUTION_MATCH_FUZZY;INSTITUTION_COLLECTION_MISMATCH"
-112.788338,53.525256,"Polygonum ramosissimum",883417603,"","CAN",284,1996,"PRESERVED_SPECIMEN","OCCURRENCE_STATUS_INFERRED_FROM_INDIVIDUAL_COUNT;INSTITUTION_MATCH_FUZZY;COLLECTION_MATCH_NONE"
-112.9084,53.4181,"Polygonum ramosissimum",883417874,"Hastings Lake","CAN",4200,1964,"PRESERVED_SPECIMEN","OCCURRENCE_STATUS_INFERRED_FROM_INDIVIDUAL_COUNT;INSTITUTION_MATCH_FUZZY;COLLECTION_MATCH_NONE"
-111.89005,50.44763,"Polygonum ramosissimum",1699899667,"","CAN",3,2014,"PRESERVED_SPECIMEN","OCCURRENCE_STATUS_INFERRED_FROM_INDIVIDUAL_COUNT;INSTITUTION_MATCH_FUZZY;COLLECTION_MATCH_NONE"
-112.246419,51.923712,"Polygonum ramosissimum",883412332,"Spiers Lake National Wildlife Area","CAN",284,2004,"PRESERVED_SPECIMEN","OCCURRENCE_STATUS_INFERRED_FROM_INDIVIDUAL_COUNT;INSTITUTION_MATCH_FUZZY;COLLECTION_MATCH_NONE"
-111.73,40.5725,"Polygonum ramosissimum",2859083600,"W of Alta, along SR 210 in Little Cottonwood Canyon, Wasatch-Cache National Forest","USA",100,2004,"PRESERVED_SPECIMEN","CONTINENT_DERIVED_FROM_COORDINATES;INSTITUTION_MATCH_FUZZY;INSTITUTION_COLLECTION_MISMATCH"
-79.6328,40.97286,"Polygonum ramosissimum",2859088529,"2 km SSW of East Brady","USA",2125,1994,"PRESERVED_SPECIMEN","CONTINENT_DERIVED_FROM_COORDINATES;INSTITUTION_MATCH_FUZZY;INSTITUTION_COLLECTION_MISMATCH"
-82.433333,52.916667,"Polygonum ramosissimum",2859079092,"Attawapiskat","CAN",3036,1952,"PRESERVED_SPECIMEN","CONTINENT_DERIVED_FROM_COORDINATES;INSTITUTION_MATCH_FUZZY;INSTITUTION_COLLECTION_MISMATCH"
-111.659444,40.722778,"Polygonum ramosissimum",2859093558,"2.1 km SSE of mouth of Lambs Canyon, Wasatch-Cache National Forest","USA",NA,1999,"PRESERVED_SPECIMEN","COORDINATE_ROUNDED;CONTINENT_DERIVED_FROM_COORDINATES;INSTITUTION_MATCH_FUZZY;INSTITUTION_COLLECTION_MISMATCH"
-97.55479,31.19037,"Polygonum ramosissimum",3978713523,"Training Area 23, at Pond 23B, 0.2 miles southeast of Union Hill Road, on dirt road that is 1.2 miles north of Rappelling Cliff Road.","USA",NA,2007,"PRESERVED_SPECIMEN","GEODETIC_DATUM_ASSUMED_WGS84;CONTINENT_DERIVED_FROM_COORDINATES;INSTITUTION_MATCH_FUZZY;COLLECTION_MATCH_FUZZY"
-101.885317,37.126582,"Polygonum ramosissimum",1931068413,"9 mi N Elkhart; bluffs along Cimarron River","USA",NA,1951,"PRESERVED_SPECIMEN","COLLECTION_MATCH_FUZZY"
-111.716667,49.016667,"Polygonum ramosissimum",894994643,"off highway 500, southwest arm of Van Cleeve coulee 10 km SSW of Wier Bridge","CAN",NA,1992,"PRESERVED_SPECIMEN","COORDINATE_ROUNDED;GEODETIC_DATUM_ASSUMED_WGS84;CONTINENT_DERIVED_FROM_COORDINATES;INSTITUTION_MATCH_FUZZY;COLLECTION_MATCH_FUZZY"
-96.793056,47.08,"Polygonum ramosissimum",2265376317,"Georgetown (Clay Co.);;;;","USA",3036,1959,"PRESERVED_SPECIMEN","GEODETIC_DATUM_ASSUMED_WGS84;CONTINENT_DERIVED_FROM_COORDINATES;AMBIGUOUS_COLLECTION"
-94.702222,43.92,"Polygonum ramosissimum",2265429643,"Watonwan County...On the north side of Kansas Lake, about 5 miles southwest of St. James...T 105N R 32W NE1/4 of NE1/4 of Sec 8. 105N 32W 8","USA",NA,1992,"PRESERVED_SPECIMEN","COORDINATE_ROUNDED;GEODETIC_DATUM_ASSUMED_WGS84;CONTINENT_DERIVED_FROM_COORDINATES;AMBIGUOUS_COLLECTION"
-94.032276,44.150847,"Polygonum ramosissimum",2265375836,"Blue Earth County...Growing along the Blue Earth River 1 mi south of Mankato;;108N;27W;00","USA",5241,1958,"PRESERVED_SPECIMEN","GEODETIC_DATUM_ASSUMED_WGS84;CONTINENT_DERIVED_FROM_COORDINATES;AMBIGUOUS_COLLECTION"
-94.861224,48.880239,"Polygonum ramosissimum",2265379050,"Lake of the Woods County...Zipple Bay State Park...south shore of Lake of the Woods. SE1/4 SW1/4 Sec. 2 T162N R33W;Zippel Bay State Park;162N;33W;02","USA",969,1983,"PRESERVED_SPECIMEN","GEODETIC_DATUM_ASSUMED_WGS84;CONTINENT_DERIVED_FROM_COORDINATES;AMBIGUOUS_COLLECTION"
-96.278112,45.21835,"Polygonum ramosissimum",2265375775,"T120N R45W S1/2 SE1/4 Sec. 10;;120N;45W;10","USA",1067,1978,"PRESERVED_SPECIMEN","GEODETIC_DATUM_ASSUMED_WGS84;CONTINENT_DERIVED_FROM_COORDINATES;AMBIGUOUS_COLLECTION"
-94.773299,48.851639,"Polygonum ramosissimum",2265376819,"Morris Point sandbar; T162N R32W Sec. 16;;162N;32W;16","USA",969,1979,"PRESERVED_SPECIMEN","GEODETIC_DATUM_ASSUMED_WGS84;CONTINENT_DERIVED_FROM_COORDINATES;AMBIGUOUS_COLLECTION"
-95.231648,47.879004,"Polygonum ramosissimum",2265377842,"Lower Red Lake, shore of lake; T151N R36W SW1/4 Sec. 23;Red Lake Indian Reservation;151N;36W;23","USA",499,1976,"PRESERVED_SPECIMEN","GEODETIC_DATUM_ASSUMED_WGS84;CONTINENT_DERIVED_FROM_COORDINATES;AMBIGUOUS_COLLECTION"
-91.265964,43.725045,"Polygonum ramosissimum",2265377745,"Upper Mississippi National Wildlife Refuge. Houston Co.; Island 13; Mississippi River mile #691; T103N R4W Sec 13...Large island W side of main channel, north end of island. 103N 04W 13","USA",969,1975,"PRESERVED_SPECIMEN","GEODETIC_DATUM_ASSUMED_WGS84;CONTINENT_DERIVED_FROM_COORDINATES;AMBIGUOUS_COLLECTION"
-96.654501,45.419226,"Polygonum ramosissimum",2265377023,"Ca. 14 mi NW of Ortonville, N of rte 7, N of hill overlooking Big Stone Lake; NW1/4 SW1/4 Sec. 35 T123N R48W (Foster Twp Ca. 14 mi NW of Ortonville, N of rte 7, N of hill overlooking Big Stone Lake; NW1/4 SW1/4 Sec. 35 T123N R48W (Foster Twp.). 123N 48W 35","USA",236,1988,"PRESERVED_SPECIMEN","GEODETIC_DATUM_ASSUMED_WGS84;CONTINENT_DERIVED_FROM_COORDINATES;AMBIGUOUS_COLLECTION"
-94.203333,44.217222,"Polygonum ramosissimum",2265410261,"Swan Lake Wildlife Management Area. Nicollet County...Swan Lake State Wildlife Management Area - North Star Supplement. About 1.5 miles north-northwest of Judson...T 109N R 28W NE1/4 of SW1/4 of Sec 28. 109N 28W 28","USA",NA,1992,"PRESERVED_SPECIMEN","COORDINATE_ROUNDED;GEODETIC_DATUM_ASSUMED_WGS84;CONTINENT_DERIVED_FROM_COORDINATES;AMBIGUOUS_COLLECTION"
-96.44368,44.972372,"Polygonum ramosissimum",2265377844,"Salt Lake, ca. 3.5 mi SW of Marietta, near shore of lake; T117N R46W Sec. 5;;117N;46W;5","USA",969,1979,"PRESERVED_SPECIMEN","GEODETIC_DATUM_ASSUMED_WGS84;CONTINENT_DERIVED_FROM_COORDINATES;AMBIGUOUS_COLLECTION"
-95.884446,45.018427,"Polygonum ramosissimum",2265378064,"Ca. 15 mi E of Madison; NE of rte 33. Lac Qui Parle River. Lac Qui Parle Township. N1/2 NE1/4 of section;Lac Qui Parle State Park;118N;42W;23","USA",2712,1988,"PRESERVED_SPECIMEN","GEODETIC_DATUM_ASSUMED_WGS84;CONTINENT_DERIVED_FROM_COORDINATES;AMBIGUOUS_COLLECTION"
-92.820776,44.698712,"Polygonum ramosissimum",2265377443,"Dakota County...valley 2 mi SE of Hastings, N of highway 316. T 114N, R 17W, W 1/2 NE 1/4 sec. 11;;114N;17W;11","USA",426,1992,"PRESERVED_SPECIMEN","GEODETIC_DATUM_ASSUMED_WGS84;CONTINENT_DERIVED_FROM_COORDINATES;AMBIGUOUS_COLLECTION"
-94.344197,46.272931,"Polygonum ramosissimum",2265377289,"Camp Ripley Military Reservation. Camp Ripley Military Reservation, Morrison County... About 1 km E of the junction of Chorwan Road and East Boundary Road. UTM: 396600E 5124800N T132N R29W SE1/4 of SW1/4 of Sec 4. 132N 29W 4","USA",969,1990,"PRESERVED_SPECIMEN","GEODETIC_DATUM_ASSUMED_WGS84;CONTINENT_DERIVED_FROM_COORDINATES;AMBIGUOUS_COLLECTION"
-96.169863,47.723313,"Polygonum ramosissimum",2265376046,"Polk Co., T149N R43W NW1/4 of the NE1/4 of S16; Mentor Wildlife Management Area.;Mentor Wildlife Management Area;149N;43W;16","USA",969,1995,"PRESERVED_SPECIMEN","GEODETIC_DATUM_ASSUMED_WGS84;CONTINENT_DERIVED_FROM_COORDINATES;AMBIGUOUS_COLLECTION"
-95.245019,45.434262,"Polygonum ramosissimum",2265377380,"Ordway Prairie; T123N R36W NW1/4 NE1/4 Sec. 30;Ordway Prairie, The Nature Conservancy;123N;36W;30","USA",969,1982,"PRESERVED_SPECIMEN","GEODETIC_DATUM_ASSUMED_WGS84;CONTINENT_DERIVED_FROM_COORDINATES;AMBIGUOUS_COLLECTION"
-93.386389,45.931111,"Polygonum ramosissimum",2265452125,"About 5 miles northwest of Mora. NW1/4 of NW1/4 of section;Ann Lake Wildlife Management Area;040N;24W;30","USA",NA,1989,"PRESERVED_SPECIMEN","COORDINATE_ROUNDED;GEODETIC_DATUM_ASSUMED_WGS84;CONTINENT_DERIVED_FROM_COORDINATES;AMBIGUOUS_COLLECTION"
-94.175078,46.576545,"Polygonum ramosissimum",2265376990,"Pelican Lake, Sunset Beach, 13 mi N of Brainerd; Sec. 35 and 36 T136N R28W;;136N;28W;","USA",4374,1977,"PRESERVED_SPECIMEN","GEODETIC_DATUM_ASSUMED_WGS84;CONTINENT_DERIVED_FROM_COORDINATES;AMBIGUOUS_COLLECTION"
-95.453069,44.751831,"Polygonum ramosissimum",2265377642,"Renville Co. Hawk Creek Twp, Sec. 20;;T115N R38W S20","USA",969,1985,"PRESERVED_SPECIMEN","GEODETIC_DATUM_ASSUMED_WGS84;CONTINENT_DERIVED_FROM_COORDINATES;AMBIGUOUS_COLLECTION"
-96.768056,46.874722,"Polygonum ramosissimum",2265376757,"East of Concordia College, Moorhead (Clay Co.);;;;","USA",6333,1958,"PRESERVED_SPECIMEN","GEODETIC_DATUM_ASSUMED_WGS84;CONTINENT_DERIVED_FROM_COORDINATES;AMBIGUOUS_COLLECTION"
-96.235364,46.159245,"Polygonum ramosissimum",2265378040,"Otter Tail Preserve; T131N R44W SW1/4 SE1/4 Sec. 17;Ottertail Prairie Scientific Natural Area;131N;44W;17","USA",969,1982,"PRESERVED_SPECIMEN","GEODETIC_DATUM_ASSUMED_WGS84;CONTINENT_DERIVED_FROM_COORDINATES;AMBIGUOUS_COLLECTION"
-84.741389,45.766156,"Polygonum ramosissimum",1988824874,"On N side of sewage lagoon, Mackinaw City.","USA",368,1979,"PRESERVED_SPECIMEN","GEODETIC_DATUM_ASSUMED_WGS84;TAXON_MATCH_FUZZY"
-83.66667,46,"Polygonum ramosissimum",1989489399,"DRUMMOND ISLAND, Big Shoal beach, near S edge sec. 18, T41N, R7E.","USA",NA,1994,"PRESERVED_SPECIMEN","GEODETIC_DATUM_ASSUMED_WGS84"
-85.244772,45.337016,"Polygonum ramosissimum",1989066974,"at North Point, sec. 14, Charlevoix Tp., ca. 2 mi. NE of Charlevoix.","USA",527,1990,"PRESERVED_SPECIMEN","GEODETIC_DATUM_ASSUMED_WGS84"
-83.666666,46.000021,"Polygonum ramosissimum",1989454586,"Drummond Island.","USA",15,1961,"PRESERVED_SPECIMEN","GEODETIC_DATUM_ASSUMED_WGS84"
-97.20417,28.47098,"Polygonum ramosissimum",2807630577,"In scarcely perceptible drainageway leading to North St. Nicholas Lake, Both sides of main N-S road on W arm of Welder Ranch, ca. 0.7 airmiles NE of center of North St. Nicholas Lake. Vidaurri Quadrangle.","USA",NA,2003,"PRESERVED_SPECIMEN","GEODETIC_DATUM_ASSUMED_WGS84;INSTITUTION_MATCH_FUZZY;COLLECTION_MATCH_FUZZY"
-104.02668,30.32072,"Polygonum ramosissimum",2807649851,"Just N of house, ca. 0.8-0.9 airmiles NNW of jct. US Rt. 90 and St. Rt. 17 in downtown Marfa. SE part of Mimms Ranch (Dixon Water Foundation). Marfa Quadrangle.","USA",NA,2012,"PRESERVED_SPECIMEN","GEODETIC_DATUM_ASSUMED_WGS84;INSTITUTION_MATCH_FUZZY;COLLECTION_MATCH_FUZZY"
-101.226618,32.520195,"Polygonum ramosissimum",2807595099,"Borden County.","USA",NA,2012,"PRESERVED_SPECIMEN","COORDINATE_ROUNDED;GEODETIC_DATUM_ASSUMED_WGS84;INSTITUTION_MATCH_FUZZY;COLLECTION_MATCH_FUZZY"
-100.217275,33.553853,"Polygonum ramosissimum",2807558935,"King County","USA",NA,2012,"PRESERVED_SPECIMEN","COORDINATE_ROUNDED;GEODETIC_DATUM_ASSUMED_WGS84;INSTITUTION_MATCH_FUZZY;COLLECTION_MATCH_FUZZY"
-98.15072,32.91747,"Polygonum ramosissimum",3336603416,"In northeastern part of Wagley Ranch, ca. 4.4 airmiles W of jct. US Rt. 281 and R.M. 254.","USA",NA,2017,"PRESERVED_SPECIMEN","GEODETIC_DATUM_ASSUMED_WGS84;INSTITUTION_MATCH_FUZZY;COLLECTION_MATCH_FUZZY"
-96.76667,30.32639,"Polygonum ramosissimum",2807375302,"N side of Middle Yegua Creek, along an unimproved park road ca. 0.5 roadmiles SE of its jct. with Co. Rd. 430, which is 2.3 roadmiles E of Co. Rd. 430's jct. with St. Rt. 141 (at Sandy Point Church) SE of New Dime Box; ca. 2.3 airmiles N to NNE of jct. St","USA",NA,1995,"PRESERVED_SPECIMEN","GEODETIC_DATUM_ASSUMED_WGS84;INSTITUTION_MATCH_FUZZY;COLLECTION_MATCH_FUZZY"
-96.00594,33.07208,"Polygonum ramosissimum",2807226616,"W bank of Cowleech Fork of Sabine River at points ca. 0.2-0.3 airmiles NW of Co. Rd. 3128 bridge, E edge of Cowleech Prairie Preserve, ca. 7 miles SE of Greenville.","USA",NA,2011,"PRESERVED_SPECIMEN","GEODETIC_DATUM_ASSUMED_WGS84;INSTITUTION_MATCH_FUZZY;COLLECTION_MATCH_FUZZY"
-98.16389,29.1,"Polygonum ramosissimum",2807352846,"Both sides of Picosa Creek ca. 0.2-0.3 mi N of its mouth at San Antonio River, 0.9-1.0 airmiles SSE of St. Rt. 97 bridge over San Antonio River, Rancho de las Cabras NHS, SW of Floresville. [Flora of San Antonio Missions NHP.].","USA",NA,2001,"PRESERVED_SPECIMEN","GEODETIC_DATUM_ASSUMED_WGS84;INSTITUTION_MATCH_FUZZY;COLLECTION_MATCH_FUZZY"
-91.135,36.901,"Polygonum ramosissimum",1258179619,"Mark Twain National Forest, Pineknot Pinery Restoration Area, east of CR 153, ca. 2.9 miles south of highwaty 60.","USA",NA,2005,"PRESERVED_SPECIMEN","OCCURRENCE_STATUS_INFERRED_FROM_INDIVIDUAL_COUNT;GEODETIC_DATUM_ASSUMED_WGS84;INSTITUTION_MATCH_FUZZY;COLLECTION_MATCH_NONE"
-65.071952,47.768044,"Polygonum ramosissimum",1914319921,"","CAN",3,2018,"HUMAN_OBSERVATION","COORDINATE_ROUNDED;CONTINENT_DERIVED_FROM_COORDINATES"
-79.218611,51.507222,"Polygonum ramosissimum",1248740548,"James Bay, Cabbage Willows","CAN",NA,1954,"PRESERVED_SPECIMEN","GEODETIC_DATUM_ASSUMED_WGS84;INSTITUTION_MATCH_FUZZY;COLLECTION_MATCH_FUZZY"
-79.533333,51.55,"Polygonum ramosissimum",1248740563,"Côte sud de la Baie James, Baie Hannah, Pointe Mesakonan, haut du rivage humide","CAN",NA,1958,"PRESERVED_SPECIMEN","GEODETIC_DATUM_ASSUMED_WGS84;GEODETIC_DATUM_INVALID;INSTITUTION_MATCH_FUZZY;COLLECTION_MATCH_FUZZY"
-79.096389,51.528889,"Polygonum ramosissimum",1248740456,"Côte sud de la Baie James, Pointe Black Bear, prairie côtière","CAN",NA,1955,"PRESERVED_SPECIMEN","GEODETIC_DATUM_ASSUMED_WGS84;GEODETIC_DATUM_INVALID;INSTITUTION_MATCH_FUZZY;COLLECTION_MATCH_FUZZY"
-78.753056,52.550278,"Polygonum ramosissimum",723290959,"Côte est de la Baie James, Baie au sud de Wood Harbour, prairie côtière","CAN",NA,1955,"PRESERVED_SPECIMEN","GEODETIC_DATUM_ASSUMED_WGS84;GEODETIC_DATUM_INVALID;INSTITUTION_MATCH_FUZZY;COLLECTION_MATCH_FUZZY"
-71.282778,46.774722,"Polygonum ramosissimum",668792350,"Québec (Sainte-Foy), entre le boulevard Laurier, la rue Hochelaga et la rue Lavigerie","CAN",NA,1978,"PRESERVED_SPECIMEN","GEODETIC_DATUM_ASSUMED_WGS84;INSTITUTION_MATCH_FUZZY;COLLECTION_MATCH_FUZZY"
-107.842468,32.889078,"Polygonum ramosissimum",3413532335,"Gallinas Canyon Recreation Area","USA",2236,1990,"PRESERVED_SPECIMEN","CONTINENT_DERIVED_FROM_COORDINATES;INSTITUTION_MATCH_FUZZY;COLLECTION_MATCH_FUZZY"
-90.666667,38.683333,"Polygonum ramosissimum",1261879445,"Below US Hwy. 40 bridge over Missouri River, first floodplain terrace on N bank of River.","USA",NA,1994,"PRESERVED_SPECIMEN","OCCURRENCE_STATUS_INFERRED_FROM_INDIVIDUAL_COUNT;COORDINATE_ROUNDED;GEODETIC_DATUM_ASSUMED_WGS84;INSTITUTION_MATCH_FUZZY;COLLECTION_MATCH_NONE"
-151.077982,60.515712,"Polygonum ramosissimum",2465051470,"Soldotna, Wooded Ln. off of Sport Lake Road, Kenai Peninsula","USA",15,2015,"PRESERVED_SPECIMEN","CONTINENT_DERIVED_FROM_COORDINATES;INSTITUTION_MATCH_FUZZY;INSTITUTION_COLLECTION_MISMATCH"
-108.7254,41.687,"Polygonum ramosissimum",1930779101,"Northeast of Point of Rocks","USA",969,1980,"PRESERVED_SPECIMEN","GEODETIC_DATUM_ASSUMED_WGS84;COLLECTION_MATCH_FUZZY"
-88.2,41.39,"Polygonum ramosissimum",4042596826,"Will County,Illinois","USA",NA,2005,"PRESERVED_SPECIMEN","COUNTRY_INVALID;GEODETIC_DATUM_ASSUMED_WGS84;PRESUMED_NEGATED_LONGITUDE;CONTINENT_DERIVED_FROM_COORDINATES;INSTITUTION_MATCH_FUZZY;COLLECTION_MATCH_NONE"
-100.45,42.92,"Polygonum ramosissimum",4042933847,"Cherry County,Nebraska","USA",NA,2009,"PRESERVED_SPECIMEN","COUNTRY_INVALID;GEODETIC_DATUM_ASSUMED_WGS84;PRESUMED_NEGATED_LATITUDE;CONTINENT_DERIVED_FROM_COORDINATES;INSTITUTION_MATCH_FUZZY;COLLECTION_MATCH_NONE"
-96.134775,40.648501,"Polygonum ramosissimum",1929688807,"","USA",NA,1974,"PRESERVED_SPECIMEN","COLLECTION_MATCH_FUZZY"
-104.584386,36.370969,"Polygonum ramosissimum",1930384285,"on north edge of Springer","USA",NA,1969,"PRESERVED_SPECIMEN","COLLECTION_MATCH_FUZZY"
-107.441807,36.709885,"Polygonum ramosissimum",1929477878,"30 miles east of Bloomfield along hwy 17","USA",NA,1973,"PRESERVED_SPECIMEN","COLLECTION_MATCH_FUZZY"
-103.7047,38.6517,"Polygonum ramosissimum",1930359940,"Punkin Center, 14 mi S along CO 71. Prairie on E side of hwy and along County Rd K.","USA",NA,2000,"PRESERVED_SPECIMEN","GEODETIC_DATUM_ASSUMED_WGS84;COLLECTION_MATCH_FUZZY"
-98.029789,42.085152,"Polygonum ramosissimum",1931277147,"along State Hwy 14, 3 miles south of Neligh","USA",NA,2001,"PRESERVED_SPECIMEN","COLLECTION_MATCH_FUZZY"
-104.922497,40.708119,"Polygonum ramosissimum",1928940563,"1.5 mi NE of Wellington, ca 12 mi NE of Fort Collins, State Wildlife Area N of Edson Reservoir","USA",NA,1984,"PRESERVED_SPECIMEN","COLLECTION_MATCH_FUZZY"
-91.98578,33.042082,"Polygonum ramosissimum",1928131451,"Around Meridian Baptist Church west of Ark. 133 and about 2.2 miles north of Louisiana state line","USA",NA,1985,"PRESERVED_SPECIMEN","GEODETIC_DATUM_ASSUMED_WGS84;COLLECTION_MATCH_FUZZY"
-103.324442,32.696656,"Polygonum ramosissimum",1930876836,"Playa lake south side of Hwy. #62 & #180, about 10 mi. w. of Hobbs.","USA",NA,1968,"PRESERVED_SPECIMEN","COLLECTION_MATCH_FUZZY"
-109.14055,36.1714,"Polygonum ramosissimum",3091281495,"Big sage flats above upper Wheatfields Canyon.","USA",NA,2001,"PRESERVED_SPECIMEN","GEODETIC_DATUM_ASSUMED_WGS84;CONTINENT_DERIVED_FROM_COORDINATES;DIFFERENT_OWNER_INSTITUTION"
-109.08333,33.83333,"Polygonum ramosissimum",3091304069,"Along FR 275, N of Alpine","USA",NA,1998,"PRESERVED_SPECIMEN","GEODETIC_DATUM_ASSUMED_WGS84;CONTINENT_DERIVED_FROM_COORDINATES;INSTITUTION_MATCH_FUZZY;COLLECTION_MATCH_NONE"
-109.5556,35.70849,"Polygonum ramosissimum",3091274485,"Hubbell Trading Post National Historic Site, Ganado. Pueblo Colorado Wash at Hubbell Trading Post","USA",NA,2001,"PRESERVED_SPECIMEN","GEODETIC_DATUM_ASSUMED_WGS84;CONTINENT_DERIVED_FROM_COORDINATES;INSTITUTION_MATCH_FUZZY;COLLECTION_MATCH_NONE"
-111.6928,35.3758,"Polygonum ramosissimum",3091304995,"Potato Tank, along FSR 418.","USA",1250,1983,"PRESERVED_SPECIMEN","GEODETIC_DATUM_ASSUMED_WGS84;CONTINENT_DERIVED_FROM_COORDINATES;INSTITUTION_MATCH_FUZZY;COLLECTION_MATCH_NONE"
-111.5336,35.1023,"Polygonum ramosissimum",3091304993,"Prime Lake along FSR 129A, just NE of USGS Observatory (Perkins Telescope).","USA",1250,1983,"PRESERVED_SPECIMEN","GEODETIC_DATUM_ASSUMED_WGS84;CONTINENT_DERIVED_FROM_COORDINATES;INSTITUTION_MATCH_FUZZY;COLLECTION_MATCH_NONE"
-112.502883,35.58825,"Polygonum ramosissimum",3091287179,"Monument Wash about 10 miles south of Tin House and 1.0 mile south of Windy Wilson Tank","USA",NA,2016,"PRESERVED_SPECIMEN","GEODETIC_DATUM_ASSUMED_WGS84;CONTINENT_DERIVED_FROM_COORDINATES;INSTITUTION_MATCH_FUZZY;COLLECTION_MATCH_NONE"
-109.361,38.316,"Polygonum ramosissimum",3091294070,"Lake Powell high water zone at the head of Kane Creek Canyon","USA",NA,2001,"PRESERVED_SPECIMEN","GEODETIC_DATUM_ASSUMED_WGS84;CONTINENT_DERIVED_FROM_COORDINATES;INSTITUTION_MATCH_FUZZY;COLLECTION_MATCH_NONE"
-102.3498776,35.0345225,"Polygonum ramosissimum",3091261097,"El Morro National Monument, gully behind residential area","USA",NA,2007,"PRESERVED_SPECIMEN","COORDINATE_REPROJECTED;CONTINENT_DERIVED_FROM_COORDINATES;INSTITUTION_MATCH_FUZZY;COLLECTION_MATCH_NONE"
-110.8405488,37.0595763,"Polygonum ramosissimum",3091302287,"Cha Canyon","USA",NA,2010,"PRESERVED_SPECIMEN","COORDINATE_REPROJECTED;CONTINENT_DERIVED_FROM_COORDINATES;INSTITUTION_MATCH_FUZZY;COLLECTION_MATCH_NONE"
-110.594271,34.429316,"Polygonum ramosissimum",3091303738,"In Heber, Buckskin Wash at motel on AZ 260","USA",100,1997,"PRESERVED_SPECIMEN","CONTINENT_DERIVED_FROM_COORDINATES;INSTITUTION_MATCH_FUZZY;COLLECTION_MATCH_NONE"
-111.197835,35.428033,"Polygonum ramosissimum",3091234326,"At Grand Falls on the Little Colorado River","USA",3000,1997,"PRESERVED_SPECIMEN","CONTINENT_DERIVED_FROM_COORDINATES;INSTITUTION_MATCH_FUZZY;COLLECTION_MATCH_NONE"
-110.4257531,37.2505787,"Polygonum ramosissimum",3091264733,"Dry lakebed of San Juan arm of Lake Powell, at the mouth of Piute Farms Wash","USA",7,2005,"PRESERVED_SPECIMEN","COORDINATE_REPROJECTED;CONTINENT_DERIVED_FROM_COORDINATES;INSTITUTION_MATCH_FUZZY;COLLECTION_MATCH_NONE"
-109.15122,36.1641,"Polygonum ramosissimum",3091215331,"In a small north facing side canyon of upper Wheatfields Creek.","USA",NA,2001,"PRESERVED_SPECIMEN","GEODETIC_DATUM_ASSUMED_WGS84;CONTINENT_DERIVED_FROM_COORDINATES;DIFFERENT_OWNER_INSTITUTION"
-110.201,35.813,"Polygonum ramosissimum",3091303739,"Navajo Reservation, Keams Canyon","USA",800,1979,"PRESERVED_SPECIMEN","CONTINENT_DERIVED_FROM_COORDINATES;INSTITUTION_MATCH_FUZZY;COLLECTION_MATCH_NONE"
-121.74019,38.59635,"Polygonum ramosissimum",2421682913,"Yolo County: About 3 miles north of Davis. Along Southern Pacific railroad.","USA",2909,1952,"PRESERVED_SPECIMEN","CONTINENT_DERIVED_FROM_COORDINATES;INSTITUTION_MATCH_FUZZY"
-120.168858,36.778223,"Polygonum ramosissimum",2421727577,"Fresno County: South side of Shields Ave. west of Yuba Ave., 22 miles northwest of Fresno.","USA",300,1953,"PRESERVED_SPECIMEN","CONTINENT_DERIVED_FROM_COORDINATES;INSTITUTION_MATCH_FUZZY"
-122.289985,38.624047,"Polygonum ramosissimum",2626938530,"North end of Lake Berryessa, near Berryessa Knoxville Road, ca. 0.5-2 km north of Pope Canyon Road intersection.","USA",600,2004,"PRESERVED_SPECIMEN","CONTINENT_DERIVED_FROM_COORDINATES;INSTITUTION_MATCH_FUZZY"
-98.410801,46.008499,"Polygonum ramosissimum",177008952,"Ludden, 13 mi W","USA",6454,1971,"PRESERVED_SPECIMEN","AMBIGUOUS_COLLECTION"
-96.78233,37.68902,"Polygonum ramosissimum",177009441,"Leon, S edge","USA",0.6,1966,"PRESERVED_SPECIMEN","GEODETIC_DATUM_ASSUMED_WGS84;AMBIGUOUS_COLLECTION"
-101.75267,37.96607,"Polygonum ramosissimum",177009399,"Syracuse, 1 mi S","USA",3841,1971,"PRESERVED_SPECIMEN","AMBIGUOUS_COLLECTION"
-98.51846,38.208974,"Polygonum ramosissimum",177009305,"T21S, R11W, sec 22","USA",1139,1959,"PRESERVED_SPECIMEN","AMBIGUOUS_COLLECTION"
-97.56517,39.675073,"Polygonum ramosissimum",177009106,"T4S, R2W, sec 29","USA",1144,1960,"PRESERVED_SPECIMEN","AMBIGUOUS_COLLECTION"
-97.839364,38.114499,"Polygonum ramosissimum",177009408,"Medora, 2 mi S, 1 mi E; Sandhill State Park","USA",2976,1977,"PRESERVED_SPECIMEN","AMBIGUOUS_COLLECTION"
-100.860961,37.935457,"Polygonum ramosissimum",177009470,"Garden City, 2.5 mi S","USA",580,1989,"PRESERVED_SPECIMEN","AMBIGUOUS_COLLECTION"
-95.225783,38.299036,"Polygonum ramosissimum",177009577,"NE corner of Garnett","USA",2079,1975,"PRESERVED_SPECIMEN","AMBIGUOUS_COLLECTION"
-98.5523,41.97947,"Polygonum ramosissimum",177009183,"Bartlett, 6.5 mi N","USA",8308,1971,"PRESERVED_SPECIMEN","AMBIGUOUS_COLLECTION"
-102.8527,41.65405,"Polygonum ramosissimum",177009206,"Broadwater, 4 mi N","USA",6129,1967,"PRESERVED_SPECIMEN","AMBIGUOUS_COLLECTION"
-98.57458,43.05722,"Polygonum ramosissimum",177009222,"Ft Randall Dam, W end, 1 mi W","USA",3.03,1972,"PRESERVED_SPECIMEN","GEODETIC_DATUM_ASSUMED_WGS84;AMBIGUOUS_COLLECTION"
-92.70978,40.30651,"Polygonum ramosissimum",1990674635,"Novinger, 8.1 air km N","USA",7,2016,"PRESERVED_SPECIMEN","AMBIGUOUS_COLLECTION"
-98.05533,40.52893,"Polygonum ramosissimum",177008866,"Clay Center, 0.5 mi N","USA",1931,1968,"PRESERVED_SPECIMEN","AMBIGUOUS_COLLECTION"
-102.39037,41.09424,"Polygonum ramosissimum",177009307,"Chappell, 4 mi E","USA",4.04,1970,"PRESERVED_SPECIMEN","GEODETIC_DATUM_ASSUMED_WGS84;AMBIGUOUS_COLLECTION"
-96.67684,40.87173,"Polygonum ramosissimum",177009419,"Lincoln, 1 mi S of Hwy 80, 0.25 mi E of 27th St","USA",0.02,1965,"PRESERVED_SPECIMEN","GEODETIC_DATUM_ASSUMED_WGS84;AMBIGUOUS_COLLECTION"
-99.50818,46.52973,"Polygonum ramosissimum",177008967,"Napoleon, 1.5 mi N, 12.5 mi E","USA",9670,1972,"PRESERVED_SPECIMEN","AMBIGUOUS_COLLECTION"
-98.96702,37.51058,"Polygonum ramosissimum",177009471,"Croft, 0.5 mi N, 1.5 mi E","USA",3869,1972,"PRESERVED_SPECIMEN","AMBIGUOUS_COLLECTION"
-99.38227,37.92307,"Polygonum ramosissimum",177009579,"Kinsley, 1.5 mi E","USA",2933,1971,"PRESERVED_SPECIMEN","AMBIGUOUS_COLLECTION"
-99.31076,39.67195,"Polygonum ramosissimum",177009323,"Glade, 0.8 mi S on US 183","USA",1.75,1970,"PRESERVED_SPECIMEN","GEODETIC_DATUM_ASSUMED_WGS84;AMBIGUOUS_COLLECTION"
-99.06968,44.51829,"Polygonum ramosissimum",177009477,"Miller, 4 mi W","USA",6848,1972,"PRESERVED_SPECIMEN","AMBIGUOUS_COLLECTION"
-102.26389,40.97384,"Polygonum ramosissimum",177009247,"Julesburg, 1 mi S","USA",4327,1972,"PRESERVED_SPECIMEN","AMBIGUOUS_COLLECTION"
-99.74984,46.39251,"Polygonum ramosissimum",177009263,"Napoleon, 8 mi S, 1 mi E","USA",7775,1967,"PRESERVED_SPECIMEN","AMBIGUOUS_COLLECTION"
-102.995834,38.980835,"Polygonum ramosissimum",177009423,"Wild Horse, 11 mi N","USA",NA,2000,"PRESERVED_SPECIMEN","COORDINATE_ROUNDED;GEODETIC_DATUM_ASSUMED_WGS84;GEODETIC_DATUM_INVALID;AMBIGUOUS_COLLECTION"
-103.8623426,46.3079209,"Polygonum ramosissimum",3462138304,"Marmarth, 1 mi N, 2.5 mi E; Little Missouri National Grassland, S of FS Road 784","USA",NA,2003,"PRESERVED_SPECIMEN","COORDINATE_REPROJECTED;COORDINATE_ROUNDED;AMBIGUOUS_COLLECTION"
-95.444341,40.176984,"Polygonum ramosissimum",1981529927,"Craig, 6.3 air km WSW; H.F. Thurnau Conservation Area","USA",100,2015,"PRESERVED_SPECIMEN","AMBIGUOUS_COLLECTION"
-103.80856,41.91127,"Polygonum ramosissimum",177008880,"Mitchell, 2 mi S","USA",4350,1970,"PRESERVED_SPECIMEN","AMBIGUOUS_COLLECTION"
-97.92295,43.63902,"Polygonum ramosissimum",177008958,"Alexandria, 1 mi S, 7 mi W","USA",6798,1965,"PRESERVED_SPECIMEN","AMBIGUOUS_COLLECTION"
-102.543921,37.636193,"Polygonum ramosissimum",177008969,"Two Buttes (town), 6 mi N, 7 mi W; Two Buttes State Wildlife Management Area, E-central part","USA",873,1998,"PRESERVED_SPECIMEN","AMBIGUOUS_COLLECTION"
-96.56613,41.04734,"Polygonum ramosissimum",177009483,"US 77, 4 mi E, just N of Lancaster Co line","USA",0.19,1998,"PRESERVED_SPECIMEN","GEODETIC_DATUM_ASSUMED_WGS84;AMBIGUOUS_COLLECTION"
