"lon","lat","species","gbifID","locality","countryCode","coordinateUncertaintyInMeters","year","basisOfRecord","issue"
44.62,-20.03,"Poupartia silvatica",2618614873,"Madagascar, Province Toliara, Menabe Region, Morondava District, Kirindy forest, along the road to Belo Tsiribihina-Morondava.","MDG",NA,2018,"PRESERVED_SPECIMEN","GEODETIC_DATUM_ASSUMED_WGS84;INSTITUTION_COLLECTION_MISMATCH"
43.66,-22.89,"Poupartia silvatica",3776335351,"Madagascar, Toliara, Atsimo-Andrefana Region. Tuléar II, Tsefanoka.","MDG",NA,2006,"PRESERVED_SPECIMEN","GEODETIC_DATUM_ASSUMED_WGS84;INSTITUTION_COLLECTION_MISMATCH"
49.37,-12.22,"Poupartia silvatica",3776351293,"Madagascar, Diana Region, Antsiranana II District, Orangea Protected Area.","MDG",NA,2020,"PRESERVED_SPECIMEN","GEODETIC_DATUM_ASSUMED_WGS84;INSTITUTION_COLLECTION_MISMATCH"
49.433333,-12.566667,"Poupartia silvatica",1258345820,"Ouest (Nord): Bassin de Saharaina, forêt de Sahafary, sur sables.","MDG",NA,1958,"PRESERVED_SPECIMEN","OCCURRENCE_STATUS_INFERRED_FROM_INDIVIDUAL_COUNT;COORDINATE_ROUNDED;GEODETIC_DATUM_ASSUMED_WGS84;DIFFERENT_OWNER_INSTITUTION"
44.51666,-20.18333,"Poupartia silvatica",1258703261,"Ouest: Forêt d'Andranomena, Marofandilia (Morondava)","MDG",NA,1969,"PRESERVED_SPECIMEN","OCCURRENCE_STATUS_INFERRED_FROM_INDIVIDUAL_COUNT;GEODETIC_DATUM_ASSUMED_WGS84;DIFFERENT_OWNER_INSTITUTION"
47.498611,-15.566667,"Poupartia silvatica",4061472866,"Boriziny, Port-Berge, Tsiningia, Andranomena II. Forêt dense sèche sur un substrat basaltique. Récolté avec R. Razakamalala & A. Tombomarina. Echantillons préservés en alcool.","MDG",NA,2004,"PRESERVED_SPECIMEN","OCCURRENCE_STATUS_INFERRED_FROM_INDIVIDUAL_COUNT;COORDINATE_ROUNDED;GEODETIC_DATUM_ASSUMED_WGS84;DIFFERENT_OWNER_INSTITUTION"
47.584167,-15.649444,"Poupartia silvatica",4061529549,"Faritany: Mahajanga, Fivondronana: Port Bergé, Bongolava. Forêt sèche de Marosely. Récolté avec R. Ramananjanahary & A. Rabezafy (guide).","MDG",NA,2004,"PRESERVED_SPECIMEN","OCCURRENCE_STATUS_INFERRED_FROM_INDIVIDUAL_COUNT;COORDINATE_ROUNDED;GEODETIC_DATUM_ASSUMED_WGS84;DIFFERENT_OWNER_INSTITUTION"
44.5,-19.93333,"Poupartia silvatica",4061286872,"Dans la concession forestière du CFPF: Kirindy. Beroboka, Marofandilia. A environ 60 km au nord-est de Morondava, par route. Forêt dense sèche. Echantillon préservé en alcool. Récolte avec J. Randrianarison.","MDG",NA,1994,"PRESERVED_SPECIMEN","OCCURRENCE_STATUS_INFERRED_FROM_INDIVIDUAL_COUNT;GEODETIC_DATUM_ASSUMED_WGS84;ELEVATION_NON_NUMERIC;DIFFERENT_OWNER_INSTITUTION"
49.5825,-13.095,"Poupartia silvatica",4060874452,"Vohemar, Daraina, village Befarafara, forêt de Solanampilana à 35 km au Nord de Daraina. Forêt sèche. Récolté avec S. Rakotonandrasana, R. Rakotondrajaona, C. Claude, Beliza, Modeste & V. Benjara.","MDG",NA,2006,"PRESERVED_SPECIMEN","OCCURRENCE_STATUS_INFERRED_FROM_INDIVIDUAL_COUNT;GEODETIC_DATUM_ASSUMED_WGS84;DIFFERENT_OWNER_INSTITUTION"
45.198611,-21.358333,"Poupartia silvatica",4061584707,"District et Commune rurale: Beroroha, Fokontany: Beronono-Makay.","MDG",NA,2010,"PRESERVED_SPECIMEN","OCCURRENCE_STATUS_INFERRED_FROM_INDIVIDUAL_COUNT;COORDINATE_ROUNDED;GEODETIC_DATUM_ASSUMED_WGS84;DIFFERENT_OWNER_INSTITUTION"
44.263056,-22.845833,"Poupartia silvatica",4061406906,"District de Sakaraha, Commune de Mahaboboka, Fokotany de Marotsiraka Betsileo, Village le plus roche Berobotsy. Collectés avec Miandry Fagnarea, Nesy, Martin (Guides).","MDG",NA,2022,"PRESERVED_SPECIMEN","OCCURRENCE_STATUS_INFERRED_FROM_INDIVIDUAL_COUNT;COORDINATE_ROUNDED;GEODETIC_DATUM_ASSUMED_WGS84;DIFFERENT_OWNER_INSTITUTION"
47.266667,-15.016667,"Poupartia silvatica",4061293455,"Ouest: Forêt d'Ambondro-Ampasy (exploitation Loyseau), Canton Antonibe, District Analalava.","MDG",NA,1958,"PRESERVED_SPECIMEN","OCCURRENCE_STATUS_INFERRED_FROM_INDIVIDUAL_COUNT;COORDINATE_ROUNDED;GEODETIC_DATUM_ASSUMED_WGS84;DIFFERENT_OWNER_INSTITUTION"
44.7,-22.7,"Poupartia silvatica",4061343081,"Lambomakandro Tuléar","MDG",NA,1952,"PRESERVED_SPECIMEN","OCCURRENCE_STATUS_INFERRED_FROM_INDIVIDUAL_COUNT;GEODETIC_DATUM_ASSUMED_WGS84;DIFFERENT_OWNER_INSTITUTION"
49.766667,-13.2,"Poupartia silvatica",1258841895,"Diego Suarez region, SE of town and SE of Ambilobe, near Daraina on road to Vohemar (Iharana); forest; D. Meyer's lemur study site.","MDG",NA,1989,"PRESERVED_SPECIMEN","OCCURRENCE_STATUS_INFERRED_FROM_INDIVIDUAL_COUNT;COORDINATE_ROUNDED;GEODETIC_DATUM_ASSUMED_WGS84;INSTITUTION_MATCH_FUZZY;COLLECTION_MATCH_NONE"
44.482778,-17.888889,"Poupartia silvatica",4031476932,"Beanka, partie nord. Ambabaky","MDG",NA,2012,"PRESERVED_SPECIMEN","OCCURRENCE_STATUS_INFERRED_FROM_INDIVIDUAL_COUNT;GEODETIC_DATUM_ASSUMED_WGS84;INSTITUTION_MATCH_FUZZY;COLLECTION_MATCH_NONE"
46.816667,-16.316667,"Poupartia silvatica",1212475738,"Ankarafantsika; Ampijoroa Forestry Station .","MDG",NA,1988,"PRESERVED_SPECIMEN","OCCURRENCE_STATUS_INFERRED_FROM_INDIVIDUAL_COUNT;COORDINATE_ROUNDED;INSTITUTION_MATCH_FUZZY;COLLECTION_MATCH_NONE"
49.4,-17.283333,"Poupartia silvatica",1212475672,"Tampolo","MDG",NA,1988,"PRESERVED_SPECIMEN","OCCURRENCE_STATUS_INFERRED_FROM_INDIVIDUAL_COUNT;COORDINATE_ROUNDED;INSTITUTION_MATCH_FUZZY;COLLECTION_MATCH_NONE"
49.016667,-12.483333,"Poupartia silvatica",1212475673,"Ca. 35 km SW of Antsiranana , Parc National Motagne d' Ambre , near Joffreville , North of Grand Cascade , Forêt d' Ambre .","MDG",NA,1992,"PRESERVED_SPECIMEN","OCCURRENCE_STATUS_INFERRED_FROM_INDIVIDUAL_COUNT;COORDINATE_ROUNDED;INSTITUTION_MATCH_FUZZY;COLLECTION_MATCH_NONE"
49.766667,-14.116667,"Poupartia silvatica",1212475675,"SE of town and SE of Ambilobe , near Daraina on road to Vohemar ( Iharana ) D. Meyers ' s lemur study site . ","MDG",NA,1989,"PRESERVED_SPECIMEN","OCCURRENCE_STATUS_INFERRED_FROM_INDIVIDUAL_COUNT;COORDINATE_ROUNDED;INSTITUTION_MATCH_FUZZY;COLLECTION_MATCH_NONE"
44.65,-23.966667,"Poupartia silvatica",1212475678,"Near Beza Mahafaly Reserve , near Betioky . Ridge east of Sakamena River , valley of Analafahy River . ","MDG",NA,1987,"PRESERVED_SPECIMEN","OCCURRENCE_STATUS_INFERRED_FROM_INDIVIDUAL_COUNT;COORDINATE_ROUNDED;INSTITUTION_MATCH_FUZZY;COLLECTION_MATCH_NONE"
49.083333,-12.916667,"Poupartia silvatica",1212475677,"Réserve Spéciale d' Ankarana , tsingy au dessus du lac Vert .","MDG",NA,1997,"PRESERVED_SPECIMEN","OCCURRENCE_STATUS_INFERRED_FROM_INDIVIDUAL_COUNT;COORDINATE_ROUNDED;INSTITUTION_MATCH_FUZZY;COLLECTION_MATCH_NONE"
45.325,-16.1,"Poupartia silvatica",4061339453,"Soalala","MDG",NA,1951,"PRESERVED_SPECIMEN","OCCURRENCE_STATUS_INFERRED_FROM_INDIVIDUAL_COUNT;GEODETIC_DATUM_ASSUMED_WGS84;DIFFERENT_OWNER_INSTITUTION"
49.44888,-12.48027,"Poupartia silvatica",4031594096,"Andrafiabe, mont Andrahona, 3 km au Nord est d'Andrafiabe. Forêt sèche décidue. Récolté avec R. Guittou & J. Be.","MDG",NA,2005,"PRESERVED_SPECIMEN","OCCURRENCE_STATUS_INFERRED_FROM_INDIVIDUAL_COUNT;GEODETIC_DATUM_ASSUMED_WGS84;INSTITUTION_MATCH_FUZZY;COLLECTION_MATCH_NONE"
44.8,-20.408333,"Poupartia silvatica",4031595713,"Forêt d'Antsakabe, 2 Km au Nord, entre la route de Dabara-Manamby. Station: sommet d'une colline.","MDG",NA,1952,"PRESERVED_SPECIMEN","OCCURRENCE_STATUS_INFERRED_FROM_INDIVIDUAL_COUNT;COORDINATE_ROUNDED;GEODETIC_DATUM_ASSUMED_WGS84;INSTITUTION_MATCH_FUZZY;COLLECTION_MATCH_NONE"
43.68972,-22.96916,"Poupartia silvatica",4031798120,"Tuléar II, Belalanda, Ranobe. Forèt sèche sur sable roux non consolidé.","MDG",NA,2007,"PRESERVED_SPECIMEN","OCCURRENCE_STATUS_INFERRED_FROM_INDIVIDUAL_COUNT;GEODETIC_DATUM_ASSUMED_WGS84;INSTITUTION_MATCH_FUZZY;COLLECTION_MATCH_NONE"
44.295556,-22.829722,"Poupartia silvatica",4066604363,"District de Sakaraha, Commune de Mahaboboka, Fokontany de Marotsiraka Betsileo, Village le plus proche: Betanimena. Collectés avec Besa. Échantillons préservés en alcool.","MDG",NA,2022,"PRESERVED_SPECIMEN","OCCURRENCE_STATUS_INFERRED_FROM_INDIVIDUAL_COUNT;COORDINATE_ROUNDED;GEODETIC_DATUM_ASSUMED_WGS84;INSTITUTION_MATCH_FUZZY;COLLECTION_MATCH_NONE"
49.794722,-12.881111,"Poupartia silvatica",4031355390,"District Vohemar, Commune Ampisikina, Fokontany Antsapilay. Village le plus proche Ankaramy. Anketrakaben'Ankaramy.","MDG",NA,2013,"PRESERVED_SPECIMEN","OCCURRENCE_STATUS_INFERRED_FROM_INDIVIDUAL_COUNT;COORDINATE_ROUNDED;GEODETIC_DATUM_ASSUMED_WGS84;INSTITUTION_MATCH_FUZZY;COLLECTION_MATCH_NONE"
49.083333,-12.5,"Poupartia silvatica",1258829124,"Ouest (Confins du Centre): Massif de la Montagne d'Ambre, rive gauche de la rivière des Makis en aval traversée de cette rivière par la piste Joffre-ville et Andranofanjava.","MDG",NA,1958,"PRESERVED_SPECIMEN","OCCURRENCE_STATUS_INFERRED_FROM_INDIVIDUAL_COUNT;COORDINATE_ROUNDED;GEODETIC_DATUM_ASSUMED_WGS84;DIFFERENT_OWNER_INSTITUTION"
43.658333,-22.175,"Poupartia silvatica",4061293545,"Route vers Basibasy, proche du village Tsilokarivo, Canton Basibasy, District Morombe. Station: dans une vestige de forêt sèche, sol sableux.","MDG",NA,1955,"PRESERVED_SPECIMEN","OCCURRENCE_STATUS_INFERRED_FROM_INDIVIDUAL_COUNT;COORDINATE_ROUNDED;GEODETIC_DATUM_ASSUMED_WGS84;ELEVATION_NON_NUMERIC;DIFFERENT_OWNER_INSTITUTION"
44.375,-18.822222,"Poupartia silvatica",1261515557,"NW forêt Tsimembo, limite concession M. Barthe.","MDG",NA,1953,"PRESERVED_SPECIMEN","OCCURRENCE_STATUS_INFERRED_FROM_INDIVIDUAL_COUNT;COORDINATE_ROUNDED;GEODETIC_DATUM_ASSUMED_WGS84;DIFFERENT_OWNER_INSTITUTION"
44.67277,-22.90611,"Poupartia silvatica",4062190259,"Sakaraha, Andoharanomaitso, Parc de Zombitse, partie Sud-est.","MDG",NA,2004,"PRESERVED_SPECIMEN","OCCURRENCE_STATUS_INFERRED_FROM_INDIVIDUAL_COUNT;GEODETIC_DATUM_ASSUMED_WGS84;DIFFERENT_OWNER_INSTITUTION"
45.303273,-16.405774,"Poupartia silvatica",4061238094,"Namoroka National Park. N. part of park to E. of Namoroka village.","MDG",NA,2016,"PRESERVED_SPECIMEN","OCCURRENCE_STATUS_INFERRED_FROM_INDIVIDUAL_COUNT;GEODETIC_DATUM_ASSUMED_WGS84;DIFFERENT_OWNER_INSTITUTION"
44.28333,-20.28333,"Poupartia silvatica",1258703275,"Marofandilia, Morondava.","MDG",NA,1979,"PRESERVED_SPECIMEN","OCCURRENCE_STATUS_INFERRED_FROM_INDIVIDUAL_COUNT;GEODETIC_DATUM_ASSUMED_WGS84;DIFFERENT_OWNER_INSTITUTION"
46.2,-24.883333,"Poupartia silvatica",1258633361,"Forêt sèche sud de Berenty Betsileo?","MDG",NA,1967,"PRESERVED_SPECIMEN","OCCURRENCE_STATUS_INFERRED_FROM_INDIVIDUAL_COUNT;COORDINATE_ROUNDED;GEODETIC_DATUM_ASSUMED_WGS84;DIFFERENT_OWNER_INSTITUTION"
49.460833,-13.145278,"Poupartia silvatica",1257983035,"Daraina, forêt d'Ambohitsitondroina.","MDG",NA,2006,"PRESERVED_SPECIMEN","OCCURRENCE_STATUS_INFERRED_FROM_INDIVIDUAL_COUNT;COORDINATE_ROUNDED;GEODETIC_DATUM_ASSUMED_WGS84;DIFFERENT_OWNER_INSTITUTION"
48.966389,-12.706111,"Poupartia silvatica",1261016252,"Diana, Masorolava, Mahagaga, Est de la forêt d'Antsoroby. Echantillon preservé en alcool. Récolté avec A. Ravoahangy, Abdillah & Samohina.","MDG",NA,2007,"PRESERVED_SPECIMEN","OCCURRENCE_STATUS_INFERRED_FROM_INDIVIDUAL_COUNT;COORDINATE_ROUNDED;GEODETIC_DATUM_ASSUMED_WGS84;DIFFERENT_OWNER_INSTITUTION"
48.085833,-13.756667,"Poupartia silvatica",1261055270,"Diana, Ambanja, Ambaliha, Tsarabanja. Forêt dense humide d'Ambohimirahavavy, village le plus proche Tsarabanja, sur la presqu'île Ampasindava. Echantillon préservé en alcool. Récolté avec Louis, Patrick, Jacky, Cathy, Morgane, Ndrianary & Pierre.","MDG",NA,2008,"PRESERVED_SPECIMEN","OCCURRENCE_STATUS_INFERRED_FROM_INDIVIDUAL_COUNT;COORDINATE_ROUNDED;GEODETIC_DATUM_ASSUMED_WGS84;DIFFERENT_OWNER_INSTITUTION"
49.016667,-12.816667,"Poupartia silvatica",1258348619,"Ankara, Diégo","MDG",NA,1952,"PRESERVED_SPECIMEN","OCCURRENCE_STATUS_INFERRED_FROM_INDIVIDUAL_COUNT;COORDINATE_ROUNDED;GEODETIC_DATUM_ASSUMED_WGS84;DIFFERENT_OWNER_INSTITUTION"
49.713056,-13.105,"Poupartia silvatica",1257982236,"Daraina, forêt de Bekaraoka, partie nord.","MDG",NA,2005,"PRESERVED_SPECIMEN","OCCURRENCE_STATUS_INFERRED_FROM_INDIVIDUAL_COUNT;COORDINATE_ROUNDED;GEODETIC_DATUM_ASSUMED_WGS84;DIFFERENT_OWNER_INSTITUTION"
44.783333,-17.966667,"Poupartia silvatica",4062070669,"Forêt Andramy, Canton Betanatanana, District Maintirano, Sation pente moyenne, sol terrain assez sablonneux.","MDG",NA,1955,"PRESERVED_SPECIMEN","OCCURRENCE_STATUS_INFERRED_FROM_INDIVIDUAL_COUNT;COORDINATE_ROUNDED;GEODETIC_DATUM_ASSUMED_WGS84;DIFFERENT_OWNER_INSTITUTION"
47.473306,-15.700806,"Poupartia silvatica",3759111321,"","MDG",3,2017,"HUMAN_OBSERVATION","COORDINATE_ROUNDED;CONTINENT_DERIVED_FROM_COORDINATES"
44.025,-18.06666,"Poupartia silvatica",1258350223,"Lieu de récolte Maintirano (Canton et District), sol latéritique.","MDG",NA,1957,"PRESERVED_SPECIMEN","GEODETIC_DATUM_ASSUMED_WGS84;DIFFERENT_OWNER_INSTITUTION"
49.166667,-12.483333,"Poupartia silvatica",2515837427,"Antsiranana ca. 35 km SW of Antsiranana, Parc National Montagne d'Ambre, near Joffreville, North of Grand Cascade, Forêt d'Ambre.","MDG",NA,1992,"PRESERVED_SPECIMEN","INSTITUTION_MATCH_FUZZY;INSTITUTION_COLLECTION_MISMATCH"
44.05861,-17.57417,"Poupartia silvatica",4040280304,"","MDG",NA,2015,"PRESERVED_SPECIMEN","GEODETIC_DATUM_ASSUMED_WGS84;CONTINENT_DERIVED_FROM_COORDINATES;COLLECTION_MATCH_FUZZY"
44.653452,-23.651021,"Poupartia silvatica",1258821941,"Near Beza Mahafaly Reserve, near Betioky. Ridge east of Sakamena River, valley of Analafahy River.","MDG",NA,1987,"PRESERVED_SPECIMEN","OCCURRENCE_STATUS_INFERRED_FROM_INDIVIDUAL_COUNT;GEODETIC_DATUM_ASSUMED_WGS84;INSTITUTION_MATCH_FUZZY;COLLECTION_MATCH_NONE"
43.708056,-23.145,"Poupartia silvatica",4061136715,"Toliara II, Ankilimalinike, Ranobe.","MDG",NA,2012,"PRESERVED_SPECIMEN","OCCURRENCE_STATUS_INFERRED_FROM_INDIVIDUAL_COUNT;COORDINATE_ROUNDED;GEODETIC_DATUM_ASSUMED_WGS84;DIFFERENT_OWNER_INSTITUTION"
49.558056,-13.212778,"Poupartia silvatica",1587377300,"Forêt d'Antsahabe, vers 20 km à l'ouest de Daraina.","MDG",NA,2005,"PRESERVED_SPECIMEN","COORDINATE_ROUNDED;TAXON_MATCH_FUZZY;INSTITUTION_MATCH_FUZZY;COLLECTION_MATCH_NONE"
44.55944,-18.12056,"Poupartia silvatica",1144736066,"Beanka, sud de la Kimanambolo","MDG",10,2012,"PRESERVED_SPECIMEN","GEODETIC_DATUM_ASSUMED_WGS84;CONTINENT_DERIVED_FROM_COORDINATES;INSTITUTION_MATCH_FUZZY;COLLECTION_MATCH_NONE"
