"lon","lat","species","gbifID","locality","countryCode","coordinateUncertaintyInMeters","year","basisOfRecord","issue"
48.9,-17.7,"Ravenea sambiranensis",4060961261,"Vavatenina, Zahamena, Vatovelona","MDG",NA,1998,"PRESERVED_SPECIMEN","GEODETIC_DATUM_ASSUMED_WGS84;DIFFERENT_OWNER_INSTITUTION"
45.46666,-18.81666,"Ravenea sambiranensis",4061992200,"TSIROANOMANDIDY: ca. 110 km WNW of town, Forest of Bongolava, nearsAmbohitsaratelo. Relict forest in a valley bottom in the midst ofsanthropogenic grassland. Collected with D.N. Cooke, A. Rakoutouzafy & J.H. Beach.","MDG",NA,1986,"PRESERVED_SPECIMEN","GEODETIC_DATUM_ASSUMED_WGS84;DIFFERENT_OWNER_INSTITUTION"
49.06666,-18.81666,"Ravenea sambiranensis",4060936747,"Brickaville, Andrambolahy Kely to Andranampony.","MDG",NA,1951,"PRESERVED_SPECIMEN","GEODETIC_DATUM_ASSUMED_WGS84;DIFFERENT_OWNER_INSTITUTION"
47.325,-22.816667,"Ravenea sambiranensis",4060937116,"Vondrozo, Madiorano, Ampasimpotsy.","MDG",NA,2006,"PRESERVED_SPECIMEN","OCCURRENCE_STATUS_INFERRED_FROM_INDIVIDUAL_COUNT;COORDINATE_ROUNDED;GEODETIC_DATUM_ASSUMED_WGS84;DIFFERENT_OWNER_INSTITUTION"
49.783333,-14.45,"Ravenea sambiranensis",1260274767,"Reserve Naturelle de Marojejy; western slopes of Mt. Beondroka; cloud forest.","MDG",NA,1989,"PRESERVED_SPECIMEN","OCCURRENCE_STATUS_INFERRED_FROM_INDIVIDUAL_COUNT;COORDINATE_ROUNDED;GEODETIC_DATUM_ASSUMED_WGS84;INSTITUTION_MATCH_FUZZY;COLLECTION_MATCH_NONE"
47.383333,-21.3,"Ravenea sambiranensis",4031771932,"Parc National de Ranomafana, SE of Savondronona, Maharira.","MDG",NA,1993,"PRESERVED_SPECIMEN","OCCURRENCE_STATUS_INFERRED_FROM_INDIVIDUAL_COUNT;COORDINATE_ROUNDED;GEODETIC_DATUM_ASSUMED_WGS84;INSTITUTION_MATCH_FUZZY;COLLECTION_MATCH_NONE"
48.37,-14.08,"Ravenea sambiranensis",1931377610,"Antsiranana. Special Reserve of Manongarivo, SE of Beraty, trail to summit of Antsatrotro, just before summit","MDG",NA,1991,"PRESERVED_SPECIMEN","GEODETIC_DATUM_ASSUMED_WGS84;COLLECTION_MATCH_FUZZY"
49.419166,-17.28743,"Ravenea sambiranensis",1453257896,"","MDG",9,2016,"HUMAN_OBSERVATION","COORDINATE_ROUNDED;CONTINENT_DERIVED_FROM_COORDINATES"
49.83333,-16.43333,"Ravenea sambiranensis",4060972098,"Mananara avaratra: Antanambe.","MDG",NA,1991,"PRESERVED_SPECIMEN","GEODETIC_DATUM_ASSUMED_WGS84;DIFFERENT_OWNER_INSTITUTION"
48.3,-14.033333,"Ravenea sambiranensis",4061003968,"Manongarivo, Bekolosy. 100 m au N de BK06, sur le sentier du sommet, variente est.","MDG",NA,1996,"PRESERVED_SPECIMEN","OCCURRENCE_STATUS_INFERRED_FROM_INDIVIDUAL_COUNT;COORDINATE_ROUNDED;GEODETIC_DATUM_ASSUMED_WGS84;DIFFERENT_OWNER_INSTITUTION"
48.1,-14.05,"Ravenea sambiranensis",912027131,"Analalava: 18 km NNE of Maromandia","MDG",0.2,1992,"PRESERVED_SPECIMEN","GEODETIC_DATUM_ASSUMED_WGS84;CONTINENT_DERIVED_FROM_COORDINATES;INSTITUTION_MATCH_FUZZY;COLLECTION_MATCH_NONE"
49.25,-14.43,"Ravenea sambiranensis",912060701,"Resrve Naturell Marojejy along trail to summit of Marojejy Est, north of Mandena, above Camp 2.","MDG",0.2,1989,"PRESERVED_SPECIMEN","GEODETIC_DATUM_ASSUMED_WGS84;CONTINENT_DERIVED_FROM_COORDINATES;INSTITUTION_MATCH_FUZZY;COLLECTION_MATCH_NONE"
49.63,-15.52,"Ravenea sambiranensis",912261906,"Maroansetra: ca. 26 km south of the town on the coast of the Bay of Antopngil, near Manambia","MDG",0.2,1986,"PRESERVED_SPECIMEN","GEODETIC_DATUM_ASSUMED_WGS84;CONTINENT_DERIVED_FROM_COORDINATES;INSTITUTION_MATCH_FUZZY;COLLECTION_MATCH_FUZZY"
44.3025,-22.7922,"Ravenea sambiranensis",1930502523,"Region Atsimo-Andrefana, Dist. Sakaraha, Comm. Mahaboboka, Fkt. Mantsiralea, Ambinanikou Dry savannah woodland","MDG",NA,2013,"PRESERVED_SPECIMEN","GEODETIC_DATUM_ASSUMED_WGS84;COLLECTION_MATCH_FUZZY"
49.2,-17.91666,"Ravenea sambiranensis",1258263335,"TOAMASINA: Betampona RNI. Ridgecrest, open forest, full sun.","MDG",NA,1991,"PRESERVED_SPECIMEN","GEODETIC_DATUM_ASSUMED_WGS84;INSTITUTION_MATCH_FUZZY;COLLECTION_MATCH_NONE"
48.678056,-13.649722,"Ravenea sambiranensis",4031614008,"Ambilobe, Beramanja, Anketrabe, forêt de Kalabenono, chaine de Galoko, 9 km au Sud-Est d'Anketrabe. Forêt dense humide de moyenne altitude, sur colline.","MDG",NA,2006,"PRESERVED_SPECIMEN","OCCURRENCE_STATUS_INFERRED_FROM_INDIVIDUAL_COUNT;COORDINATE_ROUNDED;GEODETIC_DATUM_ASSUMED_WGS84;INSTITUTION_MATCH_FUZZY;COLLECTION_MATCH_NONE"
48.85,-19.53333,"Ravenea sambiranensis",1258263334,"VATOMANDRY: 31 km S of Vatomandry on Ilaka road. Sandy, slightly swampyvalley bottom with remnants of riverine vegetation.","MDG",NA,1991,"PRESERVED_SPECIMEN","GEODETIC_DATUM_ASSUMED_WGS84;INSTITUTION_MATCH_FUZZY;COLLECTION_MATCH_NONE"
47.15,-24.77,"Ravenea sambiranensis",1927940303,"Toliara. Tôlanaro, Forêt sur la route de Ste. Luce; partie Sud.","MDG",NA,1989,"PRESERVED_SPECIMEN","GEODETIC_DATUM_ASSUMED_WGS84;COLLECTION_MATCH_FUZZY"
48,-13.77,"Ravenea sambiranensis",4061954311,"Ampasindava, forêt de Betsitsika. A 262 m du point côté 291, au 287°.","MDG",NA,2009,"PRESERVED_SPECIMEN","OCCURRENCE_STATUS_INFERRED_FROM_INDIVIDUAL_COUNT;GEODETIC_DATUM_ASSUMED_WGS84;DIFFERENT_OWNER_INSTITUTION"
49.605556,-16.6875,"Ravenea sambiranensis",4061816052,"Soanierana Ivongo: Manompana, Befanjana","MDG",NA,2006,"PRESERVED_SPECIMEN","OCCURRENCE_STATUS_INFERRED_FROM_INDIVIDUAL_COUNT;COORDINATE_ROUNDED;GEODETIC_DATUM_ASSUMED_WGS84;DIFFERENT_OWNER_INSTITUTION"
48.55,-13.86666,"Ravenea sambiranensis",4060957669,"Ambanja: 2-4 km SW of Ambalafary","MDG",NA,1992,"PRESERVED_SPECIMEN","GEODETIC_DATUM_ASSUMED_WGS84;DIFFERENT_OWNER_INSTITUTION"
44.78333,-18.9,"Ravenea sambiranensis",1260917657,"Bemaraha massif, Rivière manambolo.","MDG",NA,1990,"PRESERVED_SPECIMEN","GEODETIC_DATUM_ASSUMED_WGS84;DIFFERENT_OWNER_INSTITUTION"
49.598611,-13.233333,"Ravenea sambiranensis",4060971046,"Iharana, Daraina, forêt de Binara.","MDG",NA,2005,"PRESERVED_SPECIMEN","OCCURRENCE_STATUS_INFERRED_FROM_INDIVIDUAL_COUNT;COORDINATE_ROUNDED;GEODETIC_DATUM_ASSUMED_WGS84;DIFFERENT_OWNER_INSTITUTION"
49.75,-15.43333,"Ravenea sambiranensis",4061986804,"MAROANSETRA: ca. 15 km south of the town on the coast of the Bay of Antongil. Surviving in a vanilla plantation on coastal sand bar.","MDG",NA,1986,"PRESERVED_SPECIMEN","GEODETIC_DATUM_ASSUMED_WGS84;DIFFERENT_OWNER_INSTITUTION"
49.38333,-15.43333,"Ravenea sambiranensis",4061480499,"Maroantsetra, Makira, Beanivona","MDG",NA,2007,"PRESERVED_SPECIMEN","GEODETIC_DATUM_ASSUMED_WGS84;DIFFERENT_OWNER_INSTITUTION"
48.08333,-14.2,"Ravenea sambiranensis",1260917656,"Analalava: 18 km NNE of Maromandia.","MDG",NA,1992,"PRESERVED_SPECIMEN","GEODETIC_DATUM_ASSUMED_WGS84;DIFFERENT_OWNER_INSTITUTION"
48.806667,-18.403333,"Ravenea sambiranensis",4031725676,"Brickaville, Anjahamamy, Anivoranokely, Ankerana, Belalogno river.","MDG",NA,2012,"PRESERVED_SPECIMEN","OCCURRENCE_STATUS_INFERRED_FROM_INDIVIDUAL_COUNT;COORDINATE_ROUNDED;GEODETIC_DATUM_ASSUMED_WGS84;INSTITUTION_MATCH_FUZZY;COLLECTION_MATCH_NONE"
48.727778,-13.793889,"Ravenea sambiranensis",1259140388,"Tsaratanana Massif. Tsiafapandroaka (known locally as Belinta). Low humid evergreen forest.","MDG",NA,2001,"PRESERVED_SPECIMEN","OCCURRENCE_STATUS_INFERRED_FROM_INDIVIDUAL_COUNT;COORDINATE_ROUNDED;GEODETIC_DATUM_ASSUMED_WGS84;INSTITUTION_MATCH_FUZZY;COLLECTION_MATCH_NONE"
47.6,-23.333333,"Ravenea sambiranensis",1260917932,"Vangaindrano, Midongy Atsimo: near Ranomena.","MDG",NA,1992,"PRESERVED_SPECIMEN","OCCURRENCE_STATUS_INFERRED_FROM_INDIVIDUAL_COUNT;COORDINATE_ROUNDED;GEODETIC_DATUM_ASSUMED_WGS84;DIFFERENT_OWNER_INSTITUTION"
45.58333,-18.36666,"Ravenea sambiranensis",1260299883,"Ambohitsaratelo-Bebao (NW of Tsiroanomandidy). Stream near village. Remnant forest with Ravenala, Voacanga & Harongana.","MDG",NA,1985,"PRESERVED_SPECIMEN","OCCURRENCE_STATUS_INFERRED_FROM_INDIVIDUAL_COUNT;GEODETIC_DATUM_ASSUMED_WGS84;INSTITUTION_MATCH_FUZZY;COLLECTION_MATCH_NONE"
48.3,-13.41666,"Ravenea sambiranensis",4061610638,"Reserve Naturelle Integrale No. 6 - Lokobe. West side of the reserve, 4 km east of Hell Ville, Nossi Be. Lowland evergreen rainforest.","MDG",NA,1992,"PRESERVED_SPECIMEN","OCCURRENCE_STATUS_INFERRED_FROM_INDIVIDUAL_COUNT;GEODETIC_DATUM_ASSUMED_WGS84;INSTITUTION_MATCH_NONE"
49.55111,-15.30222,"Ravenea sambiranensis",4060949422,"Summit of quartzite massif of Ankirindro, ca. 25 air-km NW of Maroantsetra via the Antainambalana and then Vohimaro rivers. Collected with P.P. Lowry II, J. Rabenantoandro, R. Bernard & G. Modeste.","MDG",NA,1999,"PRESERVED_SPECIMEN","OCCURRENCE_STATUS_INFERRED_FROM_INDIVIDUAL_COUNT;GEODETIC_DATUM_ASSUMED_WGS84;INSTITUTION_MATCH_NONE"
46.58,-18.43,"Ravenea sambiranensis",912261784,"Ambohitsaratelo-Bebao (NW of Tsiroanomandidy). Stream near village.","MDG",15,1985,"PRESERVED_SPECIMEN","GEODETIC_DATUM_ASSUMED_WGS84;CONTINENT_DERIVED_FROM_COORDINATES;INSTITUTION_MATCH_FUZZY;COLLECTION_MATCH_FUZZY"
49,-17.67,"Ravenea sambiranensis",912261883,"Fenoarivo Atsinanana, sub-prefecture Vavatenina, Vatovelona forest, ca. 10 km south of the village Manakambahiny 1, Zahamena strict nature reserve (RNI)","MDG",0.2,1998,"PRESERVED_SPECIMEN","GEODETIC_DATUM_ASSUMED_WGS84;CONTINENT_DERIVED_FROM_COORDINATES;INSTITUTION_MATCH_FUZZY;COLLECTION_MATCH_FUZZY"
49.18,-16.85,"Ravenea sambiranensis",912189949,"Ambatovaky special reserve near Beampirano","MDG",NA,2003,"PRESERVED_SPECIMEN","GEODETIC_DATUM_ASSUMED_WGS84;CONTINENT_DERIVED_FROM_COORDINATES;INSTITUTION_MATCH_FUZZY;COLLECTION_MATCH_FUZZY"
44.83,-19.15,"Ravenea sambiranensis",912261867,"Massif de Bemaraha, Reserve de Bemaraha, Gorge of Manambolo River, northern bank, c. 6km E. of Bekopaka","MDG",1,1990,"PRESERVED_SPECIMEN","GEODETIC_DATUM_ASSUMED_WGS84;CONTINENT_DERIVED_FROM_COORDINATES;INSTITUTION_MATCH_FUZZY;COLLECTION_MATCH_FUZZY"
47.38,-23.38,"Ravenea sambiranensis",912261806,"Vangaindrano: 1 km E of ferry on Masihanaka Road.","MDG",0.2,1992,"PRESERVED_SPECIMEN","GEODETIC_DATUM_ASSUMED_WGS84;CONTINENT_DERIVED_FROM_COORDINATES;INSTITUTION_MATCH_FUZZY;COLLECTION_MATCH_FUZZY"
49.24,-16.76,"Ravenea sambiranensis",4061498926,"Soanierana Ivongo, Ambatovaky, Iampirano","MDG",NA,2003,"PRESERVED_SPECIMEN","GEODETIC_DATUM_ASSUMED_WGS84;DIFFERENT_OWNER_INSTITUTION"
47.71666,-23,"Ravenea sambiranensis",4061823940,"Manombo, Farafangana.","MDG",NA,1993,"PRESERVED_SPECIMEN","GEODETIC_DATUM_ASSUMED_WGS84;INSTITUTION_MATCH_NONE"
49.344677,-12.380033,"Ravenea sambiranensis",1883469660,"","MDG",9,2018,"HUMAN_OBSERVATION","COORDINATE_ROUNDED;CONTINENT_DERIVED_FROM_COORDINATES"
49.765208,-16.170555,"Ravenea sambiranensis",1453063079,"","MDG",1966,2015,"HUMAN_OBSERVATION","CONTINENT_DERIVED_FROM_COORDINATES"
