"lon","lat","species","gbifID","locality","countryCode","coordinateUncertaintyInMeters","year","basisOfRecord","issue"
-84.1,9.42,"Rugoloa pilosa",1096714333,"Flora de Costa Rica. Puntarenas: Aguirre. No protegida. Cuenca del Naranjo y Paquita. Plantación de Palma de Aceita. Finca Bartolo. O.2 km S del centro.","CRI",NA,2001,"PRESERVED_SPECIMEN","GEODETIC_DATUM_ASSUMED_WGS84;CONTINENT_DERIVED_FROM_COORDINATES;CONTINENT_INVALID;INSTITUTION_COLLECTION_MISMATCH"
-56.5681,4.52967,"Rugoloa pilosa",1456020977,"Central Suriname Nature Reserve, Adampada Creek, affluent of Coppename River, Caiman Sula (= rapids)","SUR",NA,2004,"PRESERVED_SPECIMEN","GEODETIC_DATUM_ASSUMED_WGS84"
-53.2,3.61,"Rugoloa pilosa",1456030534,"Eaux Claires, on road to, Saül","GUF",NA,1990,"PRESERVED_SPECIMEN","GEODETIC_DATUM_ASSUMED_WGS84"
-59.8167,4.9,"Rugoloa pilosa",1455981162,"West of Maikwak","GUY",NA,1988,"PRESERVED_SPECIMEN","GEODETIC_DATUM_ASSUMED_WGS84"
-40.25,-10.3,"Rugoloa pilosa",3043540433,"Serra da Jacobina. West of Estiva, ca. 12km. N. of Senhor do Bonfim on the BA 130 highway to Juazeiro. Lower west facing slopes of serra with television mast.","BRA",NA,1974,"PRESERVED_SPECIMEN","GEODETIC_DATUM_ASSUMED_WGS84"
-58.2,6.48,"Rugoloa pilosa",1456415369,"Atkinson Field, 3 mi. E of","GUY",NA,1954,"PRESERVED_SPECIMEN","GEODETIC_DATUM_ASSUMED_WGS84"
-58.683333,-4.166667,"Rugoloa pilosa",1931359899,"Occasional weedy grass on levee, guaraná plantation; E bank of Rio Abacaxis; black water, across from Axinim, fazenda of Francisco Ceará.","BRA",NA,1983,"PRESERVED_SPECIMEN","GEODETIC_DATUM_ASSUMED_WGS84;COLLECTION_MATCH_FUZZY"
-39.4592,-13.8908,"Rugoloa pilosa",1930367529,"23 km N of Itamarati on BR 101, then 6.8 km E on road to Embratel Tower. Reserva Municipal Cachoeira do Pau","BRA",NA,2003,"PRESERVED_SPECIMEN","GEODETIC_DATUM_ASSUMED_WGS84;COLLECTION_MATCH_FUZZY"
-49.2613935,-24.827474,"Rugoloa pilosa",1930221125,"Morro Grande","BRA",NA,1974,"PRESERVED_SPECIMEN","COORDINATE_REPROJECTED;COLLECTION_MATCH_FUZZY"
-41.38,-10.27,"Rugoloa pilosa",1930826459,"26km. North West of Lagoinha (which is 5.5km. S.W. of Delfino) on side road to Minas do Mimoso","BRA",NA,1974,"PRESERVED_SPECIMEN","GEODETIC_DATUM_ASSUMED_WGS84;COLLECTION_MATCH_FUZZY"
-47.78961,-18.01337,"Rugoloa pilosa",1929251498,"Contraforte Central, ca. 24 km N.E. of Catalão","BRA",1000,1970,"PRESERVED_SPECIMEN","COLLECTION_MATCH_FUZZY"
-50.173616,-6.055124,"Rugoloa pilosa",1928300332,"Serra dos Carajás. N-4, próximo a transição para a mata. Campo rupestre, solo de canga e na mata de terra firme.","BRA",NA,1984,"PRESERVED_SPECIMEN","COORDINATE_ROUNDED;COLLECTION_MATCH_FUZZY"
-70.13,18.57,"Rugoloa pilosa",1928387269,"Approximately 13 Km. S of Villa Altagracia on Autopista Duarte.","DOM",NA,1980,"PRESERVED_SPECIMEN","GEODETIC_DATUM_ASSUMED_WGS84;COLLECTION_MATCH_FUZZY"
-56.766667,-26.066667,"Rugoloa pilosa",4062175872,"National Park Ybycu'í, 6 km south of northwestern corner of park, along tributary of Arroyo Mina. Inundated savanna.","PRY",NA,1991,"PRESERVED_SPECIMEN","OCCURRENCE_STATUS_INFERRED_FROM_INDIVIDUAL_COUNT;COORDINATE_ROUNDED;GEODETIC_DATUM_ASSUMED_WGS84;DIFFERENT_OWNER_INSTITUTION"
-67.133333,3.933333,"Rugoloa pilosa",1259531893,"Santa Bárbara de Orinoco; 3 km W of the junction of the Río Orinoco and Río Ventuari,","VEN",NA,1979,"PRESERVED_SPECIMEN","OCCURRENCE_STATUS_INFERRED_FROM_INDIVIDUAL_COUNT;COORDINATE_ROUNDED;GEODETIC_DATUM_ASSUMED_WGS84;DIFFERENT_OWNER_INSTITUTION"
-77.3,-0.5,"Rugoloa pilosa",1259958282,"Comuna San José de Payamino at Río Payamino 4-5 hours upstream from Coca in motor canoe. Information: Silverio Jipa (33 years, married, 4 kids) and others from the community.","ECU",NA,1983,"PRESERVED_SPECIMEN","OCCURRENCE_STATUS_INFERRED_FROM_INDIVIDUAL_COUNT;GEODETIC_DATUM_ASSUMED_WGS84;DIFFERENT_OWNER_INSTITUTION"
-84.00361,10.43138,"Rugoloa pilosa",1259400139,"Finca La Selva, the OTS field station on the Río Puerto Viejo just E of its junction with the Río Sarapiquí.","CRI",NA,1986,"PRESERVED_SPECIMEN","OCCURRENCE_STATUS_INFERRED_FROM_INDIVIDUAL_COUNT;GEODETIC_DATUM_ASSUMED_WGS84;DIFFERENT_OWNER_INSTITUTION"
-68.463056,-15.044444,"Rugoloa pilosa",1259347284,"Área Natural de Manejo Integrado Apolobamba, Paujeyuyo.","BOL",NA,2004,"PRESERVED_SPECIMEN","OCCURRENCE_STATUS_INFERRED_FROM_INDIVIDUAL_COUNT;COORDINATE_ROUNDED;GEODETIC_DATUM_ASSUMED_WGS84;DIFFERENT_OWNER_INSTITUTION"
-76.183333,0.016667,"Rugoloa pilosa",1259764697,"Reserva Faunistica Cuyabeno, north of Lagune Grande.","ECU",NA,1989,"PRESERVED_SPECIMEN","OCCURRENCE_STATUS_INFERRED_FROM_INDIVIDUAL_COUNT;COORDINATE_ROUNDED;GEODETIC_DATUM_ASSUMED_WGS84;DIFFERENT_OWNER_INSTITUTION"
-83.966667,9.479167,"Rugoloa pilosa",1257621174,"R.F. Los Santos. Cuenca del Savegre. Dota, Cerro Plano.","CRI",NA,2003,"PRESERVED_SPECIMEN","OCCURRENCE_STATUS_INFERRED_FROM_INDIVIDUAL_COUNT;COORDINATE_ROUNDED;GEODETIC_DATUM_ASSUMED_WGS84;DIFFERENT_OWNER_INSTITUTION"
-54.946111,-27.088055,"Rugoloa pilosa",4061460953,"Predio UNLP, Reserva Valle del Arroyo Cuña Pirú. Alrededores del balneario, picada desde balneario a la ruta.","ARG",NA,2004,"PRESERVED_SPECIMEN","OCCURRENCE_STATUS_INFERRED_FROM_INDIVIDUAL_COUNT;COORDINATE_ROUNDED;GEODETIC_DATUM_ASSUMED_WGS84;DIFFERENT_OWNER_INSTITUTION"
-75.136389,-10.157778,"Rugoloa pilosa",2268841745,"Distrito Palcazú. Bosque de Protección San Matías San Carlos.","PER",NA,2016,"PRESERVED_SPECIMEN","OCCURRENCE_STATUS_INFERRED_FROM_INDIVIDUAL_COUNT;COORDINATE_ROUNDED;GEODETIC_DATUM_ASSUMED_WGS84;DIFFERENT_OWNER_INSTITUTION"
-84.116667,14.55,"Rugoloa pilosa",4061271730,"Miguel Bikon; rain forest [Seymour series]","NIC",NA,1972,"PRESERVED_SPECIMEN","OCCURRENCE_STATUS_INFERRED_FROM_INDIVIDUAL_COUNT;COORDINATE_ROUNDED;GEODETIC_DATUM_ASSUMED_WGS84;DIFFERENT_OWNER_INSTITUTION"
-60.834722,-14.617222,"Rugoloa pilosa",1258364844,"Parque Nacional Noel Kempff Mercado, a 15 km. del Campamento Los Fierros Bosque Alto siempre verde.","BOL",NA,1997,"PRESERVED_SPECIMEN","OCCURRENCE_STATUS_INFERRED_FROM_INDIVIDUAL_COUNT;COORDINATE_ROUNDED;GEODETIC_DATUM_ASSUMED_WGS84;DIFFERENT_OWNER_INSTITUTION"
-84.467117,12.003967,"Rugoloa pilosa",1258149344,"Sur de Muelle de los Bueyes, bosques riberos de Río La Tortuga","NIC",NA,2013,"PRESERVED_SPECIMEN","OCCURRENCE_STATUS_INFERRED_FROM_INDIVIDUAL_COUNT;COORDINATE_ROUNDED;GEODETIC_DATUM_ASSUMED_WGS84;DIFFERENT_OWNER_INSTITUTION"
-77.8,-0.9,"Rugoloa pilosa",1259765015,"Archidona.","ECU",NA,1968,"PRESERVED_SPECIMEN","GEODETIC_DATUM_ASSUMED_WGS84;DIFFERENT_OWNER_INSTITUTION"
-79.03333,0.1,"Rugoloa pilosa",4061772363,"NE of Vicente Maldonado, Reserva de ENDESA.","ECU",NA,1984,"PRESERVED_SPECIMEN","GEODETIC_DATUM_ASSUMED_WGS84;INSTITUTION_MATCH_NONE"
-83.390278,9.159722,"Rugoloa pilosa",1257618836,"No protegida. Cuenca Térraba-Sierpe. Carretera Interamericana Sur. Río Volcán.","CRI",NA,2005,"PRESERVED_SPECIMEN","OCCURRENCE_STATUS_INFERRED_FROM_INDIVIDUAL_COUNT;COORDINATE_ROUNDED;GEODETIC_DATUM_ASSUMED_WGS84;DIFFERENT_OWNER_INSTITUTION"
-63.6,-17.733333,"Rugoloa pilosa",4062067627,"Parque Nacional Amboró, 0.5-2 km upstream and SW from park camp, along Río Macuñucú.","BOL",NA,1991,"PRESERVED_SPECIMEN","OCCURRENCE_STATUS_INFERRED_FROM_INDIVIDUAL_COUNT;COORDINATE_ROUNDED;GEODETIC_DATUM_ASSUMED_WGS84;DIFFERENT_OWNER_INSTITUTION"
-61.846389,-16.520278,"Rugoloa pilosa",1261891537,"Area de estudio del proyecto BOLFOR, Las Trancas.","BOL",NA,1994,"PRESERVED_SPECIMEN","OCCURRENCE_STATUS_INFERRED_FROM_INDIVIDUAL_COUNT;COORDINATE_ROUNDED;GEODETIC_DATUM_ASSUMED_WGS84;DIFFERENT_OWNER_INSTITUTION"
-83.52,10.37,"Rugoloa pilosa",1258324618,"P.N. Tortuguero. Llanura de Tortuguero. Estación Sierpe.","CRI",NA,1990,"PRESERVED_SPECIMEN","GEODETIC_DATUM_ASSUMED_WGS84;DIFFERENT_OWNER_INSTITUTION"
-63.565833,-17.115556,"Rugoloa pilosa",1257883411,"Estancia Juan Deriva, alrededores del potrero.","BOL",NA,2009,"PRESERVED_SPECIMEN","OCCURRENCE_STATUS_INFERRED_FROM_INDIVIDUAL_COUNT;COORDINATE_ROUNDED;GEODETIC_DATUM_ASSUMED_WGS84;DIFFERENT_OWNER_INSTITUTION"
-61.1,4.883333,"Rugoloa pilosa",4061186563,"A lo largo de la Quebrada del Jaspe, aprox. 8 km al SE de San Ignacio de Yuruaní.","VEN",NA,1983,"PRESERVED_SPECIMEN","OCCURRENCE_STATUS_INFERRED_FROM_INDIVIDUAL_COUNT;COORDINATE_ROUNDED;GEODETIC_DATUM_ASSUMED_WGS84;DIFFERENT_OWNER_INSTITUTION"
-53.983333,-26.516667,"Rugoloa pilosa",4062234824,"Parque Provinvial Cruce Caballero, Ruta Nac. 14, 14 km de San Pedro camino a Tobuna","ARG",NA,1996,"PRESERVED_SPECIMEN","OCCURRENCE_STATUS_INFERRED_FROM_INDIVIDUAL_COUNT;COORDINATE_ROUNDED;GEODETIC_DATUM_ASSUMED_WGS84;DIFFERENT_OWNER_INSTITUTION"
-52.33,4.93,"Rugoloa pilosa",1456271141,"Cayenne, terrain Rebord","GUF",NA,1955,"PRESERVED_SPECIMEN","GEODETIC_DATUM_ASSUMED_WGS84"
-69.004089,12.200192,"Rugoloa pilosa",3783434840,"Curacao","CUW",500,2013,"HUMAN_OBSERVATION","COORDINATE_ROUNDED;CONTINENT_DERIVED_FROM_COORDINATES"
-57.681389,-15.228611,"Rugoloa pilosa",2236677912,"Bacia Hidrológica do Alto Rio Paraguai, Canais de drenagem ao longo da rua a cerca de 500 metros do rio; capoeira fortemente perturbada com dominância de palmeiras, usada como pasto; solos lateríticos, doiminância de palmas (cortadas).","BRA",NA,2002,"PRESERVED_SPECIMEN","GEODETIC_DATUM_ASSUMED_WGS84;CONTINENT_DERIVED_FROM_COORDINATES;CONTINENT_INVALID;INSTITUTION_MATCH_FUZZY;INSTITUTION_COLLECTION_MISMATCH"
-49.4075,-26.923889,"Rugoloa pilosa",3461467399,"São Pedro Velho.","BRA",NA,2016,"PRESERVED_SPECIMEN","COORDINATE_ROUNDED;GEODETIC_DATUM_ASSUMED_WGS84;CONTINENT_DERIVED_FROM_COORDINATES;INSTITUTION_MATCH_NONE"
-49.497222,-28.529167,"Rugoloa pilosa",3461472403,"Cirenaica.","BRA",NA,2010,"PRESERVED_SPECIMEN","COORDINATE_ROUNDED;GEODETIC_DATUM_ASSUMED_WGS84;CONTINENT_DERIVED_FROM_COORDINATES;INSTITUTION_MATCH_NONE"
-72.404475,3.4462,"Rugoloa pilosa",3893499371,"Hato Palmeras, vereda Puerto Castro, Serranía de Manacacías","COL",NA,2014,"HUMAN_OBSERVATION",""
-48.9,-27.1,"Rugoloa pilosa",2998563365,"Azambuja, Brusque.","BRA",NA,1952,"PRESERVED_SPECIMEN","GEODETIC_DATUM_ASSUMED_WGS84;CONTINENT_DERIVED_FROM_COORDINATES;INSTITUTION_MATCH_FUZZY;COLLECTION_MATCH_FUZZY"
-51.766667,-12.816667,"Rugoloa pilosa",2998280262,"W of km 229, Xavantina-Cachimbo road. .","BRA",NA,1967,"PRESERVED_SPECIMEN","COORDINATE_ROUNDED;GEODETIC_DATUM_ASSUMED_WGS84;CONTINENT_DERIVED_FROM_COORDINATES;INSTITUTION_MATCH_FUZZY;COLLECTION_MATCH_FUZZY"
-39.888333,-19.1425,"Rugoloa pilosa",2998565361,"Reserva da Camnia Vale do Rio Doce, estrada Paraju, km 1,9. .","BRA",NA,2006,"PRESERVED_SPECIMEN","RECORDED_DATE_INVALID;COORDINATE_ROUNDED;GEODETIC_DATUM_ASSUMED_WGS84;CONTINENT_DERIVED_FROM_COORDINATES;INSTITUTION_MATCH_FUZZY;COLLECTION_MATCH_FUZZY"
-96.10444,15.98583,"Rugoloa pilosa",46375787,"Distrito Pochutla; Santa Maria Xadani, 4 Km al N, por la brecha a San Miguel del","MEX",NA,1999,"PRESERVED_SPECIMEN","GEODETIC_DATUM_ASSUMED_WGS84;CONTINENT_DERIVED_FROM_COORDINATES;INSTITUTION_MATCH_FUZZY;INSTITUTION_COLLECTION_MISMATCH"
-94.61667,17.26667,"Rugoloa pilosa",46375916,"Rio Solosuchil, a orillas del Campamento Hnos. Cedillo, Hidalgotitlan","MEX",NA,1974,"PRESERVED_SPECIMEN","GEODETIC_DATUM_ASSUMED_WGS84;CONTINENT_DERIVED_FROM_COORDINATES;INSTITUTION_MATCH_FUZZY;INSTITUTION_COLLECTION_MISMATCH"
-79.91667,8.7,"Rugoloa pilosa",46376157,"Cerro Campana","PAN",NA,1980,"PRESERVED_SPECIMEN","GEODETIC_DATUM_ASSUMED_WGS84;CONTINENT_DERIVED_FROM_COORDINATES;INSTITUTION_MATCH_FUZZY;INSTITUTION_COLLECTION_MISMATCH"
-54.54111,3.10472,"Rugoloa pilosa",46376943,"Vicinity of airstrip along ulemari River, 71 Km up Ulemari River from its","SUR",NA,1998,"PRESERVED_SPECIMEN","COUNTRY_DERIVED_FROM_COORDINATES;GEODETIC_DATUM_ASSUMED_WGS84;CONTINENT_DERIVED_FROM_COORDINATES;INSTITUTION_MATCH_FUZZY;INSTITUTION_COLLECTION_MISMATCH"
-54.25861,3.22139,"Rugoloa pilosa",46376939,"Vicinity of Ulemari River, 13 Km upstream from its confluence with Litani River","SUR",NA,1998,"PRESERVED_SPECIMEN","COUNTRY_DERIVED_FROM_COORDINATES;GEODETIC_DATUM_ASSUMED_WGS84;CONTINENT_DERIVED_FROM_COORDINATES;INSTITUTION_MATCH_FUZZY;INSTITUTION_COLLECTION_MISMATCH"
-89.43333,18.25472,"Rugoloa pilosa",46376915,"A 4 Km al NE de Narciso Mendoza","MEX",NA,1997,"PRESERVED_SPECIMEN","GEODETIC_DATUM_ASSUMED_WGS84;CONTINENT_DERIVED_FROM_COORDINATES;INSTITUTION_MATCH_FUZZY;INSTITUTION_COLLECTION_MISMATCH"
-89.93333,13.81667,"Rugoloa pilosa",46376914,"P.N. El Imposible","SLV",NA,1990,"PRESERVED_SPECIMEN","GEODETIC_DATUM_ASSUMED_WGS84;CONTINENT_DERIVED_FROM_COORDINATES;INSTITUTION_MATCH_FUZZY;INSTITUTION_COLLECTION_MISMATCH"
-89.11778,16.5225,"Rugoloa pilosa",46376985,"Ceibo Grande Camp","BLZ",NA,2000,"PRESERVED_SPECIMEN","GEODETIC_DATUM_ASSUMED_WGS84;CONTINENT_DERIVED_FROM_COORDINATES;INSTITUTION_MATCH_FUZZY;INSTITUTION_COLLECTION_MISMATCH"
-94.77639,18.31528,"Rugoloa pilosa",46376881,"Benigno Mendoza","MEX",NA,1994,"PRESERVED_SPECIMEN","GEODETIC_DATUM_ASSUMED_WGS84;CONTINENT_DERIVED_FROM_COORDINATES;INSTITUTION_MATCH_FUZZY;INSTITUTION_COLLECTION_MISMATCH"
-89.40361,18.69167,"Rugoloa pilosa",46376874,"Km 20 de la carretera Xpujil-Campeche","MEX",NA,1997,"PRESERVED_SPECIMEN","GEODETIC_DATUM_ASSUMED_WGS84;CONTINENT_DERIVED_FROM_COORDINATES;INSTITUTION_MATCH_FUZZY;INSTITUTION_COLLECTION_MISMATCH"
-76.6,-2.1,"Rugoloa pilosa",46376505,"Comunidad de Pompeya. Carretera y Oleducto de Maxus en construccion,","ECU",NA,1994,"PRESERVED_SPECIMEN","GEODETIC_DATUM_ASSUMED_WGS84;PRESUMED_NEGATED_LATITUDE;CONTINENT_DERIVED_FROM_COORDINATES;INSTITUTION_MATCH_FUZZY;INSTITUTION_COLLECTION_MISMATCH"
-95.06917,18.57667,"Rugoloa pilosa",46376548,"1.5 Km al NE de La Estacion de Biologia Tropical Los Tuxtlas","MEX",NA,1994,"PRESERVED_SPECIMEN","GEODETIC_DATUM_ASSUMED_WGS84;CONTINENT_DERIVED_FROM_COORDINATES;INSTITUTION_MATCH_FUZZY;INSTITUTION_COLLECTION_MISMATCH"
-76.33333,-2.85,"Rugoloa pilosa",46376560,"Dept. Loreto, Prov. Alto Amazonas. Capahuari Sur (Campamento Petrolero).","PER",NA,1982,"PRESERVED_SPECIMEN","GEODETIC_DATUM_ASSUMED_WGS84;PRESUMED_NEGATED_LATITUDE;CONTINENT_DERIVED_FROM_COORDINATES;INSTITUTION_MATCH_FUZZY;INSTITUTION_COLLECTION_MISMATCH"
-91.23333,16.36667,"Rugoloa pilosa",46376410,"1.5 Km al NW de La Colonia Benito Juarez Miramar, sobre el camino","MEX",NA,1993,"PRESERVED_SPECIMEN","GEODETIC_DATUM_ASSUMED_WGS84;CONTINENT_DERIVED_FROM_COORDINATES;INSTITUTION_MATCH_FUZZY;INSTITUTION_COLLECTION_MISMATCH"
-105.06444,21.50472,"Rugoloa pilosa",46376431,"2 Km al W del Poblado La Yerba, enfrente del Cerro Los Voladeros","MEX",NA,1994,"PRESERVED_SPECIMEN","GEODETIC_DATUM_ASSUMED_WGS84;CONTINENT_DERIVED_FROM_COORDINATES;INSTITUTION_MATCH_FUZZY;INSTITUTION_COLLECTION_MISMATCH"
-76.45,6.66667,"Rugoloa pilosa",46376492,"Mpio. de Frontino: road between Nutibara and La Blanquita, region of lower Murri","COL",NA,1989,"PRESERVED_SPECIMEN","GEODETIC_DATUM_ASSUMED_WGS84;CONTINENT_DERIVED_FROM_COORDINATES;INSTITUTION_MATCH_FUZZY;INSTITUTION_COLLECTION_MISMATCH"
-104.95,21.25,"Rugoloa pilosa",46376347,"A 6 km al W de Compostela sobre el camino a las Cumbres de Huicicila","MEX",NA,1986,"PRESERVED_SPECIMEN","GEODETIC_DATUM_ASSUMED_WGS84;CONTINENT_DERIVED_FROM_COORDINATES;INSTITUTION_MATCH_FUZZY;INSTITUTION_COLLECTION_MISMATCH"
-80.13333,8.61667,"Rugoloa pilosa",46376335,"Vicinity of La Mesa, N of El Vallle de Anton, along East edge of Cerro Gaital","PAN",NA,1987,"PRESERVED_SPECIMEN","GEODETIC_DATUM_ASSUMED_WGS84;CONTINENT_DERIVED_FROM_COORDINATES;INSTITUTION_MATCH_FUZZY;INSTITUTION_COLLECTION_MISMATCH"
-58.43,-11,"Rugoloa pilosa",3343052457,"Estrada Juruena-Castanheira, próximo ao Rio Vermelho. Contato Floresta Ombrófila-Floresta Estacional","BRA",NA,1997,"PRESERVED_SPECIMEN","GEODETIC_DATUM_ASSUMED_WGS84;CONTINENT_DERIVED_FROM_COORDINATES;AMBIGUOUS_INSTITUTION"
-55.646944,-20.071667,"Rugoloa pilosa",2451461559,"Fazenda Taboco, margem do Rio Taboco, Rodovia MS-419, sub-região de Aquidauana, Pantanal.","BRA",NA,2006,"PRESERVED_SPECIMEN","COORDINATE_ROUNDED;GEODETIC_DATUM_ASSUMED_WGS84;CONTINENT_DERIVED_FROM_COORDINATES;INSTITUTION_MATCH_FUZZY;INSTITUTION_COLLECTION_MISMATCH"
-54.705556,-17.936389,"Rugoloa pilosa",2237736330,"MS-214 (Transpantaneira); ca. 1km da BR-163.","BRA",NA,2009,"PRESERVED_SPECIMEN","COORDINATE_ROUNDED;GEODETIC_DATUM_ASSUMED_WGS84;CONTINENT_DERIVED_FROM_COORDINATES;INSTITUTION_MATCH_FUZZY;INSTITUTION_COLLECTION_MISMATCH"
-57.605833,-19.107778,"Rugoloa pilosa",2612205011,"Pantanal sub-região do Paraguai; MS-228; início da estrada para Porto da Manga.","BRA",NA,2009,"PRESERVED_SPECIMEN","COORDINATE_ROUNDED;GEODETIC_DATUM_ASSUMED_WGS84;CONTINENT_DERIVED_FROM_COORDINATES;INSTITUTION_MATCH_FUZZY;INSTITUTION_COLLECTION_MISMATCH"
-52.128889,-20.027222,"Rugoloa pilosa",2612205519,"Fazenda Santa Cláudia, ao longo do Rio Sucuriú, em frente ao pesqueiro, com pasarela para o rio.","BRA",NA,2011,"PRESERVED_SPECIMEN","COORDINATE_ROUNDED;GEODETIC_DATUM_ASSUMED_WGS84;CONTINENT_DERIVED_FROM_COORDINATES;INSTITUTION_MATCH_FUZZY;INSTITUTION_COLLECTION_MISMATCH"
-57.683333,-17.738333,"Rugoloa pilosa",2237740084,"Sub-região Pantanal do Paraguai, mata do fundão da RPPN Acurizal.","BRA",NA,2010,"PRESERVED_SPECIMEN","COORDINATE_ROUNDED;GEODETIC_DATUM_ASSUMED_WGS84;CONTINENT_DERIVED_FROM_COORDINATES;INSTITUTION_MATCH_FUZZY;INSTITUTION_COLLECTION_MISMATCH"
-57.566667,-17.816667,"Rugoloa pilosa",2237773308,"Baía do Acurizal, Fazenda Acurizal, borda oeste do Pantanal.","BRA",NA,2001,"PRESERVED_SPECIMEN","COORDINATE_ROUNDED;GEODETIC_DATUM_ASSUMED_WGS84;CONTINENT_DERIVED_FROM_COORDINATES;INSTITUTION_MATCH_FUZZY;INSTITUTION_COLLECTION_MISMATCH"
-55.469444,-20.459722,"Rugoloa pilosa",2237731096,"Distrito de Piraputanga. Retiro da Igreja Batista.","BRA",NA,2006,"PRESERVED_SPECIMEN","COORDINATE_ROUNDED;GEODETIC_DATUM_ASSUMED_WGS84;CONTINENT_DERIVED_FROM_COORDINATES;INSTITUTION_MATCH_FUZZY;INSTITUTION_COLLECTION_MISMATCH"
-57.558611,-19.167222,"Rugoloa pilosa",3971169925,"Rodovia BR-262, a 5 Km do Clube do Laço.","BRA",NA,2001,"PRESERVED_SPECIMEN","COORDINATE_ROUNDED;GEODETIC_DATUM_ASSUMED_WGS84;CONTINENT_DERIVED_FROM_COORDINATES;INSTITUTION_MATCH_FUZZY;INSTITUTION_COLLECTION_MISMATCH"
-55.4275,-11.601389,"Rugoloa pilosa",2612208900,"Ribeirão Selma Na interseção com a estrada BR-163.","BRA",NA,2016,"PRESERVED_SPECIMEN","COORDINATE_ROUNDED;GEODETIC_DATUM_ASSUMED_WGS84;CONTINENT_DERIVED_FROM_COORDINATES;INSTITUTION_MATCH_FUZZY;INSTITUTION_COLLECTION_MISMATCH"
-51.089167,-19.304722,"Rugoloa pilosa",2612209002,"Fazenda Nova Ponte.","BRA",NA,2004,"PRESERVED_SPECIMEN","COORDINATE_ROUNDED;GEODETIC_DATUM_ASSUMED_WGS84;CONTINENT_DERIVED_FROM_COORDINATES;INSTITUTION_MATCH_FUZZY;INSTITUTION_COLLECTION_MISMATCH"
-55.506111,-20.455556,"Rugoloa pilosa",2237751208,"Piraputanga, MS 450.","BRA",NA,2010,"PRESERVED_SPECIMEN","COORDINATE_ROUNDED;GEODETIC_DATUM_ASSUMED_WGS84;CONTINENT_DERIVED_FROM_COORDINATES;INSTITUTION_MATCH_FUZZY;INSTITUTION_COLLECTION_MISMATCH"
-57.5525,-17.877222,"Rugoloa pilosa",2237733297,"Faz. Acorizal, direção Córrego do Fundão.","BRA",NA,2008,"PRESERVED_SPECIMEN","COORDINATE_ROUNDED;GEODETIC_DATUM_ASSUMED_WGS84;CONTINENT_DERIVED_FROM_COORDINATES;INSTITUTION_MATCH_FUZZY;INSTITUTION_COLLECTION_MISMATCH"
-50.411285,-25.85906,"Rugoloa pilosa",188384512,"Sao Mateus do Sul. Minas de Xisto","BRA",NA,2006,"PRESERVED_SPECIMEN","OCCURRENCE_STATUS_INFERRED_FROM_INDIVIDUAL_COUNT;GEODETIC_DATUM_ASSUMED_WGS84;CONTINENT_DERIVED_FROM_COORDINATES;INSTITUTION_MATCH_FUZZY;COLLECTION_MATCH_NONE"
-35.715,-6.970278,"Rugoloa pilosa",3414139445,"Centro de Ciências Agrárias","BRA",NA,2017,"PRESERVED_SPECIMEN","GEODETIC_DATUM_ASSUMED_WGS84;CONTINENT_DERIVED_FROM_COORDINATES;INSTITUTION_MATCH_FUZZY;INSTITUTION_COLLECTION_MISMATCH"
-35.458333,-6.735,"Rugoloa pilosa",3414139995,"Sítio Canafístula","BRA",NA,2021,"PRESERVED_SPECIMEN","GEODETIC_DATUM_ASSUMED_WGS84;CONTINENT_DERIVED_FROM_COORDINATES;INSTITUTION_MATCH_FUZZY;INSTITUTION_COLLECTION_MISMATCH"
-72.48,9.3,"Rugoloa pilosa",3043559912,"Distrito Colón: forested slopes at the settlement of Río de Oro along the Río de Oro, along the Venezuelan-Colombian border.","VEN",NA,1980,"PRESERVED_SPECIMEN","GEODETIC_DATUM_ASSUMED_WGS84"
-60.5161,5.24039,"Rugoloa pilosa",1456318575,"Wayalayeng Village, Falls of the Ataro River above first escarpment of Mount Maringma","GUY",NA,2004,"PRESERVED_SPECIMEN","GEODETIC_DATUM_ASSUMED_WGS84"
-56.5,3.51,"Rugoloa pilosa",1456136200,"Lucie R. ca 2 km below affluence of Oost R., Wilhelmina Gebergte","SUR",NA,1963,"PRESERVED_SPECIMEN","GEODETIC_DATUM_ASSUMED_WGS84"
-57.7,5,"Rugoloa pilosa",1456242729,"Baba Grant Sawmill, along Corentyne River","GUY",NA,1990,"PRESERVED_SPECIMEN","GEODETIC_DATUM_ASSUMED_WGS84"
-75.2,9.88,"Rugoloa pilosa",3043526752,"Mun. de San Jacinto; ca. 16 km NW of San Jacinto, Cerro Maco, ca. 200 m SE of radar installation.","COL",NA,1985,"PRESERVED_SPECIMEN","GEODETIC_DATUM_ASSUMED_WGS84"
-52.15,4.55,"Rugoloa pilosa",1456298357,"Cayenne, Montagne de Kaw, Pk. 45.5","GUF",NA,1987,"PRESERVED_SPECIMEN","GEODETIC_DATUM_ASSUMED_WGS84"
-52.25,-15.85,"Rugoloa pilosa",3043546435,"Royal Society/Royal Geographical Society Expedition 1967-1969. Central Brazilian Plateau. Aragarças. 13 km. N. of Aragarças. In low forest bordering stream.","BRA",NA,1968,"PRESERVED_SPECIMEN","GEODETIC_DATUM_ASSUMED_WGS84"
-64.42,10.25,"Rugoloa pilosa",3043553858,"Entre Barcelona y Cumana, carretera secundaria a 8 Km al sur de Santa Fe.","VEN",NA,1989,"PRESERVED_SPECIMEN","GEODETIC_DATUM_ASSUMED_WGS84"
-58.63,5.31,"Rugoloa pilosa",1456146396,"Mabura Hill, ca. 3 km from","GUY",NA,1982,"PRESERVED_SPECIMEN","GEODETIC_DATUM_ASSUMED_WGS84"
-53.13,2.96,"Rugoloa pilosa",1456196880,"Chemin des Emérillons, 10. 6 km de Dégrad Claude, à son intersection avec le petit Tamouri","GUF",NA,1974,"PRESERVED_SPECIMEN","GEODETIC_DATUM_ASSUMED_WGS84"
-53.81,5.6,"Rugoloa pilosa",1456113217,"Mana, Medeyre","GUF",NA,1990,"PRESERVED_SPECIMEN","GEODETIC_DATUM_ASSUMED_WGS84"
-49.3,-8.25,"Rugoloa pilosa",3043570490,"Município Conceição do Araguaia: Conceição do Araguaia, 2 km. west of town along highway PA-287.","BRA",NA,1980,"PRESERVED_SPECIMEN","GEODETIC_DATUM_ASSUMED_WGS84"
-59.48,5.16,"Rugoloa pilosa",1456467644,"Kaieteur Falls, Potaro R.","GUY",NA,1962,"PRESERVED_SPECIMEN","GEODETIC_DATUM_ASSUMED_WGS84"
-52.46,4.05,"Rugoloa pilosa",1456343987,"Approuague, Crique Ekini","GUF",NA,1955,"PRESERVED_SPECIMEN","GEODETIC_DATUM_ASSUMED_WGS84"
-104.228333,19.430556,"Rugoloa pilosa",1893972402,"Entre el crucero de La Rosa y Las Marías","MEX",90,1991,"PRESERVED_SPECIMEN","TYPE_STATUS_INVALID;OCCURRENCE_STATUS_INFERRED_FROM_INDIVIDUAL_COUNT;COORDINATE_ROUNDED;GEODETIC_DATUM_ASSUMED_WGS84;CONTINENT_DERIVED_FROM_COORDINATES;ELEVATION_MIN_MAX_SWAPPED;INSTITUTION_MATCH_NONE"
-104.1068984,19.2767216,"Rugoloa pilosa",1893972427,"Arrayanal","MEX",3080,1992,"PRESERVED_SPECIMEN","TYPE_STATUS_INVALID;OCCURRENCE_STATUS_INFERRED_FROM_INDIVIDUAL_COUNT;COORDINATE_REPROJECTED;COORDINATE_ROUNDED;CONTINENT_DERIVED_FROM_COORDINATES;ELEVATION_MIN_MAX_SWAPPED;INSTITUTION_MATCH_NONE"
-104.419167,19.618889,"Rugoloa pilosa",1893972380,"El Tecolote, 1-2 km al NE de Casimiro Castillo","MEX",90,1989,"PRESERVED_SPECIMEN","TYPE_STATUS_INVALID;OCCURRENCE_STATUS_INFERRED_FROM_INDIVIDUAL_COUNT;COORDINATE_ROUNDED;GEODETIC_DATUM_ASSUMED_WGS84;CONTINENT_DERIVED_FROM_COORDINATES;ELEVATION_MIN_MAX_SWAPPED;INSTITUTION_MATCH_NONE"
-84.28,9.72,"Rugoloa pilosa",1096714300,"Flora de Costa Rica. San José: Acosta. No protegida. Cuenca del Pirrís-Damas. Fila San Jerónimo, justo antes de San Jerónimo.","CRI",NA,2000,"PRESERVED_SPECIMEN","GEODETIC_DATUM_ASSUMED_WGS84;CONTINENT_DERIVED_FROM_COORDINATES;CONTINENT_INVALID;INSTITUTION_COLLECTION_MISMATCH"
-80.458333,8.666667,"Rugoloa pilosa",1259269743,"Continental divide N of Penonomé on road to Coclesito.","PAN",NA,1978,"PRESERVED_SPECIMEN","OCCURRENCE_STATUS_INFERRED_FROM_INDIVIDUAL_COUNT;COORDINATE_ROUNDED;GEODETIC_DATUM_ASSUMED_WGS84;INSTITUTION_MATCH_FUZZY;COLLECTION_MATCH_NONE"
-54.3,4.9,"Rugoloa pilosa",1260331063,"Crique Cabassou, lle de Cayenne. Lisiére de forêt marécageuse. Bord de piste, sur sol hydromorphe. Route R.N. 3.","GUF",NA,2002,"PRESERVED_SPECIMEN","OCCURRENCE_STATUS_INFERRED_FROM_INDIVIDUAL_COUNT;GEODETIC_DATUM_ASSUMED_WGS84;INSTITUTION_MATCH_FUZZY;COLLECTION_MATCH_NONE"
-62.05,-14.416667,"Rugoloa pilosa",4031523698,"Serranía San Simón.","BOL",NA,1994,"PRESERVED_SPECIMEN","OCCURRENCE_STATUS_INFERRED_FROM_INDIVIDUAL_COUNT;COORDINATE_ROUNDED;GEODETIC_DATUM_ASSUMED_WGS84;INSTITUTION_MATCH_FUZZY;COLLECTION_MATCH_NONE"
-83.34,8.4,"Rugoloa pilosa",1259544876,"Cantón de Golfito Jiménez, Río Piro.","CRI",NA,1991,"PRESERVED_SPECIMEN","OCCURRENCE_STATUS_INFERRED_FROM_INDIVIDUAL_COUNT;GEODETIC_DATUM_ASSUMED_WGS84;INSTITUTION_MATCH_FUZZY;COLLECTION_MATCH_NONE"
-86,15.9,"Rugoloa pilosa",1259272744,"Ciudad de Puerto Castilla y alrededores. Clima lluvioso tropical húmedo","HND",NA,1973,"PRESERVED_SPECIMEN","OCCURRENCE_STATUS_INFERRED_FROM_INDIVIDUAL_COUNT;GEODETIC_DATUM_ASSUMED_WGS84;INSTITUTION_MATCH_FUZZY;COLLECTION_MATCH_NONE"
-62,-16.033333,"Rugoloa pilosa",1260330966,"Est. Las Madres, 10 km N of Concepción.","BOL",NA,1985,"PRESERVED_SPECIMEN","OCCURRENCE_STATUS_INFERRED_FROM_INDIVIDUAL_COUNT;COORDINATE_ROUNDED;GEODETIC_DATUM_ASSUMED_WGS84;INSTITUTION_MATCH_FUZZY;COLLECTION_MATCH_NONE"
-67.416667,6.416667,"Rugoloa pilosa",1260331211,"Puerto Ayacucho. Bosque húmedo del río Cataniapo. Sector Puente, margen isquierda.","VEN",NA,1981,"PRESERVED_SPECIMEN","OCCURRENCE_STATUS_INFERRED_FROM_INDIVIDUAL_COUNT;COORDINATE_ROUNDED;GEODETIC_DATUM_ASSUMED_WGS84;INSTITUTION_MATCH_FUZZY;COLLECTION_MATCH_NONE"
-79.384722,9.213889,"Rugoloa pilosa",1259271565,"Cerro Jefé","PAN",NA,1966,"PRESERVED_SPECIMEN","OCCURRENCE_STATUS_INFERRED_FROM_INDIVIDUAL_COUNT;COORDINATE_ROUNDED;GEODETIC_DATUM_ASSUMED_WGS84;INSTITUTION_MATCH_FUZZY;COLLECTION_MATCH_NONE"
