"lon","lat","species","gbifID","locality","countryCode","coordinateUncertaintyInMeters","year","basisOfRecord","issue"
-53.161944,4.0675,"Rugoloa pilosa",4062202143,"D.Z. de Crique Jupiter, Bassin du Sinnamary.","GUF",NA,1991,"PRESERVED_SPECIMEN","OCCURRENCE_STATUS_INFERRED_FROM_INDIVIDUAL_COUNT;COORDINATE_ROUNDED;GEODETIC_DATUM_ASSUMED_WGS84;DIFFERENT_OWNER_INSTITUTION"
-85.85,16.46666,"Rugoloa pilosa",1259499946,"North East Bight","HND",NA,1987,"PRESERVED_SPECIMEN","GEODETIC_DATUM_ASSUMED_WGS84;DIFFERENT_OWNER_INSTITUTION"
-78.55,0.83333,"Rugoloa pilosa",4061052288,"Km 14-16 Lita - San Lorenzo.","ECU",NA,1988,"PRESERVED_SPECIMEN","GEODETIC_DATUM_ASSUMED_WGS84;INSTITUTION_MATCH_NONE"
-67.090278,-9.958056,"Rugoloa pilosa",4061921923,"Municipio Acrelândia; along Highway BR-364 from Rio Branco to Porto Velho, Km 88 from Rio Branco.","BRA",NA,2001,"PRESERVED_SPECIMEN","OCCURRENCE_STATUS_INFERRED_FROM_INDIVIDUAL_COUNT;COORDINATE_ROUNDED;GEODETIC_DATUM_ASSUMED_WGS84;DIFFERENT_OWNER_INSTITUTION"
-64.43333,-17.23333,"Rugoloa pilosa",1259279863,"Río Blanco, a unos 6 km de entre Ríos. Barbecho 12 a1os, chaco vecino Mario Bustamante, transecto 26.","BOL",NA,2000,"PRESERVED_SPECIMEN","GEODETIC_DATUM_ASSUMED_WGS84;DIFFERENT_OWNER_INSTITUTION"
-92.112222,16.958611,"Rugoloa pilosa",1259487162,"Slopes and steep ravines, 6-8 km north of Ocosingo along road to Bachajon.","MEX",NA,1971,"PRESERVED_SPECIMEN","OCCURRENCE_STATUS_INFERRED_FROM_INDIVIDUAL_COUNT;COORDINATE_ROUNDED;GEODETIC_DATUM_ASSUMED_WGS84;DIFFERENT_OWNER_INSTITUTION"
-92.19,17.54,"Rugoloa pilosa",1259487493,"Steep slope near Agua Azul.","MEX",NA,1981,"PRESERVED_SPECIMEN","OCCURRENCE_STATUS_INFERRED_FROM_INDIVIDUAL_COUNT;GEODETIC_DATUM_ASSUMED_WGS84;DIFFERENT_OWNER_INSTITUTION"
-76.483333,-0.583333,"Rugoloa pilosa",1261551902,"Parque Nacional Yasuni. Carretera y oleodcuto de Maxus en construcción, Km 29-41.","ECU",NA,1994,"PRESERVED_SPECIMEN","OCCURRENCE_STATUS_INFERRED_FROM_INDIVIDUAL_COUNT;COORDINATE_ROUNDED;GEODETIC_DATUM_ASSUMED_WGS84;INSTITUTION_MATCH_NONE"
-54.30747,4.01115,"Rugoloa pilosa",2473958923,"","GUF",50,2012,"HUMAN_OBSERVATION","COUNTRY_MISMATCH;CONTINENT_DERIVED_FROM_COORDINATES"
-67.25,5.583333,"Rugoloa pilosa",1259530595,"On slopes 1 km from N side of Rio Cataniapo, area of dam site, 45 km SE of Puerto Ayacucho.","VEN",NA,1980,"PRESERVED_SPECIMEN","OCCURRENCE_STATUS_INFERRED_FROM_INDIVIDUAL_COUNT;COORDINATE_ROUNDED;GEODETIC_DATUM_ASSUMED_WGS84;DIFFERENT_OWNER_INSTITUTION"
-60.95,9.25,"Rugoloa pilosa",1259537126,"Uper reaches of riverine forest of Caño Atoiba tributary of Boca Araguao.","VEN",NA,1977,"PRESERVED_SPECIMEN","OCCURRENCE_STATUS_INFERRED_FROM_INDIVIDUAL_COUNT;GEODETIC_DATUM_ASSUMED_WGS84;DIFFERENT_OWNER_INSTITUTION"
-66.616944,-14.18667,"Rugoloa pilosa",1259274930,"Isla Sumuque, forest island 1.5 km north of Estancia Espiritu","BOL",NA,1987,"PRESERVED_SPECIMEN","OCCURRENCE_STATUS_INFERRED_FROM_INDIVIDUAL_COUNT;GEODETIC_DATUM_ASSUMED_WGS84;DIFFERENT_OWNER_INSTITUTION"
-79.21666,-0.31666,"Rugoloa pilosa",4061858452,"Estación Biológica Gustavo Orcés, vía Santo Domingo-Quevedo, km 11.5. Bosque húmedo tropical, área disturbada, suelo arcilloso.Proyecto Composición Florística de la Estación Biológica Gustavo Orcés.","ECU",NA,1999,"PRESERVED_SPECIMEN","GEODETIC_DATUM_ASSUMED_WGS84;DIFFERENT_OWNER_INSTITUTION"
-83.783333,14.716667,"Rugoloa pilosa",4061548082,"Puente Poza Azul, Kornuk Creek [Seymour series]","NIC",NA,1971,"PRESERVED_SPECIMEN","OCCURRENCE_STATUS_INFERRED_FROM_INDIVIDUAL_COUNT;COORDINATE_ROUNDED;GEODETIC_DATUM_ASSUMED_WGS84;ELEVATION_NON_NUMERIC;INSTITUTION_MATCH_NONE"
-77.6,-1.06666,"Rugoloa pilosa",4061958878,"Jatun Sacha Biological Station; 8 km east of Puerto Misahualli, south of Río Napo. Tropical wet forest. Collected along roadside.","ECU",NA,1994,"PRESERVED_SPECIMEN","GEODETIC_DATUM_ASSUMED_WGS84;DIFFERENT_OWNER_INSTITUTION"
-105.41,20.901667,"Rugoloa pilosa",1893629489,"SAN FRANCISCO, ENTRE BUCERIAS Y LA PEÑITA DE JALTEMBA, EDO. DE NAYARIT","MEX",80,1986,"PRESERVED_SPECIMEN","TYPE_STATUS_INVALID;OCCURRENCE_STATUS_INFERRED_FROM_INDIVIDUAL_COUNT;COORDINATE_ROUNDED;GEODETIC_DATUM_ASSUMED_WGS84;CONTINENT_DERIVED_FROM_COORDINATES;ELEVATION_MIN_MAX_SWAPPED;INSTITUTION_MATCH_NONE"
-104.822222,20.380556,"Rugoloa pilosa",1893629486,"10-12 KM POR LA BRECHA A EL TUITO, MINAS DE ZIMAPAN EN LA SIERRA DEL CUALE","MEX",80,1986,"PRESERVED_SPECIMEN","TYPE_STATUS_INVALID;OCCURRENCE_STATUS_INFERRED_FROM_INDIVIDUAL_COUNT;COORDINATE_ROUNDED;GEODETIC_DATUM_ASSUMED_WGS84;CONTINENT_DERIVED_FROM_COORDINATES;ELEVATION_MIN_MAX_SWAPPED;INSTITUTION_MATCH_NONE"
-99.095,21.218333,"Rugoloa pilosa",1893629487,"SIETE KM AL SE DE AGUA ZARCA, SOBRE EL CAMINO A PISAFLORES","MEX",80,1987,"PRESERVED_SPECIMEN","TYPE_STATUS_INVALID;OCCURRENCE_STATUS_INFERRED_FROM_INDIVIDUAL_COUNT;COORDINATE_ROUNDED;GEODETIC_DATUM_ASSUMED_WGS84;CONTINENT_DERIVED_FROM_COORDINATES;INSTITUTION_MATCH_NONE"
-90.725,16.471667,"Rugoloa pilosa",1893629533,"A 2 KM AL W DE CRUCERO CORZAL, CAMINO PALENQUE BOCA LACANTUM","MEX",100,1985,"PRESERVED_SPECIMEN","TYPE_STATUS_INVALID;OCCURRENCE_STATUS_INFERRED_FROM_INDIVIDUAL_COUNT;COORDINATE_ROUNDED;GEODETIC_DATUM_ASSUMED_WGS84;CONTINENT_DERIVED_FROM_COORDINATES;ELEVATION_MIN_MAX_SWAPPED;INSTITUTION_MATCH_NONE"
-104.996667,21.945,"Rugoloa pilosa",1893629609,"A 6.3 KM AL E DE EL VENADO, CAMINO A SAN MIGUEL ZAPOTE, MPIO. RUIZ, NAY.","MEX",80,1985,"PRESERVED_SPECIMEN","TYPE_STATUS_INVALID;OCCURRENCE_STATUS_INFERRED_FROM_INDIVIDUAL_COUNT;COORDINATE_ROUNDED;GEODETIC_DATUM_ASSUMED_WGS84;CONTINENT_DERIVED_FROM_COORDINATES;ELEVATION_MIN_MAX_SWAPPED;INSTITUTION_MATCH_NONE"
-55.26,5.7,"Rugoloa pilosa",1456393821,"Lelydorplan","SUR",NA,1956,"PRESERVED_SPECIMEN","GEODETIC_DATUM_ASSUMED_WGS84"
-54,5.16,"Rugoloa pilosa",1456086937,"St. Laurent, piste de Paul Isnard","GUF",NA,1985,"PRESERVED_SPECIMEN","GEODETIC_DATUM_ASSUMED_WGS84"
-76.18,-0.02,"Rugoloa pilosa",3043574462,"Reserva Faunistica Cuyabeno, Río Cuyabeno, from outlet of Laguna Grande 10 km down-stream. Tropical rain forest and floodplain along river and river margins.","ECU",NA,1989,"PRESERVED_SPECIMEN","GEODETIC_DATUM_ASSUMED_WGS84"
-51.8,3.91,"Rugoloa pilosa",1456387616,"Crique Gabaret, Bassin de l'Oyapock","GUF",NA,1988,"PRESERVED_SPECIMEN","GEODETIC_DATUM_ASSUMED_WGS84"
-54.46,2.45,"Rugoloa pilosa",1456087481,"Rivière Itany, confluent avec de la crique Koulé-Koulé, Monts Tumuc-Humac","GUF",NA,1985,"PRESERVED_SPECIMEN","GEODETIC_DATUM_ASSUMED_WGS84"
-58.8103,4.3375,"Rugoloa pilosa",1456020095,"Iwokrama Rainforest Reserve. Iwokrama Mts., 1-2 km SE of camp at bottom of gorge","GUY",NA,1997,"PRESERVED_SPECIMEN","GEODETIC_DATUM_ASSUMED_WGS84"
-53.21,3.46,"Rugoloa pilosa",1456211179,"Saül, savane-roche Dachine","GUF",NA,1997,"PRESERVED_SPECIMEN","GEODETIC_DATUM_ASSUMED_WGS84"
-58.7475,5.16111,"Rugoloa pilosa",1456191484,"Tropenbos Field Station; 20 km S of Mabura Hill on Mabura Hill-Kurupukari Road","GUY",NA,1996,"PRESERVED_SPECIMEN","GEODETIC_DATUM_ASSUMED_WGS84"
-58.7333,4.58333,"Rugoloa pilosa",1456275905,"Iwokrama Rainforest Reserve; along Kurupukari-Annai Road, near head of A-B transect","GUY",NA,1995,"PRESERVED_SPECIMEN","GEODETIC_DATUM_ASSUMED_WGS84"
-57.3,6.05,"Rugoloa pilosa",1456210751,"Courantyne, Blocks III. 20 mi. SE of New Amsterdam","GUY",NA,1955,"PRESERVED_SPECIMEN","GEODETIC_DATUM_ASSUMED_WGS84"
-91.82,17.0667,"Rugoloa pilosa",1321071239,"Near Laguna Ocotal Grande, ca 25-30 km SE of Monte (Cerro) L¡bano (which is ca 45 km E of Ocosingo), Ocotal","MEX",NA,1954,"PRESERVED_SPECIMEN","GEODETIC_DATUM_ASSUMED_WGS84"
-59.25,2.08,"Rugoloa pilosa",1456370914,"Kuyuwini Landing, Kuyuwini River, Rupununi District","GUY",NA,1992,"PRESERVED_SPECIMEN","GEODETIC_DATUM_ASSUMED_WGS84"
-59.4833,5.2,"Rugoloa pilosa",1456386024,"Kaieteur Falls National Park","GUY",NA,1988,"PRESERVED_SPECIMEN","GEODETIC_DATUM_ASSUMED_WGS84"
-37.510556,-11.453333,"Rugoloa pilosa",2997759539,"","BRA",NA,2000,"PRESERVED_SPECIMEN","RECORDED_DATE_INVALID;COORDINATE_ROUNDED;GEODETIC_DATUM_ASSUMED_WGS84;CONTINENT_DERIVED_FROM_COORDINATES;INSTITUTION_MATCH_FUZZY;COLLECTION_MATCH_FUZZY"
-101.46056,18.18528,"Rugoloa pilosa",3308631094,"El Aguacate, 1.33 km al N, Mpio. de Coahuayutla de Guerrero, Guerrero","MEX",90,1999,"PRESERVED_SPECIMEN","TYPE_STATUS_INVALID;OCCURRENCE_STATUS_INFERRED_FROM_INDIVIDUAL_COUNT;GEODETIC_DATUM_ASSUMED_WGS84;CONTINENT_DERIVED_FROM_COORDINATES;INSTITUTION_MATCH_FUZZY;INSTITUTION_COLLECTION_MISMATCH"
-96.9,19.18056,"Rugoloa pilosa",3308022998,"carretera Totutla a Comapa 2 km antes de la comunidad Comapa","MEX",80,1998,"PRESERVED_SPECIMEN","TYPE_STATUS_INVALID;OCCURRENCE_STATUS_INFERRED_FROM_INDIVIDUAL_COUNT;GEODETIC_DATUM_ASSUMED_WGS84;CONTINENT_DERIVED_FROM_COORDINATES;INSTITUTION_MATCH_FUZZY;INSTITUTION_COLLECTION_MISMATCH"
-83.59167,8.48056,"Rugoloa pilosa",3308568604,"Canton del Golfito P. N. Corcovado, Península de Osa. Estación Sirena. Sendero Pavo","CRI",NA,1994,"PRESERVED_SPECIMEN","TYPE_STATUS_INVALID;OCCURRENCE_STATUS_INFERRED_FROM_INDIVIDUAL_COUNT;GEODETIC_DATUM_ASSUMED_WGS84;CONTINENT_DERIVED_FROM_COORDINATES;INSTITUTION_MATCH_FUZZY;INSTITUTION_COLLECTION_MISMATCH"
-91.30083,16.99333,"Rugoloa pilosa",3308617468,"Rancho Santa Teresita, a 1 km al O de la carretera Fronteriza del S, rumbo al arroyo","MEX",90,2002,"PRESERVED_SPECIMEN","TYPE_STATUS_INVALID;OCCURRENCE_STATUS_INFERRED_FROM_INDIVIDUAL_COUNT;GEODETIC_DATUM_ASSUMED_WGS84;CONTINENT_DERIVED_FROM_COORDINATES;INSTITUTION_MATCH_FUZZY;INSTITUTION_COLLECTION_MISMATCH"
-95.97081,16.17844,"Rugoloa pilosa",3307997864,"México, Oaxaca, Distrito: Yautepec, Mpio. de San Carlos Yautepec, 2.6 km al N de San Miguel Chongo, rumbo a San Pedro Sosoltepec","MEX",100,2001,"PRESERVED_SPECIMEN","TYPE_STATUS_INVALID;OCCURRENCE_STATUS_INFERRED_FROM_INDIVIDUAL_COUNT;GEODETIC_DATUM_ASSUMED_WGS84;CONTINENT_DERIVED_FROM_COORDINATES;INSTITUTION_MATCH_FUZZY;INSTITUTION_COLLECTION_MISMATCH"
-63.166667,-7.516667,"Rugoloa pilosa",2998652709,"Campo a 500 m para Oeste da BR-230, km 2.","BRA",NA,1979,"PRESERVED_SPECIMEN","RECORDED_DATE_INVALID;COORDINATE_ROUNDED;GEODETIC_DATUM_ASSUMED_WGS84;CONTINENT_DERIVED_FROM_COORDINATES;INSTITUTION_MATCH_FUZZY;INSTITUTION_COLLECTION_MISMATCH;MULTIMEDIA_URI_INVALID"
-55.165833,-0.221111,"Rugoloa pilosa",2997391290,"Sete Varas airstrip on Rio Curua.","BRA",NA,1981,"PRESERVED_SPECIMEN","RECORDED_DATE_INVALID;COORDINATE_ROUNDED;GEODETIC_DATUM_ASSUMED_WGS84;CONTINENT_DERIVED_FROM_COORDINATES;INSTITUTION_MATCH_FUZZY;COLLECTION_MATCH_FUZZY"
-47.9925,-25.197222,"Rugoloa pilosa",2998039003,"Cananéia, Ilha do Cardoso","BRA",NA,1975,"PRESERVED_SPECIMEN","RECORDED_DATE_INVALID;COORDINATE_ROUNDED;GEODETIC_DATUM_ASSUMED_WGS84;CONTINENT_DERIVED_FROM_COORDINATES;INSTITUTION_MATCH_FUZZY;COLLECTION_MATCH_FUZZY"
-39.567778,-16.980833,"Rugoloa pilosa",2998047312,"Fazenda Pau-brasil, ca. 5 km a NW de Itamaraju. Folha SE - 24 (17-40d)","BRA",NA,1978,"PRESERVED_SPECIMEN","COORDINATE_ROUNDED;GEODETIC_DATUM_ASSUMED_WGS84;CONTINENT_DERIVED_FROM_COORDINATES;INSTITUTION_MATCH_FUZZY;COLLECTION_MATCH_FUZZY"
-52.23,-14.63,"Rugoloa pilosa",2998046644,"21 km N. of Xavantina","BRA",NA,1968,"PRESERVED_SPECIMEN","COORDINATE_ROUNDED;GEODETIC_DATUM_ASSUMED_WGS84;CONTINENT_DERIVED_FROM_COORDINATES;INSTITUTION_MATCH_FUZZY;COLLECTION_MATCH_FUZZY"
-71.33,0.33,"Rugoloa pilosa",3043570647,"Colombianae. Río Pacoa (tributary of Río Apaporis).","COL",NA,1952,"PRESERVED_SPECIMEN","GEODETIC_DATUM_ASSUMED_WGS84"
-58.45,6.83333,"Rugoloa pilosa",1455976266,"Naamryck Canal; ±3.5 km SW of Parika","GUY",NA,1989,"PRESERVED_SPECIMEN","GEODETIC_DATUM_ASSUMED_WGS84"
-83.49,9.49,"Rugoloa pilosa",45686877,"Amubri, Camino a Soki entre la quebrada Amubri, margen izquierda de río Lari.","CRI",NA,1989,"PRESERVED_SPECIMEN","GEODETIC_DATUM_ASSUMED_WGS84;CONTINENT_DERIVED_FROM_COORDINATES;INSTITUTION_MATCH_NONE"
-83.46,9.25,"Rugoloa pilosa",45684943,"Rain forest area on slopes between Río Convento and Río Sonador, El General valley, Province of Puntarenas.","CRI",NA,1963,"PRESERVED_SPECIMEN","GEODETIC_DATUM_ASSUMED_WGS84;CONTINENT_DERIVED_FROM_COORDINATES;INSTITUTION_MATCH_NONE"
-83.66,10.66,"Rugoloa pilosa",45686781,"Hills 2 airline km SSE of Islas Buena Vista in the Río Colorado, 14 airline km SW of Barra del Colorado.","CRI",NA,1986,"PRESERVED_SPECIMEN","GEODETIC_DATUM_ASSUMED_WGS84;CONTINENT_DERIVED_FROM_COORDINATES;INSTITUTION_MATCH_NONE"
-84.37,9.72,"Rugoloa pilosa",45687009,"P.N. La Cangreja San Martín, Vara Blanca, bosque primario y secundario en la cima del Cerro La Cangreja.","CRI",NA,1992,"PRESERVED_SPECIMEN","GEODETIC_DATUM_ASSUMED_WGS84;CONTINENT_DERIVED_FROM_COORDINATES;INSTITUTION_MATCH_NONE"
-83.02,9.67,"Rugoloa pilosa",45687823,"P.I. La Amistad Cuenca del Estrella. Est. Hitoy Cerere, senderos en los alrededores de la estación.","CRI",NA,1997,"PRESERVED_SPECIMEN","GEODETIC_DATUM_ASSUMED_WGS84;CONTINENT_DERIVED_FROM_COORDINATES;INSTITUTION_MATCH_NONE"
-84.35,9.59,"Rugoloa pilosa",45687762,"Las Mesas.","CRI",NA,2001,"PRESERVED_SPECIMEN","GEODETIC_DATUM_ASSUMED_WGS84;CONTINENT_DERIVED_FROM_COORDINATES;INSTITUTION_MATCH_NONE"
-84.05,10.23,"Rugoloa pilosa",45687151,"P.N. Braulio Carrillo Estación Magsasay. Detrás de la Estación entre bosque y potreros.","CRI",NA,1990,"PRESERVED_SPECIMEN","GEODETIC_DATUM_ASSUMED_WGS84;CONTINENT_DERIVED_FROM_COORDINATES;INSTITUTION_MATCH_NONE"
-44.349722,-2.573611,"Rugoloa pilosa",1090889470,"C.V.R.D","BRA",NA,1985,"PRESERVED_SPECIMEN","GEODETIC_DATUM_ASSUMED_WGS84;CONTINENT_DERIVED_FROM_COORDINATES;INSTITUTION_MATCH_FUZZY;COLLECTION_MATCH_FUZZY"
-44.3025,-2.529722,"Rugoloa pilosa",1090894304,"","BRA",NA,2011,"PRESERVED_SPECIMEN","GEODETIC_DATUM_ASSUMED_WGS84;CONTINENT_DERIVED_FROM_COORDINATES;INSTITUTION_MATCH_FUZZY;COLLECTION_MATCH_FUZZY"
-44.139722,-2.644472,"Rugoloa pilosa",1658213655,"Sítio Aguahy","BRA",NA,2015,"PRESERVED_SPECIMEN","GEODETIC_DATUM_ASSUMED_WGS84;CONTINENT_DERIVED_FROM_COORDINATES;INSTITUTION_MATCH_FUZZY;COLLECTION_MATCH_FUZZY"
-44.053833,-2.473056,"Rugoloa pilosa",1208832341,"Praia de Panaquatira","BRA",NA,2014,"PRESERVED_SPECIMEN","GEODETIC_DATUM_ASSUMED_WGS84;CONTINENT_DERIVED_FROM_COORDINATES;INSTITUTION_MATCH_FUZZY;COLLECTION_MATCH_FUZZY"
-44.181778,-2.463611,"Rugoloa pilosa",1848114396,"Praia do Araçagy","BRA",NA,2015,"PRESERVED_SPECIMEN","GEODETIC_DATUM_ASSUMED_WGS84;CONTINENT_DERIVED_FROM_COORDINATES;INSTITUTION_MATCH_FUZZY;COLLECTION_MATCH_FUZZY"
-44.400472,-2.412944,"Rugoloa pilosa",1801179619,"Restinga da Praia de Itatinga","BRA",NA,2014,"PRESERVED_SPECIMEN","GEODETIC_DATUM_ASSUMED_WGS84;CONTINENT_DERIVED_FROM_COORDINATES;INSTITUTION_MATCH_FUZZY;COLLECTION_MATCH_FUZZY"
-62.25,5.21,"Rugoloa pilosa",1456449453,"Río Apácara, 1/4 mile downstream from mouth of Río Abácapa, W-side of Apácara-tepuí","VEN",NA,1953,"PRESERVED_SPECIMEN","GEODETIC_DATUM_ASSUMED_WGS84"
-81.680278,7.539722,"Rugoloa pilosa",1258704109,"Isla Coiba. Recorrido desde La Grua a Punta Esquina.","PAN",NA,1996,"PRESERVED_SPECIMEN","OCCURRENCE_STATUS_INFERRED_FROM_INDIVIDUAL_COUNT;COORDINATE_ROUNDED;GEODETIC_DATUM_ASSUMED_WGS84;ELEVATION_NON_NUMERIC;DIFFERENT_OWNER_INSTITUTION"
-63.9,-17.25,"Rugoloa pilosa",4061354643,"6.5 km (by air) NW of main Colonia San Juan.","BOL",NA,1994,"PRESERVED_SPECIMEN","OCCURRENCE_STATUS_INFERRED_FROM_INDIVIDUAL_COUNT;GEODETIC_DATUM_ASSUMED_WGS84;DIFFERENT_OWNER_INSTITUTION"
-55.533333,-27.266667,"Rugoloa pilosa",4061479342,"San Ignacio","ARG",NA,1951,"PRESERVED_SPECIMEN","OCCURRENCE_STATUS_INFERRED_FROM_INDIVIDUAL_COUNT;COORDINATE_ROUNDED;GEODETIC_DATUM_ASSUMED_WGS84;DIFFERENT_OWNER_INSTITUTION"
-85.6,10.91,"Rugoloa pilosa",1260892882,"40 km N of Liberia along Interamerican Hwy.","CRI",NA,1966,"PRESERVED_SPECIMEN","OCCURRENCE_STATUS_INFERRED_FROM_INDIVIDUAL_COUNT;GEODETIC_DATUM_ASSUMED_WGS84;DIFFERENT_OWNER_INSTITUTION"
-73.166667,-3.1,"Rugoloa pilosa",4061611615,"Amazon Lodge, Río Yanayacu. Seasonally inundated tahuampa forest.","PER",NA,1981,"PRESERVED_SPECIMEN","OCCURRENCE_STATUS_INFERRED_FROM_INDIVIDUAL_COUNT;COORDINATE_ROUNDED;GEODETIC_DATUM_ASSUMED_WGS84;INSTITUTION_MATCH_NONE"
-60.9125,-13.594167,"Rugoloa pilosa",1258303023,"Lago Caimán: a large system which receives water from the Río Itenez during the rainy season; becoming isolated during the dry season.","BOL",NA,1996,"PRESERVED_SPECIMEN","OCCURRENCE_STATUS_INFERRED_FROM_INDIVIDUAL_COUNT;COORDINATE_ROUNDED;GEODETIC_DATUM_ASSUMED_WGS84;DIFFERENT_OWNER_INSTITUTION"
-93.45,16.88,"Rugoloa pilosa",1259487027,"19 km N of Ocozocoautla along road to Mal Paso.","MEX",NA,1965,"PRESERVED_SPECIMEN","OCCURRENCE_STATUS_INFERRED_FROM_INDIVIDUAL_COUNT;GEODETIC_DATUM_ASSUMED_WGS84;DIFFERENT_OWNER_INSTITUTION"
-85.17,10.34,"Rugoloa pilosa",1259794770,"13 km SW of Canas; Experimental Farm at Finca La Taboga","CRI",NA,1968,"PRESERVED_SPECIMEN","GEODETIC_DATUM_ASSUMED_WGS84;DIFFERENT_OWNER_INSTITUTION"
-83.37778,9.991667,"Rugoloa pilosa",1257837835,"Sector Colonia Puriscaleña, Sendero Cerro Azul, hasta Rio Surubres.","CRI",NA,2000,"PRESERVED_SPECIMEN","OCCURRENCE_STATUS_INFERRED_FROM_INDIVIDUAL_COUNT;COORDINATE_ROUNDED;GEODETIC_DATUM_ASSUMED_WGS84;DIFFERENT_OWNER_INSTITUTION"
-53.816667,-26.433333,"Rugoloa pilosa",4062151979,"Parque Provincial Piñalito, alrededores del Salto Merri.","ARG",NA,2000,"PRESERVED_SPECIMEN","OCCURRENCE_STATUS_INFERRED_FROM_INDIVIDUAL_COUNT;COORDINATE_ROUNDED;GEODETIC_DATUM_ASSUMED_WGS84;DIFFERENT_OWNER_INSTITUTION"
-83.75,12.66666,"Rugoloa pilosa",415948160,"Pueblo Nuevo","NIC",5000,1992,"PRESERVED_SPECIMEN","GEODETIC_DATUM_ASSUMED_WGS84;CONTINENT_DERIVED_FROM_COORDINATES;INSTITUTION_MATCH_NONE"
-50.366667,-6.391389,"Rugoloa pilosa",1913567784,"Floresta Nacional de Carajás, S11D.","BRA",NA,2010,"PRESERVED_SPECIMEN","GEODETIC_DATUM_ASSUMED_WGS84;AMBIGUOUS_INSTITUTION"
-41.515675,-17.405986,"Rugoloa pilosa",1087656712,"BR-116. Teófilo Otoni em direção a Catuji, margem esquerda da estrada.","BRA",NA,2011,"PRESERVED_SPECIMEN","GEODETIC_DATUM_ASSUMED_WGS84;AMBIGUOUS_INSTITUTION"
-43.029472,-15.170472,"Rugoloa pilosa",3800721325,"Parque Estadual Caminho dos Gerais, Trilha que liga o Rio Barrinhas, Centro-sul do PECG, ao Poço da Cachoeira do encantado. Cerrado, Mata Ciliar.","BRA",NA,2009,"PRESERVED_SPECIMEN","GEODETIC_DATUM_ASSUMED_WGS84;AMBIGUOUS_INSTITUTION"
-43.696944,-20.096389,"Rugoloa pilosa",2382967991,"Serra do Gandarela","BRA",NA,2018,"PRESERVED_SPECIMEN","GEODETIC_DATUM_ASSUMED_WGS84;AMBIGUOUS_INSTITUTION"
-50.336944,-6.289444,"Rugoloa pilosa",1913567892,"Estrada Núcleo - Serra Sul","BRA",NA,2010,"PRESERVED_SPECIMEN","GEODETIC_DATUM_ASSUMED_WGS84;AMBIGUOUS_INSTITUTION"
-50.236111,-6.431667,"Rugoloa pilosa",1913568575,"Floresta Nacional de Carajás, Racha Placa.","BRA",NA,2012,"PRESERVED_SPECIMEN","GEODETIC_DATUM_ASSUMED_WGS84;AMBIGUOUS_INSTITUTION"
-43.094028,-15.067083,"Rugoloa pilosa",3800723327,"Parque Estadual Caminho dos Gerais, Coletas ao redor da Barragem de Gameleiras. Mata, cerrado.","BRA",NA,2009,"PRESERVED_SPECIMEN","GEODETIC_DATUM_ASSUMED_WGS84;AMBIGUOUS_INSTITUTION"
-54.956389,-8.205,"Rugoloa pilosa",3948562360,"Castelo de Sonhos, Vila Quatro","BRA",NA,2021,"PRESERVED_SPECIMEN","GEODETIC_DATUM_ASSUMED_WGS84;AMBIGUOUS_INSTITUTION"
-43.367778,-19.881111,"Rugoloa pilosa",1087622944,"Estação Ambiental de Peti-CEMIG, trilha partindo da Barragem até o Bom Será","BRA",NA,2002,"PRESERVED_SPECIMEN","GEODETIC_DATUM_ASSUMED_WGS84;AMBIGUOUS_INSTITUTION"
-42.556944,-14.323333,"Rugoloa pilosa",1087647176,"Brejinho das Ametistas, Área da Bahia Mineração","BRA",NA,2008,"PRESERVED_SPECIMEN","GEODETIC_DATUM_ASSUMED_WGS84;AMBIGUOUS_INSTITUTION"
-40.057611,-16.404583,"Rugoloa pilosa",1087631057,"Distrito de Talismã, fazenda Duas Barras; próximo a divisa com o estado da Bahia. Floresta Ombrófila Densa Montana entre 750-850m de altitude.;","BRA",NA,2003,"PRESERVED_SPECIMEN","GEODETIC_DATUM_ASSUMED_WGS84;AMBIGUOUS_INSTITUTION"
-47.633367,-24.0725,"Rugoloa pilosa",2013095984,"Reserva Particular da Votorantim (CBA)., Trilha da Boatudo.","BRA",NA,2013,"PRESERVED_SPECIMEN","GEODETIC_DATUM_ASSUMED_WGS84;AMBIGUOUS_INSTITUTION"
-43.396111,-19.827222,"Rugoloa pilosa",2563083031,"Cocais","BRA",NA,2019,"PRESERVED_SPECIMEN","GEODETIC_DATUM_ASSUMED_WGS84;AMBIGUOUS_INSTITUTION"
-49.920278,-6.333333,"Rugoloa pilosa",1913569000,"Serra da Bocaina","BRA",NA,2012,"PRESERVED_SPECIMEN","GEODETIC_DATUM_ASSUMED_WGS84;AMBIGUOUS_INSTITUTION"
-63.25,6.933333,"Rugoloa pilosa",1259533720,"20 km E of La Paragua. Disturbed primary forest.","VEN",NA,1978,"PRESERVED_SPECIMEN","OCCURRENCE_STATUS_INFERRED_FROM_INDIVIDUAL_COUNT;COORDINATE_ROUNDED;GEODETIC_DATUM_ASSUMED_WGS84;DIFFERENT_OWNER_INSTITUTION"
-55.05,-27.333333,"Rugoloa pilosa",1259741626,"Entre Campo Viera y Campo Grande","ARG",NA,1979,"PRESERVED_SPECIMEN","OCCURRENCE_STATUS_INFERRED_FROM_INDIVIDUAL_COUNT;COORDINATE_ROUNDED;GEODETIC_DATUM_ASSUMED_WGS84;DIFFERENT_OWNER_INSTITUTION"
-88.066667,13.933333,"Rugoloa pilosa",4062145990,"A.N.P. La Hermita, ruta plan del zapote-piedra pacha.","SLV",NA,2011,"PRESERVED_SPECIMEN","OCCURRENCE_STATUS_INFERRED_FROM_INDIVIDUAL_COUNT;COORDINATE_ROUNDED;GEODETIC_DATUM_ASSUMED_WGS84;DIFFERENT_OWNER_INSTITUTION"
-83.5,14.166667,"Rugoloa pilosa",1258336285,"Ibo Tingni, drainage of Caño Sung Sung, N of road between Puerto Cabezas and Río Wawa; gallery forest and adjacent savanna","NIC",NA,1978,"PRESERVED_SPECIMEN","OCCURRENCE_STATUS_INFERRED_FROM_INDIVIDUAL_COUNT;COORDINATE_ROUNDED;GEODETIC_DATUM_ASSUMED_WGS84;DIFFERENT_OWNER_INSTITUTION"
-67.8,4.783333,"Rugoloa pilosa",1259531539,"Departamento Atures: near Capuana, E bank of the Río Orinoco.","VEN",NA,1979,"PRESERVED_SPECIMEN","OCCURRENCE_STATUS_INFERRED_FROM_INDIVIDUAL_COUNT;COORDINATE_ROUNDED;GEODETIC_DATUM_ASSUMED_WGS84;DIFFERENT_OWNER_INSTITUTION"
-79.121667,8.258056,"Rugoloa pilosa",4061559619,"San José Island, along road between Bodega Bay and Río Mata Puerco.","PAN",NA,1967,"PRESERVED_SPECIMEN","OCCURRENCE_STATUS_INFERRED_FROM_INDIVIDUAL_COUNT;COORDINATE_ROUNDED;GEODETIC_DATUM_ASSUMED_WGS84;INSTITUTION_MATCH_NONE"
-83.687566,8.671872,"Rugoloa pilosa",1257846622,"R. F. Golfo Dulce. Cuenca Térraba-Sierpe. Sierpe, Los Planes. Albergue Tesoro Verde, Taller de Sapotaceas.","CRI",NA,2006,"PRESERVED_SPECIMEN","OCCURRENCE_STATUS_INFERRED_FROM_INDIVIDUAL_COUNT;COORDINATE_ROUNDED;GEODETIC_DATUM_ASSUMED_WGS84;DIFFERENT_OWNER_INSTITUTION"
-84.689222,12.563028,"Rugoloa pilosa",2269014281,"6.7 km SSE of Nawawas, at ford of Río Kurinwasito; roadside and moist forest scrap, red clay","NIC",NA,2019,"PRESERVED_SPECIMEN","OCCURRENCE_STATUS_INFERRED_FROM_INDIVIDUAL_COUNT;COORDINATE_ROUNDED;GEODETIC_DATUM_ASSUMED_WGS84;DIFFERENT_OWNER_INSTITUTION"
-67.816667,6.966667,"Rugoloa pilosa",4061001687,"4 km directly (in a straight line) NE of El Betun along the banks of the Río Capanaparo.","VEN",NA,1977,"PRESERVED_SPECIMEN","OCCURRENCE_STATUS_INFERRED_FROM_INDIVIDUAL_COUNT;COORDINATE_ROUNDED;GEODETIC_DATUM_ASSUMED_WGS84;INSTITUTION_MATCH_NONE"
-76.5,7.33333,"Rugoloa pilosa",4062176102,"Carretera Hacienda El Darién-Mutatá.","COL",NA,1987,"PRESERVED_SPECIMEN","OCCURRENCE_STATUS_INFERRED_FROM_INDIVIDUAL_COUNT;GEODETIC_DATUM_ASSUMED_WGS84;DIFFERENT_OWNER_INSTITUTION"
-52.306111,4.694444,"Rugoloa pilosa",4022335641,"","GUF",NA,2023,"HUMAN_OBSERVATION","COORDINATE_ROUNDED;CONTINENT_DERIVED_FROM_COORDINATES"
-78.833,0.25,"Rugoloa pilosa",47819327,"San Lorenzo - Lita km 7","ECU",NA,1999,"PRESERVED_SPECIMEN","GEODETIC_DATUM_ASSUMED_WGS84;COORDINATE_PRECISION_INVALID;INSTITUTION_MATCH_FUZZY;INSTITUTION_COLLECTION_MISMATCH"
-62.783,-15.716,"Rugoloa pilosa",47819386,"Dept. SANTA CRUZ. At fieldcamp La Chonta of BOLFOR, N of San Javier","BOL",NA,2003,"PRESERVED_SPECIMEN","GEODETIC_DATUM_ASSUMED_WGS84;COORDINATE_PRECISION_INVALID;INSTITUTION_MATCH_FUZZY;INSTITUTION_COLLECTION_MISMATCH"
-78.45,-1.833,"Rugoloa pilosa",47819479,"At Lita, along roads and railway, mostly lightopen.","ECU",NA,1985,"PRESERVED_SPECIMEN","GEODETIC_DATUM_ASSUMED_WGS84;PRESUMED_NEGATED_LATITUDE;COORDINATE_PRECISION_INVALID;INSTITUTION_MATCH_FUZZY;INSTITUTION_COLLECTION_MISMATCH"
-76.15,-0.083,"Rugoloa pilosa",47819403,"Puerto Bolívar at Río Cuyabeno.","ECU",NA,1984,"PRESERVED_SPECIMEN","GEODETIC_DATUM_ASSUMED_WGS84;COORDINATE_PRECISION_INVALID;INSTITUTION_MATCH_FUZZY;INSTITUTION_COLLECTION_MISMATCH"
-75.933,-0.183,"Rugoloa pilosa",47819406,"Along Río Cuyabeno, app. 3 hours in canoe below Puerto Bolívar. On sandy rivershore.","ECU",NA,1984,"PRESERVED_SPECIMEN","GEODETIC_DATUM_ASSUMED_WGS84;COORDINATE_PRECISION_INVALID;INSTITUTION_MATCH_FUZZY;INSTITUTION_COLLECTION_MISMATCH"
-77.916,-1.45,"Rugoloa pilosa",47819485,"Near 10.de Augusto E of Puyo. Along trail in secondary forest.","ECU",NA,1986,"PRESERVED_SPECIMEN","GEODETIC_DATUM_ASSUMED_WGS84;COORDINATE_PRECISION_INVALID;INSTITUTION_MATCH_FUZZY;INSTITUTION_COLLECTION_MISMATCH"
-71.983,4.333,"Rugoloa pilosa",47819212,"Km 84 Puerto Gaitan - Puerto Lopez. Forest and swamp","COL",NA,1995,"PRESERVED_SPECIMEN","GEODETIC_DATUM_ASSUMED_WGS84;COORDINATE_PRECISION_INVALID;INSTITUTION_MATCH_FUZZY;INSTITUTION_COLLECTION_MISMATCH"
-78.633,-3.716,"Rugoloa pilosa",47819274,"El Padmi N of Los Encuentros","ECU",NA,1998,"PRESERVED_SPECIMEN","GEODETIC_DATUM_ASSUMED_WGS84;COORDINATE_PRECISION_INVALID;INSTITUTION_MATCH_FUZZY;INSTITUTION_COLLECTION_MISMATCH"
-75.983,-1.6,"Rugoloa pilosa",47818609,"Lorocachi. A 2 horas en deslizador aguas arriba, el En cañonado. Margen derecha, zona con muchas palmas bosque primario.","ECU",NA,1980,"PRESERVED_SPECIMEN","GEODETIC_DATUM_ASSUMED_WGS84;COORDINATE_PRECISION_INVALID;INSTITUTION_MATCH_FUZZY;INSTITUTION_COLLECTION_MISMATCH"
