"lon","lat","species","gbifID","locality","countryCode","coordinateUncertaintyInMeters","year","basisOfRecord","issue"
-75.05,5.566667,"Rugoloa pilosa",1258334350,"Vereda Puente Linda, margen izquierda del rio, Samana.","COL",NA,1994,"PRESERVED_SPECIMEN","OCCURRENCE_STATUS_INFERRED_FROM_INDIVIDUAL_COUNT;COORDINATE_ROUNDED;GEODETIC_DATUM_ASSUMED_WGS84;INSTITUTION_MATCH_FUZZY;COLLECTION_MATCH_NONE"
-86.716667,14,"Rugoloa pilosa",1259270215,"Montaña los Zapotes, 10 km NO de Campamento.","HND",NA,1979,"PRESERVED_SPECIMEN","OCCURRENCE_STATUS_INFERRED_FROM_INDIVIDUAL_COUNT;COORDINATE_ROUNDED;GEODETIC_DATUM_ASSUMED_WGS84;INSTITUTION_MATCH_FUZZY;COLLECTION_MATCH_NONE"
-84.330556,10.966667,"Rugoloa pilosa",1258505491,"Municipio del Castillo, Estación Biológica Bartola, sobre el Río Bartola a 3 km de la desembocadura","NIC",NA,1998,"PRESERVED_SPECIMEN","OCCURRENCE_STATUS_INFERRED_FROM_INDIVIDUAL_COUNT;COORDINATE_ROUNDED;GEODETIC_DATUM_ASSUMED_WGS84;INSTITUTION_MATCH_FUZZY;COLLECTION_MATCH_NONE"
-81.671389,7.3275,"Rugoloa pilosa",1259273623,"Parque Nacional Coiba. Isla de Coiba, campamento Manila.","PAN",NA,1996,"PRESERVED_SPECIMEN","OCCURRENCE_STATUS_INFERRED_FROM_INDIVIDUAL_COUNT;COORDINATE_ROUNDED;GEODETIC_DATUM_ASSUMED_WGS84;ELEVATION_NON_NUMERIC;INSTITUTION_MATCH_FUZZY;COLLECTION_MATCH_NONE"
-60.416667,6.25,"Rugoloa pilosa",1260334868,"Pakaraima Mtns, Meamu R. camp, below 1st big rapids, furthest navigable point. Large sandstone boulders by river.","GUY",NA,1992,"PRESERVED_SPECIMEN","OCCURRENCE_STATUS_INFERRED_FROM_INDIVIDUAL_COUNT;COORDINATE_ROUNDED;GEODETIC_DATUM_ASSUMED_WGS84;INSTITUTION_MATCH_FUZZY;COLLECTION_MATCH_NONE"
-52.97958,5.30208,"Rugoloa pilosa",3310128354,"","GUF",5000,2011,"HUMAN_OBSERVATION","COUNTRY_MISMATCH;GEODETIC_DATUM_ASSUMED_WGS84;CONTINENT_DERIVED_FROM_COORDINATES"
-53.7546,5.15062,"Rugoloa pilosa",3310279772,"","GUF",5000,2013,"HUMAN_OBSERVATION","COUNTRY_MISMATCH;GEODETIC_DATUM_ASSUMED_WGS84;CONTINENT_DERIVED_FROM_COORDINATES"
-47.2651253,-13.8975815,"Rugoloa pilosa",1928387220,"Chapada dos Veadeiros, 13 km by road S of Terezina.","BRA",5000,1973,"PRESERVED_SPECIMEN","COORDINATE_REPROJECTED;COLLECTION_MATCH_FUZZY"
-64.408483,-9.232415,"Rugoloa pilosa",1930732799,"Secondary forest between Jaciparaná and Rio Madeira.","BRA",NA,1968,"PRESERVED_SPECIMEN","COLLECTION_MATCH_FUZZY"
-49.230556,-27.450278,"Rugoloa pilosa",2996129996,"Rio Feijão.","BRA",NA,2009,"PRESERVED_SPECIMEN","RECORDED_DATE_INVALID;COORDINATE_ROUNDED;GEODETIC_DATUM_ASSUMED_WGS84;CONTINENT_DERIVED_FROM_COORDINATES;INSTITUTION_MATCH_FUZZY;COLLECTION_MATCH_FUZZY"
-49.590556,-26.459722,"Rugoloa pilosa",2996142412,"Volta Grande.","BRA",NA,2008,"PRESERVED_SPECIMEN","COORDINATE_ROUNDED;GEODETIC_DATUM_ASSUMED_WGS84;CONTINENT_DERIVED_FROM_COORDINATES;INSTITUTION_MATCH_FUZZY;COLLECTION_MATCH_FUZZY"
-50.579722,-27.090833,"Rugoloa pilosa",2996142415,"","BRA",NA,2008,"PRESERVED_SPECIMEN","COORDINATE_ROUNDED;GEODETIC_DATUM_ASSUMED_WGS84;CONTINENT_DERIVED_FROM_COORDINATES;INSTITUTION_MATCH_FUZZY;COLLECTION_MATCH_FUZZY"
-49.098333,-27.064444,"Rugoloa pilosa",2996142890,"Morro do Sapo, Parque Nacional da Serra do Itajaí.","BRA",NA,2013,"PRESERVED_SPECIMEN","COORDINATE_ROUNDED;GEODETIC_DATUM_ASSUMED_WGS84;CONTINENT_DERIVED_FROM_COORDINATES;INSTITUTION_MATCH_FUZZY;COLLECTION_MATCH_FUZZY"
-50.94,-27.63,"Rugoloa pilosa",2996153915,"Araça.","BRA",NA,2009,"PRESERVED_SPECIMEN","GEODETIC_DATUM_ASSUMED_WGS84;CONTINENT_DERIVED_FROM_COORDINATES;INSTITUTION_MATCH_FUZZY;COLLECTION_MATCH_FUZZY"
-89.55,13.68333,"Rugoloa pilosa",1585312480,"Depto. Sonsonate, Santa Isabel Ishuatán, El Ecuador, Río Ojustheo","SLV",NA,2006,"PRESERVED_SPECIMEN","CONTINENT_DERIVED_FROM_COORDINATES;INSTITUTION_MATCH_FUZZY;COLLECTION_MATCH_NONE"
-88.5833,14.5,"Rugoloa pilosa",1836962182,"Mocorón, orillas del rio Dursuna 60 km SW de Pto. Lempira.","HND",NA,1984,"PRESERVED_SPECIMEN","GEODETIC_DATUM_ASSUMED_WGS84;CONTINENT_DERIVED_FROM_COORDINATES;INSTITUTION_COLLECTION_MISMATCH"
-76.1,-5.91,"Rugoloa pilosa",2575149853,"Experimental rice fields on Fundo San Ramon near Yurimaguas on Rio Sahnusi.","PER",1000,1970,"PRESERVED_SPECIMEN","GEODETIC_DATUM_ASSUMED_WGS84;CONTINENT_DERIVED_FROM_COORDINATES;INSTITUTION_MATCH_FUZZY"
-73.96215,11.32449,"Rugoloa pilosa",911785655,"PNN Tayrona; Estación Arrecifes","COL",1037.49,1979,"MACHINE_OBSERVATION","GEODETIC_DATUM_ASSUMED_WGS84"
-90.2625,18.645833,"Rugoloa pilosa",2268908261,"3 km al S del Ejido Libertad.","MEX",NA,1984,"PRESERVED_SPECIMEN","OCCURRENCE_STATUS_INFERRED_FROM_INDIVIDUAL_COUNT;COORDINATE_ROUNDED;GEODETIC_DATUM_ASSUMED_WGS84;DIFFERENT_OWNER_INSTITUTION"
-65.26666,-15.81666,"Rugoloa pilosa",4061635928,"Provincia Moxos; territorio Indigena, Parque Nacional Isiboro Sécure (TIPNIS), sector: San José de Patrocinio, a 1 km. de la comunidad; bajios de pampa.","BOL",NA,1996,"PRESERVED_SPECIMEN","GEODETIC_DATUM_ASSUMED_WGS84;INSTITUTION_MATCH_NONE"
-54.983333,-27.233333,"Rugoloa pilosa",1259526047,"entre Campo Viera y Campo Grande","ARG",NA,1984,"PRESERVED_SPECIMEN","OCCURRENCE_STATUS_INFERRED_FROM_INDIVIDUAL_COUNT;COORDINATE_ROUNDED;GEODETIC_DATUM_ASSUMED_WGS84;DIFFERENT_OWNER_INSTITUTION"
-67.1,3.066667,"Rugoloa pilosa",1258065480,"El Almidon, en los límites del Departmento Atabapo y Casiquiare. Rio Atacavi. Frente 2.","VEN",NA,1989,"PRESERVED_SPECIMEN","OCCURRENCE_STATUS_INFERRED_FROM_INDIVIDUAL_COUNT;COORDINATE_ROUNDED;GEODETIC_DATUM_ASSUMED_WGS84;DIFFERENT_OWNER_INSTITUTION"
-35.68,-8.48,"Rugoloa pilosa",912080577,"Reserva Ecologica Municipal da Prefeitura de Bonito.","BRA",NA,1995,"PRESERVED_SPECIMEN","GEODETIC_DATUM_ASSUMED_WGS84;CONTINENT_DERIVED_FROM_COORDINATES;INSTITUTION_MATCH_FUZZY;COLLECTION_MATCH_FUZZY"
-67.67,10.35,"Rugoloa pilosa",3043574870,"Mun. Autonomo. Girardot vertiente sur, Pque. Nacional H. Pittier,Estacion Rancho Grande camino a La Toma.","VEN",NA,1989,"PRESERVED_SPECIMEN","GEODETIC_DATUM_ASSUMED_WGS84"
-59.78,3.33,"Rugoloa pilosa",1456099297,"Rupununi Northern Savanna, St. Ignatius","GUY",NA,1963,"PRESERVED_SPECIMEN","GEODETIC_DATUM_ASSUMED_WGS84"
-71.82,-3.17,"Rugoloa pilosa",3043563316,"Peruvianae. Dept. Loreto, Prov. Maynas: Rio Ampiyacu, Pebas and vicinity. Pijuayal. Alpha Helix Amazon Expedition, 1976-1977, Phase VII.","PER",NA,1977,"PRESERVED_SPECIMEN","GEODETIC_DATUM_ASSUMED_WGS84"
-59.83,5.08,"Rugoloa pilosa",1456240494,"Mt. Iraimakipang, trail to","GUY",NA,1963,"PRESERVED_SPECIMEN","GEODETIC_DATUM_ASSUMED_WGS84"
-52.95,3.51,"Rugoloa pilosa",1456148985,"Haute Approuague, Crique Parépou","GUF",NA,1968,"PRESERVED_SPECIMEN","GEODETIC_DATUM_ASSUMED_WGS84"
-54.08,2.65,"Rugoloa pilosa",1456160348,"Monpé Soula, Camp #4, roche no. 3; Bassin du Haut-Marouini, 5 km W","GUF",NA,1987,"PRESERVED_SPECIMEN","GEODETIC_DATUM_ASSUMED_WGS84"
-95.970805,16.028444,"Rugoloa pilosa",1897570225,"2.6 km al N de San Miguel Chongo, rumbo a San Pedro Sosoltepec.","MEX",NA,2001,"PRESERVED_SPECIMEN","TYPE_STATUS_INVALID;OCCURRENCE_STATUS_INFERRED_FROM_INDIVIDUAL_COUNT;COORDINATE_ROUNDED;CONTINENT_DERIVED_FROM_COORDINATES;ELEVATION_MIN_MAX_SWAPPED;INSTITUTION_MATCH_NONE"
-96.108333,18.008333,"Rugoloa pilosa",1893395086,"Km. 13 Tuxtepec Pueblo Viejo.","MEX",90,1964,"PRESERVED_SPECIMEN","TYPE_STATUS_INVALID;COORDINATE_ROUNDED;GEODETIC_DATUM_ASSUMED_WGS84;CONTINENT_DERIVED_FROM_COORDINATES;INSTITUTION_MATCH_NONE"
-61.45,6.216667,"Rugoloa pilosa",1260332976,"Concesión Minera Oro Uno. 7Km. al N-O de la Clarita.","VEN",NA,1985,"PRESERVED_SPECIMEN","OCCURRENCE_STATUS_INFERRED_FROM_INDIVIDUAL_COUNT;COORDINATE_ROUNDED;GEODETIC_DATUM_ASSUMED_WGS84;ELEVATION_NON_NUMERIC;INSTITUTION_MATCH_FUZZY;COLLECTION_MATCH_NONE"
-49.218889,-14.476389,"Rugoloa pilosa",1258576308,"Estrada para Riachão, ca 2 km. da cidade; Fazenda Macaco. Folha Uruaçú SD-22-Z-B.","BRA",NA,1998,"PRESERVED_SPECIMEN","OCCURRENCE_STATUS_INFERRED_FROM_INDIVIDUAL_COUNT;COORDINATE_ROUNDED;GEODETIC_DATUM_ASSUMED_WGS84;INSTITUTION_MATCH_FUZZY;COLLECTION_MATCH_NONE"
-78.10752,1.602311,"Rugoloa pilosa",1258584401,"Entre Barbacoas y Payán.","COL",NA,1989,"PRESERVED_SPECIMEN","OCCURRENCE_STATUS_INFERRED_FROM_INDIVIDUAL_COUNT;GEODETIC_DATUM_ASSUMED_WGS84;INSTITUTION_MATCH_FUZZY;COLLECTION_MATCH_NONE"
-78.233333,-3.116667,"Rugoloa pilosa",1257589465,"Los Tayos.","ECU",NA,1976,"PRESERVED_SPECIMEN","OCCURRENCE_STATUS_INFERRED_FROM_INDIVIDUAL_COUNT;COORDINATE_ROUNDED;GEODETIC_DATUM_ASSUMED_WGS84;INSTITUTION_MATCH_FUZZY;COLLECTION_MATCH_NONE"
-65.033333,5.883333,"Rugoloa pilosa",1260334647,"Cuenca alto rio Nichare.","VEN",NA,1988,"PRESERVED_SPECIMEN","OCCURRENCE_STATUS_INFERRED_FROM_INDIVIDUAL_COUNT;COORDINATE_ROUNDED;GEODETIC_DATUM_ASSUMED_WGS84;INSTITUTION_MATCH_FUZZY;COLLECTION_MATCH_NONE"
-97.915,17.038333,"Rugoloa pilosa",1259269938,"1 km. de Putla rumbo a Tlaxiaco.","MEX",NA,1980,"PRESERVED_SPECIMEN","OCCURRENCE_STATUS_INFERRED_FROM_INDIVIDUAL_COUNT;COORDINATE_ROUNDED;GEODETIC_DATUM_ASSUMED_WGS84;INSTITUTION_MATCH_FUZZY;COLLECTION_MATCH_NONE"
-78.1475,8.615556,"Rugoloa pilosa",1259272761,"Mouth of Río Lara","PAN",NA,1966,"PRESERVED_SPECIMEN","OCCURRENCE_STATUS_INFERRED_FROM_INDIVIDUAL_COUNT;COORDINATE_ROUNDED;GEODETIC_DATUM_ASSUMED_WGS84;INSTITUTION_MATCH_FUZZY;COLLECTION_MATCH_NONE"
-79.658333,9.366667,"Rugoloa pilosa",1259271191,"9-12 mi E of Transisthmian Highway on Santa Rita ridge. [Coordinates on original label: 09º20'N, 079º45'W]","PAN",NA,1988,"PRESERVED_SPECIMEN","OCCURRENCE_STATUS_INFERRED_FROM_INDIVIDUAL_COUNT;COORDINATE_ROUNDED;GEODETIC_DATUM_ASSUMED_WGS84;INSTITUTION_MATCH_FUZZY;COLLECTION_MATCH_NONE"
-88.866667,16.133333,"Rugoloa pilosa",1259273926,"9 miles west of Punta Gorda on road from Punta Gorda to San Jose.","BLZ",NA,1970,"PRESERVED_SPECIMEN","OCCURRENCE_STATUS_INFERRED_FROM_INDIVIDUAL_COUNT;COORDINATE_ROUNDED;GEODETIC_DATUM_ASSUMED_WGS84;INSTITUTION_MATCH_FUZZY;COLLECTION_MATCH_NONE"
-67.666667,4.016667,"Rugoloa pilosa",4031358556,"Northern bank of the Río Orinoco, ca. 5 km E of San Fernando de Atabapo.","VEN",NA,1979,"PRESERVED_SPECIMEN","OCCURRENCE_STATUS_INFERRED_FROM_INDIVIDUAL_COUNT;COORDINATE_ROUNDED;GEODETIC_DATUM_ASSUMED_WGS84;INSTITUTION_MATCH_FUZZY;COLLECTION_MATCH_NONE"
-60.833333,-14.6,"Rugoloa pilosa",4031922677,"Parque Nacional Noel Kempff Mercado. Alrededores del campamento Los Fierros, 10 km E y 1 km S.","BOL",NA,1994,"PRESERVED_SPECIMEN","OCCURRENCE_STATUS_INFERRED_FROM_INDIVIDUAL_COUNT;COORDINATE_ROUNDED;GEODETIC_DATUM_ASSUMED_WGS84;INSTITUTION_MATCH_FUZZY;COLLECTION_MATCH_NONE"
-66.833333,1.241667,"Rugoloa pilosa",1259598817,"VICINITY OF SANTA LUCIA: 1º14'30'N, 66º50'W; elev. less than 100 m.","VEN",NA,1984,"PRESERVED_SPECIMEN","OCCURRENCE_STATUS_INFERRED_FROM_INDIVIDUAL_COUNT;COORDINATE_ROUNDED;GEODETIC_DATUM_ASSUMED_WGS84;INSTITUTION_MATCH_FUZZY;COLLECTION_MATCH_NONE"
-86.668889,14.453333,"Rugoloa pilosa",1259272772,"Montaña de Chifiringo, 20 km O de Campamento. Bosque de hoja ancha.","HND",NA,1979,"PRESERVED_SPECIMEN","OCCURRENCE_STATUS_INFERRED_FROM_INDIVIDUAL_COUNT;COORDINATE_ROUNDED;GEODETIC_DATUM_ASSUMED_WGS84;INSTITUTION_MATCH_FUZZY;COLLECTION_MATCH_NONE"
-78.388056,-5.303889,"Rugoloa pilosa",1258779902,"Soldado Oliva. Carretera entre Bagua-Imaza.","PER",NA,1999,"PRESERVED_SPECIMEN","OCCURRENCE_STATUS_INFERRED_FROM_INDIVIDUAL_COUNT;GEODETIC_DATUM_ASSUMED_WGS84;INSTITUTION_MATCH_FUZZY;COLLECTION_MATCH_NONE"
-84.300833,11.110833,"Rugoloa pilosa",4032068318,"Municipio El Castillo, Comunidad Filas Verdes","NIC",NA,2004,"PRESERVED_SPECIMEN","OCCURRENCE_STATUS_INFERRED_FROM_INDIVIDUAL_COUNT;COORDINATE_ROUNDED;GEODETIC_DATUM_ASSUMED_WGS84;INSTITUTION_MATCH_FUZZY;COLLECTION_MATCH_NONE"
-59.916667,7.616667,"Rugoloa pilosa",1260332754,"Barima-Waini Region: Barima River, 12 miles E of Arakaka, at Tenapu Creek.","GUY",NA,1986,"PRESERVED_SPECIMEN","OCCURRENCE_STATUS_INFERRED_FROM_INDIVIDUAL_COUNT;COORDINATE_ROUNDED;GEODETIC_DATUM_ASSUMED_WGS84;INSTITUTION_MATCH_FUZZY;COLLECTION_MATCH_NONE"
-77.4,7.9,"Rugoloa pilosa",1259271676,"Vicinity of Paya, Río Paya, trail between Paya & Payita.","PAN",NA,1959,"PRESERVED_SPECIMEN","OCCURRENCE_STATUS_INFERRED_FROM_INDIVIDUAL_COUNT;GEODETIC_DATUM_ASSUMED_WGS84;INSTITUTION_MATCH_FUZZY;COLLECTION_MATCH_NONE"
-83.07,10,"Rugoloa pilosa",1259271335,"Moín. Beach of Caribbean Sea.","CRI",NA,1966,"PRESERVED_SPECIMEN","OCCURRENCE_STATUS_INFERRED_FROM_INDIVIDUAL_COUNT;GEODETIC_DATUM_ASSUMED_WGS84;ELEVATION_NON_NUMERIC;INSTITUTION_MATCH_FUZZY;COLLECTION_MATCH_NONE"
-83.766667,15.266667,"Rugoloa pilosa",1259271849,"Alrededores de Puerto Lempira.","HND",NA,1978,"PRESERVED_SPECIMEN","OCCURRENCE_STATUS_INFERRED_FROM_INDIVIDUAL_COUNT;COORDINATE_ROUNDED;GEODETIC_DATUM_ASSUMED_WGS84;ELEVATION_NON_NUMERIC;INSTITUTION_MATCH_FUZZY;COLLECTION_MATCH_NONE"
-100.199444,17.384444,"Rugoloa pilosa",1259272771,"Loc. 8 Km, al NE de Paraiso, Carr. a Puerto del Gallo.","MEX",NA,1982,"PRESERVED_SPECIMEN","OCCURRENCE_STATUS_INFERRED_FROM_INDIVIDUAL_COUNT;COORDINATE_ROUNDED;GEODETIC_DATUM_ASSUMED_WGS84;INSTITUTION_MATCH_FUZZY;COLLECTION_MATCH_NONE"
-57.31,-7.35,"Rugoloa pilosa",2302445761,"Tall rainforest a. 5km SE of Missão Cururú.","BRA",NA,1974,"PRESERVED_SPECIMEN","RECORDED_DATE_INVALID;COORDINATE_ROUNDED;GEODETIC_DATUM_ASSUMED_WGS84;CONTINENT_DERIVED_FROM_COORDINATES;INSTITUTION_MATCH_FUZZY;COLLECTION_MATCH_FUZZY"
-51.19,3.36,"Rugoloa pilosa",2302436858,"In clearing, in partial shade. Middle slopes of Mt. ipac.","BRA",NA,1960,"PRESERVED_SPECIMEN","GEODETIC_DATUM_ASSUMED_WGS84;CONTINENT_DERIVED_FROM_COORDINATES;INSTITUTION_MATCH_FUZZY;COLLECTION_MATCH_FUZZY"
-59.151389,-0.441389,"Rugoloa pilosa",2302426052,"Entre Igarapé Azul e Branco e estrada Boa Vista-Caracaraí.","BRA",NA,1951,"PRESERVED_SPECIMEN","COORDINATE_ROUNDED;GEODETIC_DATUM_ASSUMED_WGS84;CONTINENT_DERIVED_FROM_COORDINATES;INSTITUTION_MATCH_FUZZY;COLLECTION_MATCH_FUZZY"
-52.55,-0.55,"Rugoloa pilosa",2302431164,"Clump grass in secondary scrub on Curuca Ore Body.","BRA",NA,1954,"PRESERVED_SPECIMEN","RECORDED_DATE_INVALID;GEODETIC_DATUM_ASSUMED_WGS84;CONTINENT_DERIVED_FROM_COORDINATES;INSTITUTION_MATCH_FUZZY;COLLECTION_MATCH_FUZZY"
-59.5667,5,"Rugoloa pilosa",1456091249,"Chenapou, Amerindian village (Patumona) 50 km upstream from Kaieteur Falls","GUY",NA,1987,"PRESERVED_SPECIMEN","GEODETIC_DATUM_ASSUMED_WGS84"
-57.75,6.55,"Rugoloa pilosa",1456080478,"E Coast Demerara, Mahaicony Abary Rice Development. Scheme","GUY",NA,1958,"PRESERVED_SPECIMEN","GEODETIC_DATUM_ASSUMED_WGS84"
-41.38,-12.57,"Rugoloa pilosa",912080578,"Rio Lencois a cima do Serrano.","BRA",NA,1984,"PRESERVED_SPECIMEN","GEODETIC_DATUM_ASSUMED_WGS84;CONTINENT_DERIVED_FROM_COORDINATES;INSTITUTION_MATCH_FUZZY;COLLECTION_MATCH_FUZZY"
-39,-13.32,"Rugoloa pilosa",912080527,"Km 11 da estrada Valenca para Guaibim.","BRA",NA,1982,"PRESERVED_SPECIMEN","GEODETIC_DATUM_ASSUMED_WGS84;CONTINENT_DERIVED_FROM_COORDINATES;INSTITUTION_MATCH_FUZZY;COLLECTION_MATCH_FUZZY"
-83.115272,9.103987,"Rugoloa pilosa",1253898270,"La Lucha. Rancho Amuo.","CRI",NA,2010,"PRESERVED_SPECIMEN","COORDINATE_ROUNDED;CONTINENT_DERIVED_FROM_COORDINATES;CONTINENT_INVALID;INSTITUTION_MATCH_FUZZY;COLLECTION_MATCH_NONE"
-83.508846,9.023852,"Rugoloa pilosa",1253827195,"Osa, Ciudad Pto Cortés, Cuesta del Burro.","CRI",NA,2005,"PRESERVED_SPECIMEN","COORDINATE_ROUNDED;CONTINENT_DERIVED_FROM_COORDINATES;CONTINENT_INVALID;INSTITUTION_MATCH_FUZZY;COLLECTION_MATCH_NONE"
-84.123611,9.560556,"Rugoloa pilosa",1253828823,"Tarrazú, San Carlos; Bajo de la Virgen, areas perturbadas junto a camino que va hacia Cerros de Quepos.","CRI",NA,2003,"PRESERVED_SPECIMEN","COORDINATE_ROUNDED;CONTINENT_DERIVED_FROM_COORDINATES;CONTINENT_INVALID;INSTITUTION_MATCH_FUZZY;COLLECTION_MATCH_NONE"
-83.604167,10.140146,"Rugoloa pilosa",1253845945,"Siquirres. Finca de Erick Berlin.","CRI",NA,2006,"PRESERVED_SPECIMEN","COORDINATE_ROUNDED;CONTINENT_DERIVED_FROM_COORDINATES;CONTINENT_INVALID;INSTITUTION_MATCH_FUZZY;COLLECTION_MATCH_NONE"
-65,10.15,"Rugoloa pilosa",2452812169,"Cerros del Bachiller, Near east end. Between Quebradas Corozal and Santa Crus, S of Santa Cruz. 10 km (by air) W of Cúpira.","VEN",NA,1978,"PRESERVED_SPECIMEN","GEODETIC_DATUM_ASSUMED_WGS84;INSTITUTION_MATCH_NONE"
-46.1876,-23.4649,"Rugoloa pilosa",2452930107,"E.B. do Alto da Serra de Paranapiacaba","BRA",NA,2009,"PRESERVED_SPECIMEN","GEODETIC_DATUM_ASSUMED_WGS84;CONTINENT_DERIVED_FROM_COORDINATES;INSTITUTION_MATCH_NONE"
-46.941667,-23.824444,"Rugoloa pilosa",2452933179,"Reserva Particular do Patrimônio Natural Paiol Maria, trilha próximo à base.","BRA",NA,2010,"PRESERVED_SPECIMEN","GEODETIC_DATUM_ASSUMED_WGS84;CONTINENT_DERIVED_FROM_COORDINATES;INSTITUTION_MATCH_NONE"
-46.316667,-23.783333,"Rugoloa pilosa",2452821856,"E.B. do Alto da Serra de Paranapiacaba","BRA",NA,1984,"PRESERVED_SPECIMEN","GEODETIC_DATUM_ASSUMED_WGS84;CONTINENT_DERIVED_FROM_COORDINATES;INSTITUTION_MATCH_NONE"
-47.666667,-23.95,"Rugoloa pilosa",2452961428,"Along highway BR-2, 1 km SW of turnoff to Juquitiba.","BRA",NA,1965,"PRESERVED_SPECIMEN","GEODETIC_DATUM_ASSUMED_WGS84;CONTINENT_DERIVED_FROM_COORDINATES;INSTITUTION_MATCH_NONE"
-68.566667,10.2,"Rugoloa pilosa",2452820765,"5 km N of Nirgua by road.","VEN",NA,1982,"PRESERVED_SPECIMEN","GEODETIC_DATUM_ASSUMED_WGS84;INSTITUTION_MATCH_NONE"
-47.148056,-22.190556,"Rugoloa pilosa",2452941043,"Fazenda Campininha, Reserva Biológica de Mogi Guaçu, Gleba B.","BRA",NA,2012,"PRESERVED_SPECIMEN","GEODETIC_DATUM_ASSUMED_WGS84;CONTINENT_DERIVED_FROM_COORDINATES;INSTITUTION_MATCH_NONE"
-68,9.733333,"Rugoloa pilosa",2452821364,"Cerros del Bachiller, Dtto. Infante. Cerros del Bachiller: Caño Carnestoleno.","VEN",NA,1981,"PRESERVED_SPECIMEN","GEODETIC_DATUM_ASSUMED_WGS84;INSTITUTION_MATCH_NONE"
-41.316667,-10.366667,"Rugoloa pilosa",2452916255,"Serra do Curral Feio, Localmente referida como Serra da Empreitada. Entrando para W a cerca de 20 km S de Delfino na estrada para Umburanas.","BRA",NA,1999,"PRESERVED_SPECIMEN","GEODETIC_DATUM_ASSUMED_WGS84;CONTINENT_DERIVED_FROM_COORDINATES;INSTITUTION_MATCH_NONE"
-45.044167,-23.256944,"Rugoloa pilosa",2452885035,"Parque Estadual da Serra do Mar, Núcleo Cunha. Estrada em direção à trilha do Rio Bonito.","BRA",NA,1996,"PRESERVED_SPECIMEN","GEODETIC_DATUM_ASSUMED_WGS84;CONTINENT_DERIVED_FROM_COORDINATES;INSTITUTION_MATCH_NONE"
-41.708611,-4.098333,"Rugoloa pilosa",2452930869,"Parque Nacional de Sete Cidades, Córrego Brejo Velho. Ponto 97. Folha SB-24-V-A.","BRA",NA,2007,"PRESERVED_SPECIMEN","GEODETIC_DATUM_ASSUMED_WGS84;CONTINENT_DERIVED_FROM_COORDINATES;INSTITUTION_MATCH_NONE"
-69.89,-3.98,"Rugoloa pilosa",768752933,"camino a Tarapacá, km 17","COL",NA,1965,"PRESERVED_SPECIMEN","INSTITUTION_MATCH_NONE"
-69.94,-4.18,"Rugoloa pilosa",768767020,"reserva natural Selva Luna, km 3,2 vía los lagos","COL",NA,2003,"PRESERVED_SPECIMEN","INSTITUTION_MATCH_NONE"
-71.55,-1.14,"Rugoloa pilosa",1147298158,"Araracuara, plano inundable, Tres islas, orilla de río","COL",NA,2001,"PRESERVED_SPECIMEN","INSTITUTION_MATCH_NONE"
-72.36,-0.6,"Rugoloa pilosa",768725252,"Araracuara, rastrojo de Oscar Román","COL",NA,1986,"PRESERVED_SPECIMEN","INSTITUTION_MATCH_NONE"
-70.25,5.6,"Rugoloa pilosa",3068331328,"corregimiento la Hermosa, finca Nicaragua, bosque de galería, llanura aluvial de desborde","COL",NA,2004,"PRESERVED_SPECIMEN","INSTITUTION_MATCH_NONE"
-69.43,0.71,"Rugoloa pilosa",1416798370,"río Papurí, montaña abajo de Teresita","COL",NA,1952,"PRESERVED_SPECIMEN","INSTITUTION_MATCH_NONE"
-72.66,2.46,"Rugoloa pilosa",1147307951,"serranía La Lindosa (Formación Araracuara)","COL",NA,1996,"PRESERVED_SPECIMEN","INSTITUTION_MATCH_NONE"
-75.88,1.43,"Rugoloa pilosa",1062921264,"parque bosque microcuenca La Resaca, vegetación de orilla de qda. y bosque moderadamente perturbado","COL",NA,2010,"PRESERVED_SPECIMEN","INSTITUTION_MATCH_NONE"
-75.9,1.6,"Rugoloa pilosa",1147304603,"Vereda Las Verdes, río pescado, margen izq., parque natural municipal Andaquí, cerro Monserrate","COL",NA,2010,"PRESERVED_SPECIMEN","INSTITUTION_MATCH_NONE"
-73.76,2.25,"Rugoloa pilosa",1416800286,"Vereda Cachivera, finca de la familia Fandiño, potrero muy limpio con algunos árboles como Caruto, Macano y Gualaday","COL",NA,2004,"PRESERVED_SPECIMEN","INSTITUTION_MATCH_NONE"
-73.9,2.51,"Rugoloa pilosa",768739946,"Vereda El Tapir, Parque Nacional Natural sierra de La Macarena, río Guayabero, bocas de río Duda, Caño Cabaña, sector Cielo Roto","COL",NA,1996,"PRESERVED_SPECIMEN","INSTITUTION_MATCH_NONE"
-75.72,1.36,"Rugoloa pilosa",768778053,"Vereda el Matadero, finca Santa María","COL",NA,2009,"PRESERVED_SPECIMEN","INSTITUTION_MATCH_NONE"
-74.48795,2.26092,"Rugoloa pilosa",768764512,"Vereda Flor de Mayo, llanura aluvial meándrica de origén andino","COL",NA,2004,"PRESERVED_SPECIMEN","INSTITUTION_MATCH_NONE"
-72.69,2.49,"Rugoloa pilosa",1932875342,"serranía La Lindosa, afloramiento rocoso","COL",NA,1996,"PRESERVED_SPECIMEN","INSTITUTION_MATCH_NONE"
-74.1674,2.6857,"Rugoloa pilosa",768740850,"Parque Nacional Natural Tinigua, río Duda, sierra Chamusa, centro de investigaciones ecológicas La Macarena","COL",NA,1996,"PRESERVED_SPECIMEN","INSTITUTION_MATCH_NONE"
-70.95,-0.03,"Rugoloa pilosa",1324650006,"Gran resguardo indígena del Vaupés, comunidad Buenos Aires, orilla del río Cananarí, cerca bocana río Apaporis","COL",NA,2013,"PRESERVED_SPECIMEN","INSTITUTION_MATCH_NONE"
-69.75,-2.7,"Rugoloa pilosa",768731049,"río Putumayo, 10km E alrededores de Puerto Nuevo, Bh-T","COL",NA,1994,"PRESERVED_SPECIMEN","INSTITUTION_MATCH_NONE"
-77.08,0.67,"Rugoloa pilosa",1416802121,"resguardo indígena Gran Jardín de la sierra, meseta aluvial, 800m del asentamiento Nuevo Mundo","COL",NA,2014,"PRESERVED_SPECIMEN","INSTITUTION_MATCH_NONE"
-74.77,-0.15,"Rugoloa pilosa",768756009,"carretera La Tagua, km 19, bosque intervenido sobre relieve colinado","COL",NA,1998,"PRESERVED_SPECIMEN","INSTITUTION_MATCH_NONE"
-72.11,2.56,"Rugoloa pilosa",1147292074,"inspección de policía Macú, localidad de Guanapalo, trocha a Charras","COL",NA,1996,"PRESERVED_SPECIMEN","INSTITUTION_MATCH_NONE"
-71.44,-1.67,"Rugoloa pilosa",1932875733,"Parque Nacional Natural Cahuinarí, río Cahuinarí, qda. La Mota, resguardo indígena","COL",NA,1997,"PRESERVED_SPECIMEN","INSTITUTION_MATCH_NONE"
-69.54,-1.32,"Rugoloa pilosa",1147294260,"río Caquetá, alrededores de la qda. La Tonina","COL",NA,1997,"PRESERVED_SPECIMEN","INSTITUTION_MATCH_NONE"
-72.33,-0.61,"Rugoloa pilosa",768728421,"Araracuara, chagra de T. Schroder.","COL",NA,1989,"PRESERVED_SPECIMEN","INSTITUTION_MATCH_NONE"
-72.71,-1.53,"Rugoloa pilosa",768727668,"río Igará-Paraná, Milán, chagra Aurelia Kuiru","COL",NA,1987,"PRESERVED_SPECIMEN","INSTITUTION_MATCH_NONE"
-69.73,-1.28,"Rugoloa pilosa",1932879034,"resguardo indígena Curare-Los Ingleses, comunidad indígena Curare, claro alrededor de una vivienda","COL",NA,2004,"PRESERVED_SPECIMEN","INSTITUTION_MATCH_NONE"
-72.7,2.51,"Rugoloa pilosa",768774126,"serranía La Lindosa, entre La Puerta de Orión y la antigua recebera","COL",NA,2008,"PRESERVED_SPECIMEN","INSTITUTION_MATCH_NONE"
-72.08,4.39,"Rugoloa pilosa",1932879738,"entre río Yucao y río Manacacías, por la carretera a la Shell, en bosque de galería","COL",NA,1993,"PRESERVED_SPECIMEN","INSTITUTION_MATCH_NONE"
-76.46,1.04,"Rugoloa pilosa",768746965,"margen izq. río Caquetá, aguas abajo de la qda. La Honda, finca Villa Osiris, rastrojo bajo, menor de 1 año","COL",NA,1996,"PRESERVED_SPECIMEN","INSTITUTION_MATCH_NONE"
-75.58,1.48,"Rugoloa pilosa",768762252,"Vereda la Turbia, paisaje de lomerío, potrero y humedal, sotobosque de humedal.","COL",NA,2003,"PRESERVED_SPECIMEN","INSTITUTION_MATCH_NONE"
-54.4667,4.9,"Rugoloa pilosa",1456445555,"Fleuve Maroni, Couch' Tabiki","SUR",NA,1986,"PRESERVED_SPECIMEN","GEODETIC_DATUM_ASSUMED_WGS84"
-62,6.08,"Rugoloa pilosa",1456353943,"Sierra de Lema, Cabaceras de Río Chicanan, 80 km in straight line to SW of El Dorado, between Río Chicanan and Río Ayaiche, between Puerta Lema and base of Sierra","VEN",NA,1961,"PRESERVED_SPECIMEN","GEODETIC_DATUM_ASSUMED_WGS84"
-56.46,3.1,"Rugoloa pilosa",1456340065,"Kayser Airstrip, Zuid R., 45 km above confl. with Lucie R., Wilhelmina Gebergte","SUR",NA,1963,"PRESERVED_SPECIMEN","GEODETIC_DATUM_ASSUMED_WGS84"
-42.73,-6.48,"Rugoloa pilosa",3043537471,"Município de Amarante: 32.8 km along road south of Amarante (25 km south of Piauí River).","BRA",NA,1970,"PRESERVED_SPECIMEN","GEODETIC_DATUM_ASSUMED_WGS84"
-71.58,8.47,"Rugoloa pilosa",3043526944,"Valle del Río Chama: carretera Rafael Caldera Mérida - El Vigía: entre Estánquez y El Vigía: sector Garibaldi.","VEN",NA,2006,"PRESERVED_SPECIMEN","GEODETIC_DATUM_ASSUMED_WGS84"
-78.083333,8.9,"Rugoloa pilosa",1259271898,"1 mile N of Río Sabana.","PAN",NA,1966,"PRESERVED_SPECIMEN","OCCURRENCE_STATUS_INFERRED_FROM_INDIVIDUAL_COUNT;COORDINATE_ROUNDED;GEODETIC_DATUM_ASSUMED_WGS84;INSTITUTION_MATCH_FUZZY;COLLECTION_MATCH_NONE"
-84.216667,15,"Rugoloa pilosa",1259273600,"Arroyada del río Dursuna, 70 km al [sur]oeste de Puerto Lempira. Clima lluvioso tropical húmedo; llanos de ~Pinus caribaea~ Morelet","HND",NA,1972,"PRESERVED_SPECIMEN","OCCURRENCE_STATUS_INFERRED_FROM_INDIVIDUAL_COUNT;COORDINATE_ROUNDED;GEODETIC_DATUM_ASSUMED_WGS84;INSTITUTION_MATCH_FUZZY;COLLECTION_MATCH_NONE"
-71.166667,-13.083333,"Rugoloa pilosa",1259545473,"Distrito de Pilcopata. Fundo Santa Alicia.","PER",NA,1985,"PRESERVED_SPECIMEN","OCCURRENCE_STATUS_INFERRED_FROM_INDIVIDUAL_COUNT;COORDINATE_ROUNDED;GEODETIC_DATUM_ASSUMED_WGS84;INSTITUTION_MATCH_FUZZY;COLLECTION_MATCH_NONE"
-83.766667,11.983333,"Rugoloa pilosa",1258480442,"Punta Masaya, near Bluefields; palms and cleared land [Seymour seriees]","NIC",NA,1968,"PRESERVED_SPECIMEN","OCCURRENCE_STATUS_INFERRED_FROM_INDIVIDUAL_COUNT;COORDINATE_ROUNDED;GEODETIC_DATUM_ASSUMED_WGS84;ELEVATION_NON_NUMERIC;INSTITUTION_MATCH_FUZZY;COLLECTION_MATCH_NONE"
