"lon","lat","species","gbifID","locality","countryCode","coordinateUncertaintyInMeters","year","basisOfRecord","issue"
48.62,-19.22,"Sabicea diversifolia",1096805151,"Madagascar. Toamasina: Atsinanana Region. Atsinanana, Vatomandry, Ambalabe, Sahanionaka. Le long de la route Sahanionaka-Ambalabe.","MDG",NA,2011,"PRESERVED_SPECIMEN","GEODETIC_DATUM_ASSUMED_WGS84;INSTITUTION_COLLECTION_MISMATCH"
48.711944,-13.588055,"Sabicea diversifolia",4061693466,"Ambilobe, Beramanja, Anketrabe Belinta. Forêt de Galoko.","MDG",NA,2013,"PRESERVED_SPECIMEN","OCCURRENCE_STATUS_INFERRED_FROM_INDIVIDUAL_COUNT;COORDINATE_ROUNDED;GEODETIC_DATUM_ASSUMED_WGS84;DIFFERENT_OWNER_INSTITUTION"
49.37833,-14.23194,"Sabicea diversifolia",1260311970,"Sava, Andapa, Doany, Anjialavahely, Antsahabalika situé à 10 Km vol d'oiseau au Nord d'Anjialava. Echantillon préservé en alcool. Récolté avec Patriode, Mobel & Germain.","MDG",NA,2006,"PRESERVED_SPECIMEN","OCCURRENCE_STATUS_INFERRED_FROM_INDIVIDUAL_COUNT;GEODETIC_DATUM_ASSUMED_WGS84;DIFFERENT_OWNER_INSTITUTION"
49.092778,-18.018611,"Sabicea diversifolia",2268867729,"District Toamasina II, Commune Rurale Sahambala, Fokontany Sahavongo, Village le plus proche Sahavongo. Rivière d' Ambatoaragnana.","MDG",NA,2017,"PRESERVED_SPECIMEN","OCCURRENCE_STATUS_INFERRED_FROM_INDIVIDUAL_COUNT;COORDINATE_ROUNDED;GEODETIC_DATUM_ASSUMED_WGS84;DIFFERENT_OWNER_INSTITUTION"
47.1175,-24.573056,"Sabicea diversifolia",4062209431,"District: Fort-Dauphin. Commune: Iaboakoho. Village le plus proche: Enakôny. Rivière la plus proche: Andranomaizina. Sommet d'Analamahavondraky.","MDG",NA,2018,"PRESERVED_SPECIMEN","OCCURRENCE_STATUS_INFERRED_FROM_INDIVIDUAL_COUNT;COORDINATE_ROUNDED;GEODETIC_DATUM_ASSUMED_WGS84;DIFFERENT_OWNER_INSTITUTION"
48.775833,-18.445,"Sabicea diversifolia",1257729061,"District Brickaville, Commune Maroseranana, Fokontany Ambodilendemy, Andrangato river.","MDG",NA,2011,"PRESERVED_SPECIMEN","OCCURRENCE_STATUS_INFERRED_FROM_INDIVIDUAL_COUNT;COORDINATE_ROUNDED;GEODETIC_DATUM_ASSUMED_WGS84;DIFFERENT_OWNER_INSTITUTION"
48.42,-18.93,"Sabicea diversifolia",1096650054,"Madagascar, Toamasina prov., Moramanga dt., Andasibe commune. Andasibe Nat. Park. - Spreading shrub 2 m high with white flowers.","MDG",NA,2006,"PRESERVED_SPECIMEN","GEODETIC_DATUM_ASSUMED_WGS84;INSTITUTION_COLLECTION_MISMATCH"
49.72,-14.97,"Sabicea diversifolia",2618545076,"Madagascar, Antsiranana. Fiv.: Andapa. Comm.: Antsahamena. Fok.: Ambodiangezoka. Camp.","MDG",NA,2003,"PRESERVED_SPECIMEN","GEODETIC_DATUM_ASSUMED_WGS84;INSTITUTION_COLLECTION_MISMATCH"
49.87,-14.62,"Sabicea diversifolia",1096704080,"Madagascar. Antsiranana Province, Andapa District, Manantenina Commune. Marojejy National Park. Along the very steeo trail to Camp 3 (900 m long).","MDG",NA,2008,"PRESERVED_SPECIMEN","GEODETIC_DATUM_ASSUMED_WGS84;INSTITUTION_COLLECTION_MISMATCH"
48.55,-13.43,"Sabicea diversifolia",2618543961,"Madagascar. Antsiranana: Montagne d'Ambato. By the foot of the mountain","MDG",NA,2003,"PRESERVED_SPECIMEN","GEODETIC_DATUM_ASSUMED_WGS84;INSTITUTION_COLLECTION_MISMATCH"
50.04722,-14.10222,"Sabicea diversifolia",4031584688,"Sambava, Anjangoveratra, Ambavala, forêt de Tsihomanaomby.","MDG",NA,2006,"PRESERVED_SPECIMEN","OCCURRENCE_STATUS_INFERRED_FROM_INDIVIDUAL_COUNT;GEODETIC_DATUM_ASSUMED_WGS84;INSTITUTION_MATCH_FUZZY;COLLECTION_MATCH_NONE"
48.0925,-13.763056,"Sabicea diversifolia",4031902397,"Ambanja, commune Ambaliha, fokontany Ambaliha, village de Tsarabanja. Foret d'Ambongomirahavavy.","MDG",NA,2011,"PRESERVED_SPECIMEN","OCCURRENCE_STATUS_INFERRED_FROM_INDIVIDUAL_COUNT;COORDINATE_ROUNDED;GEODETIC_DATUM_ASSUMED_WGS84;INSTITUTION_MATCH_FUZZY;COLLECTION_MATCH_NONE"
49.675167,-16.784444,"Sabicea diversifolia",4032170548,"District de Soanerana Ivongo, Commune de Manompana, Fokontany de Vohijiny, Village d'Ambohitsara. Collectés avec Gérand et Sèrge.","MDG",NA,2022,"PRESERVED_SPECIMEN","OCCURRENCE_STATUS_INFERRED_FROM_INDIVIDUAL_COUNT;COORDINATE_ROUNDED;GEODETIC_DATUM_ASSUMED_WGS84;INSTITUTION_MATCH_FUZZY;COLLECTION_MATCH_NONE"
46.808333,-24.675,"Sabicea diversifolia",1261253249,"Région de la Réserve Naturelle Integrale No. 11 Andohahela, Eminiminy, 43 km NW de Tolagnaro, à la côté E de la réserve, une région plus humide.","MDG",NA,1991,"PRESERVED_SPECIMEN","OCCURRENCE_STATUS_INFERRED_FROM_INDIVIDUAL_COUNT;COORDINATE_ROUNDED;GEODETIC_DATUM_ASSUMED_WGS84;INSTITUTION_MATCH_FUZZY;COLLECTION_MATCH_NONE"
49.76666,-14.43333,"Sabicea diversifolia",1261253338,"Reserve Naturelle n. 12 - Marojejy; sentier qui mène au 3e Camp, au dessus du village de Manentenina.","MDG",NA,1990,"PRESERVED_SPECIMEN","OCCURRENCE_STATUS_INFERRED_FROM_INDIVIDUAL_COUNT;GEODETIC_DATUM_ASSUMED_WGS84;INSTITUTION_MATCH_FUZZY;COLLECTION_MATCH_NONE"
47.410278,-21.256667,"Sabicea diversifolia",4032151620,"Parc National de Ranomafana, ca. 100 m de l'entrée du parc vers la route de Vohiparara. Végétation le long du talus rocheux de la RN 25.","MDG",NA,2016,"PRESERVED_SPECIMEN","OCCURRENCE_STATUS_INFERRED_FROM_INDIVIDUAL_COUNT;COORDINATE_ROUNDED;GEODETIC_DATUM_ASSUMED_WGS84;INSTITUTION_MATCH_FUZZY;COLLECTION_MATCH_NONE"
48.35944,-19.02472,"Sabicea diversifolia",1259888296,"Along the road to Lakato, 13-14 km from Route Nacional 2; east of Moramanga","MDG",NA,2005,"PRESERVED_SPECIMEN","OCCURRENCE_STATUS_INFERRED_FROM_INDIVIDUAL_COUNT;GEODETIC_DATUM_ASSUMED_WGS84;INSTITUTION_MATCH_FUZZY;COLLECTION_MATCH_NONE"
49.950278,-14.170278,"Sabicea diversifolia",4032117034,"Makirovana Massif, N of Sambava. From camp on lower southern side uphill toward NW for ca. 1 km. Secondary and impacted native vegetation, disturbed by logging, vanilla cultivation, and shifting cultivation.","MDG",NA,2010,"PRESERVED_SPECIMEN","OCCURRENCE_STATUS_INFERRED_FROM_INDIVIDUAL_COUNT;COORDINATE_ROUNDED;GEODETIC_DATUM_ASSUMED_WGS84;INSTITUTION_MATCH_FUZZY;COLLECTION_MATCH_NONE"
49.81,-16.46,"Sabicea diversifolia",912064308,"Province: Toamasina. Mananara Biosphere Reserve. Environs of PK 7.5, 5.8km WSW of Antanambe.","MDG",0.2,1997,"PRESERVED_SPECIMEN","GEODETIC_DATUM_ASSUMED_WGS84;CONTINENT_DERIVED_FROM_COORDINATES;INSTITUTION_MATCH_FUZZY;COLLECTION_MATCH_NONE"
49.459167,-17.706389,"Sabicea diversifolia",4031961834,"Toamasina II – Foulpointe- Morarano - Sahamamy – 1 km Est Sahamamy – Forêt Analalava","MDG",NA,2015,"PRESERVED_SPECIMEN","OCCURRENCE_STATUS_INFERRED_FROM_INDIVIDUAL_COUNT;COORDINATE_ROUNDED;GEODETIC_DATUM_ASSUMED_WGS84;INSTITUTION_MATCH_FUZZY;COLLECTION_MATCH_NONE"
49.85,-15.316667,"Sabicea diversifolia",2517531106,"Maroansetra, Sahavary.","MDG",NA,1988,"PRESERVED_SPECIMEN","INSTITUTION_MATCH_FUZZY;INSTITUTION_COLLECTION_MISMATCH"
47.735278,-23.010833,"Sabicea diversifolia",4031589512,"Région Atsimo-Atsinana, district Farafangana, commune Ankarana, Réserve Spéciale de Manombo, parcelle I, circuit Reharatra. Forêt dense humide de basse altitude sur sol ferralitique. Echantillons préservés en alcool. Récolté avec N. Rakotonirina, R. Razakamalala, J.J. Randrianasolo, Larizé & J. Mbita.","MDG",NA,2005,"PRESERVED_SPECIMEN","OCCURRENCE_STATUS_INFERRED_FROM_INDIVIDUAL_COUNT;COORDINATE_ROUNDED;GEODETIC_DATUM_ASSUMED_WGS84;INSTITUTION_MATCH_FUZZY;COLLECTION_MATCH_NONE"
48.60555,-17.98666,"Sabicea diversifolia",4032053761,"Ambatondrazaka, Commune Didy, Fokontany Antsevabe, forêt de Sahananto, environ 3 km à l'Est de la rivière Sahananto. Forêt dense humide de moyenne altitude. Echantillons préservés en alcool. Récolté avec M. Rasoafaranaivo, N.M. Andrianjafy & V. Raparison.","MDG",NA,2005,"PRESERVED_SPECIMEN","OCCURRENCE_STATUS_INFERRED_FROM_INDIVIDUAL_COUNT;GEODETIC_DATUM_ASSUMED_WGS84;INSTITUTION_MATCH_FUZZY;COLLECTION_MATCH_NONE"
49.42888,-14.92583,"Sabicea diversifolia",4061650772,"Ruisseau d'Andasinanantsomanga Amparihy commune rurale de Matsoandakana.","MDG",NA,2008,"PRESERVED_SPECIMEN","OCCURRENCE_STATUS_INFERRED_FROM_INDIVIDUAL_COUNT;GEODETIC_DATUM_ASSUMED_WGS84;DIFFERENT_OWNER_INSTITUTION"
49.918611,-14.140555,"Sabicea diversifolia",1257957224,"Sambava, Marogaona, Ambodivapaza. Forêt de Farahangitra. Sur crête.","MDG",NA,2013,"PRESERVED_SPECIMEN","OCCURRENCE_STATUS_INFERRED_FROM_INDIVIDUAL_COUNT;COORDINATE_ROUNDED;GEODETIC_DATUM_ASSUMED_WGS84;DIFFERENT_OWNER_INSTITUTION"
48.98472,-17.66277,"Sabicea diversifolia",4062229734,"Préfecture: Vavatenina, Commune: Ambodimangavalo, Fokontany: Manakambahiny I, Ambinanin'Antsahabesahona, 15-20 km au Sud Est du village d'Ambarifotsy, secteur 2. Forêt dense humide de basse altitude. Récolté avec S. Randrianasolo, N.M. Andrianjafy, L.J. Razafitsalama, L.M. Randrianjanaka, A. Belalahy, Randrianjafisoa, R. Mananjara.","MDG",NA,2003,"PRESERVED_SPECIMEN","OCCURRENCE_STATUS_INFERRED_FROM_INDIVIDUAL_COUNT;GEODETIC_DATUM_ASSUMED_WGS84;DIFFERENT_OWNER_INSTITUTION"
47,-22.283333,"Sabicea diversifolia",2243151403,"Fianarantsoa | Ivohibe, Ivongo, Ambahatsy. Réserve Naturelle Intégrale d'Andringitra, [] au sud[-]ouest d'Ambatomboay","MDG",NA,1994,"PRESERVED_SPECIMEN","GEODETIC_DATUM_ASSUMED_WGS84;CONTINENT_DERIVED_FROM_COORDINATES;INSTITUTION_MATCH_FUZZY;COLLECTION_MATCH_FUZZY"
50.319445,-15.291667,"Sabicea diversifolia",1257723007,"Ranovery, Mantazanina, Ambalavy, Antanandavahely, Ambohitralanana, Antalaha.","MDG",NA,2010,"PRESERVED_SPECIMEN","OCCURRENCE_STATUS_INFERRED_FROM_INDIVIDUAL_COUNT;COORDINATE_ROUNDED;GEODETIC_DATUM_ASSUMED_WGS84;DIFFERENT_OWNER_INSTITUTION"
48.146418,-14.114877,"Sabicea diversifolia",4055058405,"","MDG",6,2022,"HUMAN_OBSERVATION","COORDINATE_ROUNDED;CONTINENT_DERIVED_FROM_COORDINATES"
48.3,-14.033333,"Sabicea diversifolia",345131317,"Chemin du Cpmt France au sommet, au-dessous du trou des prospecteurs","MDG",NA,1996,"PRESERVED_SPECIMEN","COORDINATE_ROUNDED;INSTITUTION_MATCH_FUZZY;COLLECTION_MATCH_NONE"
48.428056,-18.800833,"Sabicea diversifolia",4031704122,"District: Moramanga. Commune : Andasibe Perinet. Fokontany: Faliarano. Village le plus proche: Mahatsara.","MDG",NA,2011,"PRESERVED_SPECIMEN","OCCURRENCE_STATUS_INFERRED_FROM_INDIVIDUAL_COUNT;COORDINATE_ROUNDED;GEODETIC_DATUM_ASSUMED_WGS84;INSTITUTION_MATCH_FUZZY;COLLECTION_MATCH_NONE"
50.239354,-15.793333,"Sabicea diversifolia",1233595020,"","MDG",9,2015,"HUMAN_OBSERVATION","COORDINATE_ROUNDED;CONTINENT_DERIVED_FROM_COORDINATES"
49.633333,-14.483333,"Sabicea diversifolia",2517772030,"Antsiranana. Au Nord d'Andapa. Réserve Naturelle Intégrale 12, Marojejy. Au bord de la rivière d'Andranamenabe.","MDG",NA,1994,"PRESERVED_SPECIMEN","INSTITUTION_MATCH_FUZZY;INSTITUTION_COLLECTION_MISMATCH"
48.759167,-14.025556,"Sabicea diversifolia",3946844637,"Ambanja District, Tsaratanana National Park, alongs the Antsahabe River.","MDG",NA,2019,"PRESERVED_SPECIMEN","OCCURRENCE_STATUS_INFERRED_FROM_INDIVIDUAL_COUNT;COORDINATE_ROUNDED;GEODETIC_DATUM_ASSUMED_WGS84;DIFFERENT_OWNER_INSTITUTION"
49.63,-15.723611,"Sabicea diversifolia",4061113759,"Fivondronana: Maroantsetra. Commune: Rantabe. Fokotany: Mafaipoza.","MDG",NA,2002,"PRESERVED_SPECIMEN","OCCURRENCE_STATUS_INFERRED_FROM_INDIVIDUAL_COUNT;COORDINATE_ROUNDED;GEODETIC_DATUM_ASSUMED_WGS84;INSTITUTION_MATCH_NONE"
49.6875,-14.591667,"Sabicea diversifolia",2517569106,"Antsiranana. Réserve Naturelle Intégrale de Marojejy, Antampon Ambaliabe, Andrakala, Andapa.","MDG",NA,1994,"PRESERVED_SPECIMEN","INSTITUTION_MATCH_FUZZY;INSTITUTION_COLLECTION_MISMATCH"
48.84583,-13.86667,"Sabicea diversifolia",1144780778,"Tsaratanana - Tsaratanana RNI. River Andilambe (Limit of RNI)./Faritanin Antsiranana","MDG",1500,2001,"PRESERVED_SPECIMEN","GEODETIC_DATUM_ASSUMED_WGS84;CONTINENT_DERIVED_FROM_COORDINATES;INSTITUTION_MATCH_FUZZY;COLLECTION_MATCH_NONE"
47.524611,-20.554139,"Sabicea diversifolia",1883799810,"Forêt d'Andranomainty à 5 km à l'W du village de Fenomanta","MDG",NA,2012,"PRESERVED_SPECIMEN","COORDINATE_ROUNDED;INSTITUTION_MATCH_FUZZY;COLLECTION_MATCH_FUZZY"
49.000556,-17.6875,"Sabicea diversifolia",1883799552,"à côté de la rivière Ihofika, à l'extérieur du PN","MDG",NA,2001,"PRESERVED_SPECIMEN","COORDINATE_ROUNDED;INSTITUTION_MATCH_FUZZY;COLLECTION_MATCH_NONE"
47.93333,-18.91666,"Sabicea diversifolia",1261218006,"Mandraka. P.K.69, route d'Antananarivo à Toamasina. Forêt Humide.","MDG",NA,1984,"PRESERVED_SPECIMEN","OCCURRENCE_STATUS_INFERRED_FROM_INDIVIDUAL_COUNT;GEODETIC_DATUM_ASSUMED_WGS84;INSTITUTION_MATCH_FUZZY;COLLECTION_MATCH_NONE"
