"lon","lat","species","gbifID","locality","countryCode","coordinateUncertaintyInMeters","year","basisOfRecord","issue"
49.38333,-17.28333,"Sakoanala madagascariensis",1260461130,"Tanambao Tampolo Ampasina Fénérive. Forêt humide. Sol sableux.","MDG",NA,1955,"PRESERVED_SPECIMEN","GEODETIC_DATUM_ASSUMED_WGS84;DIFFERENT_OWNER_INSTITUTION"
49.25166,-18.5625,"Sakoanala madagascariensis",4031685925,"Sous/Pref. Brickaville, Commune Ambinaninony, Fokontany Andranokoditra. Forêt de Vohibola, à 3 km nord-ouest du village d'Andranokoditra, au bord du Canal de Pangalanes. Forêt littorale sur sable. Echantillons préservés en alcool.","MDG",NA,2004,"PRESERVED_SPECIMEN","OCCURRENCE_STATUS_INFERRED_FROM_INDIVIDUAL_COUNT;GEODETIC_DATUM_ASSUMED_WGS84;INSTITUTION_MATCH_FUZZY;COLLECTION_MATCH_NONE"
49.955,-16.831389,"Sakoanala madagascariensis",4031924508,"District: Sainte Marie; Commune Sainte Marie; Fokontany Sahasifotra.","MDG",NA,2017,"PRESERVED_SPECIMEN","OCCURRENCE_STATUS_INFERRED_FROM_INDIVIDUAL_COUNT;COORDINATE_ROUNDED;GEODETIC_DATUM_ASSUMED_WGS84;INSTITUTION_MATCH_FUZZY;COLLECTION_MATCH_NONE"
49.953611,-16.851389,"Sakoanala madagascariensis",4061445676,"Fivondronana: Sainte Marie, Firaisana: Lokintsy, Fokontany: Ambohidena. Forêt d'Ambohidena. Echantillon préservé en alcool. Récolté avec R. Razakamalala, S. Andrianarivelo & Poity","MDG",NA,2003,"PRESERVED_SPECIMEN","OCCURRENCE_STATUS_INFERRED_FROM_INDIVIDUAL_COUNT;COORDINATE_ROUNDED;GEODETIC_DATUM_ASSUMED_WGS84;DIFFERENT_OWNER_INSTITUTION"
49.51666,-17.68333,"Sakoanala madagascariensis",1258971575,"Est : Forêt de Mangalimaso (sur sables), à l'Ouest de Foulpointe.","MDG",NA,1962,"PRESERVED_SPECIMEN","GEODETIC_DATUM_ASSUMED_WGS84;DIFFERENT_OWNER_INSTITUTION"
49.73333,-16.68333,"Sakoanala madagascariensis",1260461141,"Est: Forêts sublittorales, sur sable, au Sud de Manompana","MDG",NA,1964,"PRESERVED_SPECIMEN","GEODETIC_DATUM_ASSUMED_WGS84;ELEVATION_NON_NUMERIC;DIFFERENT_OWNER_INSTITUTION"
49.38333,-17.75,"Sakoanala madagascariensis",438235052,"","MDG",NA,1962,"PRESERVED_SPECIMEN","GEODETIC_DATUM_ASSUMED_WGS84;CONTINENT_DERIVED_FROM_COORDINATES;COLLECTION_MATCH_FUZZY"
