"lon","lat","species","gbifID","locality","countryCode","coordinateUncertaintyInMeters","year","basisOfRecord","issue"
-114.91657,34.03967,"Schismus arabicus",2430206510,"Arica Mountains: east side of mountain range, approximately 1.8 air miles northwest of Priest Well.","USA",NA,2009,"PRESERVED_SPECIMEN","GEODETIC_DATUM_ASSUMED_WGS84;CONTINENT_DERIVED_FROM_COORDINATES;INSTITUTION_MATCH_FUZZY"
-115.078611,33.912222,"Schismus arabicus",2430246809,"North end Palen Mountains, 2 mi west of Palen Pass","USA",NA,1988,"PRESERVED_SPECIMEN","COORDINATE_ROUNDED;GEODETIC_DATUM_ASSUMED_WGS84;CONTINENT_DERIVED_FROM_COORDINATES;INSTITUTION_MATCH_FUZZY"
46.449536,45.557424,"Schismus arabicus",1697390616,"","RUS",NA,1995,"PRESERVED_SPECIMEN","CONTINENT_DERIVED_FROM_COORDINATES;INSTITUTION_MATCH_FUZZY;COLLECTION_MATCH_FUZZY"
71.133994,36.657681,"Schismus arabicus",1697850920,"","AFG",NA,1974,"PRESERVED_SPECIMEN","CONTINENT_DERIVED_FROM_COORDINATES;INSTITUTION_MATCH_FUZZY;COLLECTION_MATCH_FUZZY"
81.144167,44.798889,"Schismus arabicus",1949920010,"","CHN",NA,2017,"PRESERVED_SPECIMEN","COORDINATE_ROUNDED;CONTINENT_DERIVED_FROM_COORDINATES;INSTITUTION_MATCH_FUZZY;COLLECTION_MATCH_FUZZY"
67.246389,37.415139,"Schismus arabicus",1799065889,"","UZB",NA,2013,"PRESERVED_SPECIMEN","COORDINATE_ROUNDED;CONTINENT_DERIVED_FROM_COORDINATES;INSTITUTION_MATCH_FUZZY;COLLECTION_MATCH_FUZZY"
-120.5722,34.9752,"Schismus arabicus",2270282377,"Santa Maria River near Guadalupe","USA",3000,1978,"PRESERVED_SPECIMEN","CONTINENT_DERIVED_FROM_COORDINATES;AMBIGUOUS_INSTITUTION"
-117.075114,34.908679,"Schismus arabicus",2270278783,"Highway 58, three miles northwest of Barstow","USA",800,1977,"PRESERVED_SPECIMEN","CONTINENT_DERIVED_FROM_COORDINATES;AMBIGUOUS_INSTITUTION"
-117.991907,35.646431,"Schismus arabicus",2270280007,"California 178; 6 miles northwest of California 14; roadside pulloff","USA",1000,1979,"PRESERVED_SPECIMEN","CONTINENT_DERIVED_FROM_COORDINATES;AMBIGUOUS_INSTITUTION"
-118.4047,37.461354,"Schismus arabicus",2270279449,"Fish Slough; 1 mile N of jct. of Fish Slough Rd. and Jean Blanc Rd. at barrier separating slough from Owens River canal","USA",1000,1984,"PRESERVED_SPECIMEN","CONTINENT_DERIVED_FROM_COORDINATES;AMBIGUOUS_INSTITUTION"
-115.3955,35.0434,"Schismus arabicus",2270281600,"Hole-in-the-Wall Campground, 0.1 mile west of Black Canyon Road, 9.7 miles from its junction with Mitchell Caverns Road, Providence Mountains","USA",1000,1968,"PRESERVED_SPECIMEN","CONTINENT_DERIVED_FROM_COORDINATES;AMBIGUOUS_INSTITUTION"
-120.99314,36.40755,"Schismus arabicus",4068939654,"Along State Hwy 25 at junction with Coalinga Road E of King City.","USA",NA,2016,"PRESERVED_SPECIMEN","CONTINENT_DERIVED_FROM_COORDINATES;INSTITUTION_MATCH_FUZZY;INSTITUTION_COLLECTION_MISMATCH"
-117.02448,35.03889,"Schismus arabicus",2430164841,"BLMCollecting in Owl Canyon to the east of Rainbow Basin, approximately 10 air miles north of Barstow.; Mud Hills","USA",NA,2013,"PRESERVED_SPECIMEN","CONTINENT_DERIVED_FROM_COORDINATES;INSTITUTION_MATCH_FUZZY"
-117.966951,34.417073,"Schismus arabicus",2430559741,"San Gabriel Mountains: Little Rock creek. Forest Road 4N15.; Juniper Hills","USA",1200,1994,"PRESERVED_SPECIMEN","GEODETIC_DATUM_ASSUMED_WGS84;CONTINENT_DERIVED_FROM_COORDINATES;INSTITUTION_MATCH_FUZZY"
-117.742407,35.312376,"Schismus arabicus",2430149199,"BLMMiddle of Rand Mtns at Junction of R49 and R43 on slopes.","USA",NA,2011,"PRESERVED_SPECIMEN","CONTINENT_DERIVED_FROM_COORDINATES;INSTITUTION_MATCH_FUZZY"
-117.777151,34.215548,"Schismus arabicus",2430470318,"Glendora Ridge Road; N side of ridge at head of un-named E fork of Oak Canyon.; Glendora 7.5","USA",1200,1992,"PRESERVED_SPECIMEN","GEODETIC_DATUM_ASSUMED_WGS84;CONTINENT_DERIVED_FROM_COORDINATES;INSTITUTION_MATCH_FUZZY"
-118.205556,35.538889,"Schismus arabicus",2430479784,"Along dirt road off of Kelso Creek Road, east of Kelso Creek and less than 1 mile south of Bird Springs Pass road junction.","USA",NA,1983,"PRESERVED_SPECIMEN","COORDINATE_ROUNDED;GEODETIC_DATUM_ASSUMED_WGS84;CONTINENT_DERIVED_FROM_COORDINATES;INSTITUTION_MATCH_FUZZY"
-116.3259,34.266,"Schismus arabicus",2430171543,"61241 Reche Rd. Landers.","USA",100,1998,"PRESERVED_SPECIMEN","CONTINENT_DERIVED_FROM_COORDINATES;INSTITUTION_MATCH_FUZZY"
-114.1745,34.2505,"Schismus arabicus",2430197368,"BLM; ca. 5 mi. n. of Earp & 6 mi. n. of Parker' Arizona. Large sand dune w. of Colorado River; sparse Palo verde & creosote bush common in disturbed habitat of motor-cross/ATV area; deep sandy soils with minor gravel along crest of dune.","USA",NA,2003,"PRESERVED_SPECIMEN","GEODETIC_DATUM_ASSUMED_WGS84;CONTINENT_DERIVED_FROM_COORDINATES;INSTITUTION_MATCH_FUZZY"
-116.4849,34.4281,"Schismus arabicus",2610100395,"Eastern edge of the greater Johnson Valley area, 2.5km NE of Mearns Lake, 33km north of the town of Yucca Valley.; Emerson Lake 7.5","USA",NA,2014,"PRESERVED_SPECIMEN","GEODETIC_DATUM_ASSUMED_WGS84;CONTINENT_DERIVED_FROM_COORDINATES;INSTITUTION_MATCH_FUZZY"
-115.40759,34.68449,"Schismus arabicus",2430136308,"BLMClipper Mountains, south side, just west of Bonanza Spring; road NS 206 ca. 3 miles northwest of Highway 66. South of Interstate 40, northwest of Danby, west-southwest of Essex.; Castle Dome 7.5'","USA",NA,2016,"PRESERVED_SPECIMEN","CONTINENT_DERIVED_FROM_COORDINATES;INSTITUTION_MATCH_FUZZY"
-116.48335,34.22073,"Schismus arabicus",2430139265,"BLMCollecting in the valley between Black Lava Butte and Flat Top Mesa at the southeastern end of the Bighorn Mountains.; Yucca Valley North","USA",NA,2015,"PRESERVED_SPECIMEN","GEODETIC_DATUM_ASSUMED_WGS84;CONTINENT_DERIVED_FROM_COORDINATES;INSTITUTION_MATCH_FUZZY"
-118.201573,36.805941,"Schismus arabicus",2430165155,"Owens Valley. : Independence","USA",2000,1970,"PRESERVED_SPECIMEN","CONTINENT_DERIVED_FROM_COORDINATES;INSTITUTION_MATCH_FUZZY"
-116.203547,35.848799,"Schismus arabicus",2430268868,"Tecopa Heights, east of the Spanish Trail Highway. Parcel number 46-401-03.","USA",1880,1992,"PRESERVED_SPECIMEN","CONTINENT_DERIVED_FROM_COORDINATES;INSTITUTION_MATCH_FUZZY"
-119.0998,34.9988,"Schismus arabicus",2430035778,"PrivateWindwolves Wildlife Refuge; foothills of the San Emigdio Mountains, about 4.3 air miles SSE of the intersection of Hwy 166 and Balderama Street.; Pleito Hills","USA",NA,2011,"PRESERVED_SPECIMEN","GEODETIC_DATUM_ASSUMED_WGS84;CONTINENT_DERIVED_FROM_COORDINATES;INSTITUTION_MATCH_FUZZY"
-116.35591,36.24125,"Schismus arabicus",2430211964,"BLMEagle Mountain: south edge of playa on north side. South-southeast of Death Valley Junction, east of Highway 127 and powerline. Amargosa River drainage.; Eagle Mountain 7.5' Quad.","USA",NA,2016,"PRESERVED_SPECIMEN","CONTINENT_DERIVED_FROM_COORDINATES;INSTITUTION_MATCH_FUZZY"
-115.45177,34.11923,"Schismus arabicus",2430154693,"The Calumet Mountains; southern section of this range in the Sheephole Valley Wilderness. Approximately 6.75 air miles northeast of Clarks Pass.; Cadiz Valley SW","USA",NA,2012,"PRESERVED_SPECIMEN","GEODETIC_DATUM_ASSUMED_WGS84;CONTINENT_DERIVED_FROM_COORDINATES;INSTITUTION_MATCH_FUZZY"
-118.385941,34.72373,"Schismus arabicus",2430110758,"Mojave Desert, w. of Fairmont along Lancaster Rd.","USA",3200,1979,"PRESERVED_SPECIMEN","CONTINENT_DERIVED_FROM_COORDINATES;INSTITUTION_MATCH_FUZZY"
-107.136094,32.146978,"Schismus arabicus",3892339304,"","USA",5,2018,"HUMAN_OBSERVATION","COORDINATE_ROUNDED;CONTINENT_DERIVED_FROM_COORDINATES"
-106.1557,31.49873,"Schismus arabicus",3969716163,"Fabens, yard of 123 Southeast Fifth Street. 31.49873 -106.1557.","USA",NA,2012,"PRESERVED_SPECIMEN","GEODETIC_DATUM_ASSUMED_WGS84;CONTINENT_DERIVED_FROM_COORDINATES;INSTITUTION_MATCH_FUZZY;COLLECTION_MATCH_NONE"
55.933334,37.833332,"Schismus arabicus",2981256374,"IRAN: Gorgan Prov., 6 km S. pag. Moraveh-taphe. 37°50' N, 55°56' E. Alt. c. 320 m.","IRN",NA,1990,"PRESERVED_SPECIMEN","COORDINATE_ROUNDED;CONTINENT_DERIVED_FROM_COORDINATES;COLLECTION_MATCH_NONE"
-118.918222,35.199,"Schismus arabicus",3320792106,"Local landmark: Wheeler Ridge Road. Weed Patch Quad.","USA",NA,1986,"PRESERVED_SPECIMEN","GEODETIC_DATUM_ASSUMED_WGS84;CONTINENT_DERIVED_FROM_COORDINATES;INSTITUTION_MATCH_FUZZY"
-119.65775,35.616889,"Schismus arabicus",3320792134,"Local landmark: Hwy 46. Lost Hills Quad.","USA",NA,1986,"PRESERVED_SPECIMEN","GEODETIC_DATUM_ASSUMED_WGS84;CONTINENT_DERIVED_FROM_COORDINATES;INSTITUTION_MATCH_FUZZY"
-119.288333,35.267417,"Schismus arabicus",3320799748,"Local landmark: Taft Highway. Tupman Quad.","USA",NA,1986,"PRESERVED_SPECIMEN","GEODETIC_DATUM_ASSUMED_WGS84;CONTINENT_DERIVED_FROM_COORDINATES;INSTITUTION_MATCH_FUZZY"
-116.47639,34.78861,"Schismus arabicus",2422407419,"Pisgah lava beds just south of old Route 66 and I-40, west of Ludlow and 7.8 mi east of Fort Cady Road","USA",NA,2004,"PRESERVED_SPECIMEN","GEODETIC_DATUM_ASSUMED_WGS84;CONTINENT_DERIVED_FROM_COORDINATES;AMBIGUOUS_INSTITUTION"
-116.12333,36.53528,"Schismus arabicus",2422417328,"Along NV Hwy 160, 2 miles south of the junction with US Hwy 95","USA",NA,1993,"PRESERVED_SPECIMEN","GEODETIC_DATUM_ASSUMED_WGS84;CONTINENT_DERIVED_FROM_COORDINATES;AMBIGUOUS_INSTITUTION"
-115.49347,35.57419,"Schismus arabicus",2422462763,"Ivanpah Valley, limestone hill emerging from alluvium below Clark Mountain, 6.5 km NW (291°) of Primm Valley Golf Club, 8 km W of I-15","USA",NA,2010,"PRESERVED_SPECIMEN","GEODETIC_DATUM_ASSUMED_WGS84;CONTINENT_DERIVED_FROM_COORDINATES;AMBIGUOUS_INSTITUTION"
-115.32361,33.34361,"Schismus arabicus",2422509379,"Chocolate Mountains, c. 0.8 km NE of Beal Well and c. 0-0.4 km east of old Niland-Blythe Rd.","USA",NA,2016,"PRESERVED_SPECIMEN","GEODETIC_DATUM_ASSUMED_WGS84;CONTINENT_DERIVED_FROM_COORDINATES;AMBIGUOUS_INSTITUTION"
-115.57667,33.54944,"Schismus arabicus",3051828305,"northern edge of Chocolate Mtns. Aerial Gunnery Range, Salt Creek Wash watershed, 1.85 km SE of intersection of Bradshaw Trail and Summit Rd.","USA",NA,2020,"PRESERVED_SPECIMEN","GEODETIC_DATUM_ASSUMED_WGS84;CONTINENT_DERIVED_FROM_COORDINATES;AMBIGUOUS_INSTITUTION"
-114.90778,33.73361,"Schismus arabicus",2422348984,"McCoy Mountains, within 0.5 mile of McCoy Spring","USA",NA,1992,"PRESERVED_SPECIMEN","GEODETIC_DATUM_ASSUMED_WGS84;CONTINENT_DERIVED_FROM_COORDINATES;AMBIGUOUS_INSTITUTION"
-117.5525,35.03194,"Schismus arabicus",2422344938,"2-5 miles north of Kramer Junction","USA",NA,1959,"PRESERVED_SPECIMEN","GEODETIC_DATUM_ASSUMED_WGS84;CONTINENT_DERIVED_FROM_COORDINATES;AMBIGUOUS_INSTITUTION"
-116.29167,34.66667,"Schismus arabicus",2422352390,"Twentynine Palms Marine Corps Base, Lavic Lake Artillery Range, west of Bullion Mts., and c. 3 km (air) east of Lavic Dry Lake; c. 7 km (air) SSE of Lavic","USA",NA,1991,"PRESERVED_SPECIMEN","GEODETIC_DATUM_ASSUMED_WGS84;CONTINENT_DERIVED_FROM_COORDINATES;AMBIGUOUS_INSTITUTION"
-116.93333,34.34167,"Schismus arabicus",2422348288,"Upper Furnace Canyon on the N slope of the mtns above Lucerne Valley, W edge of a large limestone mining pit","USA",NA,1994,"PRESERVED_SPECIMEN","GEODETIC_DATUM_ASSUMED_WGS84;CONTINENT_DERIVED_FROM_COORDINATES;AMBIGUOUS_INSTITUTION"
-115.53333,34.1,"Schismus arabicus",2422348735,"N of Joshua Tree National Monument, south of Hwy 62, c. 30 miles east of Twentynine Palms; northeast of Clarks Pass","USA",NA,1986,"PRESERVED_SPECIMEN","GEODETIC_DATUM_ASSUMED_WGS84;CONTINENT_DERIVED_FROM_COORDINATES;AMBIGUOUS_INSTITUTION"
-117.29389,34.22167,"Schismus arabicus",2422411576,"Upper Waterman Canyon","USA",NA,2005,"PRESERVED_SPECIMEN","GEODETIC_DATUM_ASSUMED_WGS84;CONTINENT_DERIVED_FROM_COORDINATES;AMBIGUOUS_INSTITUTION"
-116.89139,35.25972,"Schismus arabicus",2422516597,"Fort Irwin National Training Center, Goldstone Complex","USA",NA,2016,"PRESERVED_SPECIMEN","GEODETIC_DATUM_ASSUMED_WGS84;CONTINENT_DERIVED_FROM_COORDINATES;AMBIGUOUS_INSTITUTION"
-114.4075,36.60361,"Schismus arabicus",2422441068,"Mormon Mesa, south of I-15, c. 5 mi. (air) east of Logandale, c. 5 mi. NE of Overton, c. 1.7 mi. north of Mormon Mesa Rd. on dirt road toward Halfway Wash","USA",NA,2008,"PRESERVED_SPECIMEN","GEODETIC_DATUM_ASSUMED_WGS84;CONTINENT_DERIVED_FROM_COORDINATES;AMBIGUOUS_INSTITUTION"
-115.66083,33.36611,"Schismus arabicus",2422458783,"east side of the Salton Sea, Luento Wash at Hwy 111, north of Frink, between hwy and RR tracks","USA",NA,2010,"PRESERVED_SPECIMEN","GEODETIC_DATUM_ASSUMED_WGS84;CONTINENT_DERIVED_FROM_COORDINATES;AMBIGUOUS_INSTITUTION"
-115.73313,34.8841,"Schismus arabicus",2422488416,"Mojave National Preserve; south end of Kelso Dunes 0.4 mi. north of powerline road, 5.1 mi. west of Kelbaker Rd; Kelso Dunes","USA",NA,2012,"PRESERVED_SPECIMEN","GEODETIC_DATUM_ASSUMED_WGS84;CONTINENT_DERIVED_FROM_COORDINATES;AMBIGUOUS_INSTITUTION"
-116.315,33.84306,"Schismus arabicus",2422535357,"Coachella Valley, Thousand Palms Oasis, west of the mgmt. office","USA",NA,2019,"PRESERVED_SPECIMEN","GEODETIC_DATUM_ASSUMED_WGS84;CONTINENT_DERIVED_FROM_COORDINATES;AMBIGUOUS_INSTITUTION"
-115.50444,33.29889,"Schismus arabicus",2422423331,"Salton Basin, transect along the road on the immediate NE side of the Coachella Canal right-of-way, between siphons 10 and 11, c. 4.5 miles N of Niland","USA",NA,2005,"PRESERVED_SPECIMEN","GEODETIC_DATUM_ASSUMED_WGS84;CONTINENT_DERIVED_FROM_COORDINATES;AMBIGUOUS_INSTITUTION"
-117.375,35.61667,"Schismus arabicus",2422348628,"The Pinnacles, south end of Searles Lake","USA",NA,1987,"PRESERVED_SPECIMEN","GEODETIC_DATUM_ASSUMED_WGS84;CONTINENT_DERIVED_FROM_COORDINATES;AMBIGUOUS_INSTITUTION"
-110.88778,32.13417,"Schismus arabicus",2422453664,"Tucson, I-10 at Valencia Rd, southeast edge of town","USA",NA,1995,"PRESERVED_SPECIMEN","GEODETIC_DATUM_ASSUMED_WGS84;CONTINENT_DERIVED_FROM_COORDINATES;AMBIGUOUS_INSTITUTION"
-114.95508,33.12362,"Schismus arabicus",2422522380,"upper Ninemile Wash, near old well (windmill) and trough, Chocolate Mountains","USA",NA,2017,"PRESERVED_SPECIMEN","GEODETIC_DATUM_ASSUMED_WGS84;CONTINENT_DERIVED_FROM_COORDINATES;AMBIGUOUS_INSTITUTION"
-115.32292,33.23425,"Schismus arabicus",2422516477,"Chocolate Mountains, Niland to Pegleg Well Rd., 18.25 km east (92°) of Niland","USA",NA,2017,"PRESERVED_SPECIMEN","GEODETIC_DATUM_ASSUMED_WGS84;CONTINENT_DERIVED_FROM_COORDINATES;AMBIGUOUS_INSTITUTION"
-115.75333,35.21389,"Schismus arabicus",2422464046,"Cima Cinder Cones, Mojave National Preserve, along Lava Tube Trail, c. 4.2 miles north of Kelbaker Road, c. 3 miles southwest of Aiken Mine","USA",NA,2010,"PRESERVED_SPECIMEN","GEODETIC_DATUM_ASSUMED_WGS84;CONTINENT_DERIVED_FROM_COORDINATES;AMBIGUOUS_INSTITUTION"
-115.471,33.43915,"Schismus arabicus",2422522963,"Chocolate Mtns. Aerial Gunnery Range, Gas Line Rd. 0.86 mile north of the Imperial Co. line","USA",NA,2018,"PRESERVED_SPECIMEN","GEODETIC_DATUM_ASSUMED_WGS84;CONTINENT_DERIVED_FROM_COORDINATES;AMBIGUOUS_INSTITUTION"
-115.23797,33.1351,"Schismus arabicus",3051836303,"west side of Chocolate Mountains, slope above and 2.4 km NE (38°) of Amos, FARP (forward arming & refueling point) Star","USA",NA,2020,"PRESERVED_SPECIMEN","GEODETIC_DATUM_ASSUMED_WGS84;CONTINENT_DERIVED_FROM_COORDINATES;AMBIGUOUS_INSTITUTION"
-117.4602173,33.5664856,"Schismus arabicus",2430439594,"Southern Santa Ana Mountains, San Mateo Canyon Wilderness area. Verdugo Potero, near the Verdugo Trailhead.","USA",1000,1992,"PRESERVED_SPECIMEN","COORDINATE_REPROJECTED;CONTINENT_DERIVED_FROM_COORDINATES;INSTITUTION_MATCH_FUZZY"
-118.23028,34.43222,"Schismus arabicus",2610078086,"San Gabriel Mountains. Near town of Ravenna, 0.3 miles e. of Stonecross, c. 0.7 miles s. of Soledad Cyn. Road, c. 0.5 miles east of Mill Cyn., unnamed n.-s. oriented cyn. between Bootleggers Cyn. and Mill Cyn.; Acton","USA",NA,2014,"PRESERVED_SPECIMEN","GEODETIC_DATUM_ASSUMED_WGS84;CONTINENT_DERIVED_FROM_COORDINATES;INSTITUTION_MATCH_FUZZY"
-116.5644,34.2332,"Schismus arabicus",2430043360,"Bighorn BLM Wilderness, SE parcel near Pioneertown.","USA",NA,2013,"PRESERVED_SPECIMEN","CONTINENT_DERIVED_FROM_COORDINATES;INSTITUTION_MATCH_FUZZY"
-117.83046,35.05633,"Schismus arabicus",2430521333,"1.5 miles W on dirt rd to fossil diggings off Claymore Rd. Boron Dry Lake region. 17 mi E of Mojave, Mojave Desert.","USA",3395,1973,"PRESERVED_SPECIMEN","CONTINENT_DERIVED_FROM_COORDINATES;INSTITUTION_MATCH_FUZZY"
-117.62058,35.72171,"Schismus arabicus",2430108794,"Indian Wells Valley: China Lake","USA",2735,1975,"PRESERVED_SPECIMEN","CONTINENT_DERIVED_FROM_COORDINATES;INSTITUTION_MATCH_FUZZY"
-116.68452,34.26772,"Schismus arabicus",2430147642,"Bighorn Mountains; boulder pile area on the northeastern flanks of TipTop Mountain, approximately 0.7 air mile southwest of Viscera Spring.; Rattlesnake Canyon","USA",NA,2014,"PRESERVED_SPECIMEN","GEODETIC_DATUM_ASSUMED_WGS84;CONTINENT_DERIVED_FROM_COORDINATES;INSTITUTION_MATCH_FUZZY"
-117.846667,34.319444,"Schismus arabicus",2430085067,"Vicinity of Crystal Lake; Crystal Lake 7.5","USA",NA,1990,"PRESERVED_SPECIMEN","COORDINATE_ROUNDED;GEODETIC_DATUM_ASSUMED_WGS84;CONTINENT_DERIVED_FROM_COORDINATES;INSTITUTION_MATCH_FUZZY"
-120.453373,36.216387,"Schismus arabicus",2430095420,"Los Gatos Creek road, 11 mi NW of Coalinge, Small creek bending to north, Sandstone cliff on north side of road 120-200 ft","USA",1200,1957,"PRESERVED_SPECIMEN","GEODETIC_DATUM_ASSUMED_WGS84;CONTINENT_DERIVED_FROM_COORDINATES;INSTITUTION_MATCH_FUZZY"
-115.673333,35.758611,"Schismus arabicus",2430386138,"Two Hawk Ranch near edge of center pivot irrigated alfalfa field, Palm St. east of Two Hawk Ranch Rd., 4.65 mi SW of Sandy Valley, NV.; 7.5 West of Shenandoah Peak","USA",NA,2012,"PRESERVED_SPECIMEN","COORDINATE_ROUNDED;GEODETIC_DATUM_ASSUMED_WGS84;CONTINENT_DERIVED_FROM_COORDINATES;INSTITUTION_MATCH_FUZZY"
-108.70869,32.382375,"Schismus arabicus",3413523802,"2 road miles N of Lordsburg at junction of Highways 90 and 70","USA",141,1997,"PRESERVED_SPECIMEN","CONTINENT_DERIVED_FROM_COORDINATES;INSTITUTION_MATCH_FUZZY;COLLECTION_MATCH_FUZZY"
-109.075833,32.443,"Schismus arabicus",1889160915,"5 miles SW of summit","USA",NA,2005,"PRESERVED_SPECIMEN","COORDINATE_ROUNDED;GEODETIC_DATUM_ASSUMED_WGS84;GEODETIC_DATUM_INVALID;CONTINENT_DERIVED_FROM_COORDINATES;INSTITUTION_MATCH_FUZZY;COLLECTION_MATCH_FUZZY"
-115.68528,35.12278,"Schismus arabicus",2565962479,"25.6 (rd) miles S of Baker on Kelbaker Road, 8.2 miles N of Kelso towards Baker","USA",NA,1978,"PRESERVED_SPECIMEN","GEODETIC_DATUM_ASSUMED_WGS84;CONTINENT_DERIVED_FROM_COORDINATES;INSTITUTION_MATCH_FUZZY"
-115.6086,34.93397,"Schismus arabicus",2565960116,"ca 35 (air) miles SE of Baker, 4 miles SE of Vulcan Mine Rd, off Kelbaker Rd, 6 (air) miles SSE of Kelso.","USA",1000,1973,"PRESERVED_SPECIMEN","CONTINENT_DERIVED_FROM_COORDINATES;INSTITUTION_MATCH_FUZZY"
36.91694,31.96861,"Schismus arabicus",1848994812,"Jordanien, gouvernement Zarqa, ca. 10 km ne Azraq","JOR",NA,1998,"PRESERVED_SPECIMEN","CONTINENT_DERIVED_FROM_COORDINATES;INSTITUTION_MATCH_FUZZY;COLLECTION_MATCH_NONE"
-114.700556,32.459444,"Schismus arabicus",1893592960,"5.4 km east of San Luis Rio Colorado on Mex. 2.","MEX",80,1997,"PRESERVED_SPECIMEN","TYPE_STATUS_INVALID;OCCURRENCE_STATUS_INFERRED_FROM_INDIVIDUAL_COUNT;COORDINATE_ROUNDED;GEODETIC_DATUM_ASSUMED_WGS84;CONTINENT_DERIVED_FROM_COORDINATES;INSTITUTION_MATCH_NONE"
-113.64,36.9539,"Schismus arabicus",2270573323,"Flat southeast of Black Knolls","USA",700,1978,"PRESERVED_SPECIMEN","GEODETIC_DATUM_ASSUMED_WGS84;CONTINENT_DERIVED_FROM_COORDINATES;INSTITUTION_MATCH_FUZZY;INSTITUTION_COLLECTION_MISMATCH"
-119.757265,35.190412,"Schismus arabicus",2270498371,"30 miles SE of California Rte 58 along Soda Lake Road","USA",5000,1978,"PRESERVED_SPECIMEN","CONTINENT_DERIVED_FROM_COORDINATES;INSTITUTION_MATCH_FUZZY;INSTITUTION_COLLECTION_MISMATCH"
-113.58333,33.677925,"Schismus arabicus",2270501558,"Sonoran Desert, Little Harquahala Mountains ca 5 miles N of Interstate 10, 1.2 miles N of Martin Peak, ca 38 miles WNW of Tonopah. T4N R13W S22 SW4 NW4 NE4","USA",NA,2015,"PRESERVED_SPECIMEN","GEODETIC_DATUM_ASSUMED_WGS84;CONTINENT_DERIVED_FROM_COORDINATES;INSTITUTION_MATCH_FUZZY;INSTITUTION_COLLECTION_MISMATCH"
-112.5155033,33.8193103,"Schismus arabicus",2270671602,"","USA",NA,2005,"PRESERVED_SPECIMEN","COORDINATE_REPROJECTED;CONTINENT_DERIVED_FROM_COORDINATES;INSTITUTION_MATCH_FUZZY;INSTITUTION_COLLECTION_MISMATCH"
-113.702,34.0079,"Schismus arabicus",2270575230,"Along powerline road near Cunningham Wash.","USA",700,1980,"PRESERVED_SPECIMEN","GEODETIC_DATUM_ASSUMED_WGS84;CONTINENT_DERIVED_FROM_COORDINATES;INSTITUTION_MATCH_FUZZY;INSTITUTION_COLLECTION_MISMATCH"
-112.318926,32.850101,"Schismus arabicus",2270575329,"Sonoran Desert: south end of Maricopa Mountains N of Interstate 8 ca 1.5 miles N of Lost Horse Peak, ca 4.5 miles E of Big Horn, ca 25 miles ESE of Gila Bend.","USA",20,2013,"PRESERVED_SPECIMEN","GEODETIC_DATUM_ASSUMED_WGS84;CONTINENT_DERIVED_FROM_COORDINATES;INSTITUTION_MATCH_FUZZY;INSTITUTION_COLLECTION_MISMATCH"
-113.371807,33.459352,"Schismus arabicus",2270574543,"large sandy wash, road to Indian Springs, Eagletail Mountains,Az","USA",NA,2008,"PRESERVED_SPECIMEN","GEODETIC_DATUM_ASSUMED_WGS84;CONTINENT_DERIVED_FROM_COORDINATES;INSTITUTION_MATCH_FUZZY;INSTITUTION_COLLECTION_MISMATCH"
-113.26513,31.72169,"Schismus arabicus",2884946524,"Sand dunes just east of Pinacate volcanic range.","MEX",NA,2019,"PRESERVED_SPECIMEN","GEODETIC_DATUM_ASSUMED_WGS84;CONTINENT_DERIVED_FROM_COORDINATES;INSTITUTION_MATCH_FUZZY;INSTITUTION_COLLECTION_MISMATCH"
-109.623183,32.021883,"Schismus arabicus",2884947453,"Pat Hills, ca. 30 km (by air) SE of Willcox., Sulphur Springs Valley.","USA",NA,2015,"PRESERVED_SPECIMEN","GEODETIC_DATUM_ASSUMED_WGS84;CONTINENT_DERIVED_FROM_COORDINATES;INSTITUTION_MATCH_FUZZY;INSTITUTION_COLLECTION_MISMATCH"
-113.408,34.2814,"Schismus arabicus",2270575434,"Grapevine Springs, on south side of Santa Maria River.","USA",700,1979,"PRESERVED_SPECIMEN","GEODETIC_DATUM_ASSUMED_WGS84;CONTINENT_DERIVED_FROM_COORDINATES;INSTITUTION_MATCH_FUZZY;INSTITUTION_COLLECTION_MISMATCH"
-111.7564836,33.6573194,"Schismus arabicus",2270671554,"","USA",NA,2005,"PRESERVED_SPECIMEN","COORDINATE_REPROJECTED;CONTINENT_DERIVED_FROM_COORDINATES;INSTITUTION_MATCH_FUZZY;INSTITUTION_COLLECTION_MISMATCH"
-113.27,33.8621,"Schismus arabicus",2270576060,"N side of harquahala Mountains Dushey Canyon","USA",700,1980,"PRESERVED_SPECIMEN","GEODETIC_DATUM_ASSUMED_WGS84;CONTINENT_DERIVED_FROM_COORDINATES;INSTITUTION_MATCH_FUZZY;INSTITUTION_COLLECTION_MISMATCH"
-112.773,33.2262,"Schismus arabicus",2270682421,"S side of Old Highway 80 on the West Bank of the Gila River at the Gillespie Dam Crossing","USA",NA,2005,"PRESERVED_SPECIMEN","GEODETIC_DATUM_ASSUMED_WGS84;CONTINENT_DERIVED_FROM_COORDINATES;INSTITUTION_MATCH_FUZZY;INSTITUTION_COLLECTION_MISMATCH"
-113.094,33.6912,"Schismus arabicus",2270690276,"Plant specimen germinated in the ASU greenhouse, in soil collected from Hummingbird Springs Wilderness, near radio tower 10 miles south of Eagle Eye Road on 3/4/06.","USA",NA,2006,"PRESERVED_SPECIMEN","GEODETIC_DATUM_ASSUMED_WGS84;CONTINENT_DERIVED_FROM_COORDINATES;INSTITUTION_MATCH_FUZZY;INSTITUTION_COLLECTION_MISMATCH"
-114.13525,33.97134,"Schismus arabicus",2884951534,"Bouse Dunes, Cactus Plain; 1.55 miles south of Hwy 72","USA",NA,2019,"PRESERVED_SPECIMEN","GEODETIC_DATUM_ASSUMED_WGS84;CONTINENT_DERIVED_FROM_COORDINATES;INSTITUTION_MATCH_FUZZY;INSTITUTION_COLLECTION_MISMATCH"
-114.502489,36.630343,"Schismus arabicus",1929966768,"Moapa Valley, Rte. 169, 1/2 mile north of canal/waterway crossing under road","USA",NA,1984,"PRESERVED_SPECIMEN","COLLECTION_MATCH_FUZZY"
121.67,-32.05,"Schismus arabicus",2830224296,"14 miles [22.4 km] N of Norseman on Coolgardie road.","AUS",1000,1965,"PRESERVED_SPECIMEN","CONTINENT_DERIVED_FROM_COORDINATES;INSTITUTION_MATCH_FUZZY;COLLECTION_MATCH_FUZZY"
75.993289,42.294135,"Schismus arabicus",1798977640,"","KGZ",NA,1958,"PRESERVED_SPECIMEN","CONTINENT_DERIVED_FROM_COORDINATES;INSTITUTION_MATCH_FUZZY;COLLECTION_MATCH_FUZZY"
-120.6222,35.4392,"Schismus arabicus",3059663544,"Atascadero, 9469 Random Oaks Dr.","USA",NA,2010,"PRESERVED_SPECIMEN","GEODETIC_DATUM_ASSUMED_WGS84;CONTINENT_DERIVED_FROM_COORDINATES;INSTITUTION_MATCH_FUZZY"
-120.294033,36.194896,"Schismus arabicus",3059665480,"Anticline Ridge, 4 miles northeast of Coalinga, west of SR 33/198.","USA",NA,1973,"PRESERVED_SPECIMEN","GEODETIC_DATUM_ASSUMED_WGS84;CONTINENT_DERIVED_FROM_COORDINATES;INSTITUTION_MATCH_FUZZY"
-115.370037,33.736457,"Schismus arabicus",3059679611,"2 miles northeast of Desert Center.","USA",969,1984,"PRESERVED_SPECIMEN","GEODETIC_DATUM_ASSUMED_WGS84;CONTINENT_DERIVED_FROM_COORDINATES;INSTITUTION_MATCH_FUZZY"
-119.44185,35.676133,"Schismus arabicus",2858981908,"San Joaquin Valley, 6-8 mi NW of Wasco","USA",NA,1975,"PRESERVED_SPECIMEN","CONTINENT_DERIVED_FROM_COORDINATES;INSTITUTION_MATCH_FUZZY;INSTITUTION_COLLECTION_MISMATCH"
-114.559867,34.1714,"Schismus arabicus",2430387449,"BLMWhipple Mountains: Wash and desert pavement along Highway 95 between Vidal and Vidal Junction.","USA",NA,2003,"PRESERVED_SPECIMEN","COORDINATE_ROUNDED;GEODETIC_DATUM_ASSUMED_WGS84;CONTINENT_DERIVED_FROM_COORDINATES;INSTITUTION_MATCH_FUZZY"
-118.89553,34.52222,"Schismus arabicus",2430272275,"Los Padres National ForestEast of Topatopa Mountains: Sespe Wildlife Area. (Condor Sanctuary) Dough Flat, end of road (Goodenough road) from the town of Fillmore.; Devils Heart Peak 7.5 Quad.Beyond Dough Flat the road has been reverted to a hiking trail. General collecting from Dough Flat near 34.52222N, 118.89553W, to a water fall, near 34.52551N, 118.89078W. Which is up a drainage northeast of the Flats. Spring water was running down the falls, with yellow Mimulus guttatus seen ringing the falls from the Flats.","USA",NA,2007,"PRESERVED_SPECIMEN","GEODETIC_DATUM_ASSUMED_WGS84;CONTINENT_DERIVED_FROM_COORDINATES;INSTITUTION_MATCH_FUZZY"
