"lon","lat","species","gbifID","locality","countryCode","coordinateUncertaintyInMeters","year","basisOfRecord","issue"
-112.558311,33.48339,"Schismus arabicus",1846483087,"Skyline Regional Park, on Mountain Wash Trail.","USA",NA,2016,"PRESERVED_SPECIMEN","CONTINENT_DERIVED_FROM_COORDINATES;INSTITUTION_MATCH_FUZZY;COLLECTION_MATCH_NONE"
-112.505581,33.568787,"Schismus arabicus",1846483158,"White Tank Mountain Regional Park, Goat Camp Trail east of junction with Bajada Trail.","USA",NA,2016,"PRESERVED_SPECIMEN","CONTINENT_DERIVED_FROM_COORDINATES;INSTITUTION_MATCH_FUZZY;COLLECTION_MATCH_NONE"
-111.115,32.5405,"Schismus arabicus",1846556977,"Tortolita Mountains, BLM land NW","USA",40,2014,"PRESERVED_SPECIMEN","CONTINENT_DERIVED_FROM_COORDINATES;INSTITUTION_MATCH_FUZZY;COLLECTION_MATCH_NONE"
-111.25065,33.307833,"Schismus arabicus",2572938016,"Tonto National Forest, ca. 3-5 km east of Queen Valley; north of Hwy 357 and west of Hewitt Canyon Rd.","USA",NA,2019,"PRESERVED_SPECIMEN","GEODETIC_DATUM_ASSUMED_WGS84;CONTINENT_DERIVED_FROM_COORDINATES;INSTITUTION_MATCH_FUZZY;COLLECTION_MATCH_NONE"
-111.720833,33.979917,"Schismus arabicus",1846499850,"Tonto National Forest just to the north of FSR 1530 and Horseshoe Dam before the gate.","USA",NA,2005,"PRESERVED_SPECIMEN","GEODETIC_DATUM_ASSUMED_WGS84;CONTINENT_DERIVED_FROM_COORDINATES;INSTITUTION_MATCH_FUZZY;COLLECTION_MATCH_NONE"
-112.142017,34.08775,"Schismus arabicus",1846495300,"Agua Fria National Monument, Southwest-most corner of the monument.","USA",NA,2005,"PRESERVED_SPECIMEN","GEODETIC_DATUM_ASSUMED_WGS84;CONTINENT_DERIVED_FROM_COORDINATES;INSTITUTION_MATCH_FUZZY;COLLECTION_MATCH_NONE"
-112.8593,33.3568,"Schismus arabicus",1846545800,"Vicinity of Palo Verde Nuclear Generating Station.","USA",969,1992,"PRESERVED_SPECIMEN","CONTINENT_DERIVED_FROM_COORDINATES;INSTITUTION_MATCH_FUZZY;COLLECTION_MATCH_NONE"
-111.662957,32.715278,"Schismus arabicus",1846558009,"Santa Cruz Flats near Eloy.","USA",786,1977,"PRESERVED_SPECIMEN","GEODETIC_DATUM_ASSUMED_WGS84;CONTINENT_DERIVED_FROM_COORDINATES;INSTITUTION_MATCH_FUZZY;COLLECTION_MATCH_NONE"
-113.807,32.6717,"Schismus arabicus",1846545511,"North end of Mohawk Vallely Dunes.","USA",969,1984,"PRESERVED_SPECIMEN","CONTINENT_DERIVED_FROM_COORDINATES;INSTITUTION_MATCH_FUZZY;COLLECTION_MATCH_NONE"
-115.199,33.7158,"Schismus arabicus",1846541286,"Sonoran (Colorado) Desert; Chuckwalla Valley, 1.5 mi. SE of Sidewinder Well, south end of Palen Dry Lake, SW of Palen Mtns. (Sidewinder Well 7.5' Q)","USA",1000,2010,"PRESERVED_SPECIMEN","GEODETIC_DATUM_ASSUMED_WGS84;CONTINENT_DERIVED_FROM_COORDINATES;INSTITUTION_MATCH_FUZZY;COLLECTION_MATCH_NONE"
-114.1892,34.1078,"Schismus arabicus",1846545805,"Cactus plain, Black Peak vicinity, near utility corridor.","USA",969,1990,"PRESERVED_SPECIMEN","CONTINENT_DERIVED_FROM_COORDINATES;INSTITUTION_MATCH_FUZZY;COLLECTION_MATCH_NONE"
-111.195763,32.143962,"Schismus arabicus",1846558062,"Avra Valley.","USA",639,1977,"PRESERVED_SPECIMEN","GEODETIC_DATUM_ASSUMED_WGS84;CONTINENT_DERIVED_FROM_COORDINATES;INSTITUTION_MATCH_FUZZY;COLLECTION_MATCH_NONE"
-111.70398,34.07901,"Schismus arabicus",2861422322,"Tonto National Forest, Hillside just north of Sycamore Creek.","USA",NA,2019,"PRESERVED_SPECIMEN","CONTINENT_DERIVED_FROM_COORDINATES;INSTITUTION_MATCH_FUZZY;COLLECTION_MATCH_NONE"
-110.88325,32.872267,"Schismus arabicus",1846499017,"Freeman Road Trail, just east of trail.","USA",NA,2003,"PRESERVED_SPECIMEN","GEODETIC_DATUM_ASSUMED_WGS84;CONTINENT_DERIVED_FROM_COORDINATES;INSTITUTION_MATCH_FUZZY;COLLECTION_MATCH_NONE"
-112.905133,33.2442,"Schismus arabicus",1846485900,"Gila Bend Mountains, along Hider Road, north of Jagow Tank, northeast of Webb Mountain.","USA",NA,2005,"PRESERVED_SPECIMEN","GEODETIC_DATUM_ASSUMED_WGS84;CONTINENT_DERIVED_FROM_COORDINATES;INSTITUTION_MATCH_FUZZY;COLLECTION_MATCH_NONE"
-111.878678,33.816694,"Schismus arabicus",1846544997,"Cave Creek Rd. 1.7 mi. east of Mule Train Rd.","USA",NA,1977,"PRESERVED_SPECIMEN","GEODETIC_DATUM_ASSUMED_WGS84;CONTINENT_DERIVED_FROM_COORDINATES;INSTITUTION_MATCH_FUZZY;COLLECTION_MATCH_NONE"
-114.065533,34.148117,"Schismus arabicus",1846485904,"Just outside Gibralter Wilderness Area, just west of Osborne Wash and Osborne Road.","USA",NA,2005,"PRESERVED_SPECIMEN","GEODETIC_DATUM_ASSUMED_WGS84;CONTINENT_DERIVED_FROM_COORDINATES;INSTITUTION_MATCH_FUZZY;COLLECTION_MATCH_NONE"
-113.947117,34.167483,"Schismus arabicus",1846558709,"Buckskin Mountains, north side of Squaw Peak.","USA",NA,2005,"PRESERVED_SPECIMEN","GEODETIC_DATUM_ASSUMED_WGS84;CONTINENT_DERIVED_FROM_COORDINATES;INSTITUTION_MATCH_FUZZY;COLLECTION_MATCH_NONE"
34.95565,30.42749,"Schismus arabicus",1846545450,"Negev; HaMeshar.","ISR",5000,1969,"PRESERVED_SPECIMEN","GEODETIC_DATUM_ASSUMED_WGS84;CONTINENT_DERIVED_FROM_COORDINATES;INSTITUTION_MATCH_FUZZY;COLLECTION_MATCH_NONE"
-111.515298,32.857419,"Schismus arabicus",1846544676,"Brady Wash, Rt. 80-89.","USA",3000,1973,"PRESERVED_SPECIMEN","GEODETIC_DATUM_ASSUMED_WGS84;CONTINENT_DERIVED_FROM_COORDINATES;INSTITUTION_MATCH_FUZZY;COLLECTION_MATCH_NONE"
-115.863,35.9803,"Schismus arabicus",1846549334,"Mojave Desert; Pahrump Valley, along stateline north of Old Spanish Trail Hwy, Hidden Hills Ranch, NE of Calvada Springs (Stump Spring 7.5'Q)","USA",1000,2011,"PRESERVED_SPECIMEN","GEODETIC_DATUM_ASSUMED_WGS84;CONTINENT_DERIVED_FROM_COORDINATES;INSTITUTION_MATCH_FUZZY;COLLECTION_MATCH_NONE"
-114.793,33.6561,"Schismus arabicus",1846546624,"Sonoran (Colorado) Desert; SE side of McCoy Mountains, upper part of wash c. 4.5 mi. NW of Blythe Airport, c. 3.5 mi. ENE of McCoy Peak","USA",1000,2010,"PRESERVED_SPECIMEN","GEODETIC_DATUM_ASSUMED_WGS84;CONTINENT_DERIVED_FROM_COORDINATES;INSTITUTION_MATCH_FUZZY;COLLECTION_MATCH_NONE"
-111.55766,36.874565,"Schismus arabicus",1846556867,"Grand Canyon National Park, 6 mile Camp.","USA",730,2007,"PRESERVED_SPECIMEN","CONTINENT_DERIVED_FROM_COORDINATES;INSTITUTION_MATCH_FUZZY;COLLECTION_MATCH_NONE"
-111.661,33.1794,"Schismus arabicus",2572938552,"San Tan Mountains Regional Park, S side of dirt rd., W of area cleared for parking, ca. 1500 ft. SE of Sossaman/skyline entrance; NW Goldmine Mtns.","USA",700,1998,"PRESERVED_SPECIMEN","GEODETIC_DATUM_ASSUMED_WGS84;CONTINENT_DERIVED_FROM_COORDINATES;INSTITUTION_MATCH_FUZZY;COLLECTION_MATCH_NONE"
-113.932383,34.025317,"Schismus arabicus",1846480778,"Cactus Plain sand dunes.","USA",NA,2005,"PRESERVED_SPECIMEN","GEODETIC_DATUM_ASSUMED_WGS84;CONTINENT_DERIVED_FROM_COORDINATES;INSTITUTION_MATCH_FUZZY;COLLECTION_MATCH_NONE"
-111.88157,36.49668,"Schismus arabicus",1846480763,"Grand Canyon National Park, South Canyon. Transet 1B, adjacent and south of 1A. 12 421046E, 4039401N (21 m accuracy).","USA",NA,2005,"PRESERVED_SPECIMEN","GEODETIC_DATUM_ASSUMED_WGS84;GEODETIC_DATUM_INVALID;CONTINENT_DERIVED_FROM_COORDINATES;INSTITUTION_MATCH_FUZZY;COLLECTION_MATCH_NONE"
-109.464,32.89935,"Schismus arabicus",1846480748,"Bureau of Land Management, Upstream of Deadman Canyon along Gila River and 4WD road","USA",NA,2004,"PRESERVED_SPECIMEN","GEODETIC_DATUM_ASSUMED_WGS84;CONTINENT_DERIVED_FROM_COORDINATES;INSTITUTION_MATCH_FUZZY;COLLECTION_MATCH_NONE"
-111.660031,36.775441,"Schismus arabicus",1846480794,"Badger Canyon, River Mile 8. 12 0441099E, 4069962N (10 m accuracy).","USA",NA,2005,"PRESERVED_SPECIMEN","GEODETIC_DATUM_ASSUMED_WGS84;GEODETIC_DATUM_INVALID;CONTINENT_DERIVED_FROM_COORDINATES;INSTITUTION_MATCH_FUZZY;COLLECTION_MATCH_NONE"
-113.37225,35.7692,"Schismus arabicus",1846480806,"Grand Canyon National Park, 225-1/2 Mile Canyon, above first major chalkfall, ca 12 0285554E, 3960946N","USA",NA,2005,"PRESERVED_SPECIMEN","GEODETIC_DATUM_ASSUMED_WGS84;GEODETIC_DATUM_INVALID;CONTINENT_DERIVED_FROM_COORDINATES;INSTITUTION_MATCH_FUZZY;COLLECTION_MATCH_NONE"
-112.889961,36.255462,"Schismus arabicus",1846480787,"Grand Canyon, Hualapai Indian Reservation, National Canyon, Transect T1B, 330204 E, 4013940 N, NAD 83.","USA",NA,2006,"PRESERVED_SPECIMEN","CONTINENT_DERIVED_FROM_COORDINATES;INSTITUTION_MATCH_FUZZY;COLLECTION_MATCH_NONE"
-112.234467,33.2172,"Schismus arabicus",1846487793,"Sierra Estrella Mountains Wilderness Area, west side, along Quartz trail to top.","USA",NA,2005,"PRESERVED_SPECIMEN","GEODETIC_DATUM_ASSUMED_WGS84;CONTINENT_DERIVED_FROM_COORDINATES;INSTITUTION_MATCH_FUZZY;COLLECTION_MATCH_NONE"
-114.425167,32.691972,"Schismus arabicus",1846506188,"Just north of Interstate 8 on eastern outskirts of Yuma, Foothills ATV area.","USA",NA,2005,"PRESERVED_SPECIMEN","GEODETIC_DATUM_ASSUMED_WGS84;CONTINENT_DERIVED_FROM_COORDINATES;INSTITUTION_MATCH_FUZZY;COLLECTION_MATCH_NONE"
-113.9417,36.404,"Schismus arabicus",1929613209,"Grand Canyon Parashant NM, Cottonwood Wash above BLM roads 111 & 1007","USA",NA,2001,"PRESERVED_SPECIMEN","COLLECTION_MATCH_FUZZY"
-113.33,36.1723,"Schismus arabicus",1929428125,"Grand Canyon-ParashantNatl. Monument; canyon n. of Frog Spring.","USA",NA,2003,"PRESERVED_SPECIMEN","COLLECTION_MATCH_FUZZY"
-111.53372,37.162,"Schismus arabicus",1931335479,"1 mi E of Tibbet canyon on Warm Creek Rd.","USA",NA,1999,"PRESERVED_SPECIMEN","GEODETIC_DATUM_ASSUMED_WGS84;COLLECTION_MATCH_FUZZY"
-114.884384,33.984676,"Schismus arabicus",1929301540,"Rice Valley, 7 miles south-southwest of Rice.","USA",NA,1973,"PRESERVED_SPECIMEN","COLLECTION_MATCH_FUZZY"
86.22,44.3,"Schismus arabicus",4044669175,"","CHN",NA,1976,"PRESERVED_SPECIMEN","COUNTRY_INVALID;GEODETIC_DATUM_ASSUMED_WGS84;CONTINENT_DERIVED_FROM_COORDINATES;INSTITUTION_MATCH_FUZZY;COLLECTION_MATCH_NONE"
-108.98835,32.67024,"Schismus arabicus",1842930028,"Near unnamed spring 1.5 miles SE of Virden on S. side of Gila River Valley.","USA",285,1994,"PRESERVED_SPECIMEN","COORDINATE_ROUNDED;CONTINENT_DERIVED_FROM_COORDINATES;INSTITUTION_MATCH_FUZZY;INSTITUTION_COLLECTION_MISMATCH"
-107.865,32.329,"Schismus arabicus",1843821245,"Flora of the National Guard: Black Mountain.","USA",NA,1998,"PRESERVED_SPECIMEN","CONTINENT_DERIVED_FROM_COORDINATES;INSTITUTION_MATCH_FUZZY;INSTITUTION_COLLECTION_MISMATCH"
-113.920278,36.9275,"Schismus arabicus",2423863841,"Northwest Arizona, lowest Beaver Dam Bajada.","USA",NA,1994,"PRESERVED_SPECIMEN","GEODETIC_DATUM_ASSUMED_WGS84;CONTINENT_DERIVED_FROM_COORDINATES;INSTITUTION_MATCH_FUZZY;INSTITUTION_COLLECTION_MISMATCH"
138.04487,-30.02067,"Schismus arabicus",1454382417,"","AUS",50,2010,"PRESERVED_SPECIMEN","CONTINENT_DERIVED_FROM_COORDINATES"
-118.442,33.384,"Schismus arabicus",3053367565,"Santa Catalina Island: Cottonwood Cyn, along Cottonwood-Blackjack Rd, ca. 1.65 mi WSW of Blackjack Pk","USA",200,2001,"PRESERVED_SPECIMEN","GEODETIC_DATUM_ASSUMED_WGS84;GEODETIC_DATUM_INVALID;CONTINENT_DERIVED_FROM_COORDINATES;INSTITUTION_MATCH_FUZZY;COLLECTION_MATCH_NONE"
-118.3581,33.3256,"Schismus arabicus",3053377814,"Santa Catalina Island: E of Lone Tree, just inland from S-facing bluff top","USA",750,2000,"PRESERVED_SPECIMEN","GEODETIC_DATUM_ASSUMED_WGS84;GEODETIC_DATUM_INVALID;CONTINENT_DERIVED_FROM_COORDINATES;INSTITUTION_MATCH_FUZZY;COLLECTION_MATCH_NONE"
-121.224,36.006,"Schismus arabicus",3053337274,"Fort Hunter Liggett: ca. 1.68 km E of jct of Del Venturi and Mission rds; Ft Hunter Liggett","USA",200,2008,"PRESERVED_SPECIMEN","CONTINENT_DERIVED_FROM_COORDINATES;INSTITUTION_MATCH_FUZZY;COLLECTION_MATCH_NONE"
-119.784,34.984,"Schismus arabicus",3053353807,"St Highway 166 just E of oil field in lower Cuyama Valley","USA",1500,1957,"PRESERVED_SPECIMEN","CONTINENT_DERIVED_FROM_COORDINATES;INSTITUTION_MATCH_FUZZY;COLLECTION_MATCH_NONE"
-118.444486,34.4925,"Schismus arabicus",3053364341,"Texas Cyn Rd, 1 mi E of Bouquet Cyn Rd","USA",500,1969,"PRESERVED_SPECIMEN","CONTINENT_DERIVED_FROM_COORDINATES;INSTITUTION_MATCH_FUZZY;COLLECTION_MATCH_NONE"
-120.258,34.861,"Schismus arabicus",3053374401,"Sisquoc River at Tepusquet Cyn Rd","USA",1000,1964,"PRESERVED_SPECIMEN","CONTINENT_DERIVED_FROM_COORDINATES;INSTITUTION_MATCH_FUZZY;COLLECTION_MATCH_NONE"
-119.436229,33.227502,"Schismus arabicus",3053396696,"San Nicolas Island: S side of Divide Ridge, overlooking Sandspit","USA",200,2001,"PRESERVED_SPECIMEN","GEODETIC_DATUM_ASSUMED_WGS84;GEODETIC_DATUM_INVALID;CONTINENT_DERIVED_FROM_COORDINATES;INSTITUTION_MATCH_FUZZY;COLLECTION_MATCH_NONE"
-118.0046429,34.8614459,"Schismus arabicus",3053337536,"NW end of Buckhorn Lake, Edwards Air Force Base","USA",1000,1965,"PRESERVED_SPECIMEN","COORDINATE_REPROJECTED;CONTINENT_DERIVED_FROM_COORDINATES;INSTITUTION_MATCH_FUZZY;COLLECTION_MATCH_NONE"
-119.1226607,34.1119585,"Schismus arabicus",3053460118,"Pacific Missile Test Center: just E of South L Ave midway between 14th and 15th Streets","USA",1000,1977,"PRESERVED_SPECIMEN","COORDINATE_REPROJECTED;CONTINENT_DERIVED_FROM_COORDINATES;INSTITUTION_MATCH_FUZZY;COLLECTION_MATCH_NONE"
-119.882,35.021,"Schismus arabicus",3053470112,"Cuyama Valley: near jct of Hwy 166 and Bates Cyn Rd","USA",1000,1965,"PRESERVED_SPECIMEN","CONTINENT_DERIVED_FROM_COORDINATES;INSTITUTION_MATCH_FUZZY;COLLECTION_MATCH_NONE"
-118.5502,33.46905,"Schismus arabicus",3053439121,"Santa Catalina Island: open slope above Parson's Landing","USA",750,1992,"PRESERVED_SPECIMEN","CONTINENT_DERIVED_FROM_COORDINATES;INSTITUTION_MATCH_FUZZY;COLLECTION_MATCH_NONE"
-119.4896772,34.8869345,"Schismus arabicus",3053441479,"Ballinger Cyn, ca. 1 mi from Hwy 399","USA",1000,1958,"PRESERVED_SPECIMEN","COORDINATE_REPROJECTED;CONTINENT_DERIVED_FROM_COORDINATES;INSTITUTION_MATCH_FUZZY;COLLECTION_MATCH_NONE"
-121.0876,35.90015,"Schismus arabicus",3053472317,"Ca. 0.31 km ENE of Tank Trail and Interlake Rd intersection along the tank trail to Camp Roberts; Ft Hunter Liggett Training Area 29, Fort Hunter Liggett Military Installation.","USA",200,2015,"PRESERVED_SPECIMEN","CONTINENT_DERIVED_FROM_COORDINATES;INSTITUTION_MATCH_FUZZY;COLLECTION_MATCH_NONE"
-120.449,34.805,"Schismus arabicus",3053472806,"Casmalia Hills: Vandenberg Air Force Base; from 1 mi N of St Hwy 1 exit from St Hwy 135 S to vicinity of exit; hills and valleys W of Hwy 135; Vandenberg Air Force Base","USA",750,1993,"PRESERVED_SPECIMEN","CONTINENT_DERIVED_FROM_COORDINATES;INSTITUTION_MATCH_FUZZY;COLLECTION_MATCH_NONE"
-119.7459,34.0067,"Schismus arabicus",3053471953,"Santa Cruz Island: Central Valley, at La Cascada Crk crossing along Valley Rd","USA",500,1990,"PRESERVED_SPECIMEN","CONTINENT_DERIVED_FROM_COORDINATES;INSTITUTION_MATCH_FUZZY;COLLECTION_MATCH_NONE"
-118.0242,34.4739,"Schismus arabicus",3053442424,"Rocky Pt Cmpgrd, Little Rock Reservoir, ca. 5.5 mi SW of Little Rock","USA",1200,1963,"PRESERVED_SPECIMEN","CONTINENT_DERIVED_FROM_COORDINATES;INSTITUTION_MATCH_FUZZY;COLLECTION_MATCH_NONE"
-118.94899,34.3186,"Schismus arabicus",3053372443,"vicinity of Matilija Nursery, 8225 Waters Rd, Moorpark","USA",200,2015,"PRESERVED_SPECIMEN","CONTINENT_DERIVED_FROM_COORDINATES;INSTITUTION_MATCH_FUZZY;COLLECTION_MATCH_NONE"
-119.559,34.828,"Schismus arabicus",3053339089,"Rainbow Cyn, near Reyes Ranch in Santa Barbara Cyn","USA",1000,1973,"PRESERVED_SPECIMEN","CONTINENT_DERIVED_FROM_COORDINATES;INSTITUTION_MATCH_FUZZY;COLLECTION_MATCH_NONE"
-119.793,34.5395,"Schismus arabicus",3053352051,"Los Padres National Forest; Red Rock Cyn","USA",1000,1966,"PRESERVED_SPECIMEN","CONTINENT_DERIVED_FROM_COORDINATES;INSTITUTION_MATCH_FUZZY;COLLECTION_MATCH_NONE"
-118.809,34.537,"Schismus arabicus",3053378528,"Los Padres National Forest; Piru Area, Devils Potrero N of the Pothole, on dry trail","USA",1000,2000,"PRESERVED_SPECIMEN","CONTINENT_DERIVED_FROM_COORDINATES;INSTITUTION_MATCH_FUZZY;COLLECTION_MATCH_NONE"
-119.9666,34.9633,"Schismus arabicus",3053378625,"ca. 8 mi E of Miranda Pine Mtn, the beginning of the Wellman Burn","USA",750,1968,"PRESERVED_SPECIMEN","CONTINENT_DERIVED_FROM_COORDINATES;INSTITUTION_MATCH_FUZZY;COLLECTION_MATCH_NONE"
-115.24104,32.75828,"Schismus arabicus",3053398380,"Hwy 8, 9 mi E of Holtville","USA",402,1980,"PRESERVED_SPECIMEN","CONTINENT_DERIVED_FROM_COORDINATES;INSTITUTION_MATCH_FUZZY;COLLECTION_MATCH_NONE"
-115.37,33.15,"Schismus arabicus",3053417044,"N end of Algodones Dunes, East Mesa at E end of Montgomery Rd, ca. 1 mi E of Highline Canal.T12S, R15E, NE 1/4 of SE 1/4 S2","USA",1000,1986,"PRESERVED_SPECIMEN","CONTINENT_DERIVED_FROM_COORDINATES;INSTITUTION_MATCH_FUZZY;COLLECTION_MATCH_NONE"
-118.8588216,35.697974,"Schismus arabicus",3053426196,"Famosa Rd, 1.5 mi W of Woody","USA",1783,1964,"PRESERVED_SPECIMEN","COORDINATE_REPROJECTED;COORDINATE_ROUNDED;CONTINENT_DERIVED_FROM_COORDINATES;INSTITUTION_MATCH_FUZZY;COLLECTION_MATCH_NONE"
-118.6748,35.0508,"Schismus arabicus",3053455634,"Tejon Crk near mouth of Tejon Cyn","USA",1250,1963,"PRESERVED_SPECIMEN","CONTINENT_DERIVED_FROM_COORDINATES;INSTITUTION_MATCH_FUZZY;COLLECTION_MATCH_NONE"
-118.8171,34.7103,"Schismus arabicus",3053484441,"Hungry Valley Rd, E of Hungry Valley State Vehicular Recreation Area","USA",2200,2004,"PRESERVED_SPECIMEN","CONTINENT_DERIVED_FROM_COORDINATES;INSTITUTION_MATCH_FUZZY;COLLECTION_MATCH_NONE"
-119.661,35.149,"Schismus arabicus",3053340163,"Elkhorn Plain, 5.3 mi SE of Crocker Grade Rd on Elkhorn Rd; T32S, R22E, SW 1/4 of S7","USA",500,1986,"PRESERVED_SPECIMEN","CONTINENT_DERIVED_FROM_COORDINATES;INSTITUTION_MATCH_FUZZY;COLLECTION_MATCH_NONE"
-116.0829,33.7645,"Schismus arabicus",3053434688,"south side of Cottonwood Wash, 5 mi E of jct Dillon Rd and Fargo Cyn Rd","USA",1750,1988,"PRESERVED_SPECIMEN","CONTINENT_DERIVED_FROM_COORDINATES;INSTITUTION_MATCH_FUZZY;COLLECTION_MATCH_NONE"
-119.3502,34.4198,"Schismus arabicus",3053454801,"Casitas Pass Rd, adjacent to Lake Casitas","USA",750,1995,"PRESERVED_SPECIMEN","CONTINENT_DERIVED_FROM_COORDINATES;INSTITUTION_MATCH_FUZZY;COLLECTION_MATCH_NONE"
-117.557922,34.506462,"Schismus arabicus",3053453938,"20 mi E of Pearblossom","USA",1000,1972,"PRESERVED_SPECIMEN","CONTINENT_DERIVED_FROM_COORDINATES;INSTITUTION_MATCH_FUZZY;COLLECTION_MATCH_NONE"
44.7,39.93333,"Schismus arabicus",893487689,"Armenia: Ararat province, Ararat valley 12 km NNW of Ararat town, 7 km NW of Vedi, Erah range. semidesert with Artemisia fragrans. Alt.: 1030 m.2002-06-18, Leg.: Fayvush,G. [Ֆայվուշի,Գ.; Файвуш Г.] et al. s.n.","ARM",NA,2002,"PRESERVED_SPECIMEN","GEODETIC_DATUM_ASSUMED_WGS84;CONTINENT_DERIVED_FROM_COORDINATES;INSTITUTION_MATCH_FUZZY"
35.76667,32.35,"Schismus arabicus",1060490664,"Jordan: Ajloun Forest Reserve. (area of 13 km² in the Ajloun highlands north of Ajloun, evergreen oak vegetation). Alt.: 600-1100 m. 27.02.2004, Leg.: R. Böcker RB 900.","JOR",NA,2004,"PRESERVED_SPECIMEN","GEODETIC_DATUM_ASSUMED_WGS84;CONTINENT_DERIVED_FROM_COORDINATES;INSTITUTION_MATCH_FUZZY"
63.183403,38.566555,"Schismus arabicus",1798977667,"","TKM",NA,1952,"PRESERVED_SPECIMEN","CONTINENT_DERIVED_FROM_COORDINATES;INSTITUTION_MATCH_FUZZY;COLLECTION_MATCH_FUZZY"
70.777015,40.919674,"Schismus arabicus",1798977671,"","UZB",2000,1965,"PRESERVED_SPECIMEN","CONTINENT_DERIVED_FROM_COORDINATES;INSTITUTION_MATCH_FUZZY;COLLECTION_MATCH_FUZZY"
-71.636667,-16.129722,"Schismus arabicus",2268973037,"21 km N of Yura on highway towards Patahuasi and 45 km NW of Arequipa.","PER",NA,2004,"PRESERVED_SPECIMEN","OCCURRENCE_STATUS_INFERRED_FROM_INDIVIDUAL_COUNT;COORDINATE_ROUNDED;GEODETIC_DATUM_ASSUMED_WGS84;INSTITUTION_MATCH_FUZZY;COLLECTION_MATCH_NONE"
34.87342,31.303578,"Schismus arabicus",2596453336,"","ISR",31,2020,"HUMAN_OBSERVATION","COORDINATE_ROUNDED;CONTINENT_DERIVED_FROM_COORDINATES"
-116.36495,33.325314,"Schismus arabicus",2006081173,"","USA",10,2019,"HUMAN_OBSERVATION","COORDINATE_ROUNDED;CONTINENT_DERIVED_FROM_COORDINATES"
-116.1757,33.2905,"Schismus arabicus",3125028277,"Anza-Borrego Desert State Park in Palo Verde Wash about .5 mile (via road) downstream from crossing of Palo Verde Wash Rd and Hwy S22.","USA",NA,2005,"PRESERVED_SPECIMEN","CONTINENT_DERIVED_FROM_COORDINATES;INSTITUTION_MATCH_FUZZY;COLLECTION_MATCH_NONE"
-116.06556,33.31389,"Schismus arabicus",3125028280,"Freeman Properties (Truckhaven): West of the Salton Sea, NW of Salton City, W of Hwy. 86; Section 8 (SL8), in Big Wash, Site PHACRE in arroyo bottom and surrounding embankments","USA",80,2008,"PRESERVED_SPECIMEN","CONTINENT_DERIVED_FROM_COORDINATES;INSTITUTION_MATCH_FUZZY;COLLECTION_MATCH_NONE"
-117.48463,33.3485,"Schismus arabicus",3125020287,"Camp Pendleton: Romeo II Training Area; north of Las Pulgas Road, east of I-5 and east of El Camino Real along Horno Canyon Road","USA",NA,2011,"PRESERVED_SPECIMEN","CONTINENT_DERIVED_FROM_COORDINATES;INSTITUTION_MATCH_FUZZY;COLLECTION_MATCH_NONE"
-118.07116,35.19246,"Schismus arabicus",3125026280,"sandy flats, 10.7 mi. ne. along U.S. Hwy. 6 from jct. with Hwy. 466 at Mojave","USA",NA,1956,"PRESERVED_SPECIMEN","CONTINENT_DERIVED_FROM_COORDINATES;INSTITUTION_MATCH_FUZZY;COLLECTION_MATCH_NONE"
-115.99889,33.29722,"Schismus arabicus",3125026289,"Freeman Properties (Truckhaven): West of the Salton Sea, NW of Salton City, approx. 1 mile W of Hwy. 86; Section 14 (SL14), Palm Wash, Site ABRVIL in sandy arroyo bottom and surrounding mud embankments","USA",80,2009,"PRESERVED_SPECIMEN","CONTINENT_DERIVED_FROM_COORDINATES;INSTITUTION_MATCH_FUZZY;COLLECTION_MATCH_NONE"
-116.20711,32.8571,"Schismus arabicus",3125026291,"Anza-Borrego Desert State Park, Bow Willow Wash at S-2 crossing, south side of highway, NE of Egg Mtn","USA",NA,2005,"PRESERVED_SPECIMEN","CONTINENT_DERIVED_FROM_COORDINATES;INSTITUTION_MATCH_FUZZY;COLLECTION_MATCH_NONE"
-115.08111,33.60611,"Schismus arabicus",3125026296,"Sonoran (Colorado) Desert: south of Hwy-10, north of the Chuckwalla Mountains, Chuckwalla Valley Road c. 1.4 km west of its junction with Augustine Pass Road (East of Aztec Mines 7.5'Q)","USA",NA,2013,"PRESERVED_SPECIMEN","CONTINENT_DERIVED_FROM_COORDINATES;INSTITUTION_MATCH_FUZZY;COLLECTION_MATCH_NONE"
-114.61336,32.79709,"Schismus arabicus",3125029291,"4.2 mi. N of Winterhaven on Picacho Rd, where the road crosses the canal, broad wash","USA",161,1998,"PRESERVED_SPECIMEN","CONTINENT_DERIVED_FROM_COORDINATES;INSTITUTION_MATCH_FUZZY;COLLECTION_MATCH_NONE"
-116.1424,32.813,"Schismus arabicus",3125029294,"Anza-Borrego Desert State Park: north of the Volcanic Hills in Jojoba Wash about .1 mile west of Hwy S2 (in NNW part of square).","USA",NA,2005,"PRESERVED_SPECIMEN","CONTINENT_DERIVED_FROM_COORDINATES;INSTITUTION_MATCH_FUZZY;COLLECTION_MATCH_NONE"
-116.15497,32.90318,"Schismus arabicus",3125034303,"Anza-Borrego Desert State Park: the sw part of the South Mesa (north and east of the Carrizo Badlands). Ca. 0.3 mile to the east of the canyon drainage called Arroyo Seco del Diablo. Ca. 2 miles N of Carrizo Creek. Ca.2.8 miles west of the county line.","USA",NA,2010,"PRESERVED_SPECIMEN","CONTINENT_DERIVED_FROM_COORDINATES;INSTITUTION_MATCH_FUZZY;COLLECTION_MATCH_NONE"
-116.31502,33.13336,"Schismus arabicus",3125034306,"Anza-Borrego Desert State Park. State Route 78, 3.9 miles E of intersection with Yaqui Pass Rd. (County Rd. S-3), and 0.8 mile W of Narrows Earth Trail parking.","USA",NA,2013,"PRESERVED_SPECIMEN","CONTINENT_DERIVED_FROM_COORDINATES;INSTITUTION_MATCH_FUZZY;COLLECTION_MATCH_NONE"
-116.1683,32.7959,"Schismus arabicus",3125151299,"Jojoba Wash, Anza-Borrego Desert State Park. 2.25 miles due S of Hwy S2, 11 miles due N of Freeway I8, 3.8 miles due W of Imperial county line. Bajada WNW of the Volcanic Hills.","USA",NA,2011,"PRESERVED_SPECIMEN","CONTINENT_DERIVED_FROM_COORDINATES;INSTITUTION_MATCH_FUZZY;COLLECTION_MATCH_NONE"
-116.15975,36.17135,"Schismus arabicus",3125258242,"Resting Spring Range Wilderness: west side of Stewart Valley, east of Resting Spring Range, ca. 1.4 air mile northeast of Highway 178. Ca. 22 road miles northeast of Shoshone along Highway 178, ca. 9.5 road miles west-southwest of Pahrump, NV.Ca . . . .","USA",NA,2017,"PRESERVED_SPECIMEN","CONTINENT_DERIVED_FROM_COORDINATES;INSTITUTION_MATCH_FUZZY;COLLECTION_MATCH_NONE"
-116.2973,33.3368,"Schismus arabicus",3125156284,"Anza-Borrego Desert State Park. East side of Coyote Mountain, West margin of Clark Lake.","USA",NA,2005,"PRESERVED_SPECIMEN","CONTINENT_DERIVED_FROM_COORDINATES;INSTITUTION_MATCH_FUZZY;COLLECTION_MATCH_NONE"
-114.6162,33.0201,"Schismus arabicus",3125156286,"Picacho State Recreation Area. South side of the Colorado River, near Group Camp on N-side of main access road.","USA",80,2005,"PRESERVED_SPECIMEN","CONTINENT_DERIVED_FROM_COORDINATES;INSTITUTION_MATCH_FUZZY;COLLECTION_MATCH_NONE"
-116.11082,35.66196,"Schismus arabicus",3125278924,"Valjean Hills; east of old Tonopah and Tidewater Railroad grade D1612, ca. 4.7 road miles north of the Kingston Wash route D152, east of Highway 127. Southwest of the Kingston Range, south of the Dumont Hills, north of Baker.","USA",NA,2018,"PRESERVED_SPECIMEN","CONTINENT_DERIVED_FROM_COORDINATES;INSTITUTION_MATCH_FUZZY;COLLECTION_MATCH_NONE"
-115.34723,34.54314,"Schismus arabicus",3949972329,"Skeleton Pass, northeast Ship Mountains: along Skeleton Pass Road NS 195 0.4 air miles northwest from Carbonate Gulch road NS 403, ca. 6.1 air miles south of Danby. South of Highway 66 and north of Cadiz Road. Edge of Old Woman Mountains Wi etc.","USA",NA,2019,"PRESERVED_SPECIMEN","CONTINENT_DERIVED_FROM_COORDINATES;INSTITUTION_MATCH_FUZZY;COLLECTION_MATCH_NONE"
-115.8311,32.78994,"Schismus arabicus",3125158288,"East of Plaster City on Bureau of Land Management (BLM) property in an area proposed for development of a solar facility: S of Hwy. S80 & N of I-8, E of Ocotillo & W of El Centro; along desert flats just S of Hwy S80","USA",80,2010,"PRESERVED_SPECIMEN","CONTINENT_DERIVED_FROM_COORDINATES;INSTITUTION_MATCH_FUZZY;COLLECTION_MATCH_NONE"
-115.99508,33.61679,"Schismus arabicus",3125158293,"Mecca Hills; side canyon (east fork) of Painted Canyon","USA",NA,2016,"PRESERVED_SPECIMEN","CONTINENT_DERIVED_FROM_COORDINATES;INSTITUTION_MATCH_FUZZY;COLLECTION_MATCH_NONE"
