"lon","lat","species","gbifID","locality","countryCode","coordinateUncertaintyInMeters","year","basisOfRecord","issue"
-114.77074,33.02626,"Schismus arabicus",3125158294,"Indian Pass area between Picacho and Black Mountain: east of the Algodones Dunes; east of Ogilby Rd. (S34) & just north of Indian Pass Road; along a canyon and its adjacent slopes","USA",NA,2017,"PRESERVED_SPECIMEN","CONTINENT_DERIVED_FROM_COORDINATES;INSTITUTION_MATCH_FUZZY;COLLECTION_MATCH_NONE"
-116.02259,35.99301,"Schismus arabicus",3125274930,"Nopah Range Wilderness: East side of Nopah Range, ca. 1.75 air miles west of Mesquite Valley Road, south of Pahrump, NV, northwest of Old Spanish Trail Highway, west side of Pahrump Valley. . . . .","USA",NA,2017,"PRESERVED_SPECIMEN","CONTINENT_DERIVED_FROM_COORDINATES;INSTITUTION_MATCH_FUZZY;COLLECTION_MATCH_NONE"
-118.1177,36.6989,"Schismus arabicus",3125157278,"7.7 miles north of Lone Pine on Highway 395","USA",400,1980,"PRESERVED_SPECIMEN","CONTINENT_DERIVED_FROM_COORDINATES;INSTITUTION_MATCH_FUZZY;COLLECTION_MATCH_NONE"
-115.87331,32.78489,"Schismus arabicus",3125157286,"Southwest of Plaster City on Bureau of Land Management (BLM) property in an area proposed for development of a solar facility: S of Hwy. S80 & N of I-8, NE of Ocotillo & W of El Centro; along a powerline road","USA",80,2010,"PRESERVED_SPECIMEN","CONTINENT_DERIVED_FROM_COORDINATES;INSTITUTION_MATCH_FUZZY;COLLECTION_MATCH_NONE"
-117.55468,33.38811,"Schismus arabicus",3125157292,"Camp Pendleton: northwestern portion of Base; Alpha Two Training Area; San Onofre Creek riparian area east of I-5 and just south of Basilone Road","USA",NA,2016,"PRESERVED_SPECIMEN","CONTINENT_DERIVED_FROM_COORDINATES;INSTITUTION_MATCH_FUZZY;COLLECTION_MATCH_NONE"
-114.78177,33.3939,"Schismus arabicus",3125157293,"Northwest side of Palo Verde Mountains: southwest of the town of Palo Verde and west of the Colorado River and Hwy 78; near BLM Road #544 along a sandy arroyo and on the adjacent volcanic mesa","USA",NA,2017,"PRESERVED_SPECIMEN","CONTINENT_DERIVED_FROM_COORDINATES;INSTITUTION_MATCH_FUZZY;COLLECTION_MATCH_NONE"
-116.40497,33.36125,"Schismus arabicus",3125153280,"Anza-Borrego Desert State Park, 2½ mi N of Borrego Springs, Coyote Canyon; about 1/2 mile below the Second Crossing; 7.5 miles NW of the intersection of DiGiorgio Rd and County Hwy S22 in Borrego Springs.","USA",NA,2008,"PRESERVED_SPECIMEN","CONTINENT_DERIVED_FROM_COORDINATES;INSTITUTION_MATCH_FUZZY;COLLECTION_MATCH_NONE"
-115.15444,33.04806,"Schismus arabicus",3125022287,"BLM Algodones Dunes Natural Area. Eside of dunes. 6 miles N of Hwy 78, along Kipf Road. E and W side of road. Along wash.","USA",161,2010,"PRESERVED_SPECIMEN","CONTINENT_DERIVED_FROM_COORDINATES;INSTITUTION_MATCH_FUZZY;COLLECTION_MATCH_NONE"
-114.72889,32.70444,"Schismus arabicus",3125092189,"ca 0.3 km south from Presa Morelos, wetland, stagnant water pools","MEX",NA,2006,"PRESERVED_SPECIMEN","CONTINENT_DERIVED_FROM_COORDINATES;INSTITUTION_MATCH_FUZZY;COLLECTION_MATCH_NONE"
-117.23022,35.16632,"Schismus arabicus",3125027277,"ca 22 air miles NW of Barstow in northern end of Black Canyon, ca 2.5 miles W of Opal Mt.","USA",NA,1978,"PRESERVED_SPECIMEN","CONTINENT_DERIVED_FROM_COORDINATES;INSTITUTION_MATCH_FUZZY;COLLECTION_MATCH_NONE"
-116.69207,33.37314,"Schismus arabicus",3125027291,"Vicinity of Rocky Mountain: NE of Holcomb Village; S of Chihuahua Valley; along Puerta La Cruz Road","USA",NA,2013,"PRESERVED_SPECIMEN","CONTINENT_DERIVED_FROM_COORDINATES;INSTITUTION_MATCH_FUZZY;COLLECTION_MATCH_NONE"
-116.11497,33.09852,"Schismus arabicus",3125161303,"Split Mt Rd, ~0.5 mile NW of Halfhill Dry Lake, 2.95 miles due S of State Hwy 78, Lower Borrego Valley.","USA",NA,2011,"PRESERVED_SPECIMEN","CONTINENT_DERIVED_FROM_COORDINATES;INSTITUTION_MATCH_FUZZY;COLLECTION_MATCH_NONE"
-116.12128,36.14829,"Schismus arabicus",3125255243,"Nopah Range Wilderness: west side of Stewart Valley, east of the Nopah Range, ca. 1.6 air mile south of Highway 178. Ca. 22 road miles northeast of Shoshone along Highway 178, ca. 9.5 road miles west-southwest of Pahrump, NV.Ca. 2.4 road miles w . . . .","USA",NA,2017,"PRESERVED_SPECIMEN","CONTINENT_DERIVED_FROM_COORDINATES;INSTITUTION_MATCH_FUZZY;COLLECTION_MATCH_NONE"
-117.25373,33.33505,"Schismus arabicus",3359788358,"Fallbrook Naval Weapons Station: west of Fallbrook; South Magazine: south of Ammunition Road; extreme southeast part of station; canyon area east of Pilgrim Creek; along a dirt road","USA",NA,2020,"PRESERVED_SPECIMEN","CONTINENT_DERIVED_FROM_COORDINATES;INSTITUTION_MATCH_FUZZY;COLLECTION_MATCH_NONE"
-115.48857,34.23277,"Schismus arabicus",3949975305,"Calumet Mountains, Sheephole Valley Wilderness: just inside mouth of canyon on east side, ca. 4 miles west-southwest of NS 458, ca. 12.8 road miles north of CA highway 62. etc.","USA",NA,2019,"PRESERVED_SPECIMEN","CONTINENT_DERIVED_FROM_COORDINATES;INSTITUTION_MATCH_FUZZY;COLLECTION_MATCH_NONE"
-117.04932,33.20134,"Schismus arabicus",3125154285,"Escondido, Daley ranch, just off Jack Creek Meadow Loop Trail on the northernmost utility road in the NE corner of the property, in middle of the dirt road.","USA",241,2003,"PRESERVED_SPECIMEN","CONTINENT_DERIVED_FROM_COORDINATES;INSTITUTION_MATCH_FUZZY;COLLECTION_MATCH_NONE"
-116.11528,33.35,"Schismus arabicus",3125154294,"North East portion of Anza-Borrego Desert State Park; Wonderstone Wash, 6.3 miles SSW of Salton Sea Beach, just inside park boundary","USA",NA,2009,"PRESERVED_SPECIMEN","CONTINENT_DERIVED_FROM_COORDINATES;INSTITUTION_MATCH_FUZZY;COLLECTION_MATCH_NONE"
-114.85448,32.94544,"Schismus arabicus",3125154298,"Indian Pass area to the north of the Cargo Muchacho Mountains: east of the Algodones Dunes; east of Ogilby Rd. (S34) & just north of Indian Pass Road; along a wash and adjacent volcanic flats","USA",NA,2017,"PRESERVED_SPECIMEN","CONTINENT_DERIVED_FROM_COORDINATES;INSTITUTION_MATCH_FUZZY;COLLECTION_MATCH_NONE"
-117.83348,36.02515,"Schismus arabicus",3125025285,"vca 23 air miles SSE of Olancha, on W side of Sugerloaf Mt; small flat","USA",NA,1979,"PRESERVED_SPECIMEN","CONTINENT_DERIVED_FROM_COORDINATES;INSTITUTION_MATCH_FUZZY;COLLECTION_MATCH_NONE"
-113.6,37.17,"Schismus arabicus",1929319903,"2 mi. south of junction of Terry's Ranch Road and Welcome Spring Road and 2 mi. west of Highway 56.","USA",NA,1980,"PRESERVED_SPECIMEN","GEODETIC_DATUM_ASSUMED_WGS84;COLLECTION_MATCH_FUZZY"
-113.9775,36.2725,"Schismus arabicus",1929137491,"Northwest Tassi Spring","USA",NA,1999,"PRESERVED_SPECIMEN","COLLECTION_MATCH_FUZZY"
-116.50663,34.09669,"Schismus arabicus",2451554194,"Yucca Park above Moronga Valley c. 2 mi SW of community of Yucca Valley","USA",1609,1983,"PRESERVED_SPECIMEN","GEODETIC_DATUM_ASSUMED_WGS84;GEODETIC_DATUM_INVALID;CONTINENT_DERIVED_FROM_COORDINATES;INSTITUTION_MATCH_FUZZY"
-119.4553662,35.142392,"Schismus arabicus",2451545553,"just NE of Taft","USA",2427,1958,"PRESERVED_SPECIMEN","COORDINATE_REPROJECTED;COORDINATE_ROUNDED;CONTINENT_DERIVED_FROM_COORDINATES;INSTITUTION_MATCH_FUZZY"
-114.625833,34.156944,"Schismus arabicus",1986930027,"About 3 miles southwest of Vidal Junction","USA",NA,1979,"PRESERVED_SPECIMEN","COORDINATE_ROUNDED;GEODETIC_DATUM_ASSUMED_WGS84;CONTINENT_DERIVED_FROM_COORDINATES;COLLECTION_MATCH_FUZZY"
-113.823684,36.981659,"Schismus arabicus",1986992719,"Mojave Desert: Beaver Dam Mountains, S of summit of Cedar Pockets in Beaver Dam Wilderness Area (AZ strip BLM), ca 3.1 miles NW of Interstate 15, 1.2 miles S of the UT state line, 8 miles N of Littlefield.","USA",NA,2010,"PRESERVED_SPECIMEN","CONTINENT_DERIVED_FROM_COORDINATES;COLLECTION_MATCH_FUZZY"
-114.98593,35.84792,"Schismus arabicus",4010503308,"Eldorao Valley, Techren gentie transmission line structure 46.","USA",NA,2020,"PRESERVED_SPECIMEN","CONTINENT_DERIVED_FROM_COORDINATES;COLLECTION_MATCH_FUZZY"
-111.452778,36.967222,"Schismus arabicus",1986964705,"C part of Antelope Island ca 4 mi N of Page","USA",NA,1987,"PRESERVED_SPECIMEN","COORDINATE_ROUNDED;GEODETIC_DATUM_ASSUMED_WGS84;CONTINENT_DERIVED_FROM_COORDINATES;COLLECTION_MATCH_FUZZY"
-118.658361,34.888889,"Schismus arabicus",1986999686,"Southern Foothills of Techachapi Mountains: mouth of Canyon de la Lecheria, N of the end of 290th St. West, head of Pescado Creek","USA",100,2010,"PRESERVED_SPECIMEN","GEODETIC_DATUM_ASSUMED_WGS84;CONTINENT_DERIVED_FROM_COORDINATES;COLLECTION_MATCH_FUZZY"
-116.133889,35.407778,"Schismus arabicus",1986937784,"Eastern Mohave desert 10 mi north of Baker near Silver Lakes in Halloran Wash area","USA",NA,1982,"PRESERVED_SPECIMEN","COORDINATE_ROUNDED;GEODETIC_DATUM_ASSUMED_WGS84;CONTINENT_DERIVED_FROM_COORDINATES;COLLECTION_MATCH_FUZZY"
-115.56111,34.54056,"Schismus arabicus",2632741334,"Cadiz Valley, wash at dirt road crossing 1.7 miles SW of Chambless, 3 miles NW of Cadiz","USA",NA,2009,"PRESERVED_SPECIMEN","GEODETIC_DATUM_ASSUMED_WGS84;CONTINENT_DERIVED_FROM_COORDINATES;COLLECTION_MATCH_FUZZY"
-116.706111,37.0625,"Schismus arabicus",1986958164,"1.6 road miles S of Oasis Valley Road on road on W side of hills on W sid of the Amargosa Rover,","USA",NA,2005,"PRESERVED_SPECIMEN","COORDINATE_ROUNDED;GEODETIC_DATUM_ASSUMED_WGS84;CONTINENT_DERIVED_FROM_COORDINATES;COLLECTION_MATCH_FUZZY"
-116.856389,36.996111,"Schismus arabicus",1986958612,"Death Valley National Monument; Sarcobatus Flat, Mud Springs at SE end, 2.5 road miles S of main Grapevine Mts. road","USA",NA,2005,"PRESERVED_SPECIMEN","COORDINATE_ROUNDED;GEODETIC_DATUM_ASSUMED_WGS84;CONTINENT_DERIVED_FROM_COORDINATES;COLLECTION_MATCH_FUZZY"
-116.760278,36.907778,"Schismus arabicus",1986926140,"Cavant lot in Beatty","USA",NA,1979,"PRESERVED_SPECIMEN","COORDINATE_ROUNDED;GEODETIC_DATUM_ASSUMED_WGS84;CONTINENT_DERIVED_FROM_COORDINATES;COLLECTION_MATCH_FUZZY"
-116.713889,35.065556,"Schismus arabicus",1986937006,"South of Alvord Mountain at edge of Coyote Lake northeast of Barstow","USA",NA,1986,"PRESERVED_SPECIMEN","COORDINATE_ROUNDED;GEODETIC_DATUM_ASSUMED_WGS84;CONTINENT_DERIVED_FROM_COORDINATES;COLLECTION_MATCH_FUZZY"
-111.6858,36.7811,"Schismus arabicus",1986954073,"Arizona Strip: Badge Canyon S of the town of Vermiliion Cliffs, ca 1 air miles E of US Hwy 89.","USA",NA,2004,"PRESERVED_SPECIMEN","GEODETIC_DATUM_ASSUMED_WGS84;CONTINENT_DERIVED_FROM_COORDINATES;COLLECTION_MATCH_FUZZY"
-114.836632,32.77353,"Schismus arabicus",3039126464,"","USA",NA,2020,"HUMAN_OBSERVATION","COORDINATE_ROUNDED;CONTINENT_DERIVED_FROM_COORDINATES"
35.268937,30.752333,"Schismus arabicus",2238879564,"","ISR",NA,2019,"HUMAN_OBSERVATION","COORDINATE_ROUNDED;CONTINENT_DERIVED_FROM_COORDINATES"
-120.662,36.625,"Schismus arabicus",2273434515,"Located at Big Panoche Hills where Panoche Creek runs on to the valley floor. Found in valley grassland between 300-400 ft in sandy loam.","USA",5000,1973,"PRESERVED_SPECIMEN","CONTINENT_DERIVED_FROM_COORDINATES;INSTITUTION_MATCH_FUZZY"
-119.474002,35.369116,"Schismus arabicus",2273434464,"2mi south of Buttonwillow on Buttonwillow rd. Valley Grassland. Elev., 800 ft.","USA",591,1970,"PRESERVED_SPECIMEN","CONTINENT_DERIVED_FROM_COORDINATES;INSTITUTION_MATCH_FUZZY"
-115.127749,32.708123,"Schismus arabicus",2818533302,"","USA",119,2015,"HUMAN_OBSERVATION","CONTINENT_DERIVED_FROM_COORDINATES"
69,33.8,"Schismus arabicus",615398594,"Logar valley, Dasht-e-Sakawa; E Afghanistan/Velāyat-e Lowgar","AFG",NA,1971,"PRESERVED_SPECIMEN","GEODETIC_DATUM_ASSUMED_WGS84;CONTINENT_DERIVED_FROM_COORDINATES;INSTITUTION_MATCH_NONE"
-112.3274986,33.8021119,"Schismus arabicus",2270673221,"","USA",NA,2005,"PRESERVED_SPECIMEN","COORDINATE_REPROJECTED;CONTINENT_DERIVED_FROM_COORDINATES;INSTITUTION_MATCH_FUZZY;INSTITUTION_COLLECTION_MISMATCH"
-112.6735043,33.4989183,"Schismus arabicus",2270678344,"","USA",NA,2005,"PRESERVED_SPECIMEN","COORDINATE_REPROJECTED;CONTINENT_DERIVED_FROM_COORDINATES;INSTITUTION_MATCH_FUZZY;INSTITUTION_COLLECTION_MISMATCH"
-112.646,33.8475,"Schismus arabicus",2270574810,"Near dry wash in vicinity of Hassayampa River.","USA",700,1979,"PRESERVED_SPECIMEN","GEODETIC_DATUM_ASSUMED_WGS84;CONTINENT_DERIVED_FROM_COORDINATES;INSTITUTION_MATCH_FUZZY;INSTITUTION_COLLECTION_MISMATCH"
-114.389,32.6094,"Schismus arabicus",2270574773,"Yuma desert, 2 km west of Fortuna 1 Peak, 8.5 km northwest of Fortuna Mine.","USA",NA,1995,"PRESERVED_SPECIMEN","GEODETIC_DATUM_ASSUMED_WGS84;CONTINENT_DERIVED_FROM_COORDINATES;INSTITUTION_MATCH_FUZZY;INSTITUTION_COLLECTION_MISMATCH"
-114.57,35.1992,"Schismus arabicus",2270574489,"At west end of Cottonwood Road (immediately across Lake Mohave from Cottonwood Landing, Clark Co., Nevada.)","USA",NA,1993,"PRESERVED_SPECIMEN","GEODETIC_DATUM_ASSUMED_WGS84;CONTINENT_DERIVED_FROM_COORDINATES;INSTITUTION_MATCH_FUZZY;INSTITUTION_COLLECTION_MISMATCH"
-114.432774,36.715808,"Schismus arabicus",2270576433,"Mohave Desert: Mormon Mesa, off Carp-Elgin Road ca 2 miles S of Interstate 15, ca 21 miles WSW of Mesquite.","USA",20,2013,"PRESERVED_SPECIMEN","GEODETIC_DATUM_ASSUMED_WGS84;CONTINENT_DERIVED_FROM_COORDINATES;INSTITUTION_MATCH_FUZZY;INSTITUTION_COLLECTION_MISMATCH"
-111.5816808,33.4656128,"Schismus arabicus",2270645310,"Usery Mountain Regional Park about 100m from Meridian Trailhead","USA",NA,2007,"PRESERVED_SPECIMEN","COORDINATE_REPROJECTED;CONTINENT_DERIVED_FROM_COORDINATES;INSTITUTION_MATCH_FUZZY;INSTITUTION_COLLECTION_MISMATCH"
-114.07563,34.82848,"Schismus arabicus",2270491398,"Dutch Flats; west of Hualapai Mountain range, north side of Alamo Rd (Hwy 15) about 5 miles as the crow flies southeast of Yucca","USA",NA,2017,"PRESERVED_SPECIMEN","GEODETIC_DATUM_ASSUMED_WGS84;CONTINENT_DERIVED_FROM_COORDINATES;INSTITUTION_MATCH_FUZZY;INSTITUTION_COLLECTION_MISMATCH"
-112.0104911,33.8207133,"Schismus arabicus",2270662495,"","USA",NA,2005,"PRESERVED_SPECIMEN","COORDINATE_REPROJECTED;CONTINENT_DERIVED_FROM_COORDINATES;INSTITUTION_MATCH_FUZZY;INSTITUTION_COLLECTION_MISMATCH"
-110.297,32.1525,"Schismus arabicus",2270689123,"San Pedro River floodplain at the upstream end of Three Links Farm Preserve","USA",NA,2006,"PRESERVED_SPECIMEN","GEODETIC_DATUM_ASSUMED_WGS84;CONTINENT_DERIVED_FROM_COORDINATES;INSTITUTION_MATCH_FUZZY;INSTITUTION_COLLECTION_MISMATCH"
-111.532,32.6471,"Schismus arabicus",2270689599,"Santa Cruz River floodplain near Pretzer Rd and the Picacho Highway","USA",NA,2006,"PRESERVED_SPECIMEN","GEODETIC_DATUM_ASSUMED_WGS84;CONTINENT_DERIVED_FROM_COORDINATES;INSTITUTION_MATCH_FUZZY;INSTITUTION_COLLECTION_MISMATCH"
-112.894,33.7036,"Schismus arabicus",2270573957,"Vicinity of Coyote Wash on Hassayampa Plain","USA",700,1979,"PRESERVED_SPECIMEN","GEODETIC_DATUM_ASSUMED_WGS84;CONTINENT_DERIVED_FROM_COORDINATES;INSTITUTION_MATCH_FUZZY;INSTITUTION_COLLECTION_MISMATCH"
-113.819,35.0874,"Schismus arabicus",2270573879,"NE side of Hualapai Mountains along Blake Ranch Road (formerly Peacock Mountain Road). Across from Laughlin Ranch headquarters.","USA",700,1986,"PRESERVED_SPECIMEN","GEODETIC_DATUM_ASSUMED_WGS84;CONTINENT_DERIVED_FROM_COORDINATES;INSTITUTION_MATCH_FUZZY;INSTITUTION_COLLECTION_MISMATCH"
-111.469311,33.470725,"Schismus arabicus",2270703408,"Arizona Uplands: SW Superstition Mountains, Crosscut Trail, ca 0.5 miles NE of Lost Dutchman State Park, 4.5 miles NE of US 60/89 at Apache Junction.","USA",NA,2015,"PRESERVED_SPECIMEN","GEODETIC_DATUM_ASSUMED_WGS84;CONTINENT_DERIVED_FROM_COORDINATES;INSTITUTION_MATCH_FUZZY;INSTITUTION_COLLECTION_MISMATCH"
-112.7185055,33.5096178,"Schismus arabicus",2270672312,"","USA",NA,2005,"PRESERVED_SPECIMEN","COORDINATE_REPROJECTED;CONTINENT_DERIVED_FROM_COORDINATES;INSTITUTION_MATCH_FUZZY;INSTITUTION_COLLECTION_MISMATCH"
-112.7415082,33.7559107,"Schismus arabicus",2270673200,"","USA",NA,2005,"PRESERVED_SPECIMEN","COORDINATE_REPROJECTED;CONTINENT_DERIVED_FROM_COORDINATES;INSTITUTION_MATCH_FUZZY;INSTITUTION_COLLECTION_MISMATCH"
-113.288,34.328,"Schismus arabicus",2270686780,"Soil propagule bank study. Soil removed from Santa Maria River near Anderson Mine.","USA",NA,2007,"PRESERVED_SPECIMEN","GEODETIC_DATUM_ASSUMED_WGS84;CONTINENT_DERIVED_FROM_COORDINATES;INSTITUTION_MATCH_FUZZY;INSTITUTION_COLLECTION_MISMATCH"
-113.634,34.1366,"Schismus arabicus",2270574443,"E end of the Buckskin Mountains","USA",700,1979,"PRESERVED_SPECIMEN","GEODETIC_DATUM_ASSUMED_WGS84;CONTINENT_DERIVED_FROM_COORDINATES;INSTITUTION_MATCH_FUZZY;INSTITUTION_COLLECTION_MISMATCH"
-110.067,31.7128,"Schismus arabicus",2270573853,"Tombstone. 101 Toughnut Street.","USA",NA,1992,"PRESERVED_SPECIMEN","GEODETIC_DATUM_ASSUMED_WGS84;CONTINENT_DERIVED_FROM_COORDINATES;INSTITUTION_MATCH_FUZZY;INSTITUTION_COLLECTION_MISMATCH"
-114.098693,34.281021,"Schismus arabicus",2270574577,"Slopes of Buckskin Mountains east of Hill Crest Bay development. Parked trucks at Hill Crest Bay, walked up slopes to flat top of Buckskin Mountains Plant taken on top.","USA",1000,1973,"PRESERVED_SPECIMEN","GEODETIC_DATUM_ASSUMED_WGS84;CONTINENT_DERIVED_FROM_COORDINATES;INSTITUTION_MATCH_FUZZY;INSTITUTION_COLLECTION_MISMATCH"
-114.104,33.1665,"Schismus arabicus",2270575709,"Kofa National Wildlife Refuge. In open of large, sandy dry wash across Road 53 about 0.25 mi. southwest of Road 56.","USA",700,1986,"PRESERVED_SPECIMEN","GEODETIC_DATUM_ASSUMED_WGS84;CONTINENT_DERIVED_FROM_COORDINATES;INSTITUTION_MATCH_FUZZY;INSTITUTION_COLLECTION_MISMATCH"
-112.4514997,33.5841173,"Schismus arabicus",2270679904,"","USA",NA,2005,"PRESERVED_SPECIMEN","COORDINATE_REPROJECTED;CONTINENT_DERIVED_FROM_COORDINATES;INSTITUTION_MATCH_FUZZY;INSTITUTION_COLLECTION_MISMATCH"
-115.7,30.8667,"Schismus arabicus",2270474408,"Arroyo Valladares near Rancho Valladares; 33.4 miles east of MEX Rte 1 on the Observatory road to Sierra San Pedro Martir and then southeast on a dirt road for 17.1 miles.","MEX",NA,1994,"PRESERVED_SPECIMEN","GEODETIC_DATUM_ASSUMED_WGS84;CONTINENT_DERIVED_FROM_COORDINATES;INSTITUTION_MATCH_FUZZY;INSTITUTION_COLLECTION_MISMATCH"
-110.21,31.861,"Schismus arabicus",2270575745,"San Pedro Riparian National Conservation Area, Upper San Pedro River floodplain, Escalante Crossing","USA",NA,2002,"PRESERVED_SPECIMEN","GEODETIC_DATUM_ASSUMED_WGS84;CONTINENT_DERIVED_FROM_COORDINATES;INSTITUTION_MATCH_FUZZY;INSTITUTION_COLLECTION_MISMATCH"
-113.209,34.3547,"Schismus arabicus",2270690162,"Santa Maria River floodplain west of Hwy 93","USA",NA,2006,"PRESERVED_SPECIMEN","GEODETIC_DATUM_ASSUMED_WGS84;CONTINENT_DERIVED_FROM_COORDINATES;INSTITUTION_MATCH_FUZZY;INSTITUTION_COLLECTION_MISMATCH"
-113.471778,32.098917,"Schismus arabicus",2270458773,"Cabeza Prieta National Wildlife Refuge. West Pinta Sands ca. 1 km south of Camino del Diablo.","USA",NA,2002,"PRESERVED_SPECIMEN","GEODETIC_DATUM_ASSUMED_WGS84;CONTINENT_DERIVED_FROM_COORDINATES;INSTITUTION_MATCH_FUZZY;INSTITUTION_COLLECTION_MISMATCH"
-110.783,32.9842,"Schismus arabicus",2270574186,"San Pedro River floodplain south of San Manuel","USA",NA,2001,"PRESERVED_SPECIMEN","GEODETIC_DATUM_ASSUMED_WGS84;CONTINENT_DERIVED_FROM_COORDINATES;INSTITUTION_MATCH_FUZZY;INSTITUTION_COLLECTION_MISMATCH"
-112.368,34.281,"Schismus arabicus",2270573815,"Grapevine Springs on south side of Santa Maria River.","USA",700,1979,"PRESERVED_SPECIMEN","GEODETIC_DATUM_ASSUMED_WGS84;CONTINENT_DERIVED_FROM_COORDINATES;INSTITUTION_MATCH_FUZZY;INSTITUTION_COLLECTION_MISMATCH"
-112.158,32.7167,"Schismus arabicus",2270574396,"Pinal County: Sonoran Desert National Monument. Upper bajada ca. 1.5 mile west Table Top Mountain, campground and trailhead; USGS digital 7.5 map, NAD 27.","USA",NA,2001,"PRESERVED_SPECIMEN","GEODETIC_DATUM_ASSUMED_WGS84;CONTINENT_DERIVED_FROM_COORDINATES;INSTITUTION_MATCH_FUZZY;INSTITUTION_COLLECTION_MISMATCH"
-111.674,33.8125,"Schismus arabicus",2270661538,"Fort McDowell below Highway 87 bridge","USA",NA,2001,"PRESERVED_SPECIMEN","GEODETIC_DATUM_ASSUMED_WGS84;CONTINENT_DERIVED_FROM_COORDINATES;INSTITUTION_MATCH_FUZZY;INSTITUTION_COLLECTION_MISMATCH"
-112.1714914,33.3951243,"Schismus arabicus",2270674164,"","USA",NA,2005,"PRESERVED_SPECIMEN","COORDINATE_REPROJECTED;CONTINENT_DERIVED_FROM_COORDINATES;INSTITUTION_MATCH_FUZZY;INSTITUTION_COLLECTION_MISMATCH"
-110.566,31.9823,"Schismus arabicus",2270690257,"Cienega Creek floodplain just south of I10 at Marsh Station Rd exit","USA",NA,2006,"PRESERVED_SPECIMEN","GEODETIC_DATUM_ASSUMED_WGS84;CONTINENT_DERIVED_FROM_COORDINATES;INSTITUTION_MATCH_FUZZY;INSTITUTION_COLLECTION_MISMATCH"
-113.667,32.2947,"Schismus arabicus",2270573936,"Tule Desert, Cabeza Prieta National Wildlife Refuge, about 2 miles NW of Christmas Pass and near the intersection of the road to Heart Tank and the Tacna Road.","USA",NA,2002,"PRESERVED_SPECIMEN","GEODETIC_DATUM_ASSUMED_WGS84;CONTINENT_DERIVED_FROM_COORDINATES;INSTITUTION_MATCH_FUZZY;INSTITUTION_COLLECTION_MISMATCH"
-111.217,32.2213,"Schismus arabicus",2270651343,"Saguaro National Monument about 17 mi. west of Tucson.","USA",NA,1978,"PRESERVED_SPECIMEN","GEODETIC_DATUM_ASSUMED_WGS84;CONTINENT_DERIVED_FROM_COORDINATES;INSTITUTION_MATCH_FUZZY;INSTITUTION_COLLECTION_MISMATCH"
-112.4515014,33.7812118,"Schismus arabicus",2270670175,"","USA",NA,2005,"PRESERVED_SPECIMEN","COORDINATE_REPROJECTED;CONTINENT_DERIVED_FROM_COORDINATES;INSTITUTION_MATCH_FUZZY;INSTITUTION_COLLECTION_MISMATCH"
-112.822,32.8933,"Schismus arabicus",2270575998,"3.7km south of Smurr, 10km SW of Gila Bend; cattle ''tank'' with small Prosopis velutina bosque; Smurr 7.5' USGS topographic quadrangle","USA",NA,2003,"PRESERVED_SPECIMEN","CONTINENT_DERIVED_FROM_COORDINATES;INSTITUTION_MATCH_FUZZY;INSTITUTION_COLLECTION_MISMATCH"
-114.814114,35.241149,"Schismus arabicus",2270574323,"Mohave Desert: Piute Valley, flats on W base of Newberry Mountains, ca 2 miles E of US Hwy 95 off road to Christmas Tree Pass in Newberry Mountains, ca 16 mi SSE of Searchlight.","USA",NA,2013,"PRESERVED_SPECIMEN","GEODETIC_DATUM_ASSUMED_WGS84;CONTINENT_DERIVED_FROM_COORDINATES;INSTITUTION_MATCH_FUZZY;INSTITUTION_COLLECTION_MISMATCH"
-113.943473,37.122906,"Schismus arabicus",2270695042,"Mohave Desert: west base of Beaver Dam Mountains, base of ridge S of Reber Wash, ca 0.3 miles W of Reber Spring, 1.3 miles S of Indian Canyon, ca 4.5 miles NW of Castle Cliff. T42S R19W S23 NE4 of NW4","USA",NA,2013,"PRESERVED_SPECIMEN","GEODETIC_DATUM_ASSUMED_WGS84;CONTINENT_DERIVED_FROM_COORDINATES;INSTITUTION_MATCH_FUZZY;INSTITUTION_COLLECTION_MISMATCH"
-111.602246,33.587908,"Schismus arabicus",2270651663,"Along Bush Hwy, ca. 18 mi. northeast of Tempe.","USA",400,1982,"PRESERVED_SPECIMEN","GEODETIC_DATUM_ASSUMED_WGS84;CONTINENT_DERIVED_FROM_COORDINATES;INSTITUTION_MATCH_FUZZY;INSTITUTION_COLLECTION_MISMATCH"
-113.108,33.6434,"Schismus arabicus",2270690319,"Plant germinated in ASU greenhouse in soil collected from Hummingbird Springs Wilderness, near Hummingbird Springs on 1/27/06.","USA",NA,2006,"PRESERVED_SPECIMEN","GEODETIC_DATUM_ASSUMED_WGS84;CONTINENT_DERIVED_FROM_COORDINATES;INSTITUTION_MATCH_FUZZY;INSTITUTION_COLLECTION_MISMATCH"
-113.26,32.9,"Schismus arabicus",2270573643,"5 km northwest of I-8 along Sentinel to Agua Caliente road.","USA",200,1988,"PRESERVED_SPECIMEN","GEODETIC_DATUM_ASSUMED_WGS84;CONTINENT_DERIVED_FROM_COORDINATES;INSTITUTION_MATCH_FUZZY;INSTITUTION_COLLECTION_MISMATCH"
-112.3424957,33.4205226,"Schismus arabicus",2270673432,"","USA",NA,2005,"PRESERVED_SPECIMEN","COORDINATE_REPROJECTED;CONTINENT_DERIVED_FROM_COORDINATES;INSTITUTION_MATCH_FUZZY;INSTITUTION_COLLECTION_MISMATCH"
-112.379616,33.033939,"Schismus arabicus",2270575996,"N of Maricopa Road, 6 mi. west of Mobile.","USA",500,1982,"PRESERVED_SPECIMEN","GEODETIC_DATUM_ASSUMED_WGS84;CONTINENT_DERIVED_FROM_COORDINATES;INSTITUTION_MATCH_FUZZY;INSTITUTION_COLLECTION_MISMATCH"
-117.8247,36.0317,"Schismus arabicus",2270496883,"Ca. 23 air miles south-southeast of Olancha, on west side of Sugarloaf Mountain","USA",NA,1979,"PRESERVED_SPECIMEN","GEODETIC_DATUM_ASSUMED_WGS84;CONTINENT_DERIVED_FROM_COORDINATES;INSTITUTION_MATCH_FUZZY;INSTITUTION_COLLECTION_MISMATCH"
-111.7684808,33.2854298,"Schismus arabicus",2270674502,"","USA",NA,2005,"PRESERVED_SPECIMEN","COORDINATE_REPROJECTED;CONTINENT_DERIVED_FROM_COORDINATES;INSTITUTION_MATCH_FUZZY;INSTITUTION_COLLECTION_MISMATCH"
-113.206,33.7878,"Schismus arabicus",2270691448,"In Pump Mine Wash, near Eagle Eye Road and Hummingbird Springs Wilderness.","USA",NA,2007,"PRESERVED_SPECIMEN","GEODETIC_DATUM_ASSUMED_WGS84;CONTINENT_DERIVED_FROM_COORDINATES;INSTITUTION_MATCH_FUZZY;INSTITUTION_COLLECTION_MISMATCH"
-112.14,32.9563,"Schismus arabicus",2270576269,"unnamed wash just southeast of Haley Hills, southwest of town of Maricopa","USA",NA,2005,"PRESERVED_SPECIMEN","GEODETIC_DATUM_ASSUMED_WGS84;CONTINENT_DERIVED_FROM_COORDINATES;INSTITUTION_MATCH_FUZZY;INSTITUTION_COLLECTION_MISMATCH"
-114.78589,29.76914,"Schismus arabicus",2270489874,"Approximately 7 miles NNW of Catavina; west of Hwy 1","MEX",NA,2017,"PRESERVED_SPECIMEN","GEODETIC_DATUM_ASSUMED_WGS84;CONTINENT_DERIVED_FROM_COORDINATES;INSTITUTION_MATCH_FUZZY;INSTITUTION_COLLECTION_MISMATCH"
-116.26066,35.09646,"Schismus arabicus",2270493067,"just south of I 15 freeway along Basin Road; 16.5 miles west of Baker, CA","USA",NA,2017,"PRESERVED_SPECIMEN","GEODETIC_DATUM_ASSUMED_WGS84;CONTINENT_DERIVED_FROM_COORDINATES;INSTITUTION_MATCH_FUZZY;INSTITUTION_COLLECTION_MISMATCH"
-112.1574904,33.3161266,"Schismus arabicus",2270671530,"","USA",NA,2005,"PRESERVED_SPECIMEN","COORDINATE_REPROJECTED;CONTINENT_DERIVED_FROM_COORDINATES;INSTITUTION_MATCH_FUZZY;INSTITUTION_COLLECTION_MISMATCH"
-71.163889,-29.341944,"Schismus arabicus",1936603251,"Coquimbo (Región IV), pr. Los Choros","CHL",NA,2001,"PRESERVED_SPECIMEN","COORDINATE_ROUNDED;GEODETIC_DATUM_ASSUMED_WGS84;CONTINENT_DERIVED_FROM_COORDINATES;INSTITUTION_MATCH_FUZZY;COLLECTION_MATCH_FUZZY"
44.22,24.55,"Schismus arabicus",912552046,"Dawadimi Camp","SAU",0.2,1983,"PRESERVED_SPECIMEN","GEODETIC_DATUM_ASSUMED_WGS84;CONTINENT_DERIVED_FROM_COORDINATES;INSTITUTION_MATCH_FUZZY;COLLECTION_MATCH_FUZZY"
