"lon","lat","species","gbifID","locality","countryCode","coordinateUncertaintyInMeters","year","basisOfRecord","issue"
51.83,34.83,"Schismus arabicus",912552011,"Sud de Teheran","IRN",0.2,1972,"PRESERVED_SPECIMEN","GEODETIC_DATUM_ASSUMED_WGS84;CONTINENT_DERIVED_FROM_COORDINATES;INSTITUTION_MATCH_FUZZY;COLLECTION_MATCH_FUZZY"
57.3,32.92,"Schismus arabicus",912551992,"15km au sud de l'oasis de Pervadeh, au sud de Tabas, entre le Dasht-a-Kavir et le Dasht-e-Lut","IRN",0.2,1972,"PRESERVED_SPECIMEN","GEODETIC_DATUM_ASSUMED_WGS84;CONTINENT_DERIVED_FROM_COORDINATES;INSTITUTION_MATCH_FUZZY;COLLECTION_MATCH_FUZZY"
52.75,34.07,"Schismus arabicus",912552036,"Entre Teheran et Tabas, au S.O. du Dasht-e-Kavir","IRN",0.2,1972,"PRESERVED_SPECIMEN","GEODETIC_DATUM_ASSUMED_WGS84;CONTINENT_DERIVED_FROM_COORDINATES;INSTITUTION_MATCH_FUZZY;COLLECTION_MATCH_FUZZY"
-118.9345328,34.0487266,"Schismus arabicus",3406820380,"Santa Monica Mountains; Leo Carrillo State Park; campground area","USA",400,1979,"PRESERVED_SPECIMEN","COORDINATE_REPROJECTED;CONTINENT_DERIVED_FROM_COORDINATES;INSTITUTION_MATCH_FUZZY"
-117.983648,34.521129,"Schismus arabicus",3406875813,"Mojave Desert; Antelope Valley; Little Rock, State Highway 138","USA",1500,1978,"PRESERVED_SPECIMEN","CONTINENT_DERIVED_FROM_COORDINATES;INSTITUTION_MATCH_FUZZY"
121.793136,-32.20705,"Schismus arabicus",4016894561,"14M N of Norseman on Coolgardie Rd.","AUS",2000,1965,"PRESERVED_SPECIMEN","COORDINATE_ROUNDED;CONTINENT_DERIVED_FROM_COORDINATES;INSTITUTION_MATCH_FUZZY;COLLECTION_MATCH_NONE"
-116.6699,38.8223,"Schismus arabicus",1931082957,"1.6 road miles S of Oasis Valley Road on road on E side of hills on E side of the Amargosa River.","USA",NA,2005,"PRESERVED_SPECIMEN","COLLECTION_MATCH_FUZZY"
-111.166586,32.29636,"Schismus arabicus",1931147317,"Suaragho National Monument about 17 miles west of Tucson","USA",NA,1978,"PRESERVED_SPECIMEN","COLLECTION_MATCH_FUZZY"
120.516667,-28.066667,"Schismus arabicus",2829858208,"6 km S of Agnew, Leonora Road.","AUS",1000,1978,"PRESERVED_SPECIMEN","CONTINENT_DERIVED_FROM_COORDINATES;INSTITUTION_MATCH_FUZZY;COLLECTION_MATCH_FUZZY"
119,-29.149722,"Schismus arabicus",2853942550,"Northern boundary gate of Lake Barlee Station with Youanmery or Youangarra Stations","AUS",3000,1970,"PRESERVED_SPECIMEN","COORDINATE_ROUNDED;CONTINENT_DERIVED_FROM_COORDINATES;INSTITUTION_MATCH_FUZZY;COLLECTION_MATCH_FUZZY"
132.066667,-30.983333,"Schismus arabicus",2853908570,"54.5 km N of Colona Homestead","AUS",3000,1984,"PRESERVED_SPECIMEN","COORDINATE_ROUNDED;CONTINENT_DERIVED_FROM_COORDINATES;INSTITUTION_MATCH_FUZZY;COLLECTION_MATCH_FUZZY"
140.56589,-32.10264,"Schismus arabicus",2445915214,"","AUS",50,2010,"HUMAN_OBSERVATION","CONTINENT_DERIVED_FROM_COORDINATES"
139.3657,-30.20392,"Schismus arabicus",1085450820,"","AUS",50,2009,"HUMAN_OBSERVATION","CONTINENT_DERIVED_FROM_COORDINATES"
-106.51,32.011667,"Schismus arabicus",1703278012,"Anthony Gap, 3.4 road miles WSW of junction of Highway 213 (War Road) with State Highway 404","USA",NA,1983,"PRESERVED_SPECIMEN","COORDINATE_ROUNDED;GEODETIC_DATUM_ASSUMED_WGS84;GEODETIC_DATUM_INVALID;CONTINENT_DERIVED_FROM_COORDINATES;INSTITUTION_MATCH_FUZZY;COLLECTION_MATCH_FUZZY"
-106.611586,32.207055,"Schismus arabicus",3413533641,"1 air mile NW from top of Pyramid Peak, Bishop Cap Hills, NW tip","USA",462,1995,"PRESERVED_SPECIMEN","CONTINENT_DERIVED_FROM_COORDINATES;INSTITUTION_MATCH_FUZZY;COLLECTION_MATCH_FUZZY"
-114.205556,32.354167,"Schismus arabicus",1889155273,"Butler Mountains","USA",NA,1983,"PRESERVED_SPECIMEN","COORDINATE_ROUNDED;GEODETIC_DATUM_ASSUMED_WGS84;GEODETIC_DATUM_INVALID;CONTINENT_DERIVED_FROM_COORDINATES;INSTITUTION_MATCH_FUZZY;COLLECTION_MATCH_FUZZY"
-106.1212,32.3965,"Schismus arabicus",1889162698,"Jarilla Mountains, S end of mountains at Old Quarry","USA",NA,2010,"PRESERVED_SPECIMEN","GEODETIC_DATUM_ASSUMED_WGS84;GEODETIC_DATUM_INVALID;CONTINENT_DERIVED_FROM_COORDINATES;INSTITUTION_MATCH_FUZZY;COLLECTION_MATCH_FUZZY"
-119.27184,34.92982,"Schismus arabicus",2459171957,"(WTR/GV) San Emigdio Range, Wind Wolves Preserve, 4.16 air-miles northwest Brush Mountain","USA",3,2018,"PRESERVED_SPECIMEN","CONTINENT_DERIVED_FROM_COORDINATES;INSTITUTION_MATCH_FUZZY"
-118.159112,37.252843,"Schismus arabicus",1930311396,"White Mountains. W base of Black Mountain, 2.5 mi. S77°W of its summit. Owens Valley drainage.","USA",NA,1986,"PRESERVED_SPECIMEN","COLLECTION_MATCH_FUZZY"
45.459893,45.5217,"Schismus arabicus",1697390563,"","RUS",3000,1997,"PRESERVED_SPECIMEN","CONTINENT_DERIVED_FROM_COORDINATES;INSTITUTION_MATCH_FUZZY;COLLECTION_MATCH_FUZZY"
71.244167,41.4275,"Schismus arabicus",1798977648,"","KGZ",NA,2016,"PRESERVED_SPECIMEN","COORDINATE_ROUNDED;CONTINENT_DERIVED_FROM_COORDINATES;INSTITUTION_MATCH_FUZZY;COLLECTION_MATCH_FUZZY"
-114.120698,36.774715,"Schismus arabicus",1929396213,"Virgin Valley, Rte. 170, Bunkerville, S First/West St.","USA",NA,1984,"PRESERVED_SPECIMEN","COLLECTION_MATCH_FUZZY"
-112.0637,34.2457,"Schismus arabicus",3091215496,"Bloody Basin Road at Silver Creek","USA",NA,1998,"PRESERVED_SPECIMEN","GEODETIC_DATUM_ASSUMED_WGS84;CONTINENT_DERIVED_FROM_COORDINATES;INSTITUTION_MATCH_FUZZY;COLLECTION_MATCH_NONE"
-114.0133,36.3602,"Schismus arabicus",3091237941,"Parashant National Monument, Grand Canyon. Black Wash.","USA",1250,2003,"PRESERVED_SPECIMEN","GEODETIC_DATUM_ASSUMED_WGS84;CONTINENT_DERIVED_FROM_COORDINATES;INSTITUTION_MATCH_FUZZY;COLLECTION_MATCH_NONE"
-110.78583,33.10397,"Schismus arabicus",3091207770,"20 mi S of Globe","USA",NA,1965,"PRESERVED_SPECIMEN","GEODETIC_DATUM_ASSUMED_WGS84;CONTINENT_DERIVED_FROM_COORDINATES;INSTITUTION_MATCH_FUZZY;COLLECTION_MATCH_NONE"
-113.3,33.017134,"Schismus arabicus",3091225402,"5 km NW of I-8 along Sentinal to Agua Caliente Road, especially along roadside and in shallow draws","USA",NA,1988,"PRESERVED_SPECIMEN","GEODETIC_DATUM_ASSUMED_WGS84;CONTINENT_DERIVED_FROM_COORDINATES;INSTITUTION_MATCH_FUZZY;COLLECTION_MATCH_NONE"
-114.7353,36.00117,"Schismus arabicus",3091215683,"Sugarloaf Canyon. Lake Mead National Recreation Area","USA",NA,2003,"PRESERVED_SPECIMEN","GEODETIC_DATUM_ASSUMED_WGS84;CONTINENT_DERIVED_FROM_COORDINATES;DIFFERENT_OWNER_INSTITUTION"
-111.313383,35.710983,"Schismus arabicus",3091227307,"East edge of the gravel pit, floodplain of the Little Colorado River near Back Point east of Gray Mountain","USA",NA,2016,"PRESERVED_SPECIMEN","GEODETIC_DATUM_ASSUMED_WGS84;CONTINENT_DERIVED_FROM_COORDINATES;INSTITUTION_MATCH_FUZZY;COLLECTION_MATCH_NONE"
-111.401618,37.103369,"Schismus arabicus",3091285812,"Kaiparowits Plateau: Ahlstrom Point ca 1 mile W of Gunsight Canyon, 0.8 miles E of head of Box Canyon. T43S R5E S6 SE4 of NE4 of NE4","USA",NA,2011,"PRESERVED_SPECIMEN","GEODETIC_DATUM_ASSUMED_WGS84;CONTINENT_DERIVED_FROM_COORDINATES;INSTITUTION_MATCH_FUZZY;COLLECTION_MATCH_NONE"
-114.43102,36.35047,"Schismus arabicus",3091215684,"Roger's Bay. Lake Mead National Recreation Area;","USA",NA,2003,"PRESERVED_SPECIMEN","GEODETIC_DATUM_ASSUMED_WGS84;CONTINENT_DERIVED_FROM_COORDINATES;INSTITUTION_MATCH_FUZZY;COLLECTION_MATCH_NONE"
-111.36985,35.755467,"Schismus arabicus",3091304999,"CO Bar Ranch north of Black Point and 7 miles east of Gray Mountain","USA",NA,2014,"PRESERVED_SPECIMEN","GEODETIC_DATUM_ASSUMED_WGS84;CONTINENT_DERIVED_FROM_COORDINATES;INSTITUTION_MATCH_FUZZY;COLLECTION_MATCH_NONE"
-115.795015,33.387716,"Schismus arabicus",3091285760,"5 km SE of Imperial-Riverside Co. line along Rte 111.","USA",NA,1988,"PRESERVED_SPECIMEN","CONTINENT_DERIVED_FROM_COORDINATES;INSTITUTION_MATCH_FUZZY;COLLECTION_MATCH_NONE"
-112.50315,32.98093,"Schismus arabicus",3091215391,"1/2 mi S of mi. marker 11 on SR 238;","USA",NA,2003,"PRESERVED_SPECIMEN","GEODETIC_DATUM_ASSUMED_WGS84;CONTINENT_DERIVED_FROM_COORDINATES;INSTITUTION_MATCH_FUZZY;COLLECTION_MATCH_NONE"
-113.2943,36.1434,"Schismus arabicus",3091237822,"Lake Mead National Recreation Area, Whitmore Overlook Area.","USA",1250,2003,"PRESERVED_SPECIMEN","GEODETIC_DATUM_ASSUMED_WGS84;CONTINENT_DERIVED_FROM_COORDINATES;INSTITUTION_MATCH_FUZZY;COLLECTION_MATCH_NONE"
-111.379706,32.383273,"Schismus arabicus",3091207822,"7 mi E of Silver Bell","USA",NA,1972,"PRESERVED_SPECIMEN","GEODETIC_DATUM_ASSUMED_WGS84;CONTINENT_DERIVED_FROM_COORDINATES;INSTITUTION_MATCH_FUZZY;COLLECTION_MATCH_NONE"
-114.46608,35.40407,"Schismus arabicus",3091219294,"5 mi S of Cottonwood Road on Lone Cabin Wash Road","USA",NA,2008,"PRESERVED_SPECIMEN","GEODETIC_DATUM_ASSUMED_WGS84;CONTINENT_DERIVED_FROM_COORDINATES;INSTITUTION_MATCH_FUZZY;COLLECTION_MATCH_NONE"
-111.830972,34.814556,"Schismus arabicus",3091228746,"Red Rock State Park, Twin Cypress picnic area","USA",NA,2007,"PRESERVED_SPECIMEN","GEODETIC_DATUM_ASSUMED_WGS84;CONTINENT_DERIVED_FROM_COORDINATES;INSTITUTION_MATCH_FUZZY;COLLECTION_MATCH_NONE"
-113.743056,34.643056,"Schismus arabicus",3091194523,"SW slope of Aubrey Peak ca. 9 mi W of Wikiup off of jeep trail accessed from Chicken Springs Rd.","USA",NA,2006,"PRESERVED_SPECIMEN","GEODETIC_DATUM_ASSUMED_WGS84;CONTINENT_DERIVED_FROM_COORDINATES;INSTITUTION_MATCH_FUZZY;COLLECTION_MATCH_NONE"
-113.45,34.533333,"Schismus arabicus",3091197358,"Burro Creek Campground off Hwy 93 ca. 1 mi down river","USA",NA,2001,"PRESERVED_SPECIMEN","GEODETIC_DATUM_ASSUMED_WGS84;CONTINENT_DERIVED_FROM_COORDINATES;INSTITUTION_MATCH_FUZZY;COLLECTION_MATCH_NONE"
-114.264167,36.6835,"Schismus arabicus",3091264643,"About 15 miles SW of Mesquite and 1/4 mile south of Gold Butte Road.","USA",NA,2011,"PRESERVED_SPECIMEN","GEODETIC_DATUM_ASSUMED_WGS84;CONTINENT_DERIVED_FROM_COORDINATES;INSTITUTION_MATCH_FUZZY;COLLECTION_MATCH_NONE"
-113.08583,32.39389,"Schismus arabicus",3091225380,"Cabeza Prieta National Wildlife Refuge, Growler Mountains SW of Ajo, lower slopes of Growler Mountain NE of Charlie Bell Pass, tributaries to Daniel's Arroyo","USA",NA,1992,"PRESERVED_SPECIMEN","GEODETIC_DATUM_ASSUMED_WGS84;CONTINENT_DERIVED_FROM_COORDINATES;INSTITUTION_MATCH_FUZZY;COLLECTION_MATCH_NONE"
-114.505232,35.35915,"Schismus arabicus",3091254000,"Callea Spring, E fork Portland Wash, Portland Mine Road","USA",NA,2010,"PRESERVED_SPECIMEN","GEODETIC_DATUM_ASSUMED_WGS84;CONTINENT_DERIVED_FROM_COORDINATES;INSTITUTION_MATCH_FUZZY;COLLECTION_MATCH_NONE"
-112.93633,32.20678,"Schismus arabicus",3091225404,"Cabeza Prieta National Wildlife Refuge, Scarface Mountain, S-facing edge of drainage","USA",NA,1992,"PRESERVED_SPECIMEN","GEODETIC_DATUM_ASSUMED_WGS84;CONTINENT_DERIVED_FROM_COORDINATES;INSTITUTION_MATCH_FUZZY;COLLECTION_MATCH_NONE"
-111.809713,36.213563,"Schismus arabicus",3091291220,"COLORADO RIVER MILE 60.2R, 60 MILE CAMP , GRAND CANYON NP","USA",NA,2008,"PRESERVED_SPECIMEN","CONTINENT_DERIVED_FROM_COORDINATES;DIFFERENT_OWNER_INSTITUTION"
-110.78843,32.443131,"Schismus arabicus",3091207773,"Mount Lemmon","USA",1800,1965,"PRESERVED_SPECIMEN","CONTINENT_DERIVED_FROM_COORDINATES;INSTITUTION_MATCH_FUZZY;COLLECTION_MATCH_NONE"
-113.574997,34.263332,"Schismus arabicus",3091292065,"End of Alamo Road, north shore of Alamo Lake.","USA",NA,2001,"PRESERVED_SPECIMEN","COORDINATE_ROUNDED;GEODETIC_DATUM_ASSUMED_WGS84;CONTINENT_DERIVED_FROM_COORDINATES;INSTITUTION_MATCH_FUZZY;COLLECTION_MATCH_NONE"
-111.8,36.13333,"Schismus arabicus",3091215498,"Grand Canyon National Park, river mile 67L, between Tanner and Cardenas","USA",NA,1993,"PRESERVED_SPECIMEN","GEODETIC_DATUM_ASSUMED_WGS84;CONTINENT_DERIVED_FROM_COORDINATES;DIFFERENT_OWNER_INSTITUTION"
-113.54833,32.15222,"Schismus arabicus",3091225378,"Cabeza Prieta National Wildlife Refuge, Las Playas Quad. 7.5, Pinta Sands","USA",NA,1992,"PRESERVED_SPECIMEN","GEODETIC_DATUM_ASSUMED_WGS84;CONTINENT_DERIVED_FROM_COORDINATES;INSTITUTION_MATCH_FUZZY;COLLECTION_MATCH_NONE"
-110.5505259,37.2134488,"Schismus arabicus",3091264721,"Navajo Nation. Northern tip of No Mans Mesa, between Copper and Nokai canyons","USA",7,2005,"PRESERVED_SPECIMEN","COORDINATE_REPROJECTED;CONTINENT_DERIVED_FROM_COORDINATES;INSTITUTION_MATCH_FUZZY;COLLECTION_MATCH_NONE"
-114.421806,35.567472,"Schismus arabicus",3091218955,"Black Mountains, 42 mi N of Kingman; W of Highway 93, road to Cottonwood Springs; W 1.5 mi in canyon/wash, .5 mi past dam near Cottonwood Spring","USA",NA,2008,"PRESERVED_SPECIMEN","GEODETIC_DATUM_ASSUMED_WGS84;CONTINENT_DERIVED_FROM_COORDINATES;INSTITUTION_MATCH_FUZZY;COLLECTION_MATCH_NONE"
-110.306483,35.155733,"Schismus arabicus",3091222579,"About 10 miles north of Joseph City and 0.75 mile west of the Porter Ranch Road crossing of Cottonwood Wash","USA",NA,2016,"PRESERVED_SPECIMEN","GEODETIC_DATUM_ASSUMED_WGS84;CONTINENT_DERIVED_FROM_COORDINATES;INSTITUTION_MATCH_FUZZY;COLLECTION_MATCH_NONE"
-111.76667,36.63333,"Schismus arabicus",3091215494,"Grand Canyon National Park, river mile 20.5R, North Canyon along path in DF","USA",NA,1993,"PRESERVED_SPECIMEN","GEODETIC_DATUM_ASSUMED_WGS84;CONTINENT_DERIVED_FROM_COORDINATES;DIFFERENT_OWNER_INSTITUTION"
-109.61007,37.26125,"Schismus arabicus",3091196955,"Sand Island Campground, near Bluff,","USA",NA,2003,"PRESERVED_SPECIMEN","GEODETIC_DATUM_ASSUMED_WGS84;CONTINENT_DERIVED_FROM_COORDINATES;INSTITUTION_MATCH_FUZZY;COLLECTION_MATCH_NONE"
-114.032333,36.901167,"Schismus arabicus",3091264677,"Sand Hollow Wash, 6 miles NW of Littlefield.","USA",NA,2011,"PRESERVED_SPECIMEN","GEODETIC_DATUM_ASSUMED_WGS84;CONTINENT_DERIVED_FROM_COORDINATES;INSTITUTION_MATCH_FUZZY;COLLECTION_MATCH_NONE"
-111.13069,36.989335,"Schismus arabicus",3091215495,"Lake Powell, Labyrinth Canyon","USA",NA,1998,"PRESERVED_SPECIMEN","GEODETIC_DATUM_ASSUMED_WGS84;CONTINENT_DERIVED_FROM_COORDINATES;INSTITUTION_MATCH_FUZZY;COLLECTION_MATCH_NONE"
-115.11639,34.80234,"Schismus arabicus",3091255468,"Eastern Mohave Desert, just West of Pinte Mountains and South of I-40 on old Rt. 66 (National Trails Highway)","USA",NA,2005,"PRESERVED_SPECIMEN","GEODETIC_DATUM_ASSUMED_WGS84;CONTINENT_DERIVED_FROM_COORDINATES;INSTITUTION_MATCH_FUZZY;COLLECTION_MATCH_NONE"
-118.1884077,35.108463,"Schismus arabicus",2421682437,"Kern County: 4 miles NW of Mojave.","USA",5644,1955,"PRESERVED_SPECIMEN","COORDINATE_REPROJECTED;COORDINATE_ROUNDED;CONTINENT_DERIVED_FROM_COORDINATES;INSTITUTION_MATCH_FUZZY"
-119.345,36.1718,"Schismus arabicus",2421719951,"Tulare Co.: South of Tulare.","USA",2676,1966,"PRESERVED_SPECIMEN","CONTINENT_DERIVED_FROM_COORDINATES;INSTITUTION_MATCH_FUZZY"
-119.0071295,35.190203,"Schismus arabicus",2421678808,"Kern County: 9 miles N of Mettler on US Hwy. 99.","USA",3231,1967,"PRESERVED_SPECIMEN","COORDINATE_REPROJECTED;COORDINATE_ROUNDED;CONTINENT_DERIVED_FROM_COORDINATES;INSTITUTION_MATCH_FUZZY"
-118.425478,35.754738,"Schismus arabicus",2421720473,"Kern County: Kernville.","USA",1500,1976,"PRESERVED_SPECIMEN","CONTINENT_DERIVED_FROM_COORDINATES;INSTITUTION_MATCH_FUZZY"
-120.437323,35.91375,"Schismus arabicus",2421720774,"Monterey Co.: Cholame Creek, 0.4 mile above Parkfield.","USA",1935,1970,"PRESERVED_SPECIMEN","CONTINENT_DERIVED_FROM_COORDINATES;INSTITUTION_MATCH_FUZZY"
-117.823022,34.505853,"Schismus arabicus",2421720539,"Los Angeles County: North side of State Hwy. 18 and just west of Llano.","USA",500,1978,"PRESERVED_SPECIMEN","CONTINENT_DERIVED_FROM_COORDINATES;INSTITUTION_MATCH_FUZZY"
-120.38247,35.654828,"Schismus arabicus",2421719570,"Kings County: Temblor Range and the Western San Joaquin Valley. Kettleman Hills. Shandon, CA.","USA",2384,1955,"PRESERVED_SPECIMEN","CONTINENT_DERIVED_FROM_COORDINATES;INSTITUTION_MATCH_FUZZY"
-121.12916,36.51722,"Schismus arabicus",2421719833,"San Benito County: 30 miles southwest of Hollister, Gabilan Range. George Melendy Ranch.","USA",1576,1961,"PRESERVED_SPECIMEN","CONTINENT_DERIVED_FROM_COORDINATES;INSTITUTION_MATCH_FUZZY"
-118.0314522,35.0212654,"Schismus arabicus",2421682894,"Kern County, 8.5 miles east of Mojave, along U.S. Highway 466.","USA",4840,1955,"PRESERVED_SPECIMEN","COORDINATE_REPROJECTED;COORDINATE_ROUNDED;CONTINENT_DERIVED_FROM_COORDINATES;INSTITUTION_MATCH_FUZZY"
-117.970709,35.344945,"Schismus arabicus",2421720777,"Kern County: Mojave Desert. Mojave-Randsburg Region. Mouth of Red Rock Canyon.","USA",500,1962,"PRESERVED_SPECIMEN","CONTINENT_DERIVED_FROM_COORDINATES;INSTITUTION_MATCH_FUZZY"
-119.895278,35.2175,"Schismus arabicus",2421773613,"San Luis Obispo County: Carrizo Plain National Monument.","USA",NA,2015,"PRESERVED_SPECIMEN","CONTINENT_DERIVED_FROM_COORDINATES;INSTITUTION_MATCH_FUZZY"
-120.812,36.709,"Schismus arabicus",2421719656,"Fresno Co., NW portion: Panoche Hills just east of Mercy Hot Springs.","USA",4000,1963,"PRESERVED_SPECIMEN","CONTINENT_DERIVED_FROM_COORDINATES;INSTITUTION_MATCH_FUZZY"
-116.652222,33.984722,"Schismus arabicus",2421775731,"Riverside County: Along the west facing wall of Whitewater Canyon, just east of San Gorgonio Pass, north of US HWYs 60 and 70, (modern Interstate 10 in this locality). (Exact location unknown. Coordinates estimated by label maker.)","USA",7500,1962,"PRESERVED_SPECIMEN","CONTINENT_DERIVED_FROM_COORDINATES;INSTITUTION_MATCH_FUZZY"
-120.078559,35.857618,"Schismus arabicus",2421720287,"Kings County: 15 miles south of Avenal. 2.5 miles west Hwy. 33 on Hwy. 41, Pyramid Hills.","USA",1141,1964,"PRESERVED_SPECIMEN","CONTINENT_DERIVED_FROM_COORDINATES;INSTITUTION_MATCH_FUZZY"
-119.96283,36.008703,"Schismus arabicus",2421719909,"Kings County: Kettleman City.","USA",544,1952,"PRESERVED_SPECIMEN","RECORDED_DATE_INVALID;CONTINENT_DERIVED_FROM_COORDINATES;INSTITUTION_MATCH_FUZZY"
-118.64373,37.4053,"Schismus arabicus",2421719347,"Inyo Co.: Bishop Creek.","USA",NA,1983,"PRESERVED_SPECIMEN","GEODETIC_DATUM_ASSUMED_WGS84;GEODETIC_DATUM_INVALID;CONTINENT_DERIVED_FROM_COORDINATES;INSTITUTION_MATCH_FUZZY"
-117.33003,34.985369,"Schismus arabicus",2421719827,"San Bernardino Co.: Mojave Desert. Harper Dry Lake basin, 2 miles south of Lockhart.","USA",2000,1962,"PRESERVED_SPECIMEN","CONTINENT_DERIVED_FROM_COORDINATES;INSTITUTION_MATCH_FUZZY"
-120.061,36.65425,"Schismus arabicus",2421719618,"Fresno County: 4.8 miles south of Kerman, Madera road.","USA",288,1963,"PRESERVED_SPECIMEN","CONTINENT_DERIVED_FROM_COORDINATES;INSTITUTION_MATCH_FUZZY"
-117.712419,34.498438,"Schismus arabicus",2421720090,"Los Angeles County: 1.5 mile east on State 138 from junction with State 18 near Pinyon Hills.","USA",300,1975,"PRESERVED_SPECIMEN","CONTINENT_DERIVED_FROM_COORDINATES;INSTITUTION_MATCH_FUZZY"
-118.863513,35.574053,"Schismus arabicus",2421719460,"Kern Co.: Sierra Nevada. The Greenhorn Range. The Crater, Adobe Canyon.","USA",1000,1965,"PRESERVED_SPECIMEN","CONTINENT_DERIVED_FROM_COORDINATES;INSTITUTION_MATCH_FUZZY"
-120.6636,36.4409,"Schismus arabicus",2421720006,"San Benito County: Panoche Road, 2.5 miles below Idria.","USA",400,1967,"PRESERVED_SPECIMEN","CONTINENT_DERIVED_FROM_COORDINATES;INSTITUTION_MATCH_FUZZY"
-121.43035,36.85145,"Schismus arabicus",2421720040,"San Benito County: San Benito River bed, 1.5 miles west of Hollister.","USA",1155,1957,"PRESERVED_SPECIMEN","CONTINENT_DERIVED_FROM_COORDINATES;INSTITUTION_MATCH_FUZZY"
-117.872431,34.829569,"Schismus arabicus",2421720253,"Kern County: Mojave Desert. The Mojave-Randsburg Region. South shore of Rogers Lake, Edwards Air Force Base.","USA",3000,1964,"PRESERVED_SPECIMEN","CONTINENT_DERIVED_FROM_COORDINATES;INSTITUTION_MATCH_FUZZY"
-115.1435,32.8934,"Schismus arabicus",2421770465,"Imperial County: west bank of Coachella Canal, 6.1 miles south of Highway 78, southwest of Glamis.","USA",1609,1983,"PRESERVED_SPECIMEN","CONTINENT_DERIVED_FROM_COORDINATES;INSTITUTION_MATCH_FUZZY"
-114.235082,36.470277,"Schismus arabicus",240496007,"Along road to Red Bluff Spring","USA",1165,2001,"PRESERVED_SPECIMEN","AMBIGUOUS_COLLECTION"
-114.8568,35.2181,"Schismus arabicus",1928411994,"Piute Valley, Rte 95, 1.5 road miles north of junction with Rte 163","USA",NA,1987,"PRESERVED_SPECIMEN","COLLECTION_MATCH_FUZZY"
-117.181056,34.649832,"Schismus arabicus",2412535804,"Mojave Desert., 10 miles NE of Victorville.","USA",5000,1973,"PRESERVED_SPECIMEN","CONTINENT_DERIVED_FROM_COORDINATES;INSTITUTION_MATCH_FUZZY"
-115.816696,33.653295,"Schismus arabicus",2412535473,"Calif. Route 195, 0.5 miles southwest of Interstate 10.","USA",2877,1973,"PRESERVED_SPECIMEN","CONTINENT_DERIVED_FROM_COORDINATES;INSTITUTION_MATCH_FUZZY"
-116.375085,33.660307,"Schismus arabicus",2413153084,"Sonoran Desert near Palm Desert, Boyd Deep Canyon UC Reserve. 1.1 miles south of reserve gate.","USA",423,2019,"PRESERVED_SPECIMEN","GEODETIC_DATUM_ASSUMED_WGS84;CONTINENT_DERIVED_FROM_COORDINATES;INSTITUTION_MATCH_FUZZY"
-111.001137,33.004417,"Schismus arabicus",3047560242,"","USA",NA,2018,"HUMAN_OBSERVATION","COORDINATE_ROUNDED;GEODETIC_DATUM_ASSUMED_WGS84;CONTINENT_DERIVED_FROM_COORDINATES"
-110.990182,33.089986,"Schismus arabicus",3047565171,"","USA",NA,2018,"HUMAN_OBSERVATION","COORDINATE_ROUNDED;GEODETIC_DATUM_ASSUMED_WGS84;CONTINENT_DERIVED_FROM_COORDINATES"
-111.177456,33.133056,"Schismus arabicus",3047630745,"","USA",NA,2018,"HUMAN_OBSERVATION","COORDINATE_ROUNDED;GEODETIC_DATUM_ASSUMED_WGS84;CONTINENT_DERIVED_FROM_COORDINATES"
-64.03888,-42.64166,"Schismus arabicus",1259522472,"Borde de la Salina Grande, cercano a la RN 256, Península Valdés.","ARG",NA,1968,"PRESERVED_SPECIMEN","GEODETIC_DATUM_ASSUMED_WGS84;DIFFERENT_OWNER_INSTITUTION"
34.95,30.22,"Schismus arabicus",1094556028,"","ISR",NA,1987,"HUMAN_OBSERVATION","COUNTRY_DERIVED_FROM_COORDINATES;CONTINENT_DERIVED_FROM_COORDINATES"
35.32,31.48,"Schismus arabicus",1094497215,"","PSE",NA,1988,"HUMAN_OBSERVATION","COUNTRY_DERIVED_FROM_COORDINATES;CONTINENT_DERIVED_FROM_COORDINATES"
34.79,31.31,"Schismus arabicus",1094531022,"","ISR",NA,1989,"HUMAN_OBSERVATION","COUNTRY_DERIVED_FROM_COORDINATES;CONTINENT_DERIVED_FROM_COORDINATES"
35.01,30.23,"Schismus arabicus",1094531593,"","ISR",NA,1989,"HUMAN_OBSERVATION","COUNTRY_DERIVED_FROM_COORDINATES;CONTINENT_DERIVED_FROM_COORDINATES"
35.38,31.57,"Schismus arabicus",1094568555,"","PSE",NA,1989,"HUMAN_OBSERVATION","COUNTRY_DERIVED_FROM_COORDINATES;CONTINENT_DERIVED_FROM_COORDINATES"
34.38,30.95,"Schismus arabicus",1094539429,"","ISR",NA,1984,"HUMAN_OBSERVATION","COUNTRY_DERIVED_FROM_COORDINATES;CONTINENT_DERIVED_FROM_COORDINATES"
35.01,30.64,"Schismus arabicus",1094567600,"","ISR",NA,1989,"HUMAN_OBSERVATION","COUNTRY_DERIVED_FROM_COORDINATES;CONTINENT_DERIVED_FROM_COORDINATES"
34.37,31.13,"Schismus arabicus",1094528088,"","ISR",NA,1988,"HUMAN_OBSERVATION","COUNTRY_DERIVED_FROM_COORDINATES;CONTINENT_DERIVED_FROM_COORDINATES"
34.3,31.14,"Schismus arabicus",1094549460,"","ISR",NA,1988,"HUMAN_OBSERVATION","COUNTRY_DERIVED_FROM_COORDINATES;CONTINENT_DERIVED_FROM_COORDINATES"
35.04,29.82,"Schismus arabicus",1094514698,"","ISR",NA,1988,"HUMAN_OBSERVATION","COUNTRY_DERIVED_FROM_COORDINATES;CONTINENT_DERIVED_FROM_COORDINATES"
35.03,31.57,"Schismus arabicus",1094513980,"","PSE",NA,1988,"HUMAN_OBSERVATION","COUNTRY_DERIVED_FROM_COORDINATES;CONTINENT_DERIVED_FROM_COORDINATES"
35.49,31.77,"Schismus arabicus",1094537172,"","PSE",NA,1975,"HUMAN_OBSERVATION","COUNTRY_DERIVED_FROM_COORDINATES;CONTINENT_DERIVED_FROM_COORDINATES"
35.45,32.05,"Schismus arabicus",1094510109,"","PSE",NA,1989,"HUMAN_OBSERVATION","COUNTRY_DERIVED_FROM_COORDINATES;CONTINENT_DERIVED_FROM_COORDINATES"
34.51,31.01,"Schismus arabicus",1094524081,"","ISR",NA,1988,"HUMAN_OBSERVATION","COUNTRY_DERIVED_FROM_COORDINATES;CONTINENT_DERIVED_FROM_COORDINATES"
34.89,30.58,"Schismus arabicus",1094516183,"","ISR",NA,1989,"HUMAN_OBSERVATION","COUNTRY_DERIVED_FROM_COORDINATES;CONTINENT_DERIVED_FROM_COORDINATES"
34.5,30.99,"Schismus arabicus",1094520558,"","ISR",NA,1988,"HUMAN_OBSERVATION","COUNTRY_DERIVED_FROM_COORDINATES;CONTINENT_DERIVED_FROM_COORDINATES"
34.98,30.03,"Schismus arabicus",1094484882,"","ISR",NA,1989,"HUMAN_OBSERVATION","COUNTRY_DERIVED_FROM_COORDINATES;CONTINENT_DERIVED_FROM_COORDINATES"
35.07,31.74,"Schismus arabicus",1094545716,"","ISR",NA,1989,"HUMAN_OBSERVATION","COUNTRY_DERIVED_FROM_COORDINATES;CONTINENT_DERIVED_FROM_COORDINATES"
35.08,30,"Schismus arabicus",1094567371,"","ISR",NA,1989,"HUMAN_OBSERVATION","COUNTRY_DERIVED_FROM_COORDINATES;CONTINENT_DERIVED_FROM_COORDINATES"
34.83,30.1,"Schismus arabicus",1094554050,"","ISR",NA,1988,"HUMAN_OBSERVATION","COUNTRY_DERIVED_FROM_COORDINATES;CONTINENT_DERIVED_FROM_COORDINATES"
35.09,31.4,"Schismus arabicus",1094567380,"","PSE",NA,1988,"HUMAN_OBSERVATION","COUNTRY_DERIVED_FROM_COORDINATES;CONTINENT_DERIVED_FROM_COORDINATES"
34.99,30.92,"Schismus arabicus",1094527730,"","ISR",NA,1989,"HUMAN_OBSERVATION","COUNTRY_DERIVED_FROM_COORDINATES;CONTINENT_DERIVED_FROM_COORDINATES"
35.53,32.28,"Schismus arabicus",1094551774,"","PSE",NA,1975,"HUMAN_OBSERVATION","COUNTRY_DERIVED_FROM_COORDINATES;CONTINENT_DERIVED_FROM_COORDINATES"
34.62,30.48,"Schismus arabicus",1094485573,"","ISR",NA,1989,"HUMAN_OBSERVATION","COUNTRY_DERIVED_FROM_COORDINATES;CONTINENT_DERIVED_FROM_COORDINATES"
34.68,30.54,"Schismus arabicus",1094557787,"","ISR",NA,1989,"HUMAN_OBSERVATION","COUNTRY_DERIVED_FROM_COORDINATES;CONTINENT_DERIVED_FROM_COORDINATES"
35,30.67,"Schismus arabicus",1094527798,"","ISR",NA,1989,"HUMAN_OBSERVATION","COUNTRY_DERIVED_FROM_COORDINATES;CONTINENT_DERIVED_FROM_COORDINATES"
-63.83333,-42.15,"Schismus arabicus",1259522432,"12 km al S de Punta Norte. RP 3, Península Valdés.","ARG",NA,1968,"PRESERVED_SPECIMEN","GEODETIC_DATUM_ASSUMED_WGS84;DIFFERENT_OWNER_INSTITUTION"
-117.541564,34.99202,"Schismus arabicus",2982063927,"Hwy. 395, 6 mi. S of Boron.","USA",800,1977,"PRESERVED_SPECIMEN","CONTINENT_DERIVED_FROM_COORDINATES;INSTITUTION_MATCH_FUZZY"
-116.3359,34.135,"Schismus arabicus",2982001289,"Mojave Desert; near Hwy. 62 between Yucca Valley and Joshua Tree.","USA",3000,1972,"PRESERVED_SPECIMEN","CONTINENT_DERIVED_FROM_COORDINATES;INSTITUTION_MATCH_FUZZY"
-114.173938,36.541385,"Schismus arabicus",4062905766,"","USA",3,2022,"HUMAN_OBSERVATION","CONTINENT_DERIVED_FROM_COORDINATES"
