"lon","lat","species","gbifID","locality","countryCode","coordinateUncertaintyInMeters","year","basisOfRecord","issue"
-53.25,1.35,"Schnella smilacina",2998493025,"Riozinho, 122km NW of Porto Grande on the highway  Perimetral Norte (BR210).","BRA",NA,1985,"PRESERVED_SPECIMEN","GEODETIC_DATUM_ASSUMED_WGS84;CONTINENT_DERIVED_FROM_COORDINATES;INSTITUTION_MATCH_FUZZY;COLLECTION_MATCH_FUZZY"
-75.3,-10.33333,"Schnella smilacina",1261919218,"Cabeza de Mono, Río Iscozacin, 10 km SW of Iscozasin, Palcazu Valley, sandy river terraces. Transect 4.","PER",NA,1983,"PRESERVED_SPECIMEN","OCCURRENCE_STATUS_INFERRED_FROM_INDIVIDUAL_COUNT;GEODETIC_DATUM_ASSUMED_WGS84;INSTITUTION_MATCH_FUZZY;COLLECTION_MATCH_NONE"
-39.0617,-14.4231,"Schnella smilacina",1930810511,"Distrito de Serra Grande. 7.3 km na estrada Serra Grande/Itacaré, Fazenda Lagoa do Conjunto Fazenda Santa Cruz","BRA",NA,1991,"PRESERVED_SPECIMEN","COLLECTION_MATCH_FUZZY"
-40.109417,-13.944722,"Schnella smilacina",1090958913,"Mata da Fazenda Brejo Novo","BRA",NA,2003,"PRESERVED_SPECIMEN","GEODETIC_DATUM_ASSUMED_WGS84;CONTINENT_DERIVED_FROM_COORDINATES;INSTITUTION_MATCH_NONE"
-39.07,-15.3,"Schnella smilacina",912114899,"Estrada Una-São José. Coletas efetuadas a ca. de 27km a partir de Una.","BRA",NA,1993,"PRESERVED_SPECIMEN","GEODETIC_DATUM_ASSUMED_WGS84;CONTINENT_DERIVED_FROM_COORDINATES;TAXON_MATCH_HIGHERRANK;INSTITUTION_MATCH_FUZZY;COLLECTION_MATCH_FUZZY"
-39.08,-16.43,"Schnella smilacina",912114865,"Reserva Florestal de Porto Seguro. Próximo ao aceiro com Ari no córrego Camorogi.","BRA",NA,1990,"PRESERVED_SPECIMEN","GEODETIC_DATUM_ASSUMED_WGS84;CONTINENT_DERIVED_FROM_COORDINATES;INSTITUTION_MATCH_FUZZY;COLLECTION_MATCH_FUZZY"
-52.53381,-0.86071,"Schnella smilacina",1930170234,"Rio Jarí, margem direita, entre S. Melitão e Monte Dourado","BRA",NA,1968,"PRESERVED_SPECIMEN","COORDINATE_ROUNDED;COLLECTION_MATCH_FUZZY"
-39.091111,-14.777222,"Schnella smilacina",1090459207,"Mata da Esperança. 2Km ao NNE do Banco da Vitória, na margem da Rod. ao oeste da mata.","BRA",NA,1994,"PRESERVED_SPECIMEN","GEODETIC_DATUM_ASSUMED_WGS84;CONTINENT_DERIVED_FROM_COORDINATES;INSTITUTION_MATCH_NONE"
-39.266667,-14.983333,"Schnella smilacina",1090458202,"Escola Média de Agropecuária da região Cacaueira. Reserva 'Gregório Bondar.","BRA",NA,1994,"PRESERVED_SPECIMEN","GEODETIC_DATUM_ASSUMED_WGS84;CONTINENT_DERIVED_FROM_COORDINATES;INSTITUTION_MATCH_NONE"
-39.603889,-14.7025,"Schnella smilacina",1090520286,"Serra do Corcovado, acesso pela Estação da EMBASA. Nova trilha próximo ao sítio do seu Domingos. Entrada à esquerda da primeira cachoeira.","BRA",NA,2012,"PRESERVED_SPECIMEN","GEODETIC_DATUM_ASSUMED_WGS84;CONTINENT_DERIVED_FROM_COORDINATES;INSTITUTION_MATCH_NONE"
-39.250406,-15.146659,"Schnella smilacina",1928959903,"Estrada que liga Sao José com Una, a 17 km da BR-101. Cerca de 45 km ao S de Itabuna","BRA",NA,1979,"PRESERVED_SPECIMEN","COORDINATE_ROUNDED;COLLECTION_MATCH_FUZZY"
-42.83333,-22.45,"Schnella smilacina",437717092,"","BRA",NA,1992,"PRESERVED_SPECIMEN","GEODETIC_DATUM_ASSUMED_WGS84;CONTINENT_DERIVED_FROM_COORDINATES;COLLECTION_MATCH_FUZZY"
-40.876667,-19.231111,"Schnella smilacina",2996360256,"Serra do Alto Mutum Preto, estrada para Pedra da Colina, rampa de voo-livre. Vegetação rupestre","BRA",NA,2013,"PRESERVED_SPECIMEN","COORDINATE_ROUNDED;GEODETIC_DATUM_ASSUMED_WGS84;CONTINENT_DERIVED_FROM_COORDINATES;INSTITUTION_MATCH_FUZZY;COLLECTION_MATCH_FUZZY"
-39.202222,-16.419167,"Schnella smilacina",1123827020,"Trilha do Pequí, bloco 4 da RPPN Estação Veracel. Floresta Ombrófila Densa em fundo de vale","BRA",NA,2010,"PRESERVED_SPECIMEN","GEODETIC_DATUM_ASSUMED_WGS84;CONTINENT_DERIVED_FROM_COORDINATES;DIFFERENT_OWNER_INSTITUTION"
-76.06,-6.56,"Schnella smilacina",3033625279,"Perú. Departament de San Martín. Districte de Chazuta. Llucanayacu","PER",3421,2005,"PRESERVED_SPECIMEN","GEODETIC_DATUM_ASSUMED_WGS84;CONTINENT_DERIVED_FROM_COORDINATES;DIFFERENT_OWNER_INSTITUTION"
-41.058333,-13.944722,"Schnella smilacina",1087532262,"Fazenda Brejo Novo, Fazenda Brejo Novo, a 10,5 Km da Av. Otávio Mangabeira entrando pela Av. Exupério Miranda no Bairro do Mandacarú.","BRA",NA,2003,"PRESERVED_SPECIMEN","GEODETIC_DATUM_ASSUMED_WGS84;CONTINENT_DERIVED_FROM_COORDINATES;INSTITUTION_MATCH_NONE"
-41.966667,-21.966667,"Schnella smilacina",1423961121,"Parque Est. do Desengano - Serra da Rifa - Picada para a Pedra Lisa.","BRA",NA,1987,"PRESERVED_SPECIMEN","COORDINATE_ROUNDED;GEODETIC_DATUM_ASSUMED_WGS84;CONTINENT_DERIVED_FROM_COORDINATES;INSTITUTION_MATCH_FUZZY;COLLECTION_MATCH_FUZZY"
-41.082778,-21.404444,"Schnella smilacina",1424512938,"Reserva Ecológica de Guaxindiba. Mata de tabuleiro.","BRA",NA,2015,"PRESERVED_SPECIMEN","COORDINATE_ROUNDED;GEODETIC_DATUM_ASSUMED_WGS84;CONTINENT_DERIVED_FROM_COORDINATES;INSTITUTION_MATCH_FUZZY;COLLECTION_MATCH_FUZZY"
-41.708889,-20.893889,"Schnella smilacina",3763107303,"Parcela um. Parcela na borda da matriz de represa.","BRA",NA,2012,"PRESERVED_SPECIMEN","COORDINATE_ROUNDED;GEODETIC_DATUM_ASSUMED_WGS84;CONTINENT_DERIVED_FROM_COORDINATES;INSTITUTION_MATCH_FUZZY;COLLECTION_MATCH_FUZZY"
-42.93333,-22.53333,"Schnella smilacina",1424279231,"Estação Ecológica Estadual de Paraíso. Picada para Serra Queimada.","BRA",NA,1991,"PRESERVED_SPECIMEN","GEODETIC_DATUM_ASSUMED_WGS84;CONTINENT_DERIVED_FROM_COORDINATES;INSTITUTION_MATCH_FUZZY;COLLECTION_MATCH_FUZZY"
-41.97,-22.759722,"Schnella smilacina",1424246526,"Rasa, local conhecido como Brejo da Fazendinha. Remanescente florestal sobre solo barrento.","BRA",NA,2008,"PRESERVED_SPECIMEN","COORDINATE_ROUNDED;GEODETIC_DATUM_ASSUMED_WGS84;CONTINENT_DERIVED_FROM_COORDINATES;INSTITUTION_MATCH_FUZZY;COLLECTION_MATCH_FUZZY"
-40.138333,-18.906944,"Schnella smilacina",1424413956,"Estrada de Fátima, ca. 3 Km após a Comunidade de Santo Antonio de Pádua. Mata de terra de firme.(fragmento).","BRA",NA,2012,"PRESERVED_SPECIMEN","COORDINATE_ROUNDED;GEODETIC_DATUM_ASSUMED_WGS84;CONTINENT_DERIVED_FROM_COORDINATES;INSTITUTION_MATCH_FUZZY;COLLECTION_MATCH_FUZZY"
-40.1546,-19.0579,"Schnella smilacina",1703340251,"Refúgio Biológico Sooretama.","BRA",NA,1965,"PRESERVED_SPECIMEN","GEODETIC_DATUM_ASSUMED_WGS84;CONTINENT_DERIVED_FROM_COORDINATES;INSTITUTION_COLLECTION_MISMATCH"
-42.833333,-22.533333,"Schnella smilacina",2997573308,"entre Magé e Cachoeira de Macacau- est. Ecológica de Paraíso. Trilha p/ Mariquitas 22°27'00S 42°50'00W / 22°32'00S 42°56'00W","BRA",NA,1992,"PRESERVED_SPECIMEN","COORDINATE_ROUNDED;GEODETIC_DATUM_ASSUMED_WGS84;CONTINENT_DERIVED_FROM_COORDINATES;INSTITUTION_MATCH_FUZZY;COLLECTION_MATCH_FUZZY"
-40.68,-11.23,"Schnella smilacina",912114857,"Serra do Tombador, ca. 10km W de Curral Velho, este povoado a ca. De 1km W da BA-421 (Jacobina-Piritiba), entrando a ca. 14km S da BR-324. Fazenda Várzea da Pedra (ex. Fazenda São José).","BRA",NA,1993,"PRESERVED_SPECIMEN","GEODETIC_DATUM_ASSUMED_WGS84;CONTINENT_DERIVED_FROM_COORDINATES;INSTITUTION_MATCH_FUZZY;COLLECTION_MATCH_FUZZY"
-39.25,-16.13,"Schnella smilacina",912114836,"Reserva Ecológica Gregório Bondar. Area da EMARC-Uruçuca.","BRA",NA,1994,"PRESERVED_SPECIMEN","GEODETIC_DATUM_ASSUMED_WGS84;CONTINENT_DERIVED_FROM_COORDINATES;INSTITUTION_MATCH_FUZZY;COLLECTION_MATCH_FUZZY"
-38.818889,-12.254167,"Schnella smilacina",3381225312,"Povoado do Carrapato.","BRA",NA,2021,"PRESERVED_SPECIMEN","GEODETIC_DATUM_ASSUMED_WGS84;CONTINENT_DERIVED_FROM_COORDINATES;DIFFERENT_OWNER_INSTITUTION"
-39.575,-15.203333,"Schnella smilacina",1094918735,"Rod. que liga a BR 101 com Itapetinga, ca. de 15 km de Itaibé, Faz. Independencia. Área com ação antropica, proveniente da extração madeireira.","BRA",NA,2011,"PRESERVED_SPECIMEN","GEODETIC_DATUM_ASSUMED_WGS84;CONTINENT_DERIVED_FROM_COORDINATES;DIFFERENT_OWNER_INSTITUTION"
-42.5,-22.32,"Schnella smilacina",1095346372,"entre Magé e Cachoeira de Macacau- est. Ecológica de Paraíso. Trilha p/ Mariquitas 22°27'00S 42°50'00W / 22°32'00S 42°56'00W","BRA",NA,1992,"PRESERVED_SPECIMEN","GEODETIC_DATUM_ASSUMED_WGS84;DIFFERENT_OWNER_INSTITUTION"
-57.808611,-9.778611,"Schnella smilacina",1089062897,"Estrada para fazenda Novo Horizonte., Floresta Ombrófila Aberta. Relevo suave ondulado. Solo tipo Podzólico.","BRA",NA,1997,"PRESERVED_SPECIMEN","GEODETIC_DATUM_ASSUMED_WGS84;CONTINENT_DERIVED_FROM_COORDINATES;INSTITUTION_MATCH_NONE"
