"lon","lat","species","gbifID","locality","countryCode","coordinateUncertaintyInMeters","year","basisOfRecord","issue"
-87.8,15.9,"Senna reticulata",122919576,"Chamelecon, Cortez, Honduras","HND",210,1962,"PRESERVED_SPECIMEN","GEODETIC_DATUM_ASSUMED_WGS84;CONTINENT_DERIVED_FROM_COORDINATES;INSTITUTION_COLLECTION_MISMATCH"
-84.8294,9.97784,"Senna reticulata",122919112,"","CRI",NA,2002,"PRESERVED_SPECIMEN","GEODETIC_DATUM_ASSUMED_WGS84;CONTINENT_DERIVED_FROM_COORDINATES;COORDINATE_UNCERTAINTY_METERS_INVALID;INSTITUTION_COLLECTION_MISMATCH"
-48.19,-21.8125,"Senna reticulata",1042676122,"Coletada à margem da Rodovia Araraquara-Jaú, Bairro Campus Ville, Araraquara, próximo ao Campus da Universidade Estadual Paulista-UNESP. Área de terra firme - vermelho, massapé.","BRA",NA,2008,"PRESERVED_SPECIMEN","GEODETIC_DATUM_ASSUMED_WGS84;GEODETIC_DATUM_INVALID;INSTITUTION_MATCH_NONE"
-55.67,-5.916667,"Senna reticulata",1042471616,"Estrada Santarém-Cuiabá, BR 163, Km 1222 a 1227.","BRA",NA,1983,"PRESERVED_SPECIMEN","GEODETIC_DATUM_ASSUMED_WGS84;GEODETIC_DATUM_INVALID;INSTITUTION_MATCH_NONE"
-63.17,-7.516667,"Senna reticulata",1042540538,"Humaitá, Campo com poucas árvores para o norte da lagoa temporária, 1 Km da BR 230, Km 4.","BRA",NA,1980,"PRESERVED_SPECIMEN","GEODETIC_DATUM_ASSUMED_WGS84;GEODETIC_DATUM_INVALID;INSTITUTION_MATCH_NONE"
-54.6,-2.432722,"Senna reticulata",1042701200,"Várzea Quilombola de Saracura","BRA",NA,2013,"PRESERVED_SPECIMEN","GEODETIC_DATUM_ASSUMED_WGS84;GEODETIC_DATUM_INVALID;INSTITUTION_MATCH_NONE"
-61.7,4.1703,"Senna reticulata",1042708795,"Ilha de Maracá, SEMA Estação., North side of island at Três Igarapés, ca. Ca. 1km up Igarapé from sub-camp. On sandy banks of Igarapé.","BRA",NA,1987,"PRESERVED_SPECIMEN","GEODETIC_DATUM_ASSUMED_WGS84;GEODETIC_DATUM_INVALID;INSTITUTION_MATCH_NONE"
-62.05,-3.823056,"Senna reticulata",1042521975,"Codajás, Nas proximidades do Porto.","BRA",NA,1958,"PRESERVED_SPECIMEN","GEODETIC_DATUM_ASSUMED_WGS84;GEODETIC_DATUM_INVALID;ELEVATION_MIN_MAX_SWAPPED;INSTITUTION_MATCH_NONE"
-65.13,-2.8,"Senna reticulata",1042620382,"Região de várzea do Rio Solimões, dentro dos limites da Reserva de Desenvolvimento Sustentável Mamirauá. Comunidade Aiucá, atrás do campo de futebol.","BRA",NA,2003,"PRESERVED_SPECIMEN","GEODETIC_DATUM_ASSUMED_WGS84;GEODETIC_DATUM_INVALID;INSTITUTION_MATCH_NONE"
-72.0744,10.2783,"Senna reticulata",1936256446,"Edo. Zulia, municipio La Cañada de Urdaneta, cuenca baja del río Palmar, Campo Boscán, Finca Grano de Oro, madre vieja del río Palmar","VEN",NA,2004,"PRESERVED_SPECIMEN","GEODETIC_DATUM_ASSUMED_WGS84;CONTINENT_DERIVED_FROM_COORDINATES;INSTITUTION_MATCH_FUZZY;COLLECTION_MATCH_FUZZY"
-78.95,0.8667,"Senna reticulata",1936126646,"Prov. Esmeraldas: San José de Cayapas","ECU",NA,1980,"PRESERVED_SPECIMEN","GEODETIC_DATUM_ASSUMED_WGS84;CONTINENT_DERIVED_FROM_COORDINATES;INSTITUTION_MATCH_FUZZY;COLLECTION_MATCH_FUZZY"
-69.47,-13,"Senna reticulata",1065617704,"Confluence of riversTambopata and Chuncho","PER",0.2,1989,"PRESERVED_SPECIMEN","GEODETIC_DATUM_ASSUMED_WGS84;CONTINENT_DERIVED_FROM_COORDINATES;INSTITUTION_MATCH_FUZZY;COLLECTION_MATCH_FUZZY"
-72.38,-12.63,"Senna reticulata",1065617722,"Cusco: La Convencion","PER",0.2,2007,"PRESERVED_SPECIMEN","GEODETIC_DATUM_ASSUMED_WGS84;CONTINENT_DERIVED_FROM_COORDINATES;INSTITUTION_MATCH_FUZZY;COLLECTION_MATCH_FUZZY"
-72.83,-12.64,"Senna reticulata",1065617707,"","PER",0.2,2007,"PRESERVED_SPECIMEN","GEODETIC_DATUM_ASSUMED_WGS84;CONTINENT_DERIVED_FROM_COORDINATES;INSTITUTION_MATCH_FUZZY;COLLECTION_MATCH_FUZZY"
-59.886917,1.076611,"Senna reticulata",1090631340,"Vicinal 29, saindo da rodovia, pouco antes do início da Terra Indígena Wai-wai.","BRA",NA,2012,"PRESERVED_SPECIMEN","GEODETIC_DATUM_ASSUMED_WGS84;CONTINENT_DERIVED_FROM_COORDINATES;DIFFERENT_OWNER_INSTITUTION"
-74.402539,6.492308,"Senna reticulata",728249307,"Las Ciénagas Chiquita y El Encanto, se encuentran en la vereda Puerto Olaya, y la ciénaga Cachimbero se encuentra entre las veredas Tierradentro, Campo Seco y De La Torre.","COL",NA,2010,"HUMAN_OBSERVATION","COORDINATE_ROUNDED;GEODETIC_DATUM_ASSUMED_WGS84"
-85.620003,10.84,"Senna reticulata",3350093479,"Area de Conservacion Guanacaste, Sector Santa Rosa, Area Administrativa, cerca del Laboratorio de Biolep","CRI",NA,2011,"PRESERVED_SPECIMEN","COORDINATE_ROUNDED;GEODETIC_DATUM_ASSUMED_WGS84;CONTINENT_DERIVED_FROM_COORDINATES"
-67.48,3.05,"Senna reticulata",1928167311,"Rio Ocamo, alrededor del raudal Arata","VEN",NA,1990,"PRESERVED_SPECIMEN","GEODETIC_DATUM_ASSUMED_WGS84;COLLECTION_MATCH_FUZZY"
-88.97,16.32,"Senna reticulata",1928973915,"San Pedro, Belize Agroforestry Research Center","BLZ",NA,1990,"PRESERVED_SPECIMEN","GEODETIC_DATUM_ASSUMED_WGS84;COLLECTION_MATCH_FUZZY"
-69.4,11.32,"Senna reticulata",1931299666,"A lo largo del río Ricoa, sur de Las Dos Bocas (sitio de represa)","VEN",NA,1977,"PRESERVED_SPECIMEN","GEODETIC_DATUM_ASSUMED_WGS84;COLLECTION_MATCH_FUZZY"
-58.47,6.82,"Senna reticulata",1929664019,"Along west bank of the canal between St. Lawrence and Hubu","GUY",NA,1989,"PRESERVED_SPECIMEN","GEODETIC_DATUM_ASSUMED_WGS84;COLLECTION_MATCH_FUZZY"
-84.63,14.07,"Senna reticulata",1929808052,"Zelaya. El Salto, along Río Pis Pis and surrounding hills","NIC",NA,1979,"PRESERVED_SPECIMEN","GEODETIC_DATUM_ASSUMED_WGS84;COLLECTION_MATCH_FUZZY"
-48.455522,-1.284992,"Senna reticulata",1931111052,"Vicinity of Belém.","BRA",NA,1961,"PRESERVED_SPECIMEN","COORDINATE_ROUNDED;COLLECTION_MATCH_FUZZY"
-94.5,17.28,"Senna reticulata",1929094056,"Vicinity of Campamento La Laguna","MEX",NA,1984,"PRESERVED_SPECIMEN","GEODETIC_DATUM_ASSUMED_WGS84;COLLECTION_MATCH_FUZZY"
-75.736944,1.276111,"Senna reticulata",1930421278,"vereda La Esmeralda, finca Brasil. Vía Morelia-Valparaíso, Río Pescado.","COL",NA,2010,"PRESERVED_SPECIMEN","COORDINATE_ROUNDED;GEODETIC_DATUM_ASSUMED_WGS84;COLLECTION_MATCH_FUZZY"
-74.095417,10.587917,"Senna reticulata",3107155301,"El Torito","COL",NA,2015,"PRESERVED_SPECIMEN","COORDINATE_ROUNDED;INSTITUTION_MATCH_NONE"
-73.725508,8.433811,"Senna reticulata",3107155717,"Palenquillo","COL",NA,2014,"PRESERVED_SPECIMEN","COORDINATE_ROUNDED;INSTITUTION_MATCH_NONE"
-89.5,16.09,"Senna reticulata",3416611490,"Chimay, San Luis, Petén","GTM",NA,2020,"PRESERVED_SPECIMEN","CONTINENT_DERIVED_FROM_COORDINATES;INSTITUTION_MATCH_FUZZY;INSTITUTION_COLLECTION_MISMATCH"
-89.58,15.87,"Senna reticulata",3416611613,"San José Pacayal, Livingsstonm Izabal","GTM",NA,2019,"PRESERVED_SPECIMEN","CONTINENT_DERIVED_FROM_COORDINATES;INSTITUTION_MATCH_FUZZY;INSTITUTION_COLLECTION_MISMATCH"
-93.0059,16.8682,"Senna reticulata",1989248812,"Ángel Albino Corzo; Angel Albino Corzo; río Cuztepeques near Finca Cuztepeques","MEX",NA,1968,"PRESERVED_SPECIMEN","GEODETIC_DATUM_ASSUMED_WGS84"
-83.1205,8.405667,"Senna reticulata",1978002857,"Forested area of Zona Maritimo Terrestre","CRI",NA,2011,"PRESERVED_SPECIMEN","GEODETIC_DATUM_ASSUMED_WGS84;PRESUMED_NEGATED_LONGITUDE;CONTINENT_DERIVED_FROM_COORDINATES;INSTITUTION_MATCH_FUZZY"
-95.963139,15.827583,"Senna reticulata",1897358476,"2 km al S de Barra de la Cruz, en la laguna","MEX",100,2002,"PRESERVED_SPECIMEN","TYPE_STATUS_INVALID;OCCURRENCE_STATUS_INFERRED_FROM_INDIVIDUAL_COUNT;COORDINATE_ROUNDED;GEODETIC_DATUM_ASSUMED_WGS84;CONTINENT_DERIVED_FROM_COORDINATES;ELEVATION_MIN_MAX_SWAPPED;INSTITUTION_MATCH_NONE"
-74.085567,7.150233,"Senna reticulata",1702875202,"Quebrada la Concha al río santo Domingo, entrada por casa de Don Choco","COL",NA,2016,"HUMAN_OBSERVATION","COORDINATE_ROUNDED;GEODETIC_DATUM_ASSUMED_WGS84"
-79.682528,-3.680412,"Senna reticulata",4062653587,"","ECU",1628,2023,"HUMAN_OBSERVATION","COORDINATE_ROUNDED;CONTINENT_DERIVED_FROM_COORDINATES"
-73.721523,2.996356,"Senna reticulata",1260659039,"Llanos, 8 km S from Vistahermosa.","COL",NA,1976,"PRESERVED_SPECIMEN","GEODETIC_DATUM_ASSUMED_WGS84;INSTITUTION_MATCH_FUZZY;COLLECTION_MATCH_NONE"
-82.173333,9.17,"Senna reticulata",1259535840,"5 km S of Tiger Key on the mainland near Cacao Boquete just N of Enseñada de Bosquete.","PAN",NA,1989,"PRESERVED_SPECIMEN","OCCURRENCE_STATUS_INFERRED_FROM_INDIVIDUAL_COUNT;COORDINATE_ROUNDED;GEODETIC_DATUM_ASSUMED_WGS84;INSTITUTION_MATCH_FUZZY;COLLECTION_MATCH_NONE"
-77.411041,6.147382,"Senna reticulata",3355071304,"","COL",977,2016,"HUMAN_OBSERVATION","COORDINATE_ROUNDED;CONTINENT_DERIVED_FROM_COORDINATES"
-88.845963,16.137233,"Senna reticulata",4063037808,"","BLZ",4,2023,"HUMAN_OBSERVATION","COORDINATE_ROUNDED;CONTINENT_DERIVED_FROM_COORDINATES"
-82.247329,9.364442,"Senna reticulata",2803070089,"","PAN",970,2018,"HUMAN_OBSERVATION","COORDINATE_ROUNDED;CONTINENT_DERIVED_FROM_COORDINATES"
-42.727222,-10.809444,"Senna reticulata",1090466553,"","BRA",NA,1996,"PRESERVED_SPECIMEN","GEODETIC_DATUM_ASSUMED_WGS84;CONTINENT_DERIVED_FROM_COORDINATES;INSTITUTION_MATCH_NONE"
-92.95,17.533333,"Senna reticulata",2629660170,"20 m antes de la desviación Tapijulapa-Oxolotán, SE de Teapa","MEX",90,1986,"PRESERVED_SPECIMEN","TYPE_STATUS_INVALID;OCCURRENCE_STATUS_INFERRED_FROM_INDIVIDUAL_COUNT;COORDINATE_ROUNDED;GEODETIC_DATUM_ASSUMED_WGS84;GEODETIC_DATUM_INVALID;CONTINENT_DERIVED_FROM_COORDINATES;INSTITUTION_MATCH_NONE"
-94.616667,17.266667,"Senna reticulata",2629709575,"Campamento Hermanos Cedillo, Río Solosúchil","MEX",90,1974,"PRESERVED_SPECIMEN","TYPE_STATUS_INVALID;OCCURRENCE_STATUS_INFERRED_FROM_INDIVIDUAL_COUNT;COORDINATE_ROUNDED;GEODETIC_DATUM_ASSUMED_WGS84;GEODETIC_DATUM_INVALID;CONTINENT_DERIVED_FROM_COORDINATES;INSTITUTION_MATCH_NONE"
-92.233333,15.2,"Senna reticulata",2629516371,"Finca El Vergel, desviación a El Triunfo","MEX",100,1977,"PRESERVED_SPECIMEN","TYPE_STATUS_INVALID;OCCURRENCE_STATUS_INFERRED_FROM_INDIVIDUAL_COUNT;COORDINATE_ROUNDED;GEODETIC_DATUM_ASSUMED_WGS84;GEODETIC_DATUM_INVALID;CONTINENT_DERIVED_FROM_COORDINATES;INSTITUTION_MATCH_NONE"
-104.916667,19.6,"Senna reticulata",2629464520,"3 km al W de Nacastillo","MEX",90,1980,"PRESERVED_SPECIMEN","TYPE_STATUS_INVALID;OCCURRENCE_STATUS_INFERRED_FROM_INDIVIDUAL_COUNT;COORDINATE_ROUNDED;GEODETIC_DATUM_ASSUMED_WGS84;GEODETIC_DATUM_INVALID;CONTINENT_DERIVED_FROM_COORDINATES;INSTITUTION_MATCH_NONE"
-94.55,17.45,"Senna reticulata",2629716587,"2-4 km carretera Plan de Arroyo-Pancho Villa","MEX",90,1974,"PRESERVED_SPECIMEN","TYPE_STATUS_INVALID;OCCURRENCE_STATUS_INFERRED_FROM_INDIVIDUAL_COUNT;GEODETIC_DATUM_ASSUMED_WGS84;GEODETIC_DATUM_INVALID;CONTINENT_DERIVED_FROM_COORDINATES;INSTITUTION_MATCH_NONE"
-88.783333,18.35,"Senna reticulata",2629572339,"Zona arqueológica de Kohunlich","MEX",80,1981,"PRESERVED_SPECIMEN","TYPE_STATUS_INVALID;OCCURRENCE_STATUS_INFERRED_FROM_INDIVIDUAL_COUNT;COORDINATE_ROUNDED;GEODETIC_DATUM_ASSUMED_WGS84;GEODETIC_DATUM_INVALID;CONTINENT_DERIVED_FROM_COORDINATES;INSTITUTION_MATCH_NONE"
-96.096944,18.190278,"Senna reticulata",2629528119,"Ciudad Alemán","MEX",90,1968,"PRESERVED_SPECIMEN","TYPE_STATUS_INVALID;OCCURRENCE_STATUS_INFERRED_FROM_INDIVIDUAL_COUNT;COORDINATE_ROUNDED;GEODETIC_DATUM_ASSUMED_WGS84;GEODETIC_DATUM_INVALID;CONTINENT_DERIVED_FROM_COORDINATES;INSTITUTION_MATCH_NONE"
-96.444444,19.506111,"Senna reticulata",2629561294,"Cerrito de La Cruz, Mozomboa","MEX",80,1984,"PRESERVED_SPECIMEN","TYPE_STATUS_INVALID;OCCURRENCE_STATUS_INFERRED_FROM_INDIVIDUAL_COUNT;COORDINATE_ROUNDED;GEODETIC_DATUM_ASSUMED_WGS84;GEODETIC_DATUM_INVALID;CONTINENT_DERIVED_FROM_COORDINATES;INSTITUTION_MATCH_NONE"
-96.9275,19.54,"Senna reticulata",2629569750,"Vivero El Campesino del H. Ayuntamiento de Xalapa","MEX",80,1987,"PRESERVED_SPECIMEN","TYPE_STATUS_INVALID;OCCURRENCE_STATUS_INFERRED_FROM_INDIVIDUAL_COUNT;GEODETIC_DATUM_ASSUMED_WGS84;GEODETIC_DATUM_INVALID;CONTINENT_DERIVED_FROM_COORDINATES;INSTITUTION_MATCH_NONE"
-60.018889,-3.223056,"Senna reticulata",2996032596,"Rio Solimões. Lago Janauari. Igarapé Ipixuna (Igarapé do Belo).","BRA",NA,2017,"PRESERVED_SPECIMEN","COORDINATE_ROUNDED;GEODETIC_DATUM_ASSUMED_WGS84;CONTINENT_DERIVED_FROM_COORDINATES;INSTITUTION_MATCH_FUZZY;COLLECTION_MATCH_FUZZY"
-92.166667,14.933333,"Senna reticulata",2629655086,"Ejido Hidalgo, 10 km al N de Tuxtla Chico","MEX",110,1986,"PRESERVED_SPECIMEN","TYPE_STATUS_INVALID;OCCURRENCE_STATUS_INFERRED_FROM_INDIVIDUAL_COUNT;COORDINATE_ROUNDED;GEODETIC_DATUM_ASSUMED_WGS84;GEODETIC_DATUM_INVALID;CONTINENT_DERIVED_FROM_COORDINATES;INSTITUTION_MATCH_NONE"
-93.751667,17.140278,"Senna reticulata",2629746910,"Rancho Camback, Presa Netzahualcoyotl","MEX",90,2001,"PRESERVED_SPECIMEN","TYPE_STATUS_INVALID;OCCURRENCE_STATUS_INFERRED_FROM_INDIVIDUAL_COUNT;COORDINATE_ROUNDED;GEODETIC_DATUM_ASSUMED_WGS84;GEODETIC_DATUM_INVALID;CONTINENT_DERIVED_FROM_COORDINATES;INSTITUTION_MATCH_NONE"
-93.016667,18.15,"Senna reticulata",2629662027,"9 km carretera de Nacajuca-Villahermosa","MEX",90,1986,"PRESERVED_SPECIMEN","TYPE_STATUS_INVALID;OCCURRENCE_STATUS_INFERRED_FROM_INDIVIDUAL_COUNT;COORDINATE_ROUNDED;GEODETIC_DATUM_ASSUMED_WGS84;GEODETIC_DATUM_INVALID;CONTINENT_DERIVED_FROM_COORDINATES;INSTITUTION_MATCH_NONE"
-92.783333,17.45,"Senna reticulata",2629466654,"Tapijulapa salida a Amatán","MEX",90,1985,"PRESERVED_SPECIMEN","TYPE_STATUS_INVALID;OCCURRENCE_STATUS_INFERRED_FROM_INDIVIDUAL_COUNT;COORDINATE_ROUNDED;GEODETIC_DATUM_ASSUMED_WGS84;GEODETIC_DATUM_INVALID;CONTINENT_DERIVED_FROM_COORDINATES;INSTITUTION_MATCH_NONE"
-101.566667,17.666667,"Senna reticulata",2629640593,"Playa La Ropa, al S de Zihuatanejo","MEX",100,1991,"PRESERVED_SPECIMEN","TYPE_STATUS_INVALID;OCCURRENCE_STATUS_INFERRED_FROM_INDIVIDUAL_COUNT;COORDINATE_ROUNDED;GEODETIC_DATUM_ASSUMED_WGS84;GEODETIC_DATUM_INVALID;CONTINENT_DERIVED_FROM_COORDINATES;INSTITUTION_MATCH_NONE"
-63.88333,-17.38333,"Senna reticulata",1260663551,"Faja Norte; 2 km NW de Comando (Yapacaní), sobre el camino a Choré. Bosque húmedo tropical en zona de llanura.","BOL",NA,1990,"PRESERVED_SPECIMEN","GEODETIC_DATUM_ASSUMED_WGS84;INSTITUTION_MATCH_FUZZY;COLLECTION_MATCH_NONE"
-69.25,7.56666,"Senna reticulata",1259104893,"Distrito Muñoz, Caño Caicara, 11 airline km W of Mantecal; gallery forest.","VEN",NA,1978,"PRESERVED_SPECIMEN","GEODETIC_DATUM_ASSUMED_WGS84;INSTITUTION_MATCH_FUZZY;COLLECTION_MATCH_NONE"
-78.62277,1.05055,"Senna reticulata",4031488344,"Lita-San Lorenzo Road, 25.1 Km E of Río Tululbí, 0.6 Km W of El Durango.","ECU",NA,1999,"PRESERVED_SPECIMEN","OCCURRENCE_STATUS_INFERRED_FROM_INDIVIDUAL_COUNT;GEODETIC_DATUM_ASSUMED_WGS84;INSTITUTION_MATCH_FUZZY;COLLECTION_MATCH_NONE"
-58.21666,6.49666,"Senna reticulata",1261513532,"Ceiba Biological Station, near Georgetown Guyana. Collected with: Dr. G. Bourne, Gertrude Young, Martin Young & Reuben Kertzious.","GUY",NA,1994,"PRESERVED_SPECIMEN","OCCURRENCE_STATUS_INFERRED_FROM_INDIVIDUAL_COUNT;GEODETIC_DATUM_ASSUMED_WGS84;INSTITUTION_MATCH_FUZZY;COLLECTION_MATCH_NONE"
-88.52222,16.85611,"Senna reticulata",1259530117,"Edge of Sittee River","BLZ",NA,1967,"PRESERVED_SPECIMEN","GEODETIC_DATUM_ASSUMED_WGS84;ELEVATION_NON_NUMERIC;INSTITUTION_MATCH_FUZZY;COLLECTION_MATCH_NONE"
-76.433333,-0.216667,"Senna reticulata",4032041561,"Parroquia San Roque. Comunidad Siona de Aboquëhuira, a 20 minutos de Posa Onda, aguas abajo. Bosque muy húmedo Tropical. Bosque intervenido. Suelo arcilloso rojizo. Proyecto Etnobotánico del Herbario Nacional, co-financiado por PetroEcuador.","ECU",NA,2004,"PRESERVED_SPECIMEN","OCCURRENCE_STATUS_INFERRED_FROM_INDIVIDUAL_COUNT;COORDINATE_ROUNDED;GEODETIC_DATUM_ASSUMED_WGS84;INSTITUTION_MATCH_FUZZY;COLLECTION_MATCH_NONE"
-85.93777,15.91888,"Senna reticulata",1259529522,"Orillas del río Negro, Trujillo. Bosque húmedo tropical","HND",NA,1983,"PRESERVED_SPECIMEN","GEODETIC_DATUM_ASSUMED_WGS84;ELEVATION_NON_NUMERIC;INSTITUTION_MATCH_FUZZY;COLLECTION_MATCH_NONE"
-76.7,7.86666,"Senna reticulata",1261860803,"Mpio. de Carepa; 2 km N of Carepa, grounds of ICA at Tulenapa, 120 ha tract of disturbed forest. Disturbed primary vegetation.","COL",NA,1987,"PRESERVED_SPECIMEN","OCCURRENCE_STATUS_INFERRED_FROM_INDIVIDUAL_COUNT;GEODETIC_DATUM_ASSUMED_WGS84;INSTITUTION_MATCH_FUZZY;COLLECTION_MATCH_NONE"
-89.98944,15.56805,"Senna reticulata",1259527875,"On the road from San Pedro Carcha to Cahabón, just passed Lanquin in the dept. of Alta Verapaz","GTM",NA,1991,"PRESERVED_SPECIMEN","GEODETIC_DATUM_ASSUMED_WGS84;INSTITUTION_MATCH_FUZZY;COLLECTION_MATCH_NONE"
-65.21666,6.58333,"Senna reticulata",1260661418,"Mpio. Cedeno. Cuenca alta del rio mato, extremo Norte de la Serrania de Maigualida.","VEN",NA,1989,"PRESERVED_SPECIMEN","GEODETIC_DATUM_ASSUMED_WGS84;INSTITUTION_MATCH_FUZZY;COLLECTION_MATCH_NONE"
-84.258333,13.761111,"Senna reticulata",1261545626,"Rosita, frente al Estadio; bosque húmedo tropical","NIC",NA,1982,"PRESERVED_SPECIMEN","OCCURRENCE_STATUS_INFERRED_FROM_INDIVIDUAL_COUNT;COORDINATE_ROUNDED;GEODETIC_DATUM_ASSUMED_WGS84;INSTITUTION_MATCH_FUZZY;COLLECTION_MATCH_NONE"
-81.7,8.21666,"Senna reticulata",1259533292,"320 km west of Panama City; roadside along Panamerican Highway; between Santiago and San Felix","PAN",NA,1977,"PRESERVED_SPECIMEN","GEODETIC_DATUM_ASSUMED_WGS84;ELEVATION_NON_NUMERIC;INSTITUTION_MATCH_FUZZY;COLLECTION_MATCH_NONE"
-87.633333,15.008056,"Senna reticulata",1261879956,"La Conce, orilla del río Sulaco, 28 km E y 4 km N de Santa Cruz de Yojoa.","HND",NA,1981,"PRESERVED_SPECIMEN","OCCURRENCE_STATUS_INFERRED_FROM_INDIVIDUAL_COUNT;COORDINATE_ROUNDED;GEODETIC_DATUM_ASSUMED_WGS84;INSTITUTION_MATCH_FUZZY;COLLECTION_MATCH_NONE"
-70.316667,-3.183333,"Senna reticulata",1261478199,"Municipio de Leticia; Corregimiento de Tarapacá; Parque Nacional Natural Amacayacu; Cabaña Pamaté (extremo nor-occidental del parque); trocha que sale de la cabaña, paralela al Caño Pamaté.","COL",NA,1991,"PRESERVED_SPECIMEN","OCCURRENCE_STATUS_INFERRED_FROM_INDIVIDUAL_COUNT;COORDINATE_ROUNDED;GEODETIC_DATUM_ASSUMED_WGS84;INSTITUTION_MATCH_FUZZY;COLLECTION_MATCH_NONE"
-60.35,-3.4,"Senna reticulata",1931183854,"Lago Janauacá. Flooded lake margin.","BRA",NA,1989,"PRESERVED_SPECIMEN","GEODETIC_DATUM_ASSUMED_WGS84;COLLECTION_MATCH_FUZZY"
-56.85,-16.75,"Senna reticulata",1928227223,"Pantanal, Rio Pixaim","BRA",NA,1991,"PRESERVED_SPECIMEN","GEODETIC_DATUM_ASSUMED_WGS84;COLLECTION_MATCH_FUZZY"
-88.53,15.77,"Senna reticulata",1929388257,"Puerto Barrios, approx. 15 km from town on the road to Machacas","GTM",NA,1988,"PRESERVED_SPECIMEN","GEODETIC_DATUM_ASSUMED_WGS84;COLLECTION_MATCH_FUZZY"
-84.97,11.72,"Senna reticulata",1929932869,"0.5 km SW of Rio Oyate, between Acoyapa and Morrito","NIC",NA,1983,"PRESERVED_SPECIMEN","GEODETIC_DATUM_ASSUMED_WGS84;COLLECTION_MATCH_FUZZY"
-64.3244,8.0556,"Senna reticulata",1931191465,"Municipio Boca del Pao. Bosque de Galeria del Rio Pao.","VEN",NA,1985,"PRESERVED_SPECIMEN","GEODETIC_DATUM_ASSUMED_WGS84;COLLECTION_MATCH_FUZZY"
-70.92,10.42,"Senna reticulata",1928208698,"Dtto. Bolívar: entre Las Tres Marías (área 8 km al este de El Pensado, o sea 12 km de Quirós) y el río Chiquito, trayecto de unos 8 km al sureste de Las Tres Marías.","VEN",NA,1980,"PRESERVED_SPECIMEN","GEODETIC_DATUM_ASSUMED_WGS84;COLLECTION_MATCH_FUZZY"
-85.63,10.27,"Senna reticulata",1927805563,"Near Sta. Cruz and the edge of the Rio Enmedio along the road to Playa Tamarindo","CRI",NA,1966,"PRESERVED_SPECIMEN","GEODETIC_DATUM_ASSUMED_WGS84;COLLECTION_MATCH_FUZZY"
-79.48,1,"Senna reticulata",1930026843,"Carretera Chontaduro-Rio Verde Km 3-10","ECU",NA,1982,"PRESERVED_SPECIMEN","GEODETIC_DATUM_ASSUMED_WGS84;COLLECTION_MATCH_FUZZY"
-76.92,4.67,"Senna reticulata",1930065932,"Hoya del Rio San Juan. Río San Juan, abajo de Noanamá","COL",NA,1979,"PRESERVED_SPECIMEN","GEODETIC_DATUM_ASSUMED_WGS84;COLLECTION_MATCH_FUZZY"
-68.03,-9.8,"Senna reticulata",1928516791,"Rio Branco-Sena Madureira road 33km from Rio Branco, near the INPA building (old airport terminal)","BRA",NA,1980,"PRESERVED_SPECIMEN","GEODETIC_DATUM_ASSUMED_WGS84;COLLECTION_MATCH_FUZZY"
-78.15,-2.52,"Senna reticulata",1929656360,"Centro Shuar Yukutais. 10km S Sucua, Rio Upano, house of J. Cristobal Antuash","ECU",NA,1988,"PRESERVED_SPECIMEN","GEODETIC_DATUM_ASSUMED_WGS84;COLLECTION_MATCH_FUZZY"
-57.0369,-1.0919,"Senna reticulata",1929461058,"Cachoeira Porteira","BRA",NA,1980,"PRESERVED_SPECIMEN","COLLECTION_MATCH_FUZZY"
-70.236213,1.252556,"Senna reticulata",1928234253,"Mitú and vicinity along Río Vaupés at Mitú.","COL",NA,1976,"PRESERVED_SPECIMEN","COORDINATE_ROUNDED;COLLECTION_MATCH_FUZZY"
-48.417263,-1.440264,"Senna reticulata",1927786882,"Mocambo","BRA",NA,1999,"PRESERVED_SPECIMEN","COORDINATE_ROUNDED;COLLECTION_MATCH_FUZZY"
-56.6238383,-16.2605995,"Senna reticulata",1928279628,"Poconé- Estr. Transpantaneira- km 20","BRA",NA,1989,"PRESERVED_SPECIMEN","COORDINATE_REPROJECTED;COLLECTION_MATCH_FUZZY"
-72.2333,8.958269,"Senna reticulata",3091187621,"12 km S of Encontrados","VEN",9749,1989,"PRESERVED_SPECIMEN","CONTINENT_DERIVED_FROM_COORDINATES;INSTITUTION_MATCH_FUZZY;COLLECTION_MATCH_NONE"
-82.4333,8.4333,"Senna reticulata",3091236290,"50 km E of David","PAN",NA,1979,"PRESERVED_SPECIMEN","GEODETIC_DATUM_ASSUMED_WGS84;CONTINENT_DERIVED_FROM_COORDINATES;INSTITUTION_MATCH_FUZZY;COLLECTION_MATCH_NONE"
-73.74335,8.32595,"Senna reticulata",772811535,"Ciénaga Juncal - Baquero","COL",NA,2012,"HUMAN_OBSERVATION","GEODETIC_DATUM_ASSUMED_WGS84;CONTINENT_DERIVED_FROM_COORDINATES"
-52.916667,2.133333,"Senna reticulata",1314820384,"Amapá","BRA",NA,1960,"PRESERVED_SPECIMEN","COORDINATE_ROUNDED;GEODETIC_DATUM_ASSUMED_WGS84;INSTITUTION_MATCH_FUZZY;COLLECTION_MATCH_NONE"
-65.325833,-4.915,"Senna reticulata",1314919817,"Base de Operações Geólogo Pedro de Moura","BRA",NA,2008,"PRESERVED_SPECIMEN","COORDINATE_ROUNDED;GEODETIC_DATUM_ASSUMED_WGS84;INSTITUTION_MATCH_FUZZY;COLLECTION_MATCH_NONE"
-50.63867,-1.82856,"Senna reticulata",2365693896,"Comunidade Santa Rosa","BRA",NA,2016,"PRESERVED_SPECIMEN","GEODETIC_DATUM_ASSUMED_WGS84;INSTITUTION_MATCH_FUZZY;COLLECTION_MATCH_NONE"
-55.831999,-1.768258,"Senna reticulata",1930369805,"Rio Trombetas, margem esquerda, lago Iripixi.","BRA",NA,1980,"PRESERVED_SPECIMEN","COORDINATE_ROUNDED;COLLECTION_MATCH_FUZZY"
-76.83,7.75,"Senna reticulata",1930539671,"Near Río León approx. 20 to 30 km. upstream and south of the river mouth and approx. 15 km. west of Chigorodó.","COL",NA,1962,"PRESERVED_SPECIMEN","GEODETIC_DATUM_ASSUMED_WGS84;COLLECTION_MATCH_FUZZY"
-75.22,-10.2,"Senna reticulata",1930362080,"In vicinity of Proyecto Especial Pichis-Palcazu camp in Iscozacin, Rio Iscozacin, tributary of the Rio Palcazu.","PER",NA,1986,"PRESERVED_SPECIMEN","GEODETIC_DATUM_ASSUMED_WGS84;COLLECTION_MATCH_FUZZY"
-79.43,-1.12,"Senna reticulata",1929591857,"Road Quevedo - Babahoyo at San Carlos","ECU",NA,1980,"PRESERVED_SPECIMEN","GEODETIC_DATUM_ASSUMED_WGS84;COLLECTION_MATCH_FUZZY"
-62.245703,-5.686537,"Senna reticulata",1930302922,"Estrada Manaus-Porto Velho, Proj. RADAM","BRA",NA,1976,"PRESERVED_SPECIMEN","COORDINATE_ROUNDED;COLLECTION_MATCH_FUZZY"
-64.879289,-3.449167,"Senna reticulata",1928179913,"Lago de Tefé, Manua","BRA",NA,1973,"PRESERVED_SPECIMEN","COORDINATE_ROUNDED;COLLECTION_MATCH_FUZZY"
-69.28,-12.83,"Senna reticulata",1931172660,"Rio Tambopata. Comunidad Nativa de Infierno. Hermosa Chica. Centro Ñape","PER",NA,1991,"PRESERVED_SPECIMEN","GEODETIC_DATUM_ASSUMED_WGS84;COLLECTION_MATCH_FUZZY"
-87.17,15.67,"Senna reticulata",1931270520,"Aldea San Antonio, 60 km before Tela on road to La Ceiba","HND",NA,1987,"PRESERVED_SPECIMEN","GEODETIC_DATUM_ASSUMED_WGS84;COLLECTION_MATCH_FUZZY"
-86.63,12,"Senna reticulata",1931192732,"Orilla del Rio de Salamina, El Charco, a 13 km de la carretera a Montelimar","NIC",NA,1980,"PRESERVED_SPECIMEN","GEODETIC_DATUM_ASSUMED_WGS84;COLLECTION_MATCH_FUZZY"
-69.58,-13.08,"Senna reticulata",1928967013,"Confluence of rivers Tambopata and Chuncho","PER",NA,1989,"PRESERVED_SPECIMEN","GEODETIC_DATUM_ASSUMED_WGS84;COLLECTION_MATCH_FUZZY"
-79.28,-1.78,"Senna reticulata",1930694718,"Surroundings of Montalvo (foothills of the Andes, ca. 40 km E of Babahoyo).","ECU",NA,1973,"PRESERVED_SPECIMEN","GEODETIC_DATUM_ASSUMED_WGS84;COLLECTION_MATCH_FUZZY"
-85.82,15.13,"Senna reticulata",1929269163,"Along Río Olancho, on road between Gualaco and San Estéban at Río San Martin, 19.3 mi E from Gualaco; 8.7 mi SW of San Estéban","HND",NA,1987,"PRESERVED_SPECIMEN","GEODETIC_DATUM_ASSUMED_WGS84;COLLECTION_MATCH_FUZZY"
-75.583333,-2.666667,"Senna reticulata",1258276740,"Vista Alegre, río Tigre. Rainforest, mostly along river's edge and around village.","PER",NA,1987,"PRESERVED_SPECIMEN","OCCURRENCE_STATUS_INFERRED_FROM_INDIVIDUAL_COUNT;COORDINATE_ROUNDED;GEODETIC_DATUM_ASSUMED_WGS84;INSTITUTION_MATCH_FUZZY;COLLECTION_MATCH_NONE"
-80.613056,7.743611,"Senna reticulata",1259531763,"4 mi southeast of Los Pozos","PAN",NA,1966,"PRESERVED_SPECIMEN","OCCURRENCE_STATUS_INFERRED_FROM_INDIVIDUAL_COUNT;COORDINATE_ROUNDED;GEODETIC_DATUM_ASSUMED_WGS84;INSTITUTION_MATCH_FUZZY;COLLECTION_MATCH_NONE"
-89.3,13.483333,"Senna reticulata",1259911973,"San Diego, el Amatal.","SLV",NA,1995,"PRESERVED_SPECIMEN","OCCURRENCE_STATUS_INFERRED_FROM_INDIVIDUAL_COUNT;COORDINATE_ROUNDED;GEODETIC_DATUM_ASSUMED_WGS84;INSTITUTION_MATCH_FUZZY;COLLECTION_MATCH_NONE"
-89.37666,13.49361,"Senna reticulata",1259527863,"7 km West of La Libertad. Collection from thickets along Río Grande","SLV",NA,1970,"PRESERVED_SPECIMEN","GEODETIC_DATUM_ASSUMED_WGS84;INSTITUTION_MATCH_FUZZY;COLLECTION_MATCH_NONE"
-75.13333,6.03333,"Senna reticulata",1259032684,"vereda La Piñuela, carretera a San Francisco; bmh-T/bp-PM","COL",NA,1991,"PRESERVED_SPECIMEN","GEODETIC_DATUM_ASSUMED_WGS84;INSTITUTION_MATCH_FUZZY;COLLECTION_MATCH_NONE"
-83.95916,9.99138,"Senna reticulata",4031650496,"Cuenca del Tárcoles. Coronado, Las Nubes.","CRI",NA,1997,"PRESERVED_SPECIMEN","GEODETIC_DATUM_ASSUMED_WGS84;INSTITUTION_MATCH_FUZZY;COLLECTION_MATCH_NONE"
