"lon","lat","species","gbifID","locality","countryCode","coordinateUncertaintyInMeters","year","basisOfRecord","issue"
-79.9,-1.33,"Senna reticulata",1096736954,"Flora of Ecuador, Guayas, Hacienda Piedad, 3 km N of Balzar along Rio Daule","ECU",NA,1973,"PRESERVED_SPECIMEN","GEODETIC_DATUM_ASSUMED_WGS84;CONTINENT_DERIVED_FROM_COORDINATES;CONTINENT_INVALID;INSTITUTION_COLLECTION_MISMATCH"
-60.1333,7.5,"Senna reticulata",1456370621,"Matthews Ridge railyard of Railway Bond Bldg","GUY",NA,1991,"PRESERVED_SPECIMEN","GEODETIC_DATUM_ASSUMED_WGS84"
-43.0223445,-6.7704038,"Senna reticulata",1928200894,"Arredores de Floriano","BRA",NA,1964,"PRESERVED_SPECIMEN","COORDINATE_REPROJECTED;COLLECTION_MATCH_FUZZY"
-85.92,11.9,"Senna reticulata",1930680963,"Puerto Asese, small islands in Lago de Nicaragua","NIC",NA,1981,"PRESERVED_SPECIMEN","GEODETIC_DATUM_ASSUMED_WGS84;COLLECTION_MATCH_FUZZY"
-84.83,15.72,"Senna reticulata",1931058947,"Between Bolivar (Rio Platano) and camp","HND",NA,1981,"PRESERVED_SPECIMEN","GEODETIC_DATUM_ASSUMED_WGS84;COLLECTION_MATCH_FUZZY"
-69.341755,-3.615191,"Senna reticulata",1930288023,"Rio Solimões, Bairro de Odorio.","BRA",NA,1973,"PRESERVED_SPECIMEN","COORDINATE_ROUNDED;COLLECTION_MATCH_FUZZY"
-58.485,4.435556,"Senna reticulata",1927956052,"Iwokrama Reserve. Essequibo River; Pisham Pisham Falls and upriver channels","GUY",NA,1995,"PRESERVED_SPECIMEN","COORDINATE_ROUNDED;GEODETIC_DATUM_ASSUMED_WGS84;COLLECTION_MATCH_FUZZY"
-74.93,-9.62,"Senna reticulata",1928087412,"Panguana, Rio Yuyapichis, affluent to Rio Pachitea.","PER",NA,1983,"PRESERVED_SPECIMEN","GEODETIC_DATUM_ASSUMED_WGS84;COLLECTION_MATCH_FUZZY"
-67.790513,-10.036803,"Senna reticulata",1930571002,"Parque Municipal Chico Mendes, Rodovia AC-40 Km 10.","BRA",NA,2007,"PRESERVED_SPECIMEN","COORDINATE_ROUNDED;GEODETIC_DATUM_ASSUMED_WGS84;COLLECTION_MATCH_FUZZY"
-62.878443,-4.995765,"Senna reticulata",1930999733,"Rio Purus between Campina and Tambaqui.","BRA",NA,1971,"PRESERVED_SPECIMEN","COLLECTION_MATCH_FUZZY"
-60.6218414,-3.303106,"Senna reticulata",1930957625,"[lower R. Solimões] proximo ao acampamento da sub-base do projeto RADAM.","BRA",NA,1976,"PRESERVED_SPECIMEN","COORDINATE_REPROJECTED;COLLECTION_MATCH_FUZZY"
-85.833,13.7,"Senna reticulata",1928947736,"Camino entre Wiwilí y El Carmen, sobre los márgenes del Río Coco","NIC",NA,1980,"PRESERVED_SPECIMEN","GEODETIC_DATUM_ASSUMED_WGS84;COLLECTION_MATCH_FUZZY"
-79.72,-2.1,"Senna reticulata",1930638884,"Road Babahoyo - Guayaquil, near Yaguachi Nuevo","ECU",NA,1980,"PRESERVED_SPECIMEN","GEODETIC_DATUM_ASSUMED_WGS84;COLLECTION_MATCH_FUZZY"
-47.46989,-7.33161,"Senna reticulata",1929532627,"5 km. northeast of Carolina, beside Rio Beirao","BRA",NA,1964,"PRESERVED_SPECIMEN","COLLECTION_MATCH_FUZZY"
-78.71666,1,"Senna reticulata",1261912223,"Carretera Concepción-Urbina. Colecciones en el borde del camino. Bosque secundario y matorral. Bosque muy húmedo Tropical.","ECU",NA,1993,"PRESERVED_SPECIMEN","GEODETIC_DATUM_ASSUMED_WGS84;INSTITUTION_MATCH_NONE"
-88.1,13.916667,"Senna reticulata",1257538934,"A.P. Río Sapo; puente abajo, límite sur de área.","SLV",NA,2005,"PRESERVED_SPECIMEN","OCCURRENCE_STATUS_INFERRED_FROM_INDIVIDUAL_COUNT;COORDINATE_ROUNDED;GEODETIC_DATUM_ASSUMED_WGS84;DIFFERENT_OWNER_INSTITUTION"
-75.017778,-10.428333,"Senna reticulata",4062019453,"Distrito Puerto Bermúdez. Bosque de Protección San Matías San Carlos.","PER",NA,2017,"PRESERVED_SPECIMEN","OCCURRENCE_STATUS_INFERRED_FROM_INDIVIDUAL_COUNT;COORDINATE_ROUNDED;GEODETIC_DATUM_ASSUMED_WGS84;DIFFERENT_OWNER_INSTITUTION"
-74.91666,7.06666,"Senna reticulata",4061293608,"Mina La vetilla, margen derecha quebrada Vetillita.","COL",NA,1991,"PRESERVED_SPECIMEN","GEODETIC_DATUM_ASSUMED_WGS84;DIFFERENT_OWNER_INSTITUTION"
-75.458333,-9.908333,"Senna reticulata",1257706493,"Dist. Palcazú. Puerto Mayro.","PER",NA,2006,"PRESERVED_SPECIMEN","OCCURRENCE_STATUS_INFERRED_FROM_INDIVIDUAL_COUNT;COORDINATE_ROUNDED;GEODETIC_DATUM_ASSUMED_WGS84;DIFFERENT_OWNER_INSTITUTION"
-77.366667,-0.733333,"Senna reticulata",4061144427,"Cantón Archidona. Avila Nueva. Al pie del Volcán Sumaco, al lado del Río Huataraco. Carretera Hollín-Loreto, km 70. Bosque muy húmedo Tropical. Bosque perturbado.","ECU",NA,1989,"PRESERVED_SPECIMEN","OCCURRENCE_STATUS_INFERRED_FROM_INDIVIDUAL_COUNT;COORDINATE_ROUNDED;GEODETIC_DATUM_ASSUMED_WGS84;DIFFERENT_OWNER_INSTITUTION"
-73.749444,9.318889,"Senna reticulata",1427584755,"Entre el cerro El Ecce Homo y Caño Largo","COL",NA,2015,"PRESERVED_SPECIMEN","COORDINATE_ROUNDED;GEODETIC_DATUM_ASSUMED_WGS84;CONTINENT_DERIVED_FROM_COORDINATES;INSTITUTION_MATCH_NONE;MULTIMEDIA_URI_INVALID"
-93.560339,16.697435,"Senna reticulata",2574202722,"","MEX",NA,2015,"HUMAN_OBSERVATION","CONTINENT_DERIVED_FROM_COORDINATES"
-83.220889,8.698239,"Senna reticulata",3355207318,"","CRI",1243,2018,"HUMAN_OBSERVATION","COORDINATE_ROUNDED;CONTINENT_DERIVED_FROM_COORDINATES"
-45.05,-7.5,"Senna reticulata",2998208579,"Ilha de Balsas region, between the Rios Balsas e Parnaíba. Santa Bárbara, due SSE of Lorêto, on shore of Rio Parnaíba. Flat river plain, less than 1 km. wide, several meters above river level. Property of Dona Luzia, 1/2 km N of river.","BRA",NA,1962,"PRESERVED_SPECIMEN","GEODETIC_DATUM_ASSUMED_WGS84;CONTINENT_DERIVED_FROM_COORDINATES;INSTITUTION_MATCH_FUZZY;COLLECTION_MATCH_FUZZY"
-43.18,-13.12,"Senna reticulata",2998567144,"Basin of the Upper S o Francisco. Morr o, at about 32km from Bom Jesus da Lapa, NE behyond Calder o.","BRA",NA,1980,"PRESERVED_SPECIMEN","COORDINATE_ROUNDED;GEODETIC_DATUM_ASSUMED_WGS84;CONTINENT_DERIVED_FROM_COORDINATES;INSTITUTION_MATCH_FUZZY;COLLECTION_MATCH_FUZZY"
-49.616667,-0.6,"Senna reticulata",2998483338,"On Rio Mocoões, Fazenda Fura Olho.","BRA",NA,1987,"PRESERVED_SPECIMEN","RECORDED_DATE_INVALID;COORDINATE_ROUNDED;GEODETIC_DATUM_ASSUMED_WGS84;CONTINENT_DERIVED_FROM_COORDINATES;INSTITUTION_MATCH_FUZZY;COLLECTION_MATCH_FUZZY"
-45.066667,-7.383333,"Senna reticulata",2998483893,"Ilha de Balsas region, between the Rios Balsas and Parnaíba. Ca. 200 m S of main house of Fazenda Morros, about 35 Km. south of Loreto.","BRA",NA,1962,"PRESERVED_SPECIMEN","COORDINATE_ROUNDED;GEODETIC_DATUM_ASSUMED_WGS84;CONTINENT_DERIVED_FROM_COORDINATES;INSTITUTION_MATCH_FUZZY;COLLECTION_MATCH_FUZZY"
-61.7,3.5,"Senna reticulata",2998480044,"Reserva Ecológica de Maracá. North side of islands at Três Igarapés. Ca. 1km up Igarapé from sub-camp.","BRA",NA,1987,"PRESERVED_SPECIMEN","GEODETIC_DATUM_ASSUMED_WGS84;CONTINENT_DERIVED_FROM_COORDINATES;INSTITUTION_MATCH_FUZZY;COLLECTION_MATCH_FUZZY"
-92.808333,16.558333,"Senna reticulata",1895137780,"Acala","MEX",100,1984,"PRESERVED_SPECIMEN","TYPE_STATUS_INVALID;OCCURRENCE_STATUS_INFERRED_FROM_INDIVIDUAL_COUNT;COORDINATE_ROUNDED;GEODETIC_DATUM_ASSUMED_WGS84;GEODETIC_DATUM_INVALID;CONTINENT_DERIVED_FROM_COORDINATES;ELEVATION_MIN_MAX_SWAPPED;INSTITUTION_MATCH_NONE"
-93.243055,17.088333,"Senna reticulata",1895137816,"El rosario","MEX",90,2001,"PRESERVED_SPECIMEN","TYPE_STATUS_INVALID;OCCURRENCE_STATUS_INFERRED_FROM_INDIVIDUAL_COUNT;COORDINATE_ROUNDED;GEODETIC_DATUM_ASSUMED_WGS84;GEODETIC_DATUM_INVALID;CONTINENT_DERIVED_FROM_COORDINATES;ELEVATION_MIN_MAX_SWAPPED;INSTITUTION_MATCH_NONE"
-92.851111,15.986944,"Senna reticulata",1895137764,"Cerca de la Tigrilla","MEX",100,1951,"PRESERVED_SPECIMEN","TYPE_STATUS_INVALID;OCCURRENCE_STATUS_INFERRED_FROM_INDIVIDUAL_COUNT;COORDINATE_ROUNDED;GEODETIC_DATUM_ASSUMED_WGS84;GEODETIC_DATUM_INVALID;CONTINENT_DERIVED_FROM_COORDINATES;ELEVATION_MIN_MAX_SWAPPED;INSTITUTION_MATCH_NONE"
-93.835,16.558333,"Senna reticulata",1895137748,"Rancho BIAkmUN","MEX",100,1999,"PRESERVED_SPECIMEN","TYPE_STATUS_INVALID;OCCURRENCE_STATUS_INFERRED_FROM_INDIVIDUAL_COUNT;COORDINATE_ROUNDED;GEODETIC_DATUM_ASSUMED_WGS84;GEODETIC_DATUM_INVALID;CONTINENT_DERIVED_FROM_COORDINATES;ELEVATION_MIN_MAX_SWAPPED;INSTITUTION_MATCH_NONE"
-95.96583,15.83694,"Senna reticulata",2807321482,"Santiago astata","MEX",NA,1999,"PRESERVED_SPECIMEN","GEODETIC_DATUM_ASSUMED_WGS84;INSTITUTION_MATCH_FUZZY;COLLECTION_MATCH_FUZZY"
-96.00889,15.9075,"Senna reticulata",2807380140,"San miguel del puerto","MEX",NA,1999,"PRESERVED_SPECIMEN","GEODETIC_DATUM_ASSUMED_WGS84;INSTITUTION_MATCH_FUZZY;COLLECTION_MATCH_FUZZY"
-52.316667,3.166667,"Senna reticulata",1087016869,"","BRA",NA,1960,"PRESERVED_SPECIMEN","GEODETIC_DATUM_ASSUMED_WGS84;CONTINENT_DERIVED_FROM_COORDINATES;DIFFERENT_OWNER_INSTITUTION"
-74.630333,4.312,"Senna reticulata",1703244285,"Vereda San Jerónimo. Condominio Potreritos de Nilo","COL",NA,2015,"PRESERVED_SPECIMEN","OCCURRENCE_STATUS_INFERRED_FROM_INDIVIDUAL_COUNT;COORDINATE_ROUNDED;GEODETIC_DATUM_ASSUMED_WGS84;CONTINENT_DERIVED_FROM_COORDINATES;INSTITUTION_MATCH_NONE"
-84.57669,9.80775,"Senna reticulata",3763006634,"Costa Rica: Garabito: Tárcoles. P. N. Carara. Bosques a orillas del Río Carara. Arbusto de más o menos 3 m. Frutos secos negros. En playón del río Carara. Abundante. lifestage: fruiting. Alt.: 45 m.2004-03-09, Leg.: Acosta,L. & Lizano,G. 3384.","CRI",NA,2004,"PRESERVED_SPECIMEN","GEODETIC_DATUM_ASSUMED_WGS84;CONTINENT_DERIVED_FROM_COORDINATES;INSTITUTION_MATCH_FUZZY"
-90.06667,13.71667,"Senna reticulata",3913400378,"El Salvador: Depto. Usulután, San Francisco Menéndez, Colonia ISTA, Calle secundaria de la comunidad. Habitando fuera de una vivienda. . Árbol pequeño de aprox. 4 m; flores amarillas, vistosas; frutos verdes, erectos. Alt.: 15 m.2009-12-15, Leg.: Rodríguez,D., Gruber,K. & Monterrosa,J. 1819 [DR-01819].","SLV",NA,2009,"PRESERVED_SPECIMEN","GEODETIC_DATUM_ASSUMED_WGS84;CONTINENT_DERIVED_FROM_COORDINATES;INSTITUTION_MATCH_FUZZY"
-93.205238,15.551468,"Senna reticulata",1990458432,"","MEX",NA,2018,"HUMAN_OBSERVATION","COORDINATE_ROUNDED;CONTINENT_DERIVED_FROM_COORDINATES"
-82.568626,9.472936,"Senna reticulata",3383923692,"","PAN",NA,2021,"HUMAN_OBSERVATION","COORDINATE_ROUNDED;CONTINENT_DERIVED_FROM_COORDINATES"
-93.107771,16.618249,"Senna reticulata",1990475677,"","MEX",61,2014,"HUMAN_OBSERVATION","COORDINATE_ROUNDED;CONTINENT_DERIVED_FROM_COORDINATES"
-58.6167,6.53333,"Senna reticulata",1456137483,"Radius of 0.5 km around Goldmine settlement","GUY",NA,1992,"PRESERVED_SPECIMEN","GEODETIC_DATUM_ASSUMED_WGS84"
-79.63,9.03083,"Senna reticulata",1258706674,"Near Paraiso","PAN",NA,1971,"PRESERVED_SPECIMEN","GEODETIC_DATUM_ASSUMED_WGS84;INSTITUTION_MATCH_FUZZY;COLLECTION_MATCH_NONE"
-78.054167,7.498889,"Senna reticulata",1259535481,"Mamey.","PAN",NA,1982,"PRESERVED_SPECIMEN","OCCURRENCE_STATUS_INFERRED_FROM_INDIVIDUAL_COUNT;COORDINATE_ROUNDED;GEODETIC_DATUM_ASSUMED_WGS84;INSTITUTION_MATCH_FUZZY;COLLECTION_MATCH_NONE"
-79.63333,0.88333,"Senna reticulata",1260662151,"Vic. San Mateo, tropical moist forest.","ECU",NA,1985,"PRESERVED_SPECIMEN","GEODETIC_DATUM_ASSUMED_WGS84;INSTITUTION_MATCH_FUZZY;COLLECTION_MATCH_NONE"
-79.380556,9.083333,"Senna reticulata",1259533974,"1 mile east of Tocumen Airport on side road off Inter-American Highway.","PAN",NA,1965,"PRESERVED_SPECIMEN","OCCURRENCE_STATUS_INFERRED_FROM_INDIVIDUAL_COUNT;COORDINATE_ROUNDED;GEODETIC_DATUM_ASSUMED_WGS84;INSTITUTION_MATCH_FUZZY;COLLECTION_MATCH_NONE"
-79.36027,-0.475,"Senna reticulata",1259786623,"Sto. Domingo-Quevedo-road Km 35. Hacienda Margarita. Along small river and field edges.","ECU",NA,1981,"PRESERVED_SPECIMEN","GEODETIC_DATUM_ASSUMED_WGS84;INSTITUTION_MATCH_FUZZY;COLLECTION_MATCH_NONE"
-84.554528,10.719945,"Senna reticulata",2268820649,"El Amparo. La Trinidad. De la localidad de Santa Cecilia de los Chiles 1.5 KM sobre la carretera al Oeste y 800 m al Norte. Finca de ASOMAT.","CRI",NA,2010,"PRESERVED_SPECIMEN","OCCURRENCE_STATUS_INFERRED_FROM_INDIVIDUAL_COUNT;COORDINATE_ROUNDED;GEODETIC_DATUM_ASSUMED_WGS84;INSTITUTION_MATCH_FUZZY;COLLECTION_MATCH_NONE"
-76.009167,-7.348333,"Senna reticulata",2558279620,"Distrito Pampa Hermosa. Parque Nacional Cordilleras Azul. Sector Shanshuico.","PER",NA,2018,"PRESERVED_SPECIMEN","OCCURRENCE_STATUS_INFERRED_FROM_INDIVIDUAL_COUNT;COORDINATE_ROUNDED;GEODETIC_DATUM_ASSUMED_WGS84;INSTITUTION_MATCH_FUZZY;COLLECTION_MATCH_NONE"
-85.430278,14.1,"Senna reticulata",4031679306,"Municipio de Wiwilí, comunidad Boca de Plis, Reserva Bosawas, Territorio Tasbaika Kum, parcela 3, finca de Arnulfo Herraride 800 m al oeste de la comunidad","NIC",NA,2008,"PRESERVED_SPECIMEN","OCCURRENCE_STATUS_INFERRED_FROM_INDIVIDUAL_COUNT;COORDINATE_ROUNDED;GEODETIC_DATUM_ASSUMED_WGS84;INSTITUTION_MATCH_FUZZY;COLLECTION_MATCH_NONE"
-83.02,9.67,"Senna reticulata",1258297996,"Res. Biológica Hitoy-Cerere Alrededores de la Estación. Valle de la Estrella. Bosque primario","CRI",NA,1991,"PRESERVED_SPECIMEN","OCCURRENCE_STATUS_INFERRED_FROM_INDIVIDUAL_COUNT;GEODETIC_DATUM_ASSUMED_WGS84;INSTITUTION_MATCH_FUZZY;COLLECTION_MATCH_NONE"
-80.963611,8.215,"Senna reticulata",1259533715,"Road to Santa Fe, 15 km from Santiago.","PAN",NA,1976,"PRESERVED_SPECIMEN","OCCURRENCE_STATUS_INFERRED_FROM_INDIVIDUAL_COUNT;COORDINATE_ROUNDED;GEODETIC_DATUM_ASSUMED_WGS84;INSTITUTION_MATCH_FUZZY;COLLECTION_MATCH_NONE"
-79.73333,0.35,"Senna reticulata",4032010402,"Bilsa Biological Reserve. Montañas de Mache, 35 km W of Quinind, 5 km W of Santa Isabela. Premontane Wet Forest. Primary and disturbed forest along Old Mono Road.","ECU",NA,1994,"PRESERVED_SPECIMEN","GEODETIC_DATUM_ASSUMED_WGS84;INSTITUTION_MATCH_FUZZY;COLLECTION_MATCH_NONE"
-66.06666,-15.85,"Senna reticulata",1260661203,"Prov. Moxos, colectas a orillas del rio chirizi, 130 km San Ignacio. U. de Princeton. Bosque primario, areno arcilloso, En la orilla del rio.","BOL",NA,1991,"PRESERVED_SPECIMEN","GEODETIC_DATUM_ASSUMED_WGS84;INSTITUTION_MATCH_FUZZY;COLLECTION_MATCH_NONE"
-73.98361,-4.74555,"Senna reticulata",1260744505,"Dist. Nauta, localidad de Yarina, río Yanayacu, Bosque primario","PER",NA,2006,"PRESERVED_SPECIMEN","OCCURRENCE_STATUS_INFERRED_FROM_INDIVIDUAL_COUNT;GEODETIC_DATUM_ASSUMED_WGS84;INSTITUTION_MATCH_FUZZY;COLLECTION_MATCH_NONE"
-76.28333,-6.33333,"Senna reticulata",1258235163,"Along Río Yurimaguas, Km 62 of Tarapoto-Yurimaguas road. Secondary forest and field edges.","PER",NA,1986,"PRESERVED_SPECIMEN","OCCURRENCE_STATUS_INFERRED_FROM_INDIVIDUAL_COUNT;GEODETIC_DATUM_ASSUMED_WGS84;INSTITUTION_MATCH_FUZZY;COLLECTION_MATCH_NONE"
-87.614167,14.598333,"Senna reticulata",1258557453,"Aldea Churune a 20 km al N de Comayagua.","HND",NA,1986,"PRESERVED_SPECIMEN","OCCURRENCE_STATUS_INFERRED_FROM_INDIVIDUAL_COUNT;COORDINATE_ROUNDED;GEODETIC_DATUM_ASSUMED_WGS84;INSTITUTION_MATCH_FUZZY;COLLECTION_MATCH_NONE"
-60.77166,-14.56277,"Senna reticulata",4031941710,"Parque Nacional Noel Kempff Mercado. Los Fierros. Cerrado en la pendiente de la serrañia Caparuch con Hancornia,Vochysia,Cassia. Substrato duricosta ferruginosa y latosol.","BOL",NA,1993,"PRESERVED_SPECIMEN","GEODETIC_DATUM_ASSUMED_WGS84;INSTITUTION_MATCH_FUZZY;COLLECTION_MATCH_NONE"
-92.36,17.18,"Senna reticulata",1258557452,"Chitallik","MEX",NA,1984,"PRESERVED_SPECIMEN","OCCURRENCE_STATUS_INFERRED_FROM_INDIVIDUAL_COUNT;GEODETIC_DATUM_ASSUMED_WGS84;INSTITUTION_MATCH_FUZZY;COLLECTION_MATCH_NONE"
-89.03194,16.19916,"Senna reticulata",1258557442,"7 millas de la entrada Mafradi al NW camino a Blue Creek. Selva alta perennifolia, riparia","BLZ",NA,1982,"PRESERVED_SPECIMEN","GEODETIC_DATUM_ASSUMED_WGS84;INSTITUTION_MATCH_FUZZY;COLLECTION_MATCH_NONE"
-79.836342,9.164995,"Senna reticulata",3773567409,"","PAN",5,2018,"HUMAN_OBSERVATION","COORDINATE_ROUNDED;CONTINENT_DERIVED_FROM_COORDINATES"
-73.05,-4,"Senna reticulata",1931125823,"Mouth of Rió Tamshiyaco and Rió Amazonas.","PER",NA,1990,"PRESERVED_SPECIMEN","GEODETIC_DATUM_ASSUMED_WGS84;COLLECTION_MATCH_FUZZY"
-53.2,3.62,"Senna reticulata",1930023871,"Saül. Vicinity of airstrip","GUF",NA,1987,"PRESERVED_SPECIMEN","GEODETIC_DATUM_ASSUMED_WGS84;COLLECTION_MATCH_FUZZY"
-63.547121,1.576736,"Senna reticulata",1929129255,"Basin of Rio Demeni, vicinity of Tototobí","BRA",NA,1969,"PRESERVED_SPECIMEN","COORDINATE_ROUNDED;COLLECTION_MATCH_FUZZY"
-55.55,4.82,"Senna reticulata",1929610756,"Bank of Saramaca river near Kwattahede.","SUR",NA,1951,"PRESERVED_SPECIMEN","GEODETIC_DATUM_ASSUMED_WGS84;COLLECTION_MATCH_FUZZY"
-69.9164,-4.3331,"Senna reticulata",1929944550,"Ilha Aramaçá, almost opposite Tabatinga","BRA",NA,1973,"PRESERVED_SPECIMEN","COLLECTION_MATCH_FUZZY"
-58.5,-3.833333,"Senna reticulata",1929461315,"Ilha Tupinambarana, paraná Urariá, white water, between rio Abacaxis and rio Paraconi","BRA",NA,1983,"PRESERVED_SPECIMEN","GEODETIC_DATUM_ASSUMED_WGS84;COLLECTION_MATCH_FUZZY"
-73.65,-7.48,"Senna reticulata",1930172855,"Margin of Río Azul","BRA",NA,1986,"PRESERVED_SPECIMEN","GEODETIC_DATUM_ASSUMED_WGS84;COLLECTION_MATCH_FUZZY"
-64.28,10.17,"Senna reticulata",1929429305,"Distrito Sucre: El Guayabito, along the Río Guayabo at its juncture with the Río Zumbador (future basin of Represa Neverí).","VEN",NA,1981,"PRESERVED_SPECIMEN","GEODETIC_DATUM_ASSUMED_WGS84;COLLECTION_MATCH_FUZZY"
-42.868031,-20.761343,"Senna reticulata",1930997492,"State Agricultural School, Viçosa","BRA",NA,1958,"PRESERVED_SPECIMEN","COORDINATE_ROUNDED;COLLECTION_MATCH_FUZZY"
-67.8116845,-9.9782424,"Senna reticulata",1931329072,"Estrada do Amapá, Km 2","BRA",NA,1997,"PRESERVED_SPECIMEN","COORDINATE_REPROJECTED;COLLECTION_MATCH_FUZZY"
-61.09,-2.3564,"Senna reticulata",1929341942,"Rio Negro between Ilha Jacaré & Airão.","BRA",NA,1971,"PRESERVED_SPECIMEN","COLLECTION_MATCH_FUZZY"
-71.61821,-4.530041,"Senna reticulata",1928233490,"Rio Javari, north of Estirão de Equador","BRA",NA,1973,"PRESERVED_SPECIMEN","COORDINATE_ROUNDED;COLLECTION_MATCH_FUZZY"
-75.93,-0.17,"Senna reticulata",1928651734,"Río Cuyabeno.","ECU",NA,1981,"PRESERVED_SPECIMEN","GEODETIC_DATUM_ASSUMED_WGS84;COLLECTION_MATCH_FUZZY"
-75.87,0.08,"Senna reticulata",1927797737,"Puerto el Carmen de Putumayo.","ECU",NA,1980,"PRESERVED_SPECIMEN","GEODETIC_DATUM_ASSUMED_WGS84;COLLECTION_MATCH_FUZZY"
-52.27,4.87,"Senna reticulata",1929233691,"Commune de Rémire - Ile de Cayenne.","GUF",NA,1992,"PRESERVED_SPECIMEN","GEODETIC_DATUM_ASSUMED_WGS84;COLLECTION_MATCH_FUZZY"
-64.33,2.3,"Senna reticulata",1930677676,"Alrededor de vivienda Yanomami (Shabono) alrededores del Raudal Peñascal, en las cabeceras del Río Orinoco.","VEN",NA,1982,"PRESERVED_SPECIMEN","GEODETIC_DATUM_ASSUMED_WGS84;COLLECTION_MATCH_FUZZY"
-78.551909,-3.45665,"Senna reticulata",1929943571,"Santiago-Zamora. Bomboiza Mission.","ECU",4471.57,1985,"PRESERVED_SPECIMEN","COLLECTION_MATCH_FUZZY"
-72.8,-3.47,"Senna reticulata",1929960361,"Yanamono, Explorama Tourist Camp on Río Amazonas between Indiana and mouth of Río Napo","PER",NA,1980,"PRESERVED_SPECIMEN","GEODETIC_DATUM_ASSUMED_WGS84;COLLECTION_MATCH_FUZZY"
-75.810406,4.800527,"Senna reticulata",1986542511,"","COL",251,2018,"HUMAN_OBSERVATION","COORDINATE_ROUNDED;CONTINENT_DERIVED_FROM_COORDINATES"
-85.618361,11.493982,"Senna reticulata",2576282017,"","NIC",2560,2015,"HUMAN_OBSERVATION","CONTINENT_DERIVED_FROM_COORDINATES"
-51.094069,-0.037614,"Senna reticulata",3067612801,"","BRA",20,2020,"HUMAN_OBSERVATION","COORDINATE_ROUNDED;CONTINENT_DERIVED_FROM_COORDINATES"
-54.731878,-2.393718,"Senna reticulata",2980937369,"","BRA",NA,2020,"HUMAN_OBSERVATION","COORDINATE_ROUNDED;CONTINENT_DERIVED_FROM_COORDINATES"
-93.402145,16.860966,"Senna reticulata",3456417269,"","MEX",31,2021,"HUMAN_OBSERVATION","COORDINATE_ROUNDED;CONTINENT_DERIVED_FROM_COORDINATES"
-52.46,5.003333,"Senna reticulata",4039205953,"","GUF",NA,2023,"HUMAN_OBSERVATION","COORDINATE_ROUNDED;CONTINENT_DERIVED_FROM_COORDINATES"
-83.310226,8.538227,"Senna reticulata",3355500450,"","CRI",NA,2021,"HUMAN_OBSERVATION","COORDINATE_ROUNDED;CONTINENT_DERIVED_FROM_COORDINATES"
-82.843425,9.735989,"Senna reticulata",4062703546,"","CRI",9,2023,"HUMAN_OBSERVATION","COORDINATE_ROUNDED;CONTINENT_DERIVED_FROM_COORDINATES"
-82.634571,8.686535,"Senna reticulata",4063005540,"","PAN",3,2023,"HUMAN_OBSERVATION","COORDINATE_ROUNDED;CONTINENT_DERIVED_FROM_COORDINATES"
-76.436001,8.526751,"Senna reticulata",3383850600,"","COL",487,2021,"HUMAN_OBSERVATION","COORDINATE_ROUNDED;CONTINENT_DERIVED_FROM_COORDINATES"
-83.549856,10.55745,"Senna reticulata",4062716563,"","CRI",1164,2022,"HUMAN_OBSERVATION","COORDINATE_ROUNDED;CONTINENT_DERIVED_FROM_COORDINATES"
-93.097182,16.804746,"Senna reticulata",1931484671,"","MEX",61,2018,"HUMAN_OBSERVATION","COORDINATE_ROUNDED;CONTINENT_DERIVED_FROM_COORDINATES"
-94.26306,17.97778,"Senna reticulata",1805374112,"","MEX",792,2016,"HUMAN_OBSERVATION","COORDINATE_ROUNDED;CONTINENT_DERIVED_FROM_COORDINATES"
-60.075833,-3.031389,"Senna reticulata",3070502941,"","BRA",NA,2020,"HUMAN_OBSERVATION","COORDINATE_ROUNDED;CONTINENT_DERIVED_FROM_COORDINATES"
-72.281587,4.810363,"Senna reticulata",4063110511,"","COL",22,2023,"HUMAN_OBSERVATION","COORDINATE_ROUNDED;CONTINENT_DERIVED_FROM_COORDINATES"
-89.050556,13.7875,"Senna reticulata",3018004590,"","SLV",NA,2020,"HUMAN_OBSERVATION","COORDINATE_ROUNDED;CONTINENT_DERIVED_FROM_COORDINATES"
-73.042695,10.349158,"Senna reticulata",4018579995,"","COL",15,2023,"HUMAN_OBSERVATION","COORDINATE_ROUNDED;CONTINENT_DERIVED_FROM_COORDINATES"
-77.813672,-1.001115,"Senna reticulata",3355454335,"","ECU",8,2019,"HUMAN_OBSERVATION","COORDINATE_ROUNDED;CONTINENT_DERIVED_FROM_COORDINATES"
-92.879191,15.311541,"Senna reticulata",3044738363,"","MEX",488,2020,"HUMAN_OBSERVATION","COORDINATE_ROUNDED;CONTINENT_DERIVED_FROM_COORDINATES"
-73.582944,4.074437,"Senna reticulata",3070772577,"","COL",43,2021,"HUMAN_OBSERVATION","COORDINATE_ROUNDED;CONTINENT_DERIVED_FROM_COORDINATES"
-77.82365,-0.986798,"Senna reticulata",2238963795,"","ECU",31,2019,"HUMAN_OBSERVATION","COORDINATE_ROUNDED;CONTINENT_DERIVED_FROM_COORDINATES"
-96.584404,15.720175,"Senna reticulata",3499701595,"","MEX",NA,2022,"HUMAN_OBSERVATION","COORDINATE_ROUNDED;CONTINENT_DERIVED_FROM_COORDINATES"
-93.110234,17.511472,"Senna reticulata",4067170768,"","MEX",3063,2023,"HUMAN_OBSERVATION","COORDINATE_ROUNDED;CONTINENT_DERIVED_FROM_COORDINATES"
-79.69236,9.125514,"Senna reticulata",2823108921,"","PAN",2,2020,"HUMAN_OBSERVATION","COORDINATE_ROUNDED;CONTINENT_DERIVED_FROM_COORDINATES"
-84.72221,10.992228,"Senna reticulata",3961009423,"","CRI",122,2018,"HUMAN_OBSERVATION","COORDINATE_ROUNDED;CONTINENT_DERIVED_FROM_COORDINATES"
-93.412027,17.39721,"Senna reticulata",3773060648,"","MEX",61,2022,"HUMAN_OBSERVATION","COORDINATE_ROUNDED;CONTINENT_DERIVED_FROM_COORDINATES"
-82.822775,8.824226,"Senna reticulata",3355015452,"","PAN",8,2021,"HUMAN_OBSERVATION","COORDINATE_ROUNDED;CONTINENT_DERIVED_FROM_COORDINATES"
-88.75,16.3333,"Senna reticulata",1228491555,"Toledo","BLZ",NA,2000,"PRESERVED_SPECIMEN","GEODETIC_DATUM_ASSUMED_WGS84;INSTITUTION_MATCH_FUZZY;AMBIGUOUS_COLLECTION"
-74.962425,9.721356,"Senna reticulata",1273759795,"Vía Carmen a Zambrano","COL",NA,1987,"PRESERVED_SPECIMEN","COORDINATE_ROUNDED;INSTITUTION_MATCH_FUZZY;COLLECTION_MATCH_FUZZY"
-74.042333,8.952008,"Senna reticulata",1273759767,"Camino al Puerto","COL",NA,1987,"PRESERVED_SPECIMEN","COORDINATE_ROUNDED;INSTITUTION_MATCH_FUZZY;COLLECTION_MATCH_FUZZY"
-96.246553,15.950488,"Senna reticulata",3058766803,"","MEX",977,2012,"HUMAN_OBSERVATION","COORDINATE_ROUNDED;CONTINENT_DERIVED_FROM_COORDINATES"
-76.340186,3.875942,"Senna reticulata",4063098542,"","COL",124,2022,"HUMAN_OBSERVATION","COORDINATE_ROUNDED;CONTINENT_DERIVED_FROM_COORDINATES"
-74.8562,5.7919,"Senna reticulata",3449435350,"Vereda Santo Domingo, finca El Regalo","COL",NA,2021,"HUMAN_OBSERVATION",""
-44.333056,-3.400278,"Senna reticulata",3914322442,"Fazenda Picos","BRA",NA,1975,"PRESERVED_SPECIMEN","GEODETIC_DATUM_ASSUMED_WGS84;CONTINENT_DERIVED_FROM_COORDINATES;INSTITUTION_MATCH_NONE"
-83.56,8.45,"Senna reticulata",3307853649,"Puntarenas: Parque Nacional Corcovado. Sirena. Laguna Sirena.","CRI",NA,1988,"PRESERVED_SPECIMEN","TYPE_STATUS_INVALID;OCCURRENCE_STATUS_INFERRED_FROM_INDIVIDUAL_COUNT;GEODETIC_DATUM_ASSUMED_WGS84;CONTINENT_DERIVED_FROM_COORDINATES;INSTITUTION_MATCH_FUZZY;INSTITUTION_COLLECTION_MISMATCH"
-96.17,15.78,"Senna reticulata",3308063063,"Dto. Pochutla. A 450 m. en L.R. al noreste del puente Cacaluta. Sobre el río.","MEX",100,2004,"PRESERVED_SPECIMEN","TYPE_STATUS_INVALID;OCCURRENCE_STATUS_INFERRED_FROM_INDIVIDUAL_COUNT;GEODETIC_DATUM_ASSUMED_WGS84;CONTINENT_DERIVED_FROM_COORDINATES;INSTITUTION_MATCH_FUZZY;INSTITUTION_COLLECTION_MISMATCH"
-59.868965,-3.201876,"Senna reticulata",1930813066,"Rio Solimões, 1 km south of Careiro Village.","BRA",NA,1973,"PRESERVED_SPECIMEN","COORDINATE_ROUNDED;COLLECTION_MATCH_FUZZY"
-66.62,-14.5,"Senna reticulata",1928690412,"Prov. Gral. [General] Ballivián y Yacuma, Estación Biológica del Beni, comunidad Cero ocho, casa de Francisco Bie.","BOL",NA,1994,"PRESERVED_SPECIMEN","GEODETIC_DATUM_ASSUMED_WGS84;COLLECTION_MATCH_FUZZY"
-88.758,16.542,"Senna reticulata",1929555003,"Solomon Camp, vicinity of the junction of Richardson Creek and Bladen Branch, foothills of the Maya Mountains","BLZ",NA,1987,"PRESERVED_SPECIMEN","GEODETIC_DATUM_ASSUMED_WGS84;COLLECTION_MATCH_FUZZY"
-83.48,10.08,"Senna reticulata",1930880578,"Between Siquerres and the Río Pacuare, and remnant forest on steep hills south of the railroad bridge over the Río Pacuare","CRI",NA,1969,"PRESERVED_SPECIMEN","GEODETIC_DATUM_ASSUMED_WGS84;COLLECTION_MATCH_FUZZY"
-73.841542,-4.637738,"Senna reticulata",3762878902,"Yanayacu","PER",NA,2015,"PRESERVED_SPECIMEN","COORDINATE_ROUNDED;GEODETIC_DATUM_ASSUMED_WGS84;CONTINENT_DERIVED_FROM_COORDINATES;INSTITUTION_MATCH_FUZZY;INSTITUTION_COLLECTION_MISMATCH"
-98.126959,16.50982,"Senna reticulata",2270479701,"21 km NW of Pinotepa Nacional.","MEX",9808,1976,"PRESERVED_SPECIMEN","GEODETIC_DATUM_ASSUMED_WGS84;CONTINENT_DERIVED_FROM_COORDINATES;INSTITUTION_MATCH_FUZZY;INSTITUTION_COLLECTION_MISMATCH"
-83.1056,8.85444,"Senna reticulata",123006604,"Guami & Tico Gardens of Southern Costa Rica","CRI",NA,2002,"PRESERVED_SPECIMEN","GEODETIC_DATUM_ASSUMED_WGS84;CONTINENT_DERIVED_FROM_COORDINATES;INSTITUTION_COLLECTION_MISMATCH"
