"lon","lat","species","gbifID","locality","countryCode","coordinateUncertaintyInMeters","year","basisOfRecord","issue"
-113.483333,28.716667,"Senna confinis",1846511531,"South of Valle Las Flores, 27.2 miles S of Bahia de los Angeles, inland and N of Playa San Rafael.","MEX",NA,1996,"PRESERVED_SPECIMEN","GEODETIC_DATUM_ASSUMED_WGS84;CONTINENT_DERIVED_FROM_COORDINATES;INSTITUTION_MATCH_FUZZY;COLLECTION_MATCH_NONE"
-111.908333,26.843611,"Senna confinis",1846508365,"7 mils S of Mulege, off Route 1","MEX",NA,1984,"PRESERVED_SPECIMEN","GEODETIC_DATUM_ASSUMED_WGS84;CONTINENT_DERIVED_FROM_COORDINATES;INSTITUTION_MATCH_FUZZY;COLLECTION_MATCH_NONE"
-113.51075,28.88914,"Senna confinis",1929788651,"behind village of Bahía de los Angeles, B.C.","MEX",NA,1963,"PRESERVED_SPECIMEN","GEODETIC_DATUM_ASSUMED_WGS84;COLLECTION_MATCH_FUZZY"
-113.56667,29.53333,"Senna confinis",2807651983,"Refugio Bay","MEX",NA,1962,"PRESERVED_SPECIMEN","GEODETIC_DATUM_ASSUMED_WGS84;INSTITUTION_MATCH_FUZZY;INSTITUTION_COLLECTION_MISMATCH"
-112.316667,27.333333,"Senna confinis",1895498214,"4 mi N of Santa Rosalia","MEX",70,1974,"PRESERVED_SPECIMEN","TYPE_STATUS_INVALID;OCCURRENCE_STATUS_INFERRED_FROM_INDIVIDUAL_COUNT;COORDINATE_ROUNDED;GEODETIC_DATUM_ASSUMED_WGS84;CONTINENT_DERIVED_FROM_COORDINATES;INSTITUTION_MATCH_NONE"
-111.259909,25.810664,"Senna confinis",4062926855,"","MEX",25,2023,"HUMAN_OBSERVATION","COORDINATE_ROUNDED;CONTINENT_DERIVED_FROM_COORDINATES"
-110.68337,25.0167,"Senna confinis",3053440507,"Gulf of California; Isla San Jose","MEX",5000,1996,"PRESERVED_SPECIMEN","GEODETIC_DATUM_ASSUMED_WGS84;GEODETIC_DATUM_INVALID;CONTINENT_DERIVED_FROM_COORDINATES;INSTITUTION_MATCH_FUZZY;COLLECTION_MATCH_NONE"
-112.343055,27.389722,"Senna confinis",1259516783,"11 km al NW de Santa Rosalia, carretera a San Ignacio. Mpio. Santa Rosalia.","MEX",NA,1987,"PRESERVED_SPECIMEN","OCCURRENCE_STATUS_INFERRED_FROM_INDIVIDUAL_COUNT;COORDINATE_ROUNDED;GEODETIC_DATUM_ASSUMED_WGS84;INSTITUTION_MATCH_FUZZY;COLLECTION_MATCH_NONE"
-112.301944,27.398333,"Senna confinis",1259516918,"Littoral plain 4 mi N of Santa Rosalia.","MEX",NA,1974,"PRESERVED_SPECIMEN","OCCURRENCE_STATUS_INFERRED_FROM_INDIVIDUAL_COUNT;COORDINATE_ROUNDED;GEODETIC_DATUM_ASSUMED_WGS84;INSTITUTION_MATCH_FUZZY;COLLECTION_MATCH_NONE"
-113.33983,29.16916,"Senna confinis",3125128525,"Isla Angel de la Guarda; Arroyo Estatón","MEX",NA,1962,"PRESERVED_SPECIMEN","CONTINENT_DERIVED_FROM_COORDINATES;INSTITUTION_MATCH_FUZZY;COLLECTION_MATCH_NONE"
-112.0823,27.24658,"Senna confinis",3125128526,"San Marcos Island, NE side, Arroyo do los Chivos.","MEX",NA,1962,"PRESERVED_SPECIMEN","CONTINENT_DERIVED_FROM_COORDINATES;INSTITUTION_MATCH_FUZZY;COLLECTION_MATCH_NONE"
-111.03333,24.86667,"Senna confinis",3125128534,"Sierra de La Giganta; Arroyo del Rancho La Presa","MEX",NA,2000,"PRESERVED_SPECIMEN","CONTINENT_DERIVED_FROM_COORDINATES;INSTITUTION_MATCH_FUZZY;COLLECTION_MATCH_NONE"
-110.97169,24.9488,"Senna confinis",3125128538,"Sierra de La Giganta: along road between Rancho Casitas Viejas & Rancho Matancitas; west of Llanos de Kakiwi, southwest of Mision Dolores & northwest of San Evaristo; canyon bottom with a small pond","MEX",NA,2015,"PRESERVED_SPECIMEN","CONTINENT_DERIVED_FROM_COORDINATES;INSTITUTION_MATCH_FUZZY;COLLECTION_MATCH_NONE"
-111.27485,26.11938,"Senna confinis",3125127520,"Coronado Island, on lava.","MEX",NA,1962,"PRESERVED_SPECIMEN","CONTINENT_DERIVED_FROM_COORDINATES;INSTITUTION_MATCH_FUZZY;COLLECTION_MATCH_NONE"
-109.86667,24.25,"Senna confinis",3125127530,"Isla Cerralvo; arroyo paredones blancos, hacia la parte media oeste de la isla.","MEX",NA,1996,"PRESERVED_SPECIMEN","CONTINENT_DERIVED_FROM_COORDINATES;INSTITUTION_MATCH_FUZZY;COLLECTION_MATCH_NONE"
-110.7,24.81667,"Senna confinis",3125127531,"Costa del Golfo de California, Arroyo El Aguajon, carretera San Evaristo","MEX",NA,2004,"PRESERVED_SPECIMEN","CONTINENT_DERIVED_FROM_COORDINATES;INSTITUTION_MATCH_FUZZY;COLLECTION_MATCH_NONE"
-109.85198,23.95042,"Senna confinis",3125127533,"Sierra La Gata (Sierra El Carrizalito): east of San Juan de Los Planes near Bahia de los Muertos; along the dirt road through the northern end of the Sierra to Boca del Alamo","MEX",NA,2013,"PRESERVED_SPECIMEN","CONTINENT_DERIVED_FROM_COORDINATES;INSTITUTION_MATCH_FUZZY;COLLECTION_MATCH_NONE"
-112.29083,26.63722,"Senna confinis",3125125504,"Sierra Guadalupe: W of Mulege; west side of the mountain range; vicinity of Rancho El Tule, E of San Martin and La Vinorama","MEX",NA,1998,"PRESERVED_SPECIMEN","CONTINENT_DERIVED_FROM_COORDINATES;INSTITUTION_MATCH_FUZZY;COLLECTION_MATCH_NONE"
-111.03125,25.65277,"Senna confinis",3125142862,"Gulf of California: Isla Monserrat; extreme southwestern portion of the island; beach and adjacent low hills of a small bay","MEX",NA,2018,"PRESERVED_SPECIMEN","CONTINENT_DERIVED_FROM_COORDINATES;INSTITUTION_MATCH_FUZZY;COLLECTION_MATCH_NONE"
-110.70091,25.19701,"Senna confinis",3465116324,"Gulf of California: Isla San Diego; southwestern portion of the island; upper western slope and along the highest ridge of the island","MEX",NA,2018,"PRESERVED_SPECIMEN","CONTINENT_DERIVED_FROM_COORDINATES;INSTITUTION_MATCH_FUZZY;COLLECTION_MATCH_NONE"
-111.48342,25.97193,"Senna confinis",3125119481,"Arroyo Las Parras on road to Mission San Xavier.","MEX",NA,1955,"PRESERVED_SPECIMEN","CONTINENT_DERIVED_FROM_COORDINATES;INSTITUTION_MATCH_FUZZY;COLLECTION_MATCH_NONE"
-110.66667,24.96667,"Senna confinis",3125119494,"Lado W. de Isla San José.","MEX",NA,1996,"PRESERVED_SPECIMEN","CONTINENT_DERIVED_FROM_COORDINATES;INSTITUTION_MATCH_FUZZY;COLLECTION_MATCH_NONE"
-112.81722,28.15722,"Senna confinis",3125119495,"Cabo San Miguel, bajada along Sea of Cortes, 4-5 months after two chubascos (John and Paul, Oct 2006).","MEX",NA,2007,"PRESERVED_SPECIMEN","CONTINENT_DERIVED_FROM_COORDINATES;INSTITUTION_MATCH_FUZZY;COLLECTION_MATCH_NONE"
-111.05,25.45,"Senna confinis",3125247496,"Puerta de la cumbre en el Rancho Santa Martha 8.0 km al sur del poblado de Agua Verde.","MEX",NA,2003,"PRESERVED_SPECIMEN","CONTINENT_DERIVED_FROM_COORDINATES;INSTITUTION_MATCH_FUZZY;COLLECTION_MATCH_NONE"
-112.58333,28.68333,"Senna confinis",3125261533,"Isla San Esteban, SE side, near mouth of main arroyo.","MEX",NA,1980,"PRESERVED_SPECIMEN","CONTINENT_DERIVED_FROM_COORDINATES;INSTITUTION_MATCH_FUZZY;COLLECTION_MATCH_NONE"
-110.91667,24.7,"Senna confinis",3125261538,"Rancho Santa Cruz; Sierra de La Giganta","MEX",NA,2003,"PRESERVED_SPECIMEN","CONTINENT_DERIVED_FROM_COORDINATES;INSTITUTION_MATCH_FUZZY;COLLECTION_MATCH_NONE"
-113.6667,28.8333,"Senna confinis",3125278961,"9.5 miles east of Mision San Borja, Canon La Borreguera, Sierra La Libertad. Along disturbed rocky roadway.","MEX",NA,1978,"PRESERVED_SPECIMEN","CONTINENT_DERIVED_FROM_COORDINATES;INSTITUTION_MATCH_FUZZY;COLLECTION_MATCH_NONE"
-111.51891,25.36912,"Senna confinis",3125255527,"19 miles southwest of San Javier; Arroyo de San Domingo.","MEX",NA,1964,"PRESERVED_SPECIMEN","CONTINENT_DERIVED_FROM_COORDINATES;INSTITUTION_MATCH_FUZZY;COLLECTION_MATCH_NONE"
-110.65,24.78333,"Senna confinis",3125255537,"Cerro Mechudo","MEX",NA,2003,"PRESERVED_SPECIMEN","CONTINENT_DERIVED_FROM_COORDINATES;INSTITUTION_MATCH_FUZZY;COLLECTION_MATCH_NONE"
-110.06581,24.19541,"Senna confinis",3125253540,"Rancho Las Cruces: east of La Paz; along a trail to the southeast of the main ranch resort area","MEX",NA,2015,"PRESERVED_SPECIMEN","CONTINENT_DERIVED_FROM_COORDINATES;INSTITUTION_MATCH_FUZZY;COLLECTION_MATCH_NONE"
-112.04496,26.20567,"Senna confinis",3125124543,"Along the La Purisima River at San Isidro.","MEX",NA,1991,"PRESERVED_SPECIMEN","CONTINENT_DERIVED_FROM_COORDINATES;INSTITUTION_MATCH_FUZZY;COLLECTION_MATCH_NONE"
-111.87389,26.83167,"Senna confinis",3125124544,"Approx. 7 miles south of Mulege: Villas de Mulege; along Gulf coast near mouth of Bahia Concepcion","MEX",NA,1997,"PRESERVED_SPECIMEN","CONTINENT_DERIVED_FROM_COORDINATES;INSTITUTION_MATCH_FUZZY;COLLECTION_MATCH_NONE"
-112.60141,26.38197,"Senna confinis",3125123527,"Arroyo La Ballena: in riparian zone along the main gravel road between San Juanico and San Jose de Gracia; N of Cadeje","MEX",NA,2009,"PRESERVED_SPECIMEN","CONTINENT_DERIVED_FROM_COORDINATES;INSTITUTION_MATCH_FUZZY;COLLECTION_MATCH_NONE"
-111.11745,25.99774,"Senna confinis",3125140884,"Gulf of California: Isla Carmen; northeast portion of island in Bahia Salinas; on the dune/salt flat area on the west side of the bay","MEX",NA,2018,"PRESERVED_SPECIMEN","CONTINENT_DERIVED_FROM_COORDINATES;INSTITUTION_MATCH_FUZZY;COLLECTION_MATCH_NONE"
-113.44,28.48329,"Senna confinis",3125244499,"Sierra de La Libertad: south of Bahia de Los Angeles; in Arroyo La Bocana on the eastern side of the Sierra; along the arroyo between Rancho La Bocana and Rancho San Pedro","MEX",NA,2012,"PRESERVED_SPECIMEN","CONTINENT_DERIVED_FROM_COORDINATES;INSTITUTION_MATCH_FUZZY;COLLECTION_MATCH_NONE"
-112.51923,27.40408,"Senna confinis",3125258505,"27 miles south of San Ignacio on Mexico Highway 1.","MEX",NA,1986,"PRESERVED_SPECIMEN","CONTINENT_DERIVED_FROM_COORDINATES;INSTITUTION_MATCH_FUZZY;COLLECTION_MATCH_NONE"
-111.53338,25.94301,"Senna confinis",3125258510,"Sierra de La Giganta, Arroyo cerca del Rancho San Matias, 11 Km al NW de poblado San Javier, Mpio. de Loreto, B.C.S.","MEX",NA,2012,"PRESERVED_SPECIMEN","CONTINENT_DERIVED_FROM_COORDINATES;INSTITUTION_MATCH_FUZZY;COLLECTION_MATCH_NONE"
-110.775,25.65833,"Senna confinis",3125120503,"Catalina Island, East side, palm spring arroyo.","MEX",NA,1962,"PRESERVED_SPECIMEN","CONTINENT_DERIVED_FROM_COORDINATES;INSTITUTION_MATCH_FUZZY;COLLECTION_MATCH_NONE"
-111.71173,26.37538,"Senna confinis",3125120505,"4.0 miles southwest of Canipole.","MEX",NA,1973,"PRESERVED_SPECIMEN","CONTINENT_DERIVED_FROM_COORDINATES;INSTITUTION_MATCH_FUZZY;COLLECTION_MATCH_NONE"
-113.48098,26.97842,"Senna confinis",3125120516,"Sierra Santa Clara: north of Punta Abreojos & west of San Ignacio; Arroyo La Tinaja, south of Ejido Emiliano Zapata II & just south of Mesa Tecolote; along an open canyon & lower slopes approx. 2 miles west of the main road to Punta Abreojos","MEX",NA,2014,"PRESERVED_SPECIMEN","CONTINENT_DERIVED_FROM_COORDINATES;INSTITUTION_MATCH_FUZZY;COLLECTION_MATCH_NONE"
-110.79708,24.34487,"Senna confinis",3125277308,"El reten del aguaja en arroyo de Rancho Las Tarabillas, norte de San Juan de la Costa","MEX",NA,2015,"PRESERVED_SPECIMEN","CONTINENT_DERIVED_FROM_COORDINATES;INSTITUTION_MATCH_FUZZY;COLLECTION_MATCH_NONE"
-111.86254,26.65179,"Senna confinis",3125272326,"Bahia Concepcion, Carretera Loreto - Mulege. Kilometer 96","MEX",NA,2012,"PRESERVED_SPECIMEN","CONTINENT_DERIVED_FROM_COORDINATES;INSTITUTION_MATCH_FUZZY;COLLECTION_MATCH_NONE"
-111.87751,27.43687,"Senna confinis",3125141852,"Gulf of California: Isla Tortuga; south portion of island; along a canyon on the southeast side of the crater","MEX",NA,2018,"PRESERVED_SPECIMEN","CONTINENT_DERIVED_FROM_COORDINATES;INSTITUTION_MATCH_FUZZY;COLLECTION_MATCH_NONE"
-114.29618,29.4912,"Senna confinis",3125246479,"9.1 miles east of Laguna Chapala.","MEX",NA,1967,"PRESERVED_SPECIMEN","CONTINENT_DERIVED_FROM_COORDINATES;INSTITUTION_MATCH_FUZZY;COLLECTION_MATCH_NONE"
-111.68333,26.58333,"Senna confinis",3125246486,"Bahia Concepcion, southeast corner of the bay at the base of the peninsula.","MEX",NA,1987,"PRESERVED_SPECIMEN","CONTINENT_DERIVED_FROM_COORDINATES;INSTITUTION_MATCH_FUZZY;COLLECTION_MATCH_NONE"
-112.9161,27.2945,"Senna confinis",3125246489,"Carretera Transpeninsular; 2.7 km W de San Ignacio.","MEX",NA,2009,"PRESERVED_SPECIMEN","CONTINENT_DERIVED_FROM_COORDINATES;INSTITUTION_MATCH_FUZZY;COLLECTION_MATCH_NONE"
-110.441667,24.175,"Senna confinis",1893526874,"Carretera a El Comitán","MEX",60,1987,"PRESERVED_SPECIMEN","TYPE_STATUS_INVALID;COORDINATE_ROUNDED;GEODETIC_DATUM_ASSUMED_WGS84;CONTINENT_DERIVED_FROM_COORDINATES;ELEVATION_MIN_MAX_SWAPPED;DIFFERENT_OWNER_INSTITUTION"
-110.408333,24.425,"Senna confinis",3323515492,"Isla partida","MEX",60,1964,"PRESERVED_SPECIMEN","TYPE_STATUS_INVALID;COORDINATE_ROUNDED;GEODETIC_DATUM_ASSUMED_WGS84;CONTINENT_DERIVED_FROM_COORDINATES;ELEVATION_MIN_MAX_SWAPPED;INSTITUTION_MATCH_FUZZY;AMBIGUOUS_COLLECTION"
-110.320539,24.251699,"Senna confinis",3802621733,"","MEX",1028,2022,"HUMAN_OBSERVATION","COORDINATE_ROUNDED;CONTINENT_DERIVED_FROM_COORDINATES"
-110.635464,24.291435,"Senna confinis",2540761206,"","MEX",12,2019,"HUMAN_OBSERVATION","COORDINATE_ROUNDED;CONTINENT_DERIVED_FROM_COORDINATES"
-113.335528,28.598393,"Senna confinis",3760005381,"","MEX",3764,2022,"HUMAN_OBSERVATION","COORDINATE_ROUNDED;CONTINENT_DERIVED_FROM_COORDINATES"
-110.387085,24.505406,"Senna confinis",2543058013,"","MEX",582,2019,"HUMAN_OBSERVATION","COORDINATE_ROUNDED;CONTINENT_DERIVED_FROM_COORDINATES"
-111.060824,24.7241,"Senna confinis",1453470524,"","MEX",6261,2017,"HUMAN_OBSERVATION","COORDINATE_ROUNDED;CONTINENT_DERIVED_FROM_COORDINATES"
-114.56667,29.99167,"Senna confinis",3406855662,"24.6 km NW of Punta Willard and 0-3 km west of road","MEX",1000,1988,"PRESERVED_SPECIMEN","GEODETIC_DATUM_ASSUMED_WGS84;CONTINENT_DERIVED_FROM_COORDINATES;INSTITUTION_MATCH_FUZZY"
-111.41,26.0031,"Senna confinis",1930041075,"About 100 ft above the bottom of Arroyo Las Parras, along the edge of the road between San Janvier & Loreto, about 3.4 mi W of the intersection with Mexico Rt. 1","MEX",NA,2005,"PRESERVED_SPECIMEN","COLLECTION_MATCH_FUZZY"
-111.202815,25.93463,"Senna confinis",4009745016,"","MEX",31,2022,"HUMAN_OBSERVATION","COORDINATE_ROUNDED;CONTINENT_DERIVED_FROM_COORDINATES"
-110.310833,24.142222,"Senna confinis",1893598322,"GOLFO DE CALIFORNIA, MPIO. LA PAZ","MEX",60,1997,"PRESERVED_SPECIMEN","TYPE_STATUS_INVALID;OCCURRENCE_STATUS_INFERRED_FROM_INDIVIDUAL_COUNT;COORDINATE_ROUNDED;GEODETIC_DATUM_ASSUMED_WGS84;CONTINENT_DERIVED_FROM_COORDINATES;ELEVATION_MIN_MAX_SWAPPED;INSTITUTION_MATCH_NONE"
-112.2,27.06,"Senna confinis",3307828858,"Arroyo San Bruno, SE of Santa Rosalia, 4.8 mi W of Hwy 1 on rd to San Jose de Magdalena.","MEX",70,1991,"PRESERVED_SPECIMEN","TYPE_STATUS_INVALID;OCCURRENCE_STATUS_INFERRED_FROM_INDIVIDUAL_COUNT;GEODETIC_DATUM_ASSUMED_WGS84;CONTINENT_DERIVED_FROM_COORDINATES;INSTITUTION_MATCH_FUZZY;INSTITUTION_COLLECTION_MISMATCH"
-113.451,27.9793,"Senna confinis",1988860133,"El Arco; 4-5 mi SW from El Arco, on road to La Banderita","MEX",NA,1959,"PRESERVED_SPECIMEN","GEODETIC_DATUM_ASSUMED_WGS84"
-111.4,25.733333,"Senna confinis",2629924903,"Sierra La Giganta Arroyo del Rancho Santa Inés","MEX",60,2004,"PRESERVED_SPECIMEN","TYPE_STATUS_INVALID;GEODETIC_DATUM_ASSUMED_WGS84;CONTINENT_DERIVED_FROM_COORDINATES;ELEVATION_MIN_MAX_SWAPPED;DIFFERENT_OWNER_INSTITUTION"
-113.25,28.6333,"Senna confinis",2629924595,"35 miles S of Bahia de Los Angeles on rd to San Francisquito","MEX",70,1991,"PRESERVED_SPECIMEN","TYPE_STATUS_INVALID;GEODETIC_DATUM_ASSUMED_WGS84;CONTINENT_DERIVED_FROM_COORDINATES;ELEVATION_MIN_MAX_SWAPPED;INSTITUTION_MATCH_NONE"
-111.545044,26.328785,"Senna confinis",2574267079,"","MEX",NA,2020,"HUMAN_OBSERVATION","CONTINENT_DERIVED_FROM_COORDINATES"
-111.146683,26.020974,"Senna confinis",2574197161,"","MEX",31,2020,"HUMAN_OBSERVATION","COORDINATE_ROUNDED;CONTINENT_DERIVED_FROM_COORDINATES"
-111.501581,26.376436,"Senna confinis",3321123138,"","MEX",10,2021,"HUMAN_OBSERVATION","COORDINATE_ROUNDED;CONTINENT_DERIVED_FROM_COORDINATES"
-113.539511,29.049256,"Senna confinis",3070706481,"","MEX",NA,2021,"HUMAN_OBSERVATION","COORDINATE_ROUNDED;CONTINENT_DERIVED_FROM_COORDINATES"
-113.547397,28.666196,"Senna confinis",1933554021,"","MEX",1818,2016,"HUMAN_OBSERVATION","COORDINATE_ROUNDED;CONTINENT_DERIVED_FROM_COORDINATES"
-111.46611,26.365555,"Senna confinis",2529284580,"","MEX",NA,2019,"HUMAN_OBSERVATION","COORDINATE_ROUNDED;CONTINENT_DERIVED_FROM_COORDINATES"
-101.996,24.199,"Senna confinis",1937525115,"4-5.5 mi. SW from El Arco (as measures along the road) on road to La Banderita; E edge of Vizcaino Desert.","MEX",NA,1959,"PRESERVED_SPECIMEN","GEODETIC_DATUM_ASSUMED_WGS84;CONTINENT_DERIVED_FROM_COORDINATES;INSTITUTION_COLLECTION_MISMATCH"
-114.2560376,29.3033912,"Senna confinis",1894065558,"16 km al E de la Laguna Chapala","MEX",1000,1967,"PRESERVED_SPECIMEN","TYPE_STATUS_INVALID;RECORDED_DATE_INVALID;COORDINATE_REPROJECTED;CONTINENT_DERIVED_FROM_COORDINATES;ELEVATION_MIN_MAX_SWAPPED;INSTITUTION_MATCH_FUZZY;AMBIGUOUS_COLLECTION"
-113.311,29.145194,"Senna confinis",1894065576,"ARROYO ESTATON, ISLA ANGEL DE LA GUARDA","MEX",70,1962,"PRESERVED_SPECIMEN","TYPE_STATUS_INVALID;COORDINATE_ROUNDED;GEODETIC_DATUM_ASSUMED_WGS84;CONTINENT_DERIVED_FROM_COORDINATES;ELEVATION_MIN_MAX_SWAPPED;DIFFERENT_OWNER_INSTITUTION"
-112.133556,26.050194,"Senna confinis",3323540650,"Arroyo, 12.8 km al S del río La Purísima","MEX",60,1959,"PRESERVED_SPECIMEN","TYPE_STATUS_INVALID;COORDINATE_ROUNDED;GEODETIC_DATUM_ASSUMED_WGS84;CONTINENT_DERIVED_FROM_COORDINATES;INSTITUTION_MATCH_FUZZY;AMBIGUOUS_COLLECTION"
-110.3156837,24.3364868,"Senna confinis",1894065523,"29 km al N de La Paz, parte N de la bahía Pichilingue","MEX",6380,1960,"PRESERVED_SPECIMEN","TYPE_STATUS_INVALID;RECORDED_DATE_INVALID;COORDINATE_REPROJECTED;CONTINENT_DERIVED_FROM_COORDINATES;INSTITUTION_MATCH_FUZZY;AMBIGUOUS_COLLECTION"
-111.6096998,25.6506673,"Senna confinis",3323540923,"31 km al SE de San Javier","MEX",1450,1964,"PRESERVED_SPECIMEN","TYPE_STATUS_INVALID;COORDINATE_REPROJECTED;CONTINENT_DERIVED_FROM_COORDINATES;ELEVATION_MIN_MAX_SWAPPED;INSTITUTION_MATCH_FUZZY;AMBIGUOUS_COLLECTION"
-111.175,25.091667,"Senna confinis",3323541297,"Puerto Ballandra, Isla Carmen","MEX",60,1960,"PRESERVED_SPECIMEN","TYPE_STATUS_INVALID;COORDINATE_ROUNDED;GEODETIC_DATUM_ASSUMED_WGS84;CONTINENT_DERIVED_FROM_COORDINATES;DIFFERENT_OWNER_INSTITUTION"
-109.8482026,22.9201819,"Senna confinis",1894065545,"9.6 km al E de la Villa de Cabo San Lucas","MEX",3460,1959,"PRESERVED_SPECIMEN","TYPE_STATUS_INVALID;RECORDED_DATE_INVALID;COORDINATE_REPROJECTED;CONTINENT_DERIVED_FROM_COORDINATES;INSTITUTION_MATCH_FUZZY;AMBIGUOUS_COLLECTION"
-109.809677,24.176408,"Senna confinis",3466389319,"","MEX",NA,2022,"HUMAN_OBSERVATION","COORDINATE_ROUNDED;CONTINENT_DERIVED_FROM_COORDINATES"
-114.390028,29.5915,"Senna confinis",2629409519,"Camino a Luis Gonzaga a 20 km de Nuevo Chapala","MEX",80,2004,"PRESERVED_SPECIMEN","TYPE_STATUS_INVALID;OCCURRENCE_STATUS_INFERRED_FROM_INDIVIDUAL_COUNT;COORDINATE_ROUNDED;GEODETIC_DATUM_ASSUMED_WGS84;GEODETIC_DATUM_INVALID;CONTINENT_DERIVED_FROM_COORDINATES;ELEVATION_MIN_MAX_SWAPPED;INSTITUTION_MATCH_NONE"
-110.425782,24.136235,"Senna confinis",3093978863,"La Paz, Centro de Investigaciones Biologicas de La Paz, near bay, La Paz","MEX",60,1984,"PRESERVED_SPECIMEN","CONTINENT_DERIVED_FROM_COORDINATES;INSTITUTION_MATCH_FUZZY;COLLECTION_MATCH_FUZZY"
-110.591667,24.841667,"Senna confinis",1894815023,"Golfo de California, mpio. de La Paz","MEX",60,1997,"PRESERVED_SPECIMEN","TYPE_STATUS_INVALID;COORDINATE_ROUNDED;GEODETIC_DATUM_ASSUMED_WGS84;CONTINENT_DERIVED_FROM_COORDINATES;ELEVATION_MIN_MAX_SWAPPED;DIFFERENT_OWNER_INSTITUTION"
-113.301147,28.79085,"Senna confinis",3947358726,"","MEX",4,2022,"HUMAN_OBSERVATION","COORDINATE_ROUNDED;CONTINENT_DERIVED_FROM_COORDINATES"
-111.416259,25.446321,"Senna confinis",4006737652,"","MEX",200,2022,"HUMAN_OBSERVATION","COORDINATE_ROUNDED;CONTINENT_DERIVED_FROM_COORDINATES"
-110.587673,25.013866,"Senna confinis",4006570786,"","MEX",1602,2022,"HUMAN_OBSERVATION","COORDINATE_ROUNDED;CONTINENT_DERIVED_FROM_COORDINATES"
-110.299,23.9986,"Senna confinis",1988996330,"La Divina Providencia; La Paz; 16 km S de La Paz, 2 km N of Pichilingue","MEX",NA,1966,"PRESERVED_SPECIMEN","GEODETIC_DATUM_ASSUMED_WGS84"
