"lon","lat","species","gbifID","locality","countryCode","coordinateUncertaintyInMeters","year","basisOfRecord","issue"
49.098333,-15.533333,"Solanum marojejy",4060879368,"Sofia, Mandritsara, Ambilobe, Bandabe. Suivant la piste vers Antsiradava. Cinq Km à l'Est de Bandabe à vol d'oiseau, à l'Ouest de la forêt de Makira. Lohan'Ananjaka et Kiboro. Récoltés avec D. Ravelonarivo, A. Lehavana, Tsiady & Manankaja.","MDG",NA,2007,"PRESERVED_SPECIMEN","OCCURRENCE_STATUS_INFERRED_FROM_INDIVIDUAL_COUNT;COORDINATE_ROUNDED;GEODETIC_DATUM_ASSUMED_WGS84;DIFFERENT_OWNER_INSTITUTION"
49.766667,-14.433333,"Solanum marojejy",1262241846,"Reserve Naturelle Marojejy, along the trail to the summit of Marojejy Est, NW of Mandena between the first and second camps. 14.26-27'S 49.46-47'E. Collected with: A. Rakotozafy, G.E. Schatz, F. Badré & J. Randrianasolo.","MDG",NA,1988,"PRESERVED_SPECIMEN","OCCURRENCE_STATUS_INFERRED_FROM_INDIVIDUAL_COUNT;COORDINATE_ROUNDED;GEODETIC_DATUM_ASSUMED_WGS84;DIFFERENT_OWNER_INSTITUTION"
49.34611,-15.13027,"Solanum marojejy",4031728818,"Ruisseau Ambatoharanana Andranomena commune rurale de Matsoandakana, district de Befandrina Nord.","MDG",NA,2008,"PRESERVED_SPECIMEN","OCCURRENCE_STATUS_INFERRED_FROM_INDIVIDUAL_COUNT;GEODETIC_DATUM_ASSUMED_WGS84;INSTITUTION_MATCH_FUZZY;COLLECTION_MATCH_NONE"
49.42305,-14.92333,"Solanum marojejy",4031636813,"Tsaravilona Amparihy Androva, suivant la piste nord est de la chaîne de montagne de Tsaravilona, au bord de ruisseau d'Andasimisianantsomanga, petit ruisseau de Beamalona. Echantillons préservés en alcool","MDG",NA,2008,"PRESERVED_SPECIMEN","OCCURRENCE_STATUS_INFERRED_FROM_INDIVIDUAL_COUNT;GEODETIC_DATUM_ASSUMED_WGS84;INSTITUTION_MATCH_FUZZY;COLLECTION_MATCH_NONE"
48.42,-14.07,"Solanum marojejy",912323331,"massif de Manongarivo, crete bordant la cuvette d'Antsahakolana, Diego-Suarez","MDG",NA,2000,"PRESERVED_SPECIMEN","GEODETIC_DATUM_ASSUMED_WGS84;CONTINENT_DERIVED_FROM_COORDINATES;INSTITUTION_MATCH_FUZZY;COLLECTION_MATCH_FUZZY"
49.186944,-13.241667,"Solanum marojejy",4061786181,"Diego-Suarez / Antsiranana. Massif de Manongarivo: Crete bordant la cuvette d'Antsahakolana","MDG",NA,2000,"PRESERVED_SPECIMEN","OCCURRENCE_STATUS_INFERRED_FROM_INDIVIDUAL_COUNT;GEODETIC_DATUM_ASSUMED_WGS84;DIFFERENT_OWNER_INSTITUTION"
50.035833,-14.098889,"Solanum marojejy",4061667618,"Sambava, Anjangoveratra, Fokontany Ambodisambalahy, forêt d'Andohanimahalina.","MDG",NA,2010,"PRESERVED_SPECIMEN","OCCURRENCE_STATUS_INFERRED_FROM_INDIVIDUAL_COUNT;COORDINATE_ROUNDED;GEODETIC_DATUM_ASSUMED_WGS84;DIFFERENT_OWNER_INSTITUTION"
49.55,-14.3,"Solanum marojejy",1258356054,"forêt de Marojejy (camp III) Andapa","MDG",NA,1988,"PRESERVED_SPECIMEN","GEODETIC_DATUM_ASSUMED_WGS84;DIFFERENT_OWNER_INSTITUTION"
49.620444,-13.254028,"Solanum marojejy",1426340062,"SAVA, Vohemar, Binara Forest, transition Forest.","MDG",NA,2004,"PRESERVED_SPECIMEN","COORDINATE_ROUNDED;GEODETIC_DATUM_ASSUMED_WGS84;COLLECTION_MATCH_FUZZY"
