"lon","lat","species","gbifID","locality","countryCode","coordinateUncertaintyInMeters","year","basisOfRecord","issue"
47.48333,-21.06666,"Streptocarpus muscosus",1261196855,"Parc National de Ranomafana, Parcelle I, Ambohimera. Plantes preservées en alcool.","MDG",NA,1992,"PRESERVED_SPECIMEN","OCCURRENCE_STATUS_INFERRED_FROM_INDIVIDUAL_COUNT;GEODETIC_DATUM_ASSUMED_WGS84;INSTITUTION_MATCH_FUZZY;COLLECTION_MATCH_NONE"
49.34666,-15.13333,"Streptocarpus muscosus",4031630778,"Ruisseau Ambatoharanana Andranomena commune rurale de Matsoandakana, district de Befandrina Nord.","MDG",NA,2008,"PRESERVED_SPECIMEN","OCCURRENCE_STATUS_INFERRED_FROM_INDIVIDUAL_COUNT;GEODETIC_DATUM_ASSUMED_WGS84;INSTITUTION_MATCH_FUZZY;COLLECTION_MATCH_NONE"
47.185556,-24.5675,"Streptocarpus muscosus",4031902955,"Fort Dauphin, Iaboakoho, Antsotso, forêt de la chaine montagneuse de Vohimena, forêt d'Ambatomalama, sur rocher. Collectée avec Razafy & Evariste.","MDG",NA,2015,"PRESERVED_SPECIMEN","OCCURRENCE_STATUS_INFERRED_FROM_INDIVIDUAL_COUNT;COORDINATE_ROUNDED;GEODETIC_DATUM_ASSUMED_WGS84;INSTITUTION_MATCH_FUZZY;COLLECTION_MATCH_NONE"
49.431945,-14.922778,"Streptocarpus muscosus",1260897202,"Fokotany Tsaravilona Amparihy Androva, suivant la ligne de crête au nord du campII vers sud est. Echantillons préservés en alcool","MDG",NA,2008,"PRESERVED_SPECIMEN","OCCURRENCE_STATUS_INFERRED_FROM_INDIVIDUAL_COUNT;COORDINATE_ROUNDED;GEODETIC_DATUM_ASSUMED_WGS84;DIFFERENT_OWNER_INSTITUTION"
47.01277,-23.53583,"Streptocarpus muscosus",4031590500,"Midongy du Sud, à 2 km à l'Ouest du village d'Ankaboky. Forêt dense humide. Récolté avec M. Ramanantsoa, M.G. Maminandrasana, W. Lodwige & A. Dama.","MDG",NA,2005,"PRESERVED_SPECIMEN","OCCURRENCE_STATUS_INFERRED_FROM_INDIVIDUAL_COUNT;GEODETIC_DATUM_ASSUMED_WGS84;INSTITUTION_MATCH_FUZZY;COLLECTION_MATCH_NONE"
46.85416,-24.75277,"Streptocarpus muscosus",4032032690,"Near R. Integrale d'Andohahela, Parcelle 1. 33 km on road to Ranomafana from RN13. On moist boulders in stream.","MDG",NA,1992,"PRESERVED_SPECIMEN","OCCURRENCE_STATUS_INFERRED_FROM_INDIVIDUAL_COUNT;GEODETIC_DATUM_ASSUMED_WGS84;INSTITUTION_MATCH_FUZZY;COLLECTION_MATCH_NONE"
48.21666,-19.2,"Streptocarpus muscosus",4061963609,"Route Moramanga-Anosibe Forêt ombrophile","MDG",NA,1962,"PRESERVED_SPECIMEN","GEODETIC_DATUM_ASSUMED_WGS84;DIFFERENT_OWNER_INSTITUTION"
48.60916,-17.98916,"Streptocarpus muscosus",4061762532,"Ambohilero Forêt Classée. Logging road from Antserabe to Bemainty. Dense, humid forest and forest edge.","MDG",NA,2005,"PRESERVED_SPECIMEN","OCCURRENCE_STATUS_INFERRED_FROM_INDIVIDUAL_COUNT;GEODETIC_DATUM_ASSUMED_WGS84;INSTITUTION_MATCH_NONE"
48.83166,-18.41472,"Streptocarpus muscosus",1260380676,"Brickaville, Maroseranana, Andeka, Amparamanambola, à 6 heures de marches au Nord d'Andeka, route vers Besaha. Récolté avec J. Samisy, J.L. Andriatiana & R. Razakamalala.","MDG",NA,2005,"PRESERVED_SPECIMEN","OCCURRENCE_STATUS_INFERRED_FROM_INDIVIDUAL_COUNT;GEODETIC_DATUM_ASSUMED_WGS84;DIFFERENT_OWNER_INSTITUTION"
