"lon","lat","species","gbifID","locality","countryCode","coordinateUncertaintyInMeters","year","basisOfRecord","issue"
30.52,0.25,"Tephrosia interrupta",1096655004,"Uganda. Buhweju County, Bushenyi U2 District, Isingiro Hill. Grid Ref. TQ-72-22. Bushland formerly bordering a forest but now extinct.","UGA",NA,1998,"PRESERVED_SPECIMEN","GEODETIC_DATUM_ASSUMED_WGS84;INSTITUTION_COLLECTION_MISMATCH"
37.91,-4.34,"Tephrosia interrupta",3776336439,"Tanzania, Kilimanjaro, Same District. T 3. South Pare Mountains. Chome Forest Reserve (Shengena Forest) 2 km from junction of road from Suji and Bwamro to Chome.","TZA",NA,1999,"PRESERVED_SPECIMEN","GEODETIC_DATUM_ASSUMED_WGS84;INSTITUTION_COLLECTION_MISMATCH"
35.392222,-4.464167,"Tephrosia interrupta",2268974339,"Katesh Division; Hanang Nature Reserve; dense forest dominated by Gnidia sp., Dodonaea viscosa and Maytenus sp.","TZA",NA,2017,"PRESERVED_SPECIMEN","OCCURRENCE_STATUS_INFERRED_FROM_INDIVIDUAL_COUNT;COORDINATE_ROUNDED;GEODETIC_DATUM_ASSUMED_WGS84;INSTITUTION_MATCH_FUZZY;COLLECTION_MATCH_NONE"
29.583333,-3.2,"Tephrosia interrupta",2517689663,"Sous-bois de foret de montagne degradee Bukeye, Prov. Muramwya.","BDI",NA,1980,"PRESERVED_SPECIMEN","INSTITUTION_MATCH_FUZZY;INSTITUTION_COLLECTION_MISMATCH"
33.858507,-11.834108,"Tephrosia interrupta",2517685668,"5m NE Chikangawa.","MWI",NA,1978,"PRESERVED_SPECIMEN","INSTITUTION_MATCH_FUZZY;INSTITUTION_COLLECTION_MISMATCH"
38.416667,8.166667,"Tephrosia interrupta",2517241034,"Wegeram, Gibi arga Biteyne Forest, c. 10 km NE of Butajira town.","ETH",NA,1992,"PRESERVED_SPECIMEN","INSTITUTION_MATCH_FUZZY;INSTITUTION_COLLECTION_MISMATCH"
33.3,-9.183333,"Tephrosia interrupta",2515851950,"Mbeya: Mbeya District, 7 km from S of Ruanda II (appoximately 2 km N of water tank at Ilembo on Ilembo - Mbalizi road).","TZA",NA,1992,"PRESERVED_SPECIMEN","INSTITUTION_MATCH_FUZZY;INSTITUTION_COLLECTION_MISMATCH"
33.983333,-11.466667,"Tephrosia interrupta",2517692697,"N. Prov., Mzimba Dist., 3 mi. west of Mzuzu, Katoto.","MWI",NA,1973,"PRESERVED_SPECIMEN","INSTITUTION_MATCH_FUZZY;INSTITUTION_COLLECTION_MISMATCH"
37.462928,-2.933398,"Tephrosia interrupta",4014175615,"","TZA",NA,1969,"PRESERVED_SPECIMEN","OCCURRENCE_STATUS_INFERRED_FROM_INDIVIDUAL_COUNT;COORDINATE_ROUNDED;COLLECTION_MATCH_NONE"
35.278066,-4.616335,"Tephrosia interrupta",4014175003,"Himiti","TZA",NA,1968,"PRESERVED_SPECIMEN","OCCURRENCE_STATUS_INFERRED_FROM_INDIVIDUAL_COUNT;COORDINATE_ROUNDED;COLLECTION_MATCH_NONE"
34.96878,-9.363343,"Tephrosia interrupta",4014176451,"Nyumbanyitu Forest Reserve","TZA",NA,1967,"PRESERVED_SPECIMEN","OCCURRENCE_STATUS_INFERRED_FROM_INDIVIDUAL_COUNT;COORDINATE_ROUNDED;COLLECTION_MATCH_NONE"
35.686971,-7.771394,"Tephrosia interrupta",4014176525,"","TZA",NA,1954,"PRESERVED_SPECIMEN","OCCURRENCE_STATUS_INFERRED_FROM_INDIVIDUAL_COUNT;COORDINATE_ROUNDED;COLLECTION_MATCH_NONE"
38.291259,-4.797811,"Tephrosia interrupta",4014177955,"","TZA",NA,1967,"PRESERVED_SPECIMEN","OCCURRENCE_STATUS_INFERRED_FROM_INDIVIDUAL_COUNT;COORDINATE_ROUNDED;COLLECTION_MATCH_NONE"
29.183333,-0.45,"Tephrosia interrupta",2515805118,"Matembe.","COD",NA,1959,"PRESERVED_SPECIMEN","INSTITUTION_MATCH_FUZZY;INSTITUTION_COLLECTION_MISMATCH"
41,9.133333,"Tephrosia interrupta",2517381718,"on the road from Asbe-Tafri to Kobbo, 29km from Asbe-Tafari.","ETH",NA,1967,"PRESERVED_SPECIMEN","INSTITUTION_MATCH_FUZZY;INSTITUTION_COLLECTION_MISMATCH"
38.566667,8.983333,"Tephrosia interrupta",2515685955,"W slope of Mt. Uociacia, c 15 km W of Addis Ababa.","ETH",NA,1966,"PRESERVED_SPECIMEN","INSTITUTION_MATCH_FUZZY;INSTITUTION_COLLECTION_MISMATCH"
29.666667,-1.35,"Tephrosia interrupta",2517429612,"Kigezi District, Virunga-Kette, Nordfuss des Muhavura, Nkanda.","UGA",NA,1954,"PRESERVED_SPECIMEN","INSTITUTION_MATCH_FUZZY;INSTITUTION_COLLECTION_MISMATCH"
35.583333,6.183333,"Tephrosia interrupta",2517226945,"Maji. just N. of the Presbyterian Mission.","ETH",NA,1970,"PRESERVED_SPECIMEN","INSTITUTION_MATCH_FUZZY;INSTITUTION_COLLECTION_MISMATCH"
35.331667,-8.533333,"Tephrosia interrupta",1257551788,"Ifwagi Division, Mtwango Ward, Sawala Village Forest, with Macaranga capensis, Nuxia congesta and Apodytes dimidiata.","TZA",NA,2008,"PRESERVED_SPECIMEN","OCCURRENCE_STATUS_INFERRED_FROM_INDIVIDUAL_COUNT;COORDINATE_ROUNDED;GEODETIC_DATUM_ASSUMED_WGS84;INSTITUTION_MATCH_FUZZY;COLLECTION_MATCH_NONE"
37.33,7.57,"Tephrosia interrupta",1675872421,"Edge of barley field, Omonadda road turnoff at Little Ghibbie River, 38 km. N.E. of Jimma, then 28 km. so., between Nadda village and Omo, Kaffa Province.","ETH",NA,1962,"PRESERVED_SPECIMEN","GEODETIC_DATUM_ASSUMED_WGS84"
30.51666,-0.25,"Tephrosia interrupta",4061578842,"Buhweju County, Bushenyi U2 District, Isingiro Hill. Grid Ref. TQ-72-22. Bushland formerly bordering a forest but now extinct.","UGA",NA,1998,"PRESERVED_SPECIMEN","OCCURRENCE_STATUS_INFERRED_FROM_INDIVIDUAL_COUNT;GEODETIC_DATUM_ASSUMED_WGS84;INSTITUTION_MATCH_NONE"
38.333333,4.083333,"Tephrosia interrupta",1840357036,"Mega, S. Ethiopia","ETH",NA,1952,"PRESERVED_SPECIMEN","GEODETIC_DATUM_ASSUMED_WGS84;CONTINENT_DERIVED_FROM_COORDINATES;INSTITUTION_MATCH_FUZZY;COLLECTION_MATCH_FUZZY"
30.43,-0.33,"Tephrosia interrupta",1675993754,"Buhweju, W. Ankole U2, Muzingura-Kashaarara.","UGA",NA,1987,"PRESERVED_SPECIMEN","GEODETIC_DATUM_ASSUMED_WGS84"
38.233333,5.633333,"Tephrosia interrupta",1840357091,"Agheremariam (Alghe), S. Ethiopia","ETH",NA,1952,"PRESERVED_SPECIMEN","GEODETIC_DATUM_ASSUMED_WGS84;CONTINENT_DERIVED_FROM_COORDINATES;INSTITUTION_MATCH_FUZZY;COLLECTION_MATCH_FUZZY"
37.366667,7.616667,"Tephrosia interrupta",1840357010,"Kaffa prov., Mt. Maigudo, N.W. exposed slope","ETH",NA,1970,"PRESERVED_SPECIMEN","GEODETIC_DATUM_ASSUMED_WGS84;CONTINENT_DERIVED_FROM_COORDINATES;INSTITUTION_MATCH_FUZZY;COLLECTION_MATCH_FUZZY"
33.694069,-10.571008,"Tephrosia interrupta",3033568641,"Kaperekeza road, Nyika National Park","MWI",NA,2018,"PRESERVED_SPECIMEN","GEODETIC_DATUM_ASSUMED_WGS84;CONTINENT_DERIVED_FROM_COORDINATES;INSTITUTION_MATCH_FUZZY;COLLECTION_MATCH_FUZZY"
35.633333,-1.416667,"Tephrosia interrupta",1840357151,"Kenya: Rift Valley Province, Kajiado District. Northern slope of the highest of the Ngong Hills","KEN",NA,1968,"PRESERVED_SPECIMEN","GEODETIC_DATUM_ASSUMED_WGS84;CONTINENT_DERIVED_FROM_COORDINATES;INSTITUTION_MATCH_FUZZY;COLLECTION_MATCH_FUZZY"
29.833333,-6.2,"Tephrosia interrupta",4061157516,"Mahali Mts","TZA",NA,1958,"PRESERVED_SPECIMEN","COORDINATE_ROUNDED;GEODETIC_DATUM_ASSUMED_WGS84;INSTITUTION_MATCH_NONE"
36.133333,7.25,"Tephrosia interrupta",1840357001,"Nr. Wushuresh, Kaffa","ETH",NA,1960,"PRESERVED_SPECIMEN","GEODETIC_DATUM_ASSUMED_WGS84;CONTINENT_DERIVED_FROM_COORDINATES;INSTITUTION_MATCH_FUZZY;COLLECTION_MATCH_FUZZY"
37.383333,7.5,"Tephrosia interrupta",1840357083,"Ethiopia, Kaffa Prov. Mt. Maigudo, 41 km from Jimma- Addis road, on the Omo-Nada track","ETH",NA,1972,"PRESERVED_SPECIMEN","GEODETIC_DATUM_ASSUMED_WGS84;CONTINENT_DERIVED_FROM_COORDINATES;INSTITUTION_MATCH_FUZZY;COLLECTION_MATCH_FUZZY"
41.216667,9.3,"Tephrosia interrupta",2515832628,"Gara Ades, w. of Kulubi, along road to Asbe taferi, c. 2 km S. of mainroad.","ETH",NA,1970,"PRESERVED_SPECIMEN","INSTITUTION_MATCH_FUZZY;INSTITUTION_COLLECTION_MISMATCH"
36.43138,-7.76277,"Tephrosia interrupta",1258777350,"Udzungwa Mountains","TZA",NA,1999,"PRESERVED_SPECIMEN","OCCURRENCE_STATUS_INFERRED_FROM_INDIVIDUAL_COUNT;GEODETIC_DATUM_ASSUMED_WGS84;INSTITUTION_MATCH_FUZZY;COLLECTION_MATCH_NONE"
42.2,9.47,"Tephrosia interrupta",1675802167,"Harar Prov., road most of Ejersa-Goro to Combulcia and Harar.","ETH",NA,1963,"PRESERVED_SPECIMEN","GEODETIC_DATUM_ASSUMED_WGS84"
36.6,9.066667,"Tephrosia interrupta",2517241035,"c 5 km E of Lekemti.","ETH",NA,1965,"PRESERVED_SPECIMEN","INSTITUTION_MATCH_FUZZY;INSTITUTION_COLLECTION_MISMATCH"
33.65,-8.966667,"Tephrosia interrupta",2517643574,"Mbeya: Mbeya District, Mporoto Ridge; ca 4 km NW of Igoma on NW slope of Mlima wa Bangi (Hemp Hill).","TZA",NA,1992,"PRESERVED_SPECIMEN","INSTITUTION_MATCH_FUZZY;INSTITUTION_COLLECTION_MISMATCH"
29.783333,-1.05,"Tephrosia interrupta",2515778282,"Southern, Kigezi (U2); Rubanda. Bwindi Forest (Impenetrable Forets). RJ-84-09.","UGA",NA,1989,"PRESERVED_SPECIMEN","INSTITUTION_MATCH_FUZZY;INSTITUTION_COLLECTION_MISMATCH"
33.871553,-11.829068,"Tephrosia interrupta",2515778284,"6m. NE Chikangawa.","MWI",NA,1978,"PRESERVED_SPECIMEN","INSTITUTION_MATCH_FUZZY;INSTITUTION_COLLECTION_MISMATCH"
41.683333,9.416667,"Tephrosia interrupta",2517429613,"c. 3 km past Kulubi (also spelled Collubi) on the highway Addis Ababa - via Asbe Tafari - toHarrar.","ETH",NA,1968,"PRESERVED_SPECIMEN","INSTITUTION_MATCH_FUZZY;INSTITUTION_COLLECTION_MISMATCH"
38.25,8.066667,"Tephrosia interrupta",2515659724,"Gurage Mountains above Butajira, towards the village Ageta on the track towards Endibis.","ETH",NA,2000,"PRESERVED_SPECIMEN","INSTITUTION_MATCH_FUZZY;INSTITUTION_COLLECTION_MISMATCH"
36.64277,-7.07583,"Tephrosia interrupta",4061762635,"T6. Rubeho Mountains, Ukwiva Forest Reserve. Evergreen montane rain forest dominated by Bridelia brideliifolia, Macaranga capensis and Aphloia theiformis.","TZA",NA,2005,"PRESERVED_SPECIMEN","OCCURRENCE_STATUS_INFERRED_FROM_INDIVIDUAL_COUNT;GEODETIC_DATUM_ASSUMED_WGS84;INSTITUTION_MATCH_NONE"
35.62027,-8.61,"Tephrosia interrupta",4060942789,"Lulanda Village, shrubby woodland with tall grass three years after cultivation, 20 m W of Fufu montane forest patch.","TZA",NA,1998,"PRESERVED_SPECIMEN","OCCURRENCE_STATUS_INFERRED_FROM_INDIVIDUAL_COUNT;GEODETIC_DATUM_ASSUMED_WGS84;INSTITUTION_MATCH_NONE"
34.883333,-10.916667,"Tephrosia interrupta",4062161946,"Matengo Hills","TZA",NA,1956,"PRESERVED_SPECIMEN","COORDINATE_ROUNDED;GEODETIC_DATUM_ASSUMED_WGS84;INSTITUTION_MATCH_NONE"
36.24416,-2.9025,"Tephrosia interrupta",4060946229,"T2. Ketumbeine Mountain. E slopes.","TZA",NA,1999,"PRESERVED_SPECIMEN","OCCURRENCE_STATUS_INFERRED_FROM_INDIVIDUAL_COUNT;GEODETIC_DATUM_ASSUMED_WGS84;INSTITUTION_MATCH_NONE"
30.48333,-0.36666,"Tephrosia interrupta",4061776382,"Buhweju Bushenyi U2 (Ankole), Engorogoro, Kamuki TQ-60-20","UGA",NA,2002,"PRESERVED_SPECIMEN","OCCURRENCE_STATUS_INFERRED_FROM_INDIVIDUAL_COUNT;GEODETIC_DATUM_ASSUMED_WGS84;INSTITUTION_MATCH_NONE"
37.635,6.398333,"Tephrosia interrupta",2515633964,"Gughe highlands, 23 km N of Chencha and 6 km S of Zefne (Boreda), along little used road.","ETH",NA,2005,"PRESERVED_SPECIMEN","INSTITUTION_MATCH_FUZZY;INSTITUTION_COLLECTION_MISMATCH"
39.50638,-6.94916,"Tephrosia interrupta",4060988115,"(T6) Amani Gomvu Village, village forest W of Indian Ocean, dominated by Manilkara sp., Ozoroa obovata and Sorindeia madagascariensis.","TZA",NA,2002,"PRESERVED_SPECIMEN","OCCURRENCE_STATUS_INFERRED_FROM_INDIVIDUAL_COUNT;GEODETIC_DATUM_ASSUMED_WGS84;INSTITUTION_MATCH_NONE"
37.45,9.016667,"Tephrosia interrupta",2515824143,"c 70 km W of Ambo, near Gheddo, along Lekemti road.","ETH",NA,1965,"PRESERVED_SPECIMEN","INSTITUTION_MATCH_FUZZY;INSTITUTION_COLLECTION_MISMATCH"
33.7,-8.96666,"Tephrosia interrupta",1261525566,"Ilenga Forest Reserve; ca 5 km NE of Igoma on W slope of Ilungu mountains, in partially disturbed forest with Entandophragma sp., Parinari excelsa, and Neoboutonia macrocalyx.","TZA",NA,1992,"PRESERVED_SPECIMEN","OCCURRENCE_STATUS_INFERRED_FROM_INDIVIDUAL_COUNT;GEODETIC_DATUM_ASSUMED_WGS84;INSTITUTION_MATCH_FUZZY;COLLECTION_MATCH_NONE"
29.433333,-3.533333,"Tephrosia interrupta",2515658513,"Prov. Bujumbura; Karinzi (Misison).","BDI",NA,1979,"PRESERVED_SPECIMEN","TAXON_MATCH_HIGHERRANK;INSTITUTION_MATCH_FUZZY;INSTITUTION_COLLECTION_MISMATCH"
35.23961,-13.370524,"Tephrosia interrupta",866267569,"Vila Cabral, Vila Cabral, a 8 km, na estrada para Mandimba.","MOZ",NA,1958,"PRESERVED_SPECIMEN","RECORDED_DATE_INVALID;COORDINATE_PRECISION_INVALID;INSTITUTION_MATCH_FUZZY;COLLECTION_MATCH_FUZZY"
30.1397,0.6682,"Tephrosia interrupta",1835724628,"","UGA",NA,1994,"HUMAN_OBSERVATION","COUNTRY_DERIVED_FROM_COORDINATES;CONTINENT_DERIVED_FROM_COORDINATES"
30.0857,-0.337,"Tephrosia interrupta",1835724645,"","UGA",NA,1993,"HUMAN_OBSERVATION","COUNTRY_DERIVED_FROM_COORDINATES;CONTINENT_DERIVED_FROM_COORDINATES"
