"lon","lat","species","gbifID","locality","countryCode","coordinateUncertaintyInMeters","year","basisOfRecord","issue"
46.76972,-25.13694,"Tetracera madagascariensis",1258607763,"Hill of Eringaza, N of Mihana and campsite. Fokontany Mihana, Firaisana Manambaro, Fivondronona Fort-Dauphin. Plant preserved in alcohol. Collected under the second Madagascar Field Botanist Training Course.","MDG",NA,1997,"PRESERVED_SPECIMEN","OCCURRENCE_STATUS_INFERRED_FROM_INDIVIDUAL_COUNT;GEODETIC_DATUM_ASSUMED_WGS84;DIFFERENT_OWNER_INSTITUTION"
48.53611,-13.75,"Tetracera madagascariensis",1258970625,"Ambanja, Bemanevoka, Ambobaka. Forêt dense humide de moyenne altitude. Echantillon préservé en alcool.","MDG",NA,2000,"PRESERVED_SPECIMEN","GEODETIC_DATUM_ASSUMED_WGS84;DIFFERENT_OWNER_INSTITUTION"
49.86666,-15.2,"Tetracera madagascariensis",1260714608,"Canton : Ambohitralanana. District : Antalaha.","MDG",NA,1957,"PRESERVED_SPECIMEN","GEODETIC_DATUM_ASSUMED_WGS84;DIFFERENT_OWNER_INSTITUTION"
48.640556,-19.217778,"Tetracera madagascariensis",1257728404,"Atsinanana, Vatomandry, Ambalabe, Sahanintsina. Le long de la route Sahanintsina-Ambalabe. Echantillons préservés en alcool.","MDG",NA,2011,"PRESERVED_SPECIMEN","OCCURRENCE_STATUS_INFERRED_FROM_INDIVIDUAL_COUNT;COORDINATE_ROUNDED;GEODETIC_DATUM_ASSUMED_WGS84;DIFFERENT_OWNER_INSTITUTION"
49.618333,-14.609444,"Tetracera madagascariensis",1258062205,"District d'Andapa, Commune de Belaoko-Marovato, FKT de Belaoko-Marovato, village proche : Belaoko, forêt d'Antanetiambo, Antanetiambo Nature Reserve.","MDG",NA,2014,"PRESERVED_SPECIMEN","OCCURRENCE_STATUS_INFERRED_FROM_INDIVIDUAL_COUNT;COORDINATE_ROUNDED;GEODETIC_DATUM_ASSUMED_WGS84;DIFFERENT_OWNER_INSTITUTION"
49.565278,-16.957222,"Tetracera madagascariensis",4062006650,"Soanierana Ivongo-Ampasimbola. 50 m SE of track. PDOP 2.5. Collected with S. Randrianasolo, I. Rakotozafy, T. Rakotomamonjy & G. Rafamantanantsoa.","MDG",NA,1996,"PRESERVED_SPECIMEN","OCCURRENCE_STATUS_INFERRED_FROM_INDIVIDUAL_COUNT;COORDINATE_ROUNDED;GEODETIC_DATUM_ASSUMED_WGS84;DIFFERENT_OWNER_INSTITUTION"
49.667778,-16.770556,"Tetracera madagascariensis",4061331572,"District Soaneran'Ivongo, Commune Manompana, Fokontany Antanambao-Ambodimanga et Vohijiny, Village Andakibe et Ambohitsara. Herbier conservé en alcool.","MDG",NA,2019,"PRESERVED_SPECIMEN","OCCURRENCE_STATUS_INFERRED_FROM_INDIVIDUAL_COUNT;GEODETIC_DATUM_ASSUMED_WGS84;DIFFERENT_OWNER_INSTITUTION"
47,-24.95,"Tetracera madagascariensis",1259217918,"Fort Dauphin. Forêt de Mandena. Forêt sur sable.","MDG",NA,1985,"PRESERVED_SPECIMEN","OCCURRENCE_STATUS_INFERRED_FROM_INDIVIDUAL_COUNT;GEODETIC_DATUM_ASSUMED_WGS84;DIFFERENT_OWNER_INSTITUTION"
48.28333,-14.06666,"Tetracera madagascariensis",1260713801,"Réserve spéciale de Manongarivo. Besinkara. Entre Ambodisakoana et Ambalafary, plateau après la corniche bord de chemin en forêt secondaire jeune.","MDG",NA,1994,"PRESERVED_SPECIMEN","GEODETIC_DATUM_ASSUMED_WGS84;DIFFERENT_OWNER_INSTITUTION"
50.366667,-15.266667,"Tetracera madagascariensis",1258394735,"Masoala Peninsula, W of Ambohitralanana. Forest near Sahafary.","MDG",NA,1997,"PRESERVED_SPECIMEN","OCCURRENCE_STATUS_INFERRED_FROM_INDIVIDUAL_COUNT;COORDINATE_ROUNDED;GEODETIC_DATUM_ASSUMED_WGS84;DIFFERENT_OWNER_INSTITUTION"
50.01666,-15.78333,"Tetracera madagascariensis",1259223469,"Antalavia, Peninsula of Masaola. Coastal forest on sand.","MDG",NA,1988,"PRESERVED_SPECIMEN","OCCURRENCE_STATUS_INFERRED_FROM_INDIVIDUAL_COUNT;GEODETIC_DATUM_ASSUMED_WGS84;ELEVATION_NON_NUMERIC;DIFFERENT_OWNER_INSTITUTION"
47.981667,-13.763333,"Tetracera madagascariensis",4061711182,"Diana, Ambanja, Bemanevika, Bandrakorony. Forêt primaire subhumide de basse altitude de Bandrakorony, près du ruisseau de Betsitsika sur la presqu'île Ampasindava. Echantillon préservé en alcool.","MDG",NA,2009,"PRESERVED_SPECIMEN","OCCURRENCE_STATUS_INFERRED_FROM_INDIVIDUAL_COUNT;COORDINATE_ROUNDED;GEODETIC_DATUM_ASSUMED_WGS84;DIFFERENT_OWNER_INSTITUTION"
48.711944,-13.589722,"Tetracera madagascariensis",4061217482,"Ambilobe, Beramanja, Anketrabe Belinta. Forêt de Galoko.","MDG",NA,2013,"PRESERVED_SPECIMEN","OCCURRENCE_STATUS_INFERRED_FROM_INDIVIDUAL_COUNT;COORDINATE_ROUNDED;GEODETIC_DATUM_ASSUMED_WGS84;DIFFERENT_OWNER_INSTITUTION"
48.32,-13.42,"Tetracera madagascariensis",2618566425,"Madagascar. Antsiranana. Nosy Be. Réserve Intégrale de Lokobe.","MDG",NA,1994,"PRESERVED_SPECIMEN","GEODETIC_DATUM_ASSUMED_WGS84;INSTITUTION_COLLECTION_MISMATCH"
46.8,-24.67,"Tetracera madagascariensis",2397729349,"Anosy Region. Intégrale Réserve # 11, Andohahela, Parcelle 1, southwest of Eminiminy, Manatavona River.","MDG",NA,1993,"PRESERVED_SPECIMEN","GEODETIC_DATUM_ASSUMED_WGS84"
48.124166,-14.059504,"Tetracera madagascariensis",3902635778,"","MDG",4,2022,"HUMAN_OBSERVATION","COORDINATE_ROUNDED;CONTINENT_DERIVED_FROM_COORDINATES"
49.04,-12.59,"Tetracera madagascariensis",2618393415,"Madagascar, Antsiranana: DIANA Region. Fivondronana Antsiranana II. A 7 km á lQuest du village de Bobakilandy (Antosha)","MDG",NA,1995,"PRESERVED_SPECIMEN","GEODETIC_DATUM_ASSUMED_WGS84;INSTITUTION_COLLECTION_MISMATCH"
49.805556,-14.341667,"Tetracera madagascariensis",4031460429,"Marojejy RNI, au nord d'Andapa. Andrahanjo, Sambava. Forêt dense humide, sol sableux. Echantillon préservé en alcool.","MDG",NA,1994,"PRESERVED_SPECIMEN","OCCURRENCE_STATUS_INFERRED_FROM_INDIVIDUAL_COUNT;COORDINATE_ROUNDED;GEODETIC_DATUM_ASSUMED_WGS84;INSTITUTION_MATCH_FUZZY;COLLECTION_MATCH_NONE"
49.46722,-14.33722,"Tetracera madagascariensis",4031590583,"Sava, Andapa, Doany, Anjialavahely. Forêt humide de moyenne altitude d'Ankarongameloka. Echantillon préservé en alcool. Récolté avec Jacky, Mobel & José.","MDG",NA,2006,"PRESERVED_SPECIMEN","OCCURRENCE_STATUS_INFERRED_FROM_INDIVIDUAL_COUNT;GEODETIC_DATUM_ASSUMED_WGS84;INSTITUTION_MATCH_FUZZY;COLLECTION_MATCH_NONE"
49.766667,-15.5,"Tetracera madagascariensis",4031363372,"Nosy Mangabe, a 520 hectare island 5 km from Maroantsetra in the Bay of Antongil.","MDG",NA,1988,"PRESERVED_SPECIMEN","OCCURRENCE_STATUS_INFERRED_FROM_INDIVIDUAL_COUNT;COORDINATE_ROUNDED;GEODETIC_DATUM_ASSUMED_WGS84;ELEVATION_NON_NUMERIC;INSTITUTION_MATCH_FUZZY;COLLECTION_MATCH_NONE"
48.73333,-13.81666,"Tetracera madagascariensis",4031619509,"R.N. 4. Canton : Marovato. District : Ambanja.","MDG",NA,1952,"PRESERVED_SPECIMEN","GEODETIC_DATUM_ASSUMED_WGS84;INSTITUTION_MATCH_FUZZY;COLLECTION_MATCH_NONE"
47.394222,-14.781197,"Tetracera madagascariensis",3902165435,"","MDG",3,2019,"HUMAN_OBSERVATION","COORDINATE_ROUNDED;CONTINENT_DERIVED_FROM_COORDINATES"
48.057686,-14.411213,"Tetracera madagascariensis",3408180623,"","MDG",8,2021,"HUMAN_OBSERVATION","COORDINATE_ROUNDED;CONTINENT_DERIVED_FROM_COORDINATES"
48.167828,-13.862053,"Tetracera madagascariensis",1453218412,"","MDG",10,2016,"HUMAN_OBSERVATION","COORDINATE_ROUNDED;CONTINENT_DERIVED_FROM_COORDINATES"
49.7694,-15.4944,"Tetracera madagascariensis",1259213750,"Island of Nosy Mangabe, 5 km S of Maroantsetra in the Bay of Antongil.","MDG",NA,1990,"PRESERVED_SPECIMEN","OCCURRENCE_STATUS_INFERRED_FROM_INDIVIDUAL_COUNT;GEODETIC_DATUM_ASSUMED_WGS84;ELEVATION_NON_NUMERIC;INSTITUTION_MATCH_FUZZY;COLLECTION_MATCH_NONE"
48.547657,-13.4635,"Tetracera madagascariensis",2244277758,"","MDG",8,2019,"HUMAN_OBSERVATION","COORDINATE_ROUNDED;CONTINENT_DERIVED_FROM_COORDINATES"
48.45,-13.916667,"Tetracera madagascariensis",2516181221,"Réserve Spéciale de Manongarivo. Anketraka Be, Bas Ambahatra: Cours inférieur du bassin-versant de rano Ambahatra.","MDG",NA,1998,"PRESERVED_SPECIMEN","INSTITUTION_MATCH_FUZZY;INSTITUTION_COLLECTION_MISMATCH"
47.210278,-24.569444,"Tetracera madagascariensis",4032064195,"Commune Iabokoho, Fokontany Antsontso, Ivohibe forest.","MDG",NA,2006,"PRESERVED_SPECIMEN","OCCURRENCE_STATUS_INFERRED_FROM_INDIVIDUAL_COUNT;COORDINATE_ROUNDED;GEODETIC_DATUM_ASSUMED_WGS84;INSTITUTION_MATCH_FUZZY;COLLECTION_MATCH_NONE"
49.96666,-15.5,"Tetracera madagascariensis",4031773430,"Baie d'Antongil, bord de mer ca. 2 km au Sud d'Ambanizana. With P.P. Lowry II, G.E. Schatz, & A. Rakotozafy.","MDG",NA,1988,"PRESERVED_SPECIMEN","OCCURRENCE_STATUS_INFERRED_FROM_INDIVIDUAL_COUNT;GEODETIC_DATUM_ASSUMED_WGS84;INSTITUTION_MATCH_FUZZY;COLLECTION_MATCH_NONE"
49.96944,-15.69166,"Tetracera madagascariensis",4031986076,"Ambodiforaha, au Sud-Est, Firaisana Anjahana, Fivondronana Maroantsetra. Presqu'île de Masoala. Récolte avec R. Randriamaroson et Moise.","MDG",NA,1994,"PRESERVED_SPECIMEN","OCCURRENCE_STATUS_INFERRED_FROM_INDIVIDUAL_COUNT;GEODETIC_DATUM_ASSUMED_WGS84;INSTITUTION_MATCH_FUZZY;COLLECTION_MATCH_NONE"
47.503333,-23.525556,"Tetracera madagascariensis",4031765392,"District Vangaindrano, Commune Vohipaho, Fokontany Vohipaho, Ankarabolava-Agnakatrika.","MDG",NA,2014,"PRESERVED_SPECIMEN","OCCURRENCE_STATUS_INFERRED_FROM_INDIVIDUAL_COUNT;COORDINATE_ROUNDED;GEODETIC_DATUM_ASSUMED_WGS84;INSTITUTION_MATCH_FUZZY;COLLECTION_MATCH_NONE"
44.503889,-18.011389,"Tetracera madagascariensis",4031377904,"Beanka, partie sud. Andoloposa","MDG",NA,2012,"PRESERVED_SPECIMEN","OCCURRENCE_STATUS_INFERRED_FROM_INDIVIDUAL_COUNT;GEODETIC_DATUM_ASSUMED_WGS84;INSTITUTION_MATCH_FUZZY;COLLECTION_MATCH_NONE"
49.2,-17.85,"Tetracera madagascariensis",1261833389,"East Coast. Betampona Rèserve Naturelle Intègrale, 40 km NW of Toamasina.","MDG",NA,1993,"PRESERVED_SPECIMEN","OCCURRENCE_STATUS_INFERRED_FROM_INDIVIDUAL_COUNT;GEODETIC_DATUM_ASSUMED_WGS84;DIFFERENT_OWNER_INSTITUTION"
44.58333,-18.21666,"Tetracera madagascariensis",4061478976,"District : Antsalova","MDG",NA,1958,"PRESERVED_SPECIMEN","GEODETIC_DATUM_ASSUMED_WGS84;DIFFERENT_OWNER_INSTITUTION"
46.866667,-24.8,"Tetracera madagascariensis",1259217346,"Réserve Intégrale # 11, Andohahela, Parcelle 1, Isaka Ivondro. Plantes préservées dans l'alcool.","MDG",NA,1993,"PRESERVED_SPECIMEN","OCCURRENCE_STATUS_INFERRED_FROM_INDIVIDUAL_COUNT;COORDINATE_ROUNDED;GEODETIC_DATUM_ASSUMED_WGS84;DIFFERENT_OWNER_INSTITUTION"
50.05,-14.1,"Tetracera madagascariensis",4061191429,"Sambava, Anjangoveratra, Ambavala, forêt d'Andohananjombalava.","MDG",NA,2014,"PRESERVED_SPECIMEN","OCCURRENCE_STATUS_INFERRED_FROM_INDIVIDUAL_COUNT;GEODETIC_DATUM_ASSUMED_WGS84;DIFFERENT_OWNER_INSTITUTION"
49.13333,-18.9,"Tetracera madagascariensis",1259222678,"Along road Ambila-Lemaitso to Ampasimanolotra (Brickaville), about 500 m after turnoff to Andevoranto; low forest on sandy soil. Collected with Etienne Rakotobe, Armand Randrianasolo & Amy Pool.","MDG",NA,1991,"PRESERVED_SPECIMEN","OCCURRENCE_STATUS_INFERRED_FROM_INDIVIDUAL_COUNT;GEODETIC_DATUM_ASSUMED_WGS84;DIFFERENT_OWNER_INSTITUTION"
50.411667,-15.554167,"Tetracera madagascariensis",1258403347,"Parc National de Masoala. Antanjokatanafana.","MDG",NA,1994,"PRESERVED_SPECIMEN","OCCURRENCE_STATUS_INFERRED_FROM_INDIVIDUAL_COUNT;COORDINATE_ROUNDED;GEODETIC_DATUM_ASSUMED_WGS84;DIFFERENT_OWNER_INSTITUTION"
48.862222,-13.894722,"Tetracera madagascariensis",4061397283,"Fivondronana: Ambanja. Commune: Ambodimanga Ramena. Fokotany: Antsahabe. Ramena River. Tsaratanana Reserve.","MDG",NA,2001,"PRESERVED_SPECIMEN","OCCURRENCE_STATUS_INFERRED_FROM_INDIVIDUAL_COUNT;COORDINATE_ROUNDED;GEODETIC_DATUM_ASSUMED_WGS84;DIFFERENT_OWNER_INSTITUTION"
47.5175,-23.442778,"Tetracera madagascariensis",1257624801,"Atsimo-Atsinanana, Vangaindrano, Sianofana, Ambatomalama, forêt de Vohipaho.","MDG",NA,2009,"PRESERVED_SPECIMEN","OCCURRENCE_STATUS_INFERRED_FROM_INDIVIDUAL_COUNT;COORDINATE_ROUNDED;GEODETIC_DATUM_ASSUMED_WGS84;DIFFERENT_OWNER_INSTITUTION"
47.085,-24.503333,"Tetracera madagascariensis",4061910441,"Commune Rurale Bevoay, Fokontany Fenoambany. Forêt de Mahalao situé au Sud est du village d'Androangabe ambany.","MDG",NA,2010,"PRESERVED_SPECIMEN","OCCURRENCE_STATUS_INFERRED_FROM_INDIVIDUAL_COUNT;COORDINATE_ROUNDED;GEODETIC_DATUM_ASSUMED_WGS84;DIFFERENT_OWNER_INSTITUTION"
48.883333,-19.533333,"Tetracera madagascariensis",4061765892,"5 km north of Ilaka-Est forest, between Ambodisakaona village and Antandrainiminty.","MDG",NA,1993,"PRESERVED_SPECIMEN","OCCURRENCE_STATUS_INFERRED_FROM_INDIVIDUAL_COUNT;COORDINATE_ROUNDED;GEODETIC_DATUM_ASSUMED_WGS84;ELEVATION_NON_NUMERIC;DIFFERENT_OWNER_INSTITUTION"
47.06666,-16.15,"Tetracera madagascariensis",4061062972,"Reserve Naturelle d'Ankarafantsika, forêt au bord du lac Ravelobe.","MDG",NA,1994,"PRESERVED_SPECIMEN","GEODETIC_DATUM_ASSUMED_WGS84;INSTITUTION_MATCH_NONE"
49.46666,-17.48333,"Tetracera madagascariensis",1259048299,"4 km N of Mahambo, between Fenerive and Foulpointe, near sea level. Clay soil, not sandy.","MDG",NA,1974,"PRESERVED_SPECIMEN","GEODETIC_DATUM_ASSUMED_WGS84;DIFFERENT_OWNER_INSTITUTION"
46.96666,-24.56666,"Tetracera madagascariensis",1260713714,"Along road through mountain forest in Chaînes Anosyennes from Ft. Dauphin to Ranamafona; 1-28 km from Route #10.","MDG",NA,1975,"PRESERVED_SPECIMEN","GEODETIC_DATUM_ASSUMED_WGS84;DIFFERENT_OWNER_INSTITUTION"
49.416311,-12.62323,"Tetracera madagascariensis",1883469713,"","MDG",7,2018,"HUMAN_OBSERVATION","COORDINATE_ROUNDED;CONTINENT_DERIVED_FROM_COORDINATES"
48.45,-13.66666,"Tetracera madagascariensis",1260714592,"Km 10, Est. Dt. Ambanja Lisière de forêts","MDG",NA,1963,"PRESERVED_SPECIMEN","GEODETIC_DATUM_ASSUMED_WGS84;DIFFERENT_OWNER_INSTITUTION"
50.097222,-13.718889,"Tetracera madagascariensis",1259240273,"Fivondronana: Vohémar, Firaisana: Tsarabaria, Fokontany: Manakana. Á l'Est du village à Ambondrobe. Echantillon préservé en alcool.","MDG",NA,2004,"PRESERVED_SPECIMEN","OCCURRENCE_STATUS_INFERRED_FROM_INDIVIDUAL_COUNT;COORDINATE_ROUNDED;GEODETIC_DATUM_ASSUMED_WGS84;DIFFERENT_OWNER_INSTITUTION"
46.88333,-25,"Tetracera madagascariensis",1260714215,"Soanierana (Ft Dauphin)","MDG",NA,1966,"PRESERVED_SPECIMEN","GEODETIC_DATUM_ASSUMED_WGS84;DIFFERENT_OWNER_INSTITUTION"
49.376111,-14.162778,"Tetracera madagascariensis",1260638347,"Antsiranana, Sava, Andapa, Anjialavabe, Ankiakabe.","MDG",NA,2007,"PRESERVED_SPECIMEN","OCCURRENCE_STATUS_INFERRED_FROM_INDIVIDUAL_COUNT;COORDINATE_ROUNDED;GEODETIC_DATUM_ASSUMED_WGS84;DIFFERENT_OWNER_INSTITUTION"
49.01666,-18.38333,"Tetracera madagascariensis",1260713721,"Environs d'Anivoranokely et d'Andrambolahy kely. Dt. de Brickaville. Ct. d'Ambalarondra. Gt. d'Ambinaninony.","MDG",NA,1951,"PRESERVED_SPECIMEN","GEODETIC_DATUM_ASSUMED_WGS84;DIFFERENT_OWNER_INSTITUTION"
49.46111,-17.70527,"Tetracera madagascariensis",4061586364,"Tamatave II, Foulpointe, Morarano, Andohanakoho. Forêt d'Analalava, à 6 km Ouest de Foulpointe. Forêt dense humide de basse altitude sur latérite. Echantillons préservés en alcool.","MDG",NA,2005,"PRESERVED_SPECIMEN","OCCURRENCE_STATUS_INFERRED_FROM_INDIVIDUAL_COUNT;GEODETIC_DATUM_ASSUMED_WGS84;DIFFERENT_OWNER_INSTITUTION"
46.81094,-16.31072,"Tetracera madagascariensis",1453490848,"","MDG",10,2017,"HUMAN_OBSERVATION","CONTINENT_DERIVED_FROM_COORDINATES"
47.455237,-15.945098,"Tetracera madagascariensis",1978424037,"","MDG",2,2018,"HUMAN_OBSERVATION","COORDINATE_ROUNDED;CONTINENT_DERIVED_FROM_COORDINATES"
49.12,-17.52,"Tetracera madagascariensis",2397725586,"East Coast. Betampona Rèserve Naturelle Intègrale, 40 km NW of Toamasina.","MDG",NA,1993,"PRESERVED_SPECIMEN","GEODETIC_DATUM_ASSUMED_WGS84"
48.09371,-14.167346,"Tetracera madagascariensis",3902017612,"","MDG",4,2022,"HUMAN_OBSERVATION","COORDINATE_ROUNDED;CONTINENT_DERIVED_FROM_COORDINATES"
47.762531,-14.71514,"Tetracera madagascariensis",3031602222,"","MDG",5,2018,"HUMAN_OBSERVATION","CONTINENT_DERIVED_FROM_COORDINATES"
44.7,-18.75,"Tetracera madagascariensis",1260714667,"Berano. Canton et district : Antsalova. Station : clairière.","MDG",NA,1968,"PRESERVED_SPECIMEN","GEODETIC_DATUM_ASSUMED_WGS84;DIFFERENT_OWNER_INSTITUTION"
47.143,-16.229,"Tetracera madagascariensis",197230190,"Lac Tsimaloto","MDG",NA,1997,"HUMAN_OBSERVATION","GEODETIC_DATUM_ASSUMED_WGS84;CONTINENT_DERIVED_FROM_COORDINATES"
46.76666,-16.4,"Tetracera madagascariensis",1260714224,"Belalitra (Ambato-Boeni)","MDG",NA,1968,"PRESERVED_SPECIMEN","GEODETIC_DATUM_ASSUMED_WGS84;DIFFERENT_OWNER_INSTITUTION"
49.55,-14.3,"Tetracera madagascariensis",1260714625,"Canton : Ambalanomby. district : Doany.","MDG",NA,1957,"PRESERVED_SPECIMEN","GEODETIC_DATUM_ASSUMED_WGS84;DIFFERENT_OWNER_INSTITUTION"
46.93333,-15.98333,"Tetracera madagascariensis",1260714191,"Forêt d'Ankarafantsika","MDG",NA,1960,"PRESERVED_SPECIMEN","GEODETIC_DATUM_ASSUMED_WGS84;DIFFERENT_OWNER_INSTITUTION"
48.764424,-13.4574,"Tetracera madagascariensis",2265872332,"","MDG",15,2019,"HUMAN_OBSERVATION","COORDINATE_ROUNDED;CONTINENT_DERIVED_FROM_COORDINATES"
47.484357,-15.69095,"Tetracera madagascariensis",3058764672,"","MDG",NA,2020,"HUMAN_OBSERVATION","COORDINATE_ROUNDED;CONTINENT_DERIVED_FROM_COORDINATES"
47.595524,-15.463375,"Tetracera madagascariensis",3058782606,"","MDG",NA,2020,"HUMAN_OBSERVATION","COORDINATE_ROUNDED;CONTINENT_DERIVED_FROM_COORDINATES"
49.805556,-14.033333,"Tetracera madagascariensis",2516012445,"Antsiranana. Marojejy RNI, au nord d'Andapa.","MDG",NA,1994,"PRESERVED_SPECIMEN","INSTITUTION_MATCH_FUZZY;INSTITUTION_COLLECTION_MISMATCH"
