"lon","lat","species","gbifID","locality","countryCode","coordinateUncertaintyInMeters","year","basisOfRecord","issue"
-80.102665,8.507188,"Triplaris americana",1055896114,"","PAN",650,1982,"PRESERVED_SPECIMEN","GEODETIC_DATUM_ASSUMED_WGS84;INSTITUTION_MATCH_FUZZY;INSTITUTION_COLLECTION_MISMATCH"
-70.77,-8.15,"Triplaris americana",1929868733,"Vicinity of Tarauacá","BRA",NA,1968,"PRESERVED_SPECIMEN","GEODETIC_DATUM_ASSUMED_WGS84;COLLECTION_MATCH_FUZZY"
-68.6584285,-9.0693008,"Triplaris americana",1929282957,"Vizinhança da cidade","BRA",NA,1980,"PRESERVED_SPECIMEN","COORDINATE_REPROJECTED;COLLECTION_MATCH_FUZZY"
-52.1590428,-14.0539732,"Triplaris americana",1930470928,"26 km N. of Xavantina on the Xavantina- Cachimbo Road (unfinished). Near João Lopez bridge.","BRA",NA,1967,"PRESERVED_SPECIMEN","COORDINATE_REPROJECTED;COLLECTION_MATCH_FUZZY"
-67.91083,-14.17638,"Triplaris americana",4062106738,"Parque Nacional Madidi. Bosque tropical lluvioso primario. Tierra firme escasa pendiente, región de Tumupasa","BOL",NA,2001,"PRESERVED_SPECIMEN","GEODETIC_DATUM_ASSUMED_WGS84;DIFFERENT_OWNER_INSTITUTION"
-61.84805,-16.52166,"Triplaris americana",1261906568,"Las Trancas, Lomerio, las parcelas de Bolfor, Las Trancas '95. Bosque seco chiquitano de Anadenanthera. Suelos lateríticos.","BOL",NA,1994,"PRESERVED_SPECIMEN","GEODETIC_DATUM_ASSUMED_WGS84;DIFFERENT_OWNER_INSTITUTION"
-77.802778,8.335556,"Triplaris americana",1259177631,"Trail from Canglón-Yaviza road to Río Chucaraque, 7.7 miles E of Canglón.","PAN",NA,1982,"PRESERVED_SPECIMEN","OCCURRENCE_STATUS_INFERRED_FROM_INDIVIDUAL_COUNT;COORDINATE_ROUNDED;GEODETIC_DATUM_ASSUMED_WGS84;DIFFERENT_OWNER_INSTITUTION"
-68.848889,-13.03,"Triplaris americana",1259578857,"Parque Nacional Madidi, Río Heath, Bosque amazonico pluviestacional inundable, con Pseudolmedia laevis, Attalea ssp, Socratea exorrhiza, Manilkara bidentata, Cedrela odorata y Oenocarpus bataua.","BOL",NA,2004,"PRESERVED_SPECIMEN","OCCURRENCE_STATUS_INFERRED_FROM_INDIVIDUAL_COUNT;COORDINATE_ROUNDED;GEODETIC_DATUM_ASSUMED_WGS84;DIFFERENT_OWNER_INSTITUTION"
-75.98333,-1.6,"Triplaris americana",1261453237,"Río Curaray. Flood plain forest and riverside forest about 10 km upstream from the military camp.","ECU",NA,1980,"PRESERVED_SPECIMEN","GEODETIC_DATUM_ASSUMED_WGS84;DIFFERENT_OWNER_INSTITUTION"
-61.018611,-13.544722,"Triplaris americana",1261869902,"Parque Nacional Noel Kempff Mercado. Flor de Oro. Bosque de ribera, pampa húmeda, sobre Río Itenez. 1,5 km del campamento.","BOL",NA,1993,"PRESERVED_SPECIMEN","OCCURRENCE_STATUS_INFERRED_FROM_INDIVIDUAL_COUNT;COORDINATE_ROUNDED;GEODETIC_DATUM_ASSUMED_WGS84;DIFFERENT_OWNER_INSTITUTION"
-72.55,-12.61666,"Triplaris americana",1259495557,"Dist. Quellouno, Quebrada de Quellouno, Bosque Seco","PER",NA,2003,"PRESERVED_SPECIMEN","OCCURRENCE_STATUS_INFERRED_FROM_INDIVIDUAL_COUNT;GEODETIC_DATUM_ASSUMED_WGS84;DIFFERENT_OWNER_INSTITUTION"
-65.523611,-17.019167,"Triplaris americana",1260861561,"Zona muy proxima a Villa Tunari, a 152 km de la ciudad de Cochabamba.","BOL",NA,2007,"PRESERVED_SPECIMEN","OCCURRENCE_STATUS_INFERRED_FROM_INDIVIDUAL_COUNT;COORDINATE_ROUNDED;GEODETIC_DATUM_ASSUMED_WGS84;DIFFERENT_OWNER_INSTITUTION"
-63.06666,-17.76666,"Triplaris americana",4062047126,"12 km E of center of Santa Cruz, on road to Cotoca. Secondary subtropical semi-deciduous forest, the trees to 15 m tall, very flat, with fine-sandy soil, dominated by Anadenanthera macrocarpa, Gallesia integrifolia.","BOL",NA,1987,"PRESERVED_SPECIMEN","GEODETIC_DATUM_ASSUMED_WGS84;DIFFERENT_OWNER_INSTITUTION"
-68.685833,-14.551389,"Triplaris americana",4061580364,"Parque Nacional Madidi, rio Tuichi, arroyo Yarimita. Bosque andino semideciduo, con Astronium urundeuva, Aspidosperma cylindrocarpum, Anadenanthera colubrina, Trichilia elegans y Myrtaceae. Plantas secadas en campo.","BOL",NA,2005,"PRESERVED_SPECIMEN","OCCURRENCE_STATUS_INFERRED_FROM_INDIVIDUAL_COUNT;COORDINATE_ROUNDED;GEODETIC_DATUM_ASSUMED_WGS84;DIFFERENT_OWNER_INSTITUTION"
-67.477111,-15.460944,"Triplaris americana",4062135248,"Alto Beni, Estación Experimental Sara Ana, a 400 m de la estación.","BOL",NA,2022,"PRESERVED_SPECIMEN","OCCURRENCE_STATUS_INFERRED_FROM_INDIVIDUAL_COUNT;COORDINATE_ROUNDED;GEODETIC_DATUM_ASSUMED_WGS84;DIFFERENT_OWNER_INSTITUTION"
-73.833889,9.231944,"Triplaris americana",1427584597,"Vereda Santo Domingo, Hacienda Rincón Grande.","COL",NA,2015,"PRESERVED_SPECIMEN","COORDINATE_ROUNDED;GEODETIC_DATUM_ASSUMED_WGS84;CONTINENT_DERIVED_FROM_COORDINATES;INSTITUTION_MATCH_NONE;MULTIMEDIA_URI_INVALID"
-72.789125,4.422611,"Triplaris americana",3886896348,"Buenos Aires Alto","COL",NA,2020,"HUMAN_OBSERVATION",""
-72.835844,4.458539,"Triplaris americana",3886896527,"El Fical","COL",NA,2020,"HUMAN_OBSERVATION",""
-72.755638,4.507889,"Triplaris americana",3886897824,"Flor Amarillo","COL",NA,2020,"HUMAN_OBSERVATION",""
-58.099722,-16.208056,"Triplaris americana",1303585978,"Província Serrana, Córrego do Facão (Facão creek) about 12 km east of the city.","BRA",NA,2002,"PRESERVED_SPECIMEN","GEODETIC_DATUM_ASSUMED_WGS84;CONTINENT_DERIVED_FROM_COORDINATES;CONTINENT_INVALID;INSTITUTION_MATCH_FUZZY;INSTITUTION_COLLECTION_MISMATCH"
-57.333333,-15.833333,"Triplaris americana",1303585973,"Província Serrana, Dolina Água Milagrosa about 15 km northeast of the city.","BRA",NA,2002,"PRESERVED_SPECIMEN","GEODETIC_DATUM_ASSUMED_WGS84;CONTINENT_DERIVED_FROM_COORDINATES;CONTINENT_INVALID;INSTITUTION_MATCH_FUZZY;INSTITUTION_COLLECTION_MISMATCH"
-57.585056,-16.842111,"Triplaris americana",2577333415,"Estação Ecológica de Taiamã, Projeto de pesquisa ecológica de longa duração. Dinâmicas ecológicas da planície de inundação do Alto Paraguai (DARP- Pantanal).","BRA",NA,2017,"PRESERVED_SPECIMEN","GEODETIC_DATUM_ASSUMED_WGS84;CONTINENT_DERIVED_FROM_COORDINATES;CONTINENT_INVALID;INSTITUTION_MATCH_FUZZY;INSTITUTION_COLLECTION_MISMATCH"
-74.794044,4.983215,"Triplaris americana",3328507652,"Veredas Méndez y Maracaibo, Mina","COL",NA,2018,"HUMAN_OBSERVATION",""
-74.789232,5.002444,"Triplaris americana",3328509918,"Veredas Méndez y Maracaibo, Trincho","COL",NA,2018,"HUMAN_OBSERVATION",""
-47.860556,-22.142778,"Triplaris americana",3971172518,"Parcela SCA_03","BRA",NA,2018,"PRESERVED_SPECIMEN","GEODETIC_DATUM_ASSUMED_WGS84;CONTINENT_DERIVED_FROM_COORDINATES;AMBIGUOUS_INSTITUTION"
-45.881667,-23.464444,"Triplaris americana",3971177531,"Parcela STB_08","BRA",NA,2018,"PRESERVED_SPECIMEN","GEODETIC_DATUM_ASSUMED_WGS84;CONTINENT_DERIVED_FROM_COORDINATES;AMBIGUOUS_INSTITUTION"
-51.621111,-20.79,"Triplaris americana",2237719393,"Margem da Ferrovia próxima à Estação de Psicultura da CESP.","BRA",NA,1998,"PRESERVED_SPECIMEN","COORDINATE_ROUNDED;GEODETIC_DATUM_ASSUMED_WGS84;CONTINENT_DERIVED_FROM_COORDINATES;INSTITUTION_MATCH_FUZZY;INSTITUTION_COLLECTION_MISMATCH"
-57.383333,-19.233333,"Triplaris americana",3343077062,"Fazenda Boa Sorte. Abobral. Pantanal. Fazenda Boa Sorte. Abobral. Pantanal.","BRA",NA,1989,"PRESERVED_SPECIMEN","COORDINATE_ROUNDED;GEODETIC_DATUM_ASSUMED_WGS84;CONTINENT_DERIVED_FROM_COORDINATES;INSTITUTION_MATCH_FUZZY;INSTITUTION_COLLECTION_MISMATCH"
-57.4,-17.844444,"Triplaris americana",2237738948,"Área em frente à sede do Parque Nacional do Pantanal Matogrossense.","BRA",NA,2010,"PRESERVED_SPECIMEN","COORDINATE_ROUNDED;GEODETIC_DATUM_ASSUMED_WGS84;CONTINENT_DERIVED_FROM_COORDINATES;INSTITUTION_MATCH_FUZZY;INSTITUTION_COLLECTION_MISMATCH"
-57.113333,-18.700833,"Triplaris americana",2237763375,"Divisa Fazenda Nazaré com Colônia do Cedro, área da Mata do Cedro, leque aluvial do Rio Taquari, sub-região de Paiaguás, Pantanal.","BRA",NA,2009,"PRESERVED_SPECIMEN","COORDINATE_ROUNDED;GEODETIC_DATUM_ASSUMED_WGS84;CONTINENT_DERIVED_FROM_COORDINATES;INSTITUTION_MATCH_FUZZY;INSTITUTION_COLLECTION_MISMATCH"
-56.696944,-19.737778,"Triplaris americana",2237773310,"Parque Estadual do Rio Negro (limite sul), Rio Aquidauana, Pantanal.","BRA",NA,2005,"PRESERVED_SPECIMEN","COORDINATE_ROUNDED;GEODETIC_DATUM_ASSUMED_WGS84;CONTINENT_DERIVED_FROM_COORDINATES;INSTITUTION_MATCH_FUZZY;INSTITUTION_COLLECTION_MISMATCH"
-54.966667,-19.390278,"Triplaris americana",2237718825,"Rio do Peixe, MS-080.","BRA",NA,1998,"PRESERVED_SPECIMEN","COORDINATE_ROUNDED;GEODETIC_DATUM_ASSUMED_WGS84;CONTINENT_DERIVED_FROM_COORDINATES;INSTITUTION_MATCH_FUZZY;INSTITUTION_COLLECTION_MISMATCH"
-57.759167,-16.466389,"Triplaris americana",2237744613,"Ilha do rio Paraguai.","BRA",NA,2009,"PRESERVED_SPECIMEN","COORDINATE_ROUNDED;GEODETIC_DATUM_ASSUMED_WGS84;CONTINENT_DERIVED_FROM_COORDINATES;INSTITUTION_MATCH_FUZZY;INSTITUTION_COLLECTION_MISMATCH"
-51.721111,-20.981111,"Triplaris americana",2451465861,"Margem esquerda do Rio Paraná.","BRA",NA,1999,"PRESERVED_SPECIMEN","COORDINATE_ROUNDED;GEODETIC_DATUM_ASSUMED_WGS84;CONTINENT_DERIVED_FROM_COORDINATES;INSTITUTION_MATCH_FUZZY;INSTITUTION_COLLECTION_MISMATCH"
-52.081111,-21.742222,"Triplaris americana",2237720173,"Panorama-Caiuá. Rodovia SP-563. Margem do Rio do Peixe. Próximo à ponte.","BRA",NA,1999,"PRESERVED_SPECIMEN","COORDINATE_ROUNDED;GEODETIC_DATUM_ASSUMED_WGS84;CONTINENT_DERIVED_FROM_COORDINATES;INSTITUTION_MATCH_FUZZY;INSTITUTION_COLLECTION_MISMATCH"
-55.105556,-19.299167,"Triplaris americana",2237748929,"Serra de Maracaju, borda leste do Pantanal. Distrito de Taboco. Fazenda Colina Dourada.","BRA",NA,2013,"PRESERVED_SPECIMEN","COORDINATE_ROUNDED;GEODETIC_DATUM_ASSUMED_WGS84;CONTINENT_DERIVED_FROM_COORDINATES;INSTITUTION_MATCH_FUZZY;INSTITUTION_COLLECTION_MISMATCH"
-55.826389,-20.460556,"Triplaris americana",2237739300,"Pousada Bethania.","BRA",NA,2010,"PRESERVED_SPECIMEN","COORDINATE_ROUNDED;GEODETIC_DATUM_ASSUMED_WGS84;CONTINENT_DERIVED_FROM_COORDINATES;INSTITUTION_MATCH_FUZZY;INSTITUTION_COLLECTION_MISMATCH"
-56.983333,-19.576667,"Triplaris americana",2237747621,"Margem do rio Miranda.","BRA",NA,2012,"PRESERVED_SPECIMEN","COORDINATE_ROUNDED;GEODETIC_DATUM_ASSUMED_WGS84;CONTINENT_DERIVED_FROM_COORDINATES;INSTITUTION_MATCH_FUZZY;INSTITUTION_COLLECTION_MISMATCH"
-57.017778,-19.5725,"Triplaris americana",2237728216,"Próx.-Base de Estudos da UFMS, na Mata Ciliar (Baía da Medalha).","BRA",NA,2006,"PRESERVED_SPECIMEN","COORDINATE_ROUNDED;GEODETIC_DATUM_ASSUMED_WGS84;CONTINENT_DERIVED_FROM_COORDINATES;INSTITUTION_MATCH_FUZZY;INSTITUTION_COLLECTION_MISMATCH"
-57.051944,-19.868611,"Triplaris americana",2237771317,"Fazenda Cristo Redentor. Capão da Vista Alegre.","BRA",NA,2016,"PRESERVED_SPECIMEN","COORDINATE_ROUNDED;GEODETIC_DATUM_ASSUMED_WGS84;CONTINENT_DERIVED_FROM_COORDINATES;INSTITUTION_MATCH_FUZZY;INSTITUTION_COLLECTION_MISMATCH"
-56.7425,-20.781944,"Triplaris americana",2237729202,"Fazenda Santa Laura. Porção Salobra.","BRA",NA,2004,"PRESERVED_SPECIMEN","COORDINATE_ROUNDED;GEODETIC_DATUM_ASSUMED_WGS84;CONTINENT_DERIVED_FROM_COORDINATES;INSTITUTION_MATCH_FUZZY;INSTITUTION_COLLECTION_MISMATCH"
145.735833,-17.003333,"Triplaris americana",2827283614,"14 km to Cairns CBD, on Skeleton Creek, behind Roberts Road Firestation.","AUS",50,2007,"PRESERVED_SPECIMEN","CONTINENT_DERIVED_FROM_COORDINATES;INSTITUTION_MATCH_FUZZY;COLLECTION_MATCH_FUZZY"
146.025,-17.355556,"Triplaris americana",2827266845,"CULTIVATED: Bramston Beach.","AUS",1000,1993,"PRESERVED_SPECIMEN","CONTINENT_DERIVED_FROM_COORDINATES;INSTITUTION_MATCH_FUZZY;COLLECTION_MATCH_FUZZY"
146,-17.316667,"Triplaris americana",2827337525,"CULTIVATED: Bramston Beach.","AUS",1000,1993,"PRESERVED_SPECIMEN","CONTINENT_DERIVED_FROM_COORDINATES;INSTITUTION_MATCH_FUZZY;COLLECTION_MATCH_FUZZY"
145.720833,-16.904444,"Triplaris americana",2827278247,"Northern end of The Peak road, Park Ridge estate, Brinsmead.","AUS",50,2015,"PRESERVED_SPECIMEN","CONTINENT_DERIVED_FROM_COORDINATES;INSTITUTION_MATCH_FUZZY;COLLECTION_MATCH_FUZZY"
145.375278,-16.454444,"Triplaris americana",2827303648,"Mossman River, near Mossman Wastewater Treatment Plant.","AUS",50,2011,"PRESERVED_SPECIMEN","CONTINENT_DERIVED_FROM_COORDINATES;INSTITUTION_MATCH_FUZZY;COLLECTION_MATCH_FUZZY"
-74.721611,4.558361,"Triplaris americana",1703244474,"Camino a Jerusalén, sobre la márgen derecha del Río Seco","COL",NA,2015,"PRESERVED_SPECIMEN","OCCURRENCE_STATUS_INFERRED_FROM_INDIVIDUAL_COUNT;COORDINATE_ROUNDED;GEODETIC_DATUM_ASSUMED_WGS84;CONTINENT_DERIVED_FROM_COORDINATES;INSTITUTION_MATCH_NONE"
-74.630333,4.312,"Triplaris americana",1703244273,"Vereda San Jerónimo. Condominio Potreritos de Nilo","COL",NA,2015,"PRESERVED_SPECIMEN","OCCURRENCE_STATUS_INFERRED_FROM_INDIVIDUAL_COUNT;COORDINATE_ROUNDED;GEODETIC_DATUM_ASSUMED_WGS84;CONTINENT_DERIVED_FROM_COORDINATES;INSTITUTION_MATCH_NONE"
-66.25,-11.03,"Triplaris americana",2284182770,"Depto. Pando. Prov. Madre de Dios, Puerto Candelaria, along the Rio Madre de Dios, 21 km. (by air) WSW of Riberalta.","BOL",NA,1985,"PRESERVED_SPECIMEN","GEODETIC_DATUM_ASSUMED_WGS84"
-59.1333,2.05,"Triplaris americana",1456268240,"Kuyuwini R. watershed; Aishalton Landing; downstream 2-3 km","GUY",NA,1993,"PRESERVED_SPECIMEN","GEODETIC_DATUM_ASSUMED_WGS84"
-76.83,7.75,"Triplaris americana",2284371765,"Dept. of Antioquia: In the rain forest near Río León approx. 20 to 30 km. upstream and south of the river mouth and approx. 15 km. west of Chigorodó.","COL",NA,1962,"PRESERVED_SPECIMEN","GEODETIC_DATUM_ASSUMED_WGS84"
-75.197083,5.968273,"Triplaris americana",2234790946,"","COL",NA,2019,"HUMAN_OBSERVATION","COORDINATE_ROUNDED;CONTINENT_DERIVED_FROM_COORDINATES"
-77.53,-2.78,"Triplaris americana",2284316841,"U.P. 93 Bosque tropical húmedo 47.5 Km. Sw Taisha.","ECU",NA,1976,"PRESERVED_SPECIMEN","GEODETIC_DATUM_ASSUMED_WGS84"
-57.43,-18.25,"Triplaris americana",2618591043,"Brasil, Mato Grosso do Sul, Corumbá. Serra do Amolar, Rio Paraguai","BRA",NA,2010,"PRESERVED_SPECIMEN","GEODETIC_DATUM_ASSUMED_WGS84;CONTINENT_DERIVED_FROM_COORDINATES;CONTINENT_INVALID;INSTITUTION_COLLECTION_MISMATCH"
-74.18333,2.53333,"Triplaris americana",1260839076,"Alto Guayabero: un día en lancha río arriba del Mpio. La Macarena, bosque en terraza aluvial (banqueta) del río Guayabero.","COL",NA,1988,"PRESERVED_SPECIMEN","GEODETIC_DATUM_ASSUMED_WGS84;INSTITUTION_MATCH_FUZZY;COLLECTION_MATCH_NONE"
-76.456111,-2.807222,"Triplaris americana",1261452556,"Nuevo Andoas, Río Pastaza. Low primary and secondary rainforest.","PER",NA,1986,"PRESERVED_SPECIMEN","OCCURRENCE_STATUS_INFERRED_FROM_INDIVIDUAL_COUNT;COORDINATE_ROUNDED;GEODETIC_DATUM_ASSUMED_WGS84;INSTITUTION_MATCH_FUZZY;COLLECTION_MATCH_NONE"
-78.5,-3.166667,"Triplaris americana",4031910240,"Road from Indanza to Gualaquiza, about 25 km from Gualaquiza. Disturbed rain forest along roadside.","ECU",NA,1983,"PRESERVED_SPECIMEN","OCCURRENCE_STATUS_INFERRED_FROM_INDIVIDUAL_COUNT;COORDINATE_ROUNDED;GEODETIC_DATUM_ASSUMED_WGS84;INSTITUTION_MATCH_FUZZY;COLLECTION_MATCH_NONE"
-76.3,-6.31666,"Triplaris americana",1261452579,"Just S of Río Yuracyacu, ca 2 km N of Pongo de Cainarache, Km 62 of Tarapoto-Yurimaguas road. Roadside second growth, swampy.","PER",NA,1986,"PRESERVED_SPECIMEN","OCCURRENCE_STATUS_INFERRED_FROM_INDIVIDUAL_COUNT;GEODETIC_DATUM_ASSUMED_WGS84;INSTITUTION_MATCH_FUZZY;COLLECTION_MATCH_NONE"
-64.06166,-19.16277,"Triplaris americana",1260840091,"Aprox. 800 m, antes de llegar a Llantoj, de La Florida subiendo hacia el E of la Serranida de Kaska Orcko. Bosque montano Boliviano-Tucumano, localzado en ladera media expuesto W. con pendiente de 25%, rico en Lauraceas, juglandaceas, Leguminosas abundantes Pterydofitos., doceles de 22 m. Unico al borde de la senda, a 10 m de un área chaqueada.","BOL",NA,2004,"PRESERVED_SPECIMEN","GEODETIC_DATUM_ASSUMED_WGS84;INSTITUTION_MATCH_FUZZY;COLLECTION_MATCH_NONE"
-68.53,-14.241111,"Triplaris americana",4031768277,"Area Natural de Manejo Integrado Madidi, Azariamas, Encuentro Azariamas. Bosque de yungas subandino pluviestacional con Oxandra espintana y Eugenia sp. Fondo de valle. Parcela temporal de muestreo (0,1 ha). Plantas NO alcoholizadas.","BOL",NA,2005,"PRESERVED_SPECIMEN","OCCURRENCE_STATUS_INFERRED_FROM_INDIVIDUAL_COUNT;COORDINATE_ROUNDED;GEODETIC_DATUM_ASSUMED_WGS84;INSTITUTION_MATCH_FUZZY;COLLECTION_MATCH_NONE"
-74.1,2.16666,"Triplaris americana",1258390203,"Vereda Yarumales arriba, finca bordenado la ciénaga del Río Guayabero, 1 hora por bote al S de la Macarena, bht.","COL",NA,1988,"PRESERVED_SPECIMEN","GEODETIC_DATUM_ASSUMED_WGS84;INSTITUTION_MATCH_FUZZY;COLLECTION_MATCH_NONE"
-62.9,-17.74583,"Triplaris americana",1258759954,"10 km. E of Cotoca, along Quebrada Quitachiyú, 2 km. S of Cotoca-Pailas highway. Remnant of Chaco scrub forest, with Anadenanthera macrocarpa, Chorisia, Tabebuia nodosa, Acacia albocorticata, Capparis tweediana, Opuntia brasiliensis, flat, fine sandy soil.","BOL",NA,1994,"PRESERVED_SPECIMEN","GEODETIC_DATUM_ASSUMED_WGS84;INSTITUTION_MATCH_FUZZY;COLLECTION_MATCH_NONE"
-77.66666,-3.83333,"Triplaris americana",1261534793,"Rio Santiago. Mas abajo de la comunidad de Caterpiza, cerca de la boca, 10 vueltas a la quebrada.","PER",NA,1979,"PRESERVED_SPECIMEN","OCCURRENCE_STATUS_INFERRED_FROM_INDIVIDUAL_COUNT;GEODETIC_DATUM_ASSUMED_WGS84;INSTITUTION_MATCH_FUZZY;COLLECTION_MATCH_NONE"
-63.45,-18.1,"Triplaris americana",1260499498,"Along SE side of Río Piraí, 1 km SW of highway bridge at Tarumá. Dry forest with pastures and fields.","BOL",NA,2004,"PRESERVED_SPECIMEN","GEODETIC_DATUM_ASSUMED_WGS84;INSTITUTION_MATCH_FUZZY;COLLECTION_MATCH_NONE"
-63.18333,-18.05,"Triplaris americana",1260500854,"6 km N of Basilio, along dirt road and railroad, 50-200 m W of paved highway from Santa Cruz to Abapó. Brushy areas, former semi-deciduous subtropical forest with chaco elements, flat, sandy, Bougainvillea stipitata, Triplaris americana, Helicteres lhostskyana, Bonamia tomentosa, Clematis campestris, Arrabidaea corallina, Stachytarpheta canescens.","BOL",NA,2004,"PRESERVED_SPECIMEN","GEODETIC_DATUM_ASSUMED_WGS84;INSTITUTION_MATCH_FUZZY;COLLECTION_MATCH_NONE"
-65.08333,2.8,"Triplaris americana",1260833475,"Dpto. Atures. Rio Ocamo, 31 Km aguas arribas e su desembocadura en el Orinoco. Lomas graniticas.","VEN",NA,1990,"PRESERVED_SPECIMEN","GEODETIC_DATUM_ASSUMED_WGS84;INSTITUTION_MATCH_FUZZY;COLLECTION_MATCH_NONE"
-74.56666,-8.35,"Triplaris americana",1260499698,"Dist. Yarinacocha, Caño Tushmo, vecindad de Lago Yarinacocha. Bosque secundario, tereno inundable.","PER",NA,1997,"PRESERVED_SPECIMEN","GEODETIC_DATUM_ASSUMED_WGS84;INSTITUTION_MATCH_FUZZY;COLLECTION_MATCH_NONE"
-64.66666,-17.08333,"Triplaris americana",1261452655,"Estación Experimental Valle de Sacta de la Universidad San Simon, media camino CBBA-S.C. (El Chapare). Bosque primario, muy húmedo, con Tapirira guianensis, Eschweilera sp., Iriartea deltoides & Jessenia sp. Curso Dendrologica del USAID & PL-480.","BOL",NA,1991,"PRESERVED_SPECIMEN","OCCURRENCE_STATUS_INFERRED_FROM_INDIVIDUAL_COUNT;GEODETIC_DATUM_ASSUMED_WGS84;INSTITUTION_MATCH_FUZZY;COLLECTION_MATCH_NONE"
-68.2,-13.66666,"Triplaris americana",1260839105,"Prov. Iturrald, Comunidad de Santa Fe, Parcela Permanente de 1 ha de Estudio Etnobotanico, 4 km N de la comunidad, bosue amazonico entre sabanas húmedas.","BOL",NA,1995,"PRESERVED_SPECIMEN","GEODETIC_DATUM_ASSUMED_WGS84;INSTITUTION_MATCH_FUZZY;COLLECTION_MATCH_NONE"
-66.61666,-14.5,"Triplaris americana",1260838640,"Yacuma, Estación Biológica del Beni.","BOL",NA,1994,"PRESERVED_SPECIMEN","GEODETIC_DATUM_ASSUMED_WGS84;INSTITUTION_MATCH_FUZZY;COLLECTION_MATCH_NONE"
-50.448916,-21.152316,"Triplaris americana",3949515180,"","BRA",48,2022,"HUMAN_OBSERVATION","COORDINATE_ROUNDED;COUNTRY_DERIVED_FROM_COORDINATES;CONTINENT_DERIVED_FROM_COORDINATES"
-56.827772,-17.462818,"Triplaris americana",1640046942,"","BRA",NA,2017,"HUMAN_OBSERVATION","COORDINATE_ROUNDED;CONTINENT_DERIVED_FROM_COORDINATES"
-43.145702,-22.614004,"Triplaris americana",3998768931,"","BRA",4,2022,"HUMAN_OBSERVATION","COORDINATE_ROUNDED;COUNTRY_DERIVED_FROM_COORDINATES;CONTINENT_DERIVED_FROM_COORDINATES"
-51.062838,-21.671096,"Triplaris americana",3956780967,"","BRA",NA,2019,"HUMAN_OBSERVATION","COORDINATE_ROUNDED;COUNTRY_DERIVED_FROM_COORDINATES;CONTINENT_DERIVED_FROM_COORDINATES"
-67.83071,-12.98163,"Triplaris americana",1928602132,"Ixiamas","BOL",NA,2009,"PRESERVED_SPECIMEN","GEODETIC_DATUM_ASSUMED_WGS84;COLLECTION_MATCH_FUZZY"
-78.15,-2.37,"Triplaris americana",2447340920,"Road Sucua - Macas, km 10","ECU",NA,1979,"PRESERVED_SPECIMEN","GEODETIC_DATUM_ASSUMED_WGS84;COLLECTION_MATCH_FUZZY"
-59.72,-15.75,"Triplaris americana",1928009880,"Sararé, Radambrasil, folha SD 21-YC; ponto 54","BRA",NA,1978,"PRESERVED_SPECIMEN","GEODETIC_DATUM_ASSUMED_WGS84;COLLECTION_MATCH_FUZZY"
-63.163463,-9.253256,"Triplaris americana",1929495157,"Porto Velho to Cuiabá highway. Vicinity of km 117.","BRA",NA,1968,"PRESERVED_SPECIMEN","COORDINATE_ROUNDED;COLLECTION_MATCH_FUZZY"
-68.888515,-9.852192,"Triplaris americana",1930754837,"4 Km da margem direita do Rio Iaco.","BRA",NA,1980,"PRESERVED_SPECIMEN","COLLECTION_MATCH_FUZZY"
-78.15,-2.52,"Triplaris americana",1928759817,"Centro Shuar Yukutais. 10km S Sucua, Rio Upano, near chacra of P. Kunkumas","ECU",NA,1988,"PRESERVED_SPECIMEN","GEODETIC_DATUM_ASSUMED_WGS84;COLLECTION_MATCH_FUZZY"
-63.225,3.375,"Triplaris americana",1930141747,"Between Maitá & Paramiteri Indian Village","BRA",NA,1971,"PRESERVED_SPECIMEN","GEODETIC_DATUM_ASSUMED_WGS84;COLLECTION_MATCH_FUZZY"
-53.591111,-21.475,"Triplaris americana",1801143295,"Margem do Rio Vacaria.","BRA",NA,2013,"PRESERVED_SPECIMEN","COORDINATE_ROUNDED;GEODETIC_DATUM_ASSUMED_WGS84;CONTINENT_DERIVED_FROM_COORDINATES;INSTITUTION_MATCH_NONE"
-74.90489,4.96462,"Triplaris americana",1944382154,"","COL",330,2018,"HUMAN_OBSERVATION","CONTINENT_DERIVED_FROM_COORDINATES"
-75.052852,9.164015,"Triplaris americana",3058998554,"","COL",4,2021,"HUMAN_OBSERVATION","COORDINATE_ROUNDED;CONTINENT_DERIVED_FROM_COORDINATES"
-73.602468,4.145678,"Triplaris americana",3985758888,"","COL",11,2022,"HUMAN_OBSERVATION","COORDINATE_ROUNDED;CONTINENT_DERIVED_FROM_COORDINATES"
-41.902325,-18.844387,"Triplaris americana",3966439538,"","BRA",8,2022,"HUMAN_OBSERVATION","COORDINATE_ROUNDED;CONTINENT_DERIVED_FROM_COORDINATES"
-79.649168,9.077613,"Triplaris americana",3759330379,"","PAN",211,2022,"HUMAN_OBSERVATION","COORDINATE_ROUNDED;CONTINENT_DERIVED_FROM_COORDINATES"
-75.428337,10.344722,"Triplaris americana",1571115359,"","COL",NA,2017,"HUMAN_OBSERVATION","COORDINATE_ROUNDED;CONTINENT_DERIVED_FROM_COORDINATES"
-75.033976,9.190797,"Triplaris americana",2005311902,"","COL",31,2019,"HUMAN_OBSERVATION","COORDINATE_ROUNDED;CONTINENT_DERIVED_FROM_COORDINATES"
-75.548885,6.333933,"Triplaris americana",3881692723,"","COL",44,2022,"HUMAN_OBSERVATION","COORDINATE_ROUNDED;CONTINENT_DERIVED_FROM_COORDINATES"
-43.381406,-22.318759,"Triplaris americana",3113412615,"","BRA",203,2021,"HUMAN_OBSERVATION","COORDINATE_ROUNDED;CONTINENT_DERIVED_FROM_COORDINATES"
-77.18,-6.05,"Triplaris americana",1228373208,"km 1.5 de la carretera a Nuevo Cajamarca, Fundo San Jorge","PER",NA,1998,"PRESERVED_SPECIMEN","GEODETIC_DATUM_ASSUMED_WGS84;INSTITUTION_MATCH_FUZZY;AMBIGUOUS_COLLECTION"
-55.819278,-9.483,"Triplaris americana",1840925367,"Fazenda São Nicolau.","BRA",NA,2014,"PRESERVED_SPECIMEN","GEODETIC_DATUM_ASSUMED_WGS84;CONTINENT_DERIVED_FROM_COORDINATES;AMBIGUOUS_INSTITUTION"
-55.482778,-11.866667,"Triplaris americana",1913596392,"Fragmento de mata. Universidade Federal de Mato Grosso, Campus Sinop","BRA",NA,2018,"PRESERVED_SPECIMEN","GEODETIC_DATUM_ASSUMED_WGS84;CONTINENT_DERIVED_FROM_COORDINATES;AMBIGUOUS_INSTITUTION"
-55.1785,-9.541172,"Triplaris americana",2634932673,"Parque Estadual do Cristalino. Trilha de Monitoramento III. Cruz de Malta III. Estrada de acesso.","BRA",NA,2019,"PRESERVED_SPECIMEN","GEODETIC_DATUM_ASSUMED_WGS84;CONTINENT_DERIVED_FROM_COORDINATES;AMBIGUOUS_INSTITUTION"
-75.850003,6.216538,"Triplaris americana",1273760206,"Corregimiento Cangrejos","COL",156.45,1987,"PRESERVED_SPECIMEN","INSTITUTION_MATCH_FUZZY;COLLECTION_MATCH_FUZZY"
-53.986611,-21.797361,"Triplaris americana",1077478174,"margem do Rio Vacaria","BRA",NA,2013,"PRESERVED_SPECIMEN","GEODETIC_DATUM_ASSUMED_WGS84;CONTINENT_DERIVED_FROM_COORDINATES;AMBIGUOUS_INSTITUTION"
-67.68,-14.542222,"Triplaris americana",4062111659,"Área Natural de Manejo Integrado Madidi, río Aguapolo.","BOL",NA,2006,"PRESERVED_SPECIMEN","OCCURRENCE_STATUS_INFERRED_FROM_INDIVIDUAL_COUNT;COORDINATE_ROUNDED;GEODETIC_DATUM_ASSUMED_WGS84;DIFFERENT_OWNER_INSTITUTION"
-92.651389,15.370556,"Triplaris americana",4061782004,"Camino a Salto de Agua, 1 km al oeste de la toma de Agua.","MEX",NA,2006,"PRESERVED_SPECIMEN","OCCURRENCE_STATUS_INFERRED_FROM_INDIVIDUAL_COUNT;COORDINATE_ROUNDED;GEODETIC_DATUM_ASSUMED_WGS84;DIFFERENT_OWNER_INSTITUTION"
-73.74097,-4.91454,"Triplaris americana",3762892450,"Jenaro Herrera 3; JH3","PER",NA,2009,"PRESERVED_SPECIMEN","GEODETIC_DATUM_ASSUMED_WGS84;CONTINENT_DERIVED_FROM_COORDINATES;INSTITUTION_MATCH_FUZZY;INSTITUTION_COLLECTION_MISMATCH"
-65.0958,-14.3783,"Triplaris americana",123017728,"","BOL",NA,1993,"PRESERVED_SPECIMEN","GEODETIC_DATUM_ASSUMED_WGS84;CONTINENT_DERIVED_FROM_COORDINATES;COORDINATE_UNCERTAINTY_METERS_INVALID;INSTITUTION_COLLECTION_MISMATCH"
-73.22531,4.735125,"Triplaris americana",3332980351,"Balcones","COL",NA,2019,"HUMAN_OBSERVATION",""
-73.356342,4.521272,"Triplaris americana",3332983271,"Choapal","COL",NA,2019,"HUMAN_OBSERVATION",""
-73.29907,4.604364,"Triplaris americana",3332989505,"Jagua","COL",NA,2020,"HUMAN_OBSERVATION",""
-73.310333,4.42484,"Triplaris americana",3333000643,"La Zarza","COL",NA,2020,"HUMAN_OBSERVATION",""
-64.48,-6.57806,"Triplaris americana",1042688638,"Floresta Estadual Canutama., Rio Purus, margem esquerda, beira do lago Paecé.","BRA",NA,2010,"PRESERVED_SPECIMEN","GEODETIC_DATUM_ASSUMED_WGS84;GEODETIC_DATUM_INVALID;INSTITUTION_MATCH_NONE"
