"lon","lat","species","gbifID","locality","countryCode","coordinateUncertaintyInMeters","year","basisOfRecord","issue"
-69.22,-10.116667,"Triplaris americana",1042709643,"Bacia do Rio Purus, Rio Iaco, Fazenda Nova Olinda.","BRA",NA,1994,"PRESERVED_SPECIMEN","GEODETIC_DATUM_ASSUMED_WGS84;GEODETIC_DATUM_INVALID;INSTITUTION_MATCH_NONE"
-65.22,-4.889389,"Triplaris americana",1042692911,"Rio Urucu., BOGPM- Base de Operações Geólogo Pedro de Moura, Rio Urucu","BRA",NA,2005,"PRESERVED_SPECIMEN","GEODETIC_DATUM_ASSUMED_WGS84;GEODETIC_DATUM_INVALID;INSTITUTION_MATCH_NONE"
-49.15,-13.95,"Triplaris americana",2517634063,"between Porougatu and Uruacu, Belem-Brasilia highway.","BRA",NA,1963,"PRESERVED_SPECIMEN","INSTITUTION_MATCH_FUZZY;INSTITUTION_COLLECTION_MISMATCH"
-55.5352,-9.27,"Triplaris americana",1090626998,"Parque Estadual do Cristalino, Parque Estadual Cristalino. Próximo ao médio Rio Cristalino, entre a pousada e Limão.","BRA",NA,2008,"PRESERVED_SPECIMEN","GEODETIC_DATUM_ASSUMED_WGS84;CONTINENT_DERIVED_FROM_COORDINATES;DIFFERENT_OWNER_INSTITUTION"
-55.0148,-9.3026,"Triplaris americana",1090627079,"Parque Estadual do Cristalino, Parque Estadual Cristalino. Limite Nordeste do Parque, a oeste do Olho da Xuxa.","BRA",NA,2008,"PRESERVED_SPECIMEN","GEODETIC_DATUM_ASSUMED_WGS84;CONTINENT_DERIVED_FROM_COORDINATES;DIFFERENT_OWNER_INSTITUTION"
-57.283333,-14.783333,"Triplaris americana",1252619906,"Sítio Palmital.","BRA",NA,2007,"PRESERVED_SPECIMEN","GEODETIC_DATUM_ASSUMED_WGS84;CONTINENT_DERIVED_FROM_COORDINATES;DIFFERENT_OWNER_INSTITUTION"
-55.180556,-9.446667,"Triplaris americana",1090664151,"Parque Estadual Cristalino, Baixada com mata pertubada, com Erythrina e muitos bambus.","BRA",NA,2008,"PRESERVED_SPECIMEN","GEODETIC_DATUM_ASSUMED_WGS84;CONTINENT_DERIVED_FROM_COORDINATES;INSTITUTION_MATCH_NONE"
-58.231481,-9.87235,"Triplaris americana",2243332446,"Floresta de Igapó.","BRA",NA,2014,"PRESERVED_SPECIMEN","GEODETIC_DATUM_ASSUMED_WGS84;CONTINENT_DERIVED_FROM_COORDINATES;INSTITUTION_MATCH_NONE"
-57.081389,-9.055444,"Triplaris americana",2027496382,"Trecho Sumauma Acima do Flutuante, Aluvial.","BRA",NA,2012,"PRESERVED_SPECIMEN","GEODETIC_DATUM_ASSUMED_WGS84;CONTINENT_DERIVED_FROM_COORDINATES;INSTITUTION_MATCH_NONE"
-55.898333,-9.451667,"Triplaris americana",1090663579,"Parque Estadual Cristalino, Vegetação marginal do Rio Cristalino, com arvoretas e cipós.","BRA",NA,2008,"PRESERVED_SPECIMEN","GEODETIC_DATUM_ASSUMED_WGS84;CONTINENT_DERIVED_FROM_COORDINATES;INSTITUTION_MATCH_NONE"
-56.801667,-9.243611,"Triplaris americana",1090665364,"UHE São Manoel","BRA",NA,2009,"PRESERVED_SPECIMEN","GEODETIC_DATUM_ASSUMED_WGS84;CONTINENT_DERIVED_FROM_COORDINATES;INSTITUTION_MATCH_NONE"
-74.402539,6.492308,"Triplaris americana",728249311,"Las Ciénagas Chiquita y El Encanto, se encuentran en la vereda Puerto Olaya, y la ciénaga Cachimbero se encuentra entre las veredas Tierradentro, Campo Seco y De La Torre.","COL",NA,2010,"HUMAN_OBSERVATION","COORDINATE_ROUNDED;GEODETIC_DATUM_ASSUMED_WGS84"
-75.535,1.562722,"Triplaris americana",2992216596,"Corregimiento El Caraño, Vereda San José de Canelos","COL",NA,2017,"PRESERVED_SPECIMEN","COORDINATE_ROUNDED;INSTITUTION_MATCH_NONE"
-76.632667,1.084,"Triplaris americana",2992216307,"Centro Experimental Amazónico-CEA-Corpoamazonia","COL",NA,2016,"PRESERVED_SPECIMEN","COORDINATE_ROUNDED;INSTITUTION_MATCH_NONE"
-71.890203,6.39275,"Triplaris americana",4046856519,"Vereda San Antonio, predio Los Laureles","COL",31,2019,"PRESERVED_SPECIMEN","COORDINATE_ROUNDED;INSTITUTION_MATCH_FUZZY;COLLECTION_MATCH_FUZZY"
-44.366667,-15.483333,"Triplaris americana",1677435959,"Brejo de Amparo, c. 8km from Januaria.","BRA",NA,1989,"PRESERVED_SPECIMEN","GEODETIC_DATUM_ASSUMED_WGS84;CONTINENT_DERIVED_FROM_COORDINATES;INSTITUTION_MATCH_FUZZY;COLLECTION_MATCH_FUZZY"
-65.1875,-9.5475,"Triplaris americana",1095259087,"Margem esquerda do rio Madeira.","BRA",NA,2012,"PRESERVED_SPECIMEN","OCCURRENCE_STATUS_INFERRED_FROM_INDIVIDUAL_COUNT;GEODETIC_DATUM_ASSUMED_WGS84;CONTINENT_DERIVED_FROM_COORDINATES;INSTITUTION_MATCH_NONE"
-53.6147836,-23.3996325,"Triplaris americana",1930833774,"Rio Ivai, Pontal do Tigre","BRA",NA,1967,"PRESERVED_SPECIMEN","COORDINATE_REPROJECTED;COLLECTION_MATCH_FUZZY"
-73.719028,8.429806,"Triplaris americana",3107159445,"Palenquillo","COL",NA,2016,"PRESERVED_SPECIMEN","COORDINATE_ROUNDED;INSTITUTION_MATCH_NONE"
-36.231383,-10.116194,"Triplaris americana",1077596069,"Centro de Ciências Agrárias da UFAL- Tabuleiro.","BRA",NA,2003,"PRESERVED_SPECIMEN","GEODETIC_DATUM_ASSUMED_WGS84;CONTINENT_DERIVED_FROM_COORDINATES;DIFFERENT_OWNER_INSTITUTION"
-40.257481,-20.264092,"Triplaris americana",3949491941,"","BRA",4,2022,"HUMAN_OBSERVATION","COORDINATE_ROUNDED;COUNTRY_DERIVED_FROM_COORDINATES;CONTINENT_DERIVED_FROM_COORDINATES"
-74.103117,7.102,"Triplaris americana",1702875361,"Río Cimitarra, arriba de Santo Domingo.","COL",NA,2017,"HUMAN_OBSERVATION","COORDINATE_ROUNDED;GEODETIC_DATUM_ASSUMED_WGS84"
-72.63333,-13,"Triplaris americana",4032028709,"Dist. Vilcabamba, Paltaybamba - Chaullay, Bosque Secundario","PER",NA,2003,"PRESERVED_SPECIMEN","OCCURRENCE_STATUS_INFERRED_FROM_INDIVIDUAL_COUNT;GEODETIC_DATUM_ASSUMED_WGS84;INSTITUTION_MATCH_FUZZY;COLLECTION_MATCH_NONE"
-63.731944,-18.923056,"Triplaris americana",4032092368,"Entre Masicurí y Arenales.","BOL",NA,2012,"PRESERVED_SPECIMEN","OCCURRENCE_STATUS_INFERRED_FROM_INDIVIDUAL_COUNT;COORDINATE_ROUNDED;GEODETIC_DATUM_ASSUMED_WGS84;INSTITUTION_MATCH_FUZZY;COLLECTION_MATCH_NONE"
-75.854111,6.698012,"Triplaris americana",3895467093,"La Angelina Fase 1","COL",NA,2018,"HUMAN_OBSERVATION",""
-47.081111,-22.647222,"Triplaris americana",3695984815,"Estação Experimental da Syngenta","BRA",NA,2018,"PRESERVED_SPECIMEN","GEODETIC_DATUM_ASSUMED_WGS84;CONTINENT_DERIVED_FROM_COORDINATES;AMBIGUOUS_INSTITUTION"
-43.175702,-22.936822,"Triplaris americana",4009830920,"","BRA",1361,2022,"HUMAN_OBSERVATION","COORDINATE_ROUNDED;CONTINENT_DERIVED_FROM_COORDINATES"
-39.133333,-16.383333,"Triplaris americana",1090444628,"16Km W P. Seguro. Area da ESPAB","BRA",NA,1987,"PRESERVED_SPECIMEN","GEODETIC_DATUM_ASSUMED_WGS84;CONTINENT_DERIVED_FROM_COORDINATES;INSTITUTION_MATCH_NONE"
-92.166667,14.933333,"Triplaris americana",2629656002,"Monte Grande","MEX",110,1985,"PRESERVED_SPECIMEN","TYPE_STATUS_INVALID;OCCURRENCE_STATUS_INFERRED_FROM_INDIVIDUAL_COUNT;COORDINATE_ROUNDED;GEODETIC_DATUM_ASSUMED_WGS84;GEODETIC_DATUM_INVALID;CONTINENT_DERIVED_FROM_COORDINATES;INSTITUTION_MATCH_NONE"
-92.636111,15.323611,"Triplaris americana",2629674228,"Cuyamiapa","MEX",100,1985,"PRESERVED_SPECIMEN","TYPE_STATUS_INVALID;OCCURRENCE_STATUS_INFERRED_FROM_INDIVIDUAL_COUNT;COORDINATE_ROUNDED;GEODETIC_DATUM_ASSUMED_WGS84;GEODETIC_DATUM_INVALID;CONTINENT_DERIVED_FROM_COORDINATES;INSTITUTION_MATCH_NONE"
-67.8,4.41666,"Triplaris americana",1260839391,"Dpto. Atures, Río Orinoco, Isla Hormiga, entre Caño Grulla y Caño Ucata, terreno inundable.","VEN",NA,1989,"PRESERVED_SPECIMEN","GEODETIC_DATUM_ASSUMED_WGS84;INSTITUTION_MATCH_FUZZY;COLLECTION_MATCH_NONE"
-61.80333,-15.05583,"Triplaris americana",4031583868,"Prov. Guarayos. Reserva de Vida Silvestre Rios Blanco y Negro. Río San Martin (Concesión Oquiriquia); 3 km trayecto al SW del campamento. Bosque caducifolio de altura y transicional al bajio, estacionalmente inundado. Comunidades de mapajo (Ceiba samauma), yesquero (Cariniana domestica).","BOL",NA,1993,"PRESERVED_SPECIMEN","GEODETIC_DATUM_ASSUMED_WGS84;INSTITUTION_MATCH_FUZZY;COLLECTION_MATCH_NONE"
-69.083333,-12.5,"Triplaris americana",1260838853,"Rio Inambari. Bosque humedo tropical.","PER",NA,1972,"PRESERVED_SPECIMEN","COORDINATE_ROUNDED;GEODETIC_DATUM_ASSUMED_WGS84;INSTITUTION_MATCH_FUZZY;COLLECTION_MATCH_NONE"
-64.89,-14.690278,"Triplaris americana",1260838961,"Provincia Cercado -10 Km. al Norte de Trinidad-puente de Macavi.","BOL",NA,1987,"PRESERVED_SPECIMEN","OCCURRENCE_STATUS_INFERRED_FROM_INDIVIDUAL_COUNT;COORDINATE_ROUNDED;GEODETIC_DATUM_ASSUMED_WGS84;INSTITUTION_MATCH_FUZZY;COLLECTION_MATCH_NONE"
-77.6,-1.06666,"Triplaris americana",4031513677,"Jatun Sacha Biological Station. Napo River, 8 km east of Misahuall. Tropical Wet Forest. Primary forest. Alluvial soil, on river terrace. Marked trees in Permanent Plot No. 5.","ECU",NA,1994,"PRESERVED_SPECIMEN","GEODETIC_DATUM_ASSUMED_WGS84;INSTITUTION_MATCH_FUZZY;COLLECTION_MATCH_NONE"
-80.61666,-4.15,"Triplaris americana",1261453612,"Cerros de Amotape, Quebrada Los Conejos, ca. 25 km SE of Cherrelique. Premontane moist forest. Transect 1","PER",NA,1987,"PRESERVED_SPECIMEN","OCCURRENCE_STATUS_INFERRED_FROM_INDIVIDUAL_COUNT;GEODETIC_DATUM_ASSUMED_WGS84;INSTITUTION_MATCH_FUZZY;COLLECTION_MATCH_NONE"
-77.11888,7.44055,"Triplaris americana",1259035348,"Río Atrato near Río Sucio.","COL",NA,1974,"PRESERVED_SPECIMEN","GEODETIC_DATUM_ASSUMED_WGS84;INSTITUTION_MATCH_FUZZY;COLLECTION_MATCH_NONE"
-66.583333,3.15,"Triplaris americana",1260839708,"Dpto. Atabapo, Isla Temblador, en el río Orinoco, 30-35 kms aguas arriba de boca de río Puruname.","VEN",NA,1982,"PRESERVED_SPECIMEN","OCCURRENCE_STATUS_INFERRED_FROM_INDIVIDUAL_COUNT;COORDINATE_ROUNDED;GEODETIC_DATUM_ASSUMED_WGS84;INSTITUTION_MATCH_FUZZY;COLLECTION_MATCH_NONE"
-78.810833,-5.060556,"Triplaris americana",1260745456,"Dist. Huarango. Caserio el arenal. Bosque de arenisca y transicional.","PER",NA,2006,"PRESERVED_SPECIMEN","OCCURRENCE_STATUS_INFERRED_FROM_INDIVIDUAL_COUNT;COORDINATE_ROUNDED;GEODETIC_DATUM_ASSUMED_WGS84;INSTITUTION_MATCH_FUZZY;COLLECTION_MATCH_NONE"
-67.51666,6.26666,"Triplaris americana",1260838731,"Distrito san Fernando, near Las Caracaras, ca. 12 airline km NW of Puerto Páez. Along the bank of the Río Meta. Gallery forest.","VEN",NA,1978,"PRESERVED_SPECIMEN","GEODETIC_DATUM_ASSUMED_WGS84;INSTITUTION_MATCH_FUZZY;COLLECTION_MATCH_NONE"
-75.21666,-10.18333,"Triplaris americana",1261451359,"2-3 km E of Iscozacin. Shiringal soil tan-colored or sandy, said to be too poor for crops.","PER",NA,1982,"PRESERVED_SPECIMEN","OCCURRENCE_STATUS_INFERRED_FROM_INDIVIDUAL_COUNT;GEODETIC_DATUM_ASSUMED_WGS84;INSTITUTION_MATCH_FUZZY;COLLECTION_MATCH_NONE"
-70.466944,-4.134167,"Triplaris americana",1261452682,"Nuevo Nazaret, Río Morona. Mostly primary rainforest with some secondary rainforest and cultivated plants.","PER",NA,1986,"PRESERVED_SPECIMEN","OCCURRENCE_STATUS_INFERRED_FROM_INDIVIDUAL_COUNT;COORDINATE_ROUNDED;GEODETIC_DATUM_ASSUMED_WGS84;INSTITUTION_MATCH_FUZZY;COLLECTION_MATCH_NONE"
-63.44805,-17.90083,"Triplaris americana",4031651343,"Localidad del Monumento Natural Espejillos. 2 km al Noreste de la casa de Don José Osinaga.","BOL",NA,2007,"PRESERVED_SPECIMEN","GEODETIC_DATUM_ASSUMED_WGS84;INSTITUTION_MATCH_FUZZY;COLLECTION_MATCH_NONE"
-70.01666,9.03333,"Triplaris americana",1258520123,"30 km west of Guanare by air. Along Río Tucupido.","VEN",NA,1982,"PRESERVED_SPECIMEN","GEODETIC_DATUM_ASSUMED_WGS84;INSTITUTION_MATCH_FUZZY;COLLECTION_MATCH_NONE"
-74.858943,5.068324,"Triplaris americana",1656004236,"Hacienda Jabirú","COL",NA,2015,"HUMAN_OBSERVATION","CONTINENT_DERIVED_FROM_COORDINATES"
-72.701961,-7.624573,"Triplaris americana",1930127437,"2-5 km west of Cruzeiro do Sul","BRA",NA,1966,"PRESERVED_SPECIMEN","COORDINATE_ROUNDED;COLLECTION_MATCH_FUZZY"
-52.3426935,-22.7385296,"Triplaris americana",1927865614,"Rio Paranapanema","BRA",NA,1966,"PRESERVED_SPECIMEN","COORDINATE_REPROJECTED;COLLECTION_MATCH_FUZZY"
-46.408333,-14.325278,"Triplaris americana",2996841863,"JBS-Agro Ltda","BRA",NA,2013,"PRESERVED_SPECIMEN","RECORDED_DATE_INVALID;COORDINATE_ROUNDED;GEODETIC_DATUM_ASSUMED_WGS84;CONTINENT_DERIVED_FROM_COORDINATES;ELEVATION_MIN_MAX_SWAPPED;INSTITUTION_MATCH_FUZZY;COLLECTION_MATCH_FUZZY"
-69.28,-12.83,"Triplaris americana",1928132613,"Comunidad nativa de Infierno. Hermosa Chica","PER",NA,1988,"PRESERVED_SPECIMEN","GEODETIC_DATUM_ASSUMED_WGS84;COLLECTION_MATCH_FUZZY"
-67.389493,-8.756661,"Triplaris americana",1928960373,"Boca do Acre. Km. 1-4 road Boca do Acre to Rio Branco. Varzea forest.","BRA",NA,1966,"PRESERVED_SPECIMEN","COLLECTION_MATCH_FUZZY"
-52.333333,-14.733333,"Triplaris americana",2515677664,"Flora of Mato Grosso. Lopez Bridge, 24 km N. of Xavantina on the Xavantina-São Felix road.","BRA",NA,1968,"PRESERVED_SPECIMEN","INSTITUTION_MATCH_FUZZY;INSTITUTION_COLLECTION_MISMATCH"
-71.416667,-11.883333,"Triplaris americana",2515619051,"Dept. Madre de Dios, Prov. Manú, Parque Nacional del Manu, Estacion Biologica Cocha Cashu.","PER",NA,1998,"PRESERVED_SPECIMEN","INSTITUTION_MATCH_FUZZY;INSTITUTION_COLLECTION_MISMATCH"
-75.822361,6.863889,"Triplaris americana",1052765537,"En el camino de herradura que lleva del casco urbano del pueblo al puente de La Garrucha. Sector de Los Encuentros; confluencia de la quebrada San Pedro y Níquia. Suelos arenosos al borde de las quebradas.","COL",NA,2014,"HUMAN_OBSERVATION","COORDINATE_ROUNDED"
-75.828583,6.609917,"Triplaris americana",1052765543,"Quebrada la Mariscala, Vereda el Tunal","COL",NA,2014,"HUMAN_OBSERVATION","COORDINATE_ROUNDED"
-75.84425,6.872194,"Triplaris americana",1052766477,"Sector de el puente de la Garrucha, en abanico fluvial de la desembocadura de la quebrada Níquia al río Cauca.","COL",NA,2014,"HUMAN_OBSERVATION","COORDINATE_ROUNDED"
-39.280202,-14.7893068,"Triplaris americana",1928037618,"Avenida Asis Maron, Margem do Rio Cachoeira","BRA",NA,2000,"PRESERVED_SPECIMEN","COORDINATE_REPROJECTED;COLLECTION_MATCH_FUZZY"
-46.3695672,-14.0969874,"Triplaris americana",1929125055,"Km. 17 da rodovia BR-020, trecho Alvorado do Norte, Posse.","BRA",NA,1994,"PRESERVED_SPECIMEN","COORDINATE_REPROJECTED;COLLECTION_MATCH_FUZZY"
-73.766581,-4.817787,"Triplaris americana",1929200570,"Caño Iricahua, abajo de Senaro Herrera margen izquierda R. Ucayali","PER",NA,1982,"PRESERVED_SPECIMEN","COLLECTION_MATCH_FUZZY"
-68.830249,-14.726148,"Triplaris americana",4031694857,"Culi, en Parque Nacional Madidi, cercanías del río Pelechuco, bajando desde Pelechuco por el camino antiguo Pelechuco-Apolo. Parcela temporal de muestreo (0,1 ha). Plantas alcoholizadas.","BOL",NA,2009,"PRESERVED_SPECIMEN","OCCURRENCE_STATUS_INFERRED_FROM_INDIVIDUAL_COUNT;COORDINATE_ROUNDED;GEODETIC_DATUM_ASSUMED_WGS84;INSTITUTION_MATCH_FUZZY;COLLECTION_MATCH_NONE"
-75.88333,-0.16666,"Triplaris americana",4031950269,"Río Cuyabeno. Collections along the riverside on both sides of the river from the mouth and two hours upstream.","ECU",NA,1981,"PRESERVED_SPECIMEN","GEODETIC_DATUM_ASSUMED_WGS84;INSTITUTION_MATCH_FUZZY;COLLECTION_MATCH_NONE"
-69.6,-13.13333,"Triplaris americana",4031525476,"Dist. Puerto Maldonado, Cusco Amazónico, Bosque Primario","PER",NA,2002,"PRESERVED_SPECIMEN","OCCURRENCE_STATUS_INFERRED_FROM_INDIVIDUAL_COUNT;GEODETIC_DATUM_ASSUMED_WGS84;INSTITUTION_MATCH_FUZZY;COLLECTION_MATCH_NONE"
-73.8,9.61666,"Triplaris americana",1260839920,"Orilla izquierda del Río Ariguaní cerca de El Paso.","COL",NA,1961,"PRESERVED_SPECIMEN","GEODETIC_DATUM_ASSUMED_WGS84;INSTITUTION_MATCH_FUZZY;COLLECTION_MATCH_NONE"
-67.904528,-13.43475,"Triplaris americana",4031760346,"Ixiamas, concesión de la empresa forestal Bosques del Norte, arroyo Muri","BOL",NA,2014,"PRESERVED_SPECIMEN","OCCURRENCE_STATUS_INFERRED_FROM_INDIVIDUAL_COUNT;COORDINATE_ROUNDED;GEODETIC_DATUM_ASSUMED_WGS84;INSTITUTION_MATCH_FUZZY;COLLECTION_MATCH_NONE"
-67.959722,-14.366111,"Triplaris americana",4031515955,"Área Natural de Manejo Integrado Madidi. Arroyo Rudidi, sobre el Rio Tuichi.","BOL",NA,2002,"PRESERVED_SPECIMEN","OCCURRENCE_STATUS_INFERRED_FROM_INDIVIDUAL_COUNT;COORDINATE_ROUNDED;GEODETIC_DATUM_ASSUMED_WGS84;INSTITUTION_MATCH_FUZZY;COLLECTION_MATCH_NONE"
-68.554722,-14.391389,"Triplaris americana",4031596365,"Parque Nacional Madidi, rio Tuichi, hacienda Tuichi. Bosque andino semideciduo con Anadenanthera colubrina, Trichilia elegans y Acacia loretensis. Con vegetacion ribereña Gynerium sagittatum. Plantas secadas en campo.","BOL",NA,2005,"PRESERVED_SPECIMEN","OCCURRENCE_STATUS_INFERRED_FROM_INDIVIDUAL_COUNT;COORDINATE_ROUNDED;GEODETIC_DATUM_ASSUMED_WGS84;INSTITUTION_MATCH_FUZZY;COLLECTION_MATCH_NONE"
-67.833333,6.316667,"Triplaris americana",1259079266,"Ca. 4.5 km airline miles ESE of San Carlos del Meta along banks of the Río Meta.","VEN",NA,1978,"PRESERVED_SPECIMEN","OCCURRENCE_STATUS_INFERRED_FROM_INDIVIDUAL_COUNT;COORDINATE_ROUNDED;GEODETIC_DATUM_ASSUMED_WGS84;INSTITUTION_MATCH_FUZZY;COLLECTION_MATCH_NONE"
-67.83333,5.16666,"Triplaris americana",1261450227,"Parque Nacional Natural El Tuparro, along Río Orinoco at Miramar, vegetation growing among large granitic boulders, Lat. 5º10'N, Long. 67º50'W, alt ca. 85 m.","COL",NA,1985,"PRESERVED_SPECIMEN","OCCURRENCE_STATUS_INFERRED_FROM_INDIVIDUAL_COUNT;GEODETIC_DATUM_ASSUMED_WGS84;INSTITUTION_MATCH_FUZZY;COLLECTION_MATCH_NONE"
-72.542141,11.166971,"Triplaris americana",3821083008,"Arroyo Bruno","COL",NA,2019,"HUMAN_OBSERVATION",""
-72.541326,11.165884,"Triplaris americana",3821083961,"Arroyo Bruno","COL",NA,2019,"HUMAN_OBSERVATION",""
-72.4294,5.4855,"Triplaris americana",3901037029,"Marroquin","COL",38.5,2022,"HUMAN_OBSERVATION",""
-68.741417,-14.147889,"Triplaris americana",4031998261,"Parque Nacional Madidi, NW de Apolo, senda Azariamas-San Fermín.","BOL",NA,2006,"PRESERVED_SPECIMEN","OCCURRENCE_STATUS_INFERRED_FROM_INDIVIDUAL_COUNT;COORDINATE_ROUNDED;GEODETIC_DATUM_ASSUMED_WGS84;INSTITUTION_MATCH_FUZZY;COLLECTION_MATCH_NONE"
-63.75,2.233333,"Triplaris americana",1261450683,"Río Orinoco below Raudal y Salto El Tobogán. EXPEDICÍON CORAVEN a las cabeceras del Río Orinoco. (CORAVEN EXPEDITION to the headwaters of the Orinoco).","VEN",NA,1989,"PRESERVED_SPECIMEN","OCCURRENCE_STATUS_INFERRED_FROM_INDIVIDUAL_COUNT;COORDINATE_ROUNDED;GEODETIC_DATUM_ASSUMED_WGS84;INSTITUTION_MATCH_FUZZY;COLLECTION_MATCH_NONE"
-77.116159,7.854063,"Triplaris americana",1257610961,"Parque Nacional Natural los Katios, Camino a los Saltos El Tendal y La Tigra.","COL",NA,1999,"PRESERVED_SPECIMEN","OCCURRENCE_STATUS_INFERRED_FROM_INDIVIDUAL_COUNT;GEODETIC_DATUM_ASSUMED_WGS84;INSTITUTION_MATCH_FUZZY;COLLECTION_MATCH_NONE"
-67.333333,-16.666667,"Triplaris americana",4032049528,"Comunidad Khora-Charrupampa, cuenca del río Miguillas a 22 km de Choquetanga. Exp. SW, con antiguas ruinas, presencia de abundantes lianas. Transecto 8.","BOL",NA,1994,"PRESERVED_SPECIMEN","OCCURRENCE_STATUS_INFERRED_FROM_INDIVIDUAL_COUNT;COORDINATE_ROUNDED;GEODETIC_DATUM_ASSUMED_WGS84;INSTITUTION_MATCH_FUZZY;COLLECTION_MATCH_NONE"
-77.71666,8.16666,"Triplaris americana",1259176970,"Hill near Río Chucunaque, ca. 4 mi below Yaviza","PAN",NA,1963,"PRESERVED_SPECIMEN","GEODETIC_DATUM_ASSUMED_WGS84;INSTITUTION_MATCH_FUZZY;COLLECTION_MATCH_NONE"
-56.95,-16.95,"Triplaris americana",1929525672,"Pantanal. 7-12 km SW of Rio Cassangé on road to Porto Jofre (MT060).","BRA",NA,1985,"PRESERVED_SPECIMEN","GEODETIC_DATUM_ASSUMED_WGS84;COLLECTION_MATCH_FUZZY"
-72.626122,5.227975,"Triplaris americana",3498330337,"Vereda Cupiagua, predio Lote Rural","COL",NA,2021,"HUMAN_OBSERVATION","COORDINATE_ROUNDED"
-42.117894,-19.77248,"Triplaris americana",3957019445,"","BRA",NA,2020,"HUMAN_OBSERVATION","COORDINATE_ROUNDED;COUNTRY_DERIVED_FROM_COORDINATES;CONTINENT_DERIVED_FROM_COORDINATES"
-74.877257,4.70988,"Triplaris americana",1891238254,"Finca Los Tamarindos","COL",NA,2014,"HUMAN_OBSERVATION",""
-74.8495,4.282509,"Triplaris americana",1891237884,"Finca California","COL",NA,2014,"HUMAN_OBSERVATION",""
-61.15916,-14.66416,"Triplaris americana",1261905027,"Reserva Biológica El Refugio Parcela Montecristo 1. 1.5 km al N del camino El Divisorio y el arroyo Montecristo. Bosque inundado estacional hasta 2 m.","BOL",NA,1995,"PRESERVED_SPECIMEN","OCCURRENCE_STATUS_INFERRED_FROM_INDIVIDUAL_COUNT;GEODETIC_DATUM_ASSUMED_WGS84;DIFFERENT_OWNER_INSTITUTION"
-68.15611,-13.90444,"Triplaris americana",4062100731,"Parque Nacional Madidi. Bosque tropical lluvioso primario. Tierra firme, media ladera, fuerte pendiente, próximo a unas ruinas incas","BOL",NA,2001,"PRESERVED_SPECIMEN","GEODETIC_DATUM_ASSUMED_WGS84;DIFFERENT_OWNER_INSTITUTION"
-76.2797,-0.864067,"Triplaris americana",4061818379,"Parque Nacional Yasuní. Carretera Pompeya Sur - Iro Km 84,9. En territorio de la comunidad Huaorani de Dicaro. Parcela temporal de muestreo (0.1 ha) Nº 23.","ECU",NA,1998,"PRESERVED_SPECIMEN","OCCURRENCE_STATUS_INFERRED_FROM_INDIVIDUAL_COUNT;COORDINATE_ROUNDED;GEODETIC_DATUM_ASSUMED_WGS84;DIFFERENT_OWNER_INSTITUTION"
-78.71666,-4.3,"Triplaris americana",4062054813,"Parroquia Guayzimi. Campamento Militar Shaime. Bosque húmedo Premontano. Topografía ligera colinada, suelo de colinas o terrazas aluviales antiguas, en cima suelo mediano profundos franco-arcillosos. (DISTROPEPS). Transectos de 50 x 2 m (0.2 Ha.). A rastrojo de más de 10 años. Completo con M. Chango, V. Tapur, G. Aymard & J. Alban.","ECU",NA,1991,"PRESERVED_SPECIMEN","OCCURRENCE_STATUS_INFERRED_FROM_INDIVIDUAL_COUNT;GEODETIC_DATUM_ASSUMED_WGS84;INSTITUTION_MATCH_NONE"
-76.63333,-0.4,"Triplaris americana",1261453269,"Limoncocha. Rain forest.","ECU",NA,1984,"PRESERVED_SPECIMEN","GEODETIC_DATUM_ASSUMED_WGS84;DIFFERENT_OWNER_INSTITUTION"
-60.83361,-14.58222,"Triplaris americana",1261907985,"Parque Nacional Noel Kempff Mercado, camino a El Encanto Bosque alto húmedo.","BOL",NA,1995,"PRESERVED_SPECIMEN","OCCURRENCE_STATUS_INFERRED_FROM_INDIVIDUAL_COUNT;GEODETIC_DATUM_ASSUMED_WGS84;DIFFERENT_OWNER_INSTITUTION"
-62.87833,-16.33444,"Triplaris americana",1258539552,"A 7 km. al Sur de El Puente (haci Curucusi).","BOL",NA,1994,"PRESERVED_SPECIMEN","GEODETIC_DATUM_ASSUMED_WGS84;DIFFERENT_OWNER_INSTITUTION"
-72.95416,-12.45138,"Triplaris americana",4061430107,"Dist. Echarate, Ivochote, Comunidad Nativa Monte Carmelo. Bosque secundario","PER",NA,2005,"PRESERVED_SPECIMEN","OCCURRENCE_STATUS_INFERRED_FROM_INDIVIDUAL_COUNT;GEODETIC_DATUM_ASSUMED_WGS84;DIFFERENT_OWNER_INSTITUTION"
-74.127667,11.313778,"Triplaris americana",1054245441,"Parque Nacional Natural Tayrona, Ensenada de Chengue","COL",NA,2014,"HUMAN_OBSERVATION","GEODETIC_DATUM_ASSUMED_WGS84;CONTINENT_DERIVED_FROM_COORDINATES"
-72.166667,-0.6,"Triplaris americana",1258390202,"Río Caquetá, margen derecha 35 km arriba de la isla Sumaeta. Llanura aluvial inundable.","COL",NA,1990,"PRESERVED_SPECIMEN","OCCURRENCE_STATUS_INFERRED_FROM_INDIVIDUAL_COUNT;COORDINATE_ROUNDED;GEODETIC_DATUM_ASSUMED_WGS84;DIFFERENT_OWNER_INSTITUTION"
-64.12916,-17.39888,"Triplaris americana",1259132100,"Bosque riberen|5o poco intervenido, salida hacia Yapacani (carretera entre Buena Vista y San Carlos).","BOL",NA,2000,"PRESERVED_SPECIMEN","GEODETIC_DATUM_ASSUMED_WGS84;DIFFERENT_OWNER_INSTITUTION"
-67.794583,-14.083639,"Triplaris americana",1258070868,"Tumupasa, Infierno, Río Siriuna","BOL",NA,2014,"PRESERVED_SPECIMEN","OCCURRENCE_STATUS_INFERRED_FROM_INDIVIDUAL_COUNT;COORDINATE_ROUNDED;GEODETIC_DATUM_ASSUMED_WGS84;ELEVATION_MIN_MAX_SWAPPED;DIFFERENT_OWNER_INSTITUTION"
-71.418837,3.794944,"Triplaris americana",3391889273,"Vereda Rubiales","COL",NA,2018,"HUMAN_OBSERVATION",""
-92.266667,17.935,"Triplaris americana",1893740977,"MPIO. TUXTLA CHICO","MEX",90,1985,"PRESERVED_SPECIMEN","TYPE_STATUS_INVALID;OCCURRENCE_STATUS_INFERRED_FROM_INDIVIDUAL_COUNT;COORDINATE_ROUNDED;GEODETIC_DATUM_ASSUMED_WGS84;CONTINENT_DERIVED_FROM_COORDINATES;ELEVATION_MIN_MAX_SWAPPED;INSTITUTION_MATCH_NONE"
-92.445,15.136667,"Triplaris americana",1893740981,"PIEDRA CANOA, 6 KM AL NORTE","MEX",100,1987,"PRESERVED_SPECIMEN","TYPE_STATUS_INVALID;OCCURRENCE_STATUS_INFERRED_FROM_INDIVIDUAL_COUNT;COORDINATE_ROUNDED;GEODETIC_DATUM_ASSUMED_WGS84;CONTINENT_DERIVED_FROM_COORDINATES;ELEVATION_MIN_MAX_SWAPPED;INSTITUTION_MATCH_NONE"
-60.3692,6.34422,"Triplaris americana",1456006678,"Meamu Creek.","GUY",NA,2006,"PRESERVED_SPECIMEN","GEODETIC_DATUM_ASSUMED_WGS84"
-57.17,-14.47,"Triplaris americana",2997521040,"Sítio Palmital.","BRA",NA,2007,"PRESERVED_SPECIMEN","COORDINATE_ROUNDED;GEODETIC_DATUM_ASSUMED_WGS84;CONTINENT_DERIVED_FROM_COORDINATES;INSTITUTION_MATCH_FUZZY;COLLECTION_MATCH_FUZZY"
-46.43,-23.33,"Triplaris americana",2997759627,"Cidade Universitária Armando de Salles Oliveira, Av. Prof. Luciano Gualberto, atrás do Instituto de Matemática e Estatística (IME).","BRA",NA,2002,"PRESERVED_SPECIMEN","GEODETIC_DATUM_ASSUMED_WGS84;CONTINENT_DERIVED_FROM_COORDINATES;INSTITUTION_MATCH_FUZZY;COLLECTION_MATCH_FUZZY"
-64.8325,-3.166944,"Triplaris americana",2997434416,"Próximo ao Município de Alvarães, rio Solimões, margem direita","BRA",NA,1982,"PRESERVED_SPECIMEN","COORDINATE_ROUNDED;GEODETIC_DATUM_ASSUMED_WGS84;CONTINENT_DERIVED_FROM_COORDINATES;INSTITUTION_MATCH_FUZZY;COLLECTION_MATCH_FUZZY"
-75.204989,8.552344,"Triplaris americana",1931789333,"Las Flores, finca La Rioja","COL",NA,2017,"PRESERVED_SPECIMEN","COORDINATE_ROUNDED;INSTITUTION_MATCH_NONE"
-64.07,-17.92,"Triplaris americana",2284242703,"Santa Cruz Dept., Florida Prov. A few km N of Yerba Buena [Hierba Buena].","BOL",NA,1996,"PRESERVED_SPECIMEN","GEODETIC_DATUM_ASSUMED_WGS84"
-76.42815,-0.6642,"Triplaris americana",4061089176,"Parque Nacional Yasuní. Carretera Pompeya Sur - Iro Km 41. En territorio de la comunidad Huaorani de Tiputini. Parcela temporal de muestreo (0.1 ha) Nº 1.","ECU",NA,1998,"PRESERVED_SPECIMEN","OCCURRENCE_STATUS_INFERRED_FROM_INDIVIDUAL_COUNT;GEODETIC_DATUM_ASSUMED_WGS84;DIFFERENT_OWNER_INSTITUTION"
-64.50138,-15.88333,"Triplaris americana",1258369113,"Pascana Ministro; 70 road km E of Cuatro Cañadas, then 30 Km SE of San Miguelito. Grazed open phat through transitión of dry and riparian forest; south of Cerro Pontudo.","BOL",NA,1995,"PRESERVED_SPECIMEN","GEODETIC_DATUM_ASSUMED_WGS84;DIFFERENT_OWNER_INSTITUTION"
-73.15277,-12.84166,"Triplaris americana",4060872184,"Dist. Vilcabamba, Chuanquiri camino a Resistencia, Bosque secundario","PER",NA,2006,"PRESERVED_SPECIMEN","OCCURRENCE_STATUS_INFERRED_FROM_INDIVIDUAL_COUNT;GEODETIC_DATUM_ASSUMED_WGS84;DIFFERENT_OWNER_INSTITUTION"
