"lon","lat","species","gbifID","locality","countryCode","coordinateUncertaintyInMeters","year","basisOfRecord","issue"
-63.0667,-17.4197,"Vachellia albicorticata",2235946929,"Prov. Warnes, 14 km NE of railroad crossing on east side of Warnes, along a main dirt road.","BOL",NA,2008,"PRESERVED_SPECIMEN","GEODETIC_DATUM_ASSUMED_WGS84"
-62.534167,-19.384444,"Vachellia albicorticata",1258540543,"Iyobi. A 1 km. hacia el Oeste dentro de la comunidad.","BOL",NA,1999,"PRESERVED_SPECIMEN","OCCURRENCE_STATUS_INFERRED_FROM_INDIVIDUAL_COUNT;COORDINATE_ROUNDED;GEODETIC_DATUM_ASSUMED_WGS84;DIFFERENT_OWNER_INSTITUTION"
-63.53333,-18.16666,"Vachellia albicorticata",4061164284,"Angostura - - Along the old road between Santa Cruz and Cochabamba where, coming from Santa Cruz, it first enters the deep canyon of Angostura. Ca 50 km SW of Santa Cruz.","BOL",NA,1990,"PRESERVED_SPECIMEN","OCCURRENCE_STATUS_INFERRED_FROM_INDIVIDUAL_COUNT;GEODETIC_DATUM_ASSUMED_WGS84;DIFFERENT_OWNER_INSTITUTION"
-63.066667,-17.766667,"Vachellia albicorticata",1258420702,"12 km E of center of Santa Cruz on road to Cotoca.","BOL",NA,1987,"PRESERVED_SPECIMEN","OCCURRENCE_STATUS_INFERRED_FROM_INDIVIDUAL_COUNT;COORDINATE_ROUNDED;GEODETIC_DATUM_ASSUMED_WGS84;DIFFERENT_OWNER_INSTITUTION"
-63.956389,-19.777778,"Vachellia albicorticata",3946832036,"Ca. 2.5 km al N del centro de Monteagudo.","BOL",NA,2012,"PRESERVED_SPECIMEN","OCCURRENCE_STATUS_INFERRED_FROM_INDIVIDUAL_COUNT;COORDINATE_ROUNDED;GEODETIC_DATUM_ASSUMED_WGS84;INSTITUTION_MATCH_FUZZY;COLLECTION_MATCH_NONE"
-63.672222,-18.305278,"Vachellia albicorticata",4031617104,"Bella Vista, a orillas del Circuito Ecoturístico Quebradad el Fraile.","BOL",NA,2006,"PRESERVED_SPECIMEN","OCCURRENCE_STATUS_INFERRED_FROM_INDIVIDUAL_COUNT;COORDINATE_ROUNDED;GEODETIC_DATUM_ASSUMED_WGS84;INSTITUTION_MATCH_FUZZY;COLLECTION_MATCH_NONE"
-58.37222,-19.04861,"Vachellia albicorticata",4031487356,"Provincia German Busch; Area natural de manejo integrado y Parque Nacional Otuquis. Estancia Santa Catalina a 5 km al S de la Estancia Campo en Medio, zona inundada o chaparral inundado.","BOL",NA,1998,"PRESERVED_SPECIMEN","GEODETIC_DATUM_ASSUMED_WGS84;INSTITUTION_MATCH_FUZZY;COLLECTION_MATCH_NONE"
-63.303333,-20.678667,"Vachellia albicorticata",1260617554,"Along highway from Villa Montes to Boyuibe, 19.5 km. S of Santa Cruz/Chuquisaca department boundary, 27 km S. of Boyuibe. Roadside through former chaco forest, with Acacia albocorticata and A. aroma.","BOL",NA,2005,"PRESERVED_SPECIMEN","OCCURRENCE_STATUS_INFERRED_FROM_INDIVIDUAL_COUNT;COORDINATE_ROUNDED;GEODETIC_DATUM_ASSUMED_WGS84;INSTITUTION_MATCH_FUZZY;COLLECTION_MATCH_NONE"
-63.95,-18.125,"Vachellia albicorticata",1930779961,"Southern outskirts of Mairana. Dry valley.","BOL",NA,1998,"PRESERVED_SPECIMEN","GEODETIC_DATUM_ASSUMED_WGS84;COLLECTION_MATCH_FUZZY"
-64.88,-14.87,"Vachellia albicorticata",1261492918,"Trinidad, a 5 km sobre La Carretera a Santa Cruz, bosque seco alterado y con zonas pantanosas.","BOL",NA,1992,"PRESERVED_SPECIMEN","OCCURRENCE_STATUS_INFERRED_FROM_INDIVIDUAL_COUNT;GEODETIC_DATUM_ASSUMED_WGS84;INSTITUTION_MATCH_FUZZY;COLLECTION_MATCH_NONE"
-63.920278,-19.178056,"Vachellia albicorticata",1257900906,"Municipio de Villa Vaca Guzman, P.N. y Área de Manejo Integrado de la Serranía del Iñao. Por el camino entre el río Grande, aprox. a 5 km de la comunidad de Montegrande.","BOL",NA,2008,"PRESERVED_SPECIMEN","OCCURRENCE_STATUS_INFERRED_FROM_INDIVIDUAL_COUNT;COORDINATE_ROUNDED;GEODETIC_DATUM_ASSUMED_WGS84;INSTITUTION_MATCH_FUZZY;COLLECTION_MATCH_NONE"
-63.89916,-20.57638,"Vachellia albicorticata",1260804124,"Saliendo del Rosario de Ingre hacia Monteagudo. Bosque Chaco Serrano con rrestos de Bosue Tucumano-Boliviano en quebradas y laderas protegidas; pasando a lugares abiertos con pastizales cicundante a propiedades de hacendados.","BOL",NA,2006,"PRESERVED_SPECIMEN","GEODETIC_DATUM_ASSUMED_WGS84;INSTITUTION_MATCH_FUZZY;COLLECTION_MATCH_NONE"
-63.116667,-20.683333,"Vachellia albicorticata",1258260386,"Communidad El Viñal, S de El Salvador-CIMBOC. Puesto de Ovando.","BOL",NA,1993,"PRESERVED_SPECIMEN","OCCURRENCE_STATUS_INFERRED_FROM_INDIVIDUAL_COUNT;COORDINATE_ROUNDED;GEODETIC_DATUM_ASSUMED_WGS84;INSTITUTION_MATCH_FUZZY;COLLECTION_MATCH_NONE"
-63.7275,-18.971111,"Vachellia albicorticata",1257861653,"Entre Masicurí y Arenales, sobre la quebrada La Beria.","BOL",NA,2012,"PRESERVED_SPECIMEN","OCCURRENCE_STATUS_INFERRED_FROM_INDIVIDUAL_COUNT;COORDINATE_ROUNDED;GEODETIC_DATUM_ASSUMED_WGS84;DIFFERENT_OWNER_INSTITUTION"
-63.53,-18.17,"Vachellia albicorticata",1563301423,"Andres Ibanez Province 'Angostura' - - Along the old road between Santa Cruz and Cochabamba where, coming from Santa Cruz, it first enters the deep canyon of Angostura. Ca 50 km SW of Santa Cruz","BOL",NA,1990,"PRESERVED_SPECIMEN","GEODETIC_DATUM_ASSUMED_WGS84"
-62.9,-17.733333,"Vachellia albicorticata",4061344985,"10 km E of Cotoca, along Quebrada Quitachiyú, 2 km S of Cotoca-Pailas highway.","BOL",NA,1994,"PRESERVED_SPECIMEN","OCCURRENCE_STATUS_INFERRED_FROM_INDIVIDUAL_COUNT;COORDINATE_ROUNDED;GEODETIC_DATUM_ASSUMED_WGS84;DIFFERENT_OWNER_INSTITUTION"
-59.91944,-17.69722,"Vachellia albicorticata",1258832929,"Progresiva del Entre San Juan y el Campamento Don Mario. Kp 143+628 Vegetacion bosque mal drenado. alto con sp. entre 15 y 12 metros. momoqui, curapau, soto, cari-cari, soto, gabetillo. Sotobosque arbustivo ralo, con poco bejuco, hasta 3 metros de alto. Sotobosque arbustivo con pasto. Suelo arcilloso.","BOL",NA,2001,"PRESERVED_SPECIMEN","GEODETIC_DATUM_ASSUMED_WGS84;DIFFERENT_OWNER_INSTITUTION"
-62.58333,-19.58333,"Vachellia albicorticata",1258274069,"La Brecha, Bañados del Izozog, alrededores del hospital y 3 km E camino hacia río Parpetí.","BOL",NA,1991,"PRESERVED_SPECIMEN","OCCURRENCE_STATUS_INFERRED_FROM_INDIVIDUAL_COUNT;GEODETIC_DATUM_ASSUMED_WGS84;DIFFERENT_OWNER_INSTITUTION"
-63.6,-22.18333,"Vachellia albicorticata",1259738692,"500 m de la RP 54 por camino a 1 km al N de la Finca La Angostura.","ARG",NA,2001,"PRESERVED_SPECIMEN","GEODETIC_DATUM_ASSUMED_WGS84;DIFFERENT_OWNER_INSTITUTION"
-57.43944,-22.75722,"Vachellia albicorticata",4031353723,"Arroyo Tagatiyá-Guazú. Gallery forest on limestones.","PRY",NA,1994,"PRESERVED_SPECIMEN","OCCURRENCE_STATUS_INFERRED_FROM_INDIVIDUAL_COUNT;GEODETIC_DATUM_ASSUMED_WGS84;INSTITUTION_MATCH_FUZZY;COLLECTION_MATCH_NONE"
-63.816667,-17.416667,"Vachellia albicorticata",1258752714,"N side of Río Surutu, 1 km upstream from junction with Río Yapacani, 2 km upstream from and SE of highway bridge over Río Yapacani.","BOL",NA,1990,"PRESERVED_SPECIMEN","OCCURRENCE_STATUS_INFERRED_FROM_INDIVIDUAL_COUNT;COORDINATE_ROUNDED;GEODETIC_DATUM_ASSUMED_WGS84;INSTITUTION_MATCH_FUZZY;COLLECTION_MATCH_NONE"
-63.25611,-17.84972,"Vachellia albicorticata",1260716528,"Localidad de La Guardia km 9.5 camino antiguo a Porongo a 8 cuadras sobre el camino y terreno con vegetación natural, tras casade I. Linneo. Área con residuos de vegetación natural.","BOL",NA,2006,"PRESERVED_SPECIMEN","GEODETIC_DATUM_ASSUMED_WGS84;DIFFERENT_OWNER_INSTITUTION"
-63.607222,-18.74,"Vachellia albicorticata",1257750720,"Sobre el río Mosquera, cerca a la casa de Don Herman Ruedas.","BOL",NA,2011,"PRESERVED_SPECIMEN","OCCURRENCE_STATUS_INFERRED_FROM_INDIVIDUAL_COUNT;COORDINATE_ROUNDED;GEODETIC_DATUM_ASSUMED_WGS84;DIFFERENT_OWNER_INSTITUTION"
-63.989944,-19.566556,"Vachellia albicorticata",4061113281,"Cantón Sauces, Comunidad Azero Norte, PN-ANMI Serrania del Iñao.","BOL",NA,2009,"PRESERVED_SPECIMEN","OCCURRENCE_STATUS_INFERRED_FROM_INDIVIDUAL_COUNT;COORDINATE_ROUNDED;GEODETIC_DATUM_ASSUMED_WGS84;DIFFERENT_OWNER_INSTITUTION"
-64.72,-14.88,"Vachellia albicorticata",1261867259,"Estancia La Chacra; 22 km E de Trinidad, sobre la carretera a Santa Cruz. Arboleada de semi-altura al N del bosque de galeria de la cañada de los Lagartos.","BOL",NA,1993,"PRESERVED_SPECIMEN","GEODETIC_DATUM_ASSUMED_WGS84;DIFFERENT_OWNER_INSTITUTION"
-61.86055,-16.67194,"Vachellia albicorticata",1261862921,"Región de Lomerio. A 1 km al Este de la plaza de la comunidad de Florida.","BOL",NA,1994,"PRESERVED_SPECIMEN","GEODETIC_DATUM_ASSUMED_WGS84;DIFFERENT_OWNER_INSTITUTION"
-63.45081,-21.26645,"Vachellia albicorticata",438384373,"","BOL",NA,1971,"PRESERVED_SPECIMEN","GEODETIC_DATUM_ASSUMED_WGS84;CONTINENT_DERIVED_FROM_COORDINATES;COLLECTION_MATCH_FUZZY"
-63.1,-17.88333,"Vachellia albicorticata",1261547919,"3 km al sureste de la Refineria El Palmar por el camino a las Lomas de Arena (ca. 13 km al sureste de Santa Cruz). Bosque bajo sobre arena, muy tocado.","BOL",NA,1988,"PRESERVED_SPECIMEN","OCCURRENCE_STATUS_INFERRED_FROM_INDIVIDUAL_COUNT;GEODETIC_DATUM_ASSUMED_WGS84;INSTITUTION_MATCH_FUZZY;COLLECTION_MATCH_NONE"
-62.56666,-16.28333,"Vachellia albicorticata",1258539064,"San Javier.","BOL",NA,1998,"PRESERVED_SPECIMEN","GEODETIC_DATUM_ASSUMED_WGS84;DIFFERENT_OWNER_INSTITUTION"
-65.333333,-24.833333,"Vachellia albicorticata",1324965217,"Ciudad De Salta, Playa Del Ff.Cc, Detras De Ex Molino Batule Y Bodega Los Parrales, Al Otro Lado De La Estacion, Capital Department","ARG",3036,2006,"PRESERVED_SPECIMEN","GEODETIC_DATUM_ASSUMED_WGS84;CONTINENT_DERIVED_FROM_COORDINATES;INSTITUTION_MATCH_FUZZY;COLLECTION_MATCH_FUZZY"
-63.8,-22.11667,"Vachellia albicorticata",1144592788,"Dique Itiyuro - 15 km al S de Prof. Mazza/Provincia de Salta","ARG",1500,1991,"PRESERVED_SPECIMEN","GEODETIC_DATUM_ASSUMED_WGS84;CONTINENT_DERIVED_FROM_COORDINATES;TAXON_MATCH_FUZZY;INSTITUTION_MATCH_FUZZY;COLLECTION_MATCH_NONE"
-63.26666,-20.3,"Vachellia albicorticata",1261831310,"Boyuibe, del Pueldo. Muestras preservadas en alcohol.","BOL",NA,1992,"PRESERVED_SPECIMEN","OCCURRENCE_STATUS_INFERRED_FROM_INDIVIDUAL_COUNT;GEODETIC_DATUM_ASSUMED_WGS84;INSTITUTION_MATCH_FUZZY;COLLECTION_MATCH_NONE"
