"lon","lat","species","gbifID","locality","countryCode","coordinateUncertaintyInMeters","year","basisOfRecord","issue"
-72,-12.466667,"Weinmannia auriculata",4060877750,"Dist. Lares, Suyo, Bosque Primario Húmedo","PER",NA,2005,"PRESERVED_SPECIMEN","OCCURRENCE_STATUS_INFERRED_FROM_INDIVIDUAL_COUNT;COORDINATE_ROUNDED;GEODETIC_DATUM_ASSUMED_WGS84;DIFFERENT_OWNER_INSTITUTION"
-79.13638,-4.48888,"Weinmannia auriculata",1260902013,"Parroquia Valladolid. Reserva Tapichalaca, al lado oriental de la carretera Loja-Palanda. Parcela permanente de una hectárea de inventario de bosque, con árboles > 5 cm DAP censados. Al sureste de la entrada a Quebrada Honda, Sendero de Las Pavas. Bosque muy húmedo montano.","ECU",NA,2007,"PRESERVED_SPECIMEN","OCCURRENCE_STATUS_INFERRED_FROM_INDIVIDUAL_COUNT;GEODETIC_DATUM_ASSUMED_WGS84;INSTITUTION_MATCH_NONE"
-67.795833,-16.344167,"Weinmannia auriculata",4061114707,"Bajada de Chuspipata, por carretera estrecha que va a mina.","BOL",NA,2022,"PRESERVED_SPECIMEN","OCCURRENCE_STATUS_INFERRED_FROM_INDIVIDUAL_COUNT;COORDINATE_ROUNDED;GEODETIC_DATUM_ASSUMED_WGS84;INSTITUTION_MATCH_NONE"
-69.028583,-14.686083,"Weinmannia auriculata",4060961087,"Área Natural de Manejo Integrado Madidi, Keara viejo, Chaquimayu.","BOL",NA,2008,"PRESERVED_SPECIMEN","OCCURRENCE_STATUS_INFERRED_FROM_INDIVIDUAL_COUNT;COORDINATE_ROUNDED;GEODETIC_DATUM_ASSUMED_WGS84;DIFFERENT_OWNER_INSTITUTION"
-77.716917,-6.817817,"Weinmannia auriculata",4061071328,"Dist. Leymebamba, surroundings of La Esperanza,","PER",NA,2010,"PRESERVED_SPECIMEN","OCCURRENCE_STATUS_INFERRED_FROM_INDIVIDUAL_COUNT;COORDINATE_ROUNDED;GEODETIC_DATUM_ASSUMED_WGS84;DIFFERENT_OWNER_INSTITUTION"
-72.248333,-12.624722,"Weinmannia auriculata",4061665686,"Distrito Quellouno, Lacco, Vellavista. Bosque primario intervenido.","PER",NA,2007,"PRESERVED_SPECIMEN","OCCURRENCE_STATUS_INFERRED_FROM_INDIVIDUAL_COUNT;COORDINATE_ROUNDED;GEODETIC_DATUM_ASSUMED_WGS84;DIFFERENT_OWNER_INSTITUTION"
-79.33444,-3.71972,"Weinmannia auriculata",1261838105,"Fierro Urco. Saraguro-Loja, Km 12.4 turnoff to the West, towards Fierro Urco, Km 25.2. Montane forest remnants and surrounding páramo.","ECU",NA,1994,"PRESERVED_SPECIMEN","OCCURRENCE_STATUS_INFERRED_FROM_INDIVIDUAL_COUNT;GEODETIC_DATUM_ASSUMED_WGS84;INSTITUTION_MATCH_NONE"
-68.963694,-14.658194,"Weinmannia auriculata",3115500457,"Parque Nacional Madidi, Keara, por el camino a Mojos, sector Liriuni, abajo de Ichocorpa.","BOL",NA,2021,"PRESERVED_SPECIMEN","OCCURRENCE_STATUS_INFERRED_FROM_INDIVIDUAL_COUNT;COORDINATE_ROUNDED;GEODETIC_DATUM_ASSUMED_WGS84;DIFFERENT_OWNER_INSTITUTION"
-77.718611,-6.991667,"Weinmannia auriculata",1257906613,"Dist. Uchumarca. Cloud forest east of Laguna Huayllabamba.","PER",NA,2012,"PRESERVED_SPECIMEN","OCCURRENCE_STATUS_INFERRED_FROM_INDIVIDUAL_COUNT;COORDINATE_ROUNDED;GEODETIC_DATUM_ASSUMED_WGS84;DIFFERENT_OWNER_INSTITUTION"
-73.83645,4.84275,"Weinmannia auriculata",1703244682,"Vereda Concepción, Sobre la variante Guasca - Sueva","COL",NA,2016,"PRESERVED_SPECIMEN","OCCURRENCE_STATUS_INFERRED_FROM_INDIVIDUAL_COUNT;GEODETIC_DATUM_ASSUMED_WGS84;CONTINENT_DERIVED_FROM_COORDINATES;INSTITUTION_MATCH_NONE"
-73.777806,4.908278,"Weinmannia auriculata",1328370541,"Vereda Moquentiva, Páramo de martos, cerca al río Moquentiva, sobre la vía Guatavita - Gacheta","COL",NA,2015,"PRESERVED_SPECIMEN","OCCURRENCE_STATUS_INFERRED_FROM_INDIVIDUAL_COUNT;COORDINATE_ROUNDED;GEODETIC_DATUM_ASSUMED_WGS84;CONTINENT_DERIVED_FROM_COORDINATES;INSTITUTION_MATCH_NONE"
-78.80132,-3.17935,"Weinmannia auriculata",3946834424,"Carretera SigSig-Gualaquiza","ECU",NA,2021,"PRESERVED_SPECIMEN","OCCURRENCE_STATUS_INFERRED_FROM_INDIVIDUAL_COUNT;GEODETIC_DATUM_ASSUMED_WGS84;INSTITUTION_MATCH_FUZZY;COLLECTION_MATCH_NONE"
-77.67984,0.62927,"Weinmannia auriculata",3946836746,"Sendero hacia la Laguna Negra, Reserva La Bonita.","ECU",NA,2021,"PRESERVED_SPECIMEN","OCCURRENCE_STATUS_INFERRED_FROM_INDIVIDUAL_COUNT;GEODETIC_DATUM_ASSUMED_WGS84;INSTITUTION_MATCH_FUZZY;COLLECTION_MATCH_NONE"
-68.778278,-14.884972,"Weinmannia auriculata",4032108512,"Area Natural de manejo Integrado Apolobamba, sector Codo, primer campamento para bajar a lavar oro al río, mas allá de Chaka, por el antiguo camino Sorapata-Apolo.","BOL",NA,2009,"PRESERVED_SPECIMEN","OCCURRENCE_STATUS_INFERRED_FROM_INDIVIDUAL_COUNT;COORDINATE_ROUNDED;GEODETIC_DATUM_ASSUMED_WGS84;INSTITUTION_MATCH_FUZZY;COLLECTION_MATCH_NONE"
-67.8,-16.3,"Weinmannia auriculata",4032084067,"Vic. Chuspipata and ca. 7 km up abandoned rd. near old train station.","BOL",NA,1990,"PRESERVED_SPECIMEN","OCCURRENCE_STATUS_INFERRED_FROM_INDIVIDUAL_COUNT;GEODETIC_DATUM_ASSUMED_WGS84;INSTITUTION_MATCH_FUZZY;COLLECTION_MATCH_NONE"
-72.035833,-12.979444,"Weinmannia auriculata",4032123980,"Distrito Yanatile. Bosque montano húmedo primario.","PER",NA,2007,"PRESERVED_SPECIMEN","OCCURRENCE_STATUS_INFERRED_FROM_INDIVIDUAL_COUNT;COORDINATE_ROUNDED;GEODETIC_DATUM_ASSUMED_WGS84;INSTITUTION_MATCH_FUZZY;COLLECTION_MATCH_NONE"
-74.14361,4.43805,"Weinmannia auriculata",4031466519,"Bogotá D.C. Región del Sumapaz. Mpio. de Usme, antes de Pasquilla, bosque a la orilla del Río Tunjuelito, dominado por Weinmannia tomentosa, Myrcianthes sp. y Viburnum sp.","COL",NA,1997,"PRESERVED_SPECIMEN","GEODETIC_DATUM_ASSUMED_WGS84;INSTITUTION_MATCH_FUZZY;COLLECTION_MATCH_NONE"
-75.435555,-10.428333,"Weinmannia auriculata",4031826933,"Distrito Huancabamba, Parque Nacional Yanachaga-Chemillén, cerca a la cordillera Yanachaga. Bosque húmedo montano primario.","PER",NA,2007,"PRESERVED_SPECIMEN","OCCURRENCE_STATUS_INFERRED_FROM_INDIVIDUAL_COUNT;COORDINATE_ROUNDED;GEODETIC_DATUM_ASSUMED_WGS84;INSTITUTION_MATCH_FUZZY;COLLECTION_MATCH_NONE"
-72.605556,-12.931667,"Weinmannia auriculata",4031900311,"Dist. Maranura. Yuracmayo.","PER",NA,2008,"PRESERVED_SPECIMEN","OCCURRENCE_STATUS_INFERRED_FROM_INDIVIDUAL_COUNT;COORDINATE_ROUNDED;GEODETIC_DATUM_ASSUMED_WGS84;INSTITUTION_MATCH_FUZZY;COLLECTION_MATCH_NONE"
-75.65,-10.36666,"Weinmannia auriculata",1261362454,"Santa Barbara. Grassland/ ceja de selva mosaic, plants from ceja.","PER",NA,1984,"PRESERVED_SPECIMEN","OCCURRENCE_STATUS_INFERRED_FROM_INDIVIDUAL_COUNT;GEODETIC_DATUM_ASSUMED_WGS84;INSTITUTION_MATCH_FUZZY;COLLECTION_MATCH_NONE"
-74.978889,-11.300556,"Weinmannia auriculata",4061737627,"Distrito Pampa Hermoza. Comunidad campesina Huanuco. Caserío Antuyo. Bosque de Protección Pui Pui.","PER",NA,2014,"PRESERVED_SPECIMEN","OCCURRENCE_STATUS_INFERRED_FROM_INDIVIDUAL_COUNT;COORDINATE_ROUNDED;GEODETIC_DATUM_ASSUMED_WGS84;DIFFERENT_OWNER_INSTITUTION"
-68.980861,-14.694417,"Weinmannia auriculata",3115523449,"Parque Nacional Madidi, Keara, sector Tambo Quemado, por el camino a Mojos.","BOL",NA,2021,"PRESERVED_SPECIMEN","OCCURRENCE_STATUS_INFERRED_FROM_INDIVIDUAL_COUNT;COORDINATE_ROUNDED;GEODETIC_DATUM_ASSUMED_WGS84;DIFFERENT_OWNER_INSTITUTION"
-71.5867,-13.175,"Weinmannia auriculata",1931294849,"Wayqecha Biological Station (Amazon Conservation Association – ACA), Río Cosñipata watershed, near the road Paucartambo-Shintuya (1 hour via car east of Paucartambo)","PER",NA,2010,"PRESERVED_SPECIMEN","GEODETIC_DATUM_ASSUMED_WGS84;COLLECTION_MATCH_FUZZY"
-72.9575,-13.048889,"Weinmannia auriculata",4031748032,"Distrito Vilcabamba, Yupancca, Camino a Chuanquiri. Bosque primario intervenido.","PER",NA,2007,"PRESERVED_SPECIMEN","OCCURRENCE_STATUS_INFERRED_FROM_INDIVIDUAL_COUNT;COORDINATE_ROUNDED;GEODETIC_DATUM_ASSUMED_WGS84;INSTITUTION_MATCH_FUZZY;COLLECTION_MATCH_NONE"
-78.4234,-1.4351,"Weinmannia auriculata",3946834433,"Baños, Vía Rutun, colecciones realizadas a lo largo de la vía y en el inicio del sendero hacia el volcan.","ECU",NA,2021,"PRESERVED_SPECIMEN","OCCURRENCE_STATUS_INFERRED_FROM_INDIVIDUAL_COUNT;GEODETIC_DATUM_ASSUMED_WGS84;INSTITUTION_MATCH_FUZZY;COLLECTION_MATCH_NONE"
-78.88333,-3.33333,"Weinmannia auriculata",1258977410,"22-25 km S of Sigsig along road towards Gualaquiza, Páramos de Matanga.","ECU",NA,1985,"PRESERVED_SPECIMEN","GEODETIC_DATUM_ASSUMED_WGS84;INSTITUTION_MATCH_FUZZY;COLLECTION_MATCH_NONE"
-67.916667,-16.283333,"Weinmannia auriculata",4032110694,"Entre Unduavi & Cotapata.","BOL",NA,2005,"PRESERVED_SPECIMEN","OCCURRENCE_STATUS_INFERRED_FROM_INDIVIDUAL_COUNT;COORDINATE_ROUNDED;GEODETIC_DATUM_ASSUMED_WGS84;INSTITUTION_MATCH_FUZZY;COLLECTION_MATCH_NONE"
-78.03333,0.83333,"Weinmannia auriculata",1258264227,"Road from Tulcán to Chical, Pacific slope on descent to Maldonado. Transitional vegetation, elfin, upper montane pluvial forest and páramo.","ECU",NA,1994,"PRESERVED_SPECIMEN","OCCURRENCE_STATUS_INFERRED_FROM_INDIVIDUAL_COUNT;GEODETIC_DATUM_ASSUMED_WGS84;INSTITUTION_MATCH_FUZZY;COLLECTION_MATCH_NONE"
-67.333333,-16.733333,"Weinmannia auriculata",1257512953,"Comunidad Choquetanga (serranías de Lulini) a 13.5 km de Choquetanga.","BOL",NA,1994,"PRESERVED_SPECIMEN","OCCURRENCE_STATUS_INFERRED_FROM_INDIVIDUAL_COUNT;COORDINATE_ROUNDED;GEODETIC_DATUM_ASSUMED_WGS84;INSTITUTION_MATCH_FUZZY;COLLECTION_MATCH_NONE"
-65.028611,-17.750556,"Weinmannia auriculata",4031691665,"Sehuencas, Proximo al pueblo de Montepunku.","BOL",NA,2007,"PRESERVED_SPECIMEN","OCCURRENCE_STATUS_INFERRED_FROM_INDIVIDUAL_COUNT;COORDINATE_ROUNDED;GEODETIC_DATUM_ASSUMED_WGS84;INSTITUTION_MATCH_FUZZY;COLLECTION_MATCH_NONE"
-77.75,0.8,"Weinmannia auriculata",4031924141,"4.8 km west of Caramelo. Along road from Tulcan to Alegria via Carmelo and Santa Barbara.","ECU",NA,1982,"PRESERVED_SPECIMEN","OCCURRENCE_STATUS_INFERRED_FROM_INDIVIDUAL_COUNT;GEODETIC_DATUM_ASSUMED_WGS84;INSTITUTION_MATCH_FUZZY;COLLECTION_MATCH_NONE"
-76.607171,2.73761,"Weinmannia auriculata",1258989244,"Cerca a Morales.","COL",NA,1968,"PRESERVED_SPECIMEN","OCCURRENCE_STATUS_INFERRED_FROM_INDIVIDUAL_COUNT;GEODETIC_DATUM_ASSUMED_WGS84;INSTITUTION_MATCH_FUZZY;COLLECTION_MATCH_NONE"
-75.4,-10.5667,"Weinmannia auriculata",1228392615,"Oxapampa","PER",NA,2001,"PRESERVED_SPECIMEN","GEODETIC_DATUM_ASSUMED_WGS84;INSTITUTION_MATCH_FUZZY;AMBIGUOUS_COLLECTION"
-76.8333,-7,"Weinmannia auriculata",1228167112,"San Martín","PER",NA,2001,"PRESERVED_SPECIMEN","GEODETIC_DATUM_ASSUMED_WGS84;INSTITUTION_MATCH_FUZZY;AMBIGUOUS_COLLECTION"
-78.6,-3.03333,"Weinmannia auriculata",1260030773,"Road Gualaceo-Limón, km 35.5, E of the pass. Steep, wet rock walls and rocky riverside in montane forest.","ECU",NA,1990,"PRESERVED_SPECIMEN","GEODETIC_DATUM_ASSUMED_WGS84;DIFFERENT_OWNER_INSTITUTION"
-65.782778,-17.228611,"Weinmannia auriculata",2268815879,"Extremo Oeste del Parque Nacional Carrasco.","BOL",NA,2012,"PRESERVED_SPECIMEN","OCCURRENCE_STATUS_INFERRED_FROM_INDIVIDUAL_COUNT;COORDINATE_ROUNDED;GEODETIC_DATUM_ASSUMED_WGS84;DIFFERENT_OWNER_INSTITUTION"
-64.534722,-17.818056,"Weinmannia auriculata",1258368840,"Amboró National Park, Cerro Bravo area; ca. 10 map km N of Comarapa, near permanent plot. Cloud forest with Weinmannia spp., Podocarpus rusbyi, Prumnopitys exigua, tree ferns, and a thick epiphyte layer; with a network of cow grazing trails.","BOL",NA,1995,"PRESERVED_SPECIMEN","OCCURRENCE_STATUS_INFERRED_FROM_INDIVIDUAL_COUNT;COORDINATE_ROUNDED;GEODETIC_DATUM_ASSUMED_WGS84;DIFFERENT_OWNER_INSTITUTION"
-72.5425,-13.18027,"Weinmannia auriculata",4061536972,"Dist. Machu Picchu, Wiñay Wayna, Bosque Secundario.","PER",NA,2004,"PRESERVED_SPECIMEN","OCCURRENCE_STATUS_INFERRED_FROM_INDIVIDUAL_COUNT;GEODETIC_DATUM_ASSUMED_WGS84;DIFFERENT_OWNER_INSTITUTION"
-65.270017,-17.543355,"Weinmannia auriculata",3305390305,"Parque Nacional Carrasco, bajada de Monte-Punku, ca 4 km antes de Sehuencas.","BOL",NA,2021,"PRESERVED_SPECIMEN","OCCURRENCE_STATUS_INFERRED_FROM_INDIVIDUAL_COUNT;COORDINATE_ROUNDED;GEODETIC_DATUM_ASSUMED_WGS84;DIFFERENT_OWNER_INSTITUTION"
-76.083333,-9.7,"Weinmannia auriculata",4061155376,"Huanuco - Tingo María road, steep slopes near Carpish divide above mouth of tunnel.","PER",NA,1984,"PRESERVED_SPECIMEN","OCCURRENCE_STATUS_INFERRED_FROM_INDIVIDUAL_COUNT;COORDINATE_ROUNDED;GEODETIC_DATUM_ASSUMED_WGS84;DIFFERENT_OWNER_INSTITUTION"
-78.78333,-0.25,"Weinmannia auriculata",4061058448,"Road Chillogallo - Santo Domingo, below Chiriboga. Montane forest on steep slopes.","ECU",NA,1980,"PRESERVED_SPECIMEN","GEODETIC_DATUM_ASSUMED_WGS84;INSTITUTION_MATCH_NONE"
-66.141944,-17.005833,"Weinmannia auriculata",4062153816,"Tiquipaya, Camino a Totolima a unos 60 km del pueblo de Chapisirca.","BOL",NA,2008,"PRESERVED_SPECIMEN","OCCURRENCE_STATUS_INFERRED_FROM_INDIVIDUAL_COUNT;COORDINATE_ROUNDED;GEODETIC_DATUM_ASSUMED_WGS84;DIFFERENT_OWNER_INSTITUTION"
-72.625,-13.12305,"Weinmannia auriculata",1260743983,"Dist. Santa Teresa, Illaspay, Yerbabuenayoc, Bosque montano","PER",NA,2005,"PRESERVED_SPECIMEN","OCCURRENCE_STATUS_INFERRED_FROM_INDIVIDUAL_COUNT;GEODETIC_DATUM_ASSUMED_WGS84;DIFFERENT_OWNER_INSTITUTION"
-68.116667,-16.15,"Weinmannia auriculata",1261360171,"20.8 km al norte de La Cumbre del Valle del Río Zongo. Bosque bajo (3-5 m), tupido, nuboso, con Chusquea, Solanum, Myrsisne y Barnadesia.","BOL",NA,1987,"PRESERVED_SPECIMEN","OCCURRENCE_STATUS_INFERRED_FROM_INDIVIDUAL_COUNT;COORDINATE_ROUNDED;GEODETIC_DATUM_ASSUMED_WGS84;DIFFERENT_OWNER_INSTITUTION"
-65.642222,-17.160278,"Weinmannia auriculata",1260776808,"El Limbo. Ceja de monte, mesobosque hiperhumedo Carcaterizado por Fresiera karsteniana y Brunellia boliviana","BOL",NA,2004,"PRESERVED_SPECIMEN","OCCURRENCE_STATUS_INFERRED_FROM_INDIVIDUAL_COUNT;COORDINATE_ROUNDED;GEODETIC_DATUM_ASSUMED_WGS84;DIFFERENT_OWNER_INSTITUTION"
-79.416,-4.733,"Weinmannia auriculata",47864031,"Jimbura - Zumba road, not finished, km 17, at small lake. Páramo and Sphagnum bog with forest.","ECU",NA,1990,"PRESERVED_SPECIMEN","GEODETIC_DATUM_ASSUMED_WGS84;COORDINATE_PRECISION_INVALID;INSTITUTION_MATCH_FUZZY;INSTITUTION_COLLECTION_MISMATCH"
-79.116,-4.166,"Weinmannia auriculata",47863755,"Parque Nacional Podocarpus. Vicinity of Lagunas de Compadre. c. 6 hours walking from centro de Informacíon. Ridge top vegetation, elfin forest, paramo, lakes.","ECU",NA,1989,"PRESERVED_SPECIMEN","GEODETIC_DATUM_ASSUMED_WGS84;COORDINATE_PRECISION_INVALID;INSTITUTION_MATCH_FUZZY;INSTITUTION_COLLECTION_MISMATCH"
-78.13333,0.25,"Weinmannia auriculata",1260538938,"Cerro Golandrinas. Primary forest and vegetation highly variable due to complex topography. Mossy, upper montane pluvial forest with trees up to 30 m tall in ravines and creek bottoms. Variously stunted forest and shrubbery on exposed slopes, ridges and peaks; some areas similar to paramo.","ECU",NA,1994,"PRESERVED_SPECIMEN","GEODETIC_DATUM_ASSUMED_WGS84;INSTITUTION_MATCH_FUZZY;COLLECTION_MATCH_NONE"
-64.811944,-17.761111,"Weinmannia auriculata",1260540942,"Siberia. Bosques relictuales con algunas especies esparcidas de Prumnopitys exigua.","BOL",NA,2005,"PRESERVED_SPECIMEN","OCCURRENCE_STATUS_INFERRED_FROM_INDIVIDUAL_COUNT;COORDINATE_ROUNDED;GEODETIC_DATUM_ASSUMED_WGS84;INSTITUTION_MATCH_FUZZY;COLLECTION_MATCH_NONE"
-78.66173,-2.99923,"Weinmannia auriculata",3946833821,"Carretera Gualaceo-Plan de Milagro. Colecciones al borde la de carretera.","ECU",NA,2021,"PRESERVED_SPECIMEN","OCCURRENCE_STATUS_INFERRED_FROM_INDIVIDUAL_COUNT;GEODETIC_DATUM_ASSUMED_WGS84;INSTITUTION_MATCH_FUZZY;COLLECTION_MATCH_NONE"
-72.958056,7.520139,"Weinmannia auriculata",1707496799,"Sitio El Alto, carretera de Cachirá a Arboledas, límites entre Suratá y Arboledas","COL",NA,2013,"PRESERVED_SPECIMEN","COORDINATE_ROUNDED;GEODETIC_DATUM_ASSUMED_WGS84;INSTITUTION_MATCH_NONE"
-72.596806,7.218778,"Weinmannia auriculata",1836125953,"Vereda Tane","COL",NA,2014,"PRESERVED_SPECIMEN","OCCURRENCE_STATUS_INFERRED_FROM_INDIVIDUAL_COUNT;COORDINATE_ROUNDED;INSTITUTION_MATCH_NONE"
-72.600444,7.341083,"Weinmannia auriculata",1836137399,"Vereda Fontibón, Finca Loma Larga","COL",NA,2014,"HUMAN_OBSERVATION","OCCURRENCE_STATUS_INFERRED_FROM_INDIVIDUAL_COUNT;COORDINATE_ROUNDED"
-72.633861,7.152278,"Weinmannia auriculata",1836125789,"Vereda Siagá","COL",NA,2014,"PRESERVED_SPECIMEN","OCCURRENCE_STATUS_INFERRED_FROM_INDIVIDUAL_COUNT;COORDINATE_ROUNDED;INSTITUTION_MATCH_NONE"
-74.19222,5.00944,"Weinmannia auriculata",3913406488,"Colombia: Subachoque, Cerro el tablazo. Alt.: 3335 m.2019-10-13, Leg.: Fajardo Guiérrez,F., Calbi,M., Torrejano,A., Medellin,D., & Soler,L. FFG6028.","COL",NA,2019,"PRESERVED_SPECIMEN","GEODETIC_DATUM_ASSUMED_WGS84;CONTINENT_DERIVED_FROM_COORDINATES;INSTITUTION_MATCH_FUZZY"
-74.17389,4.13694,"Weinmannia auriculata",3913409482,"Colombia: Bogotá, D.C., Bogotá, Localidad de Sumapaz. Nazareth. Vereda Ánimas Bajas. Finca La Palma. Arbustoo de 4 m. Hojas lustrosas por haz verde por el envés con indumento pardo claro. Hojas simples pinnadas de 5 foliolos. 5 sépalos verdes triangulares cóncavos, pétalos libres caedizos, rojizos. 10 estambres, filamentos blancos, anteras amarillo claro. Estigma verde claro. Alt.: 2918 m.2019-10-08, Leg.: Fajardo Guiérrez,F., Calbi,M., Urbabo,S., Medellin,D., Montoya,A., Ramirez,P., Castro,C. & Ruiz,O. FFG6010.","COL",NA,2019,"PRESERVED_SPECIMEN","GEODETIC_DATUM_ASSUMED_WGS84;CONTINENT_DERIVED_FROM_COORDINATES;INSTITUTION_MATCH_FUZZY"
-65.273056,-17.495833,"Weinmannia auriculata",1257506793,"Sehuencas, Proximo al río y el puente de madera.","BOL",NA,2007,"PRESERVED_SPECIMEN","OCCURRENCE_STATUS_INFERRED_FROM_INDIVIDUAL_COUNT;COORDINATE_ROUNDED;GEODETIC_DATUM_ASSUMED_WGS84;DIFFERENT_OWNER_INSTITUTION"
-76.335371,2.533392,"Weinmannia auriculata",1844907491,"Valle del río Cofre, ladera del Alto de San Pedro, kilómetros 15 - 14.","COL",2634,1961,"PRESERVED_SPECIMEN","COORDINATE_PRECISION_INVALID"
-75.65375,6.33296,"Weinmannia auriculata",1844901912,"Cercanias Medellin: Boqueron 3050 m.","COL",680,1963,"PRESERVED_SPECIMEN",""
-72.958639,7.797806,"Weinmannia auriculata",1269531469,"Carretera de Cáchira a Salazar","COL",NA,2013,"PRESERVED_SPECIMEN","OCCURRENCE_STATUS_INFERRED_FROM_INDIVIDUAL_COUNT;COORDINATE_ROUNDED;GEODETIC_DATUM_ASSUMED_WGS84;INSTITUTION_MATCH_NONE"
-77.35,-7.45,"Weinmannia auriculata",1261361386,"N side of river across from La Playa base camp; Río Abiseo National Park. Montane rain forest. In 20-35 m tall forest on 0-15º slopes.","PER",NA,1985,"PRESERVED_SPECIMEN","OCCURRENCE_STATUS_INFERRED_FROM_INDIVIDUAL_COUNT;GEODETIC_DATUM_ASSUMED_WGS84;INSTITUTION_MATCH_FUZZY;COLLECTION_MATCH_NONE"
-77.16,0.74,"Weinmannia auriculata",1324650226,"Gran Jardín de la sierra, ladera cerro El Oso, entre 10-11 horas aproximadamente del asentamiento Nuevo Mundo","COL",NA,2014,"PRESERVED_SPECIMEN","INSTITUTION_MATCH_NONE"
-79.18333,-4.08333,"Weinmannia auriculata",1258265340,"Podocarpus National Park; Cajanuma; trail from guard station to Laguna Caramoto, up to and along continental divide. Upper montane forest, wet with strong wind effects; vegetation highly stunted on ridges with shrubs usually less than 1 m high.","ECU",NA,1994,"PRESERVED_SPECIMEN","OCCURRENCE_STATUS_INFERRED_FROM_INDIVIDUAL_COUNT;GEODETIC_DATUM_ASSUMED_WGS84;INSTITUTION_MATCH_FUZZY;COLLECTION_MATCH_NONE"
-69.0986,-14.5769,"Weinmannia auriculata",1936199150,"Dpto. La Paz: Prov. Franz Tamayo. Parque Nacional Madidi, Puina Viejo, rio abajo por camino al W del rio","BOL",NA,2005,"PRESERVED_SPECIMEN","GEODETIC_DATUM_ASSUMED_WGS84;CONTINENT_DERIVED_FROM_COORDINATES;INSTITUTION_MATCH_FUZZY;COLLECTION_MATCH_FUZZY"
-74.36563,4.873588,"Weinmannia auriculata",3902910939,"","COL",4,2022,"HUMAN_OBSERVATION","COORDINATE_ROUNDED;CONTINENT_DERIVED_FROM_COORDINATES"
-76.11667,5.98333,"Weinmannia auriculata",1576172397,"Camino entre Salgar y El Dauro en Chocó","COL",869,1987,"PRESERVED_SPECIMEN","INSTITUTION_MATCH_NONE"
-79.142833,-4.23125,"Weinmannia auriculata",4067891274,"Laguna Banderillas","ECU",NA,2002,"PRESERVED_SPECIMEN","GEODETIC_DATUM_ASSUMED_WGS84;CONTINENT_DERIVED_FROM_COORDINATES;DIFFERENT_OWNER_INSTITUTION"
-73.85173,4.80699,"Weinmannia auriculata",3032741058,"","COL",NA,1974,"PRESERVED_SPECIMEN","INSTITUTION_MATCH_NONE;MULTIMEDIA_URI_INVALID"
-75.683,6.267,"Weinmannia auriculata",3308434373,"Cerro del Padre Amaya, 9.4 km from Medellín-Santa Fé de Antioquia highway on road to summit","COL",NA,1987,"PRESERVED_SPECIMEN","TYPE_STATUS_INVALID;OCCURRENCE_STATUS_INFERRED_FROM_INDIVIDUAL_COUNT;GEODETIC_DATUM_ASSUMED_WGS84;CONTINENT_DERIVED_FROM_COORDINATES;INSTITUTION_MATCH_FUZZY;INSTITUTION_COLLECTION_MISMATCH"
-75.50844,3.55647,"Weinmannia auriculata",731383056,"","COL",NA,1969,"PRESERVED_SPECIMEN","GEODETIC_DATUM_ASSUMED_WGS84;CONTINENT_DERIVED_FROM_COORDINATES;COLLECTION_MATCH_FUZZY"
-79.27138,-5.67416,"Weinmannia auriculata",1258782780,"Sallique. Localidad de Lanchal: La Cocha. Bosque colinoso, intermedio entre bosque seco y la jalca. El Parámo.","PER",NA,1998,"PRESERVED_SPECIMEN","OCCURRENCE_STATUS_INFERRED_FROM_INDIVIDUAL_COUNT;GEODETIC_DATUM_ASSUMED_WGS84;INSTITUTION_MATCH_FUZZY;COLLECTION_MATCH_NONE"
-75.53333,-11.25,"Weinmannia auriculata",1261369887,"Tarma-La Merced road, 40km from Tarma, side canyon of main valley. Secondary vegetation, resulting from centuries of disturbance.","PER",NA,1984,"PRESERVED_SPECIMEN","OCCURRENCE_STATUS_INFERRED_FROM_INDIVIDUAL_COUNT;GEODETIC_DATUM_ASSUMED_WGS84;INSTITUTION_MATCH_FUZZY;COLLECTION_MATCH_NONE"
